,datetime,content,title
204,2020-05-21 15:26:24,【阿里在重庆成立新公司 注册资本1500万】天眼查数据显示，近日，阿里巴巴（重庆）信息技术有限公司成立，注册资本1500万，法定代表人为王磊，公司经营范围包括企业管理，信息系统集成服务，专业设计服务，信息咨询服务，教育咨询服务等，由阿里巴巴（中国）有限公司全资控股，后者为Alibaba Group Services Limited的全资子公司。（界面新闻）,阿里在重庆成立新公司 注册资本1500万
205,2020-05-21 15:24:56,【蒙娜丽莎：碧桂园创投入股是其在地产业上游的又一积极探索】怎么看待碧桂园的战略入股蒙娜丽莎？对此，蒙娜丽莎董事、董秘张旗康5月21日做客证券时报·e公司微访谈时表示，预计公司发行完成后，碧桂园创投将持有蒙娜丽莎6.22%的股权。碧桂园创投始终坚持“产业赋能、价值共创”的投资战略，财务型投资与战略并购型投资并重。碧桂园创投入股蒙娜丽莎，是其在地产产业链上游的又一次积极探索。（e公司）,蒙娜丽莎：碧桂园创投入股是其在地产业上游的又一积极探索
206,2020-05-21 15:23:41,【阿里本地生活大学正式运行：计划一年培训认证10万主播】据阿里方面介绍，5月21日，阿里本地生活大学正式运行，今年将培训认证10万名直播主播，服务10万家本地生活商家开设直播间。阿里本地生活大学已经开始对周黑鸭、仟吉等品牌门店员工开展全线培训，实现店铺全量上线直播的目标。（界面新闻）,阿里本地生活大学正式运行：计划一年培训认证10万主播
207,2020-05-21 15:22:12,【酒鬼酒：6月25日起 52度紫坛酒鬼酒战略价上调40元】记者从酒鬼酒获悉，酒鬼酒今日发布调价通知，决定自6月25日起，52度500mL紫坛酒鬼酒（柔和）战略价上调40元/瓶。（界面新闻）,酒鬼酒：6月25日起 52度紫坛酒鬼酒战略价上调40元
208,2020-05-21 15:20:00,【国债期货收盘涨跌不一】国债期货收盘涨跌不一，10年期主力合约涨0.04%，5年期主力合约跌0.07%，2年期主力合约持平。,国债期货收盘涨跌不一
209,2020-05-21 15:16:54,【良品铺子：每个月会选择新品和爆款产品与知名主播合作 网红直播产生的销售占比很小】良品铺子在互动平台表示，公司与明星、网络红人、知名主播均有合作，合作形式多样。每个月会选择新品和爆款产品与知名主播合作，提升品牌知名度的同时，让更多直播观众体验到产品，网红直播产生的销售在我司销售占比很小。（界面新闻）,良品铺子：每个月会选择新品和爆款产品与知名主播合作 网红直播产生的销售占比很小
210,2020-05-21 15:13:33,【软银集团将出售旗下移动子公司2.4亿股股票】据悉，软银集团将出售旗下移动子公司2.4亿股股票。（界面新闻）,软银集团将出售旗下移动子公司2.4亿股股票
211,2020-05-21 15:11:55,【中国石化集团总经理马永生：加快推进石油石化重大技术装备国产化】5月21日，全国政协委员、中国石化集团公司总经理马永生建议，加快推进石油石化重大技术装备国产化。建议国家层面明确牵头部门或在相关部门设立专门机构，归口管理国家重大技术装备创新攻关工作，统一制定政策，统筹协调相关力量，形成产学研用“一条龙”的攻关机制。（中证网）,中国石化集团总经理马永生：加快推进石油石化重大技术装备国产化
212,2020-05-21 15:10:39,【花旗预计6月起油市将出现供不应求】据悉，花旗预计从2020年6月开始，油市将出现供不应求，这一状况将持续至2020年第三季度以后。（界面新闻）,花旗预计6月起油市将出现供不应求
213,2020-05-21 15:09:33,【面值退市股越来越多如何避免踩雷？你需要知道这些】说起退市，这在资本市场早已不是什么新鲜事。而提起“面值退市”，在越来越多低价股扩容的当下，这种退市方式似乎正在成为A股上市公司主要的退市渠道。,面值退市股越来越多如何避免踩雷？你需要知道这些
214,2020-05-21 15:08:27,【天津市政府多期地方债招标结束 30年期固息品种中标利率3.77%】记者从银行间市场获悉，天津市政府今日招标发行的多期地方债已经投标结束，其中：3年期固息品种，中标利率1.86%；5年期固息品种，中标利率2.31%；10年期固息品种，中标利率2.95%；15年期固息品种，中标利率3.46%；30年期固息品种，中标利率3.77%。（界面新闻）,天津市政府多期地方债招标结束 30年期固息品种中标利率3.77%
215,2020-05-21 15:06:47,【招银国际：上调世茂房地产(00813)目标价至37.85港元 维持“买入”评级】招银国际发布报告称，调高世茂房地产(00813)今年年底每股资产净值(Net Asset Value)预测至50.46元，上调其目标价至37.85港元，维持“买入”评级。（智通财经网）,招银国际：上调世茂房地产(00813)目标价至37.85港元 维持“买入”评级
216,2020-05-21 15:00:46,【视频直播】全国政协十三届三次会议于5月21日下午3时在北京人民大会堂开幕。（新华网）,【视频直播】全国政协十三届三次会议开幕会
217,2020-05-21 15:00:26,【收盘播报】A股三大指数今日收跌，深成指与创业板指跌幅接近1%。两市合计成交6262亿元，行业板块多数收跌，科技股与农业股领跌。北向资金今日逆市净流入32.03亿元，已经连续9个交易日净流入。,A股三大指数收跌 北向资金连续9日净流入
218,2020-05-21 15:00:25,【期货市场收盘 原油大涨3.84%】国内商品期货收盘，原油大涨3.84%，燃油、沪镍等涨逾2%，白糖、焦炭等涨超1%；玻璃、焦煤等小幅上涨；苹果、沪银等跌逾1%，豆粕、棕榈等小幅下跌。,期货市场收盘 原油大涨3.84%
219,2020-05-21 15:00:19,【欧股开盘普跌 欧洲斯托克50指数跌1.1%】欧股开盘普跌，欧洲斯托克50指数跌1.1%，德国DAX指数跌0.9%，英国富时100指数跌0.7%。,欧股开盘普跌 欧洲斯托克50指数跌1.1%
220,2020-05-21 14:52:22,【商务部赴车好多集团调研 就繁荣二手车市场等深入交流】商务部网站消息，日前，商务部流通产业促进中心副主任林健赴车好多集团调研，实地了解车好多集团运营情况，以及推进二手车流通模式及汽车下乡模式创新做法。双方就共同促进汽车消费、繁荣二手车市场等进行了深入交流。（界面新闻）,商务部赴车好多集团调研 就繁荣二手车市场等深入交流
221,2020-05-21 14:51:58,【北斗总设计师：已有半数以上的国家使用北斗系统】全国政协委员、中国北斗卫星导航系统工程总设计师杨长风今天在全国政协十三届三次会议“委员通道”上介绍：世界上有半数以上的国家使用北斗系统，以后在世界任何角度，都可以享受到北斗的服务。（界面新闻）,北斗总设计师：已有半数以上的国家使用北斗系统
222,2020-05-21 14:48:54,【万科子公司近一周在天津投资6家企业 均为房地产信息咨询公司】天眼查数据显示，近日，北京万科企业有限公司新增一家对外投资公司——天津万瀛房地产信息咨询有限公司。天津万瀛房地产信息咨询有限公司成立于2020年5月19日，法定代表人为李钰丹，注册资本500万元，经营范围为一般项目：房地产咨询。股东信息显示，北京万科企业有限公司持股99%，为第一大股东。值得注意的是，天津万瀛房地产信息咨询有限公司是北京万科企业有限公司近一周内在天津投资的第6家企业。（证券时报）,万科子公司近一周在天津投资6家企业 均为房地产信息咨询公司
223,2020-05-21 14:45:10,【三部门：企业或个人捐赠支出准予在计算应纳税所得额时扣除】财政部、税务总局、民政部发布《关于公益性捐赠税前扣除有关事项的公告》，企业或个人通过公益性社会组织、县级以上政府及其部门等国家机关，用于符合法律规定的公益慈善事业捐赠支出，准予按税法规定在计算应纳税所得额时扣除。公益性捐赠税前扣除资格在全国范围内有效，有效期为三年。（证券时报）,三部门：企业或个人捐赠支出准予在计算应纳税所得额时扣除
224,2020-05-21 14:44:30,【北斗系统工程总设计师、杨长风委员：中国已有70%入网智能手机提供了北斗服务】北斗系统工程总设计师、杨长风委员：中国已有70%入网智能手机提供了北斗服务，让我们的生活更加智能便捷。（界面新闻）,北斗系统工程总设计师、杨长风委员：中国已有70%入网智能手机提供了北斗服务
225,2020-05-21 14:44:01,【6月将发射最后一颗北斗组网卫星】全国政协委员、中国北斗卫星导航系统工程总设计师杨长风介绍，今年是北斗全球系统的收官之年，最后一颗北斗组网卫星已运抵西昌卫星发射中心，计划6月份择机发射。届时，北斗系统部署将圆满完成。（界面新闻）,6月将发射最后一颗北斗组网卫星
226,2020-05-21 14:33:43,【平安基金周恩源：债市波动加剧但大环境并未动摇】股债市场后续如何发展？平安基金固收投资副总监周恩源认为，债市波动加剧，但整体友好的大环境并未动摇。当前全球各国政府都在推行低利率，全球债券利率处于历史低位。（上海证券报）,平安基金周恩源：债市波动加剧但大环境并未动摇
227,2020-05-21 14:29:27,【澳元兑美元随美指期货下滑 料于区间上落】澳元兑美元今早随美指期货下滑，料于0.6616遇阻，支持位于0.6510，短期料于这个窄幅区间上落。（经济通中国站）,澳元兑美元随美指期货下滑 料于区间上落
228,2020-05-21 14:28:47,【万马股份：公司公共充电桩保有量8825台 部分接入国网平台】万马股份(002276)在投资者交流会上表示，公司目前公共充电桩保有量为8825台，充电站保有量为1137座，部分城市的充电桩接入国网平台。公司目前以场站式布桩为主，着重布局大功率直流式充电桩，重点建站在城市枢纽、用户使用频次高的热点地带。（证券时报）,万马股份：公司公共充电桩保有量8825台 部分接入国网平台
229,2020-05-21 14:28:26,【3200个比特币被锁定在DeFi生态 创历史新高】尽管DeFi目前是以太坊的天下，但是比特币正在努力追赶，如今锁定在DeFi生态中的比特币数量已经达到了3200个BTC，达到历史新高。（巴比特）,3200个比特币被锁定在DeFi生态 创历史新高
230,2020-05-21 14:26:15,【临储拍卖28日开启 玉米市场反应或相对平静】当前国内玉米价格处于近几年的高点，近几日虽有回调，但幅度有限。临储玉米拍卖的传闻已经持续多日，市场已经提前透支拍卖带来的影响，所以市场对于拍卖政策落地的反应会相对平静。（粮油市场报）,临储拍卖28日开启 玉米市场反应或相对平静
231,2020-05-21 14:25:23,【4月人民币实际有效汇率创三个月新低 名义汇率创一年新高】国际清算银行(BIS)最新公布，4月人民币实际有效汇率指数降0.53%至125.53，为三个月来最低水平，上月修正后为降0.19%。（财华社）,4月人民币实际有效汇率创三个月新低 名义汇率创一年新高
232,2020-05-21 14:25:18,【电信格局的重大变化：5G建设四张牌照两张网】5月20日，中国移动母公司在港交所发布公告称，将与中国广播电视网络有限公司(以下简称：“中国广电”)按照1:1比例共同投资建设700MHz 5G无线网络，共同拥有并使用700MHz 5G无线网络资产，合作期限自5G合作框架协议生效之日起至2031年12月31日。（界面新闻）,电信格局的重大变化：5G建设四张牌照两张网
233,2020-05-21 14:22:28,【深成指跌逾1%】深成指跌逾1%，创业板指跌近0.9%，沪指跌近0.5%。,深成指跌逾1%
234,2020-05-21 14:21:27,【股市播报】A股三大指数下跌，医疗行业逆势上涨。广电、酿酒、体外诊断等板块表现强势，转基因、农业种植、光刻胶等板块领跌。北上资金净流入超20亿元。,A股三大指数下跌 医疗行业逆势上涨
235,2020-05-21 14:17:11,【李书福建议适当放开摩托车禁限】全国人大代表、吉利控股集团董事长李书福建议，适度放开“禁限摩”，试点部分城市恢复摩托车上牌及通行，制定摩托车相关交通管理办法；重新制定摩托车驾照考试等级，加强安全意识培训和营运摩托车的管理；鼓励摩托车相关企业在新能源暨摩托电动化方向加大研发力度，出台全国统一的电摩上牌政策。他认为，科学对待城市摩托车行驶，拉动摩托车产业转型升级，全面提升中国摩托车产品国际市场竞争力很有必要。（界面新闻）,李书福建议适当放开摩托车禁限
236,2020-05-21 14:10:03,【日经225指数收盘跌0.21%】日经225指数收盘跌0.21%，报20552.31点。,日经225指数收盘跌0.21%
237,2020-05-21 14:05:26,【特高压异动】特高压异动，通光线缆拉升涨停，汉缆股份、国电南自、中国西电等小幅跟涨。,特高压异动
238,2020-05-21 13:59:36,【港股市场生物科技B类股集体大跌】随着康希诺生物-B断崖式跳水，港股市场生物科技B类股集体大跌，迈博药业-B目前跌幅超14%，康宁杰瑞-B跌近9%，沛嘉医疗-B、信达生物-B、华领医药-B、诺诚健华-B等均跟跌。,港股市场生物科技B类股集体大跌
239,2020-05-21 13:58:38,【花旗上调短期及中期白银价格预期】花旗上调短期及中期白银价格预期，预计2020年白银价格为17.3美元/盎司。,花旗上调短期及中期白银价格预期
240,2020-05-21 13:51:23,【发改委外资司会见金砖国家新开发银行祝宪副行长一行】据发展和改革委员会5月21日消息，5月20日，发改委外资司主要负责同志会见金砖国家新开发银行副行长兼首席运营官祝宪一行。双方就利用新开发银行贷款支持推进我国经济社会重点领域复工复产、新一期贷款规划及下一步合作重点等进行了深入交流。（中国证券网）,发改委外资司会见金砖国家新开发银行祝宪副行长一行
241,2020-05-21 13:45:49,【行情】港股康希诺生物午后跳水，一度跌逾20%。截至发稿，康希诺生物下跌14.15%，报211.200港元。,港股康希诺生物午后跳水 一度跌逾20%
242,2020-05-21 13:43:33,【银保监会：到2022年车险、农险、意健险等财险业务线上化率要达80%以上】银保监会财险部今日向各财险公司下发《关于推进财产保险业务线上化发展的指导意见》(下称《指导意见》)，其中提到，到2022年，车险、农险、意外险、短期健康险、家财险等业务领域线上化率达到80%以上，其他领域线上化水平显著提高。（上海证券报）,银保监会：到2022年车险、农险、意健险等财险业务线上化率要达80%以上
243,2020-05-21 13:39:57,【北向资金净流入超20亿元】北向资金午后持续流入，截至目前净流入超20亿元。其中，沪股通净流入超21亿元。,北向资金净流入超20亿元
244,2020-05-21 13:34:49,【行情】港股康希诺生物午后跳水，一度跌逾20%。,港股康希诺生物午后跳水 一度跌逾20%
245,2020-05-21 13:30:13,【三大指数全部翻绿】三大指数全部翻绿，农业、半导体芯片、军工等跌幅居前。,三大指数全部翻绿
246,2020-05-21 13:28:24,【茅台、迈瑞、恒瑞等一批龙头股创新高！但斌昨晚不禁感叹】今日早盘，迈瑞医疗、海天味业、贵州茅台、恒瑞医药、人福医药等一批白马股股价迭创新高，但另一方面，神雾环保和盛运环保等游走在退市边缘的股票无量跌停。（上海证券报）,茅台、迈瑞、恒瑞等一批龙头股创新高！但斌昨晚不禁感叹
247,2020-05-21 13:26:27,【股市播报】A股三大指数小幅震荡，医疗行业领涨两市。广电、酿酒、体外诊断等板块表现强势，转基因、农业种植、光刻胶等板块领跌。北上资金净流入近20亿元。,A股三大指数小幅震荡 医疗行业领涨两市
248,2020-05-21 13:25:54,【软件股走弱】软件股走弱，诚迈科技逼近跌停，安恒信息、光云科技、当虹科技、卓易信息、旋极信息等跌逾5%。,软件股走弱
249,2020-05-21 13:25:07,【中芯国际午后跌超5%】中芯国际午后走弱，跌幅扩大至5.7%。中芯国际此前澄清，网上流传交流纪要内容纯属捏造。,中芯国际午后跌超5%
250,2020-05-21 13:23:03,【交通银行迎来新行长 70后少帅刘珺拟接棒】中投公司副总经理、首席风险官刘珺或将“南下”出任交通银行行长一职，今天下午即将召开全行干部大会官宣。多位知情人士对记者表示，今天下午两点交行即将召开全行大会，官宣行长任命。（21世纪经济报道）,交通银行迎来新行长 70后少帅刘珺拟接棒
251,2020-05-21 13:22:09,【华为：与东莞市水务集团签战略合作框架协议】日前，东莞市水务集团与华为签署战略合作框架协议，就共同开展智慧水务行业建设，探索大数据应用创新等方面达成共识。凭借华为在信息化技术领域的领先优势，双方将携手构建智慧水务信息化体系，进一步提升城市供排水保障与服务能力，同时华为也将借助东莞水务的行业积累加强在水务水利行业的创新能力。（证券时报）,华为：与东莞市水务集团签战略合作框架协议
252,2020-05-21 13:15:03,【万集科技：华为公司也是公司通信模组的潜在供应方】万集科技在互动平台表示，公司在V2X方面主要布局为V2X车路两端应用产品的研发、设计及制造。据公司了解，罗德与施瓦茨公司和华为公司的合作为通信模组相关测试，在通信模组方面，公司一直高度重视产品选型以保证公司V2X产品的通信性能，华为公司也是公司通信模组的潜在供应方。（界面新闻）,万集科技：华为公司也是公司通信模组的潜在供应方
253,2020-05-21 13:14:32,【全国人大代表周晓强：建议成渝共建西部金融市场平台】全国人大代表、原人民银行成都分行行长周晓强，全国人大代表、四川天府银行董事长黄毅等人在联名提案中给出了四个建议，其中包括支持探索建设金融市场平台；支持设立西部金融资产交易所、期货交易所、环境交易所、西部大数据资产交易与管理中心、成渝技术转让交易中心等。（界面新闻）,全国人大代表周晓强：建议成渝共建西部金融市场平台
254,2020-05-21 13:13:45,【半导体板块持续走弱】半导体板块持续走弱，南大光电跌逾8%，清溢光电、富满电子、晶方科技、南大光电、晶瑞股份等跌逾7%。,半导体板块持续走弱
255,2020-05-21 13:11:37,【史上首次！英国发行负收益率国债 英央行行长：正借鉴他国经验】当地时间20日，英国以-0.003%的收益率发行了37.5亿英镑的三年期英国国债。英国曾在2016年以负利率发行1个月期票据。这次是其首次以负利率发行长期债券。（第一财经）,史上首次！英国发行负收益率国债 英央行行长：正借鉴他国经验
256,2020-05-21 13:09:41,【聚酯终端行业各环节订单恢复情况调研】下游各环节工厂目前整体库存水平偏高，过半数的调研企业成品库存在30天以上。（卓创资讯）,聚酯终端行业各环节订单恢复情况调研
257,2020-05-21 13:08:40,【价格久居高位“不胜寒” 环丙现货交易量下滑】本轮环丙上涨周期持续了较长时间，四月下旬至今环丙市场累计上涨接近两千元，累计涨幅25.8%。周期之长有些出乎意料，涨幅之大亦有些出乎意料，而随着价格不算升高，环丙触顶行情出现，下游恐高情绪逐步释放，周内市场高位风险正在聚集。（卓创资讯）,价格久居高位“不胜寒” 环丙现货交易量下滑
258,2020-05-21 13:08:32,【四川将为基层开展急需紧缺专业大学生定向培养 服务期不得少于6年】据四川日报报道，近日，四川省出台《关于加强基层治理人才支撑的若干举措》，大力推进基层治理人才队伍建设，加大基层党政人才招录力度，每年拿出10%左右公务员招录计划用于县乡选调生招录。（四川日报）,四川将为基层开展急需紧缺专业大学生定向培养 服务期不得少于6年
259,2020-05-21 13:08:24,【美联储“三巨头”来袭 机构：美元指数可能还有近100点大跌空间】Tosti在文章中写道，美元指数在周一遭遇5周以来最大单日跌幅后，走势依然承压。美国联邦公开市场委员会(FOMC)的会议纪要重申，美联储已准备好使用各种工具来支持经济。（FX168）,美联储“三巨头”来袭 机构：美元指数可能还有近100点大跌空间
260,2020-05-21 13:07:13,【超高清视频板块午后走强】超高清视频板块午后开盘走强。广电网络封板，贵广网络涨超8%，海信视像涨超5%，创维数字涨近2%。消息面上，工信部、广电总局印发超高清视频标准体系建设指南（2020版）。其中指出，到2020年，初步形成超高清视频标准体系。,超高清视频板块午后走强
261,2020-05-21 12:58:23,【中通快递：第一季度净利润同比下滑45.6%】5月21日，中通快递发布了2020年第一季度业绩。中通快递第一季度营业收入39.2亿元，同比下降14.4%，净利润为3.71亿元，较上年同期下滑45.6%。剔除2.64亿元员工股权激励相关成本影响后，调整后净利润为6.4亿元，较上年同期同比下降34.3%。一季度，公司快递服务收入34.1亿元，同比下降16.1%，剔除跨境业务收入后，单票收入1.52元，同比下降19.4%。（证券时报网）,中通快递：第一季度净利润同比下滑45.6%
262,2020-05-21 12:57:33,【罗永浩5.20带货翻车致歉！被消费者投诉收枯萎玫瑰花 承诺双倍现金返还】网红罗永浩直播带货又翻车了。这次，他的直播间遭遇了用户大面积投诉。事情的起因是，5月15日罗永浩直播间上架了互联网鲜花平台花点时间的“5.20”玫瑰礼盒，但不少消费者却收到了枯萎的玫瑰。（中国证券报）,罗永浩5.20带货翻车致歉！被消费者投诉收枯萎玫瑰花 承诺双倍现金返还
263,2020-05-21 12:54:11,【全国人大代表吴相君：促进中药材种植业高质量发展】全国人大代表、以岭药业总经理吴相君建议，加强对中药材产业发展的统筹规划，进一步强化质量控制、推进中药材质量追溯，加强中药材新品种培育、种子种苗专业化生产，加强中药材山地机械的研发和应用。（中证网）,全国人大代表吴相君：促进中药材种植业高质量发展
264,2020-05-21 12:46:33,【58同城姚劲波建议：进一步降低公积金和社保缴纳比例】全国人大代表、58同城CEO姚劲波建议进一步降低公积金和社保缴纳比例，减轻企业经营负担；积极推动灵活用工等新模式，有效分担企业用工成本；引导金融机构与互联网平台合作，解决企业融资需求。（证券时报）,58同城姚劲波建议：进一步降低公积金和社保缴纳比例
265,2020-05-21 12:39:53,【上汽集团陈虹：建议支持有条件地区加快推进智能网联汽车】“建议在部分管制区域、部分限定路段试点法律法规突破，满足智能网联汽车上路测试需要。”全国人大代表、上汽集团党委书记、董事长陈虹在今年两会提交了《关于支持有条件的地区加快推进智能网联汽车发展的建议》。（证券时报）,上汽集团陈虹：建议支持有条件地区加快推进智能网联汽车
266,2020-05-21 12:38:11,【恒大拟发行40亿元公司债 利率询价最低4.9%】5月21日，深交所披露，恒大地产集团有限公司拟发行2020年第二期公司债券，发行规模不超过40亿元(含40亿元)，利率尚未厘定。公告披露，该期债券为3年期，附第2年末发行人调整票面利率选择权和投资者回售选择权。债券的询价区间为4.9%-6.9%。5月22日，恒大地产集团有限公司和主承销商中信建投证券股份有限公司将向网下合格投资者利率询价，并根据利率询价情况确定债券的最终票面利率。（新京报）,恒大拟发行40亿元公司债 利率询价最低4.9%
