,datetime,content,title
0,2020-02-20 23:50:25,【特写：跟随李兰娟院士“红区”查房】像过去的18天来一样，李兰娟院士上午8时30分准时抵达武汉大学人民医院东院国家医疗队指挥中心，准备查房。这一次，记者获准独家跟随李兰娟见证全程。自2日凌晨率医疗队抵汉，中国工程院院士、国家卫健委高级别专家组成员李兰娟开启固定作息模式：赴东院与其他医院会诊、回驻点撰写文字材料及远程指导实验室工作。（中国新闻网）,特写：跟随李兰娟院士“红区”查房
1,2020-02-20 23:31:20,【应勇在武汉检查调研城市封控工作：坚持“全国一盘棋” 坚决守牢离鄂通道外防输出】2月20日下午，省委书记、省新冠肺炎疫情防控指挥部指挥长应勇在武汉市检查调研城市封控工作时强调，当前疫情防控正处于胶着对垒的关键时刻，要深入贯彻落实习近平总书记关于疫情防控的重要指示精神，牢固树立“全国一盘棋”思想，坚持标准不降、力度不减、不胜不休，切实守牢离鄂道口，坚决外防输出，阻断疫情蔓延。在党中央的坚强领导下，在全国人民的大力支持下，打赢疫情防控阻击战。（湖北日报）,应勇在武汉检查调研城市封控工作：坚持“全国一盘棋” 坚决守牢离鄂通道外防输出
2,2020-02-20 23:25:07,【美股三大股指震荡回升 国际黄金续创七年新高】美东时间周四，美股三大股指低开后震荡回升，截至发稿，道指跌0.01%，纳指跌0.12%，标普500指数跌0.01%。现货黄金上破1620美元/盎司，日内涨超0.5%，续创7年来新高，花旗银行此前将6至12个月现货黄金价格预期调升至1700美元/盎司。（第一财经）,美股三大股指震荡回升 国际黄金续创七年新高
3,2020-02-20 23:15:30,【广东1月份贷款增加4499亿元实现开门红】记者20日从中国人民银行广州分行获悉，1月份，广东贷款增加4499亿元(人民币)，存款增加4892亿元，顺利实现“开门红”。（中国新闻网）,广东1月份贷款增加4499亿元实现开门红
4,2020-02-20 23:14:44,【中央应对新冠肺炎疫情工作领导小组：加强一线医务人员防护 推动有序复工复产】会议指出，要贯彻落实习近平总书记重要讲话、指示和中央政治局常委会会议精神，按照中央应对疫情工作领导小组部署，高度重视对医务人员保护、关心、爱护，加强各方面支持保障，加快应用临床有效药物救治患者，在做好疫情防控同时推动有序复工复产。（央视新闻）,中央应对新冠肺炎疫情工作领导小组：加强一线医务人员防护 推动有序复工复产
5,2020-02-20 23:00:07,【美股三大股指震荡回升 国际黄金续创七年新高】美东时间周四，美股三大股指低开后震荡回升，截至发稿，道指涨0.01%，纳指涨0.03%，标普500指数涨0.06%。现货黄金持稳于1600美元之上，续创7年来新高，花旗银行此前将6至12个月现货黄金价格预期调升至1700美元/盎司。,美股三大股指震荡回升 国际黄金续创七年新高
6,2020-02-20 22:58:55,【税务总局局长王军：充分发挥税收大数据优势支持疫情防控和企业复工复产】国家税务总局局长王军20日表示，要充分发挥税收大数据特别是增值税发票数据覆盖面广、及时性强等优势，从行业、地区、规模、经济类型等不同维度，深入分析经济运行动态，客观反映企业复工复产情况，细致梳理产业链、上下游需要解决的问题。（新华网）,税务总局局长王军：充分发挥税收大数据优势支持疫情防控和企业复工复产
7,2020-02-20 22:41:06,【上海完成首例新冠肺炎康复者血浆采集！还有多位痊愈患者报名血浆捐献】2月19日下午，上海首例新冠肺炎康复者血浆采集工作在市血液中心新冠肺炎康复者血浆捐献点完成。新冠肺炎康复者黄先生成功捐献血浆200ml，帮助挽救重症和危重症新冠肺炎患者的生命。此外，还有多位痊愈患者报名血浆捐献。（上海发布）,上海完成首例新冠肺炎康复者血浆采集！还有多位痊愈患者报名血浆捐献
8,2020-02-20 22:30:07,【美股开盘】美股三大股指小幅低开，道指跌0.19%，纳指跌0.18%，标普500指数跌0.17%。现货黄金持稳于1600美元之上，续创7年来新高，花旗银行此前将6至12个月现货黄金价格预期调升至1700美元/盎司。,美股三大股指小幅下跌 国际黄金续创七年新高
9,2020-02-20 22:29:17,【蛋壳公寓公布“免租期”方案 分期返还房东一个月房租等】据新京报从蛋壳公寓方面获悉，蛋壳公寓已正式向房东公布了“蛋壳房东支持计划”，提供了多种免租期支持和返还方案，包括：疫情期间爱心支持的一个月房租，在合同结束时返还或在合同的剩余租期分月份返还；疫情期间爱心支持的半个月免租期，应付剩余租金将在合同约定付款日起15个工作日内支付。（新京报）,蛋壳公寓公布“免租期”方案 分期返还房东一个月房租等
10,2020-02-20 22:24:33,"【韩红慈善基金会被举报 北京市民政局通报调查结果】2月13日，北京市民政局收到微博账户司马3忌发来的举报材料，反映北京韩红爱心慈善基金会（以下简称韩红基金会）存在违法行为。我局高度重视，立即依法依规开展调查。经调查，韩红基金会自成立以来，总体上运作比较规范,特别是在抗击疫情中做了大量工作，应予以支持和肯定。但也发现部分投资事项公开不及时,在未取得公开募捐资格前有公开募捐行为。我局已要求韩红基金会限期改正，依法规范运作。时值全国疫情防控的特殊时期，我局将加强对慈善组织的监督管理服务，动员慈善力量依法有序参与防控工作，并及时回应社会对慈善捐赠工作的关切。希望全社会营造良好监督环境，促进慈善事业健康有序发展。（北京日报）",韩红慈善基金会被举报 北京市民政局通报调查结果
11,2020-02-20 22:23:57,【中华片区茅台酒技改工程复工】来自贵州省发改委的消息，截至2月19日，贵州省重大工程项目已复工719个，其中在十大千亿级工业产业方面，茅台酒公司中华片区茅台酒技改工程等141个项目已复工。中华片区6600吨茅台酒技改工程于2017年12月28日启动，原计划在今年6月30日以前全面竣工。项目建成后，茅台酒基酒总产能将大幅提升，预计达到5.6万吨/年。（e公司）,中华片区茅台酒技改工程复工
12,2020-02-20 22:23:20,【欧盟公布数字化转型规划】欧盟委员会19日公布一系列向数字化转型规划，包括如何使欧洲适应数字化时代的总体规划和《欧洲数据战略》《人工智能白皮书》两份文件。（新华社）,欧盟公布数字化转型规划
13,2020-02-20 22:21:14,【武汉市委书记王忠林：明天实现存量核酸检测清零】今日下午，湖北省委常委、武汉市委书记王忠林主持召开专题调度会。王忠林说，开展流行病学调查，是发现患者、排除疑似的重要手段，对于疫情防控来说是基础性、源头性的工作，必须做好。他要求，持续加力、尽快清零，到21日把原来存量全部筛查完，22日开始，当日新增当日清零，实现由被动转主动。“到明天，临床确诊、疑似、密接、发热患者的核酸检测要全面清零！”。（长江日报）,武汉市委书记王忠林：明天实现存量核酸检测清零
14,2020-02-20 22:19:46,【北京：批发市场、加油站等5类场所应摘掉门帘】2月20日，北京市商务局发布商品交易市场、批发市场、商超配送物流、加油站、美发美容等5个领域疫情防控指引。指引中建议，商品交易市场、批发市场摘掉门帘，避免反复触摸造成的疾病传播风险；建议去这些场所，尽量避免乘坐厢式电梯，乘坐时应佩戴一次性医用口罩；加油站提倡“加油不下车，开票不进店，购物不接触”。（北京日报）,北京：批发市场、加油站等5类场所应摘掉门帘
15,2020-02-20 22:17:52,【除乐清外 温州今日22时撤销市域范围有关检查卡点】温州发布新型冠状病毒肺炎疫情防控工作领导小组通告，除乐清外，温州各地今天22时撤销辖区内高速公路、国省道和农村公路等全部检查卡点，并恢复原关闭的高速公路出入口。乐清市于22日20时，撤销辖区内高速公路 、普通国省道和农村公路等全部检查卡点（含市际），并同步恢复原关闭的高速公路出入口。（一财）,除乐清外 温州今日22时撤销市域范围有关检查卡点
16,2020-02-20 22:16:47,【行情】WTI原油涨幅扩大至1.10%，现报54.88美元/桶，布伦特原油涨0.78%，报59.49美元/桶。,WTI原油涨幅扩大至1.10%
17,2020-02-20 22:16:09,【王毅：中国经济不会因疫情而发生逆转】2月20日，中国－东盟关于新冠肺炎问题特别外长会在老挝万象举行。国务委员兼外长王毅表示，疫情给中国经济社会发展带来各种挑战，但这是暂时和有限的。中国从无数艰难险阻中一路走来，不断化挑战为机遇，变逆境为顺境。我们不仅将取得抗击疫情的彻底胜利，也将努力实现既定的经济社会发展目标。（证券时报）,王毅：中国经济不会因疫情而发生逆转
18,2020-02-20 22:11:21,【深圳：24日起公交线路逐步恢复正常营运】深圳决定逐步恢复深圳公交营运秩序。自2020年2月24日起，除假日专线、跨市运行的公交线路、为学校服务的公交线路、应防疫措施要求停运的公交线路外，所有公交线路原则上恢复营运。2月24日至3月1日为各公交线路发车班次恢复过渡期，具体恢复线路将尽快整理发布。（证券时报）,深圳：24日起公交线路逐步恢复正常营运
19,2020-02-20 22:09:46,【浙江省供销社：农资流通企业复工率达98%】浙江省供销社表示，督导农资企业复工复产。根据浙江省委统一部署，在做好疫情防控的前提下，全省系统农资生产企业均已复产，农资流通企业复工率达到98%，10800个基层农资经销网点已陆续恢复营业，打通了农资配送农村的“最后一公里”。（一财）,浙江省供销社：农资流通企业复工率达98%
20,2020-02-20 22:06:38,"【春秋电子：公开发行可转债申请获核准批复】春秋电子公告，近日，公司向社会公开发行面值总额24,000万元可转换公司债券申请获得证监会核准批复。（一财）",春秋电子：公开发行可转债申请获核准批复
21,2020-02-20 22:05:54,【长江干线3个航道整治工程项目同日复工】长江经济带发展规划重点项目——长江干线武汉至安庆段6米水深航道整治工程Ⅲ标段、Ⅴ标段20日复工。同日，长江中游新洲至九江河段航道整治二期工程、长江下游江心洲至乌江河段二期整治工程也按复工方案，有序展开施工。此前的2月13日，长江上游九龙坡至朝天门河段航道建设工程率先复工。长江航道局负责管理的6个航道整治在建项目，已有4个项目5个标段恢复施工。（新华社）,长江干线3个航道整治工程项目同日复工
22,2020-02-20 22:01:35,【至少14个省市出台抗疫一线医务子女入学照顾政策】目前至少已有湖北、河南、四川、青海、山东、抚州、大同、沈阳、抚顺、苏州、南京、包头、西安、重庆等14个省市，出台了对疫情一线医务人员子女入学的照顾政策。最高中考可加30分。（证券时报）,至少14个省市出台抗疫一线医务子女入学照顾政策
23,2020-02-20 21:59:49,【商务部将推进一步稳定汽车消费措施 行业复苏可期】商务部市场运行司副司长王斌20日表示，商务部将会同相关部门研究出台进一步稳定汽车消费的政策措施，减轻疫情对汽车消费的影响。目前我国汽车限购地区包括9个省市，限购地区去年的总许可额度约80万辆。据长城证券孙志东测算，若限购城市新增50%购车指标，对整体车市的拉动约为1.9%。上汽集团是国内乘用车龙头；伯特利是国内少有的在智能驾驶感知、决策、执行等领域全面布局的供应商；万里扬是国内自主变速器优秀企业。（上证资讯）,商务部将推进一步稳定汽车消费措施 行业复苏可期
24,2020-02-20 21:55:47,【甘肃无新增新冠肺炎确诊病例 新增出院6例】2月19日20时至2月20日20时，甘肃省无新增新型冠状病毒肺炎确诊病例。新增出院6例。截至2月20日20时，甘肃累计报告新型冠状病毒肺炎确诊病例91例，累计治愈出院71例，累计死亡病例2例。目前，累计追踪到密切接触者4089人，已解除医学观察3569人，其余520人正在接受医学观察。（一财）,甘肃无新增新冠肺炎确诊病例 新增出院6例
25,2020-02-20 21:50:25,【四川：景区须通过网络实名制购票 日接待量不超过日最大承载量的50%】四川省旅游景区管理协会对外发布《四川省新型冠状肺炎疫情防控期间旅游景区开放工作指南》，提出景区须通过网络实名制购票，日接待量不超过日最大承载量的50%，景区要设立临时隔离点等。（一财）,四川：景区须通过网络实名制购票 日接待量不超过日最大承载量的50%
26,2020-02-20 21:49:30,【白宫发布战略构想：美国曾首创计算机网络 现要开辟量子网】美国白宫网站近日发布一份《美国量子网络战略构想》，提出美国将开辟量子互联网，确保量子信息科学(QIS)惠及大众。（澎湃）,白宫发布战略构想：美国曾首创计算机网络 现要开辟量子网
27,2020-02-20 21:47:58,【内地总价新地王诞生！香港置地310.5亿上海夺地】9天前，上海市徐汇区黄浦江南延伸段的28个地块正式挂牌，作为上海中心城区硕果仅存的可供大规模整体开发的地块，地块价值不言而喻。310.2亿元的起始价、65亿元的保证金早已宣告了此次起拍的准入门槛和地王属性。（国际金融报）,内地总价新地王诞生！香港置地310.5亿上海夺地
28,2020-02-20 21:47:15,【联通eSIM服务年内将实现全球能力部署 行业需求望迎来爆发式增长】据报道，2020年中国联通将大力推进eSIM应用与泛智能终端产业发展，并携手合作伙伴打造360度数字化生活基础设施。eSIM卡又称嵌入式SIM卡，是将传统SIM卡直接嵌入设备芯片，用户无需插入物理SIM卡。随着联通等运营商的推广及物联网技术的成熟，eSIM卡需求望迎来爆发式增长。天喻信息公司eSIM卡产品已批量出货；恒宝股份eSIM卡业务已通过三大运营商备案测试；澄天伟业具备eSIM卡生产能力。（怀新资讯）,联通eSIM服务年内将实现全球能力部署 行业需求望迎来爆发式增长
29,2020-02-20 21:42:04,【1月信贷创单月历史天量 M1零增长并非经济停滞标志】2月20日，央行公布数据显示，1月新增金融机构人民币贷款3.34万亿元，比上月多增2.20万亿，比上年同期多增0.11万亿；1月新增社会融资规模5.07万亿元，比上月多增29670亿，比上年同期多增3909亿。（一财）,1月信贷创单月历史天量 M1零增长并非经济停滞标志
30,2020-02-20 21:42:01,【武汉公布“四类人员”收治情况】20日，武汉市公开了截至19日24时的四类人员收治情况。确诊(含临床诊断)患者：医院(86家) 23334人，方舱(15家)9302人，居家972人(核酸检测为阴)。核查排除1184。疑似患者：医院485人，隔离点1406人。（一财）,武汉公布“四类人员”收治情况
31,2020-02-20 21:36:43,【现货黄金短线走低2美元】现货黄金短线走低2美元，现报1615.7美元/盎司。,现货黄金短线走低2美元
32,2020-02-20 21:34:54,【工信部：5G等有关企业要变“危”为“机” 加大研发力度】2月20日上午，工信部总经济师王新哲一行赴东华软件股份公司调研。王新哲强调，在疫情防控阻击战中，5G、人工智能、大数据等新一代信息技术得到广泛应用，发挥了重要作用。有关企业要变“危”为“机”，加大研发力度，大力推进新一代信息技术在医疗活动中的应用和推广，培育形成企业核心技术和竞争力。产学研用等各单位要加强协作，深耕医疗领域，推进5G+制造业+诊疗技术融合发展，为全球医疗卫生事业发展提供中国方案、作出中国贡献。（一财）,工信部：5G等有关企业要变“危”为“机” 加大研发力度
33,2020-02-20 21:31:11,【数据】美国至2月15日当周初请失业金人数为21万人，预估为21.0万人，前值为20.5万人。（金十数据）,美国至2月15日当周初请失业金人数为21万人
34,2020-02-20 21:31:06,【浙江出现首例病亡病例】记者从浙江省卫生健康委获悉，截至2月19日24时，浙江省累计报告新冠肺炎确诊病例1175例，累计出院609例，出院患者占确诊病例的51.83%。一名女性患者因多器官脏器功能衰竭，于20日抢救无效病亡，这是浙江省首例病亡病例。（新华社）,浙江出现首例病亡病例
35,2020-02-20 21:21:00,【欧洲核子研究中心首次测量到反物质中的量子效应】欧洲核子研究中心19日发布公报称，首次成功对反氢原子能量结构中的某些量子效应展开测量，测量结果与“正常”氢效应的理论预测相符，为今后更精确地测量这类量子效应和其他基本量铺平了道路。（新华社）,欧洲核子研究中心首次测量到反物质中的量子效应
36,2020-02-20 21:18:17,【京东方A将独家供应华为Mate Xs的柔性折叠屏】华为要发布新款折叠屏手机，柔性OLED显示屏厂商是最直接的受益者。记者获悉，京东方A将独家供应华为Mate Xs的柔性折叠屏。京东方A在2月4日接受机构调研时表示，2019年，公司柔性AMOLED出货位居全球第二，在国内以86.7%的市占率居首位，产品已应用于Mate X折叠手机、摩托罗拉Razr折叠手机、OPPO 5G手机、努比亚X双屏手机、Intel折叠笔记本电脑等。（上证报）,京东方A将独家供应华为Mate Xs的柔性折叠屏
37,2020-02-20 21:18:12,【黄山市明天起A级景区有序恢复开放】从2月21日起，黄山市受新冠肺炎疫情影响暂时关闭的49家54处A级旅游景区，采取分类分步方式有序恢复开放，其中首批23处A级景区率先恢复开放。（安徽日报）,黄山市明天起A级景区有序恢复开放
38,2020-02-20 21:12:32,【哈尔滨两区县领导防疫不力被免职】黑龙江哈尔滨香坊区委副书记、区长赵罡，五常市委副书记、市长于军，在应对疫情工作特殊时期，对疫情严峻形势估计不足，对疫情防控领导不力，组织发动不够，防控措施不实，造成香坊区、五常市疫情扩散。经市委常委会会议研究决定，免去赵罡同志香坊区委副书记，提名免去赵罡同志香坊区政府区长职务；免去于军同志五常市委副书记，提名免去于军同志五常市政府市长职务。（一财）,哈尔滨两区县领导防疫不力被免职
39,2020-02-20 21:11:39,【浙江：承租国企房产可免收二、三月房租】从浙江省新冠肺炎疫情防控工作新闻发布会获悉，浙江省在推动国有企业自身复工复产的同时，主动帮扶企业降本减负，共渡难关，明确对承租国有企业经营性房产，从事生产经营活动的企业，免收二月、三月房租。（新华社）,浙江：承租国企房产可免收二、三月房租
40,2020-02-20 21:08:01,【华为新设HMS主管部门 相关公司受益HMS建设提速】据报道，华为消费者业务（CBG）新设了一个二级部门：消费者BG全球生态发展部，主管华为HMS（华为移动服务）生态建设。HMS是华为应对美国谷歌终止为华为提供生态服务（谷歌禁令）的举措，是华为自行研发的手机生态系统。业内认为，一旦搭载鸿蒙的华为手机正式推出，将会改变目前手机操作系统安卓和苹果一统江湖的市场竞争格局，相关合作伙伴有望受益。梦网集团与华为软件合作；北信源与华为旗下子公司鼎桥通信战略合作。（怀新资讯）,华为新设HMS主管部门 相关公司受益HMS建设提速
41,2020-02-20 21:05:34,【国资举牌又一例 兴蓉环境获长江环保集团举牌】兴蓉环境(000598)2月20日晚间公告，长江生态环保集团有限公司(下称“长江环保集团”)2月19日通过集中竞价方式，增持公司股份173.39万股，占公司总股本的0.06%。此次权益变动后，长江环保集团及其一致行动人三峡资本累计持股比例达5%。（证券时报）,国资举牌又一例 兴蓉环境获长江环保集团举牌
42,2020-02-20 21:04:14,【逐步恢复堂食 广东发布餐饮服务业新冠肺炎防控工作指引】记者20日从广东省政府新闻办新闻发布会上了解到，广东20日发布《广东省餐饮服务业新冠肺炎防控工作指引》，指导餐饮经营单位在疫情期间逐步恢复堂食服务，加强人员管理、经营管理等各项防控措施，保障餐饮服务业复工复产员工安全及公众用餐安全。（新华社）,逐步恢复堂食 广东发布餐饮服务业新冠肺炎防控工作指引
43,2020-02-20 21:03:26,【中密控股：拟非公开发行股票募资不超6.5亿元】中密控股(300470)2月20日晚间公告拟非公开发行A股股票。发行价为21.83元/股，发行对象为申万宏源、平安资管等9名。拟募资总额不超过6.5亿元，用于收购新地佩尔100%股权项目、机械密封产品数字化转型及智能制造项目、补充流动资金。（证券时报）,中密控股：拟非公开发行股票募资不超6.5亿元
44,2020-02-20 21:02:50,【湖北省疫情防控指挥部发通知：给予特殊困难群体生活物资救助】20日，湖北省新型冠状病毒感染肺炎疫情防控指挥部发出通知，要求切实做好疫情防控期间特殊困难群体帮扶和养老机构等特殊场所管理工作。（央视）,湖北省疫情防控指挥部发通知：给予特殊困难群体生活物资救助
45,2020-02-20 21:02:38,【陈光明专户持仓动向首次曝光！截至1月底仓位七至八成 偏爱这五大行业！】2月18日，“网红”基金睿远均衡价值三年持有混合大卖超1200亿元，认购规模创纪录的背后，不管是渠道还是投资者，其实都很清楚，主要还是冲着“睿远”、“陈光明”的IP去的。（每经）,陈光明专户持仓动向首次曝光！截至1月底仓位七至八成 偏爱这五大行业！
46,2020-02-20 20:55:38,【三五互联：大股东拟减持不超6%股份 降低质押风险】三五互联晚间公告，公司持股比例37.82%的大股东龚少晖计划6个月内，以大宗交易及集中竞价交易方式合计减持公司股份不超过2194.19万股（占公司总股本的6%）。减持原因包括：华融证券、财达证券对龚少晖的股票质押违约处置；降低大股东股票质押率及质押风险。（一财）,三五互联：大股东拟减持不超6%股份 降低质押风险
47,2020-02-20 20:54:21,【北京利尔：拟定增募资不超4.365亿元 投建绿色耐火材料项目】北京利尔(002392)2月20日晚间披露非公开发行A股股票预案，公司拟募资不超4.365亿元，投资日照利尔绿色耐火材料生产线建设项目一期（16万吨/年）并补充流动资金。发行对象共24名特定对象，其中仅程鹏、程天倚、上海赞谋、牛文怡4方与公司不存在关联关系。发行价格为前20个交易日公司股票交易均价的80%，即2.91元/股。（证券时报）,北京利尔：拟定增募资不超4.365亿元 投建绿色耐火材料项目
48,2020-02-20 20:51:30,【上海虹桥国际人才港正式启动 首批上千亿投资项目签约落户】上海虹桥国际人才港正式启动。虹桥商务区今年首批重大产业投资项目集中签约仪式也于同时举行。从虹桥商务区管委会获悉，虹桥商务区正加大投资促进力度，吸引优质项目落地。在当天举行的重大产业投资项目集中签约仪式上，共有7个重大产业投资项目集中签约，总投资达1200多亿元。（澎湃新闻）,上海虹桥国际人才港正式启动 首批上千亿投资项目签约落户
49,2020-02-20 20:48:20,【中国联通：1月份4G用户净增131.8万户】中国联通(600050)2月20日晚公告，1月份，公司4G用户净增131.8万户，累计达2.55亿户；固网宽带用户净增61.8万户，累计达8409.6万户。（证券时报）,中国联通：1月份4G用户净增131.8万户
50,2020-02-20 20:44:07,【大手笔！企业社保减免将达6000亿 国有资本划转力度加大】继养老、工伤和失业三项社会保险减免之后，医疗保险也出台了减半征收5个月的政策。财政部预计，此次应对疫情减免社保费“组合拳”将为企业减负约6000亿元。（一财）,大手笔！企业社保减免将达6000亿 国有资本划转力度加大
