,datetime,content,title
453,2020-04-10 16:16:34,【吉利控股集团就“欲收购神州租车”传闻回应e公司：没有这样的计划】对于“吉利集团欲收购神州租车”的传闻，吉利控股集团最新回应证券时报·e公司记者称：“没有这样的计划。”（e公司）,吉利控股集团就“欲收购神州租车”传闻回应e公司：没有这样的计划
454,2020-04-10 16:14:30,【广汽集团：3月份汽车销量同比下降39.55%】广汽集团(601238)4月10日晚披露的产销快报显示，3月份，公司汽车销量为11万辆，同比下降39.55%；1-3月累计销量为30.6万辆，同比下降38.13%。（证券时报）,广汽集团：3月份汽车销量同比下降39.55%
455,2020-04-10 16:08:45,【深交所发布关于融资融券标的证券2020年第一季度定期调整有关事项的通知】本次融资融券标的股票的调整，以优先保留现有标的股票为基本原则，并对符合《实施细则》第3.2条等相关规定的本所上市A股股票，按照加权评价指标从大到小排序，选取新增调入的标的股票，调整后本所标的股票数量为800只。（界面新闻）,深交所发布关于融资融券标的证券2020年第一季度定期调整有关事项的通知
456,2020-04-10 16:08:30,【美威胁吊销中国电信在美经营许可 赵立坚：敦促美方停止将经济问题政治化】对于美方威胁停止中国电信在美国继续提供服务的报道，外交部发言人赵立坚在回应中称，中方对此坚决反对。中国政府一贯要求中国企业在依法合规的基础上，按照市场原则开展对外经济合作，同时也要求他们遵守当地法律法规。“我们敦促美方遵守市场经济原则，停止将国家安全泛化，将经济问题政治化的错误做法，停止对中国企业的无理打压，为中国企业赴美投资、经营提供公平、公正、非歧视的环境。”赵立坚说。（环球网）,美威胁吊销中国电信在美经营许可 赵立坚：敦促美方停止将经济问题政治化
457,2020-04-10 16:04:12,【商务部：加快自贸区建设 积极推动RCEP早日签署】商务部外贸司司长李兴乾10日在新闻发布会上表示，中国政府在加大国际抗疫合作的同时，将继续密切与各个经贸伙伴开展务实合作，支持企业开拓国际市场。一是加快自贸区建设，营造良好的国际环境。积极推动《区域全面经济伙伴关系协定》（RCEP）早日签署，与更多国家商签高标准自贸协定。二是完善合作机制，畅通贸易渠道。三是更大力度培育贸易新业态新模式。四是加强与贸易伙伴沟通协调。（证券时报）,商务部：加快自贸区建设 积极推动RCEP早日签署
458,2020-04-10 15:59:55,【吉利集团欲收购神州租车 已开始进行摸底调研】界面新闻从接近吉利集团人士处独家获悉，在今年1月31日，浑水首次发布瑞幸咖啡报告的前几日，由一位同是瑞幸和神州租车的关键人物找到吉利集团战略投资部，称神州租车正在寻找买手。目前，吉利集团战投资部正在和相关机构接触，洽谈打包收购神州租车。（界面新闻）,吉利集团欲收购神州租车 已开始进行摸底调研
459,2020-04-10 15:58:58,【央行调查统计司司长阮健弘：M2增速上升比较多 总体上有效支持了疫情防控和经济社会发展】3月末中国M2同比增长10.1%，阮健弘在央行10日的发布会上表示，M2增速上升比较多，总体上有效支持了疫情防控和经济社会发展。在政策引导下，商业银行信贷投放比较多，推动了M2增速回升，全社会流动性持续保持在合理充裕状态。一季度非金融企业的存款增加1.86万亿元，同比多1.53万亿元，企业存款增加比较多，为复工复产顺利推进储备了良好的资金状况。（国是直通车）,央行调查统计司司长阮健弘：M2增速上升比较多 有效支持疫情防控和经济发展
460,2020-04-10 15:58:53,【新希望：一季度净利润同比预增125%-140%】新希望(000876)4月10日晚间公告，一季度预计盈利15亿元至16亿元，同比增长125.09%-140.1%。报告期内，受非洲猪瘟疫情影响，国内生猪供需缺口较大，生猪销售价格持续上涨，同时公司生猪出栏量同比较大幅度提高，使得公司养猪产业利润同比大幅上涨。（证券时报）,新希望：一季度净利润同比预增125%-140%
461,2020-04-10 15:57:22,【国务院出台三项措施保障失业人员基本生活】人力资源和社会保障部失业保险司司长桂桢在新闻发布会上介绍，最近，应对疫情的影响，保障失业人员基本生活，国务院实施了三项新举措：第一，延长大龄失业人员领金期限。对领取失业保险金期满仍未就业且距法定退休年龄不足一年的，可以将失业保险金发放至法定退休年龄。第二，阶段性实施失业补助金政策。2020年，对领取失业保险金期满仍旧没有就业，以及不符合法定领取失业保险金条件的参保失业人员发放6个月的失业补助金。第三，阶段性提高价格临时补贴。（界面新闻）,国务院出台三项措施保障失业人员基本生活
462,2020-04-10 15:56:14,【银泰黄金：一季度净利润同比预增55%-61%】银泰黄金(000975)4月10日晚间公告，一季度预计盈利2.65亿元至2.75亿元，同比增长55.60%-61.47%。本期业绩增长主要得益于黄金价格同比上涨和青海大柴旦矿业有限公司投产带来利润的增加。（证券时报）,银泰黄金：一季度净利润同比预增55%-61%
463,2020-04-10 15:49:33,【长安汽车：今年一季度汽车销量同比下降32.12%】长安汽车公告，今年一季度汽车销量为30.31万辆，上年同期为44.65万辆，同比下降32.12%。（界面新闻）,长安汽车：今年一季度汽车销量同比下降32.12%
464,2020-04-10 15:48:12,【视觉中国回应举报：目前没有收到相关函件】4月10日，雷腾律师事务所发布《关于视觉中国公司涉嫌诈骗罪和虚假诉讼罪的公开举报函》。对此，证券时报记者致电视觉中国，董事长办公室工作人员回应称，有看到相关报道，但目前公司没有收到相关函件。（证券时报）,视觉中国回应举报：目前没有收到相关函件
465,2020-04-10 15:47:57,【温氏股份：预计一季度净利润同比增5倍】温氏股份公告，预计一季度盈利18.92亿-18.97亿元，同比增长510.90%-511.98%。（第一财经）,温氏股份：预计一季度净利润同比增5倍
466,2020-04-10 15:46:24,【攀钢钒钛：钒钛产品市场价格下降 一季度净利润同比预降89%-92%】攀钢钒钛发布第一季度业绩预告，预计盈利6000-8000万元，比上年同期下降89%-92%。受新冠肺炎疫情和下游相关产业需求不足影响，报告期内，钒钛产品市场价格同比下降幅度较大。（界面新闻）,攀钢钒钛：钒钛产品市场价格下降 一季度净利润同比预降89%-92%
467,2020-04-10 15:42:43,【商务部：去年我国猪肉进口近200万吨】商务部部长助理任鸿斌介绍，近两年来，根据海关统计，中国农产品进口贸易额在1000亿到1400亿左右，出口额在750亿到800亿左右，进出口加在一起是2000亿到2200亿左右。进口的产品主要是大豆、肉类和乳制品，这三类产品占到了农产品进口的45%。去年我国肉类进口总量达到了482万吨，同比增长58%，其中猪肉进口近200万吨，同比增长67%。猪肉的进口对稳定国内市场、满足人民消费提供了有力的支撑。（证券时报）,商务部：去年我国猪肉进口近200万吨
468,2020-04-10 15:37:59,【央行：一季度社会融资规模增量累计为11.08万亿元】央行：初步统计，2020年一季度社会融资规模增量累计为11.08万亿元，比上年同期多2.47万亿元。（证券时报）,央行：一季度社会融资规模增量累计为11.08万亿元
469,2020-04-10 15:32:23,【央行：3月人民币贷款增加2.85万亿元 广义货币增长10.1%】3月末，本外币贷款余额165.97万亿元，同比增长12.3%。月末人民币贷款余额160.21万亿元，同比增长12.7%，增速比上月末高0.6个百分点，比上年同期低1个百分点。3月当月人民币贷款增加2.85万亿元，同比多增1.16万亿元。（央行网站）,央行：3月人民币贷款增加2.85万亿元 M2增长10.1%
470,2020-04-10 15:31:38,【工信部：特斯拉2019年新能源汽车积分实际值5562分】工信部公示2019年度乘用车企业平均燃料消耗量与新能源汽车积分情况，其中特斯拉2019年新能源汽车积分实际值5562分。（界面新闻）,工信部：特斯拉2019年新能源汽车积分实际值5562分
471,2020-04-10 15:26:38,【特锐德：预计今年一季度净利润亏损6000万元-8000万元】4月10日，特锐德发布公告称，预计2020年一季度实现归属于上市公司股东的净利润亏损6000万元-8000万元，上年同期盈利3630.15万元。,特锐德：预计今年一季度净利润亏损6000万元-8000万元
472,2020-04-10 15:19:44,【国家计算机病毒应急处理中心监测发现20余款违规移动应用】国家计算机病毒应急处理中心近期在“净网2020”专项行动中对互联网监测发现，20余款外卖、医疗和在线教育类移动应用存在涉嫌隐私不合规行为。这些移动应用的违法违规行为主要有三大方面：一是未向用户明示申请的全部隐私权限。二是未说明收集使用个人信息规则。三是未提供有效的更正、删除个人信息及注销用户账号功能。针对上述情况，国家计算机病毒应急处理中心将对这些App进行通报下架处理。（新华网）,国家计算机病毒应急处理中心监测发现20余款违规移动应用
473,2020-04-10 15:18:23,【发改委：将高质量、高水平推动生态保护补偿立法工作】据发改委4月10日消息，4月9日上午，发改委振兴司组织召开《生态保护补偿条例》起草工作专家视频座谈会。会上，各位专家学者围绕条例起草的有关内容作交流发言，对条例的框架和研究专题提出了意见建议。下一步，发改委振兴司将认真梳理、充分吸取专家学者的意见建议，抓紧修改完善条例文本，会同有关部门扎实做好专题研究，高质量、高水平推动生态保护补偿立法工作。（证券时报）,发改委：将高质量、高水平推动生态保护补偿立法工作
474,2020-04-10 15:14:10,【商务部：本届广交会将打造10×24小时全天候线上外贸平台】商务部外贸司司长李兴乾表示，第127届广交会创新提出以网上办展替代实体展，既是应对疫情的务实举措，又是创新发展的一项重大举措。本届网上广交会将主要包括线上展示对接平台、跨境电商专区、直播营销服务三部分内容，继续发挥贸易展的优势。以B2B为主，兼顾部分B2C平台，打造10×24小时全天候线上外贸平台，为参展企业和采购商提供网上推介、供采对接、在线洽谈等服务，让中外客商足不出户下订单、做生意。（第一财经）,商务部：本届广交会将打造10×24小时全天候线上外贸平台
475,2020-04-10 15:09:13,【上海将扩大新基建领域投资 加快政府专项债券发行和使用】上海市发展改革委一级巡视员王扣柱4月10日在上海市政府新闻发布会上表示，即将发布的《上海市扩大有效投资稳定经济发展若干政策措施》中，围绕扩大政府有效措施，上海将发挥政府投资项目的引导和带动作用，在巩固拓展基础设施、生态环保、社会民生领域投资的同时，进一步扩大新基建领域投资。（中证网）,王扣柱：上海将扩大新基建领域投资  加快政府专项债券发行和使用
476,2020-04-10 15:06:23,【全国超过76%的重点外贸企业产能恢复率超七成】商务部：截至目前，全国超过76%的重点外贸企业产能恢复率超七成。（第一财经）,全国超过76%的重点外贸企业产能恢复率超七成
477,2020-04-10 15:04:34,【商务部：已经启动鼓励外商投资产业目录修订工作】国务院联防联控机制4月10日举行新闻发布会，商务部外贸司司长李兴乾表示，目前，国家发改委和商务部已经启动鼓励外商投资产业目录修订工作，其中全国鼓励外商投资产业目录重点增加促进制造业高质量发展的相关条目，优化加工贸易的产业结构；中西部地区外商投资优势产业目录更加侧重提升中西部和东北地区承接产业转移的能力，优化加工贸易的区域结构。（证券时报）,商务部：已经启动鼓励外商投资产业目录修订工作
478,2020-04-10 15:00:17,【收盘播报】A股三大指数今日集体收跌，沪指跌幅超过1%，失守2800点关口，创业板指跌幅超过2%。行业板块呈现普跌态势，科技类股票领跌，仅保险与港口水运板块逆市翻红。,A股三大指数集体收跌：沪指失守2800点 创业板指跌逾2%
479,2020-04-10 15:00:17,【商品期货午盘多数上涨 黑色系期货走势偏强】4月10日消息，国内商品期货多数上涨，锰硅、焦煤、沪锡及沪镍期货涨幅居前，其中锰硅涨停，焦煤涨逾2%。专家称，焦炭的基本面情况并未好转。,商品期货多数上涨 黑色系期货走势偏强
480,2020-04-10 14:58:21,【律师公开举报视觉中国：涉嫌诈骗罪、虚假诉讼罪】4月10日，雷腾律师事务所发布《关于视觉中国公司涉嫌诈骗罪和虚假诉讼罪的公开举报函》：视觉中国公司涉嫌的违法犯罪行为，严重侵犯他人的合法权益，极大损害国家司法秩序和裁判权威，严重冲击社会诚信体系，确应依法惩治，希望公安机关及时查处视觉中国公司涉嫌诈骗和虚假诉讼的犯罪行为，维护法律应有的尊严。（证券时报）,律师公开举报视觉中国：涉嫌诈骗罪、虚假诉讼罪
481,2020-04-10 14:56:19,【中汽协：建议限购城市尽快释放市场刚需】4月10日，针对疫情对汽车行业的负面影响，中国汽车工业协会提出多项促进汽车消费的建议，包括限购城市尽快释放市场刚需、推动1.6L以下小排量汽车消费、大力鼓励新能源汽车消费，实施国三及以下排放车辆提前置换、解禁皮卡车进城、加大汽车金融支持及促进四五线城市和乡镇汽车市场发展。（中证网）,中汽协：建议限购城市尽快释放市场刚需
482,2020-04-10 14:50:40,【中汽协：3月我国动力电池产量共计4.5GWh 同比下降45.5％】3月，我国动力电池产量共计4.5GWh，同比下降45.5％，环比增长396.6％。其中三元电池产量3.2Gh，占总产量72.4％，同比下降40.9％，环比增长600.5％；磷酸铁锂电池产量1.2GWh，占总产量27.6％，同比下降50.6％，环比増长181.3％。（界面新闻）,中汽协：3月我国动力电池产量共计4.5GWh 同比下降45.5％
483,2020-04-10 14:49:11,【上海拟对产业类重大项目竣工验收和不动产登记实施“验登合一”】上海市规划资源局副局长许健表示，《关于优化本市重大项目规划资源审批和供地流程的实施意见》着眼类型全覆盖、流程全覆盖、事项全覆盖，依托在“一张蓝图”基础上构建“多规合一”业务协同平台做实项目实施库，稳定设计方案，依托行政协助制度促进项目策划生成。全力支持重大项目建设用地计划，做到应保尽保，包括提前下达全年一半的减量化用地指标，加大周转指标统筹调剂支持力度。同时，市规划资源局还会进一步研究减化《工程规划许可证》办理，包括采用开工放样复验备案制，对产业类重大项目实行竣工验收和不动产登记“验登合一”等。（界面新闻）,上海拟对产业类重大项目竣工验收和不动产登记实施“验登合一”
484,2020-04-10 14:48:12,【商务部：暂免今年4月至年底的加工贸易内销缓税利息】商务部外贸司司长李兴乾10日在国新办举行的新闻发布会上表示，暂停征收加工贸易内销缓税利息，暂免征收至年底。加工贸易企业将保税进口料件或制成品内销时，除按规定缴纳进口环节税收外，还需要缴纳缓税利息，暂免今年4月至年底的加工贸易内销缓税利息，可以降低企业的内销成本，缓解企业的资金压力。（中证网）,商务部：暂免今年4月至年底的加工贸易内销缓税利息
485,2020-04-10 14:44:48,【上海市经信委：近期将发布《促进在线新经济行动方案》】上海市经信委：已全面梳理了全市约2000个拟建、在建技术改造项目，围绕集成电路、人工智能、生物医药、新能源汽车等重点领域持续发力；近期将发布《促进在线新经济行动方案》，将实施无人工厂专项技改行动，加大对无人工厂、数字车间、智能制造等项目的支持力度。（上观新闻）,上海市经信委：近期将发布《促进在线新经济行动方案》
486,2020-04-10 14:43:26,【首次网上广交会6月中下旬举办 含直播营销等内容】国务院联防联控机制4月10日举行新闻发布会，商务部部长助理任鸿斌介绍，第127届广交会将于6月中下旬在网上举办，创新提出以网上办展替代实体展。本届网上广交会将主要包括线上展示对接平台、跨境电商专区、直播营销服务三部分内容，以B2B为主，兼顾部分B2C，打造10×24小时全天候线上外贸平台，为参展企业和采购商提供网上推介、供采对接、在线洽谈等服务，让中外客商足不出户下订单、做生意。（界面新闻）,首次网上广交会6月中下旬举办 含直播营销等内容
487,2020-04-10 14:40:32,【中国平安回应瑞幸董责险能否获理赔】瑞幸董责险总保额1000万美元#瑞幸咖啡自曝“造假约22亿元交易”后，有消息称，瑞幸咖啡上市前已购买总保额接近两亿元人民币的董责险，能否获得赔偿成很多人关心问题。10日，中国平安表示，瑞幸咖啡董责险基础层涉及多家保险公司，总保额为1000万美元。平安产险承保了基础层保单主承保份额的30%，并分保100万美元、自留200万美元(最大可能损失)。（中新网）,中国平安回应瑞幸董责险能否获理赔
488,2020-04-10 14:40:27,【商务部：缩小加工贸易禁止类商品种类 支持企业开展加工贸易】商务部表示，为了支持加工贸易发展，4月7日国务院常务会议及时出台了四项重要举措，包括调减禁止类商品目录，将已不属于“两高一资”的产品从目录中剔除。现行禁止类商品目录主要包含石化、皮革、钢铁、有色金属、木浆等生产过程能耗、污染和监管风险较高的产品，共计1862个10位海关商品编码。商务部将在符合环保监管要求的前提下，缩小加工贸易禁止类商品种类，支持企业开展加工贸易。（第一财经）,商务部：缩小加工贸易禁止类商品种类 支持企业开展加工贸易
489,2020-04-10 14:38:34,【上海市发改委一级巡视员：上海对人工智能、生物医药类战略新兴产业提供低息贷款政策】在今日召开的上海市政府新闻发布会上，发改委一级巡视员王扣柱表示，加大对先进制造业、现代服务业筹资支持力度，战略性新兴产业低息贷款政策从集成电路扩大至人工智能、生物医药领域。做好市、区两级技改专项资金保障，增加资金规模，提高项目支持比例。（界面新闻）,上海市发改委一级巡视员：上海对人工智能、生物医药类战略新兴产业提供低息贷款政策
490,2020-04-10 14:37:24,【海航集团:决定递延支付“16海航集团可续期债01”当期利息】海航集团公告，“16海航集团可续期债01”应于4月14日付息，决定递延支付本期债券的当期利息。（界面新闻）,海航集团:决定递延支付“16海航集团可续期债01”当期利息
491,2020-04-10 14:36:16,【上海：今年开工建设的住宅项目可延期缴纳城市基础设施配套费】上海市发展改革委一级巡视员王扣柱表示，将减轻房企入市成本压力。今年开工建设的住宅项目可延期缴纳城市基础设施配套费。允许符合条件的房企延期缴纳土地增值税。（第一财经）,上海：今年开工建设的住宅项目可延期缴纳城市基础设施配套费
492,2020-04-10 14:35:00,【商务部：推动传统企业触网上线完善跨境电商产业链和生态圈】商务部部长助理任鸿斌表示，下一步，商务部会同相关部门主要做好以下五方面的工作：一是推动传统企业触网上线。二是充分发挥国际性平台的作用。三是支持跨境电商平台走出去。四是高质量推进海外仓建设。五是完善跨境电商产业链和生态圈。（证券时报）,商务部：推动传统企业触网上线完善跨境电商产业链和生态圈
493,2020-04-10 14:33:59,【港口股异动】港口股异动，招商港口直线拉升封板，盐田港、南京港、连云港等跟涨。,港口股异动
494,2020-04-10 14:33:00,【商务部：鼓励企业完善海外仓配套服务 将给予一定支持】商务部表示，高质量推进海外仓建设。海外仓作为跨境电商重要的境外节点，是电商企业在境外实现本土化运作、配送、服务和市场拓展的重要依托。将鼓励企业完善海外仓配套服务，同时也将会给予一定支持。（第一财经）,商务部：鼓励企业完善海外仓配套服务 将给予一定支持
495,2020-04-10 14:32:01,【上海发布扩大有效投资稳定经济发展“20条”】据悉，《上海市扩大有效投资稳定经济发展若干政策措施》将于近期向社会公开发布。上海市发改委一级巡视员王扣柱介绍，《若干政策措施》提出要充分激发社会投资活力对投资稳增长的关键作用，具体包括7条政策措施：一是保持土地市场交易平稳有序。二是加快经营性用地出让节奏。三是加快推进城市更新。四是减轻房企入市成本压力。五是降低制造业项目用地成本。六是提高存量土地投资强度。七是加大对先进制造业、现代服务业筹资支持力度。（上海发布）,上海发布扩大有效投资稳定经济发展“20条”
496,2020-04-10 14:30:24,【股市播报】A股三大指数午后走弱，创业板指跌逾2%。氮化镓、光刻胶、云计算、国产芯片、网络安全、国产软件等科技板块领跌两市。,A股三大指数午后走弱 创业板指跌逾2%
497,2020-04-10 14:29:47,【RCS概念大幅分化 号百控股等多股跌停】RCS概念今日大幅分化，截至发稿，海联金汇、中嘉博创、神州泰岳、省广集团涨停，号百控股、银之杰、东软载波、佳都科技、佳讯飞鸿跌停。,RCS概念大幅分化 号百控股等多股跌停
498,2020-04-10 14:25:54,【商务部：降低企业内销成本 扩大内销选择性征税试点】商务部部长助理任鸿斌表示，会同有关部门从四个方面提出稳定当前加工贸易发展的政策举措：一是降低企业内销成本。加工贸易保税料件或制成品进入国内市场销售时，按规定征收进口环节税，但暂免征收缓税利息至年底。二是扩大内销选择性征税试点。将加工贸易企业内销选择按进口料件或按成品缴纳关税的试点，扩大到所有综合保税区，降低实际税赋。三是优化加工贸易结构。加快修订鼓励外商投资产业目录，促进制造业高质量发展，提升中西部和东北地区承接产业转移的能力。四是扩大商品准入范围。将部分符合产业发展政策、已不属于“两高一资”的产品，从加工贸易禁止类目录中剔除。（第一财经）,商务部：降低企业内销成本 扩大内销选择性征税试点
499,2020-04-10 14:23:57,【工信部：3月份钢铁生产库存环比双下降】工信部发布中国钢铁工业协会统计数据，3月份重点钢铁企业日产量环比下降，整体库存有所降低但仍处于较高水平。生产方面，3月份重点统计钢铁企业累计平均日产生铁、粗钢、钢材分别为182.4万吨、169.5万吨、176.6万吨，环比分别下降2.1%、3.1%和1.7%。（界面新闻）,工信部：3月份钢铁生产库存环比双下降
500,2020-04-10 14:23:24,【上海市发改委巡视员：支持房地产企业合理融资需求】在今日召开的上海市政府新闻发布会上，发改委一级巡视员王扣柱表示，支持房地产企业合理融资需求，鼓励金融机构对旧区改造的资金支持。（界面新闻）,上海市发改委巡视员：支持房地产企业合理融资需求
