,datetime,content,title
734,2020-05-06 17:26:24,【五矿股份旗下长远锂科拟科创板上市 拟融资逾27亿元】上交所5月6日消息，受理湖南长远锂科股份有限公司的科创板上市申请，该公司拟融资金额27.18亿元。长远锂科主要产品三元正极材料主要应用于新能源汽车动力电池领域，五矿股份直接持有公司22.88%股权，间接持有公司22.88%股权，合计持有公司45.76%股权，为公司的控股股东。2019年度，公司主要客户包括宁德时代、亿纬锂能、欣旺达、比亚迪等。（e公司）,五矿股份旗下长远锂科拟科创板上市 拟融资逾27亿元
735,2020-05-06 17:24:33,【国务院同意在雄安新区等46个城市和地区设立跨境电子商务综合试验区】国务院发布关于同意在雄安新区等46个城市和地区设立跨境电子商务综合试验区的批复。（中国政府网）,国务院同意在雄安新区等46个城市和地区设立跨境电子商务综合试验区
736,2020-05-06 17:22:59,,土耳其里拉对美元破7后“跌跌不休” 今年对美元贬值约16% 货币危机昨日重现？
737,2020-05-06 17:20:35,【四维图新：子公司中寰卫星与一汽解放等共同成立合资公司】四维图新公告，公司的控股子公司中寰卫星与一汽解放、一汽创新基金、罗思韦尔、知行家签署股东协议，各方将在平等、自愿、诚实信用的基础上，共同投资设立“鱼快创领智能科技（南京）有限公司”，进一步开展商用车联网业务，加强各方互信互利，共同开拓商用车后市场。合资公司注册资本为人民币10000万元，其中，中寰卫星出资人民币3500万元，占注册资本的35%。（界面新闻）,四维图新：子公司中寰卫星与一汽解放等共同成立合资公司
738,2020-05-06 17:11:31,【贵研铂业：云南锡业集团拟将贵金属集团100%股权转让给云南省投资控股集团】贵研铂业(600459)5月6日晚间披露股价异动公告，公司控股股东贵金属集团的控股股东云南锡业集团（控股）有限责任公司拟将其持有的贵金属集团100%股权以非公开协议方式转让给云南省投资控股集团有限公司。该事项不会导致公司控股股东和实际控制人发生变更。除此之外，不存在其他应披露而未披露的重大信息。（e公司）,贵研铂业：云南锡业集团拟将贵金属集团100%股权转让给云南省投资控股集团
739,2020-05-06 17:08:32,【上交所：科创板拟上市公司迪威尔提交注册】上交所5月6日披露，科创板拟上市公司南京迪威尔高端制造股份有限公司提交注册。另外，湖南长远锂科股份有限公司、无锡航亚科技股份有限公司科创板上市申请已获受理。（e公司）,上交所：科创板拟上市公司迪威尔提交注册
740,2020-05-06 17:04:15,【振江股份：股东拟合计减持不超3%股份】振江股份(603507)5月6日晚间公告，股东鸿立华享及其一致行动人计划15个交易日后的6个月内，通过集中竞价交易方式减持不超过公司总股本2%的股份；股东东楷富文及其一致行动人计划15个交易日后的3个月内，通过集中竞价交易方式减持不超过公司总股本1%的股份。（e公司）,振江股份：股东拟合计减持不超3%股份
741,2020-05-06 17:00:24,【央行：4月对金融机构开展中期借贷便利操作共1000亿元】央行公告，2020年4月，为维护银行体系流动性合理充裕，结合金融机构流动性需求，人民银行对金融机构开展中期借贷便利操作共1000亿元，期限1年，利率为2.95%。期末中期借贷便利余额为41900亿元。（第一财经）,央行：4月对金融机构开展中期借贷便利操作共1000亿元
742,2020-05-06 16:58:45,【北方稀土：股东拟减持不超1%股份】北方稀土(600111)5月6日晚间公告，持股8.0642%的股东嘉鑫有限公司计划15个交易日后的6个月内，以交易所集中竞价交易方式减持不超过3600万股，占公司总股本的比例不超过1%。（e公司）,北方稀土：股东拟减持不超1%股份
743,2020-05-06 16:51:31,【祥和实业：拟5000万元至1亿元回购股份】祥和实业(603500)5月6日晚间公告，公司拟以集中竞价交易方式回购股份，回购资金总额不低于5000万元，不超过1亿元。回购价格不超过20元/股。（e公司）,祥和实业：拟5000万元至1亿元回购股份
744,2020-05-06 16:47:54,【恒大前四月销售2126亿、回款1782亿 刷新历史记录】中国恒大5月6日公告，4月份实现销售652.1亿，同比增长11.6%；销售面积713万平米，同比增长28.5%；销售回款646.5亿，同比增长70.8%，均创同期历史新高。（e公司）,恒大前四月销售2126亿、回款1782亿 刷新历史记录
745,2020-05-06 16:45:32,【泰晶科技：提前赎回“泰晶转债”】泰晶科技公告，公司董事会同意公司本次对已发行的“泰晶转债”行使提前赎回权，提前赎回全部“赎回登记日”登记在册的“泰晶转债”。赎回登记日收市前，“泰晶转债”持有人可选择在债券市场继续交易，或者以转股价格 17.90 元/股转为公司股份。赎回登记日收市后，未实施转股的“泰晶转债”将全部冻结，停止交易和转股，被强制赎回。本次可转债赎回价格可能与“泰晶转债”的市场价格存在差异，强制赎回导致投资损失。（界面新闻）,泰晶科技：提前赎回“泰晶转债”
746,2020-05-06 16:41:06,【博天环境：持股占总股本1.51%的股东宁波高利拟清仓减持】博天环境公告，股东宁波高利持股占本公司总股本的1.51%，计划于2020年5月13日至2020年11月9日期间通过集中竞价、大宗交易方式减持其所持有的本公司股份不超过631.57万股，即不超过公司总股本的1.51%。（界面新闻）,博天环境：持股占总股本1.51%的股东宁波高利拟清仓减持
747,2020-05-06 16:37:16,【上海：支持鼓励外贸型企业再融资和重大资产重组】央行上海总部5月6日消息，近日，金融委办公室地方协调机制（上海市）印发《关于全面做好企业复工复产和稳外贸稳外资稳投资金融服务的若干意见》。意见提出：支持鼓励外贸型企业再融资和重大资产重组，为外贸企业融资提供更为便捷的监管服务。（e公司）,上海：支持鼓励外贸型企业再融资和重大资产重组
748,2020-05-06 16:33:50,【上海：加大对中小微企业复工复产信贷支持】央行上海总部5月6日消息，近日，金融委办公室地方协调机制(上海市)印发《关于全面做好企业复工复产和稳外贸稳外资稳投资金融服务的若干意见》。意见提出：加大对中小微企业复工复产信贷支持。继续用好国家5000亿元再贷款再贴现政策，着力做好“保存量、扩增量、降成本”，推动银行业金融机构将到期的普惠项下存量贷款转换成再贷款支持的优惠贷款。落实好国家新增1万亿元普惠性再贷款再贴现政策。（e公司）,上海：加大对中小微企业复工复产信贷支持
749,2020-05-06 16:33:41,【上海：坚持“房住不炒”定位 依法合规做好旧区改造等重大项目的配套融资服务】央行上海总部5月6日消息，近日，金融委办公室地方协调机制(上海市)印发《关于全面做好企业复工复产和稳外贸稳外资稳投资金融服务的若干意见》。意见提出：坚持“房住不炒”定位，支持金融机构按照市场化原则，依法合规做好旧区改造、保障性住房、轨道交通等重大项目的配套融资服务。（e公司）,上海：坚持“房住不炒”定位 依法合规做好旧区改造等重大项目的配套融资服务
750,2020-05-06 16:31:05,【东风汽车：今年1-4月份累计销量为4.57万辆 同比下降15.86%】东风汽车发布2020年4月份产销数据快报，4月份汽车销量为18885辆，上年同期为16094辆，今年1-4月份累计销量为4.57万辆，同比下降15.86%。（界面新闻）,东风汽车：今年1-4月份累计销量为4.57万辆 同比下降15.86%
751,2020-05-06 16:30:31,【金融委办公室地方协调机制出台金融服务若干意见 保障经济社会平稳运行】近日，金融委办公室地方协调机制(上海市)(以下简称“上海协调机制”)印发《关于全面做好企业复工复产和稳外贸稳外资稳投资金融服务的若干意见》(以下简称《意见》)。这是人民银行上海总部会同上海协调机制成员单位联合制订的首份政策文件，也是贯彻落实近期国务院金融委和上海市委市政府有关工作要求的具体举措。（央行上海总部）,金融委办公室地方协调机制出台金融服务若干意见 保障经济社会平稳运行
752,2020-05-06 16:30:20,【中国汽车流通协会：4月经销商客流量恢复达到80%-90%】5月6日，中国汽车流通协会副会长兼秘书长肖正三表示，据协会调研数据显示，4月全国经销商复工率100%，客流量恢复达到80%-90%。从区域看，华北华东区域相对较好，湖北地区客流恢复缓慢。按品牌看，日系、德系车辆好销，上汽大众、长安福特、上汽通用别克等品牌价格降幅较大，存在以价换量的情况。（界面新闻）,中国汽车流通协会：4月经销商客流量恢复达到80%-90%
753,2020-05-06 16:26:26,【南卫股份：获一次性医用口罩生产销售许可证】南卫股份(603880)5月6日晚间公告，公司近日获二类医疗器械注册证书，可以生产销售一次性使用医用口罩，注册证有效期为一年。该事项预计会对公司的经营业绩产生一定的积极影响，但上述产品的实际生产销售情况受多重因素的影响，尚无法预测其对公司未来业绩的具体影响。（e公司）,南卫股份：获一次性医用口罩生产销售许可证
754,2020-05-06 16:20:10,【上金所调整黄金白银延期合约保证金比例和涨跌停板】上金所发布通告称，2020年5月6日（星期三）收盘清算时起，Au（T+D）、mAu（T+D）、Au（T+N1）、Au（T+N2）、NYAuTN06、NYAuTN12等合约保证金比例从10%恢复为8%，下一交易日起涨跌幅度限制从9%恢复为7%；Ag（T+D）合约保证金比例从13%调整为10%，下一交易日起涨跌幅度限制从12%调整为9%。（第一财经）,上金所调整黄金白银延期合约保证金比例和涨跌停板
755,2020-05-06 16:18:22,【“德国带了一个很坏的头” 欧央行量化宽松案并非虚惊一场】市场人士最关心的话题应该是：其他成员国会不会效仿德国对欧洲央行的政策提出异议？（金十数据）,“德国带了一个很坏的头” 欧央行量化宽松案并非虚惊一场
756,2020-05-06 16:18:11,"【至纯科技：股东拟合计减持不超0.92%股份】至纯科技(603690)5月6日晚间公告，股东维科新业计划通过集中竞价方式减持不超过5万股,即不超过公司总股本0.0194%；股东联新投资计划通过集中竞价交易方式减持不超过232.03万股，即不超过公司总股本的0.90%。（e公司）",至纯科技：股东拟合计减持不超0.92%股份
757,2020-05-06 16:17:32,【会畅通讯：疫情期间公司云视频SaaS用户数增长达到十几倍】会畅通讯(300578)5月6日在互动平台上表示，在疫情期间，公司云视频SaaS用户数增长达到十几倍；云视频SaaS在线时长增长约800%；其中，教育业务疫情期间累计覆盖26个省近2000所学校和机构；云视频SaaS订单同比增长近100%，付费转化率达到近20%。据了解，疫情期间，公司为众多企业提供免费云视频帐号。（e公司）,会畅通讯：疫情期间公司云视频SaaS用户数增长达到十几倍
758,2020-05-06 16:14:50,【Beyond Meat盘前涨近8%】Beyond Meat盘前涨7.83%，公司第一季度净利润扭亏为盈，远超市场预期。（第一财经）,Beyond Meat盘前涨近8%
759,2020-05-06 16:12:52,【现实太残忍！原油大反弹 暴涨280%！中行原油宝 倒在了黎明前】4月21日WTI原油5月期货合约出现历史负值的结算价-37.63美元/桶，中行原油宝的投资者被收割之后，油价迎来大反弹，6月交割的WTI原油期货价格收涨20.5%，报24.56美元/桶，这是什么概念，从中行穿仓那天起，已经涨了近280%！,现实太残忍！原油大反弹 暴涨280%！中行原油宝倒在了黎明前
760,2020-05-06 16:09:34,【港股恒指收涨超1% 中芯国际大涨超10%】港股今日低开高走，恒指收涨1.13%，科技股、医药股领涨，中芯国际涨超10%，舜宇光学、中国生物制药涨约5%。,港股恒指收涨超1% 中芯国际大涨超10%
761,2020-05-06 16:07:18,【蔚来汽车盘前涨逾5%】蔚来汽车盘前涨逾5%，最新数据显示，4月交付3155辆汽车，环比增长105.8%，同比增长180.7%。（界面新闻）,蔚来汽车盘前涨逾5%
762,2020-05-06 16:02:52,【中概股跟谁学盘前涨3%】中概股跟谁学盘前涨3%，公司第一季度营收同比增长382%。（界面新闻）,中概股跟谁学盘前涨3%
763,2020-05-06 16:02:23,【欧元区4月服务业PMI终值12】欧元区4月服务业PMI终值12，前值11.7，预期11.7。（界面新闻）,欧元区4月服务业PMI终值12
764,2020-05-06 16:01:27,【和邦生物：拟3亿元-6亿元回购股份】和邦生物(603077)5月6日晚间公告，公司拟以集中竞价交易方式回购公司股份，回购股份资金总额不低于3亿元，不超过6亿元。回购价格不超过2.18元/股。拟回购股份50%用于员工持股计划；50%用于转换上市公司发行的可转换为股票的公司债券。（e公司）,和邦生物：拟3亿元-6亿元回购股份
765,2020-05-06 15:55:57,【白云机场：4月份旅客吞吐量同比减少72%】白云机场(600004)5月6日晚间公布4月份经营数据，公司4月份起降架次1.81万架次，同比减少53.6%；旅客吞吐量164.55万人，同比减少71.7%；货邮吞吐量12.40万吨，同比减少21.9%。其中，国际航线旅客吞吐量2.48万人次，同比下降98.33%。今年前四月累计旅客吞吐量1003.27万人次，同比下降58.13%。（e公司）,白云机场：4月份旅客吞吐量同比减少72%
766,2020-05-06 15:54:53,【一季度全球液晶电视面板出货量6303万片 同比下滑10.6%】群智咨询(Sigmaintell)5月6日发布报告称，一季度全球液晶电视面板的出货数量为6303万片，同比下滑10.6%；出货面积为3743.8万平方米，同比下滑3.2%。其中，中国大陆厂商一季度的出货量占比达55%。（中证网）,一季度全球液晶电视面板出货量6303万片 同比下滑10.6%
767,2020-05-06 15:52:27,【康德莱：股东拟减持不超过1.62%】康德莱晚间公告，上海康德莱拟6个月内减持不超过1.6206%股份。（第一财经）,康德莱：股东拟减持不超过1.62%
768,2020-05-06 15:48:33,【宁波港：预计4月份货物吞吐量同比增6.9%】宁波港(601018)5月6日晚间公告，4月份，公司预计完成集装箱吞吐量233.5万标准箱，同比下降3.0%；预计完成货物吞吐量6696万吨，同比增长6.9%。（e公司）,宁波港：预计4月份货物吞吐量同比增6.9%
769,2020-05-06 15:43:21,【杭钢股份：将加快推进重大资产重组事项】杭钢股份晚间公告，公司及相关各方正在有序推进本次发行股份及支付现金购买资产的相关工作。本次重大资产重组涉及的拟收购标的公司经营正常，各项业务有序开展。本次重大资产重组相关的审计、评估工作仍在进行中。（第一财经）,杭钢股份：将加快推进重大资产重组事项
770,2020-05-06 15:42:50,【上海新版基本医保监管办法6月1日起施行】上海市医保局消息，《上海市基本医疗保险监督管理办法》6月1日起施行。新版《办法》完善了个人违反相关规定的法律责任，参保人员有将本人医保凭证出借或有偿转让、变卖由医保费用结算的药品、重复就诊超量配药进行医保费用结算、提供虚假信息骗取长护险待遇等行为之一的，市、区医保局应当责令退回已由医保基金支付的相关费用，视情节轻重，可处以警告或者100元以上1万元以下的罚款，还可以改变其医保结算方式1至6个月。（第一财经）,上海新版基本医保监管办法6月1日起施行
771,2020-05-06 15:38:53,【包钢股份：控股股东拟增持20亿元-40亿元】包钢股份(600010)5月6日晚间公告，公司控股股东包钢集团计划未来12个月内通过上海证券交易所交易系统增持公司股份，金额不低于20亿元、不高于40亿元。（e公司）,包钢股份：控股股东拟增持20亿元-40亿元
772,2020-05-06 15:34:01,【盒马宣布策略性关闭福州门店】近期，盒马陆续关闭了位于福州的两家门店。记者从盒马方面了解到，由于福州门店距离供应链节点较远，暂时无法取得商品优势，关闭门店是“策略性退出”。（上海证券报）,盒马宣布策略性关闭福州门店
773,2020-05-06 15:25:25,【四川盆地获重要天然气发现 预计潜在资源量超万亿立方米】中国石油西南油气田公司对外披露，该公司近日发现了一条富含天然气的新区带，预计潜在资源量超万亿立方米。这意味着四川盆地中部将开辟出一个新的天然气规模接替区。（新华网）,四川盆地获重要天然气发现 预计潜在资源量超万亿立方米
774,2020-05-06 15:24:14,【前4月全国期市累计成交量同比增长逾50%】中国期货业协会最新统计资料表明，4月全国期货市场交易规模较上月下降，以单边计算，当月全国期货市场成交量为532.58百万手，成交额为29.63万亿元，同比分别增长77.90%和27.53%，环比分别增长1.90%和下降11.75%。（上海证券报）,前4月全国期市累计成交量同比增长逾50%
775,2020-05-06 15:14:18,【报告称五一假期重点城市新房成交同比增逾七成】诸葛找房数据研究中心6日发布的最新监测数据显示，2020年五一假期，12个重点城市新房销售套数为5671套，与去年五一假期相比成交大幅上升77.1%。（中证网）,报告称五一假期重点城市新房成交同比增逾七成
776,2020-05-06 15:06:37,【大众汽车集团称4月在中国的销量同比增长】大众汽车集团称4月在中国的销量同比增长。（界面新闻）,大众汽车集团称4月在中国的销量同比增长
777,2020-05-06 15:00:52,【欧洲主要股指开盘涨跌不一】欧洲主要股指开盘涨跌不一，欧洲斯托克50指数跌0.05%，德国DAX指数跌0.07%，英国富时100指数涨0.18%。,欧洲主要股指开盘涨跌不一
778,2020-05-06 15:00:30,【收盘播报】A股今日迎来五月首个交易日，三大指数集体收涨，其中创业板指表现较强，收盘上涨近2%。两市合计成交7211亿元，行业板块多数收涨，科技类股票强势领涨。北向资金今日净流入33.19亿元。,A股五月开门红：创业板指涨近2% 科技股强势领涨
779,2020-05-06 14:46:47,【比亚迪高管透露正与华为合作 HiCar系统此前已进入最后调试阶段】比亚迪汽车销售有限公司总经理赵长江近期在微博透露，比亚迪将与华为的合作推新款智能汽车。赵长江还表示，“特斯拉的牌打完了，轮到我们出牌了，全球超安全智能新能源旗舰轿车值得期待！”《科创板日报》此前曾报道，作为华为整体智能汽车解决方案的HiCar系统已进入最后调试阶段，支持车型今年有望推向市场。华为入局将推动国内智能汽车产业出现跨越式发展。（界面新闻）,比亚迪高管透露正与华为合作 HiCar系统此前已进入最后调试阶段
780,2020-05-06 14:46:02,【创业板指涨逾2%】创业板指涨逾2%，沪指涨近0.5%，半导体芯片、农业、通信设备等涨幅居前。科创板6股涨停，近25股涨幅超10%。,创业板指涨逾2%
781,2020-05-06 14:37:26,【加快芯恩项目建设投产！青岛发布“新基建”新政】4月28日，青岛市国资委等五部门印发实施《市属企业加快布局“新基建”实现数字化智能化转型升级三年行动计划(2020—2022年)》。（集微网）,加快芯恩项目建设投产！青岛发布“新基建”新政
782,2020-05-06 14:37:14,【疫情下的新兴市场：中国资产最受追捧 拉美恐成最大输家！】过去三个月，拉美资产的吸引力几乎消失殆尽，这突显出在新冠疫情大流行的影响下，资产组合配置正在发生怎样的转变。疫情大流行已在新兴市场造成了3万亿美元的损失。（环球外汇网）,【图解】疫情下的新兴市场：中国资产最受追捧 拉美恐成最大输家！
783,2020-05-06 14:36:52,【北向资净流入超30亿元】北向资金午后持续流入，截至目前净流入超30亿元，其中深股通净流入超41亿元，沪股通净流出11亿元。,北向资净流入超30亿元
784,2020-05-06 14:36:15,【食品板块走强】食品板块走强，日辰股份涨停，来伊份、天味食品、煌上煌、妙可蓝多等跟涨。,食品板块走强
785,2020-05-06 14:34:38,【欧市盘前：日元创七周新高 风险情绪仍利于黄金 油市不确定性上升】5月6日亚洲时段，日元创3月17日以来的七周新高，未来的贸易环境可能存在变数，同时投机资金准备好在二次疫情初露迹象之时突袭。目前黄金价格在1700美元/盎司附近盘整，等待有新的刺激因素出现。但是风险平衡倾向于金价走高。美油自近一个月高位回落，油价的上涨已失去动力，对于可能漫长而充满不确定性复苏的担忧抵消了减产会缓解供应过剩的乐观情绪。（汇通网）,欧市盘前：日元创七周新高 风险情绪仍利于黄金 油市不确定性上升
786,2020-05-06 14:31:12,【网传员工将放假至9月 富士康：运作正常 无大规模裁员及休假情况】5月6日，日前传出因疫情造成苹果手机销量削减，进而导致富士康订单减少、部分员工将从本月起放假4个月至9月1日。对此，富士康科技集团回复新京报记者称，“目前集团大陆各厂区运作正常，并无所谓大规模裁员及休假情况”。（新京报）,网传员工将放假至9月 富士康：运作正常 无大规模裁员及休假情况
787,2020-05-06 14:29:32,【行情】富时中国A50指数期货午后进一步走高，涨幅超3%。截至发稿，A50指数期货报13315点，上涨3.08%。,富时中国A50指数期货涨逾3%
788,2020-05-06 14:26:23,【科创板午后继续走强 优刻得等8股涨停】科创板个股午后涨幅继续扩大，截至发稿，优刻得、宝兰德、晶晨股份等8股涨停。,科创板午后继续走强 优刻得等8股涨停
789,2020-05-06 14:25:43,【行情】富时中国A50指数期货持续拉升，涨幅近3%。,富时中国A50指数期货持续拉升 涨幅近3%
790,2020-05-06 14:15:13,【传员工将放假至9月 富士康:运作正常 无大规模裁员】5月8日，日前传出因疫情造成苹果手机销量削减，进而导致富士康订单减少、部分员工将从本月起放假4个月至9月1日。对此，富士康科技集团回复新京报记者称，“目前集团大陆各厂区运作正常，并无所谓大规模裁员及休假情况”。（新京报）,传员工将放假至9月 富士康:运作正常 无大规模裁员
791,2020-05-06 14:10:50,【净利暴跌91% 停薪10万员工 迪士尼撑不住了？上海乐园5月11日恢复开放】5月6日凌晨，上海迪士尼度假区宣布，上海迪士尼乐园将于5月11日起重新对公众开放，这将是全球首家重新开放的迪士尼乐园，也是该乐园闭园107天后重新开园迎客。（21世纪经济报道）,净利暴跌91% 停薪10万员工 迪士尼撑不住了？上海乐园5月11日恢复开放
792,2020-05-06 14:07:51,【股市播报】A股三大指数低开高走，创业板指涨逾1%，光刻胶板块领涨，安集科技、容大感光等多股涨停。此外，农业种植、稀土永磁、国产芯片等板块也涨幅居前。旅游酒店、民航机场、高速公路、ST等板块领跌两市。截至发稿，沪指上涨0.29%，深成指上涨1.12%，创业板指上涨1.57%。,A股三大指数低开高走 光刻胶板块领涨
793,2020-05-06 14:02:49,【行情】贵州茅台股价触及1300元关口，再创历史新高。,贵州茅台股价触及1300元关口
794,2020-05-06 13:59:20,【半导体板块午后继续走强】半导体板块午后继续走强，聚辰股份、安集科技涨停，沪硅产业涨近18%，晶晨股份涨超11%。,半导体板块午后继续走强
795,2020-05-06 13:51:14,【北京今起对符合条件中小微企业发稳岗补贴 最高4540元/人】北京市人力资源和社会保障局、北京市财政局近日联合印发《关于精准支持重点行业中小微企业稳定就业工作的通知》，决定对受疫情影响严重的中小微企业，给予“以训稳岗”培训补贴和临时性岗位补贴，两项叠加，最高标准可达每人4540元。（界面新闻）,北京今起对符合条件中小微企业发稳岗补贴 最高4540元/人
