,datetime,content,title
0,2020-03-23 23:54:52,【纽约州新冠肺炎确诊病例达20875例】当地时间3月23日上午，纽约州州长科莫宣布，目前纽约州新冠肺炎确诊人数已经达到20875例。（央视新闻客户端）,纽约州新冠肺炎确诊病例达20875例
1,2020-03-23 23:48:38,3月23日，欧股大幅走低，欧洲斯托克50指数跌超3%。截至发稿，斯托克50指数跌3.61%，德国DAX30指数跌3.11%，英国富时100指数跌4.25%，法国CAC40指数跌4.29%。,欧股大幅走低 欧洲斯托克50指数跌超3%
2,2020-03-23 23:47:00,【行情】苹果跌超7%，刷新日低至212.63美元，最新总市值现为9356亿美元。,苹果跌超7%
3,2020-03-23 23:44:38,【行情】道指跌幅扩大至900点，截至目前，道指下跌4.9%，纳指跌3.2%，标普500指数跌4.6%。,道指跌幅扩大至900点
4,2020-03-23 23:42:28,【行情】美国汽油期货跌幅扩大至20%。,美国汽油期货跌幅扩大至20%
5,2020-03-23 23:36:51,【行情】道指跌幅扩大至800点，标普500指数跌近4%，纳指跌约2.7%。,道指跌幅扩大至800点
6,2020-03-23 23:36:21,【习近平同法国总统马克龙通电话】国家主席习近平23日晚同法国总统马克龙通电话。（央视新闻客户端）,习近平同法国总统马克龙通电话
7,2020-03-23 23:31:40,【习近平同英国首相约翰逊通电话】国家主席习近平23日晚同英国首相约翰逊通电话。（央视新闻客户端）,习近平同英国首相约翰逊通电话
8,2020-03-23 23:27:08,【行情】美股持续走低，道指跌幅扩大至逾4%。截至目前，道指下跌4%，纳指下跌2.7%，标普500指数跌3.8%。,道指跌逾4%
9,2020-03-23 23:08:05,【行情】现货黄金涨幅扩大至2.5%，报1536.53美元/盎司，最近五分钟上扬5.66美元；COMEX黄金期货涨幅扩大至4.0%，报1544.1美元/盎司。,现货黄金涨幅扩大至2.5%
10,2020-03-23 23:06:51,【美国纽约新冠肺炎确诊人数破万】根据纽约市政府数据，当地时间3月22日晚纽约市新冠肺炎确诊人数达到10764人，成为全美首个也是目前唯一一个新冠肺炎确诊人数突破1万的城市。此外，纽约市因新冠肺炎死亡病例在22日晚大幅上涨50%达到了99人。预计23日数据公布后，这一数字还将继续增长。（央视财经）,美国纽约新冠肺炎确诊人数破万
11,2020-03-23 22:59:30,【行情】美股跌幅扩大，道指跌超500点。截至目前，道琼斯指数下跌2.7%，纳指下跌1.32%，标普500指数跌2.65%。,美股跌幅扩大 道指跌超500点
12,2020-03-23 22:53:27,【行情】NYMEX汽油期货跌至0.50美元/加仑，创2001年以来新低。,NYMEX汽油期货跌至0.50美元/加仑
13,2020-03-23 22:45:33,【小摩：美国垃圾债券市场规模今年可能增长2150亿美元】摩根大通报告显示，由于经济衰退的预期，美国垃圾债券市场规模今年可能增长2150亿美元。（界面新闻）,小摩：美国垃圾债券市场规模今年可能增长2150亿美元
14,2020-03-23 22:33:46,【意大利皮埃蒙特大区主席新冠肺炎已治愈】当地时间23日，意大利皮埃蒙特大区主席阿尔贝托·齐里奥在社交媒体上宣布，他本人两次新冠肺炎病毒测试结果显示阴性，他的新冠肺炎已经治愈。（央视新闻客户端）,意大利皮埃蒙特大区主席新冠肺炎已治愈
15,2020-03-23 22:26:54,【美国介入油价战真的能改写油市命运吗？】美国总统特朗普上周四表示，他可能会干预俄罗斯和沙特之间的油价战，使美国的石油生产商大吃一惊。沙特与俄罗斯两大产油国的价格战愈演愈烈，美国页岩油产业损失惨重，这迫使美国德州地区监管机构权衡是否要与欧佩克合作，进行协调减产。,美国介入油价战真的能改写油市命运吗？
16,2020-03-23 22:18:57,【中信重工：2019年度净利同比增10.11%】中信重工(601608)3月23日晚发布年报，2019年度，公司实现营收52.4亿元，同比增长0.76%。实现净利1.17亿元，同比增长10.11%。公司拟每10股派发现金股利0.071元（含税）。（证券时报）,中信重工：2019年度净利同比增10.11%
17,2020-03-23 22:18:14,【快讯】肯尼亚央行降息100个基点至7.25%。（界面新闻）,肯尼亚央行降息100个基点至7.25%
18,2020-03-23 22:08:42,【香港特区政府宣布推出10亿港元纾缓措施支持航空业】今日(3月23日)，香港特区政府联同香港机场管理局(机管局)宣布推出10亿港元的纾缓措施，以协助航空业界应对公共卫生事件爆发以来持续的挑战。,香港特区政府宣布推出10亿港元纾缓措施支持航空业
19,2020-03-23 22:04:18,【工信部推进IPv6端能力提升 万物互联时代将近】工信部近日发布《关于开展2020年IPv6端到端贯通能力提升专项行动的通知》，提出到2020年底，实现IPv6网络性能与IPv4趋同，IPv6活跃连接数达到11.5亿，移动网络IPv6流量占比达到10%以上。IPv6最大的特点是地址数量非常多。全球IPv6测试中心的数据显示，2019年中国在网络设备IPv6支持方面位居世界首位。关注星网锐捷、烽火通信等上市公司均对该领域进行了深入研究和布局。（中证资讯）,工信部推进IPv6端能力提升 万物互联时代将近
20,2020-03-23 21:58:50,【行情】纳指率先转涨，此前一度跌近2%。,纳指率先转涨 此前一度跌近2%
21,2020-03-23 21:58:47,【李大霄：中国经济长期向好的基本面扎实 市场低迷时仍保持信心】A股今日出现回调，英大证券首席经济学家李大霄在其个人公众号中分析认为，A股今天虽下调幅度不小，但相对外围仍然表现相对坚挺。目前困扰海外市场的是新冠肺炎的蔓延，中国在抗疫方面已取得了阶段性胜利，复工复产有序推进，部分地区甚至开始出现堵车现象，经济活动有序恢复，这对股市来说是积极的信号。中国经济长期向好的基本面相对扎实，坚信人类在抗疫上一定能取得最终胜利，所以要在市场低迷时仍保持信心。（e公司）,李大霄：中国经济长期向好的基本面扎实 市场低迷时仍保持信心
22,2020-03-23 21:56:00,【行情】现货白银日内涨超3%，报12.92美元/盎司。现货黄金日内涨2%至1527.68美元/盎司。,现货白银日内涨超3%
23,2020-03-23 21:48:16,【美、布两油持续回落】WTI原油日内跌幅再度扩大至4.65%，报22.31美元/桶，布油跌4.81%，报25.93美元/桶。,美、布两油持续回落
24,2020-03-23 21:40:23,【美股三大股指跌幅扩大】道指、标普500指数跌幅迅速扩大至3%，纳指跌近2%。,美股三大股指跌幅扩大
25,2020-03-23 21:33:54,【行情】苹果市值跌破万亿美元关口。,苹果市值跌破万亿美元关口
26,2020-03-23 21:31:52,【美股三大指数低开 道指跌1.23%】美股三大指数低开，道指跌1.23%，纳指跌0.47%，标普500指数跌1.27%。此前，美国联邦储备委员会23日宣布将继续购买美国国债和抵押贷款支持证券以支持市场平稳运行，不设额度上限，相当于开放式的量化宽松政策。,美股三大指数低开 道指跌1.23%
27,2020-03-23 21:28:51,【羟氯喹治疗COVID-2019疗效显著 相关公司有望受益】法国科学家Didier Raoulta的团队一篇临床研究论文中显示，硫酸羟基氯喹对于治疗COVID-2019病人有显著疗效。羟基氯喹，原用来治疗疟疾。上海率先提出了安全性更好的羟氯喹治疗轻中度新冠病毒病的全国多中心临床研究，已入组184例。初步结果显示羟氯喹治疗有效且更安全，在“上海方案”中治疗性药物列首位。海外研究进一步佐证了该药的有效性。关注上海医药、昆药集团、中国医药。（怀新资讯）,羟氯喹治疗COVID-2019疗效显著 相关公司有望受益
28,2020-03-23 21:20:40,【道琼斯中国88指数推迟调整 银华道琼斯88精选基金现有成分股维持不变】银华基金表示，根据标普道琼斯指数公司通知，因市场波动等原因，道琼斯中国88指数推迟了原定于3月23日生效的指数调整。该基金仍按现有标的指数成分股名单进行投资。后续，有关标的指数成分股调整事项，待指数公司进一步通知后按其通知处理，届时不再另行公告。（中证网）,道琼斯中国88指数推迟调整 银华道琼斯88精选基金现有成分股维持不变
29,2020-03-23 21:14:13,【加拿大越洋航空公司宣布裁掉七成员工】加拿大越洋航空公司（Air Transat）当地时间23日上午宣布，受新冠肺炎疫情导致的业务量剧烈下降影响，将临时裁员3600人，这个数量约占该公司员工总数的70％。在此之前，加拿大航空和西捷航空都已经开始进行大规模裁员，分别为5100多人和超过4000人。越洋航空的总部位于加拿大魁北克蒙特利尔。（央视新闻）,加拿大越洋航空公司宣布裁掉七成员工
30,2020-03-23 21:11:19,【开尔新材：2019年净利同比增181% 拟10转8派0.62元】开尔新材公告，2019年全年实现净利润5785.7万元，同比增长180.94%，拟10转8派0.62元。预计一季度净利润为4000万-4277万元，同比增长332.79%-362.76%。（第一财经）,开尔新材：2019年净利同比增181% 拟10转8派0.62元
31,2020-03-23 21:05:58,【比特币涨至6500美元/枚上方】据交易平台Bitstamp报价显示，比特币涨至6500美元/枚上方。（金十数据）,比特币涨至6500美元/枚上方
32,2020-03-23 21:03:20,【顺丰控股：2019年净利润同比增长27.23% 拟10派2.7元】顺丰控股(002352) 3月23日晚间披露年报，2019年全年实现净利润57.97亿元，同比增长27.23%；拟10派2.7元。（证券时报）,顺丰控股：2019年净利润同比增长27.23% 拟10派2.7元
33,2020-03-23 21:01:15,【美财长：国会已非常接近达成经济刺激计划】据CNBC消息，美国财长努钦表示，国会已经非常接近达成经济刺激计划，而且必须在今天完成。据外媒报道，22日，美国财长姆努钦表示，国会的援助计划若通过，四口之家平均可获得近3000美元的援助支票，最多可动用4万亿美元来帮助企业。（第一财经）,美财长：国会已非常接近达成经济刺激计划
34,2020-03-23 20:58:44,【美国新冠肺炎确诊病例超过3.5万例】据美国约翰斯·霍普金斯大学发布的实时统计，截至北京时间23日晚8时25分，美国新冠肺炎确诊病例增至35225例，超过35000例，成全球第三个受疫情影响最严重的国家。,美国新冠肺炎确诊病例超过3.5万例
35,2020-03-23 20:54:07,【华兰生物：2019年净利润同比增长12.63% 拟10转3派4元】华兰生物(002007)3月23日晚间披露年报，公司2019年实现营收37亿元，同比增长15.02%，净利润12.83亿元，同比增长12.63%。每股收益0.91元，拟向全体股东每10股派发现金红利4元（含税），以资本公积金向全体股东每10股转增3股。（证券时报）,华兰生物：2019年净利润同比增长12.63% 拟10转3派4元
36,2020-03-23 20:48:27,【外媒：全球新冠肺炎确诊病例超过35万例 死亡病例超过1.5万】据一直追踪全球新冠肺炎确诊数据的荷兰媒体BNO新闻网最新数据，截至北京时间23日晚8时30分，全球累计确诊病例已超过35万例，达到353848例，其中死亡病例累计上升至15358例。累计治愈99268例。（环球网）,外媒：全球新冠肺炎确诊病例超过35万例 死亡病例超过1.5万
37,2020-03-23 20:43:46,【河南消费领域按下“重启键”逾六成餐企开门迎客】河南餐饮、百货、文化等消费领域按下“重启键”，生活秩序正有序恢复。全省已有六成多餐饮门店复工营业，随后开业率将会快速提升。（中国新闻网）,河南消费领域按下“重启键” 逾六成餐企开门迎客
38,2020-03-23 20:39:14,【金科股份：2019年净利润同比增长46% 拟10派4.5元】金科股份(000656)3月23日晚间披露年报，公司2019年实现营收678亿元，同比增长64%；实现归属于上市公司股东的净利润56.76亿元，同比增长46%；每股收益1.05元，拟向全体股东每10股派发现金红利4.5元（含税）。（证券时报）,金科股份：2019年净利润同比增长46% 拟10派4.5元
39,2020-03-23 20:33:05,【晶澳科技：拟投资14.54亿元建设朝阳县300MW光伏平价上网项目】晶澳科技公告，公司全资下属子公司朝阳兴华拟在辽宁省朝阳市朝阳县投资建设300MW光伏平价上网项目，预计总投资额约14.54亿元，项目资金为自筹资金。（界面新闻）,晶澳科技：拟投资14.54亿元建设朝阳县300MW光伏平价上网项目
40,2020-03-23 20:27:21,【离岸人民币兑美元升破7.10关口】离岸人民币兑美元跳涨近500个基点，升破7.10关口，日内转涨240个基点。（第一财经）,离岸人民币兑美元升破7.10关口
41,2020-03-23 20:21:25,【美股三大指数期货均涨超3% 纳指期货涨幅扩大至4%】美股三大指数期货全部涨超3%，纳指期货涨幅扩大至4%。消息面上，美联储宣布了一系列帮助市场的新计划，包括了开放式的资产购买。,美股三大指数期货均涨超3% 纳指期货涨幅扩大至4%
42,2020-03-23 20:21:23,【行情】富时中国A50指数期货涨幅扩大，现涨逾3%。（第一财经）,富时中国A50指数期货涨幅扩大 现涨逾3%
43,2020-03-23 20:19:58,【恩捷股份：拟定增募资不超50亿元 用于锂离子电池隔膜一期扩建项目等】恩捷股份(002812) 3月23日晚间公告，公司拟非公开发行A股股票。发行对象为不超过35名的特定投资者，发行价格不低于定价基准日前20个交易日股票交易均价的80%，拟募集资金总额（含发行费用）不超过50亿元，用于江西省通瑞新能源科技发展有限公司锂离子电池隔膜一期扩建项目、无锡恩捷新材料产业基地二期扩建及补充流动资金。（证券时报）,恩捷股份：拟定增募资不超50亿元 用于锂离子电池隔膜一期扩建项目等
44,2020-03-23 20:19:12,【行情】恒指期货夜盘持续拉涨，涨幅扩大至近4%。,恒指期货夜盘持续拉涨 涨幅扩大至近4%
45,2020-03-23 20:17:25,【美股三大指数期货全部涨超2%】美股三大指数期货全部涨超2%，纳指期货涨超3%。,美股三大指数期货全部涨超2%
46,2020-03-23 20:15:17,"【欧洲股市跌幅缩窄】欧洲股市跌幅缩窄，德国DAX30指数跌0.47%，欧洲斯托克50指数跌0.82%，英国富时100指数跌1.91%,法国CAC40跌0.91%。",欧洲股市跌幅缩窄
47,2020-03-23 20:13:13,【比特币回升至6000美元/枚上方】交易平台Bitstamp报价显示，比特币回升至6000美元/枚上方。（金十数据）,比特币回升至6000美元/枚上方
48,2020-03-23 20:12:42,【美、布两油持续上扬】美、布两油持续上扬，15分钟拉升约1美元，现分别报23.43美元/桶，日内翻红，布油现报26.49美元/桶。,美、布两油持续上扬
49,2020-03-23 20:09:25,【纳指期货转涨】美股三大股指期货短线持续走高，纳指期货率先转涨。,美股三大股指期货短线持续走高
50,2020-03-23 20:09:18,【两连板航天长峰：公司主营业务未发生重大变化】航天长峰(600855)连续两个交易日涨停，公司3月23日晚提示风险称，目前公司主营业务未发生重大变化，公司所处的市场经营环境及行业政策未发生重大调整，不存在影响公司股票交易价格异常波动的重大事项。公司当前的静态市盈率、滚动市盈率均明显高于同行业的中位数平均水平。公司市盈率相对来说处于较高水平，请投资者注意投资风险，理性决策，谨慎投资。（证券时报）,两连板航天长峰：公司主营业务未发生重大变化
51,2020-03-23 20:06:10,【行情】富时A50中国指数期货直线拉升，现涨1.15%。,富时A50中国指数期货直线拉升 现涨1.15%
52,2020-03-23 20:03:14,【美股三大股指期货短线上扬】美股三大股指期货短线上扬，道指期货跌幅缩窄至1.44%，纳指期货跌1.03%，标普500指数期货跌1.68%。,美股三大股指期货短线上扬
53,2020-03-23 20:02:42,【行情】现货黄金短线走高5美元，升至1500美元上方。,现货黄金短线走高5美元
54,2020-03-23 20:02:35,【世界钢铁协会：2020年2月全球粗钢产量同比增长2.1%】世界钢铁协会：2020年2月全球粗钢产量同比增长2.1%，至1.424亿吨。（界面新闻）,世界钢铁协会：2020年2月全球粗钢产量同比增长2.1%
55,2020-03-23 20:02:01,【快讯】美联储：本周每天都将购买750亿美元的国债和500亿美元的机构住房抵押贷款支持证券（MBS）。（界面新闻）,美联储：本周每天都将购买750亿美元国债和500亿美元MBS
56,2020-03-23 20:01:23,【星网宇达：公司副董事长拟减持不超3%公司股份】星网宇达(002829)3月23日晚间公告，持股26.04%的公司股东、公司副董事长李国盛计划在6个月内，通过集中竞价交易或大宗交易方式，合计减持不超过471万股，合计减持比例不超过公司总股本3%。（证券时报）,星网宇达：公司副董事长拟减持不超3%公司股份
57,2020-03-23 19:55:57,【中国电信加速5G新基建 争取年内开通30万站】3月23日，新京报记者从中国电信方面获悉，截至目前，中国电信在全国已累计开通5G基站约7.5万站。随着疫情逐渐平稳，中国电信积极复工复产，提速度、抢进度，开足马力加快5G新型基础设施建设。在前期工作的基础上，中国电信认真研究部署，调整了5G建设计划，上半年要追回受疫情影响的建设进度，力争在年底前完成30万个5G基站建设的目标。（新京报）,中国电信加速5G新基建 争取年内开通30万站
58,2020-03-23 19:54:40,【三鑫医疗：获得一次性使用医用口罩、医用外科口罩医疗器械注册证】三鑫医疗(300453)3月23日晚间公告，公司全资子公司云南三鑫于近日取得了云南省药品监督管理局颁发的一次性使用医用口罩、医用外科口罩两项产品的《医疗器械注册证》，将进一步丰富云南三鑫医用口罩类产品的种类，对公司及云南三鑫有积极意义。（证券时报）,三鑫医疗：获得一次性使用医用口罩、医用外科口罩医疗器械注册证
59,2020-03-23 19:50:50,【警惕！全球股市“黑色星期一”！这次美股像2008年还是1929年大崩盘？】今日，除日经225指数翻红外，亚太主要股指重挫。究其原因，主要有两个，一个是全球新冠肺炎确诊病例超32万例，另一个则是，对于2万亿美元的经济刺激计划，美国两党没能达成一致。这直接导致今日早上美股期指熔断，进而影响到亚太股指。,警惕！全球股市“黑色星期一”！这次美股像2008年还是1929年大崩盘？
60,2020-03-23 19:47:33,【德国政府签署7500亿欧元的疫情应对措施】据外媒报道，德国政府签署总计7500亿欧元的新冠肺炎疫情应对措施。（第一财经）,德国政府签署7500亿欧元的疫情应对措施
61,2020-03-23 19:44:12,【索菲亚：2019年净利润同比增长12.34% 拟10派5.5元】索菲亚(002572)3月23日晚间披露年报，公司2019年实现营收76.86亿元，同比增长5.13%；净利润10.77亿元，同比增长12.34%，每股收益1.18元，拟向全体股东每10股派发现金红利5.5元（含税）。（证券时报）,索菲亚：2019年净利润同比增长12.34% 拟10派5.5元
62,2020-03-23 19:41:28,【3月23日新闻联播要闻精选】今日新闻联播或涉及资本市场的内容：1、全国各地精准施策，加速推动复工复产。2、李克强主持召开中央应对新冠肺炎疫情工作领导小组会议。3、国办印发《关于在防疫条件下积极有序推进春季造林绿化工作的通知》。4、中央指导组：毫不放松疫情防控，有序恢复正常医疗秩序。5、国新办举行发布会介绍中医药防治新冠肺炎情况。6、民营医院积极投身一线战疫。7、湖北武汉重启恢复城市功能。（证券时报）,3月23日新闻联播要闻精选
63,2020-03-23 19:34:17,【富安娜：实控人提议回购公司股份】富安娜(002327)3月23日晚间公告，公司实际控制人林国芳提议回购公司股份，建议回购资金总额不低于1亿元，不超过2亿元，回购价格不超过9.5元/股。（证券时报）,富安娜：实控人提议回购公司股份
64,2020-03-23 19:32:58,【海特高新：子公司将适用退还增值税期末留抵税额政策】海特高新(002023)3月23日晚间公告，公司控股子公司成都海威华芯科技有限公司入选第四批适用退还增值税期末留抵税额政策的集成电路重大项目企业名单。根据有关规定，对国家批准的集成电路重大项目企业因购进设备形成的增值税期末留抵税额准予退还。此次退税将有助于改善海威华芯现金流。（证券时报）,海特高新：子公司将适用退还增值税期末留抵税额政策
65,2020-03-23 19:28:35,【北京市政府决定由北京城市副中心管理委员会行使部分市级行政权力】为深入落实《北京城市副中心控制性详细规划(街区层面)(2016年—2035年)》，高水平规划建设城市副中心，3月23日，北京市政府决定，由北京城市副中心管理委员会(以下简称副中心管委会)行使部分市级行政权力。（央视新闻）,北京市政府决定由北京城市副中心管理委员会行使部分市级行政权力
66,2020-03-23 19:25:49,【ST慧球：拟定增募资不超21.2亿元 用于新媒体商业大数据平台等项目】ST慧球(600556)3月23日晚披露非公开发行股票预案，发行对象为不超过35名特定投资者，募集资金总额不超21.2亿元，扣除相关发行费用后将用于投资新媒体商业大数据平台建设项目、WEIQ新媒体营销云平台升级项目、补充流动资金。（证券时报）,ST慧球：拟定增募资不超21.2亿元 用于新媒体商业大数据平台等项目
67,2020-03-23 19:23:09,【专家称疫情后一线城市有望引领楼市回暖】上海易居房地产研究院23日发布报告显示，一线城市和强二线城市楼市走势领先弱二线城市和三四线城市，前两者经过连续两年的调整后开始企稳反弹。易居研究院研究员沈昕表示，2020年一线城市有望继续引领楼市复苏。受史上最严的限购限贷政策影响，一线城市2017年和2018年的调整幅度最大，2019年企稳反弹，2020年有望延续这一趋势，在疫情影响消除后有望引领全国楼市回暖。（中证网）,专家称疫情后一线城市有望引领楼市回暖
68,2020-03-23 19:22:54,【管涛：中国市场总体存在一定韧性 短期冲击不改根本趋势】管涛认为，当下对市场的冲击不会改变根本的趋势，中国的市场总体存在一定的韧性，短期可能会对势头有一定影响，可能会对市场的预期出现冲击。但是总体上来讲，中国经济有望在全球疫情应对中脱险而出。（21世纪经济报道）,管涛：中国市场总体存在一定韧性 短期冲击不改根本趋势
69,2020-03-23 19:19:22,【中央应对疫情领导小组：针对疫情变化部署外防输入内防反弹措施】23日，中共中央政治局常委、国务院总理、中央应对新冠肺炎疫情工作领导小组组长李克强主持召开领导小组会议。（央视）,中央应对疫情领导小组：针对疫情变化部署外防输入内防反弹措施
70,2020-03-23 19:19:04,【乐普医疗：动态心电人工智能分析软件获得美国FDA批准】乐普医疗(300003)3月23日晚间公告，公司AI事业部下属全资子公司凯沃尔自主研发的基于AI算法的动态心电人工智能分析软件AI-ECG Tracker获得美国食品药品监督管理局（简称“FDA”）的注册批准。（证券时报）,乐普医疗：动态心电人工智能分析软件获得美国FDA批准
71,2020-03-23 19:16:44,【华铁股份：股东鸿锋实业及一致行动人拟减持不超6%公司股份】华铁股份(000976)3月23日晚间公告，合计持股10.38%的股东鸿锋实业及一致行动人鸿众投资计划在六个月内通过集中竞价方式及大宗交易方式合计减持公司股份数量不超过9574万股，不超过公司总股本的6%。（证券时报）,华铁股份：股东鸿锋实业及一致行动人拟减持不超6%公司股份
72,2020-03-23 19:13:31,【河南全省县际客运班线全部开通】3月23日，记者从河南省交通运输厅了解到，目前河南全省各地市客运班线逐步恢复运营，均已开通县际班线，部分地市开通县内班线、市际班线、省际班线。（央视新闻）,河南全省县际客运班线全部开通
73,2020-03-23 19:12:20,【三全食品：大股东陈泽民及其一致行动人拟减持2.8%公司股份】三全食品(002216)3月23日晚间公告，大股东陈泽民及其一致行动人李冬雨计划自公告披露之日起15个交易日后的6个月内以集中竞价或大宗交易方式减持公司股份，减持股份合计不超过2237.92万股（占公司总股本比例2.8%）。（证券时报）,三全食品：大股东陈泽民及其一致行动人拟减持2.8%公司股份
