,datetime,content,title
701,2020-02-13 19:17:37,【应勇：打好疫情防控组合拳 坚决把疫情扩散蔓延势头遏制住】应勇强调，当前，疫情形势仍然十分严峻，任务十分艰巨，我们必须坚决贯彻落实习近平总书记重要指示精神，根据党中央、国务院决策部署，以更大决心、更果断措施、更有效办法，抓实抓细抓落地，打好疫情防控组合拳，坚决把疫情扩散蔓延势头遏制住。,应勇：打好疫情防控组合拳 坚决把疫情扩散蔓延势头遏制住
702,2020-02-13 19:13:58,【科创板华润微中签号出炉 共21.1万个】华润微(688396)2月13日晚间披露中签结果，中签号码共有210956个，每个中签号码只能认购500股。（证券时报）,科创板华润微中签号出炉 共21.1万个
703,2020-02-13 19:13:05,【交通运输部：坚定不移做好湖北武汉等疫情重点地区应急运输保障工作】2月13日，交通运输部部长李小鹏主持召开部务会，会议强调，要坚定不移做好湖北武汉等疫情重点地区应急运输保障工作。科学统筹抓好春运错峰返程和“两会”运输保障工作。会议强调，要在加强疫情防控工作的前提下，统筹做好复工复产有关工作。一是加快完善规划体系，加快建设交通强国。二是做好保通保畅、保运保供工作。三是坚决打赢交通扶贫脱贫攻坚战。四是努力促进交通有效投资，全力完成年度目标任务。五是加强政策储备研究。（证券时报）,交通运输部：坚定不移做好湖北武汉等疫情重点地区应急运输保障工作
704,2020-02-13 19:09:13,【海大集团：2019年净利润16.51亿元 同比增长14.90%】海大集团发布2019年度业绩快报，报告期内，公司实现营业收入476.86亿元，同比增长13.12%；归属于上市公司股东的净利润16.51亿元，同比增长14.90%；基本每股收益1.04元，同比增长15.56%。（一财）,海大集团：2019年净利润16.51亿元 同比增长14.90%
705,2020-02-13 19:07:26,【中央应对疫情领导小组：孝感黄冈等地要采取和武汉同等的隔离救治措施】13日，中共中央政治局常委、国务院总理、中央应对新冠肺炎疫情工作领导小组组长李克强主持召开领导小组会议。会议指出，要继续把湖北省特别是武汉市作为疫情防控的重中之重。武汉市要对“四类人员”加速分类集中收治或隔离；孝感、黄冈等地要采取和武汉同等的隔离救治措施。（央视新闻）,中央应对疫情领导小组：孝感黄冈等地要采取和武汉同等的隔离救治措施
706,2020-02-13 19:05:02,【博瑞医药：关于瑞德西韦的开发工作不存在侵犯专利权的情形】科创板博瑞医药公告称，公司关注到有媒体报道或市场传闻，公司开发瑞德西韦涉嫌侵犯专利权。 截至目前，公司关于瑞德西韦的开发工作尚处于研发阶段，公司认为上述研发事宜不存在侵犯专利权的情形。（一财）,博瑞医药：关于瑞德西韦的开发工作不存在侵犯专利权的情形
707,2020-02-13 19:00:02,【平安银行：2019年净利282亿元 同比增13.6%】平安银行2月13日晚间披露年报，2019年实现营业收入1379.58亿元，同比增长18.2%；净利润281.95亿元，同比增长13.6%。基本每股收益1.54元。拟向全体股东每10股派发现金股利2.18元。（证券时报）,平安银行：2019年净利282亿元 同比增13.6%
708,2020-02-13 18:57:55,【人民日报：疫情冲击不会改变经济向好趋势】人民日报评论文章称，突如其来的疫情，给一些行业企业和大众消费带来了不同程度的影响。但是，影响是暂时的，我们完全有信心、有能力战胜疫情、提振经济。与2003年抗击非典时相比，今天中国经济的规模与质量、物质基础以及应急处置能力、宏观调控体系，都已经取得显著进步。这是中国经济发展的韧性与潜力所在，也是胜利的信心与底气所在。 疫情冲击不会改变经济向好趋势。（人民日报）,人民日报：疫情冲击不会改变经济向好趋势
709,2020-02-13 18:55:54,【中证指数公司将发布中证港股通消费主题指数】中证指数有限公司发布公告称，将于2020年3月6日正式发布中证港股通消费主题指数。（证券时报）,中证指数公司将发布中证港股通消费主题指数
710,2020-02-13 18:49:54,【中证指数公司将发布中证港股通消费主题指数】中证指数有限公司发布公告称，将于2020年3月6日正式发布中证港股通消费主题指数。（证券时报）,中证指数公司将发布中证港股通消费主题指数
711,2020-02-13 18:44:32,【武汉数据暴增解读：真实情况渐清晰 有利布局大决战】事实上，从流行病学的专业角度而言，这个数据并不意味着疫情的进一步蔓延，而是意味着：从现在起，湖北的新冠肺炎疫情，正式走入了防控的核心——控制所有传染源、切断传播路径。（一财）,武汉数据暴增解读：真实情况渐清晰 有利布局大决战
712,2020-02-13 18:41:54,【行情】美股特斯拉盘前跌幅扩大至4%，此前在北美因动力转向问题召回1.5万辆Model X。,特斯拉盘前跌幅扩大至4% 公司宣布北美召回1.5万辆Model X
713,2020-02-13 18:39:33,【行情】美股特斯拉盘前跌幅扩大至4%，此前在北美因动力转向问题召回1.5万辆Model X。（一财）,美股特斯拉盘前跌幅扩大至4%
714,2020-02-13 18:34:22,【“网红”瑞德西韦：利好比疗效来得早一些】分子式一直公开可查，而非“紧急公开”；药物前身诞生于2006年，而非针对新冠肺炎的研发新药；双盲实验仍在进行，而非参与实验患者“全部显效”……瑞德西韦这些天对于“网红是非多”当是感触颇深。（上证报）,“网红”瑞德西韦：利好比疗效来得早一些
715,2020-02-13 18:27:27,【四川首次派出精神卫生专家赴武汉】今天，四川省第七批、第八批援武汉医疗队共284人出发。救援队中首次出现了精神卫生专业专家。目前，四川一共派出1203名医疗救助队员，他们分别在武汉红十字会医院、武汉大学人民医院、武汉国际博览中心方舱医院一线参与救治。（央视新闻）,四川首次派出精神卫生专家赴武汉
716,2020-02-13 18:26:35,【深圳：疫情防控建设项目可先行使用土地】2月13日，深圳市规划和自然资源局发出做好疫情防控期间相关保障服务工作的通知，通知提出了疫情防控建设项目可先行使用土地，持续做好土地供应保障工作，提高疫情防控建设项目审批效率等措施，并暂停受理涉野生动物相关行政许可。（南方+）,深圳：疫情防控建设项目可先行使用土地
717,2020-02-13 18:22:11,【湖北武汉已启动9个方舱 累计收治病人5620人】据武汉市卫健委统计，截至2月13日下午4时，已经启动方舱9个，分别是：武昌方舱、江汉方舱、东西湖方舱、硚口方舱、汉阳方舱、黄陂方舱、江岸方舱、青山方舱、经开区方舱。目前累计收治病人5620人，出院52人，转院360人，收舱病人数为5208人。（央视新闻）,湖北武汉已启动9个方舱 累计收治病人5620人
718,2020-02-13 18:21:15,【农业农村部：继续配合做好农村疫情防控 强化蔬菜等“菜篮子”产品生产保供】农业农村部党组书记、部长韩长赋2月13日主持召开部党组会议，会议强调，要统筹抓好当前重点工作。继续配合做好农村疫情防控，特别是重点疫区返乡农民工防控工作，防止农村疫情扩散。强化蔬菜等“菜篮子”产品生产保供，紧盯“南菜北运”生产大省、设施蔬菜重点省和规模经营主体，加大支持保障，增加“菜篮子”产品生产。（证券时报）,农业农村部：继续配合做好农村疫情防控 强化蔬菜等“菜篮子”产品生产保供
719,2020-02-13 18:20:34,【国元证券：母公司1月份净利润2.88亿元】国元证券(000728)2月13日晚间公告，母公司1月份实现营业收入4.14亿元，净利润2.88亿元。（证券时报）,国元证券：母公司1月份净利润2.88亿元
720,2020-02-13 18:15:33,【人社部：推迟部分职业资格考试报名、贡献突出抗疫专技人才可申高级职称】人社部下发通知要求，避免组织举办专业技术人才聚集性活动。统筹做好上半年专业技术人员职业资格考试考务安排，部分考试将视疫情防控情况进行必要调整。推迟有关职业资格考试报名，暂缓职业资格纸质证书发放和补办。延长博士后创新人才支持计划、博士后科研工作站设站、博士后综合评估、国（境）外交流项目申报日期。对参与抗击新冠肺炎疫情的一线专业技术人才评审职称时予以倾斜，对做出突出贡献的开辟绿色通道，直接申报评审高级职称。（人民日报）,人社部：推迟部分职业资格考试报名、贡献突出抗疫专技人才可申高级职称
721,2020-02-13 18:13:19,【欧洲股市下跌 富时100指数跌逾1%】欧洲股市持续低迷，截至发稿，富时100指数跌超1%，法国CAC40指数、德国DAX指数均跌0.7%。,欧洲股市下跌 富时100指数跌逾1%
722,2020-02-13 18:12:36,【国际油价持续下挫 两油均跌超1%】国际油价持续下挫，WTI原油跌幅扩大至逾1%，现报50.68美元/桶，布伦特原油跌幅1.38%，报55.04美元/桶。,国际油价持续下挫 两油均跌超1%
723,2020-02-13 18:11:49,【易见股份：公司控制权拟发生变更 股票复牌】易见股份(600093)2月13日晚公告，公司股东九天控股拟将2.02亿股公司股份（占公司总股本的18%）转让给工投君阳；公司控股股东滇中集团拟通过公开征集受让方的方式转让其持有的8%公司股份。云南工投将参与滇中集团协议转让8%公司股份的公开征集。工投君阳为云南工投的控股子公司。若云南工投被确定为公开征集的受让方，其将成为公司控股股东，公司的实控人将变更为云南省国资委。公司股票2月14日起复牌。（证券时报）,易见股份：公司控制权拟发生变更 股票复牌
724,2020-02-13 18:07:07,【辽宁省无新增确诊病例】辽宁最新通报称，2月12日19时至2月13日17时，辽宁省无新增确诊病例，新增2例治愈出院病例，累计确诊116例。（人民日报）,辽宁省无新增确诊病例
725,2020-02-13 18:06:06,【中国人民银行在香港成功发行300亿元央行票据】2月13日，中国人民银行在香港成功发行了两期人民币央行票据，其中3个月期央行票据200亿元，1年期央行票据100亿元，中标利率分别为2.55%和2.60%。（证券时报）,中国人民银行在香港成功发行300亿元央行票据
726,2020-02-13 18:00:49,【英科医疗：股东深创投及关联方计划减持不超过4%公司股份】英科医疗公告，持有公司股份10.07%的股东深创投及关联方淄博创新计划以大宗交易方式减持公司股份，减持期间大宗交易自公告之日起三个交易日后六个月内，减持数量不超过793万股(占公司总股本比例不超过4%)。（一财）,英科医疗：股东深创投及关联方计划减持不超过4%公司股份
727,2020-02-13 18:00:01,【即日起 上海免费开放病毒基因组鉴定服务直至疫情全面结束】记者从上海科技创新资源数据中心获悉，该中心联合中国科学院上海巴斯德研究所、中国科学院上海营养与健康研究所共同研发的基于二代测序数据的病毒基因组鉴定服务，从2月13日起通过上海科技创新资源数据中心官微，在线面向全国医疗机构、医生和医学研究者免费开放至疫情全面结束。（澎湃新闻）,即日起 上海免费开放病毒基因组鉴定服务直至疫情全面结束
728,2020-02-13 17:58:46,【丽珠集团：新型冠状病毒IgM抗体检测试剂盒（酶联免疫法）进入国家应急审批通道】丽珠集团(000513)13日晚公告，丽珠试剂与中国科学院武汉病毒研究所研制的新型冠状病毒IgM抗体检测试剂（胶体金法）、新型冠状病毒IgG抗体检测试剂（胶体金法）已通过体外诊断试剂应急审批答辩，并于2月11日进入快速审批通道。而由中国食品药品检定研究院、中国科学院武汉病毒研究所和丽珠试剂共同申报的科技部应急项目，新型冠状病毒IgM抗体检测试剂盒（酶联免疫法）也于2月11日进入国家应急审批通道。（证券时报）,丽珠集团：新型冠状病毒IgM抗体检测试剂盒（酶联免疫法）进入国家应急审批通道
729,2020-02-13 17:58:06,【上海出来3000例确诊病例？上海卫健委：假消息！】上海卫健委表示，网上关于“昨天疫情大爆发，上海出来3000多例”的传言，纯属谣言。上海每天两次发布确诊病例、排除疑似病例、出院病例等相关数据，完全透明公开。另外，根据国家卫健委印发的诊疗方案，湖北以外地区的诊断标准没有变化，也就是说，上海的诊断标准没有变化。（一财）,上海出来3000例确诊病例？上海卫健委：假消息！
730,2020-02-13 17:56:54,【公安部：各地已查扣假劣口罩1630余万只】从公安部食药侦局了解到，截至目前，各地公安机关共侦办涉疫情制售伪劣产品、假劣药品、医疗器械、医用卫生材料案件356起，抓获犯罪嫌疑人838名，刑事拘留355人，捣毁犯罪窝点389个，查扣假劣口罩1630余万只。（人民日报）,公安部：各地已查扣假劣口罩1630余万只
731,2020-02-13 17:55:22,【深深房A：重大资产重组 股票明日起停牌】深深房A 2月13日公告称，股票将自2月14日起继续停牌不超过1个月；如1个月内未披露重大资产重组预案或报告书，且未申请延期复牌或申请被否，公司将发布终止重大资产重组公告并申请复牌。（一财）,深深房A：重大资产重组 股票明日起停牌
732,2020-02-13 17:53:55,【中芯国际：2019年第四季度营收8.394亿美元】中芯国际公告，2019年第四季度营收8.394亿美元，市场预估8.43亿美元；第四季度净利润8870万美元，市场预估4790万美元。预计2020年第一季度营收同比增长0%-2%。（一财）,中芯国际：2019年第四季度营收8.394亿美元
733,2020-02-13 17:51:58,【华虹半导体：去年纯利跌11.46%至1.62亿美元 销售收入创历史新高】华虹半导体发布第四季度业绩，按截至2019年12月31日止年度计算，公司实现销售收入创历史新高，达9.326亿美元，较上年度增长0.2%；毛利率30.3%，较上年度下降3.1个百分点；母公司拥有人应占溢利1.622亿美元，同比减少11.46%；基本每股盈利0.126美元。（一财）,华虹半导体：去年纯利跌11.46%至1.62亿美元 销售收入创历史新高
734,2020-02-13 17:43:06,【中国天楹：境外全资子公司中标1.5亿欧元固废处理项目】中国天楹(000035)2月13日晚间公告，近日，公司全资子公司Urbaser中标西班牙埃斯特雷马杜拉自治区固废综合处理厂运营维护以及固废运输项目，中标金额998.98万欧元/年，合计1.5亿欧元。若本中标项目最终能签署正式协议并顺利履行，将为公司在境外拓展广阔的环保市场奠定更为坚实的基础，进一步提升了公司在境内外环保行业的竞争优势，对公司的经营业绩也将带来积极的影响。（证券时报）,中国天楹：境外全资子公司中标1.5亿欧元固废处理项目
735,2020-02-13 17:39:32,【山东严禁幼儿园开展线上教学活动】2月13日，山东省教育厅发布规范延迟开学期间普通中小学线上教育教学活动的意见。意见中要求，各地和学校可暂按1个月编制教学计划，教学计划应通过门户网站等途径向学生及家长公布。线上教学对小学一、二年级不作统一硬性要求。严禁幼儿园开展线上教学活动。中学毕业年级和有条件的学校可以采用“直播+线上答疑”的形式，避免简单照搬照抄线下课堂教学组织方式、套用线下课程表进行线上教学。（一财）,山东严禁幼儿园开展线上教学活动
736,2020-02-13 17:35:14,【财政部：中央财政对地方财政按实际发生费用的60%予以补助】财政部发布关于进一步做好新型冠状病毒感染肺炎疫情防控经费保障工作的通知。通知指出，落实患者救治费用补助政策。对于确诊患者发生的医疗费用，在基本医保、大病保险、医疗救助等按规定支付后，个人负担部分由财政给予补助。所需资金由地方财政先行支付，中央财政对地方财政按实际发生费用的60%予以补助。（一财）,财政部：中央财政对地方财政按实际发生费用的60%予以补助
737,2020-02-13 17:31:17,【数据】北向资金今日净买入天齐锂业5.53亿元、五粮液2.58亿元，净卖出汇顶科技2.78亿元、京东方A2.68亿元。,北向资金今日净买入天齐锂业5.53亿元
738,2020-02-13 17:30:31,【中注协：正与有关部门密切沟通提请研究年度报告披露延期问题】21世纪经济报道记者从会计师事务所、企业处多方了解到，年报审计中的走访、函证、盘点等多项程序的进展都因疫情面临着不确定性，部分企业如期披露年报面临着一定的压力。（21世纪经济报道）,中注协：正与有关部门密切沟通提请研究年度报告披露延期问题
739,2020-02-13 17:30:25,【湖北投放130万只2元民用口罩】按照湖北省指挥部部署，省市场监管局等部门积极协调武汉小药药医药科技有限公司，加强民用口罩市场供应，13日已筹集首批50万只民用口罩，通过武汉小药药公司销售网络投向武汉商务企业和零售药店。目前，已经有同济堂、好得快、中联等药房共1235家零售药店参加销售，并悬挂对应销售标识。据了解，武汉小药药公司采取补贴运费、税费等方式，按照进货价1元/只供应零售药店，并要求零售药店张贴告示按2元/只平价向市场供应。（人民日报）,湖北投放130万只2元民用口罩
740,2020-02-13 17:28:15,【本钢板材：控股股东本溪钢铁公司拟增持5000万元-1亿元股份】本钢板材(000761)2月13日晚间公告，公司控股股东本溪钢铁公司计划自2月14日起6个月内，通过法律法规许可的方式（包括但不限于集中竞价和大宗交易），以自有资金增持公司股份。本次增持计划总金额不低于5000万元，不超过1亿元，不设价格区间。（证券时报）,本钢板材：控股股东本溪钢铁公司拟增持5000万元-1亿元股份
741,2020-02-13 17:27:41,【中新网评：战“疫”吃紧关头果断换将 严肃问责军中无戏言】疫情爆发至今，已造成千余人病亡的局面，教训深刻、代价沉重！湖北一些官员在指挥这场大战中的表现，一直被舆论质疑应对失策、贻误战机。（中新网）,中新网评：战“疫”吃紧关头果断换将 严肃问责军中无戏言
742,2020-02-13 17:23:13,【乘联会：原本预计2月零售正增长的 目前看要下滑30%以上】乘联会发布2月全国乘用车市场展望，2月面临突发的疫情冲击最为显著，原有的春节消费节奏全面改变，汽车产业链处于全面的停顿状态。由于疫情目前仍处于攻坚阶段，为配合防控要求，切实落实企业社会责任，原定的开工时间延期1周甚至更长，很多岗位工作开启居家办公模式，但短期内生产经营难以有效恢复。（一财）,乘联会：原本预计2月零售正增长的 目前看要下滑30%以上
743,2020-02-13 17:20:45,【财政部：确保人民群众不因担心费用问题而不敢就诊】财政部发布关于进一步做好新型冠状病毒感染肺炎疫情防控经费保障工作的通知。通知指出，进一步增强支持做好疫情防控工作的政治责任感、使命感和紧迫感，切实加强组织领导，努力做到工作部署更细致、政策考虑更周全、资金安排更科学，全力做好疫情防控经费保障工作。确保人民群众不因担心费用问题而不敢就诊，确保各地不因资金问题而影响医疗救治和疫情防控。（第一财经）,财政部：确保人民群众不因担心费用问题而不敢就诊
744,2020-02-13 17:19:28,【乘联会：1月新能源乘用车批发销量同比下降51.3%】乘联会：1月新能源乘用车批发销量4.5万台，同比下降51.3%，环比12月下降67%。其中插电混动销量1.0万台，同比下降38%。纯电动的批发销量3.5万台，同比下降52%。（证券时报）,乘联会：1月新能源乘用车批发销量同比下降51.3%
745,2020-02-13 17:16:56,【香港13日最新通报：新增1例新冠肺炎确诊病例 累计确诊51例】13日下午，香港卫生防护中心传染病处主任张竹君召开记者会，宣布香港确诊第51例新型冠状病毒感染病例。据悉该感染者为43岁香港本地男子，近期没有离开过香港。另外，香港卫生防护中心还获悉，停泊在日本横滨港的邮轮“钻石公主”号上，已有8名香港游客确诊感染新型冠状病毒。（央视新闻）,香港13日最新通报：新增1例新冠肺炎确诊病例 累计确诊51例
746,2020-02-13 17:15:43,【奥飞娱乐：控股股东蔡东青及其一致行动人拟合计减持不超2%股份】奥飞娱乐(002292)2月13日晚间公告，公司的控股股东蔡东青及其一致行动人蔡晓东计划合计减持公司股份不超过2714.32万股（占公司总股本的2%）。（证券时报）,奥飞娱乐：控股股东蔡东青及其一致行动人拟合计减持不超2%股份
747,2020-02-13 17:15:12,【2020巴塞罗那世界移动通信大会取消举行】全球移动通信系统协会12日宣布，取消原定于2月24日至27日在西班牙巴塞罗那举行的2020世界移动通信大会。大会组委会当天在与全球主要电信运营商代表进行紧急会议后宣布了这一决定。在本次大会正式取消之前，已有多家业内知名企业和电信运营商陆续表示因疫情放弃参展。此前，巴塞罗那市已宣布将采取多种防范措施，并表示不存在公共卫生风险。（新华社）,2020巴塞罗那世界移动通信大会取消举行
748,2020-02-13 17:12:00,【数据】乘联会：2020年1月全国乘用车市场零售169.9万台，同比2019年1月下降21.5%，这也是自2005年乘联会零售统计以来的最低增速。（乘联会）,乘联会：1月全国乘用车零售169.9万台 同比降21.5%
749,2020-02-13 17:11:07,【北京人社局呼吁优先请长辈看护孩子：让年轻人安心去工作】针对疫情期间看护孩子的话题，北京市人社局二级巡视员、新闻发言人陆晓播13日在北京疫情防控新闻发布会上表示，“我们向每个家庭发出倡议。孩子是祖国的未来，在防疫工作特殊时期，每个家庭成员都要肩负起照顾孩子的共同责任。如果家庭中有长辈能够看护孩子的，建议优先请长辈看护，让年轻人安心去工作，一起为经济社会发展做贡献。”（中新网）,北京人社局呼吁优先请长辈看护孩子：让年轻人安心去工作
750,2020-02-13 17:10:37,【广汽集团：2020年1月份汽车销量同比减少15.94% 产量同比减少24.31%】广汽集团公告，公司2020年1月份实现汽车产量13.8万辆，比去年同期减少24.31%，其中乘用车产量13.7万辆，比去年同期减少24.35%，轿车产量同比减少32.16%；2020年1月份实现汽车销量17.6万辆，比去年同期减少15.94%，乘用车销量同比减少15.94%，轿车销量同比减少27.64%。（一财）,广汽集团：2020年1月份汽车销量同比减少15.94% 产量同比减少24.31%
751,2020-02-13 17:09:44,【科创板拟上市公司京源环保获上市委会议通过】2月13日消息，科创板拟上市公司江苏京源环保股份有限公司获上市委会议通过。（证券时报）,科创板拟上市公司京源环保获上市委会议通过
752,2020-02-13 17:08:59,【首创股份：下属公司12.53亿摘牌大连恒基新润水务有限公司100%股权】首创股份(600008)2月13日晚间公告，2月12日，公司下属公司汇安环保以12.53亿元的价格于北京产权交易所成功摘牌大连恒基新润水务有限公司100%股权。目标公司业态丰富，包含市政污水处理、工业污水处理、再生水及脱盐水处理。截至2019年6月30日目标公司现金及银行理财余额9769万元，累计未分配利润2.63亿元，2016年-2018年目标公司年净利润均超过7000万元。（证券时报）,首创股份：下属公司12.53亿摘牌大连恒基新润水务有限公司100%股权
753,2020-02-13 17:07:51,【多城楼市现“定向宽松”政策 尚未触及限购等关键层面】昨日(2月12日)晚间，无锡市委、市人民政府连夜发布17条政策，包括“可延期缴纳土地出让金、开竣工时间可相应顺延、预售部分完成25%以上投资即可申请预售、到期还款困难的企业可予以展期”等超硬核条款，定向支持住建行业度过难关。据记者统计，无锡市住建局领到多达10张任务卡。（每经）,多城楼市现“定向宽松”政策 尚未触及限购等关键层面
