,datetime,content,title
483,2020-10-02 14:24:55,【澳大利亚ASX200指数收盘下跌81.40点 跌幅1.39%】澳大利亚ASX200指数收盘下跌81.40点，跌幅1.39%，报5791.50点。（格隆汇）,澳大利亚ASX200指数收盘下跌81.40点 跌幅1.39%
484,2020-10-02 14:20:43,【富时中国A50指数期货跌逾2%】富时中国A50指数期货震荡下跌，截至发稿，富时中国A50指数期货跌2.41%。,富时中国A50指数期货跌逾2%
485,2020-10-02 14:18:46,【10月2日长三角铁路预计发送旅客248万人 客流高峰持续】今日，长三角铁路预计发送旅客248万人，增开客车124列，重联223列。据中国铁路上海局集团有限公司消息，10月1日发送旅客309.9万人，创下今年以来单日客发量最高纪录。（央视）,10月2日长三角铁路预计发送旅客248万人 客流高峰持续
486,2020-10-02 14:16:48,【美股三大指数期货集体下挫 纳指期货跌近2%】美股三大指数期货集体下挫，截至发稿，道指期货跌1.68%，纳指期货跌1.82%，标普500指数期货跌1.62%。,美股三大指数期货集体下挫 纳指期货跌近2%
487,2020-10-02 14:03:55,【欧洲央行将就数字欧元举行公开磋商和试验】欧洲央行将就数字欧元举行公开磋商和试验。数字欧元将是所有公民和企业都可以使用的电子形式的央行货币。（金十数据）,欧洲央行将就数字欧元举行公开磋商和试验
488,2020-10-02 14:00:52,【日媒关注：中欧“钢铁驼队”运量逆势激增】据日本《东京新闻》9月28日报道，连接中国内陆城市和西班牙等欧洲国家的货运列车“中欧班列”的运输量激增。（参考消息网）,日媒关注：中欧“钢铁驼队”运量逆势激增
489,2020-10-02 13:51:19,【行情】美、布两油期货均跌逾3%，分别报37.36美元/桶和39.6美元/桶。（金十数据）,美、布两油期货均跌逾3%
490,2020-10-02 13:43:04,【这家券商股权遭“疯抢” 最高溢价40%！每场拍卖吸引近万人围观 为何这么火？】9月30日，华龙证券1500万股股权在阿里司法拍卖平台进行拍卖，与两个月前的“无人问津”不同，本次所拍卖股权每场都会经历数十轮激烈竞拍，合计成交价4552.883万元，较起拍价溢价约35%，且每场拍卖的围观人群都在万人左右。在证券行业激烈整合和业态剧变的当下，牌照的价值在“缩水”，公司本身的价值正接受市场检验。（券商中国）,这家券商股权遭“疯抢” 最高溢价40%！每场拍卖吸引近万人围观 为何这么火？
491,2020-10-02 13:30:48,【美股三大指数期货震荡下挫 纳指期货跌逾2%】美股三大指数期货震荡下挫，截至发稿，道指期货跌1.48%，纳指期货跌2.10%，标普500指数期货跌1.70%。,美股三大指数期货震荡下挫 纳指期货跌逾2%
492,2020-10-02 13:27:54,【美股指期货加速下跌】美股指期货加速下跌，纳指期货跌幅扩大至2%。（界面新闻）,美股指期货加速下跌
493,2020-10-02 13:15:55,【美、布原油期货跌幅扩大至2%】美、布原油期货跌幅扩大至2%，现报37.94美元/桶及40.09美元/桶。（界面新闻）,美、布原油期货跌幅扩大至2%
494,2020-10-02 13:07:43,【富时中国A50指数期货跌逾2%】富时中国A50指数期货震荡下跌，截至发稿，富时中国A50指数期货跌2.06%。,富时中国A50指数期货跌逾2%
495,2020-10-02 13:06:24,【日经225指数短线跳水】日经225指数短线跳水，现跌逾0.6%。（界面新闻）,日经225指数短线跳水
496,2020-10-02 13:05:14,【富时中国A50指数期货跌超2%】富时中国A50指数期货震荡下跌，截至发稿，富时中国A50指数期货跌2.08%。,富时中国A50指数期货跌超2%
497,2020-10-02 13:03:48,【美股指期货短线下挫】美股指期货短线下挫，三大股指期货均跌超1%。,美股指期货短线下挫 三大股指期货均跌超1%
498,2020-10-02 12:58:36,【特朗普确诊新冠】美国总统特朗普发推特称，他和妻子新冠病毒检测呈阳性。（中国日报网）,特朗普确诊新冠
499,2020-10-02 12:51:20,【苹果正打造折叠式iPhone 显示屏会自动修复划痕或凹陷】据美国媒体报道称，苹果申请的折叠屏专利再次浮出水面，而这次比较特别的是，这种屏幕本身可以 “治愈 ”不可避免的磨损。（快科技）,苹果正打造折叠式iPhone 显示屏会自动修复划痕或凹陷
500,2020-10-02 12:48:59,【前8月我国服务贸易逆差大幅减少 显出较强抗冲击能力】1-8月，受新冠肺炎疫情等因素叠加影响，我国服务贸易规模下降，但服务出口表现明显好于进口，贸易逆差减少；知识密集型服务贸易占比持续提高，显示出较强的抗冲击能力。（人民网）,前8月我国服务贸易逆差大幅减少 显出较强抗冲击能力
501,2020-10-02 12:36:52,【广州南站发送客流创十年来历史纪录】记者2日从广州南站获悉，国庆中秋长假首日广州南站发送客流43.7万人次，创下广州南站开通十年以来的最高纪录。（新华网）,广州南站发送客流创十年来历史纪录
502,2020-10-02 12:23:41,【新经济“解锁”新玩法 国庆消费亮点可期】从线上“种草”带动线下“打卡”，到发掘小众景点催生新奇玩法，今年以来呈现出蓬勃发展态势的在线新经济，在自身迎来新机遇的同时，也给消费领域带来新变化。这个假期，新经济助推下的消费亮点格外值得期待。（新华网）,新经济“解锁”新玩法 国庆消费亮点可期
503,2020-10-02 11:55:13,【我国出台大运河文旅融合发展规划】文化和旅游部、国家发展改革委等部门近日印发《大运河文化和旅游融合发展规划》，将从多方面推进大运河文旅产业融合发展，带动大运河沿线经济社会高质量发展。（新华网）,我国出台大运河文旅融合发展规划
504,2020-10-02 11:40:12,【电影《姜子牙》总票房破5亿】根据猫眼专业版数据统计，截至发稿，电影《姜子牙》总票房破5亿，电影《我和我的家乡》总票房为3.68亿，《夺冠》总票房为3.54亿。（证券时报）,电影《姜子牙》总票房破5亿
505,2020-10-02 11:39:32,【大众三季度美国汽车总销量下滑7.6%】据BusinessInsider 10月2日消息，大众三季度美国汽车总销量下滑7.6%至86446辆。（界面新闻）,大众三季度美国汽车总销量下滑7.6%
506,2020-10-02 11:18:14,【美股期货跌势扩大】美股期货跌势扩大，标普500指数期货跌近0.4%。（格隆汇）,美股期货跌势扩大
507,2020-10-02 11:05:13,【特朗普开始自我隔离】美国总统特朗普刚刚发推特称，他和妻子开始自我隔离，正在等待新冠病毒检测结果。 此前特朗普在接受福克斯新闻采访时确认女助理霍普·希克斯确诊感染新冠病毒。（中国日报网）,特朗普开始自我隔离
508,2020-10-02 10:50:46,【钢铁PMI指数四连降：9月旺季不旺 四季度产量或环比下降】据中物联钢铁物流专业委员会最新发布的报告，2020年9月国内钢铁行业PMI指数为43.9%，较上月下降3.1个百分点，连续第四个月下降。今年2月，受新冠疫情影响，当月钢铁PMI指数下降10.5个百分点。随后的3至5月，钢铁行业加快恢复，该指数持续回升。（澎湃新闻）,钢铁PMI指数四连降：9月旺季不旺 四季度产量或环比下降
509,2020-10-02 10:47:14,【富时中国A50指数期货跌近2%】富时中国A50指数期货震荡下跌，截至发稿，富时中国A50指数期货跌1.76%。,富时中国A50指数期货跌近2%
510,2020-10-02 10:41:48,【迪士尼公司宣布裁员2.8万人 美国大企业裁员潮来了吗？】9月29日，美国娱乐巨头迪士尼公司宣布裁员2.8万人让市场颇感震惊。九月份以来，美国大企业裁员此起彼伏，对很多企业来说，这是关键的一个月，因为随着月底联邦援助到期，一些企业恐将跌下财政悬崖。分析人士警告，情况如无改善，大企业的裁员潮将汹涌而来。（央视新闻）,美国大企业裁员潮来了吗？
511,2020-10-02 10:29:48,【阿特斯太阳能获17.8亿元融资 股价一周累涨21%】阿特斯(CSIQ)9月30日宣布，为旗下组件和系统解决方案业务(Module and System Solutions， MSS)子公司——阿特斯阳光电力集团(CSI Solar Co。 Ltd。，“CSI Solar”)达成17.8亿元人民币融资协议(约合2.6亿美元)，成功引进了多家知名机构投资者和战略合作伙伴(第三方投资者)，包括鼎晖投资和元禾重元等。（钛媒体）,阿特斯太阳能获17.8亿元融资 股价一周累涨21%
512,2020-10-02 10:24:15,"【前亚马逊经理及家人被控内幕交易】据财富中文网10月1日消息，美国证券交易委员会（SEC）9月28日透露，亚马逊公司税务部门的一位高级经理拉克莎·博赫拉进行了内幕交易：她伙同丈夫及公公在公司公布财报前通过买卖股票和期权赚取了140万美元。根据与SEC和解协议的条款，博赫拉一家将偿还大约150万美元的非法所得，并另外支付1,106,399美元的罚款。亚马逊未对SEC的公告置评。（界面新闻）",前亚马逊经理及家人被控内幕交易
513,2020-10-02 10:14:41,【全球App第三季度收入同比增长32％超过290亿美元】Sensor Tower初步估计显示，今年第三季度，全球消费者在移动应用上的支出达到293亿美元，同比增长32％，其中苹果App Store为190亿美元；在苹果App Store和Google Play上的应用安装量则攀升至365亿，同比增长23.3%，其中来自苹果App Store的应用为82亿个。（36氪）,全球App第三季度收入同比增长32％超过290亿美元
514,2020-10-02 10:06:58,【财新：9月中国新经济指数降至28.9】受资本投入下降影响，2020年9月万事达卡财新BBD中国新经济指数（NEI）继续下降。财新智库和BBD（数联铭品）10月2日联合发布的数据显示，9月NEI录得28.9，即新经济投入占整个经济投入的比重为28.9%，较8月下降1.6个百分点。资本投入下降是NEI下降主因，本轮招聘总量下降中，小企业及个体户招聘占比快速下降，大型企业下降速度慢于小型企业。（证券时报）,财新：9月中国新经济指数降至28.9
515,2020-10-02 10:04:14,【富时中国A50指数期货跌幅扩大至1%】富时中国A50指数期货跌幅扩大至1%。,富时中国A50指数期货跌幅扩大至1%
516,2020-10-02 09:45:22,【票房纪录再刷新！国庆档盛宴下 小心有骗局】每每出现爆款电影时，就会让人联想到背后的投资“钱景”。同时也出现了很多打着电影投资的幌子，实则是诈骗行为的各种行径。（上海证券报）,票房纪录再刷新！国庆档盛宴下 小心有骗局
517,2020-10-02 09:45:01,【一个月罕见涨价两次！这一化工品上涨动力还有多强？】不但涨价，还没货！什么化工品这么狂？就是近期“涨声一片”的钛白粉。（上海证券报）,一个月罕见涨价两次！这一化工品上涨动力还有多强？
518,2020-10-02 09:39:41,【澳大利亚8月季调后零售销售同比降4%】澳大利亚8月季调后零售销售同比降4%，前值增3.2%。（格隆汇）,澳大利亚8月季调后零售销售同比降4%
519,2020-10-02 09:37:06,【单日狂收7.3亿！国庆档彻底火了 《姜子牙》打破《哪吒》记录】国庆长假首日，猫眼专业版数据显示，国庆假期首日总票房已突破7亿元，《姜子牙》以国庆首日3.58亿元高居首位，领跑国庆档，并刷新了由《哪吒之魔童降世》保持的中国影视动画电影首日票房纪录。《我和我的家乡》《急先锋》分别以2.67亿元和5598万元分列日票房二三名。与此同时，今年国庆长假首日的7.27亿票房，相比2019年长假首日票房8.15亿元，已经恢复到89%，接近九成。（证券时报）,单日狂收7.3亿！国庆档彻底火了 《姜子牙》打破《哪吒》记录
520,2020-10-02 09:25:10,【一定是特别的缘分 134位基金经理重名 出现这些字的最多】如果将全国所有的基金经理聚集在一起开一场party，走廊里喊一声“吴昊”，会有 6 人回头，再喊一声“王鹏”，又有4个人被点名。根据概率学来算，同名同姓的人在中国是普遍存在的。谁还不认识几个王明、张伟？公募基金也不能豁免。（中国证券报）,一定是特别的缘分！134位基金经理重名 出现这些字的最多
521,2020-10-02 09:17:41,【三股连吃3个“一字”跌停 超6万股东“被埋” 发生了什么？】自9月28日开始，*ST界龙、思美传媒、国城矿业3只股票闪崩跌停。9月30日收盘，已经连续两个交易日一字跌停的3只个股继续牢牢封死跌停板。值得注意的是，这三只个股并没有出现重大的利空消息，股价诡异连续跌停引来市场关注。（每日经济新闻）,三股连吃3个“一字”跌停 超6万股东“被埋” 发生了什么？
522,2020-10-02 09:16:47,【孙宏斌为青岛东方影都引入新股东 青岛西发集团持股45%】融创和青岛西海岸发展集团在9月2日共同注册成立了“青岛东方影都产业控股集团有限公司”，核准日期为2020年9月25日，注册资本1000万元，法人代表为汪舵。可查询的资料显示，汪舵为青岛西海岸发展集团的党委副书记、董事及副总经理。（澎湃新闻）,孙宏斌为青岛东方影都引入新股东 青岛西发集团持股45%
523,2020-10-02 09:07:45,【这个大项目！或超6亿人次参与！你贡献了多少？】有数据显示，今年国庆假期到武广高铁沿线城市长沙、武汉等地的外省游客占了6成以上。仅长沙南站就为30多个旅行社预订了高铁团体票，为历年之最。专家预测，8天长假旅游人次可能超过6亿，恢复比例可能达到7到8成。（央视财经）,这个大项目！或超6亿人次参与！你贡献了多少？
524,2020-10-02 09:04:39,【COMEX期银跌幅扩大至逾2%】COMEX期银跌幅扩大至逾2%，报23.75美元/盎司。现货黄金跌破1900美元/盎司，日跌幅近0.3%。（格隆汇）,COMEX期银跌幅扩大至逾2%
525,2020-10-02 09:03:59,【平安金融：银行估值分化格局加剧 龙头溢价持续】宏观经济是对银行股价产生影响的最核心因素，银行股的本质是周期股，回溯2005以来5轮板块趋势性机会，除了14年牛市完全由流动性推动，其余都与经济走势强相关。这也能部分解释银行股的估值从07年之后就长期下行的原因。（平安金融）,银行估值分化格局加剧 龙头溢价持续
526,2020-10-02 09:03:58,【富时中国A50指数期货开盘跌近0.4%】富时中国A50指数期货开盘跌近0.4%。（格隆汇）,富时中国A50指数期货开盘跌近0.4%
527,2020-10-02 08:57:45,【海南天然气管网正式划转至国家管网 海南省管网公司成立】海南日报记者从海南省管网公司获悉，按照国家管网业务划转的安排，10月1日起，海南省天然气管网已正式划转至国家管网，并已于近日成立海南省管网公司。（中国证券网）,海南天然气管网正式划转至国家管网 海南省管网公司成立
528,2020-10-02 08:45:24,【罚缴超7亿！特大操纵期货市场案宣判 这个品种暴涨超30%的背后真相】9月29日，当大家期盼着与家人团聚、共度国庆和中秋佳节的时候，一起特大操纵期货市场案在辽宁省抚顺市中级人民法院一审公开宣判，远大石化有限公司(以下简称远大石化)利用18个账户、跨期现市场操纵PP1609合约价格的真相终于浮出水面。（期货日报）,罚缴超7亿！特大操纵期货市场案宣判 这个品种暴涨超30%的背后真相
529,2020-10-02 08:43:54,【疫情打击需求前景且OPEC产量增加 美油跌超4%】美国WTI 11月原油期货电子盘价格周四(10月1日)收盘下跌1.64美元，跌幅4.08%，报38.58美元/桶。油价周四下跌3%，因全球新增新冠肺炎病例数增加打击了需求前景，且石油输出国组织(OPEC)上月产量增加也令油价承压。（汇通网）,疫情打击需求前景且OPEC产量增加 美油大跌超4%
530,2020-10-02 08:42:11,【彰显国际影响力！境内四家交易所均被纳入ESMA交易后透明度评估正面清单】近日，根据ESMA近期评估意见，大商所全面满足相关标准，已被纳入欧洲证券及市场管理局(ESMA)更新的第三国交易场所交易后透明度评估正面清单，将为欧盟投资者参与大商所市场提供更多便利。（期货日报）,彰显国际影响力！境内四家交易所均被纳入ESMA交易后透明度评估正面清单
531,2020-10-02 08:42:11,【接地气！随报随考 满足当前期货公司高管人才引进需求】据中期协最新消息，期货公司高管人员任职资质测试“随报随考”的首次测试在北京圆满举行。（期货日报）,接地气！随报随考 满足当前期货公司高管人才引进需求
532,2020-10-02 08:41:00,【证监会本周核发4家IPO批文 还有多只募资百亿新股在路上】9月30日晚间，证监会核发了2家公司的IPO(首次公开发行)批文，至此本周总共有4家公司拿到批文。值得注意的是，长假之后，包括蚂蚁集团在内的多只募资超百亿的新股将进行网上发行。,证监会本周核发4家IPO批文 还有多只募资百亿新股在路上
533,2020-10-02 08:37:05,【突发！外盘金属普跌伦铜暴跌超5%伦锌跌超3%】隔夜外盘金属普遍下跌其中伦铜暴跌超5%，伦锌暴跌超3%。截至收盘，伦铜跌5.14%至6342.5美元/吨，伦铝跌1.39%至1738.5美元/吨，伦锌跌3.45%至2320美元/吨，伦镍跌1.17%至14300美元/吨，伦锡涨0.26%至17495美元/吨，伦铅跌1.75%至1795美元/吨。主要是因为佩洛西称白宫提出的刺激方案力度不足，双方仍有重大分歧，对大选前达成协议表示怀疑叠加美国二季度GDP暴跌31.4%，创历史最大跌幅，宏观情绪较为悲观，后续密切聚焦美国新一轮刺激谈判的进展以及即将公布的9月非农就业报告。（SMM）,突发！外盘金属普跌伦铜暴跌超5%伦锌跌超3%
534,2020-10-02 08:32:43,【十一当天全国接待国内游客近亿人次 同比恢复73.8%】记者10月1日从文旅部获悉，国庆中秋假期首日，全国共接待国内游客0.97亿人次，按可比口径同比恢复73.8%；实现旅游收入766.5亿元，按可比口径同比恢复68.9%。（新华视点）,十一当天全国接待国内游客近亿人次 同比恢复73.8%
535,2020-10-02 08:28:11,【中行落地海南自贸港首笔跨境金融区块链服务平台资本项目真实性审核业务】在国家外汇管理局海南省分局的指导和帮助下，中行海南省分行运用跨境金融区块链服务平台成功办理一笔11.07万港币的外汇资本金结汇便利化真实性审核业务。（中国金融新闻网）,中行落地海南自贸港首笔跨境金融区块链服务平台资本项目真实性审核业务
536,2020-10-02 08:27:02,【蚂蚁集团科技业务出海新成果：马来西亚月饼用上蚂蚁链溯源技术】蚂蚁链宣布，与马来西亚当地移动虚拟运营商XOX合作，推出了本地化的供应链溯源服务平台TraX，中小企业可直接在TraX平台实现商品产地、物料溯源信息的透明，提升销量。（华夏时报）,蚂蚁集团科技业务出海新成果：马来西亚月饼用上蚂蚁链溯源技术
537,2020-10-02 08:26:17,【掌握核心科技 吉利汽车如何“俘获”投资者的心?】在环境友好型社会建设的过程中，传统燃油车向新能源车转型是未来的大趋势，汽车“新四化”则是该趋势的具象描述和升级版。吉利汽车则向上响应顶层设计，向下直击行业痛点。（智通财经网）,掌握核心科技 吉利汽车如何“俘获”投资者的心?
538,2020-10-02 08:22:06,【全球首款！50%！这个世界百年难题 他们突破了！】九月中旬，潍柴控股集团有限公司正式发布了全球首款突破50%热效率的商业化柴油机。从世界第一台柴油机诞生到现在的100多年，柴油机的热效率才刚刚提升到46%。有业内人士形容，如果提升至50%，就“犹如人类史上首次百米跑跑进10秒”。然而，中国企业终于领先突破了。（央视财经）,全球首款！50%！这个世界百年难题 他们突破了！
539,2020-10-02 08:18:49,【8块钱就能窥探你家隐私！阿里腾讯上演“安全大战”】无疑，物联网安全的话题已经上升到一个前所未有的高度。因为物联网安全已经不仅涉及到了设备制造商的数据安全，还涉及到了个人隐私安全、个人财产安全，乃至于个人生命安全。（创业邦）,8块钱就能窥探你家隐私！阿里腾讯上演“安全大战”
540,2020-10-02 08:17:07,【37.5%！AMD的x86处理器市场份额14年来最高】毫无疑问，目前AMD的锐龙处理器非常受欢迎，销量也节节攀升。如今第四代锐龙处理器呼之欲出，那么在三代锐龙的加持下，AMD取得了什么杨的成绩呢？Passmark发布了x86处理器市场份额曲线图，AMD已经拿下37.5%。（中关村在线）,37.5%！AMD的x86处理器市场份额14年来最高
541,2020-10-02 08:16:29,【日本东京证交所恢复交易 日经225指数震荡上涨】日本东京证交所恢复交易，日经225指数震荡上涨，截至发稿，日经225指数涨0.54%，报23301.50点。,日本东京证交所恢复交易 日经225指数震荡上涨
542,2020-10-02 08:13:28,【高盛将以25亿美元收购通用汽车信用卡业务】知情人士称，高盛将以大约25亿美元的价格收购通用汽车的信用卡业务。通用汽车的信用卡发行商美国第一资本金融公司（Capital One Financial）与高盛就收购价格达成了一致，预计将在未来几周内敲定交易。这将是高盛去年与苹果推出联名信用卡后，在信用卡领域的第二起重大合作。（界面新闻）,高盛将以25亿美元收购通用汽车信用卡业务
543,2020-10-02 08:10:42,【全球航空发动机巨头宣布系列融资计划 涉及金额达数十亿英镑】当地时间10月1日，欧洲最大的航空发动机企业英国的罗尔斯·罗伊斯公司宣布一系列债权融资计划，其中包括增发20亿英镑新股，发行10亿英镑公司债券以及获得政府担保的借贷方案，以缓解公司深受新冠肺炎疫情危机冲击的财务状况。（央视新闻）,全球航空发动机巨头宣布系列融资计划 涉及金额达数十亿英镑
544,2020-10-02 08:08:45,【中通快递二次上市登陆港交所 依赖电商问题待解决】中通快递在招股书中直言，公司的业务及增长高度依赖于若干第三方电子商务平台，例如阿里巴巴生态系统。公司预期在可预见的将来，仍将受有关第三方电子商务平台的重大影响。例如，为了维持并促进与阿里巴巴的合作，公司或须适应阿里巴巴生态系统中各参与者的需求及规定，例如采用菜鸟网络发起的电子面单。有关需求及规定或会增加公司的业务成本或削弱公司与终端客户的联系。（中新经纬）,中通快递二次上市登陆港交所 依赖电商问题待解决
545,2020-10-02 08:01:29,【日本东京证交所恢复交易 日经225指数开盘涨0.5%】日本东京证交所恢复交易，日经225指数开盘涨0.5%。,日本东京证交所恢复交易 日经225指数开盘涨0.5%
546,2020-10-02 07:55:38,【配套规则加快完善 万亿公募REITs稳起步】基础设施REITs试点标志着境内基础设施公募REITs正式起步。这是基础设施投融资机制的一项重大创新，也是构建多层次资本市场体系的一次全新探索。然而，我们也要清楚地意识到，公募REITs同时带来的巨大挑战。一方面，亟须在试点中摸索出适合我国国情的REITs相关制度，另一方面，也对金融机构投研管理能力提出了更高要求。（中国经营报）,配套规则加快完善 万亿公募REITs稳起步
547,2020-10-02 07:42:00,【国庆中秋假期首日：国内旅游人次近亿 交通运行平稳有序】文化和旅游部发布的数据显示：国庆中秋假期首日，全国共接待国内游客0.97亿人次，按可比口径同比恢复73.8%；实现旅游收入766.5亿元，按可比口径同比恢复68.9%。（人民日报）,国庆中秋假期首日：国内旅游人次近亿 交通运行平稳有序
548,2020-10-02 07:28:54,【单日狂收7.3亿！国庆档彻底火了 《姜子牙》打破《哪吒》记录！这些A股公司要爆发？】久违的长假，在《八佰》30亿票房的预热下，电影院终于迎来“火力全开”的时刻。国庆长假首日，猫眼专业版数据显示，国庆假期首日总票房已突破7亿元，《姜子牙》以国庆首日3.58亿元高居首位，领跑国庆档，并刷新了由《哪吒之魔童降世》保持的中国影视动画电影首日票房纪录。《我和我的家乡》《急先锋》分别以2.67亿元和5598万元分列日票房二三名。与此同时，今年国庆长假首日的7.27亿票房，相比2019年长假首日票房8.15亿元，已经恢复到89%，接近九成。（e公司）,单日狂收7.3亿！国庆档火了 《姜子牙》打破《哪吒》记录！这些A股爆发？
