,datetime,content,title
253,2020-10-04 08:07:54,【《姜子牙》3天破8亿！近100岁的国产动画 背后产业链有多大】截至10月3日17点，国庆档期内全国电影累计票房已经突破15亿元！其中《姜子牙》实时票房狂收1.7亿，上映3天票房破8.34亿，此前上映2天票房就已破6亿，国庆档影片中，它目前的总成绩排名第一。（21世纪经济报道）,《姜子牙》3天破8亿！近100岁的国产动画 背后产业链有多大
254,2020-10-04 08:02:05,【Phone12或将于10月13日发布 10月16日开启预购】在 9 月苹果(AAPL.US)发布会中缺席的iPhone12或将于本月面世。（智通财经网）,iPhone12或将于10月13日发布 10月16日开启预购
255,2020-10-04 07:53:59,【细说数字人民币：央行数字货币会冲击SWIFT系统吗？】数字人民币的讨论风暴，从货币本身延申到了结算支付。有观点认为，央行数字货币将改变未来的贸易结算方式， SWIFT系统终将被数字货币取代。（澎湃新闻）,细说数字人民币：央行数字货币会冲击SWIFT系统吗？
256,2020-10-04 07:34:42,【过去四年城镇新增就业每年保持在一千三百万人以上】人社部统计显示，2016年至2019年，全国累计实现城镇新增就业5378万人。到2019年末，全国就业人员总量达77471万人，其中城镇就业人员44247万人，比2015年底增加9.5%。失业率保持低位运行，低于5.5%的控制目标。（人民日报）,过去四年城镇新增就业每年保持在一千三百万人以上
257,2020-10-04 07:22:45,【国庆期间重要财经资讯汇总（更新中）】国庆期间重要财经资讯有：特斯拉国产Model 3起步价将降至24.99万元；华为全国招聘芯片博士，轮值董事长换人；黄金周大片来袭，《姜子牙》打破国产动画首日票房纪录；央行权威报告来了！收入信心指数提升，超20%居民未来3个月计划买房；新一轮医保谈判箭在弦上，728个药品争跃“龙门”。,国庆期间重要财经资讯汇总（更新中）
258,2020-10-04 07:14:09,【保产业链供应链稳定 加快形成新发展格局】今年以来，中央多次提出推动形成双循环新发展格局，做好“六稳”工作，落实“六保”任务，保产业链供应链稳定。那么，形成新发展格局是基于什么背景提出的？产业链供应链的维系对于形成新发展格局具有怎样的意义？在保产业链供应链稳定的基础上，如何提升产业链供应链的现代化水平？为此，经济日报记者采访了中国人民大学校长刘伟。（经济日报）,保产业链供应链稳定 加快形成新发展格局
259,2020-10-04 06:55:09,【医保跨省就医直接结算669万人次 医保更便利报销更省力】截至6月底，共有669万人次享受到跨省异地就医直接结算的便利。其中，跨省住院费用累计直接结算535万人次；京津冀、长三角和西南五省份3个地区试点门诊费用跨省直接结算，累计直接结算134万人次。（人民日报）,医保跨省就医直接结算669万人次 医保更便利报销更省力
260,2020-10-04 06:35:54,【弃煤大潮持续 韩国KB金融集团不再为煤电项目提供融资支持】韩国大型金融集团之一的KB金融集团近日宣布将退出煤电融资，承诺不再为全球范围内的新建燃煤发电厂建设提供项目融资及债券承销。（澎湃新闻）,弃煤大潮持续 韩国KB金融集团不再为煤电项目提供融资支持
261,2020-10-04 06:15:13,【盒马推仓储式会员店：“更懂中国人的胃”能否反击Costco？】2019年Costco在上海落地后，业界发现其仓储式会员店模式的优势在于提供优质低价的商品，在牺牲SKU数量的同时，通过聚焦带来高单品销售量及周转率，从而实现降本增效。目前Costco会员店和山姆会员店正计划在江浙沪地区进一步扩张。盒马推出的X会员店则提供了更少的SKU和更多的自有商品，同时主打本地化需求，号称“更懂中国人的胃”。盒马推出的会员店新业态能否在大本营实现反击？（新京报）,盒马推仓储式会员店：“更懂中国人的胃”能否反击Costco？
262,2020-10-04 05:55:13,【广州港晒成绩单 前三季度商品车装卸量突破100万辆】国庆假期，广州港集团传来好消息，9月新沙、南沙商品汽车单月装卸总量及内贸装卸量均创历史新高。9月份商品汽车装卸完成16.3万辆，同比增加3.5万辆，增长27.3%；其中外贸商品车完成3.3万辆，增长26.9%。前三季度累计完成商品车装卸量达到100.9万辆。100辆国内新能源汽车领先代表小鹏汽车最新款型首次从广州港出口欧洲。（广州日报）,广州港晒成绩单 前三季度商品车装卸量突破100万辆
263,2020-10-04 05:36:25,【苏富比香港秋拍开幕 拍品总估价逾23亿港元】苏富比香港秋季拍卖会3日开幕，为期一周的拍卖会共呈献2000项拍品，总估价逾23亿港元。首日举行的两场洋酒拍卖专场总成交价约7280万港元。（新华网）,苏富比香港秋拍开幕 拍品总估价逾23亿港元
264,2020-10-04 05:16:12,【房源近三千 推货创新高 “十一”前夕及假期广州一手住宅开盘、加推个盘19个】数据显示，今年9月至今，广州已累计新批超6000宗单位，过去开发商都集中在国庆前夕才抢跑推货，而今年进入9月以来，已经有多个大盘率先入市。对于购房者来说，过去两年广州供应的涉宅用地总建面均达1200万㎡左右，今年迄今为止也卖出了近900万㎡的涉宅用地，这意味包括今年在内接下来的一段时间市场上会有很多的新楼盘亮相，随行就市的选择会有很多，所以业内人士表示，购房者可以淡定一些。（广州日报）,房源近三千 推货创新高 “十一”前夕及假期广州一手住宅开盘、加推个盘19个
265,2020-10-04 04:55:30,【东莞市前8月实际引进内外资同比增长近五成】从东莞市有关部门了解到，该市今年1—8月共引进内外资项目2507宗，协议投资金额1448亿元，同比增长12.31%，实际投资金额873亿元，同比增长48.2%；完成固定资产投资1362.1亿元，增长10.5%。其中，工业投资增长19.9%，拉动固投增长6.3个百分点。数据表明，东莞市依然是备受全球资本欢迎的投资热土，经济发展后劲十足。（中国发展网）,东莞市前8月实际引进内外资同比增长近五成
266,2020-10-04 04:36:08,【触目惊心！银行女客户经理为厅官父亲“洗黑钱”6400多万 惊人细节曝光！法院这样判了】中国裁判文书网公布的一起掩饰、隐瞒犯罪所得案，披露了银行一客户经理为担任官员的父亲“洗黑钱”的细节。（中国基金报）,触目惊心！银行女客户经理为厅官父亲“洗黑钱”6400多万 惊人细节曝光！法院这样判了
267,2020-10-04 04:13:10,【6个月、100名员工 拆拆拆！行业“时运不济” 却把这门生意带火了！】受疫情影响，全球航运业遭遇严重冲击，为了节省开支，越来越多停止运营的船只被送往土耳其、印度、孟加拉国等地进行拆解。在此期间，土耳其的船舶拆卸产业迎来逆势发展。（央视财经）,6个月、100名员工 拆拆拆！行业“时运不济” 却把这门生意带火了！
268,2020-10-04 03:53:19,【广东“十三五”建成保障性住房27.3万套】据悉，广东已连续4年提前超额完成国家下达的住房保障目标任务。“十三五”以来，广东省共新开工建设棚户区改造住房20.1万套、保障性住房4.9万套，基本建成保障性安居工程住房27.3万套；全省采用实物保障与租赁补贴相结合的住房保障方式，为超过106.6万人实现安居梦。（羊城晚报）,广东“十三五”建成保障性住房27.3万套
269,2020-10-04 03:34:21,【数字产业赋能官渡经济社会高质量发展 高起点高标准建设数字官渡】价格监测、商品指数、社会治理……作为中国百强区、昆明城市新中心、中国(云南)自贸试验区昆明片区主战场，官渡区近年来充分发挥交通便捷、环境宜人、产业突出、经济实力强的优势，主动搭乘“数字云南”的快车，先行先试，营造“产业聚集、平台多元、投资活跃”的营商、创业环境，助力产业积极转型、城市高效建管、民生精细服务，积极推动全区经济社会各领域全面数字化。（昆明日报）,数字产业赋能官渡经济社会高质量发展 高起点高标准建设数字官渡
270,2020-10-04 03:12:15,【新车险降没降价？有车主抱怨保费不降反升 什么情况？保费为何上涨容易下降难？】根据改革初衷，本次车险改革的目标是“降价、增保、提质”，要在短期内对消费者做到“三个基本”：价格基本只降不升，保障基本只增不减，服务基本只优不差——也就是传说中的“加量不加价”。根据行业普遍预测，车险保费规模下降将在15%-20%之间。（券商中国）,新车险降没降价？有车主抱怨保费不降反升 什么情况？保费为何上涨容易下降难？
271,2020-10-04 02:51:25,【疫情叠加石油出口急剧下降 中东企业如何求生存？】经济学人智库(EIU)在最新一期报告中预测，今年全球商品贸易量将减少20%，在整个中东，国际贸易也将下降两位数：海湾合作委员会(GCC)国家的进口量将在2020年下降10%，随后在2021年恢复3-4%的温和增长。（第一财经）,疫情叠加石油出口急剧下降 中东企业如何求生存？
272,2020-10-04 02:33:45,【火爆异常！传统基建迎来新周期？2万亿净投放来临 钢企开足马力 板块要爆？】根据国家统计局的最新数据，8月份国内粗钢日产量再创历史新高，连续3个月保持在300万吨以上水平，钢铁行业利润增长68.3%。而在今年前8个月，黑色金属产业链增长幅度仅次于计算机电子设备制造行业，成为规模以上工业全行业增长的第二位。（券商中国）,火爆异常！传统基建迎来新周期？2万亿净投放来临 钢企开足马力 板块要爆？
273,2020-10-04 02:14:19,【3.85亿元！这家旅游公司被阿里“相中” 究竟有何魔力？】近日，众信旅游集团股份有限公司发布公告称，阿里巴巴(中国)网络技术有限公司与众信旅游实际控制人冯滨签署《股份转让协议》，通过协议转让方式受让冯滨所持有的众信旅游4547.03万股股份，占公司股份总数约5%，股份转让价款为3.85亿元。（时间财经）,3.85亿元！这家旅游公司被阿里“相中” 究竟有何魔力？
274,2020-10-04 01:52:46,【联合国人口基金会：哈萨克斯坦将步入老龄化社会】国际文传电讯社10月2日报道称，联合国人口基金会驻哈萨克斯坦代表莫尔达古洛娃表示，联合国2019年年初的数据显示，60岁和65岁以上居民占哈萨克斯坦人口的比例分别为11.6%和7.5%，相当于上世纪90年代日本的人口结构。这说明哈萨克斯坦正处于人口老龄化的初始阶段。据联合国预测，2050年65岁以上居民占哈人口的比例将增加一倍。（每日经济新闻）,联合国人口基金会：哈萨克斯坦将步入老龄化社会
275,2020-10-04 01:31:10,【博世：新能源车续航增6%碳化硅功率器件亮相 “三化”投资预计超10亿欧元】“突破性技术博世一直也在投入，只要我们预测未来内燃机车还存在，我们的投入是持续的，但同时也要加大对新技术的投入。博世在三化的投入，今年有10亿欧元。新的技术一旦出现，不能说博世就终结了传统的技术，要持续往下走。” 日前，博世(中国)投资有限公司执行副总裁徐大全对21世纪经济报道记者表示。 （21世纪经济报道）,博世：新能源车续航增6%碳化硅功率器件亮相 “三化”投资预计超10亿欧元
276,2020-10-04 01:11:39,【浙江“海淘会”在杭举办 近千位海外采购商参加对接】10月3日，在浙江省商务厅的大力支持下，2020浙江国际优品“海淘会”在杭州和平国际会展中心举行。本次展会以“内外循环、双线互联”为主题，通过展会的品牌推广、主题论坛、抖音直播、网红打卡、浙江出口网上交易会系列站等形式，帮助外贸企业对接国际市场。（浙江新闻客户端）,浙江“海淘会”在杭举办 近千位海外采购商参加对接
277,2020-10-04 00:52:32,【广东省精密仪器设备产业将在五年内冲击3000亿元】9月28日，广东发布《广东省培育精密仪器设备战略性新兴产业集群行动计划(2021-2025年)》。该行动计划有何亮点？未来将会给行业带来怎样的新趋势？羊城晚报全媒体记者对此进行了梳理。（金羊网）,广东省精密仪器设备产业将在五年内冲击3000亿元
278,2020-10-04 00:32:03,【车市迎“金九银十” 多家4S店让利促销】“双节”期间，经销商4S店备足政策，开启放价促销。日前，新京报贝壳财经记者在探访了北京多家汽车品牌的4S店后了解到，汽车经销商的到店客流量有所回暖，各品牌都有不同程度的终端优惠。总体来看，美系车优惠幅度大，日系中本田和丰田优惠力度相对较小，德系、韩系和自主品牌汽车的优惠力度多在1万-3万元之间。（新京报）,车市迎“金九银十” 多家4S店让利促销
279,2020-10-04 00:11:02,【市场动荡避险情绪抬升 四季度重新进入布局黄金时点 机构提早埋伏】10月2日，现货黄金由涨转跌，尾盘失守1900关口，收盘1898.51美元/盎司。需要注意到，国庆节日前夕，A股贵金属板块已现小幅波动，出现资金逃离观望的现象。9月30日，贵金属板块整体下跌0.99%。其中，仅4只概念股上涨。（华夏时报）,市场动荡避险情绪抬升 四季度重新进入布局黄金时点 机构提早埋伏
280,2020-10-03 23:53:20,【中国旅游市场复苏强劲 提振全球经济信心】中国交通运输部统计数据显示，国庆节首日，全国铁路、公路、水路、民航发送旅客总量6586.23万人次，环比增长21.02%，同比下降28.11%。各种交通运输方式旅客发送量环比均出现较大幅度增长。（中国新闻网）,中国旅游市场复苏强劲 提振全球经济信心
281,2020-10-03 23:33:48,【建发物业赴港IPO，在管面积2170万平方米】9月30日晚，建发物业发展集团有限公司在港交所递交招股书，中国国际金融香港证券有限公司为独家保荐人。（界面新闻）,建发物业赴港IPO 在管面积2170万平方米
282,2020-10-03 23:15:35,【券商：25只个股上涨空间仍超50%！9月券商研报首次覆盖198只个股】随着A股市场IPO稳步提速，沪深两市上市公司总数已达4056家，可供投资者选择的标的越来越多。投资者该如何把握？券商研报或可提供一些参考。（中国证券报）,券商：25只个股上涨空间仍超50%！9月券商研报首次覆盖198只个股
283,2020-10-03 22:57:05,【9月百强房企销售同比增长29%】进入下半年以来，各大房企紧抓销售窗口期，积极营销去化。克而瑞统计显示，百强房企第三季度的操盘销售规模同比增长超28%，较上半年有明显恢复。（信息时报）,9月百强房企销售同比增长29%
284,2020-10-03 22:40:54,【日本亚航难以应对资金短缺 决定退出航空市场】疫情暴发以来，日本航空业遭受了前所未有的冲击。据日本媒体报道，由于经营困难，日本亚洲航空公司近日已决定终止航空业务，这也是疫情暴发以来第一家将要退出日本市场的航空公司。（央视财经）,日本亚航难以应对资金短缺 决定退出航空市场
285,2020-10-03 22:23:25,【AMD处理器在Steam平台份额创历史纪录 首次突破25%】AMD目前处于历史上最好的时期，比K8时期都要繁荣，市场份额已达37.5%。现在Steam平台的份额也首次突破25%，又创造了一次纪录。在9月份的CPU市场份额中，Intel CPU跌破75%，最新份额74.24%，下滑了0.85个百分点。与之对应的是，AMD份额首次超过25%，达到了25.75%，增加了0.84个百分点。（界面新闻）,AMD处理器在Steam平台份额创历史纪录 首次突破25%
286,2020-10-03 22:05:33,【湖北4A级以上景区持续火爆 个性化体验项目受青睐】据湖北省文旅厅统计，自8月8日，“与爱同行·惠游湖北”活动启动以来，全省共接待游客1924.4万人次，外省游客440.3万人，组接团游客459.4万人次，超去年同期约178.8万人次(以56天计)，是去年同期的163.71%。（中国新闻网）,湖北4A级以上景区持续火爆 个性化体验项目受青睐
287,2020-10-03 21:47:17,【国庆长假定制游小众游兴起！北上广深杭订单最多】疫情趋稳，8天长假让很多人的出游梦想变成了现实。相比于人山人海的大热景点，今年假期，熟人相约的定制游、人少景美的小众游热度明显提升。（央视网）,国庆长假定制游小众游兴起！北上广深杭订单最多
288,2020-10-03 21:30:59,【加纳将在华为的助力下于2021年9月之前实现移动通信覆盖率从83%大幅提高至95%】通过加纳电子通信投资基金(GIFEC)，加纳通信部(MoC)已与华为签定新的合同。根据合同协议，加纳将在华为的助力下于2021年9月之前实现移动通信覆盖率从目前的83%大幅提高至95%，新增覆盖人口约340万。（界面新闻）,加纳将在华为的助力下于2021年9月之前实现移动通信覆盖率从83%大幅提高至95%
289,2020-10-03 21:20:26,【公安部交管局：全国道路交通流量有所下降但仍处高位运行】据公安部交管局选取的38条高速公路200个重要通道流量监测情况看，10月3日0时至16时流量环比下降4.9%，与去年同期相比下降10.9%。预计4日起主干路网流量较3日有所回落，但旅游景区、城市郊区周边道路以及主要高速公路道路流量将继续保持高位状态。（界面新闻）,公安部交管局：全国道路交通流量有所下降但仍处高位运行
290,2020-10-03 21:20:01,【公安部交管局：全国道路交通流量有所下降但仍处高位运行】据公安部交管局消息，国庆中秋假期第三天，全国道路交通流量比2日有所下降，但仍处于高位运行，截至3日17时，全国主干公路通行正常，除京津冀、长三角、珠三角地区部分高速公路及京港澳高速、沪蓉高速、沪渝高速、福银高速、大广高速局部路段因流量大出现通行缓慢外，未发生长时间长距离交通拥堵，道路交通安全形势总体平稳。预计4日起主干路网流量较3日有所回落，但旅游景区、城市郊区周边道路以及主要高速公路道路流量将继续保持高位状态。（界面新闻）,公安部交管局：全国道路交通流量有所下降但仍处高位运行
291,2020-10-03 21:01:32,【中企承建的安哥拉坎邦迪公路竣工】安哥拉马兰热消息：由中国铁建二十局承建的安哥拉北部马兰热省坎邦迪公路2日竣工。安哥拉公共工程和国土规划部部长塔瓦雷斯·德·阿尔梅达在当天举行的竣工剪彩仪式上表示，中国企业高质量高标准完成了建设任务，希望各方继续努力，共同为安哥拉的基础设施建设贡献力量。（新华社）,中企承建的安哥拉坎邦迪公路竣工
292,2020-10-03 20:56:43,【日本九州岛发生5.2级地震】据欧洲地中海地震中心，日本九州岛发生5.2级地震。（界面新闻）,日本九州岛发生5.2级地震
293,2020-10-03 20:40:18,【文旅部将加派7个工作组赴地方安全检查指导】记者3日获悉，文旅部从10月3日起陆续加派7个工作组赴地方，对全国重点地区进行安全检查指导。要求切实把安全工作抓细抓实，严防各类事故发生，全力保障假日文化和旅游市场安全有序。对存在风险隐患的立即整改，对达不到安全要求的坚决停止运营。文旅部要求，发生安全事故要第一时间报告，不得迟报和瞒报。各地要对文化和旅游经营场所、设施设备等再次全面排查，全覆盖、过筛子，坚决不留死角。（新华社）,文旅部将加派7个工作组赴地方安全检查指导
294,2020-10-03 20:29:34,【湖南严禁用财政资金超标准建设滨河（江）风光带】在水利建设中，部分地区近年来存在超标准建设滨河(江)风光带等现象。近日，湖南省水利厅、湖南省发展和改革委员会等部门联合发布《关于进一步规范城市防洪堤建设与滨河(江)风光带建设的实施意见》，提出力争到2025年湖南现有县级以上城市防洪圈闭合达标，规定在防洪堤建设中严禁利用财政资金建设亲水平台、观景台、园林景观等附属工程，在城市防洪圈闭合达标前，严禁建设亲水平台、观景台、园林景观等附属工程。（新华网）,湖南严禁用财政资金超标准建设滨河（江）风光带
295,2020-10-03 20:16:50,【上海今日主要景点客流同比恢复82%】今日，上海全市150多家主要旅游景区(点)客流同比恢复82%，但各文化和旅游公共服务中心接待人次同比减少60.4%。（界面新闻）,上海今日主要景点客流同比恢复82%
296,2020-10-03 19:58:39,【我国科学家仿贝壳研制出“超强韧”绿色材料】近期，中国科学技术大学俞书宏院士团队受天然贝壳启发研制出一种新型薄膜材料，在强度、韧性、透光性等方面表现出远超传统塑料的力学与光学性能，埋进土壤中约两个月即可无污染降解，有望成为柔性电子器件等领域的理想材料。（界面新闻）,我国科学家仿贝壳研制出“超强韧”绿色材料
297,2020-10-03 19:50:42,【10月3日周六《新闻联播》要闻8条】今天《新闻联播》的主要内容有：1、习近平同新加坡总统就中新建交30周年互致贺电，李克强同新加坡总理互致贺电。2、习近平向特朗普总统致慰问电。3、【权威访谈·努力构建新发展格局】着力提升金融服务新发展格局的能力。4、连续48天无本土新增新冠肺炎确诊病例。5、假期第三天，全国铁路客流继续保持高位运行。6、国家森防办、应急部部署森林草原灭火工作。7、多国政要，官员庆祝新中国成立71周年。（界面新闻）,10月3日周六《新闻联播》要闻8条
298,2020-10-03 19:35:44,【小众游成新趋势 甘肃等冷门旅游地火了】疫情趋稳，8天长假，让很多人的出游梦想变成了现实。相比于人山人海的大热景点，今年假期，熟人相约的定制游、人少景美的小众游热度明显提升。某旅游平台的数据显示，和去年国庆当天相比，今年长假首日，一单一团、专车专导的“私家团”服务人次，增长40%了以上。其中，从北、上、广、深、杭出发的定制游订单排名全国前五位，目的地主要为内蒙古、甘肃、青海、云南等省份。（央视财经）,小众游成新趋势 甘肃等冷门旅游地火了
299,2020-10-03 19:21:34,【Airbnb计划12月IPO融资约30亿美元】据知情人士周五（2日）透露，房屋租赁初创企业Airbnb公司计划在今年12月进行首次公开募股（IPO），筹资约30亿美元，以利用新冠疫情席卷旅游业后其业务意外强劲复苏的机会。（界面新闻）,Airbnb计划12月IPO融资约30亿美元
300,2020-10-03 19:09:18,【刘昊然主演电影累计票房超100亿 成中国电影市场最年轻的百亿影人】据猫眼专业版数据显示，刘昊然主演电影累计票房超100亿，成为中国电影市场最年轻的百亿影人。截至10月3日14:35，《我和我的家乡》总票房破7亿。（界面新闻）,刘昊然主演电影累计票房超100亿 成中国电影市场最年轻的百亿影人
301,2020-10-03 18:43:13,【10月2日全国发送旅客6298.47万人次】10月2日，全国铁路、公路、水路、民航发送旅客总量6298.47万人次，环比下降4.37%，同比下降28.85%。（界面新闻）,10月2日全国发送旅客6298.47万人次
302,2020-10-03 18:24:04,【湖北旅游持续升温 30家重点景区单日接待31.1万人次】 “十一”黄金周前两天，湖北全省旅游市场显现浓浓暖意，群众出游热情高涨。2日当天，湖北30家重点景区共接待游客31.1万人次，接近去年同期水平，旅游综合收入恢复到去年同期的85.5%。（界面新闻）,湖北旅游持续升温 30家重点景区单日接待31.1万人次
303,2020-10-03 18:22:36,【化工巨头亨斯迈：还会在中国有更多投资 关注聚氨酯下游应用】 “对于行业景气度的判断，我始终抱比较乐观的态度，因为很多事件上的需求可以延后，但不会被消灭。”亨斯迈聚氨酯事业部亚太区总裁潘律民近日表示，按过去经验来看，化工行业明年还是会有一个比较好的恢复期，需求和原材料价格都将高于今年。（界面新闻）,化工巨头亨斯迈：还会在中国有更多投资 关注聚氨酯下游应用
