,datetime,content,title
0,2020-05-21 23:57:54,【在岸人民币兑美元夜盘收跌236点】周四在岸人民币兑美元夜盘收报7.1166，较上一交易日夜盘收跌236点。成交量279.42亿美元，较上一交易日减少8亿美元。,在岸人民币兑美元夜盘收跌236点
1,2020-05-21 23:42:19,【第三家外资 富达国际申请公募基金牌照】今年4月1日起，公募基金正式取消外资持股比例限制，多家海外资管巨头随后开始递交设立公募基金公司的申请。（财经网）,第三家外资 富达国际申请公募基金牌照
2,2020-05-21 23:40:11,【欧股全线收低 德国DAX指数跌1.43%】周四欧股全线收低，德国DAX指数跌1.43%报11062.74点，法国CAC40指数跌1.17%报4444.34点，英国富时100指数跌0.55%报6033.68点。,欧股全线收低 德国DAX指数跌1.43%
3,2020-05-21 23:27:40,【道指跌超200点】道指跌超200点，航空股逆市上涨，波音上涨3.8%。,道指跌超200点
4,2020-05-21 23:27:05,【从明星股坠落到垃圾股 被立案调查的暴风集团恐要凉了】乐视网前脚刚被终止上市，暴风集团便紧随其后被立案调查。相似的起点，是否也将走向一样的终点？5月20日晚，暴风集团公告称，因公司未按期披露定期报告，涉嫌信息披露违法违规，被证监会立案调查。（第一财经）,从明星股坠落到垃圾股 被立案调查的暴风集团恐要凉了
5,2020-05-21 23:26:59,【多省份集中加码新基建 合理规划成为新课题】近期，新基建的重要性被决策层频频提及，各地也在集中加码新基建项目。这其中既有疫情外部冲击之下，稳增长与托底经济的重要考量，也有深化中国数字经济技术优势、培养未来中国经济新增长点的新期待。（第一财经）,多省份集中加码新基建 合理规划成为新课题
6,2020-05-21 23:25:10,【能源板块领跌】在标普500指数11大板块中，能源板块领跌，跌幅达1.75%，信息技术板块、材料板块、医疗保健板块、房地产板块跌超1%。,美股能源板块领跌
7,2020-05-21 23:22:27,【瑞幸咖啡盘中跌破2美元】瑞幸咖啡盘中跌破2美元，跌幅近30%。,瑞幸咖啡盘中跌破2美元
8,2020-05-21 23:19:19,【WTI原油期货涨幅缩窄至1%】WTI原油期货涨幅缩窄至1%，现报33.84美元/桶；布伦特原油期货涨1.3%，报36.22美元/桶。,WTI原油期货涨幅缩窄至1%
9,2020-05-21 23:13:22,【纳指跌超1%】道指跌超100点，纳指跌超1%。中概股中，瑞幸咖啡跌超28%，该股昨日首日复牌跌超35%，今年迄今该股累跌近95%。虎牙跌超13%，斗鱼跌超6%。美股科技股集体下跌，特斯拉、亚马逊跌超1%，Facebook逆市涨超1%。芯片股集体下跌，恩智浦跌超5%。,纳指跌超1%
10,2020-05-21 23:09:17,【道指跌幅超过100点】道指跌幅超过100点，苹果目前跌0.5%，波音维持超过5%的涨幅。,道指跌幅超过100点
11,2020-05-21 23:01:28,【现货钯金跌4.45%】现货钯金跌4.45%至1992.40美元/盎司；现货铂金跌3.58%，报830.6美元/盎司。,现货钯金跌4.45%
12,2020-05-21 22:52:37,【中国长城与腾讯云计算达成战略合作】据中国长城消息，5月21日下午，中国长城科技集团股份有限公司与腾讯云计算(北京)有限责任公司在腾讯集团深圳全球总部大厦进行战略合作签约。双方携手后，将优势共享、资源共享、平台共享，在云计算、网络应用、安全软件、自主安全电脑等领域广泛、深入合作，探索出央企和民营企业做强自主安全网信事业的新模式，助推网络强国建设。 （e公司）,中国长城与腾讯云计算达成战略合作
13,2020-05-21 22:48:11,【英国五年期国债收益率跌穿零】英国五年期国债收益率跌穿零，为历史上首次。（第一财经）,英国五年期国债收益率跌穿零
14,2020-05-21 22:47:08,【COMEX黄金期货跌幅扩大至2.0%】COMEX黄金期货跌幅扩大至2.0%，报1715.9美元/盎司。,COMEX黄金期货跌幅扩大至2.0%
15,2020-05-21 22:46:18,【比特币跌破9000美元】交易平台Bitstamp报价显示，比特币跌破9000美元，刷新5月13日以来新低。,比特币跌破9000美元
16,2020-05-21 22:44:58,【武汉启动编制《疫后重振规划》】5月21日从武汉市自然资源和规划局获悉，该市已启动《疫后重振规划》编制工作，并召开全国专家咨询会，将用一整套规划方案的形式推动武汉重振复苏。（湖北日报）,武汉启动编制《疫后重振规划》
17,2020-05-21 22:40:02,【美元指数DXY短线走低10个点】美元指数DXY短线走低10个点，现报99.34。,美元指数DXY短线走低10个点
18,2020-05-21 22:37:16,【现货白银日内跌幅达3%】现货白银日内跌幅达3%，现报16.93美元/盎司。现货黄金跌至1720美元/盎司下方，刷新一周低位，日内跌幅达1.60%。,现货白银日内跌幅达3%
19,2020-05-21 22:24:48,【美国纽约联储主席：很难知道美国经济何时会复苏 失业率还会恶化】美国纽约联储主席、FOMC常任票委约翰·威廉姆斯(John Williams)21日表示，美国的经济未来将取决于疫情的发展，经济复苏的形式和时间尺度都存在不确定性，在有更清晰的看法之前，还需要“一段时间”。（界面新闻）,美国纽约联储主席：很难知道美国经济何时会复苏 失业率还会恶化
20,2020-05-21 22:15:06,【金融圈刷屏！48岁的他今天开始执掌10万亿大银行】在行长一职空缺近半年后，交行将迎来新任行长，中投公司副总经理、首席风险官刘珺补位。刘珺出生于1972年，现年48岁，拥有美国俄克拉荷马州东北州立大学工商管理硕士学位、香港理工大学工商管理博士学位。“70后”刘珺将成为六大行行长中最年轻的一位。（每日经济新闻）,金融圈刷屏！48岁的他今天开始执掌10万亿大银行
21,2020-05-21 22:03:40,【行情】瑞幸咖啡跌幅扩大至20%。,瑞幸咖啡跌幅扩大至20%
22,2020-05-21 22:03:15,【现货黄金下破1730美元/盎司 现货白银再度跌超2%】现货黄金下破1730美元/盎司，日内跌近1%；现货白银再度跌超2%，现报17.09美元/盎司。,现货黄金下破1730美元/盎司 现货白银再度跌超2%
23,2020-05-21 22:01:49,【美国4月成屋销售总数年化录得433万户】美国4月成屋销售总数年化录得433万户，为2011年9月以来最低。（界面新闻）,美国4月成屋销售总数年化录得433万户
24,2020-05-21 22:01:04,【安车检测：两股东已累计减持约2.5%股份】安车检测(300572)5月21日晚间公告，公司股东华睿德银已累计减持公司股份285.79万股，占公司总股本的1.4758%；股东华睿中科已累计减持公司股份196.34万股，占公司总股本的1.0139%。二者为一致行动人。（e公司）,安车检测：两股东已累计减持约2.5%股份
25,2020-05-21 21:56:21,【口风突变 英国准备拥抱负利率了？】英国负利率的闸门将开未开，又更松动了一些。不管是有意为之，还是奇妙巧合，官方关于负利率的暧昧表态和实际行动，正不断推升市场对于英国实施负利率的预期，引发英国大众对负利率将在近期变为现实的想象。（上海证券报）,口风突变 英国准备拥抱负利率了？
26,2020-05-21 21:51:00,【医药板块持续上涨 但机构发出不同声音】上半年领涨两市、频创新高的医药板块，已经让不少机构悄悄萌生退意。“从基本面、估值及资金面来看，代表着确定性的医药等板块已接近历史极值，伴随着行业中一些边际放缓信号，以及其他行业的景气度加快复苏，需警惕资金筹码松动造成的行业风格的切换。”一位私募基金管理人公开表示。（上海证券报）,医药板块持续上涨 但机构发出不同声音
27,2020-05-21 21:48:54,【美国5月Markit服务业PMI初值36.9】美国5月Markit服务业PMI初值36.9，预估为32.3，前值为26.7。美国5月Markit制造业PMI初值39.8，预估为39.5，前值为36.1。（界面新闻）,美国5月Markit服务业PMI初值36.9
28,2020-05-21 21:47:44,【*ST华塑：董事长承诺公司召开董事会审议定增募资议案前离职】*ST华塑(000509)5月21日晚间公告，公司实际控制人、董事长李雪峰出具书面《承诺函》，称其于2019年10月17日收到中国证监会《调查通知书》，目前尚未收到调查结果，为消除上述调查对上市公司本次非公开发行股票的影响和障碍，自愿在上市公司召开审议本次非公开发行股票相关议案的董事会前，辞去公司董事长及董事职务。此前公司曾公告称筹划非公开发行股票，或将导致公司实控人发生变更。（e公司）,*ST华塑：董事长承诺公司召开董事会审议定增募资议案前离职
29,2020-05-21 21:45:15,【农业农村部发出倡议 推动茶产业发展和茶文化传播】5月21日是首个“国际茶日”。农业农村部部长韩长赋发表视频致辞，就推动茶产业发展和茶文化传播提出三点倡议：一是狠抓质量，坚持为民兴茶，提高茶叶生产加工标准化、优质化、绿色化水平，打造一批品质过硬、消费者喜爱的放心茶叶品牌，大力发展茶叶电商、直播带货、茶乡旅游等新产业新业态；二是引导消费，提倡健康饮茶；三是扩大交流，践行开放促茶，共同构建公平开放的茶产品贸易环境，多层次多渠道开展茶文化交流合作。（界面新闻）,农业农村部发出倡议 推动茶产业发展和茶文化传播
30,2020-05-21 21:43:42,【俄财政部表示将大量发行联邦贷款债券】据俄罗斯卫星通讯社5月21日报道，俄罗斯财政部副部长莫伊谢耶夫在俄罗斯商业周活动框架内举办的“俄金融银行系统：反危机措施和未来前景”的论坛上表示，由于新冠肺炎疫情，政府用于支持经济和公民发展的支出增加，因此俄罗斯将大幅度增加联邦贷款债券（OFZ）的发行量。（界面新闻）,俄财政部表示将大量发行联邦贷款债券
31,2020-05-21 21:40:09,【百度一季报解读：流量增长亮眼、广告收入却降19% 是否真的被低估？】近日，百度发布2020年第一季度财报，期内总营收为225亿元(约31.8亿美元)，同比下降7%，环比下降22%；归属百度净利润为4100万元，去年同期为亏损3.27亿元；非美国通用会计准则GAAP下的净利润为30.82亿元，同比增长219%，但环比下降66%。百度业绩不算亮眼，但依然超过此前的分析师预期。（时间财经）,百度一季报解读：流量增长亮眼、广告收入却降19% 是否真的被低估？
32,2020-05-21 21:34:00,【英国高校预计失去23万生源 或将欠收61亿英镑】据英国咨询机构预计，2020到2021学年英国大约将失去23万生源，将给英国高校带来高达24.72亿英镑的学费直接损失，行业整体经济损失更将高达61亿英镑。（界面新闻）,英国高校预计失去23万生源 或将欠收61亿英镑
33,2020-05-21 21:30:13,【美股三大股指小幅低开 百度跌逾1%】美股三大股指小幅低开，道指跌0.17%，标普500跌0.06%，纳指跌0.01%，瑞幸咖啡跌近10%，昨日复牌首日收跌逾35%。百度跌逾1%。,美股三大股指小幅低开 百度跌逾1%
34,2020-05-21 21:28:49,【中顺洁柔：终止回购公司股份 已回购2768万元】中顺洁柔(002511)5月21日晚间公告，公司决定终止回购公司股份。截至目前，公司已实际回购股份数量189.59万股，回购金额2768.07万元，占拟回购金额下限的13.84%，本次实际回购股份数量基本能满足实施员工持股计划的要求。此前公司公告拟回购金额不低于2亿元，不超过4亿元。（e公司）,中顺洁柔：终止回购公司股份 已回购2768万元
35,2020-05-21 21:24:11,【*ST德奥：已收到债权人申报债权金额4.89亿元】*ST德奥(002260)5月21日晚间发布重整进展公告，截至5月21日下午5时，管理人已接收公司65家债权人申报债权，申报金额合计约4.89亿元。（e公司）,*ST德奥：已收到债权人申报债权金额4.89亿元
36,2020-05-21 21:16:10,【南非央行将2020年GDP预期从-6.1%下调至-7%】据悉，南非央行将2020年GDP预期从-6.1%下调至-7%。（界面新闻）,南非央行将2020年GDP预期从-6.1%下调至-7%
37,2020-05-21 21:15:06,【长航凤凰：南烨集团增持股份 成为公司控股股东】长航凤凰(000520)5月21日晚公告，3月17日至5月21日，南烨集团通过集中竞价增持2296万股，占公司总股本2.27%；2月24日至4月23日，黄河投资通过大宗交易增持740万股，占总股本0.73%。截至5月21日，南烨集团及其一致行动人合计持有公司18%股权成为公司第一大股东。此次权益变动后，公司控股股东由津顺航海运有限公司变更为长治市南烨实业集团有限公司，实际控制人由陈德顺变更为李杨。（e公司）,长航凤凰：南烨集团增持股份 成为公司控股股东
38,2020-05-21 21:14:07,【星源材质：拟公开发行不超10亿元可转债 用于建设超级涂覆工厂等】星源材质(300568)5月21日晚间公告，公司拟公开发行可转换公司债券，拟募集资金总额不超过10亿元，期限为自发行之日起六年，用于超级涂覆工厂、年产20000万平方米锂离子电池湿法隔膜项目及补充流动资金。其中，超级涂覆工厂项目预计投资总额29.64亿元，前次募集资金已投8.43亿元，本次拟募投3亿元。（e公司）,星源材质：拟公开发行不超10亿元可转债 用于建设超级涂覆工厂等
39,2020-05-21 21:13:16,【曼联净债务一年增加1.274亿英镑至4.291亿英镑】据《卫报》5月21日报道，在截至3月31日的12个月内，曼联的净债务增加了1.274亿英镑，达4.291亿英镑。（界面新闻）,曼联净债务一年增加1.274亿英镑至4.291亿英镑
40,2020-05-21 21:07:01,【疫情中店铺大面积停业，服饰上市公司谁最抗跌】疫情带来的店铺停业、复工推迟、大量库存积压、租金人力等成本压力、市场消费需求低迷等多方面因素，造成了中国服饰行业一季度的萎靡状态。记者统计了已披露一季度经营情况的16家中国服饰企业，其中一季度营收同比下跌过半的有4家；一季度净利润同比下跌超过70%的有9家，一季度净利润跌幅最高的拉夏贝尔达到-3609.01%。（第一财经）,疫情中店铺大面积停业 服饰上市公司谁最抗跌
41,2020-05-21 21:01:21,【北方国际：董事长辞职】北方国际(000065)5月21日晚间公告，公司董事会收到公司董事长植玉林提交的书面辞职报告。因工作调动，植玉林申请辞去公司第七届董事会董事、董事长职务。植玉林未持有公司股票，辞职之后将不在公司担任其他职务。（e公司）,北方国际：董事长辞职
42,2020-05-21 21:00:39,【艾格拉斯：两股东累计减持比例达到5%】艾格拉斯(002619)5月21日晚间公告，公司股东巨龙控股、巨龙文化于2019年5月31日至2020年5月19日期间累计减持公司股份比例达到5%，累计减持9182万股。巨龙控股、巨龙文化、吕成杰与公司实际控制人吕仁高为一致行动人。（e公司）,艾格拉斯：两股东累计减持比例达到5%
43,2020-05-21 21:00:01,【国内期市开盘 原油、铁矿涨逾1%】国内期货开盘，原油、铁矿、不锈钢、沪镍涨逾1%，焦炭、螺纹、玻璃等上涨。,国内期货开盘 原油、铁矿涨逾1%
44,2020-05-21 21:00:00,【开普云：拟参与设立产业投资基金】开普云(688228)5月21日晚间公告，公司拟与泛海投资的下属企业、深圳长润专项四期投资企业（有限合伙）共同发起设立新余开普云数字智能投资中心，重点投资新一代信息技术产业、人工智能、大数据等前沿科技在各行业有创新突破相关的投资项目。本次拟投资的基金目标募集规模为2亿元，公司出资额不超过8000万元，首期出资2400万元。（e公司）,开普云：拟参与设立产业投资基金
45,2020-05-21 20:58:02,【信息发展：终止公开发行可转换公司债券】信息发展(300469)5月21日晚公告，公司原本拟发行可转换公司债券募集资金总额不超过1.85亿元。鉴于目前国家政策及资本市场环境变化，并综合考虑公司发展规划、资本运作计划等诸多因素，公司决定终止公开发行可转换公司债券事项。（e公司）,信息发展：终止公开发行可转换公司债券
46,2020-05-21 20:56:58,【央行深圳中心支行多项支持粤港澳大湾区建设措施已落地】央行深圳中心支行多项支持粤港澳大湾区建设措施已落地。下一步，央行深圳市中心支行将用足用好有关政策，继续大力鼓励辖内非银行金融机构使用人民币进行计价结算，逐步扩大跨境人民币使用规模和范围，进一步提高跨境人民币结算业务市场认知度，扩大人民币在跨境投融资中的使用，加快跨境人民币业务发展。（界面新闻）,央行深圳中心支行多项支持粤港澳大湾区建设措施已落地
47,2020-05-21 20:56:42,【百度回应：退市相关说法系谣言】据路透，百度考虑从纳斯达克退市，以提高估值。对此，百度回应：(退市)相关说法系谣言。,百度回应：退市相关说法系谣言
48,2020-05-21 20:55:59,【金科股份：融创系不再为公司持股5%以上股东】金科股份公告，融创系股东今日卖出约1.8亿股，成交金额超14亿元，不再为公司持股5%以上股东。（第一财经）,金科股份：融创系不再为公司持股5%以上股东
49,2020-05-21 20:49:41,【航锦科技：拟出资5000万元设立子公司锦西氯碱化工】航锦科技公告称，公司拟出资5000万元设立全资子公司锦西氯碱化工。航锦科技表示，公司2017年及2018年已成功收购长沙韶光和威科电子100%股权。（第一财经）,航锦科技：拟出资5000万元设立子公司锦西氯碱化工
50,2020-05-21 20:44:14,【金融圈刷屏！国有六大行中第一位“70后”行长来了！】银行界的“后浪”来了，交通银行将迎来首位“70后”行长。消息显示，交通银行将迎来新行长刘珺，刘珺此前担任中投公司副总经理，1972年出生，现年48岁。这将是国有六大行中第一位“70后”行长，也是交通银行目前“一正四副”领导班子中唯一的“70后”。,金融圈刷屏！国有六大行中第一位“70后”行长来了！
51,2020-05-21 20:43:15,【康希诺生物：公司运营正常 并不知悉导致价格波动的任何明确原因】康希诺生物在港交所公告，公司已知悉本公司近日股份价格波动。经作出在相关情况下有关本公司的合理查询后，本公司谨此知会本公司股东及潜在投资者，本公司运营正常，并不知悉导致价格波动的任何明确原因，或任何必须公佈以避免本公司股份出现虚假市场的资料。（界面新闻）,康希诺生物：公司运营正常 并不知悉导致价格波动的任何明确原因
52,2020-05-21 20:42:14,【正元智慧：两股东拟合计减持不超4%股份】正元智慧(300645)5月21日晚公告，股东易康投资、正浩投资拟通过集中竞价交易方式分别减持不超2%的公司股份。（e公司）,正元智慧：两股东拟合计减持不超4%股份
53,2020-05-21 20:35:48,【行情】瑞幸咖啡盘前跌幅扩大至10%，上一交易日收盘跌超35%。,瑞幸咖啡盘前跌幅扩大至10%
54,2020-05-21 20:34:36,【梦洁股份：与电商直播机构谦寻文化合作不会对公司的生产经营产生重大影响】梦洁股份发布股票交易异常波动公告，5月11日，公司与电商直播机构谦寻文化签订了《战略合作协议》，公司将与谦寻文化旗下的淘宝主播薇娅在消费者反馈、产品销售、薇娅肖像权、公益等方面开展合作。本次合同的签订，不会对公司的生产经营产生重大影响。（界面新闻）,梦洁股份：与电商直播机构谦寻文化合作不会对公司的生产经营产生重大影响
55,2020-05-21 20:31:40,【南京市场监督管理局：不得相互串通 操纵头盔市场价格】南京市市场监督管理局对南京头盔生产、经营者及相关单位发出价格政策提醒告诫函称，不得利用虚假的或者使人误解的价格手段（如虚构原价、虚假优惠折价、不履行价格承诺等），诱骗消费者或者其他经营者与其进行交易。不得捏造、散布涨价信息，推动商品价格过快、过高上涨，扰乱市场价格秩序。不得相互串通，操纵市场价格，不得限制生产销售数量，分割市场，损害其他经营者或者消费者的合法权益。除生产自用外，不得超出正常的存储数量或者存储周期，大量囤积相关商品，造成市场供应紧张或价格发生异常波动，推动商品价格过快、过高上涨。（界面新闻）,南京市场监督管理局：不得相互串通 操纵头盔市场价格
56,2020-05-21 20:30:42,【数据】美国上周首次申领失业救济人数243.8万，预估为240万，前值为298.1万。（第一财经）,美国上周首次申领失业救济人数243.8万
57,2020-05-21 20:30:07,【丹邦科技：更换年度审计机构是受疫情影响】5月21日晚间，针对此前深圳证券交易所关注函中有关变更会计师事务所一事，丹邦科技表示，公司更换年度审计机构属于受疫情意外因素影响以及确保公司2019年度报告及时披露的需要。（第一财经）,丹邦科技：更换年度审计机构是受疫情影响
58,2020-05-21 20:28:43,【京天利：拟1.05亿元参设合伙企业 投资网络安全等行业相关企业】京天利(300399)5月21日晚公告，公司拟与浙江瑞饶投资管理有限公司、浙江上士网络科技有限公司、建阳和润农业有限公司共同设立上饶市天数通投资管理中心（有限合伙）。天数通采用有限合伙企业形式，总规模为2.1亿元。其中京天利作为有限合伙人认缴的出资份额为1.05亿元，占全部合伙人认缴出资总额的50%。合伙企业拟投资于信息技术、网络安全、软件服务等行业的相关企业，通过股权投资获取长期的投资回报。（e公司）,京天利：拟1.05亿元参设合伙企业 投资网络安全等行业相关企业
59,2020-05-21 20:27:52,【两连板江淮汽车：控股股东江汽控股筹划引进战投】连续两日涨停的江淮汽车(600418)5月21日晚间公告，公司控股股东江汽控股正在筹划引进战略投资者的相关工作，本次江汽控股引进战略投资者不涉及公司控制权的变更，目前尚未形成最终方案，该事项尚存在重大不确定性，对公司目前的生产经营也不构成影响。（e公司）,两连板江淮汽车：控股股东江汽控股筹划引进战投
60,2020-05-21 20:26:44,【百度回应从纳斯纳克退市：不予置评】据《科创板日报》，针对“百度考虑从纳斯达克退市以提高估值”消息，百度表示，“不予置评”。截至发稿，百度盘前跌幅从8%收窄至2%，总市值370亿美元。（界面新闻）,百度回应从纳斯纳克退市：不予置评
61,2020-05-21 20:21:31,【运达科技：拟收购运达电气100%股权 明日复牌】运达科技(300440)21日晚公告，公司拟发行股份及支付现金购买运达电气100%股权，同时拟非公开发行股票募集配套资金。交易标的资产预估值区间为5亿元-7亿元，本次交易预计不构成重大资产重组。运达电气专注于干线铁路及城市轨道交通电气保护与控制领域，主要从事该领域的重大装备研制、生产、销售、培训及系统集成、技术咨询等服务。此次收购有助于公司在铁路牵引供电系统领域延伸业务。公司股票5月22日复牌。（e公司）,运达科技：拟收购运达电气100%股权 明日复牌
62,2020-05-21 20:18:22,【因监管介入 美国原油基金被限制购买原油期货】原油市场最大的ETF——美国原油基金表示，其经纪商加拿大皇家银行告知其称，该基金当前不能购买更多的原油期货，因美国、英国和加拿大监管机构的介入；最新披露的监管文件显示，监管机构向美国原油基金施压，要求其限制在油价暴跌时期快速增长的规模；最近几周，因零售投资者预判油市触底，导致该基金获得创纪录的资金流入，对油价造成了影响；美国原油基金正寻求聘请更多的经纪商，但目前尚未与任何其他经纪商达成协议。（界面新闻）,因监管介入 美国原油基金被限制购买原油期货
63,2020-05-21 20:17:32,【京威股份：股东德国埃贝斯乐拟减持不超6%公司股份】京威股份公告，公司股东德国埃贝斯乐持有公司股份3.63亿股，占公司总股本的24.20%。德国埃贝斯乐计划通过集中竞价交易减持数量不超过3000万股，即不超过公司总股本的2%；通过大宗交易减持数量不超过6000万股，即不超过公司总股本的4%。（界面新闻）,京威股份：股东德国埃贝斯乐拟减持不超6%公司股份
