,datetime,content,title
225,2020-05-08 11:16:25,【家电股盘中走强 格力电器涨超5%】家电股盘中走强，截至发稿，格力电器涨超5%，美的集团涨近4%，华帝股份、九阳股份涨超3.5%。,家电股盘中走强 格力电器涨超5%
226,2020-05-08 11:15:09,【北向资金净流入超30亿元】早盘北向资金持续流入，截至目前，北向资金净流入超30亿元。,北向资金净流入超30亿
227,2020-05-08 11:14:18,【券商股盘中拉升 天风证券涨超5%】券商股盘中拉升，截至发稿，天风证券涨超5%，国金证券、哈投股份、东兴证券等纷纷跟涨。（证券时报网）,券商股盘中拉升 天风证券涨超5%
228,2020-05-08 11:08:19,【澳大利亚央行：受疫情影响 预计澳大利亚今年经济将萎缩6%】据外媒报道，澳大利亚央行今日表示，受疫情影响，预计澳大利亚今年经济将萎缩6％，失业率将达到10％的峰值，并在2021年之前保持在7.5％左右。同时，政府最终确定了在7月份之前全面重启经济的计划。（证券时报）,澳大利亚央行：受疫情影响 预计澳大利亚今年经济将萎缩6%
229,2020-05-08 11:07:33,【小米大涨7% 一季度全球热销手机TOP10中小米占三席】港股小米强势上涨，盘中一度涨近8%，现涨6.95%报11.08港元，暂成交16.94亿港元，最新总市值2665亿港元。据全球权威调研机构Canalys报告显示，一季度全球热销手机TOP10排行榜中，Redmi Note8&8T位居第二，Redmi Note8 Pro位居第五，Redmi 8A位居第九。,小米大涨7% 一季度全球热销手机TOP10中小米占三席
230,2020-05-08 11:03:48,【商务部：“五一”期间直播带货成为新热点】国务院联防联控机今日上午举行新闻发布会，商务部副部长王炳南表示，“五一”期间，直播带货成为新热点。“五一”期间，电商直播场次和直播商品数量同比分别增长1倍和4.7倍，北京、上海等地推出了“老字号”的直播专场，开展云逛吃、云探店等活动，扩大老字号品牌影响力，促进市场销售快速回升。（证券时报）,商务部：“五一”期间直播带货成为新热点
231,2020-05-08 11:03:04,【深成指站上11000点】深成指站上11000点，刷新3月12日以来新高，日内涨1.26%。,深成指站上11000点
232,2020-05-08 11:00:47,【疫情以来全国累计发放190多亿元消费券】商务部副部长王炳南，这些消费券帮扶了受疫情影响严重的行业企业发展，带来了明显客流量。今后将加快推进复商复市，促进城市消费升级，稳定重点商品消费，促进消费回流。（国是直通车）,疫情以来全国累计发放190多亿元消费券
233,2020-05-08 10:59:20,【科大智能成为特斯拉上海超级工厂二期项目首批供应商】据科大智能官网消息，近日，科大智能成为特斯拉上海超级工厂二期项目首批供应商，提供针对ModelY车型生产的高端非标智能装配设备。（证券时报网）,科大智能成为特斯拉上海超级工厂二期项目首批供应商
234,2020-05-08 10:56:13,【甬舟一体化提速：宁波拟给予舟山户籍人员迁移户口同城待遇】浙江宁波市拟给予一衣带水的浙江舟山市户籍人员迁移户口同城待遇，舟山市区户籍等同于宁波市区户籍，舟山县市户籍等同于宁波县市户籍。（澎湃新闻）,甬舟一体化提速：宁波拟给予舟山户籍人员迁移户口同城待遇
235,2020-05-08 10:51:26,【恒指涨幅扩大至1%】恒指涨幅扩大至1%，汽车、地产股领涨蓝筹，腾讯控股涨超2%。太阳能光伏股拉升，保利协鑫能源涨超11%。,恒指涨幅扩至1%
236,2020-05-08 10:50:20,【上证券商ETF今日起在上交所上市交易】上交所5月8日消息，汇安基金管理有限责任公司管理的汇安上证证券交易型开放式指数证券投资基金(简称：上证券商，证券代码：510200)于2020年5月8日起在上交所市场上市交易及申购、赎回。（中国证券报）,上证券商ETF今日起在上交所上市交易
237,2020-05-08 10:48:07,【北斗导航概念股走强】北斗导航概念股走强，中国卫星、天银机电拉升涨逾7%，华力创通、航天电子、北斗星通、中国卫通等各跟涨。,北斗导航概念股走强
238,2020-05-08 10:47:16,【业内人士：4月聚乙烯产量或再创新高】5月8日发布的研究报告称，预估2020年3月国内PE(聚乙烯)产量约为175.16万吨，环比增加14.54%，同比增加17.63%。其中LLDPE产量约为74.41万吨，LDPE产量约为26.19万吨，HDPE产量约为74.56万吨。1-3月国内PE总产量约为493.62万吨，同比增长14.09%。（中证网）,业内人士：4月聚乙烯产量或再创新高
239,2020-05-08 10:40:55,【比特币升破1万美元大关！减半时间或提前、大佬力挺买入……】比特币周五在亚洲早盘交易中一度上涨2.2%，至10015美元，为2月24日以来首次达到五位数。而自4月21日以来，比特币价格累计涨幅已逾40%。（环球外汇网）,比特币升破1万美元大关！减半时间或提前、大佬力挺买入……
240,2020-05-08 10:40:50,【文化和旅游部：5月1日至5日国内旅游收入475.6亿元】国务院联防联控机今日上午举行新闻发布会，文化和旅游部党组成员王晓峰表示，据测算，5月1日至5日，全国累计接待国内游客1.15亿人次，累计实现国内旅游收入475.6亿元。与去年相比，在疫情常态化防控的前提下，旅游市场基本恢复了同期的50%，促进了旅游业消费回补和潜力释放。（证券时报）,文化和旅游部：5月1日至5日国内旅游收入475.6亿元
241,2020-05-08 10:37:40,【稀土永磁板块异动】稀土永磁板块异动，中钢天源拉升封板，金力永磁、银河磁体、英洛华等跟涨。,稀土永磁板块盘中异动
242,2020-05-08 10:34:12,【商务部：认真落实各项促消费政策措施 加快释放国内市场需求】国务院联防联控机今日上午举行新闻发布会，商务部副部长王炳南表示，“五一”消费市场从疫情冲击中快速复苏，体现了我国超大规模的市场优势和内需潜力。下一步，商务部将全面落实“六保”任务，坚定实施扩大内需战略，认真落实各项促消费政策措施，在常态化疫情防控中推进复商复市，扩大居民消费，加快释放国内市场需求，为维护经济发展和社会稳定大局、保障和改善民生、加快形成强大国内市场提供有力支撑。（证券时报）,商务部：认真落实各项促消费政策措施 加快释放国内市场需求
243,2020-05-08 10:31:24,【博时基金尹浩：长期看好5G产业链投资 中国5G产业链有望站上全球5G风口】新基建成为市场热点，5G是其中主要主线。5月7日，博时5G 50ETF基金经理尹浩在接受中国证券报记者采访时指出，他长期看好5G产业链投资，中国5G产业链有望站上全球5G风口。（中证网）,博时基金尹浩：长期看好5G产业链投资 中国5G产业链有望站上全球5G风口
244,2020-05-08 10:28:33,【商务部：“五一”假期全国实物商品网络零售额同比增长36.3%】商务部副部长王炳南表示，疫情催生壮大了生鲜电商、在线教育、远程医疗等线上新型消费，“五一”假期线上消费热度不减，销售进一步加快。全国实物商品网络零售额同比增长36.3%，一些大型电商同比超过40%，“双品网购节” 实现销售额超过580亿元。（第一财经）,商务部：“五一”假期全国实物商品网络零售额同比增长36.3%
245,2020-05-08 10:27:32,【商务部：汽车、家电等前期被抑制冻结的耐用消费品销售明显回升】商务部副部长王炳南：汽车、家电等前期被抑制冻结的耐用消费品销售明显回升。“五一”期间，上海、重庆、浙江重点监测企业汽车销售额同比分别增长49.6%、28.5%和8.8%，一些电商平台家电销售额同比增长1倍左右。（第一财经）,商务部：汽车、家电等前期被抑制冻结的耐用消费品销售明显回升
246,2020-05-08 10:23:09,【美股三大股指期货均涨超1%】美股三大股指期货均涨超1%。,美股三大股指期货涨超1%
247,2020-05-08 10:19:39,【机构：需求仍然偏弱 天胶延续宽幅震荡】当前的供需矛盾依旧突出，虽然供应端受到天气的影响，但实际减产量远远修复不了需求端萎缩造成的供应过剩；海外疫情还处于爆发期，需求受到严重压制。（广发期货）,机构：需求仍然偏弱 天胶延续宽幅震荡
248,2020-05-08 10:19:38,【交通运输部：“五一”假期全国铁路、道路、水路、民航累计发送旅客总量1.21亿人次】国务院联防联控机制于8日上午10时举行新闻发布会，交通运输部副部长刘小明针对“五一”小长假期间交通情况表示，5月1日至5日，全国铁路、道路、水路、民航累计发送旅客总量1.21亿人次，日均2429.83万人次，较节前五日（4月26日至30日）的日均客运量增长了17.9%。下一步将在统筹做好常态化疫情防控和经济社会发展交通运输工作，努力完成全年目标任务，决不让疫情防控成果前功尽弃。（证券时报）,交通运输部：“五一”假期全国铁路、道路、水路、民航累计发送旅客总量1.21亿人次
249,2020-05-08 10:18:59,【刘鹤与莱特希泽、姆努钦通话】5月8日上午，中共中央政治局委员、国务院副总理、中美全面经济对话中方牵头人刘鹤应约与美贸易代表莱特希泽、财政部长姆努钦通话。双方表示应加强宏观经济和公共卫生合作，努力为中美第一阶段经贸协议的落实创造有利氛围和条件，推动取得积极成效。双方同意保持沟通协调。（新华视点）,刘鹤与莱特希泽、姆努钦通话
250,2020-05-08 10:18:17,【上海迪士尼重开：2秒成交第一单 首日及首周末门票售罄】5月8日早8点，上海迪士尼乐园重新开放售票，因新冠肺炎疫情关闭了107天之后，乐园将在5月11日重新开放。在飞猪旗舰店可以看到，8点门票开售后2秒，第一单已经成交。3分钟后，重新开园首日11号和首个周六16号的门票已售罄，日期变灰不能购买，其他日期也仅有少量余票。（新京报）,上海迪士尼重开：2秒成交第一单 首日及首周末门票售罄
251,2020-05-08 10:18:11,【FF正在中东、欧洲和亚太地区多方推动债权和股权融资】贾跃亭获得绝大多数债权人的投票支持对于FF的股权融资和B2B业务拓展都是重大利好。FF中国落地项目已经进入最后谈判的关键阶段。本次投票结果意味着贾跃亭债权人对FF资产价值和成功潜力的高度认可。FF内部人士透露，FF正在中东、欧洲和亚太地区多方推动债权和股权融资，并且有多方投资人明确表达了投资意向，贾跃亭债权人如此正面的投票结果是对融资的最佳推动。（证券时报）,FF正在中东、欧洲和亚太地区多方推动债权和股权融资
252,2020-05-08 10:12:29,【贾跃亭破产重组获超80%投票债权人赞成】备受关注的贾跃亭个人破产重组债权人投票结果正式出炉。据第三方计票网站EPIQ披露的信息显示，贾跃亭获得了超过80%的已投票债权人支持，这意味着贾跃亭破产重组方案已获债权人层面的投票通过，即绝大多数债权人的支持和认可。（证券时报网）,贾跃亭破产重组获超80%投票债权人赞成
253,2020-05-08 10:09:56,【跟谁学创始人再度回应做空：没有一个实质性的证据】跟谁学创始人陈向东8日再度回应香橼(Citron)做空时称，不少投资人都反馈说，Citron的报告真的是太烂了，所谓的“实锤”真的是惨不忍睹，没有一个实质性的证据和严谨的量化分析。（界面新闻）,跟谁学创始人再度回应做空：没有一个实质性的证据
254,2020-05-08 10:03:01,【美联储ETF购买计划存在“致命弱点”】美联储对债券发行人提出了严格的要求，使其即使在SMCCF之下也难获得某些认证。这是SMCCF的致命弱点，也是美联储要解决的最困难的问题。”（金十数据）,美联储ETF购买计划存在“致命弱点”
255,2020-05-08 10:02:40,【一批慢性病患者常用药大幅降价 4月起可陆续买到】今年1月，第二批国家组织药品集中采购产生中选结果，32个品种采购成功，药价大幅降低。32个品种中包含很多老百姓耳熟能详的药品，比如解热镇痛药对乙酰氨基酚，抗生素类阿莫西林、盐酸克林霉素、阿奇霉素、头孢拉定，糖尿病用药阿卡波糖、格列美脲，牙疼会用到的甲硝唑片，高血压用药吲达帕胺片、富马酸比索洛尔等，其中还有4款原研药。4月起，中选结果在全国各地落地，这些药品正在进入医院，患者可以陆续买到这些大幅降价的药品了。（人民日报）,一批慢性病患者常用药大幅降价 4月起可陆续买到
256,2020-05-08 10:00:15,【都是数据惹的“货” 澳纽加携手齐上扬】尽管隔夜加元起伏波动，但周四(5月7日)在多伦多时段稳步走高。中国贸易数据向好，油价走势和广泛的风险情绪共同推动加元积极向上。（FX168）,都是数据惹的“货” 澳纽加携手齐上扬
257,2020-05-08 09:59:28,【油价回归 特鲁多40亿新决议 助推加元至“跷跷板”高点】美元/加元周四(5月7日)一度升至4月23日以来的最高水平1.4172，但由于原油价格回升帮助对大宗商品敏感的加元找到需求，形势反转。截至发稿，美元/加元报1.39724。（证券时报网）,油价回归 特鲁多40亿新决议 助推加元至“跷跷板”高点
258,2020-05-08 09:54:10,【国产软件走强】国产软件走强，诚迈科技涨停封板、东华软件、中国软件、南威软件、格尔软件等跟涨。,国产软件走强
259,2020-05-08 09:54:04,【小心！即便是欧元空头 可能也低估了欧元的下行风险？】据彭博社报道，外汇交易员几乎没有理会分析师对欧元将走强的呼吁，而是通过期权来做空欧元。但即便如此，他们也可能低估了未来几个月欧元贬值的速度。（环球外汇网）,小心！即便是欧元空头 可能也低估了欧元的下行风险？
260,2020-05-08 09:53:31,【北向资金净流入超10亿元】早盘北向资金持续流入，截至目前，北向资金净流入超10亿元。,北向资金流入超10亿
261,2020-05-08 09:52:35,【非农终极前瞻：历史最大降幅！就业岗位料下降2200万 失业率将提高至大萧条时期】北京时间5月8日20:30，美国劳工部将公布4月非农就业报告。分析人士预计，4月非农就业岗位料减少2200万个，为历史最大降幅，将打破2007-2009年经济衰退期间创下的80万的纪录；预计4月份失业率将跃升至16%，打破1982年11月创下的10.8%的二战后纪录。（汇通网）,非农终极前瞻：历史最大降幅！就业岗位料下降2200万 失业率将提高至大萧条时期
262,2020-05-08 09:50:37,【深成指涨幅扩大至1%】深成指涨幅扩大至1%，创业板指涨0.87%，沪指涨0.56%。,深成指涨幅扩大至1%
263,2020-05-08 09:49:31,【可转债价格频现惨跌 投资者风险意识需提高】5月7日，泰晶科技宣布强制赎回泰晶转债，泰晶转债当天下跌47.68%，酿成一起“投资惨案”。可转债因提前强制赎回而大跌不是第一次也不会是最后一次，但很大一部分投资者风险意识依然不高。投资者还应该珍惜自己的钱包，熟悉投资规则。（证券时报）,可转债价格频现惨跌 投资者风险意识需提高
264,2020-05-08 09:45:20,【服务器股走强】服务器股走强，中科曙光拉升涨停，神州数码、浪潮信息、中国长城等跟涨。消息面上，中国电信启动2020年服务器集采，预估规模56314台。,服务器股走强
265,2020-05-08 09:37:46,【工信部原材料工业司组织召开支持湖北疫后重建 推进大型骨干机制砂石项目建设调度会】7日，工信部原材料工业司组织召开“支持湖北疫后重建推进大型骨干机制砂石项目建设调度会”。国家发展改革委、自然资源部、生态环境部等“推进机制砂石行业高质量发展工作协调机制”成员单位，湖北省经信厅等省内相关部门，华新水泥、葛洲坝集团等四家重点机制砂石企业通过视频方式参加会议。（界面新闻）,工信部原材料工业司组织召开支持湖北疫后重建 推进大型骨干机制砂石项目建设调度会
266,2020-05-08 09:37:26,【141股去年四季度获社保基金扎堆持有】社保基金持股动向曝光！去年四季度末社保基金共现身512只个股前十大流通股东榜，新进124只，增持160只。（数据宝）,141股去年四季度获社保基金扎堆持有
267,2020-05-08 09:37:19,【央行：5月14日中国人民银行将招标发行2020年第四期和第五期中央银行票据】央行：2020年5月14日（周四）中国人民银行将通过香港金融管理局债务工具中央结算系统（CMU）债券投标平台，招标发行2020年第四期和第五期中央银行票据。第四期中央银行票据期限3个月（91天），发行量为人民币200亿元；第五期中央银行票据期限1年，发行量为人民币100亿元。（界面新闻）,央行：5月14日中国人民银行将招标发行2020年第四期和第五期中央银行票据
268,2020-05-08 09:35:47,【数字货币概念股走强】数字货币概念股走强，恒宝股份涨停，金财互联、广电运通、飞天诚信、聚龙股份等涨逾5%。,数字货币概念股早盘走强
269,2020-05-08 09:34:37,【物联网高开】物联网高开，三川智慧、汇中股份开盘涨停，日海智能、移远通信、新天科技、美格智能等跟涨。消息面上，工信部指出深入推进移动物联网全面发展。,物联网高开
270,2020-05-08 09:34:05,【泰晶转债开盘涨7.37%】泰晶转债开盘涨7.37%，昨日大跌47.68%。,泰晶转债开盘涨7.37%
271,2020-05-08 09:28:44,【三大指数集体高开】沪指高开0.39%，创业板指高开0.52%，深成指高开0.56%。,三大指数高开
272,2020-05-08 09:25:56,【史上首现！美国利率期货市场开始消化负利率 叠加史上最惨非农来袭 美元高位回落】尽管美联储认定美国利率不会降至负值，但美国利率期货市场周四(5月7日)首次开始消化美国利率为负的环境，因投资者纠结于新冠病毒疫情带来的经济后果，再加上糟糕的非农预期，美元指数回落至100关口下方。（汇通网）,史上首现！美国利率期货市场开始消化负利率 叠加史上最惨非农来袭 美元高位回落
273,2020-05-08 09:24:16,【史上最惨烈非农报告即将登场！别光盯着失业数据 当心一重大意外将引发股汇大跌风暴】预计本周五(5月8日)的美国非农就业报告将是有史以来最糟糕的。经济学家认为，4月份失业人数超过2100万，这将使失业率升至16%。上一次失业率达到两位数是在1983年，当时刚刚经历了上世纪80年代的经济衰退。历史性的失业应该会推动汇率和股市走低，但鉴于所有人都在寻找一份糟糕的报告，它对市场的真正影响有多大？（FX168）,史上最惨烈非农报告即将登场！别光盯着失业数据 当心一重大意外将引发股汇大跌风暴
274,2020-05-08 09:20:51,【恒指开涨0.89%】港股高开，恒指开涨0.89%，重磅蓝筹股普涨。,恒指开涨0.89%
275,2020-05-08 09:18:58,【花旗银行：澳元/美元仍被高估 可能触及0.62大关】周四(5月7日)花旗银行讨论了对澳元/美元的分析，并表示看空澳元/美元。（FX168）,花旗银行：澳元/美元仍被高估 可能触及0.62大关
276,2020-05-08 09:18:47,【沪金期货主力合约创2011年9月以来高位】沪金期货主力合约创2011年9月以来高位，现报383.64元/克。,沪金期货主力合约创2011年9月以来高位
277,2020-05-08 09:18:07,【中国央行连续二十五个工作日不进行逆回购操作】据机构援引业内人士：中国央行公开市场今日不进行逆回购操作，已连续二十五个工作日不进行逆回购操作。（第一财经）,中国央行连续二十五个工作日不进行逆回购操作
278,2020-05-08 09:16:19,【风云突变：美元狂泻60点、黄金暴拉40美元 史上最差非农前交易员“先发制人”？】随着市场的起伏，金价周四(5月7日)创下本月新高。黄金和美元正轮流吸纳避险资金流入，而避险题材的核心是新冠病毒。（FX168）,风云突变：美元狂泻60点、黄金暴拉40美元 史上最差非农前交易员“先发制人”？
279,2020-05-08 09:15:00,【行情】人民币兑美元中间价上调143点，报7.0788。（第一财经）,人民币兑美元中间价上调143点 报7.0788
280,2020-05-08 09:12:35,【“致命”利率来了？这些市场警示美联储或很快推行负利率 美元急坠黄金飙升】期货交易员正在消化几个月内出现美国负利率的可能性。周四(5月7日)，联邦基金利率合约扩大了本周的涨势，2021年第一季期货价格水平一度突破100，表明美国基准利率未来将为负数。（FX168）,“致命”利率来了？这些市场警示美联储或很快推行负利率 美元急坠黄金飙升
281,2020-05-08 09:12:00,【深交所发布深证公共健康50等指数】深交所发布深证公共健康50指数、深证长江经济带100指数、深证云科技50指数、深证生物医药50指数和深证消费电子50指数。（第一财经）,深交所发布深证公共健康50等指数
282,2020-05-08 09:11:53,【一文解读：取消合格境外投资者投资额度限制的政策】2019年9月10日，国家外汇管理局发布消息，为贯彻落实中央、国务院关于推动形成全面开放新格局的重大决策部署，进一步扩大我国金融市场对外开放，经国务院批准，外汇局决定取消QFII和RQFII投资额度限制。根据国家外汇管理局新闻发言人、总经济师王春英就取消合格境外投资者(QFII/RQFII)投资额度限制答记者问，此次取消合格境外投资者投资额度限制时，RQFII试点国家和地区限制也一并取消。（富安达基金）,一文解读：取消合格境外投资者投资额度限制的政策
283,2020-05-08 09:11:03,【连跌3日 国债期货怎么了？资金利率再抬头 万亿国债发行在即】资金成本市场上，价格水平也不再下行，甚至有所抬头。3个月期的Shiobr利率水平，也从4月20日起，持续维持在1.40%左右，不再下行。银行间隔夜资金价格，从4月29日的最低0.6610%，上升到了5月7日的1.143%。（券商中国）,连跌3日 国债期货怎么了？资金利率再抬头 万亿国债发行在即
284,2020-05-08 09:10:40,【道指期货涨超1%】美股股指期货涨幅扩大，其中，道指期货涨超1%。,道指期货涨超1%
285,2020-05-08 09:07:55,【证券时报：可转债价格频现惨跌 投资者风险意识需提高】据证券时报，可转债因提前强制赎回而大跌不是第一次也不会是最后一次，但很大一部分投资者风险意识依然不高。投资者还应该珍惜自己的钱包，熟悉投资规则。市场有舆论认为可转债风险太大。实际上，脱离基本面的可转债很少，目前市场超过200元的可转债只有10家，溢价率高的可转债也是少数。可转债仍是好的投资品种，但投资者需要提高风险意识，不能因为价格大涨就一味往前冲，要远离雷区，别在地雷上跳舞。（界面新闻）,证券时报：可转债价格频现惨跌 投资者风险意识需提高
286,2020-05-08 09:04:24,【负利率要来了？史无前例押注震惊华尔街 最恐怖非农夜今晚降临！】尽管美联储官员一直表示不愿像部分欧洲地区和日本那样推行负利率，但在周四，利率市场却开始押注，美联储即将在明年初，正式捅破零利率与负利率之间的这层窗户纸，踏入未知领域！（环球外汇网）,负利率要来了？史无前例押注震惊华尔街 最恐怖非农夜今晚降临！
287,2020-05-08 09:02:36,【商品期市开盘 铁矿石涨逾2%】国内商品期市开盘涨跌不一，铁矿石涨逾2%，原油跌逾3%。,商品期市开盘 铁矿石涨逾2%
288,2020-05-08 09:01:48,【富时中国A50指数期货开盘涨0.34%】富时中国A50指数期货开盘涨0.34%。,富时中国A50指数期货开盘涨0.34%
289,2020-05-08 08:52:40,【行情】日经225指数涨幅扩大，盘中一度涨逾2%。截至发稿，日经225指数涨1.93%，报20054.00点。隔夜欧美股市集体收涨，道指涨0.89%，标普500指数涨1.15%，纳指涨1.41%。,日经225指数涨幅扩大 盘中一度涨逾2%
290,2020-05-08 08:48:17,【现货黄金短线走高5美元】现货黄金短线走高5美元，现报1716.46美元/盎司。,现货黄金短线走高5美元
291,2020-05-08 08:47:30,【澳元兑美元AUD/USD日内涨幅扩大至0.5%】澳元兑美元AUD/USD日内涨幅扩大至0.5%，报0.6527。（金十数据）,澳元兑美元AUD/USD日内涨幅扩大至0.5%
