,datetime,content,title
482,2020-02-14 11:20:23,【江苏出台政策支持农产品保供主体复工复产】据新华社报道，江苏省疫情防控工作领导小组农村防控组近日出台应对疫情稳定重要“菜篮子”产品生产供应5个方面15条措施，支持农产品保供主体复工复产。记者从江苏省农业农村厅获悉，江苏全省823家省级以上农业龙头企业已有247家与保供相关企业复产，另有181家饲料企业、91家生猪屠宰企业复工。（新华社）,江苏出台政策支持农产品保供主体复工复产
483,2020-02-14 11:14:12,【北向资金早盘持续流入】北向资金早盘持续流入，截至发稿，净流入超40亿元。,北向资金早盘持续流入
484,2020-02-14 11:12:14,【华为回应美司法部提起新诉讼】华为回应美司法部提起新诉讼：新指控缺乏依据，出于竞争原因伤害华为声誉和经营。（环球网）,华为回应美国提起新诉讼
485,2020-02-14 11:12:09,【华为回应美司法部提起新诉讼：新指控缺乏依据 出于竞争原因伤害华为声誉和经营】多家美媒13日最新消息说，美国政府对华为公司提起新的诉讼，指控华为与子公司合谋窃取美国的商业机密与尖端科技。针对新的指控，14日上午，华为方面向环球网编辑部发来声明，声明称，美国司法部提起新的诉状并非基于执法目的，而是出于竞争原因试图对华为声誉和经营造成不可逆转的伤害。华为还提到，新增指控缺乏事实依据。（环球网）,华为回应美司法部提起新诉讼：新指控缺乏依据
486,2020-02-14 11:09:22,【国务院指导组考察合肥京东方等公司指导复工复产企业疫情防控】日前，国务院联防联控机制指导组第十二组组长、中国疾控中心原主任王宇率队赴合肥新站高新区现场调研指导复工复产企业疫情防控工作。副市长王文松陪同。指导组一行先后来到合肥京东方显示技术有限公司、彩虹(合肥)液晶玻璃有限公司、合肥普尔德医疗用品有限公司，详细了解了企业疫情防控措施落实、疫情防护物资储备、应急预案制定和生产经营、员工返岗等情况，对企业积极组织生产、认真细致落实疫情防控措施给予肯定。（合肥日报）,国务院指导组考察合肥京东方等公司指导复工复产企业疫情防控
487,2020-02-14 11:02:17,【特斯拉柏林超级工厂建设前期准备工作已开始】特斯拉已经开始了柏林超级工厂建设的前期工作，砍伐森林，清除一些与建筑过程中的环境问题有关的障碍。（金十数据）,特斯拉柏林超级工厂建设前期准备工作开始
488,2020-02-14 11:01:37,【南京：无南京户籍、无固定居住场所、无就业岗位人士建议暂缓来宁】南京市发布《南京市“11号通告”解读》，规定：“如果您属疫情重点地区以外的其他省份人士，在南京有单位、有固定住所或投靠亲属、进行正常公务、商务等活动，是可以自由来宁的。但是在疫情防控期间，如果您无南京户籍、无固定居住场所、无就业岗位，来南京只是单纯地为了访友、旅游，那么建议您暂缓来宁。”（央视）,南京：无南京户籍、无固定居住场所、无就业岗位人士建议暂缓来宁
489,2020-02-14 10:58:19,【创业板指收复2100点】创业板指收复2100点，为2016年12月来首次，日内涨约1.7%。,创业板指收复2100点
490,2020-02-14 10:57:49,A股三大股指集体上涨，创业板指时隔三年多重返2100点，再创本轮反弹新高。钛白粉、国产芯片、PCB、光刻胶、3D摄像头等板块涨幅居前。口罩、农业等板块领跌两市。,A股三大股指集体上涨 创业板指时隔三年多重返2100点
491,2020-02-14 10:57:47,【券商、证券服务股走强】券商、证券服务股走强，大智慧拉升封板板，同花顺、国元证券、东方财富、华创阳安等跟涨。,券商、证券服务股走强
492,2020-02-14 10:52:00,【天津市人大常委会通过关于禁止食用野生动物的决定】拒绝野味，天津市人大常委会通过关于禁止食用野生动物的决定，违规食用野生动物及其制品的，最高可罚其价值10倍的罚款。（人民日报）,天津市人大常委会通过关于禁止食用野生动物决定
493,2020-02-14 10:44:10,【市场有多看衰欧元？开年头一天可能已是2020年高点！】交易员们当前正押注，在跌至2017年年中以来的最低水平后，还会有更多痛苦等着欧元。（环球外汇网）,市场有多看衰欧元？开年头一天可能已是2020年高点！
494,2020-02-14 10:43:53,【行情】深证成指涨幅扩大至1%，上证综指涨0.32%，创业板指涨1.5%。,深证成指涨幅扩大至1%
495,2020-02-14 10:41:23,【中鼎股份：公司为特斯拉开发配套多种相关橡胶制品】中鼎股份称，公司是国内汽车橡胶零部件龙头企业，一直致力于高端橡胶制品研发，掌握新能源汽车领域高端橡胶制造技术。公司通过直接与间接配套，为特斯拉开发配套多种相关橡胶制品。（第一财经）,中鼎股份：公司为特斯拉开发配套多种相关橡胶制品
496,2020-02-14 10:39:52,【创业板指涨1.3%】科技股持续拉升，创业板指涨1.3%，再创反弹新高。,创业板指涨1.3%
497,2020-02-14 10:37:22,【湖北以外新增新冠肺炎病例连降10天】据国家卫健委数据统计，2月13日0—24时，全国除湖北以外地区新增确诊病例267例，连续第10日呈下降态势。过去这一数据分别为：890例(3日)、731例(4日)、707例(5日)、696例(6日)、558例（7日）、509例（8日）、444例（9日）、381例（10日）、377例（11日）、312例（12日）。（央视新闻）,湖北以外新增新冠肺炎病例连降10天
498,2020-02-14 10:36:07,【北向资金净流入超30亿元】北向资金早盘持续流入，截至发稿净流入超30亿元。,北向资金净流入超30亿
499,2020-02-14 10:35:24,【来自天津宝坻的警报：超乎想象的危险传播链！】最近，天津市宝坻区某百货大楼内部，相继出现多例新冠肺炎病例。宝坻出现首个确诊病例后，病例不断增加。截至2月12日20点，天津市累计报告新型冠状病毒肺炎确诊病例112例，其中，宝坻区报告43例。宝坻区百货大楼成为天津新冠肺炎疫情聚集性发生的重点地区之一。从2月11日18点开始，宝坻集中全区近3000名工作人员，成立917个工作组，连夜开展走访调查，累计摸排出超过2万人，并对这些人员实施居家隔离。（央视）,来自天津宝坻的警报：超乎想象的危险传播链
500,2020-02-14 10:34:35,【湖北以外新增新型冠状病毒肺炎病例连降10天】据国家卫健委数据统计，2月13日0-24时，全国除湖北以外地区新增确诊病例267例，连续第10日呈下降态势。过去这一数据分别为：890例(3日)、731例(4日)、707例(5日)、696例(6日)、558例(7日)、509(8日)、444(9日)、381(10日)、377(11日)、312(12日)。（证券时报）,湖北以外新增病例连降10天
501,2020-02-14 10:34:22,【湖北以外新增病例连降10天】据国家卫健委数据统计，2月13日0-24时，全国除湖北以外地区新增确诊病例267例，连续第10日呈下降态势。过去这一数据分别为：890例(3日)、731例(4日)、707例(5日)、696例(6日)、558例（7日）、509（8日）、444（9日）、381（10日）、377（11日）、312（12日）。（央视新闻）,湖北以外新增病例连降10天
502,2020-02-14 10:30:24,【31个省(自治区、直辖市)和新疆生产建设兵团报告新增新冠肺炎确诊病例5090例】国家卫健委：2月13日0—24时，31个省(自治区、直辖市)和新疆生产建设兵团报告新增确诊病例5090例，新增重症病例2174例。截至2月13日24时，据31个省(自治区、直辖市)和新疆生产建设兵团报告，现有确诊病例55748例(其中重症病例10204例)，累计治愈出院病例6723例。（国家卫健委）,31个省(自治区、直辖市)和新疆生产建设兵团报告新增新冠肺炎确诊病例5090例
503,2020-02-14 10:29:15,【国家卫健委：2月13日新增新冠肺炎确诊病例5090例 累计确诊63851例】2月13日0—24时，31个省(自治区、直辖市)和新疆生产建设兵团报告新增确诊病例5090例，新增重症病例2174例，新增死亡病例121例(湖北116例，黑龙江2例，安徽、河南、重庆各1例)，新增疑似病例2450例。（国家卫健委）,国家卫健委：2月13日新增新冠肺炎确诊病例5090例 累计确诊63851例
504,2020-02-14 10:29:03,【辽宁无新增新冠肺炎确诊病例 累计确诊117例】2月13日22时—14日10时，辽宁省新增2例治愈出院病例，为沈阳市确诊病例。辽宁省累计报告新型冠状病毒肺炎确诊病例117例，治愈出院24例，死亡1例。（证券时报）,辽宁无新增新冠肺炎确诊病例
505,2020-02-14 10:25:11,【强势美元携手低迷油价 美元/加元升至1.3270高位】美元/加元在最近的两个交易日收跌，因为原油价格回升有助于大宗商品敏感的加元表现优于竞争对手。但是，当人们再次对冠状病毒倍感忧虑，促使原油价格下跌，并使得美元/加元反弹。截止发稿时，美元/加元当天上涨了0.15%，至1.3270。（FX168）,强势美元携手低迷油价 美元/加元升至1.3270高位
506,2020-02-14 10:20:23,【创业板指涨逾1%】创业板指涨逾1%，沪指涨近0.1%。,创业板指涨逾1%
507,2020-02-14 10:16:18,【上海又有28例新冠肺炎患者今日出院 其中6人愿捐献血浆】上海又有28例新冠肺炎患者今日(2月14日)出院。国家卫生健康委专家组成员、上海市公共卫生临床中心党委书记卢洪洲表示，今天出院患者中有6名愿意捐献血浆。此前有媒体报道指出，新冠肺炎患者痊愈后，血浆对现症患者有治疗作用。尤其是在目前没有特效治疗药的情况下，可快速用于抢救重症和危重症的新冠肺炎病人。（澎湃新闻）,上海又有28例新冠肺炎患者今日出院 其中6人愿捐献血浆
508,2020-02-14 10:16:03,"【盈利""大年""！139家非上市险企2019年业绩榜来了 谁是大赢家】上市的中国人寿、中国人保、中国太保和新华保险已业绩“预喜”，预告2019年净利大幅提升。非上市险企中，目前出炉的139家公司数据也显示出，中小险企的盈利面和盈利金额也有“双改善”。（券商中国）",盈利“大年”！139家非上市险企2019年业绩榜来了 谁是大赢家
509,2020-02-14 10:14:02,【紧急扩容 所有QQ群文件存储量升级至10G】从腾讯方面得到的消息，由于开学延期，众多老师通过QQ线上授课，在QQ群上传课件，教学视频的需求激增。为满足在线教学需求，2月13日腾讯QQ紧急对所有群的群文件存储容量进行了升级，从原来的2G扩容至10G。（证券时报）,所有QQ群文件存储量升级至10G
510,2020-02-14 10:12:27,【这家银行把第四大股东告上法庭 还八折甩卖其股权！股东不服：出价太便宜了】阿里司法拍卖平台信息显示，广东揭西农商行3252.48万股股权日前在揭阳市中级人民法院淘宝网司法拍卖(变卖)平台上进行公开变卖，目前变卖价为5412.13万元。（券商中国）,这家银行把第四大股东告上法庭 还八折甩卖其股权！股东不服：出价太便宜了
511,2020-02-14 10:10:05,【欧元/美元走势低迷 但仍预估反弹为时过早】法国农业信贷银行(Credit Agricole)周四(2月13日)分析了欧元/美元的前景展望并提出，虽然汇率在现水平非常低，但是反弹的预判还为时过早。（FX168）,欧元/美元走势低迷 但仍预估反弹为时过早
512,2020-02-14 10:08:25,【云梦城区实施战时管制】“平安云梦”发布关于在云梦城区实施战时管制的紧急通告，全县城区(镇区)所有小区、单位家属院一律实施全封闭管理，除抗疫车辆、公务用车、代购配送车、医护人员用车和救护、消防、抢险、警车等特种车辆外，其它车辆一律禁止出入。全县城区(镇区)居民基本生活必需物资，急需药品(感冒、咳嗽药品之外)实行全代购服务，定点超市、药店只准对代购员开放。通告自2020年2月13日24:00起实施。（证券时报）,云梦城区实施战时管制
513,2020-02-14 10:06:22,【出行教父李斌的抗疫之旅：直播卖车缓发工资 发内部信称正求生存】蔚来员工肖军对《财经天下》周刊表示，蔚来只是从2月8号临时延迟到2月14号发工资，目前13薪方案目前还没有定论。（财经天下周刊）,出行教父李斌的抗疫之旅：直播卖车缓发工资 发内部信称正求生存
514,2020-02-14 10:06:15,【花旗：做多瑞郎/日元多仓 入场点位112.22 目标115.00】花旗(Citi)周四(2月13日)持仓报告显示，该行新建瑞郎/日元多头仓位，入场点位112.22，目标115.00，止损设在110.50。（FX168）,花旗：做多瑞郎/日元多仓 入场点位112.22 目标115.00
515,2020-02-14 10:03:57,【特斯拉板块盘中走强】特斯拉板块盘中走强，秀强股份涨停，赣锋锂业、宁德时代、湘潭电化、鹏辉能源等纷纷异动。,特斯拉板块盘中走强
516,2020-02-14 10:02:34,【特斯拉汽车(北京)有限公司召回3183辆Model X系列汽车】特斯拉汽车(北京)有限公司决定自2020年6月7日起，召回2016年4月15日至2016年10月16日期间生产的部分进口Model X系列汽车，共计3183辆。（国家质检总局）,特斯拉汽车(北京)有限公司召回了3183辆Model X系列汽车
517,2020-02-14 10:02:17,【特斯拉汽车（北京）有限公司召回3183辆Model X系列汽车】日前，特斯拉汽车(北京)有限公司根据《缺陷汽车产品召回管理条例》和《缺陷汽车产品召回管理条例实施办法》的要求，向国家市场监督管理总局备案了召回计划。决定自2020年6月7日起，召回2016年4月15日至2016年10月16日期间生产的部分进口Model X系列汽车，共计3183辆。（市场监管总局）,特斯拉汽车（北京）有限公司召回3183辆Model X系列汽车
518,2020-02-14 10:02:10,【猪肉股拉升 牧原股份创历史新高】猪肉股拉升，牧原股份股份涨近6%创历史新高，新希望、天邦股份、正邦科技等跟涨。,猪肉股拉升
519,2020-02-14 10:01:16,【欧元兑美元正逼近“马克龙缺口” 汇价还要下跌？】欧元/美元走势过于迟缓？FXStreet分析师Yohay Elam周四(2月13日)撰文称，这一全球最受欢迎的货币对已连续数月陷于停滞，甚至一度跌至数年低点——这一走势有些令人沮丧。（FX168）,欧元兑美元正逼近“马克龙缺口” 汇价还要下跌？
520,2020-02-14 09:55:48,【欧洲经济延续低迷？欧元面临关键下行风险！】周五(2月14日)欧元兑美元延续跌势，在过去9个交易日中有8天收跌，日内最低跌至2017年5月以来最低1.0827。欧盟执行机构欧盟委员会表示，今年欧洲经济料延续低迷态势，并警告称疫情的爆发可能会进一步冲击经济前景。尽管国际贸易乐观向好，但疫情影响让世界陷入了新的危机。欧盟委员会将此称作“关键下行风险”。（汇通网）,欧洲经济延续低迷？欧元面临关键下行风险！
521,2020-02-14 09:52:53,【欧盟财长警告全球经济放缓比预期严重 欧元创两年半新低】周五(2月14日)亚市盘初，欧元兑美元继续走软，创逾两年半新低至1.0827，现交投于1.0834一线。（汇通网）,欧盟财长警告全球经济放缓比预期严重 欧元创两年半新低
522,2020-02-14 09:51:52,【2020年同等学力人员申请硕士学位考试报名推迟】国务院学位委员会办公室发布通知推迟2020年同等学力人员申请硕士学位外国语水平和学科综合水平全国统一考试报名时间。（中国新闻网）,2020年同等学力人员申请硕士学位考试报名推迟
523,2020-02-14 09:50:12,"【中国铁矿石库存下降90万吨至1.247亿吨】根据我的钢铁网数据，截止2月14日当周，岚山港铁矿石库存降幅最大，下降到475万吨，上周为520万吨。日照港增幅最大，达到1273万吨；较上周增加3.08%。青岛港1,320万吨，较上周减少20万吨。京唐港1575万吨，较上周减少26万吨。（我的钢铁网）",中国铁矿石库存下降90万吨至1.247亿吨
524,2020-02-14 09:45:55,【歌尔股份：小米是重要客户 有配合新机型小米10】歌尔股份在互动平台表示，小米是公司重要国内客户，公司近年来一直在配合该客户的高端机声学和微电子零组件，同样也有配合新发布的新机型小米10。（第一财经）,歌尔股份：小米是重要客户
525,2020-02-14 09:45:31,【峨眉山A:景区恢复开放时间尚不确定影响无法准确预估】峨眉山A在互动平台表示，为全力做好此次新冠疫情防控，避免人员聚焦引发的交叉感染，峨眉山景区自2020年1月24日起暂停对外开放，恢复开放时间尚不确定另行通知。因此次疫情发展趋势的不确定性，目前无法准确预估其影响的时间和程度。（第一财经）,峨眉山A:景区恢复开放时间尚不确定影响无法准确预估
526,2020-02-14 09:40:29,【芯片股开盘拉升】芯片股开盘拉升，广东芯片股智光电气、富满电子封板，台基股份、长电科技、兴森科技等跟涨。,芯片股开盘拉升
527,2020-02-14 09:36:27,【进入战时管制的中部小城：靠东风汽车赚500亿产值 人均年入3万7】2月13日下午，东风专用零部件有限公司工作人员向《财经天下》周刊表示，湖北省的要求是，企业不早于2月20日复工，但看张湾区要求，复工时间说不准了，估计要到月底。“再看情况吧，目前企业还算稳定，也没有听说裁员。”,进入战时管制的中部小城：靠东风汽车赚500亿产值 人均年入3万7
528,2020-02-14 09:33:00,【血制品板块概念股集体大涨】血制品板块集体大涨，上海莱士、天坛生物一字板，博雅生物、华兰生物、双林生物、卫光生物集体大幅高开，消息面上，治疗性新冠特免血浆制品投入临床。,血制品板块概念股集体大涨
529,2020-02-14 09:20:44,【香港恒生指数开盘小幅下跌0.11%】香港恒生指数开盘小幅下跌0.11%，应用软件、奢侈品股涨幅居前。,香港恒生指数开盘小幅下跌0.11%
530,2020-02-14 09:18:24,【安徽13日新增新冠肺炎确诊病例24例 累计934例】2月13日0-24时，安徽省报告新增确诊病例24例，新增死亡病例1例，新增治愈出院病例38例。累计报告确诊病例934例。（证券时报）,安徽13日新增新冠肺炎确诊病例24例
531,2020-02-14 09:16:59,【今年以来大涨110% 大股东高位减持 问询函深夜下发：是否存在内幕交易？】今年以来股价大涨110%，大股东趁机高位减持，一个月内4次百余机构调研……2月13日临近午夜，亚光科技披露了深交所下发的问询函，要求核查控股股东、实控人、大股东、董监高是否存在操纵股价、内幕交易的情形。（中国证券报）,今年以来大涨110% 大股东高位减持 问询函深夜下发：是否存在内幕交易？
532,2020-02-14 09:16:56,【韶能股份：子公司拟发展口罩设备业务并试生产口罩】韶能股份在互动平台表示，目前公司旗下子公司拟发展口罩设备业务并试生产口罩，计划时间为2020年2月下旬。（第一财经）,韶能股份：子公司拟发展口罩设备业务并试生产口罩
533,2020-02-14 09:15:30,【央行今日未开展逆回购操作】央行今日未开展逆回购操作，因今日没有逆回购到期，当日实现零投放和零回笼。（第一财经）,央行今天未开展逆回购操作
534,2020-02-14 09:15:28,【人民币兑美元中间价调贬58个基点】人民币兑美元中间价调贬58个基点，报6.9843。上一交易日报6.9785。（第一财经）,人民币兑美元中间价调贬58个基点
535,2020-02-14 09:13:25,【浙江新增新冠肺炎确诊病例10例 累计1155例】2月13日0-24时，浙江省报告新型冠状病毒肺炎新增确诊病例10例，新增出院病例40例。累计报告确诊病例1155例。（证券时报）,浙江新增确诊病例10例
536,2020-02-14 09:11:48,【799元甩卖5G手机？厂家招工赶订单 冰火两重天的真相是这个】疫情之下，手机线下销售遇冷，有门店本月仅卖出10部手机，有渠道商甚至799元甩卖5G手机。不过，在生产端，一些品牌手机的订单需求依然旺盛。近日，中证君从多家手机产业链公司了解到，目前公司复工率仅为50%，终端品牌5G手机订单需求不减，厂商甚至在催订单，但公司仍面临着工人紧缺、产能不足等问题。（中国证券报）,799元甩卖5G手机？厂家招工赶订单 冰火两重天的真相是这个
537,2020-02-14 09:06:48,"【女子居家隔离14天""自愈"":按时服药 喝鸡汤补营养】新冠肺炎暴发以来，各种防疫方法层出不穷。除了戴口罩、勤洗手，提升自身免疫力也是抗击病毒的关键。不少感染者通过自己的努力，最终战胜病毒。他们分享出自己隔离自愈的故事，希望给更多人带来抗击疫情的信心。（央视）",女子居家隔离14天“自愈”:按时服药 喝鸡汤补营养
538,2020-02-14 09:01:08,【白糖跌逾1%】国内期市开盘涨跌不一，白糖跌逾1%，鸡蛋高开0.74%。,白糖跌逾1%
539,2020-02-14 09:00:41,【富时A50中国指数期货开盘下跌0.2%】富时A50中国指数期货开盘下跌0.2%，隔夜夜盘收跌0.24%。,富时A50中国指数期货开盘下跌0.2%
540,2020-02-14 08:59:41,【中金：后续料有更多城市跟进楼市支持政策】中金公司认为，政策端在税费和土地款延期缴纳、信贷端支持等方面的倾斜，可有效缓解开发商的短期现金支付压力、提升其现金流安全性、缓释行业下行风险。而政府线上审批服务的推行和审批条件的适度放宽则有助于引导房企逐步恢复生产经营活动，促进楼市秩序回归。认为后续还将有更多城市在“因城施策”的框架下出台不同程度的楼市支持政策。（第一财经）,中金：后续料有更多城市跟进楼市支持政策
541,2020-02-14 08:58:14,【湖南新增新冠肺炎确诊病例20例累计确诊988例】2月13日0-24时，湖南省报告新型冠状病毒肺炎新增确诊病例20例，新增重症病例3例，新增死亡病例0例，新增出院病例40例。截至2月13日24时，湖南省累计报告新型冠状病毒肺炎确诊病例988例，累计报告重症病例130例，现有重症病例55例，死亡病例2例，出院病例352例。（证券时报）,湖南新增新冠肺炎确诊病例20例累计确诊988例
542,2020-02-14 08:57:53,【继口罩之后又有人抢购平板电脑 很多型号已卖断货】缺货，还是缺货。没想到近期被广泛讨论的网课教学，带火了平板电脑。（每日经济新闻）,继口罩之后又有人抢购平板电脑 很多型号已卖断货
543,2020-02-14 08:53:25,【国家知识产权局：对涉及防治新冠肺炎的专利、商标申请注册开辟“绿色通道”】2月13日上午，国家知识产权局召开党组会议暨局应对新冠肺炎疫情工作领导小组会议。会议强调，要扎实做好专利、商标、集成电路布图设计的申请受理和审查授权，做好服务窗口的各项工作；要积极支持企业复工复产和新项目开工建设，对复工复产企业和新建项目涉及防治新冠肺炎的专利、商标申请注册开辟“绿色通道”，加快办理效率；要指导和支持企业运用知识产权进行质押融资，缓解资金困难。（国家知识产权局网站）,知识产权局：对涉及防治新冠肺炎的专利、商标申请注册开辟“绿色通道”
544,2020-02-14 08:50:40,【河南13日新增新冠肺炎确诊病例15例 新增死亡病例1例】2月13日0-24时，河南省新增新型冠状病毒肺炎确诊病例15例，新增治愈病例55例，新增死亡病例1例。截至2月13日24时，全省累计报告新型冠状病毒肺炎确诊病例1184例，现有重症病例49例，现有危重病例34例，累计死亡病例11例，累计治愈病例313例。（证券时报）,河南13日新增确诊病例15例
545,2020-02-14 08:49:10,【数据】截至02月13日，上交所融资余额报5652.69亿元，较前一交易日增加5.64亿元；深交所融资余额报4744.96亿元，较前一交易日增加19.44亿元；两市合计10397.65亿元，较前一交易日增加25.08亿元。,上交所融资余额报5652.69亿
546,2020-02-14 08:44:26,【特斯拉盘后跌近1%】特斯拉盘后跌近1%，此前消息称特斯拉将增发的股票定价每股767美元，较昨日收盘价804美元折价4.6%。（金十数据）,特斯拉盘后跌近1%
