,datetime,content,title
197,2020-09-27 02:18:13,【国企改革三年行动方案已下发 双百、科改示范企业领跑】国务院国资委党委委员、秘书长彭华岗来到了湖南。9月26日，经济观察网记者获悉，两天前，彭华岗在中车株洲电力机车研究所有限公司调研时表示，三家“双百”企业(分别选取百户中央企业子企业和百家地方国有骨干企业推进综合改革，打造改革尖兵)要加大推进力度，做国企改革的尖兵。（经济观察网）,国企改革三年行动方案已下发 双百、科改示范企业领跑
198,2020-09-27 01:58:03,【非洲以南海域发生6.3级地震 震源深度10千米】据国家地震台网官方微博消息，中国地震台网正式测定：9月27日1时10分在非洲以南海域(南纬47.85度，东经31.72度)发生6.3级地震，震源深度10千米。（中国新闻网）,非洲以南海域发生6.3级地震 震源深度10千米
199,2020-09-27 01:39:42,【中法股东拟联合投入巨资 神龙汽车重振计划进入攻坚阶段】神龙汽车是中国最早一批建立的中外合资车企之一，旗下拥有东风雪铁龙和东风标致两个品牌，该公司与上汽大众、一汽-大众曾同样享有盛誉，其生产的爱丽舍车型是中国曾经最受欢迎的汽车，该车型与捷达、桑塔纳一起被称之为“老三样”，这种称呼代表了消费者对神龙品质和品牌的认可。在随后的发展中，神龙公司从2013年开始进入快速发展期，并在2015年达到了年销70万辆的高峰。（经济观察网）,中法股东拟联合投入巨资 神龙汽车重振计划进入攻坚阶段
200,2020-09-27 01:21:16,【出手抄底！平安增持1080万股汇丰控股 持股比例突破8% 重新成为第一大股东】当外界将目光聚焦在汇丰种种负面消息，以及中国平安在对汇丰的投资中浮亏几何等话题时，平安已悄然增持。据港交所披露易26日信息，平安在9月23日以平均每股28.2859港元的价格，增持1080万股汇丰控股股份。 （券商中国）,出手抄底！平安增持1080万股汇丰控股 持股比例突破8% 重新成为第一大股东
201,2020-09-27 01:00:20,【重磅财经前瞻：三季报披露节后启幕 七部新影片角逐国庆档】八天国庆、中秋双节假期将至，你准备怎样度过？未来两周(9月28日-10月11日)，又将有哪些重磅财经事件可能影响你的“钱袋子”？我们一起提前看！（中新经纬）,重磅财经前瞻：三季报披露节后启幕 七部新影片角逐国庆档
202,2020-09-27 00:40:15,【震惊！90后女出纳入职一年贪700余万 随手一个包20万！狂买60多件奢侈品】一间不到10平方米的房间里，堆满了各式各样的奢侈品，一件衣服6.4万元，一个包超过20万元……1990年出生的王雪，是北京市东城区某离退休干部休养所原出纳员。仅一年多的时间，王雪利用职务便利，侵吞、骗取公款多达720余万元，均用于个人奢侈消费。（中国基金报）,震惊！90后女出纳入职一年贪700余万 随手一个包20万！狂买60多件奢侈品
203,2020-09-27 00:22:19,【什么情况？这家券商员工扎堆“炒股”？2人干了5年未销户 还有刚入职就开户】近日，大通证券某营业部被福建证监局点名，因其对员工开立证券账户情况缺乏有效监控、未按要求发放经纪人执业证书及开展培训等。其中，该营业部有13名员工入职超过半年未注销证券账户，更有2名员工入职超过五年仍未注销账户，还有1名员工在入职后开立账户，可算是“知法犯法”。（券商中国）,什么情况？这家券商员工扎堆“炒股”？2人干了5年未销户 还有刚入职就开户
204,2020-09-27 00:04:48,【全球金融专家“把脉”发展机遇：“中国任何一个领域都是机会”】新冠肺炎疫情给世界经济带来冲击，亦为全球金融从业者带来挑战。目前最紧迫的风险是什么？未来最大发展机会何在？26日举行的全球财富管理论坛上海峰会上，来自不同国家的金融专家“云端”对话为此找寻答案。（中国新闻网）,全球金融专家“把脉”发展机遇：“中国任何一个领域都是机会”
205,2020-09-26 23:45:19,【中国首枚芯片邮票面世 可通过App读取芯片内容】新华社北京9月26日消息，中国邮政26日发行《第40届全国最佳邮票评选纪念》邮票纪念张，这是中国首枚NFC芯片邮票。该邮票在传统印刷工艺中植入NFC芯片，集邮者可通过中国邮政App读取芯片内容。（新华社）,中国首枚芯片邮票面世 可通过App读取芯片内容
206,2020-09-26 23:28:14,【中钢协：中国经济快速复苏带动钢铁需求显著增长】中国钢铁工业协会党委书记、执行会长何文波26日在2020(第十一届)中国钢铁节能减排论坛上指出，由于国家疫情应对得当、经济持续复苏，中国钢铁在疫情期间的生产规模世界占比大幅提升。（中国新闻网）,中钢协：中国经济快速复苏带动钢铁需求显著增长
207,2020-09-26 23:11:25,【“褚橙”掌舵人褚一斌：上市计划将延后一年】9月26日，“褚橙”所在的云南褚氏农业有限公司(下简称“褚氏农业”)举办2020产品说明会。总经理褚一斌表示，除“褚橙”外，今年将力推新品牌“云冠橙”。对业内关注的6年内上市计划，褚一斌称已有4家辅导机构进驻，但因疫情影响，上市计划将延后一年。（新京报）,“褚橙”掌舵人褚一斌：上市计划将延后一年
208,2020-09-26 22:56:40,【长三角示范区人才制度复制推广 公积金一体化加速落地】在本届长三角精英峰会上，长三角人才一体化发展城市联盟第三次联席会议召开，在原有20个联盟城市的基础上吸纳新的长三角城市加入，分别是江苏省的南京市、无锡市、扬州市和安徽省的滁州市。（第一财经）,长三角示范区人才制度复制推广 公积金一体化加速落地
209,2020-09-26 22:40:23,【平安耗资3亿港元补仓汇丰控股再度成为第一大股东 持股8%】中国平安再度成为汇丰控股第一大股东。香港联合交易所股权披露显示，9月23日，中国平安(601318.SH，2318.HK)旗下的平安资产管理有限公司(下称平安资管)以每股平均价28.2859港元买入1080万股汇丰控股(0005.HK)股票，合计出资约3.05亿港元。（澎湃新闻）,平安耗资3亿港元补仓汇丰控股再度成为第一大股东 持股8%
210,2020-09-26 22:22:13,【中国6.1亿吨粗钢产能正在实施超低排放改造】中国生态环境部大气环境司司长刘炳江26日在北京指出，目前中国钢铁业超低排放改造进展超预期，全国228家钢铁企业6.1亿吨粗钢产能正在实施超低排放改造。（中国新闻网）,中国6.1亿吨粗钢产能正在实施超低排放改造
211,2020-09-26 22:04:53,【广东支持粤港澳大湾区“金融80条”已有65条落地实施】记者从此间举行的第九届中国(广州)国际金融交易·博览会上获悉，截至8月末，广东出台的《关于贯彻落实金融支持粤港澳大湾区建设意见的实施方案》中所提80条措施中，65条措施已落地或正推进实施，为建设粤港澳大湾区提供了有力的金融支持。（新华社）,广东支持粤港澳大湾区“金融80条”已有65条落地实施
212,2020-09-26 21:55:27,【低利率时代全球财富管理迎挑战 ESG投资存在发展潜力】9月26日，全球财富管理论坛上海峰会召开。会上，来自瑞银集团、东方汇理、标准人寿安本集团、野村控股、罗素投资等多位国际资管机构高管详谈了对低利率时代全球财富管理行业的挑战与发展的看法。（第一财经）,低利率时代全球财富管理迎挑战 ESG投资存在发展潜力
213,2020-09-26 21:39:03,【国盛证券熊园：投资中国是门“好买卖” 长期看好科技和养老板块】国盛证券宏观首席分析师熊园9月26日在“建行·中证报金牛基金巡讲”第十场直播中表示，未来几年中国经济可能保持5%左右增长率，对全球资本具有很大吸引力。中长期来看，中国资产的相对优势很明显，投资中国核心资产是门“好买卖”。 他表示，长期看好科技和养老板块。（中证网）,国盛证券熊园：投资中国是门“好买卖” 长期看好科技和养老板块
214,2020-09-26 21:30:19,【跨国企业在华“因地制宜” 升级改造实体店拥抱数字化新零售】坐拥8.55亿数字消费者和最活跃的移动社交用户群体的中国市场，已经是全球消费品及零售商竞相抢夺的目标之一。于是，很多在华跨国企业或升级，或改造，或开设全新类型实体门店，落实中国本土化发展战略，赶搭中国市场“数字化”快车。麦肯锡的观点认为，线下实体店的复兴推动着实体零售的数字化创新，且有望彻底重塑购物体验。（中国新闻网）,跨国企业在华“因地制宜” 升级改造实体店拥抱数字化新零售
215,2020-09-26 21:23:20,【国家市场监管总局：组织开展节前景区客运索道安全检查】国家市场监管总局近日印发《关于加强中秋国庆期间景区特种设备安全工作的通知》，要求各地组织开展景区客运索道、大型游乐设施安全检查。目前，全国共有客运索道1078条、大型游乐设施2.51万台(套)。（中新经纬）,国家市场监管总局：组织开展节前景区客运索道安全检查
216,2020-09-26 21:13:39,【千亿P2P被立案侦查！汪涵、刘国梁曾发声道歉】9月26日，@平安东城发布消息，北京市公安局东城分局已对爱钱进(北京)信息科技有限公司(平台：爱钱进)涉嫌非法吸收公众存款案立案侦查。通告显示，为追缴涉案资金，近期东城公安分局会同东城区金融办对本案中涉及“钱站”“凡普信贷”“小凡分期”“普惠金融”等平台真实借款人开展追缴工作。（中国基金报）,千亿P2P被立案侦查！汪涵、刘国梁曾发声道歉
217,2020-09-26 21:11:07,【市值蒸发2000亿！这家国际大品牌“沦陷”：已计划关店1200家！最新业绩来了】时装品牌Zara母公司，西班牙企业Inditex上半年净亏1.95亿欧元(约合人民币15亿元)，而此前，为了应对疫情下的消费寒冬，Inditex便早已宣布于2020年及2021年关闭1000至1200间实体分店。今年以来，这家巨头集团，市值已经蒸发超2000亿元。（中国基金报）,市值蒸发2000亿！这家国际大品牌“沦陷”：已计划关店1200家！最新业绩来了
218,2020-09-26 21:05:22,【交银理财总裁：今年业务规模已增三成 转型越早越有主动权】9月26日，交银理财总裁金旗在中国资产管理武夷峰会圆桌论坛上表示，交银理财转型比较早，所以在今年的整体业务发展上，规模已经涨了30%，到年底估计会涨40%，明年可能还是会以这样的速度来发展。通过这样的速度能解决历史上的问题，但如果你就转型谈转型可能这个“车”跑不起来。（澎湃新闻）,交银理财总裁：今年业务规模已增三成 转型越早越有主动权
219,2020-09-26 20:53:06,【百万年薪去名校“抢人”！招聘季头部公募董事长亲自出马、投资总监上阵 阵仗有点大】金九银十招聘季来袭，还没找到工作？别慌，基金公司来了！大型公募基金公司董事长亲自上阵，进校园招徕人才，这阵仗属实罕见。随着公募REITs渐行渐近，这类新业务人才更是被各家争抢。（中国证券报）,百万年薪去名校“抢人”！招聘季头部公募董事长亲自出马、投资总监上阵 阵仗有点大
220,2020-09-26 20:50:44,【40亿资金未兑付、坑惨3000投资人 这家私募彻底凉了！又有59家私募被注销】9月25日，中国证券投资基金业协会发布两条公告，同时注销59家私募基金管理人登记。梳理发现，这些机构中有的负面新闻缠身，有的被当地刑侦部门介入，也有因经营不善不得不关门歇业，多数私募机构在诚信上都有问题。基金业协会表示，将继续秉持“扶优限劣”基本方针，不断完善私募基金行业诚信信息记录机制，促进行业合规健康发展。（中国证券报）,40亿资金未兑付、坑惨3000投资人 这家私募彻底凉了！又有59家私募被注销
221,2020-09-26 20:49:11,【美元指数显著反弹但仍承压】宏观经济研究机构MRB合伙公司表示，近来欧洲等地疫情再度严峻，加剧投资者对经济前景的悲观预期，市场避险情绪升温，助推美元指数反弹。但MRB合伙公司仍认为当下欧元对美元汇率被低估，看好欧元继续走强，美元则将因此承压下行。（新华网）,美元指数显著反弹但仍承压
222,2020-09-26 20:37:26,【探索长三角人才一体化发展：打破区域壁垒实现资源流动】在国务院发展研究中心原副主任侯云春看来，破除制度壁垒是实现长三角区域人才一体化的关键，因此要建立城市间人才柔性流动机制，实现人才政策无缝对接、人才作用充分发挥、人才流动无碍畅通。（中国新闻网）,探索长三角人才一体化发展：打破区域壁垒实现资源流动
223,2020-09-26 20:25:25,【北京环球度假区项目完工近九成 主体结构已封顶】北京市朝阳区政府官方微博消息，北京环球度假区项目正在加速建设中。据悉，项目工期进度已完成85.6%，目前环球度假区主体结构及主题公园已封顶，预计年内完工，为明年开园完成充分筹备。在位于环球影城主题公园的主入口可以看到，环球影城地标性的巨型地球形建筑已经搭建完毕。穿过一片广场，“北京环球影城”的白色中英文标牌已经亮相。（新京报）,北京环球度假区项目完工近九成 主体结构已封顶
224,2020-09-26 20:18:10,【安徽：总投资超过1600亿元的220个项目集中开工】26日，安徽省增强高质量发展动能暨全省贯彻“六稳”重大项目集中开工现场推进会在主会场宿州市和各市分会场举行。全省16市的220个项目集中开工，总投资1688.39亿元。据悉，安徽省将加强统筹协调，着力抓好项目工作调度，强化精准支持和服务保障，推动项目顺利实施、早见成效。（新华网）,安徽：总投资超过1600亿元的220个项目集中开工
225,2020-09-26 20:04:58,【上市公司电话接听率不足八成 投资者咨询服务电话哪类公司最畅通？最友好？】近期，中国证券投资者保护基金公司(简称“投保基金公司”)对证券公司、基金公司、期货公司和A股上市公司四类市场主体开展了2020年投资者咨询服务电话畅通情况专项调查。调查显示，基金公司接听率最高，为94.71%，上市公司最低（上海证券报）,上市公司电话接听率不足八成 投资者咨询服务电话哪类公司最畅通？最友好？
226,2020-09-26 19:58:05,【疯狂接盘医药股！机构借道大宗交易一周狂买近60亿元】临近国庆假期，尽管市场热度与成交量均有所下降，但是机构参与大宗交易的热情反而不减反增，仅本周一周就通过大宗交易买入了59.37亿元。从机构大额接盘的个股来看，医药生物的买入金额占比近半，此外电子、化工、食品饮料等行业也有多只个股被机构大举买入。有些前期热门股则遭到抛售，股价表现低迷。（上海证券报）,疯狂接盘医药股！机构借道大宗交易一周狂买近60亿元
227,2020-09-26 19:44:19,【5G让千年古道步行街释放新活力】唐朝就已是广州中轴线的北京路，如今成为一条覆盖5G网络的步行街。广州北京路步行街是2018年底商务部在全国启动的首批步行街改造提升试点之一。升级后的步行街将为促进消费、拉动内需带来更大发展空间。（新华网）,5G让千年古道步行街释放新活力
228,2020-09-26 19:31:22,【建信基金陶灿：中国消费、制造业相关产业吸引力巨大】建信基金权益投资部执行总经理陶灿表示，中国有巨大消费内需市场，同时也是制造业大国，相关产业升级具有独到竞争力，例如新能源、光伏等板块吸引力巨大。（中证网）,建信基金陶灿：中国消费、制造业相关产业吸引力巨大
229,2020-09-26 19:21:57,【建信基金陶灿：市场将以结构性机会为主】建信基金权益投资部执行总经理陶灿表示，当前，中国经济的亮点就是内需大市场提供基本盘，政策契合经济转型发展规律。对股市的影响在于“三期叠加”时期，市场将以结构性的机会为主。（中证网）,建信基金陶灿：市场将以结构性机会为主
230,2020-09-26 19:11:03,【“类金融”监管继续：商业保理企业将实行名单制管理】据悉，近日，银保监会普惠金融部印发《商业保理企业名单制管理工作方案》的函，对商业保理企业实施名单制管理。银保监会要求各省市金融监管局，对商业保理企业精准实施分类。对商业保理企业精准分类是有效开展处置工作的前提。各地方金融监督管理局（简称金融监管局）要充分采取非现场审查、现场检查、约谈、引入第三方参与核查等多种方式，摸清、摸透本辖区商业保理企业底数，做到分类结果客观、公正、经得起检验。（21世纪经济报道）,“类金融”监管继续：商业保理企业将实行名单制管理
231,2020-09-26 19:06:07,【图解陆股通：182家公司获北向资金明显增持 这些股最活跃】截至9月25日，近一周北向资金净流出247.10亿元，其中明显增持182家公司（持股增加＞0.1%）。对此，您有什么看法呢？,图解陆股通：182家公司获北向资金明显增持 这些股最活跃
232,2020-09-26 19:04:16,【凯儿得乐层级代理或涉嫌变相传销 律师建议加快微商立法】中国人民大学商法研究所所长刘俊海建议，参与微商的人，凡是属于第四、第五及以下梯队的不要参与，一是赚得少，二是涉嫌传销。现在很多微商模式的核心还是“排线布网”，产品只是道具，产品过了五六道手后已经违反了直销本意。（新京报）,凯儿得乐层级代理或涉嫌变相传销 律师建议加快微商立法
233,2020-09-26 18:50:00,【密云水库开渔 三条鱼王拍出61万余元高价】9月25日凌晨，密云水库结束了长达6个月的“休渔期”，再次迎来开渔，密云区鱼王文化节也正式拉开序幕。经过激烈竞拍，3条密云水库开渔后打捞上来的鱼王共拍出61万余元的高价，所得善款分别捐赠给水库上游河北省丰宁县、沽源县和南水北调发源地湖北省竹溪县以及密云区慈善救助协会。（新京报）,密云水库开渔 三条鱼王拍出61万余元高价
234,2020-09-26 18:40:42,【广东徐闻港新港区开通 为琼州海峡提供1700多万人次年通过能力】26日9时45分，随着首班客滚船“紫荆22号”缓缓从8号泊位驶出，广东省湛江市徐闻港区南山作业区客货滚装码头开通。这意味着粤港澳大湾区和海南自贸区之间添加一新的通道。据介绍，徐闻港新港区的开通，使徐闻到海口的航程时间缩短为1小时，比以往节省了一半的过海时间，提升了琼州海峡通航效率，形成了新的粤琼“一小时经济圈”。（新华网）,广东徐闻港新港区开通 为琼州海峡提供1700多万人次年通过能力
235,2020-09-26 18:28:05,【无人驾驶龙头获百家机构调研 正与英伟达联手干件大事！8年12倍的家电大牛股被盯上】统计显示，近一周以来机构调研个股数量有100多只。从调研机构类型来看，近一周证券公司调研相对最广泛，调研79多家公司，即近8成上市公司调研活动有券商参与；基金公司和阳光私募调研数量次之，分别调研56家和45家公司。（数据宝）,无人驾驶龙头获百家机构调研 8年12倍的家电大牛股也被盯上
236,2020-09-26 18:18:00,【印度央行增加外汇储备】印度央行公布的最新数据显示，截至9月18日，印度央行外汇储备达5450.38亿美元，相比一周前增加33.78亿美元。业内观察人士认为，印度央行之所以大量购汇和干预市场，是为了通过增加外汇储备增强困难时期处理金融问题的能力，增强海外投资者信心。印度央行还希望通过提升外汇储备增加市场流动性，同时平抑外汇市场波动。（新华社）,印度央行增加外汇储备
237,2020-09-26 18:10:43,【习近平出席第三次中央新疆工作座谈会并发表重要讲话】第三次中央新疆工作座谈会9月25日至26日在北京召开。中共中央总书记、国家主席、中央军委主席习近平出席会议并发表重要讲话。习近平强调，当前和今后一个时期，做好新疆工作，要完整准确贯彻新时代党的治疆方略，牢牢扭住新疆工作总目标，依法治疆、团结稳疆、文化润疆、富民兴疆、长期建疆，以推进治理体系和治理能力现代化为保障，多谋长远之策，多行固本之举，努力建设团结和谐、繁荣富裕、文明进步、安居乐业、生态良好的新时代中国特色社会主义新疆。（新华视点）,习近平出席第三次中央新疆工作座谈会并发表重要讲话
238,2020-09-26 18:02:16,【国内最大LNG储罐成功升顶 由中国自主设计、自主建造】9月26日，由中国海洋石油集团有限公司(下称中国海油)自主设计、自主建造的4座22万方LNG(液化天然气)储罐在江苏盐城成功升顶。这是国内最大单罐容积的LNG储罐项目，也是国内一次性建设规模最大的LNG国家储备基地，标志着中国LNG储罐核心建造技术再上新台阶。（澎湃新闻）,国内最大LNG储罐成功升顶 由中国自主设计、自主建造
239,2020-09-26 17:56:54,【损失约8亿，一审宣判！为了此案，吴京、黄渤、沈腾、韩寒曾组成“受害者联盟”】据中国版权协会监测数据显示：8部贺岁片侵权链接达3.89万条，点击播放总量约8288.2万人次，造成票房损失约7.87亿元。（21世纪经济报道）,损失约8亿 一审宣判！吴京、黄渤、沈腾、韩寒曾组成“受害者联盟”
240,2020-09-26 17:50:27,【Iphone12最快29日公布发布时间 市值一度缩水近6000亿美元、又到买入时？】受iPhone12推迟发布等影响，苹果公司股价近期由涨转跌，并于9月21日创下9月以来股价新低103.1美元/股，相较9月初的最高137.98美元/股跌去25%，苹果市值也最大缩水近6000亿美元。如此走势令部分分析师看不下去了，9月26日，摩根士丹利分析师Katy Huberty在最新报告中表示，现在正是逢低买入苹果股票的好时机，并重申了其对该公司股票“增持”的评级和130美元的目标价。（证券时报）,Iphone12最快29日公布发布时间 市值一度缩水近6000亿美元、又到买入时？
241,2020-09-26 17:47:46,【河北出台治理“餐饮浪费”省级地方性法规】为破解餐饮浪费焦点难点问题提供法治方案，河北省十三届人大常委会第十九次会议日前审议通过了《河北省人民代表大会常务委员会关于厉行节约、反对餐饮浪费的规定》。（新华网）,河北出台治理“餐饮浪费”省级地方性法规
242,2020-09-26 17:36:02,【北京影院再“松绑” 国庆档新片预售近7千万】自9月25日起，北京的电影院，每场放映的上座率上限调整为75%，影院迎来了新一轮的“松绑”。25日，电影《夺冠》正式公映，这也是疫情以来，首部回归院线的2020春节档大片。相比去年的国庆档，今年预售开启较晚，但预售次日的增速要明显高于去年。截止至9月25日16时，国庆假期首日预售票房接近7000万，其中《我和我的家乡》《姜子牙》首日预售分超2700万和2600万。（央视新闻）,北京影院再“松绑” 国庆档新片预售近7千万
243,2020-09-26 17:27:25,【11家基金获批QDII额度150亿 行业累计规模超2600亿 海外布局迎发展窗口？】国家外汇管理局官网最新披露了合格境内机构投资者(QDII)投资额度审批情况，外管局进行了新一轮QDII扩容，共向18家金融机构发放33.6亿美元(折合人民币约150亿元)的投资额度。（券商中国）,11家基金获批QDII额度150亿 行业累计规模超2600亿 海外布局迎发展窗口？
244,2020-09-26 17:23:17,【A股暴富神话正在消失！指数投资时代或已到来】A股早期市场投资高手出现的百倍、千倍的惊人收益渐行渐远。随着A股市场逐步成熟，聪明钱太多，以及基金产品规模迅速增长，在最近五年的市场行情中，明星基金经理战胜指数的难度正在提升。（券商中国）,A股暴富神话正在消失！指数投资时代或已到来
245,2020-09-26 17:18:35,【宁夏多举措促进消费】记者从宁夏回族自治区政府了解到，宁夏将在培育消费载体、推进电子商务等方面实施一系列举措，进一步稳定和促进消费。（新华网）,宁夏多举措促进消费
