,datetime,content,title
692,2020-03-12 18:05:13,【工信部：2019年中钢协会员钢企利润同比下降30.9%】工信部日前表示，由于钢铁产量增幅加快，钢材价格呈窄幅波动下行走势，铁矿石等原燃材料价格上涨等因素影响，钢铁企业经济效益大幅回落。2019年中国钢铁工业协会会员钢铁企业实现销售收入4.27万亿元，同比增长10.1%；实现利润1889.94亿元，同比下降30.9%；累计销售利润率4.43%，同比下降2.63个百分点。（一财）,工信部：2019年中钢协会员钢企利润同比下降30.9%
693,2020-03-12 18:03:02,【长沙银行稳定股价方案：第一大股东拟增持不低于1000万股】长沙银行(601577)3月12日晚披露稳定股价方案，公司第一大股东长沙市财政局增持的股份数量不低于1000万股；此外，18名管理人员增持股份金额合计不低于157.47万元。增持实施期限为自3月13日起6个月内。（证券时报）,长沙银行稳定股价方案：第一大股东拟增持不低于1000万股
694,2020-03-12 18:02:21,【福达股份：拟定增募资不超10.1亿元】福达股份(603166)3月12日晚披露非公开发行股票预案，发行对象为不超过35名特定投资者，发行数量不超1.79亿股，募资总额不超过10.1亿元，扣除发行费用后用于投资大型曲轴精密锻造生产线项目，以及补充流动资金。（证券时报）,福达股份：拟定增募资不超10.1亿元
695,2020-03-12 18:00:11,【字节跳动组织升级：张楠成字节跳动（中国）CEO】2020年3月12日，字节跳动在成立八周年之际，宣布组织全面升级。3月12日起，张利东担任字节跳动（中国）董事长，作为中国职能总负责人，全面协调公司运营，包括字节跳动中国的战略、商业化、战略合作伙伴建设、法务、公共事务、公共关系、财务、人力；抖音CEO张楠将担任字节跳动（中国）CEO，作为中国业务总负责人，全面协调公司中国业务的产品、运营、市场和内容合作，包括今日头条、抖音、西瓜视频、搜索等业务和产品。两人向张一鸣汇报。（一财）,字节跳动组织升级：张楠成字节跳动（中国）CEO
696,2020-03-12 17:58:44,【商务部：进一步强化电商扶贫、产销对接等举措落实】商务部印发《关于统筹做好新冠肺炎疫情防控和商务扶贫工作的通知》。通知提出，进一步强化电商扶贫、产销对接等举措落实，开展品牌推介洽谈活动、电商实操培训，加大力度动员和组织电商企业、大型农产品批发市场、公益性农产品示范市场、物流企业等与贫困地区积极对接，切实解决扶贫农畜牧产品滞销问题，多渠道解决农产品卖难问题。（证券时报）,商务部：进一步强化电商扶贫、产销对接等举措落实
697,2020-03-12 17:56:22,【市场大举押注降息100点  美联储却失了方向】周三(3月11日)美股结束了史上最长牛市，市场对于美国经济放缓的忧虑大幅升温，这使得美联储3月决议降息100点预期一度飙升至95%上方。而就在上周美联储刚刚紧急降息50点。,市场大举押注降息100点  美联储却失了方向
698,2020-03-12 17:53:41,【中国人寿：前2月保费收入约2280亿元】中国人寿(601628)3月12日晚公告，公司2020年1至2月期间，累计原保险保费收入约为2280亿元，上年同期为1892亿元。（证券时报）,中国人寿：前2月保费收入约2280亿元
699,2020-03-12 17:53:02,【中国人民银行、国家外汇管理局进一步便利境内机构跨境融资】日前，中国人民银行、国家外汇管理局联合发布《中国人民银行国家外汇管理局关于调整全口径跨境融资宏观审慎调节参数的通知》(银发〔2020〕64号，以下简称《通知》)，将全口径跨境融资宏观审慎调节参数由1上调至1.25。（外汇局网站）,央行、外汇管理局进一步便利境内机构跨境融资
700,2020-03-12 17:50:45,【一汽轿车：重大资产重组事项获证监会核准】一汽轿车(000800)3月12日晚间公告，公司收到证监会核发的《关于核准一汽轿车股份有限公司重大资产重组及向中国第一汽车股份有限公司发行股份购买资产的批复》，核准公司向中国第一汽车股份有限公司发行29.82亿股股份购买相关资产。（证券时报）,一汽轿车：重大资产重组事项获证监会核准
701,2020-03-12 17:44:39,【腾讯运营的switch版超级马力欧奥德赛进口游戏通过审批】原国家新闻出版广电总局官网12日发布2020年进口网络游戏审批信息，共27款游戏通过审批，腾讯运营的switch版超级马力欧奥德赛在列。（一财）,腾讯运营的switch版超级马力欧奥德赛进口游戏通过审批
702,2020-03-12 17:39:29,【湖北省印发《湖北省促进经济社会加快发展若干政策措施》】3月12日，湖北省印发《湖北省促进经济社会加快发展若干政策措施》。措施提出加强信贷纾困：各金融机构不得盲目抽贷、断贷、压贷，确保企业不因资金问题影响复工复产。2020年，全省普惠型小微企业贷款增速要高于各项贷款平均增速，小微企业贷款余额和新增贷款规模不低于去年水平，其中国有大银行上半年普惠型小微贷款余额同比增速力争不低于30%，全年增速不低于20%。（证券时报）,湖北省印发《湖北省促进经济社会加快发展若干政策措施》
703,2020-03-12 17:35:34,【自然资源部：开展矿产资源规划（2021-2025年）编制工作】自然资源部发布关于全面开展矿产资源规划（2021-2025年）编制工作的通知。通知称，2020年6月底前，形成全国规划草案。2020年12月底前，完善规划文本，组织规划论证。2021年3月底前，联合发展改革委、工业和信息化部、财政部、生态环境部、商务部等上报国务院审批。（证券时报）,自然资源部：开展矿产资源规划（2021-2025年）编制工作
704,2020-03-12 17:34:44,【行情】标普500指数期货跌超5%，触发交易限制。,标普500指数期货跌超5% 触发交易限制
705,2020-03-12 17:30:54,【数据】北向资金今日净买入TCL科技3.66亿元、牧原股份1.89亿元，净卖出中国平安12.15亿元、五粮液9.98亿元。,北向资金净卖出中国平安12.15亿、五粮液9.98亿
706,2020-03-12 17:25:05,【中证指数：调整香港新股、沪深精明优选和互联互通等指数样本股】根据指数规则，中证指数有限公司决定对香港新股(930945)、沪深精明优选和互联互通等指数的样本股进行调整，将于3月16日生效。另外，中证指数有限公司决定对深圳科技(931136)指数的样本股进行调整，将于3月16日生效。（证券时报）,中证指数：调整香港新股、沪深精明优选和互联互通等指数样本股
707,2020-03-12 17:23:53,【长安汽车：2月份销量同比降74%】长安汽车(000625)3月12日晚间公告，2月份销量合计28763辆，去年同期为109464辆，同比下降73.72%。（证券时报）,长安汽车：2月份销量同比降74%
708,2020-03-12 17:22:19,【吉华集团：拟6.53亿元改造旧厂区 建创新创业共享平台】吉华集团(603980)3月12日晚间公告，公司拟6.53亿元将红山农场厂区闲置的存量土地及旧厂区改建为“吉华创新产业园”，吸引优质企业入驻，并以向入驻企业收取租金的方式为公司创造新的利润增长点。项目结合空港区域优势和产业规划，重点围绕高端制造和生物医药等契合临空经济规划的新兴产业，建设创新创业共享平台。（e公司）,吉华集团：拟6.53亿元改造旧厂区 建创新创业共享平台
709,2020-03-12 17:18:51,【行情】巴基斯坦股指大跌，触发市场交易暂停机制。,巴基斯坦股指大跌 触发市场交易暂停机制
710,2020-03-12 17:15:37,【证监会同意三友医疗科创板IPO注册】近日，我会按法定程序同意以下企业科创板首次公开发行股票注册：上海三友医疗器械股份有限公司。上述企业及其承销商将与上海证券交易所协商确定发行日程，并刊登招股文件。（证监会网站）,证监会同意三友医疗科创板IPO注册
711,2020-03-12 17:13:20,【吉林化纤：股东3月11日减持1%股份】吉林化纤(000420)3月12日晚间公告，公司股东方威3月11日通过集中竞价交易减持所持公司股份1970万股，占公司股份总数的1%。（证券时报）,吉林化纤：股东3月11日减持1%股份
712,2020-03-12 17:10:47,【伦敦金属交易所（LME）镍注销仓单下降17100吨】伦敦金属交易所（LME）镍注销仓单下降17100吨，为纪录最大跌幅。（界面）,伦敦金属交易所（LME）镍注销仓单下降17100吨
713,2020-03-12 17:07:10,【钟南山：6月份结束疫情可以期待 但有前提条件】12日下午，广东省举行疫情防控例行新闻发布会，钟南山表示，预测本次疫情在6月份结束是可以期待的。（人民日报）,钟南山：6月份结束疫情可以期待 但有前提条件
714,2020-03-12 17:06:16,【行情】印度Sensex指数跌幅扩大至8%，势创2008年以来最大单日跌幅。,印度Sensex指数跌幅扩大至8%
715,2020-03-12 17:00:32,【国务院发布《关于授权和委托用地审批权的决定》】将国务院可以授权的永久基本农田以外的农用地转为建设用地审批事项授权各省、自治区、直辖市人民政府批准。（中国政府网）,国务院发布《关于授权和委托用地审批权的决定》
716,2020-03-12 16:57:33,【行情】离岸人民币兑美元短线跳水，跌幅扩大至超300个基点，跌破7关口。（界面）,离岸人民币兑美元短线跳水 盘中跌破7.0整数关口
717,2020-03-12 16:57:29,【金融委办公室地方协调机制（上海市）成立】人民银行上海总部召集中央金融管理部门驻沪机构、上海市政府相关部门于3月12日成立国务院金融稳定发展委员会办公室地方协调机制（上海市），并召开上海协调机制第一次全体会议。近期上海协调机制将重点围绕多方面开展工作，包括：支持区域金融改革创新，加快推动上海国际金融中心建设和金融支持长三角一体化发展“30条意见”落地实施，为加快推进上海国际金融中心建设和金融支持长三角一体化创造良好的金融生态环境。（证券时报）,金融委办公室地方协调机制（上海市）成立
718,2020-03-12 16:56:29,【中国银行：全额赎回了249.3亿元次级债券】中国银行(601988)公告，2010年3月9日，该行发行了15年期固定利率规模为人民币249.3亿元的次级债券。根据本期债券募集说明书相关条款的规定，该期债券设有发行人赎回权，发行人有权在该期债券第十年末，即2020年3月11日赎回该期债券。截至该公告日，该行已行使赎回权，全额赎回了该期债券。（全景网）,中国银行：全额赎回了249.3亿元次级债券
719,2020-03-12 16:54:52,【欧股全线下挫主要股指均跌逾6% 美股纳指期货盘中触发熔断】欧洲主要股指开盘全线下挫，截至发稿，德国DAX指数、法国CAC40指数、欧洲斯托克50指数跌幅均扩大至逾7%，西班牙IBEX指数跌近7%。美股纳斯达克指数期货触及7590止损的跌停区间，跌幅扩大至5%，触发熔断。截至发稿，美股三大股指期货跌幅均超4%，纳指期货跌4.08%，道指期货跌4.37%，标普500指数期货跌4.05%。（第一财经）,欧股全线下挫主要股指均跌逾7% 美股纳指期货盘中触发熔断
720,2020-03-12 16:53:58,【欧洲主要股指跌幅超7%】德国DAX指数、法国CAC40指数、欧洲斯托克50指数跌幅均扩大至逾7%，西班牙IBEX指数跌近7%。,欧洲主要股指跌幅超7%
721,2020-03-12 16:51:04,【搜于特今日跌停 游资合计卖出超2亿元】口罩概念股搜于特今日跌停。盘后数据显示，深股通专用买入1938万元并卖出1042万元；五大券商营业部合计卖出2.22亿元，其中东兴证券上海肇嘉浜路卖出6731万元。（一财）,搜于特今日跌停 游资合计卖出超2亿元
722,2020-03-12 16:46:44,【新华保险：前2月保费收入为395.6亿元】新华保险(601336)3月12日晚间公告，公司2020年1至2月期间累计原保险保费收入为395.6亿元，上年同期为274.3亿元。（证券时报）,新华保险：前2月保费收入为395.6亿元
723,2020-03-12 16:45:15,【行情】美股股指期货扩大跌幅，道指期货跌超5%。,美股股指期货扩大跌幅 道指期货跌超5%
724,2020-03-12 16:44:10,【奥飞数据盘中大幅震荡 八机构席位现身龙虎榜】3月12日，奥飞数据(300738)盘中触及跌停，最终收涨3.17%，盘中振幅18%，全天成交6.9亿元。盘后数据显示，机构资金博弈激烈，八个机构席位登上龙虎榜。具体来看，四个机构席位合计买入1.38亿元，其中，买一机构席位买入1.03亿元；四个机构席位合计卖出9934万元。（证券时报）,奥飞数据盘中大幅震荡 八机构席位现身龙虎榜
725,2020-03-12 16:39:51,【我国首个中外合资海上风电项目正式落地】近日，国家能源集团与法国电力集团签署了国家能源集团东台海上风电有限责任公司《合资合同》和《认购协议》，双方将合资建设并运营装机容量达502兆瓦的东台海上风电项目，我国首个中外合资海上风电项目正式落地。（一财）,我国首个中外合资海上风电项目正式落地
726,2020-03-12 16:35:58,【印尼主要股指暂停交易】印尼主要股指跌幅达5%，触发暂停交易。,印尼主要股指暂停交易
727,2020-03-12 16:30:52,【欧股全线下挫主要股指均跌逾6% 美股纳指期货盘中触发熔断】欧洲主要股指开盘全线下挫，截至发稿，德国DAX指数跌6.43%，英国富时100指数跌6.01%，欧洲斯托克50指数跌6.50%。美股纳斯达克指数期货触及7590止损的跌停区间，跌幅扩大至5%，触发熔断。截至发稿，美股三大股指期货跌幅均超4%，纳指期货跌4.08%，道指期货跌4.37%，标普500指数期货跌4.05%。（第一财经）,欧股全线下挫主要股指均跌逾6% 美股纳指期货盘中触发熔断
728,2020-03-12 16:30:08,【快讯】伊朗将4月销售至亚洲的轻质原油官方价格设定为贴水3.10美元/桶。,伊朗将4月销售至亚洲的轻质原油官方价格设定为贴水3.10美元/桶
729,2020-03-12 16:29:08,【十连板海特生物提示风险：新药研发受多方面影响】连续十日涨停的海特生物(300683)3月12日晚间公告，公司于2月27日披露的《关于国家Ⅰ类新药重组变构人肿瘤坏死因子相关凋亡诱导配体 III 期临床试验揭盲结果的公告》不会对公司近期业绩产生重大影响，仅是关键数据的初步分析结果，完整的有效性和安全性结果将以统计分析报告的最终分析结果为准。新药研发受到技术、审批、政策等多方面的影响，相关研发进展及未来产品市场竞争形势等均存在诸多不确定性风险。（证券时报）,十连板海特生物提示风险：新药研发受多方面影响
730,2020-03-12 16:26:52,【工信部副部长：全力推进电子信息企业复工复产】3月9日，工信部副部长王志军带队，赴北京经济技术开发区，调研骨干电子信息企业疫情防控和复工复产情况。王志军一行走访了冠捷显示科技(中国)有限公司、中芯北方集成电路制造(北京)有限公司、北方华创科技集团股份公司三家企业，实地查看疫情防控工作开展情况，了解复工复产面临的问题。王志军强调，要在做好疫情防控措施的基础上，全力推进企业复工复产，发挥骨干企业作用，带动产业链上下游协同发展。（证券时报）,工信部副部长：全力推进电子信息企业复工复产
731,2020-03-12 16:25:32,【滨江集团业绩快报：2019年净利16.38亿元 同比增35%】滨江集团(002244)3月12日晚间披露业绩快报，公司2019年实现营业总收入250.35亿元，同比增长18.56%；净利润16.38亿元，同比增长34.6%；每股收益0.53元。（证券时报）,滨江集团业绩快报：2019年净利16.38亿元 同比增35%
732,2020-03-12 16:23:10,【新安股份：1.47亿元增资杭新固废公司 提升危废处置能力】新安股份(600596)3月12日晚间公告，为提升公司危废处置的渠道与能力，降低公司危废处置成本和运营风险，公司拟出资1.47亿元，取得杭新固废公司新增的2000万元股权。增资完成后，杭新固废公司注册资本5000万元，公司持有40%股权。杭新固废公司将加快推进工业固废综合利用项目和二期项目（新建100吨/天焚烧处理线，扩建安全填埋场库容至35万立方米）的审批和建设。（证券时报）,新安股份：1.47亿元增资杭新固废公司 提升危废处置能力
733,2020-03-12 16:19:32,【2月至今全国新增餐饮企业同比下滑64.9%】在现有餐饮企业暂未完全复工的情况下，新增餐饮企业数量则下滑明显。天眼查专业版数据显示，2020年2月1日-3月12日，全国新增餐饮企业仅53129家，与去年同期相比下降64.9%。分地域来看，新增的餐饮企业主要集中在贵州、广东、四川、福建和山东。其中，疫情中心的湖北省，餐饮业基本停摆，在此期间仅增加了3家餐饮企业，而去年同期则新增了3810家。（证券时报）,2月至今全国新增餐饮企业同比下滑64.9%
734,2020-03-12 16:18:48,【金河生物：控股股东拟减持不超2%股份】金河生物(002688)3月12日晚间公告，公司控股股东金河建安计划15个交易日后的6个月内，以集中竞价方式减持不超过1270.58万股，占公司总股本的2%。（证券时报）,金河生物：控股股东拟减持不超2%股份
735,2020-03-12 16:16:39,【行情】MSCI全球指数较2月峰值跌20%，势将进入熊市。,MSCI全球指数较2月峰值跌20% 势将进入熊市
736,2020-03-12 16:12:33,【陕西宝鸡楼市新政：积极争取降低首套住房贷款首付比例】陕西宝鸡市人民政府网站12日发布《宝鸡市住建行业坚决打赢新冠肺炎疫情防控阻击战稳企业稳民生稳发展若干措施》，措施共计15条，包括信贷支持、土拍保证金比例、土地出让金分期支付、调整公积金贷款额度等。其中，第12条明确，各银行要积极争取降低首套住房贷款首付比例政策，公积金贷款最高额度由40万提高至50万。（一财）,陕西宝鸡楼市新政：积极争取降低首套住房贷款首付比例
737,2020-03-12 16:10:26,【收盘播报】香港恒生指数今日低开后，全天维持低位震荡，最终收盘大跌逾900点，跌幅3.66%，收报24309.07点。,香港恒生指数收盘跌逾900点 跌幅3.66%
738,2020-03-12 16:10:04,【行情】欧洲斯托克600指数跌幅扩大至4.9%。,欧洲斯托克600指数跌幅扩大至4.9%
739,2020-03-12 16:08:38,【行情】欧洲斯托克600航空及娱乐版块大跌8.1%，创2013年10月以来新低。,欧洲斯托克600航空及娱乐版块大跌8.1%
740,2020-03-12 16:04:56,【特斯拉盘前跌逾5% 此前遭大摩下调目标价及销售预期】特斯拉美股盘前跌逾5%，此前摩根士丹利将特斯拉2020年销售预期下调10%，将特斯拉目标价由500美元下调至480美元。,特斯拉盘前跌逾5% 此前遭大摩下调目标价及销售预期
741,2020-03-12 16:03:44,【商务部：支持出口企业组织口罩等医疗物资对外供应】商务部外贸司司长李兴乾表示，下一步我们将进一步扩大国际和地区合作，分享疫情防控经验。在克服自身困难同时，对有关国家，特别是疫情较重国家和地区，给予力所能及的帮助。中国政府将继续支持出口企业组织口罩等医疗物资对外供应，为全球防疫作出应有贡献。（一财）,商务部：支持出口企业组织口罩等医疗物资对外供应
742,2020-03-12 16:02:10,【安科瑞：2019年净利1.13亿元 同比增17%】安科瑞(300286)3月12日晚间披露年报，公司2019年实现营业收入6亿元，同比增长31.1%；净利润1.13亿元，同比增长16.66%；每股收益0.54元。公司拟每10股派发现金红利2元（含税）。公司预计2020年一季度净利润为1376.15万元-1965.93万元，同比下降0%-30%。（证券时报）,安科瑞：2019年净利1.13亿元 同比增17%
743,2020-03-12 16:00:52,【欧股开盘大跌 美股纳指期货盘中触发熔断】欧洲主要股指开盘全线下挫，德国DAX指数跌5.7%，英国富时100指数跌5.1%，欧洲斯托克50指数跌6.26%。截至发稿，美股三大股指期货跌幅均超4%，纳指期货跌4.08%，道指期货跌4.37%，标普500指数期货跌4.05%。（第一财经）,欧股开盘大跌 美股纳指期货盘中触发熔断
744,2020-03-12 16:00:36,【欧洲主要股指全线下挫 欧洲斯托克50指数跌6.26%】欧洲主要股指全线下挫，德国DAX指数跌5.7%，英国富时100指数跌5.1%，欧洲斯托克50指数跌6.26%。,欧洲主要股指全线下挫 德国DAX指数跌5.7%
745,2020-03-12 15:58:56,【市场监管总局：全面持续加大防疫用品价格监管力度】市场监管总局价监竞争局一级巡视员陈志江3月12日表示，市场监管总局将全面持续加大防疫用品价格监管力度，不留死角、不留短板，对哄抬价格违法行为坚持零容忍，发现一起查处一起，决不姑息，维护好市场价格秩序，支持全国抗击疫情大局，支持企业复工复产。（证券时报）,市场监管总局：全面持续加大防疫用品价格监管力度
746,2020-03-12 15:54:40,【商务部：19省市重点外贸企业复工率达到或接近100%】3月12日，商务部外贸司司长李兴乾介绍，从地方外贸企业总体复工情况看，山东、安徽、辽宁等8省市外贸企业复工率超过80%。从重点外贸企业复工情况看，浙江、江苏、上海等19省市复工率达到或接近100%。（证券时报）,商务部：19省市重点外贸企业复工率达到或接近100%
747,2020-03-12 15:52:40,【国家电网又发重磅计划！特高压建设超预期 电网投资规模将超万亿】上证报记者最新获悉，国家电网公司已研究编制了《2020年特高压和跨省500千伏及以上交直流项目前期工作计划》，明确将加速南阳-荆门-长沙工程等5交5直特高压工程年内核准以及前期预可研工作。（上证报）,国家电网又发重磅计划！特高压建设超预期 电网投资规模将超万亿
748,2020-03-12 15:50:07,【应急管理部：截至目前已检查指导22.3万家危险化学品等高危企业】应急管理部表示，截至到目前已在前面组织了2万多个、17.2万人次参加的安全指导组，紧盯危险化学品、煤矿、非煤矿山这些高危行业，检查指导了22.3万家企业，整改了16.8万处问题隐患。（一财）,应急管理部：截至目前已检查指导22.3万家危险化学品等高危企业
749,2020-03-12 15:49:47,【数据揭秘：A股大跌前会有五大信号！现在出现几个了？结论可能出乎你意料！】近期，受疫情、油价等因素影响，美股等全球主要市场剧烈波动，道琼斯工业指数近15个交易日跌去将近20%。日经225指数、英国富时100指数等同期跌幅均在20%左右。,数据揭秘：A股大跌前会有五大信号！现在出现几个了？结论可能出乎你意料！
750,2020-03-12 15:49:14,【精功科技：子公司已签署4187万元口罩生产线合同】精功科技(002006)3月12日晚间公告，公司控股子公司精功机器人已完成口罩生产线研发、试制各项工作，形成了小批量生产制造能力。截至3月12日，精功机器人已累计签署口罩生产线合同89台（其中，已发货7台，目前正在客户单位进行整机安装、调试），合同总额4187.5万元（其中已到账设备定金2850万元），预计口罩生产线业务所占公司营业收入比例较小，对公司2020年经营业绩不会产生重大影响。（证券时报）,精功科技：子公司已签署4187万元口罩生产线合同
751,2020-03-12 15:48:24,【新疆交建：预计2019年净利润1.79亿元 同比下降49.35%】新疆交建发布2019年度业绩快报，初步预计2019年实现净利润1.79亿元，同比下降49.35%。（界面）,新疆交建：预计2019年净利润1.79亿元 同比下降49.35%
752,2020-03-12 15:48:16,【澳元喜获财政刺激支撑 0.6313是短期低点？公共卫生阴霾下 机构观点分歧不小！】澳大利亚政府3月11日宣布的刺激计划虽成功提振澳元，但机构对澳元前景观点不一。盛宝银行认为，全球经济可能遭公共卫生危机的冲击，现在预测澳元见底为时过早。道明证券则暗示，只要政府能采取有力措施，澳元有望获得支撑。德国商业银行认为，若澳元能收于10月低点0.6671上方，则能确认3月9日闪崩后的0.6313是短期低点。（汇通网）,澳元喜获财政刺激支撑 0.6313是短期低点？公共卫生阴霾下 机构观点分歧不小！
