,datetime,content,title
0,2020-08-09 23:51:18,【世界最大石油公司利润骤降超70%！股价在发行价附近徘徊】沙特国家石油公司——沙特阿美石油公司当地时间9日上午公布了公司2020年二季度财务数据，其中二季度利润为66亿美元(约合人民币460亿元)，比第一季度骤降71.6%，而上半年总利润约为232亿美元，比去年同期下降了超过6%。（央视财经）,世界最大石油公司利润骤降超70%！股价在发行价附近徘徊
1,2020-08-09 23:34:42,【五位资管大佬热议理财子公司：最大的问题是客户对于净值化产品的接受程度】业内人士认为，作为银行的资管部门和理财子公司差异很大，既要在业务产品开发、风险管理上均衡的管理，还要做大量的反洗钱和消费者保护工作。而在过去，做资管部的时候消费者保护是由零售部门做的，反洗钱部门是法律合规部。（21世纪经济报道）,五位资管大佬热议理财子公司：最大的问题是客户对于净值化产品的接受程度
2,2020-08-09 23:09:36,【技术、需求双重催化 超大尺寸显示屏万亿市场之门已经打开】近两年来， LED显示屏市场变得越来越快、越来越复杂，随着LED显示屏于高端零售、会议室、电影院等细分商用显示市场需求增加，COB小间距、Mini LED、Micro LED 等新技术趋势此起彼伏。LED显示屏在技术和需求双重催化下，众多厂商紧盯市场和需求的变化，抢先创新技术和产品，从而赢得未来市场的主动权。（证券网）,技术、需求双重催化 超大尺寸显示屏万亿市场之门已经打开
3,2020-08-09 22:50:12,【头部影片定档助推电影市场复苏 两条主线掘金相关板块机会】一批大制作电影近日先后公布其在中国内地的上映日期，传递出中国电影市场从新冠肺炎疫情中加速复苏的信号。因疫情防控需要而停业数月后，中国内地低风险地区电影院在有效落实防控措施的前提下，自7月20日起恢复开放营业。这些措施包括每场放映上座率不得超过三成、陌生观众间距1米以上等。（第一财经）,头部影片定档助推电影市场复苏 两条主线掘金相关板块机会
4,2020-08-09 22:30:25,【70亿口罩合同终止！公司最新回应：订单尚未开始生产】今年以来，新冠疫情在全球的蔓延，使得口罩成为稀缺品，众多A股公司纷纷做起了口罩生意，金发科技(600143)便是其中一员。两个多月前，金发科技还接到了一家美国企业近10亿美元的大单，投资者也是喜出望外，公司股票也是应声涨停。殊不知，金发科技在多次沟通未果的情况下，公司如今宣布终止合同。（e公司）,70亿口罩合同终止！公司最新回应：订单尚未开始生产
5,2020-08-09 22:12:20,【玻璃厂商宣布提升调价幅度 终端市场需求良好】山东巨润8月9日宣布，原计划10日起产品价格上调3元/重箱，现调整为5元/重箱。滕州金晶玻璃也宣布，10日起的价格上调幅度由2元/重箱更改为5元/重箱。期货方面，玻璃近月合约上周上涨13.06%，处于数年来的新高附近。百川资讯分析师指出，玻璃现货市场情绪继续好转，市场成交也开始放量。旗滨集团浮法玻璃产能在全国居首；金晶科技已形成纯碱-玻璃-玻璃深加工产业链。（上证资讯）,玻璃厂商宣布提升调价幅度 终端市场需求良好
6,2020-08-09 21:49:22,【饲料全面禁抗开启 催生2000万吨级行业巨头】2018年，农业农村部发布《兽用抗菌药使用减量化行动试点工作方案(2018—2021年)》明确了饲料端减抗和限抗的时间表。过渡期后，中国饲料“禁抗令”开始正式全面施行，2020年7月1日起，全国饲料生产企业停止生产含有促生长类药物饲料添加剂(抗生素)的商品饲料。（第一财经）,饲料全面禁抗开启 催生2000万吨级行业巨头
7,2020-08-09 21:40:13,【MSCI将宣布8月份季度指数评审结果 三大数据勾勒概念股分化特征！】据MSCI官网公告，MSCI将于8月12日宣布8月份季度指数评审结果，结果将于8月31日收盘或者9月1日开盘时生效。据MSCI此前的公告，此次季度评审不涉及A股纳入因子变化。不过，MSCI可能会根据沪股通和深股通调整调进或者调出部分A股股票，具体安排需以MSCI公告为准。（证券日报网）,MSCI将宣布8月份季度指数评审结果 三大数据勾勒概念股分化特征！
8,2020-08-09 21:20:02,【保险股被系统性低估 投资价值凸显】中国保险企业被系统性低估了。在长期增长逻辑完善的情况下，中国保险股的整体估值恢复只是时间问题。（证券市场红周刊）,保险股被系统性低估 投资价值凸显
9,2020-08-09 21:05:46,【贝壳找房8月13日登陆纽交所 最高募资23.15亿美元】最新招股书数据显示，贝壳找房预计8月13日登陆纽交所，证券代码为“BEKE”，发行价格区间为每股美国存托股票(ADS)17~19美元，预计募资总额18.41亿~21.19亿美元，共计将发行1.06亿股ADS。（界面新闻）,贝壳找房8月13日登陆纽交所 最高募资23.15亿美元
10,2020-08-09 20:54:51,【70亿口罩订单告吹！一年50%净利润没了 抗疫牛股摊上事 黑天鹅或早有端倪】8月9日晚，金发科技(600143.SH)发布公告称，此前公司与美国某公司签订订购金额为9.75亿美元的KN95口罩订单，因买方未履行合同要求而终止。（e公司）,70亿口罩订单告吹！一年50%净利润没了 抗疫牛股摊上事 黑天鹅或早有端倪
11,2020-08-09 20:53:49,【一周机构去哪儿？易方达基金、高盛等调研了这些个股（名单）】上周(8.3~8.7)，A股震荡向上，上证指数和深证成指分别上涨1.33%和0.08%。数据显示，当周两市仅有33家上市公司披露调研报告。从行业分布来看，被调研公司集中在医药生物、食品饮料、计算机等行业。（证券时报网）,一周机构去哪儿？易方达基金、高盛等调研了这些个股（名单）
12,2020-08-09 20:46:58,【水泥涨价+天山股份重组 概念股有望受关注】据中国水泥网数据显示，8月以来，长三角水泥价格全面上涨。此外，8月7日晚，天山股份披露重大资产重组预案，公司拟向控股股东中国建材等发行股份收购中国建材水泥板块资产。综合来看，水泥行业利好因素较多，短期有望受到资金的重点青睐，标的方面有祁连山(600720)、上峰水泥(000672)、宁波富达(600724)等。（证券时报网）,水泥涨价+天山股份重组 概念股有望受关注
13,2020-08-09 20:42:03,【优客工场终止赴美上市 正考虑其他替代方案 估值缩水近7成】最新信息显示，联合办公空间运营商优客工场向美国证券交易委员会(SEC)递交文件，正式撤回独立IPO申请，“鉴于当前的资本市场状况，公司正在考虑其他替代方案，并决定暂不进行证券的发行和出售。”公告内容显示，优客工场请求美国证券交易委员会同意撤销其最初于去年12月11日提出的IPO申请。（创业资本汇）,优客工场终止赴美上市 正考虑其他替代方案 估值缩水近7成
14,2020-08-09 20:37:14,【金价突然大跌！牛市还在么？三家实力私募：关键看这个】在强势突破2000美元大关后，国际金价还在不断创出新高。金价今年以来已上涨超过30%，价格飙升的动力来自哪里？是否已经积聚了风险？（中国基金报）,金价突然大跌！牛市还在么？三家实力私募：关键看这个
15,2020-08-09 20:32:13,【下周18只新股连发！医药、军工等各个热门板块的新股都有！】继本周19只新股连发后，A股将延续打新狂欢。从行业分布来看，下周有5只新股来自医药生物板块，3只来自化工板块，2只来自电子板块，另有一只军工板块新股——派克新材。此外，“氢能汽车第一股”亿华通将于明日(周一)上市。（上海证券报）,下周18只新股连发！医药、军工等各个热门板块的新股都有！
16,2020-08-09 20:24:57,【清和泉董事长刘青山：当前股市走强的驱动力仍在 优质企业不预测估值天花板】8月9日，在诺亚财富举办的领军者线上峰会中，清和泉资本董事长刘青山做了主题发言。刘青山指出：“优质企业的估值虽然高，但是本质上的上涨逻辑还没有出现变化，依然是最具投资价值的赛道。仅按照目标价或者估值高低来买卖股票，很可能会错过股价长期的上涨。”（证券市场红周刊）,清和泉董事长刘青山：当前股市走强的驱动力仍在 优质企业不预测估值天花板
17,2020-08-09 20:13:40,【兴证策略：把握经济复苏主线】把握“复苏”主线，从“通缩”转向基本面“复苏”，部分行业正式进入补库存周期，特别是当前处于库存周期底部区域的中游原材料、工业品，如有色、化工、机械等；下游消费品，如医药、汽车等。（王德伦策略与投资）,兴证策略：把握经济复苏主线
18,2020-08-09 19:57:05,【安信策略：仍处震荡格局 线索依然围绕“大循环”】我们维持市场短期“中性”判断，即市场这一阶段处于震荡格局，我们认为短期受外部的影响，新一轮整体上升行情仍然需要等待，结构重点关注“国内大循环”，展望未来，疫苗、美国大选与“五中全会”都可能是影响市场逻辑的重大变量。近期重点关注军工、信创、苹果产业链、白酒、建材等。（陈果A股策略）,安信策略：仍处震荡格局 线索依然围绕“大循环”
19,2020-08-09 19:44:56,【棕榈股份定增议案未获股东大会通过 控股股东或将继续推行定增】棕榈股份(002431)8月9日晚披露临时股东大会决议，本次股东大会出现否决议案的情形，否决议案包括《关于公司2020年度非公开发行股票方案的议案》等。棕榈股份证券部相关人员表示，控股股东对公司的发展还是“坚定看好”的，未来仍会通过定增或其他方式扩大持股，进一步巩固控股权。（e公司）,棕榈股份定增议案未获股东大会通过 控股股东或将继续推行定增
20,2020-08-09 19:38:25,【当当网创始人李国庆和俞渝被儿子告上法庭】8月9日晚间，当当网创始人李国庆在其个人微博上称，自己和俞渝被儿子告上法庭，目的是要求法院确认我和俞渝为他代持当当股份的代持协议有效。（界面新闻）,当当网创始人李国庆和俞渝被儿子告上法庭
21,2020-08-09 19:31:53,【捷强装备中签号码出炉 共3.8万个】捷强装备(300875)8月9日晚披露网上定价发行中签摇号结果，中签号码共有3.84万个，每个中签号码只能认购500股天津捷强动力装备股份有限公司A股股票。（e公司）,捷强装备中签号码出炉 共3.8万个
22,2020-08-09 19:15:30,【复盘50年黄金走势：2000美元只是“开胃菜”？知名大佬强烈看多 一珠宝公司获3只社保杀入！】近日，国际金价一路高歌，创出历史新高，首次突破2000美元大关。从A股来看，飚股赤峰黄金从去年11月以来，上涨近5倍。山东黄金、中金黄金、银泰黄金等也是稳步走高。那么是否还有一些低位股可挖掘呢？（每日经济新闻）,复盘50年黄金走势：2000美元只是“开胃菜”？知名大佬强烈看多
23,2020-08-09 19:01:39,【信息安全龙头获百家机构调研 北上资金狂买！这些公司中报高增长低估值】近一周机构调研个股数量有40多只，启明星辰成为调研机构数量最多的股票。从调研机构类型来看，近一周证券公司调研相对最广泛，调研40家公司，即超8成上市公司调研活动有券商参与；基金公司和阳光私募调研数量次之，分别调研32家和23家公司。（数据宝）,信息安全龙头获百家机构调研 北上资金狂买！这些公司中报高增长低估值
24,2020-08-09 18:52:21,【超600亿市值即将解禁 云计算龙头面临冲击 解禁比例最高股名单出炉】数据宝统计显示，下周共有33股面临解禁，以最新收盘价计算，合计解禁市值600.2亿元。从单只股票解禁规模来看，6股解禁市值在30亿元以上，分别是微芯生物、晶晨股份、贝瑞基因、青鸟消防、河钢资源、海特生物，在面临解禁的公司中，有多只科技龙头在列，包括云计算龙头用友网络、5G光模块龙头中际旭创、基因测序龙头贝瑞基因等。（数据宝）,超600亿市值即将解禁 云计算龙头面临冲击 解禁比例最高股名单出炉
25,2020-08-09 18:43:36,【石基信息：筹划分拆子公司思迅软件至境内交易所上市】石基信息公告，公司董事会授权公司及思迅软件管理层启动分拆思迅软件至境内交易所上市的前期筹备工作。（界面新闻）,石基信息：筹划分拆子公司思迅软件至境内交易所上市
26,2020-08-09 18:32:30,【中国一汽：7月销量突破32万辆 同比增长23.2%】中国一汽官方微信8月9日发布的数据显示，中国一汽7月生产整车33.73万辆，同比增长28.6%；销售整车32.25万辆，同比增长23.2%。7月，乘用车方面，共计生产乘用车28.63万辆，同比增长18.0%；销售乘用车27.55万辆，同比增长15.6%。商用车方面，共计生产商用车51002辆，同比增长159.4%；销售商用车46964辆，同比增长99.5%。（中证网）,中国一汽：7月销量突破32万辆 同比增长23.2%
27,2020-08-09 18:30:11,【八大机构论市】中信证券：外围扰动有底线，借冲击布局三条主线；海通策略：短期调整属于扰动，中期牛市3浪继续；粤开策略：震荡上行，关注四大主线。,【八大机构论市】中信证券：外围扰动有底线 借冲击布局三条主线
28,2020-08-09 18:13:38,【华泰策略：市场波动率上升后风格或进一步再平衡】8月以来市场的波动率显著提升，反映市场分歧加大，认为后续市场预期再次走向一致过程或使风格进一步偏向价值股。政策导向方面，央行二季度的货币政策再次明确跨周期调节，我们认为实际是给未来“十四五”预留政策空间，在此基础上，A股市场慢牛基础或更加扎实。维持有“牛”但无“快牛”的判断，配置“内循环”相关板块。（第一财经）,华泰策略：市场波动率上升后风格或进一步再平衡
29,2020-08-09 18:03:44,【博晖创新：子公司静注人免疫球蛋白取得药品注册证预计不会对本年度业绩产生重大影响】博晖创新(300318)8月9日晚间回复深交所关注函称，公司控股子公司河北大安制药有限公司近日静注人免疫球蛋白和人凝血酶原复合物取得药品注册证，由于血液制品的生产周期较长，静注人免疫球蛋白和人凝血酶原复合物在今年取得批签发数及可售产品数量较少，预计不会对河北大安及公司本年度业绩产生重大影响。7月29日至8月5日，博晖创新股价连续6个交易日涨停。（e公司）,博晖创新：子公司静注人免疫球蛋白取得药品注册证预计不会对本年度业绩产生重大影响
30,2020-08-09 18:03:13,【万年青：以所持南方水泥股权参与天山股份重大资产重组】万年青(000789)8月9日晚间公告，鉴于天山股份拟以发行股份购买资产的方式收购中国建材水泥板块资产，正在论证的标的公司包括本公司参股的南方水泥。公司现持有南方水泥1.27115%的股权，董事会同意公司以所持有的南方水泥股权参与天山股份发行股份购买资产，并同意公司与天山股份就南方水泥股权转让事宜签署相关协议。（e公司）,万年青：以所持南方水泥股权参与天山股份重大资产重组
31,2020-08-09 17:54:28,【名臣健康：拟收购海南华多、杭州雷焰100%股权 切入移动网络游戏行业】名臣健康(002919)8月9日晚间公告，公司拟支付现金收购海南华多100%股权及杭州雷焰100%股权，交易价格为1.33亿元、1.29亿元，由此切入移动网络游戏行业，打造新的业绩增长点。目前，海南华多、杭州雷焰主要收入分别来自于《王者国度》、《百龙霸业》，2020年1-3月，分别实现净利润5163.63万元、2618.83万元。（e公司）,名臣健康：拟收购海南华多、杭州雷焰100%股权 切入移动网络游戏行业
32,2020-08-09 17:53:52,【贝达药业：盐酸恩沙替尼eXalt3研究期中分析结果发布】贝达药业(300558)8月9日晚间公告，公司近日发布盐酸恩沙替尼eXalt3研究期中分析结果，在ALK阳性非小细胞肺癌患者中，恩沙替尼显著延长无进展生存期，具有良好的安全性，是一线治疗的新选择。基于该eXalt3研究结果，公司将积极准备中美一线适应症的上市申报，恩沙替尼将成为公司第一个在全球上市的创新药。（e公司）,贝达药业：盐酸恩沙替尼eXalt3研究期中分析结果发布
33,2020-08-09 17:49:37,【“翻倍基”你追我赶 战况胶着！基金重仓板块还有上涨后劲吗？】今年以来医药、消费、科技、传统周期、军工行情已轮番上演，基金重仓股的估值已经越来越贵。这些前期强势的品种还有多少上涨“后劲”？（上海证券报）,“翻倍基”你追我赶 战况胶着！基金重仓板块还有上涨后劲吗？
34,2020-08-09 17:48:43,【杭锅股份：拟收购中来股份控制权】杭锅股份(002534)8月9日晚披露重大资产重组预案，拟购买林建伟、张育政持有中来股份的股份以及受让表决权委托，实现对中来股份的控制。其中，第一次股份转让杭锅股份拟购买中来股份9.58%股份，转让价格9.9元/股；满足相关条件后，公司第二次收购中来股份9.09%股份。两次交易完成后，公司将持有中来股份18.67%股份，并持有10%股份的委托表决权。中来股份8月7日报收7.59元/股。（e公司）,杭锅股份：拟收购中来股份控制权
35,2020-08-09 17:44:06,【露笑科技：将与合肥市长丰县政府投资建设第三代功率半导体（碳化硅）产业园 投资总规模预计100亿】露笑科技(002617)8月9日晚间公告，8月8日公司与合肥市长丰县人民政府在合肥市政府签署战略合作框架协议，公司将与合肥市长丰县人民政府在合肥市长丰县共同投资建设第三代功率半导体（碳化硅）产业园，包括但不限于碳化硅等第三代半导体的研发及产业化项目，包括碳化硅晶体生长、衬底制作、外延生长等的研发生产，项目投资总规模预计100亿元。（e公司）,露笑科技：将与合肥市长丰县政府投资建设第三代功率半导体（碳化硅）产业园 投资总规模预计100亿
36,2020-08-09 17:38:58,"【益生股份：7月鸡苗价格环比上涨21%】益生股份(002458)8月9日晚间公告，公司2020年07月鸡苗销售数量4461.81万只，销售收入12369.06万元，同比变动分别为33.19%、-34.93%，环比变动分别为3.40%、25.13%。益生股份介绍，随着消费的逐步回暖，2020年7月鸡苗价格环比已上涨21%,但价格仍低于去年同期，公司鸡苗销售收入同比下降。（e公司）",益生股份：7月鸡苗价格环比上涨21%
37,2020-08-09 17:34:36,【国泰君安：震荡格局有望延续 顺周期板块相对收益可期】国泰君安策略分析师李少君等8月9日表示，盈利修复对冲风险偏好下行，资金行为显示外部冲击弱化，震荡格局有望延续。顺周期板块相对收益可期，消费稳健，科技暂歇，推荐银行/建材/机械/家电/汽车/新能源。消费与医药仍有长期配置价值，压力测试显示，尽管消费与医药估值分位数超95%，但当前估值包含的盈利预期并未过分地高。从中报情况看，消费与医药板块高估值的基本面基础坚实。（e公司）,国泰君安：震荡格局有望延续 顺周期板块相对收益可期
38,2020-08-09 17:21:08,【广电5G巨无霸真的来了】此前有消息称，广电5G的“全国一网”股份公司，即中国广电网络股份有限公司(下称：广电股份)(筹)计划于今年组建挂牌。最新权威消息显示，广电股份真的来了。（上海证券报）,广电5G巨无霸真的来了
39,2020-08-09 17:15:51,【南威软件：中标2.14亿元项目】南威软件(603636)8月9日晚间公告，公司中标闽侯县公安局闽侯县“雪亮工程”二期建设项目（包1），中标金额2.14亿元，项目建设内容包括安全系统、本地创新应用、应用支撑平台、云存储系统、传输网络系统、前端监控系统及视频监控中心改造等项目建设。合同签订后549个日历日完成项目整体竣工验收。（e公司）,南威软件：中标2.14亿元项目
40,2020-08-09 17:08:10,【嘉化能源：董事长管建忠因个人原因申请辞去公司董事长】嘉化能源9日称，董事长管建忠因个人原因申请辞去公司董事长、战略与发展委员会主任委员、薪酬与考核委员会委员职务及下属控股子公司所有职务，辞职后不再担任公司及下属控股子公司任何职务。（界面新闻）,嘉化能源：董事长管建忠因个人原因申请辞去公司董事长
41,2020-08-09 16:57:05,【金力永磁：上半年净利润9150万元 同比增长55%】金力永磁(300748)8月9日晚间披露半年报，公司上半年实现营收9.63亿元，同比增长23.47%；净利润9150万元，同比增长55.34%；基本每股收益0.22元。受益于空调新能效标准的颁布和实施，报告期内，公司节能变频空调领域收入达到3.39亿元，较上年同期增长72.84%。公司新能源汽车及汽车零部件领域收入达到1.27亿元，较上年同期增长27.76%。（证券时报）,金力永磁：上半年净利润9150万元 同比增长55%
42,2020-08-09 16:56:26,【“一参一控”政策松绑 部分大券商拟申请公募牌照】记者从多位行业人士处获悉，目前已有部分大型券商有意愿申请公募牌照，部分公司已经启动了内部流程。行业人士分析，大型券商的入局，公募行业参与主体将更趋多元化，未来券商可能在股票ETF等权益类产品、公募REITs等创新产品方面优先布局，而基金业在核心投研人才、基金销售渠道等方面的竞争也将更趋激烈。,“一参一控”政策松绑 部分大券商拟申请公募牌照
43,2020-08-09 16:46:35,【易纲：保持金融总量适度 着力稳企业保就业】面对当前经济金融形势，下半年货币政策走向如何？怎样应对更加复杂多变的国际形势？记者专访了中国人民银行行长易纲。易纲表示，总的看，中国经济潜力大、韧性足的特点并没有改变，下半年我国经济增长将延续复苏的态势，全年有望实现正增长。（新华社）,易纲：保持金融总量适度 着力稳企业保就业
44,2020-08-09 16:39:46,【奥维通信：上半年实现净利526万元 同比扭亏】奥维通信(002231)8月9日晚间披露半年报，公司上半年实现营收6679万元，同比下降20.61%；净利润526万元，去年同期亏损289万元；基本每股收益0.0147元。受国内疫情影响，公司及公司上下游企业复工延迟，导致公司上半年营业收入同比有所下降。报告期内，公司加大力度开展军队用户信息化集成建设和产品研发与销售。报告期内，公司军品业务收入2231万元，同比上年同期下降1.84%。（证券时报）,奥维通信：上半年实现净利526万元 同比扭亏
45,2020-08-09 16:38:40,【又一批私募被注销 多家上市公司踩雷、20亿基金违约！】8月7日晚间，中国证券投资基金业协会发布了最新的注销私募名单，上海良卓资产、上海良杉资产、深圳弘泰基金、深圳市前海维亚基金、湖南九华私募股权投资等22家机构，因为公示期满三个月且未主动联系协会提供有效证明材料，协会将注销其管理人登记。（中国基金报）,又一批私募被注销 多家上市公司踩雷、20亿基金违约！
46,2020-08-09 16:38:01,【远兴能源连续大涨：纯碱和尿素售价回升 其他经营情况未发生重大变化】远兴能源(000683)近三个交易日涨超25%，公司8月9日晚披露股票交易异常波动公告表示，关注到近期纯碱和尿素的期货主力合约呈现上涨趋势，公司主导产品纯碱和尿素的销售价格也有所回升，公司其他经营情况和外部经营环境未发生重大变化。（证券时报）,远兴能源连续大涨：纯碱和尿素售价回升 其他经营情况未发生重大变化
47,2020-08-09 16:30:39,【ST步森：收到《行政处罚决定书》】ST步森(002569)8月9日晚间公告，公司收到中国证监会浙江监管局下发的《行政处罚决定书》，对公司责令改正，给予警告，并处以50万元罚款。证监会指出，公司未及时披露为徐茂栋实际控制企业天马轴承集团股份有限公司向德清县中小企业金融服务中心有限公司借款1亿元提供担保的情况等。（证券时报网）,ST步森：收到《行政处罚决定书》
