,datetime,content,title
0,2020-10-14 23:52:30,【行情】现货黄金短线走低近5美元，报1905.7美元/盎司。（金十数据）,现货黄金短线走低近5美元
1,2020-10-14 23:42:35,【风电发展路线图确定：剑指30亿风能 “十四五”规划应符合碳中和目标】10月14日，在北京召开的“2020北京风能大会”上，400多家风电企业史上首度发起联合宣言，确定了2060年之前风电发展的“路线图”。（21世纪经济报道）,风电发展路线图确定：剑指30亿风能 “十四五”规划应符合碳中和目标
2,2020-10-14 23:26:42,【蔚来汽车涨幅扩大至20%】美股新能源汽车股继续走强，蔚来汽车涨幅扩大至20%，公司今日正式推出NOP领航辅助功能，理想汽车、小鹏汽车涨逾11%。（21世纪经济报道）,蔚来汽车涨幅扩大至20%
3,2020-10-14 23:15:45,【受上游晶圆供应紧缺影响 富满电子产品再次涨价】富满电子发布调价通知称，由于晶圆价格大幅上涨，导致公司产品成本大幅上升且严重缺货。公司决定，8205系列产品出货单价自2020年10月14日起，在原价基础上，再上调0.05元。（界面新闻）,受上游晶圆供应紧缺影响富满电子产品再次涨价
4,2020-10-14 23:11:24,【国内商品期货夜盘多数上涨 燃油收涨逾3%】国内商品期货夜盘多数上涨。燃油收涨逾3%，LPG涨超2%，短纤涨近2%。橡胶、沥青分别涨1.09%、1.29%，螺纹钢、热轧卷板分别跌0.28%、1.06%，铁矿石跌1.8%。（21世纪经济报道）,国内商品期货夜盘多数上涨 燃油收涨逾3%
5,2020-10-14 23:02:10,【德国权威研究机构联合报告下调今明两年德国经济预期】德国五大权威经济研究所14日发布联合经济预测报告，下调今明两年德国经济预期。报告预测今年德国经济将萎缩5.4%，比春季预测的萎缩4.2%更糟；明年德国经济将增长4.7%，低于上次预测的5.8%。下调经济预期的主要原因是此次报告预期新冠疫情的影响比春季预期更持久，同时对经济恢复进程的评估更悲观。（新华网）,德国权威研究机构联合报告下调今明两年德国经济预期
6,2020-10-14 22:46:08,【转型失败 生鲜电商平台易果生鲜被曝已进入破产重组】从多名易果生鲜前员工处证实，易果生鲜确实已进入破产重组。一名易果生鲜前员工表示，去年4月份，市场部100多人就已经走的差不多了，公司一直想再融资，没有成功。另一名易果生鲜的前员工则表示：“易果生鲜在C端发展没达到预期，被盒马比下来了，转型做B端，也做不起来，尤其很重要的‘安鲜达’冷链物流也没扶起来。易果生鲜和天猫最重要的关系是天猫超市生鲜区，这块GMV应该未达到预期，后来直接关掉了。”（澎湃新闻）,转型失败 生鲜电商平台易果生鲜被曝已进入破产重组
7,2020-10-14 22:45:16,【英镑兑美元GBP/USD涨1%】英镑兑美元GBP/USD涨1%，现报1.3064。（21世纪经济报道）,英镑兑美元GBP/USD涨1%
8,2020-10-14 22:41:31,【袁隆平“超优千号”创盐碱地水稻高产新纪录】今日下午，由袁隆平“海水稻”团队和江苏省农业技术推广总站合作试验种植的耐盐水稻在江苏如东栟茶方凌垦区进行测产，经专家团队对3块各1亩左右稻田机收实测，“超优千号”耐盐水稻的平均亩产量达到802.9公斤，中国水稻研究所研究员方福平表示，这个产量创下盐碱地水稻高产新纪录。（新华网）,袁隆平“超优千号”创盐碱地水稻高产新纪录
9,2020-10-14 22:36:30,【美国三大股指悉数下跌】美国三大股指悉数下跌，苹果目前涨幅不足0.2%，特斯拉维持超过1.8%的涨幅，蔚来汽车涨幅收窄至15%。（金十数据）,美国三大股指悉数下跌
10,2020-10-14 22:25:50,【背靠18000亿级卫星市场、身披5G光环 又一家芯片企业拟冲刺科创板！】近日，通信基带芯片商北京中科晶上科技股份有限公司的科创板IPO申请获上交所受理，保荐机构为中信建投证券。若其顺利上市，科创板又将迎来一只芯片股。（全景财经）,背靠18000亿级卫星市场、身披5G光环 又一家芯片企业拟冲刺科创板！
11,2020-10-14 22:19:45,【雷军：下决心在“硬核技术”上突围 比如相机和屏幕技术】小米集团创始人、董事长兼首席执行官雷军今日表示，下决心在“硬核技术”上突围，比如相机技术、屏幕技术。今年，小米研发投入将超过100亿元，以后每年都会以一定的比例进行增长。（界面新闻）,雷军：下决心在“硬核技术”上突围 比如相机和屏幕技术
12,2020-10-14 22:15:47,【央行人士谈汇率：保持人民币汇率弹性 稳定市场预期】四季度货币政策如何定调？当前宏观杠杆率高不高？怎样看待人民币汇率后续走势？房企融资新规成效如何？针对上述市场关心的热点问题，中国人民银行货币政策司司长孙国峰、调查统计司司长阮健弘、宏观审慎管理局副局长赵先信、金融市场司副司长彭立峰等相关负责人在第三季度金融统计数据发布会上一一给予了解答。（中国证券报）,央行人士谈汇率：保持人民币汇率弹性 稳定市场预期
13,2020-10-14 22:10:34,【深交所：积极服务粤港澳大湾区建设 促进科技、资本和实体经济高水平循环】深交所：以创业板改革并试点注册制为契机，深入推进落实全面深化资本市场改革重点任务和先行示范区首批授权事项清单，积极服务粤港澳大湾区建设，促进科技、资本和实体经济高水平循环。借鉴国际最佳实践，推动构建与国际接轨的制度规则体系，进一步提升自身竞争能力、开放监管能力和风险防控能力。（深交所）,深交所：积极服务粤港澳大湾区建设 促进科技、资本和实体经济高水平循环
14,2020-10-14 22:02:03,【这次打新“包中”？一大波投资者摩拳擦掌 多家机构看好】10月15日，南方航空发行的南航转债将开启网上申购，总发行规模为160亿元。由于发行规模较大，不少投资者表示，顶格申购或“包中签”。到底南航转债能否100%中签？另外，是否值得申购？（上海证券报）,这次打新“包中”？一大波投资者摩拳擦掌 多家机构看好
15,2020-10-14 21:54:16,【美股新能源汽车板块中概股涨幅扩大 蔚来汽车涨逾15%】美股新能源汽车板块中概股涨幅扩大，蔚来汽车涨逾15%，公司今日正式推出NOP领航辅助功能，理想汽车涨逾10%，小鹏汽车涨逾7%。（e公司）,美股新能源汽车板块中概股涨幅扩大 蔚来汽车涨逾15%
16,2020-10-14 21:48:09,【万达集团旗下AMC院线跌逾20%】万达集团旗下AMC院线跌逾20%，据媒体报道，该公司可能申请破产以缓解债务带来的负担。（界面新闻）,万达集团旗下AMC院线跌逾20%
17,2020-10-14 21:45:24,【蔚来汽车涨幅扩大至13% 创历史新高】蔚来汽车涨幅扩大至13%，创历史新高，市值超330亿美元，该公司今日正式推出NOP领航辅助功能。（e公司）,蔚来汽车涨幅扩大至13% 创历史新高
18,2020-10-14 21:40:48,【美、布原油期货涨幅均超2%】WTI原油期货涨幅扩大至2%，现报41.01美元/桶；布伦特原油期货涨2.09%，现报43.3美元/桶。（e公司）,美、布原油期货涨幅均超2%
19,2020-10-14 21:38:40,【5G消息将在15个省份商用试点 产业链已准备就绪】14日消息，中国移动5G消息（RCS消息）已面向15个试点省开放试商用对接。中国移动已经与多个头部应用生态开展对接，为头部应用和服务快速迁移到5G消息平台提供支持。当前，5G消息产业链端到端已经准备就绪，产业生态初步形成。中国电信研究院移动通信研究所所长王庆扬表示，传统短信升级为5G消息后，生命力将进一步增强，预计到2021年，市场规模有望超过1500亿美元。相关公司有梦网集团、中嘉博创等。（上证资讯）,5G消息将在15个省份商用试点 产业链已准备就绪
20,2020-10-14 21:31:31,【美股三大股指微幅高开 蔚来大涨超10%】美股三大股指微幅高开，道指涨0.04%，纳指涨0.22%，标普500指数涨0.08%。美股新能源汽车板块中概股集体走强，蔚来汽车涨超10%，理想汽车涨逾4%，小鹏汽车涨逾3%。（e公司）,美股三大股指微幅高开 蔚来大涨超10%
21,2020-10-14 21:28:32,【广州浪奇：前三季度预亏8亿元至10亿元】广州浪奇(000523)10月14日晚间披露前三季度业绩预告，预亏8亿元至10亿元。由于公司在对化工品贸易业务存货进行盘点核查过程中，发现部分存货存在真实性存疑的风险，基于审慎性原则，公司对位于辉丰仓、瑞丽仓的存货计提了存货跌价准备，计提金额为合计5.72亿元。（e公司）,广州浪奇：前三季度预亏8亿元至10亿元
22,2020-10-14 21:23:54,【华大基因：前三季度净利预增863%-918%】华大基因(300676)10月14日晚间披露前三季度业绩预告，预盈26亿元至27.5亿元，同比增长862.69%-918.23%。（e公司）,华大基因：前三季度净利预增863%-918%
23,2020-10-14 21:22:28,【万达电影：前三季度预亏19.5亿元至20.5亿元】万达电影(002739)10月14日晚间披露前三季度业绩预告，预亏19.5亿元至20.5亿元，上年同期盈利8.29亿元。（e公司）,万达电影：前三季度预亏19.5亿元至20.5亿元
24,2020-10-14 21:19:46,【苏宁易购：预计前三季度净利润为5.03亿-7.53亿元】苏宁易购：预计前三季度净利润为5.03亿-7.53亿元，同比下降93.67%-95.77%。主要由于上年同期苏宁小店、苏宁金服出表带来投资收益增加影响。（中国网地产）,苏宁易购：预计前三季度净利润为5.03亿-7.53亿元
25,2020-10-14 21:17:54,【拉卡拉：前三季度净利预增12%-20%】拉卡拉(300773)10月14日晚间披露前三季度业绩预告，预盈6.9亿元至7.39亿元，同比增长12%-20%。（证券时报网）,拉卡拉：前三季度净利预增12%-20%
26,2020-10-14 21:15:03,【搜于特：下修业绩预期 预计前三季度净利润同比下降73.71%-81.92%】搜于特公告，下修业绩预期，预计前三季度净利润同比下降73.71%-81.92%，此前预计下降40.84%-60.56%。受新冠疫情影响，市场消费低迷，公司第三季度营业收入低于预期；同时，由于口罩等防护用品市场价格下降，导致预计业绩下降。（界面新闻）,搜于特：下修业绩预期 预计前三季度净利润同比下降73.71%-81.92%
27,2020-10-14 21:08:31,【央行货币政策司司长：利率水平与当前经济基本面总体匹配】下一阶段，央行将根据形势变化综合运用多种货币政策工具，保持流动性合理充裕，支持货币供应量和社会融资规模合理增长，为确保全面建成小康社会和经济高质量发展提供良好的货币环境。（澎湃新闻）,央行货币政策司司长：利率水平与当前经济基本面总体匹配
28,2020-10-14 21:07:46,【芒果超媒：前三季度净利预增56.99%-67.25%】芒果超媒(300413)10月14日晚间披露前三季度业绩预告，预盈15.3亿元至16.3亿元，同比增长56.99%-67.25%。报告期内，公司持续发挥内容创新和自制优势，综艺节目和影视剧齐头并进。《乘风破浪的姐姐》《密室大逃脱（第二季）》《妻子的浪漫旅行（第四季）》《奇妙小森林》《说唱听我的》等热门综艺和《以家人之名》《亲爱的自己》《琉璃》等热播剧集，有效带动公司广告收入和会员收入增长。（e公司）,芒果超媒：前三季度净利预增56.99%-67.25%
29,2020-10-14 21:01:02,【泰禾集团：预计前三季度净亏损16.5亿-22.3亿元】泰禾集团披露业绩预告，预计前三季度净亏损16.5亿-22.3亿元，去年同期盈利21.2亿元。2020年1-9月，受新冠肺炎疫情及公司房地产开发项目结算排期的影响，无集中交付的地产项目，仅有零星项目交付结转收入，造成收入较上年同期大幅下降，相应的营业利润大幅减少。（第一财经）,泰禾集团：预计前三季度净亏损16.5亿-22.3亿元
30,2020-10-14 21:00:35,【国内期货夜盘开盘 沪银涨超1%】国内期货夜盘开盘，苯乙烯、郑棉、LU、棉纱、沪银、短纤涨超1%，沪铝、PVC、豆粕小幅上涨。,国内期货夜盘开盘 沪银涨超1%
31,2020-10-14 20:54:34,【圣邦股份：预计前三季度净利同比增55%—80%】圣邦股份(300661)10月14日晚间披露业绩预告，预计前三季度盈利1.86亿元–2.16亿元，同比增55%—80%；其中第三季度预计盈利9238.93万元—1.07亿元，同比增55%—80%。净利润比上年同期增长的主要原因为公司积极拓展业务，产品销量增加，相应的营业收入同比增长所致。（e公司）,圣邦股份：预计前三季度净利同比增55%—80%
32,2020-10-14 20:47:51,【海能达：预计前三季度净利润为1.9亿-2.5亿元 同比增长74.57%-129.70%】海能达公告，预计前三季度净利润为1.9亿-2.5亿元，同比增长74.57%-129.70%。前三季度净利润增长的主要原因是公司加强订单质量和交付管理，持续推行精细化运营，毛利率同比提升，经营费用同比下降。（界面新闻）,海能达：预计前三季度净利润为1.9亿-2.5亿元 同比增长74.57%-129.70%
33,2020-10-14 20:45:12,【美股盘前】三大指数期货震荡盘整，截至发稿，道指期货涨0.12%，纳指期货涨0.11%，标普500指数期货跌0.05%。,美股盘前：三大指数期货震荡盘整
34,2020-10-14 20:37:55,【北新建材：上修业绩预期 前三季度净利预增超180倍】北新建材：上修业绩预期，预计前三季度净利润19.5亿元-20.5亿元，同比增长18096.57%-19019.47%，此前预增14727.98%-15669.34%。本次业绩预告修正的主要原因是：公司经营情况较前次预计稳步向好，收入及利润情况较前次预计有所增长。（第一财经）,北新建材：上修业绩预期 前三季度净利预增超180倍
35,2020-10-14 20:29:59,【央行孙国峰：M2和社融增速明显高于上年 货币政策坚持稳健取向不变】10月14日，在人民银行举行2020年三季度金融统计数据新闻发布上，货币政策司司长孙国峰表示，目前，广义货币供应量M2和社会融资规模增速明显高于上年，实体经济融资成本显著降低，有力支持了实体经济，我国将成为今年主要经济体中唯一正增长的国家。（第一财经）,央行：M2和社融增速明显高于上年 货币政策坚持稳健取向不变
36,2020-10-14 20:29:13,【央行彭立峰：重点房企融资新规起步平稳 下一步将稳步扩大适用范围】10月14日，在央行2020年三季度金融统计数据新闻发布上，金融市场司副司长彭立峰表示，重点房地产企业资金监测和融资管理规则是人民银行和住建部相关部门在前期广泛征求房地产业界、金融业界的基础上经过近两年时间的酝酿之后形成的。（第一财经）,央行彭立峰：重点房企融资新规起步平稳 下一步将稳步扩大适用范围
37,2020-10-14 20:28:01,【大族激光：前三季度净利预增65%-75%】大族激光(002008)10月14日晚间披露前三季度业绩预告，预盈9.9亿元至10.5亿元，同比增长65%-75%。受益于行业景气度的持续提升，PCB业务订单及发货均较上年同期大幅增长。（e公司）,大族激光：前三季度净利预增65%-75%
38,2020-10-14 20:21:12,【新能源车火了！这款国产车卖爆 代替传统车拐点已至？】近日，新能源汽车市场逐渐复苏，多家新能源头部车企销量增长较快，比亚迪上调三季度业绩预告。为此，证券时报·e公司记者，实探深圳、郑州、合肥三地的新能源车市，发现消费者对于电动车的热情逐渐高涨，但部分车企销售情况分化严重，政策驱动仍是增长主因。（e公司官微）,新能源车火了！这款国产车卖爆 代替传统车拐点已至？
39,2020-10-14 20:16:21,【深交所发布国证蓝色100指数 助力海洋经济高质量发展】10月14日，深交所与自然资源部共同举办“国证蓝色100指数”发布仪式暨“海洋中小企业投融资和重大科技成果路演”活动，指数由深交所全资子公司深圳证券信息有限公司联合自然资源部下属国家海洋信息中心编制。本次活动是认真贯彻党中央国务院关于加快建设海洋强国的决策部署，推进落实双方《促进海洋经济高质量发展战略合作框架协议》的具体举措，是2020中国海洋经济博览会系列活动之一。自然资源部副部长、国家海洋局局长王宏，深交所总经理沙雁等领导出席活动。（深交所）,深交所发布国证蓝色100指数 助力海洋经济高质量发展
40,2020-10-14 20:13:03,【新能源汽车中概股美股盘前集体走强】新能源汽车中概股美股盘前集体走强，蔚来汽车涨幅扩大至10%，理想汽车涨逾5%，小鹏汽车涨逾3%。,新能源汽车中概股美股盘前集体走强
41,2020-10-14 20:06:27,【獐子岛：预计前三季度盈利2000万元–3000万元 同比扭亏】獐子岛(002069)10月14日晚间披露业绩预告，预计前三季度盈利2000万元–3000万元；其中第三季度预计亏损2000万元–1000万元。扭亏原因为上半年出让部分海域使用权相关资产及转让子公司股权等非经常性损益项目收益较高等因素。（e公司）,獐子岛：预计前三季度盈利2000万元–3000万元 同比扭亏
42,2020-10-14 20:04:54,【东阿阿胶：前三季度预亏1671万元—2925万元】东阿阿胶(000423)10月14日晚间披露前三季度业绩预告，预亏1671万元—2925万元，上年同期盈利2.09亿元；其中，第三季度预计盈利5477万元—6731万元。受国内新冠肺炎疫情影响，报告期内特别是一季度，国内部分经销商复工复产延期，且药店等销售场所普遍顾客流量严重低迷，导致公司线下业务受到较大影响。（e公司）,东阿阿胶：前三季度预亏1671万元—2925万元
43,2020-10-14 20:01:08,【游资情报：国信泰九联手光大“金田哥”封板军工概念龙头】大盘连续两日震荡，大涨后歇一歇很正常，不必担心。三大指数都在趋势通道上方整固，整固后将再拾升势，而且这里的短线震荡蓄势已相对充分，即将结束。（每日经济新闻）,游资情报：国信泰九联手光大“金田哥”封板军工概念龙头
44,2020-10-14 19:55:37,【国恩股份：预计前三季度净利润同比增长140%-200%】国恩股份公告，预计前三季度净利润为6亿-7.5亿元，同比增长140%-200%。2020年前三季度，公司借助行业领先的新材料纵向一体化专业平台优势，在新冠肺炎疫情影响下做出快速反应，迅速扩产、转产医用和民用防护物资，有效提升了公司的盈利水平，取得了较好的成绩。（界面新闻）,国恩股份：预计前三季度净利润同比增长140%-200%
45,2020-10-14 19:42:50,【园城黄金：拟收购圣窖酒业100%股权 明日复牌】园城黄金(600766)10月14日晚公告，公司拟以发行股份及支付现金的方式购买刘见、刘良跃持有的圣窖酒业100%股权，同时向公司控股股东、实际控制人徐诚东非公开发行股份募集配套资金。本次交易预计构成重大资产重组。交易完成后，圣窖酒业将成为上市公司全资子公司，上市公司业务将拓展至白酒酿造及销售板块。公司股票将于10月15日起复牌。（e公司）,园城黄金：拟收购圣窖酒业100%股权 明日复牌
46,2020-10-14 19:36:38,【高盛第三季度净营收107.8亿美元】高盛第三季度净营收107.8亿美元，市场预估94亿美元，第三季度每股收益9.68美元。（界面新闻）,高盛第三季度净营收107.8亿美元
47,2020-10-14 19:32:32,【蛋壳公寓破产、跑路？公司回应：不实言论 已报警！股价最惨跌去78%】今天，网上有传言称，国内知名的租房平台蛋壳公寓“破产”、“跑路”。对此，公司今日午后回应称，目前经营活动一切正常。对于部分合作方散布“蛋壳跑路、倒闭”等相关不实言论、视频、图片的行为，公司已报警处理。（证券时报网）,蛋壳公寓破产、跑路？公司回应：不实言论 已报警！股价最惨跌去78%
48,2020-10-14 19:27:48,【12万股东请注意！你的股票开始配股 错过缴款必亏11% 15大要点速看】从今天起，国元证券正式进入配股缴款期，将连续停牌5个交易日。目前仍持有国元证券的投资者，只有一个选择：缴款。（证券时报网）,12万股东请注意！你的股票开始配股 错过缴款必亏11% 15大要点速看
49,2020-10-14 19:24:32,【完美世界：预计前三季度净利增长21%-23%】完美世界(002624)10月14日晚间披露业绩预告，预计前三季度盈利17.8亿-18.2亿元，同比增长20.68%-23.39%；其中第三季度预计盈利5.1亿元-5.5亿元，同比增12.04%–20.82%。报告期内，游戏方面，报告期内公司《诛仙》手游、《完美世界》手游、等精品移动游戏以及《CS:GO（反恐精英：全球攻势）》《诛仙》等经典端游产品表现良好，实现稳健业绩增长。（e公司）,完美世界：预计前三季度净利增长21%-23%
50,2020-10-14 19:21:43,【4年12倍大牛股跌逾14% 芯片龙头两天跌超20% 充电桩概念龙头连续3天20%涨停】在国庆节后市场表现较好的情况下，部分个股逆市大跌。此前有圣邦股份、信维通信等多只科技龙头股大跌，今天则出现宝信软件大跌近9%，安车检测更是跌逾14%。（数据宝）,4年12倍大牛股跌逾14% 芯片龙头两天跌超20% 充电桩概念龙头连续3天20%涨停
51,2020-10-14 19:20:18,【需求提升+临储库存消化 这个农产品行情一路高歌猛进 9只概念股回调幅度超20%】数据宝统计显示，A股共有13只玉米概念股，其中既有生产玉米种子、种植玉米的公司，也有玉米的加工、销售公司。今年以来的股价表现看，金健米业、苏垦农发、北大荒和荃银高科股价翻倍，农发种业、东方集团、登海种业和金健米业等9股的最新价距年内股价高点回调幅度均超20%。（数据宝）,需求提升+临储库存消化 这个农产品行情一路高歌猛进 9只概念股回调幅度超20%
52,2020-10-14 19:19:08,【中国“芯”大突破！华为迎转机？2.6万亿芯片板块迎重磅利好】中芯国际工艺获突破，这些滞涨芯片股有望受益。10月份对于果粉、花粉而言绝对是值得期待的，今日凌晨延迟了近一个月的苹果发布会上，iPhone12终于亮相，网友纷纷表示“心动了”；另外，华为消费者业务CEO余承东在微博正式宣布了Mate40的发布日期为10月22日。（数据宝）,中国“芯”大突破！华为迎转机？2.6万亿芯片板块迎重磅利好
53,2020-10-14 19:15:08,【*ST康得：预计前三季度亏损7.59亿-10.59亿元】*ST康得(002450)10月14日晚间披露业绩预告，公司预计前三季度亏损7.59亿-10.59元。（e公司）,*ST康得：预计前三季度亏损7.59亿-10.59亿元
54,2020-10-14 19:12:09,【2030年装机容量目标翻4倍 风电板块掀起涨停潮 三季报预增概念股名单出炉】10月14日，2020年北京国际风能大会开幕。来自全球400余家风能企业的代表联合发布了《风能北京宣言》。受此消息影响，A股风电板块掀起涨停潮，泰胜风能、双一科技双双斩获20%涨幅，大金重工、东方电缆、金风科技等多只个股亦涨停，金雷股份涨17.2%。（数据宝）,2030年装机容量目标翻4倍 风电板块掀起涨停潮 三季报预增概念股名单出炉
55,2020-10-14 19:07:09,【深圳宅地供应完成全年计划七成 年内2.6万套住宅将入市】10月14日，深圳市规划和自然资源局消息显示，截至10月13日，深圳市的居住用地供应完成年度计划逾七成。数据显示，2020年深圳市居住用地计划供应293.2公顷，截至10月13日实际供应217.39公顷，完成计划的72.33%。另外，从新房供应来看，今年年内还有64个项目，其中26909套住宅计划入市。（e公司）,深圳宅地供应完成全年计划七成 年内2.6万套住宅将入市
56,2020-10-14 19:00:44,【散户懵了！只有牛市才敢这样 重大资产重组告吹 主力竟借ETF扫货16亿元】本周千亿券商合并事项突然“告吹”，在大家短线集体看空之际，大量资金却逆势涌入了证券板块。13日，证券ETF份额增加了9.31亿份，达到293.46亿份再创历史新高，券商ETF也增加了3.7亿份，当日两只ETF合计净流入资金约16亿元。（每日经济新闻）,散户懵了！只有牛市才敢这样 重大资产重组告吹 主力竟借ETF扫货16亿元
