,datetime,content,title
486,2020-03-13 10:14:50,【发改委等部门：促进汽车限购向引导使用政策转变】发改委等部门：促进汽车限购向引导使用政策转变，鼓励汽车限购地区适当增加汽车号牌限额。（界面新闻）,发改委等部门：促进汽车限购向引导使用政策转变
487,2020-03-13 10:14:10,【国家发改委、商务部等23个部门联合发文：加快5G网络等信息基础设施建设和商用步伐】国家发改委、商务部等23个部门联合发文：加快5G网络等信息基础设施建设和商用步伐。支持利用5G技术对有线电视网络进行改造升级，实现居民家庭有线无线交互，大屏小屏互动。推动车联网部署应用。（界面新闻）,加快5G网络等信息基础设施建设和商用步伐
488,2020-03-13 10:13:41,【23个部门联合发文：稳定资本市场财产性收入预期】国家发改委、商务部等23个部门联合发文称，稳定和增加居民财产性收入。丰富和规范居民投资理财产品，适度扩大国债、地方政府债券面向个人投资者的发行额度。稳定资本市场财产性收入预期，完善分红激励制度，坚决查处严重损害中小投资者分红派息权益的行为。深化农村土地和集体产权制度改革，稳步推进农村集体经营性建设用地入市，探索赋予农民对集体资产股份的占有、收益、有偿退出及抵押、担保、继承权。（界面新闻）,稳定资本市场财产性收入预期
489,2020-03-13 10:12:39,【23个部门联合发文：稳定资本市场财产性收入预期】国家发改委、商务部等23个部门联合发文称，稳定和增加居民财产性收入。丰富和规范居民投资理财产品，适度扩大国债、地方政府债券面向个人投资者的发行额度。稳定资本市场财产性收入预期，完善分红激励制度，坚决查处严重损害中小投资者分红派息权益的行为。深化农村土地和集体产权制度改革，稳步推进农村集体经营性建设用地入市，探索赋予农民对集体资产股份的占有、收益、有偿退出及抵押、担保、继承权。（界面新闻）,23个部门联合发文：稳定资本市场财产性收入预期
490,2020-03-13 10:12:33,【全国除湖北外的规上工业企业平均开工率超过95%】国新办就支持产业链协同有序复工复产有关情况举行新闻发布会。工信部介绍，全国除湖北外的规上工业企业平均开工率超过95%。平均覆盖率约80%，中小企业开工率已达到了60%左右。（界面新闻）,全国除湖北外的规上工业企业平均开工率超过95%
491,2020-03-13 10:08:47,【北上资金净流出超60亿】北上资金净流出超60亿，其中沪股通超52亿。（界面新闻）,北上资金流出超60亿
492,2020-03-13 10:05:42,【特高压板块指数翻红】特高压板块指数翻红，通光线缆、通达股份、平高电气涨停，中国西电、长高集团、特变电工等涨逾5%。,特高压板块指数翻红
493,2020-03-13 10:04:33,【国家发展改革委等二十三部门联合发文促消费】国家发展改革委13日发布消息，为完善促进消费体制机制、促进消费稳定增长，国家发展改革委、中宣部、财政部、商务部等二十三个部门联合印发《关于促进消费扩容提质加快形成强大国内市场的实施意见》，以供给侧结构性改革为主线，围绕改善消费环境，破除制约消费的体制机制障碍，提升消费领域治理水平，更好满足人民群众消费需求，综合提出促进消费扩容提质、加快形成强大国内市场的政策举措。（证券时报）,二十三部门联合发文促消费
494,2020-03-13 10:03:38,【国家发改委等23部门联合发文促消费 疫情结束后助文旅产业有序恢复营业】国家发改委、商务部等23个部门联合发文促消费，提出疫情结束后帮助文化产业和旅游产业有效应对疫情、渡过难关、有序恢复营业。（央视新闻）,国家发改委等23部门联合发文促消费 疫情结束后助文旅产业有序恢复营业
495,2020-03-13 10:02:21,【北向资金合计净流出超50亿元】两市跌幅收窄，北向资金合计净流出超50亿元。（第一财经）,北向资金合计流出超50亿
496,2020-03-13 09:57:30,【加拿大总理特鲁多妻子的新冠病毒检测结果呈阳性】据加拿大CBC刚刚消息，加拿大总理特鲁多的妻子新冠病毒检测呈阳性。（环球网）,加拿大总理特鲁多妻子的新冠病毒检测结果呈阳性
497,2020-03-13 09:55:30,【菲律宾驻联合国外交官感染新冠肺炎 系联合国纽约总部首例】据路透社报道，当地时间12日，菲律宾驻联合国代表团中的一名女性外交官在新冠病毒检测中呈阳性，这是联合国纽约总部发现的首例感染新冠肺炎的病例。（海外网）,菲律宾驻联合国外交官感染新冠肺炎 系联合国纽约总部首例
498,2020-03-13 09:54:23,【恒生指数下跌近6% 腾讯控股大跌】港股早盘大幅低开，恒指低开7.36%，截止发稿，恒生指数下跌5.82%。蓝筹股全线下挫，腾讯控股大跌。,恒生指数下跌近6% 腾讯控股大跌
499,2020-03-13 09:53:49,【2020年清明节放假安排表已出 调休共3天】据北京人民广播电台官方微博消息，4月4日(星期六)至6日(星期一)放假调休，共3天。请广大市民提前安排好工作生活，节日期间注意安全，减少外出，外岀佩戴口罩、做好防护、避免参加聚会和集体活动度过一个文明、平安的节日假期。（界面新闻）,2020年清明节放假安排表已出 调休共3天
500,2020-03-13 09:53:00,A股三大股指集体下跌，创业板指跌逾3%。贵金属、云游戏、口罩、化纤、钛白粉等板块跌幅居前。截至发稿，沪指下跌3.09%，深成指下跌3.36%，创业板指下跌3.22%。,A股三大股指集体下跌 贵金属板块领跌
501,2020-03-13 09:47:41,【北上资金净流出超20亿】北上资金净流出超20亿，其中沪股通净流出超24亿。（界面新闻）,北上资金净流出超20亿
502,2020-03-13 09:47:00,【韩国KOSPI指数跌超8%，触发熔断】韩国KOSPI指数跌超8%，触发熔断。（界面新闻）,韩国KOSPI指数跌超8%
503,2020-03-13 09:45:54,韩国KOSPI指数跌超8%，触发熔断。,韩国KOSPI指数跌超8% 触发熔断
504,2020-03-13 09:45:09,【土地流转概念多股涨停】3月13日早盘，土地流转概念有多股涨停，包括海航创新、亚通股份、永安林业、上实发展等。,土地流转概念多股涨停
505,2020-03-13 09:42:31,纳指期货跌超3%，道指期货跌2.52%，标普500指数期货跌2.32%。,纳指期货跌超3% 道指期货跌2.52%
506,2020-03-13 09:40:28,【欧元/美元预测：欧洲央行维持利率不变 扩大量化宽松】FXStree首席分析师Valeria Bednairk周四(3月12日)撰文称，在欧洲央行做出货币政策决定之前，欧元/美元大幅下跌，在风险持续降低的情况下被抛售。周三，世界卫生组织(WHO)宣布新冠病毒为大流行，而美国总统特朗普宣布采取措施缓解疫情对经济的影响。不过，随着投机者的兴趣涌向避险领域，美元兑高收益竞争对手的汇率均出现上涨。（FX168）,欧元/美元预测：欧洲央行维持利率不变 扩大量化宽松
507,2020-03-13 09:39:22,【港股航空股全线走低】港股航空股全线走低。中国南方航空股份跌约10%，中国东方航空股份跌超9%，中国国航跌超5%。（界面新闻）,港股航空股走低
508,2020-03-13 09:37:23,【恒生指数下跌近7% 腾讯控股大跌】港股早盘大幅低开，恒指低开7.36%，截止发稿，恒生指数下跌6.83%。蓝筹股全线下挫，腾讯控股大跌。,恒生指数下跌近7% 腾讯控股大跌
509,2020-03-13 09:35:33,【美国贸易代表办公室对中国医疗产品给予更多关税排除】美国贸易代表办公室在声明中表示，美国将把中国一次性口罩、一次性医用口罩、一次性听诊器套以及一次性鞋套靴套在内的产品排除在关税清单之外。（界面新闻）,美国贸易代表办公室对中国医疗产品给予更多关税排除
510,2020-03-13 09:34:18,【澳大利亚基准ASX 200指数下跌8%】澳大利亚基准ASX 200指数下跌8%。（界面新闻）,澳大利亚基准ASX 200指数下跌8%
511,2020-03-13 09:29:00,【欧银未降息欧股狂泻逾10% 录得历史最大单日跌幅 美联储1.5万亿“无力回天”美股创33年最大跌幅】欧洲央行周四(3月12日)批准实施新一轮刺激措施，但央行却出人意料地维持利率不变，这一决定令市场大失所望。 欧洲央行政策决定发布后，欧股狂泻逾10%。美联储周四再度出手干预，大量投入现金，以防止市场崩盘，但美国股市周四暴跌，基准指数创出1987年以来最大跌幅，表明市场对美联储采取的非常规购债措施和美国总统特朗普的经济提案缺乏信心，认为不足以缓冲新冠疫情的经济影响。（汇通网）,欧银未降息欧股狂泻逾10% 录得历史最大单日跌幅 美联储1.5万亿“无力回天”美股创33年最大跌幅
512,2020-03-13 09:26:26,【沪指跳空低开4.08%】受外围股市影响，A股三大股指集体低开，沪指跌4.08%，创业板跌5.28%。（界面新闻）,沪指跳空低开4.08%
513,2020-03-13 09:25:04,【行情】富时中国A50指数期货跌逾5%。,富时中国A50指数期货跌逾5%
514,2020-03-13 09:21:17,【日经225指数跌幅扩大至10%】日经225指数跌幅扩大至10%，为2011年以来最大盘中跌幅。（界面新闻）,日经225指数跌幅扩至10%
515,2020-03-13 09:20:47,【香港恒生指数开盘大幅下跌7.36%】香港恒生指数开盘大幅下跌7.36%。腾讯控股大跌近8%。（界面新闻）,恒生指数开盘大幅下跌7.36%
516,2020-03-13 09:15:19,【中国央行未开展逆回购操作】中国央行未开展逆回购操作，因今日无逆回购到期，当日实现零投放零回笼。（第一财经）,央行今日未开展逆回购操作
517,2020-03-13 09:15:18,【人民币兑美元中间价较上日调降392点至7.0033】人民币兑美元中间价较上日调降392点至7.0033，中间价贬值至2020年2月28日以来最低，降幅创2020年2月4日以来最大。（第一财经）,人民币兑美元中间价较上日调降392点至7.0033
518,2020-03-13 09:12:46,【韩国昨日新增110例新冠肺炎确诊病例 累计7979例】韩国中央防疫对策本部13日通报，截至当地时间13日零时，韩国较12日零时新增新冠肺炎确诊病例110例，累计确诊病例达7979例。（环球网）,韩国昨日新增110例新冠肺炎确诊病例 累计7979例
519,2020-03-13 09:11:49,【日经225指数跌幅扩大至9%】日经225指数跌幅扩大至9%，为2011年以来最大盘中跌幅。,日经225指数跌幅扩大至9%
520,2020-03-13 09:11:15,【阿根廷宣布进入卫生紧急状态 暂停多个国际航班】当地时间12日晚，阿根廷总统费尔南德斯签署全国紧急法令并发表全国电视讲话，介绍阿根廷防控疫情最新措施。根据该法令，阿根廷进入为期一年的卫生紧急状态，同时将暂停接收来自包括中国、韩国、日本、伊朗、美国以及欧洲全境的国际航班，为期30天。(央视新闻),阿根廷宣布进入卫生紧急状态
521,2020-03-13 09:09:25,【台湾加权指数开盘跌6.9%】台湾加权指数3月13日开盘下跌719.31点，跌幅6.9%，报9703.01点。（界面新闻）,台湾加权指数开盘跌6.9%
522,2020-03-13 09:08:43,【新加坡交易所NIFTY指数期货在新加坡一度下跌9.6%】新加坡交易所NIFTY指数期货在新加坡一度下跌9.6%。（界面新闻）,新加坡交易所NIFTY指数期货在新加坡一度下跌9.6%
523,2020-03-13 09:03:36,【日经225指数跌幅扩大至8.5%】日经225指数跌幅扩大至8.5%。（界面新闻）,日经225指数跌幅扩大至8.5%
524,2020-03-13 09:03:29,【全国银行间同业拆借中心3月23日起试运行利率期权交易及相关服务】外汇交易中心：经中国人民银行批复同意，全国银行间同业拆借中心（以下简称交易中心）将于2020年3月23日起试运行利率期权交易及相关服务。（外汇交易中心）,全国银行间同业拆借中心3月23日起试运行利率期权交易及相关服务
525,2020-03-13 09:01:22,【国内期市开盘普遍低开 燃油跌2.7%】国内期市开盘普遍低开，燃油跌2.7%，沥青跌2.5%。（界面新闻）,燃油跌2.7%
526,2020-03-13 09:00:04,【行情】富时中国A50指数期货开盘跌4.41%。,富时中国A50指数期货开盘跌4.41%
527,2020-03-13 08:43:03,【两市融资余额减少34.09亿元】截至3月12日，上交所融资余额报5890.62亿元，较前一交易日减少16.94亿元；深交所融资余额报5188.64亿元，较前一交易日减少17.14亿元；两市合计11079.27亿元，较前一交易日减少34.09亿元。（证券时报）,两市融资余额减少34.09亿元
528,2020-03-13 08:39:00,【多家A股公司争相布局Wi-Fi6 产业相关企业将受益(股)】近日，三星、华为、小米等厂商纷纷发布Wi-Fi6相关终端产品，涉及手机、电视、路由器等领域。机构预测，Wi-Fi6市场规模有望保持高增长，产业链相关公司将受益。（中国证券报）,多家A股公司争相布局Wi-Fi6 产业相关企业将受益(股)
529,2020-03-13 08:37:07,【韩国将针对汇市过度波动采取措施】韩国央行官员表示，韩国将针对汇市过度波动采取措施。（界面新闻）,韩国将针对汇市过度波动采取措施
530,2020-03-13 08:36:40,【日本央行提出购买5000亿日元的日本国债回购期货】日本央行提出购买5000亿日元的日本国债回购期货。（界面新闻）,日本央行提出购买5000亿日元的日本国债回购期货
531,2020-03-13 08:33:50,【NBA将停摆至少30天】NBA总裁亚当-萧华宣布：NBA将停摆至少30天。（第一财经）,NBA总裁亚当-萧华宣布：NBA将停摆至少30天
532,2020-03-13 08:26:16,【公募业绩首尾差拉大至85% 外围动荡基金经理慎言抄底】按照最新的统计数据，基金业绩最好的达到33.71%，最差的为-51.73%，首尾相差85%。 记者采访的多位基金经理，他们目前仍多以观望为主，也有人最近开始减仓，或是调仓。(21世纪经济报道),公募业绩首尾差拉大至85%
533,2020-03-13 08:18:47,【迪士尼将关闭佛罗里达和巴黎的主题公园】迪士尼将关闭佛罗里达和巴黎的主题公园。（界面新闻）,迪士尼将关闭佛罗里达和巴黎的主题公园
534,2020-03-13 08:18:15,【中信证券：传统基建以及基建补短板可能仍是后续的政策重心】中信证券FICC首席分析师明明认为，从长周期的视角来看，新基建终将取代旧基建成为经济增长的核心驱动力；但在短周期的视角下，考虑到财政空间、政策时滞、稳增长目标，新基建上尚难以接过稳增长的大旗，传统基建以及基建补短板可能仍是后续的政策重心。但无论如何，稳增长发力离不开资金端的支持，因此后续财政、货币政策均有望加码宽松。（界面新闻）,中信证券：传统基建以及基建补短板可能仍是后续的政策重心
535,2020-03-13 08:15:29,【期货从业者廉洁细则出炉：这些行为被明确禁止！】3月12日，中期协发布实施《期货经营机构及其工作人员廉洁从业实施细则》(简称《细则》)，切实加强对期货经营机构及其工作人员廉洁从业的自律管理。（期货日报）,期货从业者廉洁细则出炉：这些行为被明确禁止！
536,2020-03-13 08:10:37,【日经225指数开盘后迅速走低 跌幅扩大至7%】日经225指数开盘后迅速走低，跌幅扩大至7%。（界面新闻）,日经225指数开盘后迅速走低 跌幅扩大至7%
537,2020-03-13 08:09:01,【日经225指数开盘后迅速走低】日经225指数开盘后迅速走低，跌幅扩大至4%。（金十数据）,日经225指数开盘后迅速走低
538,2020-03-13 08:08:24,【韩国KOSPI指数下跌8%】韩国KOSPI指数下跌8%。韩国KOSDAQ指数大幅下跌，触发熔断。（界面新闻）,韩国KOSPI指数下跌8%
539,2020-03-13 08:03:25,【早间公告：艾可蓝拟10亿元在合肥高新区投建环保项目】今天早间公告有：艾可蓝拟在合肥高新区投资建设艾可蓝研究院项目、汽车国六尾气后处理系统项目、非道路国四尾气后处理系统项目、船舶后处理系统项目，项目总投资10亿元；冠昊生物：全资子公司珠海市祥乐医疗器械与Aren Scientific，Inc。签订独家经销协议，之前协议到期日期为2020年12月31日，现续签协议至2023年12月31日。（金十数据）,早间公告：艾可蓝拟10亿元在合肥高新区投建环保项目
540,2020-03-13 08:02:29,【韩国KOSPI指数3月13日(周五)开盘下跌112.86点】韩国KOSPI指数3月13日(周五)开盘下跌112.86点，跌幅6.15%，报1834.33点。（金十数据）,韩国KOSPI指数3月13日(周五)开盘下跌112.86点
541,2020-03-13 08:01:08,"【日经225指数开盘下跌2.03%】日经225指数开盘下跌2.03%，报18,183.47。隔夜美股暴跌，三大主要股指均跌超9%。欧洲基准指数创出11%的历史最大跌幅。（界面新闻）",日经225指数开盘下跌2.03%
542,2020-03-13 07:55:58,【苹果称其中国零售店全部于周五恢复营业】苹果现在表示，在3月13日(星期五)，苹果在中国的所有42家门店都将全部重新开业。本周未开业的四家门店包括天津的三家门店和苏州的一家门店。（界面新闻）,苹果称其中国零售店全部于周五恢复营业
543,2020-03-13 07:46:30,【行情】日经225指数期货于日本大阪下跌8.4%，料日本股市将低开。（金十数据）　　,日经225指数期货于日本大阪下跌8.4%
544,2020-03-13 07:33:01,【法国宣布将关闭全国所有学校应对疫情】法国总统马克龙12日在巴黎爱丽舍宫发表电视讲话宣布，由于新冠肺炎疫情严重，法国将采取关闭学校等防控措施，但第一轮地方市镇选举将照常进行。马克龙宣布，法国将从16日起关闭全国所有学校、幼儿园等。（新华社）,法国宣布将关闭全国所有学校应对疫情
545,2020-03-13 07:30:19,据交易平台bitstamp报价显示，比特币跌破5000美元/枚。（第一财经）,比特币跌破5000美元/枚
546,2020-03-13 07:27:25,【跨境融资宏观审慎调节参数由1上调至1.25 央行外汇局助力企业境内外多渠道融资】上证报昨日从国家外汇管理局获悉，为进一步扩大利用外资，便利境内机构跨境融资，降低实体经济融资成本，中国人民银行、国家外汇管理局日前联合发布通知，将全口径跨境融资宏观审慎调节参数由1上调至1.25。（上海证券报）,跨境融资宏观审慎调节参数由1上调至1.25 央行外汇局助力企业境内外多渠道融资
547,2020-03-13 07:17:13,【澳大利亚ASX200指数盘中大跌近7%】澳大利亚ASX200指数开盘后迅速走低，现跌近7%。,澳大利亚ASX200指数盘中大跌近7%
548,2020-03-13 07:16:12,【日经225指数期货亚市盘初重挫近10%】日经225指数期货亚市盘初重挫近10%。（界面新闻）,日经225指数期货亚市盘初重挫近10%
549,2020-03-13 07:10:19,【公开市场按兵不动 定向降准指日可待】截至12日，央行已连续18个工作日未开展逆回购操作。不过，资金面较为宽裕，物价水平逐步回落。在此背景下，我国货币政策空间进一步拓宽。分析人士认为，定向降准指日可待。（中国证券报）,公开市场按兵不动 定向降准指日可待
550,2020-03-13 06:53:05,【30家房企前两月销售5525亿元同比降19% 近九成房企销售额同比下滑】截至3月12日，据中原地产研究中心提供给记者的统计数据显示，2020年前两个月，已公布销售业绩的30家上市房企签约销售额合计达5525亿元，同比下降19%。记者注意到，30家房企中，仅有4家销售额同比上涨，从8%到66%不等，其余26家全部同比下滑，占比接近九成。（证券日报）,30家房企前两月销售5525亿元同比降19% 近九成房企销售额同比下滑
551,2020-03-13 06:36:25,【英国阿森纳队主教练阿尔特塔确诊感染新冠病毒】据英国天空新闻消息，当地时间3月12日，阿森纳队主教练阿尔特塔确诊感染新型冠状病毒。（央视新闻客户端）,英国阿森纳队主教练阿尔特塔确诊感染新冠病毒
552,2020-03-13 06:23:38,【行情】亚市盘初，道指期货现跌超1%，标普500指数期货、纳指期货跌近1%。,道指期货现跌超1%
553,2020-03-13 06:17:50,【年内各类债券发行量达8.9万亿元 债市发行效率大幅提高】东方财富Choice数据显示，今年以来截至3月12日，债券市场共发行各类债券8.9万亿元。专家认为，随着债券市场融资功能提升，债券发行效率大大提高，市场化程度显著提高。（证券日报）,年内各类债券发行量达8.9万亿元 债市发行效率大幅提高
554,2020-03-13 06:03:50,【年内各类债券发行量达8.9万亿元 债市发行效率大幅提高】东方财富Choice数据显示，今年以来截至3月12日，债券市场共发行各类债券8.9万亿元。专家认为，随着债券市场融资功能提升，债券发行效率大大提高，市场化程度显著提高。（证券日报）,年内各类债券发行量达8.9万亿元 债市发行效率大幅提高
555,2020-03-13 06:01:47,【美国白宫：巴西访美代表团确诊病例未与特朗普近距离接触】当地时间12日下午，有关近期访美的巴西总统代表团成员新冠检测呈阳性一事，白宫作出回应称：已知晓此事，相关人员的确诊检测还未出结果。白宫正在研判病毒可能的暴露情况，并基于这一研判制定下一步计划。特朗普和彭斯均未与检测呈阳性的巴西官员有过互动，二人也没有出现症状。白宫表示将密切关注总统和副总统及家人的健康。（央视新闻）,美国白宫：巴西访美代表团确诊病例未与特朗普近距离接触
556,2020-03-13 05:45:28,【137份银行理财产品收费研究：超额业绩报酬高至100% 销售管理费率0-0.5%】21资管研究院调查小组针对银行理财子公司的137份热销理财产品进行了大样本测评(截至2019年12月末)，通过对收费、收益、信息披露等多维度展开详细调查发现，银行理财产品普遍存在管理费、销售费用、超额业绩报酬收取标准不统一的情况，而且不同银行理财子公司收费标准差异过大。（21世纪经济报道）,137份银行理财产品收费研究：超额业绩报酬高至100% 销售管理费率0-0.5%
557,2020-03-13 05:25:16,【债券牛市或延续 公募债基看好“固收+”投资机会】近日，海外权益市场剧烈震荡，固定收益资产市场关注度提升。多位公募基金债券基金经理接受中国证券报记者采访时表示，投资者或可借道债券基金来规避潜在风险。当前债市受基本面支撑，收益率下行或仍有空间。从券种来看，利率债交易机会明显，信用债中的房地产债以及可转债投资机会犹存。（中国证券报）,债券牛市或延续 公募债基看好“固收+”投资机会
558,2020-03-13 05:08:25,【15个交易日流出581亿：北上资金离场短期避险】春节假期后国内股市恢复交易的2月3日，A股暴跌，但当日北上资金却逆向而行，单日净流入资金规模高达181亿元。彼时被市场形容为大跌大买，随后A股大幅反弹，北上资金持续凶猛流入。,15个交易日流出581亿：北上资金离场短期避险
559,2020-03-13 05:00:20,【隔夜外盘】欧洲大幅下挫；标普500指数本周第二次触发熔断机制，美股三大股指均收跌逾9%，道指跌超2300点；油价跌4.49%，金价大跌3.17%。,隔夜外盘：再次熔断！美股三大股指均收跌逾9% 道指跌超2300点
560,2020-03-13 04:57:06,【行情】澳元兑美元盘中一度重挫超4%，最低触及0.6212，目前日内跌幅收窄至3.84%，报0.6233。美元指数目前上涨1%，盘中一度涨1.8%。,澳元兑美元盘中一度重挫超4%
561,2020-03-13 04:49:53,【年内7家银行获批发行累计不超过1180亿元永续债 专家预计全年规模将超去年】去年，面对经济下行和局部性社会信用收缩压力，央行有效发挥银行货币创造功能，对症下药，着力化解流动性、利率和资本三大约束，为金融支持实体经济汲取活水，取得较好效果。其中，以永续债为突破口助力银行补充资本效果明显，去年全年银行共发行永续债5696亿元。（证券日报）,年内7家银行获批发行累计不超过1180亿元永续债 专家预计全年规模将超去年
562,2020-03-13 04:30:50,【年内民企债券净融资量转正 医药生物行业同比增156%】“2019年信用债违约主体多是民企，所以市场对民营企业债券风险偏好下降，导致民企和国企在债券市场融资的信用利差出现显著分化。2019年全年民企信用债净融资量为负。”新时代证券首席经济学家潘向东对《证券日报》记者表示，2020年以来随着信用环境改善，流动性较为宽松，民企信用债净融资开始有所改善，净融资量开始回升至正值区间。（证券日报）,年内民企债券净融资量转正 医药生物行业同比增156%
