,datetime,content,title
438,2020-09-25 18:52:37,【证监会核发中金公司等2家企业IPO批文】近日，我会按法定程序核准了以下企业的首发申请：中国国际金融股份有限公司，欣贺股份有限公司。上述企业及其承销商将分别与交易所协商确定发行日程，并陆续刊登招股文件。（证监会发布）,证监会核发中金公司等2家企业IPO批文
439,2020-09-25 18:47:13,【东软集团：子公司成为吉利汽车指定车型的5G智能通讯终端供应商】东软集团(600718)9月25日晚公告，公司全资子公司东软大连近日收到吉利汽车的定点通知，将选择东软大连作为其指定车型的部件供应商，为其定制开发和供应5G智能通讯终端（包括5G主机总成、天线等）。上述目标车型预计将在2022年前后量产上市，多数车型为面向全球销售。预计在上述车型生命周期内，东软大连为其供应5G智能通讯终端涉及总金额在6亿元左右。（e公司）,东软集团：子公司成为吉利汽车指定车型的5G智能通讯终端供应商
440,2020-09-25 18:37:45,【18家企业宣布涨价 部分厂家称要涨价到11月！机构已盯上龙头股】近日，多家轮胎企业发布涨价函表示，因原材料价格上涨，成本压力过大，将上调轮胎产品价格。部分企业甚至宣布要涨价到11月。（数据宝）,18家企业宣布涨价 部分厂家称要涨价到11月！机构已盯上龙头股
441,2020-09-25 18:33:33,"【上交所：本周向证监会上报5起涉嫌违法违规案件线索】上交所消息，本周（9月21日至9月25日），沪市共发生25起证券异常交易行为。上交所对此及时采取了书面警示等自律监管措施。同时，针对10起上市公司重大事项等进行核查, 向证监会上报5起涉嫌违法违规案件线索。（e公司）",上交所：本周向证监会上报5起涉嫌违法违规案件线索
442,2020-09-25 18:25:08,【上交所：建议科创公司在非交易时段回复互动平台提问】上交所就《上海证券交易所科创板上市公司自律监管规则适用指引第2号——自愿信息披露》答记者问表示，关于上证e互动平台，建议科创公司在非交易时段回复投资者提问，避免因盘中误读误传信息引发股票交易异常波动。关于接受分析师和机构调研，如果在调研过程中，分析师和调研机构知悉了相关重大信息，公司应当立即披露。（证券时报）,上交所：建议科创公司在非交易时段回复互动平台提问
443,2020-09-25 18:23:05,【上交所：对于主动迎合市场热点的“蹭热点”行为 将露头就打】上交所就《上海证券交易所科创板上市公司自律监管规则适用指引第2号——自愿信息披露》答记者问表示，防范自愿披露中的不当行为，是出台《指引》的一个重要考虑。需要特别指出的是，对于主动迎合市场热点的“蹭热点”行为，特别是滥用自愿信息披露实施信息型市场操纵的违法违规行为，上交所将继续从严监管，露头就打，坚决维护好科创板信息披露市场秩序。（证券时报）,上交所：对于主动迎合市场热点的“蹭热点”行为 将露头就打
444,2020-09-25 18:22:12,【国金证券：公司A股股票继续停牌】国金证券公告，为维护投资者利益，避免公司股价异常波动，根据上海证券交易所的相关规定，公司A股股票继续停牌。目前，公司正根据《公开发行证券的公司信息披露内容与格式准则第26号—上市公司重大资产重组（2018年修订）》以及上海证券交易所《上市公司重大资产重组信息披露业务指引》的相关规定编制重大资产重组预案，公司将按照相关法律法规、业务指引的规定，及时履行信息披露义务。（第一财经）,国金证券：公司A股股票继续停牌
445,2020-09-25 18:21:00,【国联证券：公司A股股票继续停牌】国联证券公告，截至本公告披露之日，公司以及有关各方正在按照《上市公司重大资产重组 管理办法》及其他有关规定积极组织推进本次交易的相关工作。为维护投资者利益，避免公司股价异常波动，根据上海证券交易所的相关规定，公司A股股票继续停牌。（第一财经）,国联证券：公司A股股票继续停牌
446,2020-09-25 18:10:50,【上交所：科创公司不应披露可能误导投资者错误估计公司价值的市场热点相关信息】9月25日，上交所发布《上海证券交易所科创板上市公司自律监管规则适用指引第2号——自愿信息披露》。上交所指出：科创公司自愿披露的信息，应当服务于投资者决策需要，基于一定的客观事实，或者具备实施的基础条件。不宜披露与投资者决策关联不大的信息，更不应披露可能误导投资者错误估计公司价值的市场热点相关信息，不能以重大风险提示替代应有的事实基础。（证券时报）,上交所：科创公司不应披露可能误导投资者错误估计公司价值的市场热点相关信息
447,2020-09-25 18:06:03,【国务院同意《关于促进特色小镇规范健康发展的意见》】国家发展改革委《关于促进特色小镇规范健康发展的意见》已经国务院同意。（中国政府网）,国务院同意《关于促进特色小镇规范健康发展的意见》
448,2020-09-25 17:58:37,【万科郁亮：“三道红线”监管是穿透式的 多层结构、表内表外等财务技巧没用】对“三道红线”下万科会不会有更大发展机会的提问，万科董事会主席郁亮在媒体交流会上表示，这个问题不能这么看，这是行业重大规则的转变，打法都变了；万科现在从财务纪律提升到财经纪律，要考虑投资纪律等，这次的监管是穿透式的，多层结构、表内表外等财务技巧是没用的，这对对所有开发商都是挑战。郁亮表示，万科特别不希望行业出现恶性事件，希望行业健康发展，在保障万科利益的前提下，会尽可能去帮助行业内企业。（e公司）,万科郁亮：“三道红线”监管是穿透式的 多层结构、表内表外等财务技巧没用
449,2020-09-25 17:54:09,【华为着火建筑与实验室无关 沒有人员伤亡】9月25日下午消息，网友爆料称华为位于东莞的松山湖实验室突然起火，火势不小，现场浓烟滚滚。（第一财经）,华为着火建筑与实验室无关 沒有人员伤亡
450,2020-09-25 17:48:38,【宣亚国际：股东伟岸仲合拟减持不超过3%公司股份】宣亚国际(300612)9月25日晚间公告，持股比例的5.68%的股东南平伟岸仲合信息咨询中心(有限合伙)计划减持公司股份数量不超过477万股，即不超过公司总股本的3%。（e公司）,宣亚国际：股东伟岸仲合拟减持不超过3%公司股份
451,2020-09-25 17:48:28,【北向资金连续5天减持茅台！机构分析：聪明资金持币过节意味渐浓（附股）】个股方面，贵州茅台再遭净卖出6.98亿元居首，本周累计被净卖出34.31亿元；药明康德遭净卖出4.19亿元；新能源车产业链获外资逆势加仓，亿纬锂能和比亚迪分别获净买入逾3亿元。（21世纪经济报道）,北向资金连续5天减持茅台！机构分析：聪明资金持币过节意味渐浓（附股）
452,2020-09-25 17:46:15,【欧股主要股指跌幅扩大至逾1%】欧股跌幅扩大，德国DAX指数跌超1%，法国CAC40指数跌1.13%，欧洲斯托克50指数跌1.04%。（界面新闻）,欧股主要股指跌幅扩大至逾1%
453,2020-09-25 17:43:39,【金融市场对外开放再启新章：中国国债将被纳入富时世界国债指数】中国人民银行副行长、国家外汇管理局局长潘功胜表示，全球三大债券指数提供商中，有两家已先后将中国债券纳入其主要指数，此次富时世界国债指数也明确将中国债券纳入时间表。这充分反映了国际投资者对于中国经济长期健康发展、金融持续扩大开放的信心，人民银行对此表示欢迎。（央行网站）,金融市场对外开放再启新章：中国国债将被纳入富时世界国债指数
454,2020-09-25 17:39:34,【万科郁亮：“三道红线”让房地产进入管理红利阶段 所有发展商来到同一起跑线】万科董事会主席郁亮在媒体交流会上表示，“三道红线”的影响力不亚于2002年实施的土地“招拍挂”政策，自此房地产行业进入管理红利阶段。房地产行业2002年之前属于土地红利阶段，之后属于金融红利阶段。郁亮说，管理红利阶段，所有发展商再次来到同一起跑线，之前所有优势归零。“有个东西不变，对客户好，有好产品、好服务是一定可以活下去的。”郁亮说，“好产品、好服务也是我们的根本，万科希望在新阶段做的好一些。”（证券时报）,万科郁亮：“三道红线”让房地产进入管理红利阶段 所有发展商来到同一起跑线
455,2020-09-25 17:38:50,【上交所：科创板存托凭证纳入证券交易资金前端风险控制实施范围】上交所发布科创板存托凭证纳入证券交易资金前端风险控制实施范围的通知。（上交所）,上交所：科创板存托凭证纳入证券交易资金前端风险控制实施范围
456,2020-09-25 17:35:30,【深市监管动态】深交所消息，9月21日至9月25日，本所共对159起证券异常交易行为采取了自律监管措施，涉及盘中拉抬打压、虚假申报等异常交易情形；对复牌后的“天山生物”“豫金刚石”“长方集团”持续进行重点监控，并及时采取监管措施；共对13起上市公司重大事项进行核查，并上报证监会2起涉嫌违法违规案件线索。（e公司）,深交所：对复牌后的“天山生物”“豫金刚石”“长方集团”持续进行重点监控
457,2020-09-25 17:33:26,【国家卫健委官员：今年年底新冠疫苗年产能达6.1亿剂】9月25日，国务院新闻办公室举办吹风会，介绍新冠病毒疫苗工作进展情况，并答记者问。在会上，科研攻关组疫苗研发专班工作组组长、国家卫生健康委医药卫生科技发展中心主任郑忠伟表示，按照现在的估算，到今年年底，预计新冠疫苗年产能达6.1亿剂，到明年，年产能可以达到10亿剂以上。（澎湃新闻）,国家卫健委官员：今年年底新冠疫苗年产能达6.1亿剂
458,2020-09-25 17:31:20,【紫江企业：拟分拆紫江新材料至创业板上市】紫江企业(600210)9月25日晚公告，公司拟分拆所属子公司紫江新材料至深交所创业板上市。本次分拆完成后，公司的股权结构不会发生变化，且仍将维持对紫江新材料的控股权。（e公司）,紫江企业：拟分拆紫江新材料至创业板上市
459,2020-09-25 17:24:55,【文旅部：积极引导和支持旅行社创新产品和服务 加快推进线上线下融合】文化和旅游部9月25日发布旅行社有序恢复经营疫情防控措施指南(第二版)，在切实做好新冠肺炎疫情常态化防控前提下，推进旅行社有序恢复经营。指南指出，各地要根据市场新变化新需求，积极引导和支持旅行社创新产品和服务，加快推进线上线下融合，借助大数据、人工智能、移动通信等新技术新手段，开展云直播、云旅游、新媒体营销，及时推出品质化、定制化、个性化产品和服务，推动行业全面恢复和高质量发展。（e公司）,文旅部：积极引导和支持旅行社创新产品和服务 加快推进线上线下融合
460,2020-09-25 17:24:29,【30秒看完9月“聪明钱”逆势加仓股】据东方财富Choice数据显示，截至9月24日，北向资金9月已累计净流出274亿元，但仍有个股被大手笔加仓。其中耗资（本月持股增加量*个股区间成交均价）过亿增持的个股超百只。北向资金9月耗资11.65亿元增持宁德时代排名居首，万科A、比亚迪、长春高新、顺丰控股、恒瑞医药等个股被增持金额均超10亿元。让我们一起看看还有哪些股票获“聪明钱”逆市加仓。,30秒看完9月“聪明钱”逆势加仓股
461,2020-09-25 17:19:31,【旷视科技正寻求在香港和内地科创板同步发行上市】消息称人工智能公司旷视科技正寻求在香港和内地科创板同步发行上市。一位知情人士透露，旷视科技的上市计划已有实质性进展，大概率在今年底就会上市。截至发稿，旷视科技未对上述消息置评。（界面新闻）,旷视科技正寻求在香港和内地科创板同步发行上市
462,2020-09-25 17:15:54,【西安：新建商品房项目必须按比例配建公租房】西安市住建局官网消息，为解决中低收入居民和新市民的住房问题，构建以需定供、保障充分、结构合理的公共租赁住房保障体系，西安市政府规定，新建商品住房项目必须配建一定比例的公租房。据悉，此政策的范围为西安市行政区域内新出让住宅用地(含用地性质变更、规划指标调整)的商品住房项目，建设单位应按规定配建公共租赁住房。（界面新闻）,西安：新建商品房项目必须按比例配建公租房
463,2020-09-25 17:07:08,【上交所：成大生物等3家公司科创板首发过会】上交所9月25日披露，江苏富淼科技股份有限公司、辽宁成大生物股份有限公司、常州银河世纪微电子股份有限公司科创板首发过会。（e公司）,上交所：成大生物等3家公司科创板首发过会
464,2020-09-25 17:03:12,【外汇局：清理整合部分外汇账户】外汇局消息，为进一步深化外汇管理改革，简化相关业务操作流程，便利银行、企业等市场主体真实合规办理外汇业务，国家外汇管理局决定对部分外汇账户进行清理整合，进一步减少账户种类，涉及8类账户。该通知自2021年2月1日起实施。（e公司）,外汇局：清理整合部分外汇账户
465,2020-09-25 17:01:29,【铑价4年暴涨20倍 金属市场最大黑马来了】随着各国汽车减排新规不断加码，今年以来，铑价一路飞涨，累计年涨幅已超130%，统计显示，该涨幅约是金价的8倍多、钯金价的11倍多。据数据显示，截至发稿，国内铑价报3516.5元/克，累计月涨幅超12%。（中国基金报）,铑价4年暴涨20倍 金属市场最大黑马来了
466,2020-09-25 16:54:32,【中国社保基金将投资于蚂蚁集团的IPO】中国社保基金将投资于蚂蚁集团的IPO。（界面新闻）,中国社保基金将投资于蚂蚁集团的IPO
467,2020-09-25 16:49:07,【证监会：支持商品指数发展】证监会新闻发言人常德鹏表示，证监会支持商品指数发展，着力促进商品指数与股票指数、债券指数等一起形成多元包容的指数体系，为实体经济发展和居民财富管理作出应有的贡献。（第一财经）,证监会：支持商品指数发展
468,2020-09-25 16:47:40,【证监会对再融资实施分类审核：信披工作考评达一定条件可予以快速审核】证监会新闻发言人常德鹏9月25日在证监会新闻发布会上表示，为了方便上市公司再融资，更大力度支持上市公司利用资本市场做优做强。证监会对上市公司再融资实施分类审核，在审核主板、中小板的上市公司非公开发行股票申请时，对新授予的最近连续两个信息披露工作考评期评价结果为A的上市公司予以快速审核。（中证网）,证监会对再融资实施分类审核：信披工作考评达一定条件可予以快速审核
469,2020-09-25 16:46:36,【交通银行：成功发行300亿元无固定期限资本债券】交通银行(601328)9月25日晚公告，近日，公司在全国银行间债券市场成功发行无固定期限资本债券。本次债券发行规模为300亿元，前5年票面利率为4.59%，每5年调整一次，在第5年及之后的每个付息日附发行人有条件赎回权。（证券时报）,交通银行：成功发行300亿元无固定期限资本债券
470,2020-09-25 16:41:40,【*ST江特：前三季度净利同比预增208.60%-285.75%】*ST江特(002176)9月25日晚间披露业绩预告，公司前三季度预计盈利2000万元-2500万元，同比预增208.60%-285.75%。业绩预增主要原因为电机业务利润增长，处置子公司投资收益增加。（e公司）,*ST江特：前三季度净利同比预增208.60%-285.75%
471,2020-09-25 16:40:47,【外汇局：二季度我国经常账户顺差7804亿元】外汇局消息，二季度，我国经常账户顺差7804亿元，资本和金融账户逆差2443亿元，其中，非储备性质的金融账户逆差1086亿元，储备资产增加1356亿元。上半年，我国经常账户顺差5453亿元，资本和金融账户逆差1668亿元，其中，非储备性质的金融账户逆差2054亿元，储备资产减少393亿元。（e公司）,外汇局：二季度我国经常账户顺差7804亿元
472,2020-09-25 16:40:04,【在岸人民币兑美元收盘涨38点】在岸人民币兑美元北京时间16:30官方收报6.8202，较上一交易日官方收盘价涨38点，较上日夜盘收盘涨73点。（第一财经）,在岸人民币兑美元收盘涨38点
473,2020-09-25 16:39:16,【证监会批准开展短纤期货交易】证监会新闻发言人表示，证监会批准开展短纤期货交易，正式交易时间为2020年10月12日。（第一财经）,证监会批准开展短纤期货交易
474,2020-09-25 16:36:48,【塔牌集团：股东拟减持不超过2%公司股份】塔牌集团(002233)9月25日晚间公告，股东张能勇于3月25日-9月24日减持1.23%公司股份，此前披露的减持计划届满。同日，公司公告，张能勇计划在公告发布之日起6个月内以大宗交易方式，或者自公告发布之日起15个交易日后的6个月内以集中竞价方式，合计减持本公司股份2384.55万股(占本公司总股本比例2%)。（证券时报网）,塔牌集团：股东拟减持不超过2%公司股份
475,2020-09-25 16:35:20,【证监会：近三年受到证监会行政处罚的公司不能进入再融资快速审核通道】证监会上市部副主任范中超25日表示，再融资分类审核的快速通道设立了禁入条件，公司存在最近三年受到证监会行政处罚等情形不能进入快速审核通道，另一方面，证监会要求上市公司提高信息披露质量，同时保荐机构和证券服务机构要勤勉尽责，发现违法违规行为会严肃查处。（证券时报网）,证监会：近三年受到证监会行政处罚的公司不能进入再融资快速审核通道
476,2020-09-25 16:34:13,【证监会要求国金、国联证券自查 并提交内幕知情人名单】证监会新闻发言人常德鹏9月25日表示，证监会已关注到国联、国金合并中可能涉内幕交易情况。并且根据相关规定要求公司自查，提交内幕信息知情人名单，启动了核查程序。（第一财经）,证监会：已关注到国联、国金合并中可能涉内幕交易情况 启动了核查程序
477,2020-09-25 16:30:19,【部分公司利用新冠疫情蹭热点炒作 证监会：正在关注】证监会发言人表示，目前有部分公司利用新冠疫情蹭热点炒作股价，证监会目前正在关注。（第一财经）,部分公司利用新冠疫情蹭热点炒作 证监会：正在关注
478,2020-09-25 16:28:20,【证监会：期货法已列入全国人大常委会2020年立法工作计划】证监会新闻发言人常德鹏在回应新华财经记者关于期货法制定情况提问时表示，期货法已列入全国人大常委会2020年立法工作计划，证监会积极配合相关工作，争取尽快提交全国人大常委会审议。（新华财经）,证监会：期货法已列入全国人大常委会2020年立法工作计划
479,2020-09-25 16:26:28,【华为轮值董事长徐直军：目前没有考虑投资或与车企成立合资公司】据腾讯汽车，9月25日，华为轮值董事长徐直军在接受媒体采访时表示，“目前没有考虑投资或者与汽车企业成立合资公司，未来说不清楚。”徐直军透露，目前在智能汽车解决方案BU已经投入了5亿美金，短期内没有考虑汽车业务的盈利问题。（界面新闻）,华为轮值董事长徐直军：目前没有考虑投资或与车企成立合资公司
480,2020-09-25 16:25:27,【新冠病毒疫苗上市后如何定价？官方：一定在大众可接受范围内】9月25日15时，国务院新闻办举行吹风会，介绍新冠病毒疫苗工作进展情况。对于公众关注的新冠病毒疫苗上市后的价格问题，科研攻关组疫苗研发专班工作组组长、国家卫生健康委医药卫生科技发展中心主任郑忠伟表示，一定会满足可及性和可担负性，在大众可接受的范围内提出指导价格。（澎湃新闻）,新冠病毒疫苗上市后如何定价？官方：一定在大众可接受范围内
481,2020-09-25 16:22:13,【市北高新：拟发行不超10亿元公司债】市北高新(600604)9月25日晚披露公司债券发行预案，此次非公开发行公司债券规模不超过10亿元，拟用于偿还公司债务或补充流动资金。（e公司）,市北高新：拟发行不超10亿元公司债
482,2020-09-25 16:20:09,【美股三大股指期货转跌】道指期货跌0.1%，标普500指数期货跌0.16%，纳指期货跌0.27%。,美股三大股指期货转跌
483,2020-09-25 16:18:31,【证监会介绍对上市公司再融资实施分类审核有关情况】证监会今日召开新闻发布会，有关部门负责同志出席发布会介绍对上市公司再融资实施分类审核有关情况。（第一财经）,证监会介绍对上市公司再融资实施分类审核有关情况
484,2020-09-25 16:12:42,【二六三：拟2.1亿元在海南设立全资子公司】二六三(002467)9月25日晚间公告，公司基于业务发展需要，拟以自有资金出资2.1亿元设立全资子公司--海南二六三投资有限公司。本次投资设立全资子公司旨在利用海南自由贸易港政策支持、区位条件、营商环境等方面的优势，进一步完善公司产业布局，以实现公司战略发展目标和提升公司的持续竞争力。（e公司）,二六三：拟2.1亿元在海南设立全资子公司
485,2020-09-25 16:12:41,【巨星科技：前三季度净利预增40%-50%】巨星科技(002444)9月25日晚间披露前三季度业绩预告，预计盈利10.19亿元至10.92亿元，同比增长40%-50%。第三季度，美国市场产品需求环比稳定上升，大型商超客户产品库存量继续降低，部分竞争对手由于疫情原因无法正常经营，行业内中小型公司陆续出现停工和清算的情况。（证券时报网）,巨星科技：前三季度净利预增40%-50%
486,2020-09-25 16:12:41,【银河电子：拟不超过3.75亿元投资产业链上下游优质上市企业】银河电子(002519)9月25日晚间公告，9月25日董事会审议通过议案，公司拟围绕主业，用自有或自筹资金以证券投资方式对产业链上下游优质上市企业进行投资，投资总额不超过3.75亿元(不含本数)。（e公司）,银河电子：拟不超过3.75亿元投资产业链上下游优质上市企业
487,2020-09-25 16:08:28,【收盘播报】香港恒生指数今日小幅下跌0.32%，周线四连阴，本周累计下跌4.99%。个股方面，中国恒大下跌9.46%，报13.78港元；恒大汽车下跌12.76%，报16.82港元。,恒指周线四连阴 中国恒大跌逾9%恒大汽车跌近13%
488,2020-09-25 16:06:06,【中国证券业协会发布《证券公司场外期权业务管理办法》】为进一步完善证券公司场外期权业务的制度供给，加强场外期权业务的自律管理，促进业务的健康规范发展，中国证券业协会在广泛征集意见的基础上，制定了《证券公司场外期权业务管理办法》。经第六届常务理事会第十二次会议表决通过，并经中国证监会备案，现予发布，自发布之日起施行。（中国证券业协会）,中国证券业协会发布《证券公司场外期权业务管理办法》
489,2020-09-25 16:01:21,【签署系列合作协议 正式启用广西基地 深交所与广西全方位战略合作再上新台阶】2020年9月24日，深圳证券交易所与广西壮族自治区人民政府签署《强化股权债权工具应用促进广西高质量发展战略合作协议》，与自治区地方金融监管局及相关单位签署专项协议，正式启用深交所广西基地，联合开展企业投融资路演活动，双方全方位战略合作再上新台阶。（深交所）,签署系列合作协议 正式启用广西基地 深交所与广西全方位战略合作再上新台阶
490,2020-09-25 15:56:00,【通威股份：与隆基股份战略合作】通威股份公告，公司与隆基股份于2020年9月25日签订了《合作协议》、《四川永祥新能源有限公司增资扩股协议》、《云南通威高纯晶硅有限公司投资协议》，双方拟将永祥新能源注册资本由12亿元增加至28亿元，扩产后设计年产能7.5万吨；双方协商投资云南通威高纯晶硅有限公司(云南保山4万吨高纯晶硅项目)，公司注册资本为16亿元；双方以每年10.18万吨多晶硅料的交易量为基础目标。（界面新闻）,通威股份：与隆基股份战略合作
