,datetime,content,title
223,2020-08-18 13:57:57,【榆林超10多家煤矿上调价格5-10元/吨】榆林超10多家煤矿18日再次上调价格5-10元/吨，现在部分大矿连续多次涨价，带动周边煤矿也上调价格。（界面新闻）,榆林超10多家煤矿上调价格5-10元/吨
224,2020-08-18 13:57:13,【抖音概念股午后拉升】联创股份直线拉升涨停，省广集团涨逾8%，环球印务、凯撒文化等纷纷跟涨。（界面新闻）,抖音概念股午后拉升
225,2020-08-18 13:53:46,【北向资金午后转为净流出】北向资金午后转为净流出，净流出超2亿元。（第一财经）,北向资金午后转为净流出
226,2020-08-18 13:48:53,【蚂蚁集团最快月内向香港联交所递交上市申请】蚂蚁集团最快月内向香港联交所递交上市申请，香港上市集资额或达100亿美元。（界面新闻）,蚂蚁集团最快月内向香港联交所递交上市申请
227,2020-08-18 13:47:39,【我国二季度新增服装相关企业超过118万家 同比增长13.36%】天眼查专业版数据显示，我国目前状态为在业、存续、迁入、迁出的服装相关企业超过1500万家，其中近六成企业为个体工商户。行业方面，服装相关企业集中分布在批发和零售业(81.35%)，另有约6.54%的相关企业为制造业。截至8月17日，以工商登记为准，我国今年共新增服装相关企业超过235万家(全部企业状态)，其中第二季度新增超过118万家相关企业，较去年同比增长13.36%。（证券时报网）,我国二季度新增服装相关企业超过118万家 同比增长13.36%
228,2020-08-18 13:43:38,【股市播报】A股三大指数震荡，农业种植板块领涨。食品饮料、贵金属、海南、酿酒、煤炭采选等板块也涨幅居前。保险、银行、船舶制造、民航机场等板块领跌。,A股三大指数震荡 农业种植板块领涨
229,2020-08-18 13:40:51,【现货白银涨幅达2%】现货白银涨幅达2%，报27.96美元/盎司。(金十数据),现货白银涨幅达2%
230,2020-08-18 13:40:30,【2020年医保目录调整方案出炉：品种准入截止大限放宽 新药进医保更快】国家医疗保障局8月17日晚公布《2020年国家医保药品目录调整工作方案》和《2020年国家医保药品目录调整申报指南》，这也意味着，在2019年进行医保目录调整后，将首次连续两年对医保目录进行调整，而本次医保目录调整方案中诸多细节也预示着，医保目录调整正逐步动态化，往后不仅“一年一调”有望成为固定态势，而当年上市的新药也将更快的获得医保谈判“门票”。（界面新闻）,2020年医保目录调整方案出炉：品种准入截止大限放宽 新药进医保更快
231,2020-08-18 13:40:19,【首届“中国5G+工业互联网大会”将在武汉举办】据武汉发布消息，工信部将像支持武汉抗击疫情一样，对武汉疫后重振予以全力以赴的支持，明确将进一步支持武汉5G试点工作、支持指导武汉承办5G+工业互联网大会及中国国际工业设计博览会等。同时，工信部要求移动、联通、电信三大运营商在5G建设方面继续加大对武汉支持力度。（证券时报）,首届“中国5G+工业互联网大会”将在武汉举办
232,2020-08-18 13:33:57,【核电股午后走高 中国核建涨停】中国核建拉升涨停，中广核技、中核科技、兰石重装等纷纷跟随拉升。（界面新闻）,核电股午后走高 中国核建涨停
233,2020-08-18 13:30:15,【香港将推出第三轮防疫抗疫基金及第二期“保就业计划”】香港特区政府行政长官林郑月娥18日表示，香港疫情仍严峻，经济受到打击，特区政府将会推出第三轮防疫抗疫基金，并会听取业界意见。而第二轮防疫抗疫基金之下的第一期“保就业计划”，已经大致完成申请，补贴总额为439亿港元。第二期“保就业计划”将于本月31日开始接受申请。（央视新闻）,香港将推出第三轮防疫抗疫基金及第二期“保就业计划”
234,2020-08-18 13:29:42,【李迅雷：目前国内券商强强联合不太可行 强弱联合或比较可行】中泰证券首席经济学家李迅雷认为，目前国内券商之间的强强联合不太可行，即很难达到1+1大于2的效果。即便是某些“出事”的大券商被另一家大券商合并，从日后看，也不见得能做大，甚至有可能出现1+1小于1的现象。比较可行的或许是强弱联合的模式，即以强带弱，实现资源、平台和人才之间的互补。（证券时报）,李迅雷：目前国内券商强强联合不太可行 强弱联合或比较可行
235,2020-08-18 13:21:18,【免税概念午后拉升 百联股份封板】百联股份午后拉升封板，格力地产、鄂武商A、南宁百货等纷纷跟涨。（界面新闻）,免税概念午后拉升 百联股份封板
236,2020-08-18 13:16:07,【伟隆股份：已签署多个军品订单】伟隆股份(002871)在互动平台表示，公司营销中心设立了专门的军品销售部，现已签署多个军品订单，公司也正在积极开拓军工领域的相关业务，争取在军工领域的进步。（证券时报网）,伟隆股份：已签署多个军品订单
237,2020-08-18 13:10:45,【万达酒店与京东达成战略合作】据万达集团消息，18日上午，万达酒店及度假村与京东集团举行战略合作发布仪式。双方表示，将发挥各自核心优势，强强联合，促进双方在产品开发、市场开拓、整合营销、供应链共享等领域上的创新升级。（证券时报）,万达酒店与京东达成战略合作
238,2020-08-18 13:07:22,【郑商所刘鸿君：上半年棉花期货日均成交量47万手 同比增长115%】8月18日，中国棉花期货百人论坛在上海举行。郑商所农产品部总监刘鸿君表示，2016年来棉花期货成为了棉花产业健康发展坚定的推动者和守护者，市场功能持续有效发挥。今年上半年棉花期货日均成交量为47万手，同比增长115%，日均持仓量为59万手，同比增长62%。（中证网）,郑商所刘鸿君：上半年棉花期货日均成交量47万手 同比增长115%
239,2020-08-18 13:05:25,【千方科技午后直线封板】千方科技午后直线封板，股价报26.73元。（第一财经）,千方科技午后直线封板
240,2020-08-18 12:57:00,【连续涨停！一大波热点股票抢眼 大金融飙涨后熄火 淘金结构性行情】分析人士表示，市场热点扩散，投资者的做多热情被再次点燃，沪指处于冲关前的充分酝酿蓄势之中。(中国证券报),连续涨停！一大波热点股票抢眼 大金融飙涨后熄火 淘金结构性行情
241,2020-08-18 12:56:56,【知名私募手撕*ST济堂董事会，要求罢免除独董外所有董事！公司陷入资金占用、违规担保泥潭】8月17日晚间，*ST济堂公告，持有3.33%股份的股东新疆盛世信金股权投资合伙企业(有限合伙)(以下简称：盛世信金)提出临时提案，拟罢免公司除独立董事外的所有董事，并提名了新的董事人选，拟提交公司股东大会审议。(中国证券报),知名私募手撕*ST济堂董事会 要求罢免除独董外所有董事
242,2020-08-18 12:54:32,【科技龙头砸出“黄金坑” 业绩最猛的华为概念股是它】面对此番美国的再次升级打压，华为概念股今日并没有出现大幅波动。早盘数据显示，华为概念股中有近一半股票飘红，其中东软载波、湘油泵、万兴科技、联创电子、福蓉科技等涨停。（数据宝）,科技龙头砸出“黄金坑” 业绩最猛的华为概念股是它
243,2020-08-18 12:53:37,【沪指逼近7月份高点 周期股扛起领涨大旗！大蓝筹能否撑起第二波】中信证券研报认为，煤炭板块今年以来涨幅持续落后于指数，市场主要担心板块的长期景气以及宏观复苏的确定性，难以对板块持续提升估值。但从目前的经济恢复程度以及流动性的角度观察，宏观因素对板块影响的弹性在增加，行业龙头公司前景并不悲观，优质龙头公司估值修复空间明确，有配置价值。,沪指逼近7月份高点 周期股扛起领涨大旗！大蓝筹能否撑起第二波
244,2020-08-18 12:53:25,【千亿级私募高毅美股持仓曝光！买了17股12只都是中概股 二季度大举抛售阿里】管理规模已经过千亿的高毅资产，早就开始布局海外市场，最近其美股调仓路径曝光！美国证监会最新披露的数据显示，截至今年6月底，高毅资产旗下共计持仓17家美股上市公司，持股市值合计为2.74亿美元。从持仓情况来看，高毅对于中概股青睐有加，拼多多是第一大重仓股，而其二季度最为明显的动作为减持阿里巴巴。（上海证券报）,千亿级私募高毅美股持仓曝光！买了17股12只都是中概股 二季度大举抛售阿里
245,2020-08-18 12:53:13,【蚂蚁集团在广西成立新公司 注册资本1亿元】据天眼查APP显示，蚂蚁(广西)数字科技有限公司于2020年8月13日成立，注册资本1亿元，法定代表人为胡晓明，公司经营范围包括数据处理服务；软件开发；接受金融机构委托从事信息技术和流程外包服务(不含金融信息服务)等。该公司由蚂蚁金服(杭州)网络技术有限公司全资控股，后者为蚂蚁科技集团股份有限公司的全资子公司。（界面新闻）,蚂蚁集团在广西成立新公司 注册资本1亿元
246,2020-08-18 12:48:57,【通威旗下永祥多晶硅因特大洪水紧急停电停产】8月18日上午，通威旗下永祥股份子公司永祥多晶硅所在的乐山市五通桥区，遭遇百年一遇特大洪水，目前四川及乐山市已启动一级防汛应急响应，永祥多晶硅公司按当地政府应急管理局要求，已紧急停产，全部设备安全停车，复产时间视汛情和后续影响而定。据悉，当地水位还在继续上涨。（每日经济新闻）,通威旗下永祥多晶硅因特大洪水紧急停电停产
247,2020-08-18 12:42:53,【消息称谷歌在美国17个州秘密测试6GHz网络】报道称，根据近期披露的几份FCC文档，谷歌计划在美国17个州秘密测试6GHz网络。媒体表示谷歌可能正在测试某种家庭互联网服务，或用于支持谷歌的光纤项目Google Fiber。（IT之家）,消息称谷歌在美国17个州秘密测试6GHz网络
248,2020-08-18 12:36:17,【大利好！国产新冠疫苗预计年内上市 这些A股又疯涨】预计北京生物制品研究所的灭活疫苗年产量能达1.2亿剂，武汉生物制品研究所的灭活疫苗年产量能达1亿剂。(中国基金报),大利好！国产新冠疫苗预计年内上市 这些A股又疯涨
249,2020-08-18 12:36:12,【上海电气获中核4台百万级核电大单】上海电气消息，日前，上海电气与中国核电工程有限公司正式签订田湾核电站7、8号机组及徐大堡核电站3、4号机组汽轮发电机组设备采购合同。两个项目分别计划于2020年12月、2021年5月开工。此次两项目汽轮发电机组设备采购合同的签订，体现了上海电气自主优化研发的核电汽轮发电机组在不同核岛堆型的匹配性和适用性，进一步巩固上海电气汽轮发电机组技术的行业领先地位。（证券时报）,上海电气获中核4台百万级核电大单
250,2020-08-18 12:32:09,【华润电力上半年净利润45.29亿港元 同比增12.7%】据华润电力(00836.HK)8月17日公告，公司2020年上半年净利润为45.29亿港元，较去年同期净利润增加12.7%。公告显示，报告期内，华润电力附属电厂售电量为7020.92万兆瓦时，同比下降0.6%；附属燃煤电厂平均标煤单位约人民币626元/吨，较去年同期下降9.1%；平均售电单位燃料成本为185元/兆瓦时，较去年同期下降10.4%。（界面新闻）,华润电力上半年净利润45.29亿港元 同比增12.7%
251,2020-08-18 12:24:50,【发展改革委：截至今年7月底各地已签约PPP项目中民间投资项目1679个】据发展改革委8月18日消息，根据全国PPP项目信息监测服务平台数据，截至今年7月底平台已签约项目中民间投资项目共1679个，占全部已签约项目的43%；其中，民营企业单独中标项目833个，联合体中标项目中民营企业控股项目846个。今年1-7月，各地新增已签约项目158个，其中民间投资项目29个。（中国证券网）,发展改革委：截至今年7月底各地已签约PPP项目中民间投资项目1679个
252,2020-08-18 12:18:32,【中科院院士赵忠贤一行考察江西省电子集团】据江西省电子集团消息，近日，国家最高科学技术奖获得者、中国科学院院士赵忠贤，超导国家重点实验室副主任金魁，中科院深圳先进技术研究院博士生导师李烨一行，莅临集团考察调研全球首台兆瓦级高温超导感应加热设备的产业化进程。集团下属子公司江西联创光电超导应用有限公司历经6年研发制造的超导感应加热设备是有色金属热处理行业的革命性、颠覆性技术突破，可用于铝挤压、军工和航空航天金属挤压锻造等多种领域。（证券时报）,中科院院士赵忠贤一行考察江西省电子集团
253,2020-08-18 12:16:31,【中国电信：5G套餐用户达到3784万户】中国电信8月18日公布中期业绩，5G套餐用户达到3784万户，移动用户ARPU较去年下半年企稳回升。（证券时报）,中国电信：5G套餐用户达到3784万户
254,2020-08-18 12:11:03,【康希诺：Ad5-nCoV的III期临床试验尚未入组】康希诺发布澄清公告，重组新型冠状病毒疫苗Ad5-nCoV的II期临床试验已完成。本公司目前正在与多个国家联系，计划尽快推动Ad5-nCoV国际多中心III期临床试验。截至本公告日，Ad5-nCoV的III期临床试验尚未入组。（第一财经）,康希诺：Ad5-nCoV的III期临床试验尚未入组
255,2020-08-18 12:10:56,【午间公告】超华科技：正在筹划向特定对象通过包括但不限于协议转让、非公开发行股票等方式引入该特定对象成为公司控股股东，所涉及的具体股权比例尚不确定，若上述事项最终达成，可能导致公司实际控制权发生变更。交易对方所属行业是金属和非金属新材料领域。捷佳伟创：公司及全资子公司等今年累计获各项政府补助3836.9万元。永高股份：拟1800万元成立全资子公司。荣盛发展：控股子公司荣万家赴香港IPO获中国证监会核准。（证券时报）,午间公告：超华科技拟筹划控制权变更事项
256,2020-08-18 12:09:18,【中国电信上半年净利润139.5亿元 同比增0.3%】中国电信上半年营运收入1938亿元人民币，净利润139.5亿元人民币，同比增0.3%。,中国电信上半年净利润139.5亿元 同比增0.3%
257,2020-08-18 12:00:50,【国家能源局：7月新纳入国家财政补贴规模户用光伏项目总装机容量为88.67万千瓦】据国家能源局官网8月18日消息，根据各省级能源主管部门、电网企业报送信息，经国家可再生能源信息管理中心梳理统计，2020年7月新纳入国家财政补贴规模户用光伏项目总装机容量为88.67万千瓦。截至2020年7月底，全国累计纳入2020年国家财政补贴规模户用光伏项目装机容量为293.51万千瓦。（中国证券网）,国家能源局：7月新纳入国家财政补贴规模户用光伏项目总装机容量为88.67万千瓦
258,2020-08-18 11:50:53,【鼎信通讯：公司的10kV充电桩项目处于检测取证过程 下一步将开展试点】鼎信通讯(603421)在互动平台表示，公司的10kV充电桩项目目前处于检测取证过程，下一步将开展试点。公司的HPLC芯片采用28纳米工艺。（证券时报）,鼎信通讯：公司的10kV充电桩项目处于检测取证过程 下一步将开展试点
259,2020-08-18 11:42:51,【上清所：已收到康美药业“17康美MTN002”的全额利息资金】8月18日，上清所公告，已收到康美药业“17康美MTN002”的全额利息资金，并于今日代理完成了该期债券的付息工作。（证券时报）,上清所：已收到康美药业“17康美MTN002”的全额利息资金
260,2020-08-18 11:41:27,【长三角一体化金融总部在沪成立】为积极配合国家长三角一体化发展战略，8月18日，长三角一体化金融总部在沪成立，同时长三角区域一体化服务方案发布。（央视新闻）,长三角一体化金融总部在沪成立
261,2020-08-18 11:35:57,【国债期货窄幅震荡午盘多数下跌】国债期货窄幅震荡午盘多数下跌，10年期主力合约跌0.07%，5年期主力合约跌0.05%，2年期主力合约接近持平。（第一财经）,国债期货窄幅震荡午盘多数下跌
262,2020-08-18 11:30:39,【期市午盘：贵金属期货走强 沪银主力涨近4%】8月18日，国内商品期货午盘多数上涨，贵金属期货走强，沪银涨近4%。分析师指出，黄金回调后逢低吸纳为主，白银多看少动谨慎操作。,期市午盘：贵金属期货走强 沪银主力涨近4%
263,2020-08-18 11:30:38,【股市播报】A股三大指数震荡，农业种植板块领涨。食品饮料、贵金属、海南、酿酒、煤炭采选等板块也涨幅居前。保险、银行、船舶制造、民航机场等板块领跌。,A股三大指数震荡 农业种植板块领涨
264,2020-08-18 11:26:51,【第三批国家组织药品集中采购将正式开标】8月20日，第三批国家组织药品集中采购将正式开标。此次采购品种进一步扩大，涉及的品种达到56个，数量接近前两次集采中选品种的总和。本次集采包含了多个常用药品品种和部分抗白血病、抗肿瘤以及精神类药物，部分品种是前期集采流标品种，或者是前期集采品种的其他剂型。（第一财经）,第三批国家组织药品集中采购将正式开标
265,2020-08-18 11:26:15,【食品饮料个股大幅走强 安记食品涨停】安记食品拉升涨停，重庆啤酒、三全食品、安井食品、好想你等大涨逾7%。（界面新闻）,食品饮料个股大幅走强 安记食品涨停
266,2020-08-18 11:24:23,【粤澳宣布开通横琴口岸新旅检区域】作为粤港澳大湾区建设的标杆工程，横琴口岸集设施“硬联通”和制度“软联通”于一体，采用“合作查验、一次放行”的新型通关查验模式，使粤澳通关从“两地两检”变成“一地两检”，从“中间摆渡”“两上两下”变成最快5秒通关，粤澳日通行能力从75万人次提升到90万人次，大大提升通关效率，改善通关体验。（新华社）,粤澳宣布开通横琴口岸新旅检区域
267,2020-08-18 11:17:47,【高盛：上调京东集团目标价至329港元 重申“买入”评级】高盛发布研究报告表示，京东第二季度业绩的强力表现，将有助于公司股价维持强势走势，因此重申公司“买入”评级，并上调港股目标价16%，由283港元升至329港元，将其列入“确信买入”名单。（证券时报）,高盛：上调京东集团目标价至329港元 重申“买入”评级
268,2020-08-18 11:09:51,【工商银行、中国银行相继发布多项区块链相关专利】天眼查显示，近日，工商银行公布多项区块链相关专利，包括“区块链共识系统及方法”、“基于区块链的文档编辑方法、装置及系统”、“基于区块链的终端升级保护系统及方法”、“基于区块链的分布式数据库存储方法及系统”等。中国银行也在近日公布了“一种基于区块链的信息管理方法及装置”、“一种基于区块链的捐赠物资处理方法、装置及系统”、“一种基于区块链的个人信息管理方法及装置”等多项区块链相关专利。（界面新闻）,工商银行、中国银行相继发布多项区块链相关专利
269,2020-08-18 11:06:09,【隔夜shibor报2.1150%】隔夜shibor报2.1150%，下跌1.3个基点；7天shibor报2.1900%，下跌2.3个基点；3个月shibor报2.6000%，下跌0.2个基点。（金十数据）,隔夜shibor报2.1150%
270,2020-08-18 10:58:23,【万华化学TDI本周挂牌价上调 涨幅高达15%】万华化学本周TDI挂牌价格执行15000元/吨，上调2000元/吨，涨幅高达15%。货源紧缺，本周2折供应。（界面新闻）,万华化学TDI本周挂牌价上调 涨幅高达15%
271,2020-08-18 10:54:27,【中国联通王晓初：已开通26万5G基站 年底达到37万站】中国联通董事长王晓初表示，中国联通正在加快与中国电信的共建共享。目前中国联通已建成开通5G基站26万个，今年底要达到37万个。（界面新闻）,中国联通王晓初：已开通26万5G基站 年底达到37万站
272,2020-08-18 10:41:18,【非洲猪瘟疫苗将进入扩大临床和生产性试验】由中国农业科学院哈尔滨兽医研究所自主研发的非洲猪瘟疫苗进展顺利，在前期完成候选疫苗株实验室和中间试制阶段研究的基础上，目前已完成疫苗环境释放试验，即将进入扩大临床试验和生产性试验阶段。（农业农村部网站）,非洲猪瘟疫苗将进入扩大临床和生产性试验
273,2020-08-18 10:41:15,【银保监会公布农险经营名单 29家险企入选】银保监会财险部向各银保监局、各财险公司下发通知，公布了符合农业保险业务经营条件的保险公司总公司名单。共有29家财险公司入选。分别为：人保财险、中华联合财险、太保财险、国寿财险、阳光农业相互保险、安华农险、国元保险、平安财险、中原保险、中航安盟财险、安信农保、紫金财险、大地财险、北部湾财险、锦泰财险、永安财险、中煤财险、泰山财险、阳光财险、华农财险、安诚财险、太平财险、诚泰财险、国任财险、黄河财险、英大泰和财险、燕赵财险、海峡金桥财险、大家财险。 (中国证券网),银保监会公布农险经营名单 29家险企入选
274,2020-08-18 10:33:55,【山东：计划到2022年海水淡化产能超过100万吨/日】山东近日印发《关于加快发展海水淡化与综合利用产业的意见》，计划到2022年，全省海水淡化产能超过100万吨/日。（界面新闻）,山东：计划到2022年海水淡化产能超过100万吨/日
275,2020-08-18 10:33:11,【海南板块拉升走强 海航基础封板】海航基础涨停，海汽集团、海航投资、海南高速等纷纷拉升。（证券时报）,海南板块拉升走强 海航基础封板
276,2020-08-18 10:32:36,【农业农村部：7月份农业农村经济运行总体良好 早稻预计增产】农业农村部发展规划司消息，7月份农业农村经济运行总体良好。今年早稻亩穗数和穗粒数增加，结实率和千粒重受前期洪涝影响下降，由于面积增加较多，总产有望增加。（界面新闻）,农业农村部：7月份农业农村经济运行总体良好 早稻预计增产
277,2020-08-18 10:28:13,【石大胜华：公司电池级溶剂相关产品订单充足 生产安排已满产】石大胜华互动平台称，近期公司五种电池级溶剂产品需求均有增长，相关产品订单充足，生产安排已满产。（界面新闻）,石大胜华：公司电池级溶剂相关产品订单充足 生产安排已满产
278,2020-08-18 10:17:25,【花旗银行：金价有望突破新高 看向2400美元/盎司】花旗银行将现货黄金0-3个月的目标位设在2100美元/盎司，6-12个月目标位为2300美元/盎司。美元疲软及美债负收益率导致黄金ETF投资者流入速度创下纪录。现货黄金正接近突破新高，预计将延续上涨，看向2400美元。（界面新闻）,花旗银行：金价有望突破新高 看向2400美元/盎司
279,2020-08-18 10:16:03,【三聚环保与海南齐鲁签署10万吨悬浮床二代生物柴油购销合同】据三聚环保消息，近日，三聚环保与海南齐鲁发展有限公司签署了二代生物柴油(HVO)购销合同，向海南齐鲁供应10万吨HVO产品。本次与海南齐鲁签署的二代生物柴油大宗销售协议，标志着公司生产的生物燃料进一步得到国内外客户的认可，为后续投放更大规模的产能奠定了基础。（证券时报网）,三聚环保与海南齐鲁签署10万吨悬浮床二代生物柴油购销合同
280,2020-08-18 10:12:31,【富邦股份：已建成10万吨圆颗粒钾肥 正在建设20万吨土壤改良剂项目】富邦股份在互动平台表示，种植业主要投入品分为种子、化肥、农药及农技等，公司已建成10万吨圆颗粒钾肥、正在建设20万吨土壤改良剂项目，为种植业提供特种肥料。（界面新闻）,富邦股份：已建成10万吨圆颗粒钾肥 正在建设20万吨土壤改良剂项目
281,2020-08-18 10:01:15,【瑞幸咖啡（中国）有限公司申请注册“鹿茶”商标】天眼查APP显示，近日，瑞幸咖啡(中国)有限公司申请注册“鹿茶”商标，国际分类为“43-餐饮住宿”，商标状态显示为“商标其他情形”，商标流程为“商标注册申请---申请收文”。瑞幸咖啡(中国)有限公司由瑞幸咖啡(香港)有限公司100%持股。（证券时报）,瑞幸咖啡（中国）有限公司申请注册“鹿茶”商标
