,datetime,content,title
0,2020-05-08 23:43:18,【深圳2020年住房用地计划供应量翻倍 产业用地“不设上限”】5月8日，深圳市规划和自然资源局发布了《深圳市2020年度建设用地供应计划》。按用地性质分，计划供应居住用地293.2公顷(其中新供应129.2公顷)，产业用地198公顷，民生设施用地601.8公顷，商服用地107公顷。（21世纪经济报道）,深圳2020年住房用地计划供应量翻倍 产业用地“不设上限”
1,2020-05-08 23:26:11,【特斯拉涨逾5%】特斯拉涨逾5%，此前，马斯克表示，特斯拉拟于周五在菲蒙市重启生产。,特斯拉涨逾5%
2,2020-05-08 23:17:05,【取消QFII/RQFII额度限制 赶在外资大举扫货前抢筹？】5月7日晚，传出一个重磅消息：央行、国家外汇管理局发布《境外机构投资者境内证券期货投资资金管理规定》，取消境外机构投资者额度限制。抢在外资大举进入A股之前，我们该如何投资？（21世纪经济报道）,取消QFII/RQFII额度限制 赶在外资大举扫货前抢筹？
3,2020-05-08 23:01:32,【电商：直播带货成新热点 出口转内销受关注】5月8日，在国务院联防联控机制发布会上，商务部副部长王炳南介绍了五一“期间我国消费市场的情况。”五一“期间市场活跃、人气明显回升，线上消费大幅增长，商品消费亮点突出、实物消费稳步回暖、市场供应货足价稳，消费市场总体呈现了快速回升的态势。尤其在电商领域的消费表现的更加突出。（中国商务新闻网）,电商：直播带货成新热点 出口转内销受关注
4,2020-05-08 22:43:25,【我国海洋生产总值十年翻番】在加快建设海洋强国战略部署下，2019年我国海洋生产总值超过8.9万亿元，十年间翻了一番，海洋生产总值占GDP的比重近20年保持在9%左右。（新华网）,我国海洋生产总值十年翻番
5,2020-05-08 22:26:16,【新高教集团以3.848亿元收购洛阳科技职业学院45%股权】民办高教企业新高教集团（02001.HK）发布公告，以3.848亿元收购洛阳科技职业学院45%股权。此次收购后，新高教集团持有该学校全部股权。（界面新闻）,新高教集团以3.848亿元收购洛阳科技职业学院45%股权
6,2020-05-08 22:24:49,【负油价冲击 俄罗斯投资者要求调查】俄罗斯超过100名投资者要求俄罗斯央行和莫斯科交易所主要股东介入，调查（莫斯科）交易所是否故意误导了购买原油期货合约的投资者。Milton律所准备对莫斯科交易所发起法律诉讼。上月WTI原油出现史无前例的负油价，导致俄罗斯投资者损失了近10亿卢布（约合1362万美元）。（界面新闻）,负油价冲击 俄罗斯投资者要求调查
7,2020-05-08 22:18:29,【日本6月起拟向中小企业提供2万亿日元房租补贴】日本将向中小企业和个体户直接发放房租的三分之二，月额上限为中小企业50万日元（约合人民币3.3万元）、个体户25万日元，补贴为期半年。（界面新闻）,日本6月起拟向中小企业提供2万亿日元房租补贴
8,2020-05-08 22:11:32,【雷军：云服务需要ALL IN! 金山云需要独立对接资本】金山云在今天晚间正式登陆纳斯达克，代码为“KC”。金山云共发行2500万股美国存托凭证，IPO定价为17美元ADS。而金山云在招股书中披露，IPO前，小米集团持有公司4.14亿股普通股，占比15.8%。受此消息影响，小米集团港股股价一度大涨超10%。而作为职业生涯始于金山的小米董事长雷军，今天也是难掩激动之情。在面对第一财经的独家专访时，雷军表示，云服务是这个时代一个巨大的风口，分拆上市金山云则能让公司独立对接资本，从而有更大的发展空间。（第一财经）,雷军：云服务需要ALL IN! 金山云需要独立对接资本
9,2020-05-08 22:10:49,【加拿大统计局：四月份有近两百万加拿大人失业】加拿大统计局当地时间8日发布的数据显示，4月份的失业人口为199.38万，将近两百万加拿大人失业，失业率为13%。此前，3月份的失业人数超过一百万，失业率为7.8%。（证券时报网）,加拿大统计局：四月份有近两百万加拿大人失业
10,2020-05-08 22:06:06,【茅台集团金融管理委员会研究金融板块相关工作】5月8日，茅台集团金融管理委员会在茅台会议中心召开2020年第二次会议，研究金融板块子公司发展相关事宜。会议强调，面对茅台在新时期新的发展要求，要长远定位好金融板块发展方向。金融板块各子公司要做好风险管理，提高市场竞争能力，增强发展后劲，以更好的效益为集团高质量发展提供更大支撑。（第一财经）,茅台集团金融管理委员会研究金融板块相关工作
11,2020-05-08 22:03:53,【长沙启动跨境电商企业联合运营中心 打造“跨境人才高地”】中国(长沙)跨境电子商务综合试验区跨境电商企业联合运营中心8日举行启动仪式，运营中心以“湘商回归，产业赋能”为服务宗旨，打出跨境电商“招商”与“引才”组合拳，打造湖南跨境电商产业新增长极和跨境电商人才高地。运营中心项目办公总面积近5万平方米，将分三期于五年内建设完成，可同时满足百家大中型跨境电商企业办公。运营中心将围绕跨境电商“企业孵化、人才孵化、产业孵化”，引进、培育跨境电商总部型企业和中高端人才。（中国新闻网）,长沙启动跨境电商企业联合运营中心 打造“跨境人才高地”
12,2020-05-08 21:57:32,【欧洲央行工作人员研究购买垃圾债的可能性】据报道，欧洲央行的工作人员已被责成评估购买高收益信贷有何优劣，并把评估结果递交给决策者。（界面新闻）,欧洲央行工作人员研究购买垃圾债的可能性
13,2020-05-08 21:54:05,【恒瑞医药获得SHR7280临床试验通知书】恒瑞医药公告，公司及子公司上海恒瑞医药有限公司、成都盛迪医药有限公司近日收到国家药监局核准签发的关于SHR7280片的《临床试验通知书》。SHR7280是一种口服小分子GnRH受体拮抗剂，可以阻断内源性GnRH与GnRH受体的结合，抑制黄体生成素和卵泡刺激素等促性腺激素的合成和释放，降低睾酮和雌二醇等性激素水平，治疗包括子宫内膜异位症在内的激素依赖性疾病。（第一财经）,恒瑞医药获得SHR7280临床试验通知书
14,2020-05-08 21:51:45,【近期十余大中城市出台新政策 降低落户门槛】近期，重庆、青岛、杭州、苏州、南昌等十多个大中城市出台新的政策，进一步放开落户限制，有些城市已接近“零门槛”落户。国家发展改革委今年4月印发《2020年新型城镇化建设和城乡融合发展重点任务》，要求督促城区常住人口300万以下城市全面取消落户限制，推动城区常住人口300万以上城市基本取消重点人群落户限制。记者梳理发现，目前，不少城市在逐步放开对包括大学生在内人群的落户限制，但总体上还是以吸引人才为主。青岛市人社局就业促进与失业保险处处长宋平认为，此次一些城市落户再放松，是户籍制度改革在既定方向上的进一步落实。尤其在当前，推动城市间流动人口在适宜的城市落户，对于保持就业稳定、促进消费具有重要作用。疫情的冲击将进一步促进人们流向就业机会多，教育、医疗等公共服务较好，生活成本相对较低、生活压力相对小的城市。（新华社）,近期十余大中城市出台新政策 降低落户门槛
15,2020-05-08 21:46:33,【现货黄金已收复非农数据公布后的所有跌幅】现货黄金已收复非农数据公布后的所有跌幅，截至发稿，报1717.98美元/盎司。,现货黄金已收复非农数据公布后的所有跌幅
16,2020-05-08 21:37:38,【外资加速流入！连续17个月增持中国债券】5月8日，中央结算公司发布的4月债券托管量(按投资者)数据显示，境外机构投资者的债券托管量继续保持增长，4月境外机构债券托管面额为20011.36亿元，较3月增长433.19亿元，同比上涨30.45%，相较上年末上涨6.62%。（上海证券报）,外资加速流入！连续17个月增持中国债券
17,2020-05-08 21:34:40,【疫情期间Switch需求激增 任天堂利润飙升200%】2020年1月至3月，任天堂营业利润为894亿日元（约合59.34亿元人民币），飙升200%。（界面新闻）,疫情期间Switch需求激增 任天堂利润飙升200%
18,2020-05-08 21:30:15,【美国三大股指高开近1%】美国三大股指集体高开，道指涨0.97%，纳指涨0.86%，标普500指数涨0.96%。,美国三大股指高开近1%
19,2020-05-08 21:26:51,【GMO Click4月外汇交易额环比下滑】周五(05月08日)援引Finance Magnates(FM)报道，基于疫情导致的市场波动性舒缓，在3月创下交易额破纪录的强劲之后，日本零售经纪商GMO Click4月份交易额环比下滑。,GMO Click4月外汇交易额环比下滑
20,2020-05-08 21:25:46,【吉利德授权印度等国药企生产瑞德西韦 专家称国内引入意义不大】5月初，美国食品和药物管理局(FDA)为瑞德西韦颁发紧急使用授权(EUA)。5月8日，吉利德宣布，日本厚生劳动省(MHLW)已通过特殊审批途径，批准Veklury(瑞德西韦)作为SARS-CoV-2感染的治疗药物。,吉利德授权印度等国药企生产瑞德西韦 专家称国内引入意义不大
21,2020-05-08 21:21:56,【一汽奔腾：隋忠剑将接棒柳长庆任公司总经理】现任一汽奔腾轿车有限公司总经理柳长庆将调往一汽集团战略管理及商业规划部担任总经理；主管营销的一汽奔腾轿车有限公司副总经理杨大勇调任马自达营销事业部。（中国经营网）,一汽奔腾：隋忠剑将接棒柳长庆任公司总经理
22,2020-05-08 21:19:23,【山东全面放开高校生落户限制 16市均可先落户后就业】近日，山东省人力资源和社会保障厅等13部门联合印发《关于做好2020年高校毕业生就业工作的通知》。通知提出，全省全面放开对高校在校生、毕业生的落户限制，全省16市均可先落户后就业。鼓励各地结合实际出台降低高校毕业生生活成本的措施，吸引省外高校毕业生来鲁就业，促进省内高校毕业生留鲁发展。（界面新闻）,山东全面放开高校生落户限制 16市均可先落户后就业
23,2020-05-08 21:16:03,【深交所：保荐人需准确把握创业板定位 推荐符合高新技术产业和战略性新兴产业发展方向的创新创业企业】记者从券商了解到，目前深交所已起草《深圳证券交易所创业板企业发行上市申报及推荐暂行规定（征求意见稿）》《暂行规定》明确，创业板定位为“深入贯彻创新驱动发展战略，适应发展更多依靠创新、创造、创意的大趋势，主要服务成长型创新创业企业，并支持传统产业与新技术、新产业、新业态、新模式深度融合。”同时，保荐人需准确把握创业板定位，推荐符合高新技术产业和战略性新兴产业发展方向的创新创业企业，以及其他符合创业板定位的企业在创业板上市。（证券时报）,深交所：保荐人需准确把握创业板定位 推荐符合高新技术产业和战略性新兴产业发展方向的创新创业企业
24,2020-05-08 21:10:07,【印尼放宽国内旅游禁令 有条件地恢复旅行】印尼鹰航（Garuda Indonesia）已于周四恢复国内航班，狮航（Lion Air）、飞翼航空（Wings Air）和巴泽航空（Batik Air）计划于周日恢复国内航班。（界面新闻）,印尼放宽国内旅游禁令 有条件地恢复旅行
25,2020-05-08 21:06:02,【欧比特：公司旗下11个银行账户被冻结 涉及金额1亿元】欧比特公告，公司旗下11个银行账户被冻结，涉及金额1亿元，原因系该公司原董事、旗下全资子公司广东铂亚信息信息技术有限公司原法定代表人、执行董事李小明以其本人且私刻铂亚信息公章越权为个人借款，最终拖欠巨额债务，相关债权人向法院起诉，导致11个银行账户被冻结和11出房产被查封。该公司声明，欧比特和铂亚信息对李小明私人借款毫不知情，事后也从未认可。（第一财经）,欧比特：公司旗下11个银行账户被冻结 涉及金额1亿元
26,2020-05-08 21:00:10,【国内期市夜盘开盘 菜粕跌逾1%】国内期市夜盘开盘，菜粕跌逾1%、液化气涨逾1%。,国内期市夜盘开盘 菜粕跌逾1%、液化气涨逾1%
27,2020-05-08 20:59:28,【证监会核发3家企业IPO批文】近日，我会按法定程序核准了以下企业的首发申请：重庆三峰环境集团股份有限公司，安徽龙磁科技股份有限公司，昆山佰奥智能装备股份有限公司。上述企业及其承销商将分别与交易所协商确定发行日程，并陆续刊登招股文件。（证监会发布）,证监会核发3家企业IPO批文
28,2020-05-08 20:54:57,【拉卡拉回复问询函：金融科技业务不存在合规风险】拉卡拉回复深交所年报问询函。关于毛利率较高的问题，拉卡拉回复称，商户经营毛利率高是用户经营类新经济的典型特征，即通过一个刚性需求的高粘性的业务获得用户，然后全面发掘用户需求，自身或者与合作伙伴一起满足用户需求，获取用户经营收益。因此，公司在通过支付业务获取商户的基础上，经营商户所产生的各类服务收入，无需支付额外的获客成本，毛利率保持在较高水平。（界面新闻）,拉卡拉回复问询函：金融科技业务不存在合规风险
29,2020-05-08 20:47:59,【*ST皇台：向深交所提出恢复上市申请】*ST皇台(000995)5月8日晚间公告，根据《深圳证券交易所股票上市规则》有关规定，公司董事会认为公司已符合提出恢复上市申请的条件，并于4月27日召开第七届董事会第十次会议，审议通过了《关于公司符合恢复上市条件并向深圳证券交易所申请恢复上市的议案》。5月8日，公司向深圳证券交易所提交了股票恢复上市的书面申请。（e公司）,*ST皇台：向深交所提出恢复上市申请
30,2020-05-08 20:44:01,【重磅！创业板上市企业“负面清单”征求意见】5月8日，证券时报记者从券商了解到，目前深交所已起草《深圳证券交易所创业板企业发行上市申报及推荐暂行规定(征求意见稿)》(简称《暂行规定》)，正在保荐机构层面进行定向征求意见。（证券时报网）,重磅！创业板上市企业“负面清单”征求意见
31,2020-05-08 20:41:32,【招商证券两宗诉讼取得进展 康得新案和南一农药集团分获得裁定和立案】5月8日，招商证券披露，此前的康得投资集团案件有新进展，法院裁定康得集团所持康得新股票1515万股作价1627万元赔偿给公司；2017年4月与南京第一农药集团有限公司的股票质押纠纷，5月6日获得深圳福田区法院立案，合计标的价格4.18亿元。（券商中国）,招商证券两宗诉讼取得进展 康得新案和南一农药集团分获得裁定和立案
32,2020-05-08 20:34:51,【*ST鹏起：证监会对公司及实控人张朋起立案调查】*ST鹏起(600614)5月8日晚间公告，因公司及公司实际控制人均涉嫌信息披露违法违规，中国证监会决定对公司及公司实际控制人张朋起立案调查。（e公司）,*ST鹏起：证监会对公司及实控人张朋起立案调查
33,2020-05-08 20:32:20,【敦煌莫高窟5月10日起恢复开放 单日限售门票1800张】因疫情关闭百余天的世界文化遗产莫高窟将于5月10日恢复开放。开放后，莫高窟单日门票预约最大限量调整为总承载量的30%，即每天限售门票1800张，暂不接受旅行社团队预约。游客提前申领“国家防疫信息码”或“甘肃省健康出行码”后，可预约购买10日内参观门票。在进入洞窟参观时，将进行扫码核验和体温测量。（新华网）,敦煌莫高窟5月10日起恢复开放 单日限售门票1800张
34,2020-05-08 20:31:59,【上期所相关负责人就修订《上海期货交易所镍期货合约》及《上海期货交易所交割细则》答记者问】2020年5月8日，上海期货交易所(下称上期所)发布公告，对《上海期货交易所镍期货合约》及《上海期货交易所交割细则》进行修订。上期所相关负责人就市场关心的问题，回答了记者的提问。,上期所相关负责人就修订《上海期货交易所镍期货合约》及《上海期货交易所交割细则》答记者问
35,2020-05-08 20:30:05,【数据】美国4月非农就业人数减少2050万人，预估为减少2200万人，前值为减少70.1万人。美国4月失业率为14.7%，前值为4.4%。（第一财经）,美国4月非农就业人数减少2050万人 创历史最大降幅
36,2020-05-08 20:26:57,【诺德股份：拟定增募资不超14.2亿元 控股股东认购比例不低于30%】诺德股份(600110)5月8日晚间披露非公开发行股票预案，拟募集资金总额不超过14.2亿元，用于投资年产15000吨高性能极薄锂离子电池用电解铜箔工程项目、补充流动资金及偿还银行贷款。发行对象为包括控股股东邦民控股在内的不超过35名特定对象，其中邦民控股拟认购数量不低于本次发行股票数量的30%。（e公司）,诺德股份：拟定增募资不超14.2亿元 控股股东认购比例不低于30%
37,2020-05-08 20:23:40,【俄罗斯央行行长纳比乌琳娜：6月降息幅度可能超过50个基点】俄罗斯央行行长纳比乌琳娜表示，6月降息幅度可能超过50个基点，有可能达到100个基点。（界面新闻）,俄罗斯央行行长纳比乌琳娜：6月降息幅度可能超过50个基点
38,2020-05-08 20:22:40,【云图控股：信庭至诚合伙减持公司股份2020.2万股】云图控股公告，公司近日收到股东深圳市信庭至诚化工企业（有限合伙）出具的《简式权益变动报告书》。信庭至诚合伙于5月8日通过证券交易所的大宗交易方式减持公司股份2020.2万股，占公司总股本的2%。本次权益变动后，信庭至诚合伙持有公司股份4979.8万股，占公司总股本的4.93%，不再是公司持股5%以上的股东。（第一财经）,云图控股：信庭至诚合伙减持公司股份2020.2万股
39,2020-05-08 20:18:21,【中鼎股份：成为麦格纳公司纯电动卡车项目车顶支架总成产品的批量供应商】中鼎股份(000887)5月8日晚间公告，公司北美子公司ZD Metal近期收到客户的通知，公司成为麦格纳公司纯电动卡车项目车顶支架总成产品的批量供应商。本次车顶支架总成产品采用领先的镁合金技术，项目生命周期总金额约为24.53亿元。此次拿到麦格纳公司的合作项目，是公司镁合金技术的重要突破，为公司进一步拓展未来新能源及汽车轻量化领域市场奠定基础。（e公司）,中鼎股份：成为麦格纳公司纯电动卡车项目车顶支架总成产品的批量供应商
40,2020-05-08 20:14:20,【保利集团：一般性可控行政开支有条件的力争压缩10%以上】近日，保利集团公司下发了《关于积极应对疫情影响，树立过“紧日子”思想，大力开展降本增效工作的通知》，要求各部门、各子公司要细化各类费用支出标准，从严控制各项费用性开支，大力压缩差旅费、会议费、业务招待费、办公费等一般性可控行政开支，压缩幅度要达到5%以上，有条件的力争压缩10%以上。（界面新闻）,保利集团：一般性可控行政开支有条件的力争压缩10%以上
41,2020-05-08 20:11:41,【深交所发布公共健康、长江100等5条深市特色主题股票指数】5月8日，深交所联合其全资子公司深圳证券信息有限公司共同发布深证公共健康50指数、深证长江经济带100指数、深证云科技50指数、深证生物医药50指数和深证消费电子50指数等5条深市特色主题指数，进一步丰富市场指数化投资工具，引导资源配置深市优质资产，为统筹推进疫情防控和全面复工复产达产提供更为有力的资本市场支持和服务。本次发布的指数均以深市公司为选样范围，分别从公共健康产业、长江经济带、云科技产业、生物医药产业和消费电子产业中，选取总市值排名靠前的相应数量股票作为样本股。指数采用自由流通市值加权，于每年6月、12月的第二个星期五的下一个交易日进行样本股定期调整。（第一财经）,深交所发布公共健康、长江100等5条深市特色主题股票指数
42,2020-05-08 20:05:49,【哈尔斯：实控人倡议员工增持股票并承诺兜底】哈尔斯(002615)5月8日晚间公告，控股股东、实际控制人吕强倡议公司及境内主要全资子公司、控股子公司全体员工积极买入公司股票。员工事先经吕强本人确认拟购买数量，并在2020年5月13日至5月28日期间完成不超过约定数量的净买入哈尔斯股票（不低于1000股），全额连续持有18个月以上，且持有期间连续在哈尔斯履职的，该等哈尔斯股票的收益归员工个人所有，若该等股票产生亏损，由吕强予以补偿。（e公司）,哈尔斯：实控人倡议员工增持股票并承诺兜底
43,2020-05-08 20:04:55,【百润股份：拟定增募资不超过10.06亿元 拟用于烈酒（威士忌）陈酿熟成项目】百润股份公告，公司拟非公开发行A股股票。本次非公开发行股票募集资金总额不超过10.06亿元，扣除发行费用后将全额用于烈酒（威士忌）陈酿熟成项目。（界面新闻）,百润股份：拟定增募资不超过10.06亿元 拟用于烈酒（威士忌）陈酿熟成项目
44,2020-05-08 20:03:08,【6月看新片？院线称：正在等主管部门通知后安排复映工作】几位院线经理表示，他们大多表示仍在等主管部门的正式通知和具体执行办法，各个影院预计还需要几天时间根据自己影院情况以及所在地区制定相应开放标准，之后才能推进复映安排。票房分析师罗天文告诉记者，电影院到底能不能有序开门还是需要等到国家电影局的通知，但目前从全国的疫情情况来看已经不远了。“或许经过半个月左右的复工准备与重映影片对市场的预热，观众很有可能在六月看到第一批上映的新片。”（新京报）,6月看新片？院线称：正在等主管部门通知后安排复映工作
45,2020-05-08 19:54:29,【广东省：积极推广新技术、新能源、新装备】广东省交通运输厅就《广东省公共交通条例（征求意见稿）》公开征求意见：积极推广新技术、新能源、新装备，推动大数据、移动互联网等信息技术在公共交通运营、服务、安全和管理等方面的应用。（第一财经）,广东省：积极推广新技术、新能源、新装备
46,2020-05-08 19:53:25,【北汽蓝谷：1-4月北汽新能源销量同比下降68.13%】北汽蓝谷公告，公司子公司北京新能源汽车股份有限公司4月实现产量432辆，去年同期为578辆。本年累计实现产量6165辆，同比增长79.74%；4月实现销量586辆，去年同期为5009辆。本年累计实现销量9586辆，同比下降68.13%。（第一财经）,北汽蓝谷：1-4月北汽新能源销量同比下降68.13%
47,2020-05-08 19:51:55,【上期所：对参与实物交割的电解镍 取消形状限制】上期所相关负责人就修订《上海期货交易所镍期货合约》及《上海期货交易所交割细则》答记者问。近年来，随着我国新能源汽车产业的快速发展，以镍豆为代表的其它形状电解镍在国内的使用和流通规模显著增加，对于镍合约交割品多元化的需求日渐增长。为更好地服务实体经济，进一步提升期货市场的价格发现和套期保值功能，上期所顺应现货市场发展变化，及时优化合约规则。此次修订对参与实物交割的电解镍，取消形状限制。同时丰富了镍期货交割商品准入机制。在保留品牌注册制的基础上，增加品牌认可制。明确镍期货交割商品应当是在上期所注册的生产企业生产的注册品牌商品或上期所认可的生产企业生产的指定品牌商品。（第一财经）,上期所：对参与实物交割的电解镍 取消形状限制
48,2020-05-08 19:50:47,【证监会：国联证券等4家公司首发过会】证监会5月8日公告，今日上会的4家公司：国联证券股份有限公司、昆山沪光汽车电器股份有限公司、瑞鹄汽车模具股份有限公司、协创数据技术股份有限公司首发均获通过。（证券时报网）,证监会：国联证券等4家公司首发过会
49,2020-05-08 19:47:54,【圣农发展：4月家禽饲养加工行业销售收入环比下降14.98%】圣农发展2020年5月8日晚间发布公告称，4月实现销售收入11.99亿元，同比变动3.17%，环比变动-2.59% ；其中家禽饲养加工行业销售收入7.64亿元（注：抵消前的鸡肉销售收入为8.96亿元），同比变动-12.77%，环比变动-14.98%。（第一财经）,圣农发展：4月家禽饲养加工行业销售收入环比下降14.98%
