,datetime,content,title
486,2020-02-19 18:16:28,【中电兴发：调整非公开发行股票方案】中电兴发(002298)2月19日晚间公告，公司调整非公开发行股票方案。发行方式和发行时间调整为在证监会核准后12个月内向不超过35名特定对象发行股票，发行价格调整为不低于定价基准日前20个交易日股票交易均价的80%，发行数量合计不超过发行前总股本的30%，即不超过2.07亿股，限售期调整为6个月。此次发行募集资金不超过20亿元。（证券时报）,中电兴发：调整非公开发行股票方案
487,2020-02-19 18:14:22,【江西首例新冠肺炎康复者捐献血浆】19日10点，42岁的新冠肺炎康复患者董某来到南昌大学第一附属医院象湖院区成功捐献恢复期血浆300毫升。这是江西首例新冠肺炎康复者捐献血浆。（新华社）,江西首例新冠肺炎康复者捐献血浆
488,2020-02-19 18:11:14,【海利生物：投资药明海德尚处初期 短期预计不会产生盈利】海利生物(603718)2月19日晚间公告，近日有媒体报道公司参股投资的香港药明海德签订合同的事宜。公司目前尚处于投资香港药明海德的初期，预计短期内不会产生盈利，对公司目前业绩没有影响。长期财务收益取决于参股公司的实际业绩，暂无法预计。公司是香港药明海德的参股股东，非控股股东。（证券时报）,海利生物：投资药明海德尚处初期 短期预计不会产生盈利
489,2020-02-19 18:07:08,【华东重机：子公司拟开展口罩机生产销售业务】华东重机(002685)2月19日晚间公告，公司全资子公司润星科技目前已具备部分型号全自动口罩机的批量制造能力，拟正式开展口罩机的生产及销售业务，并于近日完成了经营范围的工商变更。该业务目前尚未对公司经营业绩产生重大影响，预计将对公司未来产生积极影响。（证券时报）,华东重机：子公司拟开展口罩机生产销售业务
490,2020-02-19 18:05:41,【飞荣达：非公开发行股票申请获得中国证监会核准】飞荣达公告，公司于近日收到中国证监会出具的《关于核准深圳市飞荣达科技股份有限公司非公开发行股票的批复》，批文主要内容为：核准公司非公开发行不超过6000万股新股，发生转增股本等情形导致总股本发生变化的，可相应调整本次发行数量。（一财）,飞荣达：非公开发行股票申请获得中国证监会核准
491,2020-02-19 18:00:50,【三孚股份：目前主要产品尚无电子级三氯氢硅】三孚股份(603938)连续两日涨停，该公司2月19日晚间公告，其目前主要产品为三氯氢硅、高纯四氯化硅、氢氧化钾、硫酸钾，尚无电子级三氯氢硅。（证券时报）,三孚股份：目前主要产品尚无电子级三氯氢硅
492,2020-02-19 17:59:11,【钻石公主号新增79人确诊 船上累计621人感染】据报道，日本厚生劳动省19日称，钻石公主号邮轮新增79人确诊。目前邮轮共计感染者621人。（中国日报网）,钻石公主号新增79人确诊 船上累计621人感染
493,2020-02-19 17:58:46,【新冠密切接触员工发烧 当当紧急通知在家办公】2月19日消息，当当网一名母亲确诊新冠肺炎的员工于2月18日晚间出现发烧症状。当当网紧急发布公告通知公司全体员工本周在家办公。（21世纪）,新冠密切接触员工发烧 当当紧急通知在家办公
494,2020-02-19 17:53:54,【国信证券业绩快报：2019年净利同比增43.83%】国信证券披露业绩快报，2019年实现营收140.9亿元，同比增长40.46%；净利润49.2亿元，同比增长43.83%。（一财）,国信证券业绩快报：2019年净利同比增43.83%
495,2020-02-19 17:52:00,【中国神华：1月商品煤产量为2410万吨 同比上涨14.2%】中国神华(601088)公告，1月份商品煤产量为2410万吨，同比上涨14.2%；煤炭销售量为2710万吨，同比上涨4.2%。（全景网）,中国神华：1月商品煤产量为2410万吨 同比上涨14.2%
496,2020-02-19 17:50:53,【国家邮政局：全国电子运单使用率已达98%】国家邮政局消息，截至去年年底，国家邮政局超额完成“9571”工程确定的各项目标，全国电子运单使用率达98%，电商快件不再二次包装率达52%，循环中转袋使用率达75%，设置符合标准的包装废弃物回收装置的邮政快递网点已达3万个。（证券时报）,国家邮政局：全国电子运单使用率已达98%
497,2020-02-19 17:50:04,【三利谱：调整定增方案 实控人拟参与认购】三利谱(002876)2月19日晚间公告，调整非公开发行股票方案，调整涉及发行对象、发行价格及限售期等内容，其中发行价格调整为不低于定价基准日前20个交易日股票交易均价的80%。三利谱此次计划募资不超过11亿元，投入超宽幅TFT-LCD用偏光片生产线项目，公司实控人张建军拟认购不低于4000万元。（证券时报）,三利谱：调整定增方案 实控人拟参与认购
498,2020-02-19 17:49:02,【香港确诊增加1例新型肺炎个案 至今累计确诊63例】香港卫生防护中心公布，一名83岁女病人确诊感染新型冠状病毒肺炎，为太古城确诊男病人的岳母，累计个案达63例。（央视新闻）,香港确诊增加1例新型肺炎个案 至今累计确诊63例
499,2020-02-19 17:46:48,【上海凯宝：痰热清注射液列入新冠肺炎诊疗方案第六版】上海凯宝(300039)2月19日晚间公告，痰热清注射液列入《新型冠状病毒肺炎诊疗方案（试行第六版）》。痰热清注射液是公司独家专利，主要用于细菌或病毒引起的急慢性支气管炎、肺炎及上呼吸道感染疾病的治疗。预计该事项将对痰热清注射液的市场推广和销售产生积极影响，但对经营业绩的影响暂无法估计。（证券时报）,上海凯宝：痰热清注射液列入新冠肺炎诊疗方案第六版
500,2020-02-19 17:44:36,【湘潭电化：修订定增预案 控股股东等参与认购】湘潭电化(002125)2月19日晚间公告，修订非公开发行A股股票预案。修订后，公司拟向不超过35名发行对象，募资不超过5.28亿元，用于年产2万吨高性能锰酸锂电池正极材料等项目。公司控股股东电化集团、间接控股股东振湘国投拟分别认购1亿元、1.5亿元。发行价格将不低于定价基准日前20个交易日公司股票交易均价的80%。（证券时报）,湘潭电化：修订定增预案 控股股东等参与认购
501,2020-02-19 17:43:10,【天广中茂：债权人申请公司重整】天广中茂(002509)2月19日晚间公告，债权人郑州蕴礼以公司不能清偿到期债务且明显丧失清偿能力为由，向泉州市中级人民法院申请对公司进行重整。上述申请能否被法院受理，公司能否进入重整程序尚具有重大不确定性。若重整失败，公司将存在被宣告破产的风险。如果公司被宣告破产，公司股票将面临被终止上市的风险。（证券时报）,天广中茂：债权人申请公司重整
502,2020-02-19 17:42:25,【广东“肺炎1号方”初步研究结果：总有效率达94.21%】2月19日下午，广东省政府新闻办公室召开例行新闻发布会，通报广东省新冠肺炎疫情防控最新情况，重点介绍中医药在我省疫情防控中的运用情况。作为“肺炎1号”的主要操刀人，广州市第八人民医院中医科主任谭行华在发布会上表示，研究结果提示患者总体临床症状明显改善，肺炎1号方总有效率达到94.21%，目前，全省已有11家定点医院申请调剂“肺炎1号”。（南方+）,广东“肺炎1号方”初步研究结果：总有效率达94.21%
503,2020-02-19 17:41:01,【富瀚微：2019年归母净利润同比上升65.05%】富瀚微(300613)发布2019年业绩快报，公司实现营业收入5.22亿元，同比上升26.72%；归属于上市公司股东的净利润为8995.28万元，同比上升65.05%。（全景网）,富瀚微：2019年归母净利润同比上升65.05%
504,2020-02-19 17:37:31,【成都调整防控措施：企业复工无需审批】2月19日下午，成都市新型冠状病毒肺炎疫情防控指挥部办公室发布《关于调整部分已发布指挥部通告有关内容的通知》。记者注意到，《调整通知》中最重要三项内容为：进一步加强野生动物的饲养与交易管控；原暂停的省际客运班线和包车，将有序恢复；企业复工，不再需行业主管部门审批。（21世纪经济报道）,成都调整防控措施：企业复工无需审批
505,2020-02-19 17:36:05,【10个月后A股成交再破万亿  这一市场人气指标启动揭示两大关键逻辑】近期随着市场行情的走高，沪深两市单日的成交额不断逼近万亿元大关。截至今日收盘，沪深两市的累计成交额达1.04万亿元，这也是时隔10个月后，A股单日成交额首次突破万亿大关。而今日作为市场人气指标的券商板块也开始启动。,10个月后A股成交再破万亿  这一市场人气指标启动揭示两大关键逻辑！
506,2020-02-19 17:33:29,【辽宁低风险地区不得封路、封村、封社区、封市场】辽宁在低风险地区实施“外防输入”策略，全面恢复正常生产生活秩序。要保证交通运输、城乡公共交通正常运转，不得封路、封村、封社区、封市场，确保人员正常出行和生产生活物资正常流通。要全面复工复产，积极帮助企业解决用工、原材料、资金、市场开拓等方面的困难和问题。要取消不合理限制，不得对企业复工复产设置条件，不得采取审批、备案等方式延缓开工时间。（一财）,辽宁低风险地区不得封路、封村、封社区、封市场
507,2020-02-19 17:32:11,【专家释疑中医药治疗新冠肺炎主要作用：增强抵抗力、抑制炎症因子释放、改善排便】今天下午广东省政府新闻办防控疫情发布会上，广州市第八人民医院中医科主任谭行华介绍：目前新冠肺炎是没有特效药的，中医药的一大优势是增加身体的抵抗力，比如针对老年人可提高其抵抗力。中药在抑制炎症因子的释放可以起到作用，此外还可改善排便情况，减少细菌病毒感染机会。中药在治疗过程中主要发挥综合的作用。（广州日报）,专家释疑中医药治疗新冠肺炎主要作用：增强抵抗力、抑制炎症因子释放、改善排便
508,2020-02-19 17:31:28,【特斯拉盘前涨超6%】特斯拉美股盘前涨超6%，股价超910美元。该股昨日收涨7.3%。（一财）,特斯拉盘前涨超6%
509,2020-02-19 17:30:16,【农发行首发支持企业复工复产主题债券30亿元】19日，中国农业发展银行在中央国债公司通过公开招标方式，成功发行市场首单1年期支持企业复工复产主题金融债券30亿元。募集资金将用于支持受疫情影响企业的复工复产、帮扶遇困小微企业，以及保障农副产品生产和春耕备耕等相关领域的贷款投放。（新华社）,农发行首发支持企业复工复产主题债券30亿元
510,2020-02-19 17:30:09,【数据】北向资金今日净买入五粮液8.05亿元、中国国旅6.58亿元，净卖出宁德时代2.66亿元、中兴通讯1.89亿元。,北向资金今日净买入五粮液8.05亿元
511,2020-02-19 17:29:03,【探路者：拟新增经营范围“组织生产、销售防护服 销售医疗器械”】探路者(300005)公告，为响应国家应对疫情防治所需，结合市场需求及公司实际经营情况，公司充分发挥国家高新技术企业优势，利用自身在相关领域的技术研发及生产组织能力，在相关部门的支持下将积极开展非医用防护服等防护物资研发及组织生产，为满足业务开展需求，公司拟新增经营范围“组织生产、销售防护服，销售医疗器械”。（全景网）,探路者：拟新增经营范围“组织生产、销售防护服 销售医疗器械”
512,2020-02-19 17:27:35,【华峰超纤：调整非公开发行股票方案】华峰超纤(300180)2月19日晚间公告调整非公开发行股票方案。发行对象调整为不超过35名特定投资者，发行价格不低于定价基准日前20个交易日股票交易均价的80%，发行数量调整为不超过1.65亿股，限售期调整为6个月内。募资总额预计不超过13.8亿元，拟投入江苏超纤年产5000万米产业用非织造布超纤材料项目。（证券时报）,华峰超纤：调整非公开发行股票方案
513,2020-02-19 17:26:48,【上交所：基金管理人可以为本所上市基金申请增加扩位简称】上交所将针对上市基金产品（包括ETF、LOF、分级基金），在原有不超过8个字节的证券简称基础上，增加扩位证券简称。基金管理人可以为本所上市基金申请增加扩位简称，扩位简称不得短于该基金的短简称且不超过16个字节。扩位简称不得重复、不可产生误导或歧义、不能与其他基金的短简称相同，鼓励在扩位简称中增加基金管理人信息。（证券时报）,上交所：基金管理人可以为本所上市基金申请增加扩位简称
514,2020-02-19 17:25:38,【华友钴业跌停 一机构席位卖出3.15亿元】华友钴业(603799)2月19日跌停，报收48.01元，全天成交额27.24亿元。该股盘后数据显示，一家机构席位卖出3.15亿元。另一只钴业股寒锐钴业(300618)当日也跌停，报收80.5元，全天成交额8.42亿元，遭五家机构席位合计卖出3.33亿元。消息面上，特斯拉称将自主研发新电池，预计会在4月的电池投资人会议上宣布具体信息。新电池的含钴量可能为零。（证券时报）,华友钴业跌停 一机构席位卖出3.15亿元
515,2020-02-19 17:24:52,【河南：81家上市企业已复工75家】2月19日下午，河南省召开新冠肺炎疫情防控专题第十二场新闻发布会。河南证监局副局长张智在会上表示，目前，河南81家上市企业有75家已经复工，其中，70%以上公司复工率超50%。（上证报）,河南：81家上市企业已复工75家
516,2020-02-19 17:21:26,【九安医疗收关注函：说明“兜底式增持”倡议所涉亏损补偿的合理性】九安医疗收关注函，要求说明“兜底式增持”倡议所涉亏损补偿的合理性、可行性，是否存在配合股东减持的情形。此前，公司实际控制人、董事长刘毅向全体员工倡议在2020年2月18日至2020年2月21日期间买入公司股票，并承诺对连续持有公司股票12个月以上且在职的员工净买入股票产生的亏损，以个人资金予以补偿50%。（一财）,九安医疗收关注函：说明“兜底式增持”倡议所涉亏损补偿的合理性
517,2020-02-19 17:20:18,【正邦科技：2019年实现归母净利润同比增长777.53%】正邦科技公告，公司2019年实现营业利润19.9亿元、利润总额17.8亿元、归属于上市公司股东的净利润16.97亿元、基本每股收益0.69元，分别比2018年增长671.89%、779.53%、777.53%和777.53%，主要原因是本报告期生猪价格的上涨使公司生猪养殖板块的毛利有所提升，利润增加。（一财）,正邦科技：2019年实现归母净利润同比增长777.53%
518,2020-02-19 17:18:46,【五洋停车：调整非公开发行股票方案】五洋停车(300420)2月19日晚间公告，调整公司2019年度非公开发行股票方案。发行对象调整为不超过35名特定投资者，发行价格为不低于定价基准日前20个交易日公司股票交易均价的80%，限售期调整为6个月。此次募资总额不超过8亿元，拟用于智能机械式立体停车设备制造项目（东莞基地）等。（证券时报）,五洋停车：调整非公开发行股票方案
519,2020-02-19 17:17:44,【教育部：国家中小学网络云平台访问人次已达1500万】教育部会同工信部于2月17日正式开通了国家中小学网络云平台（ykt.eduyun.cn），免费供各地自主选择使用。截至19日12:00，云平台网页浏览次数2300万，访问人次1500万，覆盖全国31个省（区、市），运行通畅。据介绍，学科课程资源覆盖了初高中12个学科，课程分周陆续上线，第一周上线169节。（中新网）,教育部：国家中小学网络云平台访问人次已达1500万
520,2020-02-19 17:16:50,【武汉市：进一步加大机动车管控力度 进一步规范市内车辆通行证】今天（19日）下午，武汉交警发布通告，将全面加强武汉市区域内交通管控，减少机动车出行。除抗疫车辆、公务用车、公共交通、医护人员用车、运输生活必需品车辆和救护、消防、抢险、环卫、警车等特种车辆外，其他车辆一律禁止通行。为进一步管控市内人员车辆，保障防疫、生产生活等车辆正常通行，对前期报备车辆，武汉市将进一步规范统一市内车辆通行证。未取得通行证、无特殊情况的车辆不得在市内通行。（湖北之声）,武汉市：进一步加大机动车管控力度 进一步规范市内车辆通行证
521,2020-02-19 17:12:25,【中广天择：2019年MCN平台营收占比很小】中广天择(603721)近三个交易日录得两个涨停板，公司2月19日晚间发布异动公告称，公司2018年开始布局短视频业务，2019年开始实现收入，2019年度MCN（网红孵化运营和营销业务）平台营收占公司总营收占比很小，目前该业务未对公司业绩产生重大影响。另外，公司股东天图兴盛2月18日通过大宗交易减持70万股，交易价22.67元/股。（证券时报）,中广天择：2019年MCN平台营收占比很小
522,2020-02-19 17:11:05,【“牛市旗手”又火了！市值暴涨近2000亿 未来空间还有多大？】本周以来，A股已累计上涨近80点，截止今日上午收盘，上证综指报收2994.07点，再次逼近3000点关口。其中，券商板块表现则更为亮眼，截止上午收盘，券商指数报收8989.76点，本周以来该指数已怒涨逾500点。,“牛市旗手”又火了！市值暴涨近2000亿 未来空间还有多大？
523,2020-02-19 17:10:46,【江苏规模以上工业企业复工面超75%】截至2月18日，江苏省规模以上工业企业复工数3.4万家，复工面75%，较2月10日提高49%，规模以上工业企业复工总数位列全国各省份首位，复工面居于全国前列；复工人数374万人，占正常用工数的57%。从地区来看，经济总量大、规模企业多的地区复工情况相对较好，苏南规模以上工业企业复工面83.6%，高于全省8.6个百分点。其中，苏州、常州、南通、无锡、镇江复工面均超过8成，分别为92%、84%、83%、82%、81%。（经济日报）,江苏规模以上工业企业复工面超75%
524,2020-02-19 17:09:22,【安居宝：尚无法评估疫情对今年业务经营和业绩的影响】安居宝(300155)2月19日晚回复深交所问询函称，公司是社区安防龙头企业，主营业务与房地产行业高度关联，疫情短期会影响房地产行业开工时间，但预计对全年影响不大；目前全国存量住宅小区还有相当一部分为非封闭小区，疫情过后，各地有可能会加强社区的管理，存量的封闭小区也可能有升级系统。但目前尚无法评估疫情对公司2020年业务经营和实际业绩的影响。（证券时报）,安居宝：尚无法评估疫情对今年业务经营和业绩的影响
525,2020-02-19 17:08:51,【外汇局修订《个人本外币兑换特许业务试点管理办法》】为促进个人本外币兑换特许业务(以下简称兑换特许业务)合规、健康发展，国家外汇管理局对《个人本外币兑换特许业务试点管理办法》(以下简称《办法》)进行了修订(见附件)。现就有关情况通知如下。（外汇局）,外汇局修订《个人本外币兑换特许业务试点管理办法》
526,2020-02-19 17:05:57,【广东专家回应中医药治疗争议：对中医药治疗新冠肺炎有信心】广东省府新闻办防控疫情发布会上，有媒体向广州中医药大学一附院主任中医师林培政提问：广州中医药大学在抗击非典的过程中创造了很多奇迹，如何看待现在中医药在治疗中引发的争议？林培政对此表示，这次新冠肺炎的几个方子，和非典时期的有所不同，针对特定症状增加了几味中药，更加具有针对性。中医药是在历年来质疑中发展的，理论学术上的发展也是守正创新的。我们对中医药治疗新冠肺炎有信心。（广州日报）,广东专家回应中医药治疗争议：对中医药治疗新冠肺炎有信心
527,2020-02-19 16:59:49,【北特科技四连板：公司和特斯拉无直接供货关系】北特科技(603009)连续4日涨停，公司2月19日晚间提示风险称，公司主营业务未发生重大变化。公司和特斯拉无直接供货关系，若后续产生直接供货关系并达到相关信披标准，公司会及时披露相关信息。（证券时报）,北特科技四连板：公司和特斯拉无直接供货关系
528,2020-02-19 16:59:44,【发改委负责人答21记者：复工复产有一个过程 政府不可能包打天下】国家发展改革委运行局二级巡视员唐社民在发布会后回应21世纪经济报道记者表示，复工复产有一个过程，政府不可能包打天下，政府只能做一些最重要的工作，比如推动煤电油运、铁路公路等基础性行业的复工复产，更多的市场化的行业还是要充分发挥市场的作用。（21世纪）,发改委负责人答21记者：复工复产有一个过程 政府不可能包打天下
529,2020-02-19 16:58:56,【宣亚国际：占总股本33.75%的限售股将于2月24日上市流通】宣亚国际(300612)公告，本次申请解除限售股份数量为5467.5万股，占公司股份总数的33.75%；本次实际可上市流通数量为1642.5万股，占公司股份总数的10.1389%；本次限售股份可上市流通日期为2020年2月24日(星期一)。（全景网）,宣亚国际：占总股本33.75%的限售股将于2月24日上市流通
530,2020-02-19 16:57:52,【浙数文化：股东傅建中拟减持不超2%股份】浙数文化(600633)公告，股东傅建中持有公司股份7948.77万股，占公司总股本6.11%，傅建中计划自本减持计划公告之日起15个交易日后的6个月内，通过集中竞价方式减持公司股份不超过2600万股，合计减持的股份总数不超过公司总股本的2%。（全景网）,浙数文化：股东傅建中拟减持不超2%股份
531,2020-02-19 16:55:05,【“钻石公主”号邮轮上有47名中国同胞被确诊】出现新冠肺炎集体感染情况的“钻石公主”号邮轮，19号确诊未被感染的乘客首度结束医学观察，顺利下船，其中也包括约五十名中国乘客。（央视新闻）,“钻石公主”号邮轮上有47名中国同胞被确诊
532,2020-02-19 16:51:02,【赛腾股份：子公司不涉及氮化镓外延片】赛腾股份(603283)发布股票交易异常波动公告称，近期有投资者在E互动问询公司全资子公司苏州智冠光电科技有限公司是否拥有氮化镓外延片，公司已及时回复子公司苏州智冠光电科技有限公司不涉及氮化镓外延片，公司主要从事智能制造装备的研发、设计、生产、销售及技术服务，为客户实现智能化生产提供系统解决方案。（全景网）,赛腾股份：子公司不涉及氮化镓外延片
533,2020-02-19 16:50:24,【习近平：务必高度重视对医务人员的保护关心爱护】中共中央总书记、国家主席、中央军委主席习近平近日就关心爱护参与疫情防控工作的医务人员专门作出重要指示，强调医务人员是战胜疫情的中坚力量，务必高度重视对他们的保护、关心、爱护，从各个方面提供支持保障，使他们始终保持强大战斗力、昂扬斗志、旺盛精力，持续健康投入战胜疫情斗争。（新华社）,习近平：务必高度重视对医务人员的保护关心爱护
534,2020-02-19 16:47:58,【中富通：修订定增预案 发行价格12.18元/股】中富通(300560)2月19日晚间公告，修订非公开发行股票预案。其中，认购价格修订为12.18元/股，即发行价格不低于定价基准日前20个交易日公司股票交易均价的80%；限售期修订为18个月。中富通此次定增拟募资4.5亿元以补充流动资金，实控人陈融洁旗下融嘉科技全额认购。（证券时报）,中富通：修订定增预案 发行价格12.18元/股
535,2020-02-19 16:47:05,【中国人保：子公司1月保费收入为918.57亿元】中国人保(601319)2月19日晚公告，1月份，公司子公司获得的原保险保费收入为918.57亿元，上年同期为952.56亿元。（证券时报）,中国人保：子公司1月保费收入为918.57亿元
536,2020-02-19 16:44:12,【财政部：加强新冠肺炎疫情防控财税政策落实和财政资金监管工作】为打赢新冠肺炎疫情防控阻击战，支持企业复工复产、保障经济运行，中央财政和地方陆续出台相关财税政策，不断加大财政资金支持力度。现就加强相关财税政策落实和财政资金监管有关事项通知如下。（财政部）,财政部：加强新冠肺炎疫情防控财税政策落实和财政资金监管工作
