,datetime,content,title
272,2020-03-23 09:43:00,【香港恒生指数下跌逾4% 中国恒大遭重挫】今日早盘，香港恒生指数开盘下跌5.02%，维持低位震荡走势，截至发稿，恒生指数报21867.79点，下跌4.16%。中国恒大股价开盘暴跌16%，截至发稿，中国恒大下跌逾14.88%，报10.18港元。,香港恒生指数下跌逾4% 中国恒大遭重挫
273,2020-03-23 09:38:11,【行情】富时中国A50指数期货跌幅收窄，截至发稿，富时中国A50指数期货跌4.17%，上一交易日夜盘收跌4.51%。,富时中国A50指数期货跌幅收窄
274,2020-03-23 09:37:40,【医药股开盘走强 东北制药、精华制药、福安药业涨停】医药股开盘走强，东北制药、精华制药、福安药业涨停，未名药业、众生药业、尔康制药等跟涨。,医药股开盘走强 东北制药、精华制药、福安药业涨停
275,2020-03-23 09:37:00,A股三大指数集体下跌，流感、维生素、口罩概念股强势上涨，光刻胶、国产芯片、特斯拉等概念领跌两市。截至发稿，沪指下跌2.32%，深成指下跌2.53%，创业板指下跌1.84%。,A股三大指数集体下跌 光刻胶概念股领跌两市
276,2020-03-23 09:37:00,【香港恒生指数下跌逾3% 中国恒大遭重挫】今日早盘，香港恒生指数开盘下跌5.02%，截止发稿，恒生指数下跌4.16%，中国恒大股价暴跌近16%。,香港恒生指数下跌逾3% 中国恒大遭重挫
277,2020-03-23 09:35:47,【光刻胶概念股开盘走弱】光刻胶概念股开盘走弱，容大感光、上海新阳跌逾9%，芯源微、南大光电、飞凯材料等跌逾6%。,光刻胶概念股开盘走弱
278,2020-03-23 09:35:05,【行情】日经225指数冲高回落，截至发稿，日经225指数涨0.18%。韩国KOSPI指数大跌，截至发稿，韩国KOSPI指数跌5.38%。,日经225指数冲高回落 韩国KOSPI指数跌超5%
279,2020-03-23 09:34:28,"【菲律宾股指开盘跌5.3%至4,527.29点】菲律宾股指开盘跌5.3%至4,527.29点。","菲律宾股指开盘跌5.3%至4,527.29点"
280,2020-03-23 09:31:57,【特朗普回应是否提前抛售了股票：让人讨厌的问题！】当地时间22日记者会上，有媒体问美国总统特朗普有没有在大跌前抛售股票。此前，有媒体曝光美国一些议员曾在美股多次熔断前偷偷抛售股票。据英国《卫报》文字直播，特朗普回答时，形容这是一个“让人讨厌”的问题。然后就开启了“聊闲篇”模式，表示“当总统耗费了我数十亿美元”。他还补充说，自己现在是一位“战时”总统，“很荣幸这个团队和我站在这里面对这么可怕的事情”。（环球网）,特朗普回应是否提前抛售了股票：让人讨厌的问题！
281,2020-03-23 09:29:59,【两市低开 沪指跌2.48%】3月23日开盘，沪指跌2.48%，深证成指跌3.16%，创业板指跌3.07%。盘面上，芯片、半导体、券商等板块跌幅居前。,两市低开 沪指跌2.48%
282,2020-03-23 09:29:53,【美股期指大幅下挫 道指期货跌超4%】美股期指大幅下挫，一度触发熔断限制。截至发稿，道指期货跌4.81%，纳指期货跌4.25%，标普500指数期货跌4.65%。,美股期指大幅下挫 道指期货跌超4%
283,2020-03-23 09:22:48,【中国恒大跌超16%】中国恒大跌超16%，公司预期2019年核心净利润较去年下降约48%。,中国恒大跌超16%
284,2020-03-23 09:22:11,【富时中国A50指数期货跌逾5%】富时中国A50指数期货跌逾5%，上一交易日夜盘收跌4.51%。截至发稿，富时中国A50指数期货跌5.23%。,富时中国A50指数期货跌逾5%
285,2020-03-23 09:20:46,【恒指开盘跌约5%】港股大幅低开，恒指开盘跌约5%。（第一财经）,恒指开盘跌约5%
286,2020-03-23 09:20:00,香港恒生指数开盘下跌5.02%。,香港恒生指数开盘下跌5.02%
287,2020-03-23 09:19:22,【韩国新冠肺炎确诊病例新增64例 累计8961例】韩国中央防疫对策本部23日通报，截至23日零时，韩国较22日零时新增新冠肺炎确诊病例64例，累计确诊病例8961例，共出现111例死亡病例。（人民日报客户端）,韩国新冠肺炎确诊病例新增64例 累计8961例
288,2020-03-23 09:16:47,【人民币兑美元中间价较上日调升112点】人民币兑美元中间价较上日调升112点至7.0940，升幅创2020年3月3日以来最大。（第一财经）,人民币兑美元中间价较上日调升112点
289,2020-03-23 09:16:45,【中国央行今日未开展逆回购操作】中国央行今日未开展逆回购操作，因今日无逆回购到期，当日实现零投放零回笼。（第一财经）,中国央行今日未开展逆回购操作
290,2020-03-23 09:15:55,【恒指期货开跌约7.5%】恒指期货开跌约7.5%，报21303点。,恒指期货开跌约7.5%
291,2020-03-23 09:15:00,【人民币兑美元中间价上调112点】人民币兑美元中间价报7.0940，上调112点，升幅创2020年3月3日以来最大。上一交易日中间价7.1052，上一交易日官方收盘价7.0661，上日夜盘报收7.0970。（第一财经）,人民币兑美元中间价上调112点
292,2020-03-23 09:14:45,【日本央行进行额外国债购买操作】日本央行进行额外国债购买操作，买入3-10年期国债。（界面新闻）,日本央行进行额外国债购买操作
293,2020-03-23 09:08:06,【“红宝石公主号”上49名乘客新冠病毒检测呈阳性】海外网援引澳大利亚广播公司报道，上周停靠在悉尼的“红宝石公主号”邮轮上有49名乘客新冠病毒检测呈阳性。（界面新闻）,“红宝石公主号”上49名乘客新冠病毒检测呈阳性
294,2020-03-23 09:08:05,【行情】日经225指数冲高回落，截至发稿，日经225指数跌0.49%。韩国KOSPI指数大跌，截至发稿，韩国KOSPI指数跌6.55%。,日经225指数冲高回落 韩国KOSPI指数跌超6%
295,2020-03-23 09:07:21,【中国台湾加权指数盘初跌幅迅速扩大至5.2%】中国台湾加权指数盘初跌幅迅速扩大至5.2%。,中国台湾加权指数盘初跌幅迅速扩大至5.2%
296,2020-03-23 09:06:36,【发电量首次正增长 经济运行现“暖”意】据新华社，3月份以来，我国发用电量明显回升。3月17日，全国全口径发电量179亿千瓦时，较2月底提高10.8%，较去年同期增长1%，日发电量实现今年春节以来首次正增长。从“持续低位”到“陡然上蹿”，数据之变反映了中国经济强大的修复能力和强劲动力。随着我国抗击新冠肺炎疫情形势好转，企业复工复产进程加快，经济社会秩序有序恢复，国民经济正加速向常态回归。（新华社）,经济运行现“暖”意
297,2020-03-23 09:05:11,富时中国A50指数期货开盘跌逾5%，上一交易日夜盘收跌4.51%。截至发稿，富时中国A50指数期货跌5.37%。,富时中国A50指数期货开盘跌逾5%
298,2020-03-23 09:05:08,【中金：下调美国2020年GDP预测至负增长】中金公司研报称，鉴于美国新冠疫情加剧，下调美国2020年实际GDP预测至负增长。虽然近期美国货币和财政宽松加码，但预计尚难完全抵消疫情对经济的负面冲击，其经济可能经历1&2季度深度负增长、但随后逐步修复的深V型走势，预计Q1/Q2/Q3/Q4实际GDP年化环比增速分别为-5.8% /-28% /+15.3% /+14.2%，全年增速-4.0%。（证券时报）,中金：下调美国2020年GDP预测至负增长
299,2020-03-23 09:03:23,【原油跌超11% 沥青跌近7%】国内期市开盘普跌，原油跌超11%，沥青跌近7%。沪铜、郑棉期货主力合约跌停。,原油跌超11%
300,2020-03-23 09:01:19,【富时中国A50指数期货开盘跌逾4.5%】3月23日，富时中国A50指数期货开盘跌逾4.5%。（证券时报）,富时中国A50指数期货开盘跌逾4.5%
301,2020-03-23 09:00:53,【美股期指大幅下挫 道指期货跌超4%】美股期指大幅下挫，一度触发熔断限制。截至发稿，道指期货跌4.38%，纳指期货跌4.39%，标普500指数期货跌4.75%。,美股期指大幅下挫 道指期货跌超4%
302,2020-03-23 08:58:24,【安倍晋三：如难以以完整形式举办 东京奥运会可延期】针对国际奥委会开始就延期举办东京奥运会进行讨论一事，日本首相安倍晋三在3月23日上午举行的参议院预算委员会上表示，假如难以以完整形式(如期)举办东京奥运会的话，(国际奥委会)做出延期举办的决定也实属无奈。安倍晋三还表示，“举办东京奥运会的决定权在国际奥委会。在没有停办这一选项上，我与国际奥委会想法一致。”(人民日报),安倍晋三：如难以以完整形式举办 东京奥运会可延期
303,2020-03-23 08:54:13,【特朗普宣布美国加州为新冠疫情重大灾区】美国总统特朗普22日宣布加州为新冠疫情重大灾区，将向加州提供联邦资金援助。（央视新闻）,特朗普宣布美国加州为新冠疫情重大灾区
304,2020-03-23 08:47:21,【今日财经日历大事件提醒】①10:00 国新办就深化“放管服”改革、推进“互联网+”行动、促进“双创”支持扩大就业有关情况举行发布会；②15:00 国务院联防联控机制就依法防控境外疫情输入最新情况举行发布会；③16:00 国新办就中医药防治新冠肺炎的重要作用及有效药物举行发布会；④20:30 美国2月芝加哥联储全美活动指数；⑤23:00 欧元区3月消费者信心指数初值(预估-13，前值-6.6)。,3月23日财经日历大事件提醒
305,2020-03-23 08:41:05,【中信建投：A股将在波动中筑底 当前到4月中旬逐步布局】中信建投研报称，市场已经大幅度下跌，并释放了前期积累的风险。随着疫情的结束，复工复产将加速推进。A股将在波动中筑底，当前时间点到4月中旬都是逐步布局的阶段。行业配置看：第一，半导体、5G通信、计算机等新基建行业是2020年全年主线；第二，逆周期调节的水泥、建材、工程机械等行业受益于积极财政政策，将存在阶段性机会。第三，经济活动正常化，复工持续推进，前期需求被压缩的消费、地产、家电等行业会重新复苏。（证券时报）,中信建投：A股将在波动中筑底 当前到4月中旬逐步布局
306,2020-03-23 08:39:05,【行情】日经225指数冲高回落，截至发稿，日经225指数跌0.23%。韩国KOSPI指数大跌，截至发稿，韩国KOSPI指数跌6.33%。,日经225指数冲高回落 韩国KOSPI指数跌超6%
307,2020-03-23 08:36:14,【数据】截至03月22日，上交所融资余额报5734.55亿元，较前一交易日减少33.4亿元；深交所融资余额报4996.49亿元，较前一交易日减少24.75亿元；两市合计10731.04亿元，较前一交易日减少58.15亿元。,上交所融资余额报5734.55亿
308,2020-03-23 08:35:05,【行情】日经225指数小幅上涨，截至发稿，日经225指数涨0.53%。韩国KOSPI指数大跌，截至发稿，韩国KOSPI指数跌5.81%。,日经225指数小幅上涨 韩国KOSPI指数跌超5%
309,2020-03-23 08:34:57,【日本东证指数跌1%】日本东证指数跌1%，报1270.37点。,日本东证指数跌1%
310,2020-03-23 08:34:53,【美股期指大幅下挫 道指期货跌超4%】美股期指大幅下挫，一度触发熔断限制。截至发稿，道指期货跌4.59%，纳指期货跌3.83%，标普500指数期货跌4.15%。,美股期指大幅下挫 道指期货跌超4%
311,2020-03-23 08:28:36,【美国议员听取疫情简报后提前抛售股票 是否应承担法律责任？】美国参议院情报委员会主席查德·伯尔先于公众多日之前，获知美国疾病预防控制中心关于疫情的报告之后，预感到美国资本市场有可能会出现问题，与自己的妻子在2020年2月13日提前出售所持有的股票，从而躲过了美国股票市场价格下跌的灾难。（证券时报网）,美国议员听取疫情简报后提前抛售股票 是否应承担法律责任？
312,2020-03-23 08:22:53,【美股期指大幅下挫 纳指期货跌超4%】美股期指大幅下挫，一度触发熔断限制。截至发稿，道指期货跌3.96%，纳指期货跌4.65%，标普500指数期货跌4.74%。,美股期指大幅下挫 纳指期货跌超4%
313,2020-03-23 08:18:25,【WTI原油期货跌幅缩窄至1.81%】据路透报价，WTI原油期货跌幅缩窄至1.81%，现报22.20美元/桶；布伦特原油期货跌4.89%，报25.67美元/桶。,WTI原油期货跌幅缩窄至1.81%
314,2020-03-23 08:17:05,【行情】日经225指数盘初迅速拉升，一度涨超1%，截至发稿，日经225指数跌0.26%。韩国KOSPI指数大跌，截至发稿，韩国KOSPI指数跌6.69%。,日经225指数冲高回落 韩国KOSPI指数跌超6%
315,2020-03-23 08:10:11,【韩国首尔综指期货暴跌】韩国首尔综指期货暴跌，触发熔断机制。,韩国首尔综指期货暴跌
316,2020-03-23 08:09:08,【中信建投：2020年新基建投资总规模有望达到9120亿元】中信建投研报称，2020年新基建投资总规模有望达到9120亿元，拉动当年固定资产投资增长0.7个百分点。考虑到特高压、铁路、充电桩投资也属于“旧基建”范畴，预计可以拉动2020年全口径基建投资增长1.0个百分点、拉动不含电力口径基建投资增长0.6个百分点。疫情影响下，1-2月固定资产投资同比下降24.5%、基建投资同比下降26.9%，新基建或主要起到“补短板”的作用。（证券时报）,中信建投：2020年新基建投资总规模有望达到9120亿元
317,2020-03-23 08:07:47,【国家卫健委：3月22日新增39例新冠肺炎确诊病例 湖北零新增】3月22日0—24时，31个省(自治区、直辖市)和新疆生产建设兵团报告新增确诊病例39例，新增死亡病例9例(湖北9例)，新增疑似病例47例。（国家卫健委）,国家卫健委：3月22日新增39例新冠肺炎确诊病例 湖北零新增
318,2020-03-23 08:04:46,【美元兑韩元USD/KRW涨2%至1272.60】美元兑韩元USD/KRW涨2%至1272.60。,美元兑韩元USD/KRW涨2%至1272.60
319,2020-03-23 08:03:05,日经225指数盘初迅速拉升，涨幅达1%。,日经225指数盘初迅速拉升 涨幅达1%
320,2020-03-23 08:02:11,【股市开盘】韩国KOSPI指数3月23日(周一)开盘下跌94.21点，跌幅6.02%，报1566.15点。（金十数据）,韩国KOSPI指数3月23日(周一)开盘下跌94.21点
321,2020-03-23 07:53:53,【美股期指大幅下挫 道指期货跌超4%】美股期指大幅下挫，一度触发熔断限制。截至发稿，道指期货跌4.53%，纳指期货跌4.11%，标普500指数期货跌4.32%。,美股期指大幅下挫 道指期货跌超4%
322,2020-03-23 07:52:48,【早知道：可转债持续火爆引监管关注；险资权益类投资比重有望提高】今日无新股申购；证监会：外部环境的影响是阶段性的，不会改变中国资本市场平稳向好的趋势；A股整体估值比较低，投资价值显现；银保监会：对有条件的保险公司适当放宽权益类投资比重30%限制；央行：现在判定全球进入金融危机为时尚早；科技部：加大5G、人工智能、量子通信等重大科技项目的实施和支持力度；上交所：将可转债交易情况纳入重点监控；万亿专项债投向基建，轨道交通建设再提速。（证券时报）,早知道：可转债持续火爆引监管关注；险资权益类投资比重有望提高
323,2020-03-23 07:45:47,【美国第三轮紧急经济救助计划在参议院遇阻】由美国共和党提出的第三轮紧急经济援助计划22日未能通过参议院程序性投票。据美媒透露，这项紧急计划的规模已经超过1.8万亿美元，包括向美国纳税人派发现金、对企业的紧急援助等内容。民主党此前公开表达对方案有不同意见，但共和党仍然坚持推动程序性投票。众议院议长佩洛希表示，如果和共和党仍然达不成一致，众议院民主党人将推出自己的版本。按照美国立法程序，参众两院的法案版本要统一，才能最终送交总统签字成为法律。（央视新闻）,美国第三轮紧急经济救助计划在参议院遇阻
324,2020-03-23 07:41:47,【影院复工路漫漫 单日票房才3万！一大波扶持政策在路上】随着新冠肺炎疫情的好转，各行各业都迎来了复工潮。电影行业也迎来了复工，但是票房比较惨。20日全国票房只有1.38万元，昨日全国票房略有增加，为3.10万元。两日票房合计还不到5万！（e公司官微）,影院复工路漫漫 单日票房才3万！一大波扶持政策在路上
325,2020-03-23 07:37:57,【WTI原油期货持续下挫】WTI原油期货持续下挫，现跌7.03%报21.06美元/桶。,WTI原油期货持续下挫
326,2020-03-23 07:33:04,【黄金避险功能暂时失灵 金价长牛趋势仍在】风险资产暴跌、市场对通缩担忧增加、美元指数走高等三个因素，令一贯避险的黄金出现剧烈震荡，也让投资者猝不及防。自3月9日美股熔断以来，国际黄金的价格已经从最高点下跌了将近12%。无论A股还是美股，黄金板块均出现明显回调，相关ETF净值也同步走低。黄金失去避险属性了吗？现在还能否配置黄金及相关基金产品？（中国基金报）,黄金避险功能暂时失灵 金价长牛趋势仍在
327,2020-03-23 07:26:10,【行情】澳大利亚S&P/ASX200指数大跌，盘中一度跌超8%，截至发稿，澳大利亚S&P/ASX200指数跌7.48%。,澳大利亚S&P/ASX200指数盘中跌逾8%
328,2020-03-23 07:25:57,【因接触者被确诊 德国总理默克尔被居家隔离】22日，德国联邦政府发表声明，在获悉与自己接触的医生新冠肺炎病毒检测呈阳性后，德国总理默克尔已居家隔离。（人民日报）,因接触者被确诊 德国总理默克尔被居家隔离
329,2020-03-23 07:18:02,【有人忙融资有人忙“花钱” 消费金融市场打响“保卫战”】疫情之下，人们的活动半径大幅缩小，进而导致消费金融市场受到较大冲击，消费信贷大幅萎缩。眼看第一季度就要过去，一场消费金融领域的“保卫战”正全面打响。一方面，持牌消费金融公司、互联网金融科技公司正在通过发行信贷资产支持证券(ABS)补充资本，增强风险抵抗力；另一方面，银行信用卡业务部门也采取花式“撒钱”手段来刺激消费，以提振大幅萎缩的业务量。（上海证券报）,有人忙融资有人忙“花钱” 消费金融市场打响“保卫战”
330,2020-03-23 07:11:10,【行情】澳大利亚S&P/ASX200指数盘初跌幅迅速扩大至8.27%。,澳大利亚S&P/ASX200指数盘初跌幅迅速扩大至逾8%
331,2020-03-23 07:03:05,【券商抢滩定增市场 锁价发行取代兜底协议】目前定增市场“玩法”有较大变化：取消传统兜底协议，锁价发行模式悄然走俏。参与定增投资热情高涨，也同时催生了券商衍生品融资等业务机会。再融资新规落地，券商参与定增市场的热情被迅速点燃，头部券商优势凸显。据券商投行人士透露，推进定增项目的进度和审批节奏均在加快，预计二季度市场会迎来井喷式增长。（中国基金报）,券商抢滩定增市场 锁价发行取代兜底协议
332,2020-03-23 06:48:58,【特朗普宣布调动联邦国民卫队帮助抗疫】当地时间周日的白宫记者会上，特朗普宣布将调动联邦国民卫队帮助华盛顿州、加州和纽约州等受疫情严重影响的地区抗击疫情。特朗普表示相关地区已陆续进入重大灾区状态，这使得联邦政府能够更密集地向这些州提供帮助。（央视新闻）,特朗普宣布调动联邦国民卫队帮助抗疫
333,2020-03-23 06:47:02,【北上资金上周净流出超300亿 采掘银行业获加仓】上周大盘累计下跌4.91%，北上资金一周累计净流出337.7亿元，其中沪股通合计净卖出170.7亿元，深股通合计净卖出167亿元。统计显示，北上资金连续四周卖出149股。分行业来看，电子行业个股数量最多，有14只。从持股比例变动情况来看，与四周前相比，91股减仓比例超0.5个百分点。（证券时报）,北上资金上周净流出超300亿 采掘银行业获加仓
334,2020-03-23 06:32:02,【重大项目加速开工 地方专项债有望扩容】3月份以来，各地陆续开复工大批重大项目，涉及投资规模相当可观。据上证报记者粗略统计，最近一周，山东、广东、陕西、福建、宁夏、甘肃、重庆等地均有一批重大项目集中开工，涉及投资规模超过万亿元。分析人士认为，为提供资金支撑，预计地方债将加快发行进度，6月份左右或将迎来又一波发行高潮，全年地方债发行规模有望超3万亿元。此外，专项债将继续扩容，重点投向医疗基础设施等民生领域以及5G等新基建领域。（上海证券报）,重大项目加速开工 地方专项债有望扩容
335,2020-03-23 06:32:02,【北上资金上周净流出超300亿 采掘银行业获加仓】上周大盘累计下跌4.91%，北上资金一周累计净流出337.7亿元，其中沪股通合计净卖出170.7亿元，深股通合计净卖出167亿元。统计显示，北上资金连续四周卖出149股。分行业来看，电子行业个股数量最多，有14只。从持股比例变动情况来看，与四周前相比，91股减仓比例超0.5个百分点。（证券时报）,北上资金上周净流出超300亿 采掘银行业获加仓
336,2020-03-23 06:17:42,【国际奥委会：2020夏季奥运会计划7月在日本东京举行】当地时间3月22日，国际奥委会在官方网站宣布，将加强2020年东京奥运会的规划，同时表示目前处于两难境地，一方面，日本民众热情欢迎奥林匹克圣火到达，这可以增强国际奥委会对日本东道国的信心。另一方面，在不同国家，新冠肺炎感染患者数量急剧增加，国际奥委会需要在不同的状况下采取下一步措施。（央视新闻）,国际奥委会：2020夏季奥运会计划7月在日本东京举行
337,2020-03-23 06:16:43,【加拿大新冠肺炎确诊病例增至1470例 死亡20例】加拿大艾伯塔省政府网站当地时间22日下午公布的统计是新增33个新冠病毒感染病例，目前累计已达259个，死亡病例1个。安大略省当天公布的死亡病例增至5个，其中，多伦多市和万锦市均首次出现新冠病毒死亡病例，分别是一位70多岁的男性和同年龄段的女性。安大略省当天下午公布的感染病例为425个。（央视新闻）,加拿大新冠肺炎确诊病例增至1470例 死亡20例
338,2020-03-23 06:14:22,【美股三大股指期货均触及跌停线】美股期货跌约5%，三大股指期货均触及跌停线。截至目前，道指期货跌5.01%，标普500指数期货跌5%，纳指期货跌4.88%。,美股三大股指期货均触及跌停线
339,2020-03-23 06:08:14,【行情】WTI原油期货盘初快速跌5.74%，现报21.32美元/桶；布伦特原油期货跌近5.03%，报27.54美元/桶。,WTI原油期货盘初快速跌5.74%
340,2020-03-23 06:00:53,【美股期指大幅下挫 触发下跌熔断限制】美股期货大幅下挫逾5%，触及下跌熔断限制。,美股期指大幅下挫 触发下跌熔断限制
341,2020-03-23 05:56:04,【美国国防部称已有111名军人确诊感染新冠病毒】美国国防部22日宣布，目前已有111名军人确诊感染新冠病毒，这一数字比两天前几乎翻了一倍（20日为67名军人）。（央视新闻）,美国国防部称已有111名军人确诊感染新冠病毒
342,2020-03-23 05:48:31,【新能源汽车市场又迎重大利好 公共领域用车电动化提速】新能源汽车产业再迎政策利好。近日，工信部组织召开会议，深入研究分领域、分区域、分车型电动化的目标、方式及政策措施。这是在前期系列政策的基础上，国家层面在公共领域用车电动化方面再次进行具体部署。业内人士表示，在全球新冠肺炎疫情的冲击下，国家再次推动在公共领域用车电动化，释放积极政策信号，将有力提振汽车业的信心。同时，继续大力推广新能源汽车，既算好“经济账”，又算好“环保账”，对行业持续健康发展具有重要意义。（中国证券报）,新能源汽车市场又迎重大利好 公共领域用车电动化提速
343,2020-03-23 05:32:37,【美国联储官员称美国第二季度失业率可能达30%】美国圣路易斯联邦储备银行行长詹姆斯·布拉德3月22日在接受彭博社采访时预测，美国第二季度的失业率可能会达到30%，原因是政府为抗击新冠病毒而关闭工厂。他还预测美国第二季度国内生产总值（GDP）将出现前所未有的50%的降幅。布拉德称联储将在授权范围内采取一切措施帮助经济复苏。（央视新闻）,美国联储官员称美国第二季度失业率可能达30%
