,datetime,content,title
222,2020-10-14 07:10:09,【预期差才是关键 基金换股紧盯三季报】国庆长假后A股市场表现强势，据记者了解，由于科技、医药和消费行业龙头股前期涨幅较大，在上市公司三季报密集披露的情况下，业绩能否达到预期成为机构关注的重点。基金调仓换股的方向，也转移到业绩增长有望消化高估值的标的，光伏、重卡、汽车、农药等高景气度行业受关注。（上海证券报）,预期差才是关键 基金换股紧盯三季报
223,2020-10-14 07:10:07,【多行业第三季度延续强势 龙头公司引领业绩增长】随着三季报披露季的开启，A股上市公司第三季度的经营状况逐渐揭开面纱。截至10月13日，共有740家公司披露了2020年三季报业绩预告，其中363家预喜(包括预增、略增、扭亏及续盈)，占比为49.05%。（上海证券报）,多行业第三季度延续强势 龙头公司引领业绩增长
224,2020-10-14 07:00:09,【定增新规下首批项目迎解禁 收益率落差明显】再融资新规下的首批竞价类定增项目6个月限售期已尽，近日陆续迎来解禁。数据显示，这些定增项目的收益率现明显分化，有收益率超过50%的，也有浮盈比例不到5%的。业内人士表示，新规落地后监管层鼓励询价定增的市场化发行，在一些优质项目实现稳定收益的同时，出现浮亏的项目也逐渐增多。“这是健康的市场状态，投资者还是要回归发现优秀公司、寻找合理估值的投资本质上来。”（上海证券报）,定增新规下首批项目迎解禁 收益率落差明显
225,2020-10-14 06:51:04,【上市房企“金九”报喜 四季度销售压力仍存】上市房企销售行情持续回暖，今年楼市的“金九银十”成色十足。中国恒大、碧桂园、万科、保利地产等上市房企近期陆续发布销售简报，9月多数房企销售额同比环比双增，其中部分房企销售环比增幅超20%。（上海证券报）,上市房企“金九”报喜 四季度销售压力仍存
226,2020-10-14 06:36:07,【我国将在“十四五”期间着力推动环保产业发展】生态环境部副部长庄国泰13日在2020中国生态环境产业高峰论坛上表示，当前环保产业总体发展向好，发展规模逐步壮大，技术水平显著提升，服务模式不断创新，“十四五”期间将从五个方面着力推动环保产业发展。（上海证券报）,我国将在“十四五”期间着力推动环保产业发展
227,2020-10-14 06:21:07,【防范化解非银行支付机构风险 人民银行将设立行业保障基金】为建立化解和处置非银行支付机构风险的长效机制，监管部门再出配套措施。记者昨日获悉，人民银行决定建立支付机构行业保障基金(下称基金)，并同步发布《非银行支付机构行业保障基金管理办法(征求意见稿)》。（上海证券报）,防范化解非银行支付机构风险 人民银行将设立行业保障基金
228,2020-10-14 06:05:22,【市场回升预期强 私募深挖“顺周期”】在上周五及本周一连续两个交易日的拉升后，A股市场主要股指10月13日早盘全线低开，但并未出现明显获利回吐迹象。来自多家一线私募的最新策略研判显示，目前私募业内对于10月A股的月度表现，普遍抱有乐观预期。多家私募认为，10月A股市场将再现结构性行情，风格将更均衡、投资机会将更广泛，可在顺周期方向深入挖掘。（中国证券报）,市场回升预期强 私募深挖“顺周期”
229,2020-10-14 05:50:22,【上海原油期货结算价交易指令上线 与国际接轨迈出关键一步】原油期货结算价交易指令(TAS)日前在上海国际能源交易中心(简称：上期能源)顺利上线，这是我国期货市场推出的首个结算价交易指令。中国证券报记者从上期能源获悉，截至10月13日，原油期货TAS上线运行平稳，市场整体参与程度较好。（中国证券报）,上海原油期货结算价交易指令上线 与国际接轨迈出关键一步
230,2020-10-14 05:48:05,【支持5G的iPhone12亮相！顶配11899元 配备6.7寸史上最大屏幕！一文读懂】北京时间10月14日凌晨1点，苹果公司举行新品发布会。发布会上，酝酿多时的iPhone 12系列终于亮相。本次发布的iPhone 12系列共有四款机型，分别是5.4英寸的iPhone 12 mini、6.1英寸的iPhone 12和Pro，以及迄今为止苹果屏幕最大的6.7英寸iPhone 12 Pro Max。iPhone 12售价分别为6299元、6799元、7599元。（每日经济新闻）,支持5G的iPhone12亮相！顶配11899元 配备6.7寸史上最大屏幕！一文读懂
231,2020-10-14 05:35:23,【银行净值型理财产品销售调查：关键信息提示不足】随着资管新规、理财新规的落地，银行理财净值化转型进程加快，净值型理财产品渐成理财市场主流。（中国经济网）,银行净值型理财产品销售调查：关键信息提示不足
232,2020-10-14 05:35:08,【中资企业海外发债创新高：低成本刺激发行 三季度环比大增36%】记者根据统计发现，今年三季度中资美元债发行规模为715.75亿美元，环比大增36%，创出历史新高。在此之前，中资美元债发行规模季度峰值为2019年二季度，当季发行规模为702.25亿美元。（21世纪经济报道）,中资企业海外发债创新高：低成本刺激发行 三季度环比大增36%
233,2020-10-14 05:23:38,【深圳数字人民币体验：上滑付款、下滑收款 3389家商户可消费】开通银行数字红包后，就可以前往罗湖区已完成数字人民币系统改造的商户消费。值得注意的是，此次红包只能在罗湖区辖内已完成数字人民币系统改造的3389家商户使用，不能转给他人或兑回本人银行账户。,深圳数字人民币体验：上滑付款、下滑收款 3389家商户可消费
234,2020-10-14 05:10:59,【香港金管局增加市场干预规模至108.81亿港元】香港金管局增加市场干预规模至108.81亿港元，以捍卫联系汇率制度。（21世纪经济报道）,香港金管局增加市场干预规模至108.81亿港元
235,2020-10-14 05:02:53,【短缺问题逐步解决 房地产业转型发展有三个方向】当前我国发展的内部条件和外部环境正在发生深刻复杂变化，为应对一系列发生的变局，中央提出推动形成以国内大循环为主体、国内国际双循环相互促进的新发展格局。房地产业在我国国民经济中占有较大比重，2019年房地产全行业投资总额占全社会固定资产投资的比重为25%，房地产业增加值占GDP的比重为7%。在即将到来的“十四五”规划期间，房地产业的健康发展对构建国内大循环将起到重要的支撑作用。（证券时报）,短缺问题逐步解决 房地产业转型发展有三个方向
236,2020-10-14 04:46:04,【新能源汽车9月销量增长近七成 牵引整体车市复苏】中国新能源汽车市场已然成为整体车市的引擎。10月13日，中国汽车工业协会(下称中汽协)发布9月汽车工业经济运行情况，当月国内乘用车销量同比增长8%，其中新能源汽车销量同比增幅高达67.7%，刷新历史纪录。此外，中汽协排出了动力电池企业装机量的新座次。中汽协相关负责人表示，新能源汽车的表现主要得益于政府对新能源汽车消费的支持。（上海证券报）,新能源汽车9月销量增长近七成 牵引整体车市复苏
237,2020-10-14 04:30:51,【300亿赔偿准备金睡大觉 信托业界：不知如何动用】行业景气度明显下滑，风险项目此起彼伏，近300亿信托赔偿准备金依然分文未动。截至2020年二季末，信托赔偿准备金高达296.01亿元，同比增长11.12%，环比增长0.21%。（证券时报）,300亿赔偿准备金睡大觉 信托业界：不知如何动用
238,2020-10-14 04:15:53,【科技白马股频现闪崩的市场寓意】近日，在A股连续上涨的背景下，部分科技白马股出现闪崩引发市场关注。这意味着节后A股市场开启了显著的风格变化，或是机构投资策略的转向，但在权益类产品大量发行的背景下，在市场调整中获取科技白马股的廉价筹码，可能性也并不大。（证券时报）,科技白马股频现闪崩的市场寓意
239,2020-10-14 04:00:16,【美股三大指数集体收跌】美股三大指数集体收跌，道指跌0.55%，标普500指数跌0.64%，纳指跌0.10%。苹果跌2.65%，今日苹果公司发布了iPhone 12系列手机。（21世纪经济报道）,美股三大指数集体收跌
240,2020-10-14 03:46:50,【三季报披露进入高峰期 121股净利增幅超100%】统计显示，截至10月13日，已经有672股公布前三季业绩预告，预增公司280家、预盈37家，合计报喜公司比例为47.17%；业绩预降、预亏公司分别有143家、106家。（证券时报）,三季报披露进入高峰期 121股净利增幅超100%
241,2020-10-14 03:30:50,【全国生猪产能恢复至八成 “二师兄”掉价趋势明显】随着产能恢复，全国各地生猪出栏价格下跌的走势愈发显现。猪周期的走势与市场供需关系密切相关，近期猪价显著下滑，显现出市场供应恢复的成效。（证券时报）,全国生猪产能恢复至八成 “二师兄”掉价趋势明显
242,2020-10-14 03:15:05,【逾6200亿元减税降费红利待确认 专家建议建立企业减负“直通车”】作为助企纾困的重要政策，今年以来，减税降费有序推进。数据显示，今年敲定的全年减税降费超2.5万亿元任务，目前已完成了75%，9月份至12月份，共有逾6200亿元减税降费红利待确认。（证券日报）,逾6200亿元减税降费红利待确认 专家建议建立企业减负“直通车”
243,2020-10-14 03:00:23,【国企混改加速“拥抱”A股 15家上市国企已官宣“A拆A”】对于数量约占A股上市公司四分之一、市值占比超过三成的国资委系统控股上市公司来说，无论是从数量或是体量上看，“进一步提高上市公司质量”的重要性毋庸置疑。（证券日报）,国企混改加速“拥抱”A股 15家上市国企已官宣“A拆A”
244,2020-10-14 02:39:29,【苹果新品发布会看点一览】①iPhone 12系列手机均支持5G，理想条件下下载速度达4.0Gbps；②iPhone 12:6.1英寸屏幕，国行售价6299元起，10月16日开始预购；③iPhone 12 Mini: 5.4英寸屏幕，国行售价5499元起，11月6日开始预购；④iPhone 12 Pro: 6.1英寸屏幕，国行售价8499元起，10月16日开始预购；⑤iPhone 12 Pro Max: 6.7英寸屏幕，国行售价9299元起，11月6日开始预购；⑥iPhone 包装：含USB-C到Lightning电缆，但不再随机附赠充电器和耳机；⑦HomePod Mini:搭载S5芯片，黑白两色可选，国行售价749元，11月6日预订；⑧MagSafe Duo无线充电：可为iPhone和Apple Watch同时充电。（21世纪经济报道）,苹果新品发布会看点一览
245,2020-10-14 02:23:06,【进度94.8%！新增专项债发行即将结束 投向哪些领域？明年将有哪些变化？】近日，财政部政府债务研究和评估中心公布了2020年9月地方政府债券发行情况。最新数据显示，9月全国发行地方政府债券7205亿元。其中，新增债券5546亿元，包括新增一般债券863亿元，新增专项债券4683亿元。再融资债券1659亿元，包括一般债券1259亿元，专项债券400亿元。（券商中国）,进度94.8%！新增专项债发行即将结束 投向哪些领域？明年将有哪些变化？
246,2020-10-14 02:08:04,【苹果公司正式发布iPhone 12 Pro】苹果公司正式发布iPhone 12 Pro，搭载6.1英寸的显示屏，iPhone 12 Pro Max搭载6.7英寸的显示屏。iPhone 12 Pro起售价为999美元。（e公司）,苹果公司正式发布iPhone 12 Pro
247,2020-10-14 02:05:49,【苹果公司股价跌幅扩大至3.5%】苹果公司股价短线跳水，跌幅扩大至3.5%。（e公司）,苹果公司股价跌幅扩大至3.5%
248,2020-10-14 01:58:53,【国际金价收跌近2%】COMEX 12月黄金期货收跌1.8%，报1894.60美元/盎司。（第一财经）,国际金价收跌近2%
249,2020-10-14 01:50:23,【苹果公司：iPhone 12 Mini起售价699美元 iPhone 12起售价799美元】iPhone 12 Mini起售价699美元，iPhone 12起售价799美元。（e公司）,苹果公司：iPhone 12 Mini起售价699美元 iPhone 12起售价799美元
250,2020-10-14 01:32:22,【9月份头部猪企生猪销售放量叠加 对冲价格下滑影响维持行业高景气度】9月份，前五大猪企中，牧原股份、温氏股份、新希望与天邦股份生猪销售均加速放量，其余猪企销量亦保持高位，头部企业放量叠加生猪产能进入恢复期。东北农业大学经管学院教授王刚毅在接受《证券日报》记者采访时表示，9月份养猪企业前期能繁母猪投入开始释放产能，以致生猪供给越趋稳定。（证券日报）,9月份头部猪企生猪销售放量叠加 对冲价格下滑影响维持行业高景气度
251,2020-10-14 01:20:15,【苹果公司正式发布iPhone 12手机 库克：新款iPhone将搭载5G】库克宣布，本次发布的新款iPhone将搭载5G。值得注意的是，苹果公司宣布，10月13日推出的所有iPhone 12都支持5G网络。（第一财经）,苹果公司正式发布iPhone 12手机 库克：新款iPhone将搭载5G
252,2020-10-14 01:17:18,【苹果宣布将5G技术带入iPhone手机】苹果宣布将5G技术带入iPhone手机。（21世纪经济报道）,苹果宣布将5G技术带入iPhone手机
253,2020-10-14 01:12:38,【行情】苹果盘中跌幅一度扩大至2.9%，纳指盘中再度转跌。（21世纪经济报道）,苹果盘中跌幅一度扩大至2.9%
254,2020-10-14 01:10:37,【苹果公司发布HomePod Mini智能音箱】10月14日，苹果公司发布HomePod Mini智能音箱。（e公司）,苹果公司发布HomePod Mini智能音箱
255,2020-10-14 00:56:04,【0.7%！累计进出口总值年内首次同比正增长】今年以来，面对新冠肺炎疫情严重冲击，我国加大宏观政策应对力度，扎实做好“六稳”工作，全面落实“六保”任务，统筹疫情防控和经济社会发展工作取得重大成果，稳外贸政策效应持续显现，进出口明显好于预期。据海关统计，前三季度，我国货物贸易进出口总值23.12万亿元人民币，比去年同期增长0.7%，累计进出口总值年内首次实现同比正增长。其中，出口12.71万亿元，增长1.8%；进口10.41万亿元，下降0.6%。（证券日报）,0.7%！累计进出口总值年内首次同比正增长
256,2020-10-14 00:47:45,【证监会立案调查！“摩托车大王”凉了：半年巨亏26亿 更有破产退市风险】昔日“摩托车大王”又出事了。10月13日晚间，力帆股份公告表示，因涉嫌信披违法违规，控股股东及实控人遭证监会立案调查。（中国基金报）,证监会立案调查！“摩托车大王”凉了：半年巨亏26亿 更有破产退市风险
257,2020-10-14 00:33:10,【以前花重金买西红柿“洋种子”！现在国产种子价格降了一半！咋回事？】最近这些年，蔬菜品种发生了很大变化，比如，以往又大又软的传统西红柿慢慢不见了，取而代之的是红彤彤、有点硬的西红柿和小西红柿；以往有刺的黄瓜一统天下，现在被无刺黄瓜分了一杯羹；以往普普通通的辣椒，也被螺丝椒、五彩椒抢了风头。蔬菜品种变化的背后，究竟隐藏着怎样的门道？（央视财经）,以前花重金买西红柿“洋种子”！现在国产种子价格降了一半！咋回事？
258,2020-10-14 00:25:36,【行情】现货白银回落至24美元/盎司下方，日内跌4.22%。,现货白银跌4.22%
259,2020-10-14 00:23:40,【美国参议院多数党共和党领袖麦康奈尔：新冠病毒纾困计划将于下周提交给国会】美国参议院多数党(共和党)领袖麦康奈尔：新冠病毒纾困计划将于下周提交给国会，金额约为5000亿美元。（界面新闻）,美国参议院多数党共和党领袖麦康奈尔：新冠病毒纾困计划将于下周提交给国会
260,2020-10-14 00:22:30,【中核集团：与海南省签订全面深化战略合作协议】10月13日，海南省与中核集团签署全面深化战略合作协议，双方将建立全天候战略合作伙伴关系，共同推进中核集团核电产业、清洁能源产业和核技术应用产业在海南的全面可持续发展，着力建设昌江核电二期工程、多功能模块式小型堆示范工程等项目，参与海南充电桩、储能项目建设和清洁能源汽车推广计划，共同建设海南清洁能源岛，推动海南自由贸易港建设。（e公司）,中核集团：与海南省签订全面深化战略合作协议
261,2020-10-14 00:16:15,【提前抢疯了？一度涨到6元/斤！“花生”了啥？】花生营养丰富，用途广泛，近年来价格不断攀升。2018年花生价格大约在每斤2、3元，2020年每斤花生价格竟一度上涨到5、6元。（央视财经）,提前抢疯了？一度涨到6元/斤！“花生”了啥？
262,2020-10-14 00:00:49,【开局先声夺人！私募乐观研判10月A股行情 这些机会值得关注】和聚投资总经理李泽刚表示，从目前时点来看，市场会寻求业绩修复弹性比较大而估值相对合理的品种，降低对确定性溢价的追捧。现阶段在组合配置上，将会坚持优质成长+低估值顺周期的双轮驱动。（中国证券报）,开局先声夺人！私募乐观研判10月A股行情 这些机会值得关注
263,2020-10-14 00:00:21,【什么情况？3100亿市值大牛股突遭利空 第二大股东要减持】股价迭创新高的隆基股份，一则减持公告引发市场关注。公司13日发布公告称，第二大股东李春安拟于未来六个月内减持不超过3771.76万股，拟减持数量不超过公司总股本的1%。按照今日收盘价计算，李春安减持金额将达到31.19亿元。（中国证券报）,什么情况？3100亿市值大牛股突遭利空 第二大股东要减持
264,2020-10-13 23:59:15,【9月债基平均收益又告负 10月债市怎么走？】就在众多基民还未从今年5月债券基金亏损的阴影中缓过来时，刚刚过去的9月，又出现多只债券基金单月亏损的现象。数据显示，市场存续的债券基金9月平均收益率为-0.18%。雪上加霜的是，部分债券基金9月亏掉的收益甚至比5月还多。（国际金融报）,9月债基平均收益又告负 10月债市怎么走？
265,2020-10-13 23:55:52,【“纸螃蟹”横行 套路太深！“2688”“3588”是型号还是价格？业内人士揭秘】记者以“螃蟹、券、卡”为关键词，在几个主要电商平台搜索，各类蟹券蟹卡应有尽有，且卡券上面一般都用大号深色加粗字体标注着1888、2688、3588等字样。乍一看，谁都会以为这是蟹卡售价， 难怪有人会说吃不起。可仔细观察会发现，在这些豪横数字的旁边往往还有一个类型的“型”字，这就是玄机所在了。原来这些动辄4位的数字，代表的是礼券型号，而非实际售价。（央视财经）,“纸螃蟹”横行 套路太深！“2688”“3588”是型号还是价格？业内人士揭秘
266,2020-10-13 23:54:23,【IMF：美国经济两到三年才能恢复到疫前水平】在IMF最新世界经济展望报告发布会上，第一财经驻美记者葛唯尔提问美国经济对全球经济复苏有怎样的作用。IMF首席经济学家兼研究部主任Gita Gopinath回答道，尽管美国有部分复苏，IMF的预测仍然是-4.3%的负增长，可能需要更多时间，到2021或者2022年才能够恢复到疫情前水平。她还提到，希望美联储提供更多支持，来帮助稳定国际金融市场。（第一财经）,IMF：美国经济两到三年才能恢复到疫前水平
267,2020-10-13 23:51:40,【助力湖北金融补短板强功能、共同做大做强汽车产业链！应勇与这两家国企负责人座谈】10月13日，湖北省委书记应勇与上汽集团董事长陈虹座谈交流。陈虹表示，上汽集团将抢抓机遇，继续加大在鄂投资力度，进一步发展壮大上汽通用武汉基地，在新能源、智能网联汽车、移动出行服务等领域深化合作，推动湖北汽车产业高质量发展。（湖北日报）,助力湖北金融补短板强功能、共同做大做强汽车产业链！应勇与这两家国企负责人座谈
268,2020-10-13 23:43:10,【英国截至8月三个月失业率升至4.5% 裁员人数达2009年金融危机以来最高】英国数据显示，虽然政府普遍的新冠就业保护计划尚未结束，但截至8月三个月的失业率从截至7月三个月的4.1%上升至4.5%，超过市场预期并创下逾三年来的最高水准。（新华财经）,英国截至8月三个月失业率升至4.5% 裁员人数达2009年金融危机以来最高
269,2020-10-13 23:42:43,【欧洲三大股指全线收跌】德国DAX30指数跌0.96%报13012.60点；英国富时100指数跌0.51%报5970.60点；法国CAC40指数跌0.64%报4947.61点。（21世纪经济报道）,欧洲三大股指全线收跌
270,2020-10-13 23:27:08,【国内期货夜盘多数收跌】螺纹期货夜盘收跌0.06%，铁矿石期货收跌0.67%；焦炭夜盘收跌0.17%，焦煤收跌0.88%，动力煤收跌1.43%。橡胶夜盘收涨1.14%，郑棉夜盘收涨1.15%。（第一财经）,国内期货夜盘多数收跌
271,2020-10-13 23:15:47,【百亿融资后 威马汽车正式启动上市辅导】据《科创板日报》记者获悉，威马智慧出行科技(上海)股份有限公司(下称“威马出行”)已于今年9月30日正式开启辅导备案，辅导机构为中信建投。威马出行旗下拥有“威马汽车”品牌，后者是一家智能电动汽车开发商。威马出行最近一次融资是在今年9月22日的100亿D轮融资，该轮融资由上海国资投资平台及上汽集团联合领投，百度与海纳亚洲创投基金(SIG)继续参与此轮融资。（界面新闻）,百亿融资后 威马汽车正式启动上市辅导
272,2020-10-13 23:11:28,【蚂蚁集团上市出变数？刚募集结束的600亿蚂蚁战配基金如何运作】参与蚂蚁集团战略配售的部分基金公司称，对蚂蚁推迟上市的预案尚未听说，不过即便推迟上市，基金也会先作为普通基金运作，等待上市时间确定。（经济观察网）,蚂蚁集团上市出变数？刚募集结束的600亿蚂蚁战配基金如何运作
273,2020-10-13 23:09:34,【美联储：未来一年通胀预期维持在3%不变】美联储：未来一年通胀预期维持在3%不变。（界面新闻）,美联储：未来一年通胀预期维持在3%不变
274,2020-10-13 23:05:09,【国内商品期货夜盘涨跌不一 苯乙烯收涨近2.5%】国内商品期货夜盘涨跌不一，苯乙烯收涨近2.5%，玉米淀粉、20号胶涨近2%，橡胶涨1.14%，铁矿石跌0.67%，螺纹钢跌0.06%，热轧卷板收平，焦炭、焦煤、动力煤分别跌0.17%、0.88%、1.43%。（21世纪经济报道）,国内商品期货夜盘涨跌不一 苯乙烯收涨近2.5%
275,2020-10-13 22:52:35,【半年之内房贷按揭逆转 这中间发生了什么？】“要办按揭贷的话，尽快办，后面会越来越收紧的。”深圳人刘春晓(化名)计划年底入手一套新房，在向多家银行询问后，得到了这样不约而同的答复。早在今年4月份，还是另一番情形。（第一财经）,半年之内房贷按揭逆转 这中间发生了什么？
276,2020-10-13 22:46:56,【酒鬼酒第三季度净利润预增三至四倍 股价年内涨幅近180%】10月13日晚间，酒鬼酒股份有限公司2020年前三季度业绩预告，预计归属于上市公司股东的净利润2.94亿元至3.31亿元，同比(较上年同期)增长60%至80%。（澎湃新闻）,酒鬼酒第三季度净利润预增三至四倍 股价年内涨幅近180%
277,2020-10-13 22:37:19,【深圳证监局：共同推动深圳基金业高质量发展】深圳证监局网站10月13日消息，9月28日，在深圳证监局指导下，深圳市投资基金同业公会召开深圳基金公司高质量发展座谈会，会议围绕目前行业发展形势、面临机遇挑战以及如何实现高质量发展进行深入交流。辖区南方基金、博时基金、招商基金、鹏华基金、平安基金等30家基金公司主要负责人参会并做了交流发言。深圳证监局、深圳市地方金融监督管理局有关负责人出席会议并认真听取行业的意见建议。（中证网）,深圳证监局：共同推动深圳基金业高质量发展
278,2020-10-13 22:27:06,【尤文图斯股价一度下跌6.9%】尤文图斯股价一度下跌6.9%，此前C罗确诊新冠肺炎。（金十数据）,尤文图斯股价一度下跌6.9%
279,2020-10-13 22:23:52,【新股上市】益海嘉里金龙鱼粮油食品股份有限公司股票将于10月15日在深圳证券交易所上市。（e公司）,金龙鱼股票将于10月15日在深圳证券交易所上市
280,2020-10-13 22:17:55,【世贸组织裁定欧盟可以对美输欧商品和服务施加反制措施】13日，第一财经记者从权威信源处获知，世贸组织（WTO）裁定由于美国未遵守WTO相关规定，欧盟可以对美输欧商品和服务施加反制措施，总额可达39.9亿美元。 （第一财经）,世贸组织裁定欧盟可以对美输欧商品和服务施加反制措施
