,datetime,content,title
736,2020-04-09 20:57:37,【豫金刚石业绩预告：一季度净利润亏损4800万元～5300万元】豫金刚石2020年第一季度业绩预告，归属于上市公司股东的净利润亏损4800万元～5300万元，上年同期盈利3393.92万元。主要原因为受新型冠状病毒肺炎疫情影响，公司人造金刚石单晶及大单晶产品收入较上年同期下降，毛利率也较上年同期下降，导致主营毛利较上年同期减少。（界面新闻）,豫金刚石业绩预告：一季度净利润亏损4800万元～5300万元
737,2020-04-09 20:54:25,【华大基因：一季度净利预增35%-45%】华大基因公告，预计一季度净利润为1.33亿-1.42亿元，同比增长35%-45%。感染防控业务及精准医学检测综合解决方案业务在报告期内实现了高速增长。（第一财经）,华大基因：一季度净利预增35%-45%
738,2020-04-09 20:53:43,【美三大股指期货均涨超1%】美股指期货涨幅扩大，道指期货涨近1.3%，标普500指数期货、纳指期货涨1%。,美三大股指期货均涨超1%
739,2020-04-09 20:52:37,【杰瑞股份年报：2019年净利润同比增加121.16% 拟10派1.6元】杰瑞股份发布年报，2019年实现营业总收入69.25亿元，较上年同期增长50.66%；归属于母公司所有者的净利润为13.61亿元，较上年同期增长121.16%。拟向全体股东每10股派发现金红利1.6元（含税）。（第一财经）,杰瑞股份年报：2019年净利润同比增加121.16% 拟10派1.6元
740,2020-04-09 20:50:59,【“乱世买黄金”！一季度全球黄金ETF净流入230亿美元再创新高】根据世界黄金协会4月8日公布的最新数据显示，今年第一季度全球黄金ETF资产管理规模录得创纪录的增幅，同比增长298吨、合计净流入230亿美元，创下史上最高以美元绝对值衡量的季度资产管理规模增幅，持仓数量增幅增亦为2016年以来的季度最高。,“乱世买黄金”！一季度全球黄金ETF净流入230亿美元再创新高
741,2020-04-09 20:48:58,【红日药业：一季度血必净注射液销售量同比大幅增长 收入同比持平】红日药业(300026)4月9日晚间发布业绩预告，预计一季度归属于上市公司股东的净利润为9644.01万元～1.32亿元，同比下滑25%～45%。业务方面，公司主力产品血必净注射液销售量较上年同期大幅增长，但因医保支付价下降46.54%，收入与上年同期基本持平；中药配方颗粒因门诊量大幅下降，销售收入同比下降；医疗器械板块，国内外订单量增长较快；原辅料板块利润受疫情影响较大；线上医疗服务增长显著。（证券时报）,红日药业：一季度血必净注射液销售量同比大幅增长 收入同比持平
742,2020-04-09 20:46:02,【哔哩哔哩美股盘前短线跳涨】哔哩哔哩美股盘前短线跳涨，现涨逾5%。公司获索尼4亿美元战略投资，双方将在多个领域展开合作。（界面新闻）,哔哩哔哩美股盘前短线跳涨
743,2020-04-09 20:43:37,【银之杰：子公司亿美软通尚未形成RCS富媒体通信服务的营收】银之杰(300085)4月9日晚间公告，公司全资子公司北京亿美软通科技有限公司的主营业务是移动信息服务，但目前国内RCS富媒体通信行业还处于标准统一和市场形成的阶段，截至目前，子公司亿美软通尚未形成RCS富媒体通信服务的营业收入，短信服务升级为RCS富媒体通信服务对亿美软通及公司经营业绩的影响尚有较大的不确定性。（证券时报）,银之杰：子公司亿美软通尚未形成RCS富媒体通信服务的营收
744,2020-04-09 20:38:35,【宁德时代：一季度净利润同比预降20%-30%】宁德时代(300750)4月9日晚间发布业绩预告，预计第一季度归属于上市公司股东的净利润为7.33亿元-8.38亿元，同比下降20%-30%。报告期内，受新冠疫情和市场影响，新能源汽车装机量大幅下降，导致公司动力电池销售收入下滑，归属于上市公司股东的净利润较上年同比下降。（e公司）,宁德时代：一季度净利润同比预降20%-30%
745,2020-04-09 20:37:49,【新三板独立董事制度和表决权差异化安排正式落地】全国股转公司4月9日晚发布消息称，按照中国证监会关于全面深化新三板改革落地实施工作部署，配套《全国中小企业股份转让系统挂牌公司治理规则》落地实施，4月9日，全国股转公司发布实施2件业务指引，即《全国中小企业股份转让系统挂牌公司治理指引第2号——独立董事》和《全国中小企业股份转让系统挂牌公司治理指引第3号——表决权差异安排》。作为新三板改革重要内容的独立董事制度和表决权差异化安排正式落地。（第一财经）,新三板独立董事制度和表决权差异化安排正式落地
746,2020-04-09 20:33:42,【美联储将采取新举措提供高达2.3万亿美元的贷款 美股期货均转涨】美联储将采取新举措提供高达2.3万亿美元的贷款，新举措包括大众企业贷款、市政流动性便利。美国三大股指期货均转涨。,美联储将采取新举措提供高达2.3万亿美元的贷款 美股期货均转涨
747,2020-04-09 20:30:47,【广东：豁免30大类建设项目环境影响评价】广东省生态环境厅4月8日印发《广东省豁免环境影响评价手续办理的建设项目名录（2020年版）》，此次豁免环评的建设项目范围涉及农副食品加工业、食品制造业、酒与饮料制造业、医药制造业、环境治理业、社会事业与服务业、农业林业渔业、交通运输业等30大类。名录自2020年4月15日起施行。（证券时报）,广东：豁免30大类建设项目环境影响评价
748,2020-04-09 20:30:44,【数据】美国上周首次申领失业救济人数660.6万，预估为550万，前值为664.8万。（第一财经）,美国上周首次申领失业救济人数为660.6万
749,2020-04-09 20:29:13,【天源迪科：公司在RCS的收入逐年下降 目前存量RCS业务较少】天源迪科(300047)今晚披露股价异动公告称，RCS相关应用受到市场关注，全资子公司广州易杰自2011年起成为华为移动端软件供应商，在RCS、IPTV等项目上合作服务海外和部分国内市场，因而近期也受到市场积极关注。但2013年后随着微信等社交平台兴起，公司在RCS的收入逐年下降，目前存量RCS业务较少，目前广州易杰与华为合作的收入主要来自于移动端的IPTV、轻量级CBS、云服务管理平台等项目。（证券时报）,天源迪科：公司在RCS的收入逐年下降 目前存量RCS业务较少
750,2020-04-09 20:24:47,【招商蛇口：一季度实现签约销售金额同比减少4.7%】招商蛇口(001979)4月9日晚间公告，3月公司实现签约销售面积93.28万平方米，同比减少0.1%；实现签约销售金额216.84亿元，同比增加21.79%。1-3月，公司累计实现签约销售面积148.55万平方米，同比减少21.37%；累计实现签约销售金额361.13亿元，同比减少4.7%。（证券时报）,招商蛇口：一季度实现签约销售金额同比减少4.7%
751,2020-04-09 20:21:22,【北纬科技：公司不存在RCS相关业务】北纬科技(002148)4月9日晚间披露股价异动公告称，近日公司关注到有媒体将公司归类为RCS概念股，目前公司主营业务为手机游戏、移动增值及行业应用，不存在RCS相关业务。（证券时报）,北纬科技：公司不存在RCS相关业务
752,2020-04-09 20:20:12,【图说：交投活跃度上升！这些个股换手率暴增】近期随着市场走强，A股交投活跃度有所增加。东方财富Choice数据显示，截至4月9日，剔除近一年上市的新股后，A股市场上月内换手率超过100%的有37只个股，换手率超过50%的个股数量更是达171只。,图说：交投活跃度上升！这些个股换手率暴增
753,2020-04-09 20:16:49,【广东：扩大机械作业面积 早稻栽插完成962万亩】针对疫情期间农业劳力紧缺矛盾，今年广东通过采用托管生产、互助合作、跨区作业的方式，投入农机总动力超1200万千瓦，扩大机械作业面积，推进“机器换人”，确保适时春耕和质量。记者从广东省农业农村厅了解到，目前，广东全省早稻栽插962万亩，占计划的74%；育秧面积1251万亩，占计划的96%，早稻生产进展顺利。今年广东还将新增的50万亩早稻扩种任务分解到各地级以上市，扩大水稻种植规模。（央视新闻）,广东：扩大机械作业面积 早稻栽插完成962万亩
754,2020-04-09 20:12:23,【华邦健康：子公司凯盛新材决定筹划申请首次公开发行股票并上市】华邦健康(002004)4月9日晚间公告，控股的新三板子公司凯盛新材，决定筹划申请首次公开发行股票并上市。根据公司披露的《2019年度业绩快报》及凯盛新材披露的《2019年年度报告》，预计2019年财务指标符合《上市公司分拆所属子公司境内上市试点若干规定》规定的条件。（证券时报）,华邦健康：子公司凯盛新材决定筹划申请首次公开发行股票并上市
755,2020-04-09 20:11:48,【深圳南山区住建局：严禁恶意炒作哄抬房价】4月9日，深圳市南山区住房和建设局发布《关于严禁恶意炒作哄抬房价维护房地产市场平稳的通知》。《通知》指出，近日收到相关投诉，反映个别中介从业人员涉嫌恶意炒作、哄抬房价，对此情况南山区住建局高度关注，主管部门将联合相关执法部门依法严格查处。（证券时报）,深圳南山区住建局：严禁恶意炒作哄抬房价
756,2020-04-09 20:04:15,【国际货币基金组织：预计全球2020年经济出现大萧条以来的最严重衰退】国际货币基金组织：预计全球2020年经济出现大萧条以来的最严重衰退。（界面新闻）,国际货币基金组织：预计全球2020年经济出现大萧条以来的最严重衰退
757,2020-04-09 19:59:36,【金牌厨柜年报：2019年净利润同比增长15.37% 拟10转4派9元】金牌厨柜发布年报，2019年公司实现营业收入21.25亿，同比增长24.90%；实现归属于母公司所有者的净利润2.42亿，同比增长15.37%。拟向全体股东每10股派发现金红利9元（含税），同时以资本公积向全体股东每10股转增4股。（界面新闻）,金牌厨柜年报：2019年净利润同比增长15.37% 拟10转4派9元
758,2020-04-09 19:53:28,【人民银行天津分行回应：未对天津市住房信贷政策进行调整】近日，有中介转发消息称，天津市购房政策出新规，其中对拥有1套住房且相应贷款未结清的居民家庭，最低首付款比例调整为40%。4月9日，人民银行天津分行回应称，近日未发布相关通知，也未对天津市住房信贷政策进行调整。目前天津市执行的住房信贷政策是2017年3月31日颁布的《关于完善差别化住房信贷政策的通知》(津银发〔2017〕65号)。（中新网）,人民银行天津分行回应：未对天津市住房信贷政策进行调整
759,2020-04-09 19:49:06,【傲农生物年报：2019年净利润2916万元 同比减少3.22%】傲农生物发布2019年年度报告，报告期公司实现营业收入57.88亿元，同比增长0.45%；实现归属于母公司所有者的净利润2916万元，同比减少3.22%。同时，公司2019年度拟不分配利润，也不以公积金转增股本。（界面新闻）,傲农生物年报：2019年净利润2916万元 同比减少3.22%
760,2020-04-09 19:48:25,【中国中车业绩预告：预计一季度净利润同比减少55%-65%】中国中车公告，公司2020年第一季度业绩预计减少9.80亿元-11.50亿元，同比减少55%-65%。（界面新闻）,中国中车业绩预告：预计一季度净利润同比减少55%-65%
761,2020-04-09 19:47:40,【大吃一惊的黑科技！特斯拉电池技术即将揭晓 这个概念最受益】被特斯拉重金收购的Maxwell前高管透露，特斯拉或将在4月中举行的特斯拉“电池日”上主推Maxwell的干电极技术，在降低电池成本的同时提高能量密度和续航里程。,大吃一惊的黑科技！特斯拉电池技术即将揭晓 这个概念最受益
762,2020-04-09 19:43:48,【欧佩克代表：欧佩克+正就减产15%-17%进行讨论】欧佩克代表：欧佩克+正就减产15%-17%进行讨论，但沙特和俄罗斯仍未能就减产基线达成一致。（界面新闻）,欧佩克代表：欧佩克+正就减产15%-17%进行讨论
763,2020-04-09 19:38:09,【国泰君安：母公司3月实现净利润8.08亿元】国泰君安4月9日晚间发布的2020年3月财务数据简报显示，母公司3月实现净利润8.08亿元，3月实现营收16.25亿元。其子公司国君资管3月实现净利润0.34亿元，上海证券3月实现净利润0.12亿元。（第一财经）,国泰君安：母公司3月实现净利润8.08亿元
764,2020-04-09 19:34:48,【四川今年规划特色产业农作物种植面积5000万亩】记者从四川省农业农村厅获悉，今年四川规划特色产业农作物种植面积5000万亩，预计第一产业产值3000亿元，休闲农业和乡村旅游综合经营性收入达到1600亿元。（新华社）,四川今年规划特色产业农作物种植面积5000万亩
765,2020-04-09 19:30:44,【国际油价直线跳水】国际油价直线跳水，WTI原油涨幅收窄至1%，此前涨9%。,国际油价直线跳水
766,2020-04-09 19:29:28,【中原证券：母公司3月亏损0.31亿元】中原证券(601375)4月9日晚间发布的2020年3月财务数据简报显示，母公司3月亏损0.31亿元，3月实现营收1.11亿元。（中证网）,中原证券：母公司3月亏损0.31亿元
767,2020-04-09 19:27:25,【四连板新赛股份：主营业务不涉及市场热点关注的粮食及种业生产销售】新赛股份(600540)连续4个交易日涨停，公司4月9日晚提示风险称，目前公司主营业务以皮棉生产销售为主，主营业务不涉及市场热点关注的粮食及种业生产销售。（证券时报）,四连板新赛股份：主营业务不涉及市场热点关注的粮食及种业生产销售
768,2020-04-09 19:22:38,【国信证券：母公司3月净利润5.69亿元】国信证券发布3月主要财务信息公告，母公司3月营业收入13.98亿元，净利润5.69亿元。（界面新闻）,国信证券：母公司3月净利润5.69亿元
769,2020-04-09 19:20:22,【全球首个新冠疫苗近期将启动II期临床】康希诺发布公告称，根据重组新型冠状病毒疫苗（腺病毒载体）（“Ad5-nCoV”）I期临床试验的初步安全数据，公司与军事科学院军事医学研究院生物工程研究所计划于近期在中国展开Ad5-nCoV的II期临床试验。Ad5-nCoV采用基因工程方法构建，以复制缺陷型人5型腺病毒为载体，可表达新型冠状病毒S抗原，拟用于预防新型冠状病毒感染引起的疾病。（界面新闻）,全球首个新冠疫苗近期将启动II期临床
770,2020-04-09 19:13:16,【克里姆林宫：俄罗斯总统普京表示 未计划与美国总统特朗普和沙特方面就原油问题进行会谈】克里姆林宫：俄罗斯总统普京表示，未计划与美国总统特朗普和沙特方面就原油问题进行会谈。（界面新闻）,克里姆林宫：俄罗斯总统普京表示 未计划与美国总统特朗普和沙特方面就原油问题进行会谈
771,2020-04-09 19:11:14,【海通证券：母公司3月份净利6.18亿元】海通证券(600837)4月9日晚公告，3月份，母公司净利为6.18亿元，上年同期为10.83亿元。（证券时报）,海通证券：母公司3月份净利6.18亿元
772,2020-04-09 19:09:36,【行情】WTI原油日涨幅扩大至近9%，日内涨超2美元，布伦特原油涨逾5%。,WTI原油日涨幅扩大至近9%
773,2020-04-09 19:08:10,【中央应对新冠肺炎疫情工作领导小组会议：加快研发抗病毒药物和疫苗】李克强主持召开中央应对新冠肺炎疫情工作领导小组会议，会议要求，目前我国疫情仍存在反弹风险，近期个别地方又出现聚集性疫情，要查找和补齐防控短板。根据检测能力的增强，抓紧在重点地区扩大核酸检测和血清抗体检测范围，提高检测率，做好流行病学调查，及时发现感染者，掌握无症状感染者状况。要改进提高检测技术，加快研发抗病毒药物和疫苗。（证券时报）,中央应对新冠肺炎疫情工作领导小组会议：加快研发抗病毒药物和疫苗
774,2020-04-09 19:06:03,【吴通控股：国都互联在运营商组织下进行了RCS消息系统产品的对接调测】吴通控股(300292)4月9日晚间披露股价异动公告称，公司全资子公司国都互联目前主要业务为基于集团短彩信的移动信息服务，未来也将是RCS消息产业生态中的一员。截至目前国都互联在运营商牵头组织下进行了RCS消息系统产品的对接调测，验证了系统商用能力。RCS业务尚未形成直接的收入，公司未来受益程度取决于RCS业务整体进展，以及国都互联在产业链当中的价值贡献与竞争情况，存在一定不确定性。（证券时报）,吴通控股：国都互联在运营商组织下进行了RCS消息系统产品的对接调测
775,2020-04-09 19:03:22,【深圳新增1万粤B车牌指标 只用于新购车上牌】4月9日，深圳市交通运输局官方微信发布消息，决定使用2020年新增小汽车指标额度，面向个人配置1万个混合动力小汽车指标。本次配置的1万个指标只能用于办理小汽车注册登记（新购车辆上牌）。此外，将根据1万个混合动力小汽车指标配置情况，尽快研究剩余3万个小汽车指标安排方案。（第一财经）,深圳新增1万粤B车牌指标 只用于新购车上牌
776,2020-04-09 18:58:11,【行情】现货黄金上破1660美元/盎司。,现货黄金上破1660美元/盎司
777,2020-04-09 18:56:30,【中共中央、国务院：全面推开农村土地征收制度改革 扩大国有土地有偿使用范围】中共中央、国务院发布关于构建更加完善的要素市场化配置体制机制的意见。建立健全城乡统一的建设用地市场。加快修改完善土地管理法实施条例，完善相关配套制度，制定出台农村集体经营性建设用地入市指导意见。全面推开农村土地征收制度改革，扩大国有土地有偿使用范围。建立公平合理的集体经营性建设用地入市增值收益分配制度。建立公共利益征地的相关制度规定。（第一财经）,中共中央、国务院：全面推开农村土地征收制度改革 扩大国有土地有偿使用范围
778,2020-04-09 18:56:03,【中共中央、国务院：支持有条件的企业承担国家重大科技项目】中共中央、国务院发布关于构建更加完善的要素市场化配置体制机制的意见。其中指出，完善科技创新资源配置方式。改革科研项目立项和组织实施方式，坚持目标引领，强化成果导向，建立健全多元化支持机制。完善专业机构管理项目机制。加强科技成果转化中试基地建设。支持有条件的企业承担国家重大科技项目。建立市场化社会化的科研成果评价制度，修订技术合同认定规则及科技成果登记管理办法。建立健全科技成果常态化路演和科技创新咨询制度。（第一财经）,中共中央、国务院：支持有条件的企业承担国家重大科技项目
779,2020-04-09 18:54:37,【北京将提升旅游消费占比 培育高质量旅游产业】北京9日发布的《北京市推进全国文化中心建设中长期规划（2019年—2035年）》提出，北京将顺应消费升级的变化，打造精细化、差异化、个性化、特色化的旅游产品，切实提升游客的体验度和满意度。到2035年，旅游消费占北京市总消费比重超过30%，北京入境游客数量达到1000万人次左右。（新华网）,北京将提升旅游消费占比 培育高质量旅游产业
780,2020-04-09 18:53:53,【中共中央、国务院：稳步推进人民币国际化和人民币资本项目可兑换】中共中央、国务院发布关于构建更加完善的要素市场化配置体制机制的意见。意见提出，稳步推进人民币国际化和人民币资本项目可兑换。逐步推进证券、基金行业对内对外双向开放，有序推进期货市场对外开放。逐步放宽外资金融机构准入条件，推进境内金融机构参与国际金融市场交易。（证券时报）,中共中央、国务院：稳步推进人民币国际化和人民币资本项目可兑换
781,2020-04-09 18:53:16,【中共中央、国务院：稳妥推进存贷款基准利率与市场利率并轨 提高债券市场定价效率】中共中央、国务院发布关于构建更加完善的要素市场化配置体制机制的意见。意见提出，稳妥推进存贷款基准利率与市场利率并轨，提高债券市场定价效率，健全反映市场供求关系的国债收益率曲线，更好发挥国债收益率曲线定价基准作用。增强人民币汇率弹性，保持人民币汇率在合理均衡水平上的基本稳定。（证券时报网）,中共中央、国务院：稳妥推进存贷款基准利率与市场利率并轨
782,2020-04-09 18:52:01,【中共中央、国务院：培育数字经济新产业、新业态和新模式】中共中央、国务院发布关于构建更加完善的要素市场化配置体制机制的意见。意见提出，培育数字经济新产业、新业态和新模式，支持构建农业、工业、交通、教育、安防、城市管理、公共资源交易等领域规范化数据开发利用的场景。发挥行业协会商会作用，推动人工智能、可穿戴设备、车联网、物联网等领域数据采集标准化。（证券时报）,中共中央、国务院：培育数字经济新产业、新业态和新模式
783,2020-04-09 18:49:58,【中共中央、国务院：加快发展债券市场】中共中央、国务院发布关于构建更加完善的要素市场化配置体制机制的意见，加快发展债券市场。稳步扩大债券市场规模，丰富债券市场品种，推进债券市场互联互通。统一公司信用类债券信息披露标准，完善债券违约处置机制。探索对公司信用类债券实行发行注册管理制。加强债券市场评级机构统一准入管理，规范信用评级行业发展。（第一财经）,中共中央、国务院：加快发展债券市场
784,2020-04-09 18:48:21,【行情】WTI原油涨幅扩大至7%，布伦特原油涨逾4%。,WTI原油涨幅扩大至7% 布伦特原油涨逾4%
785,2020-04-09 18:47:04,【中共中央、国务院：制定出台完善股票市场基础制度的意见】坚持市场化、法治化改革方向，改革完善股票市场发行、交易、退市等制度。鼓励和引导上市公司现金分红。完善投资者保护制度，推动完善具有中国特色的证券民事诉讼制度。完善主板、科创板、中小企业板、创业板和全国中小企业股份转让系统（新三板）市场建设。（证券时报网）,中共中央、国务院：制定出台完善股票市场基础制度的意见
786,2020-04-09 18:42:16,【中共中央、国务院发布关于构建更加完善的要素市场化配置体制机制的意见】完善要素市场化配置是建设统一开放、竞争有序市场体系的内在要求，是坚持和完善社会主义基本经济制度、加快完善社会主义市场经济体制的重要内容。为深化要素市场化配置改革，促进要素自主有序流动，提高要素配置效率，进一步激发全社会创造力和市场活力，推动经济发展质量变革、效率变革、动力变革，现就构建更加完善的要素市场化配置体制机制提出如下意见。（新华社）,中共中央、国务院发布关于构建更加完善的要素市场化配置体制机制的意见
787,2020-04-09 18:40:47,【上交所：对ETF申购赎回清单进行优化 并将于下周一正式上线】上交所公告，配合基金市场发展需要，上海证券交易所对ETF申购赎回清单（以下简称PCF）进行了优化，并将于2020年4月20日（周一）正式上线。新版PCF上线后，上交所交易系统将可同时支持新老版本。鉴于每只ETF产品只有一个公告文件，版本号取决于基金管理人上传的PCF，各会员单位应能同时支持新老版本公告文件的处理。（界面新闻）,上交所：对ETF申购赎回清单进行优化 并将于下周一正式上线
788,2020-04-09 18:37:11,【建设银行：赎回境外二级资本债券】建设银行(601939)4月9日晚公告，公司于2015年5月13日在香港联合交易所有限公司发布了关于20亿美元初始年利率为3.875%于2025年到期之二级资本债券发行及上市的公告。根据本期债券条件与条款，公司已行使赎回权，并将于2020年5月13日赎回所有未偿付债券。（证券时报）,建设银行：赎回境外二级资本债券
