,datetime,content,title
0,2020-08-18 23:55:18,【券商半年度大比拼！中信建投投行业务收入第一 中信证券自营收益一骑绝尘】截至6月末，133家券商中有19家券商总资产超千亿，中信证券以7258.39亿元的总资产额稳居上半年度总资产榜榜首。上半年有51家券商营收超50亿元，10家券商净利润超30亿元，中信证券在营收和净利润榜单中均为榜首。（中国证券报）,券商半年度大比拼！中信建投投行业务收入第一 中信证券自营收益一骑绝尘
1,2020-08-18 23:52:25,【SpaceX在最新一轮融资中筹集得到19亿美元】提交给监管机构的文件显示，马斯克的火箭公司SpaceX在最新一轮融资中筹集了19亿美元。此前媒体报道，在此轮融资后，SpaceX的股权价值将达到460亿美元。根据PitchBook数据，本轮融资规模是SpaceX迄今为止最大的。（界面新闻）,SpaceX在最新一轮融资中筹集得到19亿美元
2,2020-08-18 23:49:17,【申通快递回应被京东停用：京东搞错了我们的股权结构 希望沟通解决】8月18日，京东回应称，其原因为与申通快递合同过期后，双方未就续约达成一致。京东还表示，阿里巴巴集团通过战略投资成为申通的实际大股东，因此，京东物流也对等提出了入驻阿里旗下电商平台的合作需求，但至今也没有得到响应。8月18日晚，申通快递就此事回复红星新闻称，“京东认为阿里巴巴是我们大股东。是他们自己搞错了，现在大股东实际上还是公司董事长陈德军。”（界面新闻）,申通快递回应被京东停用：京东搞错了我们的股权结构 希望沟通解决
3,2020-08-18 23:48:36,【欧股多数收跌 英国富时100指数跌近1%】德国DAX指数下跌0.33%，报12877.40点；英国富时100指数下跌0.82%，报6077.04点；法国CAC40指数下跌0.68%，报4938.06点；欧洲斯托克50指数下跌0.48%，报3289.95点。（界面新闻）,欧股多数收跌 英国富时100指数跌近1%
4,2020-08-18 23:43:05,【在岸人民币兑美元较上个交易日上涨96个基点】在岸人民币兑美元夜盘收报6.9222，较上昨日上涨96个基点；成交量326.65亿美元，较昨日上涨64.11亿美元。（第一财经）,在岸人民币兑美元较上个交易日上涨96个基点
5,2020-08-18 23:39:59,【中概教育股集体上涨】中概教育股集体上涨，瑞思学科涨68%，该股昨日收涨46%；精锐教育涨超13%，达内科技涨超7%，网易有道涨近4%，华富教育、博实乐教育涨超3%，跟谁学涨近2%，好未来涨超1%。（界面新闻）,中概教育股集体上涨
6,2020-08-18 23:39:28,【珍宝岛：子公司转让福昊置业、商银置业100%股权】珍宝岛(603567)8月16日晚间公告，公司子公司亳州中药材商品交易中心有限公司拟向关联人珍宝岛集团公司转让全资子公司福昊置业、商银置业100%股权。转让价格分别为4.8亿元和3.13亿元。公司与珍宝岛集团公司的控股股东均为黑龙江创达集团有限公司。（e公司）,珍宝岛：子公司转让福昊置业、商银置业100%股权
7,2020-08-18 23:26:23,【“猫狗大战”殃及池鱼！京东禁用申通 声称阿里封杀在前】据媒体报道，京东近日通知商家，由于京东开放平台与多家物流服务承运商的合同陆续到期，为了保障订单履约及运营稳定安全，提醒商家在2020年8月31日之后，上述物流服务承运商可能无法在系统发货列表中选择，相关物流跟踪信息也将无法在京东平台展示，建议商家进行物流服务承运商切换。（国际金融报）,“猫狗大战”殃及池鱼！京东禁用申通 声称阿里封杀在前
8,2020-08-18 23:19:49,【政府一年白白支付利息数十亿！地方债资金闲置亟待解决】近日，不少省份披露了2019年度省本级预算执行和其他财政收支的审计工作报告，第一财经记者梳理发现，在有关地方政府债券资金的审计中，绝大多数省份都存在一个共同的问题，即发债筹来的钱“躺在账上”，白白支付利息。资金闲置程度不同，有的地方甚至一笔钱借了3年了还没花出去。（第一财经）,政府一年白白支付利息数十亿！地方债资金闲置亟待解决
9,2020-08-18 23:18:47,【涉嫌影响第三方卖家定价 德国等国对亚马逊展开反垄断调查】德国反垄断机构德国联邦卡特尔局(BKA)8月17日表示，目前正对亚马逊涉嫌滥用市场支配地位干涉定价、损害亚马逊德国平台上第三方卖家的合法权益进行调查。（21世纪经济报道）,涉嫌影响第三方卖家定价 德国等国对亚马逊展开反垄断调查
10,2020-08-18 23:17:24,【芯原股份上市首日大涨284%！券商跟投浮盈1.7亿元 VC/PE机构获益颇丰】8月18日，芯原股份在上交所科创板挂牌上市。首日股价表现抢眼，收报148元/股，涨幅达284.12%。打新投资者中一签可赚超过5万元，保荐机构跟投账面浮盈1.7亿元，早期投资人小米基金浮盈近37亿元。（国际金融报）,芯原股份上市首日大涨284%！券商跟投浮盈1.7亿元 VC/PE机构获益颇丰
11,2020-08-18 23:13:32,【“818”大促基金成必争之地 基金怎么买？最全测评来了！】“818”大促，一直是互联网巨头的必争之地。跟以往不同的是，这次互联网巨头们将搏杀战场拓展到了基金领域。同时，券商“818理财节”也参与到这次基金大战中。（新京报网）,“818”大促基金成必争之地 基金怎么买？最全测评来了！
12,2020-08-18 23:12:24,【为创业板注册制保驾护航！最高法推司法保障若干意见 全面落实资本市场违法犯罪“零容忍”】8月18日晚间，最高人民法院发布《关于为创业板改革并试点注册制提供司法保障的若干意见》(法发〔2020〕28号，以下简称《意见》)。该《意见》是最高人民法院继出台设立科创板并试点注册制改革的司法保障意见后，为资本市场基础性制度改革安排而再次专门制定的又一部系统性、综合性司法文件。（21世纪经济报道）,为创业板注册制保驾护航！最高法推司法保障若干意见 全面落实资本市场违法犯罪“零容忍”
13,2020-08-18 23:07:29,【国内商品期货夜盘多数下跌 苯乙烯跌超3%】国内商品期货夜盘多数下跌，苯乙烯跌3.44%，玻璃跌1.31%，纯碱涨0.8%，PVC涨0.37%。铁矿石涨0.88%，热轧卷板涨0.08%，动力煤跌0.18%，螺纹钢跌0.34%，焦炭跌0.52%，焦煤跌1.08%。（界面新闻）,国内商品期货夜盘多数下跌 苯乙烯跌超3%
14,2020-08-18 22:58:22,【香港天文台挂出今年首个8号风球】晚上10点40分，香港天文台发布八号东北烈风或暴风信号。若明早7:00前警告信号未取消，港股交易将受影响。（界面新闻）,香港天文台挂出今年首个8号风球
15,2020-08-18 22:50:35,【海南省住房公积金管理局解读为何要调整公积金个人住房贷款额度】8月18日，海南省住房公积金管理局印发通知，提高了我省住房公积金个人住房贷款最高额度，个人公积金贷款最高可贷到100万元。海南省住房公积金管理局相关负责人介绍，为了释放住房公积金惠民措施红利，满足缴存职工的购房贷款刚需，有效缓解职工贷款资金压力，以及服务保障各类在琼创业就业人才的居住需求，促进职住平衡，进一步支持海南自贸港建设。同时，严格落实我省房地产市场管控政策，从科学制定贷款房屋首付款比例等角度，保障住房公积金贷款资金安全。(海南日报),海南省住房公积金管理局解读为何要调整公积金个人住房贷款额度
16,2020-08-18 22:47:44,【我国自主研发全球首台百万千瓦级发电机转子今日吊装】18日下午，金沙江白鹤滩水电站首台机组的发电机转子完成吊装，这意味着我国自主研发的全球首台百万千瓦水电机组投产进入了倒计时阶段。（央视新闻）,我国自主研发全球首台百万千瓦级发电机转子今日吊装
17,2020-08-18 22:43:59,【高盛等纷纷上调京东目标价 预计业绩将支撑上行空间】高盛将京东加入确信买入名单，麦格理将评级提升至跑赢大盘。高盛称，即使该股在不到两年时间里涨了两倍多，但这个业绩“应该会有助于股价维持涨势。”京东周二在美国市场上涨，此前该公司公布第二季度业绩优于预期，营收创下2017年以来最大增幅，年度活跃用户数量创两年多来最快增速。截至目前，京东股价上涨4.4%，报69.98美元。（21世纪经济报道）,高盛等纷纷上调京东目标价 预计业绩将支撑上行空间
18,2020-08-18 22:41:16,【logo升级！京东金融发布品牌主张 APP实名用户达4亿】继一个多月前“京东数科拟赴科创板上市”消息被公开后，8月18日，京东数科旗下的个人金融业务品牌京东金融宣布logo全面升级、并发布品牌主张“一个懂金融的朋友”。京东数科副总裁谢锦生表示，在定位上，京东金融将成为一个联结金融机构和金融用户的开放平台，“做用户的‘金融决策平台’和金融机构的‘第二增长场景’，而不再是简单的信息展示和交易撮合平台。”（新京报网）,logo升级！京东金融发布品牌主张 APP实名用户达4亿
19,2020-08-18 22:34:31,【行情】美元指数短线上涨，较日低反弹约30点，日内跌幅收窄至0.47%，此前一度跌0.77%；现货黄金失守1980美元关口，日内下跌0.41%。（21世纪经济报道）,美元指数短线上涨
20,2020-08-18 22:29:21,【美股三大指数悉数转跌】美股三大指数悉数转跌，道指现跌0.55%。,美股三大指数悉数转跌
21,2020-08-18 22:22:18,【外资“超配”A股 下半年迎来重新布局机会？】近段时间以来，A股似乎成了外资盘中的“抢手货”，北上资金的买入和卖出也给A股创造了一个又一个的投资机遇。从香港证券交易所披露的数据来看，沪股通和深股通的买入卖出额在今年2月至7月半年的时间里近乎翻倍。（国际金融报）,外资“超配”A股 下半年迎来重新布局机会？
22,2020-08-18 22:17:20,【比特币跌破12000美元关口】比特币跌破12000美元关口，日内跌2.5%。（金十数据）,比特币跌破12000美元关口
23,2020-08-18 22:14:04,【道指、标普500指数转跌】道指、标普500指数转跌，道指现跌0.38%，标普500指数跌0.09%。（e公司）,道指、标普500指数转跌
24,2020-08-18 22:06:20,【肖钢答科创板六问：目前亟待解决的是建立长期投资者制度】近日，中国证监会原主席肖钢的新著《中国资本市场变革》一书出版后，引起了广泛关注。为此，澎湃新闻等多家媒体联合采访了肖钢。采访中，肖钢回答了澎湃新闻记者6个有关科创板的问题。（澎湃新闻）,肖钢答科创板六问：目前亟待解决的是建立长期投资者制度
25,2020-08-18 21:58:04,【上市在即 蚂蚁集团又有新布局 概念股火了！】据彭博援引知情人士消息称，蚂蚁集团计划与南洋商业银行、千方科技、宁德时代筹建消费金融公司，该公司将在重庆注册成立，注册资本为80亿元人民币。对于筹建消费金融公司一事，蚂蚁集团、宁德时代方面均向记者表示：不予置评。南洋商业银行相关人士表示：不知情，无可告知。（上海证券报）,上市在即 蚂蚁集团又有新布局 概念股火了！
26,2020-08-18 21:52:06,【风口掘金：数字货币火了！一文看懂产业链 哪些股最受益？】今年以来，数字货币指数已上涨27.11%，近3个交易日涨幅超7%。投资机遇方面，数字货币产业链各个环节均有利好。各大券商普遍认为，银行IT、支付落地场景有望成为核心受益产业链。（21世纪经济报道）,数字货币火了！一文看懂产业链 哪些股最受益？
27,2020-08-18 21:46:25,【京东涨逾6% 总市值升破1100亿美元】京东涨逾6%，刷新历史新高至71.26美元，总市值升破1100亿美元，市值超过拼多多。,京东涨逾6% 总市值升破1100亿美元
28,2020-08-18 21:44:18,【标普500指数创下历史新高】标普500指数收复疫情爆发以来的所有跌幅，升破2月份高点，再次创下历史新高。,标普500指数创下历史新高
29,2020-08-18 21:41:07,【猛料超多！私募大咖齐聊注册制 泄露投资密码】疫情冲击下中国经济展现强大韧性，注册制开闸在即，下半年亮点可能来自何方？资本市场未来走势如何？来听听私募大咖们怎么说？（全景财经）,猛料超多！私募大咖齐聊注册制 泄露投资密码
30,2020-08-18 21:30:46,【美股小幅高开 纳指再创历史新高】8月18日，美国股市三大指数小幅高开，纳指再创历史新高。截至发稿，道指上涨0.11%，纳指上涨0.35%，标普500指数上涨0.21%。,美股小幅高开 纳指再创历史新高
31,2020-08-18 21:26:57,【转板即大涨！新三板IPO概念股延续火爆 这些精选层个股机会大！】今年以来已有53只“转板”股在A股上市，这些个股上市首日几乎全部出现大涨。多只“转板”股上市以来涨幅翻倍，股价较新三板摘牌前飙升。（新三板论坛）,转板即大涨！新三板IPO概念股延续火爆 这些精选层个股机会大！
32,2020-08-18 21:18:03,【美股散户的力量到底有多大？】美股走势强劲，到底是什么力量在推动？这个问题的答案或许很难确定，但可以确定的是，美股散户的力量让一家金融科技初创公司变成“香饽饽”。（创业资本汇）,美股散户的力量到底有多大？
33,2020-08-18 21:09:56,【国泰君安黄燕铭谈当前A股估值：优质龙头公司依然有投资机会】针对当前股票估值的问题，国泰君安证券研究所所长黄燕铭8月18日表示，放在三、五年的视角上来看，当前的股票估值并不贵。在未来无风险利率下降的过程中，A股市场估值的抬升是大概率的趋势，同时还有大量优质上市公司加盟。所以到目前为止，A股的优质公司、龙头公司依然有投资机会。（e公司）,国泰君安黄燕铭谈当前A股估值：优质龙头公司依然有投资机会
34,2020-08-18 21:04:45,【必胜客也撑不住：美最大经销商破产 300家店永久关闭】在麦当劳、汉堡王、吉野家等快餐巨头纷纷宣布裁员闭店之后，必胜客也撑不住了。8月18日，CNN在报道中指出，百胜集团在美国最大的特许经销商NPC 国际公司申请破产保护，该公司旗下300家必胜客将面临永久关闭，剩余的门店也将被出售。（中国基金报）,必胜客也撑不住：美最大经销商破产 300家店永久关闭
35,2020-08-18 21:01:28,【农业农村部：南方洪涝影响水稻生产 但有望实现丰收】据农业农村部网站消息，全国农技中心副主任王戈近日就今年南方洪涝对水稻生产的影响分析指出，从实地走访和调研看，今年汛情区域相对集中，受灾程度最大的是早稻，一季中稻和双季晚稻也受到不同程度影响，但由于种植面积扩大、技术保障增强等因素，水稻有望灾年实现丰收。（中国新闻网）,农业农村部：南方洪涝影响水稻生产 但有望实现丰收
36,2020-08-18 20:58:02,【国泰君安黄燕铭：对券商行业依然非常看好 但是选股很重要】针对近期券商股走势，国泰君安证券研究所所长黄燕铭8月18日表示，券商合并的传言不值一谈，但是资本市场的发展前景决定了券商股依然有机会。主要机会集中在：证券公司能否切合国家经济发展要求，抓住创新业务的市场机会；其次，目前券商的市场份额还处在分散状态，未来必然会走向集中。总体而言，我们下个阶段对券商行业依然非常看好，但是选股很重要。（证券时报）,国泰君安黄燕铭：对券商行业依然非常看好 券商合并的传言不值一谈
37,2020-08-18 20:57:58,【国泰君安黄燕铭：下一个阶段看好低风险股票】国泰君安证券研究所所长黄燕铭在今晚的直播活动中表示，当前中美关系是影响整个A股市场风险偏好的核心原因，现在中美关系处在一个相对紧张的状态，所以下一个阶段选股应该去选低风险的股票，除了消费以外还有周期。未来时间整个风格的配置，跟国际形势有关，国际形势会影响市场的风险偏好。（e公司）,国泰君安黄燕铭：下一个阶段看好低风险股票
38,2020-08-18 20:52:18,【年内27家券商参与54家上市公司定增！这些行业公司受青睐】Choice数据显示，截至8月18日，今年以来有27家券商参与了54家上市公司定增，认购金额为132.67亿元。其中，中信建投参与18家公司定增，是参与次数最多的券商；国泰君安对14家公司定增的认购金额为26.66亿元，是认购额最多的券商。从行业来看，计算机、通信和其他电子设备制造行业的公司定增时券商参与最为积极，为7家；格林美定增时有6家券商参与，是出现券商身影最多的上市公司。（中国证券报）,年内27家券商参与54家上市公司定增！这些行业公司受青睐
39,2020-08-18 20:46:46,【特斯拉“拒交门”后续：拼多多协助武汉车主成功提车】特斯拉武汉“拒交门”事件有新进展。8月18日，在宜买车与拼多多的协助下，此前被特斯拉拒绝交付并取消订单的团购车主，成功提车，并已为车辆上险。（新浪）,特斯拉“拒交门”后续：拼多多协助武汉车主成功提车
40,2020-08-18 20:43:45,【黄燕铭对当前A股提三点看法：市场将会进入横盘震荡阶段】国泰君安证券研究所所长黄燕铭今日晚间对当前A股提出三点看法：1、6-7月大盘强势上涨的行情告一段落，今后一段时间A股将会进入横盘震荡的阶段。2、后市是一个横盘震荡、略微抬升的过程。3、下一个阶段，投资机会主要在周期和消费，科技股要暂时休整一段时间，到年底可以继续看科技股的投资机会。（e公司）,黄燕铭对当前A股提三点看法：市场将会进入横盘震荡阶段
41,2020-08-18 20:40:33,【沪市公司注意了！上交所发布定期报告一本通 将对上市公司信披带来哪些改变】刚刚，上交所正式对外发布《上市公司定期报告业务指南》(简称“《业务指南》”)，梳理整合了定期报告编制和披露有关的规则要求和注意事项，集中在一个指南中，以期达到定期报告“一本通”的效果，方便上市公司参照使用。（上海证券报）,沪市公司注意了！上交所发布定期报告一本通 将对上市公司信披带来哪些改变
42,2020-08-18 20:38:59,【华大基因：相关诉讼对于新冠检测服务与新冠检测试剂盒的销售不构成重大不利影响】华大基因(300676)今晚公告，Illumina Cambridge Ltd.在香港法院起诉深圳华大智造科技等公司关联方或子公司，侵犯了原告在香港的专利，并同时向香港法院申请了临时禁制令。目前该案件暂仅处于已被受理尚待审理环节。涉诉子公司将积极应对竞争对手的诉讼，在香港法院最终做出判决之前，涉诉子公司涉诉产品及服务相关业务不受影响。该诉讼对于新冠检测服务与新冠检测试剂盒的销售不构成重大不利影响。（e公司）,华大基因：相关诉讼对于新冠检测服务与新冠检测试剂盒的销售不构成重大不利影响
43,2020-08-18 20:34:50,【中集集团：中集产城拟引入战投 公司对其持股比例降至46%】中集集团(000039)8月18日晚间公告，非全资子公司中集产城拟引入曲江文投作为战略投资者，曲江文投向中集产城增资暂定为23.5亿元，完成后持有中集产城20%股权。本次交易完成后，本公司通过中集申发对中集产城的持股比例降至45.92%。（e公司）,中集集团：中集产城拟引入战投 公司对其持股比例降至46%
44,2020-08-18 20:30:05,【蛋壳公寓CEO被查事涉六亿国资？蛋壳回应：报道严重不实】有文章指出，蛋壳公寓CEO高靖被调查一事疑涉及国有资产问题。同时蛋壳公寓与昆山国资委全资持有的昆山银桥控股集团有限公司合资成立的子公司操作流程不合规，银桥控股投资的6亿元国资存在流失风险。对此，蛋壳公寓回应称，“该报道严重不实。蛋壳公寓与银桥公司的所有操作流程均合法合规，且均已签署相关合同。到目前为止，蛋壳公寓没有收到合作方或地方政府相关问询和质疑。”（澎湃新闻）,蛋壳公寓CEO被查事涉六亿国资？蛋壳回应：报道严重不实
45,2020-08-18 20:28:02,【朱雀基金：A股不同结构间的“估值差”已经进入收窄趋势】公募机构朱雀基金8月18日发布A股市场最新策略观点表示，目前经济基本面仍然处于修复态势中，未来需求的回升将直接反映为产品价格的上升和企业盈利能力的提高，从而会持续有利于与经济关系密切的低估值板块。与此同时，上市公司净资产回报率的上升，无疑是当前推动A股出现上升趋势的主要力量。上周以来A股持续呈现出高估值品种相对较弱、低估值板块走强的格局，也意味着市场不同结构间的“估值差”已经进入收窄趋势。（中证网）,朱雀基金：A股不同结构间的“估值差”已经进入收窄趋势
46,2020-08-18 20:23:36,"【天舟文化：上半年净利4260万元 同比下降42%】天舟文化晚间公告，受新冠疫情的影响，2020年上半年，公司新游戏业务的研发、推广受到诸多阻碍，产品上线时间推迟，同时，部分老游戏收入较上年同期出现不同幅度下降。报告期内，公司实现营业收入37,781.53万元，同比下降28.96%；实现归属于上市公司股东的净利润4,259.56万元，同比下降42.08%。（第一财经）",天舟文化：上半年净利4260万元 同比下降42%
47,2020-08-18 20:21:21,【盛视科技：公司参与横琴口岸数十个子系统的建设】盛视科技(002990)18日在互动平台上表示，公司参与横琴口岸珠海侧、澳门侧数十个子系统的建设，包括“合作查验、一次放行”相关产品。（e公司）,盛视科技：公司参与横琴口岸数十个子系统的建设
48,2020-08-18 20:11:39,【康德莱：上半年净利润同比增长26.96%】康德莱（603987）8月18日晚间发布2020年半年度报告，上半年实现营业收入12.13亿元，同比增长61.58%；归属于母公司股东净利润9417.53万元，同比增长26.96%；归属于上市公司股东的扣除非经常性损益的净利润8477.50万元，同比增长22.96%；基本每股收益0.21元。（中证网）,康德莱：上半年净利润同比增长26.96%
49,2020-08-18 20:08:59,【行情】美元兑巴西雷亚尔USD/BRL跌1%。（金十数据）,美元兑巴西雷亚尔USD/BRL跌1%
50,2020-08-18 20:08:07,【国信期货顾冯达：流动性充裕 金属价格将“水涨船高”】近期，金融市场在经历调整后重拾涨势，以有色和贵金属为代表的大宗商品续演冲高行情。截至8月18日，全球股市及大宗商品(原油能化板块除外)价格多数已创出年内甚至数年来高位。国信期货研究资咨询部主管顾冯达8月18日表示，这背后主要推动力是全球央行宽货币宽信用趋势和通胀预期抬头，各类资产价格在流动性充裕下“水涨船高”，同时资金也更青睐股市及大宗商品等高弹性的抗通胀资产。（中证网）,国信期货顾冯达：流动性充裕 金属价格将“水涨船高”
51,2020-08-18 20:07:54,【中集集团：第一大股东可能变更 股票明日起停牌】中集集团(000039)8月18日晚间公告，公司收到股东方中远海运发展股份有限公司、Broad Ride Limited及Promotor Holdings Limited的通知，正筹划转让所持有的部分本公司股权。截止本公告日，本公司无控股股东，第一大股东为招商局国际（中集）投资有限公司，该事项可能涉及到本公司第一大股东变更的情况。公司股票于8月19日（星期三）开市起停牌。（e公司）,中集集团：第一大股东可能变更 股票明日起停牌
52,2020-08-18 20:06:07,【广东证监局与广东省公安厅经侦局召开打非工作座谈会】近日，广东证监局与广东省公安厅经侦局召开打非工作座谈会。会议围绕防控非法证券活动、加强执法协作相关事宜进行了深入交流。双方在肯定阶段性协作成果的基础上，就下一步深化合作达成多项共识。（中证网）,广东证监局与广东省公安厅经侦局召开打非工作座谈会
53,2020-08-18 20:05:17,【上交所发布定期报告业务指南】今日，上交所对外发布《上海证券交易所上市公司定期报告业务指南》(以下简称《业务指南》)。《业务指南》梳理整合了定期报告编制和披露有关的规则要求和注意事项，集中在一个指南中，以期达到定期报告“一本通”的效果，方便上市公司参照使用。（上交所网站）,上交所发布定期报告业务指南
