,datetime,content,title
712,2020-03-21 04:33:49,【证监会界定战投“身份”需满足这些条件 再融资全面宽松？监管也有定调】证监会20日通过发行监管问答的形式明确了战略投资者的定义，即与上市公司谋求双方协调互补的长期共同战略利益，愿意长期持有上市公司较大比例股份，愿意并且有能力认真履行相应职责，委派董事实际参与公司治理，提升上市公司治理水平，帮助上市公司显著提高公司质量和内在价值，具有良好诚信记录，最近三年未受到证监会行政处罚或被追究刑事责任的投资者。另外，还有两方面要求。（券商中国）,证监会界定战投“身份”需满足这些条件 再融资全面宽松？监管也有定调
713,2020-03-21 04:18:56,【约翰斯·霍普金斯大学：美国新冠肺炎确诊病例超过1.6万例】美国约翰斯·霍普金斯大学发布的实时统计数据显示，截至美国东部时间20日16时(北京时间21日4时)，美国新冠肺炎确诊病例累计16638例，死亡216例。（新华社）,约翰斯·霍普金斯大学：美国新冠肺炎确诊病例超过1.6万例
714,2020-03-21 04:07:47,富时中国A50指数期货震荡走低，截至发稿，下跌4.55%。,富时中国A50指数期货跌超4%
715,2020-03-21 03:54:48,【球员武磊确诊新冠肺炎】根据西班牙当地媒体当地时间20日下午的消息，目前效力于西甲西班牙人的中国球员武磊确诊感染新冠病毒。此前，西班牙人俱乐部在官网上宣布，有6位一线队成员确诊感染新冠病毒，其中有4位球员。西媒确认武磊是4位感染病毒的球员之一。目前武磊正在家中休息，情况良好。（央视新闻客户端）,球员武磊确诊新冠肺炎
716,2020-03-21 03:50:19,【行情】美股跌幅继续扩大，纳指跌超4%，标普500指数跌4.65%，道指跌850点，或跌4.39%。,美股跌幅继续扩大
717,2020-03-21 03:40:45,【一行两会：地方政府不当干预金融机构 将纳入定性评价】3月20日，央行、银保监会、证监会近日印发了修订后的《对真抓实干成效明显地方激励措施的实施办法(2020)》。该《办法》将支农支小再贷款、股份制银行设立分支机构、绿色债、优先发展房地产REITs、设立保险公司等挂钩。并指出，各地方政府不当干预金融机构正常经营管理情况，将纳入定性评价标准。（21世纪经济报道）,一行两会：地方政府不当干预金融机构 将纳入定性评价
718,2020-03-21 03:25:20,【监管重拳出击！可转债炒作遭暴击 这一细分市场要凉？游资爆炒路径浮出水面】两大证券交易所出手了！3月20日，沪深交易所均表示，将转债交易情况纳入重点监控，对于异常交易行为及时采取监管措施。此次证券交易所的表态，在许多市场人士看来，早在预期之中。部分游资利用转债的T+0机制在正股和转债上操控诱多，在情绪博弈推动下，转债涨幅已脱离正股走势，价格一度上涨至300~400元/张。（券商中国）,监管重拳出击！可转债炒作遭暴击 这一细分市场要凉？游资爆炒路径浮出水面
719,2020-03-21 03:10:25,【险资再度举牌！今年第六例 还是大险企举牌H股！频频瞄准H股原因何在？】险资又举牌了，又是大型险企，又是H股。3月20日，中国人寿在保险业协会网站公告，增持并举牌中广核电力H股(1816.HK)股票。根据公告，截至3月13日，中国人寿对中广核电力H股持股11.17亿股，占其H股股本比例10.005%，超过10%的二度举牌线。（券商中国）,险资再度举牌！今年第六例 还是大险企举牌H股！频频瞄准H股原因何在？
720,2020-03-21 02:55:35,【行情】道指跌近700点，标普500指数跌3.4%，纳指跌2.5%。,道指跌近700点
721,2020-03-21 02:54:16,【想上科创板 科创属性够“硬核”么？证监会“3+5”评价标准来了！】3月20日晚间，中国证监会发布《科创属性评价指引(试行)》，为更好地支持和鼓励“硬科技”企业在科创板上市，进一步明确了科创属性的企业的内涵和外延。有投行人士表示，指引出台，更具体明确了哪些企业可以上科创板，科创板“科创”含量更足。（中国基金报）,想上科创板 科创属性够“硬核”么？证监会“3+5”评价标准来了！
722,2020-03-21 02:39:47,【行情】道指跌超500点，标普500指数跌2.6%，刷新日低。富时中国A50指数期货跌超4%。,道指跌超500点
723,2020-03-21 02:39:47,富时中国A50指数期货震荡走低，截至发稿，下跌4.02%。,富时中国A50指数期货跌超4%
724,2020-03-21 02:34:02,【行情】WTI 4月原油期货收跌2.69美元，跌幅10.67%，报22.53美元/桶。即月合约收盘前几分钟曾崩跌20%，刷新2002年2月份以来盘中新低。,WTI 4月原油期货收跌2.69美元
725,2020-03-21 02:28:31,【行情】美股短线下挫，道指和标普500指数均跌超2%。,美股短线下挫 道指和标普500指数均跌超2%
726,2020-03-21 02:19:51,【行情】美油布油短线下挫0.5美元，WTI原油跌超7%，报24.16美元/桶；布伦特原油跌超1%，报28.16美元/桶。,美油布油短线下挫0.5美元
727,2020-03-21 02:16:17,【美联储将在本月内实施1万亿美元回购操作】当地时间20日，美联储表示将在3月剩余10天时间内，采取每日回购的方式实施总价1万亿美元的市场回购操作，来增加市场资金流动性以应对新冠肺炎疫情影响。（央视新闻客户端）,美联储将在本月内实施1万亿美元回购操作
728,2020-03-21 02:05:38,【定向增发彻底火了！谁有资格做战略投资者？证监会明确了】今年2月再融资新规发布，有效提振资本市场，而新规中提到的“战略投资者”如何界定，成为市场关注的焦点。3月20日，证监会官网发布监管问答，对上市公司引入“战略投资者”有关事项进行了明确界定。（中国基金报）,定向增发彻底火了！谁有资格做战略投资者？证监会明确了
729,2020-03-21 01:50:23,【行情】COMEX 4月黄金期货收涨0.4%，报1484.60美元/盎司，本周则累跌2.1%。,COMEX 4月黄金期货收涨0.4%
730,2020-03-21 01:45:26,【证监会：富时罗素分两步纳A不影响整体安排】近期，富时罗素公司宣布维持A股25%的目标纳入因子不变，但将纳入具体安排调整为分两步完成。对此，证监会有关部门负责人表示，此举是根据当前国际市场运行情况作出的审慎性、技术性调整，不影响A股提升纳入因子的整体安排。（证券时报）,证监会：富时罗素分两步纳A不影响整体安排
731,2020-03-21 01:34:47,富时中国A50指数期货震荡走低，截至发稿，下跌3.16%。,富时中国A50指数期货跌超3%
732,2020-03-21 01:33:31,【单日新增确诊5986例 意大利累计确诊感染47021例】截至当地时间20日18时，意大利24小时新增新冠肺炎确诊病例5986例。累计确诊47021例，死亡4032例，治愈5129例。现存37860例确诊病例中，重症2655例，居家隔离19185例。（央视新闻客户端）,单日新增确诊5986例 意大利累计确诊感染47021例
733,2020-03-21 01:30:56,【2月外资净增持境内债券140亿美元】3月20日，国家外汇管理局发布2月银行结售汇和银行代客涉外收付款数据。数据显示，尽管受到新冠肺炎疫情影响，2月份我国外汇市场运行总体平稳，当月银行结售汇顺差142亿美元，综合考虑远期、期权等其他供求因素后，外汇市场总体供求状况基本平衡。同时，非银行部门涉外收支延续净流入态势。2月份，我国企业、个人等非银行部门涉外收支顺差96亿美元，较1月份增长5%。（证券时报）,2月外资净增持境内债券140亿美元
734,2020-03-21 01:15:29,【确诊病例突破2万 西班牙医疗资源短缺 抗疫挑战多】西班牙广播电视台(RTVE)统计显示，该国新冠肺炎确诊人数上升至20410人，其中1041人死亡，1588人治愈。（中国新闻网）,确诊病例突破2万 西班牙医疗资源短缺 抗疫挑战多
735,2020-03-21 01:09:47,富时中国A50指数期货震荡走低，截至发稿，下跌2.72%。,富时中国A50指数期货跌超2%
736,2020-03-21 00:59:39,【证监会明确定增战略投资者认定标准】为正确理解和适用非公开发行股票引入战略投资者相关规则，证监会昨日发布《发行监管问答——关于上市公司非公开发行股票引入战略投资者有关事项的监管要求》。(证券时报),证监会明确定增战略投资者认定标准
737,2020-03-21 00:44:31,【北上资金调仓换股 海外机构频做功课】近期，海外机构调研频繁，似是在为调仓换股做“功课”。据统计，A股春节后恢复交易以来，有107家上市公司披露的调研情况中出现了海外机构的身影。从行业来看，TMT及医药最受青睐。值得注意的是获海外机构调研的这些公司，部分券商研究员给予的目标价还有较大上涨空间。（投资快报）,北上资金调仓换股 海外机构频做功课
738,2020-03-21 00:39:38,【行情】欧股全线收涨，欧洲斯托克600指数涨近2%，法国CAC40指数涨5%，德国DAX指数涨3.7%。,欧股全线收涨
739,2020-03-21 00:36:43,【特朗普宣布关闭美墨边境 21日凌晨开始实施】当地时间20日上午，美国总统特朗普在白宫举行发布会，正式宣布关闭美墨边境。特朗普表示，与之前美加达成的协议一样，美墨之间的贸易和商业往来仍将保持，相关的基本工人往来继续，但以旅游为目的的游客将无法跨境。（央视新闻客户端）,特朗普宣布关闭美墨边境 21日凌晨开始实施
740,2020-03-21 00:23:51,【行情】美股三大股指均跌超1%，标普500指数跌1.81%。,美股三大股指均跌超1%
741,2020-03-21 00:23:41,【美国总统特朗普女儿伊万卡新冠肺炎病毒检测结果为阴性】当地时间20日，美国总统特朗普的女儿及高级顾问伊万卡·特朗普的新冠肺炎病毒检测结果为阴性。现在，她已返回工作岗位。（中国新闻网）,美国总统特朗普女儿伊万卡新冠肺炎病毒检测结果为阴性
742,2020-03-21 00:09:47,富时中国A50指数期货震荡走低，截至发稿，下跌3.08%。,富时中国A50指数期货跌超3%
743,2020-03-21 00:09:00,【美国新冠肺炎感染病例超过15500例 至少197人死亡】根据美国有线电视新闻网统计，结合美国各级卫生系统的数据，截至美国东部时间20号上午，美国新冠肺炎确诊病例已达15599例，至少197人因感染新冠肺炎死亡。（央视新闻客户端）,美国新冠肺炎感染病例超过15500例 至少197人死亡
744,2020-03-21 00:08:50,【行情】富时中国A50期货跌超3%。恒指期货夜盘跌幅扩大至2.68%。现货黄金短线下跌6美元，报1484.51美元/盎司。,富时中国A50期货跌超3%
745,2020-03-21 00:06:31,【行情】美股三大股指全部由涨转跌，纳指回吐近3%的涨幅，标普500指数跌幅扩大至1%。,美股三大股指全部由涨转跌
746,2020-03-20 23:52:43,【环球同业银行金融电讯协会：2月人民币国际支付份额升至2.11%】环球同业银行金融电讯协会(SWIFT)周五最新出炉的报告显示，2月人民币国际支付份额由1月的1.65%大幅升至2.11%，创半年新高，人民币国际支付排名亦上升一位至全球第五。（央视新闻客户端）,环球同业银行金融电讯协会：2月人民币国际支付份额升至2.11%
747,2020-03-20 23:45:31,【行情】WTI原油期货即月合约跌幅扩大至10%。,WTI原油期货即月合约跌幅扩大至10%
748,2020-03-20 23:37:31,【行情】NYMEX汽油期货跌幅扩大至5%。,NYMEX汽油期货跌幅扩大至5%
749,2020-03-20 23:31:29,【中国人民银行将发行100亿元人民币中央银行票据】3月20日，中国人民银行表示，为丰富香港高信用等级人民币金融产品，完善香港人民币收益率曲线，3月26日将通过香港金融管理局债务工具中央结算系统(CMU)债券投标平台，招标发行2020年第三期中央银行票据，期限6个月(182天)，发行量为人民币100亿元。（央视新闻客户端）,中国人民银行将发行100亿元人民币中央银行票据
750,2020-03-20 23:28:17,【行情】WTI原油期货下跌逾2美元，跌幅超过8%，刷新日低至23.69美元/桶，日内稍早一度冲高至28.48美元/桶。,WTI原油期货下跌逾2美元
751,2020-03-20 23:24:37,【美股短线下跌 标普500指数转跌】美股短线下跌，标普500指数转跌，道指回吐逾400点涨幅。,美股短线下跌 标普500指数转跌
752,2020-03-20 23:19:57,【行情】美油跌逾7%，刷新日低至24.05美元/桶，从日高回落超4.4美元。,美油跌逾7%
753,2020-03-20 23:19:37,【高盛集团：预计2020年美国GDP收缩3.8％】高盛集团（Goldman Sachs）预计2020年美国GDP收缩3.8％；第二季度美国GDP年度环比下降24％。（界面新闻）,高盛集团：预计2020年美国GDP收缩3.8%
754,2020-03-20 23:12:47,【日本国内新冠肺炎确诊病例破千】截至20日21时(北京时间20时)日本国内新冠肺炎累计确诊病例达到1016例(含包机归国人员确诊14例)，当日新增病例已超过50例，累计死亡35例。（新华社）,日本国内新冠肺炎确诊病例破千
755,2020-03-20 23:02:37,【美联储调整货币市场贷款机制 将市政债务纳入其中】美联储调整货币市场贷款机制，将市政债务纳入其中。（界面新闻）,美联储调整货币市场贷款机制 将市政债务纳入其中
756,2020-03-20 23:00:28,【行情】特斯拉涨幅超过10%，刷新日高至472.00美元，延续周四涨超18%的表现。,特斯拉涨幅超过10%
757,2020-03-20 22:56:14,【深圳金融监管局：适度放宽商业保理杠杆比率等监管要求】继两周前对辖区内小贷公司宣布放宽部分监管指标后，3月20日，深圳金融监管局官网又发布了《关于疫情期间调整商业保理行业部分监管要求的通知》。据悉，本次可适当调整的监管指标包括杠杆比率、风险准备金计提比率等5项；同时，经深圳金融监管局的审核同意，合规的商业保理公司可通过前海金融资产交易所融资。（新京报）,深圳金融监管局：适度放宽商业保理杠杆比率等监管要求
758,2020-03-20 22:52:42,【实锤铁证！美国议员一边瞒报疫情一边抛售股票】据美国媒体报道，美国国会参议院情报委员会主席、共和党人理查德·伯尔曾在2月中上旬，即美国疫情暴发、股市崩溃前，一边对公众表示美国的疫情可防可控，一边却抛掉了大量的股票。同时，接连多名美国参议员被美媒曝出有提前抛售股票的行为。（央视新闻）,实锤铁证！美国议员一边瞒报疫情一边抛售股票
759,2020-03-20 22:49:43,【法国航空公司和空中客车公司准备接收法国支持的贷款】法国航空公司和空中客车公司准备接收法国支持的贷款。（界面新闻）,法国航空公司和空中客车公司准备接收法国支持的贷款
760,2020-03-20 22:24:48,【中房股份：忠旺集团拟作价305亿元借壳上市】中房股份公告称，忠旺集团拟作价305亿元借壳上市。公司股票将于2020年3月23日起复牌。本次交易上市公司拟通过资产置换及发行股份的方式购买忠旺精制、国家军民融合基金持有的忠旺集团100%股权。本次交易完成后，上市公司将直接持有忠旺集团100%股权。（第一财经）,中房股份：忠旺集团拟作价305亿元借壳上市
761,2020-03-20 22:19:00,【快讯】泰国央行降息25个基点至0.75%。（界面新闻）,泰国央行降息25个基点至0.75%
762,2020-03-20 22:18:03,【美国国税局将报税截止日期推迟至7月15日】据CNBC报道，美国财长努钦表示，美国国税局将报税截止日期推迟至7月15日，此前为4月15日。（第一财经）,美国国税局将报税截止日期推迟至7月15日
763,2020-03-20 22:13:50,【美联储宣布提高与其他国家央行的货币互换额度】美联储宣布，将与加拿大央行、英国央行、日本央行、欧洲央行和瑞士央行协同行动，提高货币互换额度，进一步增加流动性。欧洲央行和其他主要国家的央行进行的7天期美元操作频率从每周提高至每天。（第一财经）,美联储宣布提高与其他国家央行的货币互换额度
764,2020-03-20 22:08:04,【借“T+0”炒低炒小？交易所重点监控！】面对史无前例的急涨急跌，上海证券交易所周五晚间紧急宣布，将可转债交易情况纳入重点监控，对影响市场正常交易秩序、误导投资者交易决策的异常交易行为及时实施自律监管。（中国证券网）,借“T+0”炒低炒小？交易所重点监控！
765,2020-03-20 22:01:27,【重磅！重组上市造假纳入欺诈发行 不仅巨额罚款 或将一退到底】3月20日，《关于修改〈上市公司重大资产重组管理办法〉的决定》(以下简称《重组办法》)正式发布，明确上市公司发行股份购买资产(包括重组上市)等重大资产重组活动中，标的资产财务资料隐瞒重要事实或者编造重大虚假内容的，也应认定为欺诈发行，从而将此前颇受争议的发行股份购买资产(包括重组上市)造假正式纳入欺诈发行范畴。（中国证券报）,重磅！重组上市造假纳入欺诈发行 不仅巨额罚款 或将一退到底
766,2020-03-20 21:55:00,【摩根大通证券（中国）有限公司在上海开业】由摩根大通控股的摩根大通证券(中国)有限公司20日在上海正式开业，上海市副市长吴清与摩根大通中国区首席执行官梁治文共同为新公司揭牌。据悉，摩根大通证券(中国)有限公司将为中国以及国际客户提供证券经纪、证券投资咨询以及证券承销与保荐等金融产品和服务。（中国新闻网）,摩根大通证券（中国）有限公司在上海开业
767,2020-03-20 21:47:07,【国际油价持续下挫】国际油价持续下挫，布伦特原油跌超3%，报27.36美元/桶；WTI原油跌2.14%，报24.42美元/桶。,国际油价持续下挫
768,2020-03-20 21:41:18,【行情】富时中国A50指数期货跌逾2%。（第一财经）,富时中国A50指数期货跌逾2%
769,2020-03-20 21:40:56,【美股迅速走低】美股迅速走低，道指、标普500指数转跌。,美股迅速走低
770,2020-03-20 21:39:48,【美股抗疫概念股普遍走低】美股抗疫概念股普遍走低，Moderna停牌，辉瑞跌2.8%，BioNtech跌10.2%，联合保健产品跌17.6%，莱斯康制药跌超20%。,美股抗疫概念股普遍走低
771,2020-03-20 21:36:52,【快讯】据法新社报道，为应对新冠肺炎疫情，美国国务院宣布，美国暂停所有常规签证服务。（环球网）,美国暂停所有常规签证服务
772,2020-03-20 21:36:17,【现货黄金失守1490美元/盎司】现货黄金短线下挫，失守1490美元/盎司。,现货黄金失守1490美元/盎司
773,2020-03-20 21:30:21,【美国三大股指集体高开】美国三大股指集体高开，道指涨0.83%，纳指涨1.36%，标普500指数涨0.94%。中概股与科技股普涨，航空股反弹，阿里巴巴涨近4%。,美国三大股指集体高开
774,2020-03-20 21:26:46,【证监会集中“打包”修改证券期货规章、规范性文件】为做好新《证券法》的贯彻落实工作，证监会于近日发布了《关于修改部分证券期货规章的决定》《关于修改部分证券期货规范性文件的决定》，对13部规章、29部规范性文件的部分条款予以修改。（证监会网站）,证监会集中“打包”修改证券期货规章、规范性文件
775,2020-03-20 21:22:37,【理财资金加速进入A股稳市场！再度“牵手”基金公司成立新产品 千亿级增量资金可期】中银理财近日牵手华夏基金成立了一款混合类专户产品，在此之前，已有建信理财与6家基金公司成立了3只权益类产品。分析人士表示，长期以来，理财资金发挥了稳定金融市场的作用。稳增长政策逐步落地，有助于理财子公司资产端的拓展。理财子公司资产端的拓张，将增加股票资产配置和非标融资，从流动性层面支持二级股票市场，同时从资金层面支持实体经济修复。机构预计，理财子公司2020年将为A股带来约1450亿元增量资金。（中国证券报）,理财资金加速进入A股稳市场！再度“牵手”基金公司成立新产品 千亿级增量资金可期
776,2020-03-20 21:17:13,【广州出台新政支持汽车产业持续健康发展】3月20日，广州市政府第15届104次常务会议审议原则通过了《广州市促进汽车生产消费若干措施》。新冠肺炎疫情对汽车行业产生较大影响最大。为了稳定汽车产业，广州出台新政策，从提振新能源汽车消费、鼓励汽车加快更新换代、营造汽车消费环境三个方面，提出购车补贴、竞价奖励、新增巡游出租车指标和优化中小客车指标调控政策等措施，支持汽车产业持续健康发展，预计拉动总产值将超过200亿元。（界面新闻）,广州出台新政支持汽车产业持续健康发展
777,2020-03-20 21:16:04,【翰宇药业：口罩产品获欧盟CE认证 接到北美、欧盟等地客户询单】翰宇药业(300199)3月20日晚间公告，近日，公司全资子公司成纪药业的防护和医用口罩产品获得了欧盟CE认证，表明相关产品取得了海外销售资质，有利于进一步增强公司及子公司的国际综合竞争力。近期公司也陆续接到来自北美、欧盟以及东南亚多个地区客户的询单，公司正积极推动口罩产品在海外市场的销售，努力为公司带来新的盈利增长点。（证券时报）,翰宇药业：口罩产品获欧盟CE认证 接到北美、欧盟等地客户询单
778,2020-03-20 21:12:56,【青岛将向市民发放3.4亿元健身消费券】记者20日获悉，青岛市体育局正组织推出“你健身、我买单”全民健身消费券派送活动，首批拟组织6家健身经营单位向市民发放总额3.4亿元的健身消费券。（新华社）,青岛将向市民发放3.4亿元健身消费券
779,2020-03-20 21:09:26,【茅台与华为联合推动“智慧茅台”建设】3月20日，茅台集团召开“智慧茅台”功能需求咨询项目专题会，会上，华为中国政企ICT规划和咨询部首席专家厉征介绍了相关工作方案。李静仁指出，希望通过本次咨询，双方能够推动华为经验与茅台特色的成功融合和无缝对接，共同推动茅台这个中国传统产业和实体经济的典型代表在数字化转型道路上走得更稳、行得更远，为传统酿造行业打造出一个全新的示范标杆。（证券时报）,茅台与华为联合推动“智慧茅台”建设
780,2020-03-20 21:08:31,【中宠股份：拟定增募资不超6.52亿元 用于年产6万吨宠物干粮项目等】中宠股份(002891)3月20日晚间公告，拟非公开发行不超过5100.25万股，募集资金总额不超过6.52亿元，扣除发行费用后全部用于年产6万吨宠物干粮项目、年产2万吨宠物湿粮新西兰项目、营销中心建设及营销渠道智能化升级项目和补充流动资金。（证券时报）,中宠股份：拟定增募资不超6.52亿元 用于年产6万吨宠物干粮项目等
781,2020-03-20 21:02:16,【青岛银行年报：2019年净利润同比增12.92% 拟10派2元】青岛银行发布年报，全年营业收入96.16亿元，同比增长30.44%；归属于母公司股东净利润22.85亿元，同比增长12.92%；拟向全体普通股股东每10股派发现金股息人民币2元（含税），不送红股、不以公积金转增股本。（界面新闻）,青岛银行年报：2019年净利润同比增12.92% 拟10派2元
782,2020-03-20 20:56:01,【天山股份：2019年净利润同比增长31.8%】天山股份(000877)3月20日晚间公告，2019年营收96.88亿元，同比增长22.14%；净利润16.36亿元，同比增长31.80%。另外，公司拟每10股派发现金红利5.1元（含税）。（证券时报）,天山股份：2019年净利润同比增长31.8%
783,2020-03-20 20:52:27,【国际油价跌幅持续扩大 美油跌近3%】国际油价跌幅持续扩大，美油跌幅扩大至近3%，报25.17美元/桶，布油跌超1%，报28.15美元/桶。,国际油价跌幅持续扩大 美油跌近3%
784,2020-03-20 20:50:45,【2019年互联网和电话财险保费收入同比增长9.08%】2019年全年，互联网和电话销售财产保险保费收入为1126.61亿元，同比增长 9.08%。其中，车险保费收入为529.61亿元，同比下滑22.03%，占比为47.01%；非车险保费收入597.01亿元，同比增长68.82%，占比为52.99%。其中，分开来看，互联网财产保险去年的保费收入为838.62亿元，同比增长20.60%。其中，车险保费收入为274.52亿元，同比下滑25.55%，占比为32.74%；非车险保费收入为564.09亿元，同比增长72.69%，占比为67.26%。（上证报）,2019年互联网和电话财险保费收入同比增长9.08%
785,2020-03-20 20:48:17,【WTI原油日内转跌】国际油价加速回落，WTI原油日内转跌，现跌逾1%，报25.63美元/桶，此前一度涨近10%；布油涨幅缩窄至0.67%，现报28.66美元/桶。（第一财经）,WTI原油日内转跌
