,datetime,content,title
788,2020-08-17 03:01:11,【世界级“海上油气工厂” 中国造】当地时间6月25日下午6点25分，在距离巴西里约热内卢不远的外海，一座庞大的海上浮式生产储卸油装置(FPSO)上喷射出熊熊火焰。对于中国海洋石油工程事业来说，这是一个历史性时刻。（经济参考报）,世界级“海上油气工厂” 中国造
789,2020-08-17 02:45:58,【资管新规整改方案来了！9家上市券商正式推出 大券商还在积极备战公募牌照】8月16日晚间，国金证券和国元证券董事会分别审议通过了资管新规相关整改方案。加上8月14日晚的中信证券等6家券商，以及8月13日晚的华安证券，目前已有9家上市券商针对资管新规推出了相关整改方案。其中国元证券、山西证券、华西证券更是明确表示，这正是针对资管新规延期之后的产品整改计划。（券商中国）,资管新规整改方案来了！9家上市券商正式推出 大券商还在积极备战公募牌照
790,2020-08-17 02:37:06,【标普超强反弹神复制2009？困局下特朗普欲破大选魔咒】上周美股延续反弹势头，在纳指率先突破历史新高后，标普500指数距离2月21日创下的高位已咫尺之遥。市场依然在犹豫中前行，就业数据、疫苗预期提振了投资者情绪，但财政谈判的曲折路径正在考验孱弱的复苏前景。在经历了史上最强反弹后，美股未来走势或将成为大选风向标。（第一财经日报）,标普超强反弹神复制2009？困局下特朗普欲破大选魔咒
791,2020-08-17 02:35:58,【豪赌ST股重组成功 今起恢复上市！老股民：起码10倍才收手？】一家奇葩A股公司，曾被判过死刑，2019年7月，ST毅达被交易所决定暂停上市。当时营收为零、前管理层全部失联、公司印章证照和财务资料下落不明、公司治理瘫痪、财务造假、因信披违规高管入刑。但没想到的是，今天，8月17日终于重新上市，在上交所恢复交易。7万股民整整等了一年多！（中国基金报）,豪赌ST股重组成功 今起恢复上市！老股民：起码10倍才收手？
792,2020-08-17 02:29:28,【监管持续收紧 7月信托发行2113亿元锐减4成】7月集合信托产品发行规模大幅缩水。用益信托最新数据显示，截至记者发稿时止，7月共计发行集合信托产品2249款，相较于6月2978款产品，环比减少24.5%，发行规模2113.3亿元，相较于上月3662.7亿元，环比下滑42.3%。（经济参考报）,监管持续收紧 7月信托发行2113亿元锐减4成
793,2020-08-17 02:15:21,【支持举措持续加码 外企布局中国市场提速 新基建领跑 重大外资项目加速落地】外商投资正在迎来多重政策利好。近期我国一系列稳外资举措密集出台，并接连推出重大外资项目，其中新基建成为重点支持领域之一。《经济参考报》记者采访获悉，随着系列利好信号持续释放，以及用地、融资等支持力度加大，很多跨国企业将进一步推进人工智能、工业互联网等领域的布局，重大外资项目正迎来落地高潮。值得注意的是，支持举措还在加码，重点鼓励外资投向高科技产业、研发环节，补齐产业链短板，激活更多创新动能。（经济参考报）,支持举措持续加码 外企布局中国市场提速 新基建领跑 重大外资项目加速落地
794,2020-08-17 01:58:02,【资管新规后理财产品生存调查：保本型产品存续期内或随时面临“下岗”】资管新规落地已满两年，带给银行理财产品市场的变化已经是十分明显。2020年7月31日，央行联合多部门决定延长资管新规过渡期至2021年底。过渡期延长，缓解了银行处置存量资产的压力。与此同时，银行理财市场、投资者的投资心态也随之发生了变化。（证券日报）,资管新规后理财产品生存调查：保本型产品存续期内或随时面临“下岗”
795,2020-08-17 01:46:34,【国家医保局大动作不断 医药行业加速“腾笼换鸟”】在医药行业不断洗牌的背景下，A股医药行业的投资风格也发生了变化，具有创新属性的上市公司得到投资者追捧，而在疫情影响下这种风格更加突出，行业分化愈加明显。（证券日报）,国家医保局大动作不断 医药行业加速“腾笼换鸟”
796,2020-08-17 01:31:34,【北上资金5日涌入逾66亿元 加码20只个股近九成被机构推荐】在连续四周净流出后，上周(8月10日-8月14日)北上资金转身呈现出净流入态势，引发了市场各方的关注。《证券日报》记者根据统计发现，上周北上资金累计净买入金额达66.65亿元，其中，周二和周五分别净买入金额达34.69亿元和40.3亿元。（证券日报）,北上资金5日涌入逾66亿元 加码20只个股近九成被机构推荐
797,2020-08-17 01:16:34,【国家医保局大动作不断 医药行业加速“腾笼换鸟”】在医药行业不断洗牌的背景下，A股医药行业的投资风格也发生了变化，具有创新属性的上市公司得到投资者追捧，而在疫情影响下这种风格更加突出，行业分化愈加明显。（证券日报）,国家医保局大动作不断 医药行业加速“腾笼换鸟”
798,2020-08-17 01:15:53,【A股何时T+0？肖钢：蓝筹率先试点风险可控！资本市场将成全球人民币资产配置中心】肖钢：注册制率先在上交所科创板试点，从制度供给的角度看，我认为，科创板目前亟待解决的短板问题，就是要建立长期投资者制度，鼓励引导更多长期投资者参与科创板。从中长期板块建设的角度看，长期投资者制度的落实，有利于实现投资和融资关系的平衡，有利于解决市场供求形势变化带来的市场估值和交易各方利益结构性调整问题。（券商中国）,A股何时T+0？肖钢：蓝筹率先试点风险可控！资本市场将成全球人民币资产配置中心
799,2020-08-17 00:59:34,【年内240家企业IPO 超七成为制造业】数据显示，4月份、5月份、6月份这三个月规模以上工业增加值分别增长3.9%、4.4%和4.8%，回升势头加快。41个工业大类中，二季度有超过半数实现正增长。装备制造业5月份、6月份两个月增加值增速分别达到9.5%和9.7%，汽车产销7月份同比分别增长21.9%和16.4%，基础原材料供销平稳。（证券日报）,年内240家企业IPO 超七成为制造业
800,2020-08-17 00:47:23,【规模全年最低！7月地方债仅发行2722亿 什么信号？8-10月将迎来爆发点？】报告显示，7月全国发行地方政府债券2722.39亿元。按债券类型分，一般债券发行1763.77亿元，专项债券发行958.62亿元。按债券性质分，新增债券发行421.97亿元，再融资债券发行2300.42亿元。新增债券中，发行新增一般债券5629亿元，完成57.4%；新增专项债券22661亿元，完成63.8%。（券商中国）,规模全年最低！7月地方债仅发行2722亿 什么信号？8-10月将迎来爆发点？
801,2020-08-17 00:33:54,【数字人民币要来了！它是法定货币 手机没信号也能用！未来现金是否会被取代？】近年来，全球多国都在加紧研究数字货币，中国也不例外。目前，我国的数字人民币研发工作正在稳妥推进。近日，商务部发布了《关于印发全面深化服务贸易创新发展试点总体方案的通知》，其中公布了数字人民币试点地区。（央视财经）,数字人民币要来了！它是法定货币 手机没信号也能用！未来现金是否会被取代？
802,2020-08-17 00:18:41,【警惕！GPS定位器竟变窃听器！有公司被窃听损失千万元】一提起窃听，很多人可能最先想到的都是谍战剧的剧情。然而，这些我们在电影电视里看到的情节很有可能就发生在身边。最近，北京一家安防公司就因为商业机密被窃听，企业竞标失败，蒙受了重大损失，而窃听器竟然是常见的GPS定位器。（央视财经）,警惕！GPS定位器竟变窃听器！有公司被窃听损失千万元
803,2020-08-17 00:03:48,【太疯狂！黄金涨涨涨 市民卖卖卖！有人一口气提了58斤金币去变现 赚了这些钱】金价的走势让一向对黄金投资“嗤之以鼻”的股神巴菲特也改变了想法，他旗下的伯克希尔-哈撒韦公司二季度只新建仓了一只股票，就是巴里克黄金。金价的飞涨，让长期手持实体黄金的投资者看到了卖出时机。近日，广东一黄金交易商接待了一名“神秘”客户，该客户竟提着一箱近29公斤重的金币来兑换现金。（央视财经）,太疯狂！黄金涨涨涨 市民卖卖卖！有人一口气提了58斤金币去变现 赚了这些钱
804,2020-08-16 23:50:13,【京东与携程联姻背后：开放用户流量 打通旅行产品供应链】8月16日，国内最大的零售平台京东集团宣布，与国内OTA领域巨头携程集团签署战略合作协议。据悉，后者的核心产品供应链将接入京东平台，双方将在用户流量、渠道资源、跨界营销、商旅拓展、电商合作等方面开展全方位的合作。（经济观察报）,京东与携程联姻背后：开放用户流量 打通旅行产品供应链
805,2020-08-16 23:45:22,【新一批集采将开标 逾400亿蛋糕谁将吞下】中康CMH数据显示，上述这56个通用名药品在2019年中国等级医院和基层医疗机构中合计销售额约440亿元。按照第二批平均降价幅度53%推算，中标后56个中标品种医院规模将减少至233亿元，按50%的医保报销比例测算，医保基金药品支出将减少超过100亿元。（第一财经）,新一批集采将开标 逾400亿蛋糕谁将吞下
806,2020-08-16 23:37:07,【并购有棵树再曝“后遗症” 天泽信息近亿元贷款逾期】去年为并购“有棵树”，天泽信息曾向金融机构申请并购贷款金额不超过4.2亿元，其中向民生银行南京分行申请贷款2.1亿元。根据还款计划，公司应于今年8月14日偿还贷款本金1.05亿元。天泽信息在8月16日晚间的公告中称，截至本公告披露之日，上述到期贷款本金仍有9586.12万元处于逾期状态。（e公司）,并购有棵树再曝“后遗症” 天泽信息近亿元贷款逾期
807,2020-08-16 23:29:48,【中国粮食地图：黑豫鲁位居前三 “北粮南运”趋势明显】国家统计局的数据显示，中国已经连续5年粮食生产稳定在1.3万亿斤以上，今年的夏粮也实现了丰收，创历史新高，夏粮产量比上年增长0.9%。分地区看，2019年我国粮食产量前十的黑龙江、河南、山东、安徽、吉林、河北、江苏、内蒙古、四川和湖南，北方地区占据较大优势。另外，近十年来，包括北京、上海、浙江、福建几个东部发达省份的粮食产量明显减少。（第一财经）,中国粮食地图：黑豫鲁位居前三 “北粮南运”趋势明显
808,2020-08-16 23:19:08,【国泰君安等大型券商已经开始筹备申请公募牌照】从多位业内人士处获悉，部分大型券商已经开始筹备申请公募牌照，最新一期《基金公司申请审核公示表》显示，国泰君安资管递交了开展公募基金管理业务资格审批申请。多位业内人士对此评论，“一参一控”限制的放宽，未来大型券商将可能陆续入局，这将带来公募参与主体的多元化，提升公募在资管行业占比，并为普通投资者带来更丰富的产品和服务。（界面新闻）,国泰君安等大型券商已经开始筹备申请公募牌照
809,2020-08-16 23:15:08,【明天 “超级周”来了！14股连发！机会都在哪？】下周A股将有14只新股申购，包括8只科创板新股、2只沪市主板新股、1只中小板新股、3只创业板新股。根据时间推算，这3只创业板注册制新股将无缘首批挂牌。（央视财经）,明天 “超级周”来了！14股连发！机会都在哪？
810,2020-08-16 23:00:41,【7月多项经济指标持续回暖 消费回升略显乏力】7月份宏观经济数据揭晓，各项经济指标持续回暖。商品零售增速年内首次转正，房地产、基建投资成为拉动经济复苏的主要驱动力。专家分析，中国经济延续缓慢复苏态势，消费回升依旧乏力。接下来宏观政策需要提升针对性，尽快推动服务消费和制造业投资回到正轨。（第一财经）,7月多项经济指标持续回暖 消费回升略显乏力
811,2020-08-16 22:46:56,【Are you ok？雷军直播带货首秀 2小时销售额破亿！】据小米公司官方微博消息，直播开始2小时后，雷军当晚销售额已经过亿。据了解，雷军此次带货商品主要为小米产品，包括小米10至尊纪念版、Redmi K30至尊纪念版、Redmi 智能电视 Max 98寸、小米透明电视等。（每日经济新闻）,Are you ok？雷军直播带货首秀 2小时销售额破亿！
812,2020-08-16 22:46:56,【当当李国庆：俞渝你有什么招冲我来 别伤及无辜】16日晚间，李国庆在微博发文，就在法院发表的情绪性言论表示承认和检讨，但他也表示，“俞渝你有什么招冲我来，别借我这题乱开炮，伤及无辜。”（界面新闻）,当当李国庆：俞渝你有什么招冲我来 别伤及无辜
813,2020-08-16 22:35:10,【新疆交建：公开发行8.5亿元可转债获得核准】新疆交建8月16日晚间公告，公司向社会公开发行8.5亿元可转换公司债券获得证监会核准。公司本期可转债拟用于G216北屯至富蕴公路工程PPP项目及补充流动资金。新疆交建日前表示，公司将加大可持续发展的大型PPP项目的拓展力度，系统提升PPP项目的实施能力和运营管理经验，力争成为新疆及西北地区PPP业务标志性企业。（e公司）,新疆交建：公开发行8.5亿元可转债获得核准
814,2020-08-16 22:32:06,【要从华尔街追回10亿！雷曼兄弟破产后打了10年官司】在金融危机被多次提及的2020年，当年一桩标志性的事件，近日又以另外一种形式重回公众视野：雷曼兄弟(Lehman Brothers)破产案的一个衍生案于近日宣判。《华夏时报》记者看到的美国法院文件显示，雷曼兄弟在破产后，曾将高盛、摩根士丹利等多家金融机构告上法庭，具体被告一度多达250个主体，涉案事件皆与当年雷曼兄弟的CDO(担保债务凭证)交易有关。（华夏时报）,要从华尔街追回10亿！雷曼兄弟破产后打了10年官司
815,2020-08-16 22:31:17,【雷军直播带货首秀销售额过亿】今晚8点，雷军在抖音平台小米直播间进行首次直播带货，截至晚上22点3分，雷军在直播间宣布当晚销售额已经过亿。据了解，雷军此次带货商品主要为小米产品，包括小米10至尊纪念版、Redmi K30至尊纪念版、Redmi 智能电视 Max 98寸、小米透明电视等。（e公司）,雷军直播带货首秀销售额过亿
816,2020-08-16 22:17:49,【下周解禁市值超400亿元 部分主板低价股大股东实际解禁压力或偏小】8月17日~8月21日，共有38家公司有限售股解禁，解禁数量为65.53亿股，对应解禁市值为441.4亿元。8月10日~8月14日，本周共有37家公司有限售股解禁，解禁数量为21.20亿股，对应解禁市值为559.23亿元。（每日经济新闻）,下周解禁市值超400亿元 部分主板低价股大股东实际解禁压力或偏小
817,2020-08-16 22:01:40,【“大胃王”吃播江湖：假吃、催吐吸粉 带货探店年入百万】很多“大胃王”吃播靠视觉和听觉冲击网友的感官，获得几十万甚至超百万的点赞量，靠带货、探店等运作年入百万。为了获得高额的流量，有些“大胃王”吃播假吃或催吐，通过拼接镜头让网友信以为真，另一边则称自己只吃不胖是因为有身材管理秘诀，而所谓的身体管理秘诀就是向网友推销减肥药。（新京报）,“大胃王”吃播江湖：假吃、催吐吸粉 带货探店年入百万
818,2020-08-16 21:55:39,【特斯拉“拒交门”事件新进展：上海拼多多团购车主顺利提车】8月16日，多家媒体报道，上海一位90后用户抢到团购特斯拉后，授权宜买车以他自己的邮箱与个人身份信息，在特斯拉官网下单，最后顺利提车。对此，拼多多“秒拼”事业群小二乐福表示，“我们已从武汉车主处证实，车辆也是其本人授权宜买车在特斯拉官网，并完成支付，与上海提车车主的操作过程完全一致，消费者本人购车也是自己使用，没有任何转卖意愿和意图，其购车用车也没有任何‘恶意’。”（大众网）,特斯拉“拒交门”事件新进展：上海拼多多团购车主顺利提车
819,2020-08-16 21:53:41,【人民币资产吸引力强劲 境外机构配置中国股债力度持续上升】近年来，中国金融市场对外开放稳步推进。截至2019年末，中国债券市场存量规模达99万亿元人民币，其中境外主体持债规模2.3万亿元人民币，同比增长26.7%；中国股票市场市值59.3万亿元人民币，其中境外主体持有股票市值2.1万亿元人民币，同比增长82%。（第一财经）,人民币资产吸引力强劲 境外机构配置中国股债力度持续上升
820,2020-08-16 21:45:38,【7月净买入量翻番！缘何韩国散户钟情A股基金？】近期，韩国散户大幅加仓A股的消息引发关注。韩国证券托管局(KSD)的数据显示，韩国投资者7月净买入2.027亿美元(约合2441亿韩元)A股基金，是上月8830万美元的两倍多。（第一财经）,7月净买入量翻番！缘何韩国散户钟情A股基金？
821,2020-08-16 21:41:23,【深圳公寓停止审批后 存量公寓“卖一套少一套” 销量不降反升】7月31日，深圳市发布通知，规定全市将停止审批新的商务公寓项目。记者走访了几处公寓楼盘发现，不管是政策发布之前还是之后，营销中心的购房者都络绎不绝。（华夏时报）,深圳公寓停止审批后 存量公寓“卖一套少一套” 销量不降反升
822,2020-08-16 21:26:14,【黄金上演过山车行情 机构看好投资前景】道富环球顾问公司首席黄金策略师、SPDR黄金信托基金的联合创始人乔治·米林斯坦利(George Milling-Stanley)表示，今年剩余时间内，金价的目标区间在2000至2200美元，金价继续上涨的概率为40%。他还指出金价难以发生大跌，不太可能跌入1700至1900美元区间，下跌的概率仅为20%。（国际金融报）,黄金上演过山车行情 机构看好投资前景
823,2020-08-16 21:15:44,【350家机构集体“嗑瓜子”！这5只股被机构扎堆调研 14家百亿私募盯上了这些公司】过去一周有5家上市公司获上百家机构扎堆调研，其中洽洽食品(002557.SZ)成为最受机构青睐的个股，参与机构多达350家，包括淡水泉、敦和、重阳、高毅等9家百亿私募。（21世纪经济报道）,350家机构集体“嗑瓜子”！这5只股被机构扎堆调研 14家百亿私募盯上了这些公司
824,2020-08-16 21:10:55,【海印股份：上半年净利同比增30.56%】海印股份(000861 )8月16日晚间披露半年报，上半年，公司实现营业收入7.18亿元，同比减少35.15%；净利润7788.8万元，同比增长30.56%。此外，实控人之一的邵建聪及其一致行动人茂名环星计划在公告发布之日起15个交易日后的6个月内，以集中竞价方式合计减持不超过4632万股，占公司总股本的2%。（e公司）,海印股份：上半年净利同比增30.56%
825,2020-08-16 21:00:42,【国元证券：上半年净利润同比增长42.77%】国元证券公告，公司上半年营业收入21.15亿元，同比增长33.44%；归属于上市公司股东的净利润6.18亿元，同比增长42.77%。（界面新闻）,国元证券：上半年净利润同比增长42.77%
826,2020-08-16 20:52:59,【银泰系掌门沈国军终于放手！新世界下一集什么剧情？】8月16日晚间，新世界发布权益变动报告书。沈国军及其一致行动人与昝圣达及其一致行动人解除一致行动关系，上海市黄浦区国有资产监督管理委员会仍为公司的第一大股东及实际控制人。（中国证券报）,银泰系掌门沈国军终于放手！新世界下一集什么剧情？
827,2020-08-16 20:41:12,【肖钢：随着注册制深入推进 A股投资者结构发生变化应该是大概率事件】证监会原主席肖钢在接受证券时报专访时表示，随着注册制深入推进，A股投资者结构发生变化应该是大概率事件。研究表明，中长期投资者可以稳定市场预期，同时对公司治理起到积极作用，因此发展长期投资者是落实资本市场供给侧结构性改革的关键举措。（e公司）,肖钢：随着注册制深入推进 A股投资者结构发生变化应该是大概率事件
828,2020-08-16 20:40:18,【肖钢：严格禁止银行资金违规或者绕道流入股市】中国证监会原主席肖钢在接受证券时报专访时表示，股市属于虚拟经济形态，也是一个风险市场，当前重点应防范杠杆资金带来的风险和冲击，严格禁止银行资金违规或者绕道流入股市。（界面新闻）,肖钢：严格禁止银行资金违规或者绕道流入股市
829,2020-08-16 20:38:05,【肖钢：中概股“回流”对中国资本市场具有重要意义】中国证监会原主席肖钢在接受证券时报专访时表示，中概股“回流”对中国资本市场具有重要意义。一是有利于改进上市公司结构，提高上市公司整体质量。二是有利于国内投资者更多地分享公司发展红利，为投资者提供多元化的投资标的，改善A股回报率。三是有利于增强我国资本市场的国际竞争力，进一步开放股市，改革完善各项基础制度，提高服务效率与水平。四是有利于维护我国科技安全和经济安全，做好外部冲击的应对工作。（e公司）,肖钢：中概股“回流”对中国资本市场具有重要意义
830,2020-08-16 20:25:07,【肖钢：蓝筹率先试点T+0风险可控 A股还缺“长钱” 改革要努力实现七大转变】2020年恰逢我国资本市场建立三十周年。我国资本市场已经实现了跨越式发展，同时也面临许多机遇与挑战，在这样的时刻，回顾资本市场变革历程，探讨市场基础制度建设，我想应该是一件有意义的事情。（证券时报）,肖钢：蓝筹率先试点T+0风险可控 A股还缺“长钱” 改革要努力实现七大转变
831,2020-08-16 20:23:37,【肖钢：中国从来没有像今天这样需要资本市场】中国证监会原主席肖钢在接受证券时报专访时表示，中央强调，资本市场在金融运行中具有牵一发而动全身的作用，具有枢纽地位，凸显了发展资本市场的重要性与紧迫性。从某种意义上来理解，中国从来没有像今天这样需要资本市场，这是我国进入工业化后期实现经济创新驱动、产业转型升级和高质量发展的必然选择。肖钢设想，中国资本市场将会成为全球人民币资产配置中心，可以海纳百川，兼收并蓄。,肖钢：中国从来没有像今天这样需要资本市场
832,2020-08-16 20:16:03,【安信策略：整固之后 复苏牛将挑战新高】我们认为市场在未来一段时间将主要呈现出“震荡向上”的格局，在此趋势下A股复苏牛有望挑战新的高度。在此逻辑下，顺周期板块会有补涨和修复性质的表现，同时我们也需要注意复苏依然是缓慢的，风格未必是一边倒的，我们认为非供给侧改革行业中的周期成长股、军工、云计算、苹果链、白酒、家电、保险、券商等都会有一定表现机会。（陈果A股策略）,安信策略：整固之后 复苏牛将挑战新高
833,2020-08-16 20:03:19,【新一轮上涨就要开始了？】汇总机构最新观点可以发现，机构对A股后市不悲观。多家券商指出，回调即是买入机会。在配置上，研究机构大多认为中期主线仍是“科技+消费+医药”，而短期更看好周期股。（上海证券报）,新一轮上涨就要开始了？
834,2020-08-16 19:58:15,【中国恒大：预期半年度核心净利润约为人民币193亿元】中国恒大：预期本集团于截至2020年6月30日止6个月录得之核心业务净利润及净利润有所下降，其中核心净利润预期约为人民币193亿元，较去年同期下降约37%，净利润预期约为人民币147亿元，较去年同期下降约46%。（e公司）,中国恒大：预期上半年核心净利润约193亿 同比降37%
835,2020-08-16 19:47:22,【A股首家未盈利IPO公司半年报来了！股东数少了近三成】8月16日晚间，泽璟制药(688266)披露2020年半年度报告，报告期内公司未实现营业收入，同期实现归属于上市公司股东的净利润为亏损1.29亿元，去年同期亏损3.41亿元。值得注意的是，相较于一季度，公司半年报披露的数据显示，泽璟制药总股东数减少了近30%。（e公司官微）,A股首家未盈利IPO公司半年报来了！股东数少了近三成
