,datetime,content,title
734,2020-10-01 08:45:56,【美联储调查：美联储主街贷款计划未覆盖目标】近期一项调查显示，备受关注的美联储主街贷款计划可能没能覆盖一个关键目标。一些企业表示，在疫情前其表现良好，但疫情后受到影响太大，不再符合贷款要求。（黄金头条）,美联储调查：美联储主街贷款计划未覆盖目标
735,2020-10-01 08:40:39,【十一出游火爆了宠物寄养生意 还有哪些产业链值得关注】华泰证券指出，美国宠物食品行业目前处于成熟稳定的发展阶段，对比美国宠物食品市场发展，我国宠物食品市场仍处发展早期阶段，国内宠物食品市场的中长期发展被看好。在A股上市公司中，佩蒂股份、中宠股份等以宠物食品为主营业务的宠物概念股，今年上半年的业绩齐齐增长，十一黄金周前股价更是开启了连续上涨模式。（上海证券报）,十一出游火爆了宠物寄养生意 还有哪些产业链值得关注
736,2020-10-01 08:40:12,【今年三季报10月10日拉开帷幕 你的自选股业绩如何？】国庆假期后，10月10日起，沪深两市4033家上市公司三季报披露将拉开帷幕。健友股份、星网宇达10月10日将率先披露。最晚的中芯国际11月12日披露。而目前预告三季报业绩的598家上市公司中，忧喜参半，其中湖北广电、金固股份已修正此前预告，前者从预降变首亏，后者从预亏变预降。因此节后进入三季报披露期，投资者需关注持股业绩情况。,今年三季报10月10日拉开帷幕 你的自选股业绩如何？
737,2020-10-01 08:37:38,【苹果授予库克期权重奖：挽留其担任CEO到2025年】外界非常确信，这是苹果释放出强烈信号，库克将至少继续担任CEO到2025年，尽管COO Jeff Williams被多次视为其潜在的内部接班人。（快科技）,苹果授予库克期权重奖：挽留其担任CEO到2025年
738,2020-10-01 08:35:26,【郑商所被纳入ESMA交易后透明度评估和限仓评估两项正面清单】经审核通过，郑商所成功列入第三国交易场所交易后透明度评估和限仓评估两项正面清单，系我国首家列入限仓评估正面清单的交易所。（期货日报）,郑商所被纳入ESMA交易后透明度评估和限仓评估两项正面清单
739,2020-10-01 08:33:57,【中期协发布两份通知 风险管理公司迎重大利好】风险管理公司应当以服务实体经济为目标，结合自身业务需求和业务能力，充分评估业务风险，合规、审慎决定开展仓储物流业务。（期货日报）,中期协发布两份通知 风险管理公司迎重大利好
740,2020-10-01 08:28:03,【国家管网集团全面接管运营 “三桶油”油气管道正式并网】据国家管网集团公司消息，9月30日，集团公司举行油气管网资产交割暨运营交接签字仪式。至此，国家管网公司宣告正式运营，我国的主要油气管道终于实现了并网运行。(21世纪经济报道),国家管网集团全面接管运营 “三桶油”油气管道正式并网
741,2020-10-01 08:23:16,【制造业PMI连续7个月高于临界点 部分重点行业景气回升加快】部分重点行业景气回升加快。数据显示，高技术制造业和装备制造业 PMI 为54.5%和53%，分别高于上月1.7和0.3个百分点。此外，随着国庆、中秋双节临近，假日消费效应有所显现，消费品行业PMI升至52.1%，高于上月1.7个百分点。（青岛财经日报）,制造业PMI连续7个月高于临界点 部分重点行业景气回升加快
742,2020-10-01 08:19:12,"【重磅信号！李嘉诚突然连续出手了！】香港联交所股权披露统计显示，9月24日至29日，李嘉诚父子连续增持长实集团股份，共计购入长实集团771,500股，涉及金额2938万港币。（中国基金报）",重磅信号！李嘉诚突然连续出手了！
743,2020-10-01 08:16:08,【临床阶段制药公司加科思药业集团港交所主板递表 2020前半年亏损超8亿】招股书披露，加科思旗下产品目前尚未获准进行商业销售，未从产品销售产生任何收入。自公司成立以来的每年，公司无盈利且持续产生亏损。于2018年、2019年以及截至2019年及2020年6月30日止六个月期间，亏损分别为人民币1.559亿元、4.258亿元、1.551亿元及8.109亿元。亏损主要来自研发开支、行政开支及具优先权的金融工具的公允价值亏损。（智通财经网）,临床阶段制药公司加科思药业集团港交所主板递表 2020前半年亏损超8亿
744,2020-10-01 08:14:43,【吉利汽车A股上市：巨额折旧与摊销压力大 每部车毛利不足万元】在目前无形资产与固定资产账面价值已经高达数百亿元的情况下，吉利汽车本次在A股IPO拟募集的200亿元资金当中，计划将110亿元投入到研发项目。或许这仍然有必要投入，但追加投入百亿资金是否合理却是值得商榷的事。（证券市场红周刊）,吉利汽车A股上市 巨额折旧与摊销压力大 每部车毛利不足万元
745,2020-10-01 08:12:04,【获阿里入股股价却跌停 众信旅游突围不容易】9月29日晚间，众信旅游发布公告称，公司控股股东、实际控制人冯滨以每股8.46元的价格向阿里巴巴(中国)网络技术有限公司转让其持有的众信旅游约4547.03万股无限售条件流通股，约占众信旅游总股本的5%。（21世纪经济报道）,获阿里入股股价却跌停 众信旅游突围不容易
746,2020-10-01 08:11:29,【时尚和科技的联结！只有NASA够时尚？中国航天摇了摇头】去年的上海时装周，Cabbeen(卡宾)与中国航天共同举办的“月兔计划2020春夏时装发布会”引发了网友热议，很多明星、博主都穿上了Cabbeen×中国航天的联名系列服饰。此后，中国航天成为了热门联名IP，时尚品牌竞相与中国航天合作，安踏便是其中之一。在与中国航天的合作中，安踏推出了两款运动鞋，均融入了航天元素。透明鞋底中镶嵌着隐约可见的“电路板”，鞋舌及后跟处印有火星探测器的图样。独特的创意与设计，塑造出新颖又不失美感的运动鞋。最近，鞋履品牌STACCATO(思加图)也成为了中国航天新的合作对象，共同推出了鞋履和包袋单品，其中马丁靴是联名系列的“重头戏”。（新京报）,时尚和科技的联结！只有NASA够时尚？中国航天摇了摇头
747,2020-10-01 08:10:07,【绿城管理上市首份财报：业绩下滑面积增长持续放缓 净利率三连降】9月24日，代建第一股绿城管理发布了2020年中期业绩公告。上半年受疫情影响，代建项目的建设和销售节点延迟1-2个月，这对于按照完工进度确认代建收入的绿城管理影响不小。公司持续经营收入为8.14亿元，较去年同期减少21.3%；持续经营业务期内利润为1.53亿元，较上年同期减少26.6%。剔除上市费用后归属于公司股东的净利润为1.63亿元，较上年同期微增4.1%。（中国经济网）,绿城管理上市首份财报：业绩下滑面积增长持续放缓 净利率三连降
748,2020-10-01 08:04:25,【美国政府调查14个月 近期或对谷歌提起反垄断诉讼】彭博社上周五称，美国司法部部长威廉·巴尔(William Barr)将发起对谷歌的反垄断诉讼，这或成为自20年前微软反垄断案件以来的最大反垄断诉讼。自2013年美国联邦贸易委员会停止对谷歌调查以来，执法者已经对这家公司没有问津多时了。（21世纪经济报道）,美国政府调查14个月 近期或对谷歌提起反垄断诉讼
749,2020-10-01 07:59:55,【政策利好市场刺激接连发力 双节合体机票预订超去年同期】今年，中秋节和国庆节双节“合体”，往年7天的黄金周延长成8天，成为疫情背景下首个“超长假期”，游客们出行的热情被彻底点燃。携程方面对记者表示，根据近期搜索、预订数据显示，国庆旅游市场已经启动，近期平台上国庆期间的航空、酒店、景区等预订数据一直呈递增态势。（新京报）,政策利好市场刺激接连发力 双节合体机票预订超去年同期
750,2020-10-01 07:53:23,【日本东京证券交易所因系统问题暂停交易】日本东京证券交易所因系统问题暂停交易。（证券时报网）,日本东京证券交易所因系统问题暂停交易
751,2020-10-01 07:47:59,【广东区块链信息服务企业占全国两成】区块链是广东省十大战略性新兴产业集群之一。广东省科技厅党组书记、厅长龚国平日前在接受记者采访时透露，广东省区块链信息服务备案企业目前约占全国备案的1/5，产业基础好，将实施七大工程推进区块链企业高质量发展，到2025年形成区块链技术和应用创新产业集群国际化示范高地。（证券时报网）,广东区块链信息服务企业占全国两成
752,2020-10-01 07:33:29,【供需两侧同步回升 拉动中国经济快速恢复】9月30日，国家统计局公布数据显示，9月份中国采购经理指数均明显回升，其中制造业采购经理指数、非制造业商务活动指数和综合PMI产出指数为51.5%、55.9%和55.1%，分别比上月上升0.5、0.7和0.6个百分点，3月份以来三大指数持续位于临界点以上。数据显示出中国经济持续恢复的趋势不断加强。（21世纪经济报道）,供需两侧同步回升 拉动中国经济快速恢复
753,2020-10-01 07:18:09,【北向资金动向曝光：9月30日这30只个股被猛烈扫货 一龙头增持超6亿元】9月30日，北上资金净买入的个股共有459只，北上资金加仓比例超1%的有390只。其中，易成新能加仓比例最为明显，最新持股比例2.89%，环比增加2.18个百分点。其他北上资金加仓比例较多的个股还包括东方日升、燕京啤酒、东山精密。（每日经济新闻）,北向资金动向曝光：9月30日这30只个股被猛烈扫货 一龙头增持超6亿元
754,2020-10-01 07:09:48,【VR看房呈爆发式增长 居住服务数字化潜力巨大】贝壳研究院数据显示，2020年一季度，贝壳找房平台上的经纪人和消费者，共同发起了超过1800万次VR带看，VR带看的通话时长达到50.7万小时，相较2019年4季度增长了80倍。2020年第二季度，贝壳平均每天约发起15.9万次VR带看，而2019年同期的数字仅为1.1万次。（人民日报海外版）,VR看房呈爆发式增长 居住服务数字化潜力巨大
755,2020-10-01 06:56:35,【多少钱能买下一家航空公司？8亿元就行！民航业卖壳潮起】9月30日，经过91次竞价，中国民航史上首家航司拍卖落锤。北京盛达金业投资咨询有限公司经过公开竞价，以8.06亿元的价格竞得“龙江航空有限公司98%股权对应股东部分权益价值项目”。（中国证券报）,多少钱能买下一家航空公司？8亿元就行！民航业卖壳潮起
756,2020-10-01 06:40:50,【还能这样“打新” 预期收益率真香！更有特色产品大盘点】打新基金常有，打新理财产品你听说过吗？近期，中证君发现，理财产品也开始打新了。这或许意味着，理财产品收益率有望提高，摆脱“收益率低”的标签。（中国证券报）,还能这样“打新” 预期收益率真香！更有特色产品大盘点
757,2020-10-01 06:25:40,【A股新“股神”来了！重仓大牛股4年豪赚百亿 收益率超100%】能源龙头陕西煤业9月30日晚间发布前三季度业绩预告，预计前三季度实现归属于上市公司股东的净利润为105亿元至115亿元。与上年同期相比，增加14.17亿元至24.17亿元，同比增加15.59%至26.6%。（中国证券报）,A股新“股神”来了！重仓大牛股4年豪赚百亿 收益率超100%
758,2020-10-01 06:21:04,【社保有大变化！这些城市将由“五险一金”变“六险一金”】截止2019年底，中国60岁及以上人口达2.54亿，预计到2053年，中国老年人口将达到4.87亿的峰值，占总人口的34.9%。（华夏时报）,社保有大变化！这些城市将由“五险一金”变“六险一金”
759,2020-10-01 06:05:13,【牛市震荡期 各类混基配置价值全线提升】8月以来，A股走势趋向震荡波动，股债混合型产品站上风口，今年新发成立的偏债混合型基金已达到1948.04亿元，远超历年总和的870.8亿元。这类以固收资产为底仓、部分权益资产做收益增强的投资方式，在震荡市中更加适合稳健型投资者。（证券市场红周刊）,牛市震荡期 各类混基配置价值全线提升
760,2020-10-01 05:47:12,【9月违规公司数量环比减少四成 受罚企业不能进入融资快车道】“近三年受到证监会行政处罚的公司不能进入再融资快速审核通道。”证监会发行部相关人士近日对外表示。这也标志着，上市公司信披工作考评成为企业能否快速实现融资输血的重点要素。统计显示，整个9月份沪深两市有83家公司受罚，数量较8月份环比减少40.71%。（大众证券报）,9月违规公司数量环比减少四成 受罚企业不能进入融资快车道
761,2020-10-01 05:40:34,【斯蒂芬·罗奇文章：美元暴跌才刚刚开始】世界报业辛迪加网站9月25日发表美国耶鲁大学高级研究员、摩根士丹利前亚洲区主席斯蒂芬·罗奇的题为《美元上的钳子收紧》的文章称，对于依然定值过高的美元来说，美元的下跌刚刚开始。（新华社）,斯蒂芬·罗奇文章：美元暴跌才刚刚开始
762,2020-10-01 05:31:04,【林氏兄弟拟将“莆田系”医院5亿元卖身莎普爱思 评估增值率高达278.88%】9月29日晚间，莎普爱思(603168.SH)公告称，拟斥资5.02亿元现金收购上海渝协医疗管理有限公司(简称“渝协管理”)、上海协和医院投资管理有限公司(简称“协和投资”)合计持有的泰州市妇女儿童医院有限公司(简称“泰州医院”)100%股权。（21世纪经济报道）,林氏兄弟拟将“莆田系”医院5亿元卖身莎普爱思 评估增值率高达278.88%
763,2020-10-01 05:16:32,【香港金管局累计向银行体系注入152.75亿港元】香港金管局累计向银行体系注入152.75亿港元，以捍卫联系汇率制。（21世纪经济报道）,香港金管局累计向银行体系注入152.75亿港元
764,2020-10-01 05:03:55,【三季度房企发债规模再创新高 “三条红线”压力下单月发行下降】自8月底监管部门提出“三条红线”政策后，房企纷纷审视自身，加快降杠杆步伐。部分品牌房企在全国开启新一轮降价促销，加速资金回笼。统计数据显示，今年第三季度房企境内外债券融资发行307次，融资规模约3247亿元，同比增长14%，三季度发债规模刷新历史纪录。（中国经营网）,三季度房企发债规模再创新高 “三条红线”压力下单月发行下降
765,2020-10-01 04:47:42,【A股上市券商密集“补血” 11家证券公司拟定增超千亿】记者统计发现，今年以来，已有11家A股券商发布募资方案，其中6家上市券商的定增已经完成，合计募集资金612.05亿元，另有5家上市券商定增尚在推行中，预计募资总额约468.56亿元。11家上市券商合计(拟)募资额约1080.61亿元。（21世纪经济报道）,A股上市券商密集“补血” 11家证券公司拟定增超千亿
766,2020-10-01 04:31:04,【中联重科调整66亿募资方案 锁价定增变“A+H”双线融资】9月30日，中联重科公告调整非公开发行预案，将原有锁价定增募资66亿元的预案，调整为A股询价定增募资56亿元加H股增发约10亿元的“A+H”预案。（每日经济新闻）,中联重科调整66亿募资方案 锁价定增变“A+H”双线融资
767,2020-10-01 04:16:41,【AI生药探索进入加速期：融资频发 互联网巨头蜂拥竞技】9月28日，人工智能(AI)药物研发公司晶泰科技(XtalPi)宣布超额完成3.188亿美元的C轮融资，创造全球AI药物研发领域融资额的最高纪录。（21世纪经济报道）,AI生药探索进入加速期：融资频发 互联网巨头蜂拥竞技
768,2020-10-01 04:10:55,【透析银行负债变化 降成本路在何方？】商业银行负债端主要由存款、同业负债、应付债券和向央行借款四个部分构成。本文以36家上市银行为样本，呈现上半年银行负债端全景及变化。总体看，上半年上市银行存款占比小幅提升，同业负债、应付债券占比小幅下降，向中央银行借款占比持平。（21世纪经济报道）,透析银行负债变化 降成本路在何方？
769,2020-10-01 04:09:56,【美联储调查：美联储主街贷款计划未覆盖目标】近期一项调查显示，备受关注的美联储主街贷款计划可能没能覆盖一个关键目标。一些企业表示，在疫情前其表现良好，但疫情后受到影响太大，不再符合贷款要求。（黄金头条）,美联储调查：美联储主街贷款计划未覆盖目标
770,2020-10-01 04:09:12,【投行相继看涨黄金 修正是买入良机？年底或重返2000美元关口上方】周三(9月30日)，瑞银全球财富管理(UBSGlobalWealthManagement)区域首席投资官凯尔文·泰伊(Kelvin Tay)表示：“我们喜欢黄金，因为我们认为到今年年底，金价可能会达到每盎司2000美元左右。”（汇通网）,投行相继看涨黄金 修正是买入良机？年底或重返2000美元关口上方
771,2020-10-01 04:00:25,【美股三大指数集体收涨 道指涨超1%】美股三大指数集体收涨，道指涨1.20%，纳指涨0.74%，标普500指数涨0.82%。,美股三大指数集体收涨 道指涨超1%
772,2020-10-01 03:52:17,【四大行遭遇重压 资本总缺口超2万亿 发生了什么？央行、银保监会重磅发文 “中国版”TLAC监管要来了】9月30日，央行、银保监会发布《全球系统重要性银行总损失吸收能力管理办法(征求意见稿)》，与国际监管要求接轨，将对全球系统重要性银行实施总损失吸收能力(TLAC)监管要求。同日发布并实施的还有《关于建立逆周期资本缓冲机制的通知》，并明确逆周期资本缓冲比率初始设定为0，不增加银行业金融机构的资本管理要求。（券商中国）,四大行遭遇重压 资本总缺口超2万亿 发生了什么？央行、银保监会重磅发文 “中国版”TLAC监管要来了
773,2020-10-01 03:42:00,【9.2亿美元！摩根大通将支付CFTC史上最大罚单 美国对“幌骗”监管升级？】美国当地时间29日，摩根大通(JPMorgan)同意支付创纪录的9.2亿美元，以和解美国司法部、美国商品期货交易委员会(CFTC)及美国证券交易委员会(SEC)对其涉嫌通过“幌骗”操纵全球金属和美国国债市场的调查。（第一财经）,9.2亿美元！摩根大通将支付CFTC史上最大罚单 美国对“幌骗”监管升级？
774,2020-10-01 03:38:41,【季节性因素带动供需改善 9月PMI延续回升格局】“季节性因素带动供需改善。PMI出现继续好转部分原因是随着国庆中秋双节的来临，假日消费效应显现。经济修复有序进行，并且生产和消费的缺口在逐渐减小。”中邮证券研发部固定收益分析师魏大朋30日在接受《大众证券报》记者采访时表示道。（大众证券报）,季节性因素带动供需改善 9月PMI延续回升格局
775,2020-10-01 03:37:42,【贵州百灵收关注函：表决权委托是否触发要约收购？】30日下午，深交所向贵州百灵企业集团制药股份有限公司下发关注函，要求说明控股股东姜伟将公司11%股份对应的表决权委托给华创证券有限责任公司行使是否触发对公司股份的要约收购等。（中新经纬）,贵州百灵收关注函：表决权委托是否触发要约收购？
776,2020-10-01 03:37:42,【刷新锁定期纪录 为传承财富 私募出现封闭期15年产品】近来，基金投资出现了一个新动向——为传承财富，出现了封闭期长达15年的私募基金，这也是目前封闭期最长的私募产品。据悉，按目前设定，格雷财富传承5号封闭期长达15年，在15年内不能赎回，此外，根据计划，每年客户还将追加3000万元投资。（21世纪经济报道）,刷新锁定期纪录 为传承财富 私募出现封闭期15年产品
777,2020-10-01 03:23:44,【行情】现货白银持续走低，跌超4%，现报23.16美元/盎司。,现货白银跌超4%
778,2020-10-01 03:02:26,【行情】WTI 11月原油期货价格上涨0.93美元，收于每桶40.22美元。（21世纪经济报道）,WTI 11月原油期货价格上涨0.93美元，
779,2020-10-01 03:00:19,【行情】纽约商品交易所黄金期货市场交投最活跃的12月黄金期价比前一交易日下跌7.7美元，收于每盎司1895.5美元，跌幅为0.4%。（21世纪经济报道）,纽约商品交易所黄金期货市场交投最活跃的12月黄金期价比前一交易日下跌7.7美元
780,2020-10-01 02:49:18,【家电新趋势：集成灶疫后恢复迅猛】进入第三季度以来，之前因疫情影响的集成灶市场开始加速恢复。奥维云网(AVC)预测，随着疫情逐步好转，加上618集成灶市场展现出良好韧性，行业仍有很大的增长潜力，预计集成灶全年零售额189.8亿元，同比增长18.6%，零售量256.64万台，同比增长20.8%。（21世纪经济报道）,家电新趋势：集成灶疫后恢复迅猛
781,2020-10-01 02:32:14,【合并国金还没结果 又要拿下公募牌照！国联证券走上“疯狂并购路”？能走多远？】“蛇吞象”并购国金证券的操作尚未完成，国联证券又在公募基金牌照方面果断出手。9月30日，国联证券H股公告，公司与法国洛希尔银行订立股权转让协议，公司已同意1.15亿元收购中海基金的25%股权；收购事项完成后，公司将持有中海基金58.409%股权，中海基金将成为公司控股子公司。（券商中国）,合并国金还没结果 又要拿下公募牌照！国联证券走上“疯狂并购路”？能走多远？
782,2020-10-01 02:17:37,【罚缴超7亿！特大操纵期货市场案宣判 这家A股被重罚！回应来了】9月30日，辽宁抚顺市中级人民法院一审判决远大石化、时任董事长吴向东操纵期货市场案，远大石化因操纵期货市场罪被罚3亿元，董事长吴向东被判五年有期徒刑，处罚金500万；同时追缴远大石化违法所得4.37亿元、吴向东违法所得487.58万元。（中国基金报）,罚缴超7亿！特大操纵期货市场案宣判 这家A股被重罚！回应来了
783,2020-10-01 02:06:31,【四大行资本缺口2万亿？“中国版”TLAC、逆周期资本缓冲都来了 多种方式分担压力】9月30日，央行、银保监会发布《全球系统重要性银行总损失吸收能力管理办法(征求意见稿)》，与国际监管要求接轨，将对全球系统重要性银行实施总损失吸收能力(TLAC)监管要求。同日发布并实施的还有《关于建立逆周期资本缓冲机制的通知》(下称“《通知》”)，并明确逆周期资本缓冲比率初始设定为0，不增加银行业金融机构的资本管理要求。（证券时报网）,四大行资本缺口2万亿？“中国版”TLAC、逆周期资本缓冲都来了 多种方式分担压力
784,2020-10-01 01:49:31,【A股三季度涨幅领跑全球！成交额69万亿同比猛增130% 四季度怎么走？机构这样看】尽管节前A股观望气氛浓厚，交投降至近期冰点，主要指数亦有不同程度下跌，但纵观整个三季度，A股市场仍取得不俗表现，主要指数量价齐升，并领跑全球主要股市。展望四季度A股表现，机构普遍认为需关注疫情以及三季报上市公司业绩等因素的影响。（证券时报网）,A股三季度涨幅领跑全球！成交额69万亿同比猛增130% 四季度怎么走？机构这样看
785,2020-10-01 01:33:16,【踩油门！国资委部署央企改革三年行动 七大任务明确 地方国企也已部署】接连两天，国企改革三年行动部署工作继续紧锣密鼓进行。9月29日，国资委召开视频会议，对中央企业改革三年行动工作进行动员部署。30日，国务院国有企业改革领导小组办公室召开“地方国有企业改革领导小组办公室主任视频会议”，对各地实施国企改革三年行动进行工作部署。（券商中国）,踩油门！国资委部署央企改革三年行动 七大任务明确 地方国企也已部署
786,2020-10-01 01:17:42,【拟“吞并”国金之后 国联证券又宣布大动作！这家外资撤退了】9月30日晚间，国联证券发布公告称，董事会审议通过《关于收购中海基金25%股权的议案》，同意公司以获取中海基金控股股东地位为目的，收购法国爱德蒙得洛希尔银行股份有限公司持有的中海基金 25%股权，收购价格为1.15亿元，这也意味着，国联证券将取代中海信托成为中海基金的控股股东。（中国基金报）,拟“吞并”国金之后 国联证券又宣布大动作！这家外资撤退了
