,datetime,content,title
197,2020-08-08 16:19:31,【雅培印度Q1业绩：净利润同比增长超五成】药企雅培印度公司报告称，截至2020年6月的一季度净利润增长54.22%，达到18.03亿印度卢比(约合1.67亿元人民币元)。雅培印度公司在周五晚间提交的孟买证券交易所(BSE)文件中表示，该公司上一财年同期的净利润为11.69亿印度卢比(约合1.08元人民币)。（界面新闻）,雅培印度Q1业绩：净利润同比增长超五成
198,2020-08-08 16:03:57,【国务院安委办：将派明查暗访组赴重点港口开展爆炸性重点管控化学品检查】记者从应急管理部获悉，为深刻吸取黎巴嫩贝鲁特“8·4”重大爆炸事件教训，国务院安委办立即专题部署开展硝酸铵等爆炸性重点管控化学品生产储存企业及港口货场明查暗访工作。8月7日，派出6个工作组，赴河北、山西、福建、山东、河南、陕西、云南、贵州、重庆、四川、甘肃等11个省份和天津、青岛、上海、宁波港等4个重点港口，重点抽查辖区内硝酸铵生产、储存数量大的企业、化工园区和涉及硝酸铵流向的港口货场。（央视新闻）,国务院安委办：将派明查暗访组赴重点港口开展爆炸性重点管控化学品检查
199,2020-08-08 15:56:26,【华为推HMS新生态系统替代谷歌 全球月活用户超7亿】8月7日，在中国信息化百人会2020年峰会上，华为公司董事、战略研究院院长徐文伟表示，在操作系统领域，华为认为未来模式的引领者，应该是用开放对抗封闭，用协同对抗割裂，我们的产业主张是开放、开源、共建OS生态，支持分布式的全场景终端。对Hi AI，华为从云、端、芯三层能力开放，助力开发者商业成功，当前AI合作伙伴已经超过4000家，HMS（华为移动服务）生态加速走向海外，全球月活用户超过7亿，注册的开发者已经达到160万，超过8万个应用已经集成了华为的HMS Core。（新华社）,华为推HMS新生态系统替代谷歌 全球月活用户超7亿
200,2020-08-08 15:51:02,【德国出口创1990年来最大环比增幅】德国联邦统计局当地时间7日公布的初步数据显示，经工作日和季节调整后，德国今年6月商品出口额环比上升14.9%，达到961亿欧元；进口额环比上升7%，达到805亿欧元。值得一提的是，虽然德国经济受新冠肺炎疫情影响陷入了史无前例的衰退，6月的进出口额即使实现增长，依旧较2019年同比下降了10%和9.4%，但此次出口的环比涨幅仍为1990年8月以来最强劲的增长，也比经济学家们此前预计的14.4%要高。（央视新闻）,德国出口创1990年来最大环比增幅
201,2020-08-08 15:39:43,【郭明錤：iPhone 12相机镜头测试现质量问题】8日消息，据9to5Mac报道，知名苹果分析师郭明錤报告称，苹果一家供应商在测试iPhone 12相机镜头时出现了质量问题，广角镜头上的涂层开裂。出现质量问题的是非Pro版5.4英寸和6.1英寸机型的摄像头模组，由玉晶光电公司制造。目前还不知道该公司是否能在发布会前及时修复该问题。（界面新闻）,郭明錤：iPhone 12相机镜头测试现质量问题
202,2020-08-08 15:26:26,【排队兑现黄金 大批投资者每克黄金赚60元以上】本周国际黄金延续强势上涨态势，记者发现，在北京市多家黄金商场，回购窗口聚集了不少的消费者。有商场负责人告诉记者，最近一个月，商场投资金回购量出现激增，大部分投资者每克黄金能赚取60元以上。有商场负责人介绍，7月份商场首饰金的销量同比增长近10%。专家提醒，此时买入黄金价位较高，一定要谨慎投资，分批建仓也许是更好的选择。（央视财经）,排队兑现黄金 大批投资者每克黄金赚60元以上
203,2020-08-08 15:22:45,【江西推出“生猪企业贷”保生猪生产供应】记者从江西省财政厅获悉，为保障生猪生产供应，江西日前推出“生猪企业贷”信贷产品，单笔最高可贷款1000万元。（新华网）,江西推出“生猪企业贷”保生猪生产供应
204,2020-08-08 15:17:26,【城市维护建设税法草案拟进一步明确规定可减免税范围】《中华人民共和国城市维护建设税法（草案）》8日二次提请全国人大常委会会议审议，拟进一步明确规定可减免税范围。草案明确，根据国民经济和社会发展的需要，国务院对重大公共基础设施建设、特殊产业和群体以及重大突发事件应对等情形可以规定减征或者免征城市维护建设税，报全国人民代表大会常务委员会备案。草案规定，纳税人所在地是指纳税人住所地或者与纳税人生产经营活动相关的其他地点，具体地点由省、自治区、直辖市确定。（新华网）,城市维护建设税法草案拟进一步明确规定可减免税范围
205,2020-08-08 15:10:26,【契税法草案拟对法定继承人继承土地房屋权属免征契税】《中华人民共和国契税法(草案)》8日二次提请全国人大常委会会议审议，拟对法定继承人继承土地房屋权属免征契税。（新华网）,契税法草案拟对法定继承人继承土地房屋权属免征契税
206,2020-08-08 14:58:31,【阿里云中标首个“智慧港口”山东港口顶层设计方案】据阿里云消息，今天，阿里云中标交通部指定的首个“智慧港口”山东港口的顶层设计方案，要把全国外贸集装箱吞吐量第一的山东港口建设成为“世界一流的智慧港口、绿色港口”。（证券时报）,阿里云中标首个“智慧港口”山东港口顶层设计方案
207,2020-08-08 14:48:41,【著作权法修正案草案二审 拟对视听作品著作权分类保护】著作权法修正案草案8日提请全国人大常委会会议第二次审议。草案二审稿完善了作品的定义和类型，删去了不得滥用权利影响作品正常传播及法律责任的规定，并增加相关规定拟对视听作品的著作权分类保护。（新华社）,著作权法修正案草案二审 拟对视听作品著作权分类保护
208,2020-08-08 14:37:49,【我国修法拟明确县级以上地方政府根据本地情况决定在特定区域禁止家畜家禽活体交易】动物防疫法修订草案二审稿8日提请十三届全国人大常委会第二十一次会议审议。相对于草案一审稿，二审稿对加强集贸市场和畜禽活体交易的管理作出进一步修改。草案二审稿规定，经营动物、动物产品的集贸市场应当具备国务院农业农村主管部门规定的动物防疫条件，并接受农业农村主管部门的监督检查。县级以上地方人民政府根据本地情况决定在特定区域禁止家畜家禽活体交易。（新华社）,我国修法拟明确县级以上地方政府根据本地情况决定在特定区域禁止家畜家禽活体交易
209,2020-08-08 14:26:46,【英国计划投入20亿英镑改善步行及骑行环境】为了鼓励大家健康出行，英国政府近期公布了在未来五年内投入20亿英镑、约合180亿元的预算，改善全英国的步行及骑行环境。英国政府还发放了首批共计5万份价值50英镑，约合450元的自行车维修代金券，鼓励人们找出家中生锈、故障的自行车维修，重回道路。（央视新闻）,英国计划投入20亿英镑改善步行及骑行环境
210,2020-08-08 14:12:48,【契税法草案二审：拟增加免征情形 明确退税规定】全国人大常委会法工委就立法工作有关情况举行记者会，会上全国人大常委会法工委发言人臧铁伟介绍，关于契税法草案(二次审议稿)。2019年12月，常委会第十五次会议对契税法草案进行了初次审议。根据各方面意见，提请本次常委会会议审议的草案二次审议稿拟作以下完善性修改：一是进一步明确计税依据。二是增加有关免征契税的情形。三是对国务院规定契税减免情形的范围予以明确。四是规范地方决定契税减免的程序。五是明确退税相关规定。（界面新闻）,契税法草案二审：拟增加免征情形 明确退税规定
211,2020-08-08 13:58:19,【汇丰银行因征信查询存在违法行为而被罚】中国人民银行上海总部网站8月6日发布的上海分行行政处罚信息显示，汇丰银行因征信查询存在违法行为，副行长及总经理等负责人均被罚，共计被罚53万元。（中国证券网）,汇丰银行因征信查询存在违法行为而被罚
212,2020-08-08 13:46:49,【CCF-GAIR2020全球人工智能和机器人峰会在深圳召开】8月7日，为期三天的2020全球人工智能和机器人峰会(CCF-GAIR2020)在深圳开幕。本届峰会以“AI新基建，产业新机遇”为主题，重点探讨AI学术基础与产业落地的未来发展趋势，由中国计算机学会(CCF)主办，香港中文大学(深圳)、雷锋网联合承办，鹏城实验室、深圳市人工智能与机器人研究院协办。（中证网）,CCF-GAIR2020全球人工智能和机器人峰会在深圳召开
213,2020-08-08 13:33:35,【贾康：房地产也属于实体经济 但往往会被赋予较强的金融属性】8月8日，华夏新供给经济学研究院院长、中国财政科学研究院研究员贾康在博鳌21世纪房地产论坛上表示，房地产也属于实体经济，但往往会被赋予较强的金融属性(抵押、财富管理、迅速增值、融资炒作)，易引出泡沫化，甚至“炒房团”式的市场畸形过热。所以有时人们较狭义地谈实体经济(如谈制造业)时，把房地产排除在外，似乎成了非实体经济。（国际金融报）,贾康：房地产也属于实体经济 但往往会被赋予较强的金融属性
214,2020-08-08 13:14:09,【小鹏汽车赴美上市：上半年营收10亿 何小鹏持股31.6%】当地时间8月7日，小鹏汽车正式向美国证券交易委员会(SEC)递交了招股书。（澎湃新闻）,小鹏汽车赴美上市：上半年营收10亿 何小鹏持股31.6%
215,2020-08-08 13:04:47,【大洋电机：公司建筑及家居电器电机业务中有可用于冷库冷柜的电机】大洋电机(002249)在互动平台表示，公司建筑及家居电器电机业务中有可用于冷库冷柜的电机。目前公司的氢燃料电池相关产品可用于数据中心供电。（e公司）,大洋电机：公司建筑及家居电器电机业务中有可用于冷库冷柜的电机
216,2020-08-08 12:56:23,【广和通MA510 LTE Cat M模组通过德国电信完全认证】8月7日，广和通MA510 LTE Cat M模组获得了德国电信(Deutsche Telekom AG)的完全认证。这意味着德国电信认可广和通MA510的功能特性，进而认可MA510可用于大规模物联网项目的部署。广和通MA510可以在德电网络下为全球客户提供无线联网服务。（证券时报）,广和通MA510 LTE Cat M模组通过德国电信完全认证
217,2020-08-08 12:39:53,【三亚依托自由贸易港政策建设跨境电子商务综合试验区】海南省政府办公厅7日夜公布《中国(三亚)跨境电子商务综合试验区实施方案》，明确该区将按照海南自由贸易港建设打造标杆的要求，建设全球供应链采购中心、现代化经济发展引擎和跨境电子商务服务中心。（中国新闻网）,三亚依托自由贸易港政策建设跨境电子商务综合试验区
218,2020-08-08 12:27:56,【武汉新设一批机构加快推进城市重振】8月7日，武汉市融资担保有限公司挂牌成立。记者梳理发现，这是武汉市一周来新设立的第三家机构。这三家机构分别承担融资担保、投资促进、城市更新等作用，以此加快推进武汉重振。除此之外，武汉市还成立一批委员会和领导小组，推进新型基础设施建设、数字经济发展、优化营商环境等重点工作。（长江日报）,武汉新设一批机构加快推进城市重振
219,2020-08-08 12:15:02,【贝壳找房更新招股书 发行价在17-19美元之间】8月8日，贝壳找房在美国SEC更新招股书，招股书披露显示，贝壳找房发行价在17美元-19美元之间，预计募集资金总额约18.41亿美元-21.19亿美元。（中国证券报）,贝壳找房更新招股书 发行价在17-19美元之间
220,2020-08-08 12:06:29,【吴晓求：要让未来有成长性的企业上市】中国人民大学副校长吴晓求表示，必须改变企业的投资价值，这是注册制改革的目标。要让那些未来有成长性的企业成为上市公司的主体。企业要有成长性，今天可以亏损，只要如实披露信息，但是，未来要有预期。改变中国上市公司的标准是非常重要的，让它赋予这个市场以成长性。（新京报）,吴晓求：要让未来有成长性的企业上市
221,2020-08-08 11:55:19,【Mayo Clinic国际部总裁：远程医疗大有可为】Mayo Clinic国际部总裁G.Anton Decker在高瓴HCare全球健康产业峰会上表示，疫情会使未来医疗会发生翻天覆地的变化，如果将这个变化比作一个钟摆，那么这个钟摆可能会完全摆到远程医疗的一端。但随着时间的推移，钟摆会慢慢回移。因为对于一些重难杂疾病而言，面诊依然很必要。以后，面诊和远程结合将成为是一个发展方向，未来的医疗服务会走向一个更加混合的模式，远程医疗大有可为。(e公司),Mayo Clinic国际部总裁：远程医疗大有可为
222,2020-08-08 11:50:19,【世诚投资陈家琳：行情处于什么阶段 掘金低估值还是追涨科技消费？】七月初以来，在流动性驱动下，一些资金开始押宝下半年的经济复苏，低估值周期股呈现出回归和修复。那么，接下来的投资主线，是掘金低估值板块还是继续追涨景气度高的科技和大消费行业？,世诚投资陈家琳：行情处于什么阶段 掘金低估值还是追涨科技消费？
223,2020-08-08 11:40:58,【Mayo Clinic国际部总裁：远程医疗大有可为】Mayo Clinic国际部总裁G.Anton Decker在高瓴HCare全球健康产业峰会上表示，疫情会使未来医疗会发生翻天覆地的变化，如果将这个变化比作一个钟摆，那么这个钟摆可能会完全摆到远程医疗的一端。但随着时间的推移，钟摆会慢慢回移。因为对于一些重难杂疾病而言，面诊依然很必要。以后，面诊和远程结合将成为是一个发展方向，未来的医疗服务会走向一个更加混合的模式，远程医疗大有可为。(e公司),Mayo Clinic国际部总裁：远程医疗大有可为
224,2020-08-08 11:40:39,【最牛大赚近8亿！券商资管最新成绩单来了 更有这个大利好】7月，券商资管子公司业绩分化明显。截至8月8日早间，已有15家券商旗下资管子公司“交出”7月成绩单。营收冠军是东证资管，7月实现营收3.5亿，净利润冠军为华泰资管，7月实现净利润1.49亿。（中国基金报）,最牛大赚近8亿！券商资管最新成绩单来了 更有这个大利好
225,2020-08-08 11:38:47,【证监会放大招 史上最独特公募基金开闸！基金业沸腾！20大解读全看懂】公募基金行业将正式迎来一个划时代的新产品！证监会8月7日发布正式《公开募集基础设施证券投资基金指引(试行)》，这意味着各大基金公司最快将于下周一上报此类产品，公募REITs即将问世。（中国基金报）,证监会放大招 史上最独特公募基金正式开闸！基金业沸腾！20大解读全看懂
226,2020-08-08 11:27:07,【高瓴资本首席投资官易诺青：高瓴正在布局研究型医院】高瓴资本联席首席投资官、合伙人易诺青在高瓴HCare2020全球健康产业峰会上透露，高瓴资本正布局研究型医院。（e公司）,高瓴资本首席投资官易诺青：高瓴正在布局研究型医院
227,2020-08-08 11:17:22,【Mayo Clinic国际部总裁：疫情过后世界经济面临挑战 但未来将会更好】Mayo Clinic国际部总裁G．Anton Decker在高瓴HCare全球健康产业峰会上表示，疫情过后的世界经济肯定会面临挑战，或者说现在已经面临着严峻的挑战。未来新市场、新产品的培育可能会受到不利影响，可以说自第二次世界大战以来，这一次疫情大流行是人类遭受到的最大挑战。但是人类的复原力是很强的，我们一定能够挺过这一关，我相信经历过疫情的洗礼，未来将会更好。（e公司）,Mayo Clinic国际部总裁：疫情过后世界经济面临挑战 但未来将会更好
228,2020-08-08 11:00:29,【中国工程院副院长王辰：中国健康相关产业增长空间巨大】中国工程院副院长、中国医学科学院北京协和医学院院校长、中国工程院院士王辰在高瓴全球健康产业峰会上表示，在未来的经济发展模式中，衣食住行的消费的增长空间相对有限，现在和将来健康相关的产业增长空间是巨大的。世界卫生组织曾经讲过，2020年以后的世界第一大产业很有可能是健康产业。因此健康事业是经济社会发展和社会安全稳定的最重要的因素，不能在在这个问题上认识含糊，或者意识不够强烈。（e公司）,中国工程院副院长王辰：中国健康相关产业增长空间巨大
229,2020-08-08 10:39:42,【商务部部长钟山：聪明的外商一定不会放弃中国市场】商务部部长钟山日前接受采访时表示，疫情冲击下，全球跨国投资大幅萎缩，一些国家鼓励产业回流，国际引资竞争加剧，我国产业向外转移压力加大，利用外资困难增多。但上半年仍有不少外资企业持续扩大在华投资，投资额1亿美元以上外资大项目达到320个。“中国拥有14亿人口的庞大市场和完善的产业配套体系，营商环境不断改善，相信聪明的外商一定不会放弃中国市场。”钟山说。（新华视点）,商务部部长钟山：聪明的外商一定不会放弃中国市场
230,2020-08-08 10:38:17,【商务部部长钟山：让政策惠及更多外贸企业】商务部部长钟山日前接受新华社记者采访时提到，下半年，我国外贸面临的形势更加复杂严峻，世界经济下滑对需求的影响将进一步显现，外贸企业生存压力仍然很大。商务部将加大政策支持力度，推动出台和落实出口退税、外贸信贷、出口信保、出口转内销等系列稳企纾困政策，让政策惠及更多外贸企业。（新华视点）,商务部部长钟山：让政策惠及更多外贸企业
231,2020-08-08 10:32:51,【吴晓求：未来资本市场改革体现在注册制为先导的系列制度变革上】在“中国经济新格局：乘风破浪”夏季峰会上，中国人民大学副校长吴晓求就“中国资本市场改革新征程”发表主题演讲。他表示，中国资本市场未来改革新征程的核心内容，主要体现在以注册制改革为先导的整个资本市场的系列制度变革。（界面新闻）,吴晓求：未来资本市场改革体现在注册制为先导的系列制度变革上
232,2020-08-08 10:23:21,【百家银行上半年成绩单出炉！超6成净利同比下滑 这家银行净利骤降80%】2020年上半年非上市银行业绩不容乐观。记者通过梳理100家中小银行上半年业绩数据发现，有61家银行净利润同比下滑，也就是说超6成银行净利同比下滑。7家银行总资产下降，还有7家银行资本充足率已跌破监管红线。（券商中国）,百家银行上半年成绩单出炉！超6成净利同比下滑 这家银行净利骤降80%
233,2020-08-08 10:20:35,【重磅信号！集成电路爆发超级利好 下周迎布局黄金期（附名单）】首当其冲的非科技股莫属！在减量博弈的市场环境下，要弥补“黑天鹅”带来的损失，操作上必须要选择弹性大的板块。而每当市场陷入低迷时，科技成长性题材往往最先发力！资金们毫不掩饰对于科技股的喜爱，实力演绎什么叫做打压的越深，反弹的越快！（券商中国）,重磅信号！集成电路爆发超级利好 下周迎布局黄金期（附名单）
234,2020-08-08 10:17:52,【踩到红线！窗口期违规买自家股票 招行时任行助被上交所点名“关注”】上市公司高管自掏腰包购买公司股票，一般是基于对公司的认可和未来发展的信心，向外界传递“看好”的信号，给投资者一份信心。(上海证券报),踩到红线！窗口期违规买自家股票 招行时任行助被上交所点名“关注”
235,2020-08-08 10:16:17,【高瓴联席首席投资官、合伙人易诺青：今天健康产业生机勃勃的景象就像当年信息产业爆发前夜】高瓴联席首席投资官、合伙人易诺青在高瓴全球健康产业峰会上表示，今天健康产业生机勃勃的景象，就像当年信息产业爆发前夜一样，上下游之间正在发生越来越强烈的耦合效应，通过产、学、研、医通力合作，构建一体化创新生态，将可能大大降低了整个行业的创新成本，缩短药物及医疗器械研发周期，创造巨大的增量价值。（e公司）,高瓴联席首席投资官、合伙人易诺青：今天健康产业生机勃勃的景象就像当年信息产业爆发前夜
236,2020-08-08 10:13:24,【严打财务造假！胜利精密因涉嫌信息披露违法违规被立案调查】8月7日晚间，胜利精密发布公告称，公司于当日收到证监会《调查通知书》，因公司涉嫌信息披露违法违规，根据证券法的有关规定，中国证监会决定对公司立案调查。公开资料显示，胜利精密2015年收购的苏州市智诚光学科技有限公司(以下简称智诚光学)存在财务造假行为，这或将导致胜利精密定期报告和临时性公告存在虚假记载。并购重组或将是导致公司此次涉嫌信息披露违法违规的导火索。(中国证券报),严打财务造假！胜利精密因涉嫌信息披露违法违规被立案调查
237,2020-08-08 10:11:31,【鞍钢集团声明：公司及所属子企业从未在江西地区销售或代理销售金融理财产品】鞍钢集团8日针对鞍钢龙江莱富龙吉安县分公司、吉安市井开区莱富龙金融信息服务有限公司在吉安市各地区以鞍钢全资子企业名义开展金融业务的行为发布声明称：鞍钢龙江莱富龙吉安县分公司及名称中带有“鞍钢龙江”字样的企业均与公司无任何股权关系。公司及所属子企业从未在江西地区销售或代理销售金融理财产品，任何单位以公司名义宣传销售金融理财产品，均属虚假宣传。（e公司）,鞍钢集团声明：公司及所属子企业从未在江西地区销售或代理销售金融理财产品
238,2020-08-08 09:53:49,【中国工程院副院长王辰：设立独立的国家医学健康科学基金是当务之急】中国工程院副院长、中国医学科学院北京协和医学院院校长、中国工程院院士王辰在高瓴全球健康产业峰会上表示，医学直接关乎国计民生，关乎健康福祉，关乎社会问题，所以设一个独立的国家的医学健康科学基金，这个是当务之急。（e公司）,中国工程院副院长王辰：设立独立的国家医学健康科学基金是当务之急
239,2020-08-08 09:36:27,【保代薪酬江湖揭秘：固定月薪6万 项目提成达千万 这个“豪”岗有多神奇？】券商保代--金融圈最神秘的一个群体，其神秘之处无疑是令常人难以想象的超高薪水。相比其他金融从业者，券商保代可谓是金领中的金领。(每日经济新闻),保代薪酬江湖揭秘：固定月薪6万 项目提成达千万 这个“豪”岗有多神奇？
240,2020-08-08 09:35:24,【销售渠道重构 格力电器“新零售”隐忧】8月6日晚间，格力电器公告，解聘望靖东财务负责人的职位，但望靖东依然担任公司董事、副总裁兼董秘。在外界看来，望靖东作为格力电器数得上号的高管，突然被调离财务负责人岗位，很难不与格力电器今年上半年业绩不佳联想到一起。(经济观察网),格力电器“新零售”隐忧！很多经销商不愿意跟着董明珠干了？
241,2020-08-08 09:34:55,【证监会“晒”稽查执法半年成绩单 行政处罚决定98份 罚没金额38.39亿元】证监会官网8月7日发布信息，通报了上半年的案件办理情况。数据显示，今年1至6月，证券期货市场新增各类案件165件，办结154件；证监会向公安机关移送涉嫌证券犯罪案件和线索共59件，作出行政处罚决定98份，罚没金额合计38.39亿元。（上海证券报）,证监会“晒”稽查执法半年成绩单 行政处罚决定98份 罚没金额38.39亿元
242,2020-08-08 09:19:51,【同程叫停“任我飞”幕后：OTA与航司相爱相杀】不限航空公司，不限次数，双份里程积分，同程旅行此前推出任我飞，将各类花式随心飞再次推向高潮。 不过产品宣布仅一天，8月1日就紧急叫停，随即遭遇网友大面积吐槽。 APP发布公告解释称，遭遇了难以解决的技术型问题不得不中止产品和相关活动。 叫停的主要原因是航空公司不愿意。（中国经营报）,同程叫停“任我飞”幕后：OTA与航司相爱相杀
