,datetime,content,title
747,2020-02-19 03:05:47,【美股走低】美股三大股指走低。截止发稿，道指跌超200点，跌幅为0.73%，标普500指数跌0.45%，纳指跌0.21%。苹果跌超2%，公司预计无法达到1月底发布的2020年一季度业绩指引。特斯拉一度涨超7%，摩根士丹利称最乐观情况下特斯拉股价将达1200美元。,美股三大股指走低苹果跌逾2% 钯金期货大涨超8%
748,2020-02-19 03:04:37,【COMEX 4月月黄金期货收涨17.20美元】COMEX 4月月黄金期货收涨17.20美元，涨幅1.10%，报1603.60美元/盎司，创2013年3月下旬以来收盘新高。,COMEX 4月月黄金期货收涨17.20美元
749,2020-02-19 02:54:06,【贷款市场报价利率20日大概率下调 定向降准或已不远】央行17日下调MLF(中期借贷便利)利率，这被业内一致解读是为20日LPR(贷款市场报价利率)的下调铺路。多家机构研报指出，2月20日LPR将大概率下调10个基点。届时，居民购房成本有望继续下降。同时，本月或再迎来一次定向降准。（中新经纬）,贷款市场报价利率20日大概率下调 定向降准或已不远
750,2020-02-19 02:48:44,【复工政策逐步松绑 多地上演抢人大战】一边是疫情防控，一边是企业复工复产，如何平衡两者成为眼下许多地方面临的难题。不过随着疫情得到有效控制，天平似乎已稍偏向复工复产那一方，杭州、宁波、广州白云区、深圳福田区等地发布的最新通知显示，企业只需备案，无需审核，即可复工。此外，为助力复工复产，吸引务工人员，多地推出系列“硬核”措施，如定制务工人员高铁专列，包大巴车甚至包飞机接工人返岗，给予新招工人生活补助等，上演“抢人式”复工。（证券时报）,复工政策逐步松绑 多地上演抢人大战
751,2020-02-19 02:30:36,【新三板挂牌企业定增积极 有效补充流动性】春节过后，新三板企业定增融资热情不减。《证券日报》记者根据东方财富choice统计发现，截至2月18日，2020年2月份新三板实施定增融资20次，融资金额22.21亿元；与2020年1月份达到的25.05亿元融资金额基本持平。业内人士表示，定增融资有助于补充挂牌公司发展所需流动资金，以优化企业财务结构，提升市场竞争力和盈利能力，助力企业在新冠肺炎疫情影响下顺利“复工复产”。（证券日报）,新三板挂牌企业定增积极 有效补充流动性
752,2020-02-19 02:15:37,【银行助企业复产“贷”出速度 260万元贷款6小时到账】为推动银行业保险业做好新冠肺炎疫情防控金融服务，日前，银保监会发布《中国银保监会办公厅关于进一步做好疫情防控金融服务的通知》(下称《通知》)，对近期重点工作事项作出强调，包括5方面12项举措。（证券日报）,银行助企业复产“贷”出速度 260万元贷款6小时到账
753,2020-02-19 02:00:37,【公募年内分红222亿元 同比大增126%】公募基金再次开启大手笔分红模式。随着A股市场持续反弹，众多权益基金的单位净值快速走高，固收基金一如既往、稳定地获取债市收益，基金单位净值走高后，众多基金陆续按照基金合同规定分红，今年以来截至2月18日，公募基金已累计分红222.15亿元，相比去年同期98.06亿元的分红总额，同比大增126.55%。（证券日报）,公募年内分红222亿元 同比大增126%
754,2020-02-19 01:45:48,【在线教育抗“疫”太火爆 服务器宕机打印机脱销】疫情下的在线教育异常火爆，超2亿学生集体上线，导致服务器时不时地撑不住闹崩溃。在家办公的一位老母亲，一面要辅导监督，一面要抢购打印机，直呼“被逼疯”。2月17日一大早，多地中小学迎来网络在线复课，学习通、腾讯课堂等在线课程App发生崩溃，这一状况迅速登上微博热搜。（证券日报）,在线教育抗“疫”太火爆 服务器宕机打印机脱销
755,2020-02-19 01:30:37,【IPO核发和再融资审批有序推进 0家公司申报或修订再融资方案】2月18日晚间，宁波银行、凯撒文化、数字政通等多家公司发布公告，对公司再融资方案进行修订。再融资新规落地后，上市公司开始密集申报和修订再融资方案，据《证券日报》记者不完全统计，截至2月18日发稿，再融资新规落地以来，已经有20家上市公司发布再融资预案或修订再融资预案。（证券日报）,IPO核发和再融资审批有序推进 0家公司申报或修订再融资方案
756,2020-02-19 01:15:36,【国资委：今年央企生产经营目标和改革任务不变】昨日，国务院应对新型冠状病毒感染肺炎疫情联防联控机制举行发布会。记者从会上了解到，此次抗击疫情期间，中央企业全面强化基础保障、高效建设专门医院、转产扩产医疗物资、充分运用高新技术等多方面支援抗疫。复产复工方面，国资委监管的中央企业所属的2万余户主要生产型子企业，目前开工率已经超过80%。（证券时报）,国资委：今年央企生产经营目标和改革任务不变
757,2020-02-19 01:00:16,【北京土地拍卖再现价格上限成交 这些房企积极竞拍】今天，北京土地市场迎来春节后第三拍。三宗地块分别位于通州区台湖镇、大兴区旧宫镇和采育镇，均为不限价纯商品住房地块，三宗宅地总起拍价65.56亿。此次竞拍可谓异常激烈，参与竞拍的企业数量井喷！有中海、旭辉、金地、保利、首开、龙湖、平安、雅居乐、招商、世茂、五矿、中交、绿城、石榴、住总、越秀、华发、卓越等20多家房地产企业参与。（中国证券报）,北京土地拍卖再现价格上限成交 这些房企积极竞拍
758,2020-02-19 00:47:37,【欧股三大股指全线走低】欧股三大股指全线走低，德国DAX指数收跌0.76%，法国CAC40指数跌0.48%，英国富时100指数跌0.69%。,欧股三大股指全线走低
759,2020-02-19 00:31:56,【现货黄金持续上行】现货黄金持续上行，现涨超1.5%，报1604.56美元/盎司；现货白银涨幅一度扩大至2.5%，报18.18美元/盎司。,现货黄金持续上行
760,2020-02-19 00:25:47,【美股走低】美东时间周二，美股三大股指走低。截止发稿，道指跌超200点，跌幅为0.86%，标普500指数跌0.65%，纳指跌0.41%。苹果跌超2%，公司预计无法达到1月底发布的2020年一季度业绩指引。特斯拉一度涨超7%，摩根士丹利称最乐观情况下特斯拉股价将达1200美元。中概股万达体育涨超35%，此前有消息称万达体育考虑出售铁人三项业务。,美股三大股指走低苹果跌逾2% 钯金期货大涨超7%
761,2020-02-19 00:19:10,【科技股还能领涨吗？这里有4大信号】2月17日，多只科技主题ETF成交额再度突破10亿元，半导体主题、5G主题等ETF位居周涨幅榜前列。同时，相关科技主题基金近日爆款频现，一大批增量资金有望快速入市，且两只云计算主题ETF也已申报！（上海证券报）,科技股还能领涨吗？这里有4大信号
762,2020-02-19 00:01:39,【拉网大排查19日交卷！王忠林：再发现一例居家确诊病人 拿区委书记区长是问】19日是武汉市拉网清底大排查的最后一天。王忠林表示，要在排查上持续加力，这是见底的措施，“不见底，打阻击战是不靠谱的”。底数摸清了，才能把握疫情防控的主动权。（长江日报）,拉网大排查19日交卷！王忠林：再发现一例居家确诊病人 拿区委书记区长是问
763,2020-02-18 23:58:20,【193家上市药企公布业绩 中药、化学制剂行业很艰难】截至2月18日，据统计，300余家医药上市企业中有193家发布了2019年度业绩预告。在这些已发布业绩预告的公司中，有24家企业首亏，按照当前预告的最大亏损值来看，誉衡药业预计亏损26亿元、通化金马预计亏损23.5亿元、亚太药业预计亏损21亿元、圣济堂预计亏损17亿元、吉药控股预计亏损15.05亿元、创新医疗预计亏损11亿元。而在4家预计持续亏损的企业中，恒康医疗预计亏损24亿元。（国际金融报）,193家上市药企公布业绩 中药、化学制剂行业很艰难
764,2020-02-18 23:41:02,【在岸人民币兑美元夜盘收跌167点】在岸人民币兑美元夜盘收报6.9980，较上一交易日夜盘跌167个基点。,在岸人民币兑美元夜盘收跌167点
765,2020-02-18 23:37:47,【美股走低】美东时间周二，美股三大股指走低。截止发稿，道指跌0.61%，标普500指数跌0.41%，纳指跌0.27%。苹果跌超2%，公司预计无法达到1月底发布的2020年一季度业绩指引。特斯拉一度涨超7%，摩根士丹利称最乐观情况下特斯拉股价将达1200美元。中概股万达体育大涨超20%，此前有消息称万达体育考虑出售铁人三项业务。,美股三大股指走低苹果跌逾2% 钯金期货大涨超7%
766,2020-02-18 23:28:39,【湖北已累计接收社会捐赠资金115.43亿元 医用防护服及口罩依旧急需】截至2月17日12时，湖北省已累计接收社会捐赠资金115.43亿元。其中，省本级56.50亿元，武汉市43.11亿元。湖北省累计接收社会捐赠物资6880.88万件（套、个、瓶）。其中，医用防护服68.88万套，N95口罩134.99万个，医用（外科）等口罩类2450.3万个，护目镜和防护面罩63.76万个，消杀防护类用品325.75万件（瓶）。 湖北省新冠肺炎疫情防控指挥部物资与市场保障组相关负责人表示，衷心感谢社会各界、爱心人士的倾情援助，因湖北省部分医疗防控物资仍然紧缺，恳请社会各界继续支援以下最急需的物资：医用防护服、医用外科口罩、医用防护口罩，医用护目镜、呼吸机、液压泵、心电监护仪、呼吸湿化治疗仪、空气消毒器等。（新华网）,湖北已累计接收社会捐赠资金115.43亿元 医用防护服及口罩依旧急需
767,2020-02-18 23:18:39,【国务院联防联控机制：加强新冠肺炎疫情期间严重精神障碍患者治疗管理工作】国务院联防联控机制综合组日前印发《关于加强新冠肺炎疫情期间严重精神障碍患者治疗管理工作的通知》。通知要求，精神卫生医疗机构要做好新冠肺炎疫情防控，防范院内感染，制定应对预案，储备防护物资；对发热或有疑似症状的严重精神障碍患者，乡镇(街道)要及时将其送往定点医院发热门诊就诊；做好居家严重精神障碍患者的管理治疗和社区照护，采取送药上门、网络诊疗等方式，保障患者居家治疗。（新华视点）,国务院联防联控机制：加强新冠肺炎疫情期间严重精神障碍患者治疗管理工作
768,2020-02-18 23:16:08,【国家卫健委：要全面加强患者救治 推进中医药临床应用】18日上午，国家卫生健康委主任马晓伟主持召开国家卫生健康委派驻武汉市工作组会议，研究部署疫情防控工作。会议要求，要根据形势变化有针对性地对下一步防控工作做出部署，对城乡社区、机关、学校等疫情防控提出更有针对性和操作性的技术方案，对“四早”各个环节具体措施进行实化细化，形成指导方案，充分体现中国特色传染病防治理论创新、实践创新成果。要深入开展流行病学调查，为评估疫情、探索防治规律打下基础。要进一步做好病例检测，突出抓好检测与临床救治的衔接。（健康报）,国家卫健委：要全面加强患者救治 推进中医药临床应用
769,2020-02-18 23:10:48,【NYMEX钯金期货上涨约7.5%】NYMEX钯金期货上涨约7.5%，刷新历史高位至2488.90美元/盎司。,NYMEX钯金期货上涨约7.5%
770,2020-02-18 23:10:47,【美股下跌】美东时间周二，美股三大股指下跌。截止发稿，道指跌0.30%，标普500指数跌0.19%，纳指跌0.13%。苹果跌超2%，公司预计无法达到1月底发布的2020年一季度业绩指引。特斯拉涨超7%，摩根士丹利称最乐观情况下特斯拉股价将达1200美元。中概股万达体育大涨超18%，此前有消息称万达体育考虑出售铁人三项业务。,美股三大股指下跌苹果跌逾2% 钯金期货大涨超7%
771,2020-02-18 23:02:20,【193家上市药企公布业绩 中药、化学制剂行业很艰难】截至2月18日，据统计，300余家医药上市企业中有193家发布了2019年度业绩预告。在这些已发布业绩预告的公司中，有24家企业首亏，按照当前预告的最大亏损值来看，誉衡药业预计亏损26亿元、通化金马预计亏损23.5亿元、亚太药业预计亏损21亿元、圣济堂预计亏损17亿元、吉药控股预计亏损15.05亿元、创新医疗预计亏损11亿元。而在4家预计持续亏损的企业中，恒康医疗预计亏损24亿元。（国际金融报）,193家上市药企公布业绩 中药、化学制剂行业很艰难
772,2020-02-18 23:01:47,【美股下跌】美东时间周二，美股三大股指下跌。截止发稿，道指跌0.30%，标普500指数跌0.19%，纳指跌0.13%。苹果跌超2%，公司预计无法达到1月底发布的2020年一季度业绩指引。特斯拉涨超7%，摩根士丹利称最乐观情况下特斯拉股价将达1200美元。中概股万达体育大涨超18%，此前有消息称万达体育考虑出售铁人三项业务。,美股三大股指下跌 苹果跌逾2%特斯拉逆市涨超7%
773,2020-02-18 22:45:32,【甘肃无新增新型冠状病毒肺炎确诊病例 累计91例】2月17日20时至2月18日20时，甘肃省无新增新型冠状病毒肺炎确诊病例。新增出院4例。（甘肃卫健委）,甘肃无新增新型冠状病毒肺炎确诊病例 累计91例
774,2020-02-18 22:31:11,【日本国内累计确诊616例 钻石公主号542例】2月18日，除了“钻石公主号”邮轮新确诊88例新冠肺炎患者之外，和歌山县、东京都、爱知县、神奈川县等日本多地新确诊8例新冠肺炎病例。截至当地时间2月18日晚上11点，日本国内累计确诊新冠肺炎患者616例。在616例中，“钻石公主号”邮轮上共确诊542例，在日本国内的日本人和中国游客等共61例，从武汉乘坐包机返回者13例。（人民日报）,日本国内累计确诊616例 钻石公主号542例
775,2020-02-18 22:30:47,【美股低开】美东时间周二，美股三大股指低开。截止发稿，道指跌0.44%，标普500指数跌0.35%，纳指跌0.3%。苹果跌超2%，公司预计无法达到1月底发布的2020年一季度业绩指引。特斯拉涨5%，摩根士丹利称最乐观情况下特斯拉股价将达1200美元。,美股三大股指低开 苹果跌逾2%特斯拉逆市涨超5%
776,2020-02-18 22:27:57,【南京：有序恢复楼盘销售、房产中介服务和不动产登记】南京市发布通告指出，扩大公共服务，逐步恢复跨省、跨市道路客运，加大市内公共交通运力。有序恢复楼盘销售、房产中介服务和不动产登记。游园绿地、公园广场、室外文化体育设施等公共空间恢复开放，室外旅游景点在控制人流密度的基础上逐步开放。（一财）,南京：有序恢复楼盘销售、房产中介服务和不动产登记
777,2020-02-18 22:23:54,【南京：实行分区防控 优化疫情防控措施加快复工达产】南京市发布关于优化疫情防控措施加快复工达产的通告。通告指出，实行分区防控。保持“一级响应”总体不变，实行分区分级精准防控。对人员密集、流动性大的玄武、秦淮、建邺、鼓楼等主城区，坚持疫情防控优先，安全有序积极推进复工达产；栖霞、雨花台、江宁、浦口、六合、溧水、高淳以及江北新区等城乡融合板块，在安全可控前提下，全力推进复工达产和面上工作。（一财）,南京：实行分区防控 优化疫情防控措施加快复工达产
778,2020-02-18 22:20:45,【郑州：明起每天下午2点 网上预约10万只口罩】自2月19日起郑州市陆续组织民用口罩货源投放市场。此次投放的口罩为一次性民用口罩，近期将每天投放10万只，每只单价0.8元。采取线上预约、线下指定药店有序购买的方式投放。每人一次限购1份（5只），每店限100份（500只），当日投放量约满即止。（郑州发布）,郑州：明起每天下午2点 网上预约10万只口罩
779,2020-02-18 22:18:20,【鄂州市委组织部：提名免去王时文同志市卫健委主任职务】鄂州市委组织部发布有关领导干部职务任免：提名免去王时文同志市卫健委主任职务，原任市公立医院管理中心主任职务因机构更名自行免除；提名万福尧同志任市卫健委主任，免去其市中心医院党委书记职务。（湖北日报）,鄂州市委组织部：提名免去王时文同志市卫健委主任职务
780,2020-02-18 22:13:20,【云南省自2月21日起将有序恢复省际客运班线】2月18日，云南省新冠肺炎疫情防控工作新闻发布会上，云南省交通运输厅党组成员、副厅长陆雪松介绍，预计云南省在2月中旬至3月上中旬将出现农民工返岗和学生返校客流高峰。自2月14日起，有序恢复市际、县际班线和客运站场的运营。自2月21日起，除目的地为湖北或途经湖北以及800公里以上的省际客运班线外，有序恢复省际客运班线。民航、铁路运输根据旅客流量适时增加运力，水路运输根据客流需要及时恢复运输。（一财）,云南省自2月21日起将有序恢复省际客运班线
781,2020-02-18 22:08:33,【巴基斯坦成功试射“雷电-2”型巡航导弹】巴基斯坦三军新闻局18日发表声明说，巴军方当天成功试射了“雷电-2”型空基巡航导弹。（新华社）,巴基斯坦成功试射“雷电-2”型巡航导弹
782,2020-02-18 22:08:05,【2019年2767家网站被约谈 暂停更新网站384家】2019年全国网信系统依法约谈网站2767家，警告网站2174家，暂停更新网站384家。（网信中国）,2019年2767家网站被约谈 暂停更新网站384家
783,2020-02-18 22:03:51,【现货白银重回18美元/盎司】现货白银重回18美元/盎司，刷新两周高位，日内涨1.2%。,现货白银重回18美元/盎司
784,2020-02-18 21:58:12,【中国信保：优先处理受疫情影响出口企业出险理赔】记者18日了解到，中国出口信用保险公司开辟理赔服务绿色通道，优先处理受疫情影响出口企业的出险理赔，简化程序，在贸易真实情况下，适当放宽理赔条件。（新华社）,中国信保：优先处理受疫情影响出口企业出险理赔
785,2020-02-18 21:48:40,【浙江：19日0时起自驾返浙或途经车辆均需“入浙通行申报”】为缓解防疫检查与高速公路通行矛盾，使各检查点防疫查控更具有针对性，浙江高速交警将于2月19日0时起正式启用“健康出行申报”复核系统。据了解，自驾返浙或途经车辆在持有浙江各城市健康绿码外，还需“健康出行申报”。成功申领浙江健康码绿码且完成“健康码出行申报”的司乘人员，进入浙江省内的各高速公路防疫检查点后，只需出示含出行信息的健康绿码，完成体温检测后，即可通过专门通道驶离，过程仅需15秒左右。（澎湃新闻）,浙江：19日0时起自驾返浙或途经车辆均需“入浙通行申报”
786,2020-02-18 21:48:35,【北大方正被银行申请重整 或为引入新股东铺路】2月18日，“债市网红”北大方正集团有限公司(简称北大方正)公告称，公司收到北京市第一中级人民法院送达的通知，北京银行以公司未能清偿到期债务，且明显不具备清偿能力，但具有重整价值为由，申请法院对发行人进行重整。（21世纪）,北大方正被银行申请重整 或为引入新股东铺路
787,2020-02-18 21:45:03,【东方银星：拟定增募资不超4.22亿元】东方银星(600753)2月18日晚披露非公开发行股票预案，拟向控股股东中庚集团、何珠兴、林聪等3名投资者定向发行合计不超3840万股，即不超过此次非公开发行前公司总股本的30%，发行价格为11元/股，募资总额不超过42240万元，扣除发行费用后全部用于补充流动资金。（证券时报）,东方银星：拟定增募资不超4.22亿元
788,2020-02-18 21:43:34,【行情】现货黄金重回1590美元/盎司上方，为2月3日来首次，日内涨0.6%，现货白银涨近1%。,现货黄金重回1590美元/盎司上方
789,2020-02-18 21:37:39,【国家电网全年投资规模或超预期 行业景气度持续】自1月17日国网公司宣布重大人事调整以来，新任董事长毛伟明在这家全球最大的公用事业企业履新已超过1个月。熟悉国网系统的人士表示，公司主要负责人变动等信号预示着今年电网投资规模将比去年底释放的信号要积极乐观。国金证券认为，国网公司要求加强农网、保民生建设，推动待核准、在建特高压工程核准、建设加快，有望使得全年电网投资增长超预期。国电南瑞、平高电气等均在国网招标中份额居前。（上证资讯）,国家电网全年投资规模或超预期 行业景气度持续
790,2020-02-18 21:37:00,【国家卫健委：323名严重精神障碍患者确诊新冠肺炎】刚刚，国家卫健委发布了《关于加强新冠肺炎疫情期间严重精神障碍患者治疗管理工作的通知》及解读，其中明确要求，对在封闭管理区居住的患者，要采取送药上门、网络诊疗等方式，保障患者居家治疗。（北京日报）,国家卫健委：323名严重精神障碍患者确诊新冠肺炎
791,2020-02-18 21:32:06,【日本10名记者被隔离观察 其中一人常出入首相官邸】2月16日，日本东京一商务车司机被确诊感染新冠肺炎，而该司机在目前判断的被感染日之后，连同其车辆曾被日本共同社雇佣过4天。目前，其接送的10名记者已被隔离观察。其中一女记者主要负责报道首相安倍晋三相关新闻，几乎每天出入首相官邸。（央视新闻）,日本10名记者被隔离观察 其中一人常出入首相官邸
792,2020-02-18 21:27:15,【秀强股份：特斯拉不是公司充电桩玻璃产品直接客户】近11个交易日连续涨停的秀强股份(300160)，2月18日晚间回复深交所问询函称，特斯拉不是公司充电桩玻璃产品的直接客户，公司充电桩玻璃产品的订单由特斯拉指定厂家下达，该厂家做成合格成品后供应给特斯拉。公司目前尚未完成特斯拉太阳能屋顶玻璃的工程认证，能否接到特斯拉太阳能屋顶订单尚存在不确定性，公司太阳能屋顶玻璃产品的客户仅有特斯拉一家。公司主营业务不涉及在线教育业务。（证券时报）,秀强股份：特斯拉不是公司充电桩玻璃产品直接客户
793,2020-02-18 21:22:45,【北京：疫情防控期间政务服务网上可办率达到97%以上】疫情防控期间，北京市持续推进政务服务事项网上办理，相继推出“中小微企业占道费减免”等多项先前未开通网上办理的事项。依据“申请6类+公共服务”进行统计，市区两级政务服务事项网上可办率达到97%以上，与去年同期相比，网上办理实办率提升38%，有效减少了实体大厅人员聚集。（新华社）,北京：疫情防控期间政务服务网上可办率达到97%以上
794,2020-02-18 21:16:20,【美团在京用无人车送菜：首次在公开道路进行实际订单配送】2月18日，记者从美团了解到，美团近日启用无人配送车，为北京市顺义区多个社区居民配送果蔬食品。美团介绍，美团自研的无人配送车辆已经在顺义部分社区进行落地，联合美团买菜顺义站点，面向距离较远的社区进行配送。（澎湃新闻）,美团在京用无人车送菜：首次在公开道路进行实际订单配送
795,2020-02-18 21:15:37,【河北：支持医疗物资重点保障企业复工复产】河北省财政厅18日透露，近日，河北省财政厅立足财政职能，细化出台11项具体措施，支持全省医疗物资重点保障企业复工复产，保障疫情防控所需医疗物资供应。（中新网）,河北：支持医疗物资重点保障企业复工复产
796,2020-02-18 21:13:46,【中基协发布《私募基金行业奋战疫情倡议书》】2月18日晚间，中国证券投资基金业协会发布《私募基金行业奋战疫情倡议书》。倡议立足抗疫攻坚，为抗疫类企业提供资金支持和技术支撑；立足经济民生，做好支持被投企业复产复工的生力军；立足长远发展，提升资本形成能力，助力疫情防控与创新发展的双重胜利。（e公司）,中基协发布《私募基金行业奋战疫情倡议书》
797,2020-02-18 21:12:52,【文化和旅游部推在线服务支持企业发展】记者18日从文化和旅游部获悉，文化和旅游部近日在部官网上增设“应对疫情支持企业发展政策措施”专题，及时发布文旅系统防控疫情的重要政策，提供在线服务支持文旅企业发展。（新华社）,文化和旅游部推在线服务支持企业发展
