,datetime,content,title
497,2020-08-17 18:38:46,【6月末上海主要中外资商业银行支持临港新片区建设贷款余额为947亿元】中国(上海)自由贸易试验区临港新片区成立已近一年。截至2020年6月末，上海主要中外资商业银行支持临港新片区建设贷款余额947亿元。（中证网）,6月末上海主要中外资商业银行支持临港新片区建设贷款余额为947亿元
498,2020-08-17 18:35:26,【传闻】消息称华大集团考虑让设备子公司在上海进行规模10亿美元的IPO。（界面新闻）,消息称华大集团考虑让设备子公司在上海进行规模10亿美元的IPO
499,2020-08-17 18:34:48,【财富趋势：上半年净利同比增33% 拟10派6元】财富趋势(688318)8月17日晚披露半年报，上半年，公司营收为9068万元，同比增长29.71%；净利为6837万元，同比增长32.97%。公司拟每10股派现6元(含税)。基本每股收益1.23元。（e公司）,财富趋势：上半年净利同比增33% 拟10派6元
500,2020-08-17 18:31:05,【农业农村部：猪价继续大幅上涨的可能性不大】农业农村部相关负责人表示：“总的来说，近期猪肉价格涨势开始减弱。综合考虑生猪生产逐步恢复和猪肉消费需求释放等因素，预计三季度猪肉仍将呈现供应偏紧、价格高位震荡的局面，随着上市肥猪量的持续增加，四季度供需关系将进一步缓和，价格再继续大幅上涨的可能性不大。”（证券时报网）,农业农村部：猪价继续大幅上涨的可能性不大
501,2020-08-17 18:30:23,【至正股份：筹划重大资产出售】至正股份(603991)8月17日晚公告，公司正在筹划重大资产出售事项，拟将公司经营状况欠佳的业务以及其所有相关资产及负债注入新设的全资子公司，并拟通过协议转让方式出售标的公司100%的股权给至正集团，构成关联交易。其中，拟出售资产为光通信线缆、光缆用特种环保聚烯烃高分子材料及电网系统电力电缆用特种绝缘高分子材料业务及所有相关资产、负债。（e公司）,至正股份：筹划重大资产出售
502,2020-08-17 18:26:01,【北京公布四起“黑中介”案：暴力威胁、敲诈勒索房客被判刑】8月17日，北京市住房和城乡建设委员会官方公众号“安居北京”发布4起已查处“黑中介”典型案例。北京市住房城乡建设委表示，将始终保持执法高压态势，常态化开展住房租赁中介机构乱象整改，严厉惩处住房租赁中介机构违法违规行为，规范住房租赁市场秩序，营造良好租赁市场环境。（澎湃新闻）,北京公布四起“黑中介”案：暴力威胁、敲诈勒索房客被判刑
503,2020-08-17 18:25:20,【农业农村部：7月份生猪存栏首次实现同比增长】7月份全国生猪生产继续较快恢复，能繁母猪存栏稳定增加，生猪存栏开始同比增长。农业农村部畜牧兽医局相关负责人表示，按照生猪生产的周期性规律，产能恢复过程首先是能繁母猪存栏恢复增长，之后是生猪存栏恢复增长，然后是出栏恢复增长。生猪存栏同比增长，预示着5-6个月后生猪出栏量也将实现同比增长，将从根本上扭转市场供应偏紧的局面。（农业农村部网站）,农业农村部：7月份生猪存栏首次实现同比增长
504,2020-08-17 18:18:58,【天孚通信：上半年净利同比增63%】天孚通信(300394)8月17日晚披露半年报，上半年，公司实现营业收入3.93亿元，同比增长57.75%；净利润1.26亿元，同比增长63.25%；基本每股收益0.638元。净利润增长一方面由于全球5G网络和数据中心建设加速带动公司多个产品线增量提效，提升了盈利能力；二是公司自4月完成对苏州天孚精密光学有限公司74.5%股权收购，并自5月纳入合并报表范围，对上半年净利润带来正向影响。（e公司）,天孚通信：上半年净利同比增63%
505,2020-08-17 18:17:20,【林园：此轮牛市或可持续5年 每个板块都有机会】深圳市林园投资公司董事长林园在接受采访时表示，当前就是牛市，中美关系等因素都改变不了牛市的趋势。牛市的操作不是追高，而是持股待涨，而且每个板块都有机会。（证券市场红周刊）,林园：此轮牛市或可持续5年 每个板块都有机会
506,2020-08-17 18:14:06,【深圳率先完成这件大事！一批上市公司应声涨停】8月17日，深圳市市长陈如桂在“点亮深圳，5G智慧之城”发布会上宣布，深圳市提前超额完成“建设4.5万个5G基站”的目标，已实现5G独立组网全覆盖。截至8月14日，深圳已建成46480个5G基站。受此消息提振，今日盘面上5G相关概念股表现抢眼，多只个股涨停。（上海证券报）,深圳率先完成这件大事！一批上市公司应声涨停
507,2020-08-17 18:13:23,【中嘉博创：上半年净利润同比下降84.63%】中嘉博创（000889）8月17日晚间发布2020年半年报，公司上半年实现营业收入11.2亿元，同比下降31.01%；实现归属于上市公司股东的净利润1284.78万元，同比下降84.63%；基本每股收益0.02元。（中证网）,中嘉博创：上半年净利润同比下降84.63%
508,2020-08-17 18:12:27,【玉禾田：上半年净利润同比增长156.26%】玉禾田（300815）8月17日晚间发布2020年半年报，公司上半年实现营业收入20.57亿元，同比增长20.75%；实现归属于上市公司股东的净利润3.48亿元，同比增长156.26%；基本每股收益2.62元。（中证网）,玉禾田：上半年净利润同比增长156.26%
509,2020-08-17 18:11:00,【上清所：未收到“17康美MTN002”付息资金】上清所8月17日消息，8月17日是康美药业股份有限公司2017年度第二期中期票据(代码：101754083，简称：17康美MTN002)的付息日。截至今日日终仍未收到康美药业股份有限公司支付的付息资金，暂无法代理发行人进行本期债券的付息工作。（e公司）,上清所：未收到“17康美MTN002”付息资金
510,2020-08-17 18:09:26,【天准科技：实控人提议公司回购8750万元至1.75亿元股份】天准科技(688003)8月17日晚公告，公司董事长、实际控制人徐一华提议公司回购股份，回购资金总额不低于8750万元，不超过1.75亿元，回购价格不超过35元/股，回购股份用于员工持股计划或股权激励。（e公司）,天准科技：实控人提议公司回购8750万元至1.75亿元股份
511,2020-08-17 18:05:22,【暗藏机会！淡水泉、高毅、盘京都盯上这一赛道 冯柳花5个亿买入这只个股】随着上市公司半年报陆续披露，百亿级私募的最新持股情况逐渐曝光。值得注意的是，百亿级私募二季度对化工行业兴趣提升。（上海证券报）,暗藏机会！淡水泉、高毅、盘京都盯上这一赛道 冯柳花5个亿买入这只个股
512,2020-08-17 18:04:38,【斗鱼组建委员会评估腾讯的提议】斗鱼组建委员会，评估腾讯的提议，斗鱼表示董事会尚未就腾讯的提议做出决定。（界面新闻）,斗鱼组建委员会评估腾讯的提议
513,2020-08-17 18:02:30,【京东方航空显示屏登陆空客A350驾驶舱】近日，中国南方航空公司6架A350飞机全面进行电子飞行包触摸屏软硬件升级。据悉，采用全新驾驶舱触摸显示屏的A350飞机是由空客与法国泰雷兹公司针对驾驶舱进行的创新。作为法国泰雷兹公司的重要战略合作伙伴，BOE（京东方）为A350新型民航驾驶舱提供了航空显示解决方案。（第一财经）,京东方航空显示屏登陆空客A350驾驶舱
514,2020-08-17 18:00:19,【斯迪克：上半年净利润同比增长141.53%】斯迪克（300806）8月17日晚间发布2020年半年报，公司上半年实现营业收入6.77亿元，同比增长1.33%；实现归属于上市公司股东的净利润5162.38万元，同比增长141.53%；基本每股收益0.44元。（中证网）,斯迪克：上半年净利润同比增长141.53%
515,2020-08-17 17:59:01,【首家欧洲航司！8月20日起法航恢复北京航线客运服务】8月17日，新京报记者从法国航空获悉，自8月20日起，法航将恢复中国大陆北京航线的客运航班服务，在巴黎戴高乐机场与天津/北京之间每周运营1个客运航班。自此，法航将在中国大陆航线上每周共执飞3个客运航班，其中包含上海航线上的2个客运航班。自今日起，该航班可通过法航官网预订。（新京报）,首家欧洲航司！8月20日起法航恢复北京航线客运服务
516,2020-08-17 17:57:35,【公牛集团：上半年净利同比下降24.62%】公牛集团(603195)8月17日晚披露半年报，上半年，公司营收为41.09亿元，同比下降17.35%；净利为8.04亿元，同比下降24.62%。公司第二季度实现营业收入27.29亿元，环比第一季度增长97.78%，较上年同期下降0.67%，实现净利6.33亿元，环比第一季度增长271.67%，较上年同期下降4.55%。（e公司）,公牛集团：上半年净利同比下降24.62%
517,2020-08-17 17:57:00,大金融爆发，非银狂涨4.68%，中国人寿两日涨停！3400点归来，这些个股被扎堆调研，最高已涨37%。,大金融爆发 中国人寿两日涨停！3400点归来 这些个股被扎堆调研
518,2020-08-17 17:55:29,【汇金股份：现有主营业务中并未涉及数字货币相关内容】汇金股份(300368)8月17日晚间披露股票交易风险提示公告，表示近期投资者和市场比较关注数字货币热点，市场上出现“汇金股份作为数字货币概念股”等传言，截至目前，公司主营业务主要分为智能制造业务、信息化综合解决方案与技术服务业务及供应链业务，公司现有主营业务中并未涉及数字货币相关内容，公司未参与中国人民银行的数字货币系统建设，公司也无相关业务收入。（e公司）,汇金股份：现有主营业务中并未涉及数字货币相关内容
519,2020-08-17 17:53:31,【曲美家居：实控人拟减持不超2%股份】曲美家居(603818)8月17日晚公告，公司控股股东及实控人赵瑞海和赵瑞宾，计划以集中竞价方式合计减持不超1166万股，不超过公司总股本的2%。（e公司）,曲美家居：实控人拟减持不超2%股份
520,2020-08-17 17:50:44,【振德医疗：上半年净利同比增长1545%】振德医疗(603301)8月17日晚披露半年报，上半年，公司营收为38.2亿元，同比增长401%；净利为9.89亿元，同比增长1545%。基本每股收益5.04元。业绩增长主要原因系报告期受疫情影响公司防疫类防护产品销售大幅增加、上年收购英国Rocialle Healthcare Limited 公司55%股权纳入公司合并报表范围及公司剔除防疫类防护用品外的业务收入增长共同影响所致。（e公司）,振德医疗：上半年净利同比增长1545%
521,2020-08-17 17:49:37,【新加坡延长四至七个月的补贴期限】新加坡副总理兼经济政策统筹部长及财政部长王瑞杰今天(17日)发表部长声明，阐述政府在下一阶段的抗疫纾困措施。王瑞杰宣布为持续支持就业，政府决定延长雇用补贴计划四到七个月，但各行业将按复苏情况获得不同程度的援助。（央视新闻客户端）,新加坡延长四至七个月的补贴期限
522,2020-08-17 17:48:10,【长盈精密：前三季度净利同比预增106.78%—117.41%】长盈精密(300115)8月17日晚间公告，前三季度预计盈利3.89亿元至4.09亿元，同比增长106.78%—117.41%。（e公司）,长盈精密：前三季度净利同比预增106.78%—117.41%
523,2020-08-17 17:47:16,【羚锐制药上半年营收同比基本持平 贴膏剂、胶囊剂占比近九成】8月17日，羚锐制药发布半年报，上半年羚锐制药实现营收11.75亿元，同比增长0.50%；归属于上市股东的净利润为1.77亿元，同比下降3.35%。从产品层面来看，贴膏剂、胶囊剂成为营收主要来源，上半年分别实现营收7.13亿元、3.10亿元，分别占报告期营收的60.68%、26.38%，两者贡献近九成营收。（新京报）,羚锐制药上半年营收同比基本持平 贴膏剂、胶囊剂占比近九成
524,2020-08-17 17:40:19,【晶丰明源：上半年净利同比降77%】晶丰明源(688368)8月17日晚披露半年报，上半年，公司实现营业收入3.84亿元，同比下降6.52%；净利润943.71万元，同比下降77.29%；基本每股收益0.15元。公司于报告期内推出2020年限制性股票激励计划，上半年内共产生股份支付费用3899.94万元，剔除股份支付影响，上半年度归属于上市公司股东的净利润为4453.66 万元，同比增长7.20%。（e公司）,晶丰明源：上半年净利同比降77%
525,2020-08-17 17:39:38,【行情】美股道指期货和标普500指数期货涨0.3%，纳指期货涨0.6%。,美股道指期货和标普500指数期货涨0.3% 纳指期货涨0.6%
526,2020-08-17 17:38:51,"【南微医学半年报：上半年净利润1.14亿元 同比减少24.19%】南微医学发布2020年半年度报告，公司实现营业收入5.7亿元，同比减少7.64%；实现归属于母公司股东的净利润1.14亿元，同比减少24.19%。2020年上半年，因新冠疫情原因,国内外医院正常医疗活动受到影响，内镜门诊和治疗人数同比下降，相关手术器械、耗材用量下滑。（第一财经）",南微医学半年报：上半年净利润1.14亿元 同比减少24.19%
527,2020-08-17 17:37:39,【雷军直播带货首秀创抖音直播带货双纪录】据小米公司官微，雷军直播带货首秀销售金额2.1亿，累计观看人数5053万，创抖音直播带货双纪录。（第一财经）,雷军直播带货首秀创抖音直播带货双纪录
528,2020-08-17 17:36:05,【浙江将公积金贷款逾期信息纳入信用评价指标】浙江省发展改革委17日公布了新编制的《浙江省五类主体公共信用评价指引(2020版)》和《浙江省公共信用信息目录(2020版)》，将公积金贷款逾期信息纳入自然人公共信用评价指标。（新华网）,浙江将公积金贷款逾期信息纳入信用评价指标
529,2020-08-17 17:34:36,【深圳机场：7月份货邮吞吐量同比增15%】深圳机场(000089)8月17日晚间公告，7月份，旅客吞吐量378.17万人次，同比减少15.57%；货邮吞吐量12.25万吨，同比增长15.28%，其中国际航线4.61万吨，同比增47.06%。（证券时报网）,深圳机场：7月份货邮吞吐量同比增15%
530,2020-08-17 17:33:21,【报告：预计到2025年中国城镇化率达65.5%】中国社会科学院农村发展研究所、中国社会科学出版社17日联合发布的《中国农村发展报告2020》(以下简称“报告”)预计，到2025年中国城镇化率将达65.5%，新增农村转移人口8000万人以上。（中国新闻网）,报告：预计到2025年中国城镇化率达65.5%
531,2020-08-17 17:32:01,【秦安股份业绩预告：上半年净利润预计为2.45亿元到2.55亿元 期货平仓净收益2.54亿元】秦安股份公告，公司预计2020年半年度实现归属于上市公司股东的净利润为2.45亿元到2.55亿元。扣除非经常性损益事项后，公司2020年半年度净利润预计为100万元到150万元。非经常性损益增加主要由于本期期货平仓及浮动收益扣除手续费后的净收益2.54亿元，卖出对公黄金积存收益936万元以及本期收到政府补贴增加3131万元所致。（e公司）,秦安股份业绩预告：上半年期货平仓净收益2.54亿元
532,2020-08-17 17:30:43,【数据】北向资金今日净流入79.1亿元，今日净买入平安银行9.73亿元、京东方9.22亿元，净卖出伊利股份3.67亿元。,北向资金今日净流入79.1亿元 净买入平安银行9.73亿元、京东方9.22亿元
533,2020-08-17 17:28:38,【秦安股份：预计上半年净利2.45亿元-2.55亿元】秦安股份晚间公告，预计2020年半年度实现归属于上市公司股东的净利润与上年同期相比，将实现扭亏为盈，预计2020年半年度归属于上市公司股东的净利润为2.45亿元-2.55亿元。本期期货平仓及浮动收益扣除手续费后的净收益为2.54亿元。（第一财经）,秦安股份：预计上半年净利2.45亿元-2.55亿元
534,2020-08-17 17:26:33,【2只创业板战配基金今日发售 未见首日售罄 释放什么信号？基金经理：看好科技股长期成长机会】8月17日，又有两只创业板战略配售基金发售，分别是博时创业板两年定开混合基金和华安创业板两年定开混合基金。截止至发稿，两只产品均未售罄，仍将继续募集。（券商中国）,2只创业板战配基金今日发售 未见首日售罄 释放什么信号？基金经理：看好科技股长期成长机会
535,2020-08-17 17:25:51,7·1一幕再现！A股爆涨1.6万亿，金融再扛大旗！7000亿引爆？五大事件驱动市场走强，蓝筹行情能否持续？,7·1一幕再现！A股爆涨1.6万亿 五大事件驱动市场走强 蓝筹行情能否持续？
536,2020-08-17 17:25:10,【中色股份：与东方锆业战略合作】中色股份8月17日晚间公告，公司与东方锆业签署了《战略合作协议》，双方同意在全球锆资源开发和工程建设领域，包括项目调研、设计、建设、运营维护、产品销售等各阶段进行全面深入合作。同时，双方将利用各自的项目信息获取和项目评价管理体系，共同寻求国内、澳洲乃更广阔地区的商业机会，分享项目信息和技术经济资料，共同筛选项目资源，联合开展项目规划和论证，共同开发。（第一财经）,中色股份：与东方锆业战略合作
537,2020-08-17 17:24:27,【康达新材：上半年净利同比增约七成】康达新材(002669)8月17日晚披露半年报，上半年，公司实现营业收入6.95亿元，同比增长61.45%；净利润9939.82万元，同比增长69.43%；基本每股收益0.394元。（e公司）,康达新材：上半年净利同比增约七成
538,2020-08-17 17:23:41,【信雅达：子公司天明环保的地块将被收储动迁】信雅达(600571)8月17日晚公告，公司控股子公司天明环保于近日收到杭州钱塘新区城市有机更新指挥部办公室下发的《通知书》，拟向天明环保支付14981万元，用于对天明环保拥有的白杨街道11号（南）大街160号房产实施收储动迁，以及补偿天明环保因此次收储动迁产生的搬迁费、停产停业损失费等费用。本次收储动迁预计对公司的净利润影响金额在7000万到8000万之间。（e公司）,信雅达：子公司天明环保的地块将被收储动迁
539,2020-08-17 17:21:47,【周鸿祎：有软件会打开麦克风偷偷录音 厂商应尊重用户知情权】8月15日，在聚焦网络安全的对谈节目《ISC夜谈》上，360集团董事长兼CEO周鸿祎谈到个人隐私泄露的话题时表示，应该关注互联网厂商搜集和使用用户数据的方式是否正当。（澎湃新闻）,周鸿祎：有软件会打开麦克风偷偷录音 厂商应尊重用户知情权
540,2020-08-17 17:19:24,【诺安基金：A股步入增量资金驱动模式 将震荡上行】8月17日，诺安基金发布权益观点指出，当前市场流动性依然充裕，A股已经步入了增量资金驱动模式，震荡后上涨的行情理会渐趋渐进。（中证网）,诺安基金：A股步入增量资金驱动模式 将震荡上行
541,2020-08-17 17:18:18,【博瑞医药：上半年实现净利润7372.26万元 同比增长78%】博瑞医药公告，公司上半年实现净利润7372.26万元，同比增长78%。（第一财经）,博瑞医药：上半年实现净利润7372.26万元 同比增长78%
542,2020-08-17 17:16:32,【招商基金：A股料震荡上行 关注安全边际相对较高的周期行业】8月17日盘后，招商基金发布市场观点指出，17日市场大涨，主要原因是随着全球疫情形势好转，投资者对于经济恢复的信心强化，场外资金持续流入估值较低的顺周期板块，预计市场会震荡上行，可关注安全边际相对较高的周期行业。（中证网）,招商基金：A股料震荡上行 关注安全边际相对较高的周期行业
543,2020-08-17 17:14:48,【美力科技：持股4.0264%股东拟最高减持不超4%】美力科技公告，持股4.0264%的股东王光明拟自本减持计划公告之日起3个交易日后的6个月内，减持公司股份。如通过集中竞价方式减持的，减持股数不超过公司总股本的2%；如通过大宗交易方式减持的，减持股数不超过公司总股本的4%。（第一财经）,美力科技：持股4.0264%股东拟最高减持不超4%
544,2020-08-17 17:13:10,【安青松：证券行业积极履行社会责任 为脱贫攻坚注入金融力量】中国证券业协会党委书记、执行副会长安青松指出，督促证券行业履行社会责任，是《证券法》赋予中国证券业协会的重要职责。近年来，在证监会指导下，协会贯彻落实党中央、国务院关于脱贫攻坚的决策部署，推动、组织证券行业履行社会责任，发挥投资银行专业优势，积极投入脱贫攻坚工作，为脱贫攻坚注入金融力量。（中证网）,安青松：证券行业积极履行社会责任 为脱贫攻坚注入金融力量
545,2020-08-17 17:11:17,【比亚迪半导体推出国内首款高集成、三合一锁控MCU】据比亚迪半导体，公司历时一年半，成功研发出国内首款集成触摸、RFID智能锁主控MCU——BF5823AM48。（e公司）,比亚迪半导体推出国内首款高集成、三合一锁控MCU
546,2020-08-17 17:09:09,【东百集团：控股股东拟发行不超5亿元可交换公司债券】东百集团(600693)8月17日晚公告，公司控股股东丰琪投资拟以其所持有的部分公司股票为标的，非公开发行可交换公司债券。本次可交换债券拟发行期限不超过3年，拟发行规模不超过5亿元。（e公司）,东百集团：控股股东拟发行不超5亿元可交换公司债券
547,2020-08-17 17:08:27,【高乐股份：花木兰盲盒产品系列前期工作已准备好 将及时向市场推出】高乐股份(002348)8月17日在互动平台上表示，公司的花木兰盲盒产品系列前期工作已准备好，公司将根据花木兰电影的具体放映情况和计划及时向市场推出。（e公司）,高乐股份：花木兰盲盒产品系列前期工作已准备好 将及时向市场推出
548,2020-08-17 17:07:47,【凯莱英：非公开发行股票获得中国证监会发审会审核通过】凯莱英(002821)8月17日晚间公告，公司非公开发行股票申请获得证监会发行审核委员会审核通过。（e公司）,凯莱英：非公开发行股票获得中国证监会发审会审核通过
549,2020-08-17 17:07:38,【“惠游湖北”启动第二周 326万人次游荆楚】“与爱同行惠游湖北”活动自8月8日启动，湖北全省近400家A级旅游景区今年内对全国游客免门票。统计数据显示，活动进入第二周，全省已接待游客逾326万人次，组团游、跨省游数量显著增长。（新华网）,“惠游湖北”启动第二周 326万人次游荆楚
550,2020-08-17 17:05:14,【比亚迪回应宁波e5被烧燃事件：可能人为纵火导致】比亚迪发布关于宁波e5被烧燃的事件说明：初步判断此事件不是车辆引起，很可能是有人沿着墙边隐蔽处进行纵火导致。具体原因，有待警方进一步调查，我们也将持续关注。（第一财经）,比亚迪回应宁波e5被烧燃事件：可能人为纵火导致
551,2020-08-17 17:03:15,【深高速：拟出资3亿元投资深圳国资协同发展基金】深高速(600548)8月17日晚公告，公司与深圳国际共同投资深圳国资协同发展私募基金合伙企业（有限合伙），其中，公司出资3亿元，约占目标募集规模40.1亿元的7.48%。上述基金重点围绕基础设施公用事业领域、金融和战略性新兴产业的“一体两翼”领域，尤其是基础设施公用事业和国资短板领域的企业开展战略性并购。深圳国际间接持有公司约52%的权益，本次交易属于与关联人共同投资。（e公司）,深高速：拟出资3亿元投资深圳国资协同发展基金
552,2020-08-17 17:02:30,【海思科：获得注射用醋酸卡泊芬净《药品注册证书》】海思科(002653)8月17日晚间公告，全资子公司辽宁海思科收到国家药监局下发的注射用醋酸卡泊芬净《药品注册证书》；创新药HSK7653片Ⅲ期临床试验获得伦理批准，可开始实施Ⅲ期临床研究；全资子公司四川海思科收到国家药监局下发的创新药HSK3486乳状注射液《受理通知书》。（e公司）,海思科：获得注射用醋酸卡泊芬净《药品注册证书》
553,2020-08-17 17:01:02,【中煤能源：7月份商品煤销量同比增长31.5%】中煤能源8月17日晚公告，7月份商品煤销量为2373万吨，同比增长31.5%；1-7月累计销量为13936万吨，同比增长15%。（第一财经）,中煤能源：7月份商品煤销量同比增长31.5%
