,datetime,content,title
500,2020-05-20 19:47:22,【惠达卫浴：拟定增募资不超过5亿元 将引入战略投资者碧桂园创投】惠达卫浴公告，公司拟非公开发行A股股票。本次发行价格为8.20元/股。本次非公开发行拟募集资金总额拟不超过人民币 5亿元（含本数），扣除发行费用后的募集资金净额将全部用于补充流动资金。发行对象包括碧桂园创投、王惠文、王彦庆和王彦伟共4名特定对象。本次非公开发行将引入战略投资者碧桂园创投。本次非公开发行股票不会导致公司实际控制权发生变化。（界面新闻）,惠达卫浴：拟定增募资不超过5亿元 将引入战略投资者碧桂园创投
501,2020-05-20 19:43:18,【新凤鸣：拟1.5亿元-3亿元回购股份】新凤鸣(603225)5月20日晚间公告，拟以集中竞价交易方式回购股份，回购资金总额不低于1.50亿元，不超过3亿元。回购价格不超过11元/股。公司拟将回购的股份全部用于员工持股计划。（e公司）,新凤鸣：拟1.5亿元-3亿元回购股份
502,2020-05-20 19:42:15,【联想刘军：去年国内PC市场一波三折 目前出现向好势头】5月20日，在联想19/20 全年及Q4业绩沟通会上，联想中国区总裁刘军表示，受大环境尤其是疫情影响，中国PC市场在去年一波三折。但疫情之后已经出现向好势头，上个月已经看到PC市场有了非常明显的反弹，联想中国对今年的市场表现比较乐观。（界面新闻）,联想刘军：去年国内PC市场一波三折 目前出现向好势头
503,2020-05-20 19:41:29,【博雅生物：获批设置单采血浆站】博雅生物(300294)5月20日晚公告，近日，公司收到海南省卫生健康委员会下发的《关于同意屯昌博雅单采血浆站设置的批复》，同意公司在屯昌县城设置屯昌博雅单采血浆站。（e公司）,博雅生物：获批设置单采血浆站
504,2020-05-20 19:39:17,【贵州茅台：提名高卫东、李静仁为董事会董事候选人】贵州茅台：公司董事会将进行换届选举，公司第二届董事会提名高卫东先生、李静仁先生、王焱先生为公司第三届董事会董事候选人，提名李伯潭先生、陆金海先生、许定波先生、章靖忠先生为公司第三届董事会独立董事候选人。（界面新闻）,贵州茅台：提名高卫东、李静仁为董事会董事候选人
505,2020-05-20 19:38:13,【量子生物收问询函：要求补充披露2017-2019年上海睿智关键经营数据】量子生物收年报问询函，要求补充披露2017-2019年上海睿智关键经营数据，针对上海睿智近三年业绩承诺完成率98%的情况说明是否存在跨期调节利润的情形。（第一财经）,量子生物收问询函：要求补充披露2017-2019年上海睿智关键经营数据
506,2020-05-20 19:34:24,【炒炒炒 头盔股突然火了】近日，公安部交管局下发通知称，自2020年6月1日起，将在全国开展“一盔一带”安全守护行动。消息一出，相关概念股纷纷大涨。其中，南京聚隆(300644)、国立科技(300716)已连续三天涨停，银禧科技(300221)、金发科技(600143)均有一天涨停，新日股份(603787)、伊之密(300415)等头盔及头盔产业链上的公司股价也连续多日涨幅居前。（金融投资报）,炒炒炒 头盔股突然火了
507,2020-05-20 19:33:22,【农业部：第四届茶博会将于7月24-27日在杭州举办】据农业农村部新闻办公室，5月20日，第四届中国国际茶叶博览会组委会在北京召开视频筹备工作会议，通报第四届茶博会工作方案，安排部署下一步工作。经综合研判国内外疫情防控和经济形势，茶博会组委会慎重决定，第四届茶博会定于7月24-27日在浙江省杭州市举办，时间可视疫情情况作适当调整。,农业部：第四届茶博会将于7月24-27日在杭州举办
508,2020-05-20 19:30:34,【农业农村部、银保监会召开视频会议 部署落实金融支持生猪生产发展政策】5月20日，农业农村部、银保监会在京召开视频会议，部署各地全面落实金融支持生猪生产发展各项扶持政策，促进生猪生产加快恢复，提高猪肉产品供给保障能力。农业农村部副部长于康震、银保监会副主席周亮出席会议并讲话。（农业农村部）,两部委召开视频会议 部署落实金融支持生猪生产发展政策
509,2020-05-20 19:29:50,【航新科技：5名股东计划减持合计不超过2%公司股份】航新科技公告，公司控股股东及其一致行动人卜范胜、卜祥尧、黄欣、柳少娟、李凤瑞，拟自本公告披露之日起3个交易日后的三个月内（窗口期不减持）以大宗交易的方式减持本公司股份。拟减持股东合计持有公司股份8200.77万股，占公司股份总数34.19%；本次合计拟减持不超过479.74万股，占公司股份总数不超过2%。（界面新闻）,航新科技：5名股东计划减持合计不超过2%公司股份
510,2020-05-20 19:28:56,【苏宁易购董事长张近东：建议大力发展C2M基地 实现助农富农】全国两会即将拉开帷幕，全国人大代表、苏宁易购董事长张近东提交了5份建议，关注乡村振兴、数据共享等。张近东介绍，“今年我在建议中提出，大力发展C2M（注：用户直连制造）生产基地，助农富农推动乡村振兴。”张近东建议从四个方面给予关注：支持回乡创业者形成集群效应，振兴乡村；政企院校联动，推动C2M基地产业化、规模化；政企合力推动C2M基地产品品牌化宣传推广；搭建助农绿色通道，打通农产品上行链路。（e公司）,苏宁易购董事长张近东：建议大力发展C2M基地 实现助农富农
511,2020-05-20 19:27:55,【*ST劝业：重组过会 股票复牌】*ST劝业(600821)5月20日晚间公告，公司重大资产置换及发行股份购买资产并募集配套资金暨关联交易事项获得证监会审核有条件通过。公司股票5月21日起复牌。（e公司）,*ST劝业：重组过会 股票复牌
512,2020-05-20 19:26:47,【WTI原油期货短线拉涨超1%】WTI原油期货短线拉升，涨幅扩大至超1%，报32.42美元/桶，刷新日内新高。,WTI原油期货短线拉涨超1%
513,2020-05-20 19:24:06,【ST庞大：拟回购总金额5亿-10亿元公司股份】ST庞大公告，公司拟回购股份资金总额不低于人民币5亿元(含)，不高于人民币10亿元（含），用于员工股权激励计划。回购价格不超过人民币1.78元/股。回购期限为自公司股东大会审议通过回购股份方案之日起12个月内。（界面新闻）,ST庞大：拟回购总金额5亿-10亿元公司股份
514,2020-05-20 19:23:16,【昊华能源：涉嫌信披违法违规 遭证监会立案调查】昊华能源(601101)5月20日晚间公告，公司收到证监会调查通知书，因公司涉嫌信息披露违法违规，决定对公司进行立案调查。（e公司）,昊华能源：涉嫌信披违法违规 遭证监会立案调查
515,2020-05-20 19:23:02,【一日售罄！爆款基金太火 认购创近两月新高 这些“大腕”也要发新品】一日售罄！易方达均衡成长基金发行首日便结束募集。有渠道人士透露，该基金认购规模或创下近2个月新基金发行认购规模新高。（中国证券报）,一日售罄！爆款基金太火 认购创近两月新高 这些“大腕”也要发新品
516,2020-05-20 19:21:49,【拼多多再推卖车补贴：联合吉利 百台汽车平均降价近2万】5月21日，吉利将携旗下两款品牌车型共计100台汽车，于“台州制造”拼多多线上直播节期间登陆拼多多汽车秒杀频道。（界面新闻）,拼多多再推卖车补贴：联合吉利 百台汽车平均降价近2万
517,2020-05-20 19:20:44,【北京：不得举办现场推介、抽奖摇号 鼓励直播卖房、线上签约】北京市住房和城乡建设委发布《关于进一步做好常态化疫情防控期间房地产开发项目售楼场所管理的通知》。《通知》显示，现场销售接待实行独立区域一对一服务，一个销售人员只接待一组客户（原则上不超过2人）；不得举办现场推介、抽奖摇号等聚集性活动。对需现场签约的，要采取预约制，严控现场人员密度，有序引导客户签订购房合同。（界面新闻）,北京：不得举办现场推介、抽奖摇号 鼓励直播卖房、线上签约
518,2020-05-20 19:19:22,【中银航空租赁成为挪威航空大股东】5月20日，中银航空租赁收购挪威航空13%的股权，成为其主要股东之一。除中银航空租赁外，租赁公司Aercap Holdings持有挪威航空16%的股权。注资完成后，挪威航空由飞机租赁商和债权人接管，股价下跌60%。（界面新闻）,中银航空租赁成为挪威航空大股东
519,2020-05-20 19:16:59,【瑞幸咖啡盘前跌幅缩窄至20%】瑞幸咖啡盘前跌幅收窄，现跌超20%，此前一度闪崩50%。,瑞幸咖啡盘前跌幅缩窄至20%
520,2020-05-20 19:14:28,【中泰证券：网上发行中签率为0.2417%】中泰证券(600918)5月20日晚间披露网上发行申购情况，本次网上发行有效申购户数为1312.86万户，回拨后本次网上发行的最终中签率为0.24171676%。（e公司）,中泰证券：网上发行中签率为0.2417%
521,2020-05-20 19:10:34,【房企美元债发行苗头再现 回归常态尚待时日】5月20日，继时代中国、正荣地产之后，碧桂园发布公告称，拟发行2025年到期的5.44亿美元优先票据用于现有中长期境外债务的再融资，票面利率为5.40%。5月以来，中资房企美元债发行重启，虽然发行企业数量以及发行规模仍较年初差距较大，但恢复苗头已现。专家表示，近期中资地产美元债的发行利率基本处在合理水平，境外发行确有恢复的苗头，但整体恢复情况仍有待进一步观察，预计下半年或回归正常水平。（中证网）,房企美元债发行苗头再现 回归常态尚待时日
522,2020-05-20 19:00:50,【瑞幸咖啡复牌 盘前跌约50%】5月20日，瑞幸咖啡复牌首日，截至发稿，盘前跌约50%。消息面上，瑞幸咖啡昨日公告称收到纳斯达克交易所的退市通知，公司计划就此举行听证会。,瑞幸咖啡复牌 盘前跌近50%
523,2020-05-20 18:57:26,【携程CEO方继勤：国内差旅市场恢复约20%-30%】据报道，携程集团高级副总裁兼携程商旅CEO方继勤表示：“疫情在中国刚爆发时，差旅市场缩水了约90%，3月以来，差旅市场逐渐复苏，但目前仅恢复20%-30%左右。”他还称，疫情下需要快速的应变能力，未来携程商旅会暂时将精力和资源都转向国内市场，扩大和挖掘商旅内需。（界面新闻）,携程CEO方继勤：国内差旅市场恢复约20%-30%
524,2020-05-20 18:50:41,【4连板香梨股份：业务不涉及市场热点关注的粮食及种业生产销售】香梨股份(600506)连续4个交易日涨停，公司5月20日晚公告，目前公司主营业务以果品销售和种植为主，主业经营规模较小，业务不涉及市场热点关注的粮食及种业生产销售。关于近期发布的《关于新时代推进西部大开发形成新格局的指导意见》，公司关注到尚无具体实施政策的落地，对公司所属行业的生产经营预计不产生直接影响。（e公司）,4连板香梨股份：业务不涉及市场热点关注的粮食及种业生产销售
525,2020-05-20 18:50:05,【新农开发：主要业务不涉及近期市场热点粮食题材】新农开发(600359)近三个交易日录得两个涨停，公司5月20日晚公告，公司主营业务未有变化，主要业务不涉及近期市场热点粮食题材。（e公司）,新农开发：主要业务不涉及近期市场热点粮食题材
526,2020-05-20 18:48:58,【超4亿大资金争抢特斯拉概念龙头】今日两市特大单净流出179.23亿元，创业板流出36.49亿元。（数据宝）,超4亿大资金争抢特斯拉概念龙头
527,2020-05-20 18:47:57,【建行银川火车站支行被罚40万：内控制度执行违反审慎经营规则】5月20日消息，宁夏银保监局发布行政处罚信息公开表，中国建设银行股份有限公司银川火车站支行因内控制度执行严重违反审慎经营规则，被罚款40万元。王新国对内控制度执行严重违反审慎经营规则承担直接责任，被警告。（界面新闻）,建行银川火车站支行被罚40万：内控制度执行违反审慎经营规则
528,2020-05-20 18:46:26,【游资猛砸光刻胶概念 主力重金杀入OLED龙头】京东方A将成iPhone12 OLED屏幕主要供应商，主力资金今日重金杀入。（数据宝）,游资猛砸光刻胶概念 主力重金杀入OLED龙头
529,2020-05-20 18:44:56,【高管增持股名单曝光！最牛董事长斥资2亿增持 这些股高管抱团买入】财报窗口期已过，上市公司高管增减持行为趋于频繁，近10个交易日共有35家公司股份获高管增持，合计增持金额3亿元，其中恺英网络获董事长增持近2亿。（证券时报）,高管增持股名单曝光！最牛董事长斥资2亿增持 这些股高管抱团买入
530,2020-05-20 18:37:21,【全国政协委员沈南鹏：新药“供得上、用得起”是升级药品保障体系的基本目标】作为中国风险投资行业唯一的全国政协委员，沈南鹏深谙科技创新、数字化升级和信息化应用对于医疗健康企业和机构的重要意义，他今年有三份提案重点聚焦在此，倡导推动建设“医药强国”。沈南鹏表示，医药产业关系国计民生，是建设健康中国的重要基础。在医药强国战略指导下，新药“供得上、用得起”是升级药品保障体系的基本目标。（e公司）,全国政协委员沈南鹏：新药“供得上、用得起”是升级药品保障体系的基本目标
531,2020-05-20 18:35:18,【最狠每股跌50元！百元股集体重挫 有机构在大举抄底！一大利空逼近高价次新股】今日百元股出现罕见集体大跌，部分次新百元股即将面临限售股解禁压力。（数据宝）,最狠每股跌50元！百元股集体重挫 有机构在大举抄底！一大利空逼近高价次新股
532,2020-05-20 18:33:07,【美锦能源：拟将子公司飞驰汽车分拆至创业板上市】美锦能源(000723)5月20日晚公告，公司拟将控股子公司佛山市飞驰汽车制造有限公司分拆至创业板上市。本次分拆完成后，公司的股权结构不会发生变化，且仍将维持对飞驰汽车的控股权。（e公司）,美锦能源：拟将子公司飞驰汽车分拆至创业板上市
533,2020-05-20 18:30:34,【欧盟免征新能车增值税提振消费 刺激力度超机构预期】欧盟委员会将推出绿色经济复苏计划，针对零排放车型免征增值税，在2025年之前建设200万座充电桩和燃料补给站，将充电设施的投资扩大一倍。另外，提供欧盟范围内采购清洁车的贷款支持，未来两年合计200亿欧元，使得整体碳排放达到欧盟标准；设置节能动力基金合计400-600亿欧元，加速零排放动力列车的投资。（界面新闻）,欧盟免征新能车增值税提振消费 刺激力度超机构预期
534,2020-05-20 18:25:49,【工信部：全国规模以上工业企业职工复岗率达95.4%】工业和信息化部部长苗圩在20日的国新办新闻发布会上表示，近期我国着力推动全产业链复工复产，截至5月18日，全国规模以上工业企业平均开工率和职工复岗率分别达99.1%和95.4%，基本达到正常水平。苗圩表示：“随着更大力度的宏观政策出台和落地，复工复产持续的推进和各项扩内需政策的效果显现，二季度工业经济的运行有望延续回升的态势。”（界面新闻）,工信部：全国规模以上工业企业职工复岗率达95.4%
535,2020-05-20 18:24:19,【红杉资本全球执行合伙人沈南鹏：医疗卫生机构需要重视大数据和人工智能的应用】全国政协委员、红杉资本全球执行合伙人沈南鹏今年将向两会提交五份提案，其中对于医疗健康领域，沈南鹏在提案中建议：政府部门需要不断优化医药创新土壤，为进一步加强新药研发转化提供政策支持，推动建设“医药强国”；医疗卫生机构需要重视大数据和人工智能的应用，在医疗资源投入上要“软硬兼施”，利用好数字化、信息化，提升中国医疗整体供给能力；对中国感染科系的应急能力建设需要提高到战略高度，实现防疫能力常态化，建设分布式传染病报告数据共享网络。（界面新闻）,红杉资本全球执行合伙人沈南鹏：医疗卫生机构需要重视大数据和人工智能的应用
536,2020-05-20 18:21:54,【Surface Go 2在中国市场开启预售和预定 Surface Earbuds正式上市】5月20日，微软中国今日宣布，全新Surface Go 2在中国市场开启预售和预定，同期Surface Earbuds 正式上市。Surface Go 2 Wi-Fi版本起售价为2988 元，LTE增强版起售价为5788元。（界面新闻）,Surface Go 2在中国市场开启预售和预定 Surface Earbuds正式上市
537,2020-05-20 18:20:33,【特锐德：控股子公司特来电与华为签订全面合作协议】特锐德官方微信信息显示，5月20日，公司控股子公司特来电新能源有限公司(简称“特来电”)与华为技术有限公司(简称“华为”)在深圳坂田华为总部正式签订全面合作协议。双方将通过全面合作和资源共享，充分发挥各自在网络通信和充电领域的技术优势，推动桩联网建设和智能充电业务发展，升级新能源车的服务生态圈，创新用户最佳体验，共同开创智能充电产业未来。（中证网）,特锐德：控股子公司特来电与华为签订全面合作协议
538,2020-05-20 18:20:13,【小米：主要产品在一季度末销售已回到疫情前水准】据《科创板日报》，小米在财报中表示，第一季度末以来，随着中国大陆疫情的逐渐缓解，主要产品在一季度末销售已回到疫情前水准。目前中国市场供应端复工复产顺利，线下客流逐渐恢复，需求端反弹趋势明显。从数据来看，小米在中国大陆的手机销量在2020年3月起已逐渐回到疫情前水平；智能电视出货量也大幅回升。境外的其他市场也采取了不同形式的应对措施，预计会对第二季度的业绩造成影响。（界面新闻）,小米：主要产品在一季度末销售已回到疫情前水准
539,2020-05-20 18:17:00,【世界铂金投资协会：一季度全球铂金条、币投资需求强劲】世界铂金投资协会（WPIC）日前最新发布的2020年第一季度《铂金季刊》指出，2020年第一季度的全球铂金总需求比上一季度下降了5%（-3吨），减至51吨。与此同时，全球铂金总供应量较2019年第四季度下降了19%（-13吨）至55吨。铂金条、币的投资需求呈现强劲势头。2020年第一季度，全球铂金条和铂金币的投资量激增至10吨，较2019年季度平均2吨的水平大幅增长。（中国证券报）,世界铂金投资协会：一季度全球铂金条、币投资需求强劲
540,2020-05-20 18:14:00,【17省份房地产开发投资走出负区间 西部地区增速快】进入4月，楼市加快复苏，房地产开发投资回稳，不过各地的表现存在明显差异，总体上，西部地区的开发投资增速位列前茅。报告显示，今年1-4月份，在全国31个省份中，17省房地产开发投资增速已由负转正。（第一财经）,17省份房地产开发投资走出负区间 西部地区增速快
541,2020-05-20 18:11:03,【新日股份：所售头盔均为外采 收入占比较小】新日股份(603787)5月20日在互动平台表示，截至目前，公司销售的头盔均为外采，作为公司电动两轮车附件之一进行销售，经销商可以选购，该类附件销售收入占比较小。新日股份今日盘中冲高回落，一度涨逾9%。（e公司）,新日股份：所售头盔均为外采 收入占比较小
542,2020-05-20 18:09:05,,核酸检测备受关注 行业前景如何？专家教你判断公司价值
543,2020-05-20 18:01:56,【药明生物母公司寻求通过配售股票至多融资8.26亿美元】据报道，药明生物母公司寻求通过配售股票至多融资8.26亿美元。,药明生物母公司寻求通过配售股票至多融资8.26亿美元
544,2020-05-20 17:56:30,【荷兰审计法院：政府去年购入法荷航集团14%股份“不合规”】荷兰政府2019年购入法荷航集团14%股份时并未通知国会。荷兰审计法院认为，根据该国宪法，针对这类交易，部长“必须提前通知国会”，不能“先斩后奏”。法院称，“在我们看来，这桩交易不合规（irregular）”。（界面新闻）,荷兰审计法院：政府去年购入法荷航集团14%股份“不合规”
545,2020-05-20 17:55:30,【三连板南京聚隆：目前公司应用于头盔的原材料产品占公司主营业务收入比例很小】三连板南京聚隆公告，目前公司应用于头盔的原材料产品仅有少量销售，占公司主营业务收入比例很小，不会对公司经营业绩产生影响。此外，5月中旬以来，聚丙烯熔喷料市场需求呈下滑趋势。（第一财经）,三连板南京聚隆：目前公司应用于头盔的原材料产品占公司主营业务收入比例很小
546,2020-05-20 17:51:56,【我国将出台政策促进清洁能源使用 上市公司谁能切分这块大蛋糕？】5月19日，国家能源局综合司官网发布关于公开征求《关于建立健全清洁能源消纳长效机制的指导意见(征求意见稿)》意见的公告。《意见》指出，推进各地区电力中长期交易在市场规则、品种、时序等方面融合，加快推进跨省跨区优先发电计划放开，不断健全省间市场交易机制，创新有利于清洁能源消纳的交易品种，扩大清洁能源消纳空间。加快推进电力现货市场，逐步提升清洁能源参与市场竞价电量规模，自主确定发电计划。（上海证券报）,我国将出台政策促进清洁能源使用 上市公司谁能切分这块大蛋糕？
547,2020-05-20 17:51:08,【全国人大代表郭新明：加大金融对公共卫生建设支持力度】全国人大代表、人民银行南京分行行长郭新明今年“两会”提交了关于深化公共卫生服务供给侧改革，发挥金融的支持和保障作用的建议，呼吁创新金融支持公共卫生体系建设的产品和服务方式。具体来说，包括以下三方面建议：一是加大公共卫生体系建设的金融支持力度。二是创新金融支持公共卫生体系建设的产品和服务方式。三是发挥好保险在应对公共卫生事件中的保障功能。（e公司）,全国人大代表郭新明：加大金融对公共卫生建设支持力度
548,2020-05-20 17:49:13,【体育产业迎来大利好！国家将确定一批体育消费试点城市】5月20日，体育总局在其官网发布了《促进体育消费试点工作实施方案》，并宣布开展国家体育消费试点城市申报工作。根据方案，体育总局将确定一批试点城市，通过鼓励体育企业投融资、强化体育设施用地保障、发放体育消费券等方式引导体育消费。体育总局后期也将会对试点城市采取政策和资源的支持。（上海证券报）,体育产业迎来大利好！国家将确定一批体育消费试点城市
549,2020-05-20 17:47:35,【华储网：将竞价交易1万吨中央储备冻猪肉】华储网发布2020年5月22日中央储备冻猪肉投放竞价交易有关事项的通知，将竞价交易1万吨。（e公司）,华储网：将竞价交易1万吨中央储备冻猪肉
550,2020-05-20 17:46:37,【小米集团：一季度互联网服务收入达59亿元 同比增长38.6%】小米集团在港交所披露，2020年第一季度，公司的互联网服务收入达到59亿元，同比增长38.6%，占总收入比达到11.9%。互联网服务的用户活跃度和使用时长在第一季度都明显增加。2020年3月，MIUI月活跃用户数达到330.7百万，同比增长26.7%，其中，中国大陆地区的MIUI 月活跃用户数为111.5百万。（e公司）,小米集团：一季度互联网服务收入达59亿元 同比增长38.6%
551,2020-05-20 17:45:58,【小米集团：第一季度智能电视全球出货量同比增长3%】小米集团在港交所披露，第一季度，尽管全球电视市场受到疫情影响，销量整体下滑，公司的智能电视的全球出货量仍然同比增长3.0%，达到2.7百万台。根据奥维云网统计，2020年第一季度小米电视连续第5个季度稳居中国大陆电视出货量的第一位，全球电视出货量前五位。（e公司）,小米集团：第一季度智能电视全球出货量同比增长3%
552,2020-05-20 17:43:38,【小米集团：境外市场收入占比首次达到总收入的一半】小米集团在港交所公告称，2020年第一季度，我们持续扩张且不断深耕境外市场，境外市场收入达到人民币248亿元，同比增长47.8%，占比首次达到总收入的一半。根据Canalys的数据，我们西欧市场的手机出货量同比增长79.3%，并且在西班牙首次夺得市场份额第一。（证券时报网）,小米集团：境外市场收入占比首次达到总收入的一半
