,datetime,content,title
0,2020-08-22 22:31:16,云财经讯，据美国约翰斯·霍普金斯大学数据，全球新冠肺炎累计确诊病例逼近2300万例，累计死亡达80万例,据美国约翰斯·霍普金斯大学数据
1,2020-08-22 22:25:59,云财经讯，国药集团中国生物董事长、国家“863”计划疫苗项目首席科学家杨晓明表示，6月23日，中国生物新冠灭活疫苗国际临床（Ⅲ期）阿拉伯联合酋长国启动仪式在中国北京、武汉、阿联酋阿布扎比三地，以视频会议方式同步举行。截至目前，入组接种人数已超过2万人，并创造了多个全球第一；安全性非常好，有效性正在进一步观察中；入组速度好于预期，非常值得期待。,中国生物董事长杨晓明：新冠疫苗Ⅲ期临床试验入组超2万人，有效性正在进一步观察中
2,2020-08-22 22:14:21,云财经讯，据中国生物微信号，国家卫生健康委科技发展中心主任、国务院联防联控机制科研攻关组疫苗研发专班工作组组长郑忠伟在节目中表示，我国已于7月22日正式启动新冠疫苗的紧急使用。,我国已于7月22日正式启动新冠疫苗紧急使用
3,2020-08-22 21:23:57,云财经讯，银保监会新闻发言人答记者问表示，银行业净利润下降主要有两方面原因：一是持续向实体经济让利。今年以来，银行保险机构统筹兼顾近期和长远利益，按照商业可持续原则，通过降低利率、减少收费、财务重组和贷款延期还本付息等措施，前7个月已向实体经济让利8700多亿元。二是不良处置和拨备计提力度加大。上半年银行业金融机构累计处置不良贷款1.1万亿元，同比多处置1689亿元。,银保监会：今年上半年商业银行净利润下降主要有两方面原因
4,2020-08-22 21:22:43,云财经讯，银保监会：通过改革开放、科技赋能和加强管理，普惠金融正逐步实现精准滴灌，信用风险总体上完全可控,银保监会：通过改革开放、科技赋能和加强管理
5,2020-08-22 21:13:01,云财经讯，银保监会：将保持金融帮扶政策总体稳定，聚焦“三区三州”等深度贫困地区，向未摘帽贫困县加大金融资源投入；推进脱贫攻坚与乡村振兴有机衔接，推动金融支持和产业扶贫融合；开展金融助力决战决胜脱贫攻坚专项督查，确保扶贫惠民措施精准落地,银保监会：将保持金融帮扶政策总体稳定
6,2020-08-22 21:11:45,云财经讯，银保监会：银保监会将坚定不移地履行开放承诺，在确保金融安全的前提下，继续稳步提升银行业保险业对外开放水平，不断改进完善监管方式方法，增强开放条件下金融管理能力和风险防控能力。,银保监会：在确保金融安全的前提下，继续稳步提升银行业保险业对外开放水平
7,2020-08-22 20:48:27,云财经讯，据媒体报道，iPhone12将在10月正式发布，双扬声器+三摄,据媒体报道 iPhone12将在10月正式发布
8,2020-08-22 20:27:58,云财经讯，据万孚生物消息，8月22日，在第十七届国际检验医学暨输血仪器试剂博览会（CACLP）的第二场新品发布会上，万孚生物正式发布了boxarray® 全自动多重核酸检测分析系统。该系统将PCR检测从专业实验室中解放出来，样本进结果出，一次检测可提供10-30个检测结果，精准检测病原微生物感染。（证券时报）,万孚生物发布全自动多重核酸检测分析系统
9,2020-08-22 20:06:18,云财经讯，特朗普：美国食品药品监督管理局（FDA）让企业的疫苗、药品测试更艰难,特朗普：美国食品药品监督管理局（FDA）让企业的疫苗、药品测试更艰难
10,2020-08-22 19:44:08,云财经讯，据应急管理部消息，当前，长江上游干流寸滩站水位已退至警戒水位以下，三峡水库入库流量持续减少，淮河流域沂沭泗水系全面退至警戒水位以下，海河、松花江、辽河汛情平稳，全国各地未发现重大险情，防汛形势趋缓。根据《国家防汛抗旱应急预案》有关规定，国家防总决定于8月22日12时将防汛应急响应调整至Ⅳ级。,防汛形势趋缓 国家防总调整防汛应急响应至Ⅳ级
11,2020-08-22 19:36:17,云财经讯，华为运营商业务首席技术官保罗•斯坎兰 （Paul Scanlan） 接受在采访中提到，5G是一个转型平台，它比4G、3G或2G都要便宜得多。主要原因是容量问题，与速度和是否延迟关系不大。而5G的容量是4G的20到30倍，是2G一万倍，耗电减少10倍，体积下降70%。（集微网）,华为高管：5G最大的优势是容量 而不是速度
12,2020-08-22 19:30:22,云财经讯，8月22日下午，上海市委常委、副市长吴清在“2020金牛资产管理论坛”上表示，面对百年未有之变局，上海将努力育新机、开新局、图发展，将对标最高水平，全力打造国际一流的金融发展环境，进一步强化全球资源配置功能，进一步发挥国内国际双循环中战略链接作用。吴清介绍称，上海还将进一步推动QDLP、QFLP在参与主体、产品创新、投资范围等方面进一步突破。（中证网）,上海市副市长吴清：上海将持续推进全球资产管理中心建设
13,2020-08-22 19:10:02,云财经讯，据广汽集团消息，8月22日，第三届全球智能汽车前沿峰会在广州白云国际会议中心召开。广汽集团总经理冯兴亚在会上表示，整车厂是智能汽车产业发展的主要引领者，作为粤港澳大湾区龙头汽车企业，广汽集团将立足广州、依托湾区、面向全球，牢牢把握住智能汽车产业发展机遇，力争2023年实现L4级自动驾驶的区域示范运营。,广汽集团：将力争2023年实现L4级自动驾驶的区域示范运营
14,2020-08-22 19:06:09,云财经讯，甘肃省水利厅22日启动水旱灾害防御Ⅱ级应急响应。甘肃省水利厅介绍，受持续降雨影响，近期甘肃暴雨洪水灾害频发重发，陇南、甘南等地山洪地质灾害高发，多处发生堰塞湖险情，黄河干流出现5号洪水。险情灾情还在进一步加重，据预测未来三天白龙江、白水江流域仍有强降雨过程，发生洪涝灾害的风险极高。（新华社）,甘肃启动水旱灾害防御Ⅱ级应急响应
15,2020-08-22 19:04:47,云财经讯，当地时间2020年8月22日，中共中央政治局委员、中央外事工作委员会办公室主任杨洁篪在釜山同韩国国家安保室长徐薰举行磋商。杨洁篪表示，中方愿同韩方共同努力，加强高层交往和战略沟通，积极推进发展战略对接，发掘和培育双边合作新增长点，活跃经贸和人文交流，推动中韩战略合作伙伴关系迈上新台阶。（新华社）,杨洁篪同韩国国家安保室长徐薰举行磋商
16,2020-08-22 18:59:20,云财经讯，本周六，全市场参与主体进行了最后一轮“实战演习”，模拟8月24日创业板交易业务正式启用场景，完成了最后一轮通关测试。为了保障24日当天交易系统平稳运行，记者了解到，多家券商对交易系统容量进行了提前扩容。东海证券对交易系统的性能按平时容量的6倍扩容；广发证券系统处理能力达到了历史峰值的6倍；湘财证券也将系统处理能力提升到历史峰值的3倍以上。（上海证券报）,创业板注册制交易完成最后一轮通关测试 券商信息系统大扩容
17,2020-08-22 18:39:59,云财经讯，美国民主党总统候选人拜登21日接受美媒采访时表示，如果科学家建议他采取行动，他愿关停美国经济以阻止新冠病毒传播。拜登称，他将做好准备，不惜一切代价拯救生命，“除非病毒得到控制，否则我们无法让美国前进”。他还批评了特朗普政府应对疫情有“根本性缺陷”。（人民日报）,拜登称愿为阻止新冠关停美国经济
18,2020-08-22 18:18:00,云财经讯，据上海发布消息，中央广播电视总台版权交易中心22日在上海启动建设，新时代城市高质量发展研究院同时启动筹备。据悉，落户于上海国际传媒港的总台版权交易中心，将依托总台优质版权资源和5G+4K/8K+AI媒体最新技术成果，打造集查询、确权、授权、交易、结算、维权于一体的版权交易平台。新时代城市高质量发展研究院将借助国内顶尖研究力量，研究制定具有中国特色的城市发展评价办法，编制城市高质量发展指标体系。,中央广播电视总台两项目在上海启动建设
19,2020-08-22 18:10:21,云财经讯，据成都天府国际生物城22日消息，四川大学华西医院生物治疗国家重点实验室研发的重组蛋白新冠疫苗获得国家药品监督管理局临床试验批文，这是中国首个由昆虫细胞生产的重组蛋白新冠疫苗。（中新网）,中国首个由昆虫细胞生产的重组蛋白新冠疫苗获临床试验许可
20,2020-08-22 18:05:18,云财经讯，高毅资产首席投资官邓晓峰表示，当前可以看到海外资金持续加大对中国资产投资和配置，这背后深层次原因来自于中国经济的增长、中国产业的发展、中国一大批公司实现的快速增长等多方面原因，并由此为投资者创造并带来巨大的价值和财富。这些增长和财富价值创造，是境外资金流入的一个根本原因。而这样的“原生价值”创造过程、资本市场资源配置推动产业发展的过程，会在相当长的时间之内成为我国资本市场比较好的发展根基。（中证网）,高毅资产邓晓峰：“两大过程”将成为我国资本市场发展根基
21,2020-08-22 18:02:33,云财经讯，《北京市自然资源资产产权制度改革方案》近日印发。根据改革方案，到2020年底，北京将基本建立归属清晰、权责明确、保护严格、流转顺畅、监管有效的自然资源资产产权制度。北京市规划自然资源委有关负责人表示，下一步，将建立统筹推进北京市自然资源资产产权制度改革的工作机制，确保各项改革工作有序推进、落地生效。（新华社）,北京：年底基本建立自然资源资产产权制度
22,2020-08-22 17:59:42,云财经讯，记者从济南市生态环境局获悉，济南市近日出台老旧柴油货车报废更新资金补贴实施方案，安排2.1亿元专项资金，引导鼓励老旧柴油货车提前报废更新，其中提前报废的最高可享3.2万元补贴。（新华社）,济南：老旧柴油货车报废最高可享3.2万元补贴
23,2020-08-22 17:58:08,云财经讯，上海市委常委会8月21日举行会议，会议指出，全面推进长三角一体化发展重点任务落地落实，更好服务全国改革发展大局。要聚焦重点领域、重大项目、重点区域，加快推进产业链补链固链强链、构建区域创新共同体、高水平协同开放、基本公共服务便利共享、公共卫生应急体系建设等重点任务，高水平推进长三角生态绿色一体化发展示范区、上海自贸试验区临港新片区、虹桥商务区、张江科学城等区域发展，打好浦东开发开放这张王牌。,上海：全面推进长三角一体化发展重点任务落地落实 更好服务全国改革发展大局
24,2020-08-22 17:51:05,云财经讯，继8月初首支“内地核酸检测支援队”的10名先遣队员抵港后，其余50名队员21日下午也来到香港。他们将协助香港特区政府开展核酸检测工作，抗击新冠肺炎疫情。（新华视点）,首支“内地核酸检测支援队”全员抵港
25,2020-08-22 17:49:15,云财经讯，8月22日，国家发改委财政金融和信用建设司二级巡视员田原表示，“十三五”期间已经累计批复企业债接近4万亿元，近几年的批复规模均超过8000亿元。（中证网）,发改委财政金融和信用建设司田原：“十三五”期间已累计批复企业债接近4万亿元
26,2020-08-22 17:48:01,云财经讯，猫眼专业版实时票房显示，电影《八佰》上映2天，票房突破5亿元,猫眼专业版实时票房显示 电影《八佰》上映2天
27,2020-08-22 17:31:57,云财经讯，记者近日从中国人民银行南宁中心支行获悉，今年以来，广西金融机构深入落实“复工贷”“稳企贷”政策，多措并举向实体经济让利超百亿元，有效缓解企业“融资贵”难题，帮助企业特别是中小微企业渡过难关。（新华社）,广西金融机构向实体经济让利超百亿元
28,2020-08-22 17:30:24,云财经讯，三星电子公司周六表示，其位于韩国的半导体工厂有两名员工的冠状病毒检测呈阳性，但其芯片生产并未受到影响。尽管出现了确诊病例，但这家全球领先的内存芯片生产商表示，其生产仍处于正常状态，不过其已下令接触过感染病毒工人的人自我隔离。（界面新闻）,三星：两名员工确诊为阳性 芯片生产未受影响
29,2020-08-22 17:20:45,云财经讯，大洋电机(002249)在互动平台表示，小鹏汽车是公司新能源汽车动力总成系统的客户。目前，公司的氢燃料电池业务已完成了30-65KW功率的模组以及DCDC、空压机、水泵等关键零部件的设计开发，更高功率（80-120KW）的模组和相关关键零部件开发工作也正在实施中。,大洋电机：小鹏汽车是公司新能源汽车动力总成系统的客户
30,2020-08-22 17:14:32,云财经讯，8月22日，第三届全球智能汽车前沿峰会暨广州汽车产业万亿战略发布会上，广州首次公布了即将印发实施的《广州市促进汽车产业加快发展的意见》。《意见》提出17项重点任务、6大体系支撑、4大政策措施，从传统汽车、新能源到智能网联汽车进行全方位支持，包括在关键核心技术突破、产业创新平台等六个方面建立支撑体系，建立组织领导、产业用地、财政资金、法制保障四大保障措施，集中整合各类资源支持汽车产业加快发展。 （南方日报）,广州增设黄埔产业园区 全面“撑”汽车产业
31,2020-08-22 16:57:17,云财经讯，辽宁省8月18日以来出现入汛后最强降雨过程。此次强降雨导致辽宁铁岭、朝阳等地不同程度受灾。截至记者发稿时，降雨已造成两地近2万公顷农田受灾，部分乡镇遭受洪涝灾害，民房及基础设施受损，直接经济损失共计9577万元。（新华社）,强降雨致辽宁部分地区受灾 直接经济损失近亿元
32,2020-08-22 16:23:33,云财经讯，基于宽禁带半导体（碳化硅）研制的大功率燃料电池DC/DC变换器，22日在中车时代电动汽车股份有限公司下线。该产品的成功研制，标志着中国氢燃料电池汽车的一项“卡脖子”技术难题得以攻克。中车电动总工程师汪伟介绍，该产品为氢能汽车燃料电池DC/DC变换器带来革命性的创新，具有“超高频”“高耐压”“低导阻”的特性。这也是中国首个商业化应用的碳化硅大功率燃料电池DC/DC变换器。（国是直通车）,攻克“卡脖子”技术难题 中国氢能汽车核心技术添“尖兵”
33,2020-08-22 16:16:48,云财经讯，格林美(002340)在互动平台表示，公司参股了扬州宁达贵金属有限公司，并持有其18%的股权，为扬州宁达第三大股东；参股慧云新科技股份有限公司，通过控股子公司淮安繁洋企业管理有限公司持有慧云股份21.78%的股权，为慧云股份第二大股东；参股深圳市本征方程石墨烯技术股份有限公司，并持有其20%的股权，为本征方程第二大股东。公司将积极推动参股公司进入资本市场，用好资本市场做强做大主营业务。,格林美：将积极推动参股公司进入资本市场
34,2020-08-22 16:06:34,云财经讯，海南省副省长沈丹阳表示，海南正建立充分满足市场主体自主需求的新外债管理体制。海南目前正在实行一次性外债登记制度，企业可在登记金额内自行借入外债资金，额度循环使用，截至7月31日，已有11家企业办理一次性外债登记，登记金额达1000亿元。（中证网）,海南省副省长沈丹阳：海南正建立充分满足市场主体自主需求的新外债管理体制
35,2020-08-22 16:03:42,云财经讯，海南省副省长沈丹阳表示，海南正构建与国际惯例规则和制度体系接轨的要素市场体系。中央明确支持海南建设国际能源、航运、大宗商品、产权、股权和碳排放权等交易场所，支持已设立的交易场所，在会员、交易、税负、清算、交割、投资者权益保护、反洗钱等方面，建立与国际惯例接轨的规则和制度体系。下一步，海南将探索允许国内、国际交易品种挂牌交易，境内外投资者自由进出参与交易，交易资金闭环自由进出，全力打造跨境交易便利化平台。（中证网）,沈丹阳：海南正构建与国际惯例规则和制度体系接轨的要素市场体系
36,2020-08-22 15:50:32,云财经讯，香港交易所首席经济学家巴曙松在2020中国上市公司论坛表示，构建离岸固定收益业务生态圈，第一，需要进一步推动交易所债券市场的互联互通；第二，构建国际化金融基建ICSD；第三，发展国债期货、人民币期货等一系列风险对冲工具，进一步巩固香港离岸产品交易及风险管理中心的地位，为人民币国际化保驾护航。,港交所首席经济学家巴曙松：构建离岸固定收益业务生态圈需构建国际化金融基建ICSD
37,2020-08-22 15:39:30,云财经讯，海南省副省长沈丹阳：积极争取法定数字货币试点在海南自由贸易港跨境贸易、跨境投融资和穿透式监管中的应用（中证网）,海南省副省长沈丹阳：积极争取法定数字货币试点在海南自由贸易港跨境贸易、跨境投融资和穿透式监管中的应用（中证网）
38,2020-08-22 15:37:52,云财经讯，海南省副省长沈丹阳表示，海南正在积极争取QDLP（合格境内有限合伙人）试点落地，加快吸引和集聚一批国际顶级资产管理机构。探索放宽单家基金管理企业的试点额度和单个投资项目的额度限制，进一步明确基金在境外的投资范围。在额度增发、机构落户和人才集聚等方面，加快构建更有利于全球资产管理机构发展的政策体系和营商环境，推动全球各类资产管理机构在海南自由贸易港集聚，更好的满足投资者全球资产多元配置的需求。（中证网）,沈丹阳：海南正在积极争取QDLP试点落地
39,2020-08-22 15:34:58,云财经讯，海南省副省长沈丹阳表示，海南正在加快研究出台QFLP（合格境外有限合伙人）暂行办法，加快吸引境外资本投资海南PE和VC市场。海南将对QFLP企业的登记注册不设最低准入门槛，力争对企业的注册资本、认缴出资额、出资币种、首次出资比例等都不加限制，并将对内外资实行无差别待遇，允许“内资管外资”和“外资管内资”的业务模式，对内外资基金管理公司的要求一致。对QFLP企业的经营范围采取负面清单管理模式，不在清单内的业务均可开展，同时，也给企业投资二级市场股票，以及进行企业债券交易的部分投资标的预留了空间。（中证网）,沈丹阳：海南正加快研究出台QFLP暂行办法
40,2020-08-22 15:32:27,云财经讯，重阳投资总裁王庆8月22日在“2020金牛资产管理论坛”上表示，与欧美国家比较，中国无论在经济增速还是在利差上都有巨大优势，近期中国国债收益率与美国收益率的利差也创出历史高点。在这一背景下近段时间以来，美元指数开始出现走弱的迹象，这可能是一个趋势的开始。进一步从历史对比来看，美元走弱时，新兴市场国家股票市场明显优于发达市场。（中证网）,重阳投资王庆：美元走弱时新兴市场股票明显优于发达市场
41,2020-08-22 15:27:45,云财经讯，香港交易所首席经济学家巴曙松在2020中国上市公司论坛表示，中国债券市场已经成为全球第三大本币债券市场，境内债券市场十分活跃。参照发达国家债券市场国际化经验，有必要进一步开放中国境内债券市场，实现投资主体多元化，促进形成更具竞争力的市场，增加市场流动性。,港交所首席经济学家巴曙松：有必要进一步开放中国境内债券市场
42,2020-08-22 15:26:01,云财经讯，一个新加坡研究小组日前在英国《柳叶刀》期刊上发表报告说，患者感染一种不太常见的新冠病毒变体后出现的症状相对较轻，深入了解这一变体的机理可能为新冠治疗及疫苗研发提供线索。（新华社）,新冠病毒变体感染症状轻 或为药物及疫苗研发提供线索
43,2020-08-22 15:25:02,云财经讯，中国社会科学院副院长蔡昉就中国经济如何实现自身的潜在增长率发表了自己的看法。他表示，消费，特别是居民消费中农村居民的消费，低收入群体的消费，应该成为更重要的拉动经济的需求因素。下一个解决内需的问题关键点就是再分配。从“三驾马车”看，他认为外需仍然重要，因此应该牢牢地利用比较优势，同时利用中国在全球价值链中的独特地位，连接性和韧性，坚定地不脱钩。（澎湃）,蔡昉：加大再分配力度才能支撑中国内需增长，外需仍然重要
44,2020-08-22 15:23:37,云财经讯，海南省副省长沈丹阳8月22日在“2020金牛资产管理论坛”上表示，海南正推动在洋浦开展离岸新型国际贸易外汇收支便利化试点工作。试点企业可以享受银行真实性审核从事前审核到事后核查，银行可凭试点企业支付指令直接办理试点企业的离岸新型国际贸易结算业务。这一试点将有利于进一步提高试点企业离岸新型国际贸易资金结算的便利性，加快做大海南自由贸易港的贸易流和资金流，形成市场增量。（中证网）,​海南省副省长沈丹阳：海南正推动在洋浦开展离岸新型国际贸易外汇收支便利化试点
45,2020-08-22 15:16:20,云财经讯，海南省副省长沈丹阳：海南正在建设海南国际清算所（中国证券报）,海南省副省长沈丹阳：海南正在建设海南国际清算所（中国证券报）
46,2020-08-22 15:14:29,云财经讯，据广东省纪委监委消息：广州市原市委常委、常务副市长苏泽群涉嫌严重违纪违法，目前正接受广东省纪委监委纪律审查和监察调查。,广州市原常务副市长苏泽群接受审查调查
47,2020-08-22 15:08:03,云财经讯，《八佰》今日票房再破1亿元，上映以来总票房达4.7亿元,《八佰》今日票房再破1亿元
48,2020-08-22 15:06:29,云财经讯，据东方电气消息，8月18日，东方电气与国家电投集团贵州金元股份有限公司（简称“贵州金元”）签署在役机组综合提效改造与服务合作框架协议，同时签订黔北3号机组综合提效改造项目合同。,东方电气与贵州金元签署机组综合提效改造合作框架协议
49,2020-08-22 14:33:33,云财经讯，中东地区多国新冠疫情持续蔓延，防控形势依然严峻。21日，以色列新冠累计确诊病例破10万例，黎巴嫩当天创下单日新增确诊病例数新高，阿拉伯联合酋长国等一些国家和地区考虑或已开始采取更严格限制措施以遏制疫情。（新华社）,中东地区新冠疫情持续 以色列确诊病例破10万
50,2020-08-22 14:07:43,云财经讯，爱尔兰农业、食品和海洋部长达拉·卡利里21日因近期参加一个人数超过政府疫情防控规定的高尔夫球协会晚宴而被迫辞职。据爱尔兰国家广播电视公司21日报道，卡利里19日参加的晚宴由爱尔兰议会高尔夫球协会举办，有80多人参加了该活动，其中有不少政界和司法界名人。目前，该事件引发的批评还在进一步发酵中。（新华国际）,爱尔兰农业部长因违反疫情防控规定辞职
51,2020-08-22 13:55:17,云财经讯，8月21日，东软集团与南宁市签署战略合作框架协议。此次战略合作是共同推动“数字南宁”建设的重要举措，双方将开展多层次、全方位合作，在南宁打造东软集团东盟区域总部基地，助力南宁市健康、政务、信创、交通、金融等领域产业发展。,东软集团就数字城市建设与南宁市开展战略合作
52,2020-08-22 13:42:07,云财经讯，据国药集团消息，8月21日，国药集团中国生物新冠灭活疫苗国际临床（Ⅲ期）阿根廷共和国启动仪式在京举行。这是继6月23日获得阿联酋临床试验批件、8月20日获得秘鲁、摩洛哥临床试验批件后，国药集团中国生物取得的又一全球抗疫合作成果。,新冠疫苗两天获三国批件 国药集团中国生物阿根廷临床试验获批
