,datetime,content,title
732,2020-09-11 15:45:25,云财经讯，信捷电气(603416)9月11日晚公告，因个人资金需求，公司大股东吉峰拟自2020年10月13日起至2021年4月08日期间内，减持不超140万股，占公司总股本的0.9960%。,信捷电气：股东拟减持不超1%股份
733,2020-09-11 15:44:42,云财经讯，通策医疗(600763)11日晚公告，公司拟收购海骏科技公司持有的10家长期股权投资，包括：杭州庆春口腔门诊部有限公司50%股权、上海三叶儿童口腔医院投资管理有限公司38.75%股权、北京三叶儿童口腔诊所有限公司65%股权等，上述股权转让价格为1.5亿元。海骏科技承诺，标的公司在业绩承诺期间内经审计的合计净利润不低于4000万元。海骏科技为公司实际控制人控制的公司。,通策医疗：拟1.5亿元收购海骏科技公司持有的10家长期股权投资
734,2020-09-11 15:41:37,云财经讯，据长城汽车消息，9月10日，长城汽车与中石化易捷在湖南长沙签订战略合作协议，双方将在汽车销售、汽车广告、汽车维修、汽车用品、汽车养护、汽车置换、二手车交易、会员权益、金融保险、非油品商品、合作营销等汽车关联业务方面开展业务合作探索。,长城汽车与中石化易捷签署战略合作协议
735,2020-09-11 15:41:04,云财经讯，标准股份(600302)9月11日晚公告，为优化国有资本布局结构，西安市国资委决定将工投集团持有的标准集团（公司控股股东）100%股权无偿划转至陕西鼓风机（集团）有限公司（陕鼓集团）。此次无偿划转完成后，陕鼓集团成为公司的间接控股股东，公司的控股股东不变，仍为标准集团，标准集团对公司的持股数量及比例未发生变化；公司的实际控制人不变，仍为西安市国资委。,标准股份：控股股东国有股权无偿划转
736,2020-09-11 15:35:28,云财经讯，国药股份9月8日与北京戴纳实验科技有限公司成功举行战略合作签约仪式。通过本次签约双方建立全面战略合作伙伴关系，就戴纳科技的方舱实验室、可拓展实验室、方舱实验室租赁等医疗领域相关创新产品，授权国药股份旗下子公司国药科技，为中国境内约定区域的总经销商，并将在产品注册、市场开发、渠道拓展及销售等方面开展深入合作。,国药股份：与戴纳科技战略合作
737,2020-09-11 15:32:26,云财经讯，国家能源局印发《国家能源研发创新平台管理办法》。国家能源局负责指导协调能源创新平台建设和管理相关工作，主要职责包括：（一）制定有关政策，指导能源创新平台建设和发展；（二）组织能源创新平台认定工作；（三）组织能源创新平台运行管理和考核评价工作。,国家能源局印发《国家能源研发创新平台管理办法》
738,2020-09-11 15:26:45,云财经讯，9月10日，工商银行与贵州省人民政府共同举办以“汇聚工行资源·助推贵州发展”为主题的助推贵州产业发展大会，并签署新一轮《战略合作协议》。大会期间，中国工商银行与贵州省人民政府签署《战略合作协议》。根据协议，工商银行未来3年向贵州省经济社会发展提供不少于3000亿元的意向性融资，助力贵州“六稳”“六保”和构建“双循环”新发展格局。会议共签约项目48个、投资总额超过1200亿元。,工商银行：与贵州省政府签署战略合作协议 助推贵州产业发展
739,2020-09-11 15:14:31,云财经讯，据鞍钢集团消息，9月10日，鞍钢集团与华为公司签署战略合作协议，双方将在企业数字化转型项层设计咨询规划、5G+El创新技术应用、智慧鞍钢建设、安全可信能力建设等方面开展合作，共同打造智慧鞍钢系列示范项目，树立钢铁行业数字化转型标杆，推进鞍钢集团高质量发展。,鞍钢集团与华为签署战略合作协议
740,2020-09-11 14:56:34,云财经讯，国家智能制造标准化协调推进组、总体组和专家咨询组全体会议在北京召开。辛国斌强调，要加强智能制造标准化工作。一是优化标准整体布局。前瞻部署一批5G、人工智能、数字孪生等新技术应用标准，加快制定供应链协同、共享制造等产业亟需标准。二是加快标准应用推广。开展智能制造国家、行业或团体标准应用试点。三是加强发展成效评价。制定完善智能制造发展成效评价标准，构建系统的动态评估评价标准体系。,工信部副部长辛国斌：前瞻部署一批5G、人工智能、数字孪生等新技术应用标准
741,2020-09-11 14:54:28,云财经讯，9月11日从去哪儿网获悉，截至9月10日，去哪儿网平台十一假期酒店预订的平均支付价格比去年增长近两成，间夜同比增长达到三成。其中，云南、西藏、甘肃、青海和海南增幅尤为突出，大理、丽江、西安、三亚、毕节等多个城市酒店预订量同比翻倍。目前国庆假期机票预订量已经超过去年同期的九成，国庆假期热门出游航线前十位中，8条航线出发地为北上广深。（中证网）,去哪儿网：十一酒店预定平均支付价格同比增长近两成
742,2020-09-11 14:46:03,云财经讯，9月11日尾盘，白酒板块加速上行，截至发稿，酒鬼酒大涨8%，口子窖涨逾7.5%，山西汾酒、古井贡酒等纷纷走强。,白酒板块尾盘冲高 酒鬼酒大涨8%
743,2020-09-11 14:44:37,云财经讯，渣打银行（中国）有限公司11日透露，其已于10日完成了首笔基于美元担保隔夜利率（SOFR）和人民币存款类金融机构间的7日债券回购利率（DR007）的交叉货币互换交易。据了解，这是中国人民银行8月31日发布《参与国际基准利率改革和健全中国基准利率体系》白皮书，明确将培育DR作为人民币实际交易的基准利率以来，中国市场上首次以DR和SOFR作为人民币和美元的基准利率进行的交叉货币互换交易。 （国是直通车）,渣打完成中国首笔基于DR与SOFR的人民币—美元交叉货币互换交易
744,2020-09-11 14:07:21,云财经讯，媒体称，特斯拉计划将中国制造的汽车运往欧洲和亚洲其他国家,特斯拉计划将中国制造的汽车运往欧洲和亚洲其他国家
745,2020-09-11 14:06:42,云财经讯，11日，50个涉及集成电路、新材料、智能化改造、数字经济产业园等数字经济关键领域的项目在宁波完成签约，总投资额约336亿元。这批项目是在当天举行的2020世界数字经济大会开幕式上完成签约的。其中，宁波市政府与中国电信、中国移动、中国联通三大运营商将在5G、大数据、人工智能、云计算等方面开展全面合作，多方共同推进新技术在数字政府、数字商务、智能物流等方面的应用。（新华社）,2020世界数字经济大会完成签约50个项目，总投资达336亿元
746,2020-09-11 14:04:46,云财经讯，注：聚龙股份间接持有杭州云象网络技术有限公司股份。,注：聚龙股份间接持有杭州云象网络技术有限公司股份
747,2020-09-11 14:04:33,云财经讯，天眼查专业版数据显示，我国目前有超过1800家医疗废弃物处理相关企业，近93%的相关企业都是有限责任公司。值得注意的是，超过一半的相关企业新增于2017年之后，截至9月9日，以工商登记为准，我国今年共新增265家相关企业。行业分布方面，我国医疗废弃物处理相关企业主要集中分布在生态保护和环境治理业，占比超31.5%，另外也有部分相关企业分布在批发业和废弃资源综合利用业。,我国今年已新增265家医疗废物处理相关企业
748,2020-09-11 14:03:33,云财经讯，近日，金风科技与渣打银行（新加坡）有限公司签署东南亚市场战略合作协议，旨在加深双方在东南亚市场的合作，共同推动绿色能源国际合作的健康有序发展，为“一带一路”沿线国家的能源转型贡献力量。近年来，国内清洁能源的快速发展和“一带一路”沿线国家对清洁能源的关注度和投资量的不断攀升为“一带一路”中的“绿色产业走出去”奠定了坚实的基础。金风科技自2011年起开始布局东盟市场，目前已累计中标约1GW。,金风科技与渣打银行签署战略合作协议 共同深耕“一带一路”市场
749,2020-09-11 13:59:36,云财经讯，博杰股份(002975)日前接受机构调研时表示，5G业务是公司上半年业务增长的来源之一，公司是得到高通认证的5G测试屏蔽箱供应商。目前公司5G屏蔽箱业务进展顺利，主要客户有苹果、高通等。,博杰股份：5G屏蔽箱业务进展顺利
750,2020-09-11 13:56:48,云财经讯，美股股指期货走高，纳指期货涨超1%,美股股指期货走高 纳指期货涨超1%
751,2020-09-11 13:49:21,云财经讯，注：广东省供销社为天禾股份实控人，天禾股份于2020年9月3日在深交所上市。,注：广东省供销社为天禾股份实控人
752,2020-09-11 13:48:26,云财经讯，氮化镓板块持续走高，海能实业涨13%，利亚德、扬杰科技、台基股份、华润微跟涨,氮化镓板块持续走高
753,2020-09-11 13:46:43,云财经讯，从今日举行的中关村论坛发布会上获悉，将于9月17日至20日在京举办的中关村论坛上，将集中发布半导体、创新药物、区块链、量子技术等领域的重大成果。戴尔科技“第五代存储”核心产品等59个国际项目，统信国产桌面及服务器操作系统V20、诺诚健华创新药奥布替尼（宜诺凯）、旷视科技“AI生产力平台Brain++商业版”、亿航216载人级自动驾驶飞行器、第四范式“企业级人工智能操作系统”等200多个国内项目将首次面向社会公开亮相。（北京日报）,中关村论坛9月17日开幕，将发布半导体、区块链等领域成果
754,2020-09-11 13:42:43,云财经讯，生态环境部副部长赵英民11日在国务院政策例行吹风会上表示，中国环保产业规模逐步发展壮大。据测算，2019年全国环保产业营业收入约1.78万亿元人民币，同比增长11.3%，远高于同期国民经济增长速度。2019年列入统计的企业11229家，从业人员近70万。（国是直通车）,2019年中国环保产业营收1.78万亿元
755,2020-09-11 13:41:30,云财经讯，马蜂窝旅游发布的2020国庆黄金周旅游趋势显示，自驾游和定制游在今年十一假期成为出行热点。在今年长达8天的“加强版”国庆黄金周中，不少游客选择自驾前往内蒙古、云南等地，开启长线自驾之旅。马蜂窝旅游大数据显示，“国庆自驾游”搜索热度周环比上涨153%。,十一自驾游搜索热度周环比涨153%
756,2020-09-11 13:40:20,云财经讯，双方将深入研究5G+智慧交通、车联网及车路协同、VR/AR等新技术，共同为智慧停车、智慧园区、智慧城市等提供整体解决方案，开展多领域、多渠道、多模式的市场合作，在市场拓展、项目推进、实施交付、服务运营等层面建立全面的战略合作伙伴关系。（苏交科官微）,苏交科集团与中兴通讯股份有限公司签署5G战略合作协议
757,2020-09-11 13:31:10,云财经讯，近日，国家能源集团煤制油首批调和柴油经化验确认符合0号车用柴油国家标准，开始销售出厂。这也标志着国家能源集团煤直接液化柴油工艺优化项目取得阶段性成功。（人民网）,国家能源集团成功研发出煤基调和柴油
758,2020-09-11 13:30:49,云财经讯，9月11日，昨日上市的创业板新股龙利得、海昌新材、万胜智能触发临时停牌，均较开盘价上涨30%。,昨日上市的三只创业板新股均触发临时停牌
759,2020-09-11 13:25:01,云财经讯，龙利得较开盘价涨30%，股票临时停牌,龙利得较开盘价涨30% 股票临时停牌
760,2020-09-11 13:22:35,云财经讯，据全国能源信息平台消息，随着各国从化石燃料发电转向更环保的替代能源发电，未来十年，太阳能和风能将为亚太地区带来1万亿美元的投资机会，相当于这一地区电力行业总量的三分之二。Wood Mackenzie的一份最新报告显示，至2030年，风能和太阳能在亚太地区发电结构中的占比将增加一倍以上，达到17%，在81个市场中，有逾51个市场的可再生能源占比都会超过10%。,未来十年，亚太区太阳能风能将吸引10000亿美元投资机会
761,2020-09-11 13:17:38,云财经讯，据双良节能消息，9月10日，双良节能全资子公司江苏双良节能投资有限公司与无锡探匠科技合伙企业合资合作，在江阴临港新城科创园正式成立了江苏双良硅材料科技有限公司。双方成立合资公司，将发挥各自的专业经验和优势资源，以研发、生产、销售大尺寸光伏级和电子级单晶硅生产设备及生产工艺，形成“设备+工艺+控制”的整体解决方案，以满足光伏产业迭代升级的市场需求以及半导体产业核心装备国产化的市场需求。,双良节能子公司与无锡探匠合资合作，入局大硅片产业
762,2020-09-11 13:11:25,云财经讯，9月11日午后，创业板注册制新股继续走强，截至发稿，卡倍亿拉升封板，安克创新、欧陆通、南大环境、杰美特等大幅跟涨。,创业板注册制新股继续走强 卡倍亿涨停
763,2020-09-11 13:10:58,云财经讯，国债期货午后跌幅扩大，10年期主力合约跌0.31%；银行间现券收益率上行幅度扩大，10年期国债活跃券200006收益率上行3bp报3.11%,国债期货午后跌幅扩大
764,2020-09-11 12:19:34,云财经讯，9月11日，流媒体巨头奈飞（Netflix）联合首席执行官里德·黑斯廷斯（Reed Hastings）表示，奈飞还没有收购电影院线的打算，目前还是以线上娱乐为主，并将持续改善系列影片，致力于打造世界上最好的电影。黑斯廷斯还谈到了与娱乐巨头迪士尼的竞争关系，其表示奈飞有在动画领域超越迪士尼的野心，但这需要长期的积累。（澎湃）,奈飞联合CEO：没有收购线下影院打算，将长期发展动画事业
765,2020-09-11 12:08:02,云财经讯，江苏省住建厅近日出台《关于推进建筑垃圾减量化的指导意见》，从开展绿色策划、实施绿色设计、推广绿色施工等方面明确减量举措。《意见》提出，到2025年底，各地逐步实现新建建筑垃圾再利用率高于30%，建筑垃圾排放量每万平方米不高于300吨（不包括工程渣土、工程泥浆）。（新华日报）,江苏省出台指导意见加快推进建筑垃圾减量
766,2020-09-11 11:56:40,云财经讯，Canalys在其最新的预测报告中预计，2020年全球5G智能手机出货量将达到近2.8亿台，其中62%来自大中华区，北美和欧洲中东非洲两大地区紧随其后。预计2020年智能手机出货量总额将比2019年全年同比下降10.7%，2021年则有望反弹同比增长9.9%，届时整个市场的出货量将超过13亿台。,报告：预计2020年5G智能手机出货量将达到近2.8亿台
767,2020-09-11 11:53:58,云财经讯，天山生物就媒体报道控股股东天山牧业的控股股东智本正业涉及场外配资一事发布澄清公告，智本正业一直从事农业投资管理，从未从事过股票配资业务。上述传闻均为不实传闻。经上海智本正业核实确认，其网站域名已于2020年3月21日到期，到期后已无官网。根据域名信息查询结果，该域名已被注册人dropcatch.com重新注册，并沿用原ICP备案信息，假冒上海智本正业名义，进行非法活动。,天山生物：智本正业从事股票配资业务为不实传闻
768,2020-09-11 11:51:33,云财经讯，天山生物澄清公告：传闻中关于上海智本正业投资管理有限公司从事配资业务等信息为不实传闻。其网站域名已被注册人 dropcatch.com 重新注册，并沿用原 ICP 备案信息，假冒上海智本正业名义，盗用并篡改上海智本正业营业执照,天山生物澄清公告：传闻中关于上海智本正业投资管理有限公司从事配资业务等信息为不实传闻
769,2020-09-11 11:47:51,云财经讯，近日，国家发改委、自然资源部、农业农村部联合印发《关于村庄建设项目施行简易审批的指导意见》，指导地方提高小型村庄建设项目审批实效，加快生态宜居美丽乡村建设。《指导意见》提出可以采取审批可行性研究报告的方式，合并办理项目建议书、可行性研究报告、初步设计等审批环节。允许地方结合实际，将部分审批事项依法委托乡镇政府实施。,国家发改委等三部门印发指导意见，推动村庄建设项目施行简易审批
770,2020-09-11 11:40:59,云财经讯，据国资小新，9月8日，在江苏省镇江市中国航天科工集团有限公司三院海鹰特材公司的生产车间，C919大型客机批生产的首批复材零件正式开工投产。这是C919从研制阶段转入批产阶段以来，复合材料生产线首次开工投产，同时意味着海鹰特材公司的C919项目参研工作顺利进入批产阶段。海鹰特材公司是C919项目的九大机体结构供应商之一，承担了C919大型客机上近40%的复合材料研制生产任务。,C919大型客机复材零件批生产启动
771,2020-09-11 11:35:19,云财经讯，在今天举行的2020中关村论坛新闻发布会上，北京经济技术开发区管委会常务副主任、北京市高级别自动驾驶示范区建设工作专班负责人孔磊表示，北京将建设全球首个高级别自动驾驶示范区。孔磊表示，北京市拟在前期领先的工作基础上，瞄准L4级以上高级别自动驾驶车辆规模化运行，统筹“车、路、云、网、图”等各类优质要素资源，规划建设高级别自动驾驶示范区，实现L4级自动驾驶出租车、智能网联公交车、自主代客泊车等高级别应用场景。（央视新闻）,北京将建设全球首个高级别自动驾驶示范区
772,2020-09-11 11:32:09,云财经讯，吉林省委书记巴音朝鲁希望中国机械工业集团继续关注和支持吉林振兴发展，围绕农业机械化、装备制造、科技研发、人才培养、基础设施建设等领域，开展全方位战略合作，加大投资力度，加快项目建设，共同推动高质量发展，实现更高水平互惠共赢。张晓仑表示将充分发挥自身资源优势，进一步加强农机装备制造、农机信息化智能化建设、农业国际合作开发等方面合作，助力吉林农业机械化和农机装备产业转型升级，为加快新时代吉林振兴作出积极贡献。（吉林日报）,吉林省与中国机械工业集团有限公司战略合作框架协议
773,2020-09-11 11:31:42,云财经讯，双方将通过搭建建设领域投资、基础设施建设、上下游产业“三位一体”合作平台，在通用民航机场、路桥、铁路、城市轻轨、水利水务、地下管廊、新型城镇化、旅游产业、基础设施等重大项目建设领域开展深层次合作，共同推动在开拓新能源、生态建设、危废改造等新兴产业领域的合作。（内蒙古日报）,内蒙古自治区政府与河北建设集团签署战略合作框架协议
774,2020-09-11 11:26:11,云财经讯，9月11日，在腾讯全球数字生态大会产业区块链专场上，腾讯云发布区块链底层引擎和区块链可信计算平台两大产品，进一步丰富区块链产品矩阵（通信世界网）,在腾讯全球数字生态大会产业区块链专场上
775,2020-09-11 11:26:02,云财经讯，上海晨鸣浆纸销售有限公司9月10日发布提价函：受运营成本居高不下影响，9月15日接单起，晨鸣铜版纸系列产品价格上调300元/吨；10月1日接单起，晨鸣铜版纸系列产品价格再次上调200元/吨。（纸引未来网）,晨鸣发布铜版纸涨价函，累涨500元/吨
776,2020-09-11 11:23:46,云财经讯，浙江省重点建设项目再扩容。记者日前从省发改委获悉，经省政府同意，《2020年省重点建设项目调整名单》正式印发。此次调整，共增补147个项目为省重点建设项目，总投资5496亿元，年度计划投资464亿元。至此，2020年省重点建设项目调整为817个，总投资35984亿元，年度计划投资4614亿元。（浙江日报）,浙江省重点建设项目再扩容 增补147个项目
777,2020-09-11 11:23:24,云财经讯，今日，在2020腾讯全球数字生态大会上，腾讯云副总裁刘煜宏透露，腾讯云大数据平台的算力弹性资源池达500万核，每日分析任务数达1500万，每日实时计算次数超过40万亿，能支持超过一万亿维度的数据训练。腾讯云不仅已经成为国内算力最强的云厂商，同时也是日实时计算量最大的公司。（​36氪）,腾讯云副总裁刘煜宏：大数据平台每日实时计算次数超过40万亿
778,2020-09-11 11:21:02,云财经讯，此次大会百度将首次与央视新闻联合举办。大会将展示百度内容生态、百度智能小程序、百度大脑、百度智能云、Apollo、小度等全年最新、最前沿的技术、产品、解决方案等最新成果。（TechWeb）,“万物智能--百度世界2020”大会将于9月15日在线上召开
779,2020-09-11 11:17:33,云财经讯，据媒体报道，无缘为iPhone 12供应OLED屏幕的京东方，仍有望在明年进入苹果的供应链，在明年下半年为iPhone 13供应OLED屏幕。京东方的高管已告知相关媒体，他们有一条名为B11的生产线，传言这一生产线将为明年下半年的iPhone 13生产OLED屏幕，因而也被他们称为“苹果生产线”，这一生产线预计在明年2月份开始满负荷运行。（ TechWeb）,京东方明年下半年有望为苹果iPhone 13供应OLED屏幕
780,2020-09-11 11:17:13,云财经讯，据中国汽车工业协会统计分析，2020年8月，销量排名前十位的轿车品牌依次为：轩逸、朗逸、英朗、速腾、宝来、卡罗拉、思域、帝豪、雷凌和雅阁。与上月相比，卡罗拉、思域和雅阁销量有所下降，其他品牌均呈增长，其中英朗和速腾增速更为明显。8月，上述十个品牌共销售29.70万辆，占轿车销售总量的36.16%。,中汽协：8月前十位轿车品牌共销售29.7万辆 占总销量的36%
781,2020-09-11 11:15:12,云财经讯，9月10日，由中国科学院和昆山市政府合作共建的安全可控信息技术产业化基地——中科可控产业化基地首台安全可靠服务器下线。活动现场，作为国产安全可靠计算机产品的代表，中科可控旗下的高端整机品牌“SUMA苏梦”同时发布。（新华日报）,中科可控智能化产线启用，首台安全可靠服务器下线
782,2020-09-11 11:14:10,云财经讯，科顺股份总裁方勇9月11日做客证券时报·微访谈时表示，从客户类型来看，公司将近80%的收入来自于房地产相关客户，20%是来自于市政基建项目；从销售渠道来看，公司65%的收入是直销客户贡献的，另外35%是经销收入。未来我们计划把市政基建的收入占比提高到30%-40%左右，经销收入占比提高到50%左右，包工包料收入占比保持稳定。我们认为这样的销售和收入结构是相对合理健康的。,科顺股份：未来我们计划把市政基建的收入占比提高到30%-40%左右
783,2020-09-11 11:12:08,云财经讯，河南省政府近日印发《河南省高速公路网规划（2021—2035年）》。《规划》第一阶段至2025年，通车里程达到10000公里以上；第二阶段至2035年，通车里程达到13800公里。远期展望至2050年，要推动高速公路智能化发展，促进大数据、互联网、人工智能、区块链、超级计算等新技术与高速公路深度融合；推动高速公路绿色集约发展，促进资源节约高效利用，强化生态环境保护修复，高速公路节能减排、资源节约、生态保护水平达到国内领先；推动高速公路与其他产业融合发展，培育“高速公路+产业”的新业态、新模式。（河南日报）,《河南省高速公路网规划（2021—2035年）》印发，通车总里程将达到13800公里
784,2020-09-11 11:09:05,云财经讯，9月10日，中关村西区智能交通系统上线试运行，该系统在边建设边使用过程中，西区交通拥堵得到极大缓解、交通流量增大，违停等秩序乱象基本杜绝。千方科技为该系统高点探头项目提供技术支持。今后，西区模式将在海淀区全区复制。（北京日报）,中关村西区智能交通系统试运行
785,2020-09-11 11:05:54,云财经讯，天眼查APP显示，9月9日，成都猫之日网络科技有限公司发生投资人（股权）工商变更，新增B站关联公司上海幻电信息科技有限公司，出资25万元，持股比例为20%。此外，该公司注册资本由此前的100万人民币增至125万人民币，增幅为25%。成都猫之日目前开发了一款名为泡沫冬景的游戏。此外，该公司还为游戏《赫炎的印加诺克的》发行公司和开发商之一。,B站关联公司入股成都猫之日 持股比例为20%
