,datetime,content,title
688,2020-04-22 10:19:45,云财经讯，深证成指率先翻红。,深证成指率先翻红
689,2020-04-22 10:19:11,云财经讯，沪指、深成指翻红,沪指、深成指翻红
690,2020-04-22 10:18:45,云财经讯，银保监会副主席黄洪：新冠肺炎疫情对我国经济社会发展带来了前所未有的冲击，疫情冲击下贷款逾期和违约情况增多，不良贷款有所增加。银行业仍保持较强风险抵御能力，各项监管指标均处于较高水平。,银保监会副主席黄洪：新冠肺炎疫情对我国经济社会发展带来了前所未有的冲击
691,2020-04-22 10:18:22,云财经讯，银保监会副主席黄洪：一季度末普惠型小微企业贷款同比增长25.93%，五家大型银行新发放普惠型小微企业贷款利率4.3%，在2019年基础上进一步下降0.3个百分点（中国网）,银保监会副主席黄洪：一季度末普惠型小微企业贷款同比增长25.93%
692,2020-04-22 10:13:47,云财经讯，银保监会副主席黄洪表示，截止目前，除湖北外，全国银行保险机构复工率约97%，银行保险网点复工率达到99%，湖北辖内已有6成多的银行保险机构、9成的银行保险网点复工，武汉辖内银行保险机构员工到岗率、网点复工率稳步提升，基本金融服务得到有效保障。,银保监会：银行保险网点复工率达到99%
693,2020-04-22 10:12:31,云财经讯，今日打新提醒：派瑞股份，申购代码300831，发行价3.98元，申购上限3.20万股，顶格申购需配市值32.00万元,今日打新提醒：派瑞股份 申购代码300831
694,2020-04-22 10:09:03,云财经讯，据朝中社21日报道，朝鲜最高领导人金正恩向两位国家有功人员送上了80岁寿筵。报道称，这两人分别是金日成勋章受勋者、劳动英雄、平壤市农村经济委员会前顾问李信子，以及金正日奖获奖者、教授、博士、金策工业综合大学研究员李时洽。（海外网）,朝中社：金正恩向国家有功人员送上80岁寿筵
695,2020-04-22 10:08:45,云财经讯，在22日上午的中钢协一季度信息发布会上，中钢协党委书记何文波介绍说，钢铁消费需求主要包括三大方向，一是建筑行业，二是制造业，三是出口，当前的钢铁需求下降是阶段性的。何文波表示，协会在年初从有关部门了解到，今年铁路、公路等基建投资额为3.5万亿元，再加上老旧小区改造，都将为钢铁需求提供重要支撑。,中钢协：当前钢铁需求下降是阶段性的
696,2020-04-22 10:05:02,云财经讯，2020年4月20日，山东孚日安防科技有限公司十万级二类医疗器械生产车间开始试生产运行。高密市政府副市长张帅和市有关部门领导，在孚日控股集团董事长孙日贵、总经理孙勇以及孚日安防总经理黄一鸣陪同下，参观考察了生产车间的运行情况。,孚日安防科技口罩防护服生产线试运行
697,2020-04-22 10:02:43,云财经讯，特高压板块拉升，国电南自拉升触板，智慧能源、四方股份、保变电气、通光线缆等跟涨。,特高压板块拉升 国电南自拉升触板
698,2020-04-22 10:00:53,云财经讯，据贵州茅台消息，4月21日，茅台集团党委书记、董事长高卫东与来访的中铁建工集团党委书记、董事长张建喜进行座谈，双方就深化合作，携手做好项目建设交换意见。,茅台集团与中铁建工集团进行座谈
699,2020-04-22 09:57:32,云财经讯，据华为中国政企业务官微，华为21日线上发布了基于自进化AI的HiSec Insight安全态势感知系统，该系统是华为面向企业全场景智能威胁检测推出的安全大脑,据华为中国政企业务官微
700,2020-04-22 09:56:58,云财经讯，4月22日早盘，化肥农药板块逆市走强，截至发稿，芭田股份、红太阳先后涨停，中旗股份、史丹利涨逾8%。,化肥农药板块走强  两股涨停
701,2020-04-22 09:53:43,云财经讯，贵州茅台涨2.3%，报1227.55元。,贵州茅台涨2.3%
702,2020-04-22 09:53:34,云财经讯，据路透社援引英国外交部常务次官西蒙·麦克唐纳的话报道称，英国政府对于允许华为参与英国5G网络建设工作的决定是坚定的。麦克唐纳表示，这一决定非常坚定并且不会复议。此前，美国一直在向英国施压，敦促其不要使用华为设备。华为公司已多次否认美方相关指控。（央视新闻）,英国称坚定允许华为参与5G建设
703,2020-04-22 09:53:21,云财经讯，人造肉板块开盘异动拉升，双塔食品涨停，丰乐种业涨8.43%，京粮控股涨3.63%，金字火腿、哈高科等跟涨,人造肉板块开盘异动拉升
704,2020-04-22 09:49:14,云财经讯，4月22日早盘，光刻胶概念反弹，截至发稿，容大感光触及涨停，飞凯材料、南大光电、上海新阳等跟涨。,光刻胶概念反弹 容大感光触及涨停
705,2020-04-22 09:48:03,云财经讯，国债期货涨幅扩大，10年期主力合约涨0.25%，5年期主力合约涨0.36%,国债期货涨幅扩大
706,2020-04-22 09:44:47,云财经讯，4月22日，科大讯飞召开2019年度及2020年第一季度网上业绩说明会。科大讯飞董秘江涛介绍，2019年科大讯飞持续推动人工智能核心技术突破及应用规模化落地，实现营收100.79亿，同比增长27.3%，是2015年度公司营收规模的四倍。,科大讯飞：2019年公司营收是2015年度营收规模的四倍
707,2020-04-22 09:44:28,云财经讯，港股TCL电子跌3.74%，此前回应遭申请提起337调查申请，称此案件不会对公司业务造成实质性影响,港股TCL电子跌3.74% 此前回应遭申请提起337调查申请
708,2020-04-22 09:42:45,云财经讯，数字乡村板块开盘异动拉升，芭田股份涨停，农产品涨3.48%，大北农涨2.29%，云图控股、新洋丰等跟涨,数字乡村板块开盘异动拉升
709,2020-04-22 09:40:52,云财经讯，光刻机（胶）板块开盘异动拉升，同益股份涨停，容大感光涨3.75%，华特气体涨3.37%，安集科技、胜利精密等跟涨,光刻机（胶）板块开盘异动拉升
710,2020-04-22 09:39:15,云财经讯，布伦特原油期货6月合约转跌，跌1.55%，现报19.00美元/桶,布伦特原油期货6月合约转跌
711,2020-04-22 09:35:56,云财经讯，半导体板块开盘异动拉升，康强电子涨停，沪硅产业涨4.53%，西陇科学涨2.56%，捷捷微电、阿石创等跟涨,半导体板块开盘异动拉升
712,2020-04-22 09:35:19,云财经讯，据广东省卫生健康委员会消息，4月21日0-24时，全省无新增境外输入确诊病例。累计报告境外输入病例191例。无新增境内确诊病例。新增无症状感染者5例，均为境外输入关联。其中，广州报告4例，通过密接排查和社区排查发现；东莞报告1例，通过隔离点发现。,广东无新增境内确诊病例 新增无症状感染者5例
713,2020-04-22 09:32:55,云财经讯，草甘膦板块开盘走高，红太阳大涨8%，长青股份、安道麦A纷纷走强,草甘膦板块开盘走高
714,2020-04-22 09:31:28,云财经讯，深交所向昌红科技下发关注函，要求公司结合深圳市柏明胜医疗器械有限公司和力因精准医疗产品（上海）有限公司生产的医疗产品、用途、市场竞争格局、生产资质、专利技术等，以及在手订单等情况，说明医疗产品业务对公司经营业绩的影响及可持续性；说明公司是否存在主动迎合市场热点、炒作公司股价的情形。,深交所向昌红科技下发关注函 要求是否存在炒作股价的情形
715,2020-04-22 09:31:24,云财经讯，数字货币概念股大幅低开，汇金股份逼近跌停，金财互联、广电运通、海联金汇、飞天诚信等跌幅居前。,数字货币概念股大幅低开
716,2020-04-22 09:30:13,云财经讯，科大讯飞于4月21日晚间同步发布2019年年度报告和2020年第一季度报告。2019年，科大讯飞人工智能战略进入2.0时代，围绕核心技术、用户规模、收入毛利及人均效益等几大任务，公司以源头技术驱动的战略布局成果不断显现，TO B及TO C双轮驱动成效显著。4月22日上午9点30分，科大讯飞将召开2019年度及2020年第一季度网上业绩说明会，证券时报·将“视频+图文”全程直播本次活动。,[直播]科大讯飞2019年度及2020年第一季度网上业绩说明会
717,2020-04-22 09:28:21,"云财经讯，大基建：宁波建工高开4.75%，大连重工高开0.89%;
云计算数据中心：浩丰科技高开8.45%，广东榕泰高开4.06%;
装修装饰：亚厦股份高开0.91%，科顺股份高开0.88%;
新冠检测：西陇科学高开2.99%，明德生物高开0.99%;
网红：引力传媒高开5.86%，天下秀高开5.56%，广博股份高开3.45%;
食品：来伊份高开2.15%，惠发食品高开1.36%;
快递物流：恒基达鑫高开10.07%，宏川智慧高开4.26%;
其他：新筑股份高开10.06%，供销大集高开9.95%，省广集团高开6.26%，宣亚国际高开5.19%，华北制药高开3.71%，梅轮电梯高开3.14%",4月22日集合竞价情况：数据中心板块溢价较高
718,2020-04-22 09:26:16,云财经讯，4月22日，贵州茅台小幅高开，上涨0.5%。消息面上，贵州茅台昨日晚披露年报，2019年净利同比增17%，拟10派170.25元。,贵州茅台开盘涨0.5% 昨日披露年报
719,2020-04-22 09:25:33,云财经讯，沪指低开0.46%，深成指跌0.78%，创业板指跌0.90%,沪指低开0.46% 深成指跌0.78% 创业板指跌0.90%
720,2020-04-22 09:19:18,云财经讯，山东省商务厅副厅长吕伟表示，下一步省商务厅将加大对新上线企业在阿里巴巴国际站等跨境电商平台网上推广的支持力度，促进线上洽谈交易。扩大线上云展会规模，拟于4月下旬至5月上旬在“一带一路”市场分别举办山东出口商品中东欧、巴基斯坦、泰国云展会，在此基础上拓展新市场、增加新订单、打造新链条。积极筹备网上广交会（6月15－24日）。发挥跨境电商、市场采购等优势，支持企业在相关国家和地区建立一批高质量海外仓。（大众日报）,山东将促进线上洽谈交易，扩大线上云展会规模
721,2020-04-22 09:16:11,云财经讯，央行今日不进行逆回购操作，今日没有逆回购到期,央行今日不进行逆回购操作
722,2020-04-22 09:15:36,云财经讯，法国卫生总署署长萨洛蒙21日说，法国新冠死亡病例升至20796例，较前一日增加531例。法国目前有30106名新冠患者在医院接受治疗，较前一日减少478人；5433人在重症监护室接受治疗，较前一日减少250人。（新华视点）,法国新冠死亡病例升至20796例
723,2020-04-22 09:12:29,云财经讯，龚正在座谈会上指出，要按照长三角一体化发展规划纲要明确的新定位，加快推进虹桥商务区开发建设。要抓好规划方案落地，力争尽快取得有显示度、有影响力的实际成效。要打造具有集聚辐射带动作用的高端服务业产业集群，进一步夯实大交通、大会展、大商务三大功能。要推进虹桥商务区与一体化示范区、临港新片区联动发展，并精心做好第三届进博会服务保障。（解放日报）,上海代市长龚正调研虹桥商务区：用好开放优势释放进博会溢出效应
724,2020-04-22 09:08:47,云财经讯，LME期镍跌3%,
725,2020-04-22 09:00:54,云财经讯，中金公司发文称，最近两个月秦皇岛5500大卡动力煤价格累计下跌了约15%至486元/吨，为最近四年首次跌破绿色区间，主要受产量稳中有增，进口维持高位，以及需求疲软的影响。虽然当前煤价已经触及部分矿山的成本线，但如果没有政策介入，煤炭企业通常会以逐步削减成本但是维持产量的方式来应对，因此煤炭还是供过于求。中长期来看，过低的煤价不利于煤炭行业的可持续发展，而煤炭产量和进口都存在一定的调节空间。,中金：中长期来看过低的煤价不利于煤炭行业的可持续发展
726,2020-04-22 09:00:03,云财经讯，内盘原油期货主力合约开盘跌停。沥青、燃油跌超8%，苯乙烯跌超6%,内盘原油期货主力合约开盘跌停
727,2020-04-22 08:59:15,云财经讯，基建投资发力正成为稳增长重要抓手，但需要强调的是，在扩大投资规模之外，扩大有效投资、提高投资效率更为重要。多项政策支持下，二季度基建投资增速将有力回升。不过，在量增的同时，更要提质，避免重复投资、低效投资。未来可以创新融资工具，为长期投资匹配更多长周期资金；改善项目评价方式，不仅从收益出发，也要结合合规性、社会价值，有效激发各类主体积极性；相信市场的判断，助力投资质量迈上新的台阶。,中证报头版评论：基建投资 增量更要重质
728,2020-04-22 08:56:52,云财经讯，《要点》围绕科创产业协同发展、基础设施互联互通、生态环境共保联治、民生服务便利共享等领域，遴选了132个项目作为长三角一体化发展年度重点项目，总投资9528.6亿元，2020年计划投资1178亿元。《要点》提出，实施合肥都市圈一体化发展行动计划，深化合芜蚌国家自主创新示范区建设；加快中国科学院量子信息与量子科技创新研究院建设；大力建设合肥国家新一代人工智能创新发展试验区；构建长三角世界级港口区，建设数字长三角等。（安徽日报）,《安徽省实施长江三角洲区域一体化发展规划纲要行动计划2020年工作要点》印发
729,2020-04-22 08:56:20,云财经讯，接受记者采访的一些业内人士表示，虽然此次疫情冲击很大，大部分线下培训机构生存艰难，但有“危”就有“机”，要抓住机遇和挑战。同时，此次疫情也会加速整个教育培训行业的洗牌。根据中国民办教育协会培训教育专业委员发布的“新型冠状病毒疫情对培训机构影响”的在线问卷调研结果显示，超过90%的机构表示存在大的影响，都普遍面临账上资金不足问题，“活下去”是唯一的愿望。（证券时报）,线下培训机构生存艰难 行业加速洗牌
730,2020-04-22 08:50:23,云财经讯，国家卫健委22日消息，4月21日0—24时，湖北无新增确诊病例，新增治愈出院病例5例（武汉5例），无新增死亡病例，现有确诊病例97例（武汉97例），其中重症病例15例（武汉15例）。,湖北现有确诊病例降至两位数
731,2020-04-22 08:49:25,云财经讯，国家卫健委：4月21日0—24时，31个省（自治区、直辖市）和新疆生产建设兵团报告新增确诊病例30例，其中23例为境外输入病例，7例为本土病例（黑龙江7例）,国家卫健委：4月21日0—24时 31个省（自治区、直辖市）和新疆生产建设兵团报告新增确诊病例30例
732,2020-04-22 08:48:13,云财经讯，中金公司称，贵州茅台2019年净利润略超预期，主要因均价提升超预期，同时考虑到公司产品结构升级和直营比例持续提升，上调今明两年盈利预测，并将目标价调升3.2%至1407元。,中金：上调贵州茅台目标价和盈利预测 均价提升助力业绩超预期
733,2020-04-22 08:42:41,云财经讯，截至4月21日，上交所融资余额报5520.24亿元，较前一交易日减少0.68亿元；深交所融资余额报4904.63亿元，较前一交易日增加10.93亿元；两市合计10424.87亿元，较前一交易日增加10.25亿元。,两市融资余额增加10.25亿元
734,2020-04-22 08:42:31,云财经讯，美国疾病控制与预防中心（CDC）主任罗伯特·雷德菲尔德接受美媒采访时表示，今年冬天可能会出现第二次新冠肺炎疫情，与流感季节同时出现，进而导致更严重的健康危机。尽管流感有预防性疫苗和治疗性药物，但它依然是一种致命性病毒感染，新冠病毒既没有获批的疫苗，也没有治疗性药物。流感和新冠病毒同时传播可能会使美国医院和卫生机构不堪重负。（海外网）,美疾控中心主任：美国今冬或出现更严重新冠肺炎疫情
735,2020-04-22 08:40:04,云财经讯，中信证券22日发布研报指出，贵州茅台2019年营收/净利润同增15%/17%，完美收官。疫情下公司龙头优势凸显，2020年业绩高确定性增长，看好茅台凭借强大的品牌力和稀缺性，表现出更抗周期波动的稳定性，享受估值溢价。综合判断2020Q1收入/净利润均望实现10%+增长。本周发布报告上调公司1年目标价至1500元，坚定推荐，维持“买入”评级。,中信证券：贵州茅台2019年完美收官 1年目标价1500元
736,2020-04-22 08:39:12,云财经讯，招商证券（香港）有限公司：将涪陵榨菜评级上调至强力买进，此前为谨慎买进； 目标价40元，即上涨20%。,招商证券（香港）有限公司：将涪陵榨菜评级上调至强力买进
737,2020-04-22 08:29:13,云财经讯，中信建投宏观固收首席分析师黄文涛在春季投资策略会上演讲表示，长期来看，由于中国自己的政策优势、制度优势，可能在后疫情阶段中国的股票市场会率先走出低谷，主要是新基建和老基建这两大主线。原油价格具备了长期的投资价值，黄金短期内可能还要继续的创新高。最后建议大家不应该担心通胀的问题，还是要关心通缩的问题。,中信建投春季投资策略：原油价格具备了长期的投资价值
738,2020-04-22 08:27:16,云财经讯，日经225指数跌幅扩大至2%,日经225指数跌幅扩大至2%
739,2020-04-22 08:20:25,云财经讯，4月底，快舟运载火箭总装总调中心（一期）将全面具备交付条件，一期工程投产后将具备年产20发火箭总装测试及试验能力。该中心顺利投产，将加速武汉航天产业集群形成，助推武汉经济高质量发展。（湖北日报）,快舟运载火箭总装总调中心（一期）近日通过预验收
740,2020-04-22 08:20:08,云财经讯，从多家券商处获知，中国证券业协会近期向证券公司下发了《证券公司声誉风险管理指引》征求意见稿，要求证券公司建立声誉风险管理制度和机制。指引》指出，证券公司应建立新闻发言人机制，由新闻发言人代表公司统一对外进行信息发布和沟通，针对新闻媒体和公众关注的公司重大事项、重要活动及经营管理行为，及时阐述公司正确的观点和立场，澄清虚假或不完整信息，为公司和行业发展营造良好的舆论环境。,中证协就券商声誉风险管理指引征求意见 新闻发言人将成标配
741,2020-04-22 08:12:38,云财经讯，海南省交通运输厅近日印发工作通知，要求各市县（区）交通运输主管部门继续做好交通运输领域清洁能源汽车年度推广应用工作，加快推进交通运输领域车辆清洁能源化，倡导绿色出行。根据通知，2020年度海南省新增和更换的公交车、巡游出租车、网约预约出租车100%使用清洁能源汽车，新增和更换公交车中新能源汽车的比例不低于90%；新增和更换的分时租赁汽车100%使用新能源汽车；新增和更换的旅游客车、班线客车使用清洁能源汽车的比例不低于20%。（海南日报）,海南省加快推进交通运输领域清洁能源汽车推广
742,2020-04-22 08:10:12,云财经讯，因港元触及强方兑换保证，香港金管局向市场卖出27.9亿港元,因港元触及强方兑换保证
743,2020-04-22 08:04:07,云财经讯，南京大学21日发布消息，著名杂志《科学美国人》近日刊登了由美国科学院院士M·里德和该校天文与空间科学学院郑兴武教授联合撰写的封面文章，他们及德国马普射电天文研究所K·门滕教授所领导的国际团队，用甚长基线干涉技术精确测量位于银盘上近200个大质量恒星的距离和自行，得到银河系旋臂的结构、太阳系的位置以及它绕银河系中心旋转的速度，绘制出尺度为10万×10万光年的全新银河系结构图。该图是迄今最精确的银河系结构图。（科技日报）,中美科学家绘出迄今最精确银河系结构图
744,2020-04-22 08:00:33,云财经讯，日经225指数开盘下跌0.89%，报19109.18点,日经225指数开盘下跌0.89%
745,2020-04-22 07:59:20,"云财经讯，黑龙江卫健委消息，4月21日0-24时,黑龙江省省内新增确诊病例7例（哈尔滨7例，本土无症状感染者转为确诊病例1例），其中：有4例是确诊病例陈某君（男，87岁）在哈医大一院住院期间同楼层同病区的住院患者、有3例为同期间住院患者陪护。全省新增境外输入确诊病例1例，为中国籍，福建省，从俄罗斯输入。",黑龙江昨日省内新增确诊病例7例
746,2020-04-22 07:54:48,云财经讯，上海市卫健委今早通报：4月21日0—24时，通过口岸联防联控机制，报告1例境外输入性新冠肺炎确诊病例。当日，无新增本地新冠肺炎确诊病例。,上海昨日新增1例境外输入病例
747,2020-04-22 07:54:35,云财经讯，世界卫生组织发言人21日表示，当前媒体和社交平台上流传着一些有关新冠病毒起源的谬论和阴谋论。世卫组织认为，就现有证据来看，这一病毒起源自动物而非实验室人为制造。（新华社）,世卫发言人：现有证据表明新冠病毒起源自动物
748,2020-04-22 07:54:34,云财经讯，TCL科技：Universal Electronics Inc.公司在美国国际贸易委员会对包括本公司在内的多家公司提起337调查申请，原告专利主要涉及电视产品之遥控相关技术，电视机业务并非公司经营范围，公司将据此提出异议及抗辩,TCL科技：Universal Electronics Inc.公司在美国国际贸易委员会对包括本公司在内的多家公司提起337调查申请
749,2020-04-22 07:54:09,云财经讯，记者经过走访发现，受小区带看名额的限制，北京二手房市场虽然逐步回温，但离正常状态还有一段距离。此前受疫情影响，市场观望情绪浓厚，二手房房源的持续增多，也将市场推向了买家。贝壳研究院数据显示，3月北京二手房市场开始低位回升，成交量恢复至去年3月小阳春水平的44%，预计二季度北京二手房市场累积需求将逐步释放，预计成交量将同比增长60%。（北京商报）,北京二手房市场逐步回温 买方议价仍占主导
750,2020-04-22 07:49:01,云财经讯，记者昨日从深圳市发改委获悉，该委联合中国进出口银行深圳分行签署合作协议，建立融资总量300亿元专项贷款，主要用于支持制造业、战略性新兴产业等行业企业的复工复产以及新基建重大投资项目的建设，以此支持深圳实体经济共渡难关，助力经济高质量发展。（深圳特区报）,深圳设300亿专项贷款支持实体经济
751,2020-04-22 07:45:11,云财经讯，记者从广东省统计局了解到，根据地区生产总值统一核算结果，2020年一季度广东省地区生产总值为22518.67亿元，同比下降6.7%。其中，第一产业增加值为876.6亿元，同比下降0.3%；第二产业增加值为7978.07亿元，同比下降14.1%；第三产业增加值为13664亿元，同比下降1.5%。（深圳特区报）,一季度广东GDP约22518亿元
752,2020-04-22 07:44:45,云财经讯，当地时间21日，智利卫生部公布该国新增新冠肺炎确诊病例325例，累计达到10832例；新增死亡病例8例，累计达147例；治愈患者达到4969人，治愈率为45%。智利卫生部认为在未来几天该国的治愈率可超过50%。根据多家媒体报道，距离首都圣地亚哥约30公里的上普恩特监狱出现了聚集性感染，目前至少有68名囚犯和81名狱警确认感染。（央视新闻）,智利新冠肺炎确诊病例升至10832例 一监狱内出现聚集性感染
753,2020-04-22 07:43:57,云财经讯，据悉，此次与浦东新区签署新一轮合作备忘录，上海海关将从七方面进一步支持浦东新区优化营商环境，包括深化自贸试验区海关改革创新、支持综合保税区建设发展、支持具有全球影响力的科创中心建设、支持浦东新区打造进口商品常年展示展销平台、支持浦东新区打造总部经济高地、支持对外贸易新业态发展、完善通关便利化措施等。随着金桥综合保税区的正式挂牌，上海地区5个获批转型的综保区已全部完成验收和挂牌程序。（解放日报）,浦东与上海海关签署合作备忘录，金桥综合保税区正式挂牌
754,2020-04-22 07:41:21,云财经讯，当地时间4月21日，南非总统拉马福萨发表演讲阐述南非未来抗疫举措表示，目前南非抗疫正处于第二阶段，稳定经济，解决物资供应短缺以及保护就业成为重点。南非政府将提供5000亿兰特的一揽子支持计划，该笔资金约占南非GDP的10％。（央视新闻）,南非总统：将提供约占南非GDP10％的资金支持抗疫
