,datetime,content,title
465,2020-09-12 13:17:20,云财经讯，中国进出口银行原董事长李若谷表示，对企业和金融业的监管，个人认为并不是越严越好，监管和管理一定要适应现在的发展水平、人员结构、机构水平等，是“适度为好”，怎么在监管与发展之间找出平衡，使监督和管理既适应风险控制的要求，又能促进企业和经济的不断发展和壮大，是我们不得不思考的一个问题。（证券时报）,中国进出口银行原董事长李若谷：对企业和金融业的监管 并不是越严越好
466,2020-09-12 12:33:28,云财经讯，陕西地方债补充中小银行资本方案即将上报，金额46亿（21财经）,陕西地方债补充中小银行资本方案即将上报
467,2020-09-12 12:10:34,云财经讯，联合国大会11日通过决议，敦促会员国通过加强国际合作与团结互助应对新冠疫情。决议敦促会员国加强卫生系统和社会关怀系统；敦促会员国致力于让所有国家及时获得优质、安全、有效和负担得起的诊断工具、治疗方法、药物和疫苗；鼓励会员国与所有相关利益攸关方开展合作，增加疫苗和医药的研发资金，利用数字技术，加强抗击新冠病毒所需的国际科学合作。（新华网）,联合国大会通过新冠肺炎疫情决议
468,2020-09-12 12:09:39,云财经讯，来自国家航天局的消息：今天（12日），已在月球背面工作618天的嫦娥四号着陆器和“玉兔二号”月球车，再次受光照自主唤醒，分别于9月12日5时15分和9月11日11时54分，迎来第22月昼工作期。（央视新闻）,嫦娥四号着陆器和“玉兔二号”月球车进入第22月昼工作期
469,2020-09-12 11:48:59,云财经讯，中国国际经济交流中心副理事长黄奇帆谈到“双循环”形势下“一带一路”建设应把握好的要点时称，接下来，要在进一步扩大与沿线国家和地区人民币互换和清算安排的基础上，推动中国与沿线的贸易和投资尽可能以人民币计价、以人民币收付、以人民币结算、以人民币储备，在扩大使用中加快推进人民币国际化。（新京报）,黄奇帆：推动中国与“一带一路”沿线的贸易投资尽可能人民币计价
470,2020-09-12 11:41:18,云财经讯，记者从贵州省发改委获悉，今年1月至8月，贵州省重大工程项目完成投资4993.34亿元、占年度计划的68.8%，建成项目161个。（新华社）,贵州前8个月重大工程项目完成投资近5000亿元
471,2020-09-12 11:27:18,云财经讯，国家粮食和物资储备局昨天（11日）表示，夏粮收购进展顺利，已近尾声，秋粮收购加快腾仓备库。今年，湖北、安徽、江苏、河南四省先后启动小麦最低收购价执行预案，江西启动早籼稻最低收购价执行预案。截至8月底，主产区小麦累计收购4926万吨、早籼稻累计收购472万吨，其中最低收购价收购分别为615万吨、40.5万吨。（央视新闻）,国家粮食和物资储备局：夏粮收购接近尾声 秋粮收购将启动 谷物库存充裕
472,2020-09-12 11:25:01,云财经讯，9月12日，光大银行与华为软件技术有限公司在东莞“华为开发者大会2020（Together）”上签署合作备忘录。根据协议，双方将在光大银行金融科技领域和华为服务号开展全面合作。（中证网）,光大银行与华为软件技术有限公司签署合作备忘录
473,2020-09-12 11:23:16,云财经讯，综合塔斯社和俄罗斯卫星通讯社9月12日报道，俄罗斯卫生部发言人当天表示，首批 “卫星-V（Sputnik V）”疫苗已运往俄罗斯相关地区。“作为试点交付的一部分，将确保向俄罗斯联邦组成实体运送疫苗的物流链、向高风险群体公民分发和组织接种针对新冠肺炎的疫苗。”卫生部发言人说。(澎湃),首批“卫星-V”疫苗已向相关地区发运，高风险群体优先接种
474,2020-09-12 11:12:41,云财经讯，9月11日晚间，上交所科创板披露了京东数字科技控股股份有限公司的招股说明书。据悉，京东数科本次拟发行不超过5.38亿股，占发行后总股本的比例不低于10%。本次发行全部为新股，不涉及原股东公开发售股份。此外，京东数科此次发行引入超额配售选择权（俗称“绿鞋机制”），超额配售选择权最高不超过发行数量的15%，其联席保荐机构和主承销商为国泰君安和五矿证券。（新京报）,京东数科IPO招股书首次披露，将引入“绿鞋机制”
475,2020-09-12 11:06:02,云财经讯，近日，外媒纷纷聚焦中国8月进出口数据。美国《华尔街日报》报道，中国出口——这个拉动中国经济增长的其中一驾马车，在8月份继续获得动力。因为包括美国在内的一些国家正逐渐从新冠疫情中复苏，这些国家在8月份采购了更多中国制造的商品。英国《金融时报》报道，牛津经济研究院（Oxford Economics）的高路易（Louis Kuijs）表示，中国出口连续3个月实现同比增长对全球贸易而言是个好兆头。（央视新闻）,外媒：强劲出口将提振中国经济
476,2020-09-12 10:35:20,云财经讯，11日于广州举办的广东国际旅游产业博览会上，粤港澳大湾区“9+2”城市旅游市场联合监管协作体签约并正式组建运作。来自香港特别行政区、澳门特别行政区以及广东省广州、深圳、珠海、佛山、惠州、东莞、中山、江门、肇庆等9个城市的文化和旅游主管部门，共同签署了《粤港澳大湾区“9+2”城市旅游市场联合监管协议书》。（新华社）,粤港澳大湾区“9+2”城市旅游市场联合监管协作体成立
477,2020-09-12 10:16:07,云财经讯，9月12日上午，300名上海游客乘坐C3856次列车从上海火车站启程，前往江苏南通开启为期两天的人文休闲之旅，这也是沪苏通铁路自今年7月开通后的首趟高铁旅游专列。（央视新闻）,沪苏通铁路迎来开通后首趟高铁旅游专列
478,2020-09-12 09:54:11,云财经讯，国家计算机病毒应急处理中心近期通过互联网监测发现，多款游戏类移动应用存在隐私不合规行为，涉嫌超范围采集个人隐私信息。违法、违规移动应用有：《汤姆猫跑酷》（版本4.3.2.351）、《宾果消消消®》（版本7.5.1）、《我的安吉拉》（版本4.6.2.1007）、《我的汤姆猫》（版本5.8.8.671）、《植物大战僵尸2》（版本2.4.84）、《迷你世界》（版本0.44.2）、《开心消消乐》（版本1.83）、《和平精英》（版本1.8.10）、《天天飞车》 （版本3.6.4.709）、《微赛斗地主》（版本1.7.2.0）、《贪吃蛇大作战®》（版本4.3.36）、《神庙逃亡2》（版本5.4....,14款游戏APP存在隐私问题
479,2020-09-12 09:47:15,云财经讯，多位中美专家学者和业内人士日前在美国中国总商会举办的视频对话活动上表示，多项调查显示，尽管中美两国企业因疫情面临挑战，但大都表示愿意继续在对方国家经营。普华永道美国公司市场分析部中国分析业务负责人克雷格·斯特龙贝尔表示，近期报告显示，超过八成的美国在华企业不考虑撤离中国市场。上海美国商会日前发布的调查显示，在340多个受访成员企业中，约92%的受访者表示，将继续在中国经营。（新华社）,调查显示中美两国企业愿继续在对方国家经营
480,2020-09-12 09:38:33,云财经讯，当地时间12日上午，日本首相安倍晋三再度前往位于东京的庆应大学医院，治疗困扰他已久的溃疡性大肠炎。据日本共同社报道，安倍曾在今年8月17日和8月24日连续两周赴庆应大学医院检查身体。此次距离他上次赴该院仅过了19天的时间，也是他8月28日宣布辞职后首次赴医院接受诊治。（海外网）,安倍辞职后首次赴医院就诊，治疗宿疾溃疡性大肠炎
481,2020-09-12 09:29:21,云财经讯，9月11日，据外媒转引两位知情人士透露，特斯拉正计划将中国制造的Model 3汽车出口到亚洲和欧洲市场。对此，特斯拉中国方面回应称暂时未收到消息（界面）,据外媒转引两位知情人士透露
482,2020-09-12 09:21:21,云财经讯，当地时间9月11日，智利卫生部公布，全国新冠肺炎新增确诊病例1860例，累计确诊430535例；新增死亡69例，累计死亡11850例；累计治愈403064例，现有病例15621例；累计进行病毒核酸检测2753769人次。此外，智利总统皮涅拉当天宣布，将把自今年3月18日开始的“国家灾难状态”自本月15日起再度延长90天，根据此前的规定，这项原定于本月14日结束的政策因国庆假期仅延长10天。（央视新闻）,智利新冠肺炎病例累计确诊超43万 “国家灾难状态”再度延长90天
483,2020-09-12 09:02:52,云财经讯，媒体称，日本首相安倍晋三再次前往位于东京的医院,日本首相安倍晋三再次前往位于东京的医院
484,2020-09-12 08:58:45,云财经讯，世界制造业大会江淮线上经济论坛9月12日正式开幕。大会论坛以“线上经济赋能高质量发展”为主题，举办云开幕、云论坛、云展示、云签约等“四朵云”活动。大会论坛首次采用线上形式，通过网络直播互动技术，将开幕式主旨论坛的主会场与安徽省16个市的分会场连线互动，并通过云平台直播全球。9月12日上午9点，世界制造业大会江淮线上经济论坛开幕式暨主旨论坛正式开始，证券时报将全程视频直播。,置顶世界制造业大会江淮线上经济论坛
485,2020-09-12 08:39:42,云财经讯，国家卫健委：9月11日0—24时新增确诊病例6例，均为境外输入病例（上海2例，广东2例，福建1例，陕西1例）；无新增死亡病例；新增疑似病例1例，为境外输入病例（在上海）,国家卫健委：9月11日0—24时新增确诊病例6例
486,2020-09-12 08:14:46,云财经讯，媒体称，美国谷歌反垄断案件调查范围将扩大，谷歌的搜索与数字广告业务将成焦点,美国谷歌反垄断案件调查范围将扩大
487,2020-09-12 08:13:15,云财经讯，意大利金融市场监管局主席保罗·萨沃纳新冠肺炎病毒检测呈阳性，目前尚无症状，正在居家隔离工作。意大利金融市场监管局表示，为采取消毒措施，其罗马及米兰的办公场所在下周工作日(9月14-18日)期间关闭，但工作人员将通过远程办公方式确保机构正常运转。（央视）,意大利金融市场监管局主席新冠肺炎病毒检测呈阳性
488,2020-09-12 07:42:57,云财经讯，媒体称，英国与日本的贸易协定将会在10月签署,英国与日本的贸易协定将会在10月签署
489,2020-09-12 07:41:40,云财经讯，那些不想付六成首付或者着急卖房的人都赶在9月12日前办好了网签。截至9月11日11时40分止，常州商品房网签数量超过了1700套，业内预计12点之前或可以网签接近1800套左右。（21世纪经济报道）,常州调控升级如期而至，9月11日网签突增至1800套
490,2020-09-12 07:33:10,云财经讯，当地时间9月11日，欧洲理事会同意在欧盟2020年预算中增加62亿欧元，以应对新冠肺炎疫情危机的影响并为研发疫苗提供资金。（央视新闻）,​欧洲理事会批准欧盟2020年预算增加62亿欧元
491,2020-09-12 07:19:46,云财经讯，随着多个非洲国家不断扩大新冠病毒测试规模，世界卫生组织和非洲疾控中心在非洲联合启动了一个实验室网络，用以加强新冠病毒的基因组测序。该网络包括12个实验室，将为它们所在的国家和周边国家提供测序、数据分析和其他技术支持服务。（央视新闻）,新冠病毒基因组测序实验室网络在非洲启动
492,2020-09-12 07:00:24,云财经讯，9月12日，第31届上海旅游节将拉开帷幕，今年的上海旅游节将首次由沪苏浙皖三省一市共同举办。除了主会场上海，今年上海旅游节还有三个分会场，分别为江苏省南通市、浙江省温州市和安徽省黄山市。（央视新闻）,2020年上海旅游节将开幕 长三角三省一市联动
493,2020-09-12 06:56:49,云财经讯，9月11日，中国和挪威举行自贸协定首席谈判代表视频会议，双方就货物贸易、服务贸易、贸易救济、竞争、电子商务、知识产权、环境与贸易、海关议题、技术性贸易壁垒、法律、争端解决等议题展开深入磋商，会议取得了显著进展。（央视新闻）,中国和挪威举行自贸协定首席谈判代表视频会议
494,2020-09-12 06:52:50,云财经讯，2020年已经过了一大半，化解水泥过剩产能的“大限”将至，各地正加紧水泥产能置换、加快淘汰水泥落后产能。因此，多地赶在2021年之前扩大了产能置换的规模。注：工业和信息化部今年初公开的《水泥玻璃行业产能置换实施办法操作问答》明确提出，已停产2年或3年内累计生产不超过1年的水泥熟料、平板玻璃生产线不能用于产能置换，该项规定自2021年1月1日起实行。,多地加快淘汰水泥落后产能
495,2020-09-12 06:50:30,云财经讯，当地时间11日，世卫组织发言人法蒂拉·沙伊布表示，刚果(金)新一轮埃博拉疫情持续蔓延，目前共计影响12个卫生区，已确诊107例埃博拉病例。由于部分出现疫情的卫生区与邻国刚果(布)接壤，增加了疫情蔓延至其他国家的风险。,世卫组织：刚果（金）新一轮埃博拉疫情持续蔓延
496,2020-09-12 06:45:25,云财经讯，截至当天收盘，道琼斯工业平均指数上涨131.06点，收于27665.64点，涨幅为0.48%；标准普尔500种股票指数上涨1.78点，收于3340.97点，涨幅为0.05%；纳斯达克综合指数下跌66.05点，收于10853.54点，跌幅为0.60%。大型科技股普遍走低，疫苗股普涨。,美股收盘涨跌不一 疫苗股普涨
497,2020-09-12 06:42:30,云财经讯，最近一个月，共有6家钢铁行业上市公司获机构密集调研，占该行业成份股比例的17.14%，位居申万一级行业前列。具体来看，华菱钢铁、永兴材料、久立特材、鞍钢股份、甬金股份等5家钢铁企业累计接待调研的机构数量均在10家以上。此外，三钢闽光也获得3家机构的集中调研。（证券日报）,钢铁行业需求向好，6家公司获机构密集调研
498,2020-09-12 06:41:35,云财经讯，最近一个月，共有52家计算机行业上市公司接待了机构的调研，占该行业上市公司总数的比例达20.80%。共有39家计算机公司接待调研机构家数超过10家。8家公司获超百家机构光顾。其中，德赛西威参与调研的机构家数最多，达到318家；紧随其后的是中科创达，参与调研机构家数为291家；广联达参与调研的机构家数也超过200家。其他参与调研机构家数超过百家的上市公司还有科大讯飞、绿盟科技、虹软科技、宇信科技、金山办公。（证券日报）,8家计算机公司均获超百家机构走访，德赛西威居首
499,2020-09-12 06:39:20,云财经讯，8月11日至9月10日的一个月内，家用电器行业共有13家公司被机构走访，九阳股份、荣泰健康、海信家电、三花智控等4家公司接待调研机构家数均在20家及以上，分别为155家、89家、40家、20家。值得注意的是，这13家获机构调研的家电公司中，有10家为中小创公司。（证券日报）,机构摸底13家家电上市公司，社保基金抢先潜入5只股
500,2020-09-12 06:37:11,云财经讯，根据同花顺数据统计后发现，近1个月时间内，共有582家上市公司接待多类机构调研。其中，电子行业共有68家上市公司被机构集中走访，被调研公司家数占行业成份股比例达23.78%，行业占比位居申万一级行业首位。最近一个月被机构调研的68家电子行业上市公司中，有12家公司被百家以上机构调研，分别是兆易创新（334家）、歌尔股份、生益科技、立讯精密）、澜起科技、工业富联、圣邦股份、锐明技术、领益智造、TCL科技、卓胜微、东山精密。,覆盖面近四分之一，电子成机构调研密度最高板块
501,2020-09-12 06:33:43,云财经讯，调查发现，部分险企的万能险结算利率全部下调至5%以下，部分险企产品结算利率分化，有的维持高位、有的则直接下调至2.5%。国华人寿的周结算万能险产品——国华智多宝终身寿险（万能型）（E账户）在8月17日及之前的结算利率为年化5.84%，从8月24日起，该款产品的结算利率直接下调至2.5%，但与此同时，该公司仍有多个万能险账户的结算利率未发生变化，稳定为年化5.84%。（证券日报）,8月有万能险结算利率跳水，从年化5.84%直降至2.5%
502,2020-09-12 06:31:19,云财经讯，离岸人民币（CNH）兑美元北京时间04:59报6.8331元，较周四纽约尾盘涨120点，盘中整体交投于6.8453-6.8318元区间,离岸人民币（CNH）兑美元北京时间04:59报6.8331元
503,2020-09-12 06:30:43,云财经讯，周五（9月11日）纽约尾盘，CME比特币期货BTC主力合约报10350美元，较上日纽约尾盘涨0.34%，盘中交投于10215-10420美元区间，本周累跌2.54%,周五（9月11日）纽约尾盘
504,2020-09-12 06:30:23,云财经讯，9月11日下午1点多，记者仍能打开开展配资业务的“智本正业”网站，该网站仍在运营。此外，该网站客服表示，公司与上海智本正业为同一个老板。不过，截至发稿，该网站已经不能打开，页面显示：“智本正业目前正在排查网络流量攻击，网站进行维护，预计维护时间12小时，给您带来不便敬请谅解。”（证券日报）,天山生物实控人陷配资业务“罗生门”：涉事网站客服称是“同一个老板”
505,2020-09-12 06:20:09,云财经讯，多位业内人士表示，在结构性存款等高成本负债不断压降的背景下，银行对其他稳定负债的需求和依赖明显增强，近期同业存单发行量价齐升就是直接体现。未来，银行对负债的争夺将日趋白热化，核心存款有望进一步受到重视。（中证报）,负债端压力升级，银行高喊做大核心存款
506,2020-09-12 06:16:13,云财经讯，机构数据显示，全国29个重点城市钢材社会库存量出现了连续四周上升。业内人士指出，目前钢材需求只是滞后，随着钢铁行业进入传统需求旺季，需求将逐步好转，9月份钢材市场不具备大幅下跌的条件。（中证报）,需求滞后，库存攀升，业内人士：钢价后市不会出现大幅下跌
507,2020-09-12 06:09:07,云财经讯，A股经历大跌之后，向下的空间很有限，从整体趋势来看，受流动性、经济基本面等因素决定，A股本轮行情远未走完，下周A股市场很可能迎来反弹期。首先，只要是优质的股票，跌得越多，反弹也就越厉害。其次，受疫情影响最大，但随着疫情逐步得到控制，行业出现拐点的行业，最典型的就是航空、机场、旅游等。第三，行业景气度不断向好的，比如光伏、证券、金融信息等行业。第四，低估值的品种，比如银行、保险、地产、环保、电力等蓝筹股。,证券时报评论：让损失的都回来吧，暴跌后抢抓反弹的四大方向
508,2020-09-12 05:46:26,云财经讯，受本周A股市场与国际市场大幅震荡影响，北上资金全周小幅净卖出5.83亿元，但分市场来看，北上资金正趁中小盘成长股大幅调整之机，积极抄底。北上资金本周加仓幅度前10位的个股中，飞利信、易成新能、银江股份、科大智能等7股为创业板个股，鸿达兴业、紫鑫药业2股为中小板，越秀金控为深市主板，没有沪市个股。长春高新、复星医药、兴业银行、东方财富等69股本周也获得北上资金超亿元的净买入。三一重工、立讯精密、京东方A、新希望等70股则被净卖出超亿元。（证券时报）,无惧调整，北上资金大举抄底创业板
509,2020-09-12 05:39:42,云财经讯，从深圳多个货代公司处了解到，目前海外各主要贸易国家都已通航，其所在公司的外贸出货量增加了三成至六成不等。但受疫情影响，柜少，航期缩减太多，舱位十分紧张。“好像抢柜一样的。”一名外贸从业人士表示，“感觉到处爆仓，我们都订不到舱。”有船运业内人士预测，订舱难问题暂时难以改善，且越往后越难，10月起欧美航线、日本航线等都可能一舱难求。（证券时报）,珠三角外贸迎采购小高潮，工厂加班抢舱发货
510,2020-09-12 05:34:10,云财经讯，限购政策目前看来很有必要，这是在房产稀缺情况下不得已的措施，补丁政策也很有必要，能堵上各种投机者。但是，限购政策已实施多年，不但没有终结的客观条件，反而更为迫切。限购本应是短期行为，现在却成了长期机制。各方对此要有更多反思。 猪肉价格上涨，政府号召多养猪，某种农产品价格上涨，政府就补贴扩大规模，但是房价上涨，政府却从限制购买力着手。现在房价大涨的警报一直没有解除，是因为房源供应一直不足。平抑房价的办法是建更多住宅，当住宅不再被哄抢，房价自然平稳，自然就不需要这样不停打补丁了。,证券时报头版评论：深圳房产限购满身补丁，治本还在增加供应
511,2020-09-12 05:29:50,云财经讯，默沙东：本公司研发的新冠肺炎疫苗开始进入人体试验阶段,默沙东：本公司研发的新冠肺炎疫苗开始进入人体试验阶段
512,2020-09-12 05:11:55,云财经讯，标普500指数11大板块涨跌各异，7大板块（工业、材料、金融、日常消费品、医疗保健、公用事业、能源）收涨，4大板块（信息技术、非日常生活消费品、电信业务、房地产）收跌，工业板块领涨，涨1.39%，其次是材料板块，涨1.31%；信息技术板块领跌，跌0.75%，其次是非日常生活消费品板块，跌0.32%。,工业板块领涨标普500指数11大板块，信息技术板块领跌
513,2020-09-12 04:28:20,云财经讯，美股各大类资产类ETF中，大豆基金-Teucrium领涨，涨1.47%，本周累涨1.83%，为连续第五周上涨，该基金在4月触及纪录低点；新兴市场ETF-iShares涨近1%。农产品基金-PowerShares也上涨0.95%，为连续第五周上涨，该基金在今年6月触及纪录低点。恐慌指数做多-iPath领跌，下跌近6%，其次是纳指100ETF，跌约0.8%。,触底反弹？大豆基金-Teucrium连涨五周，从纪录低点累涨17%
514,2020-09-12 04:08:44,云财经讯，美股各行业ETF中，金融业ETF和银行业ETF领涨，涨超0.7%，其次是日常消费品ETF，涨0.59%；互联网ETF领跌，跌近1%，科技行业ETF跌0.76%,美股各行业ETF中 金融业ETF和银行业ETF领涨
515,2020-09-12 03:58:45,云财经讯，道指初步收涨逾百点，耐克涨超3%领跑其成分股，卡特彼勒、陶氏化学、可口可乐涨超2%，但Salesforce跌超2%。主要科技股里，Nikola跌约15%，AMD跌超3%，亚马逊跌超2%，苹果跌超1%，特斯拉涨0.3%。疫苗股普遍上涨，Moderna涨超3%。亚马纳黄金跌超2%，领跌金银矿业类股。中概股跟谁学涨超4%,道指初步收涨逾百点
516,2020-09-12 03:52:45,云财经讯，汇丰将维达国际评级上调至买入，目标价为31.20港元,汇丰将维达国际评级上调至买入
517,2020-09-12 03:51:44,云财经讯，吉利德科学（GILD）维持超过2.6%的涨幅，据媒体报道，美国医院拒绝了大约三分之一分配的瑞德西韦,据媒体报道 美国医院拒绝了大约三分之一分配的瑞德西韦
518,2020-09-12 03:41:23,云财经讯，恐慌指数VIX跌超10.5%，报26.52，创9月3日以来盘中新低。标普500指数目前则涨约0.2%,恐慌指数VIX跌超10.5% 创9月3日以来盘中新低
519,2020-09-12 03:15:10,云财经讯，Nikola首席财务官：本公司下周将回应卖空者的报告,Nikola首席财务官：本公司下周将回应卖空者的报告
520,2020-09-12 03:14:12,"云财经讯，当地时间9月11日，美国传染病专家安东尼·福奇表示，不同意特朗普关于疫情“即将结束”的言论。福奇表示，目前美国疫情数据“令人担心”。美国劳动节三天小长假刚刚过去，福奇希望美国不会再次重现六月和七月的疫情反弹现象。“我们目前稳定在每天新增40000例病例，死亡约1,000例”，福奇说，在这种情况下，达科他州等地区还正在出现确诊率升高的情况，然而即将进入秋季流感季节，疫情防控风险会进一步加大。（央视新闻）",福奇：不同意特朗普“疫情将尽”说法，数据仍然“令人担心”
521,2020-09-12 03:05:00,云财经讯，根据住建部发布的城乡统计年鉴统计发现，2014年至2018年五年间，有451个城市“城扩人增”，有87个城市“城扩人走”，有18个城市“城缩人增”，有13个城市“城缩人走”。（21世纪经济报道）,五年间87个城市“城扩人走”
