,datetime,content,title
287,2020-04-23 06:30:57,云财经讯，据媒体报道：日本神户制钢自5月份开始将暂时解雇1万名员工,据媒体报道：日本神户制钢自5月份开始将暂时解雇1万名员工
288,2020-04-23 06:29:40,云财经讯，康方生物：把香港IPO价格定在每股16.18港元,康方生物：把香港IPO价格定在每股16.18港元
289,2020-04-23 06:27:17,云财经讯，Wind数据显示，截至4月22日，今年以来有781家上市公司购买了各类理财产品（主要为银行理财和信托），累计购买金额达到3524.32亿元。而去年同期对应的数据分别为919家和4637.13亿元。整体来看，购买理财产品的上市公司同比减少了138家，购买理财产品累计金额同比骤降24%。业内人士称，整体来看，上市公司中的传统理财大户变动不大，不过累计理财金额在1亿元-50亿元的上市公司数量明显减少。（中证报）,结构性存款成主流，上市公司今年以来理财规模同比降24%
290,2020-04-23 06:24:25,云财经讯，戴姆勒一季度梅赛德斯奔驰EBITDA初步营收5.1亿欧元,戴姆勒一季度梅赛德斯奔驰EBITDA初步营收5.1亿欧元
291,2020-04-23 06:23:50,云财经讯，美国白宫新冠病毒协调员Birx：美国有一整个夏天的时间来准备，以防新冠肺炎疫情卷土重来,美国白宫新冠病毒协调员Birx：美国有一整个夏天的时间来准备
292,2020-04-23 06:19:01,云财经讯，联合国感染新冠病毒员工人数升至249人（新华社）,联合国感染新冠病毒员工人数升至249人（新华社）
293,2020-04-23 06:18:34,云财经讯，天相投顾数据显示，截至2020年一季度末，剔除货币基金和理财债基，QDII基金规模为457.22亿元，较2019年四季度的383.40亿元增长了73.82亿元，环比增幅为19.25%。通过梳理QDII基金一季报发现，基金经理大多提及，因海外疫情扩散影响，一季度以来海外市场出现明显波动，这对基金投资产生一定影响。但基于海外防控措施的升级，疫情影响已在逐渐降低，依然看好海外市场投资机会，尤其是中资美元债投资机会。（中证报）,基金经理瞄准中资美元债投资机会
294,2020-04-23 06:17:24,云财经讯，天相数据显示，剔除货币和理财债基，一季度公募基金（不含估算基金）总规模达79075.59亿元，去年四季度末这一数据为68291.69亿元，规模大幅增长15.79%。按照净申购份额来看，各类ETF基金产品无疑是一季度的“吸金神器”。5GETF、芯片ETF、券商ETF、证券ETF、银华5GETF等基金产品一季度均实现了大额的净申购。其中，5GETF一季度末的规模为309.87亿份，而去年四季度末，这一数据为76.99亿份；芯片ETF一季度末规模为190.64亿份，今年1月20日其成立的规模为53.88亿份；券商ETF一季度末规模为120.86亿份，去年四季度的规模为57.31亿份。（中证...,首季公募规模环比增近16%，ETF成“吸金神器”
295,2020-04-23 06:15:46,云财经讯，美国疾控中心（CDC）主任Redfield：美国更难同时出现流感和新冠肺炎疫情,美国疾控中心（CDC）主任Redfield：美国更难同时出现流感和新冠肺炎疫情
296,2020-04-23 06:15:11,云财经讯，证券时报头版评论，疫情仍在世界范围内蔓延，对经济的影响无法预测，但一季度表现给出了一个极端情况下的参考。海外疫情、国内防控、复工复产等诸多复杂因素交织，决定了今年的经济发展不可能有四平八稳的衡量方法。过去经验在一定程度上是失效的，需要更加灵活的方式去监控和引导，这也决定了目标的设定需要更加具有弹性。,证券时报评论：今年经济增速目标 设定应更具弹性
297,2020-04-23 06:14:19,云财经讯，据报道：日本央行考虑进一步放宽货币政策,据报道：日本央行考虑进一步放宽货币政策
298,2020-04-23 06:12:41,云财经讯，世茂房地产拟配售7820万股现有股份，拟通过配售股份净筹资23.1亿港元,世茂房地产拟配售7820万股现有股份
299,2020-04-23 06:09:58,云财经讯，本周五（24日），去年二季度开展的2674亿元定向中期借贷便利（TMLF）将到期。市场人士对此笔TMLF会否续做存有分歧。鉴于目前市场流动性宽裕，TMLF续做需求不大，即便续做也是缩量操作，操作利率亦有下调可能。（中证报）,市场流动性宽裕，市场人士认为TMLF续做需求降低
300,2020-04-23 06:08:02,云财经讯，联合国国际民航组织（ICAO）：由于新冠肺炎疫情的缘故，预计国际航空旅客到2020年9月份最大下滑幅度可能会达到12亿人次,联合国国际民航组织（ICAO）：由于新冠肺炎疫情的缘故
301,2020-04-23 06:06:44,云财经讯，根据世卫组织实时统计数据，目前全球确诊新冠肺炎2475723例，死亡169151例（央视新闻）,根据世卫组织实时统计数据
302,2020-04-23 06:04:47,云财经讯，截至4月23日，公募基金一季报披露完毕。天相投顾数据显示，一季度公募基金整体股票仓位降低1.45个百分点至73.43%。其中，封闭式基金加仓4.03个百分点，6只战略配售基金也大举加仓。调仓方向上，医药、基建板块龙头被大举增持，部分消费个股被减持。虽然全球疫情尚未结束，但基金经理对A股后市保持乐观，二季度布局上，医药、科技、农业等业绩确定性较强的板块凝聚较多共识。（中证报）,一季报显露调仓玄机，公募后市青睐“医科农”
303,2020-04-23 06:03:28,云财经讯，美国正评估伊朗成功发射军事卫星,美国正评估伊朗成功发射军事卫星
304,2020-04-23 06:02:13,云财经讯，22日，中国钢铁工业协会召开2020年一季度信息发布会指出，钢行业加速复工复产，国内钢材需求逐步恢复，但受全球疫情影响，钢铁行业面临需求下滑、库存偏高、钢材价格下跌、企业效益大幅下降等问题。（经济参考报）,高库存或成今年钢铁行业常态
305,2020-04-23 05:57:17,云财经讯，自2020年中央一号文件专门部署强化农村补短板保障措施以来，支持乡村振兴的多个重磅金融政策相继落地。业内专家表示，“三农”领域考核机制的明确有利于政策更好地执行和评估，而“银政合作”长效合作模式的建立则更有利于精准施策，整体而言，诸多政策的落地将引导更多有效的金融资源流入乡村领域。（经济参考报）,支持乡村振兴 重磅金融政策密集落
306,2020-04-23 05:52:55,云财经讯，国际金价方面，纽约商品交易所黄金期货市场交投最活跃的6月黄金期价22日比前一交易日上涨50.5美元，收于每盎司1738.3美元，涨幅为2.99%。,纽约金价22日上涨
307,2020-04-23 05:50:00,云财经讯，美东时间周三，美国三大股指集体收高，道指涨逾450点。具体来看，截至收盘，截至收盘，道指涨1.99%报23475.82点，标普500涨2.29%报2799.31点，纳指涨2.81%报8495.38点。美国大型科技股多数收涨，谷歌涨3.82%，Facebook涨6.72%，微软涨3.4%。消息面上，美参议院通过4840亿美元小企业救助计划，众议院预计最早于本周四对该计划进行投票。,美国三大股指集体收高 道指涨超450点
308,2020-04-23 05:45:00,云财经讯，媒体根据对至少35个州的数据统计，养老院等长期护理机构已经至少有10783人死于新冠肺炎，而其他州还未公布与养老院有关的死亡病例数据。鉴于疫情严重，马萨诸塞州和西弗吉尼亚州已经准备对养老院的人员加强检测。美国全国有约1.5万家养老机构，护理130万老人，而这些人在疫情中都属于高风险人群。（央视新闻）,美国养老院系统已有上万人死于新冠肺炎
309,2020-04-23 05:44:16,云财经讯，据报道，意大利总理孔特在当天与工会代表举行的视频会议上表示，从5月4日起，该国的生产、建筑行业及部分商业可能开始复工。据媒体援引孔特的话说，在抗疫“第二阶段”将解除部分限制措施，但并不会是无差别全部解除，因为这是“不负责任的”。在这场视频会议上，意大利新冠病毒特别工作组负责人维托里奥·科劳表示，该国经济活动的限制措施解除可能使多达270万人能够重返工作岗位。。（央视新闻）,意大利抗疫“第二阶段”或有270万人复工
310,2020-04-23 05:41:18,云财经讯，据统计，目前有15家上市券商在2019年年报中披露其“投资性房地产”的相关信息，15家上市券商“投资性房地产”账面价值合计29.6亿元，比2018年末减少6.04亿元。（证券日报）,15家上市券商晒投资性房地产“家底”： 去年账面价值缩水6亿元
311,2020-04-23 05:40:35,云财经讯，据同花顺iFinD数据显示，截至目前，已有8家银行在今年成功发行永续债，发行金额合计1490亿元。在已发行永续债的银行中，既有邮储银行、平安银行这样的国有大行或股份制银行，也有众多城商行、农商行这类的中小银行。在今年已成功发行永续债的8家银行中，城商行、农商行等中小银行数量多达6家。在发债规模上，中小银行与国有大行或股份制银行相差甚远，占比只有26%。（证券日报）,年内8家银行近1500亿元永续债落地，中小银行占六席
312,2020-04-23 05:39:14,"云财经讯，据不完全统计，今年以来，仅银保监会和银保监局本级针对违规涉房贷款至少已开出65张罚单, 罚款金额逾4400万元。（证券日报）",65张罚单“敲打”银行贷款违规入“房”
313,2020-04-23 05:38:31,云财经讯，来自天眼查的信息显示，具体来看，我国目前有37万余家在业、存续的“猪养殖”企业。2020年3月份以来，新增了1.8万余家，与去年同期相比，增速高达131%。中国农业科学院北京畜牧兽医研究所副研究员朱增勇表示，当前的市场形势已经由生猪供给向猪肉消费需求影响转变，供需由上季度供给偏紧向相对平衡状态转变。（证券日报）,3月以来养殖企业增加1.8万家，供需由偏紧转向相对平衡状态
314,2020-04-23 05:35:10,云财经讯，一季度末，贵州茅台以被1232只基金持有的总量在所有个股中位居榜首。值得一提的是，这已经是贵州茅台连续3个季度成为最受基金青睐的重仓股。有359只基金在一季度期间对贵州茅台有所增持，招商中证白酒指数分级、中欧新蓝筹混合等基金增持动作较大。截至今年一季度末，公募基金最青睐的前十大重仓股分别是贵州茅台、恒瑞医药、中国平安、招商银行、立讯精密、伊利股份、五粮液、格力电器、长春高新和万科A。与去年四季度末相比，立讯精密和长春高新“新晋”上榜。（证券日报）,公募基金一季报收官，1232只基金青睐贵州茅台
315,2020-04-23 05:30:48,云财经讯，据证券日报，截至4月22日收盘，沪深两市已有1684家上市公司披露了2019年年报，有274家公司发布2020年一季报，其中有95家公司实现2019年年报和2020年一季报净利润同比双增长。其中，有57家公司2019年和2020年一季度每股经营活动产生的现金流量净额均为正值，占比为六成。从行业来看，上述57家公司，主要扎堆在医药生物、电子、化工、农林牧渔和计算机等五行业，分别为14家、8家、6家、4家和3家。由此计算，以科技为主导的电子和计算机行业，共有11家公司。可见，医药和科技不但是成长白马股的集中地，更是有“钱”景公司聚集处。,57只双增长股有“钱景” 扎堆医药科技等行业
316,2020-04-23 05:30:45,云财经讯，统计显示，171家公司公布了截至4月20日最新股东户数，相比之前各期，有28股股东户数连续减少3期以上，股东户数最多已连降7期。也就是说筹码呈持续集中趋势。股东户数连续下降个股中，连降时间较长的有中航机电、中洲控股等。其中，中航机电最新股东户数为63705户，已连续减少7期，累计降幅为16.61%；中洲控股股东户数连降7期，最新户数为15909户，累计降幅6.11%；股东户数连降期数较多的还有新亚制程、平庄能源、煌上煌等。（证券时报）,28股股东户数持续下降，筹码集中趋势明显
317,2020-04-23 05:29:25,云财经讯，截至4月22日，公布一季报公司中，社保基金最新出现在60家公司前十大流通股东榜。向前追溯发现，共有31股获社保基金连续持有4个季度以上，涪陵榨菜、丽珠集团等获社保基金连续持仓超5年。社保基金持有期限最长的是涪陵榨菜，自2013年二季度以来已累计持有28个季度，最新全国社保基金一一七组合，位列公司第四大流通股东，持股量为960万股，占流通股比例为1.23%，社保基金持有期限较长的还有丽珠集团、大庆华科、厦门象屿等，已连续持有25、18、17个季度。（证券时报）,社保基金连续持仓31股，连续持有涪陵榨菜、丽珠集团超5年
318,2020-04-23 05:22:30,云财经讯，离岸人民币（CNH）兑美元北京时间04:59报7.1008元，较周二纽约尾盘上涨10点，盘中整体交投于7.1014-7.0998元区间,离岸人民币（CNH）兑美元北京时间04:59报7.1008元
319,2020-04-23 05:18:18,云财经讯，香港金管局干预汇市的金额提高至33.7亿港元，以捍卫联系汇率制,香港金管局干预汇市的金额提高至33.7亿港元
320,2020-04-23 05:15:21,"云财经讯，周三（4月22日）纽约尾盘，美国10年期基准国债收益率上涨5个基点，报0.6190%。
30年期美债收益率上涨5.2个基点，报1.2146%。
两年期美债收益率上涨0.98个基点，报0.2133%。
五年期美债收益率上涨3.17个基点，报0.3673%。
10年和2年期美债收益率利差上涨3.810个基点，报40.173个基点；10年和三个月期美债收益率利差上涨4.742个基点，报50.462个基点。",伴随着国际油价及股市上涨，各期限美债集体下跌，收益率曲线趋陡
321,2020-04-23 05:12:19,云财经讯，G20贸易与投资工作组：将支持多边贸易系统,G20贸易与投资工作组：将支持多边贸易系统
322,2020-04-23 05:00:43,云财经讯，标普500指数11大板块均上涨，信息技术板块领涨，其次是能源板块；日常消费品板块领跌，其次是金融板块,标普500指数11大板块均上涨
323,2020-04-23 04:48:26,云财经讯，据美国媒体当地时间4月22日报道，沃尔玛即将在得克萨斯州开设其首个新冠病毒测试站。沃尔玛发言人安妮·哈特菲尔德表示，沃尔玛在得克萨斯州的第一个新冠病毒检测站，计划于本周五在得州北部的拉伯克市开放，第二个检测站也将于本周晚些时候在得州其他城市开放。（央视新闻）,媒体：沃尔玛将在得克萨斯州开设首个新冠病毒测试站
324,2020-04-23 04:35:22,云财经讯，巴西雷亚尔兑美元刷新收盘历史低点至5.4094雷亚尔,巴西雷亚尔兑美元刷新收盘历史低点至5.4094雷亚尔
325,2020-04-23 04:25:01,"云财经讯，拉斯维加斯金沙一季度净营收17.8亿美元，同比下降51%。
一季度经调整物业EBITDA4.37亿美元，同比下降70%。
一季度经调整每股亏损3美分",拉斯维加斯金沙一季度净营收17.8亿美元
326,2020-04-23 04:20:34,云财经讯，赛灵思第四财季EPS 65美分，上年同期95美分,赛灵思第四财季EPS 65美分
327,2020-04-23 04:10:23,云财经讯，美国铝业一季度每股亏损23美分,美国铝业一季度每股亏损23美分
328,2020-04-23 04:06:45,云财经讯，据报道：美国商品期货交易委员会（CFTC）正调查那些掌握俄罗斯与OPEC+谈判内幕信息的交易员们是否通过非法地押注油价波动获取（至少）数亿美元收益,据报道：美国商品期货交易委员会（CFTC）正调查那些掌握俄罗斯与OPEC+谈判内幕信息的交易员们是否通过非法地押注油价波动获取（至少）数亿美元收益
329,2020-04-23 04:02:18,云财经讯，推特涨超10%，Facebook、特斯拉涨超6%,推特涨超10% Facebook、特斯拉涨超6%
330,2020-04-23 04:01:38,云财经讯，中概股中，迅雷涨超9%，哔哩哔哩涨5.7%，创纪录新高,哔哩哔哩涨5.7% 创纪录新高
331,2020-04-23 03:59:57,云财经讯，道指初步收涨逾400点，成分股英特尔涨超6%，麦当劳涨超5%，耐克涨超4%，波音则跌约0.9%。纳指收涨逾2%，蓝筹股苹果涨超2%，特斯拉涨超6%。能源股切萨皮克涨约15%,道指初步收涨逾400点
332,2020-04-23 03:54:41,云财经讯，继华夏基金、银华基金推出5G交易型开放式指数基金（ETF）后，博时基金的5GETF也在昨日上市交易。Wind数据显示，截至4月21日，24只泛科技ETF最新规模达到1243亿元，是上述基金成立时规模的27倍。其中，国泰CES半导体ETF规模暴涨41倍，平安中证新能源汽车产业ETF、国联安中证全指半导体ETF、华宝中证科技龙头ETF规模增长也超过10倍。5G指数产品也受益于科技风口和赚钱效应，新发基金规模增长同样显著。成立于去年9月的华夏5GETF规模从成立之初的41.53亿元增至近300亿元，增长超过6倍；银华中证5G通信主题ETF最新规模达到50.41亿元，是发行规模的4.6倍。（...,5G场内指基再添新军，博时5G50ETF上市
333,2020-04-23 03:47:02,云财经讯，油价暴跌，部分投资者趁机进场“抄底”，油气类基金规模激增。一季报数据显示，当季10只油气类基金规模合计增加130.16亿元，增幅达108.67%。其中，5只基金的规模在一季度实现了10倍以上的增长。嘉实原油增长32倍，规模从去年底的0.66亿增至22.24亿元。华安石油规模增幅同样惊人，从1.99亿元增至26.12亿元，增长12倍；诺安油气、易方达原油、南方原油的规模都较去年增长了10倍以上。此外，广发石油规模由0.45亿元增至4.31亿元，增长8倍多。规模最大的油气类基金华宝油气，增幅较小，为17.43%，3月末的规模为123.29亿元。（证券时报）,油气基金大跌，资金凶猛抄底一季度规模翻倍
334,2020-04-23 03:43:46,云财经讯，随着西安银行披露年报，截至4月22日，去年8家新上市银行已经有7家披露了2019年业绩。除了渝农商行，其余6家银行的净利润增速都达到了两位数；资产质量方面，超过一半银行不良贷款率下降，整体不良率低于行业均值。值得注意的是，今年1月下旬以来，新冠肺炎肆虐，银行一季度业绩承压，新近披露一季报的西安银行资产规模和个人贷款业务增速出现显著下降。（证券时报）,6家新上市银行年报出彩，净利均两位数增长
335,2020-04-23 03:37:40,云财经讯，美国当地时间4月22日，一位加州官员警告说，即使加州新冠疫情曲线呈下降趋势，但仍需要保持警惕，因为加州的新冠肺炎确诊病例和死亡人数仍在不断增加。加州官员同时对新冠肺炎疫情“第二波”暴发的潜在可能性和威胁指数表示担忧。加州州长纽森也认为，加州现在还未达到疫情暴发高峰，因此现在取消居家限制将是灾难性的，同时也会增加新冠病毒在加州“第二波”暴发的可能性。（央视新闻）,美国加州官员警告：“第二波”新冠肺炎疫情可能更为严重
336,2020-04-23 03:36:01,云财经讯，美国哈佛大学公告：本校已经决定，不通过新冠肺炎疫情救济法律获取资金,美国哈佛大学公告：本校已经决定 不通过新冠肺炎疫情救济法律获取资金
337,2020-04-23 03:33:56,云财经讯，“钢铁侠”马斯克旗下SpaceX发射第七颗“Starlink”卫星网络,“钢铁侠”马斯克旗下SpaceX发射第七颗“Starlink”卫星网络
338,2020-04-23 03:31:22,云财经讯，根据媒体为世界白银协会所做的预测，2020年白银市场供应过剩的规模将下降超过一半，因新冠肺炎疫情导致生产商关闭，矿山产量降至八年来最低,根据媒体为世界白银协会所做的预测
339,2020-04-23 03:16:58,云财经讯，美国加州每天执行16000次检测,美国加州每天执行16000次检测
340,2020-04-23 03:12:06,云财经讯，截至昨日，140家基金公司旗下基金2020年一季报悉数公布完毕。基金今年一季度整体亏损288.75亿元，股票和混合基金成为亏损主要来源。表现较好的债券基金单季盈利达693.05亿元。规模增长最多的是货币基金，一季度净申购达1.06万亿份，增幅达15.16%。整体来看，一季度公募基金总份额也增长了10.11%。据天相投顾统计，一季度末包括开放式股票型、开放式混合型和封闭式股票型基金在内的2849只偏股基金平均仓位为73.43%，较去年底的74.87%下滑1.45个百分点。从行业配置变化看，一季度信息传输软件和信息技术服务业、批发零售业、水利环境和公共设施管理业成基金增持三大板块，金融业...,基金业首季亏损288亿，权益基金小幅减仓
341,2020-04-23 03:05:35,云财经讯，据俄媒援引俄罗斯数字发展、通信和大众传媒部消息，在4月21日与俄地方数字化转型负责部门举行的会议上，该部共收到21个俄联邦主体提交的关于发放数字通行证的申请。发放数字通行证的联邦级平台规定，雇主可以通过公共服务统一门户网站上的法人个人帐户，提交获得长期数字通行证的雇员名单。在验证和批准雇主的相关申请之后，将生成二维码形式的数字通行证。雇员可以在公共服务门户网站登录个人账户，或者通过电子邮箱获得通行证。（央视新闻）,应对疫情，俄罗斯21个联邦主体将引入数字通行证制度
342,2020-04-23 03:00:13,云财经讯，美国疾控中心：确认纽约州两只宠物猫感染新冠肺炎病毒，它们生活在纽约州两个不同的区域,美国疾控中心：确认纽约州两只宠物猫感染新冠肺炎病毒
343,2020-04-23 02:46:15,云财经讯，欧洲央行采取行动来应对抵押品被降级的潜在影响,欧洲央行采取行动来应对抵押品被降级的潜在影响
344,2020-04-23 02:32:54,云财经讯，意大利财长：欧盟复苏基金将达到1-1.5万亿欧元,意大利财长：欧盟复苏基金将达到1-1.5万亿欧元
345,2020-04-23 02:28:05,云财经讯，短视频新秀Quibi创始人：自4月6日推出以来，Quibi下载量达270万次（较4月13日公布的数据增加了100万次）。从5月开始，一些Quibi用户将能够将这项服务从手机投射到电视上,短视频新秀Quibi创始人：自4月6日推出以来 Quibi下载量达270万次（较4月13日公布的数据增加了100万次）
346,2020-04-23 02:22:30,云财经讯，美国国会参议院要求美联储和财政部向能源生产商提供贷款,美国国会参议院要求美联储和财政部向能源生产商提供贷款
347,2020-04-23 02:15:07,云财经讯，美国汽油期货涨幅扩大，目前上涨30%,美国汽油期货涨幅扩大 目前上涨30%
348,2020-04-23 02:13:38,云财经讯，受新冠肺炎疫情影响，美国多州与地方政府表示，若不能收到政府提供的额外经济救助，很可能即将大面积进行裁员缓解财政压力。据统计，美国总计2000万人服务于各州和地方公共部门。洛杉矶市目前已宣布，由于2021财年收入预计减少6亿美元，该市政府工作人员需接受26天的无薪假期。底特律正在考虑政府裁员200人，并令上千人接受无薪假期。（央视新闻）,美国多州及地方公共部门或大面积裁员
349,2020-04-23 02:05:26,云财经讯，美国原油基金（USO）可能会投资至多20%的原油期货合约,美国原油基金（USO）可能会投资至多20%的原油期货合约
350,2020-04-23 02:01:45,云财经讯，欧洲央行：互换额度为20亿欧元,欧洲央行：互换额度为20亿欧元
351,2020-04-23 02:00:17,云财经讯，美国原油基金停牌,美国原油基金停牌
352,2020-04-23 01:59:50,云财经讯，新冠肺炎疫情的蔓延在短期内给服务业带来较大冲击，对批零住餐、电影娱乐、文化旅游、交通运输等行业影响尤其明显。由于疫情隐蔽性强、传染性强、影响范围广且有可能反复出现，我们要在“疫”中寻“机”，坚持整合优化存量与做大做强增量“两手抓”的原则，一方面着重推动传统服务业的转型升级，另一方面着重推动现代服务业的创新发展，确保服务业的主导地位不受影响，夯实国民经济的发展根基。,经参头版评论：“疫”中寻“机”推动服务业转型升级创新发展
353,2020-04-23 01:59:19,云财经讯，COMEX 6月黄金期货收涨50.50美元，涨幅3.0%，报1738.30美元/盎司，创4月15日以来收盘新高,COMEX 6月黄金期货收涨50.50美元
354,2020-04-23 01:53:52,云财经讯，据报道，苹果公司正计划修复一个漏洞，这一漏洞可能导致超过5亿部iPhone易受黑客攻击。这个漏洞也存在于iPad中,苹果公司正计划修复一个漏洞
