,datetime,content,title
247,2020-09-14 14:09:01,云财经讯，9月上旬受台风天气影响，东北降雨频繁。黑龙江产区部分平地、洼地存在积水，红小豆长势欠佳，存在一定减产预期。持货粮商库存惜售心态升温，局部报价偏强运行。据监测，截至9月12日，黑龙江大庆林甸粮商珍珠红小豆成品出货价参考4.90-4.95元/斤，价格较上周上涨0.05元/斤，部分粮商因持货惜售，报意向出货价5.00元/斤。（卓创资讯）,新季红小豆受天气影响存减产可能，新粮上市价格或将高开
248,2020-09-14 14:07:09,云财经讯，自本公告发布之日起，除《药品进口管理办法》第十条规定的药品外，其他进口药品（包括麻醉药品、精神药品）可经由无锡航空口岸、江阴港口岸进口。增加无锡市市场监督管理局为口岸药品监督管理部门，由其承担无锡航空口岸、江阴港口岸药品进口备案的具体工作。增加无锡市药品安全检验检测中心为口岸药品检验机构，承担无锡航空口岸、江阴港口岸的药品口岸检验工作。,国家药监局、海关总署：同意增设无锡航空口岸、江阴港口岸为药品进口口岸
249,2020-09-14 14:01:47,云财经讯，猪肉板块走弱，新希望跌5%，正邦科技、双汇发展、龙大肉食等集体走弱,猪肉板块走弱 正邦科技、双汇发展、龙大肉食等集体走弱
250,2020-09-14 14:00:40,云财经讯，芯朋微(688508)9月14日在互动平台表示，目前，公司已有电源芯片产品用于无线耳机充电仓，还没有用于无线耳机本身。此外，公司在高压ACDC类芯片和高压驱动类芯片领域，有多款型号可以替代进口芯片。,芯朋微：公司已有电源芯片产品用于无线耳机充电仓
251,2020-09-14 13:42:34,云财经讯，中国人民银行副行长潘功胜9月14日在国务院政策例行吹风会上表示，在前期广泛征求意见，与房地产业界、金融业界进行广泛沟通的基础上，人民银行和住建部会同相关部门形成了对重点房地产企业的资金监测和融资管理规则。该规则是房地产市场长效机制建设的重要内容，也是房地产金融审慎管理制度的重要组成部分。下一步，央行将会同住建部以及其他的相关管理部门，跟踪评估执行情况，不断完善规则，稳步扩大适用范围。（中证网）,潘功胜：稳步扩大重点房地产企业资金监测和融资管理规则适用范围
252,2020-09-14 13:42:09,云财经讯，券商股盘中拉升，截至发稿，兴业证券涨3.79%，光大证券、中银证券等纷纷跟涨。对于商业银行或可试点控股或设立证券公司的传闻，中国人民银行副行长潘功胜9月14日在国务院政策例行吹风会上表示，我国现行金融业，以分业经营、分业监管为主的格局，是在长期实践探索中形成的，符合我国经济金融发展的现状，应当予以坚持。,券商股盘中拉升 兴业证券涨近4%
253,2020-09-14 13:39:17,云财经讯，对于商业银行或可试点控股或设立证券公司的传闻，中国人民银行副行长潘功胜9月14日在国务院政策例行吹风会上表示，我国现行金融业，以分业经营、分业监管为主的格局，是在长期实践探索中形成的，符合我国经济金融发展的现状，应当予以坚持。潘功胜称，推动资本市场健康发展，是我国金融改革的重点工作。人民银行将继续与相关部门一道，按照党中央、国务院的部署，继续推动中国资本市场的制度建设和创新发展。（中证网）,潘功胜回应商业银行试点设立证券公司：金融业分业经营、分业监管应予以坚持
254,2020-09-14 13:24:54,云财经讯，9月14日，国资委召开对标世界一流管理提升行动媒体通气会，国资委副主任翁杰明表示，以对标世界一流为出发点和切入点，以加强管理体系和管理能力建设为主线，有针对性地采取务实管用的工作措施，用2-3年的时间，推动中央企业和地方国有重点企业基本形成系统完备、科学规范、运行高效的中国特色现代国有企业管理体系，总体管理能力明显增强，部分企业管理达到或接近世界一流水平。（中证网）,国资委：全面部署央企开展对标世界一流管理提升行动
255,2020-09-14 13:16:20,云财经讯，Wind最新数据显示，北向资金净流出金额超30亿元。,北向资金净流出超30亿元
256,2020-09-14 13:13:55,云财经讯，TCL科技在互动平台上表示，TCL华星2020年上半年订单供不应求，下半年预计供给不足的情况仍将持续。,TCL科技：TCL华星订单供不应求 预计供给不足的情况仍将持续
257,2020-09-14 13:11:10,云财经讯，至纯科技：公司在第三代化合物半导体领域有相应的技术研发和储备（上证e互动）,至纯科技：公司在第三代化合物半导体领域有相应的技术研发和储备（上证e互动）
258,2020-09-14 13:03:21,云财经讯，央企改革板块午后异动，瑞泰科技封板，龙源技术一度涨停，中环装备、中建环能跟涨,央企改革板块午后异动
259,2020-09-14 12:59:30,云财经讯，一位接近字节跳动的人士称，字节跳动创始人、全球CEO张一鸣依然希望公司可以全球化发展，还在努力探索不出售TikTok美国业务的解决方案（新京报）,一位接近字节跳动的人士称 字节跳动创始人、全球CEO张一鸣依然希望公司可以全球化发展
260,2020-09-14 12:34:11,云财经讯，金信诺(300252)9月14日在互动平台表示，“WB1409GaN型功放”是为氮化镓功放配套的芯片，是公司子公司江苏万邦微电子有限公司的产品之一。,金信诺：“WB1409GaN型功放”是氮化镓功放配套的芯片
261,2020-09-14 12:26:56,云财经讯，上海期货交易所总经理王凤海在标准普尔全球普氏亚太石油会议上发表讲话时表示，随着上海国际能源交易中心原油交易的成交量增加，交易所正在考虑增加更多等级的原油，以抵消用于实物交割的期货。（新华财经）,上期所总经理：正在考虑增加更多等级的原油，以抵消用于实物交割的期货
262,2020-09-14 12:24:26,云财经讯，9月14日，记者获悉，成都市人民政府网站发布《通知》提出“房产新政15条”。《通知》指出，将优先确保保障性住房用地供应，住宅用地占经营性用地比重不低于60%，供需紧张区域不低于70%；提高公证摇号中棚改、无房居民家庭优先的比例，棚改优先最低比例由10%提高到20%，无房居民家庭优先最低比例由棚改优先后剩余房源的50%提高到60%。发挥税收调节作用，个人住房转让增值税征免年限由2年调整到5年。,成都出台“房产新政15条” 住房转让增值税征免年限由2年调整到5年
263,2020-09-14 12:23:59,云财经讯，其中提到，增加住宅用地供应，优化供应结构，住宅用地占经营性用地的比重不低于60%，供需紧张区域不低于70%，优先确保保障性住房用地供应。发挥税收调节作用，个人住房转让增值税征免年限由2年调整到5年。大力实施租赁补贴扩面提标，将公交、环卫、教育、卫生等公共服务行业人员纳入保障范围，保障住有所居，实现应保尽保。,成都出台“房产新政15条”，保持房地产市场平稳健康发展
264,2020-09-14 12:04:51,云财经讯，今日，长春高新(000661)股价大幅下跌。截至午间收盘，长春高新报于374.81元，跌幅为9.23%。长春高新相关人士告诉记者，公司生产经营一切正常，百克生物分拆上市事宜正在稳步推进中。,股价大跌9.23% 长春高新：公司生产经营一切正常
265,2020-09-14 11:56:48,云财经讯，国家卫健委：9月13日0—24时，31个省（自治区、直辖市）和新疆生产建设兵团报告新增确诊病例10例，均为境外输入病例（上海5例，福建2例，云南2例，广东1例）；无新增死亡病例；新增疑似病例3例，均为境外输入病例（均在上海）,国家卫健委：9月13日0—24时 31个省（自治区、直辖市）和新疆生产建设兵团报告新增确诊病例10例
266,2020-09-14 11:40:05,云财经讯，9月12日，二十国集团（G20）农业和水利部长会议召开，中国农业农村部部长韩长赋出席会议并讲话，他指出，二十国集团作为全球农业生产大国和重要引领力量，应携手维护国际粮食安全和农业稳定。他提出三点倡议：一是共同提升全球粮食生产能力。二是共同加强全球农业投资贸易合作。取消粮食和重要农产品出口限制，稳定全球粮食供应链。三是共同推动减少粮食损失浪费。（中国政府网）,二十国集团农业和水利部长会议召开，韩长赋倡议携手维护国际粮食安全和农业稳定
267,2020-09-14 11:23:21,云财经讯，米奥会展：公司投入多年的数字展览遇到了推广窗口期，成为目前市场上少数客户愿意付费参展的领先数字展览，今年公司数字展览创新业务将突破一个亿（互动易）,米奥会展：公司投入多年的数字展览遇到了推广窗口期
268,2020-09-14 11:22:34,云财经讯，当地时间9月13日俄罗斯卫生部长穆拉什科向外界表示，第一批俄新冠病毒疫苗已被运送至俄罗斯各地区，预计在9月14日之前完成交付。首批疫苗将首先提供给医生，教师和65岁以上的人群。穆拉什科当天同时宣布，目前俄罗斯第二款新冠病毒疫苗正在按计划完成临床研究，并将接受检验。（央视新闻）,首批俄新冠疫苗被运送至各地区 14日前交付
269,2020-09-14 11:17:47,云财经讯，四川本地股异动，四川金顶涨4%，四川双马、四川成渝、中建环能跟涨,四川本地股异动 四川金顶涨4% 四川双马、四川成渝、中建环能跟涨
270,2020-09-14 11:17:01,云财经讯，第22届CIOE中国光博会9月11日落幕，金信诺连续两年参展，此次展出了多款5G+光产品及卫星智能终端产品，还展出了多款数据中心组件产品，并实现整体材料国产化（金信诺官微）,第22届CIOE中国光博会9月11日落幕
271,2020-09-14 11:10:18,云财经讯，近日，总投资10亿美元的乐友新能源材料（无锡）有限公司竣工仪式在无锡高新区举行。乐友新能源成立于2018年6月29日，是LG化学与华友钴业共同投资的新公司。该项目产能规划10万吨，年产值达200亿元。本次竣工的项目一期可供生产一次充电里程320千米的高性能新能源汽车60万辆的动力电池。目前项目建设顺利，计划本月开始以5000吨产能实现量产，预计明年三季度实现一期4.5万吨达产目标。（上海有色网）,乐友新能源一期项目竣工 本月以5000吨产能实现量产
272,2020-09-14 11:10:16,云财经讯，近期国内顺酐市场高位上行，截至9月11日苯氢化法顺酐均价保持在8033元/吨左右，较月初大幅走高15.87%，较上月同期均价6766元/吨涨幅18.72%（生意社）,截至9月11日苯氢化法顺酐均价保持在8033元/吨左右 较月初大幅走高15.87%
273,2020-09-14 11:06:57,云财经讯，长春高新早盘单边大跌，一度触及跌停，成交额超43亿,长春高新早盘单边大跌
274,2020-09-14 11:04:00,云财经讯，汉邦高科还表示，公司目前与北京知图美信息技术有限公司开展战略合作，知图美可以在版权运营中利用公司在数字水印技术方面的优势打造完整可靠业务生态链。双方以利用数字水印技术在图片领域进行版权保护为开端，后续根据业务发展需求逐步拓展到音视频等其他领域。（互动易）,汉邦高科：公司目前与华为的合作是在新媒体监测领域
275,2020-09-14 11:02:24,云财经讯，9月14日，华晨宝马动力电池中心二期投入运营。这是宝马集团全球首个生产BMW第五代动力电池的生产基地。据悉，动力电池中心的扩建完成，将使宝马在中国的动力电池产能提高超一倍，所生产的高能量、高密度电池将率先搭载于创新纯电动BMW iX3车型。,华晨宝马动力电池中心二期投入运营
276,2020-09-14 10:57:43,云财经讯，大连商品交易所总经理席志勇在9月14日召开的“第五届中国大豆产业国际高峰论坛暨后疫情时代产融协同育新机探讨”会议上表示，将加快推进大豆系列期权品种上市，为产业企业提供更加丰富的避险工具；进一步提升大豆衍生品市场效率，综合实施做市商等一揽子措施，促进大豆系列品种合约连续活跃，适时调整交割质量标准和升贴水，持续优化完善期转现业务，促进期现货市场深度融合。（中国证券网）,大商所总经理：加快推进大豆系列期权品种上市
277,2020-09-14 10:56:47,云财经讯，9月10日至11日，国家发改委共建“一带一路”推进会在泉州召开。国家发展改革委副主任兼国家统计局局长宁吉喆，福建代省长王宁出席全体会议。宁吉喆在讲话中指出，要不断推进“一带一路”建设高质量发展。王宁表示，福建将紧紧围绕“五通”，发挥独特优势，深入实施丝路海运、丝路飞翔、数字丝路、丝路投资、丝路贸易、人文海丝、生态海丝、海丝茶道八大工程，推进“海丝”核心区建设走深走实，为共建“一带一路”高质量发展、加快形成新发展格局作出新贡献。（东南网）,国家发改委共建“一带一路”推进会在泉州召开
278,2020-09-14 10:53:10,"云财经讯，潘功胜：央行下一步将在依法依规、稳妥有序开展准入管理和事中事后监管,有效防范化解风险，提升金融控股公司服务经济高质量发展能力的同时，合理设置过渡期,把握好节奏、时机，引导相关存量企业稳妥有序调整,推动《金控办法》平稳实施。（新华财经）",潘功胜：引导相关存量企业稳妥有序调整 推动《金控办法》平稳实施
279,2020-09-14 10:52:22,"云财经讯，9月10日，有海外爆料人士在社交媒体上贴出疑似华米科技与特斯拉合作的海报。同日，华米科技创始人、董事长兼CEO黄汪也通过微博表示，9月15日将""继续飙车""，配图是去年Amazfit GTR发布会宣传板与一辆汽车的合照。这两则消息都将日期指向了同一天，极有可能暗示华米科技9月15日有大动作。（IT之家）",消息称华米科技将联合特斯拉，9月15日或发布新品智能手表
280,2020-09-14 10:45:31,云财经讯，中信证券固定收益首席分析师明明发布报告称，8月中旬以来央行增加流动性投放，货币政策操作力度较前期有所加大。往后看，商业银行仍面临较大的负债压力，恐制约信用扩张，在金融体系向实体经济让利的大背景下，货币政策可能仍有宽松空间。,中信证券明明：货币政策可能仍有宽松空间
281,2020-09-14 10:38:23,云财经讯，当前，工程机械行业持续火热。业内人士认为，国内复工复产和基建、房地产共同带来的需求，是拉动工程机械销量在二季度实现大反弹的主要因素。预计四季度工程机械行业仍将维持高景气，增长势头有望延续。据最新数据，2020年8月纳入统计的25家挖掘机制造企业共销售各类挖掘机20939台，同比增长51.3%。国内挖掘机销量连续5个月同比增速保持50%以上。今年前8个月销售总量已占到2019年全年销量的89.3%。（澎湃新闻）,工程机械持续火热：国内挖掘机销量连5个月同比增速超50%
282,2020-09-14 10:32:35,云财经讯，9月14日，《韩国经济导报》援引业内人士的消息报道称，三星电子获得了为高通生产下一代5G高端智能手机移动应用处理器的订单，价值约1万亿韩元（约8.45亿美元）。高通将于12月发布的骁龙875系列，这系列芯片预计将用于三星、小米和OPPO的智能手机中。这意味着三星击败台积电，首次获得高通旗舰芯片全部订单。三星已经开始使用EUV设备在韩国的生产线上大规模生产Snapdragon875。（澎湃新闻）,韩媒：三星首次拿下高通旗舰芯片完整订单，价值1万亿韩元
283,2020-09-14 10:32:18,云财经讯，天眼查APP显示，近日，星苒（上海）投资合伙企业（有限合伙）成立，经营范围含创业投资、投资管理等，该公司共有两大股东，分别为上海星巴克咖啡经营有限公司、深圳红杉安泰股权投资合伙企业（有限合伙）。其中，深圳红杉安泰股权投资合伙企业（有限合伙）为该公司的执行事务合伙人。此前，红杉中国通过官方公众号宣布，其已与星巴克中国达成战略合作，将携手开展战略投资，在新生代餐饮和零售科技方面进行商业合作。,星巴克联合红杉中国成立投资公司
284,2020-09-14 10:31:52,云财经讯，9月14日，商务部发布2020年第37号公告，决定即日起对原产于美国的进口相关乙二醇和丙二醇的单烷基醚进行反补贴立案调查。该产品英文名称：Certain monoalkyl ethers of ethylene glycol and propylene glycol或Certain glycol ehter，归在《中华人民共和国进出口税则》：29094400和29094990。本次调查通常应在2021年9月14日前结束调查，特殊情况下可延长至2022年3月14日。,商务部对原产于美国的进口相关乙二醇和丙二醇的单烷基醚发起反补贴立案调查
285,2020-09-14 10:30:55,云财经讯，从知情人士处获悉，不出售给微软的消息是比较准确的，同时字节跳动也不会将 TikTok 美国分公司出售给甲骨文。另据媒体报道，知情人士称，字节跳动已决定在出售或剥离资产时，将不会出售或转让该视频共享应用程序背后的算法。（中新社）,TikTok不会将美国分公司出售给甲骨文
286,2020-09-14 10:26:32,云财经讯，据供应链消息，SSD硬盘行业迎来涨价，其中128GB PCIe SSD、128GB SATA SSD报价上调0.3美元，256GB PCIe SSD、256GB SATA SSD报价上调0.5美元（快科技）,据供应链消息 SSD硬盘行业迎来涨价
287,2020-09-14 10:25:07,云财经讯，香港恒生指数涨超1%，瑞声科技涨近5%，中国联通、腾讯控股涨超3%。,香港恒生指数涨超1% 腾讯涨超3%
288,2020-09-14 10:21:01,云财经讯，吉林梅花二期年产30万吨谷氨酸钠项目近日落成投产。据了解，该项目总投资30亿，环保设施占总投资的三分之一。该项目生产线是目前全世界单体最大的谷氨酸钠生产线，拥有世界最先进的工艺（吉林日报）,吉林梅花二期年产30万吨谷氨酸钠项目近日落成投产
289,2020-09-14 10:16:00,云财经讯，拓斯达(300607)9月14日在互动平台表示，公司目前与华为在自动化业务方面已初步展开合作，相关项目尚处于前期验证阶段。,拓斯达：与华为在自动化业务方面已初步展开合作
290,2020-09-14 10:14:36,云财经讯，华特气体(688268)9月13日晚公告，因国内外市场需求变化，为提高生产效率，公司拟使用4000万元超募资金改建公司第三车间。该项目的建设可以有效增强公司在国内的仓储、运营能力，提高公司的综合竞争力，项目通过提升储存能力，加强公司在气体行业的一体化生产加工运营能力，满足客户的多元化需求，从而与下游客户建立更紧密的合作关系，为实现公司气体综合解决方案提供商的战略目标奠定坚实的产品和客户基础。,华特气体：拟使用4000万元超募资金改建第三车间
291,2020-09-14 10:12:13,云财经讯，美股股指期货持续上涨，三大股指期货均涨超1%,美股股指期货持续上涨
292,2020-09-14 10:06:45,云财经讯，国家网信办“清朗”未成年人网络环境暨网课平台专项整治依法查处第二批存在问题的网站，搜狐视频网、优酷网及其APP、芒果TV网及其APP、爱奇艺、百度输入法、新浪微博及抖音APP等在列,国家网信办“清朗”未成年人网络环境暨网课平台专项整治依法查处第二批存在问题的网站
293,2020-09-14 10:06:17,云财经讯，近日，人民银行联合发改委等部门分别向江西省人民政府、山东省人民政府印发《江西省赣州市、吉安市普惠金融改革试验区总体方案》和《山东省临沂市普惠金融服务乡村振兴改革试验区总体方案》。《江西方案》提出健全多层次多元化普惠金融体系、创新发展数字普惠金融、强化对乡村振兴和小微企业的金融支持、加强风险管理和金融生态环境建设等五个方面21项任务措施。《山东方案》提出推动农村金融服务下沉、完善县域抵押担保体系、拓宽涉农企业直接融资渠道、提升农村保险综合保障水平、加强乡村振兴重点领域金融支持和优化农村金融生态环境等七个方面26项任务措施。,中国央行会同有关部门印发两省三市普惠金融改革试验区总体方案
294,2020-09-14 09:59:44,云财经讯，科创50指数涨幅扩大至4.5%，涨幅创一个月新高，消息面上，首批科创板50ETF基金顺利获批。,科创50指数涨幅扩大至4.5%
295,2020-09-14 09:55:58,云财经讯，A股三大股指涨幅扩大，截至发稿，创业板指涨超2%。,创业板指涨逾2%
296,2020-09-14 09:46:11,云财经讯，啤酒板块大幅拉升，兰州黄河、重庆啤酒涨停，青岛啤酒涨超4%。,啤酒板块大幅拉升 兰州黄河、重庆啤酒涨停
297,2020-09-14 09:45:25,云财经讯，半导体概念股涨幅扩大，截至发稿，聚灿光电、立昂微涨停，珈伟新能涨超13%，扬杰科技涨超10%。,半导体概念股涨幅扩大 聚灿光电涨停
298,2020-09-14 09:41:17,云财经讯，国家统计局数据，据对全国流通领域9大类50种重要生产资料市场价格的监测显示，2020年9月上旬与8月下旬相比，28种产品价格上涨，14种下降，8种持平。其中多种化工产品价格上涨，硫酸、甲醇、顺丁胶分别上涨上涨9%、8.2%和5.2%；农药（草甘膦，95%原药）价格上涨10.8%。,9月上旬多种化工产品价格上涨
299,2020-09-14 09:33:19,云财经讯，统计局数据，8月份，初步测算，4个一线城市新建商品住宅销售价格环比上涨0.6%，涨幅比上月扩大0.1个百分点。其中，北京、上海、广州和深圳分别上涨0.6%、0.6%、0.9%和0.5%。二手住宅销售价格环比上涨1.0%，涨幅比上月扩大0.3个百分点。其中，北京、上海、广州和深圳分别上涨0.7%、0.8%、1.7%和1.1%。31个二线城市新建商品住宅销售价格环比上涨0.6%。,国家统计局：8月各线城市新建商品住宅销售价格环比涨幅略微扩大
300,2020-09-14 09:25:39,云财经讯，9月14日早间，沪深两市高开，沪指开盘涨0.48%，深成指涨0.63%，创业板指张1.24%。盘面上，半导体、风能、光伏等板块领涨。,开评：三大指数集体高开 半导体等板块领涨
301,2020-09-14 09:16:34,云财经讯，远方信息(300306)9月14日在互动平台表示，公司HAM-300高精度光谱雾度计、TR-2000材料透射测量系统等产品均可为屏下摄像头检测提供解决方案。,远方信息：公司产品可为屏下摄像头检测提供解决方案
302,2020-09-14 09:08:04,云财经讯，远兴能源(000683)在互动平台上表示，近期基础化工行业生产持续向好，市场需求继续恢复，国内大宗商品价格延续上涨势头，带动小苏打产品价格继续回升，目前小苏打价格较年初上涨15%-20%。公司小苏打产销状况良好。,远兴能源：目前小苏打价格较年初上涨15%-20%
303,2020-09-14 08:59:57,云财经讯，中国央行进行800亿元7天期逆回购操作，另有1000亿元逆回购到期。,央行进行800亿元7天期逆回购操作
304,2020-09-14 08:59:27,云财经讯，富时中国A50指数期货高开0.23%。,富时中国A50指数期货高开0.23%
305,2020-09-14 08:59:11,云财经讯，菜粕、豆二、豆粕期货主力开盘涨超3%，沪锌、玉米、铁矿涨超2%，沪镍、热卷、豆一、豆油、不锈钢、尿素、焦炭涨超1%。沪银低开逾1%,菜粕、豆二、豆粕期货主力开盘涨超3%
306,2020-09-14 08:48:19,云财经讯，据深圳卫健委，9月13日0-24时，深圳新增2例无症状感染者。2例无症状感染者，均为中国籍，从俄罗斯返回。入境后即被集中隔离，后转至深圳市第三人民医院观察治疗，情况稳定。,​深圳新增2例无症状感染者
307,2020-09-14 08:47:35,云财经讯，综合考虑近两三个月我国利率走势、央行官方表态以及央行实际操作，我国货币政策仍是坚持“更加灵活适度、精准导向”的总基调，一方面是结构性紧，主要是管住资金套利和防止资金违规流入房地产，另一方面是结构性松，主要是引导信贷投向实体，尤其是小微企业和制造类企业。,经济参考报头版评论：货币政策总基调未有实质性转向
