,datetime,content,title
0,2020-09-14 23:58:13,云财经讯，云南瑞丽开展全员核酸检测，全市城区人员居家隔离（人民日报）,云南瑞丽开展全员核酸检测
1,2020-09-14 23:55:28,云财经讯，广宇集团：拟20万元受让星澄商务40%股权并对其提供不超1亿元的财务资助,广宇集团：拟20万元受让星澄商务40%股权并对其提供不超1亿元的财务资助
2,2020-09-14 23:53:02,云财经讯，茶花股份：实控人之一陈冠宇拟向其姐姐陈苏敏转让不超2.77%的股份，此次转让完成后，陈苏敏与陈冠宇构成一致行动关系,茶花股份：实控人之一陈冠宇拟向其姐姐陈苏敏转让不超2.77%的股份
3,2020-09-14 23:49:07,云财经讯，9月14日，据媒体披露的交易条款显示，小米集团副董事长林斌正寻求出售小米至多10亿美元（约合人民币68亿元）的股票。而接近小米的知情人士则表示，林斌并非要抛售套现，而是要委托给信托。（贝壳财经）,小米林斌套现70亿元？知情人士：实为委托信托
4,2020-09-14 23:48:59,云财经讯，9月14日，民航局局长冯正霖赴安徽调研期间，与安徽省委书记李锦斌、省长李国英就进一步促进安徽民航发展深入交换意见。冯正霖表示，下一步，民航局将与安徽省委、省政府协同配合，充分考虑安徽在长三角一体化中的发展需要，鼓励航空公司在安徽设立分公司、投放运力、开辟航线，助力合肥航空枢纽建设，并在机场建设、临空经济发展、通航产业和航空物流发展等方面给予安徽大力支持，更好地凸显民航业重要战略作用。,民航局局长冯正霖：鼓励航空公司在安徽设立分公司、投放运力、开辟航线
5,2020-09-14 23:48:40,云财经讯，华润双鹤公告，近日，华润双鹤药业股份有限公司全资子公司华润赛科收到了国家药监局颁发的缬沙坦氢氯噻嗪片(缬沙坦80mg/氢氯噻嗪12.5mg)《药品补充申请批准通知书》，批准该药品通过仿制药质量和疗效一致性评价。,华润双鹤：全资子公司华润赛科药业药品通过仿制药质量和疗效一致性评价
6,2020-09-14 23:46:41,云财经讯，雪峰科技公告，公司拟以自有资金出资3000万元，在昌吉州阜康市产业园区投资设立全资子公司阜康雪峰，并以阜康雪峰为项目实施主体建设50000t/a现场混装乳化炸药生产系统建设项目，项目总投资5800万元。,雪峰科技： 拟投资设立全资子公司并建设50000t／a现场混装工业炸药生产系统项目
7,2020-09-14 23:45:13,云财经讯，巴西农业咨询公司Safras：预计巴西2021年大豆出口8250万吨,巴西农业咨询公司Safras：预计巴西2021年大豆出口8250万吨
8,2020-09-14 23:43:45,云财经讯，物产中大：控股子公司宏诚投资发起设立山东海洋生物医药基金，基金总规模1.5亿元，宏诚投资认缴出资150万元，占比1%,物产中大：控股子公司宏诚投资发起设立山东海洋生物医药基金
9,2020-09-14 23:41:51,云财经讯，中来股份：控股子公司泰州中来光电与江苏杰太签署《设备采购合同》，泰州中来光电向江苏杰太采购1台JT8000镀膜设备，合同总金额为2000万元,中来股份：控股子公司泰州中来光电与江苏杰太签署《设备采购合同》
10,2020-09-14 23:37:33,云财经讯，荃银高科：公司部分董监高、核心骨干、安徽张海银种业基金会等15位合伙人签署合伙协议，拟共同投资设立注册资本为500万元的安徽全贤科技合伙企业（有限合伙）,荃银高科：公司部分董监高、核心骨干、安徽张海银种业基金会等15位合伙人签署合伙协议
11,2020-09-14 23:36:11,云财经讯，天风国际分析师郭明錤发表研究报告称，近期市场在争议iPhone 12系列是否会支持120Hz，但相信这种产品规格决策早在开发初期便决定。iPhone 12系列电池容量变小，支持耗电的5G功能已不利续航力，若再支持耗电的120Hz将会显著降低使用者体验。预测新款2H21 iPhone将会采用LTPO技术以降低显示器耗电并支持120Hz。,天风国际郭明錤：预测新款2H21 iPhone将会采用LTPO技术以降低显示器耗电
12,2020-09-14 23:32:01,云财经讯，最近，广西南宁楼市率先打响了“金九银十”价格战。在南宁某楼盘的售楼部，记者了解到，特价房当日就已售空。为了在今年的“金九银十”中抢占先机，一些房企推出了每平米八九千元的特价房等促销措施。对此，业内人士表示，今年“金九银十”期间的房价略有下降，不过由于近两三年，土地价格上涨、人工成本增加等因素，推高了房企的成本，因此房价很难再出现大幅下降。（央视财经）,广西南宁部分楼盘打响促销价格战
13,2020-09-14 23:31:04,"云财经讯，四通新材公告，拟以发行股份的方式购买日本金属持有的保定隆达25%股权，以发行股份的方式购买北京迈创持有的保定隆达10.96%股权，以发行股份的方式购买保定安盛持有的保定隆达3.83%股权。保定隆达全部股权评估值为7.98亿元，经协商，交易双方确定保定隆达39.79%股权作价约3.11亿元，交易各方协商确定为14.52元/股。同时拟募集配套资金不超过3.1亿元，用于新型轻量化铝合金材
料制造项目、偿还上市公司债务和支付本次交易相关税
费及中介机构费用。",四通新材：拟3.11亿元购买保定隆达39.79%股权
14,2020-09-14 23:29:41,云财经讯，天风国际分析师郭明錤发表研究报告称，近期Apple可能会发表的新产品包括iPhone 12系列、iPad Air与Apple Watch。我们估计Apple的iPhone 12系列、iPad Air、Apple Watch的量产出货时间分别是10月上旬 (最快)、9月中旬与9月中旬，大部分供应商股价在新产品发表后上涨空间有限。（新浪）,郭明錤：Apple大部分供应商股价上涨空间有限
15,2020-09-14 23:27:15,云财经讯，广发证券首次覆盖西部超导，并给予其买入初始评级，目标价为64.10元人民币,广发证券首次覆盖西部超导
16,2020-09-14 23:24:00,云财经讯，顺灏股份公告，2020年9月14日，公司控股子公司云南绿新生物药业有限公司、参股公司云南喜科科技有限公司、上海绿馨电子科技有限公司、与云南通盈药业有限公司签订了《合作协议书》，拟出资共同合作设立云南通灏生物科技股份有限公司。上述交易完成后，公司将间接持有合资公司45%股权。,顺灏股份：子公司拟与云南喜科等共设云南通灏生物科技股份有限公司
17,2020-09-14 23:23:59,云财经讯，布伦特原油目前下跌0.9%，报39.46美元/桶,布伦特原油目前下跌0.9%
18,2020-09-14 23:23:30,云财经讯，据媒体报道：OPEC+联合减产监督委员会（JMMC）可能会在9月份会议上允许伊拉克等产油国将补偿性减产行动延长至10-11月份，沙特无意通过额外的自愿减产来提振油价,据媒体报道：OPEC+联合减产监督委员会（JMMC）可能会在9月份会议上允许伊拉克等产油国将补偿性减产行动延长至10-11月份
19,2020-09-14 23:22:05,云财经讯，方正电机公告，公司与中车株洲电力机车研究所有限公司、长沙城市发展集团有限公司、长沙智轨零号企业管理合伙企业、长沙时代智轨企业管理合伙企业(有限合伙)签订《湖南中车智行科技有限公司合资协议书》共同投资成立湖南中车智行科技有限公司。,方正电机：拟与中车株洲等共设湖南中车智行科技有限公司
20,2020-09-14 23:19:36,云财经讯，中达安：近日，公司就13个中标标段与中国移动通信集团25家分子公司分别签订了合同，合同金额合计约5.88亿元。此合同为中国移动2020年至2021年通信工程专业监理服务集中采购框架合同，合同有效期间持续至2021年12月31日止,中达安：近日 公司就13个中标标段与中国移动通信集团25家分子公司分别签订了合同
21,2020-09-14 23:18:13,云财经讯，美国国家飓风中心（NHC）表示，当地时间9月14日，热带风暴“莎莉”将在墨西哥湾中北部上空移动，然后成为飓风，并接近路易斯安那州东南部。作为一个月内威胁该地区的第二场风暴，“莎莉”预计将带来暴雨和强风，风速高达85英里/小时（137公里/小时）。密西西比州和路易斯安那州已向低洼地区的居民发布了强制疏散令，路易斯安那州州长约翰·贝尔·爱德华兹建议生活在“莎莉”路径上的人们撤离。（央视）,热带风暴“莎莉”来袭，美国密西西比州和路易斯安那州发布疏散令
22,2020-09-14 23:17:57,云财经讯，Nikola涨幅超过10%，刷新日高至35.50美元,Nikola涨幅超过10% 刷新日高至35.50美元
23,2020-09-14 23:17:05,云财经讯，斯迪克公告，公司拟与合作方宁波沃能新材料科技有限公司在江苏省太仓市设立控股子公司苏州斯迪克汽车装饰材料有限公司。注册资本1000万元人民币；公司出资510万元人民币，占注册资本的51%，沃能出资490万元人民币，占注册资本的49%。,斯迪克：拟与沃能共设苏州斯迪克汽车装饰材料有限公司
24,2020-09-14 23:14:06,云财经讯，立昂技术：拟使用募集资金向子公司立昂旗云增资4000万元，此次增资完成后，公司持有立昂旗云65.52%的股权,立昂技术：拟使用募集资金向子公司立昂旗云增资4000万元
25,2020-09-14 23:11:28,云财经讯，奥来德公告，公司董事会审议通过了《关于使用募集资金向全资子公司增资以实施募投项目的议案》，同意公司使用募集资金4.59亿元和7115万元分别向全资子公司奥来德(上海)光电材料科技有限公司和上海升翕光电科技有限公司进行增资。,奥来德：拟使用募集资金分别向上海奥来德、上海升翕增资4.59亿元和7115万元
26,2020-09-14 23:11:25,云财经讯，百事目前上涨0.8%，该公司将推出一款名为Driftwell的助眠饮料,百事目前上涨0.8% 该公司将推出一款名为Driftwell的助眠饮料
27,2020-09-14 23:09:15,云财经讯，北部湾港公告，公司、钦州码头、钦州兴港、中海码头、PSA广西、成都交投、重庆物流拟签署《广西北部湾国际集装箱码头有限公司股东协议》。根据协议约定，钦州码头、中海码头、成都交投、重庆物流分别以股权出资或现金出资形式认购全部北集司新增注册资本，其中钦州码头和中海码头将分别以其持有的钦集司60%和40%的股权出资和现金出资；成都交投和重庆物流分别以现金方式出资。本次增资金额(评估值)合计16.5亿元。,北部湾港：钦州码头、中海码头、成都交投、重庆物流拟向子公司北集司合计增资16.5亿元
28,2020-09-14 23:05:39,云财经讯，沃尔玛股价短线上扬逾2美元，刷新日高至141.10美元，使得日内整体涨幅扩大至将近3.0%,沃尔玛股价短线上扬逾2美元
29,2020-09-14 23:01:21,云财经讯，中国化学：本公司8月份当月新签合同额214.54亿元，其中国内合同额180.85亿元，境外合同额33.69亿元；当月实现营业收入95.40亿元,中国化学：本公司8月份当月新签合同额214.54亿元
30,2020-09-14 22:54:58,云财经讯，中国电建：2020年1至8月，公司新签合同总额约4476.74亿元，同比增长28.93%,中国电建：2020年1至8月 公司新签合同总额约4476.74亿元
31,2020-09-14 22:51:47,云财经讯，泰国中央破产法院14日批准泰国国际航空公司（泰航）进行重组的申请。泰航将在今年第四季度向法院提交重组计划以开启重组进程。由于经营不善，泰航近年来连年亏损。据泰国媒体报道，2017年泰航净亏损超过21亿泰铢（约合6711万美元），2018年和2019年亏损额分别扩大至116亿泰铢（约合3.71亿美元）和120亿泰铢（约合3.84亿美元）。（新华社）,泰国中央破产法院批准泰航重组
32,2020-09-14 22:50:27,云财经讯，博雅生物公告，公司去年与博雅广东签订了原料血浆供应框架协议，采购不超500吨原料血浆，采购额不超8.25亿元，目前已预付8.23亿元采购款。鉴于政策环境及现行法规，截至目前，公司向博雅广东采购原料血浆事项采取“调拨申请”方式未能获批。鉴于公司向博雅广东采购原料血浆可能存在重大不确定性，公司将积极推进“调拨申请”等申请工作；向博雅广东采取“资产使用管理”等措施，保障资金安全。,博雅生物：向博雅广东采购原料血浆或存在重大不确定性
33,2020-09-14 22:48:04,云财经讯，Worldometers最新数据显示，印度新冠肺炎死亡病例达到80026例，最新增幅272例，累计确诊4878042例，最新增幅33039例。,印度新冠肺炎死亡病例超过8万
34,2020-09-14 22:45:47,云财经讯，齐心集团：公司董事、财务总监兼董秘黄家兵增持公司股份0.02%,齐心集团：公司董事、财务总监兼董秘黄家兵增持公司股份0.02%
35,2020-09-14 22:44:09,云财经讯，经济合作与发展组织(经合组织)14日发布报告说，各国为遏制新冠肺炎疫情采取的限制措施，对第二季度经济活动产生严重影响。二十国集团二季度国内生产总值出现史无前例的下跌，中国是唯一实现正增长的国家。公报显示，中国二季度国内生产总值环比上涨11.5%，反映出中国经济的复苏。除中国之外的19个国家二季度国内生产总值平均环比下降11.8%，其中印度跌幅最大，为25.2%。综合中国的正增长，二十国集团今年二季度国内生产总值环比下降6.9%，远超2009年一季度金融危机期间1.6%的跌幅。（央视）,经合组织：中国是二十国集团中唯一实现二季度经济正增长的国家
36,2020-09-14 22:42:18,云财经讯，长川科技：公司实控人赵轶、董事钟锋浩、孙峰拟合计减持不超过3.7%,长川科技：公司实控人赵轶、董事钟锋浩、孙峰拟合计减持不超过3.7%
37,2020-09-14 22:40:11,云财经讯，据中国驻印度大使馆网站9月14日消息，孙卫东大使就近期媒体询及中印外长双边会见发表谈话。孙卫东表示，今年涉边事件发生以来，如何正确把握中印关系的发展方向更显重要。两国领导人曾达成一系列重要共识，其中的一个基本判断就是：中印是伙伴而不是对手、是机遇而不是威胁。因此，中印要和平，不要冲突；要合作共赢，不要零和博弈；要信任，不要猜忌；中印关系要前进，不要后退。这是推动两国关系重回正轨的正确方向。,中国驻印度大使再谈边境事态：中印是伙伴而不是对手、是机遇而不是威胁
38,2020-09-14 22:37:45,云财经讯，9月14日A股放量回升，第三代半导体板块大涨8.1%，成为两市焦点。有基金经理认为，随着5G手机出货量的持续增加，5G驱动的换机潮将到来，有望促进相关科技公司的业绩持续释放，当前应遵循“存优去劣”原则布局5G设备、传输网、云计算等科技核心资产。其中，半导体板块作为科技产业的底层支撑，未来有望多点开花。（中证报）,第三代半导体板块大涨逾8%，基金经理称布局科技核心资产要遵循“存优去劣”原则
39,2020-09-14 22:33:08,云财经讯，14日，澳大利亚最大的四家航空公司联合向联邦政府施压，要求重新开放各州边境。其中澳大利亚规模排在前两位的澳洲航空和维京航空表示，关闭边境，停止旅行对于航空业来说是“灾难性”的后果，而他们主张所有人都应该学会如何与疫情共处。（央视）,澳大利亚四大航空公司向澳联邦政府施压，要求重开州边境
40,2020-09-14 22:32:01,云财经讯，热门中概股多数上涨，蘑菇街涨超15%，金山云涨超13%，华米科技涨超12%，魔线涨超10%。跟谁学涨超6%，虎牙、腾讯ADR、爱奇艺涨超3%，微博、哔哩哔哩、网易、京东、拼多多涨超2%，百度、阿里巴巴涨超1%。,热门中概股多数上涨 蘑菇街涨超15%
41,2020-09-14 22:21:39,云财经讯，甲骨文恢复交易，目前上涨6.8%,甲骨文恢复交易 目前上涨6.8%
42,2020-09-14 22:21:36,云财经讯，据旷视科技消息，9月14日上午，北京市委常委、副市长殷勇带队调研旷视科技新总部，实地了解人工智能企业的技术发展、落地实践以及运营情况等。殷勇强调，当下，以北京为样板，在津冀推广，“三方协同”构建区域产业创新生态的发展模式正在形成。在此过程中，以旷视为代表的头部科技企业要充分发挥龙头企业的领先作用，积极推进和带动产业上下游产业链发展，为数字经济发展新生态贡献力量。,北京市委常委、副市长殷勇一行走访调研旷视科技
43,2020-09-14 22:20:03,云财经讯，伴随着黄金价格上涨，美股黄金股集体上涨，B2黄金涨超6%，亚马纳黄金、Alamos黄金、派拉蒙黄金、泛美白银均涨超3%，巴里克黄金，纽蒙特矿业涨超1%。金矿股ETF-VanEck Vector涨3.3%,伴随着黄金价格上涨
44,2020-09-14 22:15:27,云财经讯，美国财政部长姆努钦今天晚间接受媒体采访时称，财政部在周末接到提案，甲骨文作为TikTok可信赖的数据安全合规合作伙伴，代表解决美国国家安全问题。TikTok将继续把美国作为总部，并为美国创造2万个工作岗位。值得注意的是，姆努钦谈到的解决方案，是甲骨文作为数据合规伙伴，类似苹果在中国由云上贵州进行数据合规的方案，并不涉及之前特朗普提到的要求TikTok出售，也不涉及TikTok的核心技术转让。（国是直通车）,美财长谈TikTok解决方案：不涉及出售和技术转让
45,2020-09-14 22:14:25,云财经讯，9月14日晚公告精选：*ST康得及其实控人等涉嫌犯罪被移送检察院审查起诉；齐翔腾达拟分拆齐鲁科力至创业板上市；九强生物新冠病毒抗体检测试剂盒进入出口白名单；博雅生物向博雅广东采购原料血浆或存重大不确定性；华工科技、天喻信息等实控人可能变更；中泰化学拟剥离贸易业务；先导智能拟定增募资不超25亿元，引入战投宁德时代；美的集团上调股份回购价格至不超75元/股；东旭光电拟30亿投建中性硼硅药用玻璃管项目。,公告精选：美的集团上调回购价格；先导智能拟引入战投宁德时代
46,2020-09-14 22:07:29,云财经讯，9月14日晚间，高瓴创始人兼首席执行官张磊在谈到“价值”时表示，之前大家对于老的价值投资定义，都是所谓的寻找护城河。如果是这样的话，我是反对这种静态的价值投资论的。我认为这个世界上只有一条护城河，这个护城河就是你能不能不断地疯狂地创造长期价值。,高瓴创始人兼首席执行官张磊谈“价值”
47,2020-09-14 22:05:19,云财经讯，道指上涨逾300点，成分股美国运通、苹果均涨超2%。,道指上涨逾300点 苹果涨超2%
48,2020-09-14 22:01:38,云财经讯，Bitstamp数据显示，比特币最近24小时涨超3%，刷新9月3日以来高位至10668美元上方,Bitstamp数据显示 比特币最近24小时涨超3%
49,2020-09-14 21:58:29,云财经讯，韩国疾病管理厅14日举行成立仪式，宣布计划明年完成国产新冠疫苗研发，并在今年内研发出国产新冠病毒治疗剂（血浆治疗剂）。（新华社）,韩国宣布计划明年研发出国产新冠疫苗
50,2020-09-14 21:51:50,云财经讯，新华医疗：控股股东淄矿集团与颐养集团签订无偿划转协议，淄矿集团拟将其持有的新华医疗28.77%无偿划转至颐养集团。划转完成后，颐养集团将成为公司控股股东，淄矿集团不再持有公司股份，公司实控人不变,新华医疗：控股股东淄矿集团与颐养集团签订无偿划转协议
51,2020-09-14 21:50:51,云财经讯，协定包括十四条和七个附录，主要规定了地理标志保护规则和地理标志互认清单等内容。协定纳入双方共550个地理标志（各275个），涉及酒类、茶叶、农产品、食品等。根据协定，安溪铁观音、五常大米、四川泡菜等我国第一批100个知名地理标志将在协定生效后立即获得欧盟的保护，有效阻止仿冒等侵权行为的发生。第二批175个地理标志将于协定生效后四年内获得保护。根据协定，我国相关地理标志产品有权使用欧盟的官方标志。（商务部）,商务部部长钟山与德国驻华大使葛策、欧盟驻华大使郁白签署《中华人民共和国政府与欧洲联盟地理标志保护与合作协定》
52,2020-09-14 21:48:17,云财经讯，纳指涨幅扩大至2%，科技股与芯片股走强,纳指涨幅扩大至2%
53,2020-09-14 21:45:15,云财经讯，光莆股份：为加快公司在第三代半导体光应用领域战略布局落地，拟与火炬创投等共同投资设立产业基金，总认缴规模1.5亿元，公司作为有限合伙人拟出资7500万元,光莆股份：为加快公司在第三代半导体光应用领域战略布局落地
54,2020-09-14 21:45:08,云财经讯，爱克股份(300889)、谱尼测试(300887)、华业香料(300886)9月16日晚间披露公告，公司股票将于9月16日在创业板上市。,爱克股份、谱尼测试、华业香料9月16日将于创业板上市
55,2020-09-14 21:43:56,"云财经讯，9月14日，银保监会大型银行部有关负责人表示，近年来四大行的竞争力明显增强，与发达国家银行的差距明显缩小。下一步我国大型银行的转型方向主要是数字化，要进一步强化公司治理。分析称，随着人工智能、大数据、云计算、区块链等技术兴起，科技赋能金融已成为金融发展的重要趋势,“无科技不金融”逐渐成为行业共识。公司方面，先进数通面向金融企业提供IT解决方案及服务。华软科技在数字金融领域拥有先进产品和解决方案。（中证资讯）",银保监会表态 我国大型银行转型方向是数字化
56,2020-09-14 21:43:55,云财经讯，2020年国家网络安全宣传周今天开幕。宣传周以“网络安全为人民，网络安全靠人民”为主题，以线上宣传为重点，线上线下相结合，通过“云展览”、线上论坛等多种方式深入开展宣传教育活动。（央视）,国家网络安全宣传周今天开幕
57,2020-09-14 21:43:15,云财经讯，航锦科技：全资子公司长沙韶光近日收到来自北京X方X科技有限公司的卫星导航模拟器采购订单，订单金额2040万元。预计将为长沙韶光2020年度带来营业收入663万元，2021年度带来营业收入1377万元,航锦科技：全资子公司长沙韶光近日收到来自北京X方X科技有限公司的卫星导航模拟器采购订单
58,2020-09-14 21:40:57,云财经讯，9月14日，2020年国家网络安全宣传周拉开帷幕，5G云网新基建、新技术新应用等网络安全新议题成为亮点。中国信息通信研究院调查报告显示，42.4%的企业在选择公有云服务商时会考虑服务安全性，43%的企业在私有云安全上的投入占IT总投入的10%以上。新基建涉及到整个社会全场景的数字化改造，安全需求至少是千亿级别。深信服发布的“信服云”实现向数据中心全面云化的新战略升级；绿盟科技深耕网络安全领域多年。（上证资讯）,网络安全宣传周正式启动 行业未来市场或超千亿
59,2020-09-14 21:37:45,云财经讯，央行副行长范一飞14日发文指出：央行正在稳步推进数字人民币的研发试点工作。数字人民币主要定位于M0，是法定货币的数字化形态。从M0的发行模式看，应由商业银行承担向公众兑换数字人民币的职能。有分析称，银行App如果要服务海量B/C端客户和众多线上/线下支付场景，势必也会提高运维投入。高伟达的主要核心客户（建设银行等）业务需求旺盛；宇信科技在银行IT领域保持领先；四方精创不断在区块链领域实现创新突破。（上证资讯）,数字人民币研发稳步推进 将由商业银行实施兑换
60,2020-09-14 21:33:46,云财经讯，甲骨文美股盘中停牌，等待进一步消息披露,甲骨文美股盘中停牌
61,2020-09-14 21:31:52,云财经讯，据报道，小米将于明年发布第三代屏下摄像头技术，并将实现此款新型智能手机的量产。据悉，小米10至尊版演示了第三代屏下相机显示技术。此前，中兴首款屏下摄像头手机中兴AXON 20 5G销售异常火爆。目前，包括中兴、小米、OPPO、VIVO等手机大厂均在相关领域争先布局，随着中兴、小米等屏下摄像头手机的量产及相关技术的进步，屏下摄像头渗透率望加速，同兴达、虹软科技等相关产业链公司有望受益。（怀新资讯）,继中兴后小米明年量产新型屏下摄像头手机 行业发展望加速
62,2020-09-14 21:30:30,云财经讯，美股三大指数集体高开，道指涨0.58%，纳指涨1.44%，标普500指数涨0.96%。甲骨文涨近7%，英伟达涨逾7%。,美股三大股指集体高开 甲骨文涨近7%
