,datetime,content,title
241,2020-08-21 18:45:07,云财经讯，英唐智控：控股股东兼董事长胡庆周拟减持不超过4.98%,英唐智控：控股股东兼董事长胡庆周拟减持不超过4.98%
242,2020-08-21 18:44:14,云财经讯，太钢不锈：公司股票自2020年8月24日（星期一）上午开市起复牌,太钢不锈：公司股票自2020年8月24日（星期一）上午开市起复牌
243,2020-08-21 18:38:55,云财经讯，深交所交易监管部总监李庆中表示，创业板注册制新股上市初期，受市场供求关系、交易机制改变等因素影响，个别股票可能出现短期炒作、异常交易、大幅波动的风险。深交所将严守一线监管底线，精准打击异常交易和违法违规行为。严密监控相关股票交易，推进交易与信息披露监管联动，依托智能化监察系统，利用大数据、人工智能等技术快速锁定异动账户，对异常交易行为采取针对性的监管措施，发现市场操纵等违法违规线索快速核查上报，切实维护市场交易秩序，保护中小投资者的合法权益。,深交所交易监管部总监李庆中：创业板改革初期，将利用人工智能等快速锁定异动账户
244,2020-08-21 18:38:31,云财经讯，泰豪科技(600590)8月21日晚公告，中环资产、广播器材通过天津产权交易中心挂牌，拟转让其合计持有的天津七六四通信导航技术有限公司90%股权，挂牌转让底价为1.57亿元。公司的全资子公司泰豪军工拟以自有资金方式参与公开摘牌收购七六四公司90%股权。通过此次交易，公司可与七六四在通信指挥、卫星导航等领域形成较好的协同效应，完善公司军工装备产业相关产业链。,泰豪科技：拟公开摘牌收购七六四公司90%股权 完善军工装备产业链
245,2020-08-21 18:37:28,云财经讯，杭叉集团(603298)8月21日晚披露公开发行可转债预案，募集资金总额不超过12亿元，用于年产6万台新能源叉车建设投资项目、研发中心升级建设项目、集团信息化升级建设项目、营销网络及叉车体验中心建设项目。,杭叉集团：拟发行不超12亿元可转债 用于新能源叉车等项目
246,2020-08-21 18:34:38,云财经讯，证监会核发7家企业IPO批文，未披露筹资金额,证监会核发7家企业IPO批文
247,2020-08-21 18:32:45,云财经讯，拼多多2020年第二季度财报显示，二季度，拼多多的营收达到121.93亿元，同比增长67%。平台二季度亏损大幅收窄，非通用会计准则下，归属于普通股股东的净亏损为7724万元，对比去年同期为净亏损4.11亿元。拼多多表示，平台上的广大中小商家在后疫情时代展现出了强大的韧性，二季度是电商行业的传统旺季，加上国内经济在疫情后的稳步复苏，商家的广告需求也在迅速恢复。,拼多多Q2财报：营收同比增长67%至121.93亿元
248,2020-08-21 18:30:04,云财经讯，据专资办票房统计数据，中国电影市场时隔221天，在《八佰》正式上映首日，全国单日票房再度破亿。目前《八佰》以8900+万的单日票房成绩领跑，《哈利波特与魔法石》《1/2的魔法》《魔发精灵2》等外片分列第二、三、四位。,时隔221天 全国单日票房再度破亿
249,2020-08-21 18:27:44,云财经讯，拼多多发布2020年第二季度财报，截至6月30日，平台年活跃买家数6.832亿，较去年同期净增2亿，较上一季度净增5510万，创上市以来最大单季增长。二季度，拼多多APP平均月活用户数5.688亿，较去年同期的3.66亿增长55%，较上一季度净增8140万，单季净增规模创历史新高。该项数据仅统计拼多多APP入口月活用户，未包括通过社交网络和其他接入口访问拼多多平台的用户。,拼多多Q2财报：月活用户超5.68亿，单季增长8140万
250,2020-08-21 18:22:10,云财经讯，科伦药业公告，公司及全资子公司湖南科伦制药有限公司参加了联合采购办公室组织的第三批全国药品集中采购的投标工作。公司的枸橼酸托法替布片（5mg）、氢溴酸西酞普兰片（20mg）/氢溴酸西酞普兰胶囊（20mg）、盐酸达泊西汀片（30mg/60mg）、阿莫西林颗粒（0.125g）拟中标本次集中采购，且公司根据各省市场潜力进行了省份遴选。,科伦药业：公司参与全国药品集中采购拟中标
251,2020-08-21 18:21:44,云财经讯，百度在沧州开放Apollo Go自动驾驶出租车服务，沧州市民通过百度地图，即可一键呼叫免费搭乘体验，沧州由此成为中国第一个可以在主城区打到Robotaxi的城市。这也是继今年4月在长沙全面开放之后，Apollo在第二个城市上线常态化的打车服务，这意味着Apollo正在加速规模化部署，百度无人车服务Apollo Go迈入多地运营的全新阶段。（TechWeb）,百度无人出租车Apollo Robotaxi落地沧州
252,2020-08-21 18:16:37,云财经讯，注：此前媒体称，华大集团考虑让设备子公司华大智造最早在今年进行规模10亿美元的科创板IPO。,中信证券受聘担任华大智造首次公开发行A股股票并上市的辅导机构
253,2020-08-21 18:15:44,云财经讯，鱼跃医疗(002223)8月21日晚间公告，拟与蚂蚁集团、千方科技、国泰世华、宁德时代、南洋商业银行及中国华融共同出资80亿元在重庆市设立重庆蚂蚁消费金融有限公司。,鱼跃医疗：拟与蚂蚁集团等多方合作设立消费金融公司
254,2020-08-21 18:13:15,云财经讯，彩讯股份：持股10.12%的股东广东达盛拟减持不超过1.25%,彩讯股份：持股10.12%的股东广东达盛拟减持不超过1.25%
255,2020-08-21 18:12:47,云财经讯，上交所：科创板相关基金等涨跌幅比例为20%,上交所：科创板相关基金等涨跌幅比例为20%
256,2020-08-21 18:09:00,云财经讯，证监会关于欺诈发行上市股票责令回购实施办法（试行）（征求意见稿）起草说明：在制度设计上，《实施办法》主要遵循以下原则：通过剥夺责任主体的不当利益，强制其支付相应经济代价，并在一定情况下产生超过不当利益的经济损失，从而提高其违法成本，对上市公司及其控股股东、实际控制人起到威慑和警示作用，最终实现减少欺诈发行行为的预防功能，为注册制改革有序推进提供保障。,证监会：通过剥夺责任主体的不当利益 从而提高其违法成本
257,2020-08-21 18:08:15,云财经讯，上海凤凰(600679)8月21日晚披露半年报，上半年，公司营收为6.19亿元，同比增长56.34%，主要系自行车销售收入比上年同期增加；净利为4331万元，同比增长135%。公司认为：此次疫情提升了大众对健康出行的需求，为自行车行业的发展带来新的机遇，特别是欧美等发达国家对自行车产品需求的提升，将进一步拉动中国自行车行业向“高端化、智能化、时尚化”方向发展。,上海凤凰：上半年净利同比增长135%
258,2020-08-21 18:06:01,云财经讯，山煤国际：拟对外投资设立合资公司开展高效异质结（HJT）太阳能电池产业化一期3GW项目，预计一期项目投资金额约31.89亿元,山煤国际：拟对外投资设立合资公司开展高效异质结（HJT）太阳能电池产业化一期3GW项目
259,2020-08-21 18:02:02,云财经讯，拼多多公布财报后盘前短线跳水，现跌超5%,拼多多公布财报后盘前短线跳水
260,2020-08-21 18:01:22,云财经讯，证监会就《欺诈发行上市股票责令回购实施办法（试行）（征求意见稿）》公开征求意见,证监会就《欺诈发行上市股票责令回购实施办法（试行）（征求意见稿）》公开征求意见
261,2020-08-21 18:01:02,云财经讯，在本次签约期间，还举办了有色行业发展座谈会，双方就有色金属期货的创新、发展与国际化进行了充分研讨。双方均表示要进一步通力合作，不断提升期现产融结合的广度和深度，推动期货市场在实现有色金属行业高质量发展和建设有色金属工业强国进程中发挥更加积极的作用，全方位提高中国有色金属期货市场和有色金属产业的国际影响力，积极推动氧化铝等期货品种上市，逐步实现建设世界一流行业协会和世界一流交易所的战略目标。,上期所与中国有色协会续签战略合作协议，将推动氧化铝等期货品种上市
262,2020-08-21 18:00:27,云财经讯，8月20日，国家发展改革委投资司通过网络视频举办了“全国发展改革系统基础设施投资信托基金（REITs）试点工作培训会”。会上，投资司副司长韩志峰对做好试点工作提出了八方面具体要求：一是切实负起责任，提高工作主动性。二是准确把握发改部门职责定位。三是积极做好宣传培训工作。四是增强服务意识，主动做好项目服务工作。五是严格做好项目审核工作，推荐优质项目参与试点。六是项目申报和审查工作做到一视同仁、公平对待。七是高度重视并促进项目持续健康平稳运营。八是鼓励募集资金用于新建项目，促进形成投资良性循环。,发改委投资司：严格做好REITs试点项目审核工作，推荐优质项目参与试点
263,2020-08-21 17:58:36,云财经讯，北京市发改委：即日起，北京市基础设施REITs试点项目启动申报,北京市发改委：即日起 北京市基础设施REITs试点项目启动申报
264,2020-08-21 17:57:01,云财经讯，8月21日上午，湖北省委书记应勇，省委副书记、省长王晓东与中国银行行长王江一行座谈交流。应勇表示，希望中国银行一如既往关心、支持湖北经济社会发展，继续加大在鄂投入力度，积极发展金融业务，助力湖北培育发展金融服务业，为疫后重振提供高质量金融服务。我们将积极落实双方签署的战略合作协议，持续打造市场化、法治化、国际化的营商环境，全力支持包括中国银行在内的广大企业在湖北更好更快发展。（湖北日报）,应勇王晓东与中国银行行长王江座谈，为湖北疫后重振提供高质量金融服务
265,2020-08-21 17:56:06,云财经讯，西水股份公告，2020年8月21日，公司接到子公司天安财险通知，上述新时代信托计划中于2020年8月20日到期的“新时代信托蓝海1309号”投资本金为12.50亿元，到期利息0.59亿元，本息合计13.09亿元，截至8月20日天安财险未收到此信托计划的本金和投资收益。截至本公告日，天安财险到期且未收到投资本金和收益的新时代信托产品共有13笔、合计投资本金155.80亿元。,"西水股份：本息合计13.09亿元的信托计划逾期
           
  利空"
266,2020-08-21 17:53:41,云财经讯，拼多多盘前涨近3%，开盘后股价势将站上100美元,拼多多盘前涨近3%
267,2020-08-21 17:51:08,云财经讯，正帆科技：拟认缴出资5000万元投资青岛聚源银芯股权投资合伙企业，合伙企业募集的资金专项投资于中芯集成电路制造（绍兴）有限公司,正帆科技：拟认缴出资5000万元投资青岛聚源银芯股权投资合伙企业
268,2020-08-21 17:48:51,云财经讯，8月21日，用友网络与新网银行正式达成战略合作，未来，双方将在“金融服务”、“企业云服务”等领域展开深度合作。基于本次合作，双方将充分发挥各自优势，推动科技与金融结合，通过技术赋能，共同打造产业金融的开放商业创新平台，为产业链上的企业客户提供线上化、场景化，创新、便捷的可定制化金融服务。,用友与新网银行签署战略合作协议 探索产业数字金融创新
269,2020-08-21 17:48:38,云财经讯，上交所消息，本周（2020年8月17日至2020年8月21日），沪市共发生45起证券异常交易行为，其中，科创板4起（拉抬打压3起、对倒1起）。上交所对此及时采取了书面警示等自律监管措施。同时，针对15起上市公司重大事项等进行核查，向证监会上报4起涉嫌违法违规案件线索。,上交所：本周针对15起上市公司重大事项等进行核查
270,2020-08-21 17:48:37,云财经讯，青鸟消防：持股9.95%的股东陈文佳拟减持不超过2.49%,青鸟消防：持股9.95%的股东陈文佳拟减持不超过2.49%
271,2020-08-21 17:48:24,云财经讯，上海市委副书记、市长龚正今天前往对口联系的浦东新区调研。龚正指出，要着力扩大有效投资，围绕新基建、新型城镇化、重大工程，加快推进项目建设。要着力扩大最终消费，及时谋划出招，推动消费尽快恢复到常态化水平。要着力稳住外资外贸基本盘，助力外贸企业积极开拓新市场，狠抓重大外资项目签约落地，让浦东的“磁场”吸引力更强。要支持自贸试验区临港新片区建设跑出更快加速度，在全市发展格局中发挥好增长极和发动机作用。（澎湃）,上海市市长龚正：希望浦东新区全力以改革创新促发展、稳增长
272,2020-08-21 17:47:05,云财经讯，中联重科：今年上半年实现净利润40.18亿元，同比增长55.97%，拟10派2.1元。工程机械行业受设备更新、机械替代效应及“两新一重”建设持续推进等多重利好驱动影响，上半年行业保持高景气度,中联重科：今年上半年实现净利润40.18亿元
273,2020-08-21 17:46:46,云财经讯，中联重科(000157)8月21日晚间披露半年报，上半年营收288.27亿元，同比增长29.49%；净利润40.18亿元，同比增长55.97%；基本每股收益0.54元。,中联重科：上半年净利润同比增长55.97%
274,2020-08-21 17:44:11,云财经讯，华新水泥公告，2020年8月20日，公司第九届董事会第十九次会议审议通过了《关于公司境内上市外资股转换上市地以介绍方式在香港联合交易所有限公司主板上市及挂牌交易方案的议案》及与公司境内上市外资股转换上市地方案相关的所有议案。根据上海证券交易所的相关规定，经公司申请，公司股票自2020年8月24日开市起复牌。,华新水泥：公司股票自2020年8月24日开市起复牌
275,2020-08-21 17:42:37,云财经讯，福田汽车(600166)8月21日晚披露半年报，上半年，公司营收为272.15亿元，同比增长4.44%；净利为1.79亿元，同比下降28%。上半年，公司销售汽车32万辆，较去年同期增长17.6%，其中商用车市场占有率13.3%，较去年同期增长1.2个百分点，位列商用车第一。,福田汽车：上半年净利同比下降28%
276,2020-08-21 17:42:10,云财经讯，8月21日，长春市发布《关于新红旗大街部分路段开放智能网联汽车测试通知》，选取汽开区相应路段作为智能网联汽车测试道路，并向社会公告。目前，长春市已在净月区、汽开区开放了智能网联测试道路，测试场景包括城市核心区、旅游景区、工业园区、乡村道路等场景，涵盖了智能网联汽车测试研发、示范应用所需要的重要场景。,长春新增智能网联汽车测试开放道路，涵盖多种测试场景
277,2020-08-21 17:39:07,云财经讯，通产丽星公告，全资子公司力合科创集团有限公司与启东市人民政府签订《合作协议》，双方本着优势互补、互惠互利的原则，经友好协商，就开展长期合作达成共识。力合科创拟出资在启东经济开发区成立具有独立法人资格的启东力合创新中心有限公司，注册资本金人民币5000万元，负责产学研深度融合的科技创新孵化体系在启东的实施落地，主要包括科技成果转化、科技创新孵化、产业运营、国际化创新服务、创新教育、创新载体建设。,通产丽星：子公司与江苏省启东市人民政府签订合作协议
278,2020-08-21 17:38:14,云财经讯，马应龙(600993)8月21日晚披露半年报，上半年，公司营收为9.81亿元，同比下降23%，主要受新冠疫情影响，导致营业收入下降，其中一季度同比下降45%，二季度同比下降2.92%。上半年净利为2.35亿元，同比增长8.46%。,马应龙：上半年净利同比增8.46%
279,2020-08-21 17:36:25,云财经讯，得利斯：拟在三原县投资建设200万头/年生猪屠宰及肉制品加工项目，项目总投资约为3.96亿元,得利斯：拟在三原县投资建设200万头/年生猪屠宰及肉制品加工项目
280,2020-08-21 17:35:31,云财经讯，上海医药：收到上海药监局颁发的《药品生产许可证》，同意上海上药中西制药有限公司及上海医药集团青岛国风药业股份有限公司作为受托生产方分别受托生产溴吡斯的明片及卡马西平片,上海医药：收到上海药监局颁发的《药品生产许可证》
281,2020-08-21 17:35:24,云财经讯，妙可蓝多(600882)8月21日晚披露半年报，上半年，公司营收为10.83亿元，同比增长51.74%；净利为3222万元，同比增长727.87%。报告期，公司奶酪核心业务快速增长，且中高端零售产品比例提升，收入及产品结构持续改善。,妙可蓝多：上半年净利同比增728%
282,2020-08-21 17:34:21,云财经讯，劲拓股份(300400)8月21日晚披露半年报，上半年，公司实现营业总收入4.49亿元，较上年同期增长104.32%；净利润6664.64万元，较上年同期增长1224.72%；基本每股收益0.28元。报告期内，部分海外客户扩产需求增加，公司实现海外营业收入2686.99万元，同比增长128.94%。新增口罩机销售收入5038.13万元。,劲拓股份：上半年净利同比增1224.72% 新增口罩机销售收入5038.13万元
283,2020-08-21 17:33:39,云财经讯，广大特材：拟定增募资不超过17亿元，用于宏茂海上风电高端装备研发制造一期项目和补充流动资金,广大特材：拟定增募资不超过17亿元
284,2020-08-21 17:32:36,云财经讯，动力源：今年上半年实现净利润593.66万元，同比增长324.25%。公司持续聚焦于数据通信、智慧能源和新能源汽车领域的电能转换与能源利用，业绩实现稳定增长,动力源：今年上半年实现净利润593.66万元
285,2020-08-21 17:30:57,云财经讯，北向资金今日净买入立讯精密6.32亿元、歌尔股份4.73亿元，净卖出京东方A2.73亿元、中国卫星1.62亿元。,北向资金今日净买入立讯精密6.32亿元
286,2020-08-21 17:30:14,云财经讯，妙可蓝多：今年上半年实现净利润3222.2万元，同比增长727.87%,妙可蓝多：今年上半年实现净利润3222.2万元
287,2020-08-21 17:28:48,云财经讯，ST中孚(600595)8月21日晚公告，8月20日，公司收到债权人郑州市丰华碳素有限公司的《通知书》，因公司不能清偿到期债务并且明显缺乏清偿能力，丰华碳素已向法院提出对公司进行重整的申请。ST中孚同时披露半年报，上半年营收为31亿元，同比下降11%；净利为亏损1.87亿元，上年同期亏损1.9亿元。,ST中孚：被债权人申请重整
288,2020-08-21 17:27:53,云财经讯，大丰实业：中标鹰潭市四馆项目西馆（文化艺术中心和青少年宫）舞台工艺设备等采购项目，中标金额1.09亿元,大丰实业：中标鹰潭市四馆项目西馆（文化艺术中心和青少年宫）舞台工艺设备等采购项目
289,2020-08-21 17:26:49,云财经讯，宇新股份公告，为整合优势资源打造产业链，实现互利共赢，经友好协商，本公司与惠州新材料产业园规划建设指挥部于2020年8月20日签署了《战略合作框架协议》。公司计划在惠州新材料产业园内投资建设轻烃综合利用项目，主要生产碳三及高端化工新材料产品。项目预计总投资约159亿元人民币，分一期、二期和远期建设，按项目进度和投资进展分期供地，其中一期、二期项目所需土地面积约60万平方米，须通过招拍挂方式取得土地使用权。具体投资金额及规模尚需以政府有权机关备案批复为准。,宇新股份：与惠州新材料产业园规划建设指挥部签署了《战略合作框架协议》
290,2020-08-21 17:24:59,云财经讯，秦安股份：8月17日至8月20日，公司对前期建仓的期货投资合约进行部分平仓，平仓收益额为1.08亿元，占公司2019年度经审计净利润的91.29%,秦安股份：8月17日至8月20日 公司对前期建仓的期货投资合约进行部分平仓
291,2020-08-21 17:23:12,云财经讯，亚玛顿(002623)8月21日晚间公告，上半年公司实现营收7.42亿元，同比增43.46%；净利润4047.83万元，同比增619.33%；基本每股收益0.25元。此外，公司拟向不超过35名特定投资者，非公开发行不超过4800万股股份，定增募资不超过10亿元用于大尺寸、高功率超薄光伏玻璃智能化深加工建设等项目。,亚玛顿：上半年净利同比增逾6倍 拟定增募资不超过10亿元
292,2020-08-21 17:23:10,云财经讯，广弘控股：上半年实现净利润1.56亿元，同比增长122.24%。预计前三季度净利润为2.15亿-2.59亿元，同比增长50%-80%,广弘控股：上半年实现净利润1.56亿元
293,2020-08-21 17:20:28,云财经讯，据国家电影专资办数据，截至8月20日0时，全国票房已超10.1亿元，超3300万人次观影。院线从老片复映到新片定档，观众从期盼复工到安心观影，影院从疫情中复苏。,影院复工满月票房已超10亿
294,2020-08-21 17:17:50,云财经讯，中国人保：今年上半年实现净利润126.06亿元，去年同期为154.78亿元,中国人保：今年上半年实现净利润126.06亿元
295,2020-08-21 17:17:33,云财经讯，深高速(600548)8月21日晚公告，公司、资本集团、鲲鹏基金及福田投控将按每股3.05元的价格分别对万和证券增资并认购其发行的新股，其中，公司出资9.5亿元认购3.11亿股。增资协议完成后，公司将持有万和证券经扩股本中约8.68%股份，万和证券将不会成为公司之附属公司。深高速同时披露半年报，上半年净利为4392万元，同比下降97%。,深高速：拟9.5亿元增资万和证券 持股8.68%
296,2020-08-21 17:15:19,云财经讯，中证协发布《关于推进证券行业数字化转型发展的研究报告》，加快出台行业标准，促进金融科技应用融合。逐步建立完善人工智能、区块链、云计算、大数据等数字技术在证券行业的应用标准和技术规范，完善人工智能技术在投资顾问业务领域的应用条件及合规要求,中证协发布《关于推进证券行业数字化转型发展的研究报告》
297,2020-08-21 17:14:24,云财经讯，亚玛顿：拟定增募资不超过10亿元，用于大尺寸、高功率超薄光伏玻璃智能化深加工建设项目、大尺寸、高功率超薄光伏玻璃智能化深加工技改项目、BIPV防眩光镀膜玻璃智能化深加工建设项目、技术研发中心升级建设项目和补充流动资金,亚玛顿：拟定增募资不超过10亿元
298,2020-08-21 17:07:58,云财经讯，华金资本(000532)8月21日晚间公告，公司下属全资子公司铧盈投资拟通过协议方式转让持有的珠海富海华金创业投资基金（有限合伙）等10项股权投资基金份额。,华金资本：子公司铧盈投资拟转让持有的多项股权投资基金份额
299,2020-08-21 17:01:29,云财经讯，以岭药业：盐酸二甲双胍片、卡托普利片和盐酸环丙沙星片拟中选全国药品集中采购,以岭药业：盐酸二甲双胍片、卡托普利片和盐酸环丙沙星片拟中选全国药品集中采购
300,2020-08-21 17:00:09,云财经讯，海螺水泥：今年上半年实现净利润161亿元，同比增长5.31%,海螺水泥：今年上半年实现净利润161亿元
301,2020-08-21 16:57:39,云财经讯，发改委：自2020年8月21日24时起，国内汽、柴油价格（标准品）每吨分别提高85元和80元,发改委：自2020年8月21日24时起
302,2020-08-21 16:57:14,云财经讯，外管局：7月，货物贸易跨境收支顺差同比增长12%，外资净增持境内上市股票和债券规模同比增加1.4倍，外国来华直接投资和我国对外直接投资相关资金流动保持总体稳定,外管局：7月 货物贸易跨境收支顺差同比增长12%
303,2020-08-21 16:52:45,云财经讯，片仔癀(600436)21日晚披露半年报，上半年，公司营收为32.46亿元，同比增长12.16%；净利为8.65亿元，同比增长15.84%。报告期，公司着力推进11个在研新药项目，多个项目取得重大进展，其中，仿制药PZH2310、PZH2312已提交上市注册申请并进入补充资料阶段；治疗广泛性焦虑症新药PZH1204、治疗肠易激综合征PZH1201、治疗骨关节炎新药PZH1203进入临床研究阶段。,片仔癀：上半年净利同比增长15.84%
304,2020-08-21 16:51:11,云财经讯，兴业证券(601377)8月21日晚公告，股东福建省投及融资担保公司拟于2020年9月14日至2021年3月13日期间，以集中竞价交易方式合计减持不超1.3亿股，不超过公司总股本的1.95%。,兴业证券：股东拟减持不超1.95%股份
305,2020-08-21 16:51:09,云财经讯，外管局：7月银行结售汇逆差177亿元人民币；按美元计值，结售汇逆差25亿美元,外管局：7月银行结售汇逆差177亿元人民币
