,datetime,content,title
469,2020-03-19 07:19:00,前标普全球副主席保罗·谢尔德表示，目前市场的情绪还不足以比肩08年时。在疫情平息前，还会有刺激政策出台。但美国经济陷入危机的可能性很高。（第一财经）,前标普全球副主席：市场恐慌未及“巅峰”
470,2020-03-19 07:19:00,澳大利亚S&P/ASX200指数涨幅扩大至1.8%。,澳大利亚S&P/ASX200指数涨幅扩大至1.8%
471,2020-03-19 07:18:00,亚市早盘，WTI原油期货涨幅扩大至超12%。,亚市早盘WTI原油期货涨幅扩大至超12%
472,2020-03-19 07:15:00,广发证券海外策略首席分析师廖凌近日表示，在全球资本市场剧烈震荡的大背景下，中国权益资产的配置机会明显，且对跨市场资金而言，预计自二季度开始，港股的性价比将不断提升。对于海外股市，廖凌判断目前市场的位置还在左侧，即拐点尚未出现。...,广发证券：二季度港股或显现配置价值
473,2020-03-19 07:14:00,基金公司2019年经营业绩渐次揭开面纱，其中，睿远基金、建信基金、金鹰基金以及南华基金等4家基金公司率先亮相。睿远基金2019年净利润实现扭亏为盈，达到5914.51万元。睿远基金在陈光明、傅鹏博、赵枫等明星基金经理的打理下，品牌效应非常明显...,四基金经营业绩亮相 睿远实现盈利近6000万元
474,2020-03-19 07:14:00,巴西新冠肺炎累计确诊病例达到428例，累计死亡病例为4例。,巴西新冠肺炎累计确诊病例达到428例
475,2020-03-19 07:14:00,据荷兰媒体BNO刚刚消息，美国国会议员Mario Díaz―Balart新冠病毒检测结果呈阳性。Díaz―Balart刚刚在个人推特上也证实了这一消息。（环球网）,美国国会议员Mario Díaz―Balart新冠病毒检测结果呈阳性
476,2020-03-19 07:08:00,截至美国东部时间18日19时（北京时间19日7时），美国累计新冠肺炎确诊病例7769例，其中纽约州占1/3；累计死亡118例。（央视新闻）,美国累计新冠肺炎确诊病例7769例
477,2020-03-19 07:07:00,根据当地时间3月18日18时意大利卫生部公布的最近数据，意大利现有新冠病毒患者28710例，死亡2978例，治愈4025例，累计确诊感染新冠病毒总人数为35713例，较3月17日18时新增4207例，新增475例死亡病例。,意大利新增4207例累计确诊35713例 新增475例死亡
478,2020-03-19 07:07:00,国产大飞机的研制生产进程并未被疫情打乱，目前正有序推进中。记者了解到，AG600位于湖北的研发机构已经分区域、分批次复工；C919在南昌、东营等地开展密集试飞；运20今年首架飞机已交付。据记者不完全统计，目前已有20多家A股上市公司参与到国...,产业链A股公司协力保障 国产三款大飞机研产有序推进
479,2020-03-19 07:07:00,欧洲央行宣布7500亿欧元的应对新冠病毒大流行的资产购买计划，购买计划覆盖私人和公共部门的证券。计划包括现有资产购买项目下的所有资产类别。资产购买将进行至2020年底。,欧洲央行宣布7500亿欧元资产购买方案
480,2020-03-19 07:06:00,当地时间03月18日20时06分，葡萄牙总统发表电视讲话，正式宣布国家进入紧急状态。根据总统令，国家紧急状态将持续15天，可根据实际情况延长。紧急状态期间，与民生相关的行业如超市、药店等不会关闭。,萄萄牙总统宣布进入国家紧急状态
481,2020-03-19 07:05:00,截至美东时间18日19:00，美国约翰斯·霍普金斯大学公布的实时疫情数据显示，美国累计新冠肺炎确诊病例为7769例，其中，118例死亡病例。确诊病例遍布全美，确诊人数最多的是纽约州，确诊2495例，死亡16人。其次是华盛顿州和加州，分别确诊1014例...,美国新冠肺炎累计确诊病例7769例 纽约州占1/3
482,2020-03-19 07:04:00,在市场恐慌之际，一些机构投资者开始抄底中国优质资产。港交所最新数据显示，摩根大通、高瓴资本、朱雀基金等知名机构近期在港股市场上动作频频，斥巨资大比例增持了部分股票。与此同时，尽管北向资金近日整体呈现净流出，但A股部分优质个股同样...,逆向投资者出手 海内外机构抄底中国优质资产
483,2020-03-19 06:54:00,美国三大股指期货涨幅扩大，标普500指数涨1%。,美国三大股指期货涨幅扩大 标普500指数涨1%
484,2020-03-19 06:53:00,美国三大股指期货转涨，此前跌幅一度扩大至1%。,美国三大股指期货转涨，此前跌幅一度扩大至1%
485,2020-03-19 06:50:00,欧洲央行：宣布7500亿欧元针对疫情的的购买计划，将覆盖私营和公共领域的证券。,欧洲央行：宣布7500亿欧元针对疫情的的购买计划
486,2020-03-19 06:43:00,截至当地时间3月18日20时30分，德国共确诊11973例新冠病毒肺炎感染病例，其中死亡病例28例。（人民日报）,德国累计确诊11973例新冠病毒肺炎感染病例
487,2020-03-19 06:42:00,上海、陕西、新疆、四川等多地恢复旅游企业部分经营活动。旅行社、在线旅游平台的首批产品近日已经开始恢复上线接受预订。同时，相关地区的线下门店也开始开业。旅行社行业开始有序复工，国内旅游市场加快复苏步伐。（经济参考报）,多地恢复旅行社部分经营活动 线上预订恢复
488,2020-03-19 06:42:00,进入3月以来，随着疫情进一步得到控制，房地产市场逐渐迎来修复性回暖。机构监测数据显示，上周全国40个大中城市一手房合计成交230.53万平方米，环比增长45.46%，同比下降39.98%。其中，一、二、三线城市一手房成交面积环比分别增长23.63%、35.0...,日光盘再现 楼市回暖需时日
489,2020-03-19 06:42:00,以5G为代表的新基建备受市场关注。北京、江西、上海、深圳等多地近日部署推进2020年5G建设工作。券商分析认为，5G建设进入新阶段，产业链景气度稳步攀升，上游天线、射频器件、光模块等细分行业将优先受益。（中国证券报）,多地迅速推进 5G建设料超预期
490,2020-03-19 06:16:00,以色列将限制外国旅客入境。（美国有线电视新闻网）,以色列将限制外国旅客入境
491,2020-03-19 06:15:00,当前，从中央到地方都在密集部署推进重大投资项目开工复工。伴随重大项目的渐次启动，如何满足资金需求的问题也提上日程。连日来，地方政府专项债券发行提速、中央预算内投资接连加码。与此同时，为解资金之“渴”，多地纷纷设立专项融资资金，...,多路资金加速涌入“解渴”重大项目
492,2020-03-19 06:09:00,美股三大指数期货均跌超1%。,美股三大指数期货均跌超1%
493,2020-03-19 06:05:00,WTI原油期货开盘涨9.5%至22.30美元/桶。,WTI原油期货开盘涨9.5%至22.30美元/桶
494,2020-03-19 06:02:00,携程集团有限公司预计第一季度营收-45％至-50％。,携程集团有限公司预计第一季度营收-45％至-50％
495,2020-03-19 06:01:00,美股三大股指期货小幅低开。道指期货跌0.22%，标普500指数期货跌0.14%，纳指期货跌0.16%。,美股三大股指期货小幅低开 道指期货跌0.22%，
496,2020-03-19 05:50:00,“新债王”冈拉克：目前没有做空任何美国股票，这是多年以来首次。,“新债王”冈拉克：目前没有做空任何美国股票，这是多年...
497,2020-03-19 05:47:00,巴西圣保罗要求关闭所有零售商店，直至4月5日。,巴西圣保罗要求关闭所有零售商店
498,2020-03-19 05:38:00,从证监会官网了解到，今日（3月19日），将有6家企业首发申请上会审核。从以往IPO审核的节奏来看，发审委基本保持在平均每周审核4家企业的速度，对于这次一天上会6家企业，业内人士认为，为支持企业融资需求，资本市场直接融资功能正在发挥着积极...,今日6家企业上会，IPO常态化发行持续
499,2020-03-19 05:33:00,哈佛大学肯尼迪政府学院高级研究员、前标普全球副主席保罗·谢尔德表示，就事态的发展速度而言，虽看似与次贷危机有类似之处，但当前危机的根源是由一场大流行病所引发的公共卫生系统危机，而目前美国经济和资本市场受到的冲击都是由于防疫所采...,前标普全球副主席：市场恐慌未及“巅峰”，特朗普迎大考
500,2020-03-19 05:22:00,纽交所：本周有两名员工新冠病毒检测结果为阳性。,纽交所：本周有两名员工新冠病毒检测结果为阳性
501,2020-03-19 05:07:00,巴西央行将基准利率下调50个基点至3.75%。,巴西央行将基准利率下调50个基点至3.75%
502,2020-03-19 05:05:00,巴西参议院议长新冠病毒检测结果呈阳性。,巴西参议院议长新冠病毒检测结果呈阳性
503,2020-03-19 05:05:00,英镑兑美元GBP/USD短线跳水100点，现报1.1497。,英镑兑美元GBP/USD短线跳水100点
504,2020-03-19 05:03:00,A股市场大幅震荡，场内资金大举抄底。超100亿资金借道股票型开放式指数基金（ETF）进场，沪深300、上证50、中证500等宽基ETF，芯片ETF、半导体50ETF、5GETF等科技ETF成为资金买入的对象。根据银河证券基金研究中心的股票ETF基金资金测算模型计算...,逾百亿资金借道ETF流入A股
505,2020-03-19 04:43:00,当地时间18号，世卫组织在日内瓦总部召开新冠肺炎例行发布会，会上，世卫组织卫生紧急项目负责人迈克尔·瑞安针对媒体关注的美国总统特朗普称新冠病毒为“中国病毒”做出回应。一直以来我们传递的信息就很清晰，病毒没有国界，不区分种族肤色和...,世卫组织回应特朗普称新冠病毒为“中国病毒”：不应把病...
506,2020-03-19 04:43:00,美国纽交所将暂时性地实施完全电子交易，股票和期权交易大厅将暂时关闭，所有的电子交易将在下周一开盘时开始。,美国纽交所将暂时性地实施完全电子交易
507,2020-03-19 04:38:00,“新债王”Gundlach：美国在2020年陷入经济衰退的概率高达90%。,“新债王”Gundlach：美国在2020年陷入经济衰退的概率高...
508,2020-03-19 04:14:00,美股周三继续暴跌，道指失守20000点关口，盘中标普500指数下跌7%触发熔断机制；航空股重挫，达美航空、美国航空跌超25%。,美股收盘：美股剧震盘中熔断 道指失守2万关口
509,2020-03-19 04:13:00,据外媒，美国参议院已投票通过众议院的新冠病毒纾困法案，下一步将递交给美国总统特朗普签署。,美国参议院已投票通过众议院的新冠病毒纾困法案
510,2020-03-19 04:12:00,美国财长：金融市场将保持开放，但可能会缩短交易时间。,美国财长：金融市场将保持开放，但可能会缩短交易时间
511,2020-03-19 04:11:00,特朗普表示，美国已订购了5亿只N95口罩。,特朗普表示，美国已订购了5亿只N95口罩
512,2020-03-19 03:54:00,美股跌幅继续缩窄，道指现跌6.7%，纳指跌5.6%，标普500指数跌6%。,美股跌幅继续缩窄 道指现跌6.7%
513,2020-03-19 03:52:00,美国参议院有足够票数通过众议院的第一项新冠病毒纾困法案，投票仍在继续。,美国参议院有足够票数通过众议院的第一项新冠病毒纾困法案
514,2020-03-19 03:52:00,美股继续回升，道指跌幅缩窄至1600点以内，较日内低点涨逾700点。,美股继续回升，道指跌幅缩窄至1600点以内
515,2020-03-19 03:42:00,美国国家经济顾问表示，第三阶段的新冠病毒纾困法案可能会带来1.3万亿美元的财政刺激，美国有足够多的资源来处理援助陷入困境的行业。,美国国家经济顾问：第三阶段的新冠病毒纾困法案可能会带...
516,2020-03-19 03:41:00,美国参议员Cramer敦促特朗普对俄罗斯、沙特以及欧佩克原油实施禁令。,美国参议员Cramer敦促特朗普对俄罗斯、沙特以及欧佩克原...
517,2020-03-19 03:39:00,受新冠肺炎疫情和石油价格走低等因素影响，18日，俄罗斯股市及卢布汇率双双下跌。莫斯科交易所指数（MOEX Russia Index）3月18日收盘报2112.64点，跌幅为5.04%。为稳定卢布币值，俄央行设置“汇率走廊”，即规定汇率波动幅度的同时，不断调整波...,俄股市及卢布大幅下跌 莫斯科交易所卢布跌停
518,2020-03-19 03:36:00,“奥运会若因疫情取消，已售门票将不退”的消息在日本国内外引起热议。东京奥林匹克运动会和残奥会组委会当日进行回应：（部分）报道内容与事实不符，“7月24日开幕的奥运会仍将按计划进行准备工作。”（日本《日刊体育》）,东京奥运因疫情取消不退票？东京奥组委：部分报道内容与...
519,2020-03-19 03:31:00,丹麦国家卫生局18日发布的最新数据显示，截至当天17时，丹麦累计新冠肺炎确诊病例1057例，死亡4例。,丹麦累计新冠肺炎确诊病例1057例
520,2020-03-19 03:27:00,欧洲央行管委会就应对新冠病毒召开紧急电话会议。,欧洲央行管委会就应对新冠病毒召开紧急电话会议
521,2020-03-19 03:19:00,法国决定将银行逆周期资本缓冲率降至0%，这将释放80亿欧元的资金。,法国决定将银行逆周期资本缓冲率降至0%
522,2020-03-19 03:18:00,美国国务院发言人：美国将暂停面向大多数国家的常规签证服务。,美国国务院发言人：美国将暂停面向大多数国家的常规签证服务
523,2020-03-19 03:12:00,吉利德科学直线拉升，涨幅扩大至6.2%，此前投行Piper Sandler认为吉利德科学的瑞德西韦药物可能会获得批准。,吉利德科学直线拉升，涨幅扩大至6.2%
524,2020-03-19 03:11:00,美股回升，道指跌幅缩窄至8%以内，标普500指数跌7.1%，纳指跌6.4%。,美股回升 道指跌幅缩窄至8%以内
525,2020-03-19 03:08:00,截至3月13日，石油对冲基金Andurand 3月的收益率为40%。,石油对冲基金Andurand 3月的收益率为40%
526,2020-03-19 03:06:00,奥地利禁止做空股票，做空禁令实施期限为一个月。,奥地利禁止做空股票
527,2020-03-19 03:05:00,吉利德科学拉升，现涨超3%。,吉利德科学拉升，现涨超3%
528,2020-03-19 02:52:00,WTI原油跌幅进一步收窄至18.5%，现报21.85美元/桶；布伦特原油跌幅收窄至不足10%，报25.92美元/桶。,WTI原油跌幅进一步收窄至18.5%
529,2020-03-19 02:51:00,现货黄金继续回升，收复1500美元/盎司，较日低回升近30美元，日内跌幅收窄至1.96%。,现货黄金继续回升 收复1500美元/盎司
530,2020-03-19 02:51:00,美元指数DXY跌至101下方，日内涨幅收窄至1.6%。,美元指数DXY跌至101下方 日内涨幅收窄至1.6%
531,2020-03-19 02:44:00,美国五角大楼：（被问及近期驻伊拉克美军遭火箭弹袭击事件）仍在考虑如何对袭击作出回应。,美国五角大楼：仍在考虑如何对近期驻伊拉克美军遭火箭弹...
532,2020-03-19 02:42:00,摩根大通：预计美国经济增速将在第一季度萎缩4%，第二季度萎缩14%。,摩根大通：预计美国经济增速将在第一季度萎缩4%
533,2020-03-19 02:40:00,加拿大S&P/TSX重挫10%，跌穿关键支撑位至2012年低点。,加拿大S&P/TSX重挫10%
534,2020-03-19 02:38:00,WTI原油过去十天大跌56%，为1983年原油合约推出以来最差的十日表现。,WTI原油创1983年原油合约推出以来最差十日表现
535,2020-03-19 02:36:00,国际数据公司（IDC）：新冠肺炎疫情将在2020年对全球半导体市场产生重大影响。,IDC：新冠肺炎疫情将在2020年对全球半导体市场产生重大影响
536,2020-03-19 02:35:00,上海黄金交易所黄金T+D晚盘收盘下跌0.68%报336.80元/克；上海黄金交易所白银T+D晚盘收盘下跌10.60%报2833.00元/千克。,黄金T+D晚盘收盘下跌0.68%
537,2020-03-19 02:34:00,欧盟首席脱欧谈判官巴尼耶：有可能与英国达成大胆的、全面的协议。,欧盟首席脱欧谈判官巴尼耶：有可能与英国达成大胆的、全...
538,2020-03-19 02:28:00,德国将欧洲内部的边境管控措施扩大至航空旅行。,德国将欧洲内部的边境管控措施扩大至航空旅行
539,2020-03-19 02:27:00,毛里求斯首次报告3例新冠病毒确诊病例，将从周四开始关闭机场。,毛里求斯首次报告3例新冠病毒确诊病例
540,2020-03-19 02:25:00,美国参议院多数党（共和党）领袖麦康奈尔：共和党接近就一份更大的应对新冠病毒的刺激计划立法达成协议。,美国共和党接近就一份更大的应对新冠病毒的刺激计划立法...
541,2020-03-19 02:25:00,美元指数DXY短线下挫逾20点，涨幅收窄至1.82%，现报101.21，美元兑日元USD/JPY短线跌超30点，现报108.14，日内涨幅收窄至0.44%。,美元指数DXY短线下挫逾20点 涨幅收窄至1.82%
542,2020-03-19 02:23:00,捷克共和国的新病毒确诊病例升至522例。,捷克共和国的新病毒确诊病例升至522例
543,2020-03-19 02:22:00,法国公共卫生部官员：法国新冠肺炎确诊病例增至9134例，死亡病例增至264例，此前报告为175例。,法国新冠肺炎确诊病例增至9134例
544,2020-03-19 02:20:00,美股狂泻，道指刷新日低，失守19000点关口，已从2月的高点29568点下跌超1万点。纳指失守6700点，为2019年1月以来首次。,道指刷新日低 失守19000点关口
545,2020-03-19 02:16:00,美国新泽西州州长：新泽西州新冠病毒确诊病例升至427，死亡病例5例。,美国新泽西州新冠病毒确诊病例升至427
546,2020-03-19 02:13:00,巴西司法部长：巴西将暂时关闭边境。,巴西司法部长：巴西将暂时关闭边境
547,2020-03-19 02:06:00,美国官员称有50万套新冠病毒检测试剂正从意大利运往美国，预计还会有更多。,美国官员称有50万套新冠病毒检测试剂正从意大利运往美国
548,2020-03-19 02:05:00,据美媒报道，当地时间3月18日，美国总统特朗普表示将引用《国防生产法》来扩大口罩等防护器具的生产。《国防生产法》是美国1950年通过的战时法案，可以授权总统更大的权力以要求相关行业扩大关键物资的生产。（中国日报）,特朗普将引用国防生产法扩大口罩生产
549,2020-03-19 02:03:00,世行行长马尔帕斯：世界银行两名在华盛顿的雇员感染了新冠病毒。,世行行长马尔帕斯：世界银行两名在华盛顿的雇员感染了新...
550,2020-03-19 02:02:00,英国首相鲍里斯·约翰逊在18日晚举行的新冠疫情发布会上宣布，从本周五开始，除了少数关键岗位防疫一线人员医护人员的子女和一些弱势群体儿童等可以继续上学外，英格兰的所有学校和幼儿园等教育机构全部停课，5月和6月的升学考试也被取消。18日...,英国首相约翰逊：英格兰的所有学校和幼儿园等教育机构全...
551,2020-03-19 01:59:00,美股汽车股集体重挫，通用汽车跌超29%，蔚来汽车跌超21%，特斯拉跌近18%，福特跌近17%，菲亚特克莱斯勒跌超15%，日本丰田和本田跌超4%，法拉利跌超3%。,美股汽车股集体重挫，通用汽车跌超29%
552,2020-03-19 01:55:00,欧洲地中海地震中心：印尼巴厘岛南部发生6.4级地震。,欧洲地中海地震中心：印尼巴厘岛南部发生6.4级地震
553,2020-03-19 01:53:00,伦敦金属交易所（LME）期铜跌7.8%，为2008年以来最大单日跌幅。,伦敦金属交易所（LME）期铜跌7.8%
554,2020-03-19 01:49:00,WTI原油跌幅收窄至20%，现报21.51美元/桶；布伦特原油现报25.14美元/桶。,WTI原油跌幅收窄至20%
555,2020-03-19 01:47:00,巴西能源部长新冠病毒检测结果呈阳性。,巴西能源部长新冠病毒检测结果呈阳性
556,2020-03-19 01:44:00,美股触底回升，道指跌幅缩窄至1800点以内，纳指跌6.8%。,美股触底回升 道指跌幅缩窄至1800点以内
557,2020-03-19 01:38:00,现货白银日内一度跌超7%，现报11.673美元/盎司。,现货白银日内一度跌超7%
558,2020-03-19 01:35:00,尼日利亚将在数周内将原油产量提高至250万桶/日。,尼日利亚将在数周内将原油产量提高至250万桶/日
559,2020-03-19 01:35:00,标普500指数失守2300点，为2017年2月以来首次。,标普500指数失守2300点
560,2020-03-19 01:34:00,美股跌势不减，道指跌超10%，标普500指数跌近9%。,美股跌势不减 道指跌超10%
561,2020-03-19 01:33:00,布伦特原油跌破25美元/桶，为2003年5月以来新低。,布伦特原油跌破25美元/桶
562,2020-03-19 01:32:00,WTI原油日内跌幅进一步扩大至逾20%，报21.34美元/桶；布伦特原油跌12.37%，逼近25美元/桶。,WTI原油日内跌幅进一步扩大至逾20%
563,2020-03-19 01:32:00,美股继续暴跌，道指跌超2000点，标普500指数跌8.4%。,美股继续暴跌 道指跌超2000点
564,2020-03-19 01:30:00,道指跌幅扩大至9%，标普500跌幅扩大至8%。,道指跌幅扩大至9%，标普500跌幅扩大至8%
565,2020-03-19 01:29:00,加纳央行将基准利率由16%降至14.5%。,加纳央行将基准利率由16%降至14.5%
566,2020-03-19 01:29:00,沙特的新冠肺炎确诊人数升至238例。（沙特通讯社）,沙特的新冠肺炎确诊人数升至238例
567,2020-03-19 01:27:00,现货黄金跌至1480美元/盎司下方，日内跌3.33%。,现货黄金跌至1480美元/盎司下方
568,2020-03-19 01:22:00,因新冠肺炎疫情蔓延，智利总统皮涅拉18日宣布，从19日零时起智利全国进入灾难紧急状态，为期90天。皮涅拉说，依据宪法，在灾难紧急状态下，政府可以采取限制公众场合集会、宣布社会隔离和宵禁、限制人员车辆流动等一系列措施。（新华社）,智利总统宣布国家将进入灾难紧急状态应对疫情
569,2020-03-19 01:20:00,英国教育大臣：英国学校将在周五关闭，直至进一步通知。,英国教育大臣：英国学校将在周五关闭 直至进一步通知
570,2020-03-19 01:18:00,当地时间3月18日下午，荷兰卫生部最新通报，截至当天，荷兰境内新增确诊新冠肺炎病例346例，新增死亡病例15例；累计确诊2051例，死亡58例。（新京报）,荷兰新增346例新冠肺炎确诊病例 累计确诊2051例
571,2020-03-19 01:17:00,美国航空股重挫，达美航空跌势不减，现跌近40%，美国联合航空跌39%，美国航空集团跌31%。,美国航空股重挫 达美航空跌势不减
572,2020-03-19 01:15:00,特斯拉跌幅扩大至14%,特斯拉跌幅扩大至14%
573,2020-03-19 01:13:00,意大利累计新冠肺炎确诊病例从昨日的31506例增至35713例，累计死亡病例从2503例增至2978例。,意大利累计新冠肺炎确诊病例从昨日的31506例增至35713例
574,2020-03-19 01:13:00,加拿大S&P/TSX股指恢复交易，现跌约7%。,加拿大S&P/TSX股指恢复交易 现跌约7%
575,2020-03-19 01:11:00,美股恢复交易，跌势不止，道指继续扩大跌幅至8%。,道指恢复交易后继续下行，现跌超8%
576,2020-03-19 01:07:00,富时中国A50指数期货直线下挫，跌超1%。恒指期货跌1.2%。,富时中国A50指数期货直线下挫，跌超1%
577,2020-03-19 01:06:00,彭博美元指数创历史新高：上涨约2.2%，最高触及1281.24。,美元指数创历史新高
578,2020-03-19 01:04:00,WTI原油跌破22美元/桶，日内跌幅扩大至逾18%；布伦特原油日内跌11.15%。,WTI原油跌破22美元/桶，日内跌幅扩大至逾18%；布伦特原油...
579,2020-03-19 01:02:00,加拿大S&P/TSX股指熔断。,加拿大S&P/TSX股指熔断
580,2020-03-19 01:01:00,美国房地美和房利美将暂停止赎（ForeClosures，丧失抵押品赎回权），以帮助特朗普的新冠肺炎疫情应对计划。,房利美和房地美暂停止赎
581,2020-03-19 01:00:00,恒指期货夜盘直线下挫，现跌1.29%。,恒指期货夜盘直线下挫 现跌1.29%
582,2020-03-19 00:58:00,英镑兑美元GBP/USD持续下挫，日内跌幅一度扩大至5%，现报1.1489。,英镑兑美元持续下挫 日内跌幅扩大至5%
583,2020-03-19 00:56:00,标普500指数跌幅扩大至7%，触发本月第四次熔断，美股暂停交易15分钟。,标普500指数跌幅扩大至7% 触发本月第四次熔断
584,2020-03-19 00:52:00,美元指数DXY日内涨超2%，报101.46。,美元指数DXY日内涨超2%
585,2020-03-19 00:50:00,特朗普表示，今天可能会宣布对南部边境采取措施。,特朗普：今天可能会宣布对南部边境采取措施
586,2020-03-19 00:48:00,桥水基金创始人达里奥表示，世界已经跨过了一个非常危险的金融市场和经济的阈值。桥水基金客户通知显示，至3月16日，桥水全天候12%波动性“风险平价”基金缩水大约14%，Pure Alpha的18%波动性对冲基金缩水大约18%，主要市场14%波动性对冲基金缩...,桥水基金创始人达里奥：世界已经跨过了一个非常危险的金...
587,2020-03-19 00:44:00,周三欧洲股市收盘，欧洲斯托克50指数收跌6.04%，德国DAX指数收跌5.23%，英国富时100指数收跌3.97%，法国CAC40指数收跌6.56%。,欧洲股市大幅收跌
588,2020-03-19 00:41:00,特朗普称，还需要数百万的口罩，也需要呼吸机。,特朗普：还需要数百万的口罩，也需要呼吸机
589,2020-03-19 00:37:00,截至当地时间3月18日下午15时，瑞士联邦公共卫生部通报瑞士全境核酸检测呈阳性病例累计达3028例，其中新冠肺炎确诊病例达2772例，其他病例尚在进一步确诊和程序申报过程中。（央视）,瑞士核酸检测呈阳性病例达3028例
