,datetime,content,title
0,2020-07-10 23:51:00,世界卫生组织总干事谭德塞：全球新冠肺炎病例超1200万例，病例数在过去6周内翻了一番。,世界卫生组织总干事谭德塞：全球新冠肺炎世病例数在过去6...
1,2020-07-10 23:43:00,美股三大指数悉数转涨，道指涨0.7%，纳指涨0.05%，标普500指数涨0.3%。,美股三大指数悉数转涨
2,2020-07-10 23:39:00,据英国卫生与社会保障部消息，截至当地时间7月10日9时，英国新冠肺炎确诊病例单日新增512例，累计确诊288133例。截至当地时间7月9日17时，英国累计死亡44650例，单日新增死亡48例。,英国新冠肺炎确诊病例新增512例 累计超28.8万例
3,2020-07-10 23:30:00,日前，有消息称比亚迪旗下控股子公司比亚迪半导体有限公司考虑在科创板或创业板上市，并正与财务顾问商讨。对此，比亚迪方面回应称，比亚迪半导体拟多元化股东结构，积极寻求适当时机独立上市，公司将按照有关要求，及时履行信息披露义务。（每经）,半导体子公司将登陆科创板？ 比亚迪：积极寻求适当时机独...
4,2020-07-10 23:21:00,生物制药公司Nkarta首日开盘报54.75美元，IPO发行价报18美元，日内涨幅目前超过200%。,制药公司Nkarta上市首日涨超200%
5,2020-07-10 23:11:00,据日本广播协会电视台当地时间10日22时更新的新冠疫情数据，日本当天新增确诊病例413例，这是日本4月24日之后首次出现单日新增病例超过400例。数据还显示，日本已累计确诊病例21181例，累计死亡982例。,日本单日新增病例再超400例
6,2020-07-10 23:03:00,伊拉克报告新增2848例新冠肺炎确诊病例，累计确诊72460例。,伊拉克报告新增2848例新冠肺炎确诊病例
7,2020-07-10 22:53:00,在2020世界人工智能大会上，美团首席科学家夏华夏接受财新等采访时称，美团正探索用无人车和无人机在城市中做派送。2月，已有几辆美团无人配送车在北京顺义区常态化运营，等到把技术上的疑难杂症解决之后，最晚3到5年会到规模化的阶段。他称无人...,美团：三年到五年无人车配送规模化 无人机配送普及
8,2020-07-10 22:46:00,美、布两油短线走高0.3美元，日涨幅分别扩大至1.2%和1.1%。,美、布两油短线走高0.3美元
9,2020-07-10 22:39:00,中国疾控中心流行病学首席专家吴尊友：哈萨克斯坦有关肺炎病例是新冠肺炎的可能性更大。（环球网）,吴尊友：哈萨克斯坦有关肺炎病例是新冠肺炎的可能性更大
10,2020-07-10 22:35:00,我国目前是家电制造第一大国，也是家电消费第一大国。有数据显示，我国家电保有量已超过21亿台，相当部分家庭正在使用的家电产品，是在2009年至2011年间，我国实施“以旧换新”政策时购置的，根据安全使用寿命，这部分家电即将或者已经进入了替...,我国家电产销均列世界首位
11,2020-07-10 22:24:00,德国生物新技术公司BioNTech首席执行官表示，该公司与美国医药巨头辉瑞(PFE.N)共同开发的新冠疫苗预计将在2020年底前通过审批。据此前报道，若安全性和有效性研究成功并且疫苗获得监管部门的批准，两家公司预计，到2020年底将生产多达1亿剂，到2...,辉瑞、BioNTech新冠疫苗预计将在年内获批
12,2020-07-10 22:15:00,未来是否可能出现的零星病例？吴尊友认为，这是有可能的。个别的零星病例不代表疫情没有控制，不代表疫情反弹。从目前北京的防控形势来看，即使有的话，性质就是疫情结束前的零星病例，它与疫情初期的新增病例完全不同。清零前，发现的病例基本...,吴尊友：北京再出现个别零星病例不代表疫情反弹
13,2020-07-10 22:15:00,世界气象组织（WMO）当地时间9日发布的最新气候预测报告显示，未来五年（2020―2024年）中，每年的全球年均气温都有可能比工业化前水平（1850―1900年）至少高出1℃。世界气象组织秘书长警告称，这一研究表明气候变化《巴黎协定》温控目标面临巨...,WMO预测未来五年全球平均气温再升高
14,2020-07-10 22:03:00,现货黄金日内转跌，现报1802.53美元/盎司；现货白银涨幅收窄至0.8%，现报18.59美元/盎司。,现货黄金日内转跌
15,2020-07-10 22:02:00,美国约翰斯·霍普金斯大学实时数据显示，当地时间周四，美国新增63247例新冠肺炎确诊病例，创单日新高，累计确诊3118168例。,美国新增63247例新冠肺炎确诊病例
16,2020-07-10 21:56:00,康美300亿造假后续！这家头部券商遭重罚，拟暂停保荐资格6个月，14名责任人也被罚，公开谴责、限制领取薪酬，详情>>>,【聚焦】广发证券被采取“史上最严”监管措施
17,2020-07-10 21:54:00,现货黄金短线下挫逾3美元，现报1804.27美元/盎司。,现货黄金短线下挫逾3美元
18,2020-07-10 21:37:00,中概股普遍回调，京东(JD.O)跌3.7%，拼多多(PDD.O)跌3.3%，趣店(QD.N)跌4.9%。,中概股普遍回调
19,2020-07-10 21:30:00,美股开盘，道指接近平开；银行股、黄金股普涨；蔚来汽车开涨7%，蔚来中国获104亿元银行综合授信；吉利德科学开涨逾2%，此前其公布的数据显示瑞德西韦可降低62%的病亡风险。,美股开盘：道指接近平开 蔚来汽车开涨7%
20,2020-07-10 21:29:00,康泰生物：上半年净利预增0%―10%，盈利2.58亿元-2.84亿元。,康泰生物：上半年净利预增0%―10%
21,2020-07-10 21:25:00,特朗普批准北达科他州、田纳西州、夏威夷、犹他州因地震、风暴、洪水等自然灾害而进入灾难状态。,特朗普批准美国多州进入灾难状态
22,2020-07-10 21:14:00,中国民航局数据显示，上半年民航业的亏损额达740.7亿元。民航局将在前期出台的16项扶持政策基础上，再出台8项扶持政策，预计将为航空公司年减负约100亿元。（第一财经）,上半年民航业巨亏740亿，航司将获百亿减负
23,2020-07-10 21:07:00,WTI原油转涨，此前一度跌逾1美元，布伦特原油接近抹平日内跌幅。,WTI原油转涨
24,2020-07-10 21:02:00,广发证券：公司及相关人员收到中国证券监督管理委员会广东监管局《行政监管措施事先告知书》，广东证监局拟对公司采取责令改正、暂停保荐机构资格6个月、暂不受理债券承销业务有关文件12个月、责令限制高级管理人员权利的监管措施。,广发证券：公司及相关人员收到广东证监局《行政监管措施...
25,2020-07-10 20:59:00,得利斯：与新疆中泰签订战略合作框架协议，双方就现代养殖、畜牧业、肉类、食品加工等大农业领域，以及其他环保 PVC 等材料产业领域达成了战略合作意向。,得利斯：与新疆中泰签订战略合作框架协议
26,2020-07-10 20:48:00,乐视退：公司注意到2020年7月10日公司股价出现涨停，截至2020年7月10日（含当日）公司股票已在退市整理期交易24个交易日，仅剩余6个交易日，退市整理期结束后公司股票将被摘牌，公司股票退市后，将不能重新上市。,乐视退：已在退市整理期交易24个交易日 退市整理期结束后...
27,2020-07-10 20:44:00,央行：下半年金融系统将继续做好“六稳”工作，落实“六保”任务，加大对稳企业、保就业的金融支持，预计M2和社会融资规模将保持平稳增长。,央行：预计M2和社会融资规模将保持平稳增长
28,2020-07-10 20:43:00,央行货币政策司副司长郭凯：要引导融资成本进一步降低，向实体经济让利。国务院也有1.5万亿元让利的要求。同时也要认识到利率适当下行并不是利率越低越好，利率过低也是不利的。,央行货币政策司：要引导融资成本进一步降低，向实体经济让利
29,2020-07-10 20:43:00,"宁波银行：持股13.26%的股东雅戈尔集团股份有限公司拟减持不超过2%。
",宁波银行：持股5%以上股东拟减持不超过2%
30,2020-07-10 20:41:00,央行办公厅主任兼新闻发言人周学东：各个种类的再贷款利率都下调了，金融稳定再贷款只是再贷款当中的一个品种；下调再贷款的利率主要是为了体现对实体经济进行支持，引导金融机构降低对企业的贷款利率。,央行办公厅：下调再贷款的利率主要是为了体现对实体经济...
31,2020-07-10 20:40:00,央行调查统计司司长兼新闻发言人阮健弘：预计下半年货币信贷以及社融会保持平稳增长的态势。,阮健弘：预计下半年货币信贷以及社融会保持平稳增长的态势
32,2020-07-10 20:32:00,星网宇达：持股5%以上股东拟减持不超过1%。,星网宇达：持股5%以上股东拟减持不超过1%
33,2020-07-10 20:31:00,美国6月PPI月率-0.2%，前值0.40%。,美国6月PPI月率-0.2% 前值0.40%
34,2020-07-10 20:28:00,中装建设：中标多项重大工程项目，中标金额总计5.88亿元。,中装建设：中标多项重大工程项目 中标金额总计5.88亿元
35,2020-07-10 20:28:00,深信服：持股5%以上股东拟减持不超过2%。,深信服：持股5%以上股东拟减持不超过2%
36,2020-07-10 20:26:00,雅化集团：子公司雅化国际与银河锂业续签锂精矿承购协议。银河锂业向雅化国际供应的产品为锂辉石精矿，2020 年度供应量不低于 4.5 万吨；2021年～2025 年每个合同年度供应量不低于 12 万吨，超出 12 万吨时，在同等条件下雅化国际有优先购买权。,雅化集团：子公司雅化国际与银河锂业续签锂精矿承购协议
37,2020-07-10 20:24:00,澳门特区政府社会文化司司长欧阳瑜10日表示，粤澳和港澳健康码互认工作一直在协商中，不会因为香港疫情变化而暂停沟通。澳门特区政府会继续密切关注邻近地区疫情的发展，研判适合的时间推出新措施。她强调，任何措施都会以澳门居民的安全为大前...,欧阳瑜：通关便利措施以澳门居民安全为大前提
38,2020-07-10 20:17:00,日前，深交所已完成创业板注册制下再融资在审企业的申请受理工作，并按其在证监会的审核阶段和受理顺序开展审核工作。7月10日，深交所发出创业板试点注册制下首批再融资审核问询函，共对19家在审企业提出问询，其中4家向不特定对象发行证券申请...,深交所发出注册制下首批创业板再融资审核问询函
39,2020-07-10 20:13:00,凯捷咨询的《世界财富报告》每年发布一次，备受各方瞩目。2020年报告在美国时间7月9日发表。凯捷咨询表示，此次全球高净值人士财富增长的领头羊并非亚太地区，这种情况为2012年以来首次（连2018年财富下行时，亚太下行幅度都为各地区最大）。不...,世界财富报告显示，北美2012年以来首次跑赢亚太
40,2020-07-10 20:08:00,九洲电气：公司名称拟变更为哈尔滨九洲集团股份有限公司，证券简称变更为九洲集团。,九洲电气：公司名称拟变更为哈尔滨九洲集团股份有限公司...
41,2020-07-10 19:57:00,澳大利亚药品管理局称已批准吉利德公司的瑞德西韦作为新冠肺炎的首选治疗方案。,澳大利亚批准吉利德公司的瑞德西韦作为新冠肺炎的首选治...
42,2020-07-10 19:52:00,7月以来A股市场涨势如虹，引发资金追捧新基金，爆款基金层出不穷。一时间，新基金发行沸腾了，近期市场也传出监管层进行窗口指导的传闻。对此，接近监管层的相关人士告诉记者，监管层未对“单只基金首募规模不得超过300亿”作出窗口指导，也并未...,未作规模限制 监管层紧急澄清300亿规模上限要求
43,2020-07-10 19:49:00,鸿合科技：持股7.1895%的股东Eagle Group Business Limited拟减持不超过1.7974%。,鸿合科技：持股7.1895%的股东Eagle Group Business Limit...
44,2020-07-10 19:48:00,天华超净公告，预计上半年净利润为1.82亿-1.88亿元，同比增长560%-580%。报告期内，公司主营业务防静电超净技术产品和医疗器械产品销售和业绩保持稳定增长。同时，在国内国外新型冠状病毒疫情爆发和蔓延的形势下，公司响应国家和地方政府的号召...,天华超净：预计上半年净利润同比增长560%-580%
45,2020-07-10 19:48:00,7月10日，受安徽、景德镇等上游地区降雨、水库泄洪，以及本地强降雨影响，江西省鄱阳县县域内河流、湖泊水位暴涨，全县14座圩堤出现漫堤决口险情，其中包括2座万亩圩堤，防汛形势异常严峻。（新华网）,江西省鄱阳县14座圩堤出现漫决
46,2020-07-10 19:46:00,赛微电子：北京集成电路基金于6月10日-7月9日累计减持了1242万股，占公司总股本的1.9431%。,赛微电子：北京集成电路基金于6月10日-7月9日已累计减持1...
47,2020-07-10 19:43:00,鹿港文化公告，公司实际控制人钱文龙及主要股东缪进义与浙江省文化产业投资集团有限公司签订《表决权委托协议》，分别将其持有的上市公司1.19亿股股份和4749.94万股份对应的表决权委托给浙江文投行使。浙江文投将拥有1.66亿股股份对应的表决权，...,鹿港文化：实际控制人变更为浙江省财政厅
48,2020-07-10 19:41:00,美股股指期货盘前小幅下跌，欧股大体走高，恐慌指数VIX涨2.5%，疫情担忧再度发酵；蔚来股价大涨超8%，创历史新高，旗下蔚来中国再次获得六家银行超百亿元融资；今年全球企业创纪录地发行逾2万亿美元债券，债券风险加大。,美股盘前必读：疫情担忧再度发酵期指走低 蔚来盘前大涨超8%
49,2020-07-10 19:40:00,7月10日，证监会宣布，拟暂停广发证券保荐机构资格6个月。记者统计发现，目前在证监会主板、中小板排队，在深交所创业板排队，以及在上交所科创板排队的IPO项目总共有30家。其中，主板9家、中小板5家，创业板6家，科创板10家。有投行人士对记者...,广发证券投行业务被叫停，30家企业IPO受波及
50,2020-07-10 19:39:00,姚记科技：预计上半年净利润为7.62亿-8.32亿元，同比增长440%-490%。主要是因为公司的国内及海外游戏板块业务持续快速发展，游戏业务板块整体的活跃用户和流水增幅较大。随着国内疫情防控形势的逐渐好转，扑克牌业务也保持了稳定的发展。,姚记科技：预计上半年净利润为7.62亿-8.32亿元
51,2020-07-10 19:39:00,深交所公布创业板改革并试点注册制的新一批获受理企业。其中，博亚精工、中捷精工、超越环保等9家企业申请IPO。截至7月10日，创业板改革并试点注册制下申请IPO企业合计270家。,创业板试点注册制下再受理9家企业IPO申请
52,2020-07-10 19:37:00,深信服：持股11.4529%的股东Diamond Bright拟减持不超过6%。,深信服：持股11.4529%的股东Diamond Bright拟减持不超过6%
53,2020-07-10 19:33:00,据接近瑞幸咖啡董事会的人士获得的调查报告显示，没有证据证明以郭谨一为首的现任董事会成员及高管包括吴刚、曹文宝、杨飞等知晓或参与造假，没有证据证明CFO Reinout Schakel对虚假交易知情或有任何参与，投资人、董事刘二海、黎辉对造假行为也...,调查报告：没有证据证明瑞幸现任董事会成员及高管知晓或...
54,2020-07-10 19:27:00,近日，证监会发布《公开募集证券投资基金侧袋机制指引（试行）》，修改完善后的《指引》共十七条，一是明确侧袋机制是在符合法定条件下将难以合理估值的风险资产从基金组合资产中分离出来进行处置清算，确保剩余基金资产正常运作的机制。二是规...,证监会发布《公开募集证券投资基金侧袋机制指引（试行）》
55,2020-07-10 19:24:00,近日，证监会发布了《关于修改的决定》，主要修改内容包括：一是进一步强化合规、审慎经营导向。为更加准确反映证券公司的合规风控状况，完善对证券公司及其相关人员被采取行政监管措施、自律管理措施的扣分规则，明确对公司治理与内部控制严重...,证监会发布《关于修改<证券公司分类监管规定>的决定》
56,2020-07-10 19:22:00,中国证监会和中国银保监会联合发布《证券投资基金托管业务管理办法》，《托管办法》修订内容包括按照国家金融业对外开放的统一安排，允许外国银行在华分行申请证券投资基金托管业务资格。,中国证监会和中国银保监会联合发布《证券投资基金托管业...
57,2020-07-10 19:22:00,中国证监会和中国银保监会联合发布《证券投资基金托管业务管理办法》，《托管办法》修订内容包括按照国家金融业对外开放的统一安排，允许外国银行在华分行申请证券投资基金托管业务资格,中国证监会和中国银保监会联合发布《证券投资基金托管业...
58,2020-07-10 19:21:00,天眼查数据显示，7月9日，东莞京东利昇贸易有限公司发生工商变更，刘强东退出经理，张雱退出法定代表人、执行董事，均由宋春正接任。李娅云退出监事，新增李帅为监事。东莞京东利昇贸易有限公司成立于2015年7月，注册资本2亿人民币，公司经营范...,刘强东退出东莞京东利昇贸易有限公司经理
59,2020-07-10 19:20:00,从接近泰禾的人士处获悉，该集团近日拟引入万科为战略投资者，成为其第二大股东。但万科董事会秘书朱旭表示：“不清楚，不了解相关情况。”（一财）,从接近泰禾的人士处获悉 该集团近日拟引入万科为战略投资者
60,2020-07-10 19:07:00,7月10日，2020年全国民航年中工作电视电话会议在京召开，民航局局长冯正霖作年中工作报告。冯正霖指出，要坚持规划引领，高水平编制好民航“十四五”发展规划，将新基建作为“十四五”民航发展的重要抓手，推进四型机场和四强空管建设，大力推进...,2020年全国民航年中工作电视电话会议在京召开
61,2020-07-10 19:05:00,7月10日，诺辉健康宣布完成3000万美元E轮融资，由Rock Springs Capital领投，奥博资本(OrbiMed)、礼来亚洲基金(LAV)、Cormorant Asset Management、华润正大生命科学基金、Octagon Capital和老股东启明创投跟投。（中国新闻网）,诺辉健康获3000万美元E轮融资
62,2020-07-10 19:04:00,欧洲斯托克600指数涨0.5%至日高。,欧洲斯托克600指数涨0.5%至日高
63,2020-07-10 19:01:00,据新华社：韩正召开财税部门座谈会强调，牢固树立底线思维，抓实抓细政策落地，确保完成全年经济社会发展目标任务。,韩正：确保完成全年经济社会发展目标任务
64,2020-07-10 18:53:00,天宜上佳7月10日晚发布业绩预告，预计上半年净利润与上年同期相比，将减少11477万元，同比减少74.86%左右。,天宜上佳：预计上半年净利同比减少74.86%
65,2020-07-10 18:51:00,容百科技7月10日晚发布业绩预告，预计上半年净利润为4000万元到6000万元，同比减少47.75%到65.17%。上半年，国内外市场受新冠疫情的影响，新能源车企普遍出现开工率降低、产销量下降的情况，动力锂电池市场需求因此出现明显下降，公司下游客户订...,容百科技：预计上半年净利同比减少47.75%到65%
66,2020-07-10 18:47:00,万东医疗：第二大股东俞熔拟减持不超过2%。,万东医疗：第二大股东俞熔拟减持不超过2%
67,2020-07-10 18:45:00,宁德时代：本田拟认购公司本次非公开发行股份；兆易创新遭大基金减持236万股；芒果超媒因《乘风破浪的姐姐》等节目持续热播，上半年净利润预增29%至41%，全聚德上半年预亏1.52亿元-1.39亿元。,7月10日晚间公告集锦：兆易创新遭大基金减持236万股
68,2020-07-10 18:44:00,铂力特：预计上半年净利亏损977.47万元，较上年同期相比增加亏损744.18万元。,铂力特：预计上半年净利亏损977.47万元
69,2020-07-10 18:43:00,力帆股份：6月销售通用汽油机36147台，同比增加46.52%。,力帆股份：6月销售通用汽油机36147台 同比增加46.52%
70,2020-07-10 18:43:00,据上海市第二中级人民法院官方微信消息，上海二中院受理被告人王振华、周燕芬猥亵儿童上诉一案。被告人王振华、周燕芬猥亵儿童一案，上海市第二中级人民法院已收到上海市普陀区人民法院移送的被告人王振华、周燕芬的上诉材料，并于2020年7月10日...,上海二中院受理王振华上诉一案
71,2020-07-10 18:41:00,中央农办、农业农村部、发改委等7部门联合印发《关于扩大农业农村有效投资 加快补上“三农”领域突出短板的意见》，要求加快高标准农田、农产品仓储保鲜冷链物流设施、现代农业园区、动植物保护、沿海现代渔港、农村人居环境整治、农村供水保障...,中央农办、农业农村部、发改委等7部门联合印发《关于扩大...
72,2020-07-10 18:39:00,展鹏科技7月10日晚公告，公司拟发行股份及支付现金购买伯坦科技100%股权，具体价格尚未确定。此外，公司拟向海创投资非公开发行股份募集配套资金。此次交易预计构成重大资产重组。交易完成后，公司的主营业务范围将拓展至新能源汽车零部件产品和...,展鹏科技：重组拟收购伯坦科技 介入新能源汽车零部件领域
73,2020-07-10 18:37:00,三人行：上半年净利1.03亿元，同比增长127.76%，上年同期4510万元。,三人行：上半年净利同比增长127.76%
74,2020-07-10 18:37:00,在2020世界人工智能大会腾讯论坛上，腾讯公司副总裁、腾讯研究院院长司晓正式发布了《腾讯人工智能白皮书：泛在智能》。该白皮书指出，自2015年国家产业政策正式提及人工智能以来，政策从初期的聚焦于体系设计、技术研发以及标准制定，发展至将A...,腾讯首次发布人工智能白皮书
75,2020-07-10 18:37:00,据新华社消息，在做好疫情防控的基础上，目前，由成都市委宣传部主办、成都金沙院线承办的“电影人人看”2020年度成都公益电影放映活动已逐步恢复。,成都逐步恢复公益电影放映
76,2020-07-10 18:36:00,中国证券业协会：已在协会完成注册的证券公司、基金管理公司、信托公司、财务公司、保险公司、合格境外机构投资者以及符合《科创板首次公开发行股票网下投资者管理细则》第四条规定的私募基金管理人，可参与创业板首发股票网下询价和申购业务。,中国证券业协会：明确创业板首次公开发行股票网下投资者规则
77,2020-07-10 18:35:00,民和股份：2020年6月销售鸡苗2739万只，同比变动12.46%，环比变动-3%；销售收入7036万元，同比变动-16.84%，环比变动31.86%。主要原因是5月份毛鸡价格下降，鸡苗销售价格较低，6月毛鸡和鸡苗价格回升收入环比增长。,民和股份：6月份销售鸡苗2739.95万只 同比变动12.46%
78,2020-07-10 18:33:00,上交所：本周（2020年7月6日至2020年7月10日），沪市共发生78起证券异常交易行为，其中，科创板2起（连续竞价阶段拉抬股价）。上交所对此及时采取了书面警示等自律监管措施。同时，针对13起上市公司重大事项等进行核查，向证监会上报2起涉嫌违法...,上交所：沪市共发生78起证券异常交易行为
79,2020-07-10 18:32:00,汉商集团7月10日晚公告，公司拟7130万元购买武汉世纪嘉晟生殖医学研究所及自然人苏南、刘华持有的同济生殖医学中心部分出资份额，此次收购占同济生殖医学中心31%出资份额。同济生殖医学中心重点以辅助生殖技术、中西医结合诊疗为专科特色。汉商...,汉商集团：收购同济生殖医学中心31%的出资权
80,2020-07-10 18:29:00,中国证券业协会：已在协会完成注册的证券公司、基金管理公司、信托公司、财务公司、保险公司、合格境外机构投资者以及符合《科创板首次公开发行股票网下投资者管理细则》第四条规定的私募基金管理人，可参与创业板首发股票网下询价和申购业务。,中国证券业协会发布关于明确创业板首次公开发行股票网下...
81,2020-07-10 18:28:00,高鸿股份：公司董事、高管拟合计减持不超过0.0744%。,高鸿股份：公司董事、高管拟合计减持不超过0.0744%
82,2020-07-10 18:27:00,远大控股：预计上半年亏损9000万元–1.08亿元，上年同期盈利4643万元。,远大控股：预计上半年亏损9000万元–1.08亿元
83,2020-07-10 18:27:00,7月10日，阿里巴巴副总裁、斑马网络联席CEO张春晖出席世界人工智能大会自动驾驶主题论坛主题演讲，他直言，中国信息产业一直处于缺“芯”少“魂”的尴尬局面，“芯”就是芯片，“魂”就是操作系统。打造国产自主可控、安全可靠的操作系统，是阿...,阿里集团副总裁：打造国产自主可控、安全可靠的操作系统...
