,datetime,content,title
237,2020-05-08 21:22:00,当地时间8日，根据葡萄牙卫生部的数据，葡萄牙全国累计确诊新冠肺炎病例27268例，累计死亡1114例。24小时内新增确诊553例，新增死亡9例。（央视新闻）,葡萄牙新增553例新冠肺炎确诊病例 累计27268例
238,2020-05-08 21:17:00,近日，山东省人力资源和社会保障厅等13部门联合印发《关于做好2020年高校毕业生就业工作的通知》。通知提出，全省全面放开对高校在校生、毕业生的落户限制，全省16市均可先落户后就业。鼓励各地结合实际出台降低高校毕业生生活成本的措施，吸引...,山东全面放开高校生落户限制 16市均可先落户后就业
239,2020-05-08 21:01:00,国内期市夜盘开盘，菜粕跌逾1%，液化气涨逾1%。,国内期市夜盘开盘 液化气涨逾1%
240,2020-05-08 20:59:00,证监会核准3家企业的首发申请：重庆三峰环境集团股份有限公司，安徽龙磁科技股份有限公司，昆山佰奥智能装备股份有限公司。,证监会核发3家企业IPO批文
241,2020-05-08 20:58:00,据日本时事通讯社8日报道，日本政府8日宣布，将国产研发的新冠肺炎治疗药物法匹拉韦（Avigan）提供给爱沙尼亚。日媒称，这也是日本将这一国产药物无偿供给其他国家的“第一弹”。 （海外网）,日本开始向40国提供法匹拉韦治疗新冠肺炎
242,2020-05-08 20:55:00,从券商了解到，目前深交所已起草《深圳证券交易所创业板企业发行上市申报及推荐暂行规定（征求意见稿）》，正在保荐机构层面进行定向征求意见。《暂行规定》明确，创业板定位为“深入贯彻创新驱动发展战略，适应发展更多依靠创新、创造、创意的...,深交所：保荐人需准确把握创业板定位 推荐符合高新技术产...
243,2020-05-08 20:55:00,5月8日晚间，金山云上市前夕，该公司首席执行官王育林接受媒体采访时表示，2019年其毛利润转正，未来两三年有可能盈利。（新京报）,金山云CEO：未来两三年可能盈利 毛利润去年已转正
244,2020-05-08 20:47:00,*ST皇台5月8日晚间公告，根据《深圳证券交易所股票上市规则》有关规定，公司董事会认为公司已符合提出恢复上市申请的条件，并于4月27日召开第七届董事会第十次会议，审议通过了《关于公司符合恢复上市条件并向深圳证券交易所申请恢复上市的议案...,*ST皇台：向深交所提出恢复上市申请
245,2020-05-08 20:46:00,现货黄金跌破1710美元/盎司。,现货黄金跌破1710美元/盎司
246,2020-05-08 20:44:00,从券商了解到，目前深交所已起草《深圳证券交易所创业板企业发行上市申报及推荐暂行规定（征求意见稿）》，正在保荐机构层面进行定向征求意见。这意味着，创业板上市企业“负面清单”征求意见稿如约而至，据券商介绍，《暂行规定》结合创业板现...,创业板上市企业“负面清单”征求意见：聚焦“三创四新”...
247,2020-05-08 20:43:00,沙特新冠肺炎确诊病例超过3.5万例。（路透社）,沙特新冠肺炎确诊病例超过3.5万例
248,2020-05-08 20:39:00,4月份美国就业市场受冠状病毒导致的封锁措施的影响达到了历史最高水平，美国非农就业人数减少了2050万人，失业率飙升至14.7%。这两个数字都轻松打破了二战后的记录，也反映出在抗击病毒的过程中造成的巨大损失。（CNBC）,美国非农就业人数和失业率都轻松打破了二战后的记录
249,2020-05-08 20:17:00,俄罗斯央行行长纳比乌琳娜：6月降息幅度可能超过50个基点，有可能达到100个基点。,俄罗斯央行：6月降息幅度可能超过50个基点
250,2020-05-08 20:16:00,尔康制药：拟使用自有资金 5800万元收购豫兴康持有的武陟维尔康生化制药有限公司100%股权；计划使用自筹资金18040.25万元人民币在柬埔寨投资建设年产1万吨间苯二胺项目。,尔康制药：拟收购武陟维尔康生化制药有限公司100%股权
251,2020-05-08 20:06:00,荷兰新增319例新冠肺炎病例，累计确诊42093例，死亡病例增长1%至5359例。,荷兰新增319例新冠肺炎病例
252,2020-05-08 20:04:00,*ST信威：上交所决定自5月15日起暂停公司股票上市,*ST信威：上交所决定自5月15日起暂停公司股票上市
253,2020-05-08 20:01:00,哈尔斯：实控人向公司员工发出鼓励增持公司股票倡议，净买入不低于1000股且全额连续持有18个月以上的承诺兜底。,哈尔斯：实控人向公司员工发出鼓励增持公司股票倡议
254,2020-05-08 20:00:00,百润股份：拟定增募资不超10.06亿元，用于烈酒（威士忌）陈酿熟成项目。,百润股份：拟定增募资不超10.06亿元
255,2020-05-08 19:52:00,上交所发布《上市公司股份协议转让业务办理指南》、《股票质押式回购交易违约处置协议转让业务办理指南》。,上交所发布《上市公司股份协议转让业务办理指南》、《股...
256,2020-05-08 19:50:00,证监会5月8日公告，今日上会的4家公司：国联证券股份有限公司、昆山沪光汽车电器股份有限公司、瑞鹄汽车模具股份有限公司、协创数据技术股份有限公司首发均获通过。,证监会：国联证券等4家公司首发过会
257,2020-05-08 19:49:00,证监会：协创数据技术股份有限公司首发获通。,证监会：协创数据技术股份有限公司首发获通过
258,2020-05-08 19:49:00,上期所相关负责人就修订《上海期货交易所镍期货合约》及《上海期货交易所交割细则》答记者问。近年来，随着我国新能源汽车产业的快速发展，以镍豆为代表的其它形状电解镍在国内的使用和流通规模显著增加，对于镍合约交割品多元化的需求日渐增长...,上期所：对参与实物交割的电解镍，取消形状限制
259,2020-05-08 19:45:00,根据全国股转系统公布的数据显示，入选2020年第一批拟进行市场层级定期调整的挂牌公司初筛名单调入创新层的企业有505家，而调出的企业为4家。在这一基础上可以预测到，今年新三板创新层企业的数量较2019年将有大幅提升。（21财经）,新三板分层2020年首批初筛名单出炉：505家企业新入围
260,2020-05-08 19:44:00,诺德股份：拟定增募资不超14.2亿元，用于年产 15000 吨高性能极薄锂离子电池用电解铜箔工程项目和补充流动资金及偿还银行贷款。,诺德股份：拟定增募资不超14.2亿元
261,2020-05-08 19:42:00,世名科技：全资子公司常熟世名化工科技有限公司拟投资建设年产10000吨高频覆铜板专用树脂及特种添加剂技术改造项目。项目投资额：该项目预计总投资约为人民币 6000 万元，项目资金为公司自筹资金。,世名科技：全资子公司投资建设技改项目
262,2020-05-08 19:39:00,建艺集团：拟定增募资不超6.6亿元，用于深圳崇诚凤仪山大厦项目室内装修工程、呼和浩特土默特高等中学建设项目装修工程、汝州青瓷大酒店室内装饰工程 、国投﹒樊魏路酒店室内装修项目设计施工（EPC）总承包工程和补充流动资金。,建艺集团：拟定增募资不超6.6亿元
263,2020-05-08 19:37:00,*ST胜利：拟定增募资不超11.17亿元，用于笔记本电脑金属精密结构件扩产及智能化改造项目 、中大尺寸玻璃及复合材料显示盖板扩产项目、苏州胜利研发中心建设项目和补充流动资金。,*ST胜利：拟定增募资不超11.17亿元
264,2020-05-08 19:34:00,万里石：持股10.03%股东八大处科技集团拟减持不超1%。,万里石：持股5%以上股东拟减持不超1%
265,2020-05-08 19:34:00,Dior迪奥与美图公司已达成合作，将共同开发Dior迪奥AI美妍测肤功能。该合作基于Dior迪奥在神经系统科学、皮肤学与人工智能领域的研究以及美图影像处理技术与基于美图影像实验室打造的AI测肤技术。（36氪）,Dior迪奥与美图公司达成合作，将共同开发Dior迪奥AI美妍...
266,2020-05-08 19:33:00,盘前美股期指、欧股全线大涨，Uber盘前涨6.42%；IMF称全球经济前景较三周前预测有所恶化；北京时间今晚20：30，美国劳工部将公布4月的“非农”数据，预计将为最差月度记录。,美股盘前必读：IMF称全球经济前景较三周前预测有所恶化
267,2020-05-08 19:32:00,科达利(002850)5月8日晚间公告，持股5.14%的股东大业盛德，计划15个交易日后的6个月内，减持其持有的公司股份不超过公司总股本的1.29%。,科达利：大业盛德拟减持公司不超1.29%股权
268,2020-05-08 19:31:00,阿里研究院发布《数字点亮夜经济》，报告显示，2019年，北京、西安等12个大中型城市消费夜化度为43%，其中，夜间餐饮消费占比近4成，夜间文娱消费占比近5成，夜间网购消费占比超4成。夜经济便利度为57%，其中，夜间餐饮商家活跃度为4成，夜间出...,阿里研究院：五一阿里零售平台夜间购物成交金额占比达39.8%
269,2020-05-08 19:31:00,连续三日涨停的新农开发5月8日晚间公告，目前公司主营业务以液态奶、皮棉、棉种为主，主营业务不涉及市场热点关注的粮食等题材。,三连板新农开发：主营业务不涉及市场热点关注的粮食等题材
270,2020-05-08 19:29:00,5月8日晚间，2020年进入第一批创新层企业初筛名单出炉，包括亿童文教、圣商教育、天工股份等505家挂牌公司。同时，金天地等4家企业拟被调出创新层。全国股转公司网站显示，截至5月8日，新三板共有657家创新层企业。按上述调整后，创新层企业共11...,2020年首批创新层初筛名单出炉，505家公司新入围
271,2020-05-08 19:27:00,凤形股份：持股5%以上股东及其一致行动人拟减持不超5.2%。,凤形股份：持股5%以上股东及其一致行动人拟减持不超5.2%
272,2020-05-08 19:22:00,泰禾光电：拟投资“新建智能检测分选装备扩建项目（二期），投资预算 20575 万元。利用“人工智能+”技术，进行智能检测分选装备生产过程和关键工序的数字化、网络化、智能化升级，推进基于人工智能的智能检测分选装备研发、生产，促进产品在上...,泰禾光电：新建智能检测分选装备扩建项目（二期）
273,2020-05-08 19:16:00,WTI原油6月期货一度转涨，7月期货日内涨0.8%。,WTI原油6月期货一度转涨
274,2020-05-08 19:15:00,天茂集团：控股子公司国华人寿保险股份有限公司于 2020 年 1 月 1 日至2020 年 4 月 30 日期间累计原保险保费收入约为人民币 1734134.83 万元。,天茂集团：1-4月控股子公司国华人寿计原保险保费收入约为...
275,2020-05-08 19:12:00,科伦药业：盐酸达泊西汀片获得药品注册批件。,科伦药业：盐酸达泊西汀片获得药品注册批件
276,2020-05-08 19:08:00,长城汽车：1-4月销量同比降37.13%；国投资本：安信证券母公司4月份净利2.85亿元；*ST交昂：获中金集团及一致行动人再次举牌持股达15%。,5月8日晚间公告集锦：长城汽车1-4月销量同比降37.13%
277,2020-05-08 19:04:00,傲农生物：部分董监高拟合计减持不超 1.2275%。,傲农生物：部分董监高拟合计减持不超 1.2275%
278,2020-05-08 19:03:00,5月8日，中共中央在中南海召开党外人士座谈会，就新冠肺炎疫情防控工作听取各民主党派中央、全国工商联和无党派人士代表的意见和建议。中共中央总书记习近平主持座谈会并发表重要讲话。,中共中央召开党外人士座谈会 习近平主持并发表重要讲话
279,2020-05-08 19:02:00,上海数据交易中心5月8日宣布了新一轮融资，今年将在“新基建”相关领域投入超过10亿元人民币，包括收购和数字化平台的搭建。本次融资由中南集团、华扬联众、虎裕基金三家机构参与，是今年国内数据交易领域的首次融资。不过融资金额没有披露，第...,上海数据交易中心获新一轮融资 投入10亿发展新基建
280,2020-05-08 19:01:00,根据联合国人道主义协调办公室（OCHA）日前发布的题为《新冠疫情国际人道主义反应计划》（Global Humanitarian Response Plan: COVID-19）报告，朝鲜在卫生和非卫生领域应对新冠疫情共需3970万美元，加上其他对朝人道援助所需的1.07亿美元，合计...,联合国：帮助朝鲜抗疫需近1.5亿美元
281,2020-05-08 18:57:00,新城控股：4月份公司实现合同销售金额约180.63亿元，销售面积约164.40万平方米。1-4月累计合同销售金额约490.44亿元，比上年同期下降27.99%；累计销售面积约450.22万平方米，比上年同期下降24.06%。,新城控股：1-4月累计合同销售金额约490.44亿元，比上年同...
282,2020-05-08 18:56:00,中国航油集团石油股份有限公司在中国证监会网站刊登招股说明书申报稿，拟发行A股不超过4亿股，以募集资金投入16.3亿元的加油站等项目。中国航油集团持有公司93.62%的股份，另外两家股东为延安能化集团、通航发展公司。本次IPO的保荐人为中信证券...,中国航油集团石油股份有限公司拟在上交所IPO
283,2020-05-08 18:39:00,美三大股指期货均涨逾1%，其中道指期货涨280点。,美三大股指期货均涨逾1%
284,2020-05-08 18:38:00,港交所消息，今年前四个月，香港市场总集资金额稳步上升至1126亿港元，较去年同期上升24%。,港交所：前四个月香港市场总集资金额同比上升24%
285,2020-05-08 18:37:00,会议指出，要积极融入“一带一路”建设，用足用好雄安新区自贸试验区平台，大力促进投资贸易自由化便利化，加大智能城市建设力度，打造扩大开放新高地和对外合作新平台，努力建设高水平社会主义现代化城市。（河北新闻网）,王东峰主持召开河北省委雄安新区规划建设工作领导小组专...
286,2020-05-08 18:32:00,欧盟法院回应德国法院对欧洲央行的裁决：只有欧盟法院有权裁定欧盟机构是否违反欧盟法律。,欧盟法院反驳德国法院对欧央行的裁决
287,2020-05-08 18:32:00,金杯汽车5月8日晚间公告，公司5月8日接到信息披露义务人周晓宇的《简式权益变动报告书》，周晓宇通过其控制的“周晓宇”、“顾微”、“诸家英”等证券账户累计增持公司股份比例已达5%以上。截至2017年11月13日，周晓宇及其控制的证券账户合计持...,金杯汽车：自然人周晓宇及其控制的证券账户合计持股达5.22%
288,2020-05-08 18:30:00,西班牙新增229例新冠肺炎死亡病例，累计死亡26299例。,西班牙新增229例新冠肺炎死亡病例
289,2020-05-08 18:24:00,第127届中国进出口商品交易会（简称广交会）将于6月15-24日在网上举办。为积极应对新冠肺炎疫情影响，助力外贸企业开拓市场、共渡难关，商务部决定，第127届广交会网上举办期间不向企业收取参展费用，也不向参与同步活动的跨境电商平台收取任何...,商务部：第127届广交会免收企业参展费
290,2020-05-08 18:21:00,国务院应对新型冠状病毒感染肺炎疫情联防联控机制关于做好新冠肺炎疫情常态化防控工作的指导意见，意见称，在落实防控措施前提下，全面开放商场、超市、宾馆、餐馆等生活场所；采取预约、限流等方式，开放公园、旅游景点、运动场所，图书馆、博...,农业农村部：优势特色产业集群和农业产业强镇建设要聚焦...
291,2020-05-08 18:15:00,国务院印发应对新型冠状病毒感染肺炎疫情联防联控机制关于做好新冠肺炎疫情常态化防控工作的指导意见。指导意见提出，推进疫苗、药物科技攻关和病毒变异、免疫策略等研究。加快检测试剂和设备研发，提高灵敏度、特异性、简便性，进一步提升检测...,国务院：推进疫苗、药物科技攻关和病毒变异、免疫策略等研究
292,2020-05-08 18:07:00,国办印发通报：2020年支持上海市、浙江省、江西省、广东省、四川省或其辖内地区开展金融改革创新先行先试，在同等条件下对其申报金融改革试验区等给予重点考虑和支持，在相关领域加大再贷款、再贴现的支持力度，鼓励符合条件的全国性股份制银行...,国务院发布关于做好新冠肺炎疫情常态化防控工作的指导意见
293,2020-05-08 18:07:00,俄罗斯莫斯科交易所发布公告称，8日中午其证券交易暂停的原因为服务器程序错误，该所的证券交易已于当地12:50恢复正常。（央视新闻）,俄罗斯莫斯科交易所：其证券交易暂停的原因为服务器程序错误
294,2020-05-08 17:59:00,5月8日，上交所受理辽宁成大生物股份有限公司科创板上市申请，公司拟募资20.4亿元，中信证券为公司保荐机构。成大生物是A股上市公司辽宁成大的子公司，本次“报考”科创板也是辽宁成大落实分拆上市的重要一步。（上海证券报）,成大生物科创板IPO获受理 拟募资20.4亿元
295,2020-05-08 17:56:00,深交所发布通知，决定自2020年5月13日起暂停成都天翔环境股份有限公司股票上市。（第一财经）,深交所：暂停成都天翔环境股份有限公司股票上市
296,2020-05-08 17:50:00,日本财务省8日发布数据称，国债、借款及政府短期证券合计的国家债务截至2019年度末达1114.54万亿日元（约合人民币74万亿元），创新高。（日本共同社）,日本2019年度末国家债务逾1114万亿日元创新高
297,2020-05-08 17:47:00,美国媒体当地时间7日报道称，美国不同机构的多名医务人员对联邦政府分配瑞德西韦的透明度表示质疑。吉利德科技公司首席执行官丹尼尔·奥戴3日说，公司承诺捐赠的超过150万瓶瑞德西韦将于本周初送抵全美最危重的患者手中。这些药足以治疗15万至20...,美国医务人员称联邦政府分配瑞德西韦过程不透明
298,2020-05-08 17:39:00,5月8日收盘，南向资金买卖十大成交榜出炉，腾讯控股、小米集团-W、香港交易所位居港股通（沪）成交前三，腾讯控股、小米集团-W、宇华教育位居港股通（深）成交前三。,5月8日南向资金买卖十大成交榜
299,2020-05-08 17:37:00,凯利泰：近日获得国家药品监督管理局颁发的空心接骨螺钉Ⅲ类《医疗器械注册证》。空心接骨螺钉适用于四肢骨折内固定。,凯利泰：空心接骨螺钉注册证获批
300,2020-05-08 17:37:00,上期所：《上海期货交易所镍期货合约(修订案)》《上海期货交易所交割细则(修订案)》经上海期货交易所理事会审议通过，并已报告中国证监会，现予以发布。上述修订案自2020年10月16日起从NI2011合约开始实施。,上期所：《上海期货交易所镍期货合约(修订案)》《上海期...
301,2020-05-08 17:36:00,唐人神：2020 年 4 月生猪销量 5.20万头，同比下降 37.9%，环比上升 1.2%；销售收入合计 17216 万元，同比上升73.4%，环比下降 3.9%。2020 年 1-4 月累计商品猪销量 16.95 万头，同比下降 52.6%；销售收入 57870万元，同比上升 65.2%。,唐人神：4月份生猪销售收入环比下降3.9%
302,2020-05-08 17:36:00,湘佳股份：2020 年 4 月销售活禽 207.19万只，销售收入4720.05万元，销售均价12.82元/公斤，环比变动分别为-14.32%、-8.92%、20.52%，同比变动分别为-6.52%、11.28%、17.39%；2020 年 4 月销售冰鲜禽肉 3555.71 吨，销售收入 10928.78 万元，销...,"湘佳股份：2020 年 4 月销售活禽 207.19万只 销售收入4,7..."
303,2020-05-08 17:31:00,5月8日上午，来自中东的 “凯名”号油轮安全靠泊中国石化中科炼化港口30万吨级原油码头并顺利接卸，标志着中科炼化港口建成投用。这是目前国内一次建成规模最大、结构形式和使用功能最多的港口，也是国内最大的石化港口，将形成石化工业“前港后...,国内最大石化港口建成投用 年吞吐能力达3400万吨
304,2020-05-08 17:30:00,上海期货交易所子公司上海国际能源交易中心已于2020年5月8日发布《关于同意中化弘润石油储运（潍坊）有限公司增加原油期货启用库容的公告》(上能公告【2020】20号)。同意中化弘润石油储运（潍坊）有限公司位于山东潍坊滨海经济开发区先进制造产...,上海国际能源交易中心同意中化弘润石油储运（潍坊）有限...
305,2020-05-08 17:29:00,精测电子：持股1.21%西藏比邻医疗科技产业中心拟清仓减持。,精测电子：持股1.21%西藏比邻医疗科技产业中心拟清仓减持
306,2020-05-08 17:28:00,伊朗报告新增新冠肺炎确诊病例1556例，此前新增1485例。累计新冠肺炎确诊病例104691例，累计死亡病例为6451例。,伊朗报告新增新冠肺炎确诊病例1556例
307,2020-05-08 17:25:00,北京市教委：北京小学、幼儿园暂不开学，将按非毕业年级、小学低年级、高年级分批开学。（北京时间）,北京小学、幼儿园暂不开学
308,2020-05-08 17:20:00,世卫组织食品安全与人畜共患病专家彼得·恩巴雷克表示，新冠肺炎病毒及所属的冠状病毒族群来源于自然界的蝙蝠，偶尔通过其他不同种类动物传播到人类，适应人体后导致疾病发生，此类传播都是源自与动物的密切接触。（央视新闻）,世卫组织：新冠肺炎病毒来自自然界 多项针对传播动物的研...
309,2020-05-08 17:15:00,海容冷链：持股5.0027%的股东博信优选计划清仓减持。,海容冷链：股东拟减持不超5%股份
310,2020-05-08 17:12:00,双环传动：实际控制人之一的陈菊花女士及其一致行动人叶善群拟减持不超3%。,双环传动：股东拟减持不超3%
311,2020-05-08 17:12:00,俄罗斯证券交易所暂停股市交易。正在调查暂停交易的原因。（俄新社）,俄罗斯证券交易所暂停股市交易
312,2020-05-08 17:11:00,东方时尚：东方时尚通航为南方航空的境内飞行学员初始训练课程培训服务的成交单位。预计成交金额：6263.2 万元。,东方时尚：控股子公司成交南方航空的境内飞行学员初始训...
313,2020-05-08 17:11:00,5月8日，媒体报道称，詹克团在海淀区政务服务中心领取法人为詹克团的北京比特大陆公司营业执照时，营业执照被一群不明身份的人员从工商行政人员手中抢走。有现场人士表示，该群不明身份的人员由刘路遥指挥。刘路遥为比特大的前法人，且为吴忌寒...,比特大陆：刘路遥被警方逮捕一事纯属谣言
314,2020-05-08 17:08:00,中国银保监会就《信托公司资金信托管理暂行办法（征求意见稿）》公开征求意见的通知。（司法部）,中国银保监会就《信托公司资金信托管理暂行办法（征求意...
315,2020-05-08 17:08:00,四方股份：拟转让所持有的北京 ABB 四方电力系统有限公司40%股权，ABB四方 40%股权的拟转让价格为 1.05 亿元人民币。,四方股份：拟转让所持有ABB四方40%股权
316,2020-05-08 17:07:00,比利时报告新增新冠肺炎确诊病例591例，累计确诊病例52011例。新增新冠肺炎死亡病例107例，累计死亡病例8521例。,比利时报告新增新冠肺炎确诊病例591例
317,2020-05-08 17:06:00,深圳市规划和自然资源局召开新闻通气会，正式印发了《深圳市落实住房制度改革加快住房用地供应的暂行规定》。,深圳印发文件 全力保障住房用地
318,2020-05-08 17:04:00,蒙娜丽莎：）拟以自筹资金在广东省佛山市南海区西樵镇太平工业区投资建设特种高性能陶瓷板材绿色化、智能化技术改造项目。本项目总投资为 6 亿元。,蒙娜丽莎：投资建设特种高性能陶瓷板材绿色化、智能化技...
319,2020-05-08 16:58:00,下周（5月11日至5月15日），A股市场限售股解禁规模约682.46亿元，较本周环比提升186.86%。5月11日、15日为下周解禁高峰，合计解禁规模为682.46亿元，占全周比例的91.76%。具体到个股，三六零、苏垦农发和中简科技解禁规模居前，分别为110.97亿元...,682.46亿元限售股下周解禁 环比提升近2倍
320,2020-05-08 16:57:00,保利地产公告，2020年4月，公司实现签约面积244.01万平方米，同比下降4.37%；实现签约金额375.89亿元，同比增加0.44%。2020年1-4月，公司实现签约面积734.25万平方米，同比下降23.13%；实现签约金额1086.09亿元，同比下降26.16%。,保利地产：4月份实现签约面积同比下降4.37%
321,2020-05-08 16:57:00,*ST交昂5月8日晚间公告，中金集团及其一致行动人计划自2月4日起6个月内增持1%-4%的公司股份。自增持计划实施以来，中金集团及其一致行动人通过集中竞价交易方式合计增持21.06万股，占公司总股本的0.03%，该增持计划尚未实施完毕。截至5月8日，中...,*ST交昂：获中金集团及一致行动人再次举牌 持股达15%
322,2020-05-08 16:54:00,三德科技：持股5.95%股东、公司监事会主席朱宇宙拟减持不超0.94%。,三德科技：持股5%以上监事拟减持不超0.94%
