,datetime,content,title
711,2020-07-09 13:41:00,同花顺午后涨逾4%，总市值突破1000亿大关。,同花顺总市值突破1000亿大关
712,2020-07-09 13:39:00,印度官员表示，印度的阿育吠陀医生和美国研究人员正计划针对新冠病毒进行阿育吠陀制剂的联合临床试验。（印度经济时报）,印度和美国将针对新冠展开阿育吠陀制剂联合临床试验
713,2020-07-09 13:37:00,农业种植板块异动拉升，金健米业涨超6%，大北农、众兴菌业、丰乐种业等跟涨。,农业种植板块异动拉升
714,2020-07-09 13:35:00,聚光科技在互动平台表示，公司基于ICP-MS（电感耦合等离子体质谱仪）的在线监测设备可应用于半导体上游高纯材料、试剂、电子特气等行业,聚光科技：公司在线监测设备可应用于半导体上游行业
715,2020-07-09 13:31:00,证券板块午后走强，光大证券涨停，中银证券、东方财富等跟随上涨。,证券板块午后走强
716,2020-07-09 13:26:00,科创板国盾量子上市首日涨幅扩大至1000%，刷新科创板首日涨幅纪录。,科创板国盾量子上市首日涨幅扩大至1000%
717,2020-07-09 13:25:00,世界人工智能大会开幕式上，马斯克表示，我们开发了特斯拉的专用芯片，该芯片搭载双系统完全自动驾驶电脑，该芯片具有八位元和加速器用于点击计算，人工智能包含很多点击运算，如果你知道什么是点击运算的话，就知道点击运算量巨大意味着我们的...,马斯克：充分利用特斯拉完全自动驾驶系统可能还需要至少...
718,2020-07-09 13:24:00,7月9日消息，7月1日，河北省全面开展大额现金管理试点工作，存取10万元以上要登记。随后，网上便有消息称“转账超10万将被严查”。对此，央行近日通过中国互联网联合辟谣平台回应称，网传信息中“转账超10万将被严查”系无中生有，明显与大额现...,央行辟谣：“转账超10万将被严查”系误读
719,2020-07-09 13:20:00,2020世界人工智能大会云端峰会（WAIC）9日开幕，腾讯首席运营官任宇昕在开幕式演讲中表示，AI技术正在深深“嵌入”各行各业，变得无所不在。日益完善的新基建和产业互联网将为各行各业带来新增量，为经济发展带来新增长。（上海证券报）,腾讯任宇昕：游戏和电竞为AI提供了最理想试验场 腾讯电竞...
720,2020-07-09 13:18:00,阿里巴巴港股盘中涨幅扩大至10%，股价续刷历史新高，此前恒生公司表示阿里8月可纳入恒指成份股选股范围。,阿里巴巴港股盘中涨幅扩大至10%
721,2020-07-09 13:18:00,2020世界人工智能大会云端峰会（WAIC）9日开幕，百度公司创始人、董事长兼首席执行官李彦宏在开幕式演讲时指出，今天中国正在积极推动新基建计划，也可以看成人类进入智能经济和智能社会之前最大的基础设施工程。它有很大的希望会在中国率先掀起...,百度李彦宏：有很大希望在中国率先掀起全面人工智能化潮流
722,2020-07-09 13:17:00,银行板块午后异动拉升，青农商行水下直线拉升逾8%，江阴银行、成都银行等跟随上涨。,银行板块午后异动拉升
723,2020-07-09 13:14:00,午后A股延续涨势，创业板指涨幅扩大至4%，两市涨停个股超150只。,创业板指涨幅扩大至4%
724,2020-07-09 13:13:00,马斯克表示，人工智能是特斯拉当前和未来技术发展的重要方向。特斯拉的硬件已能够完成自动驾驶了，问题是软件如何提升，要充分发挥自动驾驶的技术优势还要至少一年时间。（第一财经）,马斯克：自动驾驶硬件已准备就绪，软件仍需适应
725,2020-07-09 13:12:00,氢燃料电池板块午后走强，厚普股份直线拉升涨停，雪人股份、美锦能源、华昌化工等纷纷走高,氢燃料电池板块午后走强
726,2020-07-09 13:10:00,港股网易午后涨幅继续扩大至13%，现报158.4港元，市值逼近5500亿港元。,港股网易午后涨幅扩大至13% 市值逼近5500亿港元
727,2020-07-09 13:09:00,宁波东力午后直线涨停，封单近200万手。公司预计上半年净利为11.22亿元，同比增长1500%。,宁波东力午后直线涨停，封单近200万手
728,2020-07-09 13:05:00,7月9日，2020人工智能大会云端峰会在上海举行。国际电信联盟秘书长赵厚麟以视频形势发言。他表示，非常希望能够加强与上海的同行和中国同行的合作和联系，期待中国的同行和上海的专家能够积极参加国际电信联盟的相关活动，这包括智慧城市、智慧...,国际电信联盟秘书长赵厚麟：在智慧金融等领域加强与中国合作
729,2020-07-09 13:05:00,加拿大联邦政府7月8日公布新法规，禁止在18岁及以下青少年可出入的公共场所或可接触到的网络空间投放任何电子烟产品广告。按照加联邦卫生部公布的《电子烟产品促销条例》，无论是实体店，还是网络或其他媒介渠道，都不得以青少年可以看见或听见...,加拿大出台新法规严格限制电子烟产品广告
730,2020-07-09 13:04:00,马云表示，数字技术的大趋势没有发生变化，但未来可能需要三五十年来完成的数字化，可能会提速到十年、二十年内就完成。技术变革提前并且加速，这是我们需要做好准备的。（第一财经）,马云：数字化可能会提速到十年、二十年内完成
731,2020-07-09 13:04:00,科创板国盾量子上市首日涨幅扩大至906%，触发临时停牌。,科创板国盾量子上市首日涨幅扩大至906%
732,2020-07-09 13:03:00,德国新冠肺炎确诊病例从198343例增加至198699例，死亡病例从9032例上升至9046例。,德国新冠肺炎确诊病例从198343例增加至198699例
733,2020-07-09 13:01:00,日本央行在季度报告中下调了对所有9个地区的评估，认为日本所有地区经济都处于恶化或严重状态。,日本央行在季度报告中下调了对所有9个地区的评估
734,2020-07-09 13:00:00,恒指公司董事兼研究及分析主管黄伟雄称，正筹备推出香港版的FANG+或类似纳斯达的科技股主题指数，期望成为继恒指及国指后，另一受市场欢迎的旗舰指数。黄伟雄指出，由于投资者对科技股抱有高期望，市场对相关指数具有需求，故正研究推出香港版的...,恒指公司：正筹备推港版科技股主题指数
735,2020-07-09 12:52:00,恒生指数有限公司董事兼研究及分析主管黄伟雄于网上研讨会表示，恒指公司留意到近年市场对科技创新股票的关注，以及对相关股票有较高期望，因此将会推出相关指数。他续指，将以客观准则选股，现时正积极研究中，期望可尽快推出。8月恒指成份股检...,恒指公司：阿里、美团及小米8月可纳入成份股选股范围
736,2020-07-09 12:45:00,TikTok母公司字节跳动签署了印度新办公室的协议。（印度经济时报）,TikTok母公司字节跳动签署了印度新办公室的协议
737,2020-07-09 12:45:00,特斯拉CEO马斯克7月9日在世界人工智能大会云端峰会上表示，上海超级工厂建设进展顺利，他希望尽快能来到上海超级工厂。他同时透露，上海超级工厂将应用AI技术和软件等，不过在工厂真正有效地使用人工智能还需要花费些时间，人们可以将工厂看作一...,马斯克：上海超级工厂进展顺利，将采用AI技术
738,2020-07-09 12:44:00,据日本共同社9日报道，东京奥组委已经通过官方网站售出约448万张奥运会门票和约97万张残奥会门票。虽然奥运会延期至明年夏天，但已经售出的门票依然有效，只是考虑到部分观众可能无法在明年按期观战，奥组委确定了允许退票的新政策。（海外网）,东京奥组委拟开放退票：最早从本月中旬开始
739,2020-07-09 12:41:00,传统芯片的缺陷在于低集成、高功耗。“如果自动驾驶用传统芯片，需要耗费数百瓦的功率，整个汽车后备箱会被计算机冷却系统占据。”马斯克说道。因此，特斯拉开发了专用的自动驾驶芯片，具有8位元和加速器，用于点积运算。（澎湃）,马斯克：要是自动驾驶用传统芯片，那后备箱都是计算机
740,2020-07-09 12:39:00,跨境通在互动平台表示，公司暂未打算申请免税牌照。目前公司的出口业务在深圳退税局，作为外贸企业类（非综服类）的出口退税量排名第一，属于办税绿色通道企业，年度具体退税金额视业务情况而定。,跨境通：暂未打算申请免税牌照
741,2020-07-09 12:21:00,世界人工智能大会开幕式上，马斯克表示，对未来实现L5级别自动驾驶或是完全自动驾驶非常有信心。马斯克称，“在特斯拉，我觉得我们已经非常接近L5级别自动驾驶了，有信心我们将在今年完成开发L5级别的基本功能。”,特斯拉CEO埃隆·马斯克：特斯拉“非常接近”L5级别的自动...
742,2020-07-09 12:21:00,中国期货业协会最新统计资料表明，今年上半年全国期货市场累计成交量为2521727273（超过25亿）手，累计成交额为1654660.52亿元（超过165万亿元），同比分别增长45.35%和28.70%。今年二季度以来，随着国内疫情被有效管控，各行各业加速复工复产，...,今年上半年全国期货市场成交量和成交额累计同比分别增长4...
743,2020-07-09 12:19:00,科技潜力龙头股名单来了！详情>>>,【机会】鸿蒙2.0有新消息 概念股爆发！
744,2020-07-09 12:12:00,印度新增新冠肺炎确诊病例24879例，累计超76万例。,印度新增新冠肺炎确诊病例24879例
745,2020-07-09 12:00:00,恒指收涨0.47% ，大型互联网企业纷纷上涨，网易、阿里涨超8%，京东涨7%，小米涨近4%；黄金、军工板块涨幅居前。,港股午评：恒指收涨0.47% 网易、阿里涨超8%
746,2020-07-09 11:59:00,宁波东力上半年净利预增15倍；神火股份筹划重大事项；绿茵生态签署1.2亿元施工合同；奥佳华控股股东邹剑寒协议转让5.01%股权给中泰资管。,7月9日午间公告一览：宁波东力上半年净利预增15倍
747,2020-07-09 11:54:00,网易港股涨幅扩大至10%，盘中股价续刷历史新高。,网易港股涨幅扩大至10%
748,2020-07-09 11:53:00,光弘科技在互动平台表示，公司独家为MatePadPro5G提供了电子制造服务报道属实，公司是华为技术和华为终端的核心供应商，将坚持以品质和技术双驱动，不断增强核心竞争力，与客户共同成长，走在行业发展前列。,光弘科技：公司独家为MatePadPro5G提供电子制造服务报道属实
749,2020-07-09 11:50:00,2020世界人工智能大会云端峰会开幕式正在举行。马化腾因身体原因不能来到现场，但通过云端，马化腾表示，腾讯华东总部将进一步扎根上海，成为上海人工智能高地的建设者之一。腾讯将加快新基建投入，与上海一起在危机中遇新机，于变局中开新局，...,马化腾：腾讯华东总部将进一步扎根上海，加快新基建投入
750,2020-07-09 11:46:00,7月8日，记者从河南省商务厅了解到，益海嘉里集团董事长郭孔丰日前率团赴周口市考察洽谈，并与该市签订益海嘉里周口项目投资框架协议。按照协议，益海嘉里金龙鱼粮油食品股份有限公司将在周口市投资50亿元建设综合型粮油项目。（上海证券报）,益海嘉里50亿元项目将落户河南周口
751,2020-07-09 11:43:00,据IFR：华夏视听香港IPO定价位于指导价区间高端。,华夏视听香港IPO定价位于指导价区间高端
752,2020-07-09 11:39:00,近日，国家发展改革委下达产业转型升级示范区和重点园区建设专项2020年第三批中央预算内投资，支持北京市石景山区、黑龙江省齐齐哈尔市、江苏省常州市、江西省萍乡市、山东省淄博市、河南省平顶山市、湖北省襄阳市、湖南省株洲市、广东省韶关市...,国家发展改革委安排专项资金支持受国务院激励城市
753,2020-07-09 11:39:00,港交所权益资料显示，中国平安被摩根大通于7月3日以每股平均价81.5769港元减持约1744.25万股，涉资约14.23亿港元。减持后，摩根大通的最新持股数目为1187996419股，持股比例由16.18%降至15.95%。,中国平安被摩根大通减持约1744.25万股
754,2020-07-09 11:36:00,申请鸿蒙商标后，华为再有新动作。企查查显示，华为技术有限公司近日新增“方舟操作系统”商标申请信息（38类通讯服务），目前该商标9类科学仪器已于2020年5月26日成功注册。有媒体报道成，华为的新系统国内版叫“鸿蒙”，海外版叫“方舟”。（...,华为方舟系统商标进入审核阶段
755,2020-07-09 11:34:00,7月9日，2020世界人工智能大会云端峰会正式开幕。联合国工业发展组织总干事李勇在为大会开幕式致辞时表示，第四次工业革命推动了人工智能的快速发展，自疫情发生以来，人工智能、大数据等技术的使用频率显著上升，数据建模与追踪得到了广泛应用...,联合国工业发展组织总干事李勇：工业人工智能技术方案将...
756,2020-07-09 11:31:00,天眼查数据显示，近日，北京小鱼在家科技有限公司发生工商变更，高欣欣、马瑛在内的5位投资人全部退出，新增北京百度网讯科技有限公司为投资人。小鱼在家是一家致力于打造智能家庭硬件终端和服务的科技创新型企业。产品涵盖智能家庭硬件终端、智...,北京百度网讯科技全资入股智能家庭硬件终端服务公司小鱼在家
757,2020-07-09 11:31:00,7月9日早间，正荣服务宣布，该公司股份发售价为每股4.55港元，预期将于7月10日上午九时起在香港联交所主板上市，股份代号为6958。（新京报）,正荣服务预计明日在港上市 全球净募资10.72亿港元
758,2020-07-09 11:30:00,【午盘气象】三大股指早盘震荡上行，创业板放量大涨逾3%，突破2700点，市场成交额再度突破万亿元，两市个股多数上涨，市场承接力度较强，光刻胶、免税板块表现强势，券商股盘中跳水回升，银行板块领跌。,午评：创业板大涨逾3%站上2700点 两市成交额再破万亿
759,2020-07-09 11:29:00,沪指涨幅扩大至1%，免税店板块表现活跃。北向资金净流入超80亿元。,沪指涨幅扩大至1%
760,2020-07-09 11:27:00,据日本共同社报道，东京商工调查公司8日发布的数据显示，2020年上半年，日本全国企业破产数(负债总额为1000万日元以上，约合人民币65万元以上)为4001家，与去年同期相比增加0.3%。虽然是微增，但此次为雷曼危机后11年来首次增加。（证券时报）,外媒：日本上半年4000家企业破产，情况或持续
761,2020-07-09 11:26:00,7月7日，新疆联通与自治区水利厅、水利部黄河水利委员会信息中心签约，加快推进新疆智慧水利发展。三方将贯彻落实“节水优先、空间均衡、系统治理、两手发力”治水思路，践行“安全、 实用”水利网信发展总要求，在5G+智慧水利、水利信息系统研...,新疆联通与自治区水利厅、水利部黄委信息中心签约
762,2020-07-09 11:25:00,深证成指涨幅扩大至2%，沪指涨0.84%。,深证成指涨幅扩大至2%
763,2020-07-09 11:23:00,两市成交额连续第六个交易日突破1万亿元，相比昨日此时放量1000亿元。,两市成交额突破1万亿元
764,2020-07-09 11:22:00,北上资金持续流入，截止发稿，累计净流入70.03亿。,北上资金持续流入 累计净流入超70亿
765,2020-07-09 11:20:00,中国10年期国债期货下跌0.43%至98.105。,中国10年期国债期货下跌0.43%至98.105
766,2020-07-09 11:19:00,7月7日，贵州茅台盘中一度触及涨停，全天大涨5.5%，其背后便不乏上述外资身影。“7月7日贵州茅台上涨背后正好是托管在美林远东、摩根斯坦利以及瑞银证券等机构的增量资金在大额净买入，而除去这托管于三家机构以外的北上资金则在净卖出。”数据...,贵州茅台“涨停”推手曝光！美林、瑞银、摩根合买11亿
767,2020-07-09 11:18:00,港股联想控股涨超13%，股价报11.92港元，换手率0.722%。,港股联想控股涨超13%
768,2020-07-09 11:17:00,在7月9日上午举行的2020世界人工智能大会云端峰会的开幕式上，2020卓越人工智能引领者评选结果揭晓。联影、百度、IBM等获2020卓越人工智能引领者奖。（第一财经）,联影、百度、IBM等获2020卓越人工智能引领者奖
769,2020-07-09 11:13:00,中国5年期国债期货下跌0.3%至99.985。,中国5年期国债期货下跌0.3%至99.985
770,2020-07-09 11:12:00,创业板指涨幅扩大至3%，光刻胶、免税板块涨幅居前。,创业板指涨幅扩大至3%，光刻胶、免税板块涨幅居前。
771,2020-07-09 11:12:00,瑞银将阅文集团评级由“中性”升至“买入”，目标价由51港元升至69港元。,瑞银将阅文集团评级升至买入 目标价升至69港元
772,2020-07-09 11:07:00,"7月7日,由国家电投出资建设、国核示范布展运营的国家电投新能源科技馆正式建成投用，总建筑面积10886平方米、总布展面积8244平方米、是目前国内规模最大、新能源展项最全面的科技展馆。",国家电投新能源科技馆正式投用 
773,2020-07-09 11:07:00,海关总署官网7月9日公告，根据《国务院关于在中国（海南）自由贸易试验区暂时调整实施有关行政法规规定的通知》（国函〔2020〕88号），对中国（海南）自由贸易试验区内自驾游进境游艇，游艇所有人或其委托的代理人免于为游艇向海关提供担保。,海关总署调整海南进出境游艇有关管理事项
774,2020-07-09 11:07:00,特斯拉将在2020年7月22日周三盘后公布其2020年第二季度的财务业绩。,特斯拉将在周三盘后公布其2020年第二季度的财务业绩
775,2020-07-09 11:06:00,港股京东涨近5%，股价续刷历史新高，市值突破8000亿港元。,港股京东涨近5%
776,2020-07-09 11:04:00,7月9日，IMT-2020推进组发布消息称，近期IMT-2020推进组组织了5G设备安全测试，由中国信息通信研究院牵头，与中国移动、中国电信、中国联通共同组成测试组，对华为、中兴、爱立信、大唐、上海诺基亚贝尔的5G基站和核心网设备进行安全保障测试。...,华为率先完成中国5G推进组5G网络安全测试
777,2020-07-09 11:04:00,国产软件板块持续走强，诚迈科技、常山北明相继封板，中国软件此前涨停，东方通、北信源、正元智慧等跟涨。,国产软件板块持续走强
778,2020-07-09 10:59:00,7月9日，2020世界人工智能大会云端峰会正式开幕。工信部部长苗圩在致辞环节中表示，近年来我国人工智能产业实现了良性发展，一是技术创新日益活跃，语音识别等部分应用技术处于全球领先的水平；二是产业规模持续壮大。2019年底，我国人工智能核...,工信部部长苗圩：我国AI核心产业规模超过510亿
779,2020-07-09 10:56:00,国家知识产权局介绍，2020年上半年，知识产权局共收到集成电路布图设计登记申请5176件，同比增长78.2%；发证5262件，同比增长111.6%。,国家知识产权局：上半年集成电路布图设计登记申请增长近八成
780,2020-07-09 10:55:00,华为鸿蒙系统（HarmonyOS）将于今年9月11日举行的华为开发者大会上发布2.0版本。2019年8月，华为推出鸿蒙1.0，之后搭载在智慧屏产品上测试，而今年的2.0版本，将打通PC、手表和车机等产品终端。,华为鸿蒙系统迭代到2.0 将于9月发布
781,2020-07-09 10:35:00,恒指转跌，此前一度涨近1%。,恒指转跌
782,2020-07-09 10:33:00,随着电动汽车制造商特斯拉的股价大涨，该公司首席执行官（CEO）埃隆·马斯克（ElonMusk）有望获得第二笔股权奖励，价值18亿美元。在高于预期的汽车交付量的推动下，特斯拉股价在过去七个交易日飙升了40%以上，使该公司市值达到2590亿美元。更重...,特斯拉股价大涨 马斯克有望获得第二笔价值18亿美元股权奖励
783,2020-07-09 10:32:00,万讯自控在互动平台表示，公司拿下赤峰金剑铜业有限责任公司铜冶炼工艺升级搬迁项目情况属实。,万讯自控：公司拿下赤峰金剑铜业有限责任公司铜冶炼工艺...
784,2020-07-09 10:30:00,北方股份7月9日在互动平台表示，公司5G无人驾驶矿车在矿山实验中。,北方股份：公司5G无人驾驶矿车在矿山实验中
785,2020-07-09 10:29:00,银行板块盘中走弱，渝农商行、浙商银行、光大银行跌超3%，青农商行、紫金银行、苏州银行等纷纷走低,银行板块盘中走弱
786,2020-07-09 10:28:00,7月9日，在线美术教育品牌美术宝教育集团宣布完成4000万美元C+轮融资，本轮继续由腾讯领投，顺为资本、蓝驰创投、华联长山兴、创致资本、博佳资本跟投。（证券时报）,美术宝教育获4000万美元C+轮融资 腾讯领投
787,2020-07-09 10:23:00,据全国“扫黄打非”办公室微信公众号消息，7月9日，全国“扫黄打非”办公室公布了“净网2020”专项行动上半年工作数据：全国共查处网络“扫黄打非”案件1800余起，取缔非法不良网站1.2万余个，处置淫秽色情等有害信息840余万条。依法处罚了一批...,全国“扫黄打非”办：严格整顿网络色情低俗问题，优酷、...
788,2020-07-09 10:23:00,指数小幅跳水，沪指翻绿。,沪指翻绿
789,2020-07-09 10:15:00,凯撒文化在互动平台表示，公司自研的日本IP《火影忍者》手游中国区域已获得字节跳动独家代理。此外，公司在 6月 12日与字节跳动旗下核心游戏平台北京朝夕光年信息技术有限公司签署了《战略合作协议》，双方发挥各自优势，整合资源，在游戏发行、...,凯撒文化：公司自研的日本IP《火影忍者》手游中国区域已...
790,2020-07-09 10:13:00,龙洲股份在互动平台表示，公司下属控股孙公司东莞中汽宏远是东莞市目前唯一一家具有新能源客车生产资质的汽车整车制造企业，公司下属全资子公司新宇汽车于2018年通过增持东莞中汽宏远股份成为东莞中汽宏远的控股股东。,龙洲股份：孙公司东莞中汽宏远是东莞市目前唯一一家具有...
791,2020-07-09 10:12:00,万讯自控在互动平台表示，公司的工业机器人3D视觉系统可应用于汽车行业等智能制造物料抓取环节，与宝马、奔驰、大众、沃尔沃、东风、本田等企业取得了合作。,万讯自控：公司与宝马、奔驰等车企均有合作
792,2020-07-09 10:10:00,消费金融板块开盘持续走高，苏宁易购涨停，重庆百货、合肥百货、美克家居纷纷走强,消费金融板块开盘持续走高
793,2020-07-09 10:08:00,黄金概念板块异动拉升，园城黄金涨停，赤峰黄金涨超8%，中润资源、恒邦股份、紫金矿业、山东黄金等跟涨。,黄金概念板块异动拉升
794,2020-07-09 10:07:00,PR曹妃甸盘中临时停牌，停牌前大涨21.26%。,PR曹妃甸盘中临时停牌
795,2020-07-09 10:07:00,生物医药板块走强，康辰药业拉升封板，兴齐眼药、华北制药、康弘药业等跟涨。,生物医药板块走强
796,2020-07-09 10:06:00,在岸人民币兑美元收复7.0关口，为3月中旬以来首次。,在岸人民币兑美元收复7.0关口
797,2020-07-09 10:05:00,永泰生物公布招股结果，公开发售部分超购258.59倍，1手中签率20%，认购100手稳夺1手；股份发售价为11元，为招股价范围之上限价，保荐人为建银国际及国信证券。(香港经济日报),永泰生物超购逾258倍 一手中签率两成
798,2020-07-09 10:03:00,沪深两市成交额突破5000亿元。,沪深两市成交额突破5000亿元
799,2020-07-09 10:03:00,财政部决定发行2020年抗疫特别国债（四期），总额700亿元，2020年7月15日招标，7月20日起上市交易。,财政部决定发行2020年抗疫特别国债（四期） 总额700亿元
800,2020-07-09 10:01:00,斯里兰卡将定期存款利率从5.5％下调至4.5％。,斯里兰卡将定期存款利率从5.5％下调至4.5％
801,2020-07-09 10:00:00,开盘半小时，沪深两市成交额达4700亿元，较上一交易日同一时间放大400亿元。,沪深两市成交额达4700亿元
802,2020-07-09 09:59:00,中国蜀塔将于明日（10日）上市，每股定价0.3元，为招股价范围（0.25元至0.4元）中间偏下水平定价，公开认购共接获约7205份申请，超购28.09倍，一手中签率为60%，认购7手稳获1手；认购2000万股的“头锤飞”有两张，中签率2%。经过重新分配，公开...,中国蜀塔超购28倍 购7手稳获1手
803,2020-07-09 09:59:00,港股黄金股造好，紫金矿业涨近8%，灵宝黄金涨超7%，招金矿业涨超5%。,港股黄金股造好
804,2020-07-09 09:56:00,港股航天军工板块高走，中船防务涨超25%，中航科工涨超5%，航天控股涨超3%，中国航空工业国际涨0.68%。,港股航天军工板块高走
805,2020-07-09 09:54:00,创业板指涨超2%，站上2700点。,创业板指涨超2%
806,2020-07-09 09:52:00,半导体板块走强，紫光国微反包涨停，蓝英装备、斯达半导、晶方科技等大幅跟涨。,半导体板块走强
