,datetime,content,title
481,2020-05-08 10:06:00,据工业和信息化部5月8日消息，为促进有色金属消费转型升级，培育新的发展动能，推动行业高质量发展，5月7日，工信部原材料工业司联合有色金属工业协会组织召开扩大铜消费应用视频研讨会。参会企业介绍了铜在家电、建筑上水管道、海洋养殖等传统...,工信部原材料工业司：扩大铜消费应用 促进有色行业消费升级
482,2020-05-08 10:05:00,前暴风TV CEO刘耀平加盟小米，出任小米电视中国区域总经理。对此，5月8日澎湃新闻记者从知情人士处了解到，名为刘耀平的员工首在今天首次出现在员工通讯录，部门是电视部管理中心。（澎湃新闻）,前暴风TV CEO刘耀平被曝加盟小米：入职电视部管理中心
483,2020-05-08 10:03:00,据IPO早知道消息，目前仍在辅导期的想念食品股份有限公司，近期新增三家机构投资者。分别为：前海股权投资基金、中原前海股权投资基金、焦作方舟创新产业投资基金，三者目前所占股权分别为5.44%、4.66%和1.55%，合计11.65%。,想念食品IPO辅导期间引入三家投资者
484,2020-05-08 09:56:00,科创板个股走强，宝兰德拉升触板，有方科技、安恒信息、卓易信息等涨逾10%。,科创板个股走强
485,2020-05-08 09:54:00,据韩国中央防疫对策本部8日通报，截至当天0时，韩国较前一天0时新增12例感染新型冠状病毒的确诊病例，累计确诊10822例。这是单日新增病例时隔5天再超10例。（韩联社）,韩国新增12例新冠肺炎确诊病例
486,2020-05-08 09:52:00,创业板指涨1%。,创业板指涨1%
487,2020-05-08 09:52:00,据德国疾控机构罗伯特·科赫研究所7日公布的数据，德国过去24小时新增新冠确诊病例1284例，累计确诊166091例。,德国新增新冠确诊病例1284例
488,2020-05-08 09:50:00,深成指涨幅扩大至1%，创业板指涨0.87%，沪指涨0.56%。,深成指涨幅扩大至1%
489,2020-05-08 09:50:00,今年1月，第二批国家组织药品集中采购产生中选结果，32个品种采购成功，药价大幅降低。4月起，中选结果在全国各地落地，这些药品正在进入医院，慢性病患者可陆续买到降价药。包含糖尿病用药阿卡波糖、格列美脲，牙疼会用到的甲硝唑片，高血压用...,一批慢性病患者常用药大幅降价，4月起可陆续买到
490,2020-05-08 09:49:00,半导体及元件板块走高，派瑞股份开盘封板，国民技术、铜峰电子先后涨停，博通集成涨6%。,半导体板块走高
491,2020-05-08 09:48:00,早上8点，上海迪士尼乐园重新开放售票，因新冠疫情关闭了107天之后，乐园将在5月11日重新开放。其飞猪旗舰店页面显示，8点门票开售后2秒，已经成交第一单。3分钟后，重新开园首日11号和首个周六16号的门票已售罄。据飞猪数据，上午10点，迪士尼...,上海迪士尼乐园今早开放售票，飞猪旗舰店2秒售第一单
492,2020-05-08 09:48:00,早上8点，上海迪士尼乐园重新开放售票，因新冠疫情关闭了107天之后，乐园将在5月11日重新开放。其飞猪旗舰店页面显示，8点门票开售后2秒，已经成交第一单。3分钟后，重新开园首日11号和首个周六16号的门票已售罄。据飞猪数据，上午10点，迪士尼...,上海迪士尼乐园今早开放售票 飞猪旗舰店2秒售第一单
493,2020-05-08 09:45:00,为贯彻落实《国务院关于在自由贸易试验区开展“证照分离”改革全覆盖试点的通知》（国发〔2019〕25号）要求，中国人民银行拟对改革所涉及到的规范性文件进行修改，起草了《中国人民银行公告（修改“证照分离”改革涉及的规范性文件）（征求意见...,中国人民银行起草《中国人民银行公告（修改“证照分离”...
494,2020-05-08 09:44:00,水泥板块小幅拉升，祁连山涨近3%，海南瑞泽、金圆股份、宁波富达小幅跟涨。,水泥板块小幅拉升
495,2020-05-08 09:44:00,7日，工信部原材料工业司组织召开“支持湖北疫后重建推进大型骨干机制砂石项目建设调度会”。国家发展改革委、自然资源部、生态环境部等“推进机制砂石行业高质量发展工作协调机制”成员单位，湖北省经信厅等省内相关部门，华新水泥、葛洲坝集团...,工信部：支持湖北疫后重建 推进大型骨干机制砂石项目建设
496,2020-05-08 09:43:00,世界旅游组织表示，由于新冠疫情大流行，2020年国际游客抵达数量将骤减60%至80%。该机构曾发布声明称，今年第一季度游客抵达数量减少22%，亚洲和欧洲下滑最为严重。（央视新闻）,世界旅游组织：国际游客数将因新冠疫情骤减80%
497,2020-05-08 09:36:00,中国央行：2020年5月14日（周四）中国人民银行将通过香港金融管理局债务工具中央结算系统（CMU）债券投标平台，招标发行2020年第四期和第五期中央银行票据。第四期中央银行票据期限3个月（91天），发行量为人民币200亿元；第五期中央银行票据期...,中国央行：5月14日中国人民银行将招标发行2020年第四期和...
498,2020-05-08 09:34:00,据深交所5月8日消息，因SHOUGANG I-OLD结束并行买卖合并股份，根据《深圳证券交易所深港通业务实施办法》的有关规定，港股通股票名单发生调整并自今日起生效。,深港通下的港股通股票名单调整 SHOUGANG I-OLD调出
499,2020-05-08 09:32:00,澳洲联储货币政策声明：预计2021年GDP增速为6%，	澳洲联储货币预计2020年澳大利亚GDP萎缩6%，预计上半年澳大利亚的产出将严重萎缩。,澳洲联储货币政策声明：预计2021年GDP增速为6%
500,2020-05-08 09:32:00,数字货币板块开盘走高，恒宝股份涨停，广电运通、汉威科技、聚龙股份、金财互联等跟涨。,数字货币板块开盘走高
501,2020-05-08 09:31:00,根据新西兰卫生部门数据，截至5月8日上午，新西兰过去24小时内新增2例新冠肺炎确诊病例，全国累计确诊1141例。累计疑似病例349例，累计康复1347例。,新西兰新增新冠肺炎确诊病例2例 累计1141例
502,2020-05-08 09:29:00,泰晶转债开盘涨7.37%，昨日大跌47.68%。,泰晶转债开盘涨7.37%
503,2020-05-08 09:29:00,新西兰总理阿德恩日前表示，5月11日，政府将公布是否继续降低警戒级别。媒体分析，零售业、国内旅行和体育活动等有望全面解封，新西兰的警戒级别也将降至二级。（央视）,新西兰有望于5月11日起大规模解封
504,2020-05-08 09:26:00,连板股今日竞价表现如下：2连板新农开发竞价涨停，4连板华盛昌高开0.33%，3连板海航投资平开，3连板三丰智能低开3.31%，3连板容大感光低开0.21%，3连板电子城低开4.10%。,连板股今日竞价表现
505,2020-05-08 09:25:00,A股指数集体高开，沪指涨0.39%，深成指涨0.56%，创业板指涨0.52%，华为概念股表现活跃。,A股指数集体高开
506,2020-05-08 09:24:00,广州市正式启动动产抵押委托登记试点工作，将动产抵押登记工作委托中国人民银行征信中心办理。（新华网）,广州启动动产抵押委托登记试点
507,2020-05-08 09:20:00,辽宁省政府于2019年出台了《关于进一步支持企业上市发展的意见》。今年是辽宁省政府上市扶持政策落地的第一年，截至4月末，辽宁省金融监管局和辽宁省财政厅向沈阳、鞍山、本溪、锦州、营口、辽阳、朝阳7个市的符合条件的企业发放补助资金8999万...,辽宁省：今年将有10余家企业向证监会系统申报上市材料
508,2020-05-08 09:20:00,恒指高开0.89%，蓝筹股普涨。,港股开盘：恒指高开0.89%
509,2020-05-08 09:17:00,沪金期货主力合约创2011年9月以来高位，现报383.64元/克。,沪金期货主力合约创2011年9月以来高位
510,2020-05-08 09:16:00,据机构援引业内人士：中国央行公开市场今日不进行逆回购操作，已连续二十五个工作日不进行逆回购操作；本周，中国央行未进行逆回购操作，因本周没有逆回购到期，本周实现零投放零回笼。,中国央行公开市场今日不进行逆回购操作
511,2020-05-08 09:15:00,人民币兑美元中间价报7.0788，上调143点，上一个交易日中间价7.0931。,人民币兑美元中间价报7.0788 上调143点
512,2020-05-08 09:15:00,人民币兑美元中间价报7.0788，上调143点。,人民币兑美元中间价报7.0788 上调143点
513,2020-05-08 09:14:00,现货白银日内涨幅扩大至0.54%，报15.38美元/盎司。,现货白银日内涨幅扩大至0.54%
514,2020-05-08 09:12:00,韩国新增新冠肺炎确诊病例12例，累计确诊病例10822例，累计死亡病例维持在256例。,韩国新增新冠肺炎确诊病例12例 累计确诊病例10822例
515,2020-05-08 09:10:00,现货黄金突破1720美元/盎司，日内涨幅为0.29%。,现货黄金日内涨幅为0.29%
516,2020-05-08 09:10:00,布伦特原油期货日内涨幅扩大至2%，报30.06美元/桶。WTI原油6月期货涨2.63%，报24.17美元/桶。,布伦特原油期货日内涨幅扩大至2%，报30.06美元/桶。WTI原...
517,2020-05-08 09:10:00,布伦特原油期货日内涨幅扩大至2%，报30.06美元/桶。WTI原油6月期货涨2.63%，报24.17美元/桶。,布伦特原油期货日内涨幅扩大至2%
518,2020-05-08 09:08:00,美股期货扩大涨势，道指期货涨1%，标普500指数期货涨0.9%，纳指期货涨0.85%。,美股期货扩大涨势
519,2020-05-08 09:07:00,受复工复产加速的驱动及高温天气的影响，5月6日10时04分，南方电网广东电网公司的电网统调负荷今年首次突破1亿千瓦，较去年首次破亿提前9天。广东成为今年全国首个负荷破亿千瓦的省份。截至6日18时，南方电网统调最高负荷达1.71亿千瓦，同比增长...,南方电网供电区域统调最高负荷同比增长17.9% 广东负荷今...
520,2020-05-08 09:05:00,深交所发布深证公共健康50指数、深证长江经济带100指数、深证云科技50指数、深证生物医药50指数和深证消费电子50指数。,深交所发布深证公共健康50等指数
521,2020-05-08 09:01:00,广东省卫健委：广东省决定省重大突发公共卫生事件二级响应调整为三级响应。,广东省卫健委：广东省决定省重大突发公共卫生事件二级响...
522,2020-05-08 09:00:00,富时中国A50指数期货高开0.26%，上一交易日夜盘收跌0.09%。,富时中国A50指数期货高开0.26%
523,2020-05-08 08:59:00,5月7日，湖北省新增无症状感染者16例，转确诊0例，解除隔离13例，尚在医学观察的无症状感染者629例。截至2020年5月7日24时，全省现有确诊病例0例，现有疑似病例0例。,湖北省新增无症状感染者16例
524,2020-05-08 08:57:00,广东省工信厅日前发布《广东省“5G+工业互联网”应用示范园区试点方案（2020-2022年）》，首批八个“5G+工业互联网”应用示范园区正式公布，分布在广州、深圳、珠海、佛山、惠州和湛江六个城市。同时，第二批广东省“5G+工业互联网”应用示范园...,广东：2022年重点工业园区5G网络将全覆盖
525,2020-05-08 08:54:00,澳大利亚准备在4周内放松冠状病毒的限制。（路透社）,澳大利亚准备在4周内放松冠状病毒的限制
526,2020-05-08 08:50:00,日经225指数涨幅扩大至2%。,日经225指数涨幅扩大至2%
527,2020-05-08 08:49:00,高比例持股组合年均复合收益率近20%！>>,QFII投资风格大复盘 目前重仓这些股
528,2020-05-08 08:45:00,中信证券认为，风险预期对银行股的影响强于不良数据的影响，因此尽管2季度可能出现不良生成率的上升，但经济预期修复料将驱动银行风险预期的修复，有助夯实银行股估值底线。预计银行板块全年盈利增速平稳，当前极低估值下，继续看好中期维度或有...,中信证券：预计银行板块全年盈利增速平稳
529,2020-05-08 08:40:00,截至05月07日，上交所融资余额报5489.83亿元，较前一交易日增加25.55亿元；深交所融资余额报4904.74亿元，较前一交易日增加33.95亿元；两市合计10394.57亿元，较前一交易日增加59.5亿元。,两市融资余额较前一交易日增加59.5亿元
530,2020-05-08 08:33:00,国家卫健委：境外输入现有确诊病例219例（含重症病例5例），现有疑似病例6例。累计确诊病例1680例，累计治愈出院病例1461例，无死亡病例。,国家卫健委：境外输入现有确诊病例219例
531,2020-05-08 08:31:00,中信证券指出，从现有经验看，疫情先冲击供给后传导到需求，一定程度能够解释在4月海外疫情发展严峻的背景下中国出口增长强于进口。此外，进口增长也一定程度受到大宗商品价格回落的拖累。向后看，在当前进出口的特征下，预计5月进出口增长压力...,中信证券：预计5月进出口增长压力将进一步加大
532,2020-05-08 08:31:00,国家卫健委：5月7日0―24时，31个省（自治区、直辖市）和新疆生产建设兵团报告新增确诊病例1例，为本土病例（在吉林）；无新增死亡病例；新增疑似病例3例，均为境外输入病例（在上海）。,国家卫健委：昨日报告新增确诊病例1例
533,2020-05-08 08:26:00,重庆市委书记陈敏尔，市委副书记、市长唐良智与新希望集团董事长刘永好一行举行座谈。按照协议，新希望集团三年内将在渝新增投资200亿元以上，建成年出栏500万头生猪产业化项目及相关产业链配套，实施生猪产业精准扶贫，深度参与重庆市乳业等食...,重庆市与新希望集团签署战略合作协议
534,2020-05-08 08:25:00,中信建投认为，通过渠道反馈，目前终端烟酒茅台、五粮液等高端酒动销已经逐步恢复到正常的60%水平，商务团购需求明显增多；大规模的商务活动和个人宴请仍未完全恢复，次高端白酒仍有压力。低线城市餐饮恢复较快，个人及家庭聚餐基本恢复正常，除...,中信建投：消费活动预计加快复苏 白酒消费场景将得到有效...
535,2020-05-08 08:22:00,中信证券分析师明明最新研报指出，在基本面预期高度一致的背景下，宽货币（预期）才是利率挑战低点的最重要动力，4月下旬我们也对5月份比较乐观，考虑到两会召开的时间窗口，进一步的宽松政策可能很快落地。但是，目前外部约束对货币政策的影响...,中信明明：短期来看债市有超跌的迹象
536,2020-05-08 08:18:00,5月7日，陕西省与恒大集团战略合作框架协议签约仪式在西安举行。陕西省委书记胡和平、省长刘国中出席签约仪式并会见恒大集团董事局主席许家印一行。根据协议，双方将发挥互补优势，深化文化旅游、康养、体育、生态、农业等领域合作，促进资源、...,陕西省与恒大集团签署战略合作框架协议
537,2020-05-08 08:17:00,当地时间5月7日周四，秘鲁农业灌溉部发布公告称，部长蒙特内格罗在6日周三进行的新冠肺炎检测结果呈阳性，目前正在严格按照医院的指引采取隔离措施。同日，秘鲁国会以112票赞成、0票反对、15票弃权的结果批准了副总统梅赛德斯·阿劳斯于去年提出...,秘鲁农业灌溉部长确诊感染新冠肺炎 国会投票批准副总统辞呈
538,2020-05-08 08:01:00,工信部官网7日发布《关于深入推进移动物联网全面发展的通知》。《通知》要求，到2020年底，NB-IoT网络实现县级以上城市主城区普遍覆盖，重点区域深度覆盖；移动物联网连接数达到12亿。,工信部：年底移动物联网连接数将达12亿
539,2020-05-08 08:00:00,日经225指数开涨1.51%。,日经225指数开涨1.51%
540,2020-05-08 07:58:00,随着互联网渠道快速发展、无接触服务兴起，银行物理网点的主渠道地位被削减，关停撤销数量逐渐增多。5月7日，银保监系统一连批复了5家支行和分理处的终止营业申请，且今年以来已有超过800家银行网点关门谢客。在分析人士看来，银行网点关停的背...,年内逾800家关停 银行网点转型迫在眉睫
541,2020-05-08 07:58:00,西班牙时间7日，世界旅游组织表示，由于新冠疫情大流行，2020年国际游客抵达数量将骤减60%至80%。该机构曾发布声明称，今年第一季度游客抵达数量减少22%，亚洲和欧洲下滑最为严重。（中新经纬）,世界旅游组织：今年国际游客数将因新冠疫情骤减60%-80%
542,2020-05-08 07:56:00,曾有着国内会计所“一哥”之称的审计机构瑞华会计师事务所如今风光不再。随着大部分A股上市公司2019年年报出炉，瑞华2019年在A股的审计客户情况也浮出水面。数据统计，截至5月7日，以已披露2019年年报的公司统计，相较于2018年326家上市公司年报...,瑞华惨败A股 年报审计客户暴降九成
543,2020-05-08 07:53:00,上海昨日无新增本地新冠肺炎确诊病例，无新增境外输入性新冠肺炎确诊病例，治愈出院3例。（健康上海）,上海昨日无新增本地新冠肺炎确诊病例
544,2020-05-08 07:52:00,上市房企4月销售数据陆续披露，从公布情况来看，4月楼市继续回温，房企整体销售规模环比大增。另据克尔瑞研究中心数据统计，4月份TOP100房企单月实现全口径销售金额9002.3亿元，环比增长17.2%，同比增长0.6%，同比年内首次转正。有研报称，随着...,楼市持续回温 百强房企4月销售额同比转正
545,2020-05-08 07:52:00,今年春节之后，以半导体为主的科技股经历了过山车的走势，到了4月中下旬，可以看到一些科技龙头走势开始逐步复苏，近几个交易日科技股迎来全面爆发。进入5月后，市场心态常被“五穷”魔咒困扰，对行情预期并不乐观，不过由于今年市场面临情况特...,大科技引擎启动 A股“红五月”呼声渐响
546,2020-05-08 07:52:00,近期，国内多地新冠病毒检测试剂实行集采，新冠病毒检测试剂产品的出口和认证也在有序推进。业内人士认为，在国内扩大新冠病毒检测叠加海外疫情维持高位的背景下，新冠检测试剂需求旺盛的基本面没有改变。二季度相关公司有望延续一季度靓丽业绩...,新冠病毒检测试剂市场放量 相关公司二季度业绩受益
547,2020-05-08 07:50:00,法国全国啤酒业协会“法国啤酒制造商”6日说，政府为遏制新冠疫情蔓延实施社交隔离等措施，致使啤酒消费受到重挫，预计超过1000万升啤酒因过期等原因被迫倒掉。（环球网）,受疫情影响法国啤酒厂将倒掉超1000万升啤酒
548,2020-05-08 07:49:00,美国总统特朗普贴身工作人员确诊感染新冠肺炎，特朗普连续两天新冠病毒检测呈阴性。,特朗普贴身工作人员确诊
549,2020-05-08 07:48:00,随着可转债市场持续扩容，数据显示，截至5月7日，今年以来可转债成交额高达2.59万亿元，较2019年同期激增近6倍。基金经理认为，可转债市场的扩容丰富了债券基金的投资品种，但需注意规避高估值风险。（中国证券报）,可转债成交额激增 基金经理提示高估值风险
550,2020-05-08 07:47:00,从未敢想的事正在发生！这些A股公司还在扩产>>,熔喷布“打假”后  这类产品火了
551,2020-05-08 07:38:00,8日四大证券报纸内容精华摘要有:大科技引擎启动 A股“红五月”呼声渐响；我国外储规模重回正增长 未来有望保持稳定；税收优惠政策持续加码 助力小微企业渡难关,四大证券报纸及人民日报头版内容精华摘要（5月8日）
552,2020-05-08 07:37:00,瑞士联邦经济事务秘书处7日发表的报告显示，受新冠疫情影响，瑞士4月份失业率由前一个月的2.9%上升到3.3%，为2017年3月以来最高点。报告说，截至4月底，瑞士共有15.3万人注册失业，比3月份增加近1.8万人，比去年同期增加4.6万人。（新华网）,瑞士失业率因疫情创三年来新高
553,2020-05-08 07:36:00,近期随着年报、一季报披露完毕，全面复工积极推进，海外市场反弹，还有政策层面继续加码的预期，市场信心进一步回升，短期保持谨慎乐观。创业板注册制改革也可看作短期提高市场风险偏好的催化剂。行业方面，随着海外逐步复工，内需逻辑逐步转向...,天风证券：短期保持谨慎乐观 看好消费电子为代表的科技
554,2020-05-08 07:35:00,巴西著名足球俱乐部弗拉门戈当地时间6日发布公告，在对俱乐部球员和工作人员及家属共293人进行新冠病毒检测后，有38人检测结果呈阳性，其中包括3名球员，其余大多数为俱乐部球员和员工的家属或与其密切接触的工作人员。弗拉门戈表示，检测结果呈...,巴西著名足球俱乐部弗拉门戈38人新冠病毒检测呈阳性
555,2020-05-08 07:31:00,特斯拉CEO马斯克日前表示，特斯拉将推迟交付新款Roadster。特斯拉上月曾表示，将把第一批Semi车型的交货时间改到2021年。马斯克表示，生产Roadster需要大规模量产Model Y、柏林超级工厂开始生产、特斯拉Semi开始生产、特斯拉Cybertruck开始等等...,马斯克：特斯拉新款Roadster将推迟交付
556,2020-05-08 07:27:00,截至4月30日，共计6953家新三板挂牌公司披露了2019年年报，合计实现营业收入14952.54亿元，同比增长9.91%，归属挂牌公司股东净利润为702.24亿元，同比增长15.40%。其中有5074家公司实现盈利，占比为73%。从业绩规模看，779家挂牌公司去年实现净...,近7000家新三板公司年报披露 超七成盈利
557,2020-05-08 07:26:00,交易平台Bitstamp报价显示，比特币突破10000美元大关，为2月24日以来首次。,比特币突破10000美元大关
558,2020-05-08 07:06:00,据了解，第二批带量采购加速在全国范围铺开。而带量采购常态化对生物医药企业销售费用、毛利率等影响备受关注。记者据同花顺iFinD数据梳理，313家生物医药A股公司公布了2019年销售费用数据。其中，仅71家上市药企的销售费用出现了下滑。与此同时...,第二批带量采购加速落地 预计生物医药上市公司毛利率将再...
559,2020-05-08 07:03:00,4月份，土地市场颇为火热，房企拿地出手“阔绰”。中国指数研究院发布的4月房企拿地排行榜显示，Top100房企拿地总额3882亿元，同比增长7.2%，环比增长108.9%。在此背景下，高溢价率地块频出。专家认为，4月份土地市场升温主要缘于一季度积压需求...,高价地频现 房企“补仓”推升土地市场
560,2020-05-08 07:01:00,截至5月7日收盘，A股市场除已经铁定退市的*ST保千外，还有天广中茂、神雾环保等6家公司股价低于1元；另有36只股票收盘价介于1元至1.5元，距离仙股区只有一步之遥。加上51只股票收盘价介于1.5元至2元（不含）之间，两市5月7日收盘价在2元以下的A...,近百公司面临面值退市风险
561,2020-05-08 07:01:00,数据显示，截至一季度末，基金的银行持仓市值减少960亿元，持有的上市银行家数从36家减少到31家。单季度减持比例为2016年以来最高水平，减持集中于龙头银行，前期涨幅较高的平安银行和宁波银行被获利了结。而险资和外资则继续入场。中国人寿、太...,基金“落袋”银行股 险资外资持续加仓
562,2020-05-08 06:59:00,阅文集团5月7日晚间再次发微博辟谣称，一批有组织的谣言袭来，鉴于此我们准备提前回应，以免大家被谣言误导。阅文集团表示，针对新团队、“阅文管理层对作者心态高高在上”等5种网传说法辟谣，并再次强调，新合同快出来了，大家拭目以待。,阅文再辟谣：新合同快出来了大家拭目以待
563,2020-05-08 06:55:00,疫情冲击下，国际原油市场价格频频出现大幅波动，同时引发了不少投资者“抄底”的念头。随着原油价格暴跌而净值回落的原油QDII基金，就成为了不少资金“抄底”的对象。业内人士指出，中行“原油宝”事件警示投资者，盲目抄底原油的风险巨大，而...,“抄底”慎入 原油QDII基金高溢价藏隐忧
564,2020-05-08 06:47:00,截至5月7日20时，95家A股上市公司公告上半年业绩预喜，分别来自电子、医药生物等多个行业。其中，4家公司预计上半年净利超过10亿元，31家公司预计上半年净利同比翻番。（中国证券报）,95家公司上半年业绩预喜 多行业亮点呈现
565,2020-05-08 06:47:00,5月伊始，货币市场笑逐颜开，银行间市场上代表性的7天期债券回购利率（DR007）重回1.5%下方，与央行逆回购利率之间的裂口再度扩大。分析人士指出，近来市场利率持续大幅低于政策利率，表明市场降息预期浓厚。当前偏松的政策氛围一时很难改变，市...,分析人士：“双降”月内上演可期
