,datetime,content,title
236,2020-06-01 15:38:00,6月1日，格力电器黄辉在2019年年度股东大会上表示，我们在芯片研发上已经有很多年了，2018年开始，我们的芯片已经投入实际使用。除了室内机，在室外机、遥控器方面都有投入。未来几乎所有格力空调用到的芯片，都会用到自己的产品。,格力电器黄辉：未来几乎所有格力空调都会用自己的芯片
237,2020-06-01 15:37:00,6月1日，日本厚生劳动省开始在东京都和宫城县实施1万人规模的检测，以掌握感染新型冠状病毒后产生的抗体携带者比例。（环球网）,日本今日启动万人规模新冠病毒抗体检测
238,2020-06-01 15:36:00,俄罗斯报告新增9035例新冠肺炎病例，累计414878例。,俄罗斯报告新增9035例新冠肺炎病例
239,2020-06-01 15:36:00,俄罗斯报告新增9035例新冠肺炎病例,俄罗斯报告新增9035例新冠肺炎病例，累计414878例
240,2020-06-01 15:35:00,上海自贸区临港新片区将建100万平方米“信息飞鱼”全球数字经济创新岛，探索建设“新型数据监管关口”，推动数据跨境流动先行先试，聚焦人工智能、生物医药、智能制造、总部经济等关键领域探索国际化数据流通机制。,临港新片区将建百万平米数字经济创新岛 推动数据跨境流动
241,2020-06-01 15:32:00,受到大众集团重金入局的消息影响，国轩高科今天开盘涨停，报32.89元；江淮汽车也是高开高走，再度涨停，报9.97元。记者以投资者身份致电江淮汽车方面，工作人员回应表示，根据目前意向书的内容，关于增资的最终协议预计在7月底前达成。        ...,江淮汽车：关于增资的最终协议争取在7月底前达成
242,2020-06-01 15:30:00,韩国方面预测2020年GDP增长为0.1％。,韩国预测2020年GDP增长为0.1％
243,2020-06-01 15:27:00,6月1日，格力电器黄辉在2019年年度股东大会上表示，目前主流的技术是蒸汽压缩技术，在全世界目前都是最高效、最成熟的。到现在为止，近几年虽然有一些新的方向在研究，这些研究的技术方向我们认为目前还不足以替代目前的蒸汽压缩制冷系统，可能...,格力电器黄辉：目前主流的技术是蒸汽压缩技术 近几年有一...
244,2020-06-01 15:25:00,赣锋锂业最新发布的投资者关系活动记录表表示，公司TWS扣式电池每日出货量10-12万只，供不应求。主要客户有OPPO、VIVO、JBL、漫步者等，主要用于蓝牙耳机和智能穿戴设备。公司计划在2020年四季度达到20-25万只/天的产能。,赣锋锂业：公司TWS扣式电池每日出货量10-12万只，供不应求
245,2020-06-01 15:25:00,赣锋锂业最新发布的投资者关系活动记录表表示，公司TWS扣式电池每日出货量10-12万只，供不应求。主要客户有OPPO、VIVO、JBL、漫步者等，主要用于蓝牙耳机和智能穿戴设备。公司计划在2020年四季度达到20-25万只/天的产能。,赣锋锂业：公司TWS扣式电池每日出货量10-12万只 供不应求
246,2020-06-01 15:23:00,6月1日起，海关总署牵头启动我国首次综合保税区发展绩效评估。一共设立五大类27项核心量化指标和地方落实主体责任等8项辅助考核指标。评估将在9月底结束。对连续两年评估结果在分地区排名且全国排名后5位的，将按规定启动退出程序。（澎湃新闻）,我国首次开展综保区绩效评估 连续2年排名后5位将按规退出
247,2020-06-01 15:23:00,韩国中央应急处置本部防疫总括组长尹泰皓1日在例行记者会上表示，截至当天0时，35例新增确诊病例中有24例由小型宗教活动引发，并呼吁民众避免在宗教设施内面对面接触。（韩联社）,韩八成社区感染新增新冠病例与宗教聚会有关
248,2020-06-01 15:21:00,俄罗斯主权财富基金（RDIF）：俄罗斯可能会开始出口新冠肺炎药物。,俄罗斯可能会开始出口新冠肺炎药物
249,2020-06-01 15:20:00,韩国现代汽车周一表示，由于新冠病毒的影响，5月销量同比下降39％至217510辆。（路透社）,现代汽车5月销量同比下降39％
250,2020-06-01 15:16:00,人民银行消息，自宣布完善LPR形成机制以来，一系列的改革措施提高了银行贷款定价的自主权，推动银行改进经营行为，坚决打破贷款利率隐性下限，疏通市场化利率传导渠道。各类型银行积极有序运用LPR定价，地方法人金融机构LPR定价贷款占比不断提高...,央行：金融机构加大LPR定价推广运用 新发放贷款中运用LPR...
251,2020-06-01 15:14:00,日本财务省1日公布的2020年一季度（1至3月）法人企业统计初值显示，除金融、保险业外的所有行业经常利润较上年同期减少32.0%至15.136万亿日元（约合人民币1万亿元），连续4个季度减少。这是雷曼危机之后的2009年三季度（减少32.4%）以来时隔约10...,日本一季度所有行业经常利润大减32%
252,2020-06-01 15:14:00,苹果公司周一宣布，计划当地时间周三（6月3日）中午重新开放其在日本东京的最大零售店。在因疫情而被迫关闭后，苹果在表参道、银座和涩谷的门店都将恢复营业，该公司在日本的最大旗舰店丸之内店也将重新开放。预计到周三，苹果在日本的10家零售...,苹果将重启东京旗舰店
253,2020-06-01 15:13:00,新加坡方面称，6月1日截至目前没有社区新冠肺炎确诊病例。,新加坡：6月1日截至目前没有社区新冠肺炎确诊病例
254,2020-06-01 15:07:00,6月1日，百联集团再次上支付宝发放近5亿元企业消费券，成为上海发放企业消费券最多的零售商业体。,百联集团今日起通过支付宝再发5亿消费券
255,2020-06-01 15:05:00,6月1日上午，“格力健康新生活”直播活动开播。据介绍，上午10:00-12:00的直播内容为探秘格力国家重点实验室、空气净化器实验室、工厂等科研重地。此外，董明珠办公室、格力数控机床精密加工车间等都是首次公开。尽管上半场直播以展示企业研发实...,3小时销售10亿元 董明珠直播带货再创新高
256,2020-06-01 15:01:00,【收盘气象】指数全天震荡走高，深成指、创业板指收涨逾3%，沪指涨2%，券商、期货等金融股大涨，消费电子概念掀涨停潮，午后海南本地股拉升，个股普涨，涨停数达150余家，市场人气显著升温。,收评：A股六月开门红 三大指数集体大涨
257,2020-06-01 15:01:00,习近平对海南自由贸易港建设作出重要指示强调，要把制度集成创新摆在突出位置，高质量高标准建设自由贸易港。（新华社）,习近平对海南自由贸易港建设作出重要指示强调
258,2020-06-01 15:01:00,欧股普遍高开，英国富时100指数涨1.43%，意大利富时MIB指数涨1.5%，法国CAC40指数涨0.12%。,欧股普遍高开
259,2020-06-01 14:58:00,星期六最新发布的投资者关系活动记录表透露，目前签约的红人达人100个左右，其中直播带货30个左右，小几十个是做情感类等直播，有几十个短视频达人。公司今年年内核心主力是抖音和快手。西瓜视频目前处于起步阶段，公司会进行尝试。B站目前公司...,星期六：目前签约网红100个左右 其中直播带货30个左右
260,2020-06-01 14:58:00,6月1日从包头稀土高新区获悉，中国北方稀土的500吨铈锆固溶体生产线开建，预计今年9月达产，这也标志着我国稀土铈锆固溶体技术已经打破了国际垄断。（科技日报）,我国稀土铈锆固溶体技术打破国际垄断
261,2020-06-01 14:55:00,据悉，俄罗斯将在下周开始使用其首个获批的抗病毒药物来治疗新冠病毒患者。知情人士透露，俄罗斯医院将从6月11日开始使用这种药物，每月足以治疗约60000人。它以阿维法韦（Avifavir）的名义注册，是俄罗斯卫生部批准的第一种冠状病毒治疗方法。...,俄罗斯批准阿维法韦用于新冠病毒治疗
262,2020-06-01 14:55:00,2020年5月29日，中国铁塔2020年开关电源产品集采项目中标结果正式公布，中兴通讯凭借领先的技术水平、优异的产品质量及良好的服务能力，斩获电源中标总量第一的成绩。本次集采包含三个标段，分别为模块化电源、模块化电源及壁挂式电源，中兴通讯...,中国铁塔2020年开关电源集采结果公布：中兴通讯中标5G电...
263,2020-06-01 14:49:00,据方正科技官网，方正国际软件有限公司与天津麒麟信息技术有限公司完成双方产品的兼容性测试工作，方正公文制作软件V1.0与银河麒麟桌面操作系统软件V4.0（政企专用和飞腾版）通过兼容测试并获得认证证书，为推进党政军机关信创工作的落实发挥积...,方正国际与天津麒麟完成兼容性认证
264,2020-06-01 14:48:00,汇丰银行（中国）有限公司今日宣布，正式代销投向QDLP（合格境内有限合伙人）基金的资产管理计划，以全新的海外市场投资渠道，进一步丰富合格投资者的全球化多元资产配置，成为内地首家成功代销此类投资产品的外资银行。（上海证券报）,积极参与金融市场双向开放 汇丰在外资行中首推QDLP
265,2020-06-01 14:44:00,据腾讯《深网》，有消息称国内即时零售和配送平台达达集团将于今天在纳斯达克启动3亿美元首次公开募资。同时《深网》获知，达达将于本周内确定正式上市日期，并于本月初赴美上市。目前，达达方面对消息表示不予置评。,有消息称达达集团将于今天在纳斯达克启动3亿美元首次公开...
266,2020-06-01 14:43:00,近日，随着湖南电力信息系统主机重启成功，9大电网经营管理系统割接顺利完成，两座110kV变电站、其所属输配电线路电网资产，以及辖区内用户全部成功划转，第三方线上交费平台、供电抢修指挥平台也同步完成系统割接，金风科技参股的国家第二批增...,金风科技参股增量配电网项目进入实质运营阶段		
267,2020-06-01 14:37:00,韩国三星电子周一宣布，将在京畿道平泽工业园区新建一条NAND芯片生产线，预计明年下半年量产。公司未宣布具体投资额，分析师估计投资额在7万-8万亿韩元。（界面）,韩国三星宣布新建一条NAND内存生产线，投资额在7万-8万亿...
268,2020-06-01 14:37:00,华邦健康在互动平台上表示，公司控股子公司颖泰生物旗下拥有江苏常隆、上虞颖泰、禾益股份等多家从事农药原药和制剂的生产型子公司，合计拥有生物和绿色化学杀虫剂原药和制剂产品113个，其中31个杀虫剂单剂/复配制剂可以快速、高效、及时地防治...,华邦健康：控股子公司拥有多家从事农药原药和制剂的生产...
269,2020-06-01 14:33:00,6月1日，亚太股市收盘集体上涨。东京日经225指数涨0.84%，报22062.39点。韩国综合指数涨1.75%，报2065.07点。澳大利亚普通股指数涨1.13%，报5938.40点。,亚太股市收盘集体上涨
270,2020-06-01 14:31:00,据荣耀方面介绍，荣耀智慧屏X1系列55英寸今天迎来首销，在618第一天开始的10小时48分钟，荣耀智慧屏打破京东黑电品类单品首销尘封5年的最高销量纪录。（36氪）,荣耀智慧屏打破京东黑电品类单品首销五年历史纪录
271,2020-06-01 14:28:00,李克强6月1日上午考察山东烟台蓝色智谷，与部分小微企业主开了个“站谈会”。总理重点了解金融支持稳企业保就业政策落实情况，仔细询问小微企业目前融资实际利率、授信额度以及经营状况等。（中国政府网）,李克强6月1日上午考察山东烟台蓝色智谷
272,2020-06-01 14:24:00,天龙集团在互动平台上表示，公司与字节跳动公司有业务往来，无投资关系。,天龙集团：公司与字节跳动公司有业务往来
273,2020-06-01 14:23:00,宝马集团计划通过向工人提供更多的激励措施，以实现裁员5000人的目标。其首席财务官尼古拉斯·彼得（Nicolas Peter）在一份公司内部的公告中表示，主要通过无薪休假、减少短期合同雇员的工作时间以及让更多员工选择提前退休的方式。（欧洲汽车新...,宝马计划裁员5000人
274,2020-06-01 14:22:00,期货概念异动拉升，中国中期涨停，瑞达期货、南华期货等跟涨。,期货概念异动拉升
275,2020-06-01 14:20:00,港股神州租车午后涨幅扩大至20%。消息面北汽集团将向神州优车收购约21.26%股份。,港股神州租车午后涨幅扩大至20%
276,2020-06-01 14:15:00,记者6月1日从郑州商品交易所获悉，郑商所第八次会员大会近日以视频会议方式召开。会上，中国证监会副主席方星海通过视频发表讲话。方星海表示，新冠肺炎疫情发生以来，证监会坚决贯彻落实党中央和国务院关于疫情防控工作的决策部署，始终把期货...,方星海：期货交易所要加大产品供给 积极推进对外开放
277,2020-06-01 14:10:00,海南本地股拉升，大东海A涨停，海德股份一字板，海汽集团、海南高速等跟涨。,海南本地股拉升
278,2020-06-01 14:06:00,近日，贝瑞基因主导设计并推出“移动式核酸检测实验室”，适用于包括新冠病毒在内的多种病原微生物核酸检测，并可以根据使用单位的实际情况，量身定制从实验流程设计、实验室部署、专业技术人员培训、资质申报到数据平台对接的综合解决方案。该...,贝瑞基因推出“移动式核酸检测实验室”
279,2020-06-01 14:04:00,法国交通部5月31日宣布，巴黎大众运输公司6月将恢复正常运力。为应对暑期高峰，法国国家铁路公司6月中旬开始将恢复百分百运力，同时取消“必须空置一半座位”的规定，欧洲范围内的高铁列车也将逐步恢复。不过，公共交通系统仍将继续采取严格的卫...,法国交通运输6月将逐步恢复正常 取消“必须空置一半座位...
280,2020-06-01 14:02:00,从哔哩哔哩（简称B站）获悉，B站计划今年6月下旬发射一颗名为“哔哩哔哩视频卫星”的遥感卫星，卫星所获的遥感视频、图片数据将用于B站科普。（观察者网）,B站拟6月发射我国自主研发遥感卫星
281,2020-06-01 13:58:00,天猫618公布战报：今年增量最快的淘宝直播仅1个半小时破20亿。这是阿里GMV突破1万亿美元之后的首个618，更是疫情之后拉动内需的一场重要节点。天猫618首日，格力董事长董明珠就率3万多门店参与淘宝直播等平台，据了解，娃哈哈宗庆后、华为何刚等...,淘宝直播1.5小时破20亿
282,2020-06-01 13:56:00,业内第一只以女性消费为主题的公募基金――博时女性消费混合基金将于6月8日发行，该基金由博时基金管理有限公司发行，渣打银行（中国）有限公司独家代销。这也是国内投资市场首次明确出现女性消费这一主题基金。（中证网）,业内首只女性消费主题基金即将发行
283,2020-06-01 13:56:00,亚美尼亚总理称自己的新冠病毒检测结果呈阳性。,亚美尼亚总理称自己的新冠病毒检测结果呈阳性
284,2020-06-01 13:49:00,氢燃料储能产业规划正在开展编制工作，预期将于2020年内发布。根据规划，加氢站和氢燃料车在2025-2035年期间，均有程度不同的规划建设/生产数量。（新浪）,氢燃料储能产业规划预期将于年内出台
285,2020-06-01 13:47:00,当地时间1日，日本厚生劳动省开始在东京都和宫城县实施1万人规模的检测，以掌握感染新冠病毒后产生的抗体携带者比例。大阪府也将于近期实施。此举旨在推定包括没有出现症状的人和康复者在内的感染蔓延情况。（共同社）,日本启动万人新冠病毒抗体检测 推定疫情蔓延情况
286,2020-06-01 13:45:00,近日，Prada集团联合首席执行官Patrizio Bertelli在接受彭博电视采访时表示，5月，Prada在中国市场的增长恢复超过10%。Bertelli还表示，Prada集团目前没有考虑退市。（界面新闻）,Prada：5月在华销量增长超10% 没有考虑退市
287,2020-06-01 13:44:00,继上线火车票业务后，拼多多近日再上线飞机票业务，与火车票业务一样，入口位于拼多多App首页“充值中心”版块。新浪科技就此向拼多多进行求证，截至发稿，拼多多方面暂无回应。（新浪科技）,不只能买火车票 拼多多上线飞机票业务
288,2020-06-01 13:34:00,今日，百度创始人、董事长兼CEO李彦宏转发“百度云计算中心项目二期主体结构提前封顶”一文，并评论：新基建提速。据阳泉日报报道， 5月28日，由中铁建工集团有限公司承建的百度云计算（阳泉）中心项目二期顺利封顶，比原计划提前了20多天。（澎...,百度云计算中心项目二期提前封顶，计划总投资14亿元
289,2020-06-01 13:32:00,沪银期货主力合约继续拉升，涨幅扩大至近5%，现报4505元/千克。,沪银期货涨幅扩大至近5%
290,2020-06-01 13:27:00,上午10时起，T恤便装的董明珠在三名主持簇拥下现身直播间，在格力电器总部展厅逐一介绍格力产品。这次直播分上下两场，在淘宝，京东，快手，抖音，微信小程序等平台同步进行。董明珠自媒体官微显示，全平台直播启动1分59秒，销售额已突破1亿元。...,董明珠直播带货 1分59秒销售额破亿
291,2020-06-01 13:26:00,酒店及餐饮板块异动拉升，西安饮食涨7%，大东海A、锦江酒店、首旅酒店、ST云网等跟涨。,酒店及餐饮板块异动拉升
292,2020-06-01 13:26:00,香港特区政府财政司司长陈茂波称，香港没有计划改变港元与美元的挂钩机制，香港作为亚洲金融中心没有看到任何“明显的”资本外流。程茂波周一表示，当局有信心捍卫港元汇率，银行体系的流动性“非常健康且强劲”。（路透社）,香港财政司司长：无计划改变港元汇率机制
293,2020-06-01 13:25:00,记者从哔哩哔哩（简称B站）获悉，B站计划今年6月下旬发射一颗名为“哔哩哔哩视频卫星”的遥感卫星，卫星所获的遥感视频、图片数据将用于B站科普。（新京报）,B站6月拟发射一颗科普视频卫星 官方账号将全程直播
294,2020-06-01 13:24:00,印度SENSEX指数涨幅扩大至3.1%。,印度SENSEX指数涨幅扩大至3.1%
295,2020-06-01 13:18:00,《雄安新区至北京大兴国际机场快线项目勘察设计招标公告》已对外发布，该项目将于近期实施。线路时速160公里以上，建成后实现雄安新区启动区至北京大兴国际机场半小时、至北京金融街一小时通达目标。（雄安发布）,雄安至北京大兴国际机场快线将启动建设
296,2020-06-01 13:15:00,记者从长安汽车确认，原雷诺汽车（中国）有限公司市场及销售执行兼大中华区销售及网络总监陈晓波将加盟长安汽车，任长安汽车乘用车营销事业部副总经理。（新京报）,陈晓波出任长安汽车乘用车营销事业部副总经理
297,2020-06-01 13:13:00,天保能源拉升涨19.12%，报0.8港元。天保能源公告称，获中国证监会批准H股全流通计划申请。,天保能源大涨近20% 获中国证监会批准H股全流通计划申请
298,2020-06-01 13:12:00,达达计划在今日晚些时候推出3亿美元纳斯达克IPO。（IFR),达达计划在今日晚些时候推出3亿美元纳斯达克IPO
299,2020-06-01 13:11:00,商业卫星测控通信服务商航天驭星完成A+轮数千万人民币融资，投资方为华强资本、科鑫资本、七酷投资。（亿邦动力网）,航天驭星完成数千万人民币A+轮融资
300,2020-06-01 13:10:00,农村电商板块异动拉升，怡亚通拉升涨停，广百股份、供销大集此前封板，芒果超媒、农产品涨逾5%。,农村电商板块异动拉升
301,2020-06-01 13:06:00,记者从上海海关获悉，今年1-4月，上海海关认真落实党中央决策部署，深化综合治税，打好“稳增长、优服务”税收政策组合拳。依法落实减免税优惠、优惠贸易协定税率、暂定税率、对美加征关税排除等政策。企业累计享受107.6亿元的税款优惠、缓征税...,稳外贸促发展 上海海关打好减税增效“组合拳”
302,2020-06-01 13:06:00,中证指数有限公司消息称，中证指数有限公司决定第二上市证券具备中证香港100等指数样本空间资格。根据最新指数规则，阿里巴巴-SW作为第二上市股票首次入选香港100指数。,阿里巴巴-SW首次入选香港100指数
303,2020-06-01 13:03:00,近日，辽宁联通携手中兴通讯，在大连成功验证了在2.1G频段下采用单个射频模块开通NR，LTE，UMTS三种制式的多模网络。验证结果显示，三模网络性能优异，其中，5G业务上下行速率接近理论峰值速率。,辽宁联通携手中兴通讯成功完成2.1G频段3/4/5G三模基站创...
304,2020-06-01 13:02:00,印度5月日经制造业就业PMI录得2005年3月该数据开展调查以来新低。,印度5月日经制造业就业PMI录得2005年3月该数据开展调查以...
305,2020-06-01 12:59:00,全国中小企业股份转让系统有限责任公司公告称，神州优车因未同步披露内幕信息，且未申请停牌，6月1日起停牌。,神州优车6月1日起停牌 因未同步披露内幕信息
306,2020-06-01 12:57:00,中证指数有限公司消息称，中证指数有限公司决定第二上市证券具备中证香港100等指数样本空间资格。根据最新指数规则，阿里巴巴-SW作为第二上市股票首次入选香港100指数。（21世纪）,阿里巴巴-SW首次入选香港100指数
307,2020-06-01 12:56:00,6月1日零点，2020年天猫618开局，天猫方面披露数据，仅用时5个小时，iPhone在天猫的成交额超过5亿元，规模相当于iPhone在中国市场一天的成交情况。（中证网）,天猫618战报：苹果手机5小时卖出5亿元
308,2020-06-01 12:55:00,日本帝国数据银行：日本受疫情冲击而申请破产的企业数量触及200家。,日本帝国数据银行：日本受疫情冲击而申请破产的企业数量...
309,2020-06-01 12:32:00,金智科技控制权拟变更；安科生物：药品重组人生长激素注射液获药品补充申请批件；富临精工实际控制人安治富决定提前终止股份减持计划。,6月1日午间公告一览：金智科技控制权拟变更
310,2020-06-01 12:27:00,财政部发布关于做好2020年电子商务进农村综合示范工作的通知。《通知》提出，要大力发展农村电子商务，促进形成农产品进城和工业品下乡畅通、线上线下融合的农产品流通体系和现代农村市场体系，培育一批各具特色、经验可复制推广的示范县。中央...,财政部：大力发展农村电商 中央财政资金重点支持县乡村三...
311,2020-06-01 12:21:00,法国政府网站5月31日公布的数据显示，法国新增新冠确诊病例257例，累计确诊151753例。法国全国的公园、绿地自周末起重新开放。,法国新冠确诊病例增至151753例 全国公园绿地重新开放
312,2020-06-01 12:04:00,截至当地时间6月1日上午8时，印度24小时内新增新冠肺炎确诊病例8392例，累计确诊190535例。（央视新闻）,印度24小时内新增新冠肺炎确诊病例8392例
313,2020-06-01 12:01:00,国务院办公厅成立2020年中国国际服务贸易交易会组织委员会和执行委员会，国务院副总理胡春华任组委会主任委员，北京市委书记蔡奇任执委会主任。,国务院办公厅成立2020年中国国际服务贸易交易会组织委员...
314,2020-06-01 12:01:00,港股恒指高开高走，此后涨幅扩大至3%，截至午盘，恒指涨3.22%，报23701.82点；国企指数涨2.86%，红筹指数涨3.85%，蓝筹股普涨，地产、消费领涨。,港股午评：恒指暴涨3.22% 腾讯、港交所涨4%
315,2020-06-01 11:53:00,根据印度卫生部官方网站公布的最新数据，截至当地时间6月1日上午，印度新冠肺炎确诊病例已升至190535例，累计死亡病例5394例。在过去24小时内，印度新增确诊病例8392例，新增死亡病例230例。（海外网）,印度新增8392例新冠肺炎确诊病例 累计逾19万例
316,2020-06-01 11:53:00,香港财政司司长陈茂波：将维持联系汇率制度。,香港财政司司长陈茂波：将维持联系汇率制度
317,2020-06-01 11:45:00,据TechWeb报道，为吸引特斯拉超级工厂落户，英国已经开始寻找一块占地400万平方英尺（约37.2万平方米）的场地，以提供足够大的工厂建设空间。事项由英国国际贸易部牵头。该部门的一名发言人透露，英国政府正与产业界合作，使英国成为开发世界级...,英国有意吸引特斯拉建设超级工厂 外媒称已开始寻找合适场地
318,2020-06-01 11:38:00,沪指放量重回2900点，北向资金半日狂扫100亿！A股下半年要重返“牛市”吗？,大A股6月实现开门红 “牛市”又回来了吗？
319,2020-06-01 11:32:00,阿里将于天猫618期间正式推出淘宝特价版直播，主推C2M定制货品，打造全球首个工厂直播平台。,阿里将于天猫618期间正式推出淘宝特价版直播
