,datetime,content,title
700,2020-05-30 09:29:00,当地时间29日，乌拉圭总统府发布声明称，一名在本周一与总统拉卡列·波乌开会的官员在29日当天确诊新冠肺炎，因此包括总统在内的与会官员都已进入隔离状态。所有与会人员都将在5月30日接受核酸检测，在结果出来之前他们都将保持隔离状态。（央视...,乌拉圭总统因曾与确诊病例接触 进入隔离状态
701,2020-05-30 09:19:00,香港财政司司长陈茂波29日在接受专访时表示，特区政府已为美国近期可能对港采取的各种经济制裁措施作出“充足应对准备”，美国如在独立关税地位、敏感技术进口和联系汇率三方面对香港作出打击，香港都不会受到严重影响。他更指国家的支持将成为...,香港财政司长：已为美制裁作足准备，定为国家守住金融安...
702,2020-05-30 09:14:00,韩国在24小时内新增39例新冠肺炎确诊病例，无新增死亡病例。,韩国在24小时内新增39例新冠肺炎确诊病例
703,2020-05-30 09:10:00,当地时间5月29日，墨西哥卫生部宣布，截至5月29日晚上7时，墨西哥全国累计84627例新冠肺炎确诊病例，较前一天新增了3227例。同时，墨西哥全国确诊死亡病例较前一天新增371例，总数已经上升到9415例。（央视新闻）,墨西哥新增新冠肺炎确诊病例3227例
704,2020-05-30 09:01:00,中华人民共和国商务部于2020年5月30日发布2020年第18号公告，决定依期终复审调查结果，自5月31日起对原产于欧盟和美国的进口四氯乙烯继续征收反倾销税，实施期限５年。,商务部决定维持对原产于欧盟和美国的进口四氯乙烯所适用...
705,2020-05-30 08:53:00,今年前五月，公募基金发行市场持续火热，新基金募资额逼近8000亿元，创下历史新高。上一次，类似体量的基金首发规模发生在2015年的大牛市行情中。,大牛市才有的现象：8000亿资金入场扫货
706,2020-05-30 08:45:00,2020年5月29日0―24时，湖北省新增新冠肺炎确诊病例0例，新增出院病例1例，无境外输入病例。截至2020年5月29日24时，全省现有确诊病例4例（均为武汉市），其中重症1例，现有疑似病例0例。5月29日，全省新增无症状感染者3例，转确诊0例，解除隔离...,5月29日湖北省新增无症状感染者3例
707,2020-05-30 08:42:00,法国官方当地时间5月29日公布博物馆和历史古迹恢复开放日程，卢浮宫将于7月6日重新开放。,法国卢浮宫将于7月6日重新开放
708,2020-05-30 08:23:00,国家卫健委：昨日新增确诊病例4例，均为境外输入病例（山东2例，上海1例，广东1例）；无新增死亡病例；新增疑似病例1例，为境外输入病例（在上海）。,全国昨日新增确诊病例4例
709,2020-05-30 08:16:00,根据巴西卫生部29日公布的数据，截至当地时间19时，该国单日新增新冠肺炎确诊病例26928例，是自疫情在巴西暴发以来的单日最大增幅。新增死亡病例1124例，连续第四天超过千例。,巴西新增新冠肺炎确诊病例26928例 累计确诊人数超46万例
710,2020-05-30 08:14:00,山东省卫健委：5月29日0―24时，山东省日照市报告2例印度输入新冠肺炎确诊病例。（央视新闻）,5月29日山东省日照市报告2例印度输入新冠肺炎确诊病例
711,2020-05-30 08:09:00,记者从天津相关部门获悉，按照《天津市促进汽车消费的若干措施》，2020年6月1日至12月31日期间，居住地在天津的人员或注册地在天津的单位在天津新购置新能源小客车，给予每辆车2000元汽车充电消费券，全市不超过30000辆。（证券时报）,天津启动申领汽车充电消费券
712,2020-05-30 08:01:00,Facebook CEO马克·扎克伯格：特朗普没有违反Facebook的政策。,Facebook CEO马克·扎克伯格：特朗普没有违反Facebook的政策
713,2020-05-30 08:00:00,Worldometers实时统计数据显示，全球新冠肺炎确诊病例超600万例，达6026091例，死亡病例达366415例。,全球新冠肺炎确诊病例超600万例
714,2020-05-30 07:54:00,上海市卫健委今早通报：5月29日0―24时，通过口岸联防联控机制，报告1例境外输入性新冠肺炎确诊病例。新增治愈出院2例，均来自阿联酋。5月29日0―24时，无新增本地新冠肺炎确诊病例。,上海昨日新增1例境外输入病例
715,2020-05-30 07:28:00,目前，5G手机价格持续下探。5月20日，华为荣耀X10 5G手机发布，售价1899元起，打破此前由小米旗下Redmi K30保持的1999元起的5G手机售价纪录。5月24日，华为发布5G手机畅享Z，售价为1699元起。5月26日，小米发布起售价1599元的5G新机Redmi 10X。...,5G手机厂商掀起价格战
716,2020-05-30 07:28:00,青岛市老牌国企混改方案相继出台并获批。继双星集团之后，海信集团的混改方案于5月28日发布，加上此前青岛啤酒推出的股权激励方案，青岛国企改革今年以来明显提速。知名家电企业海信集团其旗下的海信视像、海信家电此次混改后将从青岛市国资控制...,青岛“一企一策”国企混改提速
717,2020-05-30 07:24:00,据外媒最新消息，5月29日，苹果公司首次在美国销售官方翻新的iPhone XR手机，翻新机的的价格比目前全新机型大约便宜16%，比原价低100-120美元。（腾讯科技）,苹果首次推出iPhone XR官翻机 比新机便宜100美元
718,2020-05-30 07:10:00,今年，A股市场表现平淡，但公募基金发行市场却异常火爆，单日售罄的爆款基金频频出现，由此折射出的资金动向值得高度重视。以即将过去的5月份为例，本月仅仅发行了3只股票型基金，但合计份额却高达292.16亿份，平均每只基金发行了97.39亿份，高...,公募基金发行市场异常火爆 资金布局A股市场或将持续
719,2020-05-30 06:38:00,据美国约翰斯·霍普金斯大学发布的全球新冠肺炎数据实时统计系统，截至美国东部时间5月29日晚6时，全美共报告新冠肺炎确诊1743235例，死亡102686例。过去24小时，美国新增确诊25479例，新增死亡1216例。（人民日报）,美国新冠肺炎确诊超过174万 死亡约10.2万
720,2020-05-30 06:15:00,近30日内，共有29只银行股获机构给予“买入”或“增持”等推荐评级，占行业36只成份股总数的80.56%，居申万一级行业首位。其中，招商银行、兴业银行、南京银行、工商银行、光大银行、北京银行、邮储银行、杭州银行等8只个股均被机构推荐超10次以...,机构看好八成以上银行成份股 投资优质银行将获确定性回报
721,2020-05-30 06:14:00,两个月前，证监会基金产品行政许可审批进度公示里，连续出现了7只与新基建主题相关的基金申报，这一现象在以往基金申报的记录中还是首次发生；两个月后的今天，新基建主题基金申报数量已经达到33只。（证券日报）,23家基金公司申报新基建基金股票型ETF站上风口
722,2020-05-30 06:13:00,5月29日，证监会对《证券公司次级债管理规定》部分条款进行了修改，此次《管理规定》的修改主要包括四项内容：一是允许证券公司公开发行次级债券。二是为证券公司发行减记债等其他债券品种预留空间。三是统一法规适用。将规定中机构投资者定义统...,证监会修改证券公司 次级债管理规定
723,2020-05-30 06:11:00,上交所29日消息，上交所修订并发布《上海证券交易所风险警示板股票交易管理办法》（以下简称《管理办法》），自即日起施行。本次修订主要调整完善了沪市退市股票重新上市首日的盘中临时停牌及申报价格限制措施。重新上市的股票由于公司基本面可...,上交所完善退市股票重新上市首日交易
724,2020-05-30 05:25:00,据证券时报，美国步步紧逼及中国政策加持等多方合力下，国内半导体行业自主可控趋势已定，近来更呈现各路资金加速入场、投资火热之迹象。天眼查向证券时报·e公司记者独家提供的信息显示，2020年1月1日至5月26日，我国共新增20021家经营范围含“...,各路资本加速入场 半导体行业投资潮起
725,2020-05-30 05:02:00,据新华视点，5月30日4时13分，我国在西昌卫星发射中心用长征十一号运载火箭，采取“一箭双星”方式，成功将新技术试验卫星G星、H星发射升空，卫星顺利进入预定轨道，任务获得圆满成功。新技术试验卫星G星、H星主要用于在轨开展新型对地观测技术...,一箭双星！新技术试验卫星G星、H星发射成功
726,2020-05-30 04:58:00,英国财政大臣苏纳克周五宣布了弹性的无薪待岗雇员补贴计划，雇主可灵活安排员工出勤日，按日支付工资，剩余工作日工资由政府补贴。政府现有补贴计划负担无班可上员工最多80%的薪水，9月和10月这一比例将下降至70%和60%，雇主承担10%和20%。（中...,英国引入弹性无薪待岗补贴制度
727,2020-05-30 04:33:00,阿里巴巴：618购物节预售的第一小时商品总预售额为2019年同期的五倍，美容类商品销售额在活动开始的七分钟内就超过5亿元人民币,阿里巴巴：618购物节预售第一小时预售额为2019年同期的五倍
728,2020-05-30 04:00:00,美股初步收盘涨跌互现，道指5月累涨近4.5%；热门中概股普涨，拼多多收涨约10%。,美股初步收盘涨跌互现
729,2020-05-30 03:53:00,人造肉生产商Beyond Meat：将很快在中国市场与百胜中国控股旗下的肯德基和必胜客签署合作协议。,Beyond Meat：将很快在中国市场与肯德基和必胜客签署合作...
730,2020-05-30 03:50:00,拼多多(PDD.O)尾盘涨幅扩大至10%,拼多多尾盘涨幅扩大至10%
731,2020-05-30 03:32:00,据意大利安莎通讯社：意大利民众将在6月3日开始活动自由。,意大利民众将在6月3日开始活动自由
732,2020-05-30 03:25:00,据微软全国广播公司节目（MSNBC）报道，刚刚，美国总统特朗普在记者会上表示，将取消给予香港的特别待遇政策豁免。 （中国日报网）,特朗普：将取消给予香港的特别待遇政策豁免
733,2020-05-30 03:10:00,道指现涨6.94点，此前跌300点，标普500指数和纳指分别上涨0.39%和0.91%。阿里巴巴上涨和2.23%，京东上涨4.43%，拼多多上涨7.65%。,美股止跌转涨 中概股普涨
734,2020-05-30 03:10:00,刚刚，美国总统特朗普召开记者会宣布，“终止”美国与世卫组织的关系。（中国日报）,特朗普：“终止”美国与世卫组织的关系
735,2020-05-30 03:04:00,离岸人民币兑美元上涨逾200点，或超过0.3%，刷新日高至7.1479元。,离岸人民币兑美元上涨逾200点
736,2020-05-30 03:00:00,谷歌取消了对2000多名合同工和临时工的招聘，以缩减开支，因为这场大流行病使全球在线广告收入大幅下降。谷歌首席财务官露丝-波拉特（Ruth Porat）上个月表示，公司今年将放缓招聘步伐，“这是因为考虑到我们正面临着一场深度和持续时间不确定的...,谷歌取消2000名合同工的工作岗位
737,2020-05-30 02:52:00,美股跌势不止，道指跌超300点。,道指跌超300点
738,2020-05-30 02:50:00,美国三大股指盘中下跌，道指复跌超200点，标普500指数跌0.4%，纳指涨幅收窄至0.22%。,美国三大股指盘中下跌
739,2020-05-30 02:47:00,WTI原油期货价格上涨1.78美元，涨幅5.28%，报35.49美元/桶；布伦特原油期货价格下跌28美分，跌幅0.8%，报35.01美元/桶。WTI原油期货5月累计涨幅88%，然较1月时65.65美元/桶高位仍下浮50%。,纽约油价收涨5% 5月累计飙涨88%
740,2020-05-30 02:39:00,推特市值两天蒸发135亿元美国总统特朗普和推特公司的矛盾还在激化。显然，特朗普签署的行政令没有“吓倒”推特，29日特朗普在推特上评论明尼阿波利斯市的抗议事件，并称“当抢劫开始时，射击就开始了”。这一言论被推特认定为“美化暴力”，目前...,硬刚！市值蒸发135亿后 推特再给特朗普推文贴标签
741,2020-05-30 02:29:00,WTI原油期货涨超6%，报35.76美元/桶。,WTI原油期货涨超6%
742,2020-05-30 02:28:00,WTI原油期货、布伦特原油期货均涨超5%。,美、布两油均涨超5%
743,2020-05-30 02:23:00,布伦特原油期货8月合约升至37美元/桶上方，日内涨幅扩大至2.3%，创3月11日以来新高。,布油8月合约升至37美元/桶上方
744,2020-05-30 02:10:00,WTI原油期货涨幅达2%，报34.31美元/桶。,WTI原油期货涨幅达2%
745,2020-05-30 02:08:00,近年来，随着债券市场改革开放进一步深化，熊猫债市场日益壮大。截至2020年5月29日，熊猫债累计发行规模已超过4000亿元。“熊猫债是指外国政府类机构、国际开发机构、境外金融机构、境外非金融企业在华发行的人民币债券。（证券日报）,熊猫债累计发行逾4000亿元 新规将完善信披要求
746,2020-05-30 02:05:00,当地时间5月28日，世界上最大的全电动飞机在华盛顿州的飞机跑道上进行首次飞行。飞机由美国塞斯纳飞机公司生产的塞斯纳卡拉万改造，可搭载9名乘客，发动机制造商MagniX与航空公司AeroTEC合作推出。,世界最大纯电动飞机首飞：可搭载9名乘客
747,2020-05-30 02:01:00,腾讯音乐涨幅扩大至3%.,腾讯音乐涨至3%
748,2020-05-30 01:58:00,腾讯将投资约2亿美元作为华纳音乐IPO的一部分。腾讯将投资约2亿美元作为华纳音乐IPO的一部分。（华尔街日报）,腾讯就收购华纳音乐股份进行洽谈
749,2020-05-30 01:52:00,布伦特原油期货8月合约日内涨幅达1%，现报36.37美元/桶。,布伦特原油期货8月合约日内涨幅达1%
750,2020-05-30 01:34:00,现货白银日内涨幅达3%，现报17.88美元/盎司。,现货白银日内涨幅达3%
751,2020-05-30 01:29:00,沪银期货主力合约上涨3.02%，报4432.00元/千克。,沪银期货主力合约涨3%
752,2020-05-30 01:18:00,美国纽约州州长科莫：纽约市将于6月8日重新开放。,纽约市将于6月8日重新开放
753,2020-05-30 01:12:00,WTI原油期货短线走高逾0.3美元，现报33.55美元/桶。,WTI原油期货短线走高逾0.3美元
754,2020-05-30 01:08:00,德纳维制药涨幅扩大至逾30%。,德纳维制药涨幅扩大至逾30%
755,2020-05-30 01:08:00,携程反弹，日内跌幅收窄至0.28%，盘中一度跌超4%。公司Q1营收同比下降42%，净亏损54亿元。,携程反弹，日内跌幅收窄至0.28%
756,2020-05-30 01:05:00,美国油服贝克休斯：美国钻井公司连续四周将石油和天然气钻井平台削减至历史最低水平。,美国钻井公司连续四周将石油和天然气钻井平台削减至历史...
757,2020-05-30 00:55:00,据领英发布的数据显示，当前全球招聘率仍远低于一年前。尽管在首先采取应对措施并摆脱疫情的中国，招聘率已与去年同期持平，但在全球最大的经济体美国，这一数字下降了约35%。,当前全球招聘率仍远低于一年前
758,2020-05-30 00:51:00,29日，广西外贸企业银企对接会在南宁举行，共有20个项目签约，总授信金额128.5亿元，其中专项授信广西国际商会会员企业100亿元。“贸促贷”金融服务项目在会上正式启动。（新华网）,广西举办银企对接会启动“贸促贷”
759,2020-05-30 00:31:00,为了应对各国央行史无前例的经济刺激计划，同时担心股市的反弹无法持续，黄金成为了许多投资者资产配置的标的。今年已经有168亿美元流向黄金ETF，仅GLD（黄金ETF-SPDR）一只ETF今年就净流入120亿美元。相较那些只对应期货持仓的基金，这类黄金基...,今年黄金ETF净流入创新高
760,2020-05-30 00:23:00,美股跌势扩大，道指刷新日低，现跌1%。,美股跌势扩大
761,2020-05-30 00:21:00,从数量上来看，外资再保险公司数量已经超过中资公司的5家，达到7家。保险业一季度偿付能力报告显示，12家再保险公司今年一季度实现保费收入442.19亿元，其中，外资再保险公司实现保费收入151.02亿元，占比34.12%，达到了2017年以来的高点。（券...,外资再保险进军加速度，12家再保险机构有7家外资，保费收...
762,2020-05-30 00:08:00,预言家对6月寄予厚望。MSCI发展中国家股票指数和一项外汇指数5月都下跌约0.2%，主权债券受到全球经济活动恢复、经济增长绿芽以及对新冠疫苗的乐观情绪推动。包括霸菱和AMP Capital Investors Ltd．在内的基金管理公司表示，随着全球需求开始回升...,新兴市场投资者对6月寄予厚望
763,2020-05-30 00:02:00,随着国内新冠疫情得到控制，希腊政府29日公布首批获准入境游客来源国名单，包含中国在内共29个国家。根据希腊政府的安排，从今年6月15日起，名单内国家旅客可搭乘国际航班从首都雅典和北部城市塞萨洛尼基入境，并在机场接受希腊卫生部门的病毒检...,希腊公布包含中国在内的首批获准入境游客来源国名单
764,2020-05-30 00:00:00,沪银期货主力合约上涨2.53%，报4411.00元/千克。,沪银期货主力合约涨2%
765,2020-05-29 23:55:00,据印度国家地震局通报，当地时间21时08分（北京时间23时38分），印度哈里亚纳邦发生里氏4.6级地震，包括首都新德里在内的周边地区有明显震感。（央视新闻）,印度发生里氏4.6级地震 新德里有明显震感
766,2020-05-29 23:52:00,COMEX期金突破1750美元/盎司，日内涨幅达1.3%。,COMEX期金突破1750美元/盎司
767,2020-05-29 23:46:00,欧股大幅收低，德国DAX指数跌1.65%报11586.85点，法国CAC40指数跌1.59%报4695.44点，英国富时100指数跌逾2%。,欧股大幅收低 德国DAX指数跌1.65%
768,2020-05-29 23:42:00,美联储主席鲍威尔：资产负债表不可能趋于无穷。通胀风险是下行的，而不是上行的。,美联储主席鲍威尔：资产负债表不可能趋于无穷
769,2020-05-29 23:42:00,在岸人民币兑美元夜盘收报7.1348元，较上一交易日夜盘收涨99个基点。成交量264.9亿美元，较上一交易日减少27.08亿美元。,在岸人民币兑美元夜盘收涨99点
770,2020-05-29 23:37:00,纽约联储GDP模型预计第二季美国经济下滑35.53%。,纽约联储GDP模型预计第二季美国经济下滑35.53%
771,2020-05-29 23:32:00,今天晚上，PlayStation中国正式在微博公布将于2020年6月5日凌晨4点在线上召开PlayStation5发布会，据微博透露，本次发布会将会公布更多PlayStation5首发的独占游戏大作，该发布会时长为一个小时。（腾讯游戏）,索尼PS5发布会将于6月5日凌晨4点线上举行：将公布更多独...
772,2020-05-29 23:29:00,WTI原油期货转涨，报33.73美元/桶，布伦特原油期货8月合约转涨，报36.09美元/桶。,WTI原油期货转涨
773,2020-05-29 23:21:00,5月29日，教育部考试中心发布公告，原定于2020年6月13日举行的全国大学英语四、六级考试延期并分两次举行，考试日期分别为7月11日和9月19日。（新京报）,今年英语四六级考试延期 分7月9月两次举行
774,2020-05-29 23:20:00,加拿大新冠肺炎确诊病例累计达88856例，此前为87902例，新冠肺炎死亡病例累计达6918例，此前为6799例。,加拿大新冠肺炎确诊病例累计达88856例
775,2020-05-29 23:00:00,接近上交所的人士告诉财新记者，T+0目前只是在研究阶段，并非立刻实施，不必过度解读。（财新）,T+0目前只是在研究阶段 不必过度解读
776,2020-05-29 22:42:00,艾伦·霍华德（ALAN HOWARD）的对冲基金今年回报率为100%。,艾伦·霍华德的对冲基金今年回报率为100%
777,2020-05-29 22:40:00,西班牙政府发布公告，西甲联赛将在6月11日复赛，7月19日完赛，首战将为塞维利亚德比。（新浪体育）,西班牙政府发布公告，西甲联赛将在6月11日复赛
778,2020-05-29 22:27:00,巴西航空工业（ERJ）短线飙升，目前上涨超11%，一度暂停交易；波音4月份取消了收购巴西航空工业公司商业部门80%股份的计划，在这之后，巴西航空工业吸引了多家公司的兴趣。据报道，中国商飞已非正式表示有意与巴西航空工业合作。俄罗斯飞机制造...,与波音的交易“破产”后，巴西航空工业公司吸引了多方兴...
779,2020-05-29 22:20:00,巴西里约热内卢市市长马塞罗·卡里维拉当地时间29日宣布，从6月1日起将分六步开放商业活动，直至8月中旬完全重新开放。这是此前一天卡里维拉代表里约市政府在与卫生部专家组以及有关各方进行会商后作出的决定。（央视新闻）,巴西：里约市长宣布分六阶段重启商业活动
780,2020-05-29 22:16:00,据印度媒体报道，5月29日，位于孟买的塔拉维贫民窟新增新冠肺炎确诊病例41例，累计确诊病例升至1715例，累计死亡病例70例。塔拉维是印度最大的贫民窟，也是亚洲最大的贫民窟之一。（央视）,5月29日位于孟买的塔拉维贫民窟新增新冠肺炎确诊病例41例
781,2020-05-29 22:12:00,为加快推动5G产业发展，河南省人民政府办公厅印发《河南省加快5G产业发展三年行动计划（2020―2022年）》。计划提出，到2022年，5G基站数量达到16.8万个，网络实现乡镇以上区域连续覆盖，基本满足应用场景需求，5G用户突破6200万户；5G配套产业...,加快5G产业发展 河南印发三年行动计划
782,2020-05-29 22:02:00,5月29日，湖北省委召开会议，传达学习十三届全国人大三次会议、全国政协十三届三次会议精神。湖北省委书记应勇指出，要在做好常态化疫情防控前提下，加快复工复产、复商复市，做好复学复课相关工作，加快生产生活秩序全面恢复；要全力做好“六保...,湖北：加快复工复产、复商复市 全力稳住经济基本盘
783,2020-05-29 22:00:00,美国5月密歇根大学消费者信心指数为72.3，预期预期为74。,美国5月密歇根大学消费者信心指数为72.3
784,2020-05-29 22:00:00,俄罗斯能源部：俄罗斯能源部长诺瓦克和伊朗能源部长进行了通话。,俄罗斯能源部：俄罗斯能源部长诺瓦克和伊朗能源部长进行...
785,2020-05-29 21:48:00,中达安5月29日晚间公告，公司成为中国移动2020年至2021年通信工程专业监理服务集中采购项目的中标候选人之一，此次中标标段的标的金额共计约5.79亿元。,中达安：预中标5.79亿元中国移动采购项目
786,2020-05-29 21:35:00,29日下午，记者从云南省落实第二批国家组织药品集中采购和使用工作新闻发布会上了解到，第二批国家集中采购药品已在云南省全面落地，中选价格与省级平台原挂网价相比，平均降幅62.75%，最高降幅95.49%，预计每年可节约采购资金近2.8亿元。（新华...,第二批国家集中采购药品全面落地云南 平均降幅62.75%
787,2020-05-29 21:30:00,道指低开约130点，美股航空股走软，波音跌3.4%，达美航空与美国航空集团跌超4%，美国联合航空跌近5%；美股社交媒体股走低，Facebook与Snap微跌，推特跌0.73%。特朗普签署了针对社交媒体公司的行政令。,美股开盘：道指低开约130点 航空股与银行股走低
788,2020-05-29 21:24:00,美联储梅斯特：没有对收益率曲线的控制作出决定。,美联储梅斯特：没有对收益率曲线的控制作出决定
789,2020-05-29 21:19:00,美联储梅斯特：经济复苏可能会很缓慢，很难想象经济形势将出现“V型”复苏。,美联储梅斯特：经济复苏可能会很缓慢
790,2020-05-29 21:11:00,根据世卫组织最新实时统计数据，截至欧洲中部夏令时间5月29日12时31分(北京时间5月29日18时31分)，全球确诊新冠肺炎5701337例，死亡357688例。,世卫组织：全球新冠肺炎确诊病例超过570万例
791,2020-05-29 21:07:00,木林森公告，控股股东孙清焕拟减持不超过6%股份。,木林森：控股股东孙清焕拟减持不超过6%股份
792,2020-05-29 21:05:00,三晖电气公告，持股7.13%股东君润恒旭拟清仓式减持。,三晖电气：持股7.13%股东君润恒旭拟清仓式减持
793,2020-05-29 21:03:00,央行：2019年给予包商银行4161亿SLF支持，曾每半小时监测相关情况。（21世纪经济报道）,央行：2019年给予包商银行4161亿SLF支持
794,2020-05-29 21:03:00,智利4月份铜产量为474880吨。,智利4月份铜产量为474880吨
795,2020-05-29 21:01:00,据日本媒体报道，有消息人士表示，中国华为公司已经储备了两年份的关键美制芯片，以保护其业务不受美国政府无理制裁的打击。（腾讯科技）,日媒：华为已储备够用两年的芯片，含英特尔CPU
796,2020-05-29 21:00:00,哔哩哔哩今日发布公告称，公司将发行总额7亿美元、2027年到期的可转换优先债券，公司拟授予票据的最初购买者额外购买至多1亿美元债券的选择权，期限为30天。此次发行债券的年利率为1.25%，自2020年12月15日开始每半年支付一次利息（每年的6月15...,哔哩哔哩宣布发行7亿美元2027年到期的可转换优先债券
