,datetime,content,title
786,2020-03-18 16:43:00,国家卫健委高级别专家组组长钟南山建议，对输入病例还是要用核酸检测，比鼻拭子、咽拭子的检查准确率更高。输入病例的感染性很强，一点都不能放松。钟南山说高度警惕输入性病例，对高发国家第一波输入病人，不要看症状，而是要做检查。 （人民日...,钟南山建议对输入病例采用核酸检测
787,2020-03-18 16:43:00,钟南山说：输入病例的感染性很强，一点都不能放松，对高发国家第一波输入病人，不要看症状，而是要检查，这是我的看法。（人民日报）,钟南山：输入病例的感染性很强 一点都不能放松
788,2020-03-18 16:42:00,据乘联会，3月第一周（1-8日）的乘用车市场零售表现较强，第一周日均零售16666辆，同比增速下降50%。第一周销量总体恢复明显。3月第二周（9-15日）的乘用车市场零售回升相对平稳。第二周日均零售21696辆，同比增速下降44%。第二周销量总体恢复明...,乘联会：中国3月第二周乘用车销量总体恢复明显
789,2020-03-18 16:37:00,乘联会：3月上半月中国乘用车零售销量同比降低47%。,乘联会：3月上半月中国乘用车零售销量同比降低47%
790,2020-03-18 16:36:00,湖北省人民政府副省长曹广晶：武汉市第一类企业可以继续复工复产，其他企业按照不早于3月20日24时前复工复产。中风险地区，第一二三类企业可继续生产和复工复产；（央视新闻）,武汉一般企业不早于3月20日24时复工复产
791,2020-03-18 16:35:00,周刊君与你共同战疫国家卫生健康委高级别专家组组长钟南山表示，下一步很快地生产出有效疫苗是当前重要任务，需要很好的国际合作。,钟南山：很快地生产出有效疫苗是当前重要任务
792,2020-03-18 16:31:00,截止收盘，沪深两市所有交易个股涨跌比为655：3060，市场总体赚钱效应为17.63%，市场走势极弱。目前两市涨停53家，其中一字板18家；盘中触及涨停后打开家数为66家，封板成功率为35%，封板成功率极低；两市跌停15家。,涨停复盘：疫苗概念股大涨 特高压板块持续活跃
793,2020-03-18 16:28:00,钟南山表示，我们同其他国家进行交流得到了很好的回应，也从别的国家那里获得了很好的意见，比如重症病人粘液很多，能否用一种雾化的方式进行缓解，这都是非常好的建议，未来会进行尝试。这个病看起来不像SARS主要在中国，新冠肺炎国外病例已经1...,钟南山：新冠肺炎国外病例估计还要增加
794,2020-03-18 16:22:00,*ST东南3月18日晚间披露业绩快报，公司2019年实现营业总收入16.46亿元，同比增长12.31%；净利润5972.23万元，同比增长48.98%。业绩同比增长系公司BOPET膜及光学膜业务大幅增长，传统薄膜差异化产品特种膜也保持稳定增长等因素所致。,*ST东南业绩快报：2019年净利同比增49%
795,2020-03-18 16:21:00,国家发改委表示，当务之急是进一步压实地方政府推进复产复工、恢复营业的主体责任，在做好疫情防控的前提下抓紧取消过度管控的做法和规定，尽快让消费热起来、让经济活起来。发改委：抓紧取消过度管控的做法和规定 尽快让消费热起来。,发改委：抓紧取消过度管控 尽快让消费热起来
796,2020-03-18 16:20:00,对国外疫情防控有什么建议？钟南山：这个世纪已经产生了3次冠状病毒事件，2003年SARS，2015年MERS，还有现在这次。冠状病毒有很强的传染性，这三种冠状病毒比较来看，致死率SARS是10%，MERS是30%，目前的新冠病毒大概在2-3%左右。SARS发生17年来...,钟南山：这个世纪已产生3次冠状病毒事件 这次准备还是不足
797,2020-03-18 16:19:00,四维图新公告，控股子公司中寰卫星导航通信有限公司通过CMMI3级评估认证，并获得CMMI3级评估认证证书，有效期至2023年1月11日。CMMI（CapabilityMaturityModelIntegration）即软件能力成熟度模型集成，是国际上用于衡量软件企业能力成熟度和项目...,四维图新：控股子公司中寰卫星通过CMMI3级评估认证
798,2020-03-18 16:19:00,钟南山：新冠肺炎死亡率高于流感，传染性高于SARS。（北京日报）,钟南山：新冠肺炎死亡率高于流感，传染性高于SARS
799,2020-03-18 16:18:00,据韩媒18日报道，韩国新增7例新冠肺炎死亡病例。截至目前，韩国新冠肺炎死亡病例累计达91例。,韩国新增7例新冠肺炎死亡病例  累计死亡91例
800,2020-03-18 16:18:00,中国央行：中国2月末央行外汇占款21.2万亿元人民币。,中国央行：中国2月末央行外汇占款21.2万亿元人民币
801,2020-03-18 16:17:00,钟南山表示，医护人员要做自我防护，要先把自己照顾好，再去抢救别人。初期在武汉由于防护意识和设备材料不够的种种原因，导致比较多的医护人员被感染，大概有3000多例，造成了很大的被动。医护人员倒下了，对士气、力量都是很大的影响。随着上...,钟南山：目前没有支持的医护人员受感染的情况
802,2020-03-18 16:15:00,3月18日，华为云发布“5G云游戏解决方案2.0”，宣布将从5个方面进行升级。华为云云游戏总经理聂凯旋介绍，鲲鹏云游戏的渲染方案将升级，同时算力升级后高清游戏在线密度并发将提高3倍，以降低平台运营成本。（新京报）,华为云发布5G云游戏解决方案2.0
803,2020-03-18 16:14:00,伦铜跌幅扩大至5.5%，在下破5000美元/吨关口后进一步走低至4863美元/吨，创2015年7月以来最大单日跌幅。,伦铜跌幅扩大至5.5%
804,2020-03-18 16:13:00,WTI原油跌至26.03美元/桶下方，刷新2003年5月以来新低。,WTI原油刷新2003年5月以来新低
805,2020-03-18 16:12:00,国家发改委就业收入分配和消费司司长哈增友表示，新型消费成为我国经济发展的新动能，下一步围绕培育发展新消费方面，将重点加快以5G网络和数据中心为重点的新一代信息基础设施建设，努力推进信息服务全覆盖。,发改委：将加快以5G网络和数据中心为重点的新一代信息基...
806,2020-03-18 16:10:00,文化和旅游部产业发展司司长高政介绍，截至3月16日，全国已有28省区市3714家A级恢复对外营业，复工率超过30%，已恢复开放景区主要为山岳型景区、开放型景区和市民公园等室外场所，总体运行平稳，未出现疫情异常情况。 （人民日报）,文旅部：全国3714家A级景区已恢复开放   全国景区复工率...
807,2020-03-18 16:10:00,钟南山表示，这段时间以来，我们学到了如何对新冠病毒进行防控，高传染性疾病都有指数系数的爆发期，新冠病毒的平均传播系数接近3，是非常高的。病毒大爆发带来了很多问题，包括病房、医护人员的缺口等等。我们学到了联防联控的预防，从源头预防...,钟南山：不能靠集体免疫解决问题
808,2020-03-18 16:10:00,【港股收评】港股午后跳水，恒指大跌4.18%，国企指数跌4.4%；蓝筹股全线飘绿，科技股、中资券商股、内房股跌幅居前，舜宇光学超11%，中国联通、中兴通讯H股跌约10%，万科企业跌逾11%。,港股收评：恒指暴跌4.18%失守23000点 科技股、内房股集体...
809,2020-03-18 16:09:00,厦门空港(600897)3月18日晚间公告，2020年2月，飞机起降4797架次，同比下降68.95%；旅客吞吐量37.43万人次，同比下降83.53%；货邮吞吐量1.19万吨，同比下降28.34%。,厦门空港：2月份旅客吞吐量同比降83.53%
810,2020-03-18 16:09:00,今日市场小幅高开后快速上冲，沪指在2810点上方遇阻回落至2800点附近，随后沪指震荡上行，午收盘时三大股指全线大涨，午后市场单边下跌，各大股指纷纷翻绿，恐慌气氛浓厚，调整直至尾盘。,机构论市：市场先扬后抑 沪指逼近前低
811,2020-03-18 16:06:00,商务部消费促进司负责人王斌3月18日表示，将会同有关部门进一步研提促进汽车、家具、家电等重点商品消费的政策措施，促进汽车限购向引导使用政策转变，支持引导各地制定奖补政策，鼓励企业开展电子产品以旧换新。（证券时报）,商务部：将会同有关部门进一步研提促进汽车等消费政策措施
812,2020-03-18 16:05:00,钟南山表示，1.新冠肺炎有很高的传染性，比SARS、MERS都高。2.死亡率高于流感。3.传染还是主要通过呼吸道传播，但不限于呼吸道传染。4.到现在为止没有有效的、特异性针对的治疗药物，还没有非常满意的针对性的治疗药物。（人民日报）,我们对新冠肺炎的了解到底有多少？钟南山回应
813,2020-03-18 16:05:00,商务部消费促进司负责人王斌表示，指导各地分区分级、分类分时开展消费促进月、防疫保供网上行、云上购物节等活动，做大双品购物节，鼓励具备条件的地区和企业在公正公开的前提下，面向特定的群体、特定的商品、特定的领域推出各类消费券、购物...,商务部：鼓励具备条件的地区推出各类消费券
814,2020-03-18 16:04:00,针对如何扩大消费的问题，国家发改委就业收入分配和消费司司长哈增友表示，将突出抓好六个方面的消费工作：第一，全力保障吃穿用基本消费；第二，培育壮大新型消费、升级消费；第三，重振文旅和餐饮消费；第四，扩容提质养老、托育等服务消费；...,国家发改委：抓好六方面工作促进消费
815,2020-03-18 16:03:00,丁香园Insight数据库显示，截至3月18日，除海正药业外，还有中国人民解放军军事医学科学院毒物药物研究所、四环制药、石药中奇、瑞阳制药、京邦制药5家企业申报的法匹拉韦临床试验获得批准。（新京报）,除海正药业外 还有4家国内企业法匹拉韦片临床试验获批
816,2020-03-18 16:02:00,波音盘前跌11.39%；波音正为航空业寻求600亿美元支持。,波音盘前跌11.39%
817,2020-03-18 16:02:00,冰岛央行将基准利率降低50个基点至1.75%。,冰岛央行将基准利率降低50个基点至1.75%
818,2020-03-18 16:01:00,欧股集体低开，欧洲斯托克50指数跌3.6%，德国DAX指数跌3.9%，英国富时100指数跌3.1%。,欧股集体低开 欧洲斯托克50指数跌3.6%
819,2020-03-18 16:00:00,特斯拉美股盘前跌超8%。特斯拉位于加州弗里蒙特的工厂将无法继续正常运营，只可维持最低限度的基本操作。,特斯拉美股盘前跌超8%
820,2020-03-18 15:58:00,文化和旅游部产业发展司司长高政：当前，外放输入已成为当前我国疫情防控的重中之重，我们将依托国务院联防联控机制，密切关注其他国家新冠肺炎疫情形势，实时与在线旅游企业和平台、旅行社等联络，采取适当的、必要的措施，阻止疫情跨国扩散。...,文化和旅游部：采取适当的、必要的措施 阻止疫情跨国扩散
821,2020-03-18 15:54:00,国家发改委就业收入分配和消费司司长哈增友表示，当务之急是进一步压实地方政府推进复产复工、恢复营业的主体责任，在做好疫情防控的前提下抓紧取消过度管控的做法和规定，尽快让消费热起来、让经济活起来。,发改委：抓紧取消过度管控的做法和规定 尽快让消费热起来
822,2020-03-18 15:52:00,希腊监管当局发布卖空禁令，直至4月24日。,希腊监管当局发布卖空禁令
823,2020-03-18 15:48:00,国家发改委将全力保障吃穿用基本消费，培育壮大新型消费和升级消费，重振文旅和餐饮消费，提质养老托育消费，全面推广健康消费。（新京报）,国家发改委将重振文旅和餐饮消费
824,2020-03-18 15:44:00,现货黄金下破1500美元/盎司，日跌幅扩大至近2%。,现货黄金日跌幅扩大至近2%
825,2020-03-18 15:44:00,尾盘港股中兴通讯跌幅扩大至10.24%，报20.15港元。,港股中兴通讯跌幅扩大至10.24%
826,2020-03-18 15:43:00,国家发改委就业收入分配和消费司司长哈增友表示，为应对疫情对消费影响，近期各地出台了一些措施，其中包括南京、宁波等地推出不同形式的消费券。“我们对此密切关注，进行跟踪分析。总的来讲，为促进国内消费回补和潜力释放，我们将指导地方落...,南京等地发消费券 发改委：支持地方推出务实措施促消费
827,2020-03-18 15:35:00,国家发展改革委就业收入分配和消费司司长哈增友3月18日介绍，在当前国外疫情加速滋生和蔓延的新情况下，集中精力扩大国内消费、培育强大国内市场正当其时、非常必要。目前，围绕着促进居民愿消费、敢消费、能消费，总共出台六个方面十九条政策措...,国家发改委：集中精力扩大国内消费、培育强大国内市场正...
828,2020-03-18 15:34:00,欧洲央行：准备好适时调整所有措施。,欧洲央行：准备好适时调整所有措施
829,2020-03-18 15:32:00,为规范交易型开放式指数基金申购、赎回业务，满足特定机构投资者资金配置需求，上海证券交易所对《特定机构投资者参与交易型开放式指数基金申购赎回业务指引》有关条款进行了修订，并将规则名称调整为“《特定机构投资者参与证券投资基金申购赎...,上交所发布《特定机构投资者参与证券投资基金申购赎回业...
830,2020-03-18 15:29:00,富时中国A50指数期货跌幅进一步扩大至3%。,富时中国A50指数期货跌幅进一步扩大至3%
831,2020-03-18 15:26:00,上金所：交易所将在3月19日恢复Ag(T+D)的交易。自2020年3月18日（星期三）收盘清算时起，Ag（T+D）合约的保证金比例由14%调整至19%，下一交易日起涨跌幅度限制由13%调整至18%。,上金所：Ag(T+D)合约涨跌幅度限制由13%调整至18%
832,2020-03-18 15:25:00,商务部消费促进司负责人王斌表示，据国家统计局统计，疫情发生后，生活必需品消费稳中有增，1至2月份食品的销售同比增长了9.7%。无接触配送、无人零售、直播零售等消费新模式、新方式快速发展，人工智能、远程办公、互联网+医疗+药店等逆势发展...,商务部：人工智能、互联网+医疗+药店等消费新模式逆势发展
833,2020-03-18 15:23:00,商务部消费促进司负责人王斌表示，疫情对消费短期影响较大，中期趋于平缓，随着国家和地方出台促进消费回补政策落地，后期消费会逐步恢复。疫情不会改变我国消费长期稳定和持续升级的发展趋势。,商务部：疫情对消费短期影响大 但消费升级趋势没变
834,2020-03-18 15:22:00,全球最大对冲基金桥水已建立140亿美元空头头寸，押注欧洲公司股票因疫情而持续暴跌。但上述押注不够多，旗舰基金今年巨亏约20%，知情人士称亏损主要是股市多头仓位和国债空头仓位所致。（一财）,最大对冲基金桥水巨亏！不是140亿美元做空吗？
835,2020-03-18 15:15:00,韩联社首尔3月18日电 被确诊感染新型冠状病毒（COVID-19）的京畿道盆唐济生医院院长上周曾出席韩国中央灾难安全对策本部主持的首都圈医院院长座谈会，这令政府部门绷紧神经。,韩一医院院长确诊感染新冠 曾出席政府座谈会
836,2020-03-18 15:12:00,国家卫生健康委新闻发言人表示，我国内地首次无新增本土疑似病例。湖北除武汉以外地区已连续13日无新增本土确诊病例，援鄂医疗队正在有序分批返程。根据世卫组织通报，目前疫情已扩散到159个国家和地区，要继续防止境外疫情输入，同时积极开展国...,国家卫健委：我国内地首次无新增本土疑似病例 要继续防止...
837,2020-03-18 15:11:00,计划提出，东北四省（区）人民政府要从现有工作基础等实际情况出发，在稳定粮食生产的前提下，积极稳妥确定保护性耕作年度实施区域和面积。优先选择已有较好应用基础的县（市、区），分批开展整县推进，用3年左右时间，在县域内形成技术能到位、...,农业农村部、财政部印发《东北黑土地保护性耕作行动计划...
838,2020-03-18 15:10:00,巴基斯坦新冠肺炎病例增至241例。,巴基斯坦新冠肺炎病例增至241例
839,2020-03-18 15:09:00,记者获悉，为尽快扩大新冠病毒检测能力，协助实验室与商业企业在公共卫生紧急情况下加速开发新型冠状病毒（COVID-19）诊断测试产品，北京时间3月17日晚，美国FDA出台了新冠病毒检测产品紧急注册上市指导政策 （《Policy for Diagnostic Tests fo...,美FDA出台新冠病毒检测产品紧急注册上市指导政策
840,2020-03-18 15:08:00,记者从国家知识产权局获悉，涉疫非正常商标申请得到有效处置。截至3月16日，国家知识产权局在管控的累计1580余件涉及疫情的商标申请中，依法驳回328件，准予申请人主动撤回866件，并组织地方执法部门对相关申请人和代理机构进行约谈、整改和处理...,国家知识产权局：已驳回328件涉疫非正常商标申请
841,2020-03-18 15:08:00,印度SENSEX指数、NIFTY指数跌幅均超4%。,印度SENSEX指数、NIFTY指数跌幅均超4%
842,2020-03-18 15:08:00,新华社发表时评文章称，新冠肺炎疫情防控中，数字工具发挥了重要作用。个人健康码、远程医疗、在线办公、企业“码上复工”等数字工具广泛应用，从政府决策部署，到企业复工、社会运转，数字“基础设施”功能凸显。当前5G网络、数据中心等新型基...,新华时评：让“新基建”释放新动能
843,2020-03-18 15:06:00,俄罗斯卢布兑美元盘初跌幅迅速扩大至1.9%，创2016年2月以来新低。,俄罗斯卢布兑美元盘初创2016年2月以来新低
844,2020-03-18 15:02:00,国内期市午后大幅跳水，有色品种领跌大市。沪铜、沪铅、沪锡跌停，沪锌跌5%；沪银再次大跌6.5%；原油跌超4%，燃油、沥青均跌超5%。,内盘期货收盘普跌 有色板块上演跌停潮
845,2020-03-18 15:01:00,欧洲汽车生产协会：今年至今欧洲汽车销售创2013年以来最差表现。,今年至今欧洲汽车销售创2013年以来最差表现
846,2020-03-18 15:00:00,【收盘气象】指数午后单边下挫，尾盘集体跌逾1%，证券等大金融板块领跌，早盘活跃的养殖业、光刻胶等概念均明显回落，两市个股跌多涨少，北向资金净流出近60亿。,收评：指数集体跌逾1% 大金融板块领跌
847,2020-03-18 14:54:00,此前被曝出“减配门”后，现据特斯拉介绍，目前特斯拉各大门店已展开更换服务，并已为上百位车主完成自动驾驶计算机硬件3.0（HW3.0）的升级更换。另据特斯拉门店服务人员，若现在开始订购特斯拉Model 3，届时交付版本将不会出现类似情况。值得一...,“减配门”后续 特斯拉称已免费为上百位车主升级芯片
848,2020-03-18 14:49:00,富时中国A50指数期货跌幅扩大至2%。,富时中国A50指数期货跌幅扩大至2%
849,2020-03-18 14:45:00,据市场研究公司Bianco Research统计，周二（3月17日），美国30年期债券回报为-5.91%，为历史第二低，最低是出现上周3月10日（-6.66%）。而该债券回报最佳日出现在3月6日（+8.50%），第三高回报日是3月9日（6.72%），第四高回报日是3月16日（+5.9...,疯狂3月：美30年期债券历史最佳日回报和最差回报均出现在...
850,2020-03-18 14:43:00,三大指数尾盘均跌超1%，证券股领跌。,三大指数尾盘均跌超1%
851,2020-03-18 14:43:00,同花顺数据显示，北向资金净流出逾60亿元，其中沪股通净流出逾32亿元。,北向资金净流出逾60亿元
852,2020-03-18 14:41:00,哈萨克斯坦表示不会在4月增加原油产量。（国际文传电讯社）,哈萨克斯坦表示不会在4月增加原油产量
853,2020-03-18 14:41:00,证券板块持续走弱，华鑫股份逼近跌停，南京证券跌7%，长城证券、华林证券跌6%。,证券板块持续走弱
854,2020-03-18 14:40:00,港股中资券商股持续下挫。中金跌4.26%，中信证券跌3%，光大证券跌2.55%，海通证券跌2.4%。,港股中资券商股持续下挫
855,2020-03-18 14:37:00,亚太股市收盘多数下跌，韩国综合指数跌4.86%，报1591.20点，为2010年5月末以来首次跌破1600点关口；日经225指数收盘跌1.68%，报16726.55点；澳大利亚ASX200指数收跌6.43%，报4953.2点；新西兰NZX50指数涨0.10%，报9454.89点。,亚太股市收盘多数下跌 韩国综合指数跌4.86%
856,2020-03-18 14:32:00,恒指午后持续下挫，现跌逾3%；本地蓝筹地产股、苹果概念股跌幅居前，长实集团跌逾7%，舜宇光学科技跌逾10%，瑞声科技跌逾8%。,恒指跌逾3%
857,2020-03-18 14:21:00,美国制裁叙利亚国防部长。（新华社）,美国制裁叙利亚国防部长
858,2020-03-18 14:21:00,银保监会18日通报了中国人民人寿保险股份有限公司、中国农业银行股份有限公司和中国邮政储蓄银行股份有限公司三家银行保险机构的行政处罚。 银保监会对人保寿险共计罚款338万元，对农业银行共计罚款200万元，对邮储银行共计罚款80万元。,人保寿险、农业银行和邮储银行因侵害消费者权益遭行政处罚
859,2020-03-18 14:20:00,甘肃免征中小微企业5个月社保费。（新华社）,甘肃免征中小微企业5个月社保费
860,2020-03-18 14:19:00,沪指跌幅扩大至1%，创业板指跌0.5%，证券、保险板块领跌。,沪指跌幅扩大至1%
861,2020-03-18 14:17:00,韩国首尔综指跌超4%至2010年以来新低。,韩国首尔综指跌超4%
862,2020-03-18 14:15:00,3月18日，网商银行行长金晓龙接受媒体采访时表示，疫情对业务客观来讲有一些冲击。如部分客户因为经营困难，到期还款率没有以前那么高，不良率可能有些上升，但上升的速度和趋势是意料之中的，甚至部分好于预料。同时，今年利润可能会比去年降低...,网商银行金晓龙谈疫情冲击：不良率甚至好于预料
863,2020-03-18 14:11:00,北向资金净流出达50亿元。,北向资金净流出达50亿元
864,2020-03-18 14:09:00,韩国总统文在寅当地时间18日邀请政界、财界、劳动界、金融界、小工商人士代表、市民代表等在总统府青瓦台举行圆桌会议，与各方就新冠肺炎疫情等相关情况交换意见，并呼吁凝聚力量抗疫情、保经济。（央视新闻）,韩国总统文在寅邀各界举行圆桌会议 共商“抗疫救市”
865,2020-03-18 14:03:00,国债期货10年期主力合约涨0.21%，报100.935点。5年期涨0.15%，报101.645点。2年期涨0.09%，报101.110点。,国债期货拉升 10年期涨0.21%
866,2020-03-18 14:02:00,天眼查数据显示，近日，腾讯于天津成立新公司天津腾讯网络技术有限公司。天津腾讯网络技术有限公司注册资本2亿元，董事长、法定代表人为腾讯副总裁姚星，公司经营范围包括技术服务、技术开发、技术咨询、技术交流、技术转让、技术推广；计算机及...,腾讯出资2亿元天津成立新公司
867,2020-03-18 14:01:00,MSCI亚太（除日本）指数跌幅扩大至2%。,MSCI亚太（除日本）指数跌幅扩大至2%
868,2020-03-18 13:57:00,欧股期货跌势扩大，英国富时100指数跌4.7%，德国DAX指数跌4.2%。,欧股期货跌势扩大
869,2020-03-18 13:56:00,欧洲斯托克50指数期货跌超4%，英国富时100指数期货跌4.5%，德国DAX指数期货跌4%。,欧洲斯托克50指数期货跌超4%
870,2020-03-18 13:55:00,A股三大指数集体翻绿，沪指跌0.6%。养殖业、特高压、光刻胶等集体回落，券商股领跌。,A股三大指数集体翻绿
871,2020-03-18 13:54:00,现货白银跌幅一度扩大至2%，报12.22美元/盎司。,现货白银跌幅一度扩大至2%
872,2020-03-18 13:53:00,南非约翰内斯堡证券交易所CEO：不准备关闭（股票）市场。,南非不准备关闭股票市场
873,2020-03-18 13:53:00,恒指跌幅扩大至2%，苹果概念板块跌幅居前；恒指早盘一度涨约0.65%。,恒指跌幅扩大至2%
874,2020-03-18 13:49:00,沪铜期货主力合约跌停，跌幅为6.02%，报39960.00元/吨。,沪铜期货主力合约跌停
875,2020-03-18 13:48:00,沪锡期货主力合约跌停，跌幅为6.01%，报117390.00元/吨。,沪锡期货主力合约跌停
876,2020-03-18 13:48:00,英国首相鲍里斯·约翰逊17日表示，英国必须像“战时政府”那样应对新冠肺炎疫情。他宣布组建一个新的“大臣级结构”：由四个新的委员会来加强政府的应对措施，分别负责卫生、公共部门准备、经济和国际反应，由首相鲍里斯·约翰逊和四个委员会的...,英国首相：必须像“战时政府”那样抗击疫情
877,2020-03-18 13:47:00,沪银期货主力合约下跌6.14%，报3014.00元/千克。沪铜跌近5%。,沪银期货主力合约大跌6%，沪铜跌近5%。
