,datetime,content,title
0,2020-06-01 23:44:00,克里姆林宫：俄罗斯总统普京与特朗普进行了电话交流，讨论了新冠肺炎疫情与七国集团峰会问题，还有关于欧佩克+协议以支持油市发展的问题。,克里姆林宫：俄罗斯总统普京与特朗普进行了电话交流
1,2020-06-01 23:40:00,当地时间6月1日，美国共有26个州以及首都华盛顿特区已经启用国民警卫队应对全国范围内的示威活动。目前有超过1.7万名国民警卫队对员派驻各地辅助地方当局维持治安。此外，截至5月31日晚间，全美至少40个城市宣布宵禁，另有亚利桑那州、得克萨斯...,美国超半数州府启动国民警卫队 40城宣布宵禁
2,2020-06-01 23:39:00,美国纽约州州长科莫：纽约州昨日进行了5万次新冠肺炎检测，新增约1千例确诊病例，新增54例死亡病例。,纽约州昨日进行了5万次新冠肺炎检测 新增约1千例
3,2020-06-01 23:37:00,欧洲主要股指多数收涨，英国富时100收涨逾1.5%，法国CAC40收涨1.5%，德国DAX30收跌1.6%。,欧洲主要股指多数收涨
4,2020-06-01 23:31:00,根据美国约翰斯·霍普金斯大学的实时统计数据显示，全球新冠肺炎确诊病例累计超620例，死亡病例超37万例。其中，美国确诊病例累计超179万，死亡病例超10.4万；巴西确诊病例累计超51万，死亡超2.9万；俄罗斯确诊病例累计超41万，死亡4855千人。,全球新冠肺炎确诊病例累计超620万
5,2020-06-01 23:28:00,道指和标普500指数转跌，纳指涨幅收窄至0.15%。,道指和标普500指数转跌
6,2020-06-01 23:22:00,唐德影视：将非公开发行不超过1.257亿股股票，发行价为3.94元/股。公司实际控制人吴宏亮与易通公司于2020年6月1日签署了《股份转让协议（易通公司）》及《表决权委托协议》。公司股票将于6月2日（周二）开市起复牌。,唐德影视：吴宏亮与易通公司签署了转让协议，公司股票将...
7,2020-06-01 23:18:00,唐德影视6月1日晚公告，浙江易通、东阳聚文拟受让吴宏亮所持公司的部分股份，同时吴宏亮不可撤销的将其所持公司剩余部分股份的表决权委托给浙江易通，且浙江易通、东阳聚文现金认购上市公司非公开发行新股。公司控股股东将变更为浙江易通，公司...,唐德影视：控股股东将变更为浙江易通 实控人将变更为浙江...
8,2020-06-01 23:10:00,西班牙新冠肺炎累计确诊病例达239638例，累计死亡27127例。,西班牙新冠肺炎累计确诊病例达239638例
9,2020-06-01 23:09:00,南非新增1674名新冠肺炎确诊病例，累计确诊34357例。,南非新增1674名新冠肺炎确诊病例
10,2020-06-01 23:06:00,加拿大新冠肺炎累计确诊病例达91351例（上日为90516例），累计死亡病例达7305例（上日为7092例）。,加拿大新冠肺炎累计确诊病例达91351例
11,2020-06-01 23:03:00,布伦特原油原油期货6个月期货溢价为3月6日以来新低。,布伦特原油原油期货6个月期货溢价为3月6日以来新低
12,2020-06-01 22:59:00,今天（6月1日）晚上，省委书记巴音朝鲁来到长春市朝阳区桂林胡同，调研夜经济发展情况。他强调，要深入贯彻全国两会特别是习近平总书记重要讲话精神，全面落实“六保”“六稳”工作举措，在严格抓好常态化疫情防控的同时，坚持因地制宜，加强统...,巴音朝鲁：做大做强夜经济 培育激发新活力 为稳增长促就...
13,2020-06-01 22:58:00,智利新增新冠肺炎确诊病例5471例，累计确诊病例突破10万例。,智利新增新冠肺炎确诊病例5471例
14,2020-06-01 22:55:00,海关总署近日公布2020年1至5月海关查发的部分进口儿童用品质量安全不合格情况，共有服装、玩具等6类41批次进口儿童用品，涉及Zara、H&M、拉尔夫劳伦、乐高等品牌，查发的不合格进口儿童用品均依法依规采取退运等处置措施。,海关公布进口不合格儿童用品 涉及乐高等品牌
15,2020-06-01 22:52:00,据葡萄牙卫生部消息：葡萄牙累计确诊32700例新冠肺炎病例。（卫星新闻）,葡萄牙累计确诊32700例新冠肺炎病例
16,2020-06-01 22:48:00,当地时间1日，俄总统普京向外界表示，俄罗斯将在7月1日举行修宪全民公投。受疫情影响，原定于4月22日举行的全民修宪公投延期举行。俄罗斯联邦委员会3月11日通过俄宪法修正案草案。,普京：7月1日将举行修宪全民公决投票
17,2020-06-01 22:45:00,伊拉克新增新冠肺炎确诊病例429例，累计确诊6868例。,伊拉克新增新冠肺炎确诊病例429例
18,2020-06-01 22:44:00,截至5月31日，年内券商投行IPO承销合计收入52.39亿元，同比增长107.7%。几家欢喜几家愁，对部分投行来说，今年仍是IPO承销保荐颗粒无收的一年。据统计，目前93家具有承销保荐业务资格的券商中，有57家企业在今年的IPO承销大战中毫无斩获，占比超...,又一项榜单出炉：六成券商今年来没有一单IPO承销收入
19,2020-06-01 22:35:00,据格力电器消息，董明珠携3万家门店直播，截至22时03分，销量破50亿。,格力电器6.1直播战报：截至22时03分 销量破50亿
20,2020-06-01 22:29:00,据预测，2025年广东省全社会用电量将达9000亿千瓦时。中国南方电网公司6月1日通报，将建设包括25项关键工程在内的目标网架工程，提升远期粤港澳大湾区电力供应保障能力。据悉，25项关键工程已悉数列入广东省重点建设项目计划，预计2025年底前将...,南方电网建25项工程提升大湾区远期电力保障能力
21,2020-06-01 22:29:00,*ST华映公告，公司拟受让控股子公司华映光电股份有限公司所持有的福州华映视讯有限公司100%股权及科立视材料科技有限公司的5.98%股权。福州视讯100%股权的交易价格为8307.96万元；科立视5.98%股权的交易价格为4731.45万元。本次交易不会导致公司...,*ST华映拟收购福州视讯与科立视部分股权
22,2020-06-01 22:27:00,Zoom Video涨近11%，继上一日创收盘纪录新高后再创盘中纪录新高，股价逼近200美元，市值超过550亿美元，该股今年迄今以来累涨逾190%。,Zoom Video涨近11%
23,2020-06-01 22:15:00,当地时间5月30日，马尔代夫旅游局发布声明称，计划在2020年7月起重新开放边境。马尔代夫旅游局强调，游客进入马尔代夫将不被收费，也不会被收取其他额外费用。,马尔代夫计划7月起重新开放边境 游客进入马尔代夫将不被收费
24,2020-06-01 22:08:00,财政部网站1日消息，财政部发布《关于做好2020年电子商务进农村综合示范工作的通知》，通过中央财政资金引导带动社会资本，共同参与农村电子商务工作。财政资金重点支持农产品进城，兼顾工业品下乡，对承担疫情防控相关重要物资保供任务、且工作...,财政部发文 电子商务进农村将获中央财政资金大力支持
25,2020-06-01 22:05:00,蔚来汽车涨约3%，报4.095美元。,蔚来汽车涨约3%
26,2020-06-01 22:05:00,随着欧洲多个国家新冠肺炎疫情趋缓，旅游业也逐步开始复苏。意大利著名景点罗马斗兽场在关闭84天后，从当地时间6月1日上午开始对游客重新开放。,意大利罗马斗兽场关闭84天后重新向公众开放
27,2020-06-01 22:04:00,6月1日格力电器遭深股通净卖出3.60亿元，为连续3日净卖出，合计净卖出5.44亿元，期间股价上涨3.08%。,格力电器遭深股通连续3日净卖出 合计净卖出5.44亿元
28,2020-06-01 22:02:00,6月1日，vivo X50系列旗舰手机与TWS Neo真无线耳机亮相。vivo X50系列全系搭载汇顶科技的屏下光学指纹识别方案和系列音频解决方案。此外，vivo TWS Neo真无线耳机，也采用汇顶科技入耳检测和触控二合一方案，该方案除了能实现精准佩戴检测之外，...,vivo X50系列发布 搭载汇顶科技屏下光学指纹方案
29,2020-06-01 21:54:00,穆迪下调印度评级至Baa3，此前为Baa2。,穆迪下调印度评级至Baa3
30,2020-06-01 21:53:00,业内第一只以女性消费为主题的公募基金将于近期发行。该基金由博时基金管理管理公司简发行，渣打中国独家代销。这也是中国投资市场首次明确出现女性消费这一领域。,业内首只女性消费主题基金将于近期发行
31,2020-06-01 21:51:00,美股三大指数悉数翻红，纳指现涨0.18%。,美股三大指数悉数转涨
32,2020-06-01 21:46:00,美股三大股指短线小幅上扬。道指现跌50点，纳指涨0.22%，标普500指数微跌0.01%。,美股三大股指短线小幅上扬
33,2020-06-01 21:33:00,辉瑞(PFE.N)跌超7%；此前该公司表示，其乳腺癌治疗方法不太可能达到晚期研究的主要目标。,辉瑞跌超7%
34,2020-06-01 21:31:00,美股开盘，道指开跌约40点；吉利德科学开跌2.97%，公司宣布中度新冠患者使用瑞德西韦的3期临床试验结果。,美股开盘：道指开跌约40点 吉利德科学开跌2.97%
35,2020-06-01 21:28:00,6月1日，国寿集团在中国保险行业协会网站发布举牌公告称，5月26日公司增持农业银行H股600万股，交易完成后，国寿集团及一致行动人合计持有农业银行H股30.75亿股，占比10.002%，触发二次举牌。,国寿集团再增持600万股农业银行H股 触发二次举牌
36,2020-06-01 21:27:00,市场消息：刚果（金）官员表示，有4人死于埃博拉疫情爆发。,刚果（金）官员：有4人死于埃博拉疫情爆发
37,2020-06-01 21:23:00,近日，工业富联、中信控股、中信戴卡、华润水泥在北京签署合资协议暨项目合作框架协议。各合作方拟共同出资设立工业互联网平台公司，打造垂直行业工业互联网平台，向汽车零部件行业、水泥等建筑材料行业提供智能制造及工业互联网技术解决方案服...,工业富联、中信控股等拟成立合资公司 打造工业互联网平台
38,2020-06-01 21:19:00,据行业信息网站监测，近日国内有机硅价格持续调涨，截至上周末，DMC一周涨幅达800元/吨。6月单体装置检修计划较多，主流厂家大部分有检修计划，整体供给明显受限。下游整体需求虽不尽人意，但已有逐步回暖迹象。综合来看，在供给收缩预期及下游...,6月单体装置检修计划增多 国内有机硅价格持续上涨
39,2020-06-01 21:14:00,美布两油短线跌幅进一步扩大，WTI原油跌超3%，报34.36美元/桶，布伦特原油跌超1.5%，报37.24美元/桶。,美布两油短线跌幅进一步扩大
40,2020-06-01 21:14:00,平治信息公告，公司拟非公开发行A股股票。本次非公开发行股票的发行价格为40元/股。本次非公开发行股票募集资金总额不超过人民币10亿元，扣除发行费用后的募集资金净额将全部用于补充流动资金。本次非公开发行对象为浙江文投，发行对象均以现金...,平治信息：拟向浙江文投定增募资不超过10亿元 实控人将变...
41,2020-06-01 21:12:00,东旭光电：出售芜湖装备持有的芜湖东旭威宇医疗器械科技有限公司45.23%的股权；同意公司收购控股股东东旭集团有限公司的全资子公司东旭科技发展有限公司位于北京大兴区汇营路 15 号院的资产作为东旭光电研发中心的研发基地及专家公寓，包括 8629...,东旭光电：出售芜湖装备持有的芜湖东旭威宇医疗器械科技...
42,2020-06-01 21:10:00,WTI原油期货跌幅扩大至2.7%，现报34.58美元/桶，布伦特原油跌超1%，报37.48美元/桶。,WTI原油期货跌幅扩大至2.7%
43,2020-06-01 21:09:00,居然之家：子公司家居连锁拟与公司控股股东居然控股签署股权转让协议，以3.35亿元的交易对价收购居然小贷100%股权，以1亿元的交易对价收购居然担保100%股权；与居然控股全资子公司居然金控签署《资产转让协议》，以3400万元的交易对价收购其持有...,居然之家：以3.35亿元的交易对价收购居然小贷100%股权
44,2020-06-01 21:08:00,远兴能源6月1日晚间公告，公司拟使通过集中竞价交易方式回购公司部分股份，回购资金总额为7.5亿元至15亿元，回购价格不超过2.6元/股。按回购价格上限2.6元/股测算，回购7.5亿元、15亿元对应的回购比例为7.40%、14.79%。远兴能源当日报收1.69元。,远兴能源：拟7.5亿元至15亿元回购股份
45,2020-06-01 21:08:00,江苏2020年度省级体育产业发展专项资金申报、评审工作全面启动，本年度专项资金将对新冠肺炎疫情防控有突出贡献的体育企业申报项目适当倾斜。（证券时报）,江苏：体育产业发展专项资金将适当向疫情防控突出贡献企...
46,2020-06-01 21:06:00,华通医药：公司拟发行股份购买浙农集团股份有限公司 100%股权，根据标的资产补充评估报告，截至 2019 年 12 月 31 日，标的资产的评估值为 27.46亿元。,华通医药：公司拟发行股份购买浙农集团股份有限公司 100%...
47,2020-06-01 21:05:00,达达：京东、沃尔玛表示有兴趣认购公司发行的ADS，认购规模分别为至多6000万美元、3000万美元。,达达：京东、沃尔玛表示有兴趣认购公司发行的ADS
48,2020-06-01 21:02:00,WTI原油短线下挫0.3美元/桶，跌幅1.52%，失守35美元/桶，布伦特原油微跌0.18%，现报37.84美元/桶。,WTI原油短线下挫0.3美元/桶
49,2020-06-01 21:01:00,中兴通讯发布公告称，公司董事会收到公司股东中兴新通讯有限公司提交的一项临时提案，提案为选举新独立非执行董事。中兴通讯表示，由于此前独立非执行董事YumingBao（鲍毓明）提出由于个人原因辞去本公司独立非执行董事职务以及所担任的董事会下...,中兴通讯：鲍毓明辞职导致独董少于法定人数
50,2020-06-01 20:58:00,特  力Ａ：全资子公司深圳市汽车工业贸易有限公司，拟参与东风特种商用车有限公司所持深圳东风汽车有限公司50%股权的公开转让竞拍，公示的转让价格为1.86亿元。汽车工贸现持有深圳东风25%股权，如交易成功，将构成重大资产重组，汽车工贸将成为...,特  力Ａ：参与深圳东风汽车有限公司50%股权转让竞拍
51,2020-06-01 20:57:00,西部牧业6月1日晚间披露重大资产重组预案，公司拟以发行股份方式购买天山广和100%股权并募集配套资金，交易作价尚未确定。交易对方中，石河子国资为公司控股股东。天山广和主营奶牛养殖，并对外供应生鲜乳，公司将借助此次交易实现对饲料生产与...,西部牧业：拟收购天山广和 打通乳业产业链
52,2020-06-01 20:53:00,中集集团：获中信保诚人寿保险有限公司举牌，持股达到5.19%。,中集集团：获中信保诚人寿保险有限公司举牌，持股达到5.19%
53,2020-06-01 20:52:00,华东重机6月1日晚间披露公开发行可转债预案，拟发行总额暂定不超过12.48亿元，投资于集装箱装卸设备生产基地技改升级项目、重庆新润星高端装备产业园二期项目并补充流动资金。,华东重机：拟发行可转债募资不超12.48亿元
54,2020-06-01 20:52:00,莱美药业6月1日晚公告，公司股东邱炜合计持有公司股票2147万股（占公司总股本的2.64%）将于5月30日10时至5月31日10时（延时的除外）在“京东网”公开拍卖，根据京东网司法拍卖网络平台页面显示的拍卖结果，首轮拍卖流拍。,莱美药业：股东邱炜所持2147万股公司股份司法拍卖流拍
55,2020-06-01 20:51:00,神州泰岳：拟定增募资不超过10.24亿元，用于物联网产品生产基地项目、新款游戏开发及运营建设项目、5G技术研发项目、研发中心建设项目和补充流动资金。,神州泰岳：拟定增募资不超过10.24亿元
56,2020-06-01 20:50:00,途牛盘前跌约6%；该股上一交易日收跌逾9%。,途牛盘前跌约6%
57,2020-06-01 20:47:00,精华制药6月1日晚间公告，控股子公司森萱医药为新三板创新层挂牌企业，森萱医药6月1日收到股转公司出具的《受理通知书》，其报送的股票公开发行并在精选层挂牌的申请文件符合相关要求，股转公司决定予以受理。精华制药持有森萱医药84.14%股份。,精华制药：子公司森萱医药精选层挂牌申请获受理
58,2020-06-01 20:45:00,博思软件：公司正筹划发行股份购买资产事项，同时募集配套资金，公司股票6月2日起停牌。交易标的为公司控股子公司北京博思致新互联网科技有限责任公司剩余49%股权。,博思软件：公司正筹划发行股份购买资产事项 股票6月2日起...
59,2020-06-01 20:43:00,西部牧业：经向深圳证券交易所申请，公司股票将于 2020 年 6 月 2 日（星期二）开市起复牌。,西部牧业：公司股票将于2020年6月2日开市起复牌
60,2020-06-01 20:41:00,巨头激战618！董明珠新晋带货女王，一句笑翻股东大会。iPhone 5小时疯卖5亿，这些股要嗨！,巨头激战618！董明珠新晋带货女王 
61,2020-06-01 20:40:00,沙特新增1881例新冠肺炎确诊病例，周日为新增1877例。,沙特新增1881例新冠肺炎确诊病例。
62,2020-06-01 20:38:00,江丰电子6月1日晚间公告，公司重大资产重组事项日前未获得证监会通过，公司拟继续推进此次重大资产重组事项。此次重组，江丰电子拟收购Silverac Stella的100%股权。,江丰电子：继续推进重大资产重组事项
63,2020-06-01 20:38:00,中京电子6月1日晚间公告，全资子公司中京科技获得武器装备质量管理体系认证证书，表明中京科技产品质量管理体系已符合武器装备质量管理体系的国家军用标准，满足军用PCB的制造要求。,中京电子：全资子公司获认证 满足军用PCB制造要求
64,2020-06-01 20:38:00,乐歌股份6月1日晚间公告，公司实控人姜艺于5月19日至29日期间，合计增持公司股份88.85万股，增持股份数占公司已发行总股本的1.02%，姜艺未来不排除继续增持的可能性。,乐歌股份：实控人增持公司约1%股份
65,2020-06-01 20:34:00,国家广播电视总局局长聂辰席主持召开广电总局党组会议，会议要求，加强统筹协调，积极推动全国有线电视网络整合、广电5G建设一体化发展等年初确定的各项任务，加快实施“广播电视迭代行动计划”，完善政策措施调动行业积极性，努力在扩大内需、...,广电总局：积极推动全国有线电视网络整合、广电5G建设一...
66,2020-06-01 20:33:00,吉利德科学宣布在新冠肺炎患者中使用瑞德西韦的第三阶段试验结果，有65％的患者可能出现改善,吉利德科学宣布在新冠肺炎患者中使用瑞德西韦有65％的患...
67,2020-06-01 20:32:00,天齐锂业(002466)近两个交易日连续涨停，公司6月1日晚披露股价异动公告称，公司不存在应披露而未披露信息。基于目前公司高负债情形下带来的流动性紧张现状，公司正积极与各合作银行沟通缓解公司流动性的措施。公司控股股东、实控人、公司董事会...,天齐锂业：正加快论证各类股权融资工具的可行性
68,2020-06-01 20:32:00,吉利德科学美股盘前直线下跌，现跌3.6%。吉利德科学宣布在新冠肺炎患者中使用瑞德西韦的第三阶段试验结果，有65％的患者可能出现改善。,吉利德科学美股盘前直线下跌
69,2020-06-01 20:28:00,爱司凯筹划重组收购金云科技，或将成为创业板借壳首例，公司股票近9个交易日连续涨停。爱司凯6月1日晚披露风险提示公告称，金云科技是否符合《首次公开发行股票并在创业板上市管理办法》相关规定存在不确定性的风险；此次交易存在因公司股价的异...,近9个交易日连续涨停 爱司凯提示风险
70,2020-06-01 20:27:00,大族激光公告，为进一步拓宽公司融资渠道，公司董事会授权公司经营层启动分拆大族数控至境内证券交易所上市的前期筹备工作。,大族激光：公司经营层启动分拆大族数控至境内证券交易所...
71,2020-06-01 20:26:00,佛山照明：公司通过集中竞价交易方式或大宗交易方式减持部分国轩高科股票，减持数量不超过 33880580 股，占国轩高科目前总股本的 3%。,佛山照明：减持部分国轩高科股票
72,2020-06-01 20:24:00,6月1日，据中新网报道，“中国总资产”、“户均总资产”成为网络热议话题。国家统计局称，总资产是全社会资产总和，不全是居民家庭资产。总资产不是净资产，扣除负债才是净资产。据中国社会科学院相关研究成果，2016年总资产为1211万亿元，负债7...,统计局回应中国总资产超1300万亿元：社会总资产不等于家...
73,2020-06-01 20:22:00,韩正在推进海南全面深化改革开放领导小组全体会议上强调，把握好分步骤分阶段的实施节奏，扎实稳妥推进海南自由贸易港建设。（新华社）,韩正：扎实稳妥推进海南自由贸易港建设
74,2020-06-01 20:16:00,央行：再创设两个直达实体经济的货币政策工具，普惠小微企业贷款延期支持工具预计可以支持地方法人银行延期贷款本金约3.7万亿元；普惠小微企业信用贷款支持计划预计可带动地方法人银行新发放普惠小微企业信用贷款约1万亿元。,央行解析创新直达实体经济的货币政策工具
75,2020-06-01 20:14:00,克明面业：公司于2020年5月29日与北京刘涛演艺文化中心签署《代言服务合同》，聘请刘涛女士担任公司“陈克明”品牌面条、小包装面粉代言人。,克明面业：聘请刘涛女士担任公司“陈克明”品牌面条、小...
76,2020-06-01 20:09:00,证监会党委传达学习贯彻全国两会精神：要深化资本市场改革，稳步推进资本市场开放，化危为机，切实加强风险防控，促进资本市场平稳运行；把保护投资者合法权益贯穿于资本市场改革发展稳定各项工作之中，严厉打击上市公司财务造假等违法违规行为...,证监会：严厉打击上市公司财务造假等违法违规行为
77,2020-06-01 20:08:00,盛运环保6月1日晚间公告，公司股票已连续20个交易日收盘价格均低于股票面值（即1元），公司股票自6月2日起停牌并存在被终止上市的风险。盛运环保同时公告，公司重大资产重组交易方案基本确定，各方也正准备提交审议相关材料。但因前述终止上市风...,盛运环保：面临退市风险 明起停牌
78,2020-06-01 20:07:00,网易(NTES.O)美股盘前涨1.5%；网易晚间宣布，在港上市发售价上限为126港元/股。,网易美股盘前涨1.5%
79,2020-06-01 20:03:00,掌趣科技公告， 公司拟以自有资金1亿-2亿元回购股份，回购价格为不超过8.61元/股，回购期限，自董事会审议通过之日起12个月内；回购用途，用于实施股权激励计划或员工持股计划。,掌趣科技：拟以1亿-2亿元回购股份
80,2020-06-01 20:03:00,完美世界6月1日晚间公告，德清骏扬企业管理咨询合伙企业（简称“德清骏扬”）减持计划已实施完毕，期间累计减持公司2585.11万股股份，减持比例2%，持股比例降至约4.999997%，不再是公司持股5%以上的股东。完美世界同时披露回购进展，截至5月31日...,完美世界：德清骏扬减持公司2%股份
81,2020-06-01 20:00:00,盛运环保公告，公司股票已连续20个交易日收盘价格均低于股票面值，根据《深圳证券交易所创业板股票上市规则》的有关规定，公司股票自2020年06月02日开市起停牌，公司股票存在被终止上市的风险。,盛运环保：股票面临退市风险 明起停牌
82,2020-06-01 19:59:00,据日经新闻，华为与联发科洽谈购买更多芯片。,华为与联发科洽谈购买更多芯片
83,2020-06-01 19:57:00,中共中央、国务院印发《海南自由贸易港建设总体方案》，根据方案内容，我们从大量优惠政策中精选出干货60条>>>,海南自由贸易港政策干货精选60条！
84,2020-06-01 19:55:00,首钢股份公告，公司拟在境内面向专业投资者公开发行总额不超过100亿元人民币的公司债券。本次公司债券的募集资金扣除发行费用后拟用于补充流动资金、偿还公司有息债务以及法律法规允许的其他用途。,首钢股份：拟发行不超过100亿元的公司债券 用于补充流动...
85,2020-06-01 19:46:00,三大股指期货微幅下跌；因抗议活动，全美40个城市发布宵禁令，15个州出动国民警卫队；网易将赴港二次上市，美股盘前涨1.5%；苹果拟6月3日重启东京旗舰店。,美股盘前必读：三大股指期货微幅下跌 网易将赴港二次上市
86,2020-06-01 19:44:00,山东路桥6月1日晚间公告，公司全资子公司路桥投资拟通过收购存量股权并增资的方式，收购中铁隆工程集团有限公司（简称“中铁隆”）控股权，交易总额3.56亿元。交易后，路桥投资合计持有中铁隆公司49.82%股权，公司将对中铁隆合并财务报表。中铁...,山东路桥：拟3.56亿元收购中铁隆控股权
