,title,content,pub_time,src
0,美联储降息减弱避险资产吸引力 黄金微幅收跌,"金融界(美股JRJC)美股讯北京时间3月5日消息，民主党竞选人、前副总统拜登在总统初选中大胜以及美联储周二紧急降息为风险资产带来提振，从而导致避险资产价格，但美国国债收益率仍旧承压又为金价提供了一定的支撑，纽约黄金微幅收跌。
纽约商品交易所4月份交割的黄金期货价格下跌1.40美元，报收于每盎司1643美元，跌幅为0.09%，盘中一度触及每盎司1654.30美元的高点。在周二的交易中，该合约收盘上涨3.1%，创下了自去年6月份以来的最大单日百分比涨幅。
Zaner Metals的分析师在一份每日研究报告中写道，全球股市在周三的交易中竞相走高，因此看到金价从最初的高点回升“并不令人感到意外”。报告指出：“当然，股市的大幅反弹对黄金价格来说造成了轻微的负面影响。但请记住，黄金最近的表现就像是一种实物商品，从而使得实物需求不会由于受到病毒的影响而大幅下降。”
在金价周三下跌之际，据ADP发布的报告显示，2月份美国私营部门的新增就业人数与前月相比略有下降。报告显示，该月私营部门的新增就业人数为18.3万人，略低于此前一个月的20.9万人，但仍超出经济学家预期的16.5万人。另外，美国供应管理协会(ISM)的3月份服务业指数从2月份的55.5上升到了57.3%，但调查显示企业对新冠病毒的担忧情绪有所加深。
推动金价周二大幅上涨的原因是，投资者纷纷抛售股票和其他被视为风险较高的资产，转而买入美国国债和贵金属等避险资产。美联储周二出人意料地在两次排期会议之间宣布紧急降息50个基点，以缓解与新冠病毒扩散相关的任何经济干扰影响，但仍旧未能拉动股市上涨。除此以外，美国国债价格飙升，从而压低了收益率，导致10年期国债收益率有史以来首次跌破1%关口。
美联储降息可能会提高黄金对投资者的吸引力，这是因为黄金是一种非付息资产。与此同时，美联储降息还倾向于推动美元汇率下跌，而在通常情况下，美元汇率下跌会促使黄金等以美元计价的大宗商品期货的价格上涨，原因是持有其他货币的投资者买入这些商品的成本将会变低。截至黄金期货市场周三收盘时，用于追踪美元兑六种国际主要货币汇率变动的洲际交易所(ICE)美元指数上涨0.2%，报97.38。
“美联储给黄金多头打了一针强心针，因为人们对全球央行采取更协调一致的政策宽松政策的预期日益高涨，这为金价提供了新的上行空间。”富拓外汇(FXTM)的市场分析师Han Tan在一份报告中表示。“即使新冠病毒爆发造成的死亡率在短期内稳定下来，投资者也仍需等待，以了解未来几个月全球最终的经济损失是多少。在这种旷日持久的不确定性中，金价预计仍将受到支撑。“
在纽约商品交易所的其他金属交易中，5月份交割的期银价格上涨5.8美分，报收于每盎司17.246美元，涨幅为0.3%。5月份交割的期铜价格上涨0.5%，报收于每磅2.586美元。4月份交割的期铂价格上涨0.7%，报收于每盎司875.20美元。6月份交割的期钯价格下跌0.1%，报收于每盎司2385美元。
关注同花顺财经（ths518），获取更多机会
(function(){var obj = null;if(document.getElementById('arctTailMark')) {obj = document.getElementById('arctTailMark');}if(obj!=null){var str = '(image_address=""http://i.thsi.cn/images/article/logo.jpg"")  返回首页';var showed = 0;try{var oo = obj.previousSibling;while(oo.nodeType!=1 || oo.innerHTML.replace(/\s|\u3000/g,'').length==0){oo = oo.previousSibling;}if(oo.nodeType==1 && oo.tagName.toLowerCase()=='p') {var span = document.createElement('span');span.innerHTML =str;oo.appendChild(span);showed = 1;}}catch (e){}if(showed == 0){obj.innerHTML =str;}}})();",2020-03-05 05:50:22,同花顺
1,尼日利亚今年经济增速预计为2.1%,"本报比勒陀利亚电记者蔡淳田士达报道：尼日利亚国家统计局日前公布的数据显示，尼日利亚2019年经济增长率为2.27%，较2018年增速提高0.36个百分点，超过国际货币基金组织此前预测的2.1%，预计2020年经济增速为2.1%。
尼日利亚国家统计局表示，受信息通信、农业、金融保险和制造业等行业推动，2019年第四季度尼日利亚经济同比增长2.55%，这是该国2016年经济衰退以来的最高季度增速。
数据显示，尼日利亚2019年全年日均产油量保持在200万桶左右，石油部门产值增长4.59%，占国内生产总值比重为8.78%。
尼日利亚是非洲第一大经济体和第一大产油国。近年来，受制于财政状况、税收制度和经济结构性问题，尼日利亚经济增长乏力。据世界银行最新预测，2020年尼日利亚经济增速为2.1%。
同花顺上线「疫情地图」
点击查看：新型肺炎疫情实时动态地图>>>
关注同花顺财经（ths518），获取更多机会
(function(){var obj = null;if(document.getElementById('arctTailMark')) {obj = document.getElementById('arctTailMark');}if(obj!=null){var str = '(image_address=""http://i.thsi.cn/images/article/logo.jpg"")  返回首页';var showed = 0;try{var oo = obj.previousSibling;while(oo.nodeType!=1 || oo.innerHTML.replace(/\s|\u3000/g,'').length==0){oo = oo.previousSibling;}if(oo.nodeType==1 && oo.tagName.toLowerCase()=='p') {var span = document.createElement('span');span.innerHTML =str;oo.appendChild(span);showed = 1;}}catch (e){}if(showed == 0){obj.innerHTML =str;}}})();",2020-03-05 05:43:32,同花顺
2,疫情投资不停歇：法瑞纳科技获菁英资本数千万元战略投资,"疫情投资不停歇：法瑞纳科技获菁英资本数千万元战略投资!2020年1月22日，广东法瑞纳科技有限公司与深圳前海菁英投资管理有限公司于法瑞纳集团总部举行《菁英资本战略投资法瑞纳集团签约仪式》。2月15日，
疫情投资不停歇：法瑞纳科技获菁英资本数千万元战略投资!2020年1月22日，广东法瑞纳科技有限公司与深圳前海菁英投资管理有限公司于法瑞纳集团总部举行《菁英资本战略投资法瑞纳集团签约仪式》。2月15日，法瑞纳集团获得菁英投资的数千万元资金支持完成新一轮投资。
(image_address=""http://e.thsi.cn/img/e03687ab522215ac"")
左：法瑞纳房建涛右：菁英资本陈文雄
本次战略协议签署后，双方将共同推动法瑞纳集团现有产品(共享陪护床、共享轮椅等)及后续产品线的研发、生产，并加速医疗领域智能共享硬件布局。
(image_address=""http://e.thsi.cn/img/4a3681b2da361d59"")
左：法瑞纳科技房建涛右：菁英资本陈文雄
法瑞纳科技董事长房建涛表示，此轮获得投资将用于开拓公司后续共享产品的研发、制造、宣传推广、产品申报以及团队建设等，大大助力企业快速发展。
(image_address=""http://e.thsi.cn/img/431c99e4e8a3355e"")
左：法瑞纳科技房建涛右：菁英资本陈文雄
法瑞纳集团目标直指智能共享产品
该公司成立于2015年，是一家集研发、设计、生产共享智能设备(软/硬件)运营商。推出的共享产品(共享陪护床、共享轮椅等)，以物联网为依托，以解决客户需求为前提的企业理念，为进入共享领域行业的企业及个人提供一体化式全程解决方案。同时，法瑞纳集团提供共享领域信息资源，致力于满足不同市场需求及定制化需求，满足各类消费群体及个人。
该公司专注于智能共享产品研发，现如今已有多项产品申请专利：共享陪护床、共享轮椅、共享童车、共享陪护椅、公共自行车、共享雨伞、共享单车等...
法瑞纳共享陪护床
法瑞纳共享轮椅
进入2020年以来，很多产业受到疫情冲击，但是科研从未停歇，法瑞纳科技设计范围广，深受关注的医疗产品、未来可期的智能技术，任何人群都有涉及。此轮获得投资对公司具有里程碑意义，获得新一轮数千万元战略投资将有助于法瑞纳集团实现跨越式发展。
菁英资本不断开拓新前程
深圳前海菁英资本由陈文雄先生创办，定位于全球领先的医疗及智能硬件投资平台。涵盖智慧医疗、智能制造、人工智能、物联网等多个领域;菁英资本于深圳、香港、广州、北京、长沙等各城市有分支机构。该公司迄今为止，已经投资超过20家企业。
受新冠肺炎大环境的影响下，投融投资市场复杂且艰难，该公司愿与所有的中小企业一起共克时艰。本次投资活动顺利完成，也为菁英资本新一年的投融资创造了新希望，打开了新窗口，开拓了新前程。
如今，疫情仍旧存在，中小企业的生存面临前所未有的挑战，虽然很多企业纷纷开启自救模式，但也需要业内专业平台相助。
除此之外，还有很多企业面临转型，法瑞纳集团拥有诸多战略合作伙伴外，还有很多专业领域的人才为您的企业保驾护航，法瑞纳集团坚信，不论处于什么情况，信心和黄金同样珍贵。
当前，举国众志成城，防控疫情，而如何促进疫情下经济发展也逐渐提上日程，企业作为国家的命脉，是国家的造血机制。法瑞纳集团一直坚信物联共享美好生活，为不同客户提供具有针对性的优质共享产品定制开发服务，致力于解决物联网软硬件一站开发，是法瑞纳集团一直以来坚持的本心。
免责声明：本文为企业宣传商业资讯，仅供用户参考，如用户将之作为消费行为参考，凤凰网敬告用户需审慎决定。
关注同花顺财经（ths518），获取更多机会
(function(){var obj = null;if(document.getElementById('arctTailMark')) {obj = document.getElementById('arctTailMark');}if(obj!=null){var str = '(image_address=""http://i.thsi.cn/images/article/logo.jpg"")  返回首页';var showed = 0;try{var oo = obj.previousSibling;while(oo.nodeType!=1 || oo.innerHTML.replace(/\s|\u3000/g,'').length==0){oo = oo.previousSibling;}if(oo.nodeType==1 && oo.tagName.toLowerCase()=='p') {var span = document.createElement('span');span.innerHTML =str;oo.appendChild(span);showed = 1;}}catch (e){}if(showed == 0){obj.innerHTML =str;}}})();",2020-03-05 05:22:59,同花顺
3,区块链+智能合约,"本报讯(王洁瑜记者粘青)突如其来的新冠肺炎疫情给生产生活带来不便的同时，也给法院工作带来极大考验。疫情防控期间，珲春市人民法院进一步加强智慧法院建设应用，坚持疫情防控与审判执行工作两不误。一方面积极参与疫情联防联控工作，一方面充分利用区块链等手段灵活办案，探索“零接触”式网上办公模式。
“区块链+”让审执衔接更顺畅。传统的执行立案方式，需要当事人持法律文书向法官申请出具生效证明，再到立案窗口申请立案。不仅耗时长、步骤多，往往还存在衔接困难。如何优化审判执行流程，打造“立审执”一体化工作格局，为人民群众提供更加高效、便捷的诉讼服务，是珲春市人民法院近年来的工作焦点之一。2019年年末，珲春市人民法院成为我省法院系统首批审执衔接工作试点单位，开始探索以区块链智能合约技术作为依托，以调解案件为切入点逐步推行审执工作自动衔接。
据悉，约定履行期限届满后，12368司法服务热线将自动向原告发送信息，确认被告是否如期履行义务，如当事人选择“未履行”，案件将会自动跳转进入执行立案程序，经审核后纳入执行系统。一跳一转看似简单，实则有效地减少了当事人往返法院申请执行立案的时间、经济成本，诉讼成本也随之降低。
一键立案让零接触成为现实。2月21日，珲春市人民法院成功实现利用区块链智能合约技术完成执行案件网上立案，在坚持做好防疫工作同时，确保执行工作不松懈。2019年12月，某公司与金某保证保险合同纠纷一案，经珲春市人民法院主持调解，双方达成调解协议。与以往不同的是，法院在调解过程中明确征求双方当事人意见，确认如被告在约定期限内未履行义务，将通过智能审执衔接平台自动办理执行立案。2月20日，某公司代理人王某打来电话，告知法官自己收到法院发来的短信，询问该如何进行操作。法官了解到被告金某并未履行义务，公司希望立即申请强制执行后，耐心引导原告点击“未履行完毕”按键，并在智能审执衔接平台确认被告应履行金额、填写执行申请、完成电子签名等操作，使该案件直接进入立案程序。法院执行立案平台通过对民事调解书的区块链验真审核后，立案成功进入执行系统。
在该案件审理过程中，王某对法院高效、快捷、便民的诉讼服务模式和工作人员认真负责的工作态度大加赞赏。
关注同花顺财经（ths518），获取更多机会
(function(){var obj = null;if(document.getElementById('arctTailMark')) {obj = document.getElementById('arctTailMark');}if(obj!=null){var str = '(image_address=""http://i.thsi.cn/images/article/logo.jpg"")  返回首页';var showed = 0;try{var oo = obj.previousSibling;while(oo.nodeType!=1 || oo.innerHTML.replace(/\s|\u3000/g,'').length==0){oo = oo.previousSibling;}if(oo.nodeType==1 && oo.tagName.toLowerCase()=='p') {var span = document.createElement('span');span.innerHTML =str;oo.appendChild(span);showed = 1;}}catch (e){}if(showed == 0){obj.innerHTML =str;}}})();",2020-03-05 05:12:58,同花顺
