,title,content,pub_time,src
0,经销商热炒华为手机 最高涨700元,"(image_address=""https://e.thsi.cn/img/c38b41df228b2d8"")
成都王府井华为授权店的华为麒麟芯片系列目前仍有一定货源
近日，有关华为手机在渠道商中涨价的消息在朋友圈里传开。据了解，因华为麒麟芯片库存告急，导致华为Mate、P40、NOVA系列天天涨价，并且购买华为手机还要以当天的报价为准。对此，金融投资报记者在成都市场采访了解到，在品牌授权里，华为手机价格与官方定价相同，只是之前的优惠活动没了，相当于变相涨价；而在一些非授权店里，销售人员对记者表示：华为手机确实在涨价。
■本报记者 陈美 文/图
普遍涨价mate30涨得最多
随着9月15日的大限将至，海思芯片将面临全面断供的风险。受此影响，近日搭载麒麟芯片的华为手机开始全面涨价。
9月1日上午，金融投资报记者来到成都王府井（600859）的华为品牌授权店，发现目前该店华为手机的价格仍是官方定价，但其销售人员也毫不掩饰地表示，现在外面的渠道商都开始涨价了。该销售人员表示，在同等价格中，华为的麒麟芯片在性能和速度上都是最好的。“现在由于断供，麒麟芯片或成高端芯片机绝版，所以涨价也是有一定道理的。”
记者在该店看到，目前搭载麒麟985芯片的华为NOVA7 Pro，126G的售价是3699元。而之前在优惠活动的影响下，该款手机可以比官方价格少几百元。
在成都太升南路一家华为专卖店里，其销售小哥也同样表示：在芯片断供之后，公司都统一了价格。“之前去实体店或者京东苏宁等商城上购买，都会给你一个活动折扣，但现在的折扣都减少了，这也相当于变相涨价吧。”销售小哥称。
在非品牌授权店里，金融投资报记者发现，越高端的华为手机渠道价差越大。以125G的华为P40 pro为例，之前在非授权店里，拿货的价格是5200元，而现在是5500元，涨了300元。华为mate30，之前125g的价格是3800元，现在要卖4500元，上涨700元。该渠道商向金融投资报记者透露，华为越高端的机型，渠道价差越大，有些可以达到1000多元的价差。因此，在麒麟芯片断供后，渠道商就有操作价差的空间。
天玑或成为代替芯片
众所周知，麒麟芯片之所以库存告急，源于台积电无法继代工，而眼下距离9月15日的大限已迫在眉睫。那么，断供之后，华为该怎么办？在采访中，华为专卖店的员工均对金融投资报记者表示未来很可能用“天玑”芯片来代替。
成都王府井华为授权店的销售人员表示，相比麒麟芯片，天玑芯片在性能和速度方面要差一些。“未来，不排除机型会做厚。”
记者采访的一位业内人士也表示，目前天玑最强的是天玑1000，但距麒麟处理器仍有一段差距，更别提骁龙865了。该业内人士称，天玑1000在芯片中算是中端之王，毕竟它是中端处理器中唯一使用A77架构的。市场中，OPPO、小米，乃至于接下来要发布华为畅享Z都会采用天玑系列芯片。从这一点来看，该业内人士认为，短期华为可能很难在高端机上发力。
数据显示，今年二季度，华为以5580万部出货量超过三星（5370万部），成为全球最大的手机销售商。其中，高端机型中，华为P40 pro也是碾压三星S20系列。但断供之后，华为的形势可能急转直下。面对这一困境，一家华为专卖店里的销售小哥坚信公司能够妥善解决。其称：“现在只是无法代工了，但设计技术都在公司里，未来公司肯定会想办法的。”
目前，为最大程度满足华为5纳米订单需求，台积电正在24小时不停歇生产。其要在9月14日前全部交货，因为在大限之后他们不得再接华为芯片的订单。此外，联发科也在在这段时间火力全开，为华为提供多达3000万套芯片，还向美方提出申请，力求9月15日后继续供货给华为。而在台积电生产的5纳米订单中，有华为最高端的麒麟9000芯片，该技术相当于每平方毫米可容纳1.713亿个晶体管。面对这一“末代”芯片，华为销售人员也感叹：这或许是华为最后一批高端旗舰芯片了！
市场竞争力或受影响
技术决定竞争力，在华为断供之后，天风国际分析师郭明錤发布的最新研报显示，随着9月15日的大限将至，华为手机的市场竞争力与市占份额均会受到负面影响。“情况好一点就是华为市占份额降低，坏一点可能会导致华为退出手机市场。现在华为芯片已经到了艰难之时。”郭明錤表示。
郭明錤认为，华为手机对相机、HDI、存储与5G芯片的零部件规格与单价要求明显高于Android竞争对手，因此，若华为手机竞争力衰退，上述零部件技术升级趋势将放缓。
对于华为当下所面临的严峻外部环境，华为消费者业务CEO余承东曾呼吁半导体产业链上的伙伴应全方位扎根，突破物理学材料学的基础研究和精密制造。在终端器件方面，比如显示模组、摄像头模组、5G器件等方面，华为也要加大材料与核心技术的投入，实现新材料＋新工艺紧密联动，突破制约创新的瓶颈。
最新消息显示，除了芯片断供，华为重要内存及闪存芯片供应商美光科技高管在BMO全球技术大会上也正式宣布：受美国禁令影响，美光在9月14日之后，将不能继续向华为供货。
资料显示，美光科技于1978年在美国爱达荷州首府博伊西市，主营业务是DRAM、NAND闪存、CMOS图像传感器、其它半导体组件以及存储器模块。经过几十年的发展，美光科技已经成为全球最大的半导体储存及影像产品制造商之一。而美光与华为的合作超过了20年，是华为的主要内存及闪存芯片供应商，每年华为都要从美光采购的元器件超过26亿美元。因此，分析人士认为，在全面断供之后，华为将有一段很艰难的路要走。
关注同花顺财经（ths518），获取更多机会
(function(){var obj = null;if(document.getElementById('arctTailMark')) {obj = document.getElementById('arctTailMark');}if(obj!=null){var str = '(image_address=""http://i.thsi.cn/images/article/logo.jpg"")  返回首页';var showed = 0;try{var oo = obj.previousSibling;while(oo.nodeType!=1 || oo.innerHTML.replace(/\s|\u3000/g,'').length==0){oo = oo.previousSibling;}if(oo.nodeType==1 && oo.tagName.toLowerCase()=='p') {var span = document.createElement('span');span.innerHTML =str;oo.appendChild(span);showed = 1;}}catch (e){}if(showed == 0){obj.innerHTML =str;}}})();
责任编辑：cjh",2020-09-02 00:47:51,同花顺
1,保障用户对推销短信电话“拒绝权”需对其利益链条加大管理“合围”,"行业管擦
保障用户对推销短信电话“拒绝权”是民意所向，综合问责还需更给力。
骚扰电话、推销短信长期困扰着公众生活。针对这一现象，工信部日前发布《工业和信息化部就 公开征求意见》，明确规定任何组织或个人未经用户同意不得向其发送商业性短信息。
该《意见》首先厘清了企业、运营商、相关部门各自要承担的责任。企业未经用户同意不得发送推销短信，拨打推销电话；其次，作为短信和电话基础功能的提供者，运营商如果发现所合作企业存在类似问题，就要对其采取限制或者暂停其通信能力的平台约束手段；而工信部还将建立全国统一的“谢绝来电”平台，引导企业做好自律，运营商则提供“谢绝来电”服务，让用户可以一键拒绝推销类短信和服务；最后，对于屡教不改的企业，12321受理中心负责相关用户投诉，进行相应处理。
此外，《意见》还对明知故犯的企业采取行政罚款、吊销电信业务经营许可等问责举措。而肩负管理责任的运营商一旦没有履行平台责任，同样要承担被警告及罚款等后果。
相比以往的类似规定，此次《意见》有不少亮点，比如除了罚款之外，对于情节严重的企业，可以吊销电信业务经营许可并回收相应码号资源，这将让违规企业付出更多的代价。而另一点则是对运营商责任的强化，运营商不能坐视合作企业滥发短信和电话，否则也会受罚。
但徒法不足以自行。目前，许多企业之所以采取滥发短信、滥打电话的方式，一是其成本低廉，据称一条推销短信成本不过几分钱，几万条短信也就几百元支出。更具反讽意味的是，随着AI（人工智能）技术的发展，近期还出现了系统自动拨打公众电话、并提供统一口径推销内容的电话推销模式，等于进一步降低了企业的成本。
由此可以看出，推销短信和电话背后是巨大的利益链条，部分企业希望以“低成本”获客，试图挖掘这一“商机”的违法者则通过提供用户手机号码等隐私、短信群发技术、电话自动拨打技术等方式，通过售卖给有此需求的企业，共同收割这一灰色利益。
因此，对于推销短信及电话的监管新政，需要从相关产业的上下游同时入手，工信部还需联合其他职能部门，形成对用户隐私被贩卖、短信群发、电话自动拨打等非法交易的监管合力。对于上述非法行为，多部门共同制定更高问责标准的新规，对相关环节责任人的处罚力度应进一步增强，包括民事责任和法律责任。
此外，目前部分骚扰短信和电话都转移到了线上平台，这也需要工信部加大日常监测，尽快采取更严格的治理举措，从而达成线上线下一体化的管理体系。
保障用户对推销短信电话“拒绝权”是民意所向，综合问责还需更给力，从立法、执法等方面入手，针对其利益链条加大管理“合围”，最大程度减少此类现象的生存空间。
□毕舸（财经评论人）
关注同花顺财经（ths518），获取更多机会
(function(){var obj = null;if(document.getElementById('arctTailMark')) {obj = document.getElementById('arctTailMark');}if(obj!=null){var str = '(image_address=""http://i.thsi.cn/images/article/logo.jpg"")  返回首页';var showed = 0;try{var oo = obj.previousSibling;while(oo.nodeType!=1 || oo.innerHTML.replace(/\s|\u3000/g,'').length==0){oo = oo.previousSibling;}if(oo.nodeType==1 && oo.tagName.toLowerCase()=='p') {var span = document.createElement('span');span.innerHTML =str;oo.appendChild(span);showed = 1;}}catch (e){}if(showed == 0){obj.innerHTML =str;}}})();
责任编辑：cjh",2020-09-02 00:46:32,同花顺
2,健康经济聚焦中医药养生 多糖产品市场潜力巨大,"今年以来，疫情防控、养生保健等话题的热度持续提升，健康的生活方式、健康的消费新趋势受到越来越多的关注。《中国健康经济白皮书2019》（以下简称“《白皮书》”）课题组日前再次来到无限极（中国）有限公司（以下简称“无限极”）调研，并以“科普教育与科技创新”为切入点，开展主题为“健康消费新趋势”的座谈会。这也是课题自2019年9月22日启动以来，又一次深入调研活动。
作为《白皮书》首批调研单位，无限极多年来十分注重在先进管理理念和科技研发方面的投入，是行业内龙头科技企业，对《白皮书》的调研具有样本意义。2019年11月，课题组一行曾全面了解无限极在产学研等各方面的情况；疫情期间，课题组多次召开线上会议，围绕健康养生及健康消费新现象进行研讨；而此次调研，课题组聚焦健康消费新趋势，围绕疫情防控常态化背景下的免疫调节等话题展开讨论。
健康消费：疫情“大考”倒逼潜力释放
据信达证券的一份行业研究报告中预计，到2022年末，我国人均保健品消费额将达到20.7美元，消费规模达268亿美元，而优秀的保健品企业将享受行业约65亿美元（约450亿人民币）的增量市场空间。
该报告同时指出，保健品行业的投资机会一方面来源于从粗放到精细化管理的行业升级，另一方面来自于保健品行业价格逐步合理化带来的低线消费新动能，所以行业整体的市场空间实质比起增量要来的更大。
“面对更加细分的市场，产业势必朝着更加专业化、精准化的方向发展，从业人员的职业化水平也需进一步提升。”中国保健协会副理事长周邦勇在调研中指出，需求催生新业态、新模式，企业应抓住市场需求，在研发过程中就加以思考，发挥好“三产融合”的优势。
事实上，“以满足老百姓的健康需求为出发点，坚持研发理念，做出高品质产品”，也正是无限极的健康食品研发思路。在疫情防控常态化的当下，契合健康消费新趋势及对免疫调节产品的需求，贴近消费市场利益的复合多糖产品更是在无限极众多产品中脱颖而出。
多糖技术：解密藏在食物中的养生智慧
调研中，无限极的多位技术专家重点介绍了其贴近消费市场利益的复合多糖产品，以及无限极在此领域的产品研发和科技投入情况。无限极在复合多糖领域的研究成果，亦为本次调研以及下一步关于中医药免疫调节的相关研究，提供了有价值的参考。
疫情触及了人们对全生命周期健康意识的高度重视，并普遍达成共识――自身免疫能力和自愈能力十分重要。可以说，在疫情防控常态化的背景下，免疫调节的作用得到了前所未有的重视。而多糖在人体免疫调节功能中又发挥怎样的作用呢？
调研中，课题组一行通过参观走访无限极复合多糖生产车间，深入了解了复合多糖产品的前景和趋势。从堆满中草药原材料的第四层开始向楼下参观，一条先进的生产线呈现在眼前。
在“堆料间”，干燥的环境，使得香菇、茯苓、银耳、虫草、竹荪等药食同源的中草药原材料散发出一股香甜的气味。中国科学院过程工程研究所生化工程国家重点实验室糖生物工程课题组组长杜昱光开玩笑道：“这就是‘多糖’的味道！”他向课题组一行介绍：“尽管糖链的功能奥秘人类目前尚未完全揭示，但它已经展示给我们许多独特的生物学功能。随着对其研究开发的不断深入，必将会推动和促进中国糖工程产业的兴起，同时也将推动我国绿色及健康产业的发展。”
据介绍，糖类化合物是自然界中含量最丰富的天然产物，与我们的生活密切相关。作为药食同源的补益类中药的重要活性成分，多糖是公认的天然、优质的免疫调节剂。研究表明，其能有效提升人体免疫力，是人体细胞或脏器维系正常功能不可缺少的主要成分。
多糖虽好，但想从消化道吸收活性物质，还存在消化利用效能的问题。以灵芝多糖为例，临床试验人体需要的量为每天1.8克，按照纯化灵芝多糖的提取率为0.7%计算需要的灵芝量为257克。但一天内吃下这么多灵芝显然不现实，利用中药现代化技术萃取“精华”就显得尤为关键。
可以说，掌握多糖的核心技术，就能解密藏在食物中的养生智慧。通过萃取原材料中的多糖成分，不仅能够满足人们调节免疫功能所需的摄入量，也更易于被人体吸收、减轻胃肠道负担。
在复合多糖生产车间二层，记者注意到有多排巨型密封容器，上面分别标识着蒸汽冷凝器、蒸发室、加热室、冷凝水储罐、提取液储罐等字样，这一套“巨无霸”生产线，正是生产的关键部分。“我们的复合多糖产品中，复合不是随意的，而是有意识、有目的地将不同功效的几种多糖进行组合。先进的中草药多糖提取工艺，更是令中草药多糖提取率及活性大幅提高。”无限极的一位技术专家介绍。
其实，早在多年前，无限极就已独立拥有复合多糖领域的多个核心技术和知识产权。其将复合多糖技术应用到中草药健康产品中，推出了数十款中草药多糖系列健康产品，充分发挥了多糖在免疫调节方面的作用。
中医药养生：创新研究恰逢其时
如今，一系列法律法规和重要文件的出台将保护、扶持、促进中医药发展上升为国家意志和国家战略。尤其是在治疗新冠肺炎的过程中，中医药发挥了突出作用，也让人们对其价值有了全新认识。
在大健康行业，也有一些致力于中医药养生的企业在科技投入和创新研究方面取得了亮眼的成绩。以无限极为例，其成立28年来，一直投身于中草药前沿技术的研究。其与全国乃至全球众多科研机构开展了广泛合作，在功效评价与验证、机理研究、工艺技术等方面做了很多前沿的、有意义的研究与发现，努力将科研成果转化为大众需要的健康产品，致力于推动中华养生文化的现代化和国际化。
目前，无限极已拥有实力雄厚的中草药健康产品研发团队，由多领域、多学科的博士、硕士及专业技术人员组成；共取得400多项专利，连续11年4次获得国家批复同意、广东省颁发的“高新技术企业”称号；共有45类100款产品认定为“广东省高新技术产品”。
与此同时，在中草药健康产品的研发生产与销售中，无限极通过自建中草药种植基地，不仅为企业带来了质量过硬的道地药材，还使产品品控和产品溯源更有效率。
据悉，中医药养生也成为课题组下一步研究对象。据主办方介绍，《白皮书》课题的研究工作已接近尾声，并将于今年10月正式对外发布。届时，《中国健康经济白皮书2020（中医药养生）》课题将同步启动，课题组将开展更细分领域的精准研究工作。
关注同花顺财经（ths518），获取更多机会
(function(){var obj = null;if(document.getElementById('arctTailMark')) {obj = document.getElementById('arctTailMark');}if(obj!=null){var str = '(image_address=""http://i.thsi.cn/images/article/logo.jpg"")  返回首页';var showed = 0;try{var oo = obj.previousSibling;while(oo.nodeType!=1 || oo.innerHTML.replace(/\s|\u3000/g,'').length==0){oo = oo.previousSibling;}if(oo.nodeType==1 && oo.tagName.toLowerCase()=='p') {var span = document.createElement('span');span.innerHTML =str;oo.appendChild(span);showed = 1;}}catch (e){}if(showed == 0){obj.innerHTML =str;}}})();
责任编辑：cjh",2020-09-02 00:45:56,同花顺
