,title,content,pub_time,src
7,65家券商投身创业板注册制改革 IPO跟投成下半年布局重点,"本报记者 王思文
进入金秋九月，创业板注册制下，已有21只新股上市交易，IPO融资总额达211.68亿元。作为专业机构投资者，证券公司正积极筹备、推进创业板项目保荐，助力创业板改革。
据深交所数据统计，目前共有65家券商参与到创业板注册制IPO、再融资、重大资产重组的申报当中，为创业板项目“保驾护航”。其中，中信证券、中信建投（601066）证券、民生证券的保荐项目数量最多。据《(image_address=""//comment.10jqka.com.cn/sourcepic/12/1qTIr8jVsagtsay.png"")》记者了解，多家头部券商早在今年年初便提前积极储备创业板注册制项目，为上半年保荐业务提供增长点。
值得注意的是，在今年下半年的投行保荐业务布局中，多家头部券商仍持续“锚定”创业板保荐业务，其中“创业板IPO跟投业务”成为下半年业务布局的重点。
保荐业绩排名出炉
头部券商竞争激烈
截至记者截稿，据深交所数据显示，创业板注册制IPO受理企业已达到368家。其中29家企业处于“已受理”阶段，270家企业“已问询”，14家企业已获上市委会议通过，48家企业处于“提交注册”阶段，还有7家企业处于“中止”阶段。
除首发上市外，创业板存量企业也迎来了“升级版”的再融资和并购重组规则。数据显示，截至9月1日，深交所累计受理创业板168家企业再融资申请，9家企业重大资产重组申请。
作为保荐机构和项目重要参与者，券商积极备战创业板注册制IPO、再融资、重大资产重组的申报。总体来看，目前共有65家券商参与到上述三类创业板保荐项目中。创业板注册制下，中信证券、中信建投证券、民生证券、国信证券、华泰联合证券的保荐服务项目数量位居前五，分别有57家、40家、32家、29家、27家。国金证券和国泰君安以26家和25家紧随其后。
具体来看，有57家券商参与了创业板注册制下的IPO保荐项目。从IPO申报企业家数来看，中信证券暂列保荐服务家数榜首，中信建投证券、国信证券、民生证券紧随其后，保荐服务家数分别为30家、27家、23家和23家。
再融资方面，共有46家券商参与到168家企业的再融资申报当中，中信证券、国泰君安、中信建投证券位居前列，保荐服务家数分别为26家、14家、13家。
重大资产重组方面，共有9家券商参与到9家企业的重大资产重组申报当中，分别为中信证券、申万宏源承销保荐、国信证券、国金证券、方正承销保荐、东兴证券、中原证券（601375）、联储证券、华创证券。
对此，山西证券非银团队刘丽表示：“从券商业务来看，受创业板上市公司密集登陆创业板及交易活跃影响，有利于增厚其投行业务和经纪业务的业绩，提升证券板块估值水平。”
布局创业板
成头部券商共识
《(image_address=""//comment.10jqka.com.cn/sourcepic/12/1qTIr8jVsagtsay.png"")》记者翻阅上市券商半年报发现，不少券商早在今年年初就提前布局创业板试点注册制相关业务工作。
例如，国信证券表示2020年上半年公司以注册制为重点，把握创业板改革并试点注册制等重大市场契机，聚焦粤港澳大湾区，全力做好项目培育及申报。同时，上半年积极推进投资者适当性、交易风险控制、技术系统改造等准备工作，以确保创业板试点注册制后相关融资融券及转融通业务顺利开展。
华泰证券也在半年报中表示，今年上半年，股权承销业务立足生物医药、科技创新等重点行业，着力提升境内外一体化综合服务能力，同时积极储备创业板注册制项目。针对创业板放宽涨跌幅限制、首日可作为两融标的等变化，全面分析对融资融券和股票质押业务的风险影响，研究完善创业板集中度限制、追保平仓机制、风险跟踪及回溯机制等风险控制措施，保障业务在风险可测、可控、可承受的前提下平稳运行。
在券商平稳有序开展创业板注册制下保荐等业务的同时，2020年下半年的工作重点也逐渐浮出水面。《(image_address=""//comment.10jqka.com.cn/sourcepic/12/1qTIr8jVsagtsay.png"")》记者发现，多家头部券商在今年下半年的工作计划中提到“继续把握注册制下创业板业务机会”，尤其是创业板注册制IPO跟投业务。
中信建投证券表示：“2020年下半年，公司将积极做好创业板等项目的开发和执行工作。同时，有序推进创业板注册制IPO跟投工作，争取成为公司新的利润增长点。”
华泰证券同样表示：“今年下半年，在另类投资业务方面，将持续健全完善投资管理和业务发展模式，积极把握投资机会，持续健全完善创业板跟投业务制度和机制，稳步提高资金使用效率和资产回报率。”
与此同时，券商也将持续加大针对创业板注册制等创新业务的布局。例如，中信证券在2020年下半年投行业务展望中明确提出，公司将紧密跟进政策变化，针对创业板试点注册制等创新业务持续进行布局。华泰证券则表示，下半年将践行重点区域开发和行业深耕，加大优质客户布局，同时加强跨境联动，把握红筹企业回A、GDR、中概股回归、境外上市等业务机会。
关注同花顺财经（ths518），获取更多机会
(function(){var obj = null;if(document.getElementById('arctTailMark')) {obj = document.getElementById('arctTailMark');}if(obj!=null){var str = '(image_address=""http://i.thsi.cn/images/article/logo.jpg"")  返回首页';var showed = 0;try{var oo = obj.previousSibling;while(oo.nodeType!=1 || oo.innerHTML.replace(/\s|\u3000/g,'').length==0){oo = oo.previousSibling;}if(oo.nodeType==1 && oo.tagName.toLowerCase()=='p') {var span = document.createElement('span');span.innerHTML =str;oo.appendChild(span);showed = 1;}}catch (e){}if(showed == 0){obj.innerHTML =str;}}})();
责任编辑：cjh",2020-09-02 00:42:45,同花顺
8,“天坛大脑”启动 三个模块助力北京天坛医院智慧管理,"日前，天坛医院智慧管理中心“天坛大脑”启动仪式暨公立医院精细化运营管理交流活动在首都医科大学附属北京天坛医院举行。启动仪式上，北京天坛医院院长王拥军介绍了天坛医院智慧管理中心――“天坛大脑”。
据悉，“天坛大脑”包含三个模块：天坛医院智能集成平台、天坛医院智慧运营管理平台、天坛家后勤运营数据看板。
其中，天坛医院智能集成平台以动态3D模型的方式立体展示医院建筑结构；动态展示医院各科室位置、医院手术间状态、电梯运行情况以及各门诊与病区等候人数等信息，可以对全院各个区域进行实时监控。
“天坛医院智慧运营管理平台”汇总整合了院内不同业务信息系统的医疗数据、业务数据、管理数据等，凝练为各类运营指标，多层次、多角度、多区间对医院整体运营情况进行智慧管理。
天坛家后勤运营数据看板则是通过展示“综合维修、综合服务、预定、咨询、投诉”五大类业务工单实时及历史数据，对后勤服务问题及时预警、精准处理，提高服务质量，为医护人员提供更便捷更高效的后勤一体化服务。
据了解，北京天坛医院搬迁以来，加强精细化运营管理，2019年3月专门成立了运营管理办公室。经过1年多的运转，从最初的数据采集、数据集成到功能集成、可视化界面集成，初步实现了智慧运营管理平台的可视化和智能化。
借助医院新院发展的契机，在精细化运营管理的多项举措下，医院运营效率和效益均得到提升。新冠疫情发生前的2019年12月与上年同期相比，月均每诊位诊次较同期提高28.68%，床位使用率较同期提高10.91%，住院手术量较同期提高38.25%。在业务量不断增加的情况下，平均住院日与上年同期相比下降1.3天，百元医疗收入消耗卫生材料指标较上年同期下降0.91%。医院核磁共振、CT、超声和数字减影血管造影的检查人次增幅均在20%以上。
活动邀请国家卫生健康委、北京市医院管理中心相关领导及长江商学院经济学教授，讲解运营管理、绩效考核的最新政策和管理思路，同时交流分享在疫情常态化考验下的公立医院精细化运营管理的策略和实施。北京各市属医院院长、主管副院长、运营绩效等部门负责人参加了此次活动。
关注同花顺财经（ths518），获取更多机会
(function(){var obj = null;if(document.getElementById('arctTailMark')) {obj = document.getElementById('arctTailMark');}if(obj!=null){var str = '(image_address=""http://i.thsi.cn/images/article/logo.jpg"")  返回首页';var showed = 0;try{var oo = obj.previousSibling;while(oo.nodeType!=1 || oo.innerHTML.replace(/\s|\u3000/g,'').length==0){oo = oo.previousSibling;}if(oo.nodeType==1 && oo.tagName.toLowerCase()=='p') {var span = document.createElement('span');span.innerHTML =str;oo.appendChild(span);showed = 1;}}catch (e){}if(showed == 0){obj.innerHTML =str;}}})();
责任编辑：cjh",2020-09-02 00:41:48,同花顺
9,岸绿水美映高质量发展生机 ――江西九江“共抓大保护”见闻,"漫步在紧邻长江大堤的江西九江城西港区湿地公园，难以想象，两年前，这里还是污水横流的老旧村庄和荒滩。
坐落在万里长江、千里京九和五百里鄱阳湖交汇之处的九江，是长江经济带绿色发展示范区首批创建城市之一。“共抓大保护，不搞大开发”，这个曾经以高耗能、高污染产业为支柱的沿江城市，已悄然转身，踏上高质量发展道路。
长江“最美岸线”显山露水
依山傍水，江风拂面，九江市彭泽县长江湿地公园内绿意盎然。
“这里曾是一片荒滩地，晴天一身灰，雨天一身泥，如今绿道环绕，是休闲健身的好去处。”谈到江岸生态环境的变化，市民这样感慨。
受地质灾害等影响，过去彭泽县长江沿岸有14处受损山体存在边坡风化、开裂、崩塌等现象。2019年4月，彭泽县携手三峡集团对14处山体实施生态修复，破解山体修复“一年绿、两年荒、三年死”难题。截至目前，14处山体已圆满完工。
近两年，沿着长江岸线，九江已栽种植物700多万株；拆除沿江非法码头87个，规范提升40个，恢复岸线7529米；堤顶道路“白改黑”近160公里；治理废弃矿山8626亩；新建、改造小景点小游园60个……
依水而兴的九江同步打响一场前所未有的“治水战”。
53个规模以上入河排污口监测全覆盖；16个工业园区污水处理厂执行一级B以上标准；在中心城区，与三峡集团合作实施总投资144亿元的水环境治理项目……治污水、活死水、防洪水、优供水，九江之水愈发清澈灵动。
“九江地处长江中下游分界点和江西‘五河一湖’汇入长江的特殊位置，对长江生态保护至关重要。”九江市委书记林彬杨说，九江将始终担起“一湖清水入江、一江清水东流”的重大责任。
生态存量转为经济增量
上港集团（600018）九江港城西港区集装箱码头，3条作业线满负荷运转。经过3年打造，这里实现始发直达上海“天天班”，货物到达上海的时间由10天缩短至3天。
说起九江港升级给企业带来的改变，TCL空调器（九江）有限公司总经理李心安深有体会：“对企业来说，订单交期至关重要。从九江港发往上海的货物3天内到达，对我们开展国际贸易非常有利。”
李心安说，因为九江港货运周转效率提升，TCL集团对九江基地的定位从面向国内调整为面向全球，将其高端产品生产线引入九江基地。
“九江航运中心江海直达、服务全省、辐射周边功能初步显现。”九江市港口航运管理局局长曹俊良说，目前，九江港货物吞吐量在沿江5个同类港口中排名第二。
九江清除非法码头，为建设长江经济带区域性航运中心和商贸物流中心腾出空间。“水美、岸美是表象，高质量发展的基础在于产业美，要把生态存量转化为经济增量。”九江市工信局局长娄琦说。
为扭转过去化工重镇高耗能、高污染的产业形象，九江对沿江1公里范围内的小化工企业分类实施“关停并转搬”，出清38家小化工企业，把沿江发展空间留给以临港经济、数字经济为龙头的新兴产业。
在长江南岸、鄱阳湖西畔，一座规划面积158.53平方公里的鄱阳湖生态科技城正在兴起，阿里巴巴、华为、浪潮等一批行业巨头纷纷入驻。
“为抓住新基建机遇，我们把电子信息产业和数字经济作为招商引资的主攻方向，逐步推动产业生态化。”九江市商务局局长黄家杰说。
让环保为发展开路
绝不让环保为发展让路，而是让环保为发展开路。“经过这几年‘共抓大保护’，九江正涅槃重生。我们对长江保护和开发的理解，从没有像现在这样深刻。”娄琦说，要弥补生态环境欠账，必须高举“大保护”旗帜，划出“红线”执行到底。
“生态环保制度的完善，引导干部形成绿色政绩观。”九江市生态环境局局长陈世超介绍，2019年九江建立生态环境保护委员会，制定生态环境保护责任清单，并提升生态环境考核权重，对生态环境保护工作落实不力的一票否决，全面压实“党政同责、一岗双责”。
杜绝“带污染”的GDP和财政收入，已成为九江各地上项目、抓发展的“铁律”。近几年，九江先后拒绝400多个对生态环境有负面影响的投资项目。
“原来各地招商引资只算经济账，现在要算政治账、生态账、社会账、长远账。”九江市沿江开放开发领导小组办公室主任吴斌说，原来讲经济总量、投资、财政，现在讲环保、绿色、高效，干部高质量发展的意识和能力逐步增强。
关注同花顺财经（ths518），获取更多机会
(function(){var obj = null;if(document.getElementById('arctTailMark')) {obj = document.getElementById('arctTailMark');}if(obj!=null){var str = '(image_address=""http://i.thsi.cn/images/article/logo.jpg"")  返回首页';var showed = 0;try{var oo = obj.previousSibling;while(oo.nodeType!=1 || oo.innerHTML.replace(/\s|\u3000/g,'').length==0){oo = oo.previousSibling;}if(oo.nodeType==1 && oo.tagName.toLowerCase()=='p') {var span = document.createElement('span');span.innerHTML =str;oo.appendChild(span);showed = 1;}}catch (e){}if(showed == 0){obj.innerHTML =str;}}})();
责任编辑：cjh",2020-09-02 00:41:42,同花顺
10,严防资产质量劣变和新一轮资产泡沫 加力压降影子银行等高风险业务 监管层多维度加固金融风险防线,"近期，全方位强化金融风险防控的政策信号不断释放。《经济参考报》记者获悉，央行、银保监会等金融监管部门正密集筹划，针对资产质量劣变、新一轮资产泡沫等潜在风险，研究更多防控举措，将加大不良资产、高风险影子银行等重点领域的处置力度。地方层面，多地召开专题会议，针对金融领域放贷等主要风险点部署专项整治。同时，监管部门正加快补齐金融风险处置的制度短板，健全金融机构法人治理、完善资本市场基础制度等改革措施将陆续推出。
监管部门密集谋划储备“弹药”
面对疫情给金融防风险带来的新挑战，金融监管部门正密集谋划，为进一步加强金融风险防控储备“弹药”。
根据银保监会最新数据，今年二季度末，商业银行不良贷款余额2.74万亿元，较上季度末增加1243亿元；商业银行不良贷款率1.94%，较上季度末增加0.03个百分点。此外，根据36家A股上市银行披露的业绩情况，上半年共有18家银行不良贷款率出现上升。
“当前，经济尚未全面恢复，疫情仍有较大不确定性，所带来的金融风险也存在一定时滞，预计有相当规模贷款的风险会延后暴露，未来不良上升压力较大。对此，我们密切关注，提早谋划，积极应对。”银保监会主席郭树清近日表示。
同时，在资金面宽松背景下，企业、居民、政府的债务问题也引发监管部门高度关注。郭树清指出，利率下行一致性预期强化后，有可能助长杠杆交易和投机行为，催生新一轮资产泡沫。信用较差的借款人可能借延期还款等优惠政策恶意逃废债务，结构复杂的高风险影子银行也容易卷土重来。
地方层面也在加紧部署，加强重点风险防控。例如，江西省金融监管局局长韦秀长近日在开展防范化解重大金融风险督查调研时表示，要强化对非法集资等非法金融活动的打击处置力度，持续推进高风险地方法人机构风险化解。浙江嘉兴市金融办近日召开重大金融风险防范处置专项工作推进会，部署专项整治行动。
中国银行国际金融研究所研究员范若滢对《经济参考报》记者表示，当前我国金融领域风险整体可控，但仍需警惕重点领域金融风险的累积。其中，部分中小金融机构风险明显增大，处于持续暴露过程中。在宏观经济环境面临不确定性以及宏观杠杆率上升的背景下，企业信用风险可能攀升。此外，地方政府隐性债务风险等也需高度重视。
重点风险领域处置力度将加大
为防控资产质量劣变、新一轮资产泡沫等潜在风险，下一步，不良资产、高风险影子银行等重点风险领域处置力度将加大。
记者了解到，针对信贷资产质量问题，相关部门将引导机构通过提前加大拨备计提等，尽最大可能提早处置不良资产。同时，将疏通不良资产处置的政策堵点。在充分揭示风险前提下，研究分阶段下调拨备覆盖率的监管要求，释放资源全部用于处置不良。
机构层面也已为更多不良资产化解做好准备。在近日举行的中期业绩发布会上表示，中行、农行等多家银行均表示，下半年将充分运用批量处置、债转股、债务重组等各种手段加大不良资产处置力度。资管公司下半年也将大力拓展业务，积极参与中小银行等机构不良资产收购。例如，中国长城（000066）下半年计划出资800亿元收购金融及非金融类不良资产。
“商业银行不良贷款规模和比率虽然走高，但相对于中国目前的经济总量、银行业规模以及金融体系的风险处置能力而言，仍可控可防，通过市场化的手段可以实现对银行业不良风险的逐步化解。”民生银行首席研究员温彬表示。
记者还了解到，为防范高风险影子银行风险反弹回潮，相关部门将对高风险业务保持高压态势。其中，将规范交叉金融产品，持续整治互联网金融风险，严厉打击非法集资等违法违规金融活动。
监管部门还将精准有效施策，及时处置不同类型机构风险。实际上，“精准拆弹”重点领域风险一直是金融风险防控工作的重点。例如，银保监会日前对天安财险、新华信托等六家保险、信托机构实施接管。银保监会新闻发言人表示，托管组将坚持分类施策，根据每家公司的不同风险，采取不同的化解方式，坚持守住底线，确保不发生系统性金融风险。
加快补齐风险处置制度短板
在有序处置重点领域突出风险的同时，监管部门将加快防范化解金融风险制度建设，补足监管制度短板。
近期，一系列旨在强化风险防控的政策相继落地。例如，银保监会近日印发《健全银行业保险业公司治理三年行动方案（2020-2022年）》，将深入整治股权与关联交易乱象视为工作重点，进一步整治资本质量不实、股权关系不清、股东行为不当等突出问题。“中小银行风险背后的根源在于公司治理失灵，以及与之相关的金融腐败和违法犯罪。应从关键点入手，探索建立规范有效的中小银行公司治理机制。”包商银行接管组组长周学东近日撰文表示。
此前，银保监会等多部门联合印发了中小银行深化改革和补充资本工作方案，全面部署推进城商行、农信社改革和风险化解工作，多途径增强中小银行资本实力。
《经济参考报》记者获悉，下一步，更多防风险补短板政策措施将推出，包括完善资本市场基础制度，引导理财、信托、保险等为资本市场增加长期稳定资金，抓紧研究提出国内系统重要性银行名单，对于名单内的金融机构，组织制定恢复与处置计划，并建立高效的问题机构风险处置机制，以进一步实现对风险机构的精准施策。
“金融和实体经济共生共荣。为实体经济服务是金融的天职和宗旨，也是防范金融风险的根本举措。”郭树清表示，面对复杂严峻的经济形势，既要进一步提升金融服务质效，推动经济发展尽快步入正常轨道，也要“分类施策、精准拆弹”，有序处置重点领域突出风险，实现稳增长和防风险长期均衡。
关注同花顺财经（ths518），获取更多机会
(function(){var obj = null;if(document.getElementById('arctTailMark')) {obj = document.getElementById('arctTailMark');}if(obj!=null){var str = '(image_address=""http://i.thsi.cn/images/article/logo.jpg"")  返回首页';var showed = 0;try{var oo = obj.previousSibling;while(oo.nodeType!=1 || oo.innerHTML.replace(/\s|\u3000/g,'').length==0){oo = oo.previousSibling;}if(oo.nodeType==1 && oo.tagName.toLowerCase()=='p') {var span = document.createElement('span');span.innerHTML =str;oo.appendChild(span);showed = 1;}}catch (e){}if(showed == 0){obj.innerHTML =str;}}})();
责任编辑：cjh",2020-09-02 00:41:36,同花顺
