,title,content,pub_time,src
8,沪东中华13000吨重吊船实现船体数字化建造,"(image_address=""http://e.thsi.cn/img/88c9c416ee2419cc"")
沪东中华于2019年7月成立了新一代数字化造船模式实船应用项目组，以13000吨重吊船为推进载体，借助3DE三维体验平台，逐步实现全船和全专业的数字化应用。
攻关小组开展业务需求与流程梳理、软件功能开发、业务培训、环境配置、基础建库等技术准备工作，以及整船的建模出图工作。经一年努力，完成了全船10个总段的结构详细设计SFD建模，92个分段的结构施工设计SDD建模以及全船所有分段的三维作业指导书编制工作，实现了13000吨重吊船船体无纸化作业。
(image_address=""http://e.thsi.cn/img/1ced0323e1e32eb0"")
经过充分调研和论证，本次应用采用达索系统3DE平台2019X版本开展工作，这是国内该版本软件首次应用于实船设计建造。项目推进过程中，结构设计团队凝心聚力，攻坚克难，一举打破传统的“先三维建模后二维出图”模式，创新出一种“基于模型的三维”标注方式，受到业内专家的好评。
结构设计团队应用基于三维实体模型数字化技术，解决了传统三维设计意图表达问题，节省了三维设计模型到二维图纸的转换步骤，使工艺制造信息更直观更统一，真正实现设计工艺制造的一体化。按照建造流程，以三维模型方式展示装配过程，生成了用于指导现场生产的三维作业指导模型，通过PAD将生成的三维作业指导模型进行建造无纸化、可视化应用，保证了在整个产品生命周期内设计数据、工艺数据、生产数据的准确性、同源性。
关注同花顺财经（ths518），获取更多机会
(function(){var obj = null;if(document.getElementById('arctTailMark')) {obj = document.getElementById('arctTailMark');}if(obj!=null){var str = '(image_address=""http://i.thsi.cn/images/article/logo.jpg"")  返回首页';var showed = 0;try{var oo = obj.previousSibling;while(oo.nodeType!=1 || oo.innerHTML.replace(/\s|\u3000/g,'').length==0){oo = oo.previousSibling;}if(oo.nodeType==1 && oo.tagName.toLowerCase()=='p') {var span = document.createElement('span');span.innerHTML =str;oo.appendChild(span);showed = 1;}}catch (e){}if(showed == 0){obj.innerHTML =str;}}})();
责任编辑：cjh",2020-07-24 04:48:12,同花顺
9,今年成都所有居民小区将基本配齐垃圾分类投放设施,"(image_address=""http://e.thsi.cn/img/ed35c9e25c8bf3f8"")
(image_address=""http://e.thsi.cn/img/ed35c9e25c8bf3f8"")
7月23日，由成都市生活垃圾分类工作推进领导小组办公室主办，成都市城市管理委员会、成都市生活垃圾分类管理服务中心承办的“垃圾分类就是新时尚”之“垃圾分类齐参与 健康文明新时尚”主题宣传活动，走进了金牛区新金牛公园。
活动中，成都市生活垃圾分类管理服务中心相关负责人表示，《成都市生活垃圾管理条例》预计将于下半年出台，配合《条例》出台，今年成都所有居民小区将基本配齐垃圾分类投放设施。
截至今年6月底
全市居民小区垃圾分类
覆盖率超六成
成都商报-红星新闻记者了解到，截至今年6月底，成都全市党政机关、学校、医院、商业综合体生活垃圾分类覆盖率均达100%，全市居民小区垃圾分类覆盖率为64.5%。
接下来，成都市在生活垃圾管理方面将着力建设“五大体系”，包括：法规体系建设，推动《成都市生活垃圾管理条例》出台；政策体系建设，保障《条例》顺利实施，制定出台配套政策措施；工作体系建设，建立完善市、区、街道、社区四层级和市级行业主管部门之间的工作体系；标准体系建设，围绕生活垃圾制定一系列标准；设施体系建设，进一步完善成都市垃圾分类投放、收集、运输和处置设施体系。
编写垃圾分类知识读本
让学生养成分类习惯
主题宣传活动所在的金牛区，正在推动建设4个成建制示范街道。其中今年3月，沙河源中加水岸小区成功创建为全市20个示范小区之一，该小区不断完善分类投放设施，加装感应开关门和太阳能装置，实现了生活垃圾无接触和绿色投放，提高群众分类投放体验和支持度。
同时小区建立了分类督导员和引导员体系，实行定时定点投放；对生活垃圾中转房进行改造，严格实行分类收集和分类运输。另外，该小区还设立“最佳投手奖”、“最佳活跃奖”、“垃圾分类光荣榜”等激励、引导居民正确投放。
在学校方面，梧桐小学通过设置“六个一”，即学校一面文化墙、班级一块板报角、校园一套回收站、每班一套垃圾桶、校园一组展示柜、班级一名宣传员，完善了分类设施并营造浓厚的分类氛围。学校教师还编写垃圾分类知识读本纳入教学实践，学生动手创作垃圾分类绘本故事，师生共同创作垃圾分类主题文创作品，潜移默化让学生养成分类习惯，进而带动家庭和社区。
成都商报-红星新闻记者 叶燕 林聪 实习生 肖皓月 摄影记者 吕国应
关注同花顺财经（ths518），获取更多机会
(function(){var obj = null;if(document.getElementById('arctTailMark')) {obj = document.getElementById('arctTailMark');}if(obj!=null){var str = '(image_address=""http://i.thsi.cn/images/article/logo.jpg"")  返回首页';var showed = 0;try{var oo = obj.previousSibling;while(oo.nodeType!=1 || oo.innerHTML.replace(/\s|\u3000/g,'').length==0){oo = oo.previousSibling;}if(oo.nodeType==1 && oo.tagName.toLowerCase()=='p') {var span = document.createElement('span');span.innerHTML =str;oo.appendChild(span);showed = 1;}}catch (e){}if(showed == 0){obj.innerHTML =str;}}})();
责任编辑：cjh",2020-07-24 04:45:59,同花顺
10,滨海旅游领跑海洋经济,"(image_address=""http://e.thsi.cn/img/d8345d99a7f3e9"")
在海南陵水，游客体验滑翔伞运动，从空中俯瞰海岛美景。 李 民摄（人民视觉）
(image_address=""http://e.thsi.cn/img/3c442b11ac25cd83"")
游客在山东省日照万平口风景区海上游玩。 李 青摄（人民视觉）
滨海旅游业持续较快增长，2019年实现增加值18086亿元，比上年增长9.3%，发展模式呈现生态化和多元化，滨海旅游业正在领跑海洋经济。
据自然资源部发布的《2019年中国海洋经济统计公报》显示：2019年全国海洋生产总值89415亿元，比上年增长6.2%。海洋经济结构持续优化，海洋第一、第二和第三产业增加值占海洋生产总值的比重为4.2％、35.8％和60.0％。滨海旅游业、海洋交通运输业和海洋渔业作为海洋经济发展的支柱产业，其增加值占主要海洋产业增加值的比重为50.6%、18.0%和13.2%。
资源丰富市场庞大
暑期来临，海南三亚的海岛游、体育游、亲子游等呈现强劲复苏的态势。广东汕头南澳岛迎来大批自驾游客。众多游客前往惠州的黄金海岸、巽寮湾等景区清凉度夏。滨海旅游在盛夏活力四射，成为许多人出游的首选。
海洋是最富吸引力的旅游资源之一。生命开始于海洋，人类对海洋有一种先天的亲近感。厦门大学旅游管理与规划研究所主任林德荣介绍，滨海旅游业是以海岸带为依托，以海水、阳光、沙滩为主要内容，为满足人们的精神和物质需求而进行的海洋游览、娱乐、体育和疗养等活动，包括沿海地区的城市建设、商务活动等与旅游活动相关的食、住、行、游、购、娱等诸要素所形成的综合产业。
中国大陆海岸线长1.8万多公里，拥有面积大于500平方米的海岛7300多个。特有的地貌特征、复杂的生态系统、广阔的海域空间等为滨海旅游发展提供了丰富的旅游资源。此外，海洋文化具有开放性和多样性，沿海地区的文化艺术、风俗习惯都是滨海旅游独有的人文资源。
中国旅游研究院副院长唐晓云告诉记者：“中国发展滨海旅游具有较为突出的资源和市场优势。渤海湾、长三角、珠三角、海峡西岸和海南五个区域的滨海旅游活跃，沿海分布着天津、秦皇岛、青岛、上海、厦门、三亚等主要旅游城市，既是重要的旅游客源地，也是重要的旅游目的地。同时，中国国内游有60亿人次的市场规模，且需求正在向品质化、休闲化发展，休闲度假人数增长快，滨海旅游具备坚实的资源和巨大的市场。”
活力强劲成为支柱
海洋旅游业实有企业基数大、增长快，连续5年保持两位数增长。国家海洋信息中心主任何广顺在解读《2019年中国海洋经济统计公报》时谈到，随着供给侧结构性改革持续推进，涉海市场主体活力进一步释放。
近年来，沿海地区的滨海旅游呈现强劲发展态势。2018年，浙q江海岛地区接待游客接近1亿人次，总收入超过1500亿元。滨海旅游成为浙江海洋经济新亮点。《广东海洋经济发展报告（2020）》显示，2019年广东海洋生产总值在全国率先突破2万亿元，海洋生产总值连续25年位居全国首位。海洋旅游业、海洋化工业、海洋交通运输业增加值分别达到3581亿元、832亿元、737亿元，海洋旅游业遥遥领先。
唐晓云认为，滨海旅游成为海洋经济的支柱产业有多方面原因，一是东部地区分布着中国主要的经济大省，大部分城市的滨海旅游休闲需求旺盛。二是滨海旅游内涵广泛，基本覆盖了海滨、海上、海下、近海、远洋等发展空间，产业的综合带动力强。
滨海旅游日益成为旅游消费的新热点。采访中记者了解到，滨海旅游业已形成包括海洋观光游览、休闲娱乐、度假住宿、体育运动、海底休闲、低空飞行、邮轮游艇等立体式的旅游产品体系。目前最受欢迎的滨海旅游业态包括：公共海滩、海洋主题公园、滨海度假酒店、海上运动项目、夜市和酒吧街等。
“滨海旅游的休闲度假属性强，游客过夜率高，便于发育出完善的旅游消费业态，不仅带来高客流量，还能实现较高的客单价，具有很强的消费带动作用。”中国旅游协会旅游营销分会副会长、中青旅（600138）联科公关顾问有限公司执行总经理葛磊认为。
潜力巨大创新转型
海洋经济前景广阔。滨海旅游业作为其重要支柱，更是潜力巨大。海岛度假、邮轮旅游、海洋运动旅游、海洋文化旅游等新型滨海旅游产品正引领着旅游经济和海洋经济的发展。滨海旅游正在成为建设海洋生态文明、实现兴海富民以及推动海洋经济持续、健康、快速发展的增长点。
当下，旅游业正面临疫情防控常态化、旅游消费需求品质提升、旅游消费方式多样化，旅游产品智慧化的发展趋势。林德荣认为，要保持滨海旅游高质量发展，创新驱动是必由之路，尤其是发展模式、体制机制、经营理念和服务意识与服务手段等方面的创新。
唐晓云认为，滨海旅游业要实现持续高质量发展，首先要加强海洋旅游资源保护。其次要大力推动包含体育、医疗、美食、会展、渔业、生物技术、装备制造等在内的“滨海旅游+”的多行业融合，以推进滨海旅游产品体系升级，推动形成符合国民休闲需求的滨海旅游新格局。
在葛磊看来，疫情之后，生态红利会逐渐释放，人们更加渴望亲近大自然，尤其是海洋。对于滨海旅游而言，一方面要把握旅游消费心理对于陪伴、健康、减压的诉求，给予游客更用心的服务体验；另一方面要适应消费升级需求，着力打造滨海旅游在亲子、研学、婚拍、户外、会展、康养等领域的产品深耕，持续推动滨海旅游的高质量转型。
关注同花顺财经（ths518），获取更多机会
(function(){var obj = null;if(document.getElementById('arctTailMark')) {obj = document.getElementById('arctTailMark');}if(obj!=null){var str = '(image_address=""http://i.thsi.cn/images/article/logo.jpg"")  返回首页';var showed = 0;try{var oo = obj.previousSibling;while(oo.nodeType!=1 || oo.innerHTML.replace(/\s|\u3000/g,'').length==0){oo = oo.previousSibling;}if(oo.nodeType==1 && oo.tagName.toLowerCase()=='p') {var span = document.createElement('span');span.innerHTML =str;oo.appendChild(span);showed = 1;}}catch (e){}if(showed == 0){obj.innerHTML =str;}}})();
责任编辑：cjh",2020-07-24 04:41:16,同花顺
11,工业经济运行回到正常轨道,"近年来，河北省邯郸市肥乡区坚持培育发展先进装备制造产业，打造以环保汽车、精密铸件等为核心的特色装备制造产业基地，助推经济结构优化升级。目前，肥乡区规上装备制造业企业达24家。图为近日工人在肥乡区一家装备制造企业生产车间工作。
今年上半年，新冠肺炎疫情从供需两侧对工业经济造成了前所未有的冲击。在此背景下，工业经济运行情况如何？接下来将呈怎样的走势？在7月23日举行的国新办新闻发布会上，工业和信息化部相关负责人指出，二季度以来工业经济稳步回升，经济运行初步判断已经回归到了正常轨道。综合来看，我国工业经济的基本面是好的，疫情对我国工业经济的影响总体可控，长期向好的基本趋势不会由于疫情的影响和国际经济下行的冲击有所改变。
各项指标走出底谷
“上半年我国工业经济各项指标先降后升，二季度运行状态逐月好转。”工业和信息化部副部长辛国斌表示，具体来看，有4个方面的积极变化。
工业经济运行各项指标走出底谷。前两个月规模以上工业增加值同比大幅下降13.5%。到3月份，降幅收窄至1.1%。4、5、6三个月分别增长3.9%、4.4%和4.8%。同时，市场销售回暖，这几个月的产销率保持在98%左右。企业预期向好，6月份制造业采购经理人指数是50.9%，连续4个月处于荣枯线以上。
主要行业、重点省份同步好转。41个工业大类中，二季度超过半数的行业实现正增长，其中装备制造业5、6两个月增加值增速分别达到9.5%和9.7%。从地区看，上半年有18个省份增加值实现正增长。10个工业大省中，绝大多数恢复了正增长。
新兴产业逆势增长。上半年高技术制造业增加值增长4.5%，在前两个月猛降14.4%的情况下快速反弹，3月份以来各月增速均保持在8.9%-10.5%之间。生物医药、电子及通信设备、医疗仪器设备等行业增加值同比分别增长13.8%、7.2%和27.2%，6月份3D打印设备、智能手表、充电桩等产品产量增长超过40%。
稳企惠企政策发力增效。今年以来，已累计减税降费超过1万亿元。在金融政策方面，3次实施普惠降准、定向降准，综合运用再贴现再贷款等措施，创新直达实体经济的货币政策工具，前5个月制造业中长期贷款余额同比增长19.6%。
中小企业运行回暖
中小企业是保护生产力的主力军、稳就业的主渠道。工信部数据显示，中小企业运行明显回暖，上半年规模以上中小企业生产降幅比一季度收窄10.3个百分点，前5个月利润降幅比一季度收窄21.7个百分点。进入二季度以来中小企业的主要经济指标增速均由负转正，其中营业收入4、5月份分别增长了8.6%和3%，利润总额分别增长了14.9%和14.1%。
“随着各项惠企政策落地生效，中小企业克服疫情影响，加快恢复发展。”辛国斌表示，在疫情冲击下，中小企业资金链断裂是一个非常严重的问题。“为此，我们进一步加大了清欠和清理规范涉企收费力度，上半年已清偿政府部门和大型国有企业无分歧账款827亿元，各地对500万元以下的无分歧欠款全部清零。”
在强化政银企对接方面，对中小微企业实施阶段性延期还本付息政策，支持金融机构加大对小微企业信贷投放。截至目前，已对超过1.8万亿元贷款本息实施延期。普惠性小微企业贷款余额超13万亿元，同比增长27.6%；平均利率6.03%，较去年全年的平均利率降低了0.67个百分点。
工信部运行监测协调局局长黄利斌指出，下一步，将推动各地区、各部门狠抓现有政策落实，推动中小企业稳定健康发展。在全国范围内开展促进中小企业发展环境的第三方评估；支持地方加大专精特新中小企业培训力度，培育第二批专精特新“小巨人”企业；进一步推动缓解中小企业融资难的问题；健全中小企业公共服务体系。
激发潜在消费活力
下半年，工业经济形势如何？
辛国斌指出，当前国际疫情仍在蔓延，世界经济陷入深度衰退，国际贸易环境恶化已是不争的事实；国内常态化疫情防控任务仍然艰巨，需求恢复仍有一个过程，企业经营困难还是比较严重，洪涝等各种自然灾害也对经济复苏产生一些不利影响。
“下一步，我们将在做好疫情常态化防控的基础上，继续加大工作力度，切实保持制造业产业链、供应链稳定。”辛国斌表示，将打通断点堵点难点，加强国内外合作，聚焦重点产业链，推动龙头企业带动上下游中小企业的协同复产达产扩产，促进大中小企业融通发展，组织召开电子信息、消费品等重点行业全球产业链供应链畅通研讨会，畅通物流、人流、资金流、信息流，保障产业链、供应链正常运转。
“此外，落实扩大内需战略，释放消费潜力。”辛国斌说，通过促进消费畅通、供需畅通，加快落实汽车消费的政策措施，鼓励互联网平台带动外向型企业出口转内销；加快推进5G等新型基础设施建设，鼓励各地开通4K超高清频道、增加节目源，积极拓展线上线下新应用，激发潜在的消费活力，带动产业链、供应链加快运转。
辛国斌认为，展望下半年，有不利因素，也存在有利条件。随着国家扩大财政赤字和地方政府专项债规模、加大减税降费力度、强化稳企业金融支持等措施进一步落地，基建投资托底支撑作用将进一步发力，保就业促消费政策将持续显效，疫情催生的新产业（300832）新业态新模式为经济增长注入新动能。“我们应该有信心、有能力继续保持工业经济平稳向好的运行态势。”
关注同花顺财经（ths518），获取更多机会
(function(){var obj = null;if(document.getElementById('arctTailMark')) {obj = document.getElementById('arctTailMark');}if(obj!=null){var str = '(image_address=""http://i.thsi.cn/images/article/logo.jpg"")  返回首页';var showed = 0;try{var oo = obj.previousSibling;while(oo.nodeType!=1 || oo.innerHTML.replace(/\s|\u3000/g,'').length==0){oo = oo.previousSibling;}if(oo.nodeType==1 && oo.tagName.toLowerCase()=='p') {var span = document.createElement('span');span.innerHTML =str;oo.appendChild(span);showed = 1;}}catch (e){}if(showed == 0){obj.innerHTML =str;}}})();
责任编辑：cjh",2020-07-24 04:41:08,同花顺
12,小心！别踩二手交易平台的“坑”,"近年来，随着互联网二手交易平台的飞速发展，不少人在网上买卖日用百货、数码产品、家居用品等闲置物品。防疫期间，网络二手交易平台活跃度更是加速提升。但一些平台上有卖家趁机出售过期食品、假酒假包等，影响恶劣。如何避免互联网二手交易平台成为“假劣货集市”，成为业界关心的话题。
有人借二手交易卖假货
在北京上大学的小王，由于平日酷爱打篮球，收藏各式各样的篮球鞋成为他的兴趣之一。近日，小王在某互联网二手交易平台看到有人出售闲置的某品牌限量款篮球鞋，并再三保证“绝对是正品”“不满意可申请退货”。小王动了心，很快向对方支付了一笔不菲的费用。几天后，满怀期待的小王拆开寄来的快递却傻了眼，原来对方寄来的是一款假鞋。再次试图联系卖家时，小王发现对方早已“人去楼空”。
中国黄金集团首席经济学家万喆认为，随着经济社会不断发展，居民消费需求与消费能力逐步提升，买的东西多了，手头闲置的东西自然越来越多，人们交易闲置物品的需求也就应运而生。“但是，由于我国互联网二手交易平台起步时间较晚，相应的规章制度还不健全，对于二手物品交易方面明确的法律规定较为匮乏，造成违约成本过低，给了一些不法分子钻空子的机会”。
北京师范大学网络法治国际中心执行主任、中国互联网协会研究中心秘书长吴沈括表示，在交易过程中，由于买卖双方信息不对称，卖方对售卖物品的了解程度远超过买方，加之因缺乏完善的信用体系，卖方售卖伪劣产品无法和其信用度挂钩，这些都给了卖方售卖伪劣产品的“底气”，导致欺诈行为频发。
“对买方来说，也存在不少恶意欺诈的问题。”万喆介绍说，比如卖方在互联网二手交易平台上出售了一个衣柜，但买方收货后故意咬定柜门或把手存在质量问题并要求砍价，卖方若没有提前保留证据，很难“自证清白”，只能被迫赔钱。“由于被制裁可能性很小，现在很多买方热衷于这类骗术，还起了个名字叫‘到手刀’，并从中牟利，扰乱正常的市场秩序。”
亟待建立信用评价体系
尽管互联网二手交易平台大多对商品发布禁区有所规定，比如禁止发布制售假货、高风险商品等，且出售过期食品、假货劣货等行为同时也被相关法律法规所严格禁止，但一些相关物品仍然被公开交易。
吴沈括认为，种种规章制度被轻易绕开，说明互联网二手交易平台监管不力。“二手交易平台应加强用户资质审核，对卖方的信用情况进行监控与记录，建立并完善网上交易的信用评价体系和交易风险警示机制。二手交易平台还应满足买方要求其承担起居间服务的要求，例如可以在售前做好二手物品质量监测，且提供完善的售后服务，使买方投诉有途径。”吴沈括说。
万喆表示，对于买方来说，也应尽可能提高风险意识。据调查，在二手商品交易过程中，买方反映最多的就是二手商品质量存疑等问题，且事后往往因证据不足陷入维权的“死胡同”，“这就提醒买方一方面要与平台结合进行信用系统的完善，另一方面，自己在买卖过程中也要进行合理估价以及质量预期，使自己的损失降到最低。”
近年来，由于买卖双方纠纷频现，一些互联网二手交易平台纷纷引入第三方力量协助化解。比如闲鱼就推出了小法庭机制，邀请17位不同身份不同背景的优质用户担任评审员，对解决纠纷事件投票表决，投票机制为17票9胜制。“再加上其他互联网二手交易平台纷纷‘查漏补缺’，我们可以看到互联网二手交易平台正在积极完善自身的规则，强化监管责任与义务，这种行为应当予以鼓励。”万喆说。
从长远看，作为一种处于高速发展期的新业态，互联网二手交易平台前景可期，因对可持续发展、循环经济等方面有积极作用，应该鼓励和支持其规范发展。专家认为，有关部门应尽快研究出台相关法律法规，明确买卖双方的权利和责任，做到有法可依、有规可循，进一步推动互联网二手交易平台健康有序发展，保护消费者权益，让售假商户无缝可钻。
关注同花顺财经（ths518），获取更多机会
(function(){var obj = null;if(document.getElementById('arctTailMark')) {obj = document.getElementById('arctTailMark');}if(obj!=null){var str = '(image_address=""http://i.thsi.cn/images/article/logo.jpg"")  返回首页';var showed = 0;try{var oo = obj.previousSibling;while(oo.nodeType!=1 || oo.innerHTML.replace(/\s|\u3000/g,'').length==0){oo = oo.previousSibling;}if(oo.nodeType==1 && oo.tagName.toLowerCase()=='p') {var span = document.createElement('span');span.innerHTML =str;oo.appendChild(span);showed = 1;}}catch (e){}if(showed == 0){obj.innerHTML =str;}}})();
责任编辑：cjh",2020-07-24 04:40:40,同花顺
