,title,content,pub_time,src
13,扭转近两年下滑趋势 证券从业人员数量出现正增长,"(image_address=""http://e.thsi.cn/img/2a3c8f3c84a50bef"")
⊙记者 卢丹 ○编辑 孙放
据金融终端统计证券业协会数据，截至8月26日，登记在册的证券从业人员总数为33.02万人，较2019年末有小幅增长，结束了近两年从业人员总数连续下滑的态势。
今年以来，股市交投趋于活跃、资本市场改革红利持续释放，券商业绩普遍出现大幅增长。在此背景下，不仅从业人员数量已开始正增长，券商的各类融资活动也明显增多。
回看前3年的数据：2017年末，证券从业人员数量为34.23万人，2018年末降至33.58万人，至2019年末进一步减少到32.88万人，呈逐年递减之势。而目前，从业人员数量已较去年底时有所增加，扭转了此前的下滑趋势。
而通过分析从业人员结构的变化，可总结出三个业务板块的发展走向：首先是经纪业务从业人员数（经纪人及投资顾问合并统计）呈逐年下滑趋势，但进一步细分，经纪人的数量在加速减少，投资顾问数则逐年增加；其二，研究人员数量呈逐年上升趋势；第三，投行业务人员数量也在逐年上升，且今年以来的增量更为显著。
具体来看，经纪人被逐年出清的力度较大。2017年末，券商的经纪人总数为9.04万人，而目前已降至6.92万人。与之对应，投资顾问的数量则从2017年末的4.02万人增至5.76万人。
今年以来，经纪人数量缩减规模最大的3家券商分别为申万宏源、海通证券和方正证券，分别减少527人、358人和324人。同时，头部券商中信证券的经纪人数量已降至10人，几乎全部出清。而今年投资顾问人数增加最多的3家券商是中信证券、方正证券和国泰君安，分别增加441人、351人和324人。
对此，一家中型券商的财富管理部负责人认为：这些数据说明，一方面，券商经纪业务由线下转至线上的趋势十分明显，新设营业部配备的人员数量一般都很少；另一方面，经纪业务的财富管理转型是大势所趋，随着居民财富管理需求日益增加，预计券商压缩经纪人数量、增加投资顾问的力度还将加大。
研究所业务方面，登记在册的分析师数量从2017年末的2589人增至目前的3457人，今年以来新增分析师人数最多的3家券商是长江证券、开源证券和华西证券（002926）。其中，开源证券、华西证券均以卖方研究业务作为展业重点。
投行业务方面，保荐代表人数量由2017年末的3489人增至4212人。
从各家券商的数据看，中信证券、中信建投（601066）和民生证券今年以来保荐人队伍扩充明显，分别增加58人、48人、42人，而被处罚的广发证券保荐人大量流失，减少29人。
关注同花顺财经（ths518），获取更多机会
(function(){var obj = null;if(document.getElementById('arctTailMark')) {obj = document.getElementById('arctTailMark');}if(obj!=null){var str = '(image_address=""http://i.thsi.cn/images/article/logo.jpg"")  返回首页';var showed = 0;try{var oo = obj.previousSibling;while(oo.nodeType!=1 || oo.innerHTML.replace(/\s|\u3000/g,'').length==0){oo = oo.previousSibling;}if(oo.nodeType==1 && oo.tagName.toLowerCase()=='p') {var span = document.createElement('span');span.innerHTML =str;oo.appendChild(span);showed = 1;}}catch (e){}if(showed == 0){obj.innerHTML =str;}}})();
责任编辑：cjh",2020-08-27 04:31:08,同花顺
14,券商年度分类结果出炉 A类增至47家占比近半,"⊙记者 刘艺文 王红 ○编辑 孙放
一年一度的券商大考发榜了！根据证监会昨晚公布的“2020年证券公司分类结果”，今年共有A类券商47家，比去年多9家。其中，AA级券商15家，比去年多5家；A级券商里，中小券商接近20家。今年的B类券商有39家，较去年减少11家。
今年共有98家券商参与分类评级。其中，评级上升的有32家，下降的有25家，39家保持不变。2家外资券商摩根大通、野村东方首次参与评级，皆为BBB级。
具体来看，15家AA级券商有国泰君安、国信证券、海通证券、华泰证券、平安证券、招商证券、中金公司、中信建投（601066）、中信证券，还有新升至AA级的安信证券、光大证券、国金证券、申万宏源、银河证券、中泰证券（600918）。
此外，今年的C类券商为11家，其中CCC级6家，被接管的新时代证券、国盛证券均为CCC级。而去年的D类券商网信证券今年仍是D类。
从升降幅度看，国融证券今年连升5级，从去年的C级升至BBB级；长江证券、恒泰证券、九州证券等上升4级。而江海证券则连降5级，从去年的BBB降到了C级，金元证券也下降4级。
根据《证券公司分类监管规定》，证券公司分为A（AAA、AA、A）、B（BBB、BB、B）、C（CCC、CC、C）、D、E等5大类11个级别。A、B、C三大类中各级别公司均为正常经营公司，其类别、级别的划分仅反映公司在行业内业务活动与其风险管理能力及合规管理水平相适应的水平。D类、E类公司分别为潜在风险可能超过其可承受范围及因发生重大风险被依法采取风险处置措施的公司。
据了解，今年的分类结果更加适应证券行业的发展状况和审慎监管需要。具体体现在以下几方面：
首先，适当增加A类证券公司家数。近年来，在监管机构和企业自身的努力下，行业整体的风险管控能力有所提升，重点业务领域风险趋于收敛。因此A类公司家数有所上升。
其次，进一步强化了专业服务导向，以适应证券行业差异化发展、错位转型发展的趋势，引导证券公司突出主业，做优做强。今年，在财富管理、机构客户服务、财务顾问等特色化的业务方面，均有部分中小型券商获得加分。
再次，在风险管理方面，加强了四方面的引导。如引导证券公司更加重视风控指标的持续有效。在最近3个、4个评价期内，券商主要风控指标若持续达标，可分别获2分、3分的加分。
引导行业更加重视资本约束，评价期内风险覆盖率达到130%，且净资本150亿元以上的加2分，有近1/3的证券公司获得加分。风险覆盖率达到130%的加1分，其余证券公司都获得了加分。
同时，引导证券公司更加重视风险管理的全覆盖以及风险监测的有效性；引导证券公司的业务发展状况与风险管理能力更加适应。
最后，今年延续了履行社会责任的专项评价加分，有90家证券公司因此获得加分。另外新增了服务资本市场重大改革的专项评价，今年有21家证券公司因此而获得加分。
证监会表示，证券公司分类结果不是对证券公司资信状况及等级的评价，而是证券监管部门根据审慎监管的需要，以证券公司风险管理能力、持续合规状况为基础，结合公司业务发展状况，对证券公司进行的综合性评价。
证监会根据分类结果对不同类别的证券公司在监管资源分配、现场检查和非现场检查频率等方面实施区别对待的监管政策。分类结果主要供证券监管部门使用，证券公司不得将分类结果用于广告、宣传、营销等商业目的。
关注同花顺财经（ths518），获取更多机会
(function(){var obj = null;if(document.getElementById('arctTailMark')) {obj = document.getElementById('arctTailMark');}if(obj!=null){var str = '(image_address=""http://i.thsi.cn/images/article/logo.jpg"")  返回首页';var showed = 0;try{var oo = obj.previousSibling;while(oo.nodeType!=1 || oo.innerHTML.replace(/\s|\u3000/g,'').length==0){oo = oo.previousSibling;}if(oo.nodeType==1 && oo.tagName.toLowerCase()=='p') {var span = document.createElement('span');span.innerHTML =str;oo.appendChild(span);showed = 1;}}catch (e){}if(showed == 0){obj.innerHTML =str;}}})();
责任编辑：cjh",2020-08-27 04:30:42,同花顺
15,证监会公布券商分类结果 47券商评A,"证券时报记者 程丹
证监会昨日公布了2020年证券公司分类结果。根据评级结果，A类券商家数增加，今年A类公司共有47家，比去年新增9家。其中，AA级公司共15家，比去年新增5家；A级公司共32家，比去年新增4家。有部分特色化业务的中小券商获得加分，有近20家中小型券商被评为A类A级。
此次评审是根据7月最新发布的《证券公司分类监管规定》，经证券公司自评、证监局初审、证监会证券基金机构监管部复核，以及证监局、自律组织、证券公司代表等组成的证券公司分类评价专家评审委员会审议，确定了2020年证券公司分类结果。
证监会相关人士表示，整体来看，今年的评价体系突出了两方面内容。一是更加强化合规风控导向，合规方面，一旦券商出现违规、被采取监管措施的情况，按照规定要依法扣分；风控方面，对于没有违规，强调了风控的导向，要看风险管理的导向，风险管理做得好的、资本约束做得好的、风险管理全覆盖加分，如果说合规风控管理有部分缺陷，或者与业务发展整体不相匹配，还是会根据规定进行扣分。二是更加强化专业服务导向和差异化发展导向，无论是大券商还是中小券商都要在监管导向下得到更好的发展，对于财富管理、财务顾问等都有特色加分，深化差异化发展格局。
根据《证券公司分类监管规定》，证券公司分为A（AAA、AA、A）、B（BBB、BB、B）、C（CCC、CC、C）、D、E等五大类11个级别。A、B、C三大类中各级别公司均为正常经营公司，其类别、级别的划分仅反映公司在行业内业务活动与其风险管理能力及合规管理水平相适应的相对水平。D类、E类公司分别为潜在风险可能超过公司可承受范围及因发生重大风险被依法采取风险处置措施的公司。
风险管理方面，风控指标持续有效。最近三、四个评价体系主要风控指标持续达标，分别加2分、3分，行业的参评主体均获得以上加分，至少加到了2分。资本约束方面，风险覆盖率达130%且净资本150亿元以上的可加2分，有近1/3的证券公司获得2分的加分；风险覆盖率达130%的加1分，全部的证券公司均获以上加分。有90家证券公司因履行社会责任获得加分，新增了服务资本市场重大改革的专项评价，有21家券商因此获加分。
值得注意的是，仅网信证券评级为D，C类的券商有爱建证券、首创证券、太平洋证券、宏信证券、德邦证券、东海证券、江海证券、金元证券、中山证券、国盛证券等。
关注同花顺财经（ths518），获取更多机会
(function(){var obj = null;if(document.getElementById('arctTailMark')) {obj = document.getElementById('arctTailMark');}if(obj!=null){var str = '(image_address=""http://i.thsi.cn/images/article/logo.jpg"")  返回首页';var showed = 0;try{var oo = obj.previousSibling;while(oo.nodeType!=1 || oo.innerHTML.replace(/\s|\u3000/g,'').length==0){oo = oo.previousSibling;}if(oo.nodeType==1 && oo.tagName.toLowerCase()=='p') {var span = document.createElement('span');span.innerHTML =str;oo.appendChild(span);showed = 1;}}catch (e){}if(showed == 0){obj.innerHTML =str;}}})();
责任编辑：cjh",2020-08-27 04:26:19,同花顺
