,title,content,pub_time,src
0,瑞士将采取进一步经济措施促重启,"央视新闻客户端消息，当地时间17日，瑞士联邦经济委员盖.帕尔梅林(Guy Parmelin)表示，瑞士将采取进一步的经济措施促重启，他希望提供进一步的中长期激励计划，以提振经济。帕尔梅林表示国家可以加快已经批准的项目，为企业提供一个机会，特别是那些基础设施项目。此外，他希望在公开招标中尽可能优先考虑瑞士本土公司。
同花顺上线「疫情地图」
点击查看：新型肺炎疫情实时动态地图>>>
关注同花顺财经（ths518），获取更多机会
(function(){var obj = null;if(document.getElementById('arctTailMark')) {obj = document.getElementById('arctTailMark');}if(obj!=null){var str = '(image_address=""http://i.thsi.cn/images/article/logo.jpg"")  返回首页';var showed = 0;try{var oo = obj.previousSibling;while(oo.nodeType!=1 || oo.innerHTML.replace(/\s|\u3000/g,'').length==0){oo = oo.previousSibling;}if(oo.nodeType==1 && oo.tagName.toLowerCase()=='p') {var span = document.createElement('span');span.innerHTML =str;oo.appendChild(span);showed = 1;}}catch (e){}if(showed == 0){obj.innerHTML =str;}}})();",2020-05-17 17:51:08,同花顺
1,美国百年老店杰西潘尼百货申请破产保护,"新京报讯(记者王琳)当地时间5月15日，美国百货连锁店J.C.Penney(杰西潘尼百货)在官方网站发布消息称，因受新冠肺炎疫情影响，公司已向法院申请破产保护，将通过重组来减少债务，目前已取得9亿美元融资。
J.C.Penney在5月15日发布的公告中表示，公司已通过“债务人持有”融资取得9亿美元资金，可以在破产程序处理期间维持业务运作，而此次重组预计将减少数十亿美元债务。当地时间5月16日，J.C.Penney再次在官网发布公告称，法院已批准公司获得并使用其约5亿美元的现金抵押品，此外法院也授权公司继续支付非休假员工工资，向所有员工提供部分福利。并表示，目前J.C.Penney的门店正逐步分阶段重新开放，消费者可以通过其网络平台购物。
根据官网信息显示，J.C.Penney拥有118年的历史，目前在美国和波多黎各拥有约850家门店，员工近8.5万。此前曾有公开报道称，早在新冠肺炎疫情暴发前J.C.Penney就已面临将近40亿美元的债务压力，以及来自低折扣零售商的竞争和电商企业的挑战。其首席执行官Jill Soltau在5月15日的公告中表示，在疫情暴发之前公司在转型战略方面已经取得了重大进展，但受新冠疫情影响门店关闭，不得不采取金融结构调整策略。
Jill Soltau同时表示，现阶段公司的零售高管团队正在专注于重建公司业务，恢复财务实力，也在对公司的电子商务平台进行重大改革。这个重组计划是确保J.C.Penney在未来几十年里能继续为客户提供服务的最佳途径。
此外，在J.C.Penney申请破产之前，当地时间5月7日，拥有113年历史的美国奢侈品百货公司Neiman Marcus Group(内曼.马库斯)也申请了破产保护，获得6.75亿美元融资。
同花顺上线「疫情地图」
点击查看：新型肺炎疫情实时动态地图>>>
关注同花顺财经（ths518），获取更多机会
(function(){var obj = null;if(document.getElementById('arctTailMark')) {obj = document.getElementById('arctTailMark');}if(obj!=null){var str = '(image_address=""http://i.thsi.cn/images/article/logo.jpg"")  返回首页';var showed = 0;try{var oo = obj.previousSibling;while(oo.nodeType!=1 || oo.innerHTML.replace(/\s|\u3000/g,'').length==0){oo = oo.previousSibling;}if(oo.nodeType==1 && oo.tagName.toLowerCase()=='p') {var span = document.createElement('span');span.innerHTML =str;oo.appendChild(span);showed = 1;}}catch (e){}if(showed == 0){obj.innerHTML =str;}}})();",2020-05-17 17:51:06,同花顺
2,北京核酸检测机构增至70家 日检测能力达到5.1万个样本,"人民网北京5月17日电（池梦蕊） 今天下午，北京市召开新型冠状病毒肺炎疫情防控工作新闻发布会。北京新冠肺炎疫情防控工作领导小组医疗保障组副组长、北京市卫生健康委主任雷海潮介绍，经过近两个月努力，目前，北京全市70家医疗卫生机构可开展核酸检测，每日检测能力达到5.1万个样本。
他表示，实际上，最近一天检测的情况是最高不到3万的水平，所以综合目前的能力和实际需求来看，还有一定的富余量。
同花顺上线「疫情地图」
点击查看：新型肺炎疫情实时动态地图>>>
关注同花顺财经（ths518），获取更多机会
(function(){var obj = null;if(document.getElementById('arctTailMark')) {obj = document.getElementById('arctTailMark');}if(obj!=null){var str = '(image_address=""http://i.thsi.cn/images/article/logo.jpg"")  返回首页';var showed = 0;try{var oo = obj.previousSibling;while(oo.nodeType!=1 || oo.innerHTML.replace(/\s|\u3000/g,'').length==0){oo = oo.previousSibling;}if(oo.nodeType==1 && oo.tagName.toLowerCase()=='p') {var span = document.createElement('span');span.innerHTML =str;oo.appendChild(span);showed = 1;}}catch (e){}if(showed == 0){obj.innerHTML =str;}}})();
责任编辑：jdm",2020-05-17 17:46:57,同花顺
3,香港贸发局：第三届进博会港企展区扩容 提供一站式服务,"新华社上海5月17日电(王婧媛许晓青)将于今年11月在上海举行的第三届中国国际进口博览会上，香港贸发局组织香港企业参展的总面积将达1700平方米，比第二届进博会时增加约20%。
香港贸易发展局中国内地总代表吴子衡近日在上海相关签约仪式上介绍了香港贸发局积极组织港企参展第三届进博会的最新情况。
吴子衡介绍，进博会是香港企业拓展内地市场的发展契机，香港特别行政区政府对此高度重视。作为特区政府的官方组展机构，香港贸发局组织香港企业参展，计划设立“香港食品馆”和“香港服务业馆”。
他说，在过往两届进博会，香港企业都取得了丰硕成果，很多展商现场签订了合作意向和订单。今年，香港企业仍对进博会充满信心，有意参展的企业有增无减。
他表示，贸发局将继续组织更多香港企业和香港代理的优秀品牌到上海参展，并将充分发挥香港在国际贸易、金融、航空物流等领域的优势，引进一批供应链管理、检测验证、包装设计等领域的优秀港企，优化和提升香港服务业馆，打造一个面向全球企业的一站式“进口商品综合服务平台”，展示香港服务全球商品进入内地市场的专业能力。
此外，香港贸发局还将积极邀请更多的香港贸易商和国际采购商到进博会洽谈合作，进一步扩大进博会的国际影响力。
同花顺上线「疫情地图」
点击查看：新型肺炎疫情实时动态地图>>>
关注同花顺财经（ths518），获取更多机会
(function(){var obj = null;if(document.getElementById('arctTailMark')) {obj = document.getElementById('arctTailMark');}if(obj!=null){var str = '(image_address=""http://i.thsi.cn/images/article/logo.jpg"")  返回首页';var showed = 0;try{var oo = obj.previousSibling;while(oo.nodeType!=1 || oo.innerHTML.replace(/\s|\u3000/g,'').length==0){oo = oo.previousSibling;}if(oo.nodeType==1 && oo.tagName.toLowerCase()=='p') {var span = document.createElement('span');span.innerHTML =str;oo.appendChild(span);showed = 1;}}catch (e){}if(showed == 0){obj.innerHTML =str;}}})();",2020-05-17 17:29:43,同花顺
4,北京3个团队研发的新冠疫苗已进入二期临床,"新京报快讯(记者李玉坤吴为)5月17日，北京市政府召开新冠防控第107场发布会。
北京市科委主任许强介绍，目前北京有3种新冠检测试剂通过审批，5种新冠治疗药品通过审批。目前，5条技术路线8个团队在进行疫苗研发，其中有3个团队进入二期临床，数据都很好。
关注同花顺财经（ths518），获取更多机会
(function(){var obj = null;if(document.getElementById('arctTailMark')) {obj = document.getElementById('arctTailMark');}if(obj!=null){var str = '(image_address=""http://i.thsi.cn/images/article/logo.jpg"")  返回首页';var showed = 0;try{var oo = obj.previousSibling;while(oo.nodeType!=1 || oo.innerHTML.replace(/\s|\u3000/g,'').length==0){oo = oo.previousSibling;}if(oo.nodeType==1 && oo.tagName.toLowerCase()=='p') {var span = document.createElement('span');span.innerHTML =str;oo.appendChild(span);showed = 1;}}catch (e){}if(showed == 0){obj.innerHTML =str;}}})();",2020-05-17 17:29:09,同花顺
5,全国人大代表张智龙：应将中医药纳入公共卫生管理体系,"“现在很多中医都会看CT，两条腿走路比一条腿好。”
新京报讯(记者郭薇)在此次新冠肺炎疫情防治中，中医药发挥了不小的作用。日前，全国人大代表、中国农工民主党天津市委员会副主任委员、天津市中医药研究院副院长张智龙建议，将中医药机构和人员纳入公共卫生管理体系中，在国家各级疾控中心中设立中医科室或在相关科室中配备中医人员，以更好发挥其在疾病预防和突发公共卫生事件应急中的作用。
全国人大代表、天
津市新冠肺炎中医药防治专家组副组长
张智龙。受访者供图
作为天津市新冠肺炎中医药防治专家组副组长，张智龙在疫情防控期间从未停歇。他认为，中医药在新冠肺炎重症转轻症等方面发挥了重要作用。但同时，他也发现了一些问题，“现行的疾病防御体系中缺乏中医体制机制设置，影响了中医药早介入、深度融合的发挥。”
今年全国“两会”，张智龙带来了3条建议，分别关于充分发挥中医药在疾病预防和突发公共卫生事件应急中的作用、中医住院医师规范化培训轮转方案以及调整中医药收费项目促进中医药传承创新发展。
关于发挥中医药在疾病预防和突发公共卫生事件应急中的作用，张智龙表示，2017年起实施的《中医药法》明确，县级以上人民政府应当发展中医药预防保健服务……发挥中医药在突发公共卫生事件应急工作中的作用，加强中医药应急物资、设备、设施、技术与人才资源储备。医疗卫生机构应当在疾病预防与控制中积极运用中医药理论和技术方法。2019年印发的《关于促进中医药传承创新发展的意见》进一步明确，建立有效机制更好发挥中医药在流感等新发突发传染病防治和公共卫生事件应急处置中的作用。“但是《突发公共卫生事件应急条例》中，没有中医药的内容。”
更为紧要的是，我国各级疾控中心均没有中医机构设置和中医药人员的配备。“人才是事业发展的第一要素”，张智龙认为，没有相应的体制机制和人员队伍，法律就难以充分执行。
因此，张智龙建议尽快修订《突发公共卫生事件应急条例》，增加发挥中医药作用的相关规定，以更好地落实《中医药法》，畅通中医药参与疾病预防和突发公共卫生事件应急的渠道，为发挥中医药的预防、应急处置，提供人、财、物的制度保障。
他还建议，建立健全疾病预防控制和突发公共卫生事件的中西医协作机制和救治机制，完善中医药应对突发公共卫生事件应急的体制机制。同时，将中医药机构和人员纳入公共卫生管理体系中，在国家各级疾病预防控制中心中，设立中医科室或在相关科室中配备中医人员，加强公共卫生管理中西医结合队伍建设及其能力和水平的培养。此外，建立和完善疾病预防控制和传染病防治的学科体系，在公共卫生专业教育中增设中医专业课程，培养中西医结合的公共卫生管理人才。
张智龙师从中国工程院院士、天津中医药大学校长张伯礼，已经很久没有联系过恩师了。“实在是不忍心打扰老师，知道他太忙了，很期待在两会上与老师见面，见到后一定要抱抱他”。
对话
“很多中医都会看CT，两条腿走路比一条腿好”
新京报：在你看来，中医药在这次新冠肺炎防治工作中发挥的最大作用是什么？
张智龙：这次疫情防治工作中，大家看到了中医药对于重症转轻症等方面有非常大的作用，老百姓很认可。不仅如此，一些国外的专家也与我们视频联线，请教中医药在抗击新冠肺炎中的运用，他们也在使用中药。
新京报：有人认为中医药并不适合防疫工作，你怎么看待这种声音？
张智龙：诋毁中医的人，实际上是不了解中医。有人说中医很慢，但是中医治疗退热只需要一副药，中医退热是很快的，得分是什么病。包括我们现在很多中医都会看CT的片子，我认为两条腿走路总比一条腿好。
新京报：中医关于防疫的理论基础来自哪里？
张智龙：汉代的记载中就有关于“方舱医院”的内容，那时候就提出，有疫病的人要隔离，好多防疫思想老祖宗已经写在了书里。所以我认为以后公共卫生的教育中也要加入这方面内容，培养中西医结合，形成具有中国特色的公共卫生防疫体系。
新京报：目前在我国基层医疗机构中，中医药的发展现状如何？
张智龙：虽然现在国家在大力扶持中医，社区医院基本都有中医医师，但总体上中医在基层医院的占比偏少，人才队伍配备的难度很大，也没有梯队建设。而且，很多老百姓还不是很相信社区医院。这主要是一级医院的管理问题，导致医生出现散漫。国家应该更重视基层社区医生的培养，给他们提供更多外出交流学习的机会。
同花顺上线「疫情地图」
点击查看：新型肺炎疫情实时动态地图>>>
关注同花顺财经（ths518），获取更多机会
(function(){var obj = null;if(document.getElementById('arctTailMark')) {obj = document.getElementById('arctTailMark');}if(obj!=null){var str = '(image_address=""http://i.thsi.cn/images/article/logo.jpg"")  返回首页';var showed = 0;try{var oo = obj.previousSibling;while(oo.nodeType!=1 || oo.innerHTML.replace(/\s|\u3000/g,'').length==0){oo = oo.previousSibling;}if(oo.nodeType==1 && oo.tagName.toLowerCase()=='p') {var span = document.createElement('span');span.innerHTML =str;oo.appendChild(span);showed = 1;}}catch (e){}if(showed == 0){obj.innerHTML =str;}}})();",2020-05-17 17:13:02,同花顺
6,发展量子计算有什么用？ 生物公司教授：疫苗研发可在几天内完成,"(image_address=""http://e.thsi.cn/img/d827ede1c6451b51"")
凤凰网科技讯北京时间5月17日消息，据国外媒体报道，新型冠状病毒疫情正在证明，人类必须在某种病毒成为疫情之前更快地识别病毒并减小其影响。因为在当今全球，病毒的传播比以往任何时候都更快、更远和更频繁。生物技术企业家沙克尔(Noor Shaker)教授认为，一旦量子计算取得突破，那么新疫苗或药物的研发在几天内就可以完成。
如果说新型冠状病毒教会了人类什么，那就是，尽管自1918年西班牙流感爆发以来，人类识别和治疗流行病的能力已大大提高，但仍有很大的改进空间。在过去的几十年里，人类在提高快速检测能力方面取得了巨大的进步。仅仅用了12天的时间就用新技术绘制出了新型冠状病毒的外部“突刺”蛋白。而在上世纪80年代，对艾滋病病毒(HIV)进行类似的结构分析花了四年时间。
生物技术企业家沙克尔(Noor Shaker)教授强调了目前药物研发过程中的一个主要问题：高度依赖于经验。分子制造出来后需要进行测试，而不能预先准确地预测它的效果。测试过程本身是漫长、乏味、繁琐的，而且可能无法预测未来的并发症，只有当分子大规模部署时才能得出结论，这大幅降低了药物研发领域的成本与效益比。虽然人工智能/机器学习工具已经开发和部署优化了某些流程，但它们在流程中的关键任务上的效率是有限的。
理想情况下，减少时间和成本的一个好方法是将人类当前进行的昂贵且时间效率低下的研发和测试过程转移到计算机模拟环境下。今天人类已经可以获得分子的数据库。如果人类有无限的计算能力，就可以简单地扫描这些数据库并计算每个分子是否可以用于新型冠状病毒的治疗或疫苗。我们只需将这些分子输入到模拟环境中，然后在化学空间中进行筛选，以找到问题的解决方案。
如果坚持用传统计算机，那人类永远无法实现这个目标。为什么量子计算机在模拟分子方面比传统计算机好得多？
电子以一种强烈相关的方式在分子中扩散，每个电子的特性在很大程度上依赖于其相邻电子的特性。这些量子关联(或纠缠)是量子理论的核心，使得用经典计算机模拟电子非常棘手。
新型冠状病毒的“外突”蛋白包含成千上万个原子，因此传统计算机完全难以应付。蛋白质的大小使它们难以用经典的模拟方法精确地模拟出来，即使在当今最强大的超级计算机上也是如此。虽然化学家和制药公司使用超级计算机来模拟分子(尽管没有蛋白质那么大)，但他们现在使用的是非常粗糙的分子模型，这些模型无法捕捉完整模拟的细节，从而导致估计上存在巨大误差。
可能需要几十年的时间，才能制造出能够模拟蛋白质大小的分子的足够大的量子计算机。但当这样的计算机出现时，它将意味着制药和化学工业运作方式的彻底变革。
几十年后，有了合适的技术，人类可以把整个过程转移到计算机模拟中，让人类以惊人的速度得到结果。等到一种新的流行病的出现，科学家们可以在几天内识别并开发出一种潜在的疫苗或药物。
要实现所有这些梦想，需要对量子计算作为一种技术的发展进行持续的投资。正如高希尼教授(Shohini Ghose)在2018年的Ted演讲中所讲的那样：“灯泡的出现不是因为蜡烛的制造技术越来越好。灯泡是一种基于更深入的科学理解的不同技术。今天的计算机是现代技术的奇迹，并将随着人类的进步而不断改进。然而，再强大的传统计算机也无法解决药物研发中遇到的问题。它需要更适合这项任务的新技术——量子计算。”(良弼)
关注同花顺财经（ths518），获取更多机会
(function(){var obj = null;if(document.getElementById('arctTailMark')) {obj = document.getElementById('arctTailMark');}if(obj!=null){var str = '(image_address=""http://i.thsi.cn/images/article/logo.jpg"")  返回首页';var showed = 0;try{var oo = obj.previousSibling;while(oo.nodeType!=1 || oo.innerHTML.replace(/\s|\u3000/g,'').length==0){oo = oo.previousSibling;}if(oo.nodeType==1 && oo.tagName.toLowerCase()=='p') {var span = document.createElement('span');span.innerHTML =str;oo.appendChild(span);showed = 1;}}catch (e){}if(showed == 0){obj.innerHTML =str;}}})();",2020-05-17 17:11:47,同花顺
7,“互联网5G+”时代下知识产权保护论坛在深举行,"5月15日，以“强化知识产权运营保护，助力经济高质量发展”为主题的“互联网5G+”时代下知识产权保护论坛在中国(深圳)知识产权保护中心(以下简称“知保中心”)举行。
论坛现场。(image_address=""//comment.10jqka.com.cn/sourcepic/12/0MK7qs34.png"")发
本次论坛由深圳市市场监督管理局(知识产权局)指导，知保中心联合中国(南方)知识产权运营中心等单位主办，采取线上直播的方式，旨在与知识产权主管部门、司法部门、互联网科技企业、上市公司、行业协会、律师事务所和专家等知识产权专业人士共同探讨“互联网/5G+”时代背景下的知识产权保护问题，助力构建知识产权“严保护、大保护、快保护、同保护”体系。
活动中，知保中心与中国(南方)知识产权运营中心现场签订了战略合作协议。在主题演讲环节，深圳市中级人民法院法官王媛媛以“电子证据的司法保护难点问题”为题进行了演讲；平安科技法律合规部总经理田甜分析“互联网环境下知识产权保护新趋势”；知保中心副主任邓爱科进行互联网领域快速审查政策解析和案例分享。
谈及在新技术、新时代背景下各方如何紧跟时代发展加强知识产权保护，知保中心总监于波表示，5G是互联网移动通讯技术的更新升级，不是简单的4G+1G，5G互联网技术拥有广泛的应用场景，5G+产业的融合发展将为社会带来巨大的经济增长前景和海量的创新机会。同样，互联网/5G+时代的到来也对知识产权的保护提出了新的要求及挑战，希望通过此次论坛，推动各方积极为知识产权保护建言献策，助力深圳知识产权保护更上一层楼。
据了解，知保中心成立一年多以来，结合深圳的定位与需求，探索符合深圳优势产业发展的保护机制，中心以快速授权、快速维权的“两快”和全门类业务大厅、全链条服务平台的“两全”为核心，以“一站式”协同保护平台和国家海外纠纷应对指导深圳分中心、WIPO技术与创新支持中心(TISC)的“两大海外中心”为两翼，以社会组织库、服务机构库、备案企业库、海外维权专家库的“四库”为抓手，着力构建国际化、多元化、专业化的业务体系，助力互联网产业发展。(王明月)
关注同花顺财经（ths518），获取更多机会
(function(){var obj = null;if(document.getElementById('arctTailMark')) {obj = document.getElementById('arctTailMark');}if(obj!=null){var str = '(image_address=""http://i.thsi.cn/images/article/logo.jpg"")  返回首页';var showed = 0;try{var oo = obj.previousSibling;while(oo.nodeType!=1 || oo.innerHTML.replace(/\s|\u3000/g,'').length==0){oo = oo.previousSibling;}if(oo.nodeType==1 && oo.tagName.toLowerCase()=='p') {var span = document.createElement('span');span.innerHTML =str;oo.appendChild(span);showed = 1;}}catch (e){}if(showed == 0){obj.innerHTML =str;}}})();",2020-05-17 17:04:44,同花顺
