,title,content,pub_time,src
14,多地部署下半年监管重点 剑指互联网等领域 反不正当竞争监管加压,"全国首例涉5G云游戏侵权案、全国首例盲盒盗版侵权纠纷案、全国首例媒体商标侵权及不正当竞争案、全国首次适用反不正当竞争法互联网专条案件……多起涉反不正当竞争的案件近期密集曝光，“全国首例”成关键词。
《经济参考报》记者获悉，我国反不正当竞争强监管还将升级，监管部门正密集部署并召开专题会议，互联网、电子商务、医疗、教育培训等领域将成执法重点。除了强化反不正当竞争执法，我国竞争政策也在谋求制度创新，不少自贸区正先行先试。
8月31日晚，豆神教育（300010）发布公告称，全资子公司中文未来教育科技（北京）有限公司起诉沪江教育科技（上海）股份有限公司及上海佳课教育科技有限公司，针对其侵害中文未来大语文教育传播权及不正当竞争行为，请求法院判决被告停止不正当竞争和侵权行为，欲索赔2000万元。该纠纷已获北京市海淀区人民法院受理。近一个月来，多起涉及反不正当竞争的案件，引发业内广泛关注。
“经济下行压力下，市场扩张难、企业压力增大，导致商家之间的竞争愈发激烈。为树立良好的竞争模式和竞争业态、维护市场公平竞争环境、营造良好营商环境，反不正当竞争执法亟须强化。”清华大学竞争法与产业促进研究中心主任张晨颖对《经济参考报》记者表示。
中国政法大学经济法研究所所长张钦昱对《经济参考报》记者指出，根据国家市场监管总局6月印发的《关于加强反不正当竞争执法营造公平竞争环境的通知》，各地要扎实开展生活消费、互联网、电子商务、直播平台、医药购销和医疗服务、要素市场等重点领域反不正当竞争执法。“目前不正当竞争有相当一部分集中在网络平台领域，比如平台要求商家‘二选一’纠纷等，各地也在加大对重大疑难、新类型、典型案件的研究和查办力度。”
据了解，多地正紧锣密鼓开展重点领域反不正当竞争执法专项行动。比如四川提出重点查处“保健”市场、医疗美容机构、教育培训机构虚假宣传等违法行为；互联网、电子商务、网络直播等平台市场混淆、刷单炒信、商业诋毁等违法行为；医药购销和医疗服务领域商业贿赂行为等。陕西将聚焦民生领域，加强对仿冒混淆、虚假宣传、商业诋毁、商业贿赂等不正当竞争行为的监管执法。
关注同花顺财经（ths518），获取更多机会
(function(){var obj = null;if(document.getElementById('arctTailMark')) {obj = document.getElementById('arctTailMark');}if(obj!=null){var str = '(image_address=""http://i.thsi.cn/images/article/logo.jpg"")  返回首页';var showed = 0;try{var oo = obj.previousSibling;while(oo.nodeType!=1 || oo.innerHTML.replace(/\s|\u3000/g,'').length==0){oo = oo.previousSibling;}if(oo.nodeType==1 && oo.tagName.toLowerCase()=='p') {var span = document.createElement('span');span.innerHTML =str;oo.appendChild(span);showed = 1;}}catch (e){}if(showed == 0){obj.innerHTML =str;}}})();
责任编辑：cjh",2020-09-02 00:40:17,同花顺
15,疫情反复 印度经济复苏势头减弱,"新冠肺炎疫情对印度造成沉重打击。由于疫情持续蔓延、市场需求不断萎缩，印度经济复苏势头近期明显衰减。分析人士表示，如缺乏有效提振消费的刺激措施，印度经济恐难进一步复苏。
印度央行8月25日在一份报告中表示，2019年至2020年为全球金融危机以来印度经济最差表现，并将这一财年实际GDP增长下修为5%。由于疫情对消费的严重冲击和对贫困人群的沉重打击，印度经济可能需要相当长的时间才能恢复到疫情前的水平。
8月31日，印度统计局公布数据显示，今年二季度印度实际经济增长率同比负增长23.9％，创下自1997年有统计数字以来的最差单季增长率，包括制造业在内的多个行业出现两位数下滑。
印度制造业持续收缩。7月印度制造业采购经理人指数为46，低于6月的47.2，连续四个月处于荣枯线之下。野村证券近日发布的印度商业恢复指数为73.4，与此前数周持平，显示经济增长乏力。世界银行6月发布的报告指出，由于防疫措施严重影响经济活力，预计2020至2021财年印度经济收缩3.2%。
今年5月，印度政府大范围放松疫情防控措施，宏观经济指标有所改善，但相关数据向好趋势没能持续，经济回升速度持续放缓，市场乐观情绪消退。分析人士认为，印度经济复苏乏力，主要由于部分地区疫情持续蔓延及市场需求不断萎缩。
不少专家指出，印度疫情“拐点”恐怕要到今年11月才能出现。在经济重镇班加罗尔、加尔各答等地区，放松防控措施导致确诊病例数量再次迅速增长，当地不得不重新实施严格的隔离措施。
印度经济监测中心数据显示，最近几个月，就业岗位持续减少。受疫情影响，大量印度民众收入锐减，消费市场需求萎缩。印度央行7月发布的一份调查结果显示，印度居民消费信心已处于历史最低水平。二季度，印度乘用车销售水平降至去年同期的五分之一。印度主要城市孟买的中小型商场恢复营业后，消费者寥寥无几。
为推动经济复苏，印度政府5月出台20.97万亿卢比（1美元约合74.5卢比）的刺激措施，用于中小企业贷款担保、市场流动性支持、针对工人和商贩等的救济资金及基础设施建设等。分析人士指出，政府相关措施主要着眼供给端，缺乏对需求端的刺激。
世界银行此前在一份报告中指出，尽管印度实施了相关货币和财政政策刺激经济，但不足以对冲疫情对经济的冲击。另外，世界经济增长放缓和印度国内财政平衡压力等因素，都在制约印度经济复苏。
市场分析人士表示，一旦印度经济复苏趋势进一步弱化，政府将推出第二轮经济刺激政策。据印度媒体报道，有迹象表明第二轮经济刺激政策将重点着眼于削减乘用车税费等领域，以促进消费恢复。
关注同花顺财经（ths518），获取更多机会
(function(){var obj = null;if(document.getElementById('arctTailMark')) {obj = document.getElementById('arctTailMark');}if(obj!=null){var str = '(image_address=""http://i.thsi.cn/images/article/logo.jpg"")  返回首页';var showed = 0;try{var oo = obj.previousSibling;while(oo.nodeType!=1 || oo.innerHTML.replace(/\s|\u3000/g,'').length==0){oo = oo.previousSibling;}if(oo.nodeType==1 && oo.tagName.toLowerCase()=='p') {var span = document.createElement('span');span.innerHTML =str;oo.appendChild(span);showed = 1;}}catch (e){}if(showed == 0){obj.innerHTML =str;}}})();
责任编辑：cjh",2020-09-02 00:39:59,同花顺
16,守护小兴安岭的“绿色明珠”,"8月的小兴安岭，林海起伏，层峦叠嶂。在有着“红松故乡”之称的黑龙江丰林国家级自然保护区，宋国华像往常一样，一大早就前往森林深处一处样地观测。
丰林保护区位于黑龙江省伊春市丰林县境内，小兴安岭南坡北段，是东北亚天然红松林分布的核心区域。59岁的宋国华是丰林保护区科研室主任，从1983年参加工作开始，一直在这里工作。
“阔叶红松林是保护区典型的地带性植被，我们现在所处的位置是保护区的实验区，可以进行一些科研，核心区是不能进入的。”宋国华一边说，一边拨开眼前的树枝，踏着松针，行走在高大挺拔的红松林间，阳光透过树叶间隙形成的光斑在他脸上闪烁。
数十年间，小兴安岭林区为国家源源不断输送木材，而过量采伐也使保护区周边林区的原始红松林消失殆尽。
丰林保护区前身为1958年成立的黑龙江省丰林森林自然保护区，1988年成为国家级自然保护区，总面积约1.8万公顷，并代管一个8000多公顷的林场。这里保留了小兴安岭面积最大、生态系统最完整的原始红松林。
守护这片“绿色明珠”，一代又一代的丰林人在此坚守，奉献了青春和汗水。
“每年春夏是最紧张的防火时期，每天都有3班人上瞭望塔观测，一有情况就会及时处置。”宋国华说。
登上保护区的瞭望塔放眼望去，云雾升起，仿佛看到一片绿色的海洋。
“新手很难区分开云雾、水汽和因火灾引起的烟，需要多年经验。”宋国华说，每年最担心的是雷击火、电线火等非人为火灾隐患。“有一年一只鸟撞到高压线上，引燃了附近的树木，好在及时发现后扑灭了。”
“刚参加工作的时候，在山上一住就是一个月。徒步去巡查，要爬30多公里的山路，一天爬不完，还要在深山中搭帐篷过夜。”宋国华说。
身处深山，最令护林人担心的便是突遇黑熊等大型动物。老职工会传授给“新兵”经验：走在山路上，要经常喊叫，吓走黑熊，这便是“喊山”。
但“喊山”并不总奏效。宋国华还记得，有一次在山中直面黑熊，自己转身就跑，好在黑熊没跟上来。
近年来，保护区的科研、生活条件得到了很大改善，过去测量雨量的量筒、量杯变成了自动测量装置；过去通过观察脚印研究野生动物，现在有了红外相机；过去在树上刷油漆记录信息，现在变成了金属铭牌。
“从2009年开始，我们已经给近20万棵树挂上了铭牌，相当于这些树都有了自己的‘身份证’。”宋国华说。
1997年，丰林保护区加入联合国教科文组织世界生物圈保护区网络，成为中国乃至世界重要的阔叶红松林生态定位研究、林业科研和科普基地。
每年6月下旬，红松进入“繁殖期”，经过15个月的“孕育”，红松种子才成熟。种子组成的球果不能自己掉落，松鼠和鸟类都是红松种子的传播者。
红松林里，从红松种子，到鼠类、鸟类，再到其他食草、食肉动物，形成了一条食物链，也构成了多姿多彩的生物多样性网络。2015年，稀有的中华秋沙鸭也出现在保护区里。
“丰林保护区建立60多年来，示范和教育着人们如何与自然和谐相处。”黑龙江丰林国家级自然保护区管理局局长毕连柱说，丰林保护区的生态、环境、科研和社会价值巨大，希望有更多人参与到保护生态的行列中，守护好这一方绿水青山。
与丰林保护区一样，越来越多的自然保护区在“扮绿”小兴安岭。伊春市目前已有自然保护区23个，其中国家级自然保护区11个。
关注同花顺财经（ths518），获取更多机会
(function(){var obj = null;if(document.getElementById('arctTailMark')) {obj = document.getElementById('arctTailMark');}if(obj!=null){var str = '(image_address=""http://i.thsi.cn/images/article/logo.jpg"")  返回首页';var showed = 0;try{var oo = obj.previousSibling;while(oo.nodeType!=1 || oo.innerHTML.replace(/\s|\u3000/g,'').length==0){oo = oo.previousSibling;}if(oo.nodeType==1 && oo.tagName.toLowerCase()=='p') {var span = document.createElement('span');span.innerHTML =str;oo.appendChild(span);showed = 1;}}catch (e){}if(showed == 0){obj.innerHTML =str;}}})();
责任编辑：cjh",2020-09-02 00:39:15,同花顺
17,南非八月份制造业表现有所改善,"据南非每日商报网站9月1日报道，Absa制造业采购经理人指数（PMI）从7月份的51.2升至8月份的57.3。PMI衡量制造业活动，低于50分表示收缩。该指数追踪了六个月内的预期商业状况，已升至约18个月来的最高水平。制造业约占南非GDP的13％。由于“封禁”限制放松，经济活动加快，商业活动和新的销售订单在8月份上升，但就业和库存指数保持疲软。Absa表示，尽管采购经理人指数的水平很可能夸大了复苏程度，但八月份该指数再次上升令人鼓舞，尤其是在本地和出口需求均得到改善的情况下。此外，采购经理对未来的商业状况变得更加乐观。
关注同花顺财经（ths518），获取更多机会
(function(){var obj = null;if(document.getElementById('arctTailMark')) {obj = document.getElementById('arctTailMark');}if(obj!=null){var str = '(image_address=""http://i.thsi.cn/images/article/logo.jpg"")  返回首页';var showed = 0;try{var oo = obj.previousSibling;while(oo.nodeType!=1 || oo.innerHTML.replace(/\s|\u3000/g,'').length==0){oo = oo.previousSibling;}if(oo.nodeType==1 && oo.tagName.toLowerCase()=='p') {var span = document.createElement('span');span.innerHTML =str;oo.appendChild(span);showed = 1;}}catch (e){}if(showed == 0){obj.innerHTML =str;}}})();
责任编辑：cjh",2020-09-02 00:39:08,同花顺
18,11家银行理财子公司开业一年内均盈利 招银理财半年挣了15亿元,"本报记者 彭妍
随着上市银行半年报披露完毕，其理财子公司有也展现了上半年的“战绩”。
据《(image_address=""//comment.10jqka.com.cn/sourcepic/12/1qTIr8jVsagtsay.png"")》记者不完全统计，银行中报披露了11家银行理财子公司上半年净利润数据，今年上半年合计盈利34.6亿元，这11家都是在2019年开业的理财子公司，最早的是在去年5月份，最晚的是在12月份。其中，招银理财以15亿元净利润居首位。
受资管新规落地的影响，上市银行理财产品转型加快，理财净值化转型再提速，与净值型产品高速增长相对应的，则是保本型理财产品的加速退场。同时，权益类理财产品逐渐成为发力方向。
工银理财总资产达168亿元
据记者不完全统计，目前银行理财子公司开业数量增至17家，包括6家国有银行、5家股份制银行、5家城商行、1家农商行。
《(image_address=""//comment.10jqka.com.cn/sourcepic/12/1qTIr8jVsagtsay.png"")》记者注意到，在资产规模方面，6家国有行理财子公司合计资产规模达732.81亿元。其中，分属工农中建四大行旗下的工银理财、农银理财、中银理财和建信理财资产规模均超百亿元。
工行旗下工银理财总资产规模最高，其总资产168.24亿元，净资产165.94亿元。建信理财紧随其后，总资产157.22亿元，净资产151.91亿元。农银理财、中银理财资产总额分别为129.81亿元和108.43亿元。交银理财、中邮理财资产规模相对较小，分别为84.72亿元和84.39亿元。
目前已披露业绩的理财子公司全部实现盈利。招商银行理财子公司的盈利能力位居首位，此外交通银行、光大银行、兴业银行的理财子公司的盈利能力均有所提升。
招商银行半年报显示，截至6月末，招银理财总资产70.54亿元，净资产65.22亿元，实现净利润15亿元。
交通银行半年报显示，交银理财上半年实现净利润3.04亿元。
光大理财报告期内实现净利润2122万元，相比2019年370万元的盈利大幅提升。
兴银理财上半年累计实现营业收入1.44亿元，实现净利润1.03亿元。
保本型理财产品逐步清零
梳理上市银行半年报发现，多家银行在交出亮丽业绩的同时，也透露出理财业务转型步伐正在加快，受资管新规影响，保本型理财产品正在逐步下降，与此同时，符合新规的净值型理财产品的数量和规模正在逐步增长。
以招商银行为例，其半年报显示，截至6月末，招银理财管理的理财产品余额（不含结构性存款）2.38万亿元，较上年末增长8.68%。新产品余额1.09万亿元，较上年末增长59.08%，占理财产品余额（不含结构性存款）的45.80%，较上年末提高14.58个百分点。在财报中，招银理财解释所谓的新产品即符合资管新规导向的理财产品。
工商银行半年报显示，在工银理财成立一周年之际，推出千亿元规模主题产品，符合资管新规产品和投资规模峰值实现双破万亿元，平稳推动规模承接和创新开拓。6月末，非保本理财产品余额24945.72亿元。
在打破刚兑、消除多层嵌套并限制通道业务的目标之下，今年上半年银行业全面开始资管转型之路，从半年报透露的数字来看，部分银行保本理财也逐渐成为“过去式”。普益标准数据显示，今年二季度，全市场商业银行净值型理财产品存续数量23078款，较一季度增加3488款，环比增长17.81%；存续规模估计为13.24万亿元，较一季度环比增长5.56%。
更多权益类产品将推出
银行理财子公司的策略普遍仍以“固收+”的产品为主，但从银行半年报显示，理财子公司对于增强权益类资产投资具有较强的意愿。多家银行理财子公司均对外表示，未来将进一步加强权益类理财产品的布局。
招商银行半年报显示，产品与销售持续转型发展。报告期内，根据资管新规及其配套政策要求，基于“招赢睿智卓越”产品体系发行新产品109支。在平稳过渡的前提下，积极推动现金管理类产品合规改造，为后续老产品加速改造积累经验。加大固收+、权益、多资产等产品的发行和销售力度，产品多样性和收益水平进一步提升，产品结构持续优化；工商银行在年报中披露，工银理财形成以固定收益类产品为主，权益类、混合类产品为辅的产品布局。
普益标准研究员赵迪在接受《(image_address=""//comment.10jqka.com.cn/sourcepic/12/1qTIr8jVsagtsay.png"")》记者采访时表示，整体来说，银行理财子公司在未来或推出更多混合及权益类产品，中风险产品的增多将是产品结构及投向变化背景下的大趋势，政策引导下长期投资产品的比例也将越来越高。同时，银行理财子公司也会推出更多的“1元产品”以满足普通投资者理财需求，引导资金量较少的群体逐步进入理财市场。
普益标准研究员王伟对《(image_address=""//comment.10jqka.com.cn/sourcepic/12/1qTIr8jVsagtsay.png"")》记者表示，对于理财子公司来说，受制于投研人才短缺、投研能力存在短板，新产品的研发受到掣肘，也较难从已发售的产品中获取超额收益，与此同时，监管进一步规范了理财产品营销管理，这都影响了银行理财规模的增长，从而限制了银行获取管理费收入。对此，未来理财子公司一方面需要夯实业务基础，通过外部招聘或内部培养形式招募投研人才，补足投研短板，提升大类资产配置能力，根据客户需求研发推介相应的理财产品。
关注同花顺财经（ths518），获取更多机会
(function(){var obj = null;if(document.getElementById('arctTailMark')) {obj = document.getElementById('arctTailMark');}if(obj!=null){var str = '(image_address=""http://i.thsi.cn/images/article/logo.jpg"")  返回首页';var showed = 0;try{var oo = obj.previousSibling;while(oo.nodeType!=1 || oo.innerHTML.replace(/\s|\u3000/g,'').length==0){oo = oo.previousSibling;}if(oo.nodeType==1 && oo.tagName.toLowerCase()=='p') {var span = document.createElement('span');span.innerHTML =str;oo.appendChild(span);showed = 1;}}catch (e){}if(showed == 0){obj.innerHTML =str;}}})();
责任编辑：cjh",2020-09-02 00:39:06,同花顺
19,湖南上市公司超八成盈利 圣湘生物净利暴增147倍,"本报记者 何文英
虽然上半年受疫情影响，上市公司复工复产普遍延迟，但对于吃得苦、“霸得蛮”的湖南人来说，这都不算个事儿。
统计数据显示，今年上半年，114家湖南上市公司（不含千山退（300216））合计实现总营业收入约3133亿元，实现净利润235亿元。有92家湖南上市公司实现盈利，占比80.7%；五成公司营收同比增长，超六成公司净利润同比增长。其中，中联重科（000157）上半年净赚40亿元，盈利能力位居湖南上市公司榜首。
透镜公司研究创始人况玉清在接受《(image_address=""//comment.10jqka.com.cn/sourcepic/12/1qTIr8jVsagtsay.png"")》记者采访时表示：“在疫情影响下，湖南上市公司上半年能交出这样一份期中成绩单，表现相当不错。像中联重科、蓝思科技（300433）这类头部企业增长迅猛，可见湖南制造业的头部企业还是很强的。”
5家湘企营收跻身百亿元
今年上半年，湖南省GDP为19026.4亿元，114只湘股的营业收入共计3133亿元，占全省GDP的16.47%。同时，A股上市的湖南企业的经营规模也呈增长态势，114家上市湘企业的营收平均值约27亿元，比去年同期增长12%。
上半年营收超过百亿元的湖南上市公司共有5家，分别是华菱钢铁（000932）、多喜爱（002761）、中联重科、蓝思科技和步步高（002251），其中有3家分布在制造业。
多喜爱的上榜，得益于重组蜕变。多喜爱主营家纺产品，在2019年被浙建集团借壳重组后，主营业务由家纺产品的生产销售变成建筑施工、基础设施投资运营等，今年上半年以371亿元的营收规模排名湖南上市公司营收榜的第二位。
中联重科则受益于“两新一重”建设，上半年实现营业收入288亿元，同比增长29.49%。公司董秘杨笃志对《(image_address=""//comment.10jqka.com.cn/sourcepic/12/1qTIr8jVsagtsay.png"")》记者表示，上半年公司持续完善业务端对端管理模式，管理效能稳步提升，市场竞争优势增强，新兴产业空间持续打开，实现了高质量、可持续的业绩增长。
蓝思科技一直被视为消费电子护窗玻璃行业的风向标。上半年，公司实现营业收入156亿元，同比增长37.05%。蓝思科技董秘钟臻卓对《(image_address=""//comment.10jqka.com.cn/sourcepic/12/1qTIr8jVsagtsay.png"")》记者解释称：“上半年，公司及时可靠地保障了下游客户的交付需求，进一步赢得客户的信任与支持，扩大了公司在全球优质细分产品领域的市场占有率。此外，公司在消费电子垂直领域加强整合，多点开花，从而成功穿越了传统淡季。”
科创板“新兵”成“黑马”
上半年，114家湖南上市公司合计盈利235亿元。其中，有92家公司上半年盈利，共赚了约266亿元；另外22家合计亏损约31亿元。
中联重科上半年实现净利润40亿元，摘得湖南上市公司盈利榜桂冠。华菱钢铁、长沙银行（601577）、五矿资本（600390）、蓝思科技、圣湘生物、芒果超媒（300413）、爱尔眼科（300015）、方正证券、中南传媒（601098）分列湖南上市公司盈利榜的第二至第十位。
值得关注的是，今年的榜单中，除了往年经常上榜的金融业、制造业、医疗业的“优等生”外，还杀出了一匹科创板“黑马”圣湘生物。资料显示，圣湘生物是一家以自主创新基因技术为核心，集诊断试剂和仪器的研发、生产、销售以及第三方医学检验服务于一体的体外诊断整体解决方案提供商。公司于今年8月28日正式登陆科创板。
在新冠肺炎疫情防控工作中，圣湘生物研发的新型冠状病毒核酸检测试剂盒迅速供往疫情防控一线。在产品快速铺开的贡献下，圣湘生物上半年实现净利润12亿元，同比大增147倍。
圣湘生物董秘彭铸对《(image_address=""//comment.10jqka.com.cn/sourcepic/12/1qTIr8jVsagtsay.png"")》记者表示：“除了新冠检测试剂贡献的业绩外，今年上半年公司的仪器装机量是过去三年的近2倍，为公司试剂业务的持续发展带来较大增量空间。此外，公司国际化步伐大幅提速，上半年境外销售占比由去年的5.05%一跃增至45.12%，国际销售渠道中50%以上为国外政府官方相关渠道，公司产品目前已服务于全球130多个国家和地区疫情防控一线，国际化将成为公司业绩持续增厚的新主线。”
不过，也有部分湖南上市公司受疫情影响较大，上半年业绩出现亏损。其中，*ST金贵（002716）是亏损大户，半年亏损13亿元。此外，佳沃股份（300268）、*ST湘电（600416）、华银电力（600744）、开元股份（300338）等7家公司的亏损额也超过1亿元。
开元股份董秘彭民在接受《(image_address=""//comment.10jqka.com.cn/sourcepic/12/1qTIr8jVsagtsay.png"")》记者采访时表示：“上半年受疫情影响重大，但公司及时调整战略以适应新形势变化，七八月份业务明显好转，下半年业绩有望逐渐复苏，重回正常经营轨道。”
关注同花顺财经（ths518），获取更多机会
(function(){var obj = null;if(document.getElementById('arctTailMark')) {obj = document.getElementById('arctTailMark');}if(obj!=null){var str = '(image_address=""http://i.thsi.cn/images/article/logo.jpg"")  返回首页';var showed = 0;try{var oo = obj.previousSibling;while(oo.nodeType!=1 || oo.innerHTML.replace(/\s|\u3000/g,'').length==0){oo = oo.previousSibling;}if(oo.nodeType==1 && oo.tagName.toLowerCase()=='p') {var span = document.createElement('span');span.innerHTML =str;oo.appendChild(span);showed = 1;}}catch (e){}if(showed == 0){obj.innerHTML =str;}}})();
责任编辑：cjh",2020-09-02 00:33:57,同花顺
