,title,content,pub_time,src
0,上市公司提质步入“深水区” 机构投资者肩负重要“股东责任”,"本报记者杜雨萌
2020年，A股市场“三十而立”，上市公司质量提升向更深层次、更广维度演进，机构投资者的作用亦愈发凸显。因为，借助引导中长期资金入市、健全机构投资者参与公司治理，不仅是资本市场深化改革的重要突破口，更是资本市场实现高质量发展的核心所在。
《证券日报》记者注意到，在国务院10月9日印发的《关于进一步提高上市公司质量的意见》(下称《意见》)中，无论是从提高上市公司治理水平还是推动上市公司做优做强的重点举措中，除了上市公司自身的行动，亦将笔墨着重于机构投资者的担当。
华兴证券首席经济学家庞溟在接受《证券日报》记者采访时表示，随着近年来我国资本市场的改革和发展，机构投资者在资本市场的持股比例以及影响力得到了明显提升。并且，越来越多的机构投资者出于信托责任或维护自身权益的积极性，有能力与动力参与上市公司治理，可以说，未来机构投资者在提高上市公司质量方面将扮演重要角色。
机构投资者影响力日益增强
虽然，从目前投资者开户的数量看，我国资本市场投资者结构仍以中小投资者为主，但可喜的变化是，机构投资者队伍正在不断地发展壮大。
中国结算披露的最新数据显示，截至8月末，我国股票市场投资者已突破1.7亿户，其中A股机构投资者数量达38.14万户；而去年同期，A股机构投资者数量仅为35.02万户；事实上，除了开户数量的明显增长外，近年来机构投资者在A股市场的持仓规模也在持续壮大。
兴业证券提供的数据显示，截至2020年二季度末，剔除一般法人来看，机构投资者持股市值占A股流通市值的30%，创下历史新高。从具体机构来看，基金占比约12%，保险和社保合计占比约6%，境外投资者占比约9%，其他机构占比约3%。
不过，虽然目前机构投资者在参与A股市场的投资力度上有所加大，且在稳定市场、推动价值投资等方面发挥着越来越重要的作用，但机构投资者对于公司治理参与的广度和深度确实还有进一步提升的空间。
在此背景下，《意见》适时强调，健全机构投资者参与公司治理的渠道和方式，加快推行内控规范体系，强化上市公司治理底线要求，切实提高公司治理水平。
庞溟表示，目前场内的实证研究表明，一方面，机构投资者由于拥有大量股权和更大的预期收益，更有能力和动机去分辨上市公司的优劣，并按照公司真实价值确认股票价格，从而起到有效配置资源、增加市场稳定性的作用；另一方面，机构投资者可以利用其专业优势，监督上市公司大股东和管理层的经营运作，促使大股东和管理层以公司的真实业绩为目标、减少了公司的短期投机行为、有损股东利益的行为乃至违法违规行为。总的来说，机构投资者积极参与公司治理和经营决策，可以说在提升公司价值从而最大化投资回报等方面，发挥着重要的促进及监管作用。
东北证券首席策略分析师邓利军在接受《证券日报》记者采访时表示，为平衡机构投资者与公司管理层、大股东三者之间的关系，一方面需要加强沟通，机构投资者要对公司管理层和大股东的本地化经验有充分了解，并思考自身经验在本土化应用上的适用性；另一方面，要加强机构投资者的信用建设，敦促机构投资者积极、审慎、公开透明地行使股东权利。
长周期考核机制待探索
值得关注的是，对于机构投资者而言，此次《意见》除了明确在建制度的完善外，其在推动上市公司做优做强方面进一步提出，探索建立对机构投资者的长周期考核机制，吸引更多中长期资金入市。
在申万宏源证券（000562）分析师沈盼看来，探索对机构投资者的长周期考核机制，有助于拉长资金久期，降低短期要素在资产定价中的权重，引导长期投资理念。未来，随着衍生品等风险管理工具的进一步丰富，预计也将有助于降低投资机构的短期操作必要性。
庞溟分析称，机构投资者应以中长期投资和价值投资成为主流投资理念和投资体系的主流，构建和完善基本面研究和深度研究的框架、体系和逻辑，在此基础上驱动投资，以更好地产生主动管理的超额收益和长期稳健的投资回报；与此同时，专业机构内部平台应更好地识别、重视、赋能和奖励能创造可持续的优秀业绩的专业人才。也就是说，在提高机构专业能力的同时，必须要构建和强化长期激励约束机制，以进一步发挥机构专业投资、长期投资的理念。
事实上，“吸引中长期资金入市”一直是监管部门努力的方向与目标，如仅从国内角度来看，近年来一系列助力保险资金、社保基金、养老金、企业年金等入市利好政策相继落地。如今年7月份，银保监会发布《关于优化保险公司权益类资产配置监管有关事项的通知》，明确权益类资产监管比例，最高可到占上季末总资产的45%等。
“吸引更多中长期资金入市，除了有利于促进我国资本市场的长期、稳定、健康发展外，还有利于增强我国资本市场的融资功能与资源配置能力。当然，对于接受这类中长期资金投资的企业来说，其除了获得关注长期收益、社会责任感与价值观一致的金融资源和资本投资外，还可以获得这类战略投资者在产业、技术、管理、社会资本等方面分享的资源与经验。可谓一举多得。”庞溟表示，未来，监管部门应继续大力发展机构投资者队伍，鼓励重要的长期专业投资者进行专业性的集中运作，充分发挥机构投资者的市场有效定价和资源优化配置作用，加强资本市场融资端和投资端的协调平衡，进而形成投资业绩和上市公司发展的正向循环。
关注同花顺财经（ths518），获取更多机会
(function(){var obj = null;if(document.getElementById('arctTailMark')) {obj = document.getElementById('arctTailMark');}if(obj!=null){var str = '(image_address=""http://i.thsi.cn/images/article/logo.jpg"")  返回首页';var showed = 0;try{var oo = obj.previousSibling;while(oo.nodeType!=1 || oo.innerHTML.replace(/\s|\u3000/g,'').length==0){oo = oo.previousSibling;}if(oo.nodeType==1 && oo.tagName.toLowerCase()=='p') {var span = document.createElement('span');span.innerHTML =str;oo.appendChild(span);showed = 1;}}catch (e){}if(showed == 0){obj.innerHTML =str;}}})();",2020-10-27 01:19:59,同花顺
1,郎酒新增2万吨产能 “千亿郎酒”正式起航,"“站在百亿起点，百年郎酒正迎来历史巨变！”让郎酒集团董事长汪俊林有底气喊出如此雄心勃勃口号的，正是郎酒集团全新的吴家沟生态酿酒区。
10月25日，2020吴家沟生态酿酒区启用仪式在郎酒庄园举行。同一天，2020年郎酒重阳下沙仪式启动。
传统与创新在这一天碰撞，让各界看到的不止是郎酒对传统酿造技艺的传承，在尊重自然的前提下为世界酿造一杯佳酿的决心。更重要的，郎酒希望通过全新的生态酿酒区，改写其生产体系版图。
汪俊林表示，吴家沟生态酿酒区重大技改升级，一步新增一个百亿酱香郎酒，使郎酒酱酒产能、储能、势能站到了行业最前列。作为郎酒百年发展史上的关键工程，郎酒将从吴家沟再出发，再来一次“四渡赤水”，加速实现郎酒三大目标。
站在百亿起点，千亿郎酒起航
“10里黄金河谷，8年艰辛打造，6万吨制曲能力，2万吨酱酒产能，新增产值200亿元，再造一个百亿酱香郎酒，带来无限发展可能”。这是汪俊林当天在活动现场对引发众人热议的一组特殊数据进行的解读。“1、2、6、8、10、200、∞”这组特殊的数字与符号，讲述了吴家沟的发展历程，更展现出郎酒被吴家沟项目所激发出的新动能。
全新的吴家沟生态酿酒区坐落于赤水河南岸酱酒黄金产区，是郎酒庄园五大核心生态酿酒区之一，这是该项目拥有的自然禀赋。
数据显示，吴家沟生态酿酒区占地1200亩，拥有3栋制曲车间、42栋酿造车间。整个项目全部建成后，郎酒将新增制曲产能6万吨，新增酱酒产能2万吨。
吴家沟项目几乎重造了一个全新的郎酒工厂，因此，吴家沟生态酿酒区正式启用，也被郎酒视为郎酒技改升级的历史性节点。2020年郎酒酱酒产能3万吨，老酒储量13万吨，吴家沟全面投产后，酱酒产能将提升到5万吨。
借吴家沟生态酿酒区描绘全新蓝图的郎酒，计划用5年时间达到30万吨老酒储量，使得郎酒产能、储能、势能均占据行业领先地位，站在百亿起点，千亿郎酒就此起航。
所谓“千亿郎酒”的说法也并不是空穴来风。仅吴家沟新增的2万吨酱酒产能，若以红花郎估算，可实现年销售收入120亿元，税收30亿至40亿元；以青花郎估算，可实现销售收入360亿元，税收100亿至150亿元；以红运郎估算，可实现销售收入超过500亿元。
坚持品质发展，抢占行业高地
产能的大幅提升让行业对郎酒的未来有了更多想象，这种想象的来源，与近年来酱香酒板块的快速发展密不可分。席卷全国的“酱酒热”，让拥有高产能的知名酱香酒生产企业，也拥有了在高端白酒领域赢得先机的砝码。
有数据显示，2019年，我国酱酒产能约为55万千升，占白酒总产量的7%左右，完成了行业21.3%的营业收入，实现了行业42.7%的利润总额，成为中国酿酒业行业最具竞争力的板块。以茅台、郎酒、习酒为代表的赤水河流域的酱酒企业，在2019年合计营收超过1260亿元，占全国酱酒销售的92%。
赤水河流域有限的生态承载能力，也意味着老酒多、产能大、基酒存放时间长的企业，更容易在未来市场竞争中取得先机和优势。
郎酒并不满足于产能优势提升，将品质与产能有机结合，是郎酒追寻的目标。
一直以来，品质都是郎酒的核心竞争力，是郎酒发展不竭的根本动力。依托赤水河生态基底匠心打造的吴家沟，正是郎酒长期践行“正心正德，敬畏自然，崇尚科学，酿好酒”理念的生动体现。
以25日当天的郎酒“重阳下沙”仪式为例，郎酒为保证酒的品质，依然遵循了郎酒千百年来的酿造工艺，从请水进粮、填粮、润粮、拌粮，到上甑、摊晾等传统酿酒环节，无不体现出郎酒对传统酿造工艺的传承。
尊重自然，尊重传统，方能更好地创新，获得更高品质。
与此同时，郎酒坚持“一慢两快”、品质至上和长期主义，慢销售、快生产、快储存。2020年酱酒限量销售1万吨，此后每年增加1000吨，充分保障酱香产品的高品质和稀缺性。
也正是郎酒在产能与品质上两手抓，才为郎酒赢得了极高的行业声誉和企业地位。
打造产业集群，带动区域发展
从此前郎酒发布的招股说明书中也能看到，2017年到2019年，郎酒的营业收入分别为51.16亿元、74.79亿元、83.48亿元；净利润分别为3.02亿元、7.26亿元、24.44亿元，后两年增速达140%和237%。高达三位数的净利润增幅与现有的19家上市白酒企业相比遥遥领先。
快速发展的郎酒也成为带动当地群众致富增收的重要载体。据悉，郎酒自2002年来累计上缴税费170亿元，为古蔺县当地决战脱贫攻坚注入强大动力。当前，规划总投资50亿元的吴家沟工程建设，已完成实际投资30亿元，新增产能预计每年新增本地采购米红粱4.5万吨，小麦6万吨，新增就业5000人，可助力10万农民增收脱贫，新增税收50亿至100亿元。
泸州市委书记刘强表示，泸州正着力打造千亿白酒产业、建设世界级优质白酒产业集群。吴家沟生态酿酒区是郎酒历时8年建起的全国最大的单一酱酒生产基地，必将为郎酒和泸州白酒产业高质量发展注入强劲动力。
有能力，方能发展；有责任心，方能长久。汪俊林表示，郎酒将从吴家沟再出发，再来一次四渡赤水。依托高品质发展路径，郎酒一定能实现三大目标，在白酒行业具有重要地位；与赤水河对岸的茅台各具特色、共同做大高端酱酒；把郎酒庄园打造成为白酒爱好者的圣地、世界级庄园。
关注同花顺财经（ths518），获取更多机会
(function(){var obj = null;if(document.getElementById('arctTailMark')) {obj = document.getElementById('arctTailMark');}if(obj!=null){var str = '(image_address=""http://i.thsi.cn/images/article/logo.jpg"")  返回首页';var showed = 0;try{var oo = obj.previousSibling;while(oo.nodeType!=1 || oo.innerHTML.replace(/\s|\u3000/g,'').length==0){oo = oo.previousSibling;}if(oo.nodeType==1 && oo.tagName.toLowerCase()=='p') {var span = document.createElement('span');span.innerHTML =str;oo.appendChild(span);showed = 1;}}catch (e){}if(showed == 0){obj.innerHTML =str;}}})();
责任编辑：wyj",2020-10-27 01:16:02,同花顺
2,税收征管体制改革红利持续释放,"“十三五”以来，我国税收征管体制改革在多个关键领域取得了新突破。记者采访了解到，当前，改革的成果已经落地生效，多重红利在持续释放。
税务机构由“分”到“合”，办税服务先行实现了“1+1>2”的效果。合并后的税务部门不断通过简化环节、简便程序、精简资料，持续提升纳税人、缴费人的获得感。
改革持续深入，服务也不断升级。今年，通过信息技术手段，税务部门先后分3批推出54项具体措施，梳理发布税费事项网上办理清单，让“非接触式”成为办税新常态。
国税地税征管体制改革在信息化和大数据领域的深耕，让税收大数据在征管实践中的作用愈发凸显。在国家税务总局提出“数据服务大局要加力”的明确要求后，短短数月，各级税务机关闻令而动，进一步盘活数据资源、挖掘数据价值、拓展数据应用，竭力为复工复产复销按下“快进键”。
与此同时，各地税务部门通过全力落实各项减税降费政策，加速推动市场主体自助创新“强链”，利用国内疫情防控形势好于海外的黄金“窗口期”，抢占国际市场份额，从而助力构建新发展格局。
业内指出，“十三五”时期征管体制改革顺利推进，逐步构建起优化高效统一的税收征管体系，税收在国家治理中的基础性、支柱性、保障性作用进一步彰显。展望下一阶段，税收征管体制改革仍将向纵深推进。
关注同花顺财经（ths518），获取更多机会
(function(){var obj = null;if(document.getElementById('arctTailMark')) {obj = document.getElementById('arctTailMark');}if(obj!=null){var str = '(image_address=""http://i.thsi.cn/images/article/logo.jpg"")  返回首页';var showed = 0;try{var oo = obj.previousSibling;while(oo.nodeType!=1 || oo.innerHTML.replace(/\s|\u3000/g,'').length==0){oo = oo.previousSibling;}if(oo.nodeType==1 && oo.tagName.toLowerCase()=='p') {var span = document.createElement('span');span.innerHTML =str;oo.appendChild(span);showed = 1;}}catch (e){}if(showed == 0){obj.innerHTML =str;}}})();
责任编辑：wyj",2020-10-27 01:15:04,同花顺
3,云南省依靠科技转变营造林发展方式 精准飞播攻克造林难点,"记者从省林草局了解到，按照省委、省政府明确的加快绿化九大高原湖泊、石漠化地区、滇中地区等的宜林地或困难造林地的要求，全省林草部门正着力转变营造林发展方式，推广使用林木良种，提升营造林成效和质量，及时开展困难立地精准飞播造林工作，补齐生态发展短板。
通过多年的造林绿化，云南宜林地的结构和分布发生较大变化，剩下的多为困难立地区域，迫切要求生态修复治理方式必须从规模速度粗放增长转向高质量效益型增长，从面上治理转向精准攻坚。为此，云南省立足省情，对困难立地精准飞播造林工作深入调研，开展了详实的前期试点工作。
今年，省林草局把澄江市抚仙湖流域作为困难立地精准飞播试点，省林木种苗总站联合当地林草局共同实施了2020年度云南省省级财政林草科技推广项目――“困难立地精准飞播良种造林技术推广示范”，计划用3年时间在澄江市龙街镇梁王山、路居镇黑山脚等困难立地开展精准飞播良种造林工作。根据现场调查显示，播种后云南松、黄连木两个树种萌芽情况良好，出苗率接近50%，块状整地落种率达到100%，初步实现精准目标。
省林木种苗总站专家介绍，无人机飞播造林是一种行之有效的生态修复手段，具有速度快、省劳力、投入少、成本低、受地形限制小等特点和优势，特别是生态环境恶劣、立地条件差的区域，效果尤为明显。
为确保飞播造林成效，加快恢复森林植被，切实提高全省森林覆盖率，林草部门将坚持适地适树，精准用种，以生态造林树种搭配乡土树种、观赏树种等多模式的飞播方式，使飞播造林有更丰富的生物多样性和更加稳定的森林结构。同时，坚持人机结合，精准飞播，封山抚育，精准管护。以播区为单位实行封禁管理，适时做好补植、补播、幼林抚育、防火、有害生物防治等工作，明确管护责任，确保飞播造林成效。同时，将及时总结飞播造林方法、技术、经验等，为全省大规模开展飞播造林工作做好准备。（记者 胡晓蓉）
关注同花顺财经（ths518），获取更多机会
(function(){var obj = null;if(document.getElementById('arctTailMark')) {obj = document.getElementById('arctTailMark');}if(obj!=null){var str = '(image_address=""http://i.thsi.cn/images/article/logo.jpg"")  返回首页';var showed = 0;try{var oo = obj.previousSibling;while(oo.nodeType!=1 || oo.innerHTML.replace(/\s|\u3000/g,'').length==0){oo = oo.previousSibling;}if(oo.nodeType==1 && oo.tagName.toLowerCase()=='p') {var span = document.createElement('span');span.innerHTML =str;oo.appendChild(span);showed = 1;}}catch (e){}if(showed == 0){obj.innerHTML =str;}}})();
责任编辑：wyj",2020-10-27 01:14:59,同花顺
