,title,content,pub_time,src
9,2020全球程序员节：奇安信副总裁吴俣谈“内生安全框架”保障信创环境安全,"“基于信创计算底座的IT信息化升级改造和替代，离不开新一代网络安全技术能力解决安全问题。”在2020第四届全球程序员节信创圆桌峰会上，奇安信副总裁吴俣表示，奇安信基于信息技术应用创新的安全体系，提供了五大能力：数据驱动的“终端”管控能力；边界管控的“网络”防护能力；合规高效的“信创”平台能力；中枢纽带的“应用”支撑能力；人机协作的“服务”运营能力。
据悉，本届全球程序员节活动在西安举办，以“云启信创，码动未来”为主题，延续往届程序员节成果的基础上，顺应时代潮流，聚焦信创产业、数字经济等议题，邀请了2007年图灵奖获得者约瑟夫希发基思，中国工程院院士张锡祥、加拿大国家工程院、国家工程研究院两院院士沙温和（Mohamad Sawan)、中国互联网协会理事长尚冰等业内顶级专家以及知名企业相关负责人，从技术创新、安全防护、新基建赋能等方面，研判信创产业未来趋势，探讨最新战略与政策要求，旨在共同推进信创产业高质量发展，构建信创产业命运共同体。
权威机构指出，2020年是信创产业全面推广的起点，未来三到五年，信创产业将迎来黄金发展期。我国国产基础软硬件从“不可用”发展为“可用”，并正在向“好用”演变。信创产业作为“新基建”的重要内容，将成为拉动经济发展的重要抓手之一。
吴俣在演讲中表示，信创工程将成为数字经济和智慧应用发展的基石，从芯片、操作系统、基础软件到整机，再到网络、应用，几乎涉及IT领域的全产业链。从安全的角度看，必须把基础的芯片、操作系统、基础软件的本质安全，和漏洞挖掘、漏洞补丁的管理、身份鉴别和访问控制、行为监控和分析、网路攻防、技术研究等方面组成的过程安全相结合，做到本质安全和过程安全的深度融合，才能够体系化地保障整个信创工程应用的安全。
吴俣认为，在当前的国际竞争和网络安全形势下，需要通过信创解决我国IT核心技术断供问题，保障IT产业和系统的供应链安全；通过信创解决核心IT和通信系统被植入“后门 ”问题；通过信创掌握漏洞“主动权”，防御武器化后的漏洞攻击等。同时，信创是信息化系统的升级、替代和重构，而不简单是处理器和操作系统的替代和更换。
为此，吴俣建议：
一是信创要从基础能力的安全下功夫，如代码的审计与检测、漏洞挖掘、建立漏洞机制等；
二是要以同步规划、同步建设、同步运营的原则，实现信创应用与安全能力融合，实现信息化环境与网络安全能力融合；
三是培养面向信创领域的实战化网络安全人才。
“要从整体的视角，从用户的视角，从全局的视角去规划设计，而不是站在一个局部的整改方面去建设，实现网络安全能力和信息化环境的融合，这样才能真正建立内生安全的安全体系。”
吴俣表示，今年8月奇安信正式推出的“内生安全框架”就是实现“内生安全”的方法，该框架是结合“内生安全”理念和系统工程方法论提出的安全解决方案，能指导不同行业输出符合其特点的体系化、实战化的网络安全架构；通过分解为可落地实施的“十大工程五大任务”， 为政企机构提供从“甲方视角、信息化视角、网络安全全景视角”出发的顶层规划与体系化设计建议，以满足数字化转型和智能化升级的信息化保障需求。目前已在40多家大型政企机构进行了落地实践并取得良好效果。作为顶层网络安全设计指导，内生安全框架为万物互联时代创建了网络安全协同联动防御体系。
吴俣表示，通过内生安全框架的落地建设，信创发展将具备五大安全能力，即数据驱动的“终端”管控能力；边界管控的“网络”防护能力；合规高效的“信创”平台能力；中枢纽带的“应用”支撑能力；人机协作的“服务”运营能力。
据悉，目前奇安信产品线已完成信创平台百分之百的适配，如奇安信打造的可信浏览器已成为信创专用操作系统上的预装软件、代码安全系列产品全面覆盖信创产业多个核心场景等；奇安信在北京还设有信创适配基地，倾力打造安全服务、集成服务以及适配测试等完善的服务；
同时主导多个国家部委级的内、外网应用迁移适配、检测工作；奇安信的安全与中国电子PK体系深度融合，构建强大的PK-S体系，实现本质安全+过程安全的有效结合，引领行业发展方向。
关注同花顺财经（ths518），获取更多机会
(function(){var obj = null;if(document.getElementById('arctTailMark')) {obj = document.getElementById('arctTailMark');}if(obj!=null){var str = '(image_address=""http://i.thsi.cn/images/article/logo.jpg"")  返回首页';var showed = 0;try{var oo = obj.previousSibling;while(oo.nodeType!=1 || oo.innerHTML.replace(/\s|\u3000/g,'').length==0){oo = oo.previousSibling;}if(oo.nodeType==1 && oo.tagName.toLowerCase()=='p') {var span = document.createElement('span');span.innerHTML =str;oo.appendChild(span);showed = 1;}}catch (e){}if(showed == 0){obj.innerHTML =str;}}})();
责任编辑：wyj",2020-10-25 21:08:07,同花顺
10,穆长春：数字人民币生态建设过程要保持公平竞争,"中证网讯（记者 彭扬 赵白执南）中国人民银行数字货币研究所所长穆长春10月25日在中国金融四十人论坛联合各组委会成员机构举办的第二届外滩金融峰会上表示，在数字人民币生态建设过程中，一定要保持公平竞争，确保由市场来发挥资源配置的决定性作用，充分调动市场各方的积极性和创造性。“数字人民币的发行和流通，涉及到社会的方方面面，从来不是人民银行一家的事，也不是某一个机构能够凭一己之力完成的事。需要全社会的共同努力，所以我们一直按照双层运营的原则，和社会各界各方一起在进行研发，也取得了一些成果。”
关注同花顺财经（ths518），获取更多机会
(function(){var obj = null;if(document.getElementById('arctTailMark')) {obj = document.getElementById('arctTailMark');}if(obj!=null){var str = '(image_address=""http://i.thsi.cn/images/article/logo.jpg"")  返回首页';var showed = 0;try{var oo = obj.previousSibling;while(oo.nodeType!=1 || oo.innerHTML.replace(/\s|\u3000/g,'').length==0){oo = oo.previousSibling;}if(oo.nodeType==1 && oo.tagName.toLowerCase()=='p') {var span = document.createElement('span');span.innerHTML =str;oo.appendChild(span);showed = 1;}}catch (e){}if(showed == 0){obj.innerHTML =str;}}})();
责任编辑：wyj",2020-10-25 21:05:23,同花顺
11,金融观察：金融创新需要大魄力大担当 更需要监管主动创新,"可以让创新的子弹飞一会，但监管要及时跟上，治理手段不能落后太多，更不能落后太久。
显然，马云的发言是有很明确的指向性的。在24日外滩金融峰会上，马云提出了两个大概念，一个是中国金融没有系统性风险，因为没有系统；二是好的创新不怕监管，但是怕昨天的方式去监管，“不能用管理火车站的办法来管机场”。
马云的讲话是触及了当前我国金融业的发展核心，即金融创新与金融监管的平衡问题。
马云作为互联网金融服务的从业专家，本身需要从金融监管机构获得政策支持，以便让企业获得更大的发展。但目前我们的金融监管体系，甚至是全球金融监管体系，对于数字金融的监管均是一个新课题，监管方面在一定程度上缺乏创新动能。
首先，作为监管层面，本着金融三性中第一位的“安全性”，金融监管机构对于新兴金融服务业态，自然着眼风险防控意识，进一步加强管控，这就不免存在遏制金融创新的情况发生。
以P2P为例，理论上P2P能降低小微企业的融资成本，同时让资金方可以获得比银行更好的理财回报。但在实际操作中，由于放贷项目呆坏账很高，P2P平台只能加大融资利率来覆盖风险，造成融资方资金反而成本很高，变相成为高利贷。甚至出现恶意骗贷、诈骗跑路和非法集资等各种怪象。
在演讲中，马云认为，互联网金融必须有三个核心要素：一是丰富的数据；二是基于大数据的风控技术；三是基于大数据信用体系。用这三个标准衡量，就会看到P2P根本不是互联网金融，但是不能因为P2P把整个互联网技术对金融的创新给否定了。
事实上，在经历2016年以来的P2P乱象之后，我们的金融监管是逐渐收紧的。
其次，当前我国的金融监管还处于分业监管状态，对新兴金融业态存在监管空白和监管漏洞。在当前金融各项业务逐渐混合、深度融合、交叉渗透的现实状态，金融监管需要更加紧密及相互协调。
巴塞尔协议是原银监会主席刘明康引进的国际化银行业监管体系，对我国银行业的健康发展和规范性发展起到了重要作用。
但站在互联网金融服务机构的角度，这种监管模式已经落伍了。目前的数字金融已经打通了银行、基金、信托以及证券等各种业务的融合，业务边界也越来越模糊，综合监管于是提上日程。
央行副行长范一飞在25日的演讲中提出，要全面加快金融数字化转型步伐，同时加快健全适应数字经济发展的现代金融体系。
同时，他在之前一天提到，下一步要加强宏观审慎管理，建立商业银行、互联网联合贷款专项统计制度，将该类业务纳入商业银行宏观审慎评估，将符合条件的互联网企业纳入金融控股公司监管。
按照这一提法，阿里巴巴、蚂蚁集团都将类比金融控股公司，并接受央行等相关机构和相关法规的监管。如此，在蚂蚁集团的许多金融服务中，很多业务属于传统金融范畴，属于持牌金融机构才能从事的业务，是明显与传统金融机构抢夺资源。但站在蚂蚁角度，它是为个人、个体工商户以及小微企业提供金融服务，而这种服务是传统金融机构覆盖不到或做不了的，是必要的有益的补充。
事实上，解决中小微企业融资难、融资贵问题，是全世界的难题。我国提倡金融支持实体企业，特别是金融支持小微企业喊了十几年了，但传统金融机构在这一方面的突破难有建树。
相反，数字金融能很好地通过信息技术解决这个难题。
25日，蚂蚁集团董事长井贤栋在演讲中称，金融创新在全球经济中带来了创造性变化。他认为，金融科技让过去不可能做的事成为可能。今年以来蚂蚁集团通过自身渠道提供了5000多亿的资金服务，其中4000多亿的业务是转给商业银行的，涉及全国100多家银行。
这就是科技的力量，也是金融创新的结果。
当然，创新必然会带来风险。而站在国家层面，每个国家发展金融的前提都是金融稳定。在目前，不管是监管高层还是金融专家，均认为，在风险可控的前提下，需要积极鼓励支持金融创新。
全国社会保障基金理事会副理事长陈文辉10月25日表示，应从稳健角度出发，审慎看待创新业务；风险可控前提下应包容创新、鼓励创新，推动金融产业数字化转型。
但马云认为，真正的创新一定是没有人带路的，一定会犯错误。关键不是不犯错，而是犯错后能否纠正。“很多时候把风险控制为零就是最大的风险。”
这就像一场无形当中的交锋，是数字金融服务从业专家和监管层之间在数字金融创新与监管之间的思想碰撞。
对于金融科技企业而言，金融创新一不小心就会踩到监管红线，甚至有时会付出严重的违规成本，这时候就需要企业有不断创新的大气魄和大担当。
对于监管层而言，不能因为监管框架欠缺，监管技术跟不上，就干脆一刀切。中国互联网金融协会会长李东荣认为，可以让创新的子弹飞一会，但监管要及时跟上，治理手段不能落后太多，更不能落后太久。
在当前数字经济、数字金融在全球大发展的背景下，要运用科技技术加强监管能力，提升行业监管水平。
正如原证监会主席肖钢在25日的课题报告中提到的，运用技术进行监管创新，好的数字金融监管，能为数字金融发展营造包容、审慎的监管环境，提升监管协调性、有效性，有效防范系统性风险。
关注同花顺财经（ths518），获取更多机会
(function(){var obj = null;if(document.getElementById('arctTailMark')) {obj = document.getElementById('arctTailMark');}if(obj!=null){var str = '(image_address=""http://i.thsi.cn/images/article/logo.jpg"")  返回首页';var showed = 0;try{var oo = obj.previousSibling;while(oo.nodeType!=1 || oo.innerHTML.replace(/\s|\u3000/g,'').length==0){oo = oo.previousSibling;}if(oo.nodeType==1 && oo.tagName.toLowerCase()=='p') {var span = document.createElement('span');span.innerHTML =str;oo.appendChild(span);showed = 1;}}catch (e){}if(showed == 0){obj.innerHTML =str;}}})();
责任编辑：wyj",2020-10-25 21:00:30,同花顺
