,title,content,pub_time,src
11,华尔街和普通民众之间被广泛引用的“脱节”突然变得不那么令人困惑了,"这给我们带来了一个关键问题：“现在怎么办？”市场加速复苏的做法正确吗？由于越来越多的人认为经济正在稳步复苏，股市――投资者对股市的怀疑态度根深蒂固――是否有些超前了呢？
【(image_address=""//comment.10jqka.com.cn/sourcepic/12/09Gyxs34.png"")外汇资讯】-出乎意料、相当突然的是，投资者获得了重置、暂缓和重新开始的机会。他们应该怎么做？
截至周二为止的50个交易日中，美国股市的强劲反弹已经是有史以来最好的。上周五，标普500指数今年以来的涨幅几乎持平。包括股息在内，在经历了37%的暴跌、一场全球冠状病毒大流行以及经济依然受限之后，该指数在2020年让你赚到了钱。
由于5月就业报告远好于预期，上周五股市大幅走高，交易员们争相在复苏前景中获得更多敞口，这意味着他们抛售美国国债，买入价格较低的周期性股票，而这些股票曾是经济封锁的主要受害者。
这给我们带来了一个关键问题：“现在怎么办？”市场加速复苏的做法正确吗？由于越来越多的人认为经济正在稳步复苏，股市――投资者对股市的怀疑态度根深蒂固――是否有些超前了呢？
*许多差距的缩小*
股指的上升缩小了许多真实和感知的差距，这些差距自冠状病毒危机爆发以来一直很大。
经济指标从相当低迷的水平有所改善，使得股市从3月23日的低点大幅上扬似乎与经济基本面的关联度有所降低。股市总是试图跑在数据之前，它们更关心的是变化的方向而不是活动的水平，并且总是爬上一堵令人担忧的墙。
现在，在经历了45%的反弹之后，人们更加相信美国只是在快速恢复经济――无论后果如何――华尔街和普通民众之间被广泛引用的“脱节”似乎不那么令人困惑了。
其他迅速缩小的差距包括股票和债券之间、美国指数和全球市场之间，以及市场的成长型和价值型板块之间。
美国国债收益率上周加速上升，10年期国债收益率两个半月来首次超过0.9%。摩根士丹利资本国际全球指数(不含美国)在过去一个月里上涨了15%，而标准普尔500指数上涨了11%。
尽管过去一年，罗素1000成长型指数仍比罗素1000指数领先25个百分点，但成长型股票和周期性价值股之间的历史差距已大幅缩小。
再加上对企业信贷的强劲需求降低了资本成本，使企业资产负债表重新增加，这些趋势表明，全球市场正在经济复苏的背景下调整定价。
*好事太多了？*
对于股市来说，这是一个强有力的看涨天气系统：雄心勃勃的重新开放势头、被压抑的消费者需求、对经济敏感股票的大规模抛售、巨大的全球刺激以及投资者的极度焦虑，而此时关于感染高峰和长期消费者谨慎的看跌理由根本无法在数月内被证明是正确的。
但现在，在这轮强劲反弹之后，市场是在追赶现实，还是在超前？
这盘磁带确实开始跑得很热了。标准普尔500相对强弱指数上周五突破了70水平，而且很少会超过70点太多。标准普尔500相对强弱指数衡量趋势的强度和持续性。
反弹可以在RSI超过70后继续，但在很多情况下，之后的上涨很快就会大部分或全部逆转。
看跌期权与看涨期权之比也是类似的情况。上周，该比率创下多年低点，因下行保护的需求相对于上行押注的需求蒸发了。
周四，纳斯达克成交量创下历史最高纪录，这暗示着越来越狂热的追逐，以及看跌交易员可能正在进行的投降。
上周，美国国家积极投资经理协会(National Association of Active Investment manager)的战术投资顾问的股票敞口达到了典型区间的上限，这些顾问以全权委托策略管理客户资金。
这些定位线索表明，专业人士已经完全处于拉力赛模式，不再与友好的美联储或热情洋溢的磁带作斗争。
许多人都在关注那些使用Robinhood或其他零佣金经纪人的小型在家交易者，他们蜂拥至一些投机性更强、交易速度最快的股票。在过去一周Robinhood客户中最受欢迎的十只股票中，有四只是航空公司的。
不过，可以公平地说，富有的个人和更传统的基金经理变得更为保守。资金源源不断地从股票型基金流出，流入债券型基金。令人担忧的“墙”肯定更短了，防守头寸带来的推动力也减弱了。但两者都没有完全消失。
美国非农就业报告出炉后，股市大涨，这对市场持续走强的预测好坏参半。Bespoke Investment Group表示，标普500指数是就业报告公布后涨幅最大的10个指数之一。在另外九次报告中，无论是一周还是一个月后，标普500指数九次中有三次下跌。周五开盘一周后的平均涨幅为0.8%，一个月后为2.3%。标准普尔500指数上周五收于3163点，收盘较该点位高出约1%。
美国银行全球策略师迈克尔·哈特内特(Michael Hartnett)近几个月一直正确地看多风险资产，部分基于他的牛-熊人气指标和资金流被锁定在零水准。到上周四，该指标略高于零。在2002年以来该指标从零上涨的五次中，标普500指数在接下来的四周平均上涨2.8%，在八周内上涨4.8%。然而，在过去12周的时间里，有两次出现了个位数左右的下跌。
他在上周五数据和市场走势公布前撰文，预计标普500指数将升至3250点，但建议卖出。该指数上周五的高点为3211点。
这是一个合乎逻辑的水平，就像股票在重新评估风险敞口以及“恢复正常”的样子，以及何时恢复正常的情况下，趋于平稳或略有回落一样。
但值得记住的是，表明本轮反弹在短期内过热的许多相同特征，也往往只会出现在持久的长期上涨中。
同花顺上线「疫情地图」
点击查看：新型肺炎疫情实时动态地图>>>
关注同花顺财经（ths518），获取更多机会
(function(){var obj = null;if(document.getElementById('arctTailMark')) {obj = document.getElementById('arctTailMark');}if(obj!=null){var str = '(image_address=""http://i.thsi.cn/images/article/logo.jpg"")  返回首页';var showed = 0;try{var oo = obj.previousSibling;while(oo.nodeType!=1 || oo.innerHTML.replace(/\s|\u3000/g,'').length==0){oo = oo.previousSibling;}if(oo.nodeType==1 && oo.tagName.toLowerCase()=='p') {var span = document.createElement('span');span.innerHTML =str;oo.appendChild(span);showed = 1;}}catch (e){}if(showed == 0){obj.innerHTML =str;}}})();
责任编辑：lg",2020-06-09 04:45:47,同花顺
12,2020年5月中国陶瓷产品出口量为117.5万吨 同比下降41.3%,"(image_address=""//comment.10jqka.com.cn/sourcepic/12/1tDJzMfpsajNextagAtsaytsay.png"")讯：据中商产业研究院数据库显示，2020年5月中国陶瓷产品出口量下降，2020年5月中国陶瓷产品出口量为117.5万吨，同比下降41.3%。
(image_address=""http://e.thsi.cn/img/86aed9e51c898a82"")
数据来源：中商产业研究院数据库
从金额方面来看，2020年5月中国陶瓷产品出口金额为1731.9百万美元，同比下降15%。
(image_address=""http://e.thsi.cn/img/5d9faf45e0758641"")
数据来源：中商产业研究院数据库
2020年1-5月中国陶瓷产品出口量及金额增长情况
(image_address=""http://e.thsi.cn/img/d3bc951fdd14b372"")
数据来源：中商产业研究院数据库
同花顺上线「疫情地图」
点击查看：新型肺炎疫情实时动态地图>>>
关注同花顺财经（ths518），获取更多机会
(function(){var obj = null;if(document.getElementById('arctTailMark')) {obj = document.getElementById('arctTailMark');}if(obj!=null){var str = '(image_address=""http://i.thsi.cn/images/article/logo.jpg"")  返回首页';var showed = 0;try{var oo = obj.previousSibling;while(oo.nodeType!=1 || oo.innerHTML.replace(/\s|\u3000/g,'').length==0){oo = oo.previousSibling;}if(oo.nodeType==1 && oo.tagName.toLowerCase()=='p') {var span = document.createElement('span');span.innerHTML =str;oo.appendChild(span);showed = 1;}}catch (e){}if(showed == 0){obj.innerHTML =str;}}})();
责任编辑：lg",2020-06-09 04:44:25,同花顺
13,二手奢侈品千亿市场背后 红布林的机遇与,"早前有行业专家认为，中国已经开始复制日本90年代的二手奢侈品繁荣发展之路，中国的奢侈品消费市场已经出现了从过剩消费向二手奢侈品市场流通的过渡苗头。从2010年开始，国内二手电商萌芽就已出现，这一市场至今一直保持着增长的趋势，据统计，中国的闲置品交易规模呈现每年30%以上的速度增长，预计到2020年将达到1万亿元。面对潜力如此巨大的市场，国内电商巨头都已深度布局，像阿里的闲鱼、京东的拍拍二手、58的转转。而在垂直领域，也出现了许多新平台，二手奢侈品交易的红布林、二手书交易的多抓鱼、二手车交易的优信和瓜子等等。
面对不同领域的市场规模，不同领域中二手电商平台的崛起也都透露着各自领域内的市场特点，像近两年的二手奢侈品概念，已然悄悄的在互联网交易中不断被普及和被接受。这让行业人士和资本都参与到了二手奢侈品行业内一探究竟。
·千亿市场规模是怎样产生的
近十年来，中国一直是全球奢侈品市场增长的重要引擎，中国消费者的市场购买力持续呈现强劲趋势。井喷式的购买使得中国消费者手中囤积了大量的奢侈品，产生了我们常说的”过度消费”现象。根据贝恩的统计，中国的奢侈品消费占据了全球奢侈品消费近1/3的市场为7000亿元，依照欧美平均20%-30%的二手渗透率，至少也是1400亿元的二手奢侈品市场规模，预计到2026年中国二手奢侈品的存量将达到3000亿元，而受经济走势的放缓、物价指数的波动、中美贸易摩擦等多方面的因素影响，奢侈品新品的消费人群会对资产的泡沫化有所顾虑，奢侈品市场出现循环经济链条就成为了一个必然的发展趋势。
物质过剩的时代，消费者购买能力的下降以及对资产变现、追求性价比的需求，给中国二手奢侈品市场的崛起和发展创造了极佳的机会。
·用户的消费理念发生了什么变化
随着90后、千禧一代的崛起，这群人逐渐成为了主力消费人群，他们的心态更加开放，对不同文化的包容程度更高，不再喜欢一成不变，热爱变化。从奢侈品品牌近年的动作就能看出来，各品牌在发生变革，追求更多的潮流个性和新颖来抓住年轻消费群体。而年轻消费群的开放心态也成为了二手奢侈品市场发展的重要动力。
有研究结果显示，超过60%的千禧一代在二手平台很活跃。二手奢侈品红布林的数据报告中显示，平台有超过70%的消费人群为90后00后，这也体现了中国二手奢侈品消费代表人群年轻化的特点。
还有行业观点认为，年轻一代是消费老道的一代，他们并非一昧冲动购买，而是会将性价比考虑在其中，特别是二手奢侈品的支付成本低的特点很好的匹配了年轻群体的整体消费水平。同时他们也被认为是有环保理念的一代，他们消费观念的转变使得二手奢侈品市场的需求量不断增长。
更有趣的是，时尚人士和流量明星经常被曝逛中古店，他们经常穿戴中古店淘来的时尚品进行演出，这其中的时尚消费理念，无形当中也会对当代年轻人产生了一定影响。
·二手奢侈品交易靠怎样的模式跑起来
中国高度发达的互联网在二手交易中也发挥着极具特色的作用。像闲鱼、转转等多为社区属性，这种属性下买卖家双方通过平台产生交流和交易，属于C2C模式，这也是中国早期二手电商发展的主要模式。
而生于2017年的红布林，针对二手奢侈品这一垂直细分领域，采用C2B2C的模式，平台作为中间的B，提供着审核、鉴定、估价等一系列具有增值价值的服务。这一模式其实成为了垂直领域的切入突破口，它的好处就是能够很好的标准化商品，一定程度上保证二次流通市场的规范性。从服务体验角度来看，红布林的模式也很好的解放了买卖家，减少了时间成本，促成二手奢侈品的高效运转。
总体来看，目前国内的二手电商以C2C和C2B2C两种模式为主，C2B2C适合垂直品类，形成本身领域的壁垒后能够稳扎稳打的横向扩张品类。像红布林这样的垂直细分类平台的玩法未来也许会在其它领域具有更多的复制扩展可能性。
同花顺上线「疫情地图」
点击查看：新型肺炎疫情实时动态地图>>>
关注同花顺财经（ths518），获取更多机会
(function(){var obj = null;if(document.getElementById('arctTailMark')) {obj = document.getElementById('arctTailMark');}if(obj!=null){var str = '(image_address=""http://i.thsi.cn/images/article/logo.jpg"")  返回首页';var showed = 0;try{var oo = obj.previousSibling;while(oo.nodeType!=1 || oo.innerHTML.replace(/\s|\u3000/g,'').length==0){oo = oo.previousSibling;}if(oo.nodeType==1 && oo.tagName.toLowerCase()=='p') {var span = document.createElement('span');span.innerHTML =str;oo.appendChild(span);showed = 1;}}catch (e){}if(showed == 0){obj.innerHTML =str;}}})();
责任编辑：lg",2020-06-09 04:43:16,同花顺
14,杨德龙：全球金融市场巨震完成大半第三阶段即将到来,"6月8日周一受到海外市场普遍大涨的影响，三大指数高开高走，出现了较好的反弹，从盘面上来看，ELD板块表现突出，白酒板块也表现较佳，消费电子板块大幅反弹。另一方面，地摊经济板块在前期炒作较猛，周一相关概念股大幅走弱，这也再次验证了我的预判，提醒大家一定不能过度炒作热点板块特别是题材板块，因为这些热点如果不能落实到上市公司的业绩上，在短线炒作之后可能出现较大幅度调整，追高被套的风险较大。
全球市场上周均出现大幅表现，特别是美股上周大幅反弹，纳斯达克指数盘中创出历史新高，标普500指数和道琼斯指数也收复大部分失地。美股的强劲回升为全球股市的反弹起到了很好的带头作用，上周五道指一度暴涨逾千点，涨幅达到3.15%，更显示出美股的强劲走势。
欧美股市在上周也纷纷出现大涨，上周法国CAC40指数大涨10.7%，德国DAX指数暴涨10.88%。港股方面，上周也出现大幅反弹，恒生指数上周上涨7.88%，恒生国际指数上周上涨5.28%。这显示出全球资本市场已从前期大幅调整阶段进入快速反弹阶段。我在3月份美股暴跌时提出全球金融市场完成巨震需要三个阶段，现在逐步得到市场的验证。在第一阶段，以美股暴跌为标志，出现流动性枯竭，所有资产都暴跌，避险资产黄金也出现大幅下跌，而原油价格一度下跌70%。第二阶段是流动性改善带来的大幅反弹阶段，标志是美联储将基准利率降到0且实施无限量化宽松政策，美联储大量放水带动全球各国央行放水救市，全球资本市场迎来反弹，经济在受到疫情冲击大幅回落之后，随着复产复工，经济面也开始出现复苏的预期，这些都会给全球资本市场带来反弹的机会。流动性宽松、经济复苏预期两因素共同推动，美股率先大幅反弹，纳斯达克指数强势创出历史新高，另一个重要原因是科技受到疫情的冲击较小，疫情主要影响的是消费服务业，美国科技股基本面良好，率先创出新高，还带动了股市的反弹。
油价也改变了之前大幅下跌的走势，油价在伦敦市场6月8日升破每桶43美元，直接原因是欧佩克及其盟友此前同意把历史性的减产协议延长一个月，并承诺采取更严格的措施确保成员国履行承诺，布伦特原油期货上涨2.4%，上周五连续第六次实现全周上涨，为2018年5月以来最长连涨走势。原油价格在第一阶段一度下跌70%，但第二阶段实现了翻倍反弹，也显示出投资者对经济复苏的预期较为强烈。第一阶段美元是唯一上涨的资产，因为在危机中，投资者以现金为王，对于全球投资者来说现金指的就是美元，美元作为硬通货具有较强信用和流动性，因此美元指数出现快速上涨，其他国家货币纷纷出现贬值，特别是新兴市场货币贬值力度较大。进入第二阶段，全球流动性改善，投资者风险偏好提升，这时美元可能走弱，其他国家货币有望迎来反弹机会。
第三阶段的标志是疫情出现趋势性拐点，特别是美股疫情开始下降，这时全球经济强劲复苏，全球金融市场有望迎来大幅上涨的机会，美股也有望再创新高。当前已处于第二阶段末、第三阶段即将到来的时刻，作为经济晴雨表，股市往往提前反映经济的变化，尽管经济复苏还需要一两个月的时间来验证，但美国经济的一些先行指标已显示复苏正在开始，但并不强劲，美股则提前反映了这种预期。上周五公布的非农就业数据远超预期，加上欧央行加码购债规模，欧佩克达成减产延期协议，美国出现了强劲回升，虽然周末传出五月非农就业数据出现乌龙，实际上没有那么好，但比预期的还是要高一些，因此预计周一美股可能出现一定的震荡调整，但美股强势走势已经形成，短期内很难改变，可能还会出现一定震荡反复，但大幅下挫的可能性已经不大，全球金融市场巨震已经完成了大半。
回到A股市场，当前A股市场已完成探底的过程，进入筑底反弹阶段，A股市场一些优质股票已率先启动，例如我建议大家重点关注的消费白马股、科技龙头股轮番表现，特别是消费板块里的三剑客，白酒、医药、食品饮料龙头股不断创出历史新高，带来了很好的投资机会。外资也在加速流入A股市场，据统计，4月份流入530亿，5月份流入300亿，累计超过800亿，预计今年全年外资流入A股的量仍会达到3000亿左右，与过去两年相当，并未受到3月份全球股市大跌导致的外资短暂流出的影响，这显示出A股市场的优质股票已具备较强的外资吸引力。根据测算，目前欧美股市估值水平处于过去10年的80%-90%分位，沪深300上证综指估值则处于历史较低水平，这对于全球资金来说具有一定的吸引力。从经济增长来看，根据IMF的预测，今年美国、欧元区、日本、德国、法国、英国的经济增速分别为-5.9%、-7.5%、-5.2%、-7.0%、-7.2%和-6.5%。而中国经济增速在全年有望实现正增长，虽然一季度中国GDP受到疫情冲击出现了6.8%的负增长，但下半年经济会强力复苏，全年经济有望保持正增长，这在全球主要经济体里无疑是领先的，无论是中国经济增长对全球经济增长的贡献，还是中国经济总量占全球经济总量的占比均会出现明显的回升，经济复苏及相对顽强的走势也会增加人民币资产中长期的投资吸引力。
随着国内股市和债市逐步对外开放，A股市场和中国债券的投资吸引力也将不断增加，预计外资可能加速流入中国资本市场。白马股依然是外资的首选，从2016年起我就建议大家跟外资学投资，外资这一年大量流入的股票即为可重点关注的股票，一些投资者简单抄作业也取得了很好的回报。外资流入前十名基本都是我建议大家重点关注的白龙马股，特别是消费白马股，虽然当前这些股票估值并不便宜，但外资还是大量流入抢筹，这说明在外资眼中，这些公司虽然价格较高，但仍具备长期的投资价值，这一点值得大家参考。
（责任编辑：任刚 HF008）
同花顺上线「疫情地图」
点击查看：新型肺炎疫情实时动态地图>>>
关注同花顺财经（ths518），获取更多机会
(function(){var obj = null;if(document.getElementById('arctTailMark')) {obj = document.getElementById('arctTailMark');}if(obj!=null){var str = '(image_address=""http://i.thsi.cn/images/article/logo.jpg"")  返回首页';var showed = 0;try{var oo = obj.previousSibling;while(oo.nodeType!=1 || oo.innerHTML.replace(/\s|\u3000/g,'').length==0){oo = oo.previousSibling;}if(oo.nodeType==1 && oo.tagName.toLowerCase()=='p') {var span = document.createElement('span');span.innerHTML =str;oo.appendChild(span);showed = 1;}}catch (e){}if(showed == 0){obj.innerHTML =str;}}})();
责任编辑：lg",2020-06-09 04:43:01,同花顺
15,全球汽车销量走出低迷：中国引领 日本落后,"疫情之后，中国市场成为了全球市场的恢复引擎。
随着新冠疫情导致的紧迫状态有所缓和，中国汽车销售市场基本上已经迅速复苏，并恢复正向增长。在政策刺激、需求释放等一系列利好因素的影响下，根据中国汽车工业协会的数据，5月份中国新车销量同比增长11.7％，至约214万辆，成为全球销量最大的市场，这是中国汽车销售实现的第二个月增长。
与此同时，在美国和欧洲市场之中，需求下降趋势逐渐触底，汽车销售市场也开始显现出改善迹象。市场研究公司MarkLines数据显示，5月份美国新车销量下滑30.1％，至111万辆，降幅小于4月份的46.6％，三个月来首次超过100万辆。
随着美国经销商重新运营，汽车销售市场开始向好发展，通用汽车就是受益者之一。新泽西一家通用汽车经销店的高管表示，“销售从4月下旬就已经开始逐步回升了。”不过，愈演愈烈的游行示威活动正在与疫情产生叠加影响，美国市场在5月表现出的缓和迹象能否得以延续，还需要打上一个问号。
经销商的重新运营也使得德国与英国的终端销售情况稍显缓和。数据显示，德国5月份下降了销量同比下滑了49.5％，要好于4月份同比下降61.1％；英国市场也是如此，4月份，其销量同比下跌超过97％，5月份销量略有回升，降至89％。但可以预见的是，不管是德国还是英国市场，想要恢复正常状态还有很长的一段路要走。
与上述国家不同，日本5月市场恶化更多的来自于政策影响以及消费心理的变化。根据日本汽车经销商协会和日本轻型汽车和摩托车协会的数据，销量下降了44.9％，至218,285辆，而4月份则下降了28.6％。
这主要源于三个因素，其一是去年10月的消费税增加。 由于消费者急于在加息前大举购买，去年9月份日本汽车市场销量增长了12.9％，然后在10月份就开始呈现下降态势，此后便一直保持着下跌状态。九州岛一位经销商代表表示：“ 财政年度末的2月和3月涨幅没有往常那么大,先前加息造就的消费高峰是可能原因。”
其二是消费时间上不允许。日本政府的紧急状态和全屋服务要求恰好与4月下旬至5月初的春季黄金周假期重叠导致汽车市场错过了一次市场的消费高峰期。
“外出旅行的限制没有其他国家严格，但是很多业务通常都集中在假日期间，因此影响很大。”咨询公司Arthur D. Little Japan的合伙人铃木裕人如此表示。
当然,消费者的消费情绪也可能发挥作用，经济低迷的预期削弱了消费对大件商品的渴望，消费需求正在进一步萎缩。如何重振市场信心成为日本政府需要着重考量的问题之一。
汽车消费是国民经济中的重要标志，对各国的工业产出和就业有着举足轻重的影响。疫情之后，汽车消费市场的复苏情况在很大程度上体现了国民经济之后的运行状态。从这个角度来说，中国汽车消费的快速复苏正在为我国经济的长远发展提供充足的信心。
同花顺上线「疫情地图」
点击查看：新型肺炎疫情实时动态地图>>>
关注同花顺财经（ths518），获取更多机会
(function(){var obj = null;if(document.getElementById('arctTailMark')) {obj = document.getElementById('arctTailMark');}if(obj!=null){var str = '(image_address=""http://i.thsi.cn/images/article/logo.jpg"")  返回首页';var showed = 0;try{var oo = obj.previousSibling;while(oo.nodeType!=1 || oo.innerHTML.replace(/\s|\u3000/g,'').length==0){oo = oo.previousSibling;}if(oo.nodeType==1 && oo.tagName.toLowerCase()=='p') {var span = document.createElement('span');span.innerHTML =str;oo.appendChild(span);showed = 1;}}catch (e){}if(showed == 0){obj.innerHTML =str;}}})();
责任编辑：lg",2020-06-09 04:42:33,同花顺
