,title,content,pub_time,src
0,沙特启动终极石油实力竞赛 这将是它所能得到的,"北京时间3月14日消息，沙特阿拉伯已经放弃了支持全球市场原油价格的努力，现在正准备洪水大量廉价石油，这是一个惊人的转变策略，推动原油期货戏剧性暴跌，开启了与俄罗斯和美国等竞争对手的价格战。
全球最大的原油出口国沙特一周前前往欧佩克(OPEC)位于维也纳的总部，游说该组织其他成员国和俄罗斯等产油国延长并深化协同减产，以应对新型冠状病毒爆发导致的需求急剧下降。
然而在维也纳举行的会议没有达成协议就破裂了，沙特阿拉伯和俄罗斯变成了一场原油生产战的对手。在这场生产战中，胜利意味着出售更多的石油，攫取更多的市场份额——无论价格如何。然而，这种策略是有风险的——尤其是在新型冠状病毒爆发期间——这可能会导致一个仍然依赖原油销售来拉动国内经济的国家度过艰难的年份。
分崩离析
沙特能源大臣阿卜杜勒-阿齐兹.本.萨勒曼王子(Abdulaziz bin Salman)去年12月推动欧佩克和其他产油国的部长们将产量进一步削减至每天170万桶。沙特今年2月自愿减产40万桶/天，并寻求每天进一步削减150万桶，以应对冠状病毒造成的需求下降的影响。
一位出席维也纳会议的欧佩克高级消息人士称，在欧佩克所有成员国的支持下，本.萨尔曼还推动将削减计划延长至2020年，但没有获得俄罗斯能源部长诺瓦克(Alexander Novak)的事先同意。
诺瓦克在会后告诉记者，4月1日，生产商将可以自由地做出自己的生产决定，不再被集体市场管理方式所束缚。
沙特阿拉伯是减产的主要推动者，在过去3年里，减产帮助支撑了原油价格。但当俄罗斯拒绝让步时，沙特改变了计划，开始进攻，并加强了许多观察家所称的夺回市场份额的激进战略。
沙特阿拉伯的第一步行动是自4月1日起大幅增产260万桶/日，达到创纪录的1，230万桶/日。次日，沙特阿拉伯国有石油巨头沙特阿美公司(Saudi Aramco)宣布，将向优先客户大幅降价。这些举措震惊了能源市场，原油价格创下1991年以来最大单日跌幅。
随着原油价格暴跌，沙特能源部长随后指示沙特阿美加快计划，在年底前将产能提高至每日1300万桶。该地区的盟友阿拉伯联合酋长国随后也加入了进来。阿布扎比国家石油公司(Abu Dhabi National Oil Company)承诺，将在4月使市场供应量提高至每日400万桶以上，较当前产量高出100万桶，并将加快将产能提高至500万桶/日的计划。
事后看来，沙特和其他地区大国显然想向世界传达两个关键信息。首先，沙特仍愿意展示自己的实力，并提醒所有人，如果沙特不能在供应过剩的市场上充当全球能源减震器，将会发生什么。在就是，如果能源世界真的被自由市场力量所左右，那么海湾产油国将是最后的幸存者。他们开采原油的成本比任何生产商都低，开采成本较美国的页岩油生产商低得多。
全球影响
标普环球本周指出，由于全球市场崩溃和债务水平高企，美国中型石油生产商Apache、Devon和Murphy Oil已经削减了三分之一的预算。他们根本无法对中东的对手采取强硬态度。
一位了解情况的沙特消息人士表示，发动价格战不在维也纳的计划之内。这位消息人士谈到了努力追求一个不同的结果——他辩称，俄罗斯人参加会议的目的是决定结束美国页岩油生产商的扩张。一位俄罗斯政府消息人士表示，他们愿意妥协，但不会像利雅得方面希望的那样，那样深入或长期地削减产量。
美国页岩油巨头也出手了，控告沙特非法倾销石油。美国页岩油亿万富翁、现任总统的挚友哈姆(Harold Hamm)向美国商务部提出申诉，控告沙特“非法”向全球市场倾销原油，他将与国内能源生产商联盟(Domestic Energy Producers‘Alliance)一起发起调查。美国商务部将有20天的时间来决定是否接受申诉，以及在60天内做出裁决。
美国能源公司正陷入困境，油价从1月份的高点下跌了50%，跌至2016年初以来的最低水平。美国能源情报署(US Energy Information Administration)表示，美国今年的石油日产量增幅将低于预期的76万桶，到2021年将下降逾30万桶。
当今，美国仍然是世界上最大的石油生产国。到4月，随着俄罗斯的石油产能扩张能力有限，沙特可能会在世界石油生产国中排名第二。一些人认为，在沙特重新夺回全球产量桂冠之前，石油价格战不会结束。
同花顺上线「疫情地图」
点击查看：新型肺炎疫情实时动态地图>>>
关注同花顺财经（ths518），获取更多机会
(function(){var obj = null;if(document.getElementById('arctTailMark')) {obj = document.getElementById('arctTailMark');}if(obj!=null){var str = '(image_address=""http://i.thsi.cn/images/article/logo.jpg"")  返回首页';var showed = 0;try{var oo = obj.previousSibling;while(oo.nodeType!=1 || oo.innerHTML.replace(/\s|\u3000/g,'').length==0){oo = oo.previousSibling;}if(oo.nodeType==1 && oo.tagName.toLowerCase()=='p') {var span = document.createElement('span');span.innerHTML =str;oo.appendChild(span);showed = 1;}}catch (e){}if(showed == 0){obj.innerHTML =str;}}})();",2020-03-15 00:27:12,同花顺
