,title,content,pub_time,src
0,一览群智在“科技战疫大数据公益挑战赛”中喜提四项认证,"6月28日，“2020北京数据开放创新应用大赛--科技战疫·大数据公益挑战赛”举办了线上颁奖会，一览群智“疫情政务问答助手”荣获算法赛道季军，并获评产业应用潜力证书;同时，“重大突发公共卫生事件处理解决方案”获评北京公共数据开放创新基地创新实践方案证书，以及一阶段竞赛优秀方案证书。
本次大赛由北京市经济和信息化局、中国计算机学会大数据专家委员会联合主办，北京市大数据中心、北京市政交通一卡通有限公司、DataFountain等联合承办，旨在助力疫情防控和疫情之后的经济社会恢复工作，吸纳大数据产业顶尖社会资源，释放专业人才智慧，推介国产人工智能产品，助力大数据产业高质量发展。
大赛自2月启动，分为两个赛道：;算法赛道注重科学性和智能性，赛题包括“网民情绪识别”、“重点区域人群密度分析”、“疫情虚假新闻检测”、“疫情问答助手”;方案赛道则更注重方案的创新性和实用性，赛题包括“重大突发公共卫生事件处理解决方案”、“疫情对北京社会经济影响分析” 、“疫情数据可视化”;大赛吸引了来自全球的6709人，组成5525支队伍参赛，提交作品2万余份，全部比赛于6月13日顺利结束。
在大赛举办过程中，来自学术、行业的专家参与了多轮评审，层层筛选下，一览群智算法团队与政企解决方案团队凭借自身的突出表现，囊括四项大奖，充分彰显了一览群智在技术与创新等多方面的强劲实力。
1)“疫情政务问答助手”
算法赛道中的疫情政务问答助手旨在测评智能问答算法能力，是问题理解、内容搜索、答案提取等多个环节综合能力的集成。任务将提供以疫情为主的政策数据及、用户问题以及标注好的答案片段，参赛者通过对政策数据的分析、处理和组织，利用训练数据集训练智能问答算法，并在测试数据集上进行评测，评测指标为最终返回答案的准确性。
(image_address=""http://e.thsi.cn/img/1ac5438ce0309cb1"")
在竞赛过程中，在信息检索和认知智能方面的深厚经验和快速迭代改善模型的能力，是一览群智算法团队成功的两大关键。团队采用基于ElasticSearch的全文检索模块和基于Transformer结构的阅读理解模型方案，综合展示了其在问题理解、内容搜索、答案提取等多个环节的全面算法能力。问答系统主要分为“信息检索”和“阅读理解”两部分，团队在设计疫情政务问答系统时以竞赛为目标、实用性为导向，针对疫情文本的领域特殊性，在整个方案的细节上进行了多重优化。整体方案在竞赛中取得了优异成绩，也再次验证了相关文本理解技术通用方案的先进性。
(image_address=""http://e.thsi.cn/img/6a1a65b49b1332d"")
2)“重大突发公共卫生事件处理解决方案”
随着新冠疫情传播迅速，北京市及时启动了重大公共卫生事件一级响应，避免疫情进一步扩散。面对重大突发公共卫生事件，技术的应用应发挥支撑作用。本赛题要求参赛者利用公开数据，以新冠疫情为例，运用大数据、人工智能、云计算等数字技术，从疫情监测分析、病毒溯源、精准防控施策、精准资源调配、防控措施效果评估等单个或多个角度，提供重大突发公共卫生事件综合处理解决方案及基础设施建议建议。
一览群智解决方案团队基于此前参与的北京市抗击新型冠状病毒疫情防控工作经验，结合已设计研发的AI防控智能追踪服务系统，综合运用大数据、云计算、人工智能等数字技术，通过多种数据采集渠道，针对各种类型突发事件，围绕关键数据的采、治、用、管，并基于自研的“智语”、“智慧”、“智图”、“智策”系统，快速建立各种AI模型和重大突发卫生事件的防控应用系统，从重大突发公共卫生事件的监测分析、追踪溯源、防控救治、应急决策等方面设计出AI感知识别系统、AI智能追踪溯源系统、AI复盘推演系统、AI应急处置系统;四大系统的落地，形成了从数据感知、数据认知、数据应用等全生命周期的重大突发公共卫生事件处理防控解决方案，提高重大突发卫生事件的风险感知能力和精度，从而有效规避风险，使决策管理的影响评估变得可行、精准，风险得到有效管控，从整体层面提升突发公共卫生事件应急处置能力。
(image_address=""http://e.thsi.cn/img/d933f4085adbcbf8"")
3)技术+方案，助力“科技战疫”
随着新冠疫情的逐渐散去，此次科技抗疫的“大练兵”，给各科技行业都带来了全新的思考。在大赛后，一览群智将会把此次科技创新成果快速落地，满足政府对于社会治理、智慧城市等多方面的需求，提供给用户更便捷的服务体验。
一览群智以实际行动证明，一家有担当的企业不仅有过硬的技术能力，同时还具备完善的产品与解决方案体系;未来，一览群智将继续以NLP和知识图谱等认知智能技术为基础，满足政府的实际需求，为其提供一站式AI产品和行业解决方案，为数字政府建设添砖加瓦。
关注同花顺财经（ths518），获取更多机会
(function(){var obj = null;if(document.getElementById('arctTailMark')) {obj = document.getElementById('arctTailMark');}if(obj!=null){var str = '(image_address=""http://i.thsi.cn/images/article/logo.jpg"")  返回首页';var showed = 0;try{var oo = obj.previousSibling;while(oo.nodeType!=1 || oo.innerHTML.replace(/\s|\u3000/g,'').length==0){oo = oo.previousSibling;}if(oo.nodeType==1 && oo.tagName.toLowerCase()=='p') {var span = document.createElement('span');span.innerHTML =str;oo.appendChild(span);showed = 1;}}catch (e){}if(showed == 0){obj.innerHTML =str;}}})();
责任编辑：xr",2020-07-08 15:55:14,同花顺
1,中医药治疗尘肺病大有可为,"尘肺病被称为中国头号职业病，也被称为“慢性癌症”，危害大、影响广、患者众。目前全国尘肺病患者多达600万人，据湖南省卫健委统计，2019年湖南省新增报告尘肺病1218例。
尘肺病之类的职业病是致贫返贫的“疑难杂症”
安化县清塘铺镇曾经煤矿、金矿等矿企林立，当地居民不少在矿上干活。以前，由于缺乏对职业病尤其是尘肺病的认知，工人在一线作业时基本是无防护、无体检、无保险。据镇长文武介绍，截至2019年底，该镇有3800多名尘肺病患者，其中有 900多名属尘肺病三期，700多名属二期，情况十分严峻。
清塘铺镇尘肺病现状是我省农民工职业病问题的一个缩影。尘肺病不仅给患者带来无尽的痛苦，同时，也是农民工致贫返贫的“疑难杂症”。依据相关法规，尘肺病人享受工伤待遇先要进行职业病诊断及鉴定，但诊断鉴定的前提是需要确定劳动关系，提供职业史。实际上，先前在一些小型矿企工作的农民工很少有与企业签订劳动合同。
据《中国尘肺病农民调查报告（2019）》显示，尘肺病病患农民去年年平均收入为20639元 、中位数为20000元 ，年平均总支出为29995 元、中位数为25000元，其中64%的尘肺病病患农民家庭在上一年处于入不敷出状态。《尘肺病治疗中国专家共识（2018年版）》显示，我国每例尘肺患者年均医疗费用1.91万元，间接费用和其他费用4.58万元。
近年来，各级政府和社会组织每年均需投入上千亿资金用于尘肺病患者的救助，但仍不能解决根本问题。湖南省在全国率先启动“尘肺病农民工基本医疗救治救助”惠民行动，省财政投入专项救助资金1.5亿元，让45766人次获得基本医疗救治救助，其中建档立卡贫困户占1/3，缓解了他们的生活压力。
尘肺病治疗向中医药“求解”
当前，尘肺病问题的难点在于国内外均没有针对尘肺病肺纤维化有效的治疗药物和措施，且理论上肺组织纤维化是不可逆转和恢复的，因此尘肺病目前仍是一个没有医疗终结的疾病。
我国现行主流的医治尘肺病的方法源自西医，主要包括抗肺纤维化的药物治疗、合并症的综合治疗、肺移植、大容量肺灌洗等。但西医的常规治疗方法属于“对抗疗法”，即针对病灶和症状进行直接治疗。
“大多数时候，我们都是头痛医头、脚痛医脚。”湖南省职业病防治院职业病科主任、国家临床重点专科学科带头人肖雄斌说，“对于三期的患者，我们现在最多只能缓解其病痛，缺乏有效的治愈手段，作为一名医生我时常感到无助和无奈。”
世界上尘肺病研发实力最强的医疗机构和企业大多在欧美。“但他们每年新增的尘肺病患者很少，有的国家才几十号病患，对尘肺病的关注很少，研发动力不足。指望他们是万万不可的，治疗尘肺病我们必须走自己的路。”肖雄斌说。
因此，2017年，从医近三十年的肖雄斌开始新的尝试，决定向中医“求解”。
建议将中医药治疗尘肺病纳入国家体系
浏阳利美医院的“查、调、消、排、养”五步中医康复法受到了省内医学界的持续关注，业内专家认为其对于治疗尘肺病获得了临床突破，主要表现在临床治疗效果、药物安全性和临床推广意义三个方面。
2018年至今，利美医院开始定期免费收治尘肺病患者。以安化县清塘铺镇为试点，该镇389名尘肺病患者先后分20批赴利美医院接受6-12个月的中医药治疗。
患者熊咸友表示：“连续服药6个月后，就不再容易感冒了，人也舒服了很多。13个月后身体基本恢复正常，大部分家务活现在都可以承担。”吴顺林称：“服药1个月后就有了一些好转，目前呼吸顺畅，今年停药后，肺部状态也保持得比较好。”赵国强在服药9个月后也明显好转，目前已重新就业，在镇上的一家购物广场当保安。
接受中医治疗的病患每三个月进行一次肺功能检查，通过胸部CT、肺功能、血氧浓度、临床症状、6分钟步行、肝肾功能等检测，并对治疗效果进行整体评估，结果显示，利美医院治疗方案的整体有效率为71%，且该方案的花费远低于目前主流的医治方案。
肖雄斌对此评价说：“湖南省先前在救治尘肺病农民工的投入上走在全国前列，现在需要给中医药一次机会，让湖南中医治疗经验造福更多的尘肺病患者。”
全国人大代表邹彬不久前来到浏阳利美医院进行调研后表示，将建议将中医药治疗尘肺病纳入国家体系，在全国筛选、确定临床疗效明显的中医药疗法纳入国家重点科技攻关项目，给予技术、资金和政策配套支持；建议建立中药创新临床药物评价体系；尽快将中医治疗优势病种纳入医保、推行按病种付费；建议相关部门组织对中医药治疗尘肺病等特色治疗方法和特殊的中药方剂进行系统总结和重点推广。（李卓群）
关注同花顺财经（ths518），获取更多机会
(function(){var obj = null;if(document.getElementById('arctTailMark')) {obj = document.getElementById('arctTailMark');}if(obj!=null){var str = '(image_address=""http://i.thsi.cn/images/article/logo.jpg"")  返回首页';var showed = 0;try{var oo = obj.previousSibling;while(oo.nodeType!=1 || oo.innerHTML.replace(/\s|\u3000/g,'').length==0){oo = oo.previousSibling;}if(oo.nodeType==1 && oo.tagName.toLowerCase()=='p') {var span = document.createElement('span');span.innerHTML =str;oo.appendChild(span);showed = 1;}}catch (e){}if(showed == 0){obj.innerHTML =str;}}})();
责任编辑：cyf",2020-07-08 15:54:24,同花顺
2,2019年全国广播电视行业总收入8107.45亿元 同比增长16.62%（图）,"(image_address=""//comment.10jqka.com.cn/sourcepic/12/1tDJzMfpsajNextagAtsaytsay.png"")讯：据国家广播电视总局消息，2019年深入贯彻新发展理念，推动高质量发展，广播电视行业总收入持续增长，实际创收收入增幅较大。2020年，广播电视行业将坚持以习近平新时代中国特色社会主义思想为指导，深入贯彻落实党的十九大和十九届二中、三中、四中全会精神，继续正本清源、坚持守正创新，深入实施“舆论引导能力提升”、“新时代精品”、“智慧广电”建设、“视听中国”播映、“安全播出”、“管理优化”六大工程，以工程带项目、抓重点带整体，创新创优出亮点、见实效，为夺取全面建成小康社会伟大胜利作出更大贡献。
数据显示，2019年全国广播电视行业总收入8107.45亿元，同比增长16.62%。
(image_address=""http://e.thsi.cn/img/8b5e65964c800bdc"")
数据来源：国家广播电视总局、中商产业研究院整理
从收入构成来看，2019年，财政补助收入801.97亿元，同比增长3.48%，占行业总收入的9.89%。广播电视和网络视听业务占比83.47%。其他收入538.58亿元，同比增长0.19%，占比6.64%。
(image_address=""http://e.thsi.cn/img/1b9332e9fb8b60af"")
数据来源：国家广播电视总局、中商产业研究院整理
在三大业务收入中，广播电视和网络视听业务占据八成市场。2019实际创收收入6766.90亿元，同比增长19.99%。
(image_address=""http://e.thsi.cn/img/e6a2ac58a08c6744"")
数据来源：国家广播电视总局、中商产业研究院整理
关注同花顺财经（ths518），获取更多机会
(function(){var obj = null;if(document.getElementById('arctTailMark')) {obj = document.getElementById('arctTailMark');}if(obj!=null){var str = '(image_address=""http://i.thsi.cn/images/article/logo.jpg"")  返回首页';var showed = 0;try{var oo = obj.previousSibling;while(oo.nodeType!=1 || oo.innerHTML.replace(/\s|\u3000/g,'').length==0){oo = oo.previousSibling;}if(oo.nodeType==1 && oo.tagName.toLowerCase()=='p') {var span = document.createElement('span');span.innerHTML =str;oo.appendChild(span);showed = 1;}}catch (e){}if(showed == 0){obj.innerHTML =str;}}})();
责任编辑：cyf",2020-07-08 15:53:15,同花顺
3,青岛市海洋生物产业联盟组建,"本报青岛讯 7月1日，青岛市海洋发展局组织举办青岛市海洋药物和生物制品企业、百洋医药集团双向对接会，明月海藻、聚大洋、英豪集团、海大生物、博智汇力等10家企业分别与百洋医药集团达成合作意向，并组建“青岛市海洋生物产业联盟”，构筑海洋生物产业发展生态圈。
青岛市作为国家海洋生物产业基地和全国海洋科技创新基地，形成了崂山海洋生物特色产业园、胶南经济开发区海洋生物产业园和青岛高新区蓝色生物医药科技园等3个以海洋生物为主导产业的特色园区。青岛市海洋生物产业联盟将致力于优化市场资源要素配置，畅通资源交互共享，打通企业市场端“最后一公里”。青岛市海洋发展局也将依托新组建的联盟平台，大力支持海洋药物和生物制品企业与百洋医药集团深度对接，探索合作路径，开展合作交流，形成优势互补、相互借力、抱团发展、协同推进的良好局面，推动全市海洋药物和生物制品产业发展壮大。
关注同花顺财经（ths518），获取更多机会
(function(){var obj = null;if(document.getElementById('arctTailMark')) {obj = document.getElementById('arctTailMark');}if(obj!=null){var str = '(image_address=""http://i.thsi.cn/images/article/logo.jpg"")  返回首页';var showed = 0;try{var oo = obj.previousSibling;while(oo.nodeType!=1 || oo.innerHTML.replace(/\s|\u3000/g,'').length==0){oo = oo.previousSibling;}if(oo.nodeType==1 && oo.tagName.toLowerCase()=='p') {var span = document.createElement('span');span.innerHTML =str;oo.appendChild(span);showed = 1;}}catch (e){}if(showed == 0){obj.innerHTML =str;}}})();
责任编辑：xr",2020-07-08 15:48:40,同花顺
4,“服务供应链云平台”将成智能硬件产业加速发展的新基建,"疫情影响和冲击之下，坏消息纷至沓来，经济下滑，订单取消，岗位减少……但凡事都有两面，钉钉、腾讯会议、zoom等数字化协同平台，迎来了爆发式增长，智能硬件产业也获得巨大发展机遇，但疫情影响下的人员流动减缓，也限制了智能硬件企业快速扩张的步伐。如果不走“自建扩张体系和下沉渠道”的传统扩展之路，智能硬件企业，尤其是最富于活力和创造力的中小型智能硬件企业，在“疫情时代”的不确定性影响下，有没有可能走出一条不同以往的全新发展之路，实现突围增长呢？
随着2019年5G牌照提前颁发，智能硬件市场就被各方广泛看好。《2020中国智能硬件行业发展全景研究报告》就显示，我国的智能硬件行业市场前景广阔，即将踏入万亿市场。更大的发展机遇，也意味着更为激烈的竞争。智能硬件领域有很多创新能力很强的中小型企业，但受制于体量小、资本少，而自建销售服务网络的周期长、成本高、管理难，往往在与大品牌厂商竞争中，因销售渠道和服务网络的不足错失良机。
互联网和移动互联网加速降低信息流动成本，新兴产业在与传统产业的竞争中，充分运用网络赋能，终于取得对传统产业的竞争优势。当前，整个社会正在深度数字化，制造业的服务供应链也出现了云化和数字化的趋向，是否会在硬件领域上演小吃大、快吃慢的好戏呢？
雅座是一家餐饮行业营销云服务商, 主要为餐饮企业提供中台会员管理软件、智慧收银机、智慧点单机、智能扫码枪和供应链管理解决方案。雅座2017年推出的“小雅系列”智能收银机还入选了“中国十大智能收银机”，但苦于没有全国代理商渠道，无法为分散在各地的餐饮商户做快速响应的安装和运维服务，业务增长不理想。而青桔智能作为起步不久的智能门锁行业厂商，同样受制于售后服务的高成本、低效率、低透明度等问题，产品销量和品牌建设都受到了严重制约。
雅座和青桔智能等智能硬件企业的苦恼其实是个共性问题。很多智能硬件企业专长于产品研发，但在销售和服务体系方面缺人缺钱缺经验，不自建销售和售后渠道，企业做不大随时可能被“大鳄”吃掉，但自建这套体系却可能因为成本高效率低被“拖累死”。
IDC发布的《2020年中国中小企业数字初始化指数》报告中指出，未来数字经济会不断优化企业资源，中小企业依靠数字化可以降低各类运营风险，化解商业系统中的不确定性，让复杂的商业元素走向系统化，从而具备较强的生命力。
3月18日，工业和信息化部发布《中小企业数字化赋能专项行动方案》，提出“引导数字化服务商面向中小企业推出云制造平台和云服务平台，支持中小企业设备上云和业务系统向云端迁移，帮助中小企业从云上获取资源和应用服务，满足中小企业研发设计、生产制造、经营管理、市场营销等业务系统云化需求。”4月7日，国家发展改革委、中央网信办联合印发《关于推进“上云用数赋智”行动培育新经济发展实施方案》，提出“以数字化平台为依托，构建‘生产服务+商业模式+金融服务’数字化生态，形成数字经济新实体，充分发掘新内需。”
5月13日，国家发展改革委联合有关部门、国家数字经济创新发展试验区、媒体单位，以及互联网平台、行业龙头企业、金融机构、科研院所、行业协会等145家单位，共同启动“数字化转型伙伴行动（2020）”。旨在通过多方合力，加强数字化转型共性解决方案研发，推出普惠性的数字化转型产品和服务，探索通过共享模式开放自身资源，联合打造一体化转型服务能力，支持中小微企业降低数字化转型成本、缩短转型周期、提高转型成功率。
大鱼云服是一家提供数字化云服务平台企业，构建的全国服务网已覆盖360多个城市和2100多个区县级下沉市场，可以支持厂商从“售前推荐”到“售中安装”再到“售后维修”的全流程交付需求。各类厂商都可以通过大鱼云服提供的全套云端应用系统，快速建立起自己的一站式在线服务流程和全国服务网。客户扫描二维码就可以享受方便快捷的本地上门服务，厂商不必再担心因无法提供安装维修服务而被投诉退货，影响品牌形象。相比传统厂商动辄要投入数年时间和数亿元投资自建全国服务网，使用大鱼云服的解决方案几乎是零成本、零周期。
大鱼云服有一套“智能派单调度算法”，可以在综合服务类型、产品种类、师傅技能、地理位置、交通成本等十多个变量因素的基础上实现精准调度，达到每天无误处理10多万份订单的支撑能力。在大鱼云服的支持下，已有数十家厂商享受到售后云服务带来的便利，按单付费的灵活用工模式，让厂商综合服务成本降低60%以上。
雅座与大鱼合作后，快速建立起覆盖全国的服务网，满足了高速增长的产品销量对售后服务的庞大需求。青桔则借助大鱼的线上服务平台及线下资源整合,实现成本可控、全流程服务可视，明显提升了用户体验。
小熊U租是一家从深圳起家的办公设备租赁公司，在全国有9个分公司。业务进入高速发展期后，其“安装-维修-回收”服务需求量骤增，公司面临巨大的服务压力。通过大鱼云服，其服务网立刻扩展到全国100多个城市，大幅提升了服务能力和运营管理效率，建立起在办公设备租赁行业中的竞争优势。
北京欧科乐办公设备维修公司在发展初期，曾因承受不起高额房租从中关村退租，搬到亚运村做社区服务。为了获得客户，每年在信息网站发布广告费用超过10万元，但每月的服务量仅500单，公司经营十分艰难。但如果自建管理信息系统，要花费数百万元，超出了企业的承受能力，面临生存难题的欧科乐在使用大鱼云服平台的接单服务后，业务量迅速增长到每月2000单以上，如今已发展出9个业务分部。
大鱼云服创始人兼CEO袁巍认为，万物互联时代里，实物形态的商品会更便宜，比如共享汽车。未来的售后服务，越是用到人工的地方会越来越贵。越发达的地方，人力成本越高，服务越昂贵。智能硬件行业厂商三个月才能培养一个初级工程师，一年培养一个中级工程师，三年培养一个高级工程师，五年以上培养一个专家级工程师。培养成本高而且人员流失可能性很大，分散在各地的业务更难管理。
艾媒咨询数据显示，2020年中国智能硬件市场规模预计达到10767亿元，智能硬件作为高科技产品，在消费升级趋势下，市场需求扩大。加上技术落地加快，智能硬件应用场景更趋多样化，市场稳步扩大。而疫情之后，新基建、5G的提速，更成为智能硬件产业加速发展的新风口。服务供应链云平台，则将成为智能硬件产业的“新基础设施”，服务供应链云平台能让中小型企业和创新型企业更专注于产品本身，更有利于智能硬件产业的整体发展。
在袁巍看来，智能硬件设备的市场增长对服务的需求，以及厂商对服务业务灵活用工的需求，将成为推动服务供应链平台发展的两大驱动因素。而通过互联网形成的服务供应链云平台，可以提升厂商的服务水平和运营效率，实现各类品牌厂商、全国服务网点和维修师傅资源的整合调度。预计未来3-5年内服务供应链平台年复合增长率超过50%，并在5年后形成类似物流行业的市场格局。
关注同花顺财经（ths518），获取更多机会
(function(){var obj = null;if(document.getElementById('arctTailMark')) {obj = document.getElementById('arctTailMark');}if(obj!=null){var str = '(image_address=""http://i.thsi.cn/images/article/logo.jpg"")  返回首页';var showed = 0;try{var oo = obj.previousSibling;while(oo.nodeType!=1 || oo.innerHTML.replace(/\s|\u3000/g,'').length==0){oo = oo.previousSibling;}if(oo.nodeType==1 && oo.tagName.toLowerCase()=='p') {var span = document.createElement('span');span.innerHTML =str;oo.appendChild(span);showed = 1;}}catch (e){}if(showed == 0){obj.innerHTML =str;}}})();
责任编辑：hmg",2020-07-08 15:48:18,同花顺
