,title,content,pub_time,src
12,不设年度经济增速目标 “六保”成宏观政策最大着力点,"证券时报两会报道组
昨日，十三届全国人大三次会议开幕，国务院总理李克强作政府工作报告。报告约9500字，为改革开放40年来最短，但亮点多多。围绕年度经济增速、创业板试点注册制改革、财政政策和货币政策等问题，证券时报记者采访了多位市场机构人士和专家学者。
不设年度经济增速目标
今年首次没有提出具体的全年经济增速目标，政府工作报告对此进行了说明。报告表示，主要因为全球疫情和经贸形势不确定性很大，我国发展面临一些难以预料的影响因素。这样做，有利于引导各方面集中精力抓好“六稳”、“六保”。
这一安排得到了普遍认同。中国人民大学副校长刘元春对证券时报记者表示，在疫情防控形势仍面临高度不确定的背景下，更加强调底线管理、更加强调“以保促稳”的工作定位，使得我们要以完成“六保”任务为目标代替GDP增速目标。
刘元春也强调，不设定GDP增长目标不等于没有目标，不等于不实现全面建成小康社会的目标，也不等于对经济增长没有要求。实际上，今年要完成“六保”任务，特别是要完成稳就业的任务，必须要有相应的经济增速。
报告中也提出，今年要优先稳就业保民生，坚决打赢脱贫攻坚战，努力实现全面建成小康社会目标任务。实现城镇新增就业900万人以上，城镇调查失业率6%左右。“根据我们的测算，要实现稳就业目标，GDP增长速度应该在4%左右。”刘元春说。
从衡量全面建成小康社会目标来看，刘元春表示，这包含了一系列指标，此前，“两个翻番”的目标被广泛关注，但考虑到经济结构、国民经济核算体系的统计口径已经发生了很大变化，不宜对其过度关注。“六保”是今年“六稳”工作的着力点，这一宏观政策目标和广大居民、经济主体的最终感受具有一致性。
中泰证券（600918）首席经济学家李迅雷也对记者表示，从其他经济目标来看，报告未提及宏观杠杆率，但提到了坚决守住不发生系统性风险底线。在保民生方面，居民消费价格目标设定在3.5%左右，居民收入增长将与经济增长保持同步。
盘古智库高级研究员王静文对证券时报记者表示，“保市场主体”是六保的重要内容。金融措施中值得关注的包括：大型商业银行普惠型小微企业贷款增速要高于40%，鼓励银行合理让利，推动中小银行补充资本和完善治理等。
资本市场改革目标明确
政府工作报告中，关于资本市场的表述具化到改革本身，提及了“改革创业板并试点注册制”，这将是贯彻全年资本市场改革的重点工作。
这并非是注册制首次进入政府工作报告，2019年政府工作报告就作出安排部署。如今，“改革创业板并试点注册制”被列入政府工作报告，在科创板试点增量注册制改革的经验积累上，创业板试点存量市场的注册制改革，这是全市场分阶段实现注册制改革目标的重要一步。李迅雷表示，注册制试点很快从科创板推进到了创业板，意义非常重大，这有利于改善整个融资体系，助力资本市场跟国际市场进一步接轨，在资本市场改革和走向开放的背景下，A股市场将更有活力，实现健康稳定发展。
目前，创业板改革的总体实施方案已公布，除了推行注册制之外，改革内容还包括强化投资者保护、放宽涨跌幅限制等。
新时代证券副总裁、首席经济学家潘向东指出，创业板试点注册制是2020年资本市场的头等大事，这项工作写入政府工作报告，表明改革势在必行。
具体而言，第一，在疫情冲击下，实施创新驱动发展战略、建设数字经济体系、发展创新驱动力，将会激发资本市场活力，更好服务科技创新；第二，创业板改革主要针对的是中小企业，有助于化解中小企业直接融资的难题，激发民间资本的投资热情，吸引更多民间资本进入创新领域；第三，创业板市场是我国多层次资本市场的重要组成部分，其改革将为资本市场注入长期发展活力；第四，加快创业板改革，有助于加快形成中国资本市场全面深化改革开放的新格局，加快构建与国际接轨的开放型经济和资本市场制度。
就创业板试点注册制改革的建议，李迅雷指出，注册制改革推进过程中，要严格实施退市制度，注册制放宽了市场入口，同等的需要把跟不上市场发展节奏的企业淘汰出去，这对于提高公司治理水平、保护投资者权益都是有利的。同时，要在严格信息披露的制度下，加大对弄虚作假者的惩处力度，实施更加严格的事中事后监管和更加严厉的违法违规惩戒，解决好资本市场违法违规成本过低问题，让市场参与各方自觉的回到维护市场秩序的轨道上来。
财政政策被寄予厚望
在今年政府工作报告中，对于财政政策着墨较多，积极有为的财政政策被寄予厚望。报告明确，将赤字率提高到3.6%以上；发行1万亿元抗疫特别国债；拟安排地方政府专项债券3.75万亿元。
相比去年，财政赤字规模增加1万亿元。同时，中央财政还将发行1万亿元的抗疫特别国债。中信证券研究所副所长明明认为，受今年疫情冲击的影响，财政收入下降的幅度较为明显，而财政支出需求是比较刚性的，因此赤字率抬升将有益于弥补欠缺资金。今年赤字率如期突破过往上限，相较去年有较大突破。
中国社会科学院世界经济与政治研究所研究员张明指出，对于赤字率的安排，3.6%应该是底线，还将随着经济形势变化有向上的弹性。
对于特别国债的安排，明明指出，此次发行特别国债也具有支持特定项目的特殊意义，在降低融资成本的同时，对于基建投资、促进消费、支持银行补充资本金、加大对中小微民营企业都有积极作用。1万亿规模符合市场预期，未来将关注释放途径和对增量资金的撬动作用。
刘元春表示，特别国债通过特别转移支付机制直接下达到县市一级，主要用于保就业、保基本民生、保市场主体，包括支持减税降费、减租降息、扩大消费和投资等的安排，指向很明确，很精准。“这跟我们以往的财政结构和支出方式相比有重大调整，应该重点关注。”他说。
报告还提出，今年拟安排地方政府专项债券3.75万亿元，比去年增加1.6万亿元。对此，明明认为，专项债将重点支持既促消费惠民生又调结构增后劲的“两新一重”建设。增量专项债规模将有效缓解地方财力缺口问题，对基建增速、民生领域和经济的拉动效果产生积极影响。
直达实体经济新工具
引猜测
今年的政府工作报告对货币政策和金融支持小微企业融资有诸多新提法，为下一步更多货币信贷政策的出台指明了方向。
在货币政策方面，报告指出，稳健的货币政策要更加灵活适度，综合运用降准降息、再贷款等手段，引导广义货币供应量和社会融资规模增速明显高于去年。保持人民币汇率在合理均衡水平上基本稳定，创新直达实体经济的货币政策工具，务必推动企业便利获得贷款，推动利率持续下行。
“创新直达实体经济的货币政策工具”是全新内容，究竟何为直达实体经济的货币政策工具，目前市场有诸多猜测。明明认为，央行可能会创新再贷款或类似CBS的票据互换支持企业部门发债等或通过数字货币形式支持居民部门，与财政政策合力实现稳就业、保住市场主体的目标。
民生银行首席宏观研究员温彬则建议，央行可以采取扩大抵押品范围、适度提高抵押率等方式，创新货币政策工具，向金融机构提供流动性支持，引导资金流向重点领域和薄弱环节，实现“宽货币”向“宽信用”转化。
结合报告对M2增速和社融规模增速，以及企业贷款的目标表述看，分析人士普遍认为，今年后续央行还有望继续加大宽货币、宽信用力度，降准降息依然有较多空间。
“虽然政府工作报告对货币政策的定位仍然是稳健，但从具体的要求来看，今年的货币环境会比以往更加宽松，且宽信用将是重点。”粤开证券首席经济学家李奇霖对记者表示，一方面，政府工作报告少有地直接提出要充分利用好“降准降息”手段，推动利率持续下行；另一方面，今年报告不再提“把好货币供给总闸门”，对M2增速和社融规模增速也提出更高要求，这意味着今年必然是一个宽信用的大年。
今年货币政策宽松的落脚点依然是加大对中小企业的信贷支持力度。报告明确，中小微企业贷款延期还本付息政策再延长至明年3月底，对普惠型小微企业贷款应延尽延，对其他困难企业贷款协商延期。鼓励银行大幅增加小微企业信用贷、首贷、无还本续贷。大型商业银行普惠型小微企业贷款增速要高于40%。支持企业扩大债券融资。
同花顺上线「疫情地图」
点击查看：新型肺炎疫情实时动态地图>>>
关注同花顺财经（ths518），获取更多机会
(function(){var obj = null;if(document.getElementById('arctTailMark')) {obj = document.getElementById('arctTailMark');}if(obj!=null){var str = '(image_address=""http://i.thsi.cn/images/article/logo.jpg"")  返回首页';var showed = 0;try{var oo = obj.previousSibling;while(oo.nodeType!=1 || oo.innerHTML.replace(/\s|\u3000/g,'').length==0){oo = oo.previousSibling;}if(oo.nodeType==1 && oo.tagName.toLowerCase()=='p') {var span = document.createElement('span');span.innerHTML =str;oo.appendChild(span);showed = 1;}}catch (e){}if(showed == 0){obj.innerHTML =str;}}})();
责任编辑：lsz",2020-05-23 09:12:53,同花顺
13,A股存量博弈不改 紧抓“稳就业”投资机会,"证券时报记者 付建利
A股市场期待的两会行情没有兑现，本周A股周跌幅1.91%，是最近两个月以来的最大周跌幅，市场没有持续性较强的热点题材，就连此前涨不休的内需消费品，本周也出现了高位回落的态势，而科技股走势更加萎靡，短期A股市场仍将以存量博弈为主，震荡或将持续一段时间，而“稳就业”将成为经济工作的主要目标，后市的投资机会，也将围绕着“稳就业”展开。
低估值策略失效
的真实原因
今年以来A股市场有一个比较奇怪的现象，就是银行、保险、券商、钢铁、煤炭等低估值甚至创下历史估值谷底的品种，股价表现一直萎靡不振，反而是估值高企的内需消费和医药股却涨不停，比如贵州茅台（600519）、五粮液（000858）、海天味业（603288）、千禾味业（603027）、青岛啤酒（600600）、珀莱雅（603605）、恒瑞医药（600276）、迈瑞医疗（300760）等，这些股票的估值动辄高达50倍以上，有的甚至在80倍以上，但市场似乎无惧高估值，高山之上有高山，一山更比一山高，这是为什么呢？
其实原因并不复杂，受新冠肺炎疫情影响，全球经济增速大幅下滑，中国经济一季度增速大幅下滑，不少行业和企业都在“猫冬”，比如出口和外贸，再加上中美贸易摩擦加剧，美国举全国之力打压华为，以半导体为代表的科技类企业业绩预期变差，股价近期也表现不振，手机产业链也受到波及，市场原本期待在国产替代的主题下，芯片股会来一波行情，无奈美国全面封杀华为，市场情绪面受到影响，本周芯片股不仅没有较好表现，反而还套牢了不少投资者。
在经济增速大幅下滑的当下，无论是周期股，还是科技股，业绩增长都充满不确定性，周期股本身面临周期向下，科技股又时不时受到中美贸易摩擦的负面冲击，那么，哪个行业是确定性较强的呢？选来选去，最好的就是内需消费，比如酱油、榨菜、白酒、医药这些。在不确定性的市场大环境下，如果一个行业确定性明显胜出，那么，这个行业享受估值溢价就是很自然的事情了。
与此同时，基金等机构投资者对内需消费品高度一致性看好，最终会形成主流机构投资者持仓高度趋同化的市场特征，这又会进一步加剧内需消费品的估值溢价，使得业绩增长确定性较强的内需消费品享受了一场狂欢的估值溢价盛宴。与之相伴随的是，低估值的银行、保险等周期性股票，即便估值跌到历史谷底，也很难有行情。市场上一部分投资者的“低估值策略”在今年以来的行情中彻底失效。
围绕“稳就业”
挖掘投资机会
本周五，两会上最受关注的政府工作报告对当下的经济工作进行了定调，作出了战略部署，仔细阅读这份干货满满的政府工作报告，可以找出很多投资线索。
在经济下滑以及中美贸易摩擦不断的当下，中国经济的发展要实现“六稳”、“六保”，核心是要稳就业、保民生。如果就业不稳，民生就没法得到保障，经济也会加速下滑。
那么，政府会如何“稳就业”呢？首先，为了为保持甚至创造更多的就业岗位，政府必须加大基建，包括老基建和新基建，老基建带来的投资机会集中在水泥、建筑建材等行业，新基金主要是5G、物联网、数据中心；其次是消费，尽管消费股整体估值不便宜了，但并不意味着后市没有机会，消费股的估值不可能涨到天上去，但调整就是机会，尤其是半年报披露时，消费股仍将是业绩领先的品种；第三，科技股，美国全面打压华为，只会倒逼中国加快核心技术领域的国产替代和自主可控，国产替代将成为A股未来很长一段时间的投资主题，比如半导体、芯片、网络安全、软件服务等，科技企业创造了大量就业机会和创业机会，是“稳就业”的主要抓手；第四，新能源汽车。传统燃油汽车的空间会逐渐缩小，新能源汽车带动大量产业，可以吸纳大量高素质就业人员，而且符合未来经济发展趋势，在后补贴时代，大力扶持和刺激新能源汽车发展，可以带动整个产业链上下游的发展，创造无数个就业机会，新能源汽车是房地产之后最重要的经济发展支柱，在坚守“房住不炒”的底线下，新能源汽车最有希望带领经济恢复性增长。
同花顺上线「疫情地图」
点击查看：新型肺炎疫情实时动态地图>>>
关注同花顺财经（ths518），获取更多机会
(function(){var obj = null;if(document.getElementById('arctTailMark')) {obj = document.getElementById('arctTailMark');}if(obj!=null){var str = '(image_address=""http://i.thsi.cn/images/article/logo.jpg"")  返回首页';var showed = 0;try{var oo = obj.previousSibling;while(oo.nodeType!=1 || oo.innerHTML.replace(/\s|\u3000/g,'').length==0){oo = oo.previousSibling;}if(oo.nodeType==1 && oo.tagName.toLowerCase()=='p') {var span = document.createElement('span');span.innerHTML =str;oo.appendChild(span);showed = 1;}}catch (e){}if(showed == 0){obj.innerHTML =str;}}})();
责任编辑：lsz",2020-05-23 09:10:41,同花顺
14,舟山中远海运重工完成“帕拉克”轮修理改装任务,"5月19日，“帕拉克”轮在舟山中远海运重工圆满完成所有修理改装任务，顺利开航。
“帕拉克”轮是地中海航运旗下4系列集装箱船，该轮长299米，宽48米，此次进厂修理改装任务涉及混合式脱硫装置改装、全船舱盖改装等，工程量多且杂，改装难度高。
“帕拉克”轮未进厂前，总管小组组织召开专题研讨会，提前熟悉工程清单，借鉴系列船舶改装经验，策划施工方案，严格把控施工安全质量，确保了全船玻璃钢管管路系统试压报验均一次性通过，受到船东船检一致认可。
在修理改装期间，总管小组反复研究主线工程施工计划，科学合理安排脱硫分段吊运以及舱盖吊运安装等作业，两条主线分别安排又统筹协调，见缝插针，利用好门机吊运时间，确保了两大主线工程按计划逐步推进。
在舱盖改装这一主线上，为确保改装质量一次验收通过，总管小组群策群力，自制测量工装，保证切割眼环留根高度符合要求，并积极协调施工人员配合舱盖的服务工程师，两天时间完成全部舱盖数据测量作业。此次“帕拉克”轮的圆满完工，赢得了船东、船检以及服务商的高度认可。
同花顺上线「疫情地图」
点击查看：新型肺炎疫情实时动态地图>>>
关注同花顺财经（ths518），获取更多机会
(function(){var obj = null;if(document.getElementById('arctTailMark')) {obj = document.getElementById('arctTailMark');}if(obj!=null){var str = '(image_address=""http://i.thsi.cn/images/article/logo.jpg"")  返回首页';var showed = 0;try{var oo = obj.previousSibling;while(oo.nodeType!=1 || oo.innerHTML.replace(/\s|\u3000/g,'').length==0){oo = oo.previousSibling;}if(oo.nodeType==1 && oo.tagName.toLowerCase()=='p') {var span = document.createElement('span');span.innerHTML =str;oo.appendChild(span);showed = 1;}}catch (e){}if(showed == 0){obj.innerHTML =str;}}})();",2020-05-23 09:08:28,同花顺
15,全国人大代表杨玉经：加强数据共享促推办事零跑腿,"(image_address=""//comment.10jqka.com.cn/sourcepic/12/0MK7qs34.png"")银川5月23日电(记者靳赫)近些年，宁夏银川市持续推行“放管服”改革，取得了显著成效，但在全面推进“一网通办”、探索开展“智能审批”，争取让群众办事“零跑腿”的工作中，也遇到了业务系统整合难、减材料减环节数据支撑不足等问题。全国人大代表、宁夏银川市市长杨玉经认为，究其根源，主要是因为系统整合不到位、数据共享不到位，在今年提交全国两会的建议中，他提出应自上而下做好顶层设计，让数据多跑路，让群众办事少跑腿甚至零跑腿。
据悉，目前不少行业、部门办事系统依旧相互独立，办事时申报的基础信息和办理结果、证照数据依旧不能共享，整体构架和流程设计仍停留于“部门串联式”审批模式下，申报信息不能复用、环节不能有效衔接，自然人法人基础信息、户籍婚姻信息、职称与职业资格证书信息等高频应用数据，部分处于分散的“碎片化”保存状态，部分又集中于国家平台统管，不能在全国范围实现信息资源的充分共享。在办理一些证照时，有些部门的标准和要求互为前置，使群众为难，一些“奇葩证明”也应运而生，给群众办事创业带来诸多不便。
杨玉经认为，为适应新的形势和要求，推进政务服务“一网、一门、一次”改革，亟需加强信息化顶层设计，整合优化政府服务信息系统，构建统一高效、互联互通、安全可靠的数据资源体系，加强政府信息资源跨部门、跨层级互通和协同共享，实现“网络通、数据通、业务通”，打通群众办事零跑腿“最后一公里”。
为此，杨玉经建议国家层面强化顶层设计和协调力度，深化“互联网+政务服务”，全面推进各业务系统向全国一体化在线政务服务平台整合，在系统全面融合、数据全面共享的基础上，积极探索新技术在政务服务领域的创新应用，通过数字政务带来的高效便捷，不断增强办事群众的获得感、幸福感、体验感。(完)阿
同花顺上线「疫情地图」
点击查看：新型肺炎疫情实时动态地图>>>
关注同花顺财经（ths518），获取更多机会
(function(){var obj = null;if(document.getElementById('arctTailMark')) {obj = document.getElementById('arctTailMark');}if(obj!=null){var str = '(image_address=""http://i.thsi.cn/images/article/logo.jpg"")  返回首页';var showed = 0;try{var oo = obj.previousSibling;while(oo.nodeType!=1 || oo.innerHTML.replace(/\s|\u3000/g,'').length==0){oo = oo.previousSibling;}if(oo.nodeType==1 && oo.tagName.toLowerCase()=='p') {var span = document.createElement('span');span.innerHTML =str;oo.appendChild(span);showed = 1;}}catch (e){}if(showed == 0){obj.innerHTML =str;}}})();",2020-05-23 09:07:04,同花顺
16,证监会完善 证券公司分类监管,"□本报记者昝秀丽
证监会5月22日消息，为优化证券公司分类监管制度，促进证券公司增强风险管理能力，引导证券行业差异化发展，证监会对《证券公司分类监管规定》相关条款进行修改，现向社会公开征求意见。本次修改的主要内容包括对相关评价指标进行优化，进一步强化合规、审慎经营导向，强化专业服务能力导向。
分析人士指出，此次征求意见稿优化了市场竞争力评价指标等，同时完善持续合规状况的扣分标准及调降级别依据，有利于完善中介机构分类监管，打造良好行业生态。
优化评价指标
分类监管制度是证券行业一项基础性监管制度。2009年5月，中国证监会出台《证券公司分类监管规定》，确立了分类评价指标体系，并于2010年5月、2017年7月两次进行修改。近年来，分类监管制度对促进证券公司加强合规风控、提升核心竞争力发挥了积极的正向激励作用，得到行业和市场认可。本次修改主要包括如下内容：
一是维持现行以风险管理能力、持续合规状况为主的证券公司分类评价体系和有效做法，着重对相关评价指标进行优化，集中解决实践中遇到的突出问题。
二是进一步强化合规、审慎经营导向。围绕使分类评价结果更加准确反映证券公司的合规风控状况，完善对证券公司及其人员被采取处罚处分措施的扣分规则，明确对公司治理与内部控制严重失效等情形予以调降分类级别的依据，全面梳理强化风险管理能力评价指标和标准。优化风险管理能力加分项，引导证券公司强化资本约束，提高全面风险管理的有效性，切实实现风险管理全覆盖。
三是进一步强化专业服务能力导向。适应行业发展状况，从营业收入、证券经纪、投资银行、资产管理、机构客户服务及交易、财富管理、信息技术投入等方面，优化市场竞争力评价指标，既反映证券公司的综合实力，又反映其专项业务能力，引导证券公司突出主业，做优做强，同时也引导证券行业差异化发展。
完善分类监管
分析人士指出，证监会拟修改证券公司分类监管规定是对近期完善分类监管政策的延续。
证监会主席易会满日前在“5·15全国投资者保护宣传日”活动上表示，证监会将进一步完善中介机构分类监管、差异化发展思路，对好机构加大政策扶持力度，支持做优做强做大；对问题机构和相关责任人，强化责任追究，健全黑名单制度，真正体现奖优罚劣。
适应注册制改革要求，证监会会同相关部委正在制定中介机构从事证券服务业务备案管理规定，在取消事前审批的同时，更加突出事中事后监管，推动行业规范健康发展。同时，继续推进建设“合规、诚信、专业、稳健”的行业文化，健全声誉约束机制，打造良好行业生态。
“证监会就修改《证券公司分类监管规定》公开征求意见，是对近期券商监管政策的延续。一是利好行业龙头，排名靠前的券商实力较强，加分可能性更高；二是重合规风控，守住风险底线。总体而言，新规定将进一步鼓励券商行业在守住底线的基础上做大做强。”前券商资深保荐代表人王骥跃称。
同花顺上线「疫情地图」
点击查看：新型肺炎疫情实时动态地图>>>
关注同花顺财经（ths518），获取更多机会
(function(){var obj = null;if(document.getElementById('arctTailMark')) {obj = document.getElementById('arctTailMark');}if(obj!=null){var str = '(image_address=""http://i.thsi.cn/images/article/logo.jpg"")  返回首页';var showed = 0;try{var oo = obj.previousSibling;while(oo.nodeType!=1 || oo.innerHTML.replace(/\s|\u3000/g,'').length==0){oo = oo.previousSibling;}if(oo.nodeType==1 && oo.tagName.toLowerCase()=='p') {var span = document.createElement('span');span.innerHTML =str;oo.appendChild(span);showed = 1;}}catch (e){}if(showed == 0){obj.innerHTML =str;}}})();
责任编辑：lsz",2020-05-23 09:05:09,同花顺
