,title,content,pub_time,src
0,2020年1-5月中国家具及其零件出口金额增长情况分析,"(image_address=""//comment.10jqka.com.cn/sourcepic/12/1tDJzMfpsajNextagAtsaytsay.png"")讯：据中商产业研究院数据库显示，2020年5月中国家具及其零件出口金额下降，2020年5月中国家具及其零件出口金额为4181.2百万美元，同比下降15.5%。
(image_address=""http://e.thsi.cn/img/a336fd1ac70eaa0d"")
数据来源：中商产业研究院数据库
2020年1-5月中国家具及其零件出口金额增长情况
(image_address=""http://e.thsi.cn/img/145bf99a4dfeb79"")
数据来源：中商产业研究院数据库
上述数据来源及分析请参考中商产业研究院发布的《2020-2025年中国家具及其零件行业市场前景及投资机会研究报告》,同时中商产业研究院还提供产业大数据、产业规划策划、产业园策划规划、产业招商引资等解决方案。
同花顺上线「疫情地图」
点击查看：新型肺炎疫情实时动态地图>>>
关注同花顺财经（ths518），获取更多机会
(function(){var obj = null;if(document.getElementById('arctTailMark')) {obj = document.getElementById('arctTailMark');}if(obj!=null){var str = '(image_address=""http://i.thsi.cn/images/article/logo.jpg"")  返回首页';var showed = 0;try{var oo = obj.previousSibling;while(oo.nodeType!=1 || oo.innerHTML.replace(/\s|\u3000/g,'').length==0){oo = oo.previousSibling;}if(oo.nodeType==1 && oo.tagName.toLowerCase()=='p') {var span = document.createElement('span');span.innerHTML =str;oo.appendChild(span);showed = 1;}}catch (e){}if(showed == 0){obj.innerHTML =str;}}})();
责任编辑：lg",2020-06-09 04:54:47,同花顺
1,湖北当阳：两亿收入来自“苕”产业,"原标题：湖北当阳：两亿收入来自“苕”产业
在湖北宜昌，人们口中的“苕”，就是红薯(甘薯)。在上世纪60年代初缺粮的岁月，“苕”是无数人脑海中难忘的记忆。近年来，宜昌市农技中心和当阳市引导农民着眼市场需求，规模种植红薯，把“苕”这个昔日人们眼中上不得桌面的土产品盘成了新兴产业，并辐射到周边市州乃至省外。
6月6日，记者慕名来到当阳市玉阳办事处，探访这里的“苕”产业。在种植大户金祖国的田间，记者见到了正在查看薯苗长势的宜昌市农技中心推广研究员郑守贵。
“我们发明的红薯‘两段法’育苗技术成果2017年获湖北省技术发明奖，对长江流域红薯产业的发展具有重要意义”，郑守贵告诉记者，针对近几年当阳红薯产业迅猛发展的实际，中心自2014年开始，安排他常驻当地，传授“两段法”育苗技术，助推产业做大做强。
郑守贵介绍，宜昌市海拔800米以下地区均可种植红薯。红薯“两段法”育苗元月份在大棚内下种，三四月份把大棚苗采后扦插到大田，开始第二阶段种苗繁殖。采用这种方法，用种量仅为传统种植方法的5%，亩平节约开支150元。
骄阳似火，刚移栽不久的红薯苗却长势茂盛。“‘苕’只要水、肥够了，产量就不愁”，金祖国笑着对记者说，笑容中充满了对丰收的憧憬。
十年前，干了几年红薯经纪人的金祖国承包了几十亩地，开始种红薯。“投入少、用工不多，种植简单，一亩地纯收入在1000元以上，比种水稻强”，尝到了甜头的金祖国一发不可收，2014年牵头成立当阳金小艳薯业种植专业合作社，注册了“苕娃子”红薯商标，采取线上+线下的方式卖薯。如今，合作社拥有社员108户，辐射湖南澧县和省内荆门、恩施等地共2000多种植户。
“今年，我自己种了100亩红薯，还与当阳富乐柑橘合作社联营种了270亩”，金祖国透露，本月中旬，“苕娃子”红薯专业合作社联合社将挂牌成立，带动越来越多的乡亲抱团种红薯。
与金祖国仅隔着一个山岭的徐云，不光自己种红薯，还繁育种苗卖。有着10多年“薯龄”的徐云，最高峰曾种了300亩，还投资数百万元建起了容积5400立方米的储薯地窖，是远近闻名的“薯王”。
今年，徐云发展8亩塑料大棚繁育薯苗。“主要销给了附近的农户，毛收入一亩大棚3万元，纯收入1.5万元”，徐云说，原先农户的苗子大多要到外地去买，1根种苗近2角钱，我运用学到的“两段法”繁育薯苗，一根种苗一角钱向乡亲们供应，降低了他们的种植成本。
采访中，记者品尝到了金祖国现榨的一杯红薯汁，甘甜可口，滋味醇厚，回味无穷。在当阳，薯农主要种植的是“三峡红心王薯”、“普薯32”和“徐薯22”等几个品种，金小艳薯业合作社选送的“普薯32”样品曾获得2018年中国甘薯产业博览会三等奖。
“近几年，薯农平均亩产在3000公斤以上，销价在1元每公斤左右，亩纯收入在1200元以上”，在宜昌市农技中心的红薯产业发展报告上，记者看到了这样一组数据。2019年，当阳薯农达7028户，种植红薯7万亩，创产值2.1亿元，红薯已成为当地农民增收致富的一个特色产业。
(责任编辑：DF515)
同花顺上线「疫情地图」
点击查看：新型肺炎疫情实时动态地图>>>
关注同花顺财经（ths518），获取更多机会
(function(){var obj = null;if(document.getElementById('arctTailMark')) {obj = document.getElementById('arctTailMark');}if(obj!=null){var str = '(image_address=""http://i.thsi.cn/images/article/logo.jpg"")  返回首页';var showed = 0;try{var oo = obj.previousSibling;while(oo.nodeType!=1 || oo.innerHTML.replace(/\s|\u3000/g,'').length==0){oo = oo.previousSibling;}if(oo.nodeType==1 && oo.tagName.toLowerCase()=='p') {var span = document.createElement('span');span.innerHTML =str;oo.appendChild(span);showed = 1;}}catch (e){}if(showed == 0){obj.innerHTML =str;}}})();
责任编辑：lg",2020-06-09 04:54:33,同花顺
2,海南自贸港怎么建：离岛免税额提至10万 不允许搞黄赌毒,"原标题：一文读懂海南自贸港怎么建：离岛免税额提至10万，不允许搞黄赌毒
6月8日，国务院新闻办公室举行新闻发布会，国家发展改革委副主任林念修，财政部副部长邹加怡，商务部副部长兼国际贸易谈判副代表王受文，中国人民银行副行长、国家外汇管理局局长潘功胜，海关总署副署长李国和中共海南省委书记、海南省人大常委会主任刘赐贵，中共海南省委副书记、海南省人民政府省长沈晓明在会上介绍《海南自由贸易港建设总体方案》有关情况。
中共海南省委书记、海南省人大常委会主任刘赐贵表示，自贸港在零关税后全岛封关，最重要的是要防止走私，因此我们这两年实际上已经在进行防止走私，构建近岸、近海、岸线和岛内三道防控圈。
刘赐贵表示，世界上有很多自贸港都是资本主义制度下的自贸港，社会主义制度下的自贸港就是海南。海南自贸港是中国特色社会主义制度的自贸，要坚定不移走中国特色社会主义道路，不允许危害国家安全、不允许在意识形态破坏社会主义制度、不允许通过货物贸易走私、不允许搞黄赌毒、不允许破坏海南良好的生态环境、不允许在海南自贸港建设过程中产生腐败不廉洁的行为，针对这些原则性的问题都会制定或者已经制定了相应的管控措施。
财政部副部长邹加怡指出，零关税是海南自贸港的重要制度设计。在2025年海南全岛封关运作前，率先对部分进口商品实施零关税，免征进口关税、进口环节增值税和消费税。此外，大幅放宽离岛免税购物政策，海南离岛免税购物限额提至10万元每人每年，进一步扩大免税商品种类。
五部委详解《海南自由贸易港建设总体方案》
发改委：海南自贸港货物贸易以“零关税”为基本特征
国家发改委副主任林念修介绍，《总体方案》围绕6个方面的自由便利作出了一系列制度安排。
贸易自由便利方面，对货物贸易，实行以“零关税”为基本特征的自由化便利化制度安排。对服务贸易，实行以“既准入又准营”为基本特征的自由化便利化政策举措。投资自由便利方面，大幅放宽海南自由贸易港市场准入，进一步激发各类市场主体活力。跨境资金流动自由便利方面，坚持金融服务实体经济，重点围绕贸易投资自由化便利化，分阶段开放资本项目，有序推进海南自由贸易港与境外资金自由便利流动。人员进出自由便利方面，针对高端产业人才，实行更加开放的人才和停居留政策，打造人才集聚高地。运输来往自由便利方面，实施高度自由便利开放的运输政策，推动建设西部陆海新通道国际航运枢纽和航空枢纽。数据安全有序流动方面，在确保数据流动安全可控的前提下，扩大数据领域开放，培育发展数字经济。
发改委：2025年前启动全岛封关运作
林念修介绍，《总体方案》的推进实施可以分为打基础和全面推进两个阶段。第一个阶段，从现在起到2025年以前主要是打基础、做准备。这一阶段的目标任务是，突出贸易投资自由化便利化，在有效监管的基础上，有序推进开放进程，推动各类要素便捷高效流动，形成早期收获，适时启动全岛封关运作。第二个阶段，2035年以前，主要是全面推进自由贸易港政策落地见效。
发改委：海南自贸港与香港互补大于竞争
林念修在发布会上说，海南自由贸易港与香港的定位不同，重点发展产业也不同，互补大于竞争，不会给香港造成冲击。
财政部：海南离岛免税购物限额提至10万元每人每年
财政部副部长邹加怡指出，零关税是海南自贸港的重要制度设计。在2025年海南全岛封关运作前，率先对部分进口商品实施零关税，免征进口关税、进口环节增值税和消费税。此外，大幅放宽离岛免税购物政策，海南离岛免税购物限额提至10万元每人每年，进一步扩大免税商品种类。
财政部：大幅放宽海南离岛免税购物政策
邹加怡表示，零关税是海南自由贸易港的一项非常重要的制度设计。大幅放宽离岛免税购物政策，免税购物额度从现在的每人每年3万元提升到每人每年10万元，并且在现行的38类商品的基础上，进一步扩大免税商品的种类，同时优化管理，提高旅客购物的便利程度。
财政部：将制定进口征税商品目录 海南封关运作后目录外商品免征进口关税
邹加怡介绍，等到条件成熟，于2025年实现全岛封关运作之后，会在简并税制的基础上，对进口征税商品目录以外的所有进口商品免征进口关税，这是实现零关税的最终制度安排。国家要制定一个进口征税商品目录，只有在目录上的商品仍然需要征收关税，其他大部分不在目录上的进口商品会实现免征进口关税。
商务部：今年年内将制定中国跨境服务贸易第一张负面清单
商务部副部长兼国际贸易谈判副代表王受文表示，在服务贸易方面，服务贸易有四种形态。其中跨境交付、境外消费和自然人移动叫做跨境服务贸易。对跨境服务贸易的这三种形态，今年年内将制定跨境服务贸易负面清单。跨境服务贸易负面清单对三种模式项下的服务贸易，如果有限制就纳入到这个负面清单，如果没有限制的，负面清单之外开放，这将是海南自由贸易港制度集成创新的一个亮点，它将是中国跨境服务贸易的第一张负面清单。
央行：率先在海南自贸港落实金融服务业扩大开放政策
中国人民银行副行长、国家外汇管理局局长潘功表示，率先在海南自由贸易港落实金融服务业的扩大开放政策，丰富海南的金融业态。培育商业银行等金融机构服务于开放型经济的金融能力，支持国际能源、航运、大宗商品等要素交易平台建设。强化金融支持和改革创新，推动海南重点发展产业的产业聚集规模和产业竞争力的提升，创新发展贸易金融、消费金融、绿色金融、科技金融。
海关总署：不禁止洋浦保税港区内居住居民及设立营业性的商业设施
海关总署副署长李国介绍，考虑到海南自由贸易港涉及商业消费等业态，对洋浦保税港区内设立的营利性商业设施等不做禁止性的规定，这也是一个巨大的突破，因为现在所有的海关特殊监管区域内都是不允许人员居住和设立营利性场所，这是开了一个口子。
海南省委书记、省长答疑自贸港怎么做
海南省委书记：严格控制海南房地产 不能成为房地产的加工厂
中共海南省委书记、海南省人大常委会主任刘赐贵表示，要严格控制房地产，海南的房地产不是外面想要多少就建设多少，不能成为房地产的加工厂。我们土地是有限的，历史上也有过教训，所以在构建现代化产业体系方面，不能是单一的。在发展的同时，也要注重生态环境的保护。
海南省委书记：海南自贸港全岛封关后最重要是防止走私
刘赐贵表示，自贸港在零关税后全岛封关，最重要的是要防止走私，因此我们这两年实际上已经在进行防止走私，构建近岸、近海、岸线和岛内三道防控圈。
海南省委书记：海南2030年将不再销售燃油汽车
刘赐贵说，大气质量方面，海南设定的目标是到2030年PM2.5个位数，为实现这一目标已经采取了一系列措施，比如采用清洁能源，届时全岛将使用清洁能源；2030年将不再销售燃油汽车；从今年底开始，海南将“禁塑”，实现禁止使用不可降解塑料制品。
海南省委书记：海南省面向全球推出4万余就业岗位
刘赐贵介绍，这两年来，已经超过10万人到海南就业创业。最近我们推出了4万多个向全球招聘的岗位，年底之前还会再推出，就有几十万海内外的人才踊跃报名。
海南省委书记：海南自贸港将实现全岛同城化 推出政策促农民留在农村
刘赐贵指出，海南自贸港是全岛自贸港，海南主要的人口还是在农村，主要的面积也是在农村，农村的状况如何决定着海南自贸港是否成功。我们对包括农民在内的居民都很好的进行培训，提升他们的素质，对乡村教师、乡村医生在职称、工资待遇、住房等方面有一套良好的优惠政策，使他们愿意留在农村。因为今后海南自由贸易港是全岛同城化，所以必须提升乡村人才的素质。
海南省委书记：海南自贸港不允许搞黄赌毒
刘赐贵表示，海南自贸港是中国特色社会主义制度的自贸港，所以我们有几个不允许。不允许危害国家安全，不允许在意识形态来破坏社会主义的制度，不允许通过货物的贸易走私，不允许搞黄赌毒，不允许破坏海南良好的生态环境，不允许在海南自贸港建设过程中产生腐败，不廉洁的行为。对这些原则性的问题，我们都会制定或者已经制定相应的管控措施。
海南省省长：海南自贸港实行“非禁即入” ，原则上政府取消审批
中共海南省委副书记、海南省人民政府省长沈晓明指出，海南自贸港实行“非禁即入” ，原则上政府取消审批。
海南省省长：全岛封关以后 除了极少数产品外其他都没有进口关税
沈晓明表示，全岛封关以后，除了极少数产品外，其他都没有进口关税了。但是在全岛封关之前，我们也设定了四类物品，通过清单管理免关税。一是生产资料，二是原辅料，三是交通工具，四是岛内居民的消费品。我大致算了一下，进口游艇税收的成本大概能够降低38%。另外，进口娱乐设备税收大概能省20%。
海南省长：海南个人所得税将免缴高于15%部分
沈晓明表示，人才在海南岛呆满183天，个人所得税将免缴高于15%的部分。
海南自由贸易港有多省钱？海南省长：买1000万元游艇能省380万
沈晓明国新办新闻发布会上说，全岛封关以后，除了极少数产品外，其他都没有进口关税了。本来1000万进口一条游艇，你需要交380万的税，但是你如果在海南买一条1000万的进口游艇，就不需要交380万的税，比其他地方买游艇省了380万。另外，进口娱乐设备税收大概能省20%。
海南省长：支持自贸港内注册的境内企业通过境外发行股票方式融资
海南省长沈晓明表示，将支持自贸港内注册的境内企业通过境外发行股票方式融资。
同花顺上线「疫情地图」
点击查看：新型肺炎疫情实时动态地图>>>
关注同花顺财经（ths518），获取更多机会
(function(){var obj = null;if(document.getElementById('arctTailMark')) {obj = document.getElementById('arctTailMark');}if(obj!=null){var str = '(image_address=""http://i.thsi.cn/images/article/logo.jpg"")  返回首页';var showed = 0;try{var oo = obj.previousSibling;while(oo.nodeType!=1 || oo.innerHTML.replace(/\s|\u3000/g,'').length==0){oo = oo.previousSibling;}if(oo.nodeType==1 && oo.tagName.toLowerCase()=='p') {var span = document.createElement('span');span.innerHTML =str;oo.appendChild(span);showed = 1;}}catch (e){}if(showed == 0){obj.innerHTML =str;}}})();
责任编辑：lg",2020-06-09 04:53:34,同花顺
3,增值税直降75% 二手车市场会被政策“催熟”吗,"2020年初突如其来的疫情，让本就处于“寒冬”的汽车行业日子更加难过了，不仅新车增长陷入冷冻期，二手车行业也受影响颇深。疫情期间，车商歇业、没人收车、无人卖车、车管所放假、办不了手续、过不了户……导致整个二手车行业都处于“待工期”。
价格优势曾是以往二手车市场的杀手锏，但由于新车市场销量下滑严重，终端零售价格也在不断下探，对二手车形成了新的压迫。疫情和价格优势失利的双重压力下，二手车市场表现得更加惨淡。一个拥有亿万级发展前景的市场会就此没落吗？答案是否定的。
近期，随着国内疫情的消散，消费者的日常生活也重回正轨，沉寂已久的二手车市场也逐渐走出“惨淡期”。根据流通协会发布的数据显示，4月全国二手车市场交易量为111.34万辆，环比增长17.23%，交易额为708.76亿元，已接近去年同期水平。这意味着，二手车市场“春暖花开”指日可待。业内普遍认为，受疫情的持续影响，二手车市场虽然仍未达到此前的繁荣景象，但其前景向好。
二手车政策加持释放新车销售空间
为了进一步刺激二手车行业的复苏，4月29日国家发改委等十一部委发布的《关于稳定和扩大汽车消费若干措施的通知》（下称《通知》）中提出,自2020年5月1日至2023年底,对二手车经销企业销售旧车,减按销售额的0.5%征收增值税。
“这几年二手车本来就便宜,按照税务部门要求，以前是按2%缴纳增值税，税务负担较重，现在减按销售额的0.5%征收增值税，降幅达75%，对于我们二手车经销商是个很大的实惠。”北京花乡二手车经销商如是说。
以2019年二手车交易金额9356.86亿元为例，新政推出之前的税收额度约为181亿元，而新政推出后的税收额度约为46亿元。这意味着政府将“拿出”140亿元来为二手车回暖保驾护航。“二手车的这一减税政策,最重要的是能够促使汽车生态链更加健康，加快二手车交易，拉动新车销售。”中国汽车流通协会副秘书长郎学红表示，二手车是汽车生产企业和汽车经销商业链上的重要一环，二手车减税就是推动新车销售的一个新动力。
事实上，数据也证实了，二手市场的回暖进一步拉动了新车销量的增长。中国汽车工业协会发布的产销数据显示，4月，我国汽车销量达207万辆，环比增长43.5%,同比增长4.4%,结束了连续21个月的下降。其预计，5月汽车行业销量预计完成213.6万辆，环比增长3.2%，同比增长11.7%。
对此，在中国汽车流通协会副秘书长罗磊表示：“二手车增值税降至0.5%,对释放汽车销售而言可谓是久旱逢甘霖。”在他看来，活跃二手车市场是促进汽车置换、拉动新车销量的重要途径，新车市场和二手车市场是相辅相成、互相支持的关系。
盖世研究院指出，二手车交易在一定的阶段内和新车是相辅相成的，二手车市场的活跃将在一定程度上刺激新车的销量增长。
“汽车总体保有量的持续增长以及消费者对汽车消费日趋理性务实,在汽车行业进入转型的关键时期,尤其是二手车置换交易将会释放出新车销售的巨大空间。”全国乘用车市场信息联席会秘书长崔东树也持相同意见。
市场潜力虽大领域仍有难题待解
亘古至今，机遇与危机都是并存的。随着二手车行业快速增长，商业模式、市场环境、消费习惯等已发生显著改变，在此趋势下，我国二手车市场在流通管理上的相对滞后与高速发展之间的矛盾凸显，现行办法、规范已无法完全适应。
据悉，在二手车交易方面，现行国家商务部、公安部、工商行政管理总局、税务总局联合印发《二手车流通管理办法》于2005年实施。
2006年，国家商务部配套印发了《二手车交易规范》，由此代表了我国二手车行业进入了政府引导发展时期。时至今日，在14年的发展中，二手车流通不断发展壮大，二手车市场交易量增长超10倍，汽车保有量增长达9.5倍，十余年间，其中内容虽有部分废止和修改，但已经很难跟上快速发展的行业现状。
此外，在行业标准方面，二手车鉴定评估技术规范是二手车行业内首个且唯一的国家标准，于2013年12月31日发布，2014年6月1日开始实施，但值得的是，此技术规范GB/T仅为推荐性国家标准，又称自愿标准，而非必须执行的强制性标准，换而言之，这类标准任何单位都有权决定是否采用，这也就意味着违反这类标准，也无需承担经济或法律方面的责任，所以对二手车市场的实际意义并不大。
由于行业相关政策法规的滞后，造成了二手车市场“以次充好”事件频发，让一部分不良卖家有可乘之机，从而大大降低了消费者对二手车市场的信心。除此之外，限迁和排放标准不一也成为掣肘二手车发展的重要因素。山东的二手车经销商王先生告诉盖世汽车，因为地方层面取消限迁的相关政策有的地方有，而有的地方没有，所以实际还是难以执行。与其并行的还有排放标准的不统一。
此前，国内多个地区出台了二手车限迁政策，且大部分城市的二手车准入门槛为“国四”排放标准。而随着“国六”排放标准的逐步实施，尽管此次《通知》要求尚未实施“国六”的地方可推迟到明年，但实际上对于二手车的限迁来说，很多地方对“国六”排放标准实施并没有出台明确的政策，这也是现实中一个难以逾越的“壁垒”。
“除了部分已经提前实施‘国六’排放标准的地区之外，都应取消限迁，才能释放汽车消费活力。”崔东树如是说。
对此，盖世研究院认为，首先二手车行业应该树立起一个标准的体制，向新车体系的正规化看齐；另一方面，车企应该认识到二手车的价值布局二手车业务，建立品牌标准，在价格方面形成标准化。可以预见的是，随着二手车行业的规模化、专业化、品牌化发展，未来该领域将进一步释放活力为新车消费创造更大的市场空间。
同花顺上线「疫情地图」
点击查看：新型肺炎疫情实时动态地图>>>
关注同花顺财经（ths518），获取更多机会
(function(){var obj = null;if(document.getElementById('arctTailMark')) {obj = document.getElementById('arctTailMark');}if(obj!=null){var str = '(image_address=""http://i.thsi.cn/images/article/logo.jpg"")  返回首页';var showed = 0;try{var oo = obj.previousSibling;while(oo.nodeType!=1 || oo.innerHTML.replace(/\s|\u3000/g,'').length==0){oo = oo.previousSibling;}if(oo.nodeType==1 && oo.tagName.toLowerCase()=='p') {var span = document.createElement('span');span.innerHTML =str;oo.appendChild(span);showed = 1;}}catch (e){}if(showed == 0){obj.innerHTML =str;}}})();
责任编辑：lg",2020-06-09 04:53:06,同花顺
