,title,content,pub_time,src
8,消费反弹 银行消费金融机遇在哪里？,"原标题：消费反弹，银行消费金融机遇在哪里？
2019年，我国社会消费品零售总额41.2万亿，同比增长8%，消费对经济增长贡献率57.8%，拉动GDP增长3.5个百分点，已连续六年成为经济增长的第一拉动力。然而受新冠肺炎疫情影响，作为经济增长“三驾马车”之一的消费受到了较大冲击，2020年一季度社会消费品零售总额7.86万亿，同比大幅下降19.0%，对消费金融行业也产生了深远影响。
随着国内疫情防控形势持续向好，前期被抑制、被冻结的消费重新释放出来，在疫情防控中催生的新型消费和升级消费，给商业银行发展消费金融带来了新的机遇。
根据国家商务部发布的报告显示，预计到2020年我国消费金融市场规模将达到12万亿元，市场渗透率将达25.05%。从渗透率判断，美国消费金融市场渗透率超过40%，我国消费金融仍处于发展初期，仍有较大的增长空间。
后疫情时代消费的变化
线上消费增速明显
据统计，2019年实物商品网上零售额占社会消费品零售总额的比重为20.70%，约为8.52万亿，如果加上网上服务性消费，网络消费的规模将更大。预计今年实物商品网上零售额有望突破10万亿。疫情期间更多的商品通过线上渠道销售，“直播带货”交易火爆，各地政府负责人也加入线上直播做起“网红”推销本地特色商品，推动消费复苏。
以医疗保健和健康产业为主的消费大幅增长
受疫情影响，消费者更加注重健康和医疗保健，健康消费异军突起。国家统计局数据显示，2020年一季度，全国居民人均购买洗涤及卫生用品支出增长27.2%，居民购买口罩等医疗卫生器具支出增长4.2倍。除了防疫必需品，从电商数据来看，空气净化器、除菌洗碗机、除菌干衣机等健康生活类家电走俏，保健品、营养品受到追捧，运动手环、健康监测产品等销售火爆。
数字经济促进消费方式升级
疫情期间，基于大数据、人工智能、云计算等数字技术大量的服务消费迁移至云端。在线问诊、在线教育、在线旅游、在线健身、远程办公开始成为疫情期间的生活日常。后疫情时代，一方面消费者线上服务消费的习惯得以延续，另一方面，预计将有更多的服务类消费运用互联网平台，引导消费者利用线上线下两个渠道，改变消费习惯、提升消费体验、推广消费升级。
(image_address=""http://e.thsi.cn/img/e47619c616975010"")
资料来源：国家统计局
疫情对消费金融的影响
2010年，我国首批3家中银、北银、锦程消费金融公司获银监会批准筹建，经过10年发展已有25家消费金融公司批复开业。其中大股东为银行的有17家，占比达到68%，国有大行、股份行、城商行均参与其中。据已披露2019年报数据，行业总资产规模近5000亿元，平均营收为30亿元，平均净利润为3亿元，头部效应初露端倪。疫情对消费金融行业的影响是阶段性的，中长期来看，行业向好趋势不变。短期来看，影响主要体现在几个方面：
前端获客
受疫情影响部分客户收入减少甚至因为失业导致没有收入，导致消费疲弱。对于传统消费金融领域的汽车、家用电器等耐用消费品需求大幅减少，由于居家隔离，文化旅游方面的消费金融需求也近乎停滞。这可能会倒逼整个消费金融行业向风险承担能力更强、定价更低的客户迁徙。
中端运营方面
现阶段，消费金融从产品开发到客户营销再到风险识别及贷款催收还主要依靠业务人员从事一系列工作。疫情期间的交通管制、封闭隔离措施对消费金融行业员工到岗复工造成影响。因此，对中端运营带来较大的压力，特别是呼叫中心、贷后管理等人员密集型业务连续性受到较大影响。
后端风控
因为疫情原因，部分用户收入和偿债能力、还款意愿等会受影响，导致部分用户可能会借此机会逃废债务。此外由于出行受限，还款便利性等方面也会受到一定影响，这些因素会抬高整个行业的不良率，给消费金融风控带来挑战。
后疫情时代商业银行消费金融的机遇
银行消费金融最近几年快速发展，尤其是互联网银行和城商行、农商行，整体来看，借助平台化外拓渠道，保持高位高速增长。不过，市场分化也已初显，收缩消费金融业务规模的城商行也不在少数；同时随着业务规模持续扩大，不良贷款率也在持续攀升。
根据最近银行披露的年报来看，从增速来看，25家城商行和农商行中，5家银行个人消费贷款余额2019年增速超过100%，其中盛京银行直接从2018年末的31亿元直接跳到了173亿元，增速超过4倍。上海银行（601229）、江苏银行（600919）和宁波银行的个人消费贷款余额增速分别达11%、54%和23%。
此外，行业分化也已经初显，有5家城商行和农商行的个人消费贷余额出现负增长。
疫情后期，消费逐渐回暖，银行的消费金融机遇在哪里？笔者认为主要在于如下几个方面：
一是消费金融短期受疫情影响将呈现萎缩的情况、不良率也会可能增加，但中长期看将会延续疫情前持续增长的总体趋势。随着国内大部分地区经济活动逐渐恢复，以及3月15日银保监会“适时通过消费信贷支持新型消费和消费复苏”的指导下，新的消费方式和消费金融需求正蓄势待发。无论从扩大内需还是金融产品创新角度看，发展消费金融都具有积极意义。消费金融的发展对于刺激消费、优化消费结构有着重要的支撑作用。
二是随着监管机构加大对消费金融领域的治理，消费金融市场逐步规范。自2009年8月《消费金融公司试点管理办法》正式下发以来，国内的专业持牌消费金融公司已走过10个年头。经历了10年的发展，部分非持牌机构的暴力催收、高利贷行为，导致了诸多社会乱象。监管机构加大治理力度，以P2P为代表的网络借贷基本出清。现阶段全国共有25家持牌消费金融公司获批开业，还有不少商业银行拟投资成立消费金融公司，或加大消费金融资金和人员投入。
三是监管机构进一步释放政策红利，为商业银行开展互联网贷款提供政策支持。近年来，商业银行与互联网平台、小贷公司等外部机构合作，利用互联网技术、大数据手段开展互联网贷款，满足借款人消费。5月9日，银保监会公布最新版《商业银行互联网贷款管理暂行办法(征求意见稿)》，进一步规范商业银行互联网贷款行为。《办法》为商业银行依法合规开展互联网贷款业务，对消费类个人贷款限额(不超过20万元)、强化风险管理、规范与第三方合作机构等给予明确。
四是新型消费方式的崛起，为消费金融提供了更广泛的需求。居民消费结构的深层次变化已深入改变消费金融服务场景和业务内容。数据显示，目前，用户取得消费信贷后用于购买家电最多，约占三成，而用于家庭装修、教育培训、旅游和非汽车类交通工具消费贷款增长迅速。疫情后消费者更加注重健康和医疗保健，健康消费需求也呈现大幅增长态势。多元化的消费形式，为商业银行开发适用于不同消费场景的消费金融产品提供了机会。
除了已基本成型的二维码、手机银行、微信银行等自营营销渠道，银行都在拓展外部渠道，与消费购物平台、互联网金融平台等场景广泛合作。比如百信银行最近升级了消费信贷产品“好会花”，这是百信银行面向个人用户推出的正规银行小额信用贷款产品，最高借款额度为30万。相比于其他信用借款平台，好会花年利率低至7.2%。并与百度、360、云闪付、爱奇艺、滴滴一些平台展开合作。江苏银行与借呗、度小满、京东金条、平安普惠等合作。
五是大数据、人工智能、云计算等金融科技极大地提高了消费金融的便利性和可控性。金融科技与传统金融业务和场景进行深度融合，通过流程改造与工具创新，深刻地改变了金融交易的产品形态和业务模式。商业银行的技术和人才优势将推动消费金融数字化转型，人工智能识别、大数据风控、线下业务线上化结合等进一步加快实现消费金融和金融科技的深度融合，可以实现7*24小时全天候为用户提供在线金融服务，帮助优化业务决策、风控管理等。
(责任编辑：DF533)
关注同花顺财经（ths518），获取更多机会
(function(){var obj = null;if(document.getElementById('arctTailMark')) {obj = document.getElementById('arctTailMark');}if(obj!=null){var str = '(image_address=""http://i.thsi.cn/images/article/logo.jpg"")  返回首页';var showed = 0;try{var oo = obj.previousSibling;while(oo.nodeType!=1 || oo.innerHTML.replace(/\s|\u3000/g,'').length==0){oo = oo.previousSibling;}if(oo.nodeType==1 && oo.tagName.toLowerCase()=='p') {var span = document.createElement('span');span.innerHTML =str;oo.appendChild(span);showed = 1;}}catch (e){}if(showed == 0){obj.innerHTML =str;}}})();
责任编辑：lsz",2020-05-23 09:22:17,同花顺
9,2020政府工作报告：加快跨境电商发展 一文了解我国跨境电商发展现状及前景（图）,"(image_address=""//comment.10jqka.com.cn/sourcepic/12/1tDJzMfpsajNextagAtsaytsay.png"")讯：5月22日上午9点，十三届全国人大三次会议正式开幕，国务院总理李克强作政府工作报告。据政府工作报告指出，促进外贸基本稳定。围绕支持企业增订单稳岗位保就业，加大信贷投放，扩大出口信用保险覆盖面，降低进出口合规成本，支持出口产品转内销。加快跨境电商等新业态发展，提升国际货运能力。推进新一轮服务贸易创新发展试点。筹办好第三届进博会，积极扩大进口，发展更高水平面向世界的大市场。
今年以来，跨境电商频频被提及，发展前景大好。跨境电子商务是指分属不同关境的交易主体，通过电子商务平台达成交易、进行支付结算，并通过跨境物流送达商品、完成交易的一种国际商业活动。跨境电商可分为B2B模式、B2C模式、C2C模式。
一、跨境电商市场分析
随着互联网应用加深，跨境运输网络日益发达，海淘从困难重重变得像日常购物一样便利。海淘具有其特有的价格、品类等优势，近年来我国海淘用户规模不断扩大。根据中商产业研究院发布的《2020年中国跨境电商行业市场前景及投资研究报告》数据显示，2018年我国海淘用户规模突破1亿人。2019年，我国海淘用户规模将近1.55亿人，预计2020年有望扩大至2.35亿人。
(image_address=""http://e.thsi.cn/img/e856b64c1e42b7b0"")
来源：中商产业研究院
近年来，我国跨境电商行业不断发展，市场规模持续扩大，2018年我国跨境电商零售进出口交易额突破1000亿元。2019年，中国跨境电商零售进出口额达到1862.1亿元人民币，是2015年的5倍，年均增速49.5%。随着跨境电商综试区增加，跨境电商市场规模将进一步扩大，2020年进出口交易额有望达到2800亿元。
(image_address=""http://e.thsi.cn/img/afd589162912fc13"")
来源：中商产业研究院
从跨境电商进出口结构来看，目前我国跨境电商中出口仍占主导地位，但近年来出口占比在慢慢下滑，进口则在不断提升。整体来看，我国跨境电商进出口占比结构中，出口占比将近八成，而进口仅超过两成。
（1）进口跨境电商
自2013年后进口跨境电商平台逐渐出现，跨境网购用户也逐年增加，我国进口跨境电商市场规模增速迅猛。2015年由于进口税收政策的规范以及部分进口商品关税的降低，进口跨境电商爆发式的增长。据数据显示，2019年中国进口跨境电商交易规模约为2.4万亿元。
(image_address=""http://e.thsi.cn/img/866d5a2c44901acb"")
来源：中商产业研究院
关注同花顺财经（ths518），获取更多机会
(function(){var obj = null;if(document.getElementById('arctTailMark')) {obj = document.getElementById('arctTailMark');}if(obj!=null){var str = '(image_address=""http://i.thsi.cn/images/article/logo.jpg"")  返回首页';var showed = 0;try{var oo = obj.previousSibling;while(oo.nodeType!=1 || oo.innerHTML.replace(/\s|\u3000/g,'').length==0){oo = oo.previousSibling;}if(oo.nodeType==1 && oo.tagName.toLowerCase()=='p') {var span = document.createElement('span');span.innerHTML =str;oo.appendChild(span);showed = 1;}}catch (e){}if(showed == 0){obj.innerHTML =str;}}})();
责任编辑：lsz",2020-05-23 09:22:07,同花顺
10,Zara又败诉了 爱抄袭的品牌你可喜欢？,"(image_address=""//comment.10jqka.com.cn/sourcepic/12/1tC5extagsnMsagtsay.png"")/中国商网（记者 王玥 图/文）时隔四年，快时尚品牌Zara与丹麦服装品牌Rains的设计侵权案最终以Zara败诉落锤。Zara“拿来主义”的做法在业界饱受诟病，屡陷抄袭风波却又屡教不改，这样的品牌消费者还喜欢吗？
据悉，Zara与Rains的设计侵权案始于一件防水外套轮廓的外观设计。Rains方面表示，Zara旗下两款Parka Coat和Long Jacket防水外套轮廓的外观设计与自身派克大衣极为相似，尽管曾试图解决彼此之间的纠纷，但Zara母公司Inditex拒绝与律师见面。最终，在2016年，Rains向丹麦法院管理局提起诉讼。
在赢得诉讼后，Rains在索赔的同时申请禁令救济，要求永久禁止Zara出售涉嫌侵权的夹克。Rains联合创始人对外表示，业内一直期待这场诉讼的结果，全球巨头不能无限制地侵犯设计权利。
实际上，这并不是Zara第一次在侵权案件中败诉。早在2015年，意大利时尚集团OTB（Only The Brave）集团起诉Zara抄袭该集团旗下品牌Diesel和Marni的牛仔裤和凉鞋两件单品。尽管Zara方面坚称牛仔裤产品缺乏原创、凉鞋产品之间存在明显差异，但最终法院宣布Zara侵权成立，要求立即召回侵权产品、停止销售，并为每件产品支付235美元的赔偿金。此外，Zara曾多次被爆抄袭奢侈时尚品牌和艺术家作品元素。
据悉，Zara每年都有数百人的团队穿梭在时装周、秀场之间，方便获得最新的设计潮流趋势。纺织服装品牌管理专家、上海良栖品牌管理有限公司总经理程伟雄在接受(image_address=""//comment.10jqka.com.cn/sourcepic/12/1tC5extagsnMsagtsay.png"")记者采访时表示，Zara定位快时尚，品牌上新速度快，通过“拿来主义”能快速将流行趋势反馈至产品上。
同时，服装行业专家马岗告诉记者，Zara通过抄袭能够得到较大的投入产出比，就算被判定为侵权，Zara需要付出的赔偿金额也远低于因产品所得的利润。
当然，除了快时尚品牌外，国内服装品牌涉嫌产品抄袭的也不在少数。2018年，运动品牌安踏的多款儿童书包外观设计涉嫌抄袭；去年，“鞋王”百丽被法国奢侈品品牌路易威登（Louis Vuitton）起诉抄袭；男装品牌海澜之家（600398）旗下的黑鲸潮牌也被潮牌ROARINGWILD公开指责抄袭。
程伟雄告诉记者，抄袭似乎已成为服装行业的普遍现象。程伟雄坦言，当前，服装行业抄袭存在举证难、赔偿少的现实问题。由于服装行业流行趋势变化快，产品设计涉及面料、款式、颜色等多种元素，申请专利的时间远长于一款产品的流行时间，服装品牌往往会把精力放在打造流行“爆款”上而忽视专利。
马岗认为，服装行业抄袭事件频发，本质上是品牌对知识产权的重视度不够，忽视了产品研发的重要性。再加上服装产品单价较低，消费者往往不会在意服装设计的专利情况。
同花顺上线「疫情地图」
点击查看：新型肺炎疫情实时动态地图>>>
关注同花顺财经（ths518），获取更多机会
(function(){var obj = null;if(document.getElementById('arctTailMark')) {obj = document.getElementById('arctTailMark');}if(obj!=null){var str = '(image_address=""http://i.thsi.cn/images/article/logo.jpg"")  返回首页';var showed = 0;try{var oo = obj.previousSibling;while(oo.nodeType!=1 || oo.innerHTML.replace(/\s|\u3000/g,'').length==0){oo = oo.previousSibling;}if(oo.nodeType==1 && oo.tagName.toLowerCase()=='p') {var span = document.createElement('span');span.innerHTML =str;oo.appendChild(span);showed = 1;}}catch (e){}if(showed == 0){obj.innerHTML =str;}}})();
责任编辑：lsz",2020-05-23 09:21:55,同花顺
11,广西防城港山心沙岛：候鸟能量补给站,"原标题：广西防城港山心沙岛：候鸟能量补给站
广西防城港山心沙岛是候鸟迁徙的必经之地
岛上迁徙候鸟的种类达到30多种
同花顺上线「疫情地图」
点击查看：新型肺炎疫情实时动态地图>>>
关注同花顺财经（ths518），获取更多机会
(function(){var obj = null;if(document.getElementById('arctTailMark')) {obj = document.getElementById('arctTailMark');}if(obj!=null){var str = '(image_address=""http://i.thsi.cn/images/article/logo.jpg"")  返回首页';var showed = 0;try{var oo = obj.previousSibling;while(oo.nodeType!=1 || oo.innerHTML.replace(/\s|\u3000/g,'').length==0){oo = oo.previousSibling;}if(oo.nodeType==1 && oo.tagName.toLowerCase()=='p') {var span = document.createElement('span');span.innerHTML =str;oo.appendChild(span);showed = 1;}}catch (e){}if(showed == 0){obj.innerHTML =str;}}})();",2020-05-23 09:15:41,同花顺
