,title,content,pub_time,src
13,海外华教：挑战与机遇并存,"“我非常喜欢看中国电视剧《还珠格格》，当时看的是配音版。我就想如果懂汉语就好了，就能直接理解小燕子在说什么！”来自泰国暖武里的华裔学生陈素欣谈起最初学习汉语的动因，仍然按捺不住兴奋。
华裔学汉语热情高
12岁开始接受汉语教育，高中开始自主报班进行“一对一”语法学习，大学主修中国研究专业，研究生阶段选择来华攻读硕士学位，陈素欣汉语听说读写能力非常强，参观了不少中国名人故居，最近又在学习中国文言文。
谈及对中国的了解，她说：“中华文化上下五千年，我还有很大的学习空间。”
在泰国等东南亚国家，有许多像陈素欣这样的“中国迷”，他们大都受过良好的华文教育。
菲律宾红烛华文教育基金会咨询委员张杰有7年教龄，他在接受采访时介绍，华文教育的内容主要包括，中国汉字教育、汉语语言教育以及中华文化教育。最初的教育对象是海外华人及其后代，现在，很多非华裔的本土学生也加入进来。这主要是由于东南亚国家与中国在政治、经济和文化上都有非常友好和密切的交往，也从侧面体现了中国软实力的大幅度提升。
面临人才匮乏等困境
学习一门陌生的语言和一种全新的文化并非易事，如何让学生积极参与并且真正学有所得呢？这也是海外华教老师面临的最大难题。
张杰认为，关键在于“激发学生的学习兴趣”，他解释道，学生缺乏相应的语言环境，加上选修课的课程定位，导致学生的自主性不够强。另一方面，很多国家和地区的教学设施不够发达，老师不得不采用传统的教学方式，这也在一定程度上限制了教学水平的发挥。
针对这种情况，张杰提出“以兴趣为前提，以课堂为抓手，以考核为导向”的教学理念，鼓励教师讲述更多现代中国的故事以调动学生兴趣，通过课外活动进行开放式考核，使学生获得成就感。
从大环境来讲，张杰为海外华教的人才匮乏感到担忧：“年轻人不愿意当老师，海外相关的财力人力支持也有所欠缺。”
可以看出，人才匮乏和流失、资金投入小、管理不当等是目前海外华教面临的困境。
如何解决这些问题，张杰认为，可以参考菲律宾的“造血计划”：将本土人才送到中国进行教师培养，学成之后回国开展华文教育。
“在这方面，中国政府是大力支持的，也投入了大量资金和资源。”张杰补充说。
传统教学方式亟待改进
新冠肺炎疫情在全球范围内暴发，使海外华教不得不采用线上授课的形式。
张杰认为，“疫情带来的波动既是挑战，也是机遇”。在东南亚的一些国家，网络技术的应用远没有国内这么便捷和发达，这对以传统授课模式为主的华文教育是一个不小的挑战，面临受课群体心理变化和外在技术环境的双重考验。同时，张杰也表示，中国政府“生命第一”的态度和迅速有效的抗疫行动，得到了海外华人的广泛点赞。
受困于此次疫情，目前居家学习的陈素欣希望可以早日返校，回到中国：“我父母相信中国政府在疫情时期一定可以有效解决我们的学业问题，提供帮助，这也是他们大力支持我学习汉语和中华文化的重要原因。”
文化是联结不同民族的坚实桥梁。“如何让中华文化在世界文化大花园中盛放？如何用当地人所喜欢的方式讲好中国故事？新侨如何接受华文教育？”张杰表示，这些应该是海外华教工作者思考和努力的方向。
关注同花顺财经（ths518），获取更多机会
(function(){var obj = null;if(document.getElementById('arctTailMark')) {obj = document.getElementById('arctTailMark');}if(obj!=null){var str = '(image_address=""http://i.thsi.cn/images/article/logo.jpg"")  返回首页';var showed = 0;try{var oo = obj.previousSibling;while(oo.nodeType!=1 || oo.innerHTML.replace(/\s|\u3000/g,'').length==0){oo = oo.previousSibling;}if(oo.nodeType==1 && oo.tagName.toLowerCase()=='p') {var span = document.createElement('span');span.innerHTML =str;oo.appendChild(span);showed = 1;}}catch (e){}if(showed == 0){obj.innerHTML =str;}}})();
责任编辑：cjh",2020-07-24 04:40:18,同花顺
14,保利虎门TOD项目开工 总投资240亿元 预计2024年8月前竣工,"(image_address=""http://e.thsi.cn/img/e0ffdea6feb749b6"")
虎门TOD效果图。　　□文、图 信息时报记者 段亚雄
7月22日，东莞2020年第三季度重大项目、增资扩产项目、TOD项目集中开工仪式举行，虎门会场设在虎门高铁站TOD核心区综合开发项目现场。记者获悉，虎门高铁站TOD核心区综合开发项目投资240亿元，改造完成后将极大优化虎门站的客流动线及外观形象，项目预计在2024年8月前竣工。
保利66亿斩获该TOD地块
今年6月29日，国铁保利以66亿元斩获虎门高铁核心区总建筑面积约140万平方米TOD地块，该地块需进行虎门站站房改扩建工程，配建高铁站附属市政配套工程、市政道路、地下通廊工程等，改造完成后将极大优化虎门站的客流动线及外观形象，预计在2024年8月前竣工。
虎门高铁站是三轨交汇的核心枢纽，从虎门站出发，最快17分钟可通达广州、深圳，约40分钟抵达香港西九龙，真正实现广深港1小时生活圈。除了通过高铁连通省际、城际，虎门站还具有城轨、地铁，多种交通方式无缝换乘。
据介绍，虎门TOD项目由保利联合（002037）中国铁路局联手打造，双方各施所长，是今年东莞重大项目的主力担当。项目以世界典型TOD为蓝本，参照了日本东京大阪站、涩谷站的规划，并选用香港西九龙TOD的原班设计院――凯达建筑事务所操刀，由中国铁路局监督和参与建设，将虎门站打造为湾区新地标，开创工作生活一体化、休闲娱乐一体化的全新模式。保利将对城市公建进行科学规划，对TOD附属的市政道路、地下空间等工程加以改造。最终将建成高铁站房、TID换乘中心、城市平台，打造成站城一体的综合交通枢纽、产城融合的现代产业集聚区、宜居宜业宜游的国际社区。
打造5平方公里交通枢纽新城
活动现场，东莞市委副书记白涛表示，虎门高铁站TOD核心区综合开发项目作为东莞推进粤港澳大湾区建设标志性项目，对于东莞积极打造生态、开放、活力、精致的城市客厅，全面建设粤港澳大湾区互联互通陆上交通综合枢纽具有非常重要的意义。
滨海湾新区党工委书记、管委会主任、虎门镇委书记罗斌表示，虎门将牢牢把握和充分发挥虎门高铁站具有高铁、城际、地铁三线交汇，连通穗、深、港三大中心城市，直达广州、深圳两大国际机场的得天独厚的优势和重大发展机遇，以高铁站为核心打造5平方公里的现代化交通枢纽新城，推动交通、产业、城市更新和基础设施全盘规划、全面提升，同步推进虎门高铁站和深茂铁路滨海湾站开发建设，做好做活两大TOD片区开发这篇大文章，打造滨海湾大道经济带，重塑主动对接新区、深度融入湾区的城市发展新格局，加快释放TOD综合开发带来的发展红利，以此为动力引擎，驱动虎门城市、产业、人口、管理全面转型升级，努力实现更高水平开放、更高质量发展。
关注同花顺财经（ths518），获取更多机会
(function(){var obj = null;if(document.getElementById('arctTailMark')) {obj = document.getElementById('arctTailMark');}if(obj!=null){var str = '(image_address=""http://i.thsi.cn/images/article/logo.jpg"")  返回首页';var showed = 0;try{var oo = obj.previousSibling;while(oo.nodeType!=1 || oo.innerHTML.replace(/\s|\u3000/g,'').length==0){oo = oo.previousSibling;}if(oo.nodeType==1 && oo.tagName.toLowerCase()=='p') {var span = document.createElement('span');span.innerHTML =str;oo.appendChild(span);showed = 1;}}catch (e){}if(showed == 0){obj.innerHTML =str;}}})();
责任编辑：cjh",2020-07-24 04:26:31,同花顺
15,科威特将从28日起进入复工复产第三阶段,"新华社科威特城7月23日电（记者王薇 聂云鹏）科威特政府23日召开会议对复工复产第二阶段进行评估后决定，该国将从28日起进入复工复产第三阶段，恢复政府部门和私营部门最多50%的工作。
科威特政府发言人塔里克·穆兹里目当天在社交媒体上表示，复工复产第三阶段将恢复政府部门和私营部门最多50%的工作，包括重新开放酒店和度假村、恢复出租车运营等。从28日起，宵禁时间将从目前的每日20时至次日5时缩短至每日21时至次日3时。
他还表示，科威特政府决定从26日起完全解除对费尔瓦尼耶地区的封锁。该地区是科威特最后一处因疫情被封锁的地区。
科威特政府5月28日宣布，将实施分为5个阶段的复工复产计划。科威特从5月31日起进入复工复产第一阶段，恢复网上购物和送货服务、餐馆和咖啡馆外卖服务、车辆保养服务等。6月30日，科威特进入复工复产第二阶段，恢复政府部门和私营部门最多30%的工作。
据科威特卫生部7月23日发布的数据，科威特新增新冠确诊病例687例，累计确诊61872例，其中治愈52247例，死亡421例。
关注同花顺财经（ths518），获取更多机会
(function(){var obj = null;if(document.getElementById('arctTailMark')) {obj = document.getElementById('arctTailMark');}if(obj!=null){var str = '(image_address=""http://i.thsi.cn/images/article/logo.jpg"")  返回首页';var showed = 0;try{var oo = obj.previousSibling;while(oo.nodeType!=1 || oo.innerHTML.replace(/\s|\u3000/g,'').length==0){oo = oo.previousSibling;}if(oo.nodeType==1 && oo.tagName.toLowerCase()=='p') {var span = document.createElement('span');span.innerHTML =str;oo.appendChild(span);showed = 1;}}catch (e){}if(showed == 0){obj.innerHTML =str;}}})();
责任编辑：cjh",2020-07-24 04:23:34,同花顺
