,title,content,pub_time,src
0,2020 年 Q2 平板电脑应用处理器份额：苹果、英特尔、高通、联发科、三星占前五,"(image_address=""//comment.10jqka.com.cn/sourcepic/12/SVTWrrzS.png"")10月25日消息近期，Strategy Analytics手机元件技术(HCT)服务最新发布的研究报告《2020年Q2平板电脑应用处理器市场份额追踪：出货量攀升15%》指出，2020年Q2，全球平板电脑应用处理器市场收益增长26%至5.56亿。
(image_address=""//comment.10jqka.com.cn/sourcepic/12/SVTWrrzS.png"")获悉，报告指出，2020年Q2苹果、英特尔、高通、联发科和三星LSI占据了平板电脑应用处理器(AP)收益份额的前五名。苹果以43%的收益份额领先，其次是英特尔(18%)和高通(15%)。
Strategy Analytics表示：“正如先前预测的那样，由于新冠疫情推动远程学习和工作，2020年Q2平板电脑应用处理器市场实现了强劲的增长。2020年上半年，苹果出货量实现29%的强劲增长。我们预测，平板电脑应用处理器供应商在2020年下半年将继续增长。受疫情推动，在经历了多年的下滑之后平板电脑应用处理器市场将在2020年实现年度出货量增长。”
Strategy Analytics估计，“2020年Q2，蜂窝集成的平板电脑应用处理器出货量实现强劲增长，占平板电脑应用处理器出货总量的36%，高于去年同期的31%。高通，联发科，海思和三星LSI推动了集成应用处理器的发展。我们预计2020年下半年集成应用处理器供应商的出货量将继续增长。”
关注同花顺财经（ths518），获取更多机会
(function(){var obj = null;if(document.getElementById('arctTailMark')) {obj = document.getElementById('arctTailMark');}if(obj!=null){var str = '(image_address=""http://i.thsi.cn/images/article/logo.jpg"")  返回首页';var showed = 0;try{var oo = obj.previousSibling;while(oo.nodeType!=1 || oo.innerHTML.replace(/\s|\u3000/g,'').length==0){oo = oo.previousSibling;}if(oo.nodeType==1 && oo.tagName.toLowerCase()=='p') {var span = document.createElement('span');span.innerHTML =str;oo.appendChild(span);showed = 1;}}catch (e){}if(showed == 0){obj.innerHTML =str;}}})();",2020-10-25 21:56:10,同花顺
1,印度订单回流、又见大单 中国纺织业的春天来了吗,"(image_address=""http://e.thsi.cn/img/3b5d9ac462199171"")
本报记者张智北京报道
一夕之间，中国的纺织业骤然刮起一阵回暖风。
在“中国第一布市”的苏州盛泽镇中国东方丝绸市场，布商周建春敏锐地发现，纺织业自9月起已经开始了快速复苏。9月份，他接到了一个100万米左右的外贸订单，这在今年纺织服装行业整体承压的背景下，实属凤毛麟角。
但周建春的大订单并不是全行业中最受瞩目的。来自浙江金华的某家家纺工厂几十万条ZARA的订单，才是让整个行业沸腾的关键。
近年来，由于国内人工成本暴涨，以及中美之间的贸易关系反反复复，导致前几年大量低端纺织品订单转移到了东南亚、印度等国家。此次，由于印度多家大型出口纺织企业受到疫情影响，接到的订单无法正常生产，不得不将大量订单转至中国工厂生产，甚至有部分企业开始在中国直接采购。
“首都新德里开发区那边大概有100个工厂没有复工，主要是一些做服装纺织品的加工，很多人转行。”北京大学国际关系博士、印度新德里金砖智库所长高兴对媒体表示。
不仅是印度。9月以来，中国的外贸订单重新进入活跃期，订单回流趋势明显。内贸平台上，不断有接到印度订单的中国纺织企业向同行“求援”，共同进行生产。
“从我们的调研来看，是有企业反映接到印度那边转移过来的，但目前行业还是比较谨慎的。”中国家用纺织品行业协会产业部人士向记者表示。据了解，近期外贸订单进入活跃期，国内的企业也都在给双十一备货，为了保障完成印度订单，中国不少工厂已经开辟了新的生产线，也扩充了数倍的员工，每天加班加点连夜生产。
不过，分析人士也指出，订单回流只是短期行为，要保证我国在国际市场的地位，应该将重心放至高端产品上，进一步加重我国纺织品的不可替代性。
订单回流
阿里巴巴国际站发布的数据显示，从5月份开始，中国面料及纺织原材料订单数增长超100%；服装行业订单数同比增长200%以上；10月14日，商务部公布我国2020年1-9月外贸运行情况，前三季度，我国进出口总额23.12万亿元人民币，增长0.7%，累计增速转负为正，且进出口、出口规模均创历史同期新高。
行业内知名的纺织龙头东方盛虹（000301）内，近日一直处于加班加点生产的状态。化纤板块外贸负责人缪云龙称，印度的纺织订单确实起到了不小的作用。
据了解，印度是全球最大的产棉国、全球最大的黄麻产国、全球第二大丝绸生产国、其纱线产能占全球22%。2019年，印度纺织服装市场的规模在2500亿美元左右。纺织服装业也是印度最大的外汇收入来源之一，该行业占印度出口总收入的15%左右。2000年至2018年期间吸引了价值29.7亿美元的外国直接投资。
不过，疫情发生后，印度在防控方面做得不太理想，导致产业链受到极大冲击，印度很多工厂没有办法如期开工，于是越来越多的纺织订单被取消，或者转向中国等国家。
和其他国家不同，中国既有原材料，也有大量的化工原料，供应链完整，这也成为印度订单回流的主要原因之一。同时，中国具备高度的工业自动化，可以在最短的时间内完成订单，而且通过机械化批量生产，不考虑原料供应等环节，生产成本也会更便宜。
目前，国内不少纺织外贸工厂出现爆单情况，甚至有些工厂订单已经排到明年5月。
“订单与产业的转移是一种自发的市场行为。中国科学统筹疫情防控和经济社会发展取得显著成效，率先实现复工复产，有力保障了国际市场供给，也支撑了国际产业链供应链顺畅运转。目前，中国几乎每天都有一些行业和地方的外贸订单转移到其他国家和市场来生产。”商务部外贸司司长李兴乾表示。
事实上，从5月开始，纺织服装业已经逐渐向好发展。
“5月份以后，出口就已经在恢复，第三季度开始逐步与去年同期持平，部分地区出口甚至还高过去年增长水平，8、9月份出口量都创下历史新高。如今很多产品供货都很紧张，再加上内销市场需求恢复更快，最近内外贸都出现了客户排队的现象。”缪云龙表示。
来自海关总署的数据显示，今年前三季度，全国纺织品服装出口额为2157.8亿美元，同比增长9.4%，出口增速较上半年提高6.2个百分点。1-9月份，我国纺织品出口1179.5亿美元，同比增长33.7%，保持较快增长态势，出口增速较上半年提高5.9个百分点。
海关总署表示，下半年以来，服装出口形势持续好转，9月份服装出口额为152.3亿美元，同比增长6.5%，连续两个月保持正增长态势。当前，我国纺织业较为稳定的产业链供应链也正在吸引部分海外订单回流。
不仅是东南亚订单再增加，受益于国外圣诞季备货，部分老板也接到了不少欧美国家的订单，一位做外贸的纺织行业老板表示，近期接到了美国的10万米棉布和20万米的再生春亚纺、桃皮绒订单，10月份的订单量比去年同期更好。
应进一步优化产业结构
在分析师看来，订单一般会提前一个季度，目前第四季度订单基本下完，印度疫情正盛或持续到年底，所以明年一季度的订单也将保持较高水平。因此，本次复苏至少会持续两个季度。
不过需要注意的是，这只是特殊时期发生的事情。印度、东南亚的纺织服装企业在人力成本、能源成本、土地成本、政府税收、关税、环保等方面具有优势。仅就东南亚来说，当地的纺织服装企业毛利率要比国内高5个百分点。因此，一旦疫情结束，这些订单就会重新回到印度和东南亚，甚至可能会出现部分订单违约。
“目前，欧美的需求端尚未复苏，需求上不来，不管是印度订单还是国内订单，都是短期行为，没有长线逻辑。国内企业也需要平衡短期利益与长期战略，不能误以为纺织业大量流到中国，更不能因为接到新订单而盲目扩产。”分析师表示。
在缪云龙看来，当前，国内纺织服装已经意识到了低端纺织品过于饱和，话语权低，开始往中高端方向研发。比如，常规的仿记忆、春亚纺、尼丝纺等已经不再受欢迎，而像T400、T800新型弹力面料却受到了设计师的青睐。
“高端面料、功能性面料，不少只有中国能做，因为中国的产业链完整，这就保证了这部分订单不会被别国抢走，且利润较为可观。这才是国产纺织业的优势。”缪云龙表示。
中国纺织工业联合会会长孙瑞哲也认为，国内面料企业还是应该走差异化路线，向中高端领域进军。
“新冠疫情加速产业经济开启新周期，国内服装行业面临新挑战、新变局，但同时危中有机、危可转机，在这过程中，服装领军企业由点及面、自上而下地贯穿数字转型，不失为引领整个产业生态向数字化、智能化与集成化发展的一条现实路径。”孙瑞哲表示。
此外，目前出口跨境电商交易规模在中国出口规模中比重不断扩大，成为“稳外贸”新增长点，中国本土时尚电商迎来绝佳出海时机，需要企业深耕品牌建设，逐步从“流量导向型”、“产品导向型”转为为“品牌导向型”。
中国服装协会相关负责人也表示，当前，中国服装行业全面进入战略重构和创新变革的全新发展阶段，已经站在参与引领全球服装产业变革的新起点，可以充分显示我国构建“双循环”发展格局释放的发展动能。
责任编辑：方凤娇主编：陈岩鹏
(image_address=""http://e.thsi.cn/img/3b5d9ac462199171"")
关注同花顺财经（ths518），获取更多机会
(function(){var obj = null;if(document.getElementById('arctTailMark')) {obj = document.getElementById('arctTailMark');}if(obj!=null){var str = '(image_address=""http://i.thsi.cn/images/article/logo.jpg"")  返回首页';var showed = 0;try{var oo = obj.previousSibling;while(oo.nodeType!=1 || oo.innerHTML.replace(/\s|\u3000/g,'').length==0){oo = oo.previousSibling;}if(oo.nodeType==1 && oo.tagName.toLowerCase()=='p') {var span = document.createElement('span');span.innerHTML =str;oo.appendChild(span);showed = 1;}}catch (e){}if(showed == 0){obj.innerHTML =str;}}})();",2020-10-25 21:55:15,同花顺
2,上海船研所与洋浦经济开发区合作成立航运安全技术实验室,"10月23日上午，上海船舶运输科学研究所和洋浦经济开发区管理委员会在洋浦大厦举行签约仪式。
根据协议内容，上海船舶运输科学研究所将主要围绕“数字洋浦”“智慧洋浦”“绿色洋浦”和“创新洋浦”，就智慧航运、智慧港口、智能船舶、航运物流数字化生态和新型基础设施建设，以及环境咨询、污染治理等与洋浦开展合作，并在洋浦成立上海船研所的航运技术与安全国家重点实验室工作站。
与此同时，上海船研所将依托其技术、人才、资本等优势，围绕港航产业发展开展合作，进一步提升洋浦的港航科技创新能力，完善洋浦港航基础设施建设，助力打造洋浦西部陆海新通道航运枢纽，促进洋浦港航产业发展。
上海船舶运输科学研究所董事长蔡惠星表示，将会根据洋浦需要做相应的技术方案，特别是要为未来入驻的港航物流企业提供一些共性服务，更好地位洋浦船舶进出港提供技术保障。
签约结束后，任延新还与蔡惠星举行工作会谈，双方就落实战略合作协议、航运技术与国家安全重点实验室挂牌及人才交流等方面开展交流。
关注同花顺财经（ths518），获取更多机会
(function(){var obj = null;if(document.getElementById('arctTailMark')) {obj = document.getElementById('arctTailMark');}if(obj!=null){var str = '(image_address=""http://i.thsi.cn/images/article/logo.jpg"")  返回首页';var showed = 0;try{var oo = obj.previousSibling;while(oo.nodeType!=1 || oo.innerHTML.replace(/\s|\u3000/g,'').length==0){oo = oo.previousSibling;}if(oo.nodeType==1 && oo.tagName.toLowerCase()=='p') {var span = document.createElement('span');span.innerHTML =str;oo.appendChild(span);showed = 1;}}catch (e){}if(showed == 0){obj.innerHTML =str;}}})();",2020-10-25 21:33:25,同花顺
3,老周侃股：公开交易信息可抑制可转债过度投机,"针对可转债的过度投机，监管层周末出台了部分措施，可转债的过度投机预计会有所缓解。在本栏看来，将可转债的公开交易信息及时公开，将很大程度的抑制可转债的过度投机。公开交易信息，能够让投资者及时看到到底是哪些资金在盘中兴风作浪，及时了解他们的交易动态，一方面能为散户投资者提供一些交易参考，另一方面也能让投资者意识到投机炒作的风险。
公开交易信息虽然并没有直接抑制过度投机，却能在一定程度上起到心理威慑的作用。试想，对于庄家而言，自己干了些什么，如果全都公开在阳光下，那么他们在交易的时候，心理上或多或少也会有些担心，毕竟投资者随时可以知道是谁在高举高打，是谁在割投资者的韭菜，而且这些交易信息也有可能成为管理层处罚违规资金的依据。所以，公开交易信息将会在一定程度上抑制投机资金的违法违规行为。
公开交易信息也能让散户投资者有所警觉，毕竟当投资者看到自己持有的可转债有大资金大幅拉升，然后当价格出现一定回调走势时，投资者就会思考，是不是大资金出逃了，自己要不要及时撤退，这就能够让投资者获得一些投资依据，从而提高风险意识，规避可能出现的投资风险。
从某种程度上来说，可转债市场的疯狂与交易信息不公开、不透明有很大的关系。可转债的交易规则是T+0，大量的投机资金在盘中来回买卖，因此导致成交量巨大。而突然暴涨的股价也会吸引不少跟风投资者进场交易。对于散户投资者而言，只看到的是可转债股价盘中的疯狂上涨，除此之外，他们基本是一无所知。
在可转债市场真正能够赚大钱的，一定是那些利用资金优势，当日无数次做着拉高出货，逢低吸纳买卖的大型投机资金，但散户投资者对他们一无所知，而他们也正是利用了这一点，当散户投资者热情不高涨的时候，再用点钱拉升一下煽风点火，然后等投资者进场的时候他们再逢高派发。
如果能够将可转债的交易信息公开，尤其是那些当日明显异动的可转债，诸如，换手率超过一定数值，单日连续两度熔断，成交金额达到某个数值等，将上述条件设置为公开交易信息的触发条件，就和沪深交易所目前每个交易日盘后公布的公开交易信息一样，把那些触发标准的可转债交易信息向广大投资者全部公开，这样投资者就能够较为及时地了解场内资金的博弈情况。
在交易信息公开的情况下，投资者能够洞悉投机资金在盘中的交易戏码，诸如买卖情况，获利情况等，从而对可转债当前的市场表现有一个更为深入的判断。诸如，通过买卖前五的情况大致能够推算出他们的获利情况，如果获利很大的话，说明场内的主要资金推手随时可能离场，投资者就要十分小心了。
北京商报评论员周科竞
关注同花顺财经（ths518），获取更多机会
(function(){var obj = null;if(document.getElementById('arctTailMark')) {obj = document.getElementById('arctTailMark');}if(obj!=null){var str = '(image_address=""http://i.thsi.cn/images/article/logo.jpg"")  返回首页';var showed = 0;try{var oo = obj.previousSibling;while(oo.nodeType!=1 || oo.innerHTML.replace(/\s|\u3000/g,'').length==0){oo = oo.previousSibling;}if(oo.nodeType==1 && oo.tagName.toLowerCase()=='p') {var span = document.createElement('span');span.innerHTML =str;oo.appendChild(span);showed = 1;}}catch (e){}if(showed == 0){obj.innerHTML =str;}}})();",2020-10-25 21:22:15,同花顺
4,从“云广交”看中国外贸企业新变化,"新华社北京10月25日电 题：从“云广交”看中国外贸企业新变化
新华社记者于佳欣、丁乐
从没想过做线上交易，到成为直播网红；从做出口业务为主，到打开国内销路；从专注做老产品，到不断开发新需求……
为期10天的第128届广交会24日落下帷幕，这是继今年6月之后广交会第二次“上云”。贸易盛会从线下搬到线上，这种应对挑战的变化也彰显了中国外贸企业转型创新的不懈努力。
从“水土不服”到入“网”随俗
“作为一家传统陶瓷外贸制造企业，我们从没想过用直播的方式做外贸。”广东大埔县发源发展有限公司业务负责人邓茉莉日前接受记者采访时如此感慨。
摸着石头过河，企业做足各种准备，在上半年第一次“云广交”中尝试首次直播，收到意向订单约60万美元，大大超出企业预期。
而4个月后，在第128届广交会期间，这家外贸企业已褪去第一次“触网”时的青涩。不仅直播人员更专业娴熟，还增设了VR虚拟展、3D效果图，并用AI大数据精准搜索目标客户。5场直播下来，收到订单金额比上一届涨了20万美元，还认识了一批新客户……
从“面对面”到“屏对屏”，这样的转变曾一度让不少外贸企业“水土不服”，而今，这样的状况正在改变。
5117万次――这是截至闭幕时本届广交会官网累计访问量。越来越多的国内外参展商正在接受线上贸易洽谈模式。本届广交会上，场景仿真、一键互换名片、采购商一键注册等系列新功能的加入，让这一切变得更便捷更高效。
除了做直播，邓茉莉还带领团队在网站设计和展品展示上下功夫。“从线下搬到线上，意味着企业不分大小，能否吸引客户的关键在于引流能力。”她说，“虽然这给我们提出了挑战，但只要做好了，就可能获得更多订单。”
从订单危机到新意迭出
在上半年疫情吃紧时，不少外贸企业海外业务一度停滞，无论线上线下，接单都成问题。通过创新产品、拓新市场，在“新”上下功夫，解决了一批企业的订单危机。
参加广交会第17个年头的深圳市牧人电器五金制品有限公司，这次带来6款新产品。如今营业额九成来自海外市场，这家企业打算开拓更广的国内市场，计划未来三年内做到进出口基本平衡。
市场转换的背后是产品设计的调整。
“就像以搅拌功能为主的厨师机，针对国内客户，机器的和面力道要更大。”深圳牧人公司董事长王文雄说。
针对国内市场，大埔县发源发展有限公司专门开发了青花陶瓷灯座系列、陶瓷储物罐系列、十二生肖系列；而针对东南亚、中东等海外市场开发的中国龙青花瓷系列、仿真大理石贴花系列，出口份额比往年有明显提高。
从此次参展企业上传的展品中，也能感受到十足的创新气息：据统计，企业上传的新产品73万件，比上届增加13万件；智能产品10万件，比上届增加2万件。
真正用心发现需求的企业，永远不缺市场――
浙江达柏林阀门有限公司董事长林海林最近刚结束了一个月的市场调研，准备开发新产品：瞄准高端消费市场，将过去销售的生活用水PPR管升级为紫铜管，更好满足饮用水健康安全需求。
疫情下防疫物资订单不缺，广东省纺织品进出口股份有限公司也没有停止创新。公司总经理杨全兴告诉记者，通过细分市场，企业开发出针对妇女、儿童、老人等不同群体的口罩，以及针对防疫、防霾、运动等不同功能的口罩。此外，顺应“宅经济”的火热，公司还加大对瑜伽服、休闲睡衣、消毒纸巾等的生产，收到源源不断的订单。
从固守一隅到内联外拓
展示了企业产品和形象，维系了与老客户的关系，结识了不少新客户……一场“云广交”下来，外贸企业普遍有这样的感受。
但“云广交”带给企业的不仅仅是订单的增加，更是眼界的开阔和思路的转变。
用好国内国际两个市场，针对需求差异开发出更多新产品，用好数字化技术做生意……经历风雨中，外贸企业一次次实现华丽转身。
“经此一‘疫’，未来外贸数字化转型趋势必将加快并成为常态，这也给外贸企业提出了新要求，若不及时转型就可能被淘汰。”林海林说。
疫情下，越来越多的外贸企业开始思考借助更大电商平台与海外客商做生意。“我们正在跟阿里国际站洽谈，将签订跨境电商服务协议，未来会逐步增加对其他平台的投入，打造全新营销模式。”邓茉莉说。
广交会新闻发言人徐兵表示，广交会未来将更加积极地拥抱数字化发展潮流，在智慧广交会建设基础上，推动线上线下深度融合和一体化发展。
“在构建以国内大循环为主体、国内国际双循环相互促进的新发展格局中，外贸企业可以发挥‘补缺’和‘升级’作用。”商务部研究院对外贸易研究所副所长竺彩华说，一方面可以补给国内供给体系不足，另一方面通过国际竞争提升企业创新能力。
而插上数字化的翅膀，这一目标的实现定会加快步伐。
关注同花顺财经（ths518），获取更多机会
(function(){var obj = null;if(document.getElementById('arctTailMark')) {obj = document.getElementById('arctTailMark');}if(obj!=null){var str = '(image_address=""http://i.thsi.cn/images/article/logo.jpg"")  返回首页';var showed = 0;try{var oo = obj.previousSibling;while(oo.nodeType!=1 || oo.innerHTML.replace(/\s|\u3000/g,'').length==0){oo = oo.previousSibling;}if(oo.nodeType==1 && oo.tagName.toLowerCase()=='p') {var span = document.createElement('span');span.innerHTML =str;oo.appendChild(span);showed = 1;}}catch (e){}if(showed == 0){obj.innerHTML =str;}}})();
责任编辑：wyj",2020-10-25 21:15:16,同花顺
