,title,content,pub_time,src
0,好消息！柳叶刀发表陈薇团队新冠疫苗试验结果：全部产生免疫应答！,"柳叶刀发表陈薇团队新冠疫苗试验结果：安全，能诱导免疫反应
5月22日，世界权威医学期刊《柳叶刀》在线刊登了军事医学研究院陈薇院士和江苏省疾控中心朱凤才教授团队的新冠疫苗人体试验临床数据结果，研究结果显示，一期临床108个志愿者全部有显著的细胞免疫反应，这是世界首个新冠疫苗的人体临床数据。
(image_address=""http://e.thsi.cn/img/a1ccbd19e5b8c40f"")
最新研究表明，这是第一种进入第一阶段临床试验的COVID-19疫苗安全、耐受性好，能够在人体内产生抗SARS-CoV-2的免疫应答。在108名健康成人中进行的开放标签试验显示，在28天后显示出了有希望的结果，最终结果将在6个月内进行评估，接下来需要进一步的试验来确定它引起的免疫反应是否能有效地预防SARS-CoV-2感染。
在《柳叶刀》方面提供的资料中，负责这项研究的军事科学院军事医学研究院生物工程研究所的陈薇说道，这是一个里程碑。“该试验表明，单剂量的新型5型腺病毒载体COVID-19（Ad5-nCoV）疫苗可在14天之内产生病毒特异性抗体和T细胞，使其有可能进一步研究。”陈薇表示， “但是，应谨慎解释这些结果，开发COVD-19疫苗所面临的挑战是前所未有的，并且触发这些免疫反应的能力并不一定表明该疫苗将保护人类免受COVID-19的侵害， 这一结果显示了开发COVID-19疫苗的希望，但距离所有人都能使用这种疫苗还有很长的路要走。”
有效的疫苗被视为控制COVID-19大流行的长期解决方案。当前，全球有超过100种候选COVID-19候选疫苗正在开发中。在该试验中评估的新型Ad5载体COVID-19疫苗是首次在人体中进行测试。
它使用弱化的普通感冒病毒（腺病毒，该病毒容易感染人细胞，但无法引起疾病）将编码SARS-CoV-2穗突蛋白的遗传物质传递给细胞。然后，这些细胞产生刺突蛋白，并到达淋巴结，在免疫系统中，淋巴结会生成抗体，这些抗体会识别突刺蛋白并与冠状病毒抗争。
“我们的研究发现，预先存在的Ad5免疫可以减慢对SARS-CoV-2的快速免疫反应，并降低反应的峰值水平。此外，高度存在的Ad5免疫也可能会对疫苗引起的免疫反应的持续性产生负面影响。”江苏省疾病预防控制中心朱凤才教授表示。
研究者指出，该试验的主要局限性在于其样本量小，持续时间相对较短以及缺乏随机对照组，这限制了对疫苗产生更罕见不良反应的能力或为其产生抗炎药的能力提供了有力的证据。在所有人都可以使用该试验疫苗之前，需要进一步的研究。
目前，已在武汉启动了一项针对Ad5-nCoV疫苗的随机，双盲，安慰剂对照的2期临床试验，以确定是否可以复制该结果。
英国启用被遗忘的1.5亿英镑抗疫，已从超过15年的休眠账户释放超6亿英镑
5月20日，英国政府宣布将从银行的“休眠账户”中释放1.5亿英镑，以在冠状病毒爆发期间帮助慈善机构、社会企业和弱势群体。“休眠账户”的定义是超过15年无人认领的账户，2011年以来，已释放超6亿英镑用于慈善事业。
韩国对新天地教会进行扣押搜查 系首次强制调查
22日，韩国水原地方检察厅刑事6部动员100多名检察官和调查官，对韩国全国的新天地教会设施场所进行了扣押搜查。这是韩国检方首次对“新天地”进行强制调查。韩国检方当天上午同时对京畿道果川和加平、釜山、光州、大田等城市的新天地相关设施进行了扣押搜查。
特朗普说我戴口罩了但不想你们看到
当地时间21日，美国总统特朗普视察密歇根州福特工厂时，仍未戴口罩。当被记者追问时，特朗普自称在镜头外曾戴口罩，“我不想让媒体看到我因戴口罩而快乐”。密歇根州总检察长表示，如果特朗普不戴口罩，他将不能再进入密歇根州任何未封闭设施。
查清楚了！吉林市""断链""病例已找到传染源
5月22日消息，5月19日，吉林省卫健委通报的确诊病例情况介绍中，病例3、病例4两人为舒兰市返吉人员。不少网友发现，官方当时并未通报其与已确诊病例有过密切接触史，因此有人解读为疫情“断链”。5月20日，官方通报初步调查结果，该两例病例与5月10日通报的确诊病例2有关联。
针对这一热点问题，人民日报记者近日对吉林省新型冠状病毒肺炎疫情防控工作领导小组相关负责人进行了采访，并得到明确答复：该两例确诊病例的传染源已经查清，“断链”一说不存在！以下为具体情况：
问：5月19日通报的病例3和病例4，当时并未通报其与其他确诊病例有过密切接触；目前感染来源是否明确，能否介绍一下具体情况？
答：通过多部门联合调查，5月19日通报的确诊病例3（姜某某）和病例4（郑某某）系由5月20日通报的确诊病例（姜某）传染。
5月20日通报的确诊病例（姜某）与5月10日通报的病例9（郝某某）、5月10日通报的病例1（刘某）三人在5月2日晚20时-22时同时在北华大学南校区校门口小吃夜市活动，有共同暴露史，姜某在暴露后4天发病。
5月19日通报的确诊病例3（姜某某）和病例4（郑某某），5月9日从舒兰返回家中与5月20日通报的确诊病例（姜某）共同生活，分别于5月14日和5月15日发病，从暴露到发病分别为5天和6天，符合新冠肺炎传播特征。
据澎湃新闻，截至5月21日24时，舒兰聚集性疫情已导致48人感染，包括45例确诊病例，3例无症状感染者。
关注同花顺财经（ths518），获取更多机会
(function(){var obj = null;if(document.getElementById('arctTailMark')) {obj = document.getElementById('arctTailMark');}if(obj!=null){var str = '(image_address=""http://i.thsi.cn/images/article/logo.jpg"")  返回首页';var showed = 0;try{var oo = obj.previousSibling;while(oo.nodeType!=1 || oo.innerHTML.replace(/\s|\u3000/g,'').length==0){oo = oo.previousSibling;}if(oo.nodeType==1 && oo.tagName.toLowerCase()=='p') {var span = document.createElement('span');span.innerHTML =str;oo.appendChild(span);showed = 1;}}catch (e){}if(showed == 0){obj.innerHTML =str;}}})();
责任编辑：lsz",2020-05-23 09:36:14,同花顺
1,乌克兰政府公布逐步放松隔离措施方案,"人民网基辅5月22日电（记者谭武军）乌克兰政府21日公布分5个阶段逐步放松隔离措施方案。根据方案，乌克兰实施的隔离状态将至少延长至6月22日，但是从5月22日起，各州可根据本地实际情况放松隔离措施。
第一阶段从5月22日起，恢复市内、郊区、城市间和国际公路客运；允许在无观众情况下，举办50人以下的体育赛事；有条件举办宗教活动（每10平方米1人）。
第二阶段从5月25日起，恢复地铁运营，但乘客需佩戴口罩类防护用品；计划开放幼儿园。
第三阶段从6月1日起，恢复健身中心和教育机构运营，但是最多只能10人为一组，各州间的铁路运输也将恢复。
第四阶段从6月10日起，计划允许餐饮企业、文化单位以及酒店业恢复营业。
第五阶段从6月15日起，恢复航空旅行。
据乌卫生部统计，截止5月22日9时30分，乌克兰日新增442例新冠肺炎确诊病例，新增死亡9例，乌累计确诊20148例，死亡588例，治愈6585例。
同花顺上线「疫情地图」
点击查看：新型肺炎疫情实时动态地图>>>
关注同花顺财经（ths518），获取更多机会
(function(){var obj = null;if(document.getElementById('arctTailMark')) {obj = document.getElementById('arctTailMark');}if(obj!=null){var str = '(image_address=""http://i.thsi.cn/images/article/logo.jpg"")  返回首页';var showed = 0;try{var oo = obj.previousSibling;while(oo.nodeType!=1 || oo.innerHTML.replace(/\s|\u3000/g,'').length==0){oo = oo.previousSibling;}if(oo.nodeType==1 && oo.tagName.toLowerCase()=='p') {var span = document.createElement('span');span.innerHTML =str;oo.appendChild(span);showed = 1;}}catch (e){}if(showed == 0){obj.innerHTML =str;}}})();
责任编辑：lsz",2020-05-23 09:35:30,同花顺
2,5月首场土拍火爆 南京成房企拿地焦点城市,"华夏时报记者 李贝贝 上海报道
延续4月热度，5月南京首场土拍仍吸引了多家房企争相竞逐，显示出南京这座长三角核心城市对于房企们的强烈吸引力。
南京市房地产学会副会长李子墨表示，目前很多房企在南京都没有什么土地储备了，急需补仓扩充土地储备。同时，今年以来货币政策相对宽松，房企融资能力大增、融资成本降低，房企资金充裕。而南京这样的强二线城市，近期出让的大多为热门板块的优质土地，自然成为房企们拿地的焦点。
6宗地块69亿元成交
4月末，南京土地市场连续两天卖地共收金371亿元，高调为4月画上了句号。
时隔20天，南京“红5月”首场土拍姗姗来迟。5月20日，南京推出6幅地块，其中包括3幅纯宅地、1幅涉宅混合用地及2幅商业用地，分别位于河西南（1幅）、紫东（2幅）、六合（1幅）、江宁（2幅），总出让面积337081.92平方米，总规划建筑面积687780.66平方米，起始总价58.1亿元。经过2个小时的网上竞价，最终6幅地块全部成功出让，成交总价达69.04亿元，溢价率为18.9%。
作为本次土拍中最受关注的地块，仙林湖G16地块经过52轮报价之后，被南京栖霞建设（600533）股份有限公司成功竞得。地块总价17.5亿元，成交楼面价27142元/平方米，达到最高限价；自持人才房建筑面积200平方米，溢价率40%。来自我爱我家（000560）南京研究院等机构提供的数据显示，这一楼板价创下仙林湖区域新高。
同样人气颇高的尧化门G15地块吸引了高科、卓越、金科等多家房企争夺。经过1个小时、56轮的竞拍，该地块由南京高科（600064）置业有限公司以总价20.4亿元、楼板价19712元/平方米的代价拿下，溢价率36.9%。据悉，这是高科首次进驻尧化门板块，该地块楼板价略低于“鲁能地王”20171元/平方米的均价，但相比4月石榴地产斩获的G04宅地17608元/平方米的楼板价高出近2000元/平方米。
首次进驻六合板块的金科地产，旗下南京金科天宸房地产有限公司以8.1亿元总价拿下六合G17地块，成交楼面地价为6122元/平方米，溢价率2.53%。
南京曦地馨科商业管理有限公司（首创置业）以底价12.5亿拿下河西南G18号地块。此外，经过15轮竞价，南京万聚建设拿下谷里G19地块，总价1.3亿元；江宁城建以底价9.24亿元拿下汤山G20地块。
值得一提的是，汤山G20地块在去年出让时遭遇流标。据悉此次重新挂牌调整了起拍楼面价、租赁住房面积。同时，该地块也设置了住宅销售门槛，要求住宅首期销售面积不得超过住宅总建筑面积的50%，待酒店取得施工许可证后，允许销售住宅建面的80%；待酒店竣工备案后，住宅方可全部销售，这在南京尚属首例。
市场热度高居不下
今年以来，南京土地市场的热度持续上扬：根据中国指数研究院发布的《2020年1-4月全国房地产企业拿地排行榜》数据，1-4月，南京继上海、杭州、北京之后，成交总价位列第四，同比增长139%；4月单月，南京市则以439.2亿元的出让金总额位列300城首位，且有三宗宅地入围全国总价TOP10。
南京工业大学天诚不动产研究所执行所长吴翔华向《华夏时报》记者强调，这其实不是土地市场的单独现象，而是一个系统的回暖，甚至是反弹、上扬的现象。根据5月18日国家统计局发布的数据，环比来看，南京新建商品房房价4月环比涨幅相对较大，以1.8%的涨幅位列全国第一，房价涨幅从3月份第27位跃升至4月第1位。
业内人士普遍认为，南京土地市场不断升温的背后，不仅有疫情逐渐稳定的原因，也在于资金面渐宽和土地供应增加等因素的影响。
从供应端来看，南京今年土地供应的充裕程度高过以往。《华夏时报》记者查阅资料发现，4月江苏土地市场网公布了南京市2020年度国有建设用地供应计划，2020年供应总量为2999公顷，其中商品住房用地672公顷，超过2019年590公顷的商品住房用地总量。
土地市场加大供应，使得不少有志在一二线增加土储规模的房企们摩拳擦掌，希望加速揽储优化土储结构。李子墨直言，“目前很多房企在南京都没有什么土地储备了，急需补仓，尽快拿地，扩充土地储备”。而资金面的宽松，使得房企们的拿地积极性进一步提高。吴翔华认为，疫情过后，融资、金融政策都相对来说比较宽松，资金不可避免地会流入到房地产市场中。
更重要的是，南京这座城市本身的发展潜力，令房企对南京未来的市场走势抱有良好预期。李子墨认为，南京的城市地位、综合实力在江苏省的首位度在提升、对周边地区的辐射力和吸引力比较强，毕竟南京是江苏省省会、也是东部地区重要的中心城市、长三角特大城市，在长三角一体化、长江经济带这样的国家战略中占有重要地位，具备足够的亮点和发展引擎，这使得南京成为那些“重返二三线”房企的投资热土，购房者亦认为南京有足够的发展潜力。
“南京做为长三角核心城市，不但有着大量人口红利，同时对于周边的安徽有很强虹吸力。”58安居客房产研究院分院院长张波也向《华夏时报》记者解释说，当前大型房企开始回归价值投资逻辑，即核心城市优质地块努力争抢，例如万科、雅居乐、新城等品牌房企都采取紧盯优质都市圈，拿地谨慎的同时对优质地块则毫不手软。
张波指出，从房企在南京拿地的倾向性也可以清晰看出，选择核心城市的优质地块这一底层逻辑表现得非常明显。部分拍出的南京地块从价格上看并不便宜，但抗风险性强，在未来或难出现超预期收益表现，但有可能降低拿地的风险性。
对于南京土地市场的走向，吴翔华认为，短期内这种趋势还是会延续的。当然不仅仅是土地市场，包括一二手房市场也都将会继续这种“热度稳步攀升”的状态。但对于房企在南京拿下的“地王”，吴翔华直言，目前部分板块的二手房市场还不支持这样的高地价，但整体来看，房企拿地目前还是相对保持冷静。
与吴翔华看法类似，张波也认为今年南京土地市场整体的吸引力依然会保持一定强度。不过，其强调市场会出现分化：“优质地块的关注度热度未来会持续增强，但郊远区域或后续发展空间偏小的地块则会表现平淡，甚至流拍地块也会出现。”
责任编辑：张蓓 主编：张豫宁
同花顺上线「疫情地图」
点击查看：新型肺炎疫情实时动态地图>>>
关注同花顺财经（ths518），获取更多机会
(function(){var obj = null;if(document.getElementById('arctTailMark')) {obj = document.getElementById('arctTailMark');}if(obj!=null){var str = '(image_address=""http://i.thsi.cn/images/article/logo.jpg"")  返回首页';var showed = 0;try{var oo = obj.previousSibling;while(oo.nodeType!=1 || oo.innerHTML.replace(/\s|\u3000/g,'').length==0){oo = oo.previousSibling;}if(oo.nodeType==1 && oo.tagName.toLowerCase()=='p') {var span = document.createElement('span');span.innerHTML =str;oo.appendChild(span);showed = 1;}}catch (e){}if(showed == 0){obj.innerHTML =str;}}})();
责任编辑：lsz",2020-05-23 09:32:22,同花顺
3,全国人大代表、湖北证监局局长李秉恒：建议设立专门机构 加快证券行业不良资产处置,"在李秉恒看来，当前证券不良资产处置领域主要存在四方面问题：缺乏专门的证券不良资产处置机构；处置周期较长、手段不足，债券违约处置通常耗时3至5年，甚至更长时间，部分案例中，投资者只能被动等待司法程序；债券等证券资产持有人相对分散，给风险处置带来困难；困境企业对接产业资本的渠道不畅。
全国人大代表、湖北证监局局长李秉恒：
建议设立专门机构 加快证券行业不良资产处置
⊙本报两会报道组 ○编辑 马婧妤
全国人大代表、湖北证监局局长李秉恒日前接受上证报记者采访表示，近年来，债券违约等证券领域风险事件逐步增多，证券不良资产有所增长，迫切需要进一步推动证券不良资产处置机制优化、完善。他建议，设立证券行业不良资产处置机构，以此为龙头，推动证券不良资产处置生态建设。
在李秉恒看来，当前证券不良资产处置领域主要存在四方面问题：缺乏专门的证券不良资产处置机构；处置周期较长、手段不足，债券违约处置通常耗时3至5年，甚至更长时间，部分案例中，投资者只能被动等待司法程序；债券等证券资产持有人相对分散，给风险处置带来困难；困境企业对接产业资本的渠道不畅。
对此，李秉恒建议，设立证券监管部门牵头的证券行业不良资产处置机构。他认为，证券不良资产处置机构应由人民银行指导，证券监管部门牵头，交易所、行业协会、部分市场机构出资设立，处置机构不以盈利为目的。同时，可以发挥行业培育功能，通过设立基金等方式，组织和引导市场各主体积极参与证券不良资产处置，积极探索总结证券不良资产处置业务模式，向市场推广可供复制的经验，促进行业发展壮大。
在李秉恒的设想中，与传统的资产管理机构主要对接银行体系不同，证券处置机构主要依托资本市场开展违约债券等证券领域的不良资产处置。随着刚性兑付打破，违约债券将成为常态化的不良资产类别，也将成为证券不良资产处置机构的主要业务标的。
在资产处置手段方面，李秉恒认为，要突出股债结合的方式。证券不良资产处置机构以市场化方式运作，在资产处置过程中，注重发挥上市公司的平台优势，探索推动通过债转股等股债结合方式化解企业债务风险。同时，要兼顾企业短期风险化解和长期转型发展，在帮助困境企业暂时缓释风险后，支持企业相对从容地寻找具有业务协同性的产业资本介入，通过重组、重整等方式重新焕发生机。
设立证券不良资产处置机构的最终目的，是要推动证券不良资产处置相关制度完善和生态建设。李秉恒表示，要发挥证券不良资产处置机构的牵头作用，提升证券持有人在企业债务处置中的话语权，提高市场化平等协商和司法程序效率，推动不良资产处置方式创新。在实践中不断查找现有制度堵点、断点，做好政策调研，发挥政府背景下的沟通协调优势，推动有关部门完善相关市场机制和司法制度，提升证券不良资产处置效率，促进形成良好市场生态。
同花顺上线「疫情地图」
点击查看：新型肺炎疫情实时动态地图>>>
关注同花顺财经（ths518），获取更多机会
(function(){var obj = null;if(document.getElementById('arctTailMark')) {obj = document.getElementById('arctTailMark');}if(obj!=null){var str = '(image_address=""http://i.thsi.cn/images/article/logo.jpg"")  返回首页';var showed = 0;try{var oo = obj.previousSibling;while(oo.nodeType!=1 || oo.innerHTML.replace(/\s|\u3000/g,'').length==0){oo = oo.previousSibling;}if(oo.nodeType==1 && oo.tagName.toLowerCase()=='p') {var span = document.createElement('span');span.innerHTML =str;oo.appendChild(span);showed = 1;}}catch (e){}if(showed == 0){obj.innerHTML =str;}}})();
责任编辑：lsz",2020-05-23 09:25:06,同花顺
