,title,content,pub_time,src
4,北京新增病例详情公布！多位密接者确诊，两人在食品厂工作……,"(image_address=""https://x0.ifengimg.com/res/2020/8AF4833191AF1FADDB7E52EF1992D45D048144A9_size73_w1080_h810.jpeg"")
北京市医疗保障组领导、市卫生健康委领导和市纪委监委驻市卫生健康委纪检组负责人两次召开约谈会，要求各医疗机构对照北京市院感防控16条措施，认真查找问题、发现问题、立行立改，确保整改到位，各办医主体和属地政府加强监督指导。
文｜李佳霖杨学聪编辑｜刘辛未
头图摄影｜邓攀
6月20日下午，北京市召开疫情防控第127场例行新闻发布会。
19日新增22例确诊病例详情公布
两人工作单位为某食品厂
北京市疾病预防控制中心副主任刘晓峰介绍了6月19日新增确诊病例相关情况。
(image_address=""https://x0.ifengimg.com/res/2020/008D9DF536DC18D717A2EAF185E32543907B9E6D_size48_w1080_h704.jpeg"")
来源：经济日报
6月19日0时至24时，北京市新增新冠肺炎确诊病例22例，其中男性11例，女性11例；年龄平均37岁，最小1岁，最大56岁；北京户籍6例，外省户籍16例；丰台区13例、大兴区8例、海淀区1例；临床分型轻型9例，普通型13例，确诊病例均与新发地市场有关联。具体情况通报如下：
病例1，男，50岁，黑龙江人，住丰台区花乡，工作单位为新发地市场，6月14日发病，19日确诊，临床分型为普通型。
病例2，女，33岁，河北人，住大兴区西红门镇，工作单位为新发地市场，6月17日发病，19日确诊，临床分型为轻型。
病例3，男，39岁，湖北人，住丰台区花乡，工作单位为新发地市场，6月15日发病，19日确诊，临床分型为普通型。
病例4，男，34岁，河北人，住丰台区花乡，工作单位为新发地市场，6月17日发病，19日确诊，临床分型为普通型。
病例5，女，54岁，黑龙江人，住大兴区黄村镇，工作单位为新发地市场某饭店，6月15日发病，19日确诊，临床分型为普通型。
病例6，女，43岁，北京人，住丰台区花乡，曾经到新发地市场采购，6月14日发病，19日确诊，临床分型为普通型。
病例7，男，52岁，河南人，住丰台区马家堡街道，曾经到新发地市场采购，6月15日发病，19日确诊，临床分型为普通型。
病例8，男，34岁，山东人，住丰台区马家堡街道，曾经到新发地市场采购，6月15日发病，19日确诊，临床分型为普通型。
病例9，男，31岁，河南人，住丰台区花乡，曾经到新发地市场采购，6月14日发病，19日确诊，临床分型为普通型。
病例10，女，34岁，北京人，住大兴区天宫院街道，曾经到新发地市场采购，6月14日发病，19日确诊，临床分型为轻型。
病例11，男，34岁，广西人，住丰台区花乡，曾经到新发地市场采购，6月19日发病，19日确诊，临床分型为轻型。
病例12，女，32岁，四川人，住大兴区黄村镇，工作单位为某食品厂，为6月17日确诊病例的密切接触者，17日发病，19日确诊，临床分型为普通型。
病例13，女，34岁，河南人，住大兴区西红门镇，工作单位为某食品厂，为6月17日确诊病例的密切接触者，18日发病，19日确诊，临床分型为轻型。
病例14，女，56岁，北京人，住海淀区永定路街道，为6月16日确诊病例的密切接触者，14日发病，19日确诊，临床分型为普通型。
病例15，男，22岁，河南人，住丰台区马家堡街道，为6月19日确诊病例的密切接触者，17日发病，19日确诊，临床分型为轻型。
病例16，女，53岁，河南人，住丰台区马家堡街道，为6月19日确诊病例的密切接触者，17日发病，19日确诊，临床分型为轻型。
病例17，男，1周岁，北京人，住丰台区花乡，为6月18日确诊病例的密切接触者，18日发病，19日确诊，临床分型为轻型。
病例18，男，44岁，河北人，住大兴区高米店街道，为6月18日确诊病例的密切接触者，13日发病，19日确诊，临床分型为普通型。
病例19，男，36岁，河北人，住大兴区清源街道，为6月13日确诊病例的密切接触者，18日发病，19日确诊，临床分型为普通型。
病例20，女，24岁，北京人，住大兴区黄村镇，为6月17日确诊病例的密切接触者，14日发病，19日确诊，临床分型为轻型。
病例21，女，47岁，河北人，住丰台区花乡，为6月19日确诊病例的密切接触者，14日发病，19日确诊，临床分型为普通型。
病例22，女，22岁，北京人，住丰台区卢沟桥街道，为6月12日确诊病例的密切接触者，19日发病，19日确诊，临床分型为轻型。
补充通报6月18日晚些时候确诊的4例病例情况：
病例1，男，54岁，广西人，住丰台区花乡，曾经到新发地市场采购，6月15日发病，18日确诊，临床分型为普通型。
病例2，女，46岁，安徽人，住丰台区花乡，为6月18日确诊病例的密切接触者，14日发病，18日确诊，临床分型为轻型。
病例3，女，57岁，黑龙江人，住丰台区南苑乡，曾经到新发地市场采购，6月15日发病，18日确诊，临床分型为普通型。
病例4，女，61岁，北京人，住丰台区花乡，同一小区已报告多名确诊病例，6月15日发病，18日确诊，临床分型为普通型。
北京8家医疗卫生机构负责人被约谈
涉及中日友好医院、北京协和医院等
北京市卫生健康委员会新闻发言人高小俊介绍了北京市进一步加强疫情防控期间医院感染防控情况。
(image_address=""https://x0.ifengimg.com/res/2020/5128D866F3CAC054FF33D4ADDCD0ED9F4C05949D_size50_w1080_h704.jpeg"")
来源：经济日报
高小俊说，根据监督检查发现的问题，6月18日、19日，北京市医疗保障组领导、市卫生健康委领导和市纪委监委驻市卫生健康委纪检组负责人两次召开约谈会，就院感防控工作，对中日友好医院、北京世纪坛医院、北京市慧慈医院、北京永民康医药技术有限公司第一诊所、中国医学科学院北京协和医院、北京大学肿瘤医院、首都儿科研究所附属儿童医院、北京核子华曦医学检验实验室负责人，以及东城区、海淀区、朝阳区、大兴区、平谷区政府分管领导，经济技术开发区管委会领导和市医管中心负责人进行约谈。要求各医疗机构对照北京市院感防控16条措施，认真查找问题、发现问题、立行立改，确保整改到位，各办医主体和属地政府加强监督指导。
北京累计核酸采样229.7万人
集中隔离人员14天期满要再次核酸检测
北京新冠肺炎疫情防控工作领导小组检疫检测工作组副组长、市委组织部副部长张强介绍，6月13日以来，核酸检测工作稳步推进。截至6月20日6时，已累计采样229.7万人。
(image_address=""https://x0.ifengimg.com/res/2020/2B94F514D5A1D969AAE2049F0C744825ED711A0F_size53_w1080_h704.jpeg"")
来源：经济日报
张强介绍，对目前处于封闭管控的40个小区的居民，要求进行居家观察，足不出户，避免交叉感染。对不遵守居家观察有关要求的，统一执行集中观察措施。对所有集中隔离人员14天期满要再次进行核酸检测，结果呈阴性的可解除隔离。
食物会传播新冠病毒吗？
进口生鲜现在能否正常购买和食用？
进口海鲜有新冠病毒存活吗？发布会上，国家食品安全风险评估中心微生物实验室主任李凤琴表示，世界卫生组织早已经明确，经过呼吸道、飞沫传播，和密切接触传播是新冠病毒肺炎的主要传播途径，到目前为止，国内外还没有发现通过食物传播新型冠状病毒肺炎的报道。
(image_address=""https://x0.ifengimg.com/res/2020/5EFE67B4ED94ED9C1E77EEE5E9DCC2B11AFD0D99_size19_w596_h444.jpeg"")
来源：经济日报
第二，包括海鲜在内的所有的食物，不会感染新型冠状病毒，但是可能存在着被新型冠状病毒污染的可能。目前还不能排除低温冷藏的食品和食品包装材料作为病毒的载体造成新型冠状病毒污染环境并引起人类传播的可能。
第三，检验检疫是发现新型冠状病毒的有效手段，目前我国海关对进口的每个批次的食品都要抽样并进行新型冠状病毒的检测。
第四，为了防止新型冠状病毒污染的食品进入食物链，当前加大各个环节的监管力度，加强食品企业的主体责任，这是非常重要的。
进口食品如海鲜、牛排等可否正常购买食用？李凤琴表示，可以正常购买和食用。应该选择新鲜干净的食物；在加工的时候所用的工具以及使用的水应该是干净的。不要在水龙头下冲洗生肉，同时注意食品要生熟分开，防止交叉感染。",2020-06-20 19:05:24,凤凰财经
