,title,content,pub_time,src
0,锦旗门事件反转，八成业主挽留！万科物业：“江湖路远，吾道不孤”,"从“青山绿水，江湖再见”，到“江湖路远，吾道不孤，巍巍青山在，细水长河流”，万科物业锦旗门事件出现反转。
当地社区居委会委托第三方机构以电话征询形式，对宁波中梁首府小区各户业主进行意见征询，结果超过八成业主希望宁波万科物业继续留任履职。宁波万科物业对此十分感谢，表示“留任后将继续努力”。
论规模，万科物业是行业内老大，整体美誉度亦居前列。因此，想换一个比万科物业服务更好的公司，并不是一件容易的事情。如今，宁波中梁首府小区与万科物业摒弃前嫌，继续携手，对行业及各方都是最好的结果。
万科物业留驻宁波中梁首府
据了解，10月21日上午，在骆驼街道、箭港湖社区居委会、区物业主管部门、宁波万科物业、中梁首府小区业主代表、开发商代表、媒体代表、房地产行业相关人士等共同见证下，宁波市镇海区骆驼街道箭港湖社区居委会宣布意见征询结果，超过八成业主希望物业服务方宁波万科物业继续履职。宁波万科物业总经理王超表示，感谢这份多数人的选择与信任，留任后将继续努力。
(image_address=""https://x0.ifengimg.com/ucms/2020_43/050B7708DA81EA9EEB2A9D8DE5451217F1E42469_w1080_h1527.jpg"")
此前的9月5日上午9时许，宁波中梁首府小区几位业主驾车，将小区车行出入口堵死，随后几位业主将印有“干啥啥不行，收钱第一名”的锦旗递交给小区物业服务中心。之后“锦旗门”事件持续发酵，给物业递类似锦旗，成了一种流行做法，在万科物业宁波中梁首府小区之前，全国多个小区都收到业主嘲讽锦旗。
9月13日，宁波万科物业发布致宁波中梁首府业主朋友的一封信，称“鉴于该事件给物业行业造成的负面影响，我们拟向街道与小区业主大会提出申请启动退出中粮首府小区物业服务工作的程序。”万科物业当时表示，时间是检验真伪的试金石，青山绿水，江湖再见。
事件发生后，大部分宁波中梁首府小区的业主希望能够留下万科物业。
据了解，为了解小区业主的真实意愿，9月27日9时至9月29日16时，就“是否由宁波万科物业继续为小区提供服务事宜”，箭港湖社区居委会委托第三方机构以电话征询形式，对各户业主进行意见征询。征询结果为“小区共计730户，已明确表达意愿682户，其中同意587户，不同意60户，随大流23户，弃权12户”，即超过八成业主希望宁波万科物业继续留任履职。该结果以《告业主书》的形式张贴于小区公告栏，自9月30日启动“7个工作日”的公示期，截至10月15日公示期结束。
(image_address=""https://x0.ifengimg.com/ucms/2020_43/81007A7218EBF06250F7BE0CF978D8B95A0392B8_w696_h826.jpg"")
（图：箭港湖社区居委会《中梁首府调访结果反馈建议函》）
宁波房地产资深人士叶巍俊评价道，少数业主激进表态，多数业主理性思考做出选择，最终物业留任，这是万科物业作为行业领跑者的一次成功市场示范。作为为多业权业主提供公共空间服务的企业，物业行业面临的痛点之一是业主达成共识之困难，群体与个体存在利益差则容易产生矛盾。因此物业企业不仅要具备与业主对话、游说的能力，还应具备专业能力，替业主花好钱。
万科物业品牌回归住宅
在此前的9月25日，万科集团合伙人、万科物业首席执行官朱保全宣布万科物业品牌回归住宅，会是以为住宅物业为主、提供高品质服务的品牌。
万科物业在万科营收占比并不高，但行业人士都知道，这是中国物业管理方面的龙头。
万科物业2019年营业收入127亿元，是行业老大。
万科往年财务数据显示，2015年~2019年间，万科物业营业收入分别为29.7亿元、42.60亿元、71.27亿元、97.96亿元、127亿元，营业利润率分别为17.38%、17.22%、16.18%、17.44%、17.96%，对应的营业利润分别为5.16亿元、7.34亿元、11.53亿元、17.08亿元、23.6亿元。
今年是万科物业成立30年，三十而立之际，朱保全再次思考“万科物业的本质是什么”。
在过去十年，万科物业定下“住宅商企、两翼齐飞”的目标，要让万科物业成为既可以做住宅，也可以做写字楼的公司。去年12月12日，万科物业与戴德梁行正式签约，成立新品牌“万物梁行”。“融合10个月以来，万物梁行业务已覆盖149城、拓展新项目超140个，共服务项目超1140个，管理面积超1亿平方米，商写物业领域规模在大中华区处于绝对领先地位且还在扩大。”万科物业稍早之前对外透露的数据显示。
“因为万物梁行和城市物业已具规模，万科物业聚焦住宅物业，将成为以住宅物业为主，提供高品质服务的一个品牌。”朱保全之前宣布，“也就是万科物业走过了30年，从住宅物业到商企物业到城市物业，三驾马车形成以后，我们要让品牌重新回归到住宅。”
“物业的本质是替业主花好钱。物业和基金管理人（GP）一样。”朱保全认为，如果能花好钱，让业主满意，那么提高的物业费就是超额的纯收益，这是其他行业无法媲美的。“物业能在资本市场获得20-30倍的市盈率，我觉得已经超过了很多行业。”
在10月17日万科北方媒体交流会上，万科董事会主席郁亮表示，万科物业一定会上市，但时间还没想好。郁亮说，万科能够上市的业务都应该上市，接受市场考验，最担心的是大家对资本的热潮迷失了初心。
相较于之前“刻意让物业板块与资本市场保持距离”的表述，万科在物业业务是否上市的态度上已经发生了明显的变化。
当前，多家房地产企业已经分产物业板块登陆资本市场，包括碧桂园服务、保利物业、雅生活等，恒大物业分拆上市事宜也在推进之中。",2020-10-23 12:59:49,凤凰财经
1,PayPal将支持加密货币交易  比特币突破1.3万美元,"比特币价格迎来2020年最高价格。
2020年10月21日晚，比特币价格骤升，根据币价网站CoinmarketCap数据，比特币一度突破13000美元大关，最高达到13184.39美元，随后有所滑落。截至发稿，比特币价格约为12870美元，24小时内涨幅达5.99%，24小时内比特币成交额为411.37亿美元。
(image_address=""https://x0.ifengimg.com/ucms/2020_43/5E4C56DDD282A31EAA403625A4A386008E5F0529_w1344_h798.jpg"")
24小时内比特币价格走势
截至发稿，合约帝行情统计报告显示，过去1小时比特币全网总计爆仓434万美元，24小时比特币全网爆仓4.09亿美元，爆仓人数23161人。
实际上，自7月26日突破10000美元后，比特币价格曾在半个月内快速冲破11000美元和12000美元，又在9月初骤降至10000美元出头，此后呈现波动上升的趋势。直到昨日，又再次突破12000美元，今日早晨一度站上13000美元。
(image_address=""https://x0.ifengimg.com/ucms/2020_43/91FB17D54D1E7894E49D97E836E131A1D7D5DE19_w1335_h826.jpg"")
近三个月比特币价格走势
此轮上涨行情的背后，有哪些原因？
PayPal宣布将允许用户使用加密货币
OKExResearch首席研究员William表示，从基本面上看，比特币上涨的直接原因是昨日PayPal宣布将允许用户在平台上购买、销售和持有加密货币。
币安研究院研究员也指出，从消息面上来看最重要的利好就是纽约州金融服务部向PayPal授予了BTC的许可权。
10月21日，据路透社报道，支付平台PayPal发布公告称将推出加密货币支付方式，用户将能通过PayPal账户买卖、持有加密货币，并且能在全球2600万家商户进行购物。
William认为，PayPal是目前全球使用最广泛的网上支付工具之一。如果说支付宝是中国的，主要支持人民币结算；那么PayPal就是全球性的，支持美元、欧元和日元等25种国际主流货币，在全球跨境电子商务第三方结算与支付平台中占有很大的市场份额。这不仅仅将为比特币带来在PayPal2600万商户进行购物支付的应用场景，更重要的是意味着以比特币为代表的加密数字货币正在被主流商业界所认同，因此对于比特币而言是一个绝对的利好，所以昨日比特币创下了新高。
火币研究院高级分析师康律之则表示，昨夜的上涨没有什么特别的原因。从正常周期观测，比特币减半行情一直没有真正到来，所以此次价格突破前高在情理之中。随着加密数字货币市场受到越来越多的关注，大量机构巨资持有比特币，但是比特币每日的新增供应量已经减半，通胀率随着减半进一步减少，供应量出现上限。
“因此比特币突破前期高点，甚至之后达到历史高点，都是有可能的。”他说。
美元贬值与美股增强
从宏观经济角度来说，币安研究院研究员认为，美元对于人民币已持续贬值，“国内虽已出台相关政策调节期待稳定人民币兑美元汇率，但持续的美元贬值使得国内大量持有USDT的用户进行BTC的购买以达到资产保值的目的。”
除此之外，他还认为前段时间的美股走强也间接提升了资本市场的风险偏好，从而带动资本以及机构对于BTC作为另类资产的投资，引发BTC的上涨。
或与央行数字人民币研究热潮相关？
近期，央行数字货币热潮不断高涨，中国的数字人民币也在上周进行了深圳的数字人民币红包试点。
此轮比特币上涨是否与全球空前高涨的央行数字货币研究热有关？
康律之表示，近期，虽然监管逐步趋严的，但比特币价格并没有受到很大的影响，仍然持续保持高位。实际上从各国政府以及相关机构近段时间透露的信息与频频动作中不难看出，CBDC和区块链正在逐步升温，这导致CBDC以及与其强关联的比特币等一系列加密数字货币也同样被拉回公众视野，受到更多投资机构关注。
此外，他也提到，昨天晚间全球知名支付商PayPal宣布，其在线钱包支持买卖比特币及其他加密数字货币，这一消息对市场产生了很强的刺激。传统支付商对于加密数字货币的支持为市场带来了新的活力和资金助力，这可能是PayPal对CBDC等一系列新型数字货币布局的第一步，也昭示着以PayPal为代表的系列传统支付机构对加密数字货币的认可，代表着比特币等相关的加密数字资产正在逐步被世界认同，市场可能会开启新一轮的繁荣。
“客观来说，央行数字货币热潮并非是导致此轮比特币上涨的主要原因。”币安研究院研究员持相反态度。
他表示，每次央行数字货币相关消息露出，都被大家认为是一种利好，比如本次央行数字货币试点红包发放，实际上这些进展是大大有利于于我国金融层面开展更有效的支付系统、加强货币政策等方面起到良好的作用，对于比特币而言并没有直接利好关系。
不过，他也认为，央行数字货币的推行将使更多用户了解电子支付，进而学习区块链技术，更多人将加入到这项新兴产业的大热潮中，对整个行业而言无疑是很大的推动。同时，央行数字货币的一些进展和国家扶持政策等也可以反应出国家政府对于区块链技术的态度，目前来看整体态势还是较为积极和正向的。",2020-10-23 12:22:24,凤凰财经
2,“钱多多”涉嫌非吸被立案侦查，已查封涉案房产350余套,"P2P平台“钱多多”遭立案侦查。
10月21日，据上海市公安局浦东分局官方微信公众号“警民直通车浦东”发布，近期上海市公安局浦东分局根据投资人报案，对上海旭胜金融信息服务股份有限公司(以下简称“旭胜公司”)以涉嫌非法吸收公众存款罪立案侦查。而旭胜公司运营的网贷平台名为“钱多多”。
上海市公安局浦东分局表示，截至目前，公安机关已依法追缴现金1100余万元，查封涉案房产350余套，并冻结相关银行账户。追赃挽损工作仍在全力进行中，最终清退将由法院依法进行。公安机关已获取“钱多多”平台相关数据，同时聘请专业司法审计机构对每位投资人的投资及出借资金进行确认，并追查资金去向。
(image_address=""https://x0.ifengimg.com/ucms/2020_43/57F128B02DAFC97DF48CC53582802058AA853587_w1080_h2250.jpg"")
上海市公安局浦东分局发布的警情通报
对“钱多多”平台已出借的资金，上海市公安局浦东分局要求对外岀借资金所涉借款人将还款本息依法汇入公安机关指定的涉案赃款退款账户，未及时还款的，公安机关将依法予以追缴。
对于此案非法集资行为人(包括“旭胜公司”及其关联公司高管、部门主管、理财经理、业务员及其他为募集资金提供帮助人员)，上海市公安局浦东分局告诫，自通报发布之日起，应立即前往该分局经侦支队全额退缴所获佣金、提成、返点等非法所得，或将非法所得依法退还至公安机关指定的涉案赃款退款账户。对于构成非法集资犯罪且拒不退缴赃款的，公安机关将依法追究刑事责任。
钱多多平台官网信息显示，旭胜公司成立于2013年8月23日，旗下品牌——钱多多（D.com.cn）于2013年10月8日正式上线，是一家提供融资需求撮合业务的互联网金融企业，2014年12月在上海股权托管交易中心E板挂牌。注册资金1.1亿元，实缴资金1.1亿元，现有员工百余人，总部位于上海浦东新区自由贸易区。
早在2年前，2018年9月19日，钱多多就发布了“告钱多多全体出借人书《平台业务调整公告》”，宣布暂停平台业务，制定整改计划待备案细则切实落地后视平台情况再提交相关备案申请。
同年10月18日，钱多多发布《平台业务调整暨兑付方案》，承诺将完成全部待收本金约17.75亿100%兑付，兑付期限为21个月，到2020年7月15日为止。并提供现金兑付方案，不动产兑付方案以及特殊兑付方案，特殊兑付方案又包括债权转让、小额优先兑付、逾期和展期的待还本金和利息三种。
不过，根据官方数据，钱多多的原始债权金额约17.75亿元，原始出借人数11846人。截至10月22日，兑付进度的总体兑付比例仅为17.52%（现金+已过户房产+其他物），剩余待兑付金额达12.06亿，剩余出借人数为7479人。",2020-10-23 12:21:08,凤凰财经
3,恒生指数午盘收涨0.62%报24938点 中海油(00883)升6%领涨蓝筹,"凤凰网港股|港股今日强势上行，恒指高开后震荡向上，延续近期震荡走强的格局，截至午间收盘，恒生指数涨152.72点，涨幅0.62%，报24938.85点，国企指数涨64.34点，涨幅0.64%，报10149.52点，恒生科技指数跌1.13%报7534点。
蓝筹股涨幅榜中，中国海洋石油(00883.hk)涨6.154%，报7.59港元，成交额3.89亿港元、中国石油化工股份(00386.hk)涨5.333%，报3.16港元，成交额3.2亿港元、中国石油股份(00857.hk)涨5.093%，报2.27港元，成交额2.49亿港元、汇丰控股(00005.hk)涨3.84%，报32.45港元，成交额11.48亿港元、恒生银行(00011.hk)涨3.643%，报119.5港元，成交额3.54亿港元。
保险板块涨幅最大，行业平均涨幅：1.800%；中国太平(00966.hk)涨7.179%，报12.540港元、中国太保(02601.hk)涨4.272%，报26.850港元、新华保险(01336.hk)涨4.207%，报32.200港元、中国财险(02328.hk)涨3.041%，报5.760港元、中国人寿(02628.hk)涨2.682%，报19.140港元。
银行板块涨幅居前，行业平均涨幅：0.974%；汇丰控股(00005.hk)涨3.840%，报32.450港元、中国光大银行(06818.hk)涨3.806%，报3.000港元、恒生银行(00011.hk)涨3.643%，报119.500港元、大众金融控股(00626.hk)涨3.390%，报1.830港元、民生银行(01988.hk)涨2.733%，报4.510港元。
石油与天然气板块获得追捧，行业平均涨幅：0.525%；金禧国际控股(00091.hk)涨14.198%，报0.185港元、延长石油国际(00346.hk)涨9.091%，报0.036港元、中国海洋石油(00883.hk)涨6.154%，报7.590港元、中国石油化工股份(00386.hk)涨5.333%，报3.160港元、中国石油股份(00857.hk)涨5.093%，报2.270港元。
零售业板块亦有不错表现，行业平均涨幅：0.504%；先施(00244.hk)涨17.241%，报0.340港元、中国汽车新零售(00526.hk)涨12.500%，报0.135港元、广州基金国际控股(01367.hk)涨8.750%，报0.435港元、和谐汽车(03836.hk)涨7.921%，报3.270港元、中升控股(00881.hk)涨6.754%，报56.900港元。
邓声兴表示，美股周四表现反覆，市场续等待刺激经济方案推进。道指曾挫170点，全日低见28040点，其后反弹，曾升210点，收市升152点，报28363点。纳指升0.19%，报3453点及11506点；亚太股市今早个别发展。日股最新升19点，报23494。中港市场下周一假期休市，港股维持观望气氛。
免责声明：本文不代表凤凰网港股立场，不作为投资依据。投资有风险，入市需谨慎。",2020-10-23 12:18:08,凤凰财经
4,银行同业存单被迫提价发行 有股份行通知存款“一浮到顶”,"“城商行（同业存单）方面，不少机构在提价到了3.19%-3.20%才有买盘青睐。”10月22日，一位货币市场交易员向21世纪经济报道记者表示。
近期存单到期压力较大，一些银行同业存单选择提价发行。多位市场人士表示，同业存单一级发行利率继续上行，虽然已超3%，但到期高峰也将至。并且，随着结构性存款持续压降，同业存单利率居高不下，银行负债端成本承压。
同业存单已成为银行负债端来源的重要手段，2020年同业存单到期量将达18.16万亿元，比2019年全年到期量多逾1万亿元。根据Wind统计，截至10月22日，同业存单发行规模已达14.59万亿元。
而在本周，有7113亿元同业存单到期，创2018年9月以来新高，叠加缴税和国债发行等，流动性面临一定压力。
但降准或不会到来。今年，中期借贷便利（MLF）操作利率、贷款市场报价利率（LPR）连续6个月按兵不动。市场分析认为，以降息降准为代表的总量宽松或将不再加码。
特别值得注意的是，时隔多日之后，央行重提货币总闸门。
10月21日，中国人民银行行长易纲在2020金融街论坛年会上指出，货币政策需把好货币供应总闸门，适当平滑宏观杠杆率波动，使之长期维持在一个合理的轨道上。
一位券商首席策略分析师表示，5月中旬以来，DR007显著反弹回到公开市场操作大致2.2%的水平，AA级别同业存单从5月最低2%大幅提升到目前3.46%。显示中小银行流动性告急，并实际影响了部分信用融资，也导致了长端利率持续上行。
但其认为，向前看，货币政策很难再进一步收缩，更大可能性是维持当前紧平衡的状态，以保证融资环境相对健康，比如债券和贷款发行规模较大的时候，央行可能会相应多释放MLF，反之则少释放。
在此情况下，已有股份制银行提高通知存款利率，以增加存款来源。记者获悉，华南某股份制银行的通知存款按央行通知存款利率上浮50%，其中7天期通知存款利率已上浮至2.025%。
同业存单量价齐升
“近期存单到期压力较大，发行方纷纷选择提价发行。”10月22日，一位货币市场交易员表示。
例如，3个月期限同业存单利率10月22日再创新高，中行在2.95%位置便募到了量，随后股份行提价来到2.98%，城商行只能发在3.09%-3.10%。6个月期限同业存单同样提到价格新高，股份制行以及大行最高提到了3.08%。城商行方面，不少机构在提价到了3.19%-3.20%才有买盘青睐。1年期期限，股份行和大行10月22日均提价1BP到了3.16%，但募集量不及短期限，不少买盘对于长期限存单依旧持观望态度。
今年以来，银行发行的同业存单利率先跌后升，走出深V形，反超MLF利率，但发行量不减反增。
上半年，受新冠肺炎疫情影响，在流动性大幅宽松下，同业存单收益率在今年快速下行。以1年期AAA级同业存单加权平均收益率观察，4月初创下1.6%的历史新低，随后随货币政策收紧而收益率大幅反弹，6月5日突破2%，8月28日超过1年期MLF利率2.95%。截至10月22日，1年期AAA级同业存单收益率报3.09%。
2020年四季度，预计同业存单到期总规模约5.3万亿元。其中，10、11、12三个月分别有1.90万亿、1.76万亿和1.62万亿同业存单到期。从不同主体同业存单的到期量来看，四季度六大行共计到期同业存单规模近1.13万亿元，股份制银行共计到期同业存单规模约1.91万亿元，城农商行共计到期同业存单规模约2.24万亿元。
光大证券首席金融业分析师王一峰认为，今年结构性存款“压量控价”和同业存单“量价齐升”现象同时出现，存款市场与资金市场利率罕见“并轨”，其背后是同业协同以及监管驱动共振所致。“银行对中长期稳定资金需求较为旺盛，使得结构性存款与同业存单形成了‘跷跷板’效应，推动了量价齐升。”
结构性存款曾一度成为商业银行“揽储利器”。今年6月份，监管部门对部分银行进行窗口指导，要求结构性存款规模在2020年9月30日之前压降至年初规模，并在今年年底前逐步压降至年初规模的三分之二。
根据央行数据，9月末，中资银行结构性存款规模为8.98万亿元，相比8月末压缩了4450.81亿元，环比下降4.72%，也是自2019年以来首次低于9万亿元。今年结构性存款1-4月连续回升后，至4月末达到历史峰值。不过5月后连续5个月下降，主要因为监管部门要求商业银行压缩结构性存款，中小银行是此轮结构性存款压降的主力。
压降结构性存款，是降低融资成本的重要一步。但在此过程中，压降规模较大的银行失去稳定的长期资金，进而只能通过同业存单、金融债等方式来补充负债端来源。但同时，同业存单不计入一般性存款，在流动性指标等约束下，中小行争夺存款的力度仍然激烈。
东兴证券分析师张怀志表示，压降结构性存款使银行流动性趋紧，同业存单规模的快速增长，在一定程度上弥补了结构性存款压降和一般存款增长缓慢的问题。
今年流动性“易紧难松”
业内人士称，面对同业存单集中到期，迭加结构性存款压降、缴税和大额国债发行的压力，银行难以从根本上解决缺长钱的问题，预计11月前流动性都处于“易紧难松”的状态。
“量价齐升”的同业存单未来是否还会继续走高？王一峰认为，结构性存款与NCD的跷跷板效应仍将延续，“NCD发行需求依然旺盛，NCD利率年内难有明显回落空间”。
具体来看，量方面，9-12月份同业存单月均净融资额有望维持在1500亿-3000亿元水平。价方面，同业存单价格已现企稳迹象，但在结构性存款与同业存单“跷跷板效应”下，同业存单价格下行空间有限，1年期同业存单将大概率维持在2.8%-3.1%区间，MLF利率将成为同业存单的基准锚。
华泰证券固收团队发表的最新观点也认为，银行结构性存款压降仍将继续，加上同业存单到期高峰期，发行压力仍不小。同业存单向下以一年期中期借贷便利（MLF）利率2.95%为下限，向上的高度取决于MLF能否持续放量。
对于银行接下来的资产负债配置策略，张怀志称，过了10月份，银行的流动性承压相对来说会有所缓解，一是债券发行高峰已经过去，负债端压力减小。二是超储率会有一个季节性抬升。
王一峰认为，下半年银行综合负债成本有望改善，净息差具有稳定基础。一是各类存款产品与结构性存款的价差收窄，核心存款增长有望出现反弹；二是NCD、金融债等中长期稳定负债的吸收仍有必要；三是高质量核心存款增长将更加受到银行重视。",2020-10-23 12:16:50,凤凰财经
