,title,content,pub_time,src
12,挖掘机涨价潮释疑：基建赶进度，配件存断供风险，价格战难以为继,"“部分产品短期内供不应求，3月总收入创下了新高，但我们预计4月的销售极有可能会超过3月。”
徐工挖掘机市场销售人员李建告诉21世纪经济报道，进入3月后，其物联网平台上统计的挖掘机工作时间同比大增30%，市场销售一片火热。
被视作基建行业风向标、乃至经济晴雨表之一的挖掘机销售正在快速升温，今年3月，国内挖掘机销量达4.94万台，同比增长11.6%，刷新历史新高，而在此前的1月和2月，挖掘机月销量均未超万台。
同时，工程机械行业正迎来一轮“涨价潮”，近日中联重科、三一重工、徐工、柳工、临工、山推等几乎所有国内厂商都加入了涨价大军，泵车、挖掘机、起重机、推土机等诸多产品也纷纷上调价格。
受访人士指出，3月销售“新高”是在前期低谷基础上的恢复性回补，在建项目密集复工支撑了工程机械的销售升温，而稳增长背景下，今年的基建投资有望持续加码，达到20万亿，工程机械国内销量可能大幅超出市场预期。
涨价的另一个重要原因在于，海外疫情蔓延带来了工程机械零部件供应压力，供应链成本上升，发动机、油缸、传感器等部分依赖进口的零件面临断供风险。
疫情带来的需求旺盛以及供给不确定性或将为连年的价格战画上了休止符。不过，在经历多年激烈的价格搏杀之后，各个厂家收紧商务政策是当务之急，是否会真正大幅涨价仍有待观察。
赶进度带来挖掘机销量“新高”
据中国工程机械工业协会统计，今年3月，国内25家挖掘机企业总销量达4.94万台，创下了历史新高。而在过去的1月和2月，单月销量都没有超过一万台，
进入3月，多数企业销售一片火热：当月，三一重工一家的挖掘机销量即达1.28万台，同比增长14.2%；徐工销量8403台，增长34.7%；山东临工销量4102台，增长55.2%；柳工销量4096台，也增长了24.7%。
中国工程机械工业协会副秘书长吕莹告诉21世纪经济报道，3月销售数据确实亮眼，略微超出预期，但总体仍在情理之中。
“首先这有季节性因素，挖掘机每年都是3月卖得最好，买早了的话，假期期间开不了工，土也冻着；买晚了的话，就会影响进度。”
他强调，应当注意3月的“新高”在很大程度上是前期低谷的恢复性回补，一季度的销售增速仍然为负值，“今年2月，国内挖掘机销量同比大幅下降50.5%，1月份也下降了15.4%，从季度数据上看，一季度累计销量也同比下降了8.2%。”
他介绍，受疫情影响，2月很多项目处于停工状态，不少采购商把交货期推到了3月，我们预计这一情况会延续到4月份，进而抬高4月的销售数据。
李建的经历印证了这一点，“从1月下旬开始，徐工的挖掘机的销售开始受到疫情的抑制，整个2月销售惨淡，进入3月，随着复工的推进，被压抑的需求开始集中释放。”
他介绍，根据徐工的汉云物联网平台数据，1-2月尤其是2月的开工数据大幅下滑，但到了3月份，开工率明显上升，挖掘机平均工作时间更是增长了近30%。
中联重科的大数据也给出了类似的信号，其销售人员晋先生告诉21世纪经济报道，连接着近28万台工程机械设备的物联网平台中科云谷提供的数据显示，3月以来，各地工程复工明显加速，目前，国内工程设备的开工率已恢复至疫前水平。
尽管4月销售数据尚未公布，但李建认为，4月份徐工的销售极有可能会超过3月，“这是以往任何年份都没出现的一个情况，受疫情影响，传统的3月份旺季会整体后延，4月极有可能会再创一个新高，至少不比3月份差太多。”
他表示，3月加速复工之后，预计4月将迎来房地产及市政工程的全面复工，周期偏后的混凝土机械和起重机有望迎来较高增速。
徐工董事长王民近日指出，“2月份，徐工营业收入比去年下降了18%，3月全国各地正加快复工复产，对工程机械的需求不断增大。机不可失，现在要‘高产满产’，尽快满足市场需求。”
基建加速，挖机销售或超预期
挖掘机“大卖”是否释放了“中国基建正在加速启动”的信号？
吕莹认为，提振3月销售的主要是在建项目的复工，而非新开工项目的上马，相较后者，前者周期更短，他预计后期国内新项目开工会明显加速，但很多项目需要必要的审批流程，资金到位也需要一定时间。
李建认为，在稳增长需求下，今年基建投资力度有望持续加码。“今天（20日）财政部又要提前下发1万亿的地方专项债，用于地方基础设施建设，今年经济压力很大，以基建为主的投资是三驾马车里难得的动力源。”
截至3月末，全国各地共发行1.08万亿元新增专项债券，发行规模同比增长63%，且投向基建领域的比例大幅提升。
中信建投机械团队吕娟预计，2020年中国基建投资或达19.28万亿元，同比增长5.89%，“同样的投资额，在10.5个月工期背景下拉动的工程机械需求要高于原先的11.5个月工期产生的需求，因此，2020年工程机械国内销量会大幅超出市场的预期。”
国元证券研究预计2020年挖掘机行业增速约10%，起重机行增速将超10%，同时2020-2022年三年是泵车替换高峰，预计未来每年更新量在7000-8000台左右，而2020年混凝土机械销量增速有望达20%。
“旺季可能会迟到，但不会缺席。我们预计2020年，机械工业运行将呈现前低后高、逐步回升的走势。”中机联执行副会长陈斌近日表示。
“涨价潮”背后的进口件断供隐忧
与此同时，工程机械行业正在掀起一轮轰轰烈烈的“涨价潮”。
4月2日、4月9日中联重科、三一重工相继将泵车价格全面上调5%-10%，随后多家工程机械主机厂商纷纷跟进。
截至发稿，工程机械行业的中联重科、三一重工、徐工、柳工、临工、山推、玉柴、雷沃、山河智能等企业纷纷上调了部分产品价格，涨价的范围囊括了泵车、挖掘机、起重机、推土机、装载机静压桩机、平地机等诸多品类。
涨价幅度上，大部分企业小挖提价10%、中大挖提价5%，装载机提价3000-10000元不等，推土机与平地机涨价2-5万元不等，起重机价格上调5%-10%，此外，千里马供应链配件、维修服务费也上调了10%。
(image_address=""https://x0.ifengimg.com/ucms/2020_17/A3C30AD59A49F530FA36893046BCE34B893EFBB4_w547_h401.jpg"")
(image_address=""https://x0.ifengimg.com/ucms/2020_17/5AB89BF4921105BBDDD31DA21AAC3EB7621FE9EF_w547_h250.jpg"")
吕莹介绍，小型工程机械提价幅度较高，这是因为其单价较低，比如，一般大挖价格在200万左右，而小挖只有十几万，市场回暖行情下，其价格全线上涨。
李建表示，3月销量迅速回升给了挖掘机等厂商涨价的底气，而短期内部分产品供不应求也推动了价格的上涨。
华创证券指出，疫情压缩工期，放大了基建、地产投资对工程机械需求的拉动作用，加之扩内需政策加码，导致3月中下旬以来国内需求快速回升，工程机械企业持续超负荷生产，多种机型供不应求，涨价并不是短期行为。
中国社科院工经所市场与投资副主任江飞涛近日接受21世纪经济报道采访时指出，近日工程机械涨价的一个重要原因是，海外疫情蔓延带来了工程机械零部件供应的压力，供应链成本上升，部分零件面临断供的风险。
三一重工泵送事业部就涨价发布《敬告客户书》时也曾表示，由于海外新冠疫情蔓延，欧洲重卡底盘厂商相继宣布停工或减产，泵车进口底盘资源短缺，是涨价的重要原因。
“近期国外不少配件无法按期供货，部分已经开始断货，欧洲的供应商也给我们企业发信息称，能供货的下个月也存在断供风险。不少厂家预测后期供货能力上存在问题，所以会选择提前涨价。”吕莹解释称。
他介绍，从数额上来看，进口零部件占工程机械整机的比重并不大，但这主要集中在发动机、液压件、控制元件等关键环节，往往缺少一个部件就导致整机无法出厂。
徐工集团备件监督管理部一位负责人向21世纪经济报道介绍，进口件在徐工产品中的比重大概在15%左右，主要集中在中大吨位的产品上，涉及发动机、油缸、阀锁、传感器、电器件等产品，“很多产品是整个国家都面临的‘卡脖子’问题，比如大马力的发动机，整个国内发动机都不行，需要进口。”
这位负责人表示，目前徐工尚未出现零部件断供的情形，“进口物料的采购是长周期的，现在生产所需的物料在去年六七月份就已定好了，我们的库存也至少能满足半年以上生产，所以短期之内还不会有影响，但是如果海外疫情持续半年以上，肯定是会受影响的。”
三一重工一位负责人也指出，三一的核心零配件90%以上已实现国产化，自建了从发动机、油缸、泵阀马达、到底盘、四轮一带，甚至高强度钢板的全链条核心零配件公司。但挖机还是需要外采美国康明斯发动机，德国博世力士乐的马达等产品，泵车也需要奔驰、沃尔沃、日野的进口底盘。
吕莹指出，进口件大多是国内难以替代的核心零部件，在短期之内寻找国内供应存在难度，但如果海外断供风险持续上升的话，或将加速本地化替代的进程。
恶性竞争暂缓，涨价能否落地存疑
在李建看来，断供风险并非工程机械全线涨价的直接原因。
“如果是进口件占比特别大的产品，比如说泵车要用奔驰的底盘，成本也主要在底盘上，其涨价还可以接受。但所有工程机械全线涨价就很难用采购吃紧来解释了。”
他认为，工程机械全线涨价所传递的一个信号是，在经历连年价格战之后，行业内龙头企业号召企业停止恶性竞争，加强风控，至于这些产品是否真的会去涨价，则仍待观察。
“涨价最先是由三一等龙头企业发起的，其他厂家更多是被动跟随，但在需求回暖的这个时间点，调价政策一窝蜂地集中释放了出来，这传递了一个不再降价的信号。至于涨价，没有人会真涨，也没有人敢真涨。”
李建解释，之所以如此，是因为工程机械经历了长期的价格战，商务政策放得非常宽松，如果整机厂商亟需提高利润空间的话，最合理的是先把商务政策收紧，而非涨价。
“在你的产能达到极限的情况下，涨价只会带来更多的应收账款，账面盈利会增加，但在你收到现金之前都是虚的，如果具备条件的话，厂商更急迫的是收紧商务政策，比如说增加首付比例，或者缩短分期年限。”
吕莹也认为，在经历多年激烈的价格搏杀之后，各个厂家是真涨价还是假涨价仍不好下结论。
一位挖掘机代理商告诉21世纪经济报道，无论是挖掘机，还是装载机、起重机，没有哪一家厂家敢轻易地真正涨价，但在供不应求的背景下，价格战可能会告一段落。
他表示，很多品牌对市占率考核十分严苛，代理商的年终考核也与此挂钩，有些品牌在同一个省份就有三五家代理商，有些品牌宁可不赚钱也要抢夺市场占有率，而降低商务政策是扩大市场占有率的重要手段，于是品牌之间、代理商之间连年混战，如火如荼，不少代理商推出了“零首付”、“卖整机送配件”、“终身免费维修”等激进的商务政策，使得工程机械行业利润薄如纸片。
一同崛起于长沙的中联重科与三一重工更是在几乎所有领域激烈搏杀。行业内熟知的一个案例是，中联重科此前交付深圳的63米斯堪尼亚泵车报价420万元，而三一的销售则把价格直接杀到300万元。
中国是世界上最大的工程机械单一市场，也是竞争最激烈的市场。工程机械行业的恶性竞争由来已久，去年中国工程机械工业协会挖掘机械分会发布的《中国挖掘机械行业市场不当竞争风险提示函》明确提到，部分企业盲目追求市场占有率，商务政策存在严重过度竞争倾向。
李建表示，疫情所带来的需求旺盛以及供给不确定性风险将为连续多年的价格战与恶性竞争画上一个休止符，“工程机械涨价更多是部分产品供不应求背景下的价格回归，而各厂商是否会真的涨价，将取决于新开工项目上马的数量，也取决于全球疫情持续的时间。”",2020-04-21 21:10:52,凤凰财经
13,个股活跃！今天出现6连板股票，下一个会是谁？,"(image_address=""https://x0.ifengimg.com/ucms/2020_17/0F57CC8F4E0F4BBC08E047519E4BAAB23E3B54D1_w1080_h460.jpg"")
本周前两个交易日，虽然大盘指数上攻遇阻，但个股活跃度已明显提升。反映在盘面上，两市连板个股家数开始增多。
今日，特高压概念股国电南自股价全天宽幅震荡，尾盘急速拉升成功封死涨停，日线收获6连板。这是近10个交易日内，两市首只收获6连板的股票。
(image_address=""https://x0.ifengimg.com/ucms/2020_17/BC21FFE4FBFF48C122649A54B13332E8CFE7266B_w579_h853.png"")
国电南自日线走势
国电南自是近期基建板块热度升温的缩影。除了国电南自之外，近期4连板的建研院，3连板的新筑股份，两连板的梅轮电梯等，均与基建题材相关。
(image_address=""https://x0.ifengimg.com/ucms/2020_17/B907463FE10E56ED4AD6D16DFDE0FA85B99E549B_w577_h864.png"")
建研院日线走势
散户、游资疯抢基建股
今日盘后，交易所披露了国电南自单日榜单，买卖前五全部由券商营业部构成。两家个人投资者聚集的西藏东方财富证券席位分列买入前两位，买入金额分别为1715.49万元和1653.47万元。一线游资国泰君安证券南京太平南路营业部位居买三，买入1169.04万元。
(image_address=""https://x0.ifengimg.com/ucms/2020_17/86E336EC26B0FD3D5FA99F4CCE49514A24D26D3D_w1080_h416.png"")
国电南自今日龙虎榜
建研院今日龙虎榜游资云集。国泰君安证券南京太平南路营业部再度现身，高居买一位置，买入金额1355.07万元。中国中金财富证券无锡清扬路营业部、海通证券蚌埠中荣街营业部分别买入939.95万元和678.43万元。
(image_address=""https://x0.ifengimg.com/ucms/2020_17/4582106D0ED2DE3D28E177883E9ACD677DDA1547_w1080_h422.png"")
建研院今日龙虎榜
中国西电、交建股份、梅轮电梯等今日龙虎榜中，买卖前五同样全部是券商营业部，并未出现机构或沪深股通席位。
多股提示交易风险
尽管在游资踊跃进场的带动下，相关基建股股价短线内连续涨停，但公司方面发布的风险提示仍然不容忽视。
4月17日，国电南自发布公告，提醒投资者理性投资，注意交易风险。国电南自介绍，2019年公司充电桩业务订货金额约5.50万元，特高压交流输变电工程订货金额约636.81万元，充电桩、特高压业务不会对目前经营业绩产生重大影响。此外，截至2020年4月17日，国电南自市盈率为124.38倍，电气机械及器材制造业行业市盈率为23.74倍，显著高于同行业市盈率水平。
(image_address=""https://x0.ifengimg.com/ucms/2020_17/03127973C388877776DD80A742B330177F17CF3A_w912_h364.png"")
截自国电南自《风险提示公告》
新筑股份日前发布《股票交易异常波动公告》，提示公司2018年从德国马克斯•博格公司引进的内嵌式中低速磁悬浮系统全套主要核心技术目前处于消化吸收阶段。此外，公司2019年实现归属于上市公司股东的净利润-1.83亿元，同比大幅度减少，整体经营质量较差。
(image_address=""https://x0.ifengimg.com/ucms/2020_17/E934BB5FDDFA893ECBDD76862D1390D4520DE7B8_w932_h194.png"")
截自新筑股份《股票交易异常波动公告》
6连板成为近期强势股瓶颈
自3月12日海特生物狂揽10连板后，在近一个多月的时间内，两市再也没有出现一只7连板的股票，6连板俨然成为短线强势股的瓶颈。
3月16日，熔喷布概念股顺威股份日线收获6连板。次日，顺威股份股价急转直下遭遇跌停。
(image_address=""https://x0.ifengimg.com/ucms/2020_17/7C243FE58F76E992817BA98594B56B8C29573850_w560_h838.png"")
顺威股份日线走势
4月7日，新能源汽车概念股继峰股份日线收获6连板。次日，继峰股份股价高开低走遭遇跌停。
(image_address=""https://x0.ifengimg.com/ucms/2020_17/28E837BA07BBD8EABFE79B61C3A62B580B5D6EFD_w602_h903.png"")
继峰股份日线走势
同样是4月7日，粮食板块金健米业日线收获6连板。次日，金健米业股价一度逼近涨停，但此后遭遇大量获利盘打压，最终仅收涨4%，全天成交额创出历史新高。
(image_address=""https://x0.ifengimg.com/ucms/2020_17/5E4A780D3B1EFA90353E22D4A1C04BE44D3AA687_w620_h927.png"")
金健米业日线走势
值得一提的是，截至目前，上述3只股票最新收盘价均较当初6连板时的价格出现回落。其中，顺威股份最新股价较高点回撤达36%，继峰股份回撤28%，走势相对较强的金健米业也回撤近6%。
由此来看，对于这些短期连续涨停的个股而言，投资者若盲目追涨，面临的风险极大。",2020-04-21 21:05:51,凤凰财经
