,title,content,pub_time,src
3,全年卖地收入再次冲击7万亿，概率有多大,"在历经新冠肺炎疫情和经济下滑双重冲击之后，国内房地产市场逐渐回暖，热点城市的土地市场升温也比预期来得更快些。
全国土地出让收入有望维持去年水平，甚至再度冲击新高。
财政部数据显示，今年上半年全国国有土地使用权出让收入28129亿元，同比增长5.2%。而在今年1~2月份，这一数据还是同比下降16.4%。由此可见，最近几个月土地市场的升温势头十分明显。
7万亿土地出让收入是什么概念
从历史数据梳理可以发现，在全年土地出让收入总额中，上半年的贡献一般在三四成左右，大头一般是在下半年。
例如，2019年上半年这一数据是26738亿元，比2018年同期的26941亿元还略少一些。但2019年下半年创收45779亿元，将全年数据推高至72517亿元的历史新高。
(image_address=""https://x0.ifengimg.com/ucms/2020_32/A5B99DBF612BBE4B250BDB1100B1B92C35D84055_w901_h623.jpg"")
7万亿元是个什么概念？纵向看，1995年全国土地出让收入仅约400亿元；横向看，2019年全国地方一般公共预算本级收入约10.1万亿元。
虽然今年上半年土地出让收入5.2%的增速并不十分亮眼，但28129亿元的规模已创下同时间段历史新高。如果土地市场不出现大的转折性变化，全年土地出让数据维持在六七万亿元高位水平上的可能性很大。
土地市场回暖的另一个表现是，土地流拍现象减少，楼面地价逐渐上涨。
市场机构诸葛找房近日发布的报告显示，新冠肺炎疫情以来，国内土地市场经历了由停滞到恢复的风云变化。2020年第一季度到二季度成交楼面地价持续上涨，且达到自2016年以来的历史最高点。2020年重点城市第二季度楼面地价为5067元/平方米，同比上涨15.3%。疫情趋稳后，大量优质地块放出，拉动整体楼面地价提升。
从流拍情况看，上述报告显示，2月份疫情冲击下，地方土地流拍较为严重，随后大量优质地块放出，房企热情也显著提升，之前积压的需求全面释放，土地流拍率逐渐走低。
楼市销售复苏和融资环境改善，也为房地产企业拿地提供了更多“弹药”。
国家统计局数据显示，今年1~6月份，房地产开发企业到位资金83344亿元，同比下降1.9%。虽然增速尚未转正，但与今年1~2月份同比下降17.5%相比，已经好转许多。
积极稳地价
在土地出让收入几乎全部归于地方的背景下，土地市场回暖将有助于地方稳定房地产投资。
据中原地产研究中心统计，今年前7个月，杭州、上海、北京、南京、广州五个城市土地出让收入已经超过千亿元，紧随其后的还有武汉、苏州、佛山、宁波等地。
(image_address=""https://x0.ifengimg.com/ucms/2020_32/C01E682ECAE477841BEB4F518E4912F83C2223F3_w901_h568.jpg"")
这些城市基本上都是近几年来房地产市场的热点城市，屡屡出现在各种民间版本的土地出让收入排行榜中。
“截至7月31日，50大城市年内卖地金额超过2.35万亿元，同比上涨17.4%。”中原地产首席分析师张大伟表示，虽然整体土地市场地价未全面上涨，但部分城市部分土地的价格已经达到历史高点。
房价并非因地价而定，但土地价格的持续上涨，会给业界传递一种房价走高的预期信号。因此，热点城市地价的较大波动，也逐渐引起高层关注。
7月24日，房地产工作座谈会召开，要牢牢坚持房子是用来住的、不是用来炒的定位，坚持不将房地产作为短期刺激经济的手段，坚持稳地价、稳房价、稳预期，因城施策、一城一策，从各地实际出发，采取差异化调控措施，及时科学精准调控，确保房地产市场平稳健康发展。
易居研究院智库中心研究总监严跃进表示，从今年上半年全国百城居住用地的价格数据看，地价本身依然有热度，这也客观上要求积极稳地价。
“各类高地价、地价过热的城市，都有可能会收紧政策。相关房企在下半年的购地过程中，需要谨慎看待地价上涨过快的城市，要防范政策出台所带来的风险。适当要对各地土地市场的政策和周期有足够的预判。”严跃进说。
(image_address=""https://x0.ifengimg.com/ucms/2020_32/0BA3872070BC0BAEFC86DC5C9AEBA8BCA128DCB2_w901_h395.jpg"")",2020-08-06 19:33:02,凤凰财经
4,“千亿民营房企”美的置业债券利率降至0.1%！待偿有息负债567亿元,"导读：不久前，家电巨头美的集团创始人何享健遭挟持事件，引发各界关注。美的集团的兄弟公司美的置业集团也被投去了关注的目光。
2019年美的置业集团销售额首破千亿，但是与之俱来的债务也不容小觑。有息债务达到567.35亿元，把控融资成本成了公司必须面对的考验。如今，美的置业集团宣布调整“18美置01”票面利率至0.1%。
值得注意的是，若考虑到回售因素，2020年和2021年公司将面临百亿债务偿付的压力。
(image_address=""https://x0.ifengimg.com/res/2020/EF38A3EB79B3A39710EE728CC22FFAEB4687385B_size69_w1080_h459.jpeg"")
作者|雷晨
来源|债市观察
01
债券利率下调至0.1%，降融资成本利器
8月5日，美的置业集团有限公司（简称“美地置业集团”或“公司”）公告称，“18美置01”存续期前2年票面利率为7.5%，本期债券第2年末，发行人决定下调票面利率至0.1%。
(image_address=""https://x0.ifengimg.com/res/2020/E583C182FA02EFE4B247B3E6354E222F69AFAC06_size139_w668_h491.png"")
图片来源：公司公告
根据“18美置01”募集说明书中所设定的投资者回售选择权，美的置业集团发出调整本期债券票面利率及调整幅度的公告后，债券持有人有权选择回售或继续持有本期债券。
在外界看来，美的置业集团此番下调利率后，债券持有人可能更会选择回售。对美的置业来说，在当前的市场环境下可以用比7.5%更低的利率发行新债券，降低融资成本。
中指研究院数据显示，今年1-7月，房地产行业信用债平均利率为4.44%，同比下降0.94个百分点；7月信用债平均利率5.13%，同比下降0.17个百分点。
融资成本一定程度反映了房企的综合实力，融资成本低能够减少财务支出，提升盈利能力，进而提高企业市场竞争力。较高的融资成本意味着需要支付更多利息，摊薄企业利润。
作为家电巨头美的集团涉足房地产的重要载体，美的置业集团控制融资成本的能力堪称一流。
美的置业集团主营房地产开发业务，截至2019年末注册资本为38.07亿元，控股股东美的建业香港直接和间接持股100%，实际控制人为何享健和卢德燕（何享健之子何剑锋的妻子）。
上市公司美的置业(3990.HK)间接持有美的建业香港100%股权。实际上，美的置业集团是美的置业最主要的房地产经营主体，2019年合同销售金额占比达到99%。
(image_address=""https://x0.ifengimg.com/res/2020/E85E9B5E51C7588EC1437AC33C8E7402B879CA5D_size157_w699_h401.png"")
图片来源：东方金诚报告
克而瑞数据显示，在《2019年度中国房地产企业销售TOP200》上，美的置业的全口径合同销售金额和权益金额分别为1011.4亿元和728亿元，位列第34位和35位。
拥有美的集团品牌底色，美的置业的融资成本在民营房企中颇具优势，2019年综合融资成本为5.87%，同比下降0.04个百分点。
据亿翰智库与《国际金融报》联合出品的《2019年30家典型上市房企融资成本》数据，美的置业融资成本排名第13位，在民营房企中仅高于龙湖集团、世茂房地产和滨江集团三家。
02
有息债务567亿，面临百亿偿付压力
美的集团在家电领域大名鼎鼎，兄弟公司美的置业集团在地产领域也分量十足，2019年销售额首破千亿，何享健的地产野心不容低估。但是，与之俱来的债务也值得警惕。
美的置业集团以住宅地产开发为主营业务，辅以物业管理、自持物业租赁、酒店、材料销售和工程设计等业务。2019年公司实现营业总收入384.72亿元，利润总额46.01亿元。
(image_address=""https://x0.ifengimg.com/res/2020/C9DEB2BB23DBDF975BB5F52CB76268758224713B_size1125_w942_h499.png"")
图片来源：美的置业官网
随着业务规模扩大，融资需求也不断增加。今年一季度末，公司长期借款为405.11亿元，较2019年末增加57.62亿元；应付债券为59.17亿元。
据债市观察（ID：bondreview）统计，美的置业集团存续14只债券，存量规模144.84亿元，其中近百亿元将于1-3年内到期，逾40亿元将于3-5年内到期。
(image_address=""https://x0.ifengimg.com/res/2020/836E9D4C08CE4A9DC7D9D34802183205AAA54867_size45_w828_h806.jpeg"")
图片来源：企业预警通
在信用评级方面，东方金诚6月22日公告称，维持美的置业集团主体信用等级为AA+，评级展望为稳定，维持“18美置01”、“19美置01”和“19美置02”信用等级为AA+。
东方金诚认为，从债务期限结构来看，以公司2019年末有息债务为基础，在债券不提前回售的情况下，有息债务将主要集中于2020年至2022年到期，并将于2022年出现偿债高峰。
进一步来看，2019年末美的置业集团有息债务567.35亿元，若考虑债券回售因素，那么2020年和2021年应偿还的有息债务分别为204.51亿元和188.2亿元，面临债务集中偿付的压力。
面对百亿债务的偿付压力，美的置业集团的偿债能力跟得上吗？
截至今年一季度末，美的置业集团总资产2661.51亿元，所有者权益394.95亿元，资产负债率85.16%；总负债为2266.56亿元，其中流动负债1786.76亿元，占总负债的78.83%。
在流动负债中，短期借款2.9亿元、应付票据41.18亿元、一年内到期的非流动负债118.56亿元，短期债务合计162.64亿元。
就短期偿债能力指标而言，一季度末公司流动比率和速动比率分别为139.09%和47.3%。除此之外，公司手握257.94亿元货币资金，能够覆盖162.64亿元短期债务。
或许是手握近260亿现金给的底气，如今美的置业集团将债券利率降至0.1%，剑指降低融资成本。千亿民营房企对债券利率“下狠手”，你有被惊到了吗？欢迎在文末留言。",2020-08-06 19:16:30,凤凰财经
5,券商股尾盘偷袭，大盘走出“深v”，你赚钱了吗？,"文|小宁
各位看官朋友们大家好，财哥又和大家见面了。
最近两日，财哥在直播中多次跟大家提到，券商马上要发布7月份业绩，大超预期的可能性非常高，可以重点关注。
(image_address=""https://x0.ifengimg.com/res/2020/AD9B3884A0F99EFBA8BA9F6B2B3307F06404F4DF_size49_w1378_h184.jpeg"")
今日尾盘券商股偷袭，中信建投一度涨停，不仅带动券商板块异动，也直接给颓废一天的沪指打了一剂强心针，收盘沪指翻红。
不少投资者还在疑问难道是又有合并的消息了？
看直播的小伙伴应该很清楚，肯定是盘后要发业绩了，果不其然，盘后多家券商发布7月份业绩，财哥的逻辑也得到了验证，你们都赚到钱了吗？
下面把尺度直播视频中的一些观点进行简单的总结：
1）早报给大家提出，大分歧后的快速修复不意味着退潮期不会来临，关键看是市场高位人气股的走势。而开盘高位人气股，尤其是疫苗板块即走弱，那就预示着今天可能会二次退潮，盘中还出现了美国“干净网络”的措施，同样压制了市场情绪，早盘指数也是单边下行的。
2）临近午盘，芯片半导体板块走强带动大盘小幅反弹，这个也在我们预期之内，毕竟前一天的利好是因为预期过于一致，那么修复也就正常。信创板块也有表现，这个主要是针对美国“干净网络”的措施的一个市场反应，信创的国产替代逻辑显现，中国软件一度冲板。
3）此外，军工全天保持强势，具体个股财哥已在早报中给大家做了总结，这里不多说。临近尾盘，券商股偷袭，中信建投，中信证券大涨。
(image_address=""https://x0.ifengimg.com/res/2020/439CE3A7B97F199850CC59159E117598F7209FE2_size40_w640_h427.jpeg"")
4）总体来看，财哥在今日早报给大家提的两点建议非常受用：其一是轮动加快之下，大家一定不要轻易追高，而是关注主线板块的低吸机会；其二中美之间的摩擦是这个市场的不可控因素，要时刻保持关注。
此外，大盘连续的走“深v”，大家不要掉以轻心，犹豫中的上涨是因为每次都有板块来救主，那么下次如果无人救主呢？要谨防7月长阴现象的出现。
5）热点板块上面，券商，军工，信创，建材，贵金属等表现不错，疫苗股全线走弱。最近中报正文即将发布，可以适当关注。
以上就是今日的复盘。",2020-08-06 19:00:13,凤凰财经
