,title,content,pub_time,src
0,又有银行出事！男子被伪造签名欠银行2000多万，维权四年女友退婚,"原标题：又有银行出事！男子被伪造签名欠银行2000多万，维权四年女友退婚！网友：银行业该反省了
中国基金报泰勒
最近国内银行不知道怎么回事，天天有事发生。先有中行原油宝踩雷负油价，接着中信银行被曝泄漏个人隐私，今天，又有一家银行上了热搜第一：江西男子被伪造签名欠银行2千多万，数年间遭遇银行起诉女朋友退婚！
(image_address=""https://x0.ifengimg.com/ucms/2020_20/58EFD3C00834552E6E7D7C3510A30FA537A1680F_w537_h306.png"")
来看看到底是怎么回事？
江西男子被伪造签名欠银行2千多万
江西男子项招辉莫名背债2千多万引发关注。
据红星新闻报道，江西南昌一男子项招辉头上突然多出2239万元贷款，放款银行是华夏银行南昌分行。他表示，为了自证清白花了两年时间来回奔波于法院和银行之间，期间伴随着村里人的指指点点，打算结婚的女友也因此离他而去。
事情是这样的。
2016年6月，项招辉接到南昌市公安局电话，称有一笔贷款需要协助调查，他从不记得自己有过贷款，遂以为是诈骗电话，没有理会。
同年12月，项招辉因创业开网店，急需资金周转，去银行贷款查看征信记录时，发现在华夏银行南昌分行有一笔贷款审批纪录，显示曾在银行贷款3920万元，其中2239万元没有还已逾期。
2017年4月，项招辉正式接到法院传票，一家人陷入恐慌，“之前都不确定，直到收到传票，我妈都问如果真犯了什么事，就说出来一起解决，我只能反复跟她强调我真的没有借钱。”
项招辉称此后村里人对他指指点点，他无法在村里继续呆下去，网店又因资金短缺开不下去，为了调查清楚这件事，他关闭了网店，在南昌租了一间单身公寓，开始奔波于法院、银行之间。
根据从法院调取的材料，项招辉这才意识到，这笔贷款与他供职了四年的公司存在很大关联。
据他回忆，2011年，他入职天腾动漫科技（江西）有限公司从事销售工作。之后，公司以办“工资卡”的名义收了他的身份证。在项招辉当时未知的情况下，他成了索克斯公司的法人。而这家索克斯公司并无实际办公地点，也没有员工等。
据项招辉讲述，2014年公司曾组织十几位同事前往华夏银行南昌分行贷款，“当时公司领导说不知道贷不贷得下来，让我们先试试，我们就签字了。”项招辉表示，当时还存放了他的两张照片。“但是我2015年没有签过这样的合同，我2014年年底就辞职了，当时还要求把公司法人变更过来，直到2015年5月，他们才给我变更。”
无奈之下，项招辉向法院提出申请，要求对合同中的签名和手印指纹进行司法鉴定。2018年9月，项招辉拿到了司法鉴定书，结果显示指纹和笔迹都不是他本人的。
司法鉴定显示，这份《个人最高额保证合同》的签名，并非项先生本人所写，指纹也不是项先生所留。从裁判文书网上找到了本案的一审民事判决书，判决书也提及了相关鉴定意见。
(image_address=""https://x0.ifengimg.com/ucms/2020_20/936F4CCF29D3F9B19649E05B547266FE549CE853_w550_h232.jpg"")
(image_address=""https://x0.ifengimg.com/ucms/2020_20/3C40788AE3A248FC575177B7E170D398443ED1F3_w550_h147.jpg"")
两份司法鉴定显示签名、指纹均非来自项先生
(image_address=""https://x0.ifengimg.com/ucms/2020_20/4914FDDE287A1EA4C5699F27AE447C840560058B_w550_h94.png"")
员工存在违规行为
索赔却遭银行踢皮球
后来项招辉拿着鉴定书，将情况反映至江西银监局。随后，银监局出示《意见书》称，根据档案资料与相关的司法鉴定结果，表明华夏银行南昌分行员工在见证合同签署环节存在不实行为。项招辉称，银行于2019年3月对他撤诉，同时他前往中国人民银行将逾期记录删除，但是贷款记录仍在征信中。
银监局出示《意见书》称，根据档案资料与相关的司法鉴定结果，表明华夏银行南昌分行员工在见证合同签署环节存在不实行为，该行在该笔授信业务办理过程中未严格审查《个人最高额保证合同》资料的真实性，未能及时发现员工的违规行为，存在贷前调查不实、贷中审查不严、员工行为管理不到位等违规问题。
该《意见书》还显示，针对本次核查中发现的华夏银行南昌分行存在的贷前调查不实、贷中审查不严、员工行为管理不到位、办理无真实贸易背景的银行承兑汇票业务等违规问题，江西银监局已先后4次约谈该行行领导、相关部门负责人，要求该行充分认识信贷管理工作中存在的不足，责成该行按照问题导向、风险导向，梳理涉及投诉核查的信贷业务存在问题的原因，划分责任，立即采取措施完善制度流程、加强监督管理、开展执纪问责，堵塞漏洞、防范风险。对本次核查发现华夏银行南昌分行存在的问题，江西银监局将视情况采取下一步监管措施。
项招辉没想到的是，2019年，华夏银行南昌分行经历了一次领导班子变更，新任行长为廖某，副行长为彭某，原副行长李某调至另一分行任行长，三位行领导对项先生的事“打起了太极”。项先生称，“现在李某推彭某，彭某说我新来的不知道，找他们廖行长，又说是李某负责，哎，感觉我好像欠了他们一样的。”
天眼查信息显示，2019年3月，华夏银行南昌分行负责人变更，现任负责人为廖某。同时项先生称，银行告诉他当时的贷款员工已经离职。
“真的太绝望了。”项先生表示，两千多万对他来说是一个天文数字。自己奔波维权路上，网店也只好停下来，由于没有经济来源，生活一度靠朋友接济。“这对我整个家庭都是灭顶之灾，然而银行至今不能够给个说法。”
项招辉表示，之后他决定起诉华夏银行，要求删除征信中有关这笔贷款的所有记录，并出具一份文件证明他与这笔贷款无关，最后希望银行对他的损失进行赔偿和道歉。“至此华夏银行南昌分行都没有正面给我回复过，也没有任何的公开道歉，一个被冒名的签字就这样让我一无所有。”
近期多家银行出事
近期，中国银行“原油宝”事件给银行账户商品交易业务的风险敲响警钟。4月22日，中国银行“原油宝”参与的纽约市场原油期货5月合约-37.63美元/桶的结算价格被确认有效，给客户带来巨大损失，引发市场关注。
另外，脱口秀演员池子举报中信银行未经授权向第三方提供其“个人流水”一事持续发酵。5月9日，银保监会发布《关于中信银行侵害消费者合法权益的通报》。通报称，中信银行在未经客户本人授权的情况下，向第三方提供个人银行账户交易明细，违背为存款人保密的原则，涉嫌违反《中华人民共和国商业银行法》和银保监会关于个人信息保护的监管规定，严重侵害消费者信息安全权，损害了消费者合法权益。
与此同时，5月9日，银保监会连续发布九张处罚信息公开表，对中国银行、农业银行、建设银行、工商银行、交通银行、邮储银行、中信银行、光大银行等8家银行做出行政处罚，罚款累计金额接近2000万元，六家国有大行均在列。
值得注意的是，上述8家银行的案由全部与监管标准化数据（EAST）系统数据质量及数据报送存在违法违规行为有关，其中有多家涉及理财产品数量漏报和资金交易信息漏报严重等案由。
网友评论
(image_address=""https://x0.ifengimg.com/ucms/2020_20/CAA10C6512B11F9BB2E61F6EA708A4F948AC25FA_w859_h927.png"")
(image_address=""https://x0.ifengimg.com/ucms/2020_20/5BF84E3C13F86B25F75CAEBD8F0D81BC996A80EE_w813_h413.png"")",2020-05-12 20:53:54,凤凰财经
1,物价回落超预期、券商激辩通缩风险 A股影响几何？,"财联社5月12日讯，在油价走低和猪肉价格回落的带动下，中国通胀水平从高位回落。统计局今日公布数据显示，4月CPI为3.3%，创七个月新低，PPI为-3.1%，创四年最大降幅。在物价超预期回落的当下，市场也开始在关注通缩来临时，对股市的影响程度。
阶段性通缩魅影显现
国家统计局最新公布的数据显示，2020年4月份，CPI同比上涨3.3%，环比下降0.9%，PPI同比下降3.1%，环比下降1.3%。
(image_address=""https://x0.ifengimg.com/ucms/2020_20/6FF6E09FB8DDF1EE00998655DCD630F0D96D8C7A_w549_h316.png"")
(image_address=""https://x0.ifengimg.com/ucms/2020_20/9610D6CAE9AE2BFE9DF365B22FBEA45D36FE7FD0_w554_h309.png"")
结合各大券商的观点来看，CPI环比连续第二个月负增，食品和交通分项为主要拖累项，其中，生猪产能持续修复导致CPI大权重猪肉价格环比下降7.6%，直接影响CPI环比下降0.38个百分点。另外，天气转暖后鲜菜供应量增加，鲜菜项环比在3月下跌12.2%的基础上，4月继续下跌8.0%，叠加猪肉共同带动CPI环比下降。此外，疫情因素仍对旅游出行需求构成抑制，导致交通分项环比下行显著。
PPI方面，从数据上来看，油气产业链仍然是PPI超预期下行的主要拖累。4月国际原油价格续创新低，由于国内成品油有40美元/桶的“地板价”条款，因而对CPI的影响有限，而上游工业品价格不受“地板价”的影响，因此总的来讲，国际油价下探是PPI通缩加剧的主因。
数据出炉后，市场中关于通缩的讨论声愈发增多。
粤开证券李奇霖直接指出，通缩趋势已经明确，PPI的通缩压力将进一步加剧，而CPI的通缩压力将在数据上体现得更明显，理由有三个：
一是今年7月起，CPI的翘尾将下降到3%以下。4月CPI翘尾3.2%，新涨价因素只有0.1%，翘尾将继续是后面影响CPI同比的重要组成。根据计算，今年5月、6月CPI翘尾依然有3.2%和3.3%，但7月开始快速回落。
(image_address=""https://x0.ifengimg.com/ucms/2020_20/7597ABCFA5D05A8C478332C1FC8AE603AF14FEF8_w554_h386.png"")
二是海外疫情扩散对出口的影响还没有完全体现，5月开始中国出口增速可能会明显回落，一些消费品在国内供过于求，从而有降价压力。
三是高社融对总需求的拉动可能有限。4月金融数据亮眼，新增社融3.1万亿，其中贷款新增1.7万亿，均大超市场预期，这种信用周期再扩张的趋势，主要由政府基建和居民购房恢复驱动。在预期悲观的情况下，总需求可能持续低迷，这加大了通缩压力。
兴业证券则认为，CPI同比读数可能于四季度转负，但PPI同比读数或已接近底部。其指出，猪价仍然是今后一段时期影响CPI的核心变量，目前来看猪肉供给修复的趋势相对确定，但猪价仍然面临经济修复带来需求上升的扰动，整体看猪价向上的弹性不足。
PPI方面，兴业证券表示，进入5月国际油价出现反弹，油气产业链对PPI的拖累有望缓解，此外重卡、挖掘机销量数据反映出基建投资正在加码，黑色、有色产业链环比降幅有望继续收窄并在未来数月转正，由于基数原因，5月PPI同比可能仍处于底部区域，但6月之后PPI同比降幅有望逐步收窄。
光大证券同样认为CPI后续仍将回落，其理由为CPI中新涨价因素继续减弱和去年的较高基数。PPI方面，与兴业证券不同，光大证券认为目前基本面尚属于修复阶段，离反弹尚有一段时间，预计PPI在整个2季度和3季度走势都比较弱，4季度可能开始筑底修复。
光大证券指出，从一季度经济增速和物价水平来看，目前疫情已经冲击到需求，CPI和PPI增速快速回落可能加剧需求不足的状态，后续要想使基本面尽快复苏，政策需要进一步发力。
此外，有机构认为，通胀压力的进一步减弱，也给后续货币政策的边际宽松提供了更加友好的空间，后续随着全球复工复产持续顺利推进和政策再度加码，通缩压力或有所缓解。
历史上四次通缩期A股均出现一定幅度调整
历史数据显示，自1990年至今共发生过四次通缩，同期上证综指均出现一定程度的调整，且最近两次(2008-09年、2011-12年)从峰值到底部的调整幅度分别高达25.0%和15.5%。
有机构分析称，通缩期对上市公司业绩的负面影响叠加同期发生的全球或区域性经济危机，致使A股出现业绩与估值的双杀局面。
目前来看，沪深300估值仍处于底部区域，但这可能也无法避免通缩带来的负面影响。数据显示，最近两次通缩期开始时，沪深300PE也较低，但是期间PE的下滑幅度却最多达36.8%和14.4%。
短期来看，国君认为，5月关键的时间窗口在下旬，包括两会和经济数据。当前市场所定价的预期是最乐观的预期，仍需要警惕不及预期的可能。第一，流动性宽松的边际需要修正。第二，外生性风险的冲击需要审慎评估。第三，微观交易结构，各类风格已完成完整的轮动，破局需要新的超预期。",2020-05-12 20:53:53,凤凰财经
2,央行：一季度宏观杠杆率显著回升只是阶段性的,"问：4月份M2增长较快，请问您怎样看待当前货币供应量增长的？
答：今年以来，货币政策逆周期调节效果十分显著。4月末，M2同比增长11.1%，分别比上月末和上年同期高1个和2.6个百分点，增速上升较多，货币派生能力较强，货币乘数处于6.72的高水平；M1平稳增长5.5%，分别比上月末和上年同期高0.5个和2.6个百分点；4月末超储率为1.9%，比上年同期高0.7个百分点。
前4个月，人民币各项存款增加9.34万亿元，同比多增2.77万亿元。存款主要流向实体经济，住户和非金融企业新增存款8.7万亿元，占新增各项存款的93.2%。
其中，住户存款增加5.67万亿元，同比多增2265亿元，一方面，是由于疫情影响，居民消费减少，另一方面国家加大民生支持力度，居民名义收入保持正增长；非金融企业存款增加3.03万亿元，同比多增2.87万亿元，企业获得了较多信贷资金支持，有效对冲了收入下降，并为后续企业运营储备了资金；财政性存款和机关团体存款合计增加256亿元，同比少增1.56万亿元，体现了财政政策加大对实体经济支持力度。
整体来看，当前稳健的货币政策更加灵活适度，为疫情防控、复工复产和实体经济发展提供了精准的金融服务。
问：请您介绍一下，今年以来推动社会融资规模大幅增长的主要因素有哪些方面？
答：4月末，社会融资规模余额同比增长12%，为2018年6月以来最高水平。1-4月社会融资规模增量累计为14.19万亿元，与去年上半年的增量接近；其中，4月份社会融资规模增量为3.09万亿元，同比多增1.42万亿元。
社会融资规模大幅增长主要受以下三个方面合力推动：
一是金融机构进一步加大对实体经济的信贷支持。1-4月金融机构对实体经济发放的人民币贷款累计增加8.88万亿元，同比多增1.71万亿元。其中，4月对实体经济发放的人民币贷款增加1.62万亿元，同比多增7506亿元。
二是金融市场对实体经济提供的直接融资增多，企业债券和股票融资在社融中的比重明显上升。1-4月企业债券净融资为2.68万亿元，相当于去年全年企业债券净融资的80%；1-4月非金融企业股票融资1570亿元，同比增长近一倍。二者合计占社会融资规模的比重达到20%，同比高6.4个百分点，从历史上看也处于较高水平。
三是金融体系积极配合财政政策发力，推动政府债券融资大幅增加。1-4月政府债券净融资1.91万亿元，同比多5246亿元。其中，地方政府专项债券净融资1.14万亿元，同比多4373亿元。
问：贷款总体增长速度比较快，在结构上主要表现在哪些领域？
答：当前，为有力支持实体经济恢复发展，金融逆周期调控力度大幅增强，信贷投放速度明显加快。4月末，金融机构人民币贷款余额161.91万亿元，同比增长13.1%，比上月末高0.4个百分点，是2019年6月以来的最高水平；4月份新增1.70万亿元，同比多增6818亿元。
分借款主体看，企业部门贷款增速上升较快，住户部门消费贷款增长逐步恢复。4月末，企（事）业单位人民币贷款余额同比增长12.7%，比上月末高0.6个百分点；4月份新增9563亿元，同比多增6092亿元。4月份，个人消费贷款新增4782亿元，同比多增90亿元。其中，个人住房贷款新增3675亿元，同比多增173亿元，总体保持稳定。
企业贷款结构显示，金融支持实体经济的针对性和有效性提升明显，突出表现为抗疫和受疫情影响大的行业受信贷支持力度大，且较多中长期贷款流向制造业、基础设施业（注1）、服务业等关键领域。具体来看：
一是卫生和社会工作（注2）行业贷款增速大幅上升。4月末，卫生和社会工作行业贷款余额同比增长19.2%，分别比上月末和上年末高2.3和7.1个百分点；4月份新增113亿元，同比多增122亿元（去年同期减少9亿元）。信贷继续大力支持社会抗疫。
二是批发零售业贷款增速上升较快。4月末，批发零售业贷款余额同比增长8.8%，分别比上月末和上年末高0.8和4.3个百分点；4月份新增258亿元，同比多增698亿元（去年同期减少440亿元）。
三是交通运输、仓储和邮政业贷款较快增长。4月末，交通运输、仓储和邮政业贷款余额同比增长13.7%，比上月末和上年末分别高0.9和1.2个百分点；4月份新增1399亿元，同比多增1132亿元。
四是投向制造业、基础设施业、服务业等关键领域的中长期贷款增速均创近期高点。4月末，制造业中长期贷款余额同比增长17.8%，比上月末高1.1个百分点，是2011年3月以来的高点。其中，高技术制造业中长期贷款持续快速增长，月末余额同比增长39.9%，比上月末高0.7个百分点。基础设施业中长期贷款余额同比增长11.2%，比上月末高0.7个百分点，是2018年5月以来的高点。服务业（不含房地产业）中长期贷款余额同比增长14.7%，比上月末高0.7个百分点，是2018年3月以来的高点。
此外，投向房地产业的中长期贷款增速稳定，增长10.5%，与上月末持平，比上年末低0.9个百分点。
问：疫情发生以来，全社会非常关心普惠金融领域中的“小微”和“三农”获得信贷支持的情况，从总量数据看，当前贷款增长速度很快。能否介绍一下“小微”“三农”贷款增长的具体情况。
答：4月份，在各项政策引导下，金融机构继续加大对实体经济，特别是普惠领域的信贷支持，取得了较好的效果，政策效果也进一步显现。从小微企业贷款情况看，“量增、面扩、价降、结构优化”的特点更为突出。
一是普惠小微贷款加速增长。2020年4月末，普惠小微贷款（包括单户授信1000万元以下的小微企业贷款及个体工商户和小微企业主经营性贷款）余额12.6万亿元，同比增长25.1%，增速分别比上月末和上年末高1.5个和2个百分点。前4个月，普惠小微贷款累计新增1.1万亿元，占各项贷款增量的12.2%，比前3个月高0.4个百分点。
二是信贷支持小微经营主体的覆盖面继续扩大。截至2020年4月末，普惠小微贷款支持了2815万户小微经营主体，同比增长21.9%。前4个月增加117万户。从各月增长情况看，1-2月受疫情影响，仅增长18万户。3月份随着复工复产的推进，金融机构及时加大了对小微经营主体的针对性支持。3月当月增加71万户，相当于去年同期增量的四分之三；4月当月增加28万户，已基本恢复去年同期增量水平。
三是普惠小微企业贷款利率持续下降。2020年4月，当月新发放普惠小微企业贷款利率为5.24%，比上年12月下降0.77个百分点。
四是有七成多普惠小微企业贷款投向了制造业等劳动密集型行业。截至2020年4月末，普惠小微企业贷款中，制造业、批发零售业和建筑业企业贷款分别占39.3%、29.7%和7.6%，合计占76.6%。上述劳动密集型企业在疫情中受到冲击较大，信贷资金及时支持这些企业解决流动性问题和复工复产，对“保就业”也起到明显促进作用。
五是信用贷款占比提升。2020年4月末，信用贷款余额占普惠小微企业贷款的15.5%，占比比上年末提高了2个百分点。
六是涉农贷款持续回升。2020年4月末，本外币涉农贷款余额37.05万亿元，同比增长9.6%，增速比上月末高0.6个百分点，连续9个月回升；今年前4个月增加2.04万亿元，占各项贷款增量的25.0%，比上年全年水平高7.1个百分点。涉农贷款的稳步增长对农业、农村的持续发展和疫情下保持民生稳定具有积极作用。
问：请您介绍一下，一季度宏观杠杆率情况如何？
答：2017年以来，我国宏观杠杆率总体保持稳定，2018年还实现净下降，2019年仅上升约5.7个百分点，增幅远低于2008至2016年年均增长10个百分点的水平，初步实现稳杠杆目标。今年一季度，受疫情冲击影响，我国宏观杠杆率有显著的上升。
应该看到，一季度宏观杠杆率的回升，是逆周期政策支持实体经济复工复产的体现。在疫情防控常态化前提下，逆周期政策的制定应对疫情防控和经济社会发展做统筹考虑，把更好支持实体经济恢复发展放到更加突出位置，同时，做好金融风险防控。在这个过程中，当前应当允许宏观杠杆率有阶段性的上升，扩大对实体经济的信用支持，这主要是为了有效推进复工复产，这实际上为未来更好地保持合理的宏观杠杆率水平创造了条件。
虽然一季度宏观杠杆率显著回升，但只是阶段性的。特别是逆周期政策支持实体经济复工复产取得显著成效，向实体经济传导效率明显提升，生产秩序加快恢复。人民银行对全国1万家实体企业的调查显示，4月末，工业生产基本修复到位，服务业开工率持续回升，97.5%的企业已复产，超半数工业企业设备利用率已达到或超过上年二季度平均水平。
注1：包括交通运输、仓储和邮政业，水电气的生产和供应业，水利环境和公共设施管理业。
注2：社会工作是指提供慈善、救助、福利、护理、帮助等社会工作的活动。",2020-05-12 20:48:29,凤凰财经
