,title,content,pub_time,src
0,建17层高楼养猪！时下楼房养猪兴起，中小企业抢滩入局,"最近，关注猪的热搜真是上了又上，这次不是因为肉价高，而是因为住的高！
近日，一则四川遂宁9层楼养8000头猪的新闻在网络上引发热议，湖北鄂州也传出将修建两栋17层大楼养猪的消息。
今年以来，楼房养猪在生猪养殖业内开始兴起，企业纷纷布局，其中不乏行业龙头上市公司。
与平房养猪相比，楼房养猪具有哪些优劣势？这一养殖方式是否会成为行业趋势？近日，《每日经济新闻》记者实地探访了新希望（000876，SZ）在四川投建的首个楼房养猪项目，试图了解这家农牧龙头关于此种养猪模式的态度和规划。
据新希望上述项目负责人介绍，相比传统平房养猪，楼房养猪可节约用地90%以上，节约用水70%以上。
1
楼房养猪兴起
8月23日，《每日经济新闻》记者来到位于广安市武胜县龙女镇联合村的新希望楼房养猪项目现场。在显要位置，一栋5层的大楼伫立，这便是项目的核心建筑，将用于母猪妊娠、产仔等。截至目前，这栋大楼已经封顶，正在进行外部装饰和内部生产线装配过程中，大楼旁边则修建有育肥猪舍。
据新希望方面透露，这是公司在四川建设的第一个立体养殖项目，总投资2.7亿元，用地739亩，设计存栏种母猪6750头、育肥猪4.8万头，年产仔猪约16万头，出栏育肥猪约10万头。
(image_address=""https://x0.ifengimg.com/res/2020/A02A1CA1709175D3C966C046552B1AC6CDDA5176_size68_w1080_h810.jpeg"")
广安武胜新希望楼房养猪项目现场图片来源：每经记者曾剑摄
据项目负责人介绍，该楼房养猪项目于今年7月正式开工，预计11月投入使用，12月实现全封闭生产。项目是新希望“川猪壮大计划”的组成部分。公司此前提出总投资超过300亿元的“川猪壮大计划”，计划集中在四川落地一批生猪养殖及产业链相关项目，预计到2021年底，可实现新建生猪产能超过1000万头。
实际上，楼房养猪在国内并非新鲜事物。2015年，广西扬翔股份联合华中农业大学共同研发集群式楼房智能化养猪模式。据广西农业农村厅发布的消息，2019年5月，农业农村部科技发展中心组织有关专家对上述“集群式楼房智能化猪场研发与应用”成果进行评价。与会专家一致认为，该成果针对当前我国养殖用地紧缺、养殖生物防控任务艰巨、智能化和绿色养殖需求迫切等问题，极具推广应用前景。
近几年，国内猪肉价格上涨，生猪养殖成为风口。去年以来，在政策支持下，楼房养猪也逐渐兴起。
2019年12月，自然资源部、农业农村部联合发布《关于设施农业用地管理有关问题的通知》，明确“养殖设施允许建设多层建筑”。
2020年5月中旬，畜牧巨头牧原股份（002714，SZ）宣布楼房猪舍项目正式开工；同期，立华股份（300761，SZ）9栋7层楼房式生猪养殖项目开工；温氏股份（300498，SZ）今年也已布局多个楼房养猪项目。
不过，《每日经济新闻》记者注意到，目前养殖龙头企业对待楼房养猪似乎均以“探索”、“尝试”为主。
温氏股份在2019年年报中称，会“探索研究楼房养猪等新型高效养殖模式”；牧原股份在其2020年半年报中也表示，将在楼房养猪项目上尝试在生产管理、饲料供应、粪污处理等方面使用大量新技术、新设备，提高生产效率和健康水平。
较之龙头企业相对谨慎的态度，一些中小企业的动作更加迅猛。
8月17日，湖北中新开维现代牧业有限公司年产60万头生猪养殖项目开工典礼在湖北世纪新峰雷山水泥厂区内举行。据湖北鄂州市政府网站发布的消息，该项目占地约260亩，计划建设两栋17层高的生产大楼及附属配套设施，建成后年出栏生猪60万头。项目总投资20亿元，建成后年产值20亿元。
(image_address=""https://x0.ifengimg.com/res/2020/0ABF7F518DB392BD4612E2E16F560EC506151591_size298_w1080_h574.png"")
图片来源：鄂州市政府网站相关报道截图
2
业内：楼房养猪项目落地仍需因地制宜
相较于平房养猪，楼房养猪的确有其独到之处，比如大幅节约土地，减少饲料、断奶猪仔等的运输成本，还能提升养殖效率、促进规模化、智能化等等。
据新希望上述项目负责人介绍，相比传统平房养猪，楼房养猪可以节约用地90%以上，节约用水70%以上。同时，封闭式的分区管理、智能化控制通风，可以确保生猪与外来疫病完全隔离。此外，粪污可以实现统一收集再利用。
不过，楼房养猪的劣势也较为明显，比如前期工程造价高；由于饲养密度大，疫情防控难度大，对防疫要求更高。
“为什么我们要在广安做这个项目？是因为没有足够的土地实施平房养猪。”上述项目负责人表示，广安地处丘陵地带，很多地方是山，而且大部分能够用来开发的非基本农田比较分散，没法实施大规模的平房养猪。因地制宜做楼房养猪就成为最优选择。
同时，选择楼房养猪项目的落地区域，也需要企业综合考量。该负责人表示，楼房养猪项目需要落地在生猪出栏量较高的区域，在四川的生猪产业版图上，广安市历来是生猪大市，其下辖广安区、岳池县、武胜县、邻水县4个生猪调出大区县。
在该负责人看来，楼房养猪不是5个平层的叠加，关于管理和防疫等内容，需要通过项目的实施不断积累经验教训。除了因地制宜外，智能化、机械化是开展“楼房养猪”的核心要素。
不过，针对楼房养猪近期引发热议，新希望上述项目负责人认为，楼房养猪短期内不会成为行业风口。他表示，在生猪保供任务完成后，我国的生猪存栏数量将趋于稳定，出栏数量不可能再像过往几年那样大幅上涨。也就是说，平房养猪已经能够实现猪肉的供给，短期并没有大规模实施楼房养猪的必要。
撰文|曾剑",2020-08-27 18:51:03,凤凰财经
1,钻石卖不动了？钻石巨头下调原钻价格近10%，消费市场买账吗？,"受新冠肺炎疫情影响，历来拒绝降价的钻石巨头也不得不放低姿态了。
由于需求减弱，以“钻石恒久远，一颗永流传”而闻名的全球钻石巨头戴比尔斯（DeBeers）近日告知客户，从本周开始将1克拉以上原钻的价格下调近10%，而这距离其上次降价不到一年。
此前，为应对疫情带来的不利影响，该公司已破例允许钻石采购商在签订合同之后仍可以取消订单，并制定了裁员计划。但是，由于上半年出售原钻数量大幅下挫，DeBeers的财报显示，该公司第二季度的毛坯钻石销售额仅为5600万美元，上半年亏损约为2.14亿美元。
在尝试诸多手段后，DeBeers又将目光锁定在了“降价”上。
矿区停工影响供给
DeBeers与埃罗莎（Alrosa）是全球钻石行业的两大巨头，共占全球市场份额的六成以上。这两家公司的财报显示，今年二季度，这两家公司合计的原钻销售只有1.3亿美元，而去年同期为21亿美元。今年二季度，Alrosa和DeBeers的产量分别为1370万与570万克拉。
钻石行业咨询公司Gemdax在一份报告中表示，目前全球五大钻石生产商的钻石原石库存已经高达35亿美元。预计2020年全球原钻库存囤积规模可能高达45亿美元，这几乎是钻石开采行业一年产量的三分之一。
各国采取的封锁措施使原钻开采受损较重。俄罗斯、博兹瓦纳、加拿大分列全球原钻年产量前三位。今年4～5月，博兹瓦纳政府采取全境封锁措施，导致矿区停运。尽管该国5月中旬的大部分矿产已重新投产运营，但生产力仅处于满足市场较低需求的水平。DeBeers位于加拿大的钻石矿区产量录得27%的跌幅。
相对于供给端，需求端降幅更大，使得原钻供过于求。这也给切割、抛光和交易钻石的中游企业带来了不小的压力。在全球钻石行业的中游，印度是最重要的国家，该国每年毛坯钻净进口额占据全球大约90%的份额。外媒报道显示，由于印度钻石毛坯的内部库存量承压较重，印度钻石加工制造商抵制进货。
对于钻石产业上游、中游的国家来说，博兹瓦纳的疫情已明显好转，其矿区已部分复工。但是，印度、俄罗斯的疫情仍十分严峻。约翰斯&middot;霍普金斯大学的实时数据显示，截至8月27日，印度和俄罗斯新冠肺炎累计确诊病例数位居全球第三与第四，超过330万与97万人，每日新增确诊病例数分别超过7000与4000人。此外，加拿大部分地区仍处于封锁状态，其矿区不能复工。
戴比尔斯：下半年钻石消费或将回暖
在钻石行业的消费领域，疫情使得个人奢侈品销售承压较重。咨询公司麦肯锡预测，腕表和珠宝市场受疫情打击可能最为严重，2020年腕表和珠宝市场或将同比下跌25%～45%。
不过，DeBeers对钻石行业的复苏仍持乐观态度。在近期发布的《钻石洞察快报》中，DeBeers认为，疫情使得消费者节省了度假资金等不少开支，未来可能会购买钻石产品。摩根士丹利的分析师AlainGabriel预计，下半年DeBeers的销售额可能达到16亿美元。
美国、中国是钻石行业两大消费市场，其中美国占全部销售额的近一半。DeBeers在上述快报中对500名18岁以上的美国人展开了调查，其中三分之二的受访者表示在2020年取消了旅游计划。而在这部分人群中，有55%的人手上有了更多闲钱。在没能旅游的人群中，有12％的消费者表示愿意用这笔钱购买钻石产品，以纪念一些特殊时刻。
钻石行业分析师戈兰（EdahnGolan）认为，除疫情外，仍要关注其他影响钻石价格变动的因素。相对疫情而言，钻石行业出现的多种问题才是价格出现下跌的关键原因。
他表示，疫情暴发之前，成品钻的价格在2019年已经出现了一段时期的下落。其问题在于，珠宝商缺乏具有吸引力的市场推广、对客户需求转变的反应过慢、缺乏对客户的维护等。
他认为，目前实体店正逐步复工，但消费者对钻石消费依旧抱有谨慎的态度。但是，有些消费（例如婚庆）不会因为疫情而产生大幅度变化。长期来看，未来珠宝消费的总额度会减少，但数量却会不断增长。而一旦有消费产生，就会引发链条式反应，带动中游和上游企业的发展。这个过程中可能会有很多企业离开钻石行业，从而导致行业洗牌。",2020-08-27 18:38:45,凤凰财经
2,德易车CEO王国光获“2020新时代商业领袖奖” ,"8月27日，第九届中国财经峰会在上海隆重召开。本届峰会以“信心与活力”为主题，汇聚国内外颇具远见的商业领袖、经济学界翘楚、创业家及新青年代表，聚焦后疫情时代的经济发展及商业展望。德易车CEO王国光受邀出席，并荣膺“2020新时代商业领袖奖”。
(image_address=""https://x0.ifengimg.com/ucms/2020_35/5E44D786E2CFA2FF50B3C8E55E8AD8B3D3300EE9_w1264_h843.png"")
本次奖项由CFS第九届中国财经峰会组委会发起评选，汇集5G、人工智能、智慧医疗、数字经济、金融等多个领域，用来表彰在各个领域的先进企业和年度影响力精英人物。组委会邀请知名研究机构、咨询公司、专家学者、媒体领袖组成评审委员会，并根据评审委员会成员通过的综合评估体系，进行可量化的数据比对，最终评选出获评名单。
疫情爆发后，对国民经济和社会消费带来明显的抑制，以线下业务为主的二手车市场也曾陷入低迷。在国家复工复产的号召下，以德易车为代表的二手车市场参与者于2020年3月份逐步完成复工复产的各项工作，助力推动二手车市场的复苏，并通过金融服务带动二手车消费，盘活汽车后市场，助推国内经济形势好转。
王国光表示，相对于被疫情影响较为严重的一二线城市，三四五线城市二手车市场受疫情影响较小，恢复也更快。他认为，疫情的发生同样刺激了大众的购车需求，私密空间的价值在疫情面前更能体现安全的一面；考虑到人们亟待解决的出行条件，以及逐渐开放的消费习惯，在百业审慎的情况下，私家车尤其是二手车将成为大众消费者的首要选择。此外，王国光还表示，近年来解除二手车限迁、税费优惠等政策的支持，也彰显了国家对于社会零售特别是汽车消费以及金融业务发展的支持和青睐，这对于行业和从业者来说，是个难得的机遇。
尽管新冠肺炎疫情正在全球蔓延，世界经济面临严峻考验，但随着中国疫情防控形势持续向好，被按下“暂停键”的中国经济正在加速重启。王国光也表示，在“双循环”的大背景下，德易车将终坚守初心、严格自律，以服务用户为第一宗旨，致力为金融机构提供专业且合规的汽车金融促成业务，为汽车消费者提供更优质、专业的汽车金融产品和服务，用实际行动为持续回暖的中国经济以及全球经济的恢复增添信心、注入动力。",2020-08-27 18:08:44,凤凰财经
