,title,content,pub_time,src
0,理想汽车最早7月美股IPO，小范围路演反响乐观,"作者：李勤
36氪从多位接触到理想汽车项目的知情人士处获悉，理想汽车即将赴美IPO，最早在7月上市，承销商包括摩根士丹利和瑞银等。
其中一位消息人士向36氪透露，6月底的线上沟通会中，理想汽车CEO李想告诉投资机构，“理想汽车将在7月或者8月IPO（首次公开发行股票）”，但因为是小范围沟通阶段，募资金额还未确定。另外多位资本行业人士也向36氪证实了这一消息，“目前看，7月有点来不及，大概率是在8月上市。”
针对上述消息，理想汽车向36氪回应称：不予置评。
消息人士向36氪表示，因为特斯拉和蔚来汽车业绩趋于稳定，股价节节走高，理想汽车这样的项目也在二级市场受到一定程度热捧，“投行在资本市场问了一圈，份额应该不愁卖。”
就在一周前的6月24日，《晚点LatePost》报道，理想汽车即将获得5.5亿美元D轮融资，美团领投5亿美元，本次融资将理想汽车估值推高至40.5亿美金。此后，有投资者在深交所平台上向理想汽车股东利欧股份求证，后者回复称：目前相关交易正在进行中。
最新的官方数据显示，新冠肺炎疫情全面爆发的二季度，特斯拉交付量依然达到90650辆，超出资本市场预期。国内的新造车公司领头羊蔚来汽车二季度交付量也首次过万，达到10331辆。
而理想汽车自2019年底交付以来，市场销量也表现稳定，据官方数据，6月16日，半年多时间，理想汽车首款车型理想ONE已经交付一万辆。
接触到理想汽车项目的投资人告诉36氪，“像理想汽车这样的条件，在美股和港股都能上，比较而言，在美股能拿到更高估值。”
不过，理想汽车并未采用主流的纯电动路线，而是以燃油发电机为基础的增程式技术路线，这也引发部分投资机构的困惑。有投资机构向36氪直言，“目前看不太清楚这个路线的风险性，更偏向于接触纯电动项目。”
早在今年年初，理想汽车的IPO进程已经启动。2020年1月份，路透社报道，理想汽车正在申请赴美IPO，计划募集5亿美元以上，最早将于上半年上市。
但新冠肺炎疫情突然爆发，普遍影响到汽车公司一季度的交付量，这也拖慢了理想汽车的上市节奏。一位理想汽车投资人曾向36氪表示，至少要等二季度销量数据出来，“用这个数据去上市，估值会更好。”
2015年7月，李想创立理想汽车（原名为车和家），早期接受采访时，李想曾表示，已经创建了汽车之家这样一个百亿美金市值的公司，再次创业造车，是想“创建一家千亿美金市值的公司”。
与大部分新造车公司选择纯电动技术路线不同，理想汽车的首款量产车理想ONE是一款串联式插电混动车型（增程式），在动力电池之外，还额外配置了以内燃机为基础的增程器，为驱动电机提供动力。这款车在2019年12月正式交付，定价32.8万元，定位中大型SUV。
李想曾在公开场合表示，选择增程式技术路线的原因主要包括，国内充电设施不足，增程式技术路线可以保留纯电动体验，同时解决电动车的续航焦虑问题，此外，电池成本高企也让纯电动车难以获得可观的利润空间。
不同于主流的路线选择，让理想汽车早期的融资遇到一定阻力，C轮融资前，理想汽车总融资额仅为10亿美金，是蔚来汽车上市前的单一轮次融资额。直到引入美团创始人王兴的投资，这一局面明显改善。
2019年8月，理想汽车宣布，获得5.3亿美元C轮融资，其中美团创始人、CEO王兴个人出资2.85亿美元，美团旗下的龙珠资本出资1500万美元，理想汽车投后估值29.3亿美元。时隔不到1年，美团再次以5亿美金领投理想汽车D轮融资。
不仅连续8亿美金投入理想汽车，美团1号、2号人物王兴和王慧文，也在社交媒体为理想汽车频繁站台。
理想汽车以运营效率和成本控制著称，李想自身也公开表示，用不到10亿美金融资，做到了公司经营现金流为正，这在普遍依靠融资续命的新造车行业，十分罕见。不过，理想汽车并未急于实现盈利，而是转向业务扩张。
在日前一场公开演讲中，李想披露了公司的扩张计划，主要包括：将今年的开店数量，从全年开20家，改为全年开60家店；公司原计划明年启动L4自动驾驶的研发，改为今年就启动，李想称其为10亿规模级的投入。
李想认为，未来5-10年，自动驾驶是趋势，而卖出足够多的车并获得高质量数据，是未来竞争的关键筹码，“自动驾驶是AI的竞争，在两个方面，一个是车的AI，一个是道路环境的AI，这两个全部来自于数据，AI的生产资料是数据。所以我们如何通过足够多的车，获得高质量的数据和高质量的训练模型，这是未来自动驾驶竞争的根本。”
无论是造车本身还是自动驾驶技术研发，都需要大量资金长期投入，而理想汽车从D轮融资到IPO的连续资本举措，显然也是在为未来竞争储备足够多的弹药。
2014年起，涌现出上百个新能源造车项目，但进入2020年，已经出现明显的淘汰现象，博郡汽车、拜腾汽车、赛麟汽车、前途汽车、天际汽车等公司，普遍被曝出资金断裂、量产延后，乃至业务关停等情况，当下相对稳定经营的仅有蔚来汽车、小鹏汽车、理想汽车、威马汽车等数家公司。而在登陆公开市场、争取多元资本渠道的二次竞争中，淘汰显然还会加速。",2020-07-03 15:59:24,凤凰财经
1,9天狂涨90%！这家券商彻底火了！刚拿到这个重要牌照,"光大证券近期可谓热得发烫，二级市场股价大涨，还拿下了新的业务资质。
昨晚光大证券公告称，公司证券投资基金托管资格已获证监会核准，未来将积极开展基金托管业务。光大证券是目前业内拿到基金托管牌照的第20家券商，就在6月万联证券、华鑫证券也获得了相关资质。
今天开盘，A股光大证券(601788)大涨，从6月19日至今股价已经从11元左右涨至21元左右，区间最大的涨幅达90%左右，表现十分亮眼；港股光大证券(6178.HK)昨日暴涨近27%，截至目前今天开盘也大涨14%左右。
光大证券拿下基金托管资格
昨晚，光大证券公告称，收到证监会《关于核准光大证券股份有限公司证券投资基金托管资格的批复》，根据该批复，公司证券投资基金托管资格已获核准。光大证券将按照相关规定开展证券投资基金托管业务，认真履行基金托管人的职责，采取有效措施，确保基金资产的完整性和独立性，切实维护基金份额持有人的合法权益。
光大证券是今年第3家获得基金托管资格的券商，根据证监会网站消息，此前万联证券、华鑫证券分别在今年6月8日、6月15日拿下证券投资基金托管资格，短短一个月内获批3家，可谓速度之快。
基金托管牌照对券商具有重要意义，业内人士表示，基金托管牌照的获得，将进一步加快券商完善投资银行基础功能的步伐，有利于其在融资融券、场外金融产品等方面的创新。
(image_address=""https://x0.ifengimg.com/ucms/2020_27/6F0237EB03ECFC641F4F19F42CD8058C7FF5574B_w600_h402.jpg"")
(image_address=""https://x0.ifengimg.com/ucms/2020_27/7F666415BF12FF78DABAE0E85860B1B9E1A9E658_w600_h379.jpg"")
具备托管牌照的券商增至20家
在光大证券获批后，目前业内具有基金托管牌照的券商已有20家。基金托管的江湖，竞争比较激烈，商业银行占据优势，尤其在公募基金托管这块，券商后来居上，在私募基金托管等领域发力，这几年也不断扩展版图。
从其发展路径看，2013年《证券投资基金法》修订颁布，允许经证监会审批后的非银行金融机构开展基金托管业务；同年，证监会公布《非银行金融机构开展证券投资基金托管业务暂行规定》，券商获得“入场券”。2014年初，海通证券、国信证券、招商证券成首批获证监会批准，得以开展证券投资基金托管业务的券商。
(image_address=""https://x0.ifengimg.com/ucms/2020_27/A98510482FC12F0B13B79919926CF54857D11866_w300_h437.jpg"")
基金托管牌照对券商颇具吸引力，引来各大券商积极申请。证监会网站信息显示，目前在排队申请证券投资基金托管资格的券商还包括长江证券、西部证券、国元证券、华安证券、财通证券、长城证券、华福证券。
平安证券基金研究团队执行总经理贾志认为，相对于银行托管业务，券商托管业务有两个优势。一是一站式服务。单从托管业务上，银行和券商同质化明显，但是如果将托管业务作为机构服务基金公司业务中的一项来看，券商有更全面的服务能力。比如交易、托管、结算一条龙服务。二是专业优势。相对于银行，券商更贴近资本市场，在专业程度上有优势。对于创新品种的理解和支持上，在创新产品的交收清算、净值计算等方面有自身的专业优势，对此类基金吸引力更强。
光大证券股价连续大涨
除了获得证券投资基金托管资格，光大证券最近在二级市场的走势也备受关注。A股市场光大证券(601788)短短几个交易日就出现多个涨停，今天开盘股价也大涨。最近券商板块表现强势，光大证券也是十分火爆，从6月19日至今股价已经从11.04元的开盘价涨至今天最高20.93元，区间最大的涨幅达90%左右，表现十分亮眼。
在港股市场，光大证券(6178.HK)暴涨近27%，截至目前，今天开盘以来也大涨超14%。
昨日晚间，光大证券回应股票交易异常波动公告称，公司未发现对公司股票交易价格可能产生重大影响的需要澄清或回应的媒体报道、市场传闻及市场热点概念。经公司自查并书面问询公司控股股东，公司、控股股东均不存在影响公司股票交易异常波动的重大事项以及其他应披露而未披露的重大信息。
(image_address=""https://x0.ifengimg.com/ucms/2020_27/2C36591BDF4AA667735E6A8C4A2B7FD44A3FEF68_w593_h529.jpg"")
（文章来源：中国基金报）",2020-07-03 15:43:46,凤凰财经
2,痛心！已找到162名遇难者遗体！全球翡翠行业的“心脏”遭遇惨烈塌方,"当地时间7月2日早上6：30左右，缅甸北部克钦邦帕敢地区一翡翠矿区发生大规模山体塌方。截至2日19时，已找到162名遇难者遗体，54人在事故中受伤。
(image_address=""https://x0.ifengimg.com/ucms/2020_27/49EBBE8295CAA5D7490EE4CA42D7043ECD835F40_w582_h357.jpg"")
缅甸帕敢翡翠矿区塌方已致162人遇难
帕敢是缅甸著名的翡翠矿石产区，当地时常发生废矿堆、矿坑堤坝塌陷等事故。
(image_address=""https://x0.ifengimg.com/ucms/2020_27/261A9A8D62CFE72B9EA803CB67A8A5FFF637C39B_w776_h396.png"")
缅甸社会援助组织帕敢地区负责人表示，由于此次塌方情况严重，他们正在调集更多人力参与搜救工作。
另据了解，缅甸资源与环保部曾于6月26日发布通知，要求自7月1日起至9月30日暂停克钦邦翡翠矿区采掘作业，所以发生塌方的矿区应该属于违规开采。截至目前，当地正在开采的矿区有六百多个，其中有很多都属于非法开采。
(image_address=""https://x0.ifengimg.com/ucms/2020_27/FD8C1171192D145B5B0C13DCCC5E05E405407E06_w742_h374.png"")
从缅甸全国各地前来的劳工共有30万人，分别在玉石区块以家庭为单位进行非法开采，他们每天在废土堆里寻找毛料，在玉石开采区块寻找玉石。
(image_address=""https://x0.ifengimg.com/ucms/2020_27/523BE1575EE4B60CA934EEE2720A63A176AE4698_w765_h388.png"")
据了解，此前缅甸最严重的矿区坍陷事故发生在2015年，当时遇难人数达到上百人；
2019年4月发生的一起坍陷事故导致60多人遇难；
今年6月9日发生的一起塌陷事故造成1人丧生；
6月23日，帕敢矿区发生的另一起塌陷事故造成2人丧生、6人受伤。
帕敢矿难现场惨烈引缅甸各方高度关注
此次塌方是否将成为缅甸历史上最严重的、死亡人数最多的一次矿难？缅甸当地的主流舆论目前是怎么报道和评论这一事件的？它会对相关产业的发展造成什么影响？
(image_address=""https://x0.ifengimg.com/ucms/2020_27/3E15C3605124FE348F35CF9071BBC1BCAB4E7F4E_w450_h253.gif"")
记者表示，据称此次事故是一座三百多米高的矿石堆，由于降雨过多，滑入了旁边一座45000平米的水池中，而在水池中正有几百名捡拾翡翠矿石的工人。截至昨晚2日19时，已找到162名遇难者遗体，54人在事故中受伤。
(image_address=""https://x0.ifengimg.com/ucms/2020_27/7B0F68E62D89A56341F4018B9C28860E165526F5_w604_h316.png"")
记者表示，据目前掌握的消息，这是在缅甸发生的规模最大的翡翠矿区塌方事故。
(image_address=""https://x0.ifengimg.com/ucms/2020_27/64BEC0B62F2921B947FF13EB8A401BC3AF228961_w765_h386.png"")
目前很多现场视频在很多社交媒体广泛传播，现场的惨烈场面让很多人深感震惊。
同时很多人也质疑，为什么缅甸的自然资源与环保部已经要求克钦邦的帕敢矿区从7月1日暂停采掘，却还发生了这样大规模的矿难事故？
据了解，目前出现事故的这个采掘的区域，属于非法采掘。这些年来缅甸克钦邦的帕敢矿区非法采掘屡禁不止，也是导致经常出现矿难事故的主要原因。
(image_address=""https://x0.ifengimg.com/ucms/2020_27/1CBBD405A894AD847F02D141A98587B4C39FFD33_w450_h253.gif"")
这样的事故是否会对翡翠行业产生影响？
按照惯例，每年雨季缅甸自然资源与环保部都会下令暂停克钦邦帕敢矿区开采，所以这次也是例行规定。近年来，很多企业采用机械化规模采掘，所以几个月的暂停采掘不会影响翡翠供应。
这一事故是否会影响之后自然资源与环保部对矿权的审批？
据目前了解，目前出现事故属于非法采掘，所以正常的审批不会受到大的影响，但今后一段时间政府可能会加大对非法采掘的打击力度。
新闻链接：全球超九成翡翠玉石来自缅甸
缅甸北部山区盛产翡翠，全球市场超过九成的翡翠玉石来自缅甸，因此翡翠又经常被称为“缅甸玉”。在缅甸的对外贸易当中，玉石一直是重要的出口产品之一。
(image_address=""https://x0.ifengimg.com/ucms/2020_27/C95F09BD51B35D90393A34F303D0C489ED66FB65_w754_h382.png"")
“公盘”，很多人耳熟能详的一个词语，却常常只跟缅甸翡翠关连在一起。缅甸对翡翠资源的管理非常严格，只有通过“公盘”才可以交易出境，其他一律视为走私。缅甸每年都会举办玉石珠宝交易会，俗称“翡翠公盘”。
(image_address=""https://x0.ifengimg.com/ucms/2020_27/DD0DCEACE399F6FC4A22DA94AF0281E848D4080A_w758_h390.png"")
根据路透社援引缅甸政府发布的官方数据，仅在2016至2017年度一年间，缅甸玉石的销售总额就高达6.71亿欧元，约合人民币53.5亿元。不过也有业内专家认为，实际上缅甸玉石的真实销售额远远超过这一官方数据。
(image_address=""https://x0.ifengimg.com/ucms/2020_27/8BCC14CBEF1594FAF1DA7B052171EB366D7B413A_w716_h392.png"")
玉石价格不断走高，有多方面的原因。根据缅甸财政部的数据，2018财年，缅甸共出产玉石3万多吨，产量近几年呈逐年下降之势。与此同时，玉石的出口量近年来也在逐年走低，一方面是由于缅甸对翡翠玉石产量的调控，从2018年以来不断关闭到期的矿场，且不批准新的采矿许可；另一方面，玉石价格的连续上涨，作为主力买主的中国玉商无力承担过高的溢价，采购量也有所减少。",2020-07-03 15:43:23,凤凰财经
3,逾500家广告商联合抵制也没用？脸书股票为何连续强劲反弹,"从可口可乐、阿迪达斯到大众汽车，已有超过500多家公司和组织停止在脸书公司（Facebook）的社交媒体平台上投放广告。
当地时间7月1日，抵制在脸书上投放广告的运动正式开启，为期一个月。参与的商业公司名单迅速扩容，涵盖了微软、戴姆勒、福特、联合利华、玛氏和Verizon等行业巨头。分析师预测，由于从众压力，未来可能会有更多公司加入这一行动。受此影响，脸书首席执行官马克&middot;扎克伯格已经同意与组织抵制活动的民权组织会面讨论。
值得注意的是，继6月23日创下242.24美元收盘新高后，受抵制消息的负面影响，脸书股价在6月26日大跌超过8%至216.08美元。但此后连续三日强劲反弹，7月1日收盘时其股价回涨至237.55美元。虽然7月2日出现小幅下跌至234.85美元，但今年迄今为止，脸书的纳斯达克指数仍上涨超过11.27%。为何如此？
脸书股票价格为何依然坚挺？
尽管有超过500余家品牌联合抵制，但脸书平台上的广告商规模要远比这一数字壮观。
根据投行高盛分析师贝里尼（HeatherBellini）的报告，有超过800万家企业在脸书上购买广告服务，即使前10名企业撤掉2020年上半年的全部广告支出，也只相当于该公司收入的1.73%。该公司首席运营官桑德伯格（SherylSandberg）在曾在2019年表示，脸书前100名广告商占其广告总收入的比例不到20%。
换言之，脸书的命脉是数以百万计的中小型企业，这些企业长期以来利用该公司复杂的广告购买系统来锁定潜在客户。根据德意志银行的数据，这些企业在脸书上的支出占到其总支出的76%，因此可能无法暂停这种高效的营销形式。尤其是在疫情期间，脸书平台上的全球用户超过20亿人，在经济封禁时期会更加频繁地使用社交平台，分析师由此指出，广告商们不会愿意长久地放弃这一机会。
美国银行的分析师在近期一份简报中称，即使脸书因此损失了广告主，鉴于平台的“拍卖动态”，该平台也能够迅速找到其他企业来替代流失的客户。花旗银行的分析师指出，如果广告抵制只持续一个月，那么对脸书股票的影响可能只有每股1美元。
这也并非脸书首次遇到此类负面消息。
事实上，从2016年美国大选期间出现的对外国干涉选举和假新闻的担忧，到2018年爆出的剑桥分析公司丑闻，脸书总能安然脱身。
根据该公司财报显示，从2016年至今，脸书财政收入增幅超过了155%。其广告收入总额也依然连年增加，2019年全公司广告收入为697亿美元，高于2018年的550亿美元，比2015年的171亿美元更是扩大4倍有余。分析师指出，该公司已经度过了一次又一次的危机，现在仍然没有什么理由认为这次抵制会与之前不同。
华尔街还认为，从以往经验来看，科技平台巨头在经历了类似的抵制后业务都会恢复常态。三年前，Verizon、AT&T、百事可乐和强生公司因视频分享平台油管（YouTube）上的极端主义内容而从该平台撤下了数百万美元的广告。但油管仍在2017年获得了82亿美元的广告收入，并在2018年和2019年产生了35%以上的增长。
不过，花旗银行的分析师称，如果脸书无法说服参与抵制的公司恢复业务，则这对其股票的影响将达到每股17美元。
因此，面对声势浩大的抵制活动，脸书仍做出了一系列补救措施。上周五（6月26日），扎克伯格在一篇长文中回应称，他承诺将不论对象地删除“煽动暴力”或禁止投票的内容，暗示也可能会删除政客的发言。本周一（6月29日），脸书正式封禁了一些与极端运动““boogaloo”有关的组织。随后，在本周二（6月30日）晚些时候，扎克伯格同意与民权组织会面。
“神仙打架，凡胎遭殃”
同样，在企业方面，若要参与此次倡议行动，大型跨国企业面临的风险并不可怕，反而是那些不通过零售商直接向消费者销售的小公司和营销人员更岌岌可危。
数字营销机构Wpromote副总裁西蒙森（KevinSimonson）称：“大多数主要通过互联网销售的消费品牌的商业模式，严重依赖脸书。因此，对于他们来说，暂停主要收入来源会对他们的业务造成毁灭性影响。对于绝大多数参与抵制的大品牌来说，则不会如此。”
需要指出的是，由于许多参与抵制的企业也暂停了在其他小型社交媒体平台上的广告，这最终可能会导致对脸书的财务状况较弱的竞争对手网站的更大伤害。",2020-07-03 15:43:18,凤凰财经
4,国家市场监督管理总局：推动全国逐步取消活禽市场交易,"今天（3日）下午，国务院联防联控机制在北京召开新闻发布会。会上，国家市场监督管理总局市场稽查专员陈谞介绍，农贸市场包括批发市场，是城市食品供应的重要渠道，据了解70%以上的畜禽肉、水产品、蔬菜水果，均通过农贸市场批发市场流入我们市场流通的。下一步市场监管总局将督促各地时刻绷紧疫情防控这根弦，认真落实属地管理的责任，切实加强农贸市场等重点场所的食品安全监管，以北京新发地市场为警戒，着力排查农贸市场安全风险隐患，部署加强批发市场等重点场所的食品安全风险的管理。
严厉打击野生动物非法交易，禁止食用野生动物，限制活禽交易和宰杀，鼓励有条件的地方推广活禽集中宰杀，逐步取消活禽市场交易。",2020-07-03 15:42:51,凤凰财经
5,四部门：进一步延长受疫情影响还款困难的扶贫小额信贷还款期限,"7月3日讯，银保监会、财政部、央行、国务院扶贫办联合发布《关于进一步完善扶贫小额信贷有关政策的通知》。通知提出，进一步延长受疫情影响还款困难的扶贫小额信贷还款期限。对到期日在2020年1月1日后（含续贷、展期），受疫情影响还款困难的贫困户扶贫小额信贷，在延长还款期限最长不超过6个月的基础上，将还款期限进一步延长至2021年3月底。
以下为全文：
(image_address=""https://x0.ifengimg.com/ucms/2020_27/960F457A6964851594CF02AC40383EC6BFB6CF4E_w1117_h935.png"")
(image_address=""https://x0.ifengimg.com/ucms/2020_27/7FC3ADC328BAEF0B5C7F9B893B1965DD29629914_w1090_h555.png"")",2020-07-03 15:34:09,凤凰财经
6,恒生国企指数进入技术性牛市,财联社7月3日讯，恒生国企指数从三月低点回升20％，进入技术性牛市。,2020-07-03 15:17:28,凤凰财经
