,title,content,pub_time,src
0,酒店免单、机票报销、感染新冠我买单… 这些国家旅游已开放,"解封后你最想去哪里？
(image_address=""https://x0.ifengimg.com/ucms/2020_25/6BA8E37A87DB5A5E1E7AD8A80C56289063C1A18B_w1080_h719.jpg"")
从意大利到德国，不少国家已经逐渐解封，打开国门，准备迎接旅游的“爆发性反弹”。不少国家还推出了花样翻新、脑洞大开的“迎客红包”，努力吸引来自世界各地的旅游者。
哪些国家旅游已经开放了？解封后，你又最想去哪里？
欧洲：
开放边界拯救旅游业
(image_address=""https://x0.ifengimg.com/ucms/2020_25/A2132C99A0EC45DC55B583A0E8604DA1A86DE6FA_w1080_h720.jpg"")
欧盟宣布，从7月1日起，欧洲以外的游客将获准进入欧盟。
这是欧盟委拯救夏季旅游业计划的一部分，希望借此挽救数以百万计的旅游业工作岗位。
欧盟委员会副主席博雷尔说，旅行禁令将“逐步和部分地”解除。来自低风险国家的游客将首先被允许进入欧洲，但美国游客并不会在第一轮名单中。
新冠肺炎疫情仍然处在第二波乃至第三波蔓延中，许多国家仍然不鼓励非必要旅行，但许多依赖旅游业的经济体已经计划尽快向游客敞开大门。
意大利：西西里岛为游客买单！报销一半机票和三分之一酒店费用
意大利是欧洲新冠肺炎疫情最严重的国家之一，也是欧洲封锁时间最长的国家。从3月10日到5月4日，意大利6200万居民在家中自我隔离。
作为一个经济严重依赖旅游业的国家，意大利现在允许人们自由进出，无需隔离。
“来到意大利，只有一个风险：你会变胖！”意大利卡拉布里亚州州长乔&middot;桑特利(JoleSantelli)努力推销意大利旅游。
意大利旅游重镇西西里岛更是大手笔宣布，将为今年到访的游客支付一半机票费用和三分之一酒店费用。
不过，意大利南部的一些地区，包括普利亚和撒丁岛，要求游客在抵达前必须提交健康和登记表格。
西班牙：每日新增确诊过百，但“6月底欢迎游客回来”
西班牙交通部长何塞•路易斯•阿巴罗斯(JoseLuisAbalos)近期表示，他希望游客们能从6月底开始前往西班牙。
事实上，6月15日，因疫情暂停3个月的西班牙旅游业已经迎来了首批外国游客——从德国杜塞尔多夫乘坐航班前往马略卡岛的5人小团队。
虽然首批只是小规模“试水”，但很快，西班牙计划安排47个航班，向马略卡岛、伊维萨岛和梅诺卡岛输送大约1.09万名德国游客，而且他们抵达目的地后无需进行14天隔离。
6月21日前，从国外入境西班牙的其他游客仍须隔离14天。不过阿巴罗斯强调，旅行限制将逐步取消。“从健康的角度来看，我们必须使西班牙成为一个有吸引力的国家，”
希望西班牙的愿望不仅是一厢情愿。毕竟，西班牙的疫情仍然不容乐观。
6月18日数据，西班牙新冠肺炎疫情诊病例累计245268例，单日新增确诊病例143例；累计死亡27136例，过去7天新增死亡52例，是欧洲新冠肺炎疫情死亡率最高的国家之一。
希腊：计划为交通行业减税，降费迎客
希腊宣布从6月15日起，飞往雅典和塞萨洛尼基的国际航班逐步恢复正常。目前，国际航班已经被允许飞往雅典。
然而，欧洲航空安全局(EASA)列出的高危地区旅客，在抵达希腊后将仍需进行核酸检测，包括美国和英国。
游客在接受检测后必须在指定酒店过夜，等待结果。根据检测结果，旅行者在希腊将面临“自我隔离一周”或者“在监督下隔离两周”这两种不同的“旅行套餐”。非高危地区游客，也需接受随机检测。
不过，希腊也在想尽一切办法迎客，毕竟旅游业收入约占希腊国内生产总值的20%。政府计划暂时将所有交通行业增值税从24%降至13%，从而降低往返希腊的旅行费用，以此吸引更多游客。
塞浦路斯：奇葩促销！旅行期间感染新冠我买单
着急开放旅游的欧洲国家中，塞浦路斯的“迎客礼包”应该是最为脑洞大开的。
已经于6月9日开放边境的这个地中海国家宣布：将为任何在访问塞浦路斯期间感染新冠肺炎的游客支付住宿、餐饮和药品费用。
目前，塞浦路斯只对来自“安全”国家的游客开放。有19个国家在这个名单上，包括德国，奥地利，希腊，芬兰，丹麦和挪威等。
据约翰斯&middot;霍普金斯大学数据，截至当地时间18日，塞浦路斯有985例确诊病例，19例死亡。
北美：
大部分仍要求两周隔离
(image_address=""https://x0.ifengimg.com/ucms/2020_25/DCBBB711A285A0A4F006D7F1BAAD32BB0D291A5A_w1080_h720.jpg"")
美国：部分解除旅行禁令
此前，美国于6月8日宣布对旅行禁令作出调整，引起一片哗然。美国称，将逐步取消对全球五个国家以及美国本国39个州的旅行禁令。这五个国家包括，英国、德国、比利时、日本和巴林。
美国作为全球第一大旅游经济体，旅游业受到的影响也首当其冲。2019年美国共有国际游客7900万人次。今年自3月份疫情在美国失控以来，占美国GDP7.8%的旅游业已全面沦陷。
加拿大也要求入境需隔离两周，与美国的边境在6月21日之前也禁止非必要旅行。
墨西哥：旅游胜地提供免费住宿或疯狂打折
墨西哥最著名的旅游胜地坎昆、图伦和玛雅海岸6月8日起已经开始迎接国际游客。
坎昆所在的金塔纳罗奥州（QuintanaRoo）旅游委员会表示，已经重新开放来自美国、加拿大和欧洲的航班，预计最初的游客将以婚礼和会议为主。
坎昆和金塔纳罗奥的其他景点宣布，将对游客提供首日免费住宿和其他大幅折扣，以促进旅游业复苏。
根据目前计划，7月份墨西哥将大面积开放国际航班进出。
加勒比地区：
准备百页防疫指南迎客
(image_address=""https://x0.ifengimg.com/ucms/2020_25/8309C0D6265D1111BED467BA094B211B524C544A_w1080_h720.jpg"")
牙买加：准备100多页防疫指南迎接游客
牙买加6月15日起恢复旅游，成为重新开放的最大一个加勒比旅游目的地。
不过，每位入境的游客，将会收到一份“厚重的礼物”：牙买加新制定的以新冠肺炎为重点的健康和安全协议，多达100多页。这些规定包括从交通、旅游到酒店、餐厅在内的一切场所的卫生法规。
亚洲地区：
尚在谨慎观望中
(image_address=""https://x0.ifengimg.com/ucms/2020_25/2B46D670455ABFD79A64481FF417E8A5D7D316A4_w1080_h720.jpg"")
亚洲国家目前基本上不对外国旅游者开放，大多数国家尚在谨慎观望中。
日本6月18日刚刚宣布将逐步放宽外国人入境限制，但仍未正式实施。
日本首相安倍晋三表示，正在与疫情已稳定的越南、泰国、澳大利亚、新西兰协商，若符合相关条件，允许部分人员入境日本。此外，还将综合考虑国内外的疫情情况，依次扩大适用对象范围，允许作为特例的部分人员往来。
越南和新加坡尚未宣布开放日期；印尼巴厘岛初步计划将在10月份重新开放。
亚洲旅游业大国泰国，则急切希望恢复旅游业。
今年前5个月，泰国入境旅游的总收入同比下降六成。为此泰国6月16日批准一项预算为224亿泰铢（约合51亿元人民币）的国内旅游刺激计划，其中部分预算将用于补贴国内游客的住宿、食物等费用，游客承担60%，政府补贴40%。
泰国旅游与体育部部长皮帕表示，泰国旅游部门正与疫情已得到较好控制的国家协商共推“旅行泡泡”计划，即双方互相开放国际旅行，且不必隔离14天。
旅游业作为支柱产业的马尔代夫，已经宣布从7月1日起重启国际商业航班，预计阿提哈德航空、阿联酋航空和卡塔尔航空都将是首批返航的航空公司。
法属波利尼西亚宣布，从7月15日起向所有国家的游客开放。但是，包括著名的大溪地岛、博拉博拉在内的岛屿要求游客出示72小时内的核酸检测阴性报告，或者出具“免疫证明”，证明已经从之前的感染中康复。
非洲地区：
“最坏的情况”2021年开放
(image_address=""https://x0.ifengimg.com/ucms/2020_25/84DDD330DA0368059373066175E5590D1A68E236_w1080_h658.jpg"")
5月，坦桑尼亚已经宣布无条件欢迎各国游客，成为非洲最早恢复旅游业的国家之一。
南非的情况则更为谨慎，当地旅游官员说，希望在9月能重新对游客开放，但如果遇到“最坏的情况”，则可能推迟到2021年。",2020-06-19 19:47:29,凤凰财经
1,周星驰对赌失败11亿元豪宅被抵押，又被前任讨债，喜剧之王何时重归？,"(image_address=""https://x0.ifengimg.com/ucms/2020_25/7F66004D6CCA491D3FB369C8C9C4D37B173424CF_w1080_h459.png"")
图片来源：小欢插画
作者|宋冠宇
来源|野马财经
对于周星驰来说，2020年无疑是多事之秋。对赌赔钱、豪宅抵押、前女友追债三位一体，压得星爷喘不过气。
巨额对赌欠下巨额赔款，星爷抵押“天比高”救急
近日，有媒体爆料，演员周星驰借其姐周文姬之名，将其山顶的11亿港币豪宅“天比高”抵押给摩根大通银行。作为早已名利双收多年的国民喜剧教父，周星驰此举不免让人疑惑，到底是什么原因让星爷突然有了如此巨大的资金诉求？
(image_address=""https://x0.ifengimg.com/ucms/2020_25/DA98F0A1964D6E8C90D4FA99F6BA04738E882CCA_w884_h492.png"")
图片来源：小欢插画
野马财经（微信公号：ymcj8686）发现，想追根溯源，还需从2017年周星驰与内地买家签订的对赌协议谈起。
2017年，新文化（300336，SZ）旗下两个子公司以人民币13.26亿元的价格购买了周星驰名下公司PREMIUMDATAASSOCIATESLIMITED51%的股权成为控股股东。
在协议签订时附带了对赌条款，周星驰承诺在2016年至2019年4年期间内，公司净利润分别不低于1.7亿元人民币、2.21亿元人民币、2.873亿元人民币以及3.617亿元人民币，合计10.4亿元。若不能达到该要求，周星驰愿自掏腰包补足差额或回购股份。
值得注意的是，彼时该公司于2016年营收仅仅为人民币117.4万元，净利润不过34.84万元，而2016年1~9月只有净利润人民币6418.5万元，如此轻体量的公司竟然售得十几亿并且另要承担10.4亿的对赌，不得不令人惊叹。
要知道，当时市场对该公司的估值达到26亿元，而且不少业内投资者认为并不存在虚高的情况，可见与周星驰有关概念的火热程度。
细心的朋友可能已经发现，周星驰在近几年作品不断，产量较之前年度大幅提升，想必顺利完成对赌条款是增产的一大动力。
2016年《美人鱼》一炮而红，票房口碑双赢，国内斩获票房36亿港币，全球拿下将近43亿港币的不错成绩。
可从接下来的《西游记伏妖篇》开始，越来越多的观众并不买账了。电影质量的差强人意，风格固化，使得“每个人都欠周星驰一张电影票”的话术由情怀篇逐渐变为嘲讽梗。
再到最近的《新喜剧之王》，名头之大，IP之响，无出其右。可在2019年贺岁档最终的票房成绩比拼中，只获得6.15亿的《新喜剧之王》不要说难以望43.19亿票房的《流浪地球》项背，就连6.91亿的《熊出没》都没能战胜，令人大跌眼镜。
祸不单行，在事业不顺的同时，后院起火法院传票的召唤，想必也让他感到焦头烂额。
前女友来袭，强大后援团誓要7000万港币赔偿
演员出身的周星驰，靠演技获得了巨大名誉，但其财富之源却是扎根在浩瀚商海。
星爷的投资领域十分广泛，前文所述的PREMIUMDATAASSOCIATESLIMITED只是小巫，影视领域内更为知名的周氏公司当数星辉海外。自1996年公司创立之初，星辉海外创作了《食神》、《喜剧之王》、《少林足球》、《长江7号》、《功夫》及《美人鱼》等叫好又叫座的电影，记录了一个时代。得益于影片的优异成绩加持，海外星辉在市场上所占的地位与份额也越发壮大。
此外有公开资料显示，周星驰曾在2002年以3000万港元买下香港旺角两间商铺，以每月23万港元的价格出租，并于2004年以4300万港元将其卖出，从中获得较高收益。
随后2007年，周星驰又以2.1亿港元买入位于九龙尖沙咀的一个商场，并在2009年以3亿港元的价格售出，账面净赚9000万港元。
坊间传言，巅峰期周星驰的身价达到50亿刚毕业，这份财富成就除了归因于周星驰个人的实力与努力外，其实很大程度上更要归功于其前女友，同时也是其私人财务助理的于文凤身上。
自1998年开始便与星爷在一起的于文凤，本是香港建设“前熊谷组”家族于镜波的小女儿，最早以影迷的身份与周星驰相识，后发展为好友，最后成为恋人，开始了13年的感情长跑。
在这期间，于文凤为周星驰的投资版图扩建出谋划策，不仅担当他的财务大臣，还帮他做房地产开发，累计获利高达港币二十亿，使得周星驰跃居一线富豪行列。
遗憾的是，最终二人的感情之路还是在2010年画上了句号，和平分手。
自2012年开始，于文凤不断向法院提出上诉，起诉书中指出，她与周星驰曾有口头协议，周星驰会就获利的投资项目向她支付佣金，佣金为除税后利润的10%。
2004年周星驰采纳她的建议，以3.2亿港币投得山顶普乐道十号物业。于文凤又引入菱电与周星驰合作发展“天比高”项目，2007年在地皮上建成四座独立房，其中16号及18号已于2009年出售，周星驰为此向于文凤支付佣金超过1,494万港币。
菱电后来出售10号屋，余下12号屋的注册业主为星扬海外有限公司，于文凤指出周星驰是星扬的实际利益拥有人，12号屋的净值达8亿港币，周星驰同意按协议就12号屋支付于文凤8千万港币佣金。
2003年7月，周星驰透过菱电的胡亮明向于文凤建议分期支付该笔佣金，即头三年每年支付1千万元，至第四年将12号屋出售，然后支付尾数，但于文凤并没有同意。
同年12月，于文凤向周星驰发律师信追讨佣金。
2004年2月27日，于文凤同意撤销法律行动，周星驰则同意支付1千万元佣金，另就尾数的付款安排提交书面建议。3月1日，于文凤去信周星驰确认已收到部分佣金即该1千万元。不过3月30日，周星驰去信于文凤反指该1千万属无偿付款，同时否认对于拖欠佣金。
自此之后，剩下的7000万元酬金便不了了之了。虽然于文凤出身名门，与周星驰分手后又与身价百亿的银行家之子相恋，过着富足的生活，但对于这7000万元的执着，除了维护自身利益外，更多是为了给自己多年付出争一口气。
据悉，于文凤此次组建了豪华的律师团队，来势汹汹，而经过一番运作，该案也终于安排在本年的11月开审，至于结果如何，尚未可知。
企业观察员杨建远针对此事向野马财经（微信公号：ymcj8686）表示：其实中国电影市场近两年的发展还是很喜人的，不论是《战狼2》的横空出世，还是《流浪地球》开启的科幻元年都获得了热烈反响。周星驰作为一个时代的代表，在退出屏幕的这几年间所拍摄的电影虽然还是周氏喜剧的架构，但却失去本尊出演的灵魂。而且以炒作情怀居多，这样的质量和套路难以满足越来越挑剔的中国观影者需求。
豆瓣评分上，5.9分的《新喜剧之王》、5.5分的《西游伏妖篇》更是难以与早年8、9分的《逃学威龙系列》及《赌圣》等经典相媲美。可以说，观众不买账，票房的逐渐走低是没有达到对赌条件的重要因素之一。
对于“我们都欠周星驰一张电影票”这一说法你现在怎么看？如今又遇到影视寒冬和疫情的夹击，周星驰下一步又将有何计划？欢迎在评论区留言。",2020-06-19 19:47:16,凤凰财经
2,千亿芯片巨头19天火速过会！拟募资200亿，下周二拿批文？,"原标题：无悬念，千亿芯片巨头19天火速过会！拟募资200亿，下周二拿批文？港股本月暴涨37%！
没有悬念，中芯国际科创板IPO过会，成为第三家过会的红筹公司。
(image_address=""https://x0.ifengimg.com/ucms/2020_25/DA3D0250B692951D9A11856C9B4B182F868F7946_w509_h258.png"")
同时，公司本次IPO征途也创出了科创板多项审核新纪录：IPO材料受理3天后即收首轮问询，之后仅花四天答完问卷，按受理算起到6月19日成功过会，中芯国际总共花了19天。
当晚，资深投行人士王骥跃向证券时报&middot;e公司记者表示，在上会环节上市委一般会出具审核意见或无意见。企业在上交所审核同意后即可上传注册稿，理论上当天可以注册，此前中国通号是次日拿到注册批文。所以，预计中芯国际最快可能下周二（6月23日）获得注册批文，即在端午节前。
“后续询价路演发行上市至少需要13个工作日，中芯国际在7月22日（科创板开市一周年）之前应有望上市，具体或在7月15日那周。”王骥跃预计。
市值已逾1200亿港币
中芯国际未来发行价如何定价，港股股价或是参照标准。据证券时报&middot;e公司记者观察，随着公司回归A股步伐加快，6月至今，中芯国际（HK00981）港股股价已累计上涨约36%，一举创出历史新高，市值达到1274亿港币。
(image_address=""https://x0.ifengimg.com/ucms/2020_25/F2A6D781FF809DCB46C0EA99561116CB83F63E59_w929_h506.png"")
在受访业内人士看来中芯国际的火速过会并无悬念，公司已在境外成熟市场上市，具有16年公众公司的天然属性，公司治理和日常信息披露已经得到了严格的市场检验。同时，浓厚的科创成色、战略价值和市场地位也成为中芯国际IPO回归进程得以提速的先决条件。
此前招股书披露，中芯国际是全球领先的集成电路晶圆代工企业之一，主要为客户提供0.35微米至14纳米多种技术节点、不同工艺平台的集成电路晶圆代工及配套服务。本次公司拟发行不超过16.86亿股新股，预计募资200亿元人民币，计划分别投入中芯南方正在进行的12英寸芯片SN1项目（80亿元），先进及成熟工艺研发项目储备资金（40亿元），补充流动资金（80亿元）。其中，“12英寸芯片SN1项目”是中国大陆第一条14纳米及以下先进工艺生产线，规划月产能为3.5万片，目前已建成月产能6000片。
据悉，在集成电路晶圆代工领域内，全球范围内有技术能力提供14纳米技术节点的纯晶圆代工厂有4家，而目前有实际营收的纯晶圆代工厂仅剩3家。中芯国际曾表示，在下一代技术节点的开发上，在全球纯晶圆代工厂中仅剩台积电和中芯国际。
(image_address=""https://x0.ifengimg.com/ucms/2020_25/B568E9CB0ED7DA28AE75FC8C544B14DC20C35CE9_w653_h338.jpg"")
(image_address=""https://x0.ifengimg.com/ucms/2020_25/DEE6A0506C68848BDEA8C436B1818C7D11E662D3_w604_h391.jpg"")
可以说，作为国产芯片制造的龙头企业，中芯国际与境内资本市场快速对接的意义不仅仅在于中芯国际本身。展现的是注册制下，科创板对高科技企业的支持力度，对经济发展模式转型升级的推动力。大力支持科创标杆企业到科创板上市，加大科创板的示范性和影响力。
回看本次科创板上市委所提主要问题，技术相关问题被首个问及：公司需说明14nm和28nm等较先进制程产品的市场定位及未来应用前景等。
先进工艺一到三年推进一代
经证券时报&middot;e公司记者观察，短短19天并非简单走过场，上述相关问询问题公司此前已有答复；在本次招股书（上会稿）中，公司也已结合审核中心意见落实函的回复和首轮问询回复中等内容进行了修订、补充，全面梳理了“重大事项提示”等多项内容，突出重大性，增强针对性，强化风险导向等。
例如，中芯国际着重提示了目前公司14nm及28nm制程产品收入占比较低，28nm制程产品产能过剩、收入持续下降、毛利率为负的风险。以及公司面临较高的折旧压力，且研发投入不断增大，使得扣非后归母净利润持续为负的风险等。
又如，在晶圆代工领域技术升级迭代的风险中，公司提示和总结：集成电路丰富的终端应用场景决定了各细分领域芯片产品的主流技术节点与工艺存在差异，且技术迭代与相应市场需求变化较快。
中芯国际指出，先进工艺一般一到三年往前推进一代，如行业龙头2015年量产16纳米/14纳米，2016年量产10纳米，2018年量产7纳米，2020年量产5纳米。若晶圆代工厂商技术迭代大幅落后于产品应用的工艺要求，则无法满足市场和客户的需求。
“目前公司第一代14纳米FinFET技术已进入量产阶段，第二代FinFET技术（N+1工艺技术）平台已进入客户导入阶段，但相较于行业龙头已量产更先进制程的现状，公司在工艺制程上与行业龙头公司仍存在一定差距等。”中芯国际坦诚。
基于此，外界颇为关注的是，上述第二代FinFET技术相关性能和功耗水平几何？对此，公司也已在首轮问询回复中予以了披露，并在招股书（上会稿）中进行了补充披露：公司作为中国大陆第一家实现14纳米量产的集成电路晶圆代工企业，具备14纳米以下先进工艺研发所需要的技术基础与资金实力。与第一代FinFET技术中的14nm相比较，公司预计第二代FinFET技术有望在性能上提高约20%，功耗降低约60%。
中芯国际介绍，14纳米及以下先进工艺主要应用于5G、人工智能、智能驾驶、高速运算等新兴领域，未来发展前景广阔。随着相关应用领域持续发展，先进工艺的市场需求将持续上升，市场份额将不断扩大，成为集成电路晶圆代工市场新的增长点。
此前据长期关注中芯国际的业内人士向证券时报&middot;e公司记者介绍，中芯国际的N+1工艺技术，在功率和稳定性方面，N+1和7nm工艺较为相似，但区别在于性能方面，和14nm相比，N+1工艺性能提约20%，市场基准的（7nm工艺）性能提升应该是35%。按其理解，中芯国际对N+1的目标是低成本应用，可以将成本相对市场上的7nm减少大约10%，因此是一个非常特殊的工艺节点，但因为性能上的差距，尚不能等同于7nm工艺。
加速先进制程追赶步伐
尽管要迎头赶上世界最先进工艺仍有待时日，但机构们对未来前景普遍看好：中芯国际本次科创板IPO有望加速其先进制程的推进和追赶步伐，从而带动整个国产半导体产业链缩短与国际水平的差距。
中信建投在此前研报中指出，中芯国际14nm市场需求景气向上，带来更广阔市场空间。同时，由于突破FinFET工艺，“N+1”“N+2”代先进工艺推进有望超出预期，中芯国际在先进制程节点不断突破，缩小与国际先进大厂的差距；看好大陆半导体产业链转移给公司带来的机会。
新时代证券认为，中芯回归科创板，募投资金主要用于产线扩充，将给国产半导体设备和材料带来更多需求，关注核心环节国产厂商如中微公司，北方华创，安集科技，晶瑞股份等。
据中银证券梳理，中芯国际工艺设备进口为主，而其成熟制程培育了一批国产品牌。根据中芯国际公告，2019-2020年累计资本开支将达到64亿美元，主要用于先进制程，部分用于成熟制程。2019年至今，公司公告累计采购应用材料、LamResearch、TEL的工艺设备达32.5亿美元。国产设备供应商则包括北方华创、中微公司、盛美股份、芯源微、屹唐等，根据各公司公告，中芯国际或控股公司曾是中微、盛美、芯源微前5大客户之一。
该行指出，中芯国际半导体材料也以进口为主，但掩模版、研磨液国产化率较高：例如，安集约占中芯国际研磨液采购额的1/3；电子特气方面，华特气体约占中芯国际采购额的6.6%；靶材预计国产化率超过10%，江丰电子多项产品此前已供应中芯国际。
中芯国际供应链情况
(image_address=""https://x0.ifengimg.com/ucms/2020_25/EC3229BEEEB7ACB4336EA234AFC053F6AAC0293B_w694_h358.png"")
(image_address=""https://x0.ifengimg.com/ucms/2020_25/D0F63A127C8885170E98182EAD2917CC40420B18_w688_h571.png"")
附中芯国际的科创板IPO征程时间表：
5月5日，中芯国际宣布将在科创板IPO。
5月7日，公司与海通证券、中金公司签署了科创板上市辅导协议。
6月1日，中芯国际科创板上市申请获受理。
6月2日，公司敲定中国信科及上海集成电路基金将成战投，合计认购25亿元人民币股份。
6月4日，中芯国际收到首轮问询。
6月7日，中芯国际回复首轮问询。
6月19日，中芯国际科创板IPO过会。",2020-06-19 19:40:05,凤凰财经
