,title,content,pub_time,src
0,中国石化：2019年度净利润575.91亿元 同比下滑8.7%,"中国石化(600028)3月29日披露年报，公司2019年度营收29661.93亿元，同比增长2.6%；净利润575.91亿元，同比下滑8.7%。基本每股收益0.476元。公司建议派发末期股利每股0.19元（含税）。
(image_address=""https://x0.ifengimg.com/ucms/2020_14/7D199AC7F07167B58E22E424086CBE007247E8AF_w1020_h1152.jpg"")",2020-03-29 15:49:18,凤凰财经
1,新冠医保结算近十万人次，确诊患者人均花费1.7万元,"治疗一名新冠肺炎患者需要花费多少钱？国家医保局给出的答案是，确诊患者人均花费1.7万元。
根据中央纪委国家监委网站3月29日消息，国家医保局医药服务管理司司长熊先军接受采访时表示，截至3月15日，全国新冠肺炎确诊和疑似患者发生医保结算93238人次（包括门诊患者多次就诊结算），涉及总费用103960万元，医保系统共支付67734万元。
其中，全国确诊患者结算人数为44189人，涉及总费用75248万元，人均费用1.7万元，其中医保支付比例约为65%（剩余部分由财政进行补助）。
国家医保局公布的这一费用水平，与深圳市定点医院此前公布的数据相差不大。
2月28日，深圳市第三人民医院李义平等在《中国医院管理》网络首发了论文《深圳市105例新型冠状病毒肺炎患者住院费用及结构分析》。这篇论文采用回顾性调查的方法收集深圳定点收治医院2020年1月11日~2月15日期间通过绿色通道入院的新冠肺炎患者，通过医院信息系统（HIS）导出已出院患者的基本信息和住院费用信息。最终纳入105例病例，其中男性51例，女性54例。
论文数据显示，在105例新冠肺炎患者中，以19~40岁青壮年人群为主，平均住院日为11天，平均住院费用为12288.53元。从住院费用的构成来看，化验费占比最高，近40%；其次是西药费占比为27%，检查费为10%。
该论文称，住院日对住院费用的影响最大，随着住院日的增加，患者的床位费、护理费、治疗费、检查费和药品费都会随之增加。
熊先军表示，由于新冠肺炎是一种新的疾病，医保局充分考虑到患者和临床需要，无论之前是否在医保目录中或是否有限定支付范围，均临时纳入医保基金支付范围。同时根据诊疗方案变化，动态调整报销范围。如诊疗方案中的体外膜肺氧合（ECMO）因对诊疗水平要求较高，费用较为昂贵，之前许多省份未纳入支付范围，在肺炎疫情中医保也予以支付。
第一财经从多地医院了解到，治疗一名新冠肺炎轻中症患者的费用约在2万元，重症患者的花费比较高，主要是抢救费用比较高，比如使用ECMO等诊疗设备，费用要到40~50万元。
论文数据分析还显示，不同年龄组患者的住院费用在统计学意义上具有差异，年龄越高，医疗花费就越高。高龄人群免疫力低下且大多伴随基础疾病，为病毒的易感人群，年龄可以充分预测新冠肺炎患者的疾病严重程度，年龄的增加不仅加大了救治难度，而且也增大了医疗资源的利用。
1月22日，国家医保局会同财政部明确提出“确保患者不因费用问题影响就医、确保收治医疗机构不因支付政策影响救治”的“两个确保”要求。为了打消患者的后顾之忧，让患者放心就诊，医保部门要求对于确诊和疑似患者全部实行先救治、后结算。在基本医保、大病保险、医疗救助等按规定支付后，个人负担部分由财政给予补助。
熊先军还表示，为缓解医疗机构垫资压力，医保经办机构还专门预付专项资金用于患者救治。截至3月19日，各地医保部门累计拨付资金193亿元，其中湖北省37亿元。",2020-03-29 15:30:42,凤凰财经
2,来自欧洲的一份份订单，随恐慌情绪消失,"(image_address=""https://x0.ifengimg.com/ucms/2020_14/0553554866DF99C61848AC5769A5CA4BE6EE43CC_w900_h601.jpg"")
张明可能没有想到，2月复工之后，一场更大的困难在等着他。
“3月初工厂陆续开工，我们原本的缺货问题得到了缓解。”他告诉记者，但没想到新冠肺炎疫情又自欧洲开始发酵。
张明在深圳经营一家中等规模的跨境电商企业，主要通过亚马逊（Amazon）和易贝（eBay）等平台，将国内配件等小商品卖到海外市场，比如英国、意大利、美国等。
然而3月初以来，疫情在上述国家快速扩散，公司竟一下子到了生死关头。“3月15日开始，订单量一下子比上年同期掉了50%，就像过山车一样。”他说，当晚公司紧急开会讨论策略，针对需求改卖防疫物品，但不确定能撑多久，因为疫情，国际航班大幅减少或停运，货运不过去。
“ABCD预案我们都讨论过，现在的目标就是生存，撑到明年公司就能活下来。”他说。
不过，危机中也蕴藏机会。此时，一场从上至下的驰援行动也已开始。3月24日召开的国务院常务会议确定，推动制造业和流通业在做好疫情防控同时积极有序复工复产的措施；部署进一步提升我国国际航空货运能力，努力稳定供应链。
订单断崖式地往下掉
3月11日，意大利新冠肺炎确诊病例破万。看着新闻中飙升的数字，张明心中当时就“咯噔一下”。有着十多年电商出口业务经验的他，很清楚这些欧美国家的情况，估摸着事态会越来越严重。
事实果真不出所料。疫情很快在欧洲扩散，世界卫生组织（WHO）随即宣布疫情全球大流行。
恐慌情绪变成了现实中一个个消失的订单。
先是非必需品类物资销量大幅下降。“主要是需求没了，都紧着生活必需品。”张明告诉记者，订单量每天都在锐减，较前一日往往会跌去30%至90%。
看着陡降的订单量，公司连着周末紧急开会，商量对策。讨论的结果是——先根据海外疫情需求调整品类，如口罩、温度计等防疫物品。能卖什么的问题暂时解决了。
但没想到接下来情况还是没有好转迹象——3月20日前后，英国、澳大利亚等国际航班陆续停运，物资运输成了更大的麻烦。
跨境电商高度依赖国际客运航班运能，因为相较货机而言，一是航班多，二是价格低。尽管现在运输价格从常规的20元/公斤，飙涨到80至100元/公斤，但对张明而言，苦在航班太少，就算有订单，货也运不过去。
“很多节点可能都会出问题，不知道哪个‘雷’先爆。”张明坦言，他预计海外疫情影响可能会持续3到6个月。但隐忧在于，欧美居民大多没有储蓄习惯，消费能力至少要到明年才能缓过来。
最坏的结果还没来
张明的公司成立于2008年，如今员工100人左右，一年营收约2亿元。
“我们早就预料到情况会非常严重，把可能出现的情况都讨论过一遍。”他说，好在公司经营一直比较保守，财务状况相对健康，资金杠杆也不高，应该不会出现特别极端的情况。
尽管抱着“兵来将挡”的想法，但他的担忧没有消退——全球确诊病例还在攀升。
世卫组织数据显示，截至欧洲中部时间3月28日18时（北京时间3月29日1时），全球确诊新冠肺炎575444例，死亡26654例。目前全球已有201个国家地区出现新冠肺炎病例，中国以外新冠肺炎确诊病例超过49万例。
之前，跨境电商平台“洋码头”CEO曾碧波坦承，疫情给电商企业带来的机会大于风险，但是跨境电商在物资流通方面受到的影响很大。
记者注意到，近日来，亚马逊，eBay、Wish、Lazada等平台都发布调整政策，包括出入库品类、物流配送等，涉及欧洲、美国等全球多个市场。
“我们很多日常类产品是通过亚马逊来投递，3月23日,亚马逊已经停止了非必需品派送。”张明说，先前是不让卖家补仓。亚马逊通知派送要1个月后，但何时真的恢复是未知数。
据报道，美国新冠病毒疫情已蔓延到至少6个亚马逊仓库，已有亚马逊工作人员感染。亚马逊关闭了部分仓库来进行清洁消毒，与受感染同事密切接触的人员也被隔离。
“这是可以预见的。”张明表示，仓库属于人员密集型区域，一人感染，全部停工，或者为预防感染，采取轮班制，处理能力肯定明显下降。这意味着，就算物资运到当地后，能够顺利派送到客户手中也成了问题。
现在对他来说，最坏的情况还没有到来。在国外，无论是亚马逊还是eBay，派送都是与当地邮政合作，比如英国皇家邮政（RoyalMail），如果疫情进一步恶化，派送体系可能停摆。
危中有机，还是有好消息
作为传统外贸的新业态，在过去10年的经济高速增长期，跨境电商形成了数以万计的庞大卖家群体，贡献的业务量是近年来外贸增长的一大亮点。
张明公司所在地深圳，聚集了华南地区80%的跨境电商。
事实上，外贸强省广东的跨境电商业务量排在全国首位。海关总署数据显示，2019年通过海关跨境电商平台统计的广东省跨境电商进出口总值1107.9亿元，同比增长45.8%，占全国跨境电商总值的59.5%。其中出口741.6亿元，增长62%，占全国78.6%。今年前两月，广东省跨境电商进出口79.5亿元，增长33.4%，继续保持全国首位。
危机中也蕴含机会。
河南保税集团总裁、中国跨境电商50人论坛第三届联席主席徐平表示，疫情在全球180多个国家和地区蔓延，一些国家在学习借鉴中国的做法，这意味着全球对线上购物、线上办公需求会有更多地认可和接受度。她建议卖家，短期内可以改变产品品类，做好从外需到内需的快速转变和自救。
跨境电商的冬天可能不会太长，目前来看，从航运、到通关，再到金融服务等都有相应政策支持。
3月24日召开的国务院常务会议，明确要加强国际协作，畅通国际快件等航空货运，对疫情期间国际货运航线给予政策支持。鼓励增加货机，发展全货机运输等。海关总署也制定50条“清单”，全面保障外贸产业链、供应链畅通。银保监会26日也下发通知，要求银行业金融机构强化金融支持“稳外贸”作用，增加外贸信贷投放，对优质外贸企业授信和支用放款建立“绿色通道”。
张明的公司，正在积极卖防疫物品。前些日子，每天口罩就能卖几万个，基本秒光。虽然现在平台不让卖口罩和洗手液，但温度计等物品还可卖。如果物流情况能够很快好转，通过销售防疫物品，公司撑到明年希望很大。",2020-03-29 15:28:00,凤凰财经
3,收房就拿产权证！江苏6月起全省实行“交房即发证”模式,"近日，江苏省自然资源厅与国家税务总局江苏省税务局联合印发了《关于在全省推广“交房（地）即发证”不动产登记模式提升服务质量的通知》，同时公布交房（地）即发证时间推进表，4月中旬前各地制定实施方案并报省厅备案；6月起各地全面开展工作，实现常态化运行。江苏是目前在全国范围内唯一整省推广“交房（地）即发证”不动产登记模式的省份。
(image_address=""https://x0.ifengimg.com/ucms/2020_14/CFAAF3B7365AAC415F199B095C3341006A7E5DD0_w966_h466.jpg"")
不动产权证是房产归属的书面凭证，相当于房产的身份证。在没拿到不动产权证前，购房者并不能算是该房产法律意义上的拥有者。过去，从交房到拿证，少则几个月，多则几年，收房了却办不到不动产权证的情况在全国各地也屡见不鲜。而迟迟拿不到不动产权证又会使购房者在落户、子女上学、房屋转赠转让、抵押贷款等权益的实现上受到极大阻碍，并且没有不动产权证房子就不能出售，也不受国家法律保护，给购房者维权造成困扰。
而江苏的新规，要求“交房（地）即发证”，为买房者大大提供了方便，购房者在收房拿钥匙后，无论按揭购房，还是全款付清，仅需结清税款、备齐资料，即可在收房时同步申请办理不动产登记，领取不动产权证书，无需再跑办事大厅，还能同步领取水、电、气、网8个证（卡）。
(image_address=""https://x0.ifengimg.com/ucms/2020_14/E82BFEFE9DB728DB2443FCDE2942815743E44E6D_w638_h438.jpg"")
对于房产企业来说，时间就是金钱，办证等待时间越短，就越能最大限度节约建设成本。以前从签完土地协议到办土地证需要几个月的时间，今后土地交付当天就可领证，大大节省了企业的时间成本和财务成本。
交房（地）即发证要求房产企业严格落实在新建商品房不动产登记办证中的主体责任，破解了项目审批后监管难的问题。对房产企业而言，这是一个不小的压力：房屋建设各项手续必须齐全，楼盘质量必须过硬，房屋销售前验收阶段有一关通不过，都不能销售。但另一方面，也恰恰因为这种有效监管，使得越来越多“符合条件的优质房产企业”能够凭借品质、口碑、业绩来赢得更多购房者。并且，通过市场手段，让“优胜劣汰”成为常态，有助于房地产市场秩序的健康有序发展。
作为首批“交房即发证”的试点城市，徐州自2019年12月底就开始采用市自然资源和规划局、市政务服务管理办公室、市住房和城乡建设局、国家税务总局徐州市税务局四部门联动办公模式。部门间所需的信息及资料，一律通过信息共享获取，电子化远程推送，避免申请企业和群众重复提交，实现了零材料申请，杜绝了虚假材料，保障了登记安全。同时，通过不动产智能链服务平台，缩短办证时间，为企业大幅节省人力与时间成本。（总台央视记者吴睿）",2020-03-29 15:11:52,凤凰财经
4,巨亏，清盘，关门！ 惨遭失落十年，全球对冲基金又受重创！,"今年早些时候，对冲基金巨头雷&middot;达里奥认为，他和桥水基金的团队在新冠疫情问题上“愚蠢透顶”。
桥水基金曾经对新冠疫情不以为然。在2月下旬，达里奥还对投资者表示：“如果我们为了应对最近的新闻头条而改变自己的做法，那将是一个错误。”
一个月后业绩见分晓，今年截至3月18日，桥水基金旗舰纯阿尔法对冲基金损失14%，另一只更激进的基金下跌了21%。市场一度传言其基金爆仓，在残酷的现实面前，作为经济预言家形象的达里奥不得不承认，他错了。
对冲基金行业的目标是在大多数市场条件下赚钱，并在经济低迷时期保护投资者的资本，而事实证明，最大规模的对冲基金也不过如此。其实历史早就有过先见之明：2008年金融危机期间，当时对冲基金平均亏损18%——远好于股市，但仍大幅下跌。
今年开年，对冲基金行业在动荡期间表现得还算不错：对冲基金研究公司HFR的数据显示，2月份对冲基金平均仅亏损1.4%。但随着动荡不断加深，早期的反弹逐渐消退，甚至连可靠基金的业绩也出现滑铁卢。今年3月，对冲基金下跌8.6%，全年跌幅接近10%。
清盘屡见不鲜
德国最大保险集团旗下的安联环球投资正在清算两只暴跌中蒙受巨大损失的对冲基金。该公司发言人表示，结构性阿尔法1000和结构性阿尔法1000Plus将“进入有序清算阶段”，这两家公司都采用了基于衍生品的策略。
尽管这两只对冲基金都使用看跌期权来对冲其投资组合，但它们仍蒙受了巨额损失。基金经理在市场抛售期间采取了降低投资组合风险的措施，这两只对冲基金都录得巨额亏损。
据了解，安联拥有两项大型资产管理业务——德盛安联和债券集团太平洋投资管理公司，这两家公司管理的资产总额接近2万亿欧元。不过，规模庞大的母公司也未能保驾护航。
另一欧洲对冲基金则表示永久离开这个行业。瑞典对冲基金管理公司BodenholmCapitalAB决定关闭其基金，并向投资者返还资金。这位总部位于斯德哥尔摩的对冲基金经理在写给投资者的信中表示：“出于对投资者的最大利益考虑，这些基金已被清盘，在可预见的未来，我们的团队将彻底脱离这个行业。”Bodenholm经营着一个多空股票基金，管理着大约10亿美元的资产。
美国也有基金在忙着闭门谢户。Solus另类资产管理公司是最知名的不良投资专家之一，是高风险资产价格暴跌的首批受害者之。在遭遇大规模赎回和业绩不佳的双重打击后，该公司正在关闭其旗舰基金。
3月上旬，该公司向投资者表示，即要么将其投资转入新基金，要么面临有序清算，尽快返还投资者剩余资金。就在去年11月，这家对冲基金还管理着43亿美元的资产。
此外，目前，孔雀石资本管理公司，曼尼凯等一些基金向投资者返还资金。其它许多基金在承受自2008年金融危机以来的最大损失，在是否关门的边缘徘徊。
高杠杆受重挫
宏观基金受益
总体来看，对冲基金不同策略、个别基金经理、甚至多策略基金内部的业绩差异很大，但绝大多数投资策略都遭受了“割肉”的损失。
利用杠杆来放大收益的对冲基金首当其冲。寻求从美国国债与美国国债期货之间的微小差异中获利的对冲基金受到重创。这一策略虽有一贯的稳定性，公司利用大量的杠杆来提高回报。但当正常的相关性被打破，所有资产一起被抛售，情况很快变得糟糕。另一类就是风险平价基金。该类基金本意是利用不同资产之间不同的风险来配置资产，同样利用了杠杆来放大低风险端资产的回报。
寻求利用市场趋势的对冲基金也多少有些失望。趋势跟踪策略在2008年增长了18%，但自那以来一直表现不佳。有投资者感慨，如果他们现在不能证明自己的价值，该策略就几乎没有生存空间了。
基金经理们表示，美联储激进的货币宽松政策已经止住了跌势，但在此之前，包括城堡和千禧基金等一些对冲基金行业巨头已经受到了冲击。在传统的做多/做空股票的对冲基金和CTA策略中，这种痛苦更为严重。
另一方面，一些押注于重大经济趋势的全球宏观基金，却比多数基金更能从最近的波动中获利。由于押注债券价格上涨，布勒旺&middot;霍华德资产管理公司和卡克斯顿今年实现了两位数的涨幅。
与此同时，由于一些欧洲国家禁止卖空，对冲基金的投资风格正面临限制。卖空是一种押注价格下跌的行为。有基金经理抱怨，你不能仅仅因为某些行业（或）公司这些天的表现非常糟糕，就指责卖空者。
下跌冲击堪比金融危机
许多人担心，此次暴跌极有可能导致2008年那种大规模的对冲基金“团灭”，规模较小的基金尤其脆弱，这还会深刻重塑对冲基金行业。有业内人士表示，现在发生的事情是史诗级的。在此之后，这个行业将不再是原来的样子，许多知名基金将纷纷下马。另一方面，强者恒强，部分基金规模将变得更大。
2008年金融危机后十年里，对冲基金整个行业都经历了一段表现低迷的时期。创纪录的低利率和央行的量化宽松引发多年牛市，这种市场环境有利于廉价的指数跟踪基金，却让那些追求更复杂、更昂贵策略的基金日子不好过。
多年来，对冲基金经理一直渴望更大的波动性，因为对冲基金本意是在市场动荡时提供风险对冲。新冠大流行造成的经济损失和人员伤亡远超预期，那些寻求更大波动的业内人士没能如愿以偿，或许对冲基金的绝对收益和避险功能只是传说。
在过去17个季度中，对冲基金已有13个季度遭遇投资者资金外流，而全球对冲基金公司的数量再也没有超过2008年金融危机前。好在活跃的市场帮助该行业的资产管理规模稳定在3万亿美元左右，但现在这一数字马上也要大打折扣。
鉴于市场动荡，许多投资者将评估他们的对冲基金配置，结果可能是更多资金流出。长期令人失望的回报率导致了管理费的下降压力，使得2%的管理费和20%的绩效结构开始成为例外，而非之前的常态，许多留下来的公司利润更少。不少投资者质疑，如果对冲基金的损失仅略低于股市，那有什么意义?",2020-03-29 15:03:52,凤凰财经
