,title,content,pub_time,src
5,壕：61股创历史新高，两类股被买爆！,"壕：61股创历史新高，两类股被买爆！2020年05月13日 18:42:07
来源：每经牛眼
原标题：壕：61股创历史新高，两类股被买爆！谁会是下一批10倍王者？一大关键指标直接锁定！（名单）
继昨天V形反转之后，今天A股又来了个低开高走、意外翻红！不过严格来讲，今天沪指和深指表现很一般，两者都只是微涨，而且两市成交量都出现萎缩，并且创出了近1个月新低。
然而，个股表现却颇有“风起云涌”、“奋勇争先”的感觉：共有61只个股创出历史新高，特别是其中消费行业和医药医疗行业个股继续一路飙升，带给人牛市的错觉。
那么，在市场来回震荡之时，哪些个股更值得提前布局进行把握呢？“每经牛眼”注意到，或许可以从个股的品牌价值、市值之间的变动关系中找到一些端倪，从而寻找到未来的十倍潜力股！
两大消费行业涨势如虹
据WIND数据统计显示，今日两市共有61只个股创出历史新高（剔除刚上市不久的次新股），并且主要集中在食品饮料、医药生物两大消费行业。
前者包括有“鸭脖一哥”绝味食品、啤酒龙头青岛啤酒、速冻食品龙头安井食品、白酒板块今世缘、山西汾酒以及调味品板块中炬高新、千禾味业等；后者包括有多家细分领域龙头公司，如眼科医疗龙头爱尔眼科、生长激素龙头长春高新、疫苗龙头康泰生物等。
(image_address=""https://x0.ifengimg.com/ucms/2020_20/444E65378B1C74D292C0F85FC313C81E5BA72381_w1020_h503.jpg"")
山西汾酒近期日K线图
而从两市的行业板块和概念板块的涨幅来看，这两类行业个股也占据头几名的位置。然而更值得注意的是，这两个消费行业已经连续多日上涨，显然市场资金对其持续看好。
(image_address=""https://x0.ifengimg.com/ucms/2020_20/C92DEBA5D0B04C2CFEACB823BAF656C1654C31D9_w368_h331.jpg"")
今日两市行业板块涨幅排名
(image_address=""https://x0.ifengimg.com/ucms/2020_20/9C95818A005A8BEAB2F57B415023B0436DDF0777_w365_h310.jpg"")
今日两市概念板块涨幅排名
而从北向资金的动向来看，今日净流入近14亿元，实现连续第4个交易日净流入。
(image_address=""https://x0.ifengimg.com/ucms/2020_20/15211A1461643C2999BE63AEEE80B8F501193C21_w432_h426.jpg"")
今日北向资金净流入近14亿元
“每经牛眼”注意到，在上面提到的两大消费行业中，有多只股票被业内称作是“A股核心资产”，而从以上种种迹象来看，这一“核心资产”极有可能在震荡市中成为资金不断追捧的对象，“大而强”与“小而美”的公司将成为中短期市场的焦点。
那么，如何选择其中最值得投资的标的呢？查看由专业机构从多个维度总结出来的名单是最为简单便利的方式。
“每经牛眼”注意到，5月10日下午，由清华大学经济管理学院中国企业研究中心、每经智库研究支持，每日经济新闻出品的""2020中国上市公司品牌价值榜""在线上发布。今年是榜单连续发布的第四年，榜单对全球范围内中国上市公司的品牌价值进行全面而科学的评估，备受资本市场关注。
今年发布的榜单包括总榜Top 100、海外榜Top 50以及新锐榜Top 50。值得注意的是，在资本市场上，品牌价值同样会影响到投资者对它们的认可程度。越是品牌认可度高的公司，往往也越是投资者青睐的价值投资品种。统计数据显示，Top 100上榜的所有上市公司中，有多达13家公司过去一年以来，总市值增长超过500亿元；有14家总市值涨幅超过30%。显然，品牌价值的增加与资本市场市值变化亦呈现明显的正相关。
(image_address=""https://x0.ifengimg.com/ucms/2020_20/C52B7BC2474A15F4DECD9F736A76D902AA0916D6_w1080_h118.jpg"")
品牌价值与市值高度正相关
“2020中国上市公司品牌价值榜”中，中国上市公司品牌价值榜Top 100的总体品牌价值为125513亿元，比上年增加了11039亿元，增长了9.6%。
Top 100中排名第一的是阿里巴巴，品牌价值达到11782亿元，比上年第一位腾讯的品牌价值增加了1475亿元，增长了14.3%。排名第100位的是建发股份， 品牌价值为351亿元，比上年进入Top 100门槛提高了63亿元，增长了21.9%。
在2020年Top 100中，有两家公司的品牌价值突破了10000亿元人民币，它们的总体品牌价值为23106亿元，占Top 100的18.4%。品牌价值在1000-9999亿元的公司有31家，它们的总体品牌价值为64635亿元，占Top 100的51.5%。品牌价值在1000亿元以下的公司有67家，它们的总体品牌价值为37773亿元，占Top 100的30.1%。
品牌价值的增加与资本市场市值变化亦呈现明显的正相关，只要是具有品牌溢价的公司，“大而强”与“小而美”都会受到市场青睐。
东方财富Choice金融终端数据显示，Top100上榜的所有上市公司对应34.42万亿元总市值（已将美股、港股上市公司换算成人民币计价）。有多达13家公司过去一年以来，总市值增长超过500亿元；有14家总市值涨幅超过30%。
(image_address=""https://x0.ifengimg.com/ucms/2020_20/4B725C97101EDD50D3CEE361ABB8099C205B66EB_w676_h647.jpg"")
总市值增长超过500亿元公司
在总市值大涨的公司中，既有阿里巴巴、腾讯控股这样的巨无霸，也有海底捞、唯品会这样的细分领域龙头。阿里巴巴、腾讯控股品牌价值为11782亿元和11323亿元，分别同比增长16.7%和9.9%。而总市值上，2019年5月1日~2020年5月8日，两者的市值增幅分别达到15.94%和15.14%，与品牌价值增幅同步。
唯品会和海底捞则体现了小而美的魅力。唯品会成立不到十年，但它在中国开创了“名牌折扣+限时抢购+正品保障”的创新电商模式，被称为“线上奥特莱斯”。2019年5月1日，它的市值仅有391.37亿元，2020年5月8日则增长至817.75亿元，增幅高达108.9%。在本次品牌价值榜中，它的品牌价值增长率达到13.4%，为630亿元。海底捞以火锅出名，它将服务做到了极致，也受到了消费者和投资者的青睐。海底捞同期市值从1373.05亿元增长至1650.57亿元，增幅为20.27%。今年它的品牌价值为401亿元，新上榜Top 100，排名第88位。
品牌价值与股价“护城河”关系的正反案例
对一家公司而言，品牌价值，也是经营中最重要的护城河之一。从A股二级市场表现来看，近一年来品牌价值上升较快的公司往往也会对应股价上涨。
贵州茅台是其中最典型的例子。在2020年的品牌价值榜中，贵州茅台排名第六，品牌价值3449亿元，较上年同期上升22.4%。
A股市场上，贵州茅台近期创出历史新高，原因在于它超亮丽的2019年年报和2020年一季报。2019年贵州茅台不仅营收和净利润均实现两位数增长，公司拟分红金额也增至200亿级别，达到近214亿元，每10股派发现金红利约170元(含税)。
此前两年，贵州茅台分红金额逐年上升。其中2017年每10股派息109.99元(含税)，分红金额138.17亿元；2018年每10股派息145.39元(含税)，分红金额182.64亿元。近三年分红金额占合并报表中归属于上市公司普通股股东的净利润的比率均超过51%
即使是新冠疫情，贵州茅台业绩依然未受影响。一季度实现净利润130亿元，同比增长16%。对应到二级市场上，茅台股价近期连续上涨，不断创出历史新高，目前已经超过1300元历史高点。
(image_address=""https://x0.ifengimg.com/ucms/2020_20/49F7F1867AF791452457FF5B3C6196C9A0C189F3_w697_h310.jpg"")
贵州茅台股价日K线图
同样，在非消费品领域，一些公司近年来也做出特色做出口碑，它们也一直受到市场的关注和青睐。
招商银行今年总榜中排名第32位。品牌价值1051亿元，同比增长5.4%。在银行板块整体破净的情况下，它目前市净率约为1.3倍，能够获得估值溢价，很大程度上是其在零售银行上的龙头地位，已经形成了很好的品牌效应。
东北证券曾分析过招商银行零售之王的成功原因：第一，招行管理层稳定，一脉相承，王世祯，马蔚华，田惠宇，都致力于发展零售业务，战略层面的统一促使招行沿着正确的道路一路前行，终获丰收。第二，招行股权相对集中，招商局一直作为公司的实际控制人，能够保证战略的稳定和管理层的稳定。第三，招行自实施零售战略后，多项经营指标向好，终获市场认可。多年来它的零售业务成果有三：第一，信用卡借记卡业务提供了庞大零售客群。第二，金葵花，成为客群分层的靓丽名片。第三，私行业务，AUM和户均AUM碾压同业。
目前招商银行总市值超过8800亿元，其股价表现一直稳健。去年5月至今涨幅为4.24%。
(image_address=""https://x0.ifengimg.com/ucms/2020_20/E313A0133F3E9DAABFFBDC10851634734C5101AA_w1026_h504.jpg"")
招商银行近1年日K线图
但同时，品牌价值不断变化。一些品牌价值下降的公司，它们在二级市场上表现也往往不佳。正如清华大学所指出：""企业的品牌价值不仅是不进则退，而且是慢进则退。""
同样是银行，中信银行今年的品牌价值为600亿元，同比下降2%，排名第56位。今年以来，中信银行下跌16.86%，其市净率只有约0.7倍。
(image_address=""https://x0.ifengimg.com/ucms/2020_20/09CAC7281D2953395D57EEEB795720B0D4C8442D_w1027_h505.jpg"")
中信银行今年日K线图
中信银行正处于零售转型之中，其业绩表现不错，但在转型成果明晰之前，对比招商银行可以看出，市场并未给予估值溢价。2020年中信银行一季度营业收入515.09亿元，同比增长8.65%；净利润144.53亿元，同比增长9.36%；每股收益0.3元。截至报告期末，不良贷款率1.80%，比上年末上升0.15个百分点。但是公司拨备充足，2020年一季度拨贷比3.19%，较年初上升0.3个百分点。拨备覆盖率177.37%，较年初上升2.12个百分点。
宝钢股份今年品牌价值下跌2.4%，为489亿元。公司今年一季度营业收入599.73亿元，同比下滑8.27%；净利润15.36亿元，同比下滑43.63%。宝钢股份预计2020年上半年净利润同比上年同期将出现较大幅度下降。在二级市场上，宝钢股份去年5月以来已经下跌18.40%。
(image_address=""https://x0.ifengimg.com/ucms/2020_20/8293AA3369414B030405337442E7150468144B8E_w1027_h507.jpg"")
宝钢股份今年日K线图
宝钢股份的涨跌、经营业绩好坏与其周期行业特征有密切关系。但在钢铁行业激烈竞争中，要维持一如既往的品牌价值并不容易。
中国核心资产如何选？
海外品牌价值或成重要投资参考
随着社会经济的不断发展，中国GDP早已跃升至全球第二，作为拥有敏锐“嗅觉”的海外投资者不可能不重视中国机会。另外，随着互联互通（沪港通、深港通等）的不断深化完善，海外投资者早已对A股、港股、美股这些重要资本市场进行了全覆盖。
近几年来，伴随各行各业龙头企业的壮大及市值的增长，“中国核心资产”这一概念也被反复提及。而这些最值得进行长期价值投资的上市企业也基本分布在A股、港股和美股市场中。
2020年中国上市公司品牌价值榜中海外榜Top 50，列出了最具海外品牌价值的前50家优秀企业。上榜企业毫无疑问就是最纯正的中国核心资产。
清华大学经济管理学院中国企业研究中心主任赵平教授表示：“从各国经济发展的路径来看，在国际市场上品牌价值集中度提高，是经济向高端发展的表现。”他指出，如日本的索尼、丰田、松下，韩国的三星、现代、LG，这些强势品牌通过获得国际市场的青睐，带动了整个国民经济的快速发展。目前，中国也有越来越多的著名品牌逐渐在全球市场占据一席之地。
在2020年海外榜中，海外品牌价值大于500亿元的公司有4家，其海外品牌价值合计为3549.6亿元。海外品牌价值在100亿至500亿元之间的公司有32家。海外品牌价值提升最快的是深康佳A，同比提高87.8%，其排名从去年的第40位跃升至第25位。
作为海外品牌价值提升最快的上市企业，深康佳A的股价自然也得到了很好的呈现，可以用惊心动魄来形容。2020年以来，深康佳A股股价累计大涨72.31%，独占鳌头。
深康佳A股股价的启动是从今年1月22日开始的，当天公司股价上涨3%以后，第二天便盘中涨停，随后又出现了三个一字板，而就在开板之后该股仍然继续上攻，并达到了13.61元/股的高点，比行情启动前每股4元左右的股价上涨了两倍多。
(image_address=""https://x0.ifengimg.com/ucms/2020_20/12DDEA657E1FBB224B1C97436E1425164E27C098_w1024_h503.jpg"")
深康佳A今年日K线图
而从市值来看，阿里巴巴和腾讯控股是今年海外榜榜单企业中市值最大的两家，市值均超过四万亿港元，今年在海外榜上的排名分别为第三和第十位。毋庸置疑，腾讯控股和阿里巴巴已经是全球级别的顶级互联网企业，在即时通讯、电子商务、游戏产业等行业均处于领先地位。
需要注意的是，在2019年的海外榜中，阿里巴巴以908亿元的海外品牌价值荣登榜单冠军，今年的海外价值为898亿元，位居联想集团和美的集团之后。年初至今，阿里巴巴的股价下跌约5%。
腾讯控股的海外品牌价值为327亿元，排名与去年持平。即便今年行情震荡，腾讯控股的股价从年初至今仍上涨了约15%。
另外，今年有11家新公司入围了海外榜名单，这也意味着有11家公司跌落海外榜名单。今年新入围的高鑫零售在过去一段时间里其股价呈现出优异表现。在过去的250个交易日里，高鑫零售累计上涨了约80%。
而去年榜上有名的锦江酒店（前名：锦江股份）今年落榜。今年以来，锦江酒店的表现也不太理想，下跌4.49%。
(image_address=""https://x0.ifengimg.com/ucms/2020_20/B0234F580D310DC886794919E32FF7734C774B47_w1025_h506.jpg"")
锦江酒店今年日K线图
从资金量来看，海外的散户比例很低，绝大多数为机构投资者。因此，海外投资者更加看重公司的基本面，且换手率也相对较低。美股、港股市场的换手率较A股市场就要低得多，而他们持股的时间也相应长不少，短线的交易会相对较少。
以美的集团为例。今年，美的集团在海外榜的排名从去年的第三名上升到了第二名。公司股价目前正在其历史新高附近。优秀的品牌价值，加上外资的凶猛加持，美的集团的股价走势也是相当靓丽。事实上，去年底，美的集团的外资持股比例就已经接近红线。
(image_address=""https://x0.ifengimg.com/ucms/2020_20/215D177DFD5D4589220A25D2B24A38FE114D9250_w695_h372.jpg"")
美的集团外资持股变动
清华大学经济管理学院中国企业研究中心主任赵平教授表示，品牌价值来源于品牌资产。品牌资产是公司无形资产重要的组成部分，被存放在人们的头脑中，是人们对品牌的认知和情感。
对于海外品牌价值对投资决策的影响，老虎证券投研团队向《每日经济新闻》记者介绍，营收、利润这些财务数据以及价格、市值这些交易数据都是可以对比的定量指标，而品牌价值多以人为判断为基础，是较为定性的指标。对上市公司的研究和判断往往都是多维度的，在行业间竞争激烈的今天，品牌作为非常重要的定性指标影响着从上游到下游，从供应商到消费者以及从政府到投资人的决策，因此也成为公司影响力的重要因子。
关注这些十倍潜力股
回顾“中国上市公司品牌价值榜”这4年来的变化可以发现，其中有一些公司凭借自身的“硬实力”成为圈粉无数的“超级牛股”。
2017年以来，A股的消费白马走出了一轮持续至今的慢牛行情。在2017年的百强榜中，我们可以看到贵州茅台、美的集团、格力电器、五粮液、双汇发展、中国国旅、海天味业等多只传统消费白马入选。这些个股大多当年入选，当年就表现不俗。
而在随后的几年中，这些消费白马都是“中国上市公司品牌价值榜”中的常客，而这些常客同样也是近年来A股市场的“常青树”。相信长期持有这些个股的投资者，已经凭着它们稳健向上的表现获得了丰厚的回报。
此外，2017年的民营榜中还涌现了恒瑞医药、海大集团等A股市场稀有的“非卖品”。
值得注意的是，近年来上榜的牛股中既有长期因素累积后的必然结果，又有新锐力量的催化。随着中国经济“新旧动能”的持续转化，A股市场的格局已经在悄然中发生了某种意义深远的变化。
从2018年起，“中国上市公司品牌价值榜”中的科技含金量明显提升。在2018年的榜单中专设了“科技创新榜”，其中涌现了之后市场表现长期趋好的中兴通讯、环旭电子等硬科技公司。
2019年以来，随着资本市场的新锐科技力量开始逐渐占据舞台的中央，市场的“投票机”不再唯业绩而论，科创属性的强弱逐渐变成估值高低的重要标准。而2019年榜单就甄选出了一批最近两年内上市的科技股，这些公司中有的虽然在榜单的绝对排名不高，但已成为资本市场冉冉升起的新星。
例如，2019年的新锐榜中评选出的锂电池行业龙头宁德时代、线路板产业龙头鹏鼎控股、医疗器械行业一哥迈瑞医疗、医药外包行业龙头药明康德、美股电商新贵拼多多等已经从众多新股中脱颖而出，成为国内外机构追逐的热点公司。
2020百强榜、海外榜以及新锐榜已经最新出炉，让我们一起试着从最新发布的榜单中找一找未来有成长为十倍股潜力的公司。
从历年发布的“中国上市公司品牌价值榜”来看，其中“新锐榜”通常是未来潜力股的聚集地。最新发布的2020“中国上市公司品牌价值榜”新锐榜Top 50中又有不少上市还不到一年的新面孔出现。
近年来，大消费行业无疑是外资的“心头好”。从此次发布的新锐榜来看，有一批上市不久的消费行业新贵，如JS环球生活、中国飞鹤、三只松鼠、丸美股份、小熊电器等。
(image_address=""https://x0.ifengimg.com/ucms/2020_20/2F3816D8C7B2F7A0BCB89D4BBE33C87E0E7A83C8_w502_h534.jpg"")
今年新锐榜的部分上市公司一览
其中JS环球生活于去年12月在港交所上市，并于今年入选港股通。今年4月底，该公司发布了一份靓丽的2019年报，2019年公司实现收入30.16亿美元，同比增长12.5%，经调整后归属于母公司股东净利润同比增长127.8%至1.36亿美元，超出市场预期。与此同时，公司宣布特别派息每股7.34美分（0.5717港元），对应股息率达9.1%。
针对该公司，申万宏源家电团队近日发布报告指出，虽然今年有疫情影响，不过公司强劲的产品研发、市场开拓及多品牌业务协同效应有望继续驱动基本面保持较快成长。
此外，从市场表现来看，新锐榜中还有不少公司已经得到了市场的认可，这其中包括教育行业的中国科培、物联网龙头移远通信、物业行业的保利物业、卫星互联网概念股中国卫通等。
今年来，凭借多重因素催化，卫星互联网成为市场的一大热门主题。而在一些机构看来，能实现全球无缝宽带覆盖的卫星互联网不仅有想象空间，而且我国低轨道卫星系统技术能力完善，布局时机已成熟，将先组网后运营。
有机构近日发布研报称，作为新基建的新方向，卫星互联网产业链可拆分为卫星制造、卫星发射、地面设备、卫星运营四大环节，其中卫星运营是使能变现环节，将驱动数千亿蓝海市场。预计至2027年卫星运营市场空间可达6975亿元，这一市场规模是卫星制造、卫星发射和地面设备总投资额的4倍，而中国卫通是国内卫星运营领域的龙头。
去年7月正式落地的科创板无疑是近年来资本市场最大的关注焦点之一。值得注意的是，在今年的这份榜单中也有公司来自科创板。在新锐榜中高居第五的传音控股于去年9月登陆科创板。公司被市场称为“非洲手机之王”，目前公司在非洲市场排名稳居第一，在印度、孟加拉等新拓展市场排名快速提升。
入市投资谋增值，开户就选广发【马上点击开户】",2020-05-13 18:42:07,凤凰财经
6,来了！三项强制性国家标准正式发布，打算买车的必看,"5月12日，工业和信息化部组织制定的GB18384-2020《电动汽车用动力蓄电池安全要求》、GB38032-2020《电动客车安全要求》和GB38031-2020《电动汽车安全要求》三项强制性国家标准（以下简称“三项强标”）由国家市场监督管理总局、国家标准化管理委员会批准发布，将于2021年1月1日起开始实施。
电动汽车安全是消费者关注的焦点，也是新能源汽车产业持续健康发展的根本保障。为落实《节能与新能源汽车产业发展规划（2012-2020年）》《汽车产业中长期发展规划》等要求，结合新能源汽车产业发展实际和技术进步需要，工业和信息化部于2016年启动电动汽车安全三项强标制定工作。三项强标以我国原有推荐性国家标准为基础，与我国牵头制定的联合国电动汽车安全全球技术法规（UNGTR20）全面接轨，进一步提高和优化了对电动汽车整车和动力电池产品的安全技术要求。其中：
《电动汽车安全要求》主要规定了电动汽车的电气安全和功能安全要求，增加了电池系统热事件报警信号要求，能够第一时间给驾乘人员安全提醒；强化了整车防水、绝缘电阻及监控要求，以降低车辆在正常使用、涉水等情况下的安全风险；优化了绝缘电阻、电容耦合等试验方法，以提高试验检测精度，保障整车高压电安全。
《电动客车安全要求》针对电动客车载客人数多、电池容量大、驱动功率高等特点，在《电动汽车安全要求》标准基础上，对电动客车电池仓部位碰撞、充电系统、整车防水试验条件及要求等提出了更为严格的安全要求，增加了高压部件阻燃要求和电池系统最小管理单元热失控考核要求，进一步提升电动客车火灾事故风险防范能力。
《电动汽车用动力蓄电池安全要求》在优化电池单体、模组安全要求的同时，重点强化了电池系统热安全、机械安全、电气安全以及功能安全要求，试验项目涵盖系统热扩散、外部火烧、机械冲击、模拟碰撞、湿热循环、振动泡水、外部短路、过温过充等。特别是标准增加了电池系统热扩散试验，要求电池单体发生热失控后，电池系统在5分钟内不起火不爆炸，为乘员预留安全逃生时间。
三项强标是我国电动汽车领域首批强制性国家标准，综合我国电动汽车产业的技术创新成果与经验总结，与国际标准法规进行了充分协调，对提升新能源汽车安全水平、保障产业健康持续发展具有重要意义。",2020-05-13 18:40:29,凤凰财经
