,title,content,pub_time,src
0,旷视科技因李开复“口误”再引关注：赴港IPO一年无进展，数据隐私或成拦路虎,"出品｜公司研究室（ID：gsyjs8）
文｜曲奇
前不久，李开复公开演讲提到“曾在早期帮助旷视科技公司找了包括美图和蚂蚁金服等合作伙伴，让他们拿到了大量的人脸数据。”
尽管在李开复说出这句话不久后，蚂蚁集团、旷视科技以及李开复均进行回复，否认了隐私泄露一事，李开复事后也承认为“口误”，但这一事件也让旷视科技因为数据隐私问题再次进入公众视线。
成立十年的旷视科技，已经完成了9轮、累计13.5亿美元的融资。
2019年8月，公司曾向港交所递交招股书，但一年过去，公司上市迟迟未有新的进展。旷视科技CEO印奇曾表示，“IPO的不可控，让他确实感受到了压力。”
除IPO和数据隐私困扰之外，这家AI独角兽企业的核心业务——城市物联网也面临着激烈的市场竞争。
个体人脸识别不再是重点
TOB的城市物联网成核心业务
2011年成立的旷视科技，与商汤科技、依图科技、云从科技被市场并称为“CV四小龙”。
2015年，在德国汉诺威信息展会开幕式上，马云亲自向包括德国总理默克尔在内的与会者，展示了支付宝的人脸识别支付技术，旷视正是这项应用的开发者。由此，旷视和其人脸识别云平台“Face++”获得业界关注。同年，公司开启商业化。
(image_address=""https://x0.ifengimg.com/ucms/2020_40/3169801975937A6B6D3D28AEFAACA76C36399273_w1007_h496.png"")
2019年初，旷视将logo从“Face++旷视”变成了“Megvii旷视”；核心技术从Face++升级为系统化AI算法引擎Brain++。印奇曾说，“Brain++是旷视新阶段的标注，标志着我们从狭义的人脸识别公司变成一家更综合的公司。”
此后，旷视的业务场景从城市管理、零售、手机、金融等垂直场景升级为个人设备大脑、城市大脑、供应链大脑三大AIoT场景。
(image_address=""https://x0.ifengimg.com/ucms/2020_40/ADCE1AEB30C7E5C9984185D8B3D6C8B3E08F4626_w1020_h563.png"")
招股书显示，2016年到2018年，旷视的营收分别为0.7亿元、3.1亿元、14.3亿元，年复合增长率358.8%。2019年上半年，公司营收9.5亿元，同比增长210.3%。可见，2016年至2019年上半年，旷视处于高速发展阶段。
公司收入来自个人物联网、城市物联网、供应链物联网三部分。个人物联网是公司的起步业务，应用场景有人脸识别、优化手机摄像头算法等，主要客户是金融科技、手机厂商等公司，比如OPPO。
三大业务板块中，个人物联网业务收入2.1亿元，同比增长136.0%。但该业务收入占比持续下降，由2016年的72.5%下降至21.8%。
这是因为人工智能更大的应用场景在B端市场，而非C端。
印奇曾表示，公司最重要的两大场景：一是城市大脑场景，主要在安防领域，主要客户是政府机构、学校、地产公司、系统集成商等；二是供应链大脑场景，以智能物流为核心，以机器人硬件为承载，主要客户是物流公司、线下零售商等。
印奇认为，城市物联网和供应链物联网会成为旷视两大支柱。不过，现阶段供应链物联网仍处于孕育期，2019年上半年，该业务收入只有0.5亿元，同比增长51.6%，收入占比仅有5.0%。
城市物联网是公司高增长的主要动力，2016年到2018年，旷视科技城市物联网收入分别为0.2亿元、1.7亿元、10.6亿元，两年增长了55倍。2019年上半年，城市物联网收入6.9亿元，同比增长273.7%，收入占比73.2%。
城市物联网市场份额只有7.4%
净利润扣除政府补贴后亏损
近年来，旷视科技营收高速增长，毛利率也有显著提高。
2016年到2018年，毛利率分别为31.0%、52.1%、65.2%，2019年上半年毛利率为64.6%，同比增长2.3个百分点。不过需要注意的是，2019年上半年，城市物联网业务毛利率59.0%，同比下降4.2个百分点。
(image_address=""https://x0.ifengimg.com/ucms/2020_40/46E5516EDE296D53B1C503D8EBBA41696FE3E609_w795_h268.png"")
根据招股书数据，城市物联网领域里，旷视科技的市场份额只有7.4%，位列第三。前两家竞争者的市场份额分别为36.9%和14.7%，占据了一半以上的市场份额。
城市物联网的参与者中，海康威视和大华股份这两家传统安防企业是公司最主要的竞争对手，这两家公司已经深耕安防领域十多年，产品能力和渠道都领先于旷视，公司1和公司2极有可能是海康威视和大华股份。
除海康和大华外，公司还要与商汤科技、云从科技等新兴AI独角兽争夺剩余的市场份额，同时还要防范华为等互联网巨头抢食。
(image_address=""https://x0.ifengimg.com/ucms/2020_40/CF5A856321DFA5F98F4C0987322B74D38863B579_w874_h552.png"")
海康威视近9年的平均毛利率为45.3%，2019年全年的毛利率为45.99%，以此来看，旷视2019年上半年的毛利率超60%已经不低了，但公司依然迟迟无法盈利。
2016年到2018年，旷视分别亏损3.4亿元、7.6亿元、33.5亿元，累计亏损44.5亿元。2019年上半年，旷视亏损52.0亿元，比过去三年亏损总和还多，三年半累计亏损近百亿。
旷视在招股书中解释，亏损增加的原因主要是受到了优先股的公允价值变动的影响。如果剔除优先股等因素影响，2016年到2019年上半年，公司净利润分别为-0.9亿元、-1.4亿元、0.3亿元和0.3亿元。
2018年和2019年上半年，公司连续实现盈利，但事实真的如此吗？
需要注意的是，旷视作为一家高新技术企业，享受国家税收优惠政策。2016年到2019年上半年，公司收到的政府补贴分别为203万元，0.6亿元，0.9亿元及0.4亿元。扣除政府补贴后，2018年和2019年上半年，公司仍然是亏损的。
(image_address=""https://x0.ifengimg.com/ucms/2020_40/CF83F42A327837A984B5546ACDADAAD8B0DBE2CA_w986_h548.png"")
除了优先股的公允价值变动的影响外，公司实质性亏损的重要原因在于，公司持续的研发投入。
2016年到2018年，旷视的研发费用分别为0.8亿元、2.1亿元、6.1亿元，年复合增长率达180%。同期，公司研发费用率分别为115.3%、65.6%、43.0%，公司营收规模快速扩张，导致费用率快速下降。2019年上半年，旷视的研发费用4.7亿元，研发费用率49.4%，较2018年有所提高。
公司创始人均是清华“姚班”出身，一直保持高研发投入，但AI周期长、落地难的困境是旷视无法绕开的。
数据隐私连续2次引争议
招股书状态仍为“失效”
目前，对于旷视科技而言，困扰公司的是盈利问题，困扰公众的则是数据隐私问题。正因为公众对数据安全越来越敏感，李开复“口误”之后，才引得蚂蚁金服和旷视科技紧急澄清。
事实上，这不是旷视科技第一次因公共数据使用问题引起的争议。
2019年，旷视科技推出一套“智慧教学”系统，通过视觉AI对学生的面部细节、动作进行捕捉，将学生听课、阅读、举手、睡觉、玩手机等行为进行记录、统计，来判断学生上课时的状态。
(image_address=""https://x0.ifengimg.com/ucms/2020_40/100929ADFEE362170AFADF1D46CB43E9167080EF_w719_h536.png"")
当年9月，网上流传出一段带有旷视logo的课堂监控视频，画面上写着“听课6次、阅读8次、举手6次”等，不少网友认为这种行为侵犯了学生的隐私权。当时，旷视表示，图片为技术场景化概念演示，仅停留在技术展示阶段，未落地应用。
这个技术应用的场景正是城市物联网，也就是公司最主要的业务支柱。
招股书显示，2019年6月末，公司城市物联网已经覆盖全国112个城市，服务339个客户。公司在街道、学校、小区等人口密集区安装监控摄像头，对人脸数据进行采集和分析。
业内人士认为，这样采集得到的海量数据，如果利用不当，就可能带来数据安全隐患。
2018年初，Facebook就因大规模用户数据泄露而股价大跌、扎克伯格连续遭到美国国会问讯。2019年，两个第三方开发的Facebook应用程序泄露了5.4亿用户数据。
业内人士认为，旷视科技IPO之所以一波三折，一个很重要的原因，就在于公众数据隐私处理上始终没有一个令人满意的方案。
此外，在2020年初有媒体曝出，在港交所官网上，旷视科技的招股书的申请状态为“失效”。
早在3月份，旷视科技就港交所招股书“失效”问题进行过回应，旷视称，在半年前其提交的IPO招股书中，披露的财务数据为“2019年上半年”，而时间进入2020年2月份后，为了继续推进IPO进程，就必须向港交所提交截止到2019年年底的财务数据。旷视科技方面目前在做的“资料更新”，实际上就是指这一部分工作。这些工作的耽误，完全是由于春节前后疫情的影响造成的，目前只要尽快完成这些更新即可。
港交所的上市规则中，对“失效”有相关规定：企业申请IPO的相关文件资料，虽然存在一个有效期限，但即便在资料过期后，拟发行人依然可以通过更新资料、重新申请的方式，将上市程序“激活”。
然而，至今半年过去了，截至9月30日，公司研究室发现，其招股书状态仍为“失效”，尚未“激活”。",2020-09-30 14:57:01,凤凰财经
1,玖富公布2020上半年财务业绩  科技为核业务转型势在必得,"9月29日，玖富集团（NASDAQ:JFU）公布了截止2020年6月30日上半年未经审计的财务业绩。财报显示，2020年上半年玖富净收入总额为8.5亿元人民币；净亏损为7.4亿元人民币，较2019年下半年的净亏损28.5亿元人民币缩窄73.9%；调整后的净亏损为4.5亿元人民币，较2019年下半年调整后的净亏损24.1亿元人民币缩窄81.2%。
玖富是国内知名的数字金融账户平台，提供综合、个性化的金融服务，涵盖贷款产品、在线财富管理产品和付款便利化服务。
疫情影响下沉着应对财报数据亏损收窄
2020年初，新冠肺炎疫情爆发，全球企业经营被迫按下“暂停键”。受此影响，玖富的财务状况和经营业绩均受到了负面影响。此外，金融领域监管态势不断加强，最高人民法院发布了《关于修改〈关于审理民间借贷案件适用法律若干问题的规定〉的决定》，规定对向借款人收取的超过合同成立时一年期贷款市场报价利率四倍的部分，人民法院不予支持，使得玖富未来业务增长发展面临不确定性。
虽然受到以上负面影响，玖富2020上半年财报出现账面亏损，但调整后的净亏损较2019年下半年降低81.2%，亏损程度呈较大缩窄，这主要归因于公司严格执行监管部门要求，主动压缩网贷业务规模，并重点部署无风险科技业务。；同时，截至2020年6月30日，注册用户1.10亿人，较2019年12月31日的1.01亿人增长9.1%，注册用户等核心运营指标的稳定增长表明，公司整体综合实力仍受用户认可，经营层面运营良好。
紧抓机遇积极发展业务转型
为解决疫情影响带来的经营业绩不利影响，及时把握数字经济社会发展大潮趋势，玖富积极开展业务调整，依托科技基因提升业务拓展能力，扩大商业场景建设。
为更好赋能合作伙伴发展，玖富依托数字科技实力战略升级“新消费、新财富、新科技”，以“数字+”丰富金融业内涵，扩展服务外延。玖富正围绕用户和科技驱动内生发展，为大众用户搭建数字消费生活服务平台，为中高净值用户开展全球财富管理配置服务，以数字科技驱动，连接用户、消费场景与金融机构，为超1亿优质用户提供高质量金融服务。
此外，为解决消费金融领域借贷信息撮合流程中的痛点问题，玖富倾力打造了旗下优选品质在线商城——小饭卡聚优惠。通过小饭卡聚优惠，玖富将努力为用户提供“消费、生活、权益”全场景服务，通过深入供应链精选全球特色品质好物。
着力修炼自身实力之外，玖富积极开展外部机构合作，全方位打造数字普惠消费金融新生态。目前玖富已与多家银行、消费金融公司及持牌小贷公司等在内的持牌金融机构达成数字普惠合作，将依托用户、场景、风控、数据、海外业务等方面优势，持续强化自身的“连接器”价值，精准链接用户、场景和金融机构，提供更加智能、便捷的数字普惠金融服务。
通过准确把握行业机遇，不断调整业务转型发展，玖富转型发展已初显成效。
科技为核强化场景服务
对于玖富来说，成立14年来，科技早已成为贯通企业发展的主线。凭借多年在场景与技术方面的应用创新，玖富已与华为云、阿里云、Talkingdata等头部技术伙伴纵深合作，通过数字科技、人工智能等技术助力金融机构与场景方成为3A(Account、AI、API)智慧数字企业。
与此同时，玖富还携手知名学术机构、技术企业设立联合实验室：与中科院自动化研究所国家重点实验室合作成立智能语音服务联合实验室；与清华五道口合作建设清华大学金融科技研究院智慧金融研究中心。凭借自身在数字化、生态化领域的能力积累不断深化与合作伙伴的优势互补，玖富将为中国金融科技发展和经济高质量发展尽己所能，为更多用户带来更多优质服务。
以数字科技为核心，未来玖富将积极为合作伙伴提供技术赋能，发挥企业“连接器”价值，开启发展新征途。",2020-09-30 14:49:05,凤凰财经
