,title,content,pub_time,src
3,谁将是李小加的继任者？,"9月29日晚间，港交所发布了一条消息，瞬间刷屏。李小加将提前退休，于今年12月31日卸任港交所集团行政总裁，现任联席总裁及首席营运总监戴志坚则被委任为代理集团行政总裁。对于李小加为何提前辞任，市场众说纷纭，扑朔迷离。
李小加本人并未透露下一步的动向及会否继续留在金融市场，但他向媒体透露，会继续留在香港发展，并强调香港是他的家。市场此前曾传言李小加有望投身政界。今年5月，他首次宣布将辞任行政总裁时表示，离开港交所后会“退而不休”，“不会回家玩弄儿孙”。
自李小加5月宣布明年不续约后，港交所主席史美伦与董事阿博巴格瑞、渣打银行大中华及北亚地区行政总裁洪丕正及独立非执行董事席伯伦已组成遴选委员会，物色新行政总裁。港交所表示遴选工作进展良好，将适时作出公布。
市场消息称，刚被任命为代理行政总裁的戴志坚、港交所市场主管姚嘉仁、上市主管陈翊庭及早前调职至港交所旗下伦敦金属交易所（LME）担任顾问的霍炳光，均有机会角逐下任行政总裁之位。
戴志坚现年58岁，毕业于香港大学，曾在汇丰、加拿大皇家银行、ABN-AmroBank多家外资银行担任财资管理部相关工作，1998年加入香港期交所，担任产品主管。戴志坚加入交易所工作逾22年，在港交所核心高层组成的管理委员会中资历最高。他目前同时但任联交所、期交所、中央结算和场外结算业务的行政总裁。
香港立法会金融服务界议员张华峰向记者表示，戴志坚任职港交所多年，经验丰富、熟悉市场运作，相信可继续带领港交所发展，是下任行政总裁的理想人选。在他看来，合适的行政总裁人选必须同时熟悉国际与中国内地资本市场，才能继续带领港交所在连接东西方市场中扮演独特角色。
姚嘉仁去年4月加入港交所，负责集团股票及衍生产品业务和运营。他此前在深圳乾坤期货、北京高华证券担任高层，并曾在高盛、瑞士信贷第一波士顿任职。
现年50岁的陈翊庭，今年1月再度加入港交所，接替退休的戴林瀚（DavidGraham），曾任职港交所上市科，被外界视为港交所主席史美伦的得力爱将之一。此前，她曾担任达维律师事务所合伙人及金融发展局董事会成员，曾于2007年4月加入港交所，主管上市科的首次公开招股交易部。
霍炳光曾在花旗、瑞信等多家华尔街银行任职，自2016年担任港交所战略策划主管，一直主力负责港交所的战略规划，也是港交所决策最高组织——管理委员会成员。据悉，他曾是港交所竞购伦敦证券交易所“世纪联姻”的主要推手，但最终交易无疾而终。
今年5月初，港交所发布公告，称李小加通知董事会，计划在现有合约于2021年10月底到期时不再续约。根据港交所目前设定的60岁退休年龄，现年59岁的李小加在合约期满后亦到达退休年龄。明年1月1日起，他将转任港交所董事局高级顾问，为期6个月，从而确保过渡安排顺利。
另外还有两位热门“空降”人选，分别为金发局主席李律仁及汇丰亚太区环球银行联席主管刘哲宁。
李律仁现年48岁，为资深大律师，在1999至2005年期间任职证监会，曾与时任证监会副主席史美伦共事。但李律仁向媒体表示自己无意担任港交所行政总裁。
刘哲宁2009年离开美资投行摩根士丹利，加入汇丰担任环球银行中国及香港区主管，曾参与香港多个大型交易，如李嘉诚旗下长和系世纪重组等。
作者：朱丽娜",2020-09-30 14:22:50,凤凰财经
