,title,content,pub_time,src
0,轻松集团6周年庆发布三大重磅健康战略 中国最值得信赖的健康保障平台全速向前,"9月21日，轻松集团6周年庆“只为用户而生”健康保障战略发布会在北京召开。北京大学第一医院感染病学系主任、中华医学会肝病学分会“主任委员”徐小元教授，中联肝健康促进中心李明阳主任，叮当快药CEO俞雷，及轻松集团合作伙伴、数百名媒体记者出席发布会，共同见证轻松集团6年的发展成果，见证“中国最值得信赖的健康保障平台”未来的健康战略。
大会伊始，轻松集团创始人、董事长杨胤发表致辞，回顾了轻松集团发展过程中的艰辛与坚守，向支持轻松集团发展的社会各界朋友表示了衷心的感谢。她表示，为健康事业殚精竭虑，轻松集团乐在其中。而历经6年的高速发展，轻松集团不仅在发展规模上行业领先，更树立起极佳的口碑，在业界极具市场竞争力。轻松集团CEO张科重点回顾了近一年轻松集团取得的主要成绩，并表示，在速度制胜的年代，不断地前进与奔跑，让轻松集团更加年轻。
(image_address=""https://x0.ifengimg.com/ucms/2020_39/931FB81FA5F24A2D5B1D5EB7858282F25437904F_w1042_h704.jpg"")
轻松集团创始人、董事长杨胤
站在6周年的新起点上，作为中国最值得信赖的健康保障平台，轻松集团秉持“只为用户而生”的理念，全新启动轻松集团x轻松保严选“一城一保•百城普惠健康保障计划”、中联朵尔互联网肝病中心、慢病管理联盟2.0三大健康保障战略，并宣布迎来“病房图书馆”的新公益宣传大使：吴尊、THE9，迎来新助力。发布会还宣布将联合阳光保险集团及中国妇女发展基金会启动“粉红阳光&middot;轻松爱-关爱女性公益计划”，呼吁社会关注女性健康。
轻松集团x轻松保严选“一城一保•百城普惠健康保障计划”发布发力惠民保险
保险作为风险管理的重要手段，可以为国民健康提供有力的事前保障。轻松集团轻松保严选积极探索普惠保险产品，于9月1日上线全国首款省级普惠型补充医疗保险——“惠桂保”，以46元起获取最高200万保额的性价比创下了同类产品之最。“惠桂保”是由轻松集团与国富人寿为广西人民联合定制的惠民保险产品，不仅参保门槛低、保障范围广，还不限年龄、不限职业，无等待期，并引入了大病筹款机制帮助贫困参保人，有效提升了广西城乡居民抵御健康风险的水平。
在“惠桂保”获得成功的基础上，轻松集团正式公布“轻松集团x轻松保严选一城一保•百城普惠健康保障计划”。作为中国最值得信赖的健康保障平台，轻松集团将始终贯彻严选保险标准，把定制型普惠保险带入更多城市，让人人享受精准保险服务的同时，铸造普惠于民的城市健康名片，更好地服务于多层次医疗保障体系建设及民生事业发展。同时，轻松集团x轻松保严选一城一保•百城普惠健康保障计划的发布也是“让保险回归保障”的重大实践，并为下沉保险市场保险开垦提供了一个样本。
(image_address=""https://x0.ifengimg.com/ucms/2020_39/2812DE40DFA2EC2754EA60B32BF95515EB41AD6E_w1019_h698.jpg"")
轻松集团CEO张科
布局互联网肝病中心轻松集团开辟健康新赛道
成立于2014年的轻松集团，以“让每个家庭都拥有应对疾病的勇气和力量”为企业使命。为实现这一伟大愿景，轻松集团在轻松筹、轻松保严选、轻松互助、轻松公益、轻松健康五大业务协同作用下，充分发挥中国最值得信赖的健康保障平台的社会价值。
在成立6周年之际，为进一步给用户提供更加全面的健康保障服务，并响应“2030健康中国”国家战略、顺应“互联网+医疗健康”发展大势，轻松集团正式将“中联朵尔互联网肝病中心”提升至集团发展的重要战略位置。而在此之前，密切关注用户需求动向的轻松集团，已完成这一赛道的初步卡位。
受疫情影响，今年以来，国民在线医疗需求激增。9月，轻松集团联合中联肝健康促进中心共同打造“中联朵尔互联网肝病中心”，携手全国顶尖肝病专家、医生为3亿肝病患者提供在线诊疗、处方开具、在线取药等健康服务。
中联朵尔互联网肝病中心，以AI、大数据等互联网科技为支撑，以创新业务模式和数字运营能力为驱动，以配合政府改善民生为导向，积极探索互联网+医疗，将集肝病医学研究、肝病医疗网络服务、肝病长期健康管理于一体，是轻松集团在互联网健康领域的又一深入布局。
作为一个专注保障国民健康的平台，轻松集团从国民健康保障需求出发，并以肝病为切入点，不断探索边界，整合线上线下资源，不断升级迭代、扩大病种范围，为更多慢病患者提供更智能化、更优质全面的慢病管理服务，改善全民健康保障格局，提升国民健康意识，深入贯彻“只为用户而生”理念。
(image_address=""https://x0.ifengimg.com/ucms/2020_39/8B4412D74D6449616FC781BECFB3369284837891_w1029_h686.jpg"")
轻松集团联席CEO钟诚
发布慢病管理联盟2.0轻松集团升级慢病管理闭环
近年来，由于新增病例年轻化趋势及管理不到位等问题，慢病群体越发庞大。为提升慢病人群健康管理水平，轻松集团于2019年携手健康产业龙头品牌众惠相互、丁香园、中康资讯、美年大健康成立全球首个慢病管理联盟，通过整合健康保障平台、健康资讯、保险公司、健康体检机构资源优势，为慢病用户构建值得信赖的一体化干预及管理机制。
为进一步升级慢病管理生态，轻松集团在6周年庆典上发布全球首个“慢病管理联盟2.0”启动，并引入线上医药服务先进企业叮当快药，与众惠相互、丁香园、中康资讯、美年大健康共同构成慢病管理闭环。在“慢病管理联盟2.0”战略下，轻松集团进一步链接线上线下药店等健康领域资源，对患者进行用药提醒、不良习惯排查、复诊通知或线上复诊等，提供覆盖诊前、诊中、诊后全流程的慢病管理服务，从而达到强化慢病预防意识，加强慢病病情控制，提升国民整体健康水平的效果。
(image_address=""https://x0.ifengimg.com/ucms/2020_39/DABF4C9F2C3EDD000214BD24671CD43E9F6A4C2A_w1050_h674.jpg"")
在轻松集团x轻松保严选“一城一保•百城普惠健康保障计划”、中联朵尔互联网肝病中心、慢病管理联盟2.0三大全新战略的基础上，轻松集团将继续秉持“只为用户而生”的理念，为用户提供疾病预防、疾病筛查到疾病治疗、慢病管理、用药服务、保险保障的全链条健康管理服务，发挥“中国最值得信赖的健康保障平台”的领导力。
除此之外，发布会上还首发了发人深省、感人至深的健康短片。短片通过展现多个奋斗者的生活状态，揭示了朝夕奔梦者更需要为自己和家人添一份保障的道理，唤醒受众健康保障意识的同时，也展现出轻松筹、轻松保等轻松集团业务对于奋斗者的重大守护作用，蕴含着浓厚的人文关怀。
在合作伙伴颁奖环节，轻松集团为感恩合作伙伴长期以来的支持，特别设置了4大奖项。百年人寿保险股份有限公司等6家公司获得“年度最佳合作伙伴”，复星联合健康保险股份有限公司等5家公司摘取“年度最佳服务商”称号，中国太平洋财产保险股份有限公司海南分公司等4家伙伴荣膺“年度最受客户欢迎奖”，而中宏人寿保险有限公司等3家公司被授予“年度最佳产品创新奖”。
(image_address=""https://x0.ifengimg.com/ucms/2020_39/DF714B790C18690DB66CE96A9A69331D63130635_w951_h645.jpg"")
轻松集团历经6年的沉淀与蓄力、创新与突破，只为完成“让每个家庭都拥有应对疾病的勇气和力量”的崇高使命。在6周年节点，轻松集团发布全新战略方向，是在“只为用户而生”理念下的开拓探索。未来，通过中国最值得信赖的健康保障平台——轻松集团，用户将享受到更完善的健康体验与服务，一站式解决自身健康管理问题。",2020-09-21 18:51:24,凤凰财经
1,警惕！“95”、“96”号码成电信诈骗重灾区，但这个“6”电话一定要接！,"警惕！“95”、“96”号码成电信诈骗重灾区，但这个“6”电话一定要接！2020年09月21日 18:30:26
来源：证券时报
原标题：警惕！""95""、""96""号码成电信诈骗重灾区，5大套路你可了解？但这个""96""电话，一定要接！
当下，部分95、96开头的电话已成为骚扰、诈骗电话“重灾区”，以致于大家看到乱七八糟的来电号码就想直接按掉。
(image_address=""https://x0.ifengimg.com/ucms/2020_39/C3A0F992355104104855EC9450D56231BA264267_w377_h417.png"")
最近，有市民接到号码显示为“96110”的来电，以为是诈骗电话，接都不接就直接挂掉了。殊不知，这样做的后果很严重。因为，您可能正在遭遇电信网络诈骗而不自知，却又掐掉了来自警方的提醒。
真警察才会通过96110来电
据公安部刑侦局消息，国家反诈中心提醒“96110” 来电一定要接听，“96110”是全国统一的预警劝阻咨询电话，真警察才会通过 “96110” 来电。这个电话目前有三大主要服务功能：
一是劝阻，接到“96110”这个号码打来的电话，说明市民或其家人正在遭遇电信网络诈骗，又或者属于易受骗高危人群。
二是咨询，市民如遇到疑似电信网络诈骗，可致电咨询。
三是举报，市民如果发现涉及电信网络诈骗的违法犯罪线索，可通过该专线举报。
警方透露，为了及时劝阻群众，避免其上当受骗，反诈民警经常会一遍又一遍地拨打事主电话，然而，部分市民落入了骗子的圈套，非但不听劝阻，还把民警当成骗子，执意汇款，直到发现受骗，才幡然醒悟。
目前，全国已有21个省区市开通，其他地区正在逐步开通之中。“96110”反诈专线威力初显。2019年共向各地推送预警线索170万条，劝阻受害人101.6万人次，挽回直接经济损失56.1亿元。随着今年以来，更多地方开通96110反诈专线，无疑会发挥更大作用。
95、96是什么电话？
“地铁口不限购不限贷的新房你考虑吗?”、“你有资金需求吗？”、“最近股票做得怎么样？”……无孔无入的骚扰或诈骗电话已成为日常标配，这些电话主要分三种：一是推销房地产的；二是推销银行贷款的；三是推销股票的。
这类电话，以“95”、“96”开头居多，和以往“400”、 “800”的骚扰电话不同，“95”开头的号码混淆在银行、快递等号段之中，让人不敢不接，防不胜防。
那么，95或96开头的究竟都是什么电话呢？据记者了解，95开头的电话号码属于全国型的呼叫中心号码，96开头的号码则属于省级呼叫中心号码，均属于特服号码。
既然是特服号码，门槛高，费用不菲，为何会成为骚扰或电信诈骗电话的重灾区呢？都是扩位惹的祸。
比如“95”号段，本来规划用于跨省或全国范围内统一使用的客户服务短号码、电信业务接入号码等，因此一般情况下企业申请下来的“95”号段号码是5位或6位数。后来，为提升使用效率，用于电信业务接入的“95”短号码可以申请扩展位长至8位，如确有需求，可扩展至13位。如此一来，企业申请一个号码后，实际使用的号码能够成百上千拓展。如果个别企业将其中一部分号码转卖，就有可能最终流入违法者手中。
95号码按用途可以分为三类：服务型企事业单位客户服务号码、公益服务号码和其他业务接入号码。
如何区分是否为推销业务？工信部列出了一个小口诀：356，放心接；110，认真听；其他号，要辨别。
也就是说，953、955、956打头的号码，号码长度为5位或6位，它们是银行、证券、保险、航空、物流（快递）、石油、铁路、电力行业里具有影响力的大型企业使用的客户服务号码，可以放心接听。110，指的是目前投入使用的海警95110公益服务号码，可一定要注意接听。其他号，指的是950、951、952、954和957打头的号码，它们是呼叫中心等增值电信企业开展业务使用的号码，号码长度一般为8位（有一些为5位或6位，也有一些老号码长度超过8位）,这里可能有正常企业（如快递公司）来电，也可能有不良企业来电，需要你自行判断了。
96号码则属于地区性号码，每个地区分别放号，外地拨打需要加区号，这个由省通信管理局审批，对于公司的注册资金要求也比较低，每年缴纳号码占用费即可。
工信部作为主管部门曾多次发文强化对骚扰电话的整治。今年6月工信部发布《关于加强呼叫中心业务管理的通知》，明确对呼叫中心企业将强化信用约束，因骚扰电话问题被有关政府部门通报、约谈、行政处罚等，将依法纳入电信业务经营不良和失信名单。
电信诈骗多发 套路推陈出新
据公开数据显示，我国电信网络犯罪数量已占犯罪总数的三分之一，且每年以30%左右的幅度增加，成为第一大犯罪类型。2019年，全国破获电信网络诈骗案件20万起、抓获犯罪嫌疑人16.3万人，同比分别上升52.7%、123.3%。今年上半年，全国共破获电信网络诈骗案件10.1万起，抓获犯罪嫌疑人9.2万名，同比分别上升73.7%、78.4%。
“自古深情留不住，总是套路得人心。”电信网络诈骗犯罪分子是最努力的一群人，他们总在绞尽脑汁地思考着如何将套路翻出花样。以下是广东网警巡查执法最新总结的几种主要电信诈骗手法，以及应对措施。
1. 冒充客服诈骗惯用伎俩。
通过非法获得事主的电话和购物信息，致电事主，通过说出事主个人信息等内容获取信任。谎称事主购买的货物有问题，需要申请退款，让事主添加伪仿的“官方客服”微信。用事主支付信用不足无法到账等借口，一步步诱使事主转账或者从互联网借贷产品中贷款给对方。
见招拆招：对于主动联系自己的各类客服，一定要先通过官方渠道核实对方的身份，尤其是当对方提出退差价、高额赔付或者奖励的时候，一定要谨防猫腻，千万不要贪图便宜，特别是手机验证码绝对不可透露给他人。
2. 代办信用卡、贷款惯用伎俩
通过网络等途径散布可以办理高额度信用卡的广告，一旦有使用资金需要的人与其联系，诈骗分子就会以手续费、中介费、保证金等名义实施诈骗。
见招拆招：勿听信网络上可以快速办理信用卡、低担保或免担保办理贷款的消息;办理信用卡、贷款一定要到正规银行和金融机构办理。
3. 交友诱导赌博、投资类诈骗惯用伎俩
通过微信、QQ、抖音、陌陌、百合网、珍爱网等网络社交平台添加事主为好友，冒充“高富帅”、“白富美”、“同性恋”、“投资专家”、“境外赌博网站高管”等身份拉拢事主进微信、QQ群，推荐炒股、博彩、投资虚拟货币等。
再以“了解投资平台漏洞”、“平台内部工作人员可以操作”等理由引诱事主下载“投资APP”、转账投资。在投资初期给予小额回报获取信任，事主进行大额投资后会被拉黑，造成巨额经济损失。
见招拆招：网络博彩是违法犯罪。“网站漏洞”、“微投入高收入”都是设计好的骗局，“炒股群”、“虚拟货币投资群”都不靠谱，群内除了被害人，其他全部是诈骗分子。
4. 购物交易诈骗惯用伎俩
利用“更低价格、直接线下交易”、“拒绝使用网站提供的第三方安全支付工具（如支付宝等）”、“预交订金或保证金”等方式诱骗事主进行线下直接交易，从而逃避网上交易安全系统的监控，待事主付款后就销声匿迹。
见招拆招：要谨慎选择交易对象，核实网站是否合法，认真阅读交易规则，注意保存有关单据、必要时要截图保存有关证据。
5. 刷单兼职诈骗惯用伎俩
以招聘人“刷信誉”、“刷等级”为名让事主通过网络支付为网店“刷单”，并承诺退还本金并支付一定数额的好处费。当事主转账以后，诈骗分子就会失联，或以“保证金”、“手续费”等名义继续对事主实施诈骗。
见招拆招：刷单本来就是违法行为，不参与刷单，更不要为所谓的网店转账垫付资金。",2020-09-21 18:30:26,凤凰财经
