,title,content,pub_time,src
11,全球降息日中国维持政策利率不变，宽松预期有何变化？,"在13日央行宣布降准以来，月内降息几乎是市场的一致预期，但本周一（16日）央行1年期MLF（中期借贷便利）维持利率不变的操作，让市场预期大打折扣。面对全球“超级降息日”，中国央行却如此淡定，究竟有何深意，未来的宽松预期还在吗？
专家认为，MLF利率保持不变，主要原因是前期降成本政策措施的效果还在继续释放，无需进一步下调政策利率。另一方面也体现出我国货币政策独立性。未来，货币政策宽松的逻辑和空间继续存在，进一步降低存款基准利率的可能性提高。
同时，对于中国市场而言，受到全球影响，短期内存在波动，但中长期来看，中国抗击疫情、复工复产以及各项宏观经济政策均走在全球前列，将有利于提高国际投资者的信心，人民币资产仍然具备吸引力。
降成本效果显现，MLF利率维持不变
周一，央行公告实施定向降准，释放长期资金5500亿元。同时，开展MLF操作1000亿元，中标利率3.15%。利率维持不变，规模则较2月的2000亿元缩减至1000亿元，货币宽松的力度低于市场预期。
当日，美联储宣布降息至零利率，且推出7000亿美元购债计划。随后，一天之内全球有11家央行宣布降息。在这样的日子里，中国央行为何反其道操作？
中国民生银行首席研究员温彬分析称，在此背景下，MLF利率保持不变，一方面体现我国货币政策独立性，另一方面是因为虽然我国2月份CPI涨幅出现回落，但仍在高位，需要继续观察经济运行和通胀情况。
瑞银证券中国股票策略团队近日发表最新流动性观察报告显示，MLF操作利率不变，显示出前期政策措施的效果还将继续释放的情况下，央行可能并不急于频繁调整政策利率。同时，未来海外疫情变化以及对中国经济的负面影响目前来看仍有较大的不确定性。在这种情况下，央行在价格工具的使用上保持定力，也保留了未来进一步宽松的空间。
事实上，央行一直以来都在通过各种货币政策工具、结构性工具来降低银行负债成本，促进实体经济的复工复产。1月末推出3000亿元专项再贷款纾困疫情相关行业和企业，实际融资成本约1.28%；2月26日再叠加5000亿元再贷款再贴现额度，通过中小银行，精准滴灌中小企业；3月16日，央行通过普惠金融定向降准和针对股份行定向降准，向市场注入5500亿元流动性，每年可直接降低相关银行付息成本约85亿元，对银行机构降低负债成本有明显的促进作用。
2月以来银行间市场流动性整体也保持了较宽裕的状态。3月以来，银行间市场7天逆回购利率（DR007）进一步降至2.0%左右，低于央行2.4%的7天逆回购利率。
预留宽松空间，存款基准利率下调可期
那么，本月LPR是否还会进一步下调？未来降息的空间和路径如何？
分析人士认为，本月LPR很大概率会进一步下调，货币政策仍有较大空间，存款基准利率进一步下调的可能性加大。
“首先，定向降准的落地在一定程度上降低了银行负债成本。其次，2月份以来资金利率大幅下行有助于银行负债成本下行，进而引导LPR下行。”中信证券首席固定收益分析师明明认为。
温彬表示，本次定向降准对银行机构降低负债成本有明显的促进作用，有助于引导银行机构降低实体经济融资成本，预计本月1年期LPR将下调5BP（基点）至4%。与此同时，在全球主要经济体央行重启量化宽松政策背景下，随着我国CPI涨幅回落，货币政策仍有较大空间，4月中上旬或是降息（政策利率）的时间窗口。
不仅如此，市场预测，央行进一步降低存款基准利率的可能性将进一步加大。
15日，央行货币政策司司长孙国峰在国务院联防联控机制召开的新闻发布会上提到，继续发挥存款基准利率作为整个利率体系“压舱石”的作用。
明明认为，央行在全球主要发达经济体转向零利率和负利率的背景下更要珍惜常规的货币政策空间，在没有进一步降息的促进下，LPR报价要继续下降已经面临一定的瓶颈，降成本方式包括降准、降息、存款基准利率调整、考核指标、行政监管等，后续有调整存款基准利率的可能。
德意志银行大中华区宏观策略主管刘立男预测，一年法定存款利率有下调0.25个百分点的空间。
总体而言，货币宽松的大方向是一定的，如孙国峰在上述发布会上所言，“下一步，人民银行将继续综合采取多种措施促进贷款利率明显下行，支持企业复工复产和经济发展。”进一步降低公开市场利率、全面降准甚至是降低存款利率都在央行的货币政策工具箱中。
中国政策全球领先，有利市场稳定
当下，受全球市场大幅波动影响，中国市场也随之发生剧烈震荡。市场涌现出一部分较为悲观的情绪。不过总体而言，中国无论是疫情防控、复工复产，还是金融市场、经济政策，都走在全球其他国家前面，人民币资产将更具吸引力，有利于市场的稳定。
瑞银认为，受全球市场大幅波动影响，作为风险资产一员的A股受制于全球风险偏好迅速下降，难以独善其身。但由于中国政府对疫情的果断控制，中国经济的恢复应该会早于全球绝大多数国家，因此相对全球市场，A股具有韧性。其中，传统基建和新基建相关板块可能将因具有较高的盈利可见性而跑赢市场。
值得一提的是，人民币债券市场目前成为了全球投资者避险的一个重要选择。
刘立男认为，美元流动性紧缩有可能推升新兴市场/亚洲市场本地资产估值的波动性，同时人民币债券和股票市场波动性亦将受美元全球市场溢出性影响。但现阶段，海外投资者在中国债券市场上的持有占比约为2.35%，尚低于其他新兴市场，因此国内债券市场所受影响应相对较小。
2月末，人民币国债纳入摩根大通全球新兴市场政府债券指数生效，纳入将在接下来10个月分步完成。
德意志银行预计，受此推动，每月境外资金流入规模将达25亿至30亿美元。虽然受美元资金市场流动性紧缩影响，近期市场下调人民币债券配置，但刘立男认为，这为投资者带来加大长期人民币资产配置的机遇。全球收益率下调，中国政策宽松将推动人民币债券市场看涨。
明明认为，本周五（20日）有两种情景：第一，如果LPR维持不变，将利多债市；第二，如果LPR下调5BP，那么可能意味着货币宽松将在复工复产和经济恢复过程中配合财政政策发力，货币政策的窗口期可能延长到年中时点。对债市而言，短期货币政策谨慎下，市场情绪可能延续胶着，市场可能处于震荡行情之中。长远来看，10年国债到期收益率会进入到2.4%~2.6%区间。",2020-03-17 17:29:07,凤凰财经
12,标普500指数期货、道指期货转跌 此前曾触及涨停,【标普500指数期货、道指期货转跌此前曾触及涨停】美国期指持续走低，标普500指数期货、道指期货转跌，纳指期货涨约0.5%。此前美股三大指数期货均上涨约4%并触发交易限制。,2020-03-17 17:27:21,凤凰财经
13,全球市场“熊出没”，道指周跌幅进入历史前十,"全球市场“熊出没”，道指周跌幅进入历史前十2020年03月17日 17:25:10
来源：第一财经
近期全球市场大变脸，疫情扩散令投资者陷入恐慌，多国股票跌入“技术性熊市”，美国股市八天内惊现三次熔断。
16日凌晨，美联储提前降息至0并重启QE，而市场却显然不买账。昨夜，美三大股指开盘下挫，标普500指数下跌7%，触发本月第三次熔断，尾盘特朗普发话疫情可能延续至8月，美股尾盘应声直线下跌。
当被问到“美国经济是否正在走向衰退”时，特朗普回答：“有可能”。但他表示，“现在考虑的不是经济衰退，重要的是抗击病毒”。特朗普指出，一旦遏制住疫情，美国经济将因为需求积压而反弹，最终将实现巨大增长。
目前，海外疫情仍在急剧扩散，根据美国约翰·霍普金斯大学公布的实时疫情数据，截至北京时间3月17日早上7时，中国以外累计确诊病例数已超过10万例。
熔断不断！全球市场上演“熊出没”
周一美股上演“秒熔断”，美洲市场“哀鸿遍野”。
追随美股跌势，加拿大S&P/TSX综合指数开盘跌12%，触发熔断暂停交易。随着COLCAP指数大跌10%，哥伦比亚证券交易所也宣布暂停交易。而在美股开盘之前，巴西股指开盘大跌12.5%，触发熔断。
3月11日道指从近期高点29568.57点已下跌近6000点，跌幅超过20%，正式进入“技术性熊市”。随着美股引发恐慌情绪向全球金融市场蔓延，全球股市“熔断”集中爆发，包括巴西、加拿大、泰国、菲律宾、巴基斯坦、韩国、印尼、墨西哥、哥伦比亚、斯里兰卡等10个国家的股市因暴跌触发熔断机制，盘中暂停交易。
据不完全统计，全球多个国家和地区的股票市场已经跌入""技术性熊市""。
(image_address=""https://x0.ifengimg.com/ucms/2020_12/98885896BB32D6C08C631FD43A5F7076A6263515_w625_h685.png"")
此外，截至昨日，台湾加权指数较近期高点下挫超19.69%，濒临 “技术性熊市”边缘，而今日该股指继续下挫，已进入“技术性熊市”。
美国银行全球研究部分析指出，美国股市在短短21天内从牛市顶峰下跌至熊市区间，但本轮危机与2008年金融危机不同，金融危机的风险集中在流动性恶化、信贷风险传染、失业和经济衰退。目前，大规模财政刺激措施十分重要，只有这样才能扭转局势。
新冠疫情拖累，道指周跌幅进入历史前十
自2009年金融危机以来，11年间美国股市一直都是牛市，而这只强大的公牛却在2020年初被新冠病毒绊住了脚步。
道指上周累计跌超10%，期间接连触发两次熔断，上周跌幅在美股自1900年以来的周跌幅排名中位列第17。
同样在新冠肺炎疫情期间，二月的最后一周，道指累计大跌超12%，位列周跌幅排行第10位。
(image_address=""https://x0.ifengimg.com/ucms/2020_12/7DF1E11D439A3E76D3EF48A17558B09A61905DD8_w534_h616.png"")
3月16日是本周的第一个交易日，道指大跌近13%，创1987年以来最大单日跌幅。
自熔断机制出台以来，历史上，美股的暴跌熔断一共发生过4次，而今年3月刚刚过半，我们就在这半个月内见证了其中的3次。
促使美股推出熔断机制的主要原因是1987年的“黑色星期一”。在当年10月19日，道指暴跌508.32点，跌幅22.6%。
3个月之后，1988年2月熔断机制出台，10月首次开始实施。1997年1月，美国熔断机制做出调整，将熔断触发阈值在原有基础上分别增加100点。随后在1997年10月27日，道琼斯工业指数暴跌7.18%，收于7161.15点，创下自1915年以来最大跌幅。这一天，也是熔断机制在1988年引入之后首次被触发。
高盛首席股票策略师科斯汀认为，熊市的快速到来让许多年轻的市场参与者感到不安。而相比之下，经验丰富的投资者则会回忆起1987年10月19日的黑色星期一。以往事件驱动所致熊市的教训是，金融灾难最终会催生一个新的牛市。",2020-03-17 17:25:10,凤凰财经
14,传闻东京奥运会将推迟至后年 体育用品股受压滔搏跌逾9.2%,"凤凰网港股|受新冠病毒影响，市场传闻东京奥组委多名理事同意，东京奥运会将推迟至2022年，内地体育用品股全线受压。
滔搏(06110)报7.62元，跌9.28%；
裕元集团(00551)报13.2元，跌8.33%；
361度(01361)1.2元，跌6.97%；
安踏体育(02020)50.7元，跌5.23%；
李宁(02331)报17.928元，跌2.18%。
据《路透社》日前亦引述消息人士指，虽然日本已强调东京奥运将按计划举行，但政府和央行官员在预测今年的经济前景时，都开始更认真地考虑取消的风险。据称，奥组委理事会将于30日召开会议讨论该问题。
免责声明：文章观点仅代表作者本人，不代表凤凰网港股立场。若内容涉及投资建议，仅供参考不作为投资依据。凤凰网港股不承担由此引起的任何损失或损害。投资有风险，入市需谨慎。",2020-03-17 17:24:54,凤凰财经
15,"港元拆息全线走高,1个月拆息三连扬重上1.4厘","凤凰网港股|港元拆息(HIBOR)全线走高，其中与楼按相关的1个月拆息连续第三日上升，并重上1.4厘水平，报1.43893厘，较周一高0.17107厘。
据财资市场公会网页显示，港元隔夜拆息报1.19726厘，较周一弹0.0575厘；1星期拆息回升至1.26155厘；两星期拆息上扬至1.36107厘；3个月拆息升至1.3875厘。
长息方面，半年期拆息走高至1.40946厘；1年期拆息上扬至1.43464厘。
金管局总裁余伟文日前表示，新型冠状病毒疫情已令环球金融市场大幅调整，香港股票市场亦同样跟随外围出现波动。金融市场如常有序地运作，港元汇率、利率亦大致保持平稳，银行体系在充足的资本及流动性的基础上保持稳健。
余伟文还指出，环球金融市场正处于风高浪急的时刻，金管局会继续保持警觉，与其他监管机构合作，密切监察市场情况，并根据联系汇率制度确保香港货币稳定。我亦想提醒投资者，市场仍会大上大落，做任何投资决定前，必须小心考虑以及做好风险管理。
免责声明：文章观点仅代表作者本人，不代表凤凰网港股立场。若内容涉及投资建议，仅供参考不作为投资依据。凤凰网港股不承担由此引起的任何损失或损害。投资有风险，入市需谨慎。",2020-03-17 17:23:00,凤凰财经
16,银保监会肖远企：当前我国金融资产估值较低 境外投资者购入人民币资产避险,"中证网讯（记者陈莹莹欧阳剑环）疫情变化正搅动全球金融市场。对此，中国银行保险监督管理委员会首席风险官兼办公厅主任、新闻发言人肖远企17日表示，当前我国金融市场的变化主要是受外围市场的影响，但影响是短期的且有些影响可以对冲，应该对我国金融市场应该充满信心。
肖远企表示，我国金融市场有稳中向上的基础：一是疫情防控方面我国有“先发优势”，现在我国国内的疫情基本上控制住了，复工复产、生产生活正恢复正常；二是我国经济基本面长期向好的趋势没有改变；三是我国的金融资产估值总体处于较低水平，无论是对比2008年我国股票市场的市盈率还是美国股市的市盈率，都处于低位。短期来看，我国金融资产属于避险资产，长期来看属于价值资产。四是我国政策工具丰富，空间较大。从财政政策和货币政策来看，与境外国家相比都有较大空间。“多国进入零利率、负利率时代，仅从利率方面来看，我国也有较大空间。”
肖远企称，近期，境外投资者已经在购买人民币资产，作为避险资产。谈及境外欧美股市大幅震荡，他分析一方面是全球疫情扩散导致恐慌效应放大，投资者信心产生波动。“需求侧在这样的情况下，很容易出现乘数效应，导致推迟消费、推迟投资等。”另一方面或源于技术性熊市。过去十一年，美国股市经历了较长时间的牛市，估值已经出现一些泡沫，现在可能正在出现一些技术性回调，这也是正常的。",2020-03-17 17:17:13,凤凰财经
17,泰国股指第一级熔断限制从8%调整至10%,3月17日讯，泰国股指第一级熔断限制从8%调整至10%。,2020-03-17 17:15:01,凤凰财经
18,法国财长勒梅尔：如有必要，可能将企业国有化以保护它们,财联社3月17日讯，法国财长勒梅尔表示，如有必要，可能将企业国有化以保护它们。,2020-03-17 17:09:17,凤凰财经
19,油价大降创12年之最，重回5元时代！加满一箱油省40元,"今天是国内成品油调价的窗口，受国际油价大幅下跌的影响，国内汽柴油价格也随之大幅下调，创下2008年以来的最大单次降幅，汽柴油每吨下调1015元和975元，全国平均来看，92号汽油每升下调0.80元，95号汽油每升下调0.84元，0号柴油每升下调0.83元。
今年的调价窗口总共出现过5次，三次下调，两次搁浅，汽柴油每升总共下调了1.45元和1.52元，汽柴油价格也重新回到了5元时代。北京某加油站负责人表示，目前92号汽油每升6.32元，95号汽油每升6.73元，这次调价以后，价格会回落到2016年的每升5元多。
(image_address=""https://x0.ifengimg.com/ucms/2020_12/2E2A16183587DA1D8F20F22B1B6883C827C23F52_w900_h1138.jpg"")
央视财经记者给您算了一笔账，按一般家用汽车油箱50L容量估测，加满一箱92号汽油，将少花40元。本次调价是2020年国内成品油调价窗口出现的第三次下调。
国际油价震荡中大幅下跌
调价周期内，以沙特为首的欧佩克与俄罗斯未能就减产达成一致。谈判破裂后，沙特发动价格战，一方面与阿联酋等产油国先后下调原油官方售价，另一方面计划扩大原油产量。再加上新冠肺炎疫情在海外呈爆发式增长，世卫组织宣布新冠肺炎为“大流行病”，市场恐慌情绪加重。受此影响，国际市场原油价格在剧烈震荡中大幅下降。以3月9日为例，当天原油价格大幅下跌24%，为1991年海湾战争以来最大单日跌幅。平均来看，本调价周期纽约WTI、伦敦布伦特原油期货价格分别为每桶37.15美元、40.27美元，分别比上期下跌25.86%、27.30%。
(image_address=""https://x0.ifengimg.com/ucms/2020_12/0EFFBECCF995066B8C4EFA66687A4B21B3015CD1_w836_h533.jpg"")
国家发改委价格监测中心预计，综合多方面因素，国际油价在40美元或40美元以下的低位还将持续一段时间。从需求方面来看，我国疫情防控态势积极向好的情况下，海外疫情却呈蔓延之势，防控形势日益严峻，全球经济增长受到明显影响，其中交通运输业首当其冲，成品油和航空煤油消费需求大幅下降，一季度原油需求预期由升转降，预计疫情对全球原油需求的影响至少会持续整个上半年。从供给方面来看，沙特开打价格战后，沙特阿美计划4月份原油供应量增至1230万桶/日，与1月份供应量相比增长近25%。同时俄罗斯也计划从4月份开始增加原油产量。如果双方不回到谈判桌上，按此产能进行扩产，二季度全球原油将面临严重的供应过剩，原油价格也将持续保持低位。此外，疫情的蔓延也加重了市场的恐慌情绪，股市、债市大幅下跌，市场信心较为脆弱。后期市场关注的焦点将集中在新冠肺炎疫情在海外的发展状况及防控效果，以及美国采取干预油价的政策效果。
(image_address=""https://x0.ifengimg.com/ucms/2020_12/2F9051467F7C097A4616EC0A9396F1BA9AEE95F6_w632_h237.jpg"")
国内成品油价格大幅下调触及地板价
国家发改委今天对外表示,按照2016年出台的《石油价格管理办法》规定,国内汽、柴油最高零售价根据国际原油价格变化,每10个工作日调整一次。从近10个工作日看,国际油价大幅下跌,平均水平已跌破每桶40美元调控下限,国内成品油价格将按机制自今日24时起大幅下调至对应40美元的水平,低于40美元部分不再下调。
成品油价格机制设定了调控上下限。上限为每桶130美元,下限为40美元,即当国内成品油价格挂靠的国际市场原油价格高于每桶130美元时,汽、柴油最高零售价格不提或少提;低于40美元时,最高零售价格不再下调。从历史情况看,2016年1~4月份,由于国际油价大幅下跌,触动了国内成品油价格调控下限,国内油价按机制在40美元以下部分未作调整。
设定上下限，主要是考虑我国既是石油进口和消费大国，也是石油生产大国,油价过高过低都会带来不利影响。过高,会加大用油行业和消费者负担,影响国民经济平稳运行；过低,会影响国内原油开采行业正常发展,削弱自给能力,导致对外依存度进一步上升，不利于保障国内能源安全。
需要说明的是，当油价低于调控下限时，国内成品油价格未调金额不是直接留给企业成为收入,而是全部纳入风险准备金,并根据《油价调控风险准备金征收管理办法》规定,全额上缴中央国库纳入一般公共预算管理,统筹用于节能减排、提升油品质量、保障石油供应安全,以及应对国际油价大幅波动,实施保障措施的资金来源。
年内油价变动一览：三跌两搁浅
2020年，国内成品油调价已呈现“三跌两搁浅”的格局。截至3月17日,今年共有5次调价窗口期,其中2月4日、2月18日、3月17日国内成品油价格下调。截至本次调价，汽油价格累计每吨下调1850元，柴油价格累计每吨下调1780元。1月14日和3月3日两次窗口期对应的前10个工作日国际油价有涨有跌，平均水平变化不大，国内成品油调价金额每吨不足50元，价格未作调整，未调部分已分别纳入2月4日和3月17日调价金额。
(image_address=""https://x0.ifengimg.com/ucms/2020_12/BD9FEFF7CB9B26ADF2E990062C589216D205ABB8_w700_h1551.jpg"")",2020-03-17 17:02:28,凤凰财经
20,银保监会：鼓励支持理财资金和保险资金在合规前提下增加价值投资,中证网讯（记者陈莹莹欧阳剑环）中国银行保险监督管理委员会首席风险官兼办公厅主任、新闻发言人肖远企17日表示，长期以来，理财资金和保险资金都发挥了稳定金融市场的作用。一是两者资金量都不小，二是两者都是机构投资者，投资更趋于稳定，更注重规避风险，是资本市场的长期投资者。“接下来，银保监会仍将鼓励支持理财资金和保险资金在合规前提下，增加价值投资。”,2020-03-17 17:00:50,凤凰财经
