,title,content,pub_time,src
0,今年经济目标能否完成？物价走势如何？怎样扩大有效投资…发改委回应,"原标题：今年经济目标能否完成？物价走势如何？怎样扩大有效投资…发改委一一回应
(image_address=""https://x0.ifengimg.com/ucms/2020_12/B1277B574B2B30CA24177340E80EB81FBE7E5ADD_w800_h480.jpg"")
国家发改委17日召开3月份例行新闻发布会，发改委新闻发言人和相关司局负责同志出席本次线上发布会并对当前经济形势如何，将采取哪些措施促进经济增长，今年物价走势如何，如何推进投资等重点问题一一回应。
3月以来发用电量明显回升，六省复工率接近100%
发改委新闻发言人孟玮介绍，在发用电情况方面，今年前2个月，全国规模以上工业发电量同比下降8.2%，全国全社会用电量同比下降7.8%。分地区看，全国8个省（区、市）用电正增长，其中内蒙古、云南2个省（区）增速超过5%。同时应当看到，3月以来发用电量明显回升，3月16日调度发电量相比2月底上升9.9%。
在复工复产方面，全国规模以上工业企业复工率提高较快，除湖北等个别省份外，全国其他省（区、市）复工率均已超过90%，其中浙江、江苏、上海、山东、广西、重庆等已接近100%。从电网企业监测的用电情况看，目前有色金属行业用电量已达到去年正常水平，医药、化工、电子行业用电量已恢复到正常水平的九成以上，钢铁、机械、纺织行业用电量恢复到正常水平的八成以上。铁路装车数已恢复到正常水平，民航、港口、水运均正常运营。
实现经济发展目标具有很多支撑
如何看待疫情对今年经济增长造成的影响，今年既定经济发展目标能否完成备受关注。
对此，发改委综合司副司长李慧表示，疫情确实对我国经济运行带来了明显影响，前两个月主要经济数据都出现了明显回落。但是同时也应该看到，随着疫情防控的成效日渐显现，一系列已经出台的阶段性应急政策措施逐步落地，特别是后续我们还将适时推动出台一系列对冲政策，企业活力和市场潜力将进一步激发，我国经济运行必将回归常态，实现国民经济和社会发展目标任务具有很多支撑。
李慧介绍，首先，14亿人口生活有保障。近两个月来，尽管经济运行受到疫情较大冲击，但全国人民生活必需品、医疗物资、电气水热等基本供应都得到有力有效的保障，食品、药品、基础工业品、基本公共服务等关系国计民生的重点行业有序运转，经济社会大局保持稳定。这表明我们在保障民生上经受住了一次大考。
第二，大国经济有韧性。作为世界第二大经济体，疫情对经济的短期冲击我们是可以承受的，特别是我国拥有雄厚的物资技术基础和超大规模市场优势，为应对疫情影响提供了有力的支撑。比如说，短时间内我国各种应急物资的生产能力得到了有效发挥并迅速扩张，及时满足了快速攀升的防控需求和大量集中的生活需求，这也充分体现出了我国经济具有的强大供给能力、适应能力和修复能力。
第三，复产达产在推进。目前来看，规模以上工业企业的复工率提高还是比较快的，在大中型企业的带动之下，大量小微企业的复工复产也在加快推进。
第四，经济运行现亮点。虽然疫情对经济运行带来了比较大的冲击，但是我们也看到，一些行业企业特别是新业态、新模式和新产品出现了逆势成长，呈现出不少亮点，比如说网购快递、生鲜电商、在线教育、远程问诊、远程办公等新兴服务需求快速扩张。实物商品网上零售额同比增长3%，占社会消费品零售总额的比重提高了5个百分点，信息服务业生产指数增长了3.8%，智能手表、智能手环的产量分别增长了119.7%、45.1%。
第五，应急政策见成效。这段时间以来，各地各部门根据形势需要紧锣密鼓地出台了多项有力有效的对冲政策。比如说不久前出台实施的总计超过1万亿元的减税降费政策，促进消费提质扩容的19条措施以及16日开始实施的定向降准等。随着这些政策措施的落地见效，相信将会不断缓解经济运行特别是中小微企业面临的困难。
与此同时，在一系列应对措施的作用下，我国疫情扩散势头已经得到基本遏制，防控形势逐步向好，这为经济尽早恢复正常运行提供了有力支撑。从目前调研了解的情况来看，企业家信心也正在逐步回稳，国际上对我国经济发展也充满信心，国际货币基金组织总裁日前表示，在中国政府各项有效措施的作用下，中国经济将在二季度恢复正常。
下一步将采取五方面措施促进经济增长
对于将采取哪些措施来促进经济增长，李慧表示，下一步，发改委将会同有关部门，在加强疫情防控的同时，有序恢复正常生产生活秩序，强化“六稳”举措，注重长短结合、精准施策，顺势而为，充分释放我国发展的巨大潜力和强大动能，重点做好五个方面的工作：
一是有序推动复产达产，根据疫情分区分级推进复工复产，使人流、物流、资金流有序转动起来，保持产业链总体稳定，畅通经济社会循环。
二是抓好各项援企政策落地见效，加大对重点行业和中小企业帮扶力度，全面强化稳就业举措，落实好减税降费、定向降准和稳岗补贴等各项政策，努力保障已复工和准备复工企业日常防护物资需求。
三是积极扩大有效需求，促进消费回补和潜力释放，发挥好有效投资关键作用，特别是要以更大力度、更加精准地补齐疫情防控暴露出的短板弱项，为经济社会的持续健康发展打下良好基础。
四是努力稳定外贸外资，保障外贸产业链、供应链畅通运转，用足用好出口退税、出口信用保险等稳外贸政策工具，抓好重大外资项目落地。
五是着力释放发展潜力，更加注重用好改革开放关键一招，加快体制机制改革步伐，持续优化营商环境，进一步扩大对外开放，充分激发市场主体的活力、动力和潜力。
此外，李慧还表示，中国拥有的政策工具依然充足，发改委将密切监测经济运行态势，根据形势发展需要，适时推动相关储备政策出台实施，加大政策对冲力度，力争将疫情的影响降到最低，完成好全面建成小康社会目标任务。
预计全年物价走势将呈前高后低的态势
对于当前的物价形势，发改委价格司副司长、一级巡视员彭绍宗表示，2月份CPI上涨主要是由猪肉和蔬菜拉动，物价运行的结构特征十分明显。从统计数据看，当月的猪肉价格上涨了9.3%，蔬菜9.5%，二者对CPI环比涨幅拉动的比例合计达到了92%。但是，剔除食品和能源价格的核心CPI同比上涨1%，仍处在温和区间。从总体上看，全社会供给充足，物价总水平平稳运行的态势并没有改变。
同时，对于猪肉价格，彭绍宗表示，发改委监测的36个大中城市，超市、集贸市场的精瘦肉零售价格近一个月连续每天回落。主要是通过采取增加政府储备的冻猪肉的投放等措施加强了调控。特别是生猪产能在不断恢复，将为猪肉价格企稳回落提供有力保障。
彭绍宗指出，工业生产价格总体保持平稳运行态势。2月份PPI同比小幅下降0.4%，部分大宗商品价格有所下降，但少数小品种比如生产口罩的熔喷布、测温枪的热传感器等等，因为需求快速增长，而出现了价格上涨。也有一些中间产品，因为前一段时间相关企业复工复产还比较慢，供需衔接不太畅通，导致供应不足，出现短时间涨价。
关于后期价格走势，彭绍宗表示，随着新冠肺炎疫情防控形势持续向好，生产生活秩序加快恢复，产能进一步释放，物价涨幅有望回落。预计全年物价走势将呈前高后低的态势，不存在全面上涨的基础。
将从五方面扩大有效投资
对于应对疫情对投资运行的影响，将采取哪些政策措施？发改委投资司副司长刘世虎介绍，发改委将聚焦补短板等重点领域，选准投资项目，充分发挥有效投资关键作用。具体来说，就是加快推进国家规划已明确的重大工程和基础设施建设，重点加大公共卫生服务、应急物资保障领域投入；加强脱贫攻坚、交通能源、重大水利、农业农村、生态环保、市政设施、社会民生、城镇老旧小区改造等补短板领域建设；加快5G网络、数据中心等新型基础设施建设进度，更加注重调动民间投资积极性。
刘世虎表示，下一步，发改委将努力扩大有效投资，提高投资效益，推动稳投资各项政策措施落地见效，充分发挥有效投资关键作用。一是在确保疫情防控到位的前提下，坚持分类指导、分区分级施策，积极有序推动重大投资项目开复工，协调解决在用工、运输、原材料等方面的困难和问题。二是进一步优化投资结构，抓紧下达中央预算内投资，加大对疫情重灾区应急医疗救治设施、隔离设施等传染病防治急需项目建设的支持力度。三是扩大地方政府专项债券规模，抓紧准备专项债券项目，支持有一定收益的基础设施和公共服务项目建设。四是加大投资审批制度改革力度，加强投资项目在线审批服务，加快推进重大项目前期工作。五是按照“资金跟着项目走”、“要素跟着项目走”的原则，协调加强资金、用地等要素保障，确保建设项目扎实推进。",2020-03-17 17:56:55,凤凰财经
1,"融资杠杆松绑！多省市小贷公司获多项""临时性""利好，能否破解融资难题？","融资杠杆松绑！多省市小贷公司获多项""临时性""利好，能否破解融资难题？2020年03月17日 17:56:48
来源：证券时报
融资杠杆松绑！多省市小贷公司获多项""临时性""利好，能否破解融资难题？
(image_address=""https://x0.ifengimg.com/ucms/2020_12/3994C2EDBF9E05C5DB4412F6C66776FC2B9E84AD_w600_h333.jpg"")
多地释放小贷公司利好。
3月份以来，广东、重庆、山东、深圳、湖南、河南、四川等多省市向小贷公司释放利好政策：涉及阶段性放宽融资杠杆、拓宽小贷公司融资渠道、扩张展业区域等多个方面。
对于全行业家数近8000家，近三年来屡屡传出遭遇融资瓶颈、不良率激高至经营亏损、从新三板摘牌等消息的小贷公司来说，正是初春迎来及时雨。
多地融资政策利好：降成本、宽渠道、提杠杆
近日，河南省金融局发布《关于有效发挥地方金融从业机构作用积极支持疫情防控和中小微企业复工复产的若干意见》明确，为充分发挥小贷差异化信贷功能，鼓励小额贷款公司加大对受疫情影响较大的中小微企业复工复产的支持力度。
具体而言，疫情防控期间，国有小额贷款公司年化综合实际利率原则上下调5%～10%。而且允许小额贷款公司因支持企业复工复产围绕供应链跨区放贷。各项监管指标优良、参与疫情防控和支持企业复工复产的小额贷款公司，经报备后融资余额可放宽至不超过净资产的3倍。
不难发现，河南地方在上述文件对小贷公司在疫情防控期间的政策调整，划重点是四个关键词：部分小贷公司（国有、监管指标优良等）、融资成本降低（原则下调5%～10%），跨区域展业（围绕供应链支持企业复工复产）、融资杠杆放宽（≤净资产的3倍）。
不仅仅河南，券商中国记者在各地方金融局官网看到，从2月底至今，已经至少有广东、重庆、山东、深圳、湖南、四川等合计6个省份及直辖市围绕这四个方向做文章，向辖内的小贷公司释放了利好。
比如融资成本方面，四川省金融局对小额贷款公司在疫情期间对符合条件的小微企业（含个体工商户）客户新增业务和展期业务，融资利率原则上可在原利率基础上下浮15%。
杠杆倍数方面，广东省金融局率先提出在疫情期间提出放宽小贷杠杆至5倍，而对于通过非标准化融资方式的小贷公司，融资杠杆放宽至不超过净资产2倍。深圳金融局方面提到，如因支持疫情防控需提高融资杠杆的、融资杠杆不超过5倍。此外，山东金融监管局宣布适度放宽优秀小贷公司的融资杠杆至5倍。
对于小贷公司来说，杠杆倍数的调整意味着，可以基于净资产（注册资本）放大其放贷额度。此次未对此作出调整的湖南金融监管局，则更侧重降低小贷公司的准入门槛，如鼓励符合条件的优质企业在制定区域设立小额贷款公司、可不受主发起人其关联方持股比例上限的限制，注册资本金可降低至3000万元。曾在2012年率先在放宽融资杠杆的重庆地区此次也只考虑酌情增加贷款额度、适度下调贷款利率，但强调支持小额贷款公司用好用足原来的2.3倍融资杠杆。
在展业区域上，湖南金融监管局表示，对净资产2亿元（含）以上且分类监管评级达到A级的小贷公司，经省地方金融监管局批准，小贷公司可在全省范围内开展业务。山东地区小贷公司为防疫物资生产企业提供资金支持，经市地方金融监管局认定并报省地方金融监管局同意后，可适当放宽经营区域和业务范围。
融资渠道方面，湖南、深圳地方金融监管局都表示，允许小贷公司通过银行、股东定向借款、行业内拆借等非标准化方式融入资金；鼓励优质小贷公司使用证券交易市场、银行间市场发行债券、资产证券化产品等标准化工具融资。湖南金融监管局则提出，允许优质小贷公司在全国中小企业股权转让系统、区域性股权市场等国家认可的金融交易场所挂牌融资。
屡屡融资难、经营亏损，小贷公司获及时雨？
相比互联网小贷公司，传统小贷公司有严格的展业区域限制，客群比较集中于当地行业，比如江苏、广东作为小贷公司数量最多的省份之一，这些小贷公司的辐射范围，即是通过线下向乡、镇、街道等特定区域即大小工业园区等拓展。也因此，为数众多的小贷公司在这次金融支持企业复工复产中作用不小。
苏宁金融研究院院长助理薛洪言认为，我国小微企业位数众多，相比银行获取授信的门槛，适当提高小贷公司的杠杆上限很有必要，能充分释放其贷款投放能力，助力更多小微企业渡过难关。
不过，实际情况是，企业数量多达近8000家的小贷行业近三年的发展情况或并不乐观。央行数据显示，截至2019年9月末，全国共有小额贷款公司7680家，贷款余额9288亿元，前三季度减少257亿元，小贷公司机构数量和从业人员数量持续减少。比如2018年底，中国小贷公司是8133家、同比上年已下降4.89%。
自2014年7月30日全国首家小贷公司鑫庄农贷挂牌新三板以来，小贷公司作为曾经扎堆新三板的明星行业之一，截至2018年末，至少有46家小贷公司在其登陆。但到2020年2月末，据记者不完全统计，已经有约14家小贷公司终止挂牌。
今年2月26日，滨江小贷(OC.833342)终止在全国中小企业股份转让系统挂牌，原因降低公司运营成本，提高经营决策效率等。这家主营业务是向“三农”发放贷款、提供融资性担保、开展金融机构业务代理的公司，去年前三季度，营业收入812万、同比下降11.06%；净利润录入97万、同比下降77.21%；而该公司2018年净利润一度同比暴增2326.36%、在新三板小贷公司中表现突出，亏损主因是应收帐款坏账准备大幅增加，放贷规模较年初不增反减。
而且滨江小贷的情况或者只是一个缩影，与小贷公司数量、从业人数的下滑相印证的是，小贷行业整体业绩在近三年来的持续下滑。“千顺”小贷大数据系统显示，从新三板33家小贷公司披露2018年年报看，2018年，全行业累计实现营业收入11.76亿元、同比下降13.19%；同期全年实现净利润2.06亿元、同比下降69.22%，净利润超3000万的仅6家，5家出现亏损，分别是商汇小贷（1.95亿）、通利农贷(1.24亿）、日升昌（3161万）、棒杰小贷（1500万）、阳光小贷（657万）。
正如零壹研究院分析的情况，尽管小贷业务在过去几年快速发展，但也受融资渠道受限、资金成本较高，宏观经济周期影响带来的不良处置压力及不良率上升，业务模式单一及互联网小贷业务冲击等明显影响。“放宽小贷公司的融资杠杆以及融资渠道，一方面是缓解小贷公司自身的经营和资金压力，另一方面也是使得小贷公司有余力加大对小微企业客户的金融服务。”在零壹研究院院长于百程看来，从近几年来看，多数小贷公司面临着经营压力，只有小微企业客户平稳度过这次危机，小贷公司才能够降低经营风险。
不过，值得注意的是，疫情期间各地对小贷等监管指标的调整，均是有“时间期”限制的临时性特点。比如湖南金融监管局、山东金融监管局对小贷公司监管标准的执行期限是实行自发布之日起的6个月。而重庆金融监管局局执行期则是自发布之日起至2020年6月30日止。",2020-03-17 17:56:48,凤凰财经
2,高盛：美股流动性已到了金融危机以来最糟糕的时候,"3月17日讯，按照高盛的测量方法，美股的流动性已经来到了金融危机以来最糟糕的时候，这也能解释为什么市场的涨跌显得一惊一乍的。目前美股做市商提供的买卖价差爆炸般上涨，标普500期货市场的市场深度也来到了有史以来的最低水平。
(image_address=""https://x0.ifengimg.com/ucms/2020_12/42AF13D2FF09F19D157B9A68A50D19CBCE4AA2A1_w550_h356.jpg"")
(image_address=""https://x0.ifengimg.com/ucms/2020_12/A46A001E9AF9282CB59B24B4BDAAAF8489C7455E_w550_h243.jpg"")
来源：RobinWigglesworthFT资深记者，覆盖全球金融新闻智堡",2020-03-17 17:56:32,凤凰财经
