,title,content,pub_time,src
1,滴滴分拆，嘀嗒上市：打车生意迈入下一个战场,"“打车大战”八年后，出行市场硝烟再起。
嘀嗒出行传出计划赴香港IPO的消息，据《商业数据派》独家获悉，嘀嗒2020年预计盈利约4亿元，对此消息嘀嗒方向表示：不予置评。据其6周年披露的数据，截至2020年8月31日，注册用户数和注册车主数分别达到1.8亿和1900万，连续15个月盈利；
另一边，滴滴出行接连拆分出多个新的子品牌：青菜拼车、花小猪打车、快的新出租，经过两年“Allin安全”的调整之后，滴滴明显开始提速“补课”业务；
此外，高德宣布接入多家出租车公司总计3万辆巡游出租车，接近北京市巡游出租车总量的一半；哈啰出行推出物流业务“哈啰快送”，已在东莞、佛山两个城市上线测试。
2017年底，滴滴创始人程维说，“滴滴可能是有史以来世界上竞争最惨烈的公司”。三年过去了，作为行业用户量老大的滴滴不仅没有高枕无忧，还面临嘀嗒、哈啰、高德的挑战，出行行业仍然充满了变数。
(image_address=""https://x0.ifengimg.com/ucms/2020_37/16D0B4223D5375C0B2DDA8584BA0713BB51E3D4D_w998_h527.png"")
梳理&制图：商业数据派
八年局势未稳，打车行业的焦灼可见一斑。从最初的提升运营效率，到如今的深入B端服务，下一个从出行领域中搏杀出位的锦囊妙计，到底在哪里？
滴滴分拆
2020年9月1日，滴滴出租车业务升级为“快的新出租”，同时宣布投入1亿元专项补贴，为出租车乘客发放打车券拉动消费。
此举意味着，在滴滴的业务版图中，曾经因为合并而消失的“快的”，曾经网约车崛起而被边缘的“出租车”，将被重新提升高度，承担滴滴下一阶段增长的重任。
出租车业务对于滴滴，是一个起点，也是一个难点。
2012年的冬天开始，滴滴创始团队在出租车北京西站停车过道、路边休息区，靠一个个的解释说服，为一万个出租车司机安装了滴滴软件。
在激烈的市场份额抢夺大战中，通过补贴出租车乘客和司机，滴滴和快的聚拢了用户，培养了人们手机叫车的习惯，为快车和专车等网约车的推出打下了基础。
但出租车与后二者存在本质不同：出租车打表计价，乘客支付给司机的车费，滴滴不参与分成。
这一状况导致了滴滴和出租车行业之间若即若离的微妙关系：滴滴从出租车业务上赚不到钱，而出租车司机在离不开打车软件的同时还时有不满，出租车公司的态度从剧烈抗拒到尝试合作共赢。
2012年滴滴刚进入移动出行市场时，全国出租车每天的订单有近7000万，8年后的今天，出租车日均订单依然在5500万左右，服务人次超过1亿。而滴滴出租车业务覆盖全国300多个城市，去年日均订单量才300万单，不足10%。
(image_address=""https://x0.ifengimg.com/ucms/2020_37/3CE11B2259AA129E44D23D8C85C06F6400FE67D7_w830_h502.png"")
数据来源：ZAKER｜数读天下｜天眼查
9月5日，交通运输部运输服务司孟秋透露，截止目前，已有超190家网约车平台公司取得了经营许可，101万辆车取得了网约车运输证，网约车日均订单量达2200万单。出租车订单量仍然远超网约车，同时不少城市也推出增发出租车牌照的计划，比如西安今年预计将增发4000多个牌照，深圳过去两年则增发了6000多张牌照。——曾经“一照难求”的出租车，也开始出现供大于求的现象。
滴滴重新深入出租车市场，更像是忽然觉醒，开始对以前业务缺失的补课，思考的出发点不再是一个个的司机，而是背后的出租车公司。
今年6月，滴滴进行了一轮架构调整。出租车运营部组织升级，下设安全与用户体验部、创新发展部、交易运营部、市场部、商业发展部。
今年9月，快的新出租宣布与银建出租、新月联合、北方北创、银山出租、三元出租及赛达福等北京26家出租车公司达成合作，为这些公司提供信息化管理软件“桔行系统”。该系统可实现出租车订单线上化、信息化和可视化。截至目前，北京已有超6万辆出租车接入平台。
互联网出行对出租车行业的改变，已经不再是解决乘客打车难问题的C端生意，而是面向出租车公司数字化转型的B端生意，接下来在出租车业务领域的竞争，或许转变为大客户的竞争。
滴滴正在调整和补课的还有顺风车业务。2019年11月20日开始，滴滴顺风车陆续在全国多个城市试运营，今年6月19日，滴滴公布，顺风车已陆续在全国300个城市重新上线试运营，相较试运营初期，每周选择顺风车出行的车主、乘客数量增长了数十倍。
对于滴滴来说，恢复上线的顺风车、重新深耕的出租车，将是不一样的挑战。网约车的难点在于牌照（其他的网约车平台也都一样），顺风车的难点在于安全，而出租车的难点是各大出租车公司。
嘀嗒翻身
2018年，滴滴顺风车遭遇下线整改期间，原本在夹缝中生存的嘀嗒出行，获得宝贵的咸鱼翻身的机会。
顺风车因为不需要补贴、运营成本较低，更容易实现盈利。滴滴顺风车下线前，日均订单200万单，仅占滴滴全部订单量的8%，却为滴滴创造了8亿元的利润。
2019年9月，嘀嗒出行宣布盈利，而《商业数据派》方面也独家获悉嘀嗒预计在2020年收入4亿元的净利润。
嘀嗒出行的利润点都来自哪里呢？除了每单收取的1-3元不等的信息服务费，以及广告增值业务、后市场的加油、维修保养、保险、车辆金融服务，以及新车、二手车买卖业务等等。
嘀嗒出行6周年成绩单显示，截至2020年8月31日，注册用户数和注册车主数分别为1.8亿和1900万。这一数字还没有达到滴滴顺风车下线前的水平，此前媒体报道数据显示，截至2017年末滴滴顺风车注册车主3000万人，注册乘客1.6亿人。
不同于滴滴在出行市场多线布局，嘀嗒将重心集中在顺风车和出租车两项业务上。
2019年7月，嘀嗒宣布“出租车&middot;新出行”战略，定位为城市出租车智慧运营服务商，为城市出租车管理部门、运营公司和从业人员提供一整套数字化服务和管理体系。
“2017年时我们也认为网约化是出租车改革的发动机，但很快我们发现这是错的，网约化并不能让它走出困境，甚至可能让它加快灭亡。”嘀嗒出行CEO宋中杰说，“网约和扬招只是叫车路径的不同，服务质量才是内核，如果用户体验不好，出租车网约化会加速被乘客抛弃。”
因此，如何用线上化的方式，帮助网约或扬招不同场景下出租车提升服务质量，提高运营效率，成为嘀嗒出行出租车业务核心要解决的问题。
在产品层面，嘀嗒出行开发了“出租车智慧码”、“扬招打车助手”，前者帮助乘客了解自己乘坐的出租车车辆和司机信息、评价订单、在线支付、获取电子发票、分享行程等，后者使乘客了解附近出租车运行状态，再根据实际情况选择到底网约还是路边扬招。
由此积累的评价数据、行驶数据，能够帮助城市监管部门和出租车公司建立司机评价体系，精准预测和调度运力。
据了解，“出租车智慧码”工具在西安市区全部近1.4万辆出租车试点，使用量超过5000万次，占当地出租车营运总趟次的72%。
如何将出租车的数字化服务转化为收入，经过一年实践的嘀嗒已经有了思路：为出租车行业和司机创造的新订单和收入，收取信息费，为出租车企业研发系统，收取服务费；进一步地，未来合作探索出租车内衍生广告平台、移动电商等，嘀嗒出行也将获得相应收入。
而这些领域，显然也是滴滴已经或者即将进攻的方向。今年以来，原“滴滴出租车”陆续开展出租车事业部组织架构升级；为出租车企业提供信息化管理系统“桔行系统”；加快试点新服务，包括加强打击黑产、推出司机加油、吃饭优惠；以及与出租车企业和地方政府合作，试点“优选出租车”等。
相对于打车补贴中的漫天轰炸，B端服务更像一点点攻坚，打下每个堡垒，拿下每个城池。区域地区的攻坚能力，或将成为滴滴和嘀嗒在出租车B端服务上的下一个竞争点。
竞争逻辑变了
2017年，美团推出打车业务，程维接受《财经》采访时说：“每一个赛段都是一个110米栏，你都有对手，但你要盯着终点，余光看看（对手）就好。”
曾经在打车大战中拼杀出来的滴滴，也很难想到后续还有这么多新对手出现。
“农村包围城市”，下沉市场的逆袭。嘀嗒从顺风车到出租车，从远郊市场到城区，哈啰从单车到出租车、顺风车，从下沉市场到一线市场，二者都是从不受关注的低线市场开始，悄无声息开始蚕食主流市场份额。
但是嘀嗒的前景也并非一片光明，其固守的顺风车和出租车都是增长相对较慢的业务，嘀嗒虽然已经盈利，其收入模式很重要的一份来自衍生业务，对流量入口非常依赖。
而且，嘀嗒、高德、哈啰距离滴滴的体量还有较大差距。8月26日滴滴宣布其全球日订单已突破5000万，滴滴出行CEO程维定下的3年内日订单1亿已经完成一半。
4月16日，滴滴出行CEO程维在公司战略会上公布了未来3年的战略目标“0188”：安全是滴滴发展的基石，没有安全一切归0；3年内实现全球每天服务1亿单；国内全出行渗透率8%；全球服务用户MAU超8亿。在日订单量目标中，四轮车承担5000万单，两轮车、国际化分别承担4000万、1000余万单。
今年5月，滴滴出行总裁柳青在接受采访时表示,公司的核心网约车业务已经盈利，而在此之前则是滴滴七年的亏损。
出行行业要走向盈利，烧钱换增长的方式行不通了。
滴滴铺的面更广，而嘀嗒、首汽、高德在细分领域扎的更深。规模化要保持，产业链也要打透，新战场上对每个玩家的要求更高了。
有趣的是，两种模式开始逐渐交融，滴滴在努力做深自己的服务，而小嘀嗒们也一定会想办法横向拓展自己的市场。
作者：商业数据派",2020-09-09 10:41:59,凤凰财经
2,美联储调整货币政策外溢效应，欧日央行陷入两难,"美联储货币政策调整会导致美元进一步走弱，不希望本币继续对美元升值的欧日央行如何进行政策调整？
近期，美联储主席鲍威尔在杰克逊霍尔全球央行年会上阐述了美联储对货币政策的修改，而这给欧日央行在内的全球其他主要央行同时出了两道难题：其一，如何针对美联储增加对通胀率容忍度带来的美元进一步走弱进行政策调整；其二，是否效仿美联储，将央行政策目标延伸至社会政策领域。
(image_address=""https://x0.ifengimg.com/ucms/2020_37/C1B940D3EC40157626D89092EEEA973A62589ADA_w483_h328.jpg"")
美联储主席鲍威尔
弱美元令欧日央行陷两难
过去30多年，美联储一直采用的是提前加息以阻止通胀上升的策略。而此次，美联储对货币政策框架进行修改，寻求实现平均2%的通胀率，在通胀持续低于2%的时期，适当的货币政策可能会在一段时间内实现适度高于2%的通胀目标。
这一调整表明，美联储将对通货膨胀采取更宽松的立场，即便未来通胀率超过美联储2％的目标，美联储仍计划将利率维持在低水平。在市场人士看来，这意味着弱美元将持续更长时间。
渣打中国财富管理首席投资策略师王昕杰在接受第一财经记者采访时表示，美联储新的平均通胀目标政策意味着，它可能会容忍通胀率更高，从而进一步抑制实际收益率。美国实际利率相对下降和日益充足的美元流动性，将继续支持看跌美元的观点。
此外，他称，美国攀升的双赤字也将加重投资者的忧虑，导致长期海外投资从美元流出，并削减美元储备配置。美国大选的进程和结果还可能引发不确定性并增加美元的波动性。外汇策略师以萨（MazenIssa）也认为，平均通胀目标强化了美元失去实际收益率优势的现实，从周期性角度来看，这对美元构成了挑战，让市场相信美元长期高估的状况可能被削弱。
王昕杰还称，弱美元下，欧元、日元对美元强势回升，可能会令欧央行和日本央行感到不安。
自从美联储宣布新的通胀政策以来，欧元对美元加速上涨，上周一度冲上1.20的两年高位，使得欧央行首席经济学家连恩（PhilipLane）在本周欧央行利率会议前表示，欧元对美元利率对货币政策“确实重要”。
“首先，这两个经济体都依赖出口，汇率升高大幅降低其竞争力。其二，尤其重要的是，汇率提高变相降低其进口商品价格，使得通胀水平继续下降。”王昕杰称，“所以，考虑到美国货币政策框架的改变，不排除欧日央行也会推出对等的货币政策，以提升本地区的通胀水平，来努力维持一定的汇率水平。”
新加坡华侨银行大中华地区研究主管谢栋铭在接受第一财经记者采访时也表示，在美联储进一步调整货币政策框架，更加看重平均通胀的情况下，大家对美元的进一步下滑存在比较大的共识。如此一来，欧元可能会进一步升值，从而间接对欧央行的政策产生一定影响。
但他同时表示，即使没有美联储的政策调整，在杰克逊霍尔会议上，连恩在鲍威尔之后也发表了讲话，列出了欧央行的两步走，第一步是如何对冲疫情对经济的影响，第二步是在后疫情时代货币政策是否需要更加宽松。因此，不管美联储的政策如何运作，欧央行的政策框架已经设定好了。
“欧央行最主要的目标就是确保中期价格稳定，这可能需要额外的货币宽松政策。接下来欧央行可能会增加资产回购规模或进一步讨论负利率。”谢栋铭称，“但欧央行会在9月还是年底推出进一步的宽松政策，目前还不确定。美联储的政策调整可能会迫使欧央行提早推出进一步宽松政策。”
欧央行理事会成员德科斯（PabloHernandezdeCos）近日曾表示，欧央行“随时准备必要时调整所有工具，在欧央行管理委员会上，我们已经明确表示有必要保持高度的货币宽松以支持复苏，避免金融分裂并维护我们的价格稳定目标”。
日本央行前官员、现任第一生命研究所（Dai-ichiLifeResearchInstitute）首席经济学家的熊野秀夫（HideoKumano）也称：“如果美联储将在很远的未来才推动加息，日央行将不得不担心日元对美元可能升值，而这需要日本央行采取政策应对，包括加深负利率。”
不过，欧日央行调整政策的空间实际上遭到诸多限制。两者都连续多年实施负利率政策，已接近超宽松政策的极限。欧洲内部和日本国内也都反对采取更多宽松政策。
谢栋铭表示，以欧央行为例，进一步推行负利率的确存在副作用，空间也有限，最显著的就是对银行业利润的影响，“最根本的还是要取得一个均衡，既能够刺激经济又能鼓励银行参与到经济中，这是很多国家的监管机构都会面临的一个比较大的挑战”。
基于此，他认为欧央行下一步还是可能通过资产购买，扩张资产负债表的方式支持经济，本周四的利率会议也有可能推出新的货币措施。
以萨称，如果欧央行此次在官方声明中提到欧元最近的反弹，可能会对外汇市场产生重大影响；而如果它被推到问答环节，市场将不以为然。
央行政策目标是否该延伸至社会政策领域
更值得注意的是，美联储在表态中调整了对就业最大化问题的看法，以推动劳动力市场实现更广泛的增长。鲍威尔称，这一变化反映了美联储对强劲劳动力市场的赞赏，尤其是对许多中低收入群体而言。而这给全球其他主要央行提出了另一个难题：央行的政策目标是否该延伸至社会政策领域。
日本央行副行长田部昌澄（MasazumiWakatabe）称：“就个人而言，我认为，货币政策应该更多地考虑就业和收入问题。”欧央行行长拉加德此前也曾表示，可将气候变化列为评估其政策的关键因素。
但央行官员是非选举产生的行政官员，涉及气候变化、不平等等问题可能令其遭到政治上的攻击，影响央行独立性。
王昕杰认为，量化宽松政策会导致资本泡沫，这也是造成美国及其他发达市场贫富差距更加悬殊的原因。虽然这些问题超出了央行的政策目标，他们也并不需要为此负责，但在未来，央行如何缩小或者维持因为超发货币导致的贫富差距更加扩大，也应是一个重要议题。
OneRiver资产管理公司首席投资官彼得斯（EricPeters）则对全球央行政策与美联储政策的趋同提出疑虑。
“过去十年来，全球央行都向美联储的政策组合靠拢，降低利率，扩大流动性，刺激全球债务和杠杆率出现历史性上升。”彼得斯称，“进入2020年，全球的政策组合是罗马时代以来最单一的，就像生活中所有的事物一样，缺乏多样性会降低弹性。”
此外，他还称，美联储对全球货币政策的主导权产生了复杂又意想不到的结果。例如，减轻了政治家们的治理任务。每一次危机都可以通过货币轻松解决，将未来的需求提前拉到现在，这使得政治家们可以避免在为今天的支出和为明天的投资之间作出艰难的选择。
“这会导致未来的繁荣被拉到现在。而在某个时间点，实体经济将毫无反应，货币政策将完全无能为力。一旦接近这个终点，货币政策就会逐渐失去效力，政治家们不得不重新开始更加艰难的选择。”他称。",2020-09-09 10:28:56,凤凰财经
3,上交所副总经理刘逖：年内科创板总市值有望超过5万亿元,9月9日，上交所副总经理刘逖在全球创投峰会上表示，随着蚂蚁集团、京东数科、吉利汽车等企业申报科创板上市，预计年内科创板总市值有望超过5万亿元。,2020-09-09 10:09:45,凤凰财经
4,反诉游戏开发商、新品生产滞后，机构：苹果股价还有30%下跌空间,"自从9月2日触及高点137.98美元以来，最近三个交易日，苹果公司股价累计跌幅超过15%，总市值也已跌破2万亿美元。
即将于当地时间9月15日上午10时（北京时间9月16日凌晨1时）举行秋季新品发布会的消息，并没能提振苹果公司股价。
当地时间周二，美国股市延续了上周的下行行情，再次全线下挫。苹果公司股价报收于112.82美元，下跌8.14美元，跌幅为6.73%。自从9月2日触及高点137.98美元以来，最近三个交易日，苹果公司股价累计跌幅超过15%，总市值也已跌破2万亿美元，目前为19295亿美元。
(image_address=""https://x0.ifengimg.com/ucms/2020_37/1A77135300141B82B2B38F6EECF80B4CD97F356F_w490_h308.jpg"")
当地时间周二，苹果公司针对EpicGames的诉讼提出反诉。
除了受美国股市总体趋势的影响，与《堡垒之夜》（Fortnite）游戏开发商EpicGames的诉讼纠纷，让苹果公司股价雪上加霜。
当地时间周二，苹果公司针对EpicGames的诉讼提出反诉，指控该游戏公司违反了与苹果公司之间的合同，并寻求损害赔偿。不过，目前还不清楚苹果公司要求对方赔偿的具体金额。
在提交给加州北区地方法院的一份文件中，苹果公司表示：“虽然EpicGames将自己描绘成一家现代企业‘罗宾汉’，但实际上它是一家价值数十亿美元的企业，却根本不想为自己从AppStore应用商店获得的巨大利润支付任何费用。”
双方的争端始于8月13日。当时EpicGames在苹果AppStore应用商店发布了《堡垒之夜》的一个版本，该版本允许用户直接向EpicGames付费购买游戏中的内容，而不必像之前那样给苹果公司30%的提成。
随后，苹果公司下架了这款游戏，而EpicGames则迅速对苹果公司提出起诉。8月28日，苹果公司暂停了EpicGames的开发者账户，这意味着EpicGames无法在苹果公司的平台上创建新的应用或更新《堡垒之夜》。
在周二提起的反诉中，苹果公司进一步请求法院追究EpicGames违约和其他责任，要求对方归还《堡垒之夜》通过其支付系统收取的所有费用，并希望法院颁布一项永久禁令，禁止EpicGames在包括《堡垒之夜》在内的所有应用中使用外部支付机制。
“EpicGames从AppStore应用商店获得了超过6亿美元的利润。”苹果公司在提交给法院的文件中表示。
EpicGames则辩称，苹果公司打压了自由市场竞争，要求恢复《堡垒之夜》在AppStore应用商店的使用权，并恢复其开发者账户。
听证会目前定于9月下旬举行，不过日期可能会改变。
苹果公司反诉、封杀EpicGames的举动，一度引发全球游戏厂商和玩家的讨伐。若整个游戏界联手抵制苹果公司，势必将对其业绩产生重大冲击。
加上受到新冠肺炎疫情干扰，苹果公司可能会在本月中旬才开始生产第一批5GiPhone。这一时间表明显落后于苹果过去几年的常规时间表，往年苹果公司都是在8月份开始批量生产9月份发布的新产品。今年早些时候，苹果最初订购了约1亿部iphone的零部件，但在疫情暴发后，将目标降至约8000万部。
投行高盛将其对苹果公司的评级维持在“卖出”，认为苹果公司股价仍有30%以上的下跌空间。高盛分析师罗德&middot;霍尔（RodHall）在写给客户的报告中表示，“苹果公司的增长率不足以支持其相对于标普500指数的高溢价”。",2020-09-09 10:00:10,凤凰财经
