,title,content,pub_time,src
3,A股“医药一哥”卷入受贿案，75亿学术推广费也被质疑,"原标题：A股“医药一哥”卷入受贿案，75亿学术推广费也被质疑！公司最新回应来了……
近日，A股市场中的医药一哥恒瑞医药(600276)卷入浙江某医院医生受贿案件。
恒瑞医药5月12日晚发布澄清公告称，浙江某医院医生受贿案件中部分证人是公司的子公司员工。经核实，该事件是子公司员工个人行为，严重违反了公司管理制度，但也反映出公司管理方面存在漏洞。目前，相关人员已离职，子公司责任领导已被调离岗位。公司及公司董事、监事、高管不存在违法违规行为，目前不存在相关诉讼。今后，公司将吸取教训，加强对子公司的合规管理，杜绝此类事情发生。
(image_address=""https://x0.ifengimg.com/ucms/2020_20/141C98C3731133949A0C85AE887BF1217FCCF8CA_w700_h597.png"")
据e公司记者了解，有媒体日前发布了标题为《恒瑞医药一年学术推广费近75亿花哪儿了》的文章。文章称，近日，浙江丽水一名医院麻醉科主任雷李培的刑事判决书，再次将电影《我不是药神》中，关于治病救人还是治病赚钱的讨论放在了公众视野下。而查询中国裁决文书网，恒瑞医药卷入的医生腐败案，远不止这一件。
文章指出，2019年，恒瑞医药花掉了85亿的销售费用，并质疑公司2019年销售费用和其他现金支出的合理性。
文章称，2020年一季度，恒瑞医药仍然花费了19.27亿元的销售费用，同比增长了约8%。从2019年财务数据对比看，该公司学术推广费和差旅费两项支出占销售费用98%以上。因季报中恒瑞医药并未列明学术推广费和差旅费的具体金额，目前外界并不能判断今年1-3月公司学术推广费用和差旅费这两项支出的同比增减情况。而如果疫情背景下，恒瑞医药今年一季度这两项费用不减反增，则需要公司作出合理解释。
5月12日晚，恒瑞医药除在澄清公告当中称，2019年公司销售费用率36.61%。根据同花顺数据，公司销售费用率在沪深股市医药制造业230多家公司（含原料药公司）中，位列第85，处于行业居中水平。公司2019年年报披露的销售费用主要包括公司产品的学术推广、创新药专业化平台建设等市场费用、差旅费以及股权激励费用等，本期发生额分别是75.26亿元、9.09亿元和8834.09万元。
恒瑞医药同时表示，公司近年来严格控制各项费用支出，销售费用率逐年下降。2020年一季度，公司需要进行现场交流的销售活动受到疫情影响有所减少，但销售费用中包含销售人员的工资、五险一金、办公费、学术研究等相对固定的费用，并且随着销售人员的增加及待遇的提高，相应费用有所增加。公司实行全面预算管理，对各销售分子公司年度预算进行审批并严格管控。各分子公司及各部门在年度预算范围内，根据工作进度进行月度预算，财务部门在月度预算额度内根据付款申请拨付及账务处理。公司上述销售费用真实、合规、合理。
恒瑞医药同时还对公司其他现金支出作出说明。恒瑞医药表示，公司2019年支付的其他与经营活动有关的现金科目中，其他项目金额合计13.65亿元，主要包括研发系统、销售系统和行政管理系统各部门及人员使用的业务备用金、员工福利购房借款等。其中销售系统备用金9.62亿元，研发系统备用金3.04亿元，行政管理系统备用金0.61亿元，员工福利购房借款0.14亿元，其他支出0.25亿元。
据了解，国内医药医疗领域的商业贿赂案件历来被媒体重点关注。恒瑞医药作为中国创新型龙头制药企业，创新药已形成了上市一批、开发一批、临床一批的格局，有大量学术推广属正常现象，而其销售费用率在行业排名居中，并不具有典型性。此次判决书公布后引发媒体关注，其深层次折射出外界对整个国内制药行业销售费用率居高不下的焦虑和质疑。
恒瑞医药方面表示，随着国家医药、医疗和医保领域的改革深入推进，特别是国家药品集中采购的常态化和大范围推广，未来国内药品销售费用大幅下降是必然趋势，合规转型也将成为国内制药企业的生存法则，而节省下来的费用，将最终让利给药品消费者。",2020-05-12 20:46:33,凤凰财经
4,为5毛钱，用户怒了！15个月巨亏10亿，丰巢急了？百亿市场突现死结,"为5毛钱，用户怒了！15个月巨亏10亿，丰巢急了？百亿市场突现死结2020年05月12日 20:43:27
来源：证券时报
原标题：为5毛钱，用户怒了！15个月巨亏10亿，丰巢急了？百亿市场突现死结，“躺赚”为何成“躺亏”？
近日，丰巢公司发布的一份关于保存包裹收费的通知引发争议。
通知指出，丰巢将为用户在12小时之内免费保存包裹，超时将按照0.5元/12小时的价格进行收费。用户可通过加入丰巢会员的方式，享受有效期内不限保管次数的服务。
在丰巢公布新的收费方案后，大多数网友表示不满，多地部分小区业委会暂停合作，多地监管部门表明了依法处理的态度。快递柜诞生的初衷是为了解决快递行业成本高昂的“最后100米”的问题，丰巢收费引发的争议将快递业长期存在的末端配送矛盾暴露了出来。那么，快递柜能否向消费者收取服务费？是否合法合规？快递柜的盈利模式是什么？未来发展趋势怎样？
丰巢收费引发争议
4月30日，丰巢科技官方宣布将向用户收取一定的超时费用，普通用户免费保管12小时，超时后收取0.5元，3元封顶，消费者也可以选择购买会员，月卡5元一个月，不限保管次数，每件可享7天长时存放。
虽然收取的费用不高，但对于丰巢突如其来的操作，消费者在各种平台上表达了自己的不满。
5月10日，上海中环花苑小区发布致丰巢公司的公开信，直指丰巢快递柜收费不合理。该小区认为丰巢公司没有权利要求用户这样去操作，更不能剥夺用户可以足不出户收到快递的权利。
与上海小区有相同做法的，国内多地均出现部分小区选择停用丰巢快递柜的现象，山东、江苏、浙江、福建等地监管部门也陆续发声，回应快递柜收费相关话题。
除此之外，新华社人民日报等主流媒体纷纷发声。新华社发消息三问""快递柜收费""，人民日报评论""人民微评""也表示，消费者的知情权和选择权不容侵犯，有关制度设计的尊严不容挑战。
5月9日晚，丰巢发布致用户公开信再度回应，解释初衷并推出鼓励尽早取件的红包政策。也就是说，丰巢并未因用户的不满而终止收费行为。
(image_address=""https://x0.ifengimg.com/ucms/2020_20/0D64F3337160E90D043621CAC7B693CA6B05E4C8_w550_h1227.png"")
在用户的一片哗然中，部分消费者对丰巢的利润提出了质疑。
在上海中环花苑小区的信中就提到了丰巢的利润问题，该小区称，丰巢公司目前占有70%的市场份额，且其已向快递员收取了使用费用（大中小三种格子，分别收0.45元、0.4元和0.35元每单），即使每个格子周转率一天只有一次，单个快递柜80格，取快递员支付费用三档的中间值0.4元/单计算，每天收入至少为36元，而快递柜进驻小区每天的场地租金收入（含电费）只有十几元，即每天的利润率为240%甚至更多。
国信证券研报也指出，智能快件箱使用寿命或可达10年以上，折旧期远小于使用期。不考虑折旧的情况下，目前即使在一线城市，快件箱的运营已经可以覆盖成本。
虽然都说的有理有据，然而对应的现实却是丰巢连续五年的亏损。仅去年一年，丰巢和速递易两家快递柜头部企业合计亏损近13亿元。目前这两家行业龙头已于5月5日合并。数据显示，丰巢2020年一季度末未经审计的营业收入为3.34亿元，亏损2.45亿元；2019年营收16.14亿元，亏损7.81亿元。
对于推出超时存放的收费标准，丰巢方面此前表示，初衷是为了服务进一步的精细化、改善投递效率，同时也希望推动物流末端市场的迭代。此外考虑到快递柜目前经常被超长时间占用，公司面临经营成本上的压力才做出的调整。
收费是否合理合法？
争议过后，社会各界就快递柜收费是否合理合法的问题展开了讨论。
法律相关人士指出，快递柜的投放和收费涉及到三方之间的法律关系：收件人、快递公司、运营快递柜的企业。快递公司如果不取得收件人同意将快递放入柜中，违反了货物运输合同，侵害收件人权利。
不过此次丰巢事件更为复杂，实际涉及多方的法律关系。此前有律师向媒体表示，发货人、收货人、快递公司、丰巢、业委会、物业公司等六个方面的利益都牵扯其中。
其中，发货人、收货人和快递公司这三方有“运输法律合同”，物业公司和丰巢之间有“场地租赁服务合同”，物业公司和业委会之间有“物业服务合同”。
物业公司和丰巢签的协议，业委会有没有权利单方面终止。显然原协议中未提及收费，丰巢突然提出4月30日起要收取12小时外的超时服务费，业委会认为不合理，但这不能算终止合同的理由，确实属于违约。
丰巢快递柜提供12小时免费保管，超过12小时收取超时保管费。丰巢快递柜这种做法本身并不违法，是正常的市场行为和市场选择。《智能快件箱寄递服务管理办法》第二十五条规定：“智能快件箱运营企业应当合理设置快件保管期限，保管期限内不得向收件人收费。”并没有规定快递柜不能收费。
但矛盾在于，在实际操作中，快递员常常为了提高效率往往不经过收件人同意就擅自将包裹放置快递柜中，损害了快递收件人的合法权益。
《智能快件箱寄递服务管理办法》第二十二条规定：“智能快件箱使用企业使用智能快件箱投递快件，应当征得收件人同意；收件人不同意使用智能快件箱投递快件的，智能快件箱使用企业应当按照快递服务合同约定的名址提供投递服务。寄件人交寄物品时指定智能快件箱作为投递地址的除外。”
因此，只有征得用户同意后，快递公司才能将包裹投递快递柜中，若未经用户同意投递，那么因超时而造成的费用，收件人就没有义务支付。
可见，丰巢快递柜收取超时保管费，关键不是免费保管时长是设置12小时还是24小时，而是要切实保障快递收件人的知情权和选择权。
网经社电子商务研究中心法律权益部分析师蒙慧欣表示，关于快递柜收费问题不能“一刀切”，而是要建立在双向选着和自愿原则基础上。快递柜存在的初衷是收件人收件不方便时的备选项，同样对于快递公司配送量过大且保障时效的前期下，快递柜也是最好选择。
因此，在用户同意的情况下，快递员告知其存放收费政策从而保障用户知情权，收费是合理的。
智能快递柜缺口巨大
因电子商务和快递行业的高速发展，智能快递柜成为解决快递行业“最后一公里”物流配送环节的重要工具。2010年后快递柜模式开始进入物流末端市场，因其相对灵活安全便捷，获得了部分消费者认可。2012年，中邮速递易率先在国内开启智能快递柜业务。随后多家企业进入快递柜行业，全国快递柜数量经历了爆发式增长，快递入柜率也快速提升。
截至2019年底，全国快递柜数量已经达到40.6万组，全国快递入柜率达到10.5%。国家邮政局数据显示，预计到2020年快件入柜率有望达20%，对应快递柜格口需求约为7600万个。预计到2023年将达到30%，设备市场规模超500亿元。
(image_address=""https://x0.ifengimg.com/ucms/2020_20/4DBE0871F08CA43BC777F46DE4722F77426C142B_w771_h444.png"")
从快递业务量增速与智能快递柜的数量来看，智能快件柜远未达到天花板，投递覆盖率仍在较低水平。 国家邮政局数据显示，2019年快递业务量完成635.2亿件，同比增长25.3%；业务收入累计完成7497.8亿元，同比增长24.2%。整体来看，快递业仍保持高速增长的态势，整体规模在不断扩大，预计到2020年业务量将超700亿件。
(image_address=""https://x0.ifengimg.com/ucms/2020_20/34056938D6A24A713FAB041D70D139C626FA4BC4_w770_h465.png"")
上游端来看，智能快递柜仍有不断扩张的趋势。A股市场上智能快递柜生产商主要有智莱科技与新北洋。新北洋为智能快件箱龙头，在丰巢、中邮速递易等厂商的市占率第一。不过，公司2019年营收与净利均出现下滑，对于业绩下滑的原因，公司表示主要因新零售行业和物流行业部分大客户订单调整所致。
智莱科技2019年实现营业收入10.46亿元，同比增长18.0%；归母净利润2.86亿元，同比增长35.25%。其中，公司智能快件箱类设备营收占比高达92.8%，毛利率高达48.03%。
对于智能快递柜未来发展趋势，智莱科技董事长干德义表示，从需求上来看，智能快件柜的市场空间还很大。目前互联网式的电商物品交付模式仍处于发展的阶段，智能快件箱在国内一二线城市或者主要省会城市偏多，但在三四线及以外的城市基本上没有。虽然国外起步早，但目前国外大部分解决的是比较集中的公寓、别墅等区域的铺设问题，并且国外的主要产品运营是在欧美发达的国家，而在南美、中东、东南亚这些地方还不够。同时，随着消费者使用习惯的改变、无接触式交付模式带来的便利性以及疫情对消费者的教育，未来智能快件箱的入箱率也会有所上升。
另一快递柜生产商新北洋表示，2020年将巩固并提升末端配送产品、信息化终端产品及物流自动化分拣产品的优势地位，加快发展服务运营业务，形成全产业链的竞争优势。
政策层面，因安全、高效、便捷的配送模式，智能快件箱屡屡获国家支持。本次疫情中，国家防控指挥部在新闻发布会上鼓励使用快递柜进行物品交付，减少人与人之间的接触。国常会在3月份也提出要将智能快件箱纳入城乡基础设施建设范畴。4月，国家邮政局与商务部明确智能快件箱、快递末端综合服务场所的公共属性，提出将智能快件箱、快递末端综合服务场所纳入公共服务设施相关规划，提供用地保障、财政补贴等配套措施。
盈利模式如何突围？
当前，快递柜运营商主要分为三大阵营，分别为快递系、电商系与第三方快递柜企业，其中丰巢与中邮速递易属于快递系，菜鸟驿站与京东智能柜属于电商系。从目前盈利能力来看，快递柜似乎并不“赚钱”，快递柜两大巨头丰巢与中邮速递易近年来几乎均为亏损状态。
“从“一元赞赏功能”到“超时收费”，快递柜都在试图探索盈利模式，侧面反映其面临持续亏损压力。如何盈利已成为目前智能快递柜运营企业所面临的共同难题。”网经社电子商务研究中心法律权益部分析师蒙慧欣向记者表示。
目前来看，大部分快递柜的收入主要有五种。一是向快递员收取派件收费，也就是快递员使用速递易快递柜投放快递时需根据快递柜大小缴纳一定费用；二是用户寄件收费；三是向用户收取超期使用费；四是广告业务收入；五是增值服务收入的模式。智能快递柜要实现盈利仅仅依靠收费和广告还远远不够，如何形成一种可持续的盈利模式？
“智能快递柜基础价值在柜，但增量价值在智能化、数字化服务，一旦普及化、网络化发展。” 中国物流学会特约研究员杨达卿表示。快递柜作为社区服务桥头堡，可以产生两个超级价值，一是可能成便民物流服务链在社区的综合性出水口，解决未来包括普货快件，甚至特殊货物如生鲜冷鲜、甚至餐饮外卖等温控快件。二是可能成为较贴近社区消费者，开展快递揽件及精准营销、社交电商等服务数据的磁吸口，为销售决策和营销服务提供支撑。
一直以来，快递柜运营商们在不断探索新的盈利增长点，丰巢快递柜此次收费也是其中之一。
“智能快件柜有公共服务设施属性，如果没有匹配公共服务设施的政策支持，可能永远会被囚禁在社区物业利益和各种服务矛盾的囚笼里。”杨达卿表示，落实国务院2018年提出的把智能快件柜纳入公共服务设施相关规划并给予支持，才可能促进快件柜降本运营。
对于如何降本运营，杨达卿称，电商快递上游的电商平台和中游快递企业都会影响到快递柜服务稳定，需要快递服务链上下游协同。电商平台要在给消费者的配送物流服务选项上加入是否接受寄存就近快递柜并接受延时收费的选项。快递商要规范快递员的寄存入柜前与消费者的必要信息沟通，保稳定服务就是保收益。此外，快递柜企业应积极推进多元化业务拓展，打破单一收寄存费的低附加值服务，向精准营销等增量服务拓展。
网经社电子商务研究中心特约研究员解筱文向记者表示，智能快递柜发展主要困境在于如何协调快递企业和消费群体，解决公益服务和市场经营之间的矛盾，培养大量消费者广泛使用的习惯，更进一步提升智能化服务水平，探索被各方接受的盈利模式。去年开始，有智能快递柜企业创设的柜体广告投放模式，目前快递柜运营企业的商业模式比较单一，盈利模式简单粗暴，整体发展还在探索发展中。
”就国内当前的情况而言，智能快递柜运行者要盈利，就应想方设法降低成本。”瑞典皇家理工大学客座教授、高级物流师王勇博士认为，通过“一柜多用”来提高收益，还通过其他途径来实现盈利，比如与支付宝、网银企业合作，让消费者支付方参与到智能快递柜免费使用上来，降低成本。事实上，随着智能快递柜的进一步普及和曝光频率增加，广告商的兴趣也会增加，广告盈利会稳固增长，这也是运行方可期的。
关于快递柜盈利模式应该如何突围，有专家持不同态度。快递行业专家赵小敏向记者表示，目前快递柜行业的核心问题不是盈利，市场现在才刚刚开始，未来会有新的企业陆续加入，现在谈盈利价值不大。
丰巢收费或重构行业生态
“超时收费”事件的发酵显然超出了丰巢科技的预料。目前的情况是，用户表示不满、多地小区联合抵制、多地监管部门表态，权威媒体也为此发声称消费者的知情权和选择权不容侵犯。
在各方压力下，丰巢表示全国性措施暂不改，为鼓励大家及时取件将于近期推出早取件、赢红包的活动。也就是说，收费是没有商量余地的，只不过可以适当给予优惠。
虽然只是超过12小时收费5角钱，丰巢突然宣布的收费规则还是触动了不少消费者的神经。
本轮消费者对丰巢的核心“骂点”在于三个方面：第一，快递柜方便的是快递员而非用户，并且用户的选择权受到了伤害；第二，12小时储存时间对于都市上班族来说太短；第三，丰巢既赚了快递员的钱，又赚了广告主的钱，现在又要来收割用户 。
先来看一下快递柜的收入问题，以丰巢为例，此前在使用上会对快递员收取使用费用，丰巢柜分大中小三种格子，分别收0.45元、0.4元和0.35元每单。除此之外，丰巢快递柜的表面基本上都贴商家广告，显示屏里也在循环播放各类广告，是丰巢日常收入的一部分。
再拆解一下快递柜的成本，成本由一次性快递柜设备投入，加上日常维护费用以及已存在或可能存在的物业落地费三部分组成。
从会计角度来看，快递柜8年左右就能折旧完毕，之后只要柜子的收入能覆盖维护性费用，快递柜企业就能躺着赚钱。
此前，快递柜行业常年亏损已是老生常谈的问题，主要涉及两方面问题：一是营收方面，用户不愿为存放快件付费，而快递员向快递柜企业支付的费用十分低廉；二是成本方面，设备生产成本较高，同时投放点位租金较高。这两个死结至今无解，或许丰巢是在无奈之下才想出“超时收费”的办法。按照丰巢的思路，超时费用未来将会占到总收入的一部分。
智能快递柜的本质是共享加密空间，参考共享充电宝，共享单车，最终的盈利模式只能靠向用户收取使用费。然而快递柜现在欲收费但遭抨击的阻力就在责任不清楚，到底该向谁收？
在国外，快递柜大多是小区基本配套，作为一种公共资源。以日本为例，每栋楼宇都有一个标准的配置用来收发快递，主要是政府投资安装，操作十分简单。
瑞典皇家理工大学客座教授、高级物流师王勇博士表示，国内智能快递柜未来亦可作为政府民生工程出现，不过要想发展成熟还需要一段时间。
目前来看，一个较为理想的方案就是在用户使用快递服务的时候提供两个选择：第一，可以使用丰巢，如果逾期由用户付费，这个服务价格低一些；第二，不可以使用丰巢，快递员送货上门，这个服务价格高一些。这样可以根据用户的消费能力和消费习惯进行一个区分，也能更好的满足不同层次的用户。
值得一提的是，丰巢在推出会员制后的几日，就收购了中国邮政速递易，成为了名副其实的行业老大。行业地位奠定后，议价能力也会随之提升。由于丰巢带头收费，快递柜免费的日子或许不会太长久。不过，此次丰巢宣布超时收费后，菜鸟方面明确表态继续为消费者免费保管。
丰巢本来已经向快递员收费，也得到行业的普遍默认，现在增加向消费者免费收快件保管期之后的延时占柜费，或引起一些价格敏感性客户拒用丰巢快件柜，造成已接受快递柜的快递企业不得不重回无差别到门配送，使得配送压力增加。行业服务有层级，服务价格有差别，这次矛盾或利于行业各方把矛盾摊到桌面上，寻找合适的解决方案。”中国物流学会特约研究员杨达卿表示。",2020-05-12 20:43:27,凤凰财经
