,title,content,pub_time,src
0,“奶酪第一股”股价翻倍，蒙牛突然终止认购，什么情况？两大股东本想“悄悄”减持，结果...,"每经记者彭水萍
作为A股“奶酪第一股”，妙可蓝多近年来可谓风头正盛，尤其是今年年初蒙牛集团受让5%股权，乳业“强强联手”令其股价今年以来涨幅超200%。今年3月，蒙牛集团拟通过妙可蓝多的非公开发行进一步增持股份，更是令其股价翻倍，一度逼近50元关口。
(image_address=""https://x0.ifengimg.com/ucms/2020_35/78E218457ADF41715666D2176D211A9A6A65E43A_w796_h562.png"")
不过，出人意料的是，妙可蓝多23日晚间突发公告，宣布终止此前与蒙牛集团签订的非公开发行股票预案。同时计划向实控人柴琇100%持股的广讯投资非公开发行股票，募资总额不超过5.75亿元，用于乳制品和奶酪加工项目等。
(image_address=""https://x0.ifengimg.com/ucms/2020_35/0428206A8ACBA3F9E2A5680AEAF603BAFF3C7BAA_w634_h561.png"")
有意思的是，就在新发行预案公布前两日，妙可蓝多公告称其两位股东存在违规减持行为，而这两名股东正是年初转让股权给蒙牛集团的自然人股东刘木栋、王永香，由此两人持股刚好降至5%以下，以为往后可以“悄悄”减持了，不曾想随后的减持还是违规！
蒙牛认购妙可蓝多股票预案终止
今年3月25日，妙可蓝多发布非公开发行A股股票预案，拟向控股股东柴琇实控的东秀实业、内蒙古蒙牛乳业（集团）股份有限公司（以下简称蒙牛集团）发行不超过5870.71万股，柴琇与蒙牛集团的计划认购金额分别为5.75亿元、3.15亿元。募集资金将主要用于妙可蓝多上海第二工厂改扩建项目、吉林中新食品区奶酪加工建设项目、广泽乳业特色乳品产业升级改造项目。
在此次非公开发行前，蒙牛集团已于今年1月与沂源县东里镇集体资产经营管理中心、王永香、刘木栋、沂源华旺投资有限公司签署股份转让协议，交易完成后持有妙可蓝多5%的股份。待该股份转让和本次认购完成后，蒙牛集团将合计持有妙可蓝多约8.81%的股份，成为后者第二大股东。
然而在谋划了几个月后，上述非公发行预案突然终止。妙可蓝多在8月23日公告中解释称，终止发行是综合考虑最新监管要求、资本市场环境并结合公司实际情况提出的，不会对公司正常经营与持续稳定发展造成重大影响。
(image_address=""https://x0.ifengimg.com/ucms/2020_35/D5A73F04CC312377A163EDBD9C150C6DD4834D99_w637_h637.png"")
在终止上述发行预案的同时，妙可蓝多宣布拟通过向吉林省广讯投资有限公司（以下简称广讯投资）非公开发行股票，募集资金总额不超过5.75亿元，主要用于年加工27000吨乳制品项目和吉林中新食品区奶酪加工建设项目。
由于广讯投资由妙可蓝多实控人柴琇100%控股，因此构成关联交易。认购前，柴琇合计持有妙可蓝多19.88%的股份。认购完成后，广询投资将持有妙可蓝多3.84%的股份，柴琇合计持股比例将增至22.96%。
新预案发行前两股东违规减持
8月21日，即最新非公开发行股票预案披露的前两天，妙可蓝多发布公告称，其股东刘木栋、王永香合计违规减持股票约1236.72万股，占妙可蓝多总股本的3.02%。值得注意的是，这两名股东正是年初转让股权给蒙牛集团的两名自然人股东，而在转让之前均为持股超5%，转让后刚好降至5%以下。这次股权转让于3月26日完成过户登记手续。
(image_address=""https://x0.ifengimg.com/ucms/2020_35/AE9E9AB75C5A54D4C0C74397522200B90FA7E70B_w483_h264.png"")
妙可蓝多在上述公告中称，两名股东虽不再是本公司持股5%以上的股东，但根据《上市公司董监高减持股份的若干规定》第十条，“通过协议转让方式减持股份并导致股份出让方不再具有上市公司大股东身份的，股份出让方、受让方应当在减持后6个月内继续遵守本规定第八条、第九条第一款的规定。”“股东通过协议转让方式减持其持有的公司首次公开发行前发行的股份、上市公司非公开发行的股份，股份出让方、受让方应当在减持后6个月内继续遵守本规定第九条第二款的规定。”
两名股东最近的减持行为未提前15个交易日预先披露相关减持计划公告，以及在3个月内通过上海证券交易所集中竞价减持股份比例超过公司股份总数的1%，违反了中国证监会《上市公司大股东、董监高减持股份的若干规定》（证监会公告[2017]9号）第八条以及第九条第一款的规定。
公告称，刘木栋、王永香向公司说明，此次减持并非主观故意违规，主要系相关人员对减持相关规定认知解读不充分。刘木栋、王永香就本次违规减持行为进行了深刻的自查和反思，并就此向公司和广大投资者表示诚恳的歉意。",2020-08-24 09:10:31,凤凰财经
1,累计亏损扩大至4.70亿元，但扩张步伐仍将狂奔，疫苗“后浪”康希诺能否卡到C位？,"《科创板日报》（上海，记者金小莫）讯，8月23日下午，A+H股康希诺生物公布2020年半年报显示，其实现营收402.96万元，较同期增长111.43%，主要系疫苗组分销售及技术服务收入增加所致；归母公司净利润为负1.02亿元，较同期亏损增长46.65%，亏损的主要原因在于企业持续进行疫苗的研发工作和临床试验，研发支出较高。
至此，康希诺生物已累计亏损4.70亿元，公司在半年报中称，未来一段时间内，预期存在累积未弥补亏损并将持续亏损。
亏损仍将持续
康希诺生物扩张的脚步继续加大，这体现在三方面。
一是康希诺研发关系持续增加。据半年报，其现有研发管线包括：脑膜炎、新型冠状病毒、百白破、肺炎、结核病、带状疱疹等13个适应症的16种创新疫苗产品的研发。报告期内，康希诺的研发费用为1.08亿元，预计未来三年还要投入9-12亿元。
“公司主要研发项目在报告期内取得了实质性的进展，随着现有研发项目的陆续进入临床试验阶段，公司在研发人员薪酬、耗用物料、仪器设备、检验测试等方面将进行持续性的投入。”康希诺生物称。
二是生产厂房的建造。康希诺称，目前，其已初步建成疫苗产业化基地(一期)，计划投入5.75亿元用于生产基地二期建设。另上述疫苗研发成功后也需要建设厂房，预计主要疫苗品种的生产线构建平均超过亿元，工艺复杂、产能需求大的疫苗可能需要数亿元。
三是康希诺生物正在进行国际化布局。《科创板日报》记者注意到，今年5月，康希诺在加拿大成立了全资子公司，注册资金1万加拿大元。“将用于疫苗、化学生物药品的辅助研究、临床申报和进出口贸易等。”康希诺生物称，旨在促进公司海外研发工作，加强与国际市场交流合作。
另外，今年1月康希诺生物任命PierreArmandMorgon博士担任高级副总裁，负责国际业务，“该任命将进一步推动公司的国际化发展战略”康希诺生物称。
持续高额的版图扩张是否太过激进？太平洋证券盛丽华分析师认为，我国疫苗产品存在升级换代需求，其未来可能发生的事与仿制药与原研药类似，“先发企业能持续在产品迭代速度快于后发者，使得头部企业将能持续保持竞争优势。”
强者恒强效应将会显现。因此，作为新入局者的康希诺生物必须尽快实现规模化发展，并建立起自己的行业地位。除此之外，“还需要注意到国内先发企业凭借品种，将率先建立疫苗渠道优势，以及凭借品种搭建起技术平台的规模效应。”盛丽华认为。
产品有望今年上市
一个有利于的消息是，康希诺生物旗下两款产品：脑膜炎球菌结合疫苗MCV4及MCV2疫苗已提交药品监督管理局上市申请。其中，MCV2与2019年2月提交新药注册并受理;MCV4于2019年11月提交新药注册并受理，并被纳入优先审评。
光大证券分析认为，MCV2疫苗有望于今年上市，MCV4有望于2021年起贡献业绩；东兴证券则估计前两款产品均可在今年实现上市，并称其MCV2疫苗为潜在中国最佳疫苗；MCV4疫苗为潜在中国首创疫苗。
“国内目前尚无MCV4产品上市，康希诺生物在研的MCV4在国内所有在研MCV4疫苗中进度领先。”东兴证券支持，康希诺生物已与辉瑞签署MCV4推广服务协议，产品获批后，将由辉瑞负责产品在中国大陆市场的学术推广工作。
其进一步预测认为，康希诺生物在2020-2022年预计实现收入2.24亿元、8.59亿元、15.05亿元；2030年预计实现收入157.91亿元。
据本期财报数据显示，康希诺生物的资产负债率为19.50%，与同行相比，其低于智飞生物（49.93%）、长春高新（30.66%）、万泰生物（24.13%），高于沃森生物（16.07%）、华兰生物（12.42%）。",2020-08-24 09:10:28,凤凰财经
2,80亿！最强消费金融公司诞生，蚂蚁牵头，股东阵容豪华，互联网巨头都在抢滩这一领域,"作者：胡飞军
继中国平安、小米之后，又一家巨无霸消费金融公司即将诞生。
阿里巴巴入局消费金融迎来实锤消息。
8月22日，鱼跃医疗公告，拟与蚂蚁集团、宁德时代、千方科技、国泰世华银行、南洋商业银行和中国华融一起设立蚂蚁消费金融公司，注册资本高达80亿元，注资规模与捷信消费金融并列行业第一。
蚂蚁消费金融公司的股东阵容强大，集聚了蚂蚁集团科技巨头+2家外资银行+3家上市公司+1家AMC，行业涵盖支付、银行、医疗、新能源、资产管理等诸多领域，称得上是资金方与场景齐聚最全的消金公司。
最大消费金融公司将诞生
阿里系有望再拿一张金融牌照。
近日，鱼跃医疗与千方科技均发布关于参与设立重庆蚂蚁消费金融有限公司的消息，注册资本80亿元，注册地位于重庆。
具体来看蚂蚁消费金融有限公司的股东构成：
(image_address=""https://x0.ifengimg.com/ucms/2020_35/0E1782C927647C88EDDE2E350CE81CC93BE52EC4_w554_h486.png"")
上述7家股东企业已于8月21日签署共同投资合作交易文件。
根据公告，蚂蚁消费金融有限公司成立以后业务范围主要有：开展消费金融相关业务，经营范围包括发放个人消费贷款、接受股东境内子公司及境内股东的存款、发行金融债券、境内同业拆借等。
拆解已披露的蚂蚁消费金融有限公司股东情况：包括了1家互联网科技巨头、2家外资银行、1家新能源科技公司、1家布局智慧交通和物联网公司、1家医疗器械公司和1家AMC（不良资产管理公司）。
资料显示，南洋商业银行创办于香港，目前是中国信达资产附属公司，而国泰世华银行为中国台湾地区最大的民营银行，在银保监会归类中，这2家银行均为外资银行。
“南洋商业银行、国泰世华银行和中国华融应该是蚂蚁消费金融公司的主要资金方。”一位消费金融行业研究人士对记者表示，拉上外资银行一起设立消费金融公司，这在目前金融开放背景之下更容易获批，加上这些银行都不是实力特别强的银行，蚂蚁集团能够有更强势的话语权。
上述人士所言非虚，2018年，由台湾地区中国信托商业银行股份有限公司参股的两岸首家消费金融公司——厦门金美信消费金融公司，从获批筹建到开业仅用了半年时间，大大刷新消费金融公司开业速度。
今年8月10日，光大银行、中青旅和外资银行——台湾地区王道银行一起设立的阳光消费获批开业，较同期其他一起筹建消金公司的公司节奏快了很多。
鱼跃医疗称，投资蚂蚁消金，是考虑到公司作为国内最大的家用医疗器械公司，面向消费者的品类众多，特别是单价较高产品，非常适合与标的公司合作，以消费金融的方式赋予高端医疗器械普惠大众的可能。
这意味着，若消费者购买单价较高的医疗器械产品，以后可以选择蚂蚁消金的贷款、分期等方式支付，即通过消费金融的创新方式，降低消费者购买门槛。
千方科技布局智慧交通和智能物联，在交通等领域场景较多，而宁德时代可能与鱼跃医疗类似，动力电池产品可能适合消费金融的方式。
8月20日，蔚来汽车宣布，携手宁德时代、国泰君安国际控股有限公司和湖北省科技投资集团三家企业共同投资成立武汉蔚能电池资产有限公司，以推动“车电分离”新商业模式在新能源汽车行业的发展，并在此基础上推出BaaS（Battery　as　a　Service，电池租用服务）业务。
根据流程，蚂蚁消金尚需经过银保监会重庆监管局和银保监会审批通过后方可实施。
如果顺利获批，蚂蚁消金注册资本80亿元将跃居行业并列第一。
据记者了解，目前消费金融行业已开业公司达到27家，注册资本最高的为捷信消费金融有限公司，该公司经过多次增资才达到80亿元，紧随其后的为平安消费金融（50亿）、马上消费金融（40亿）、招联消费金融（38.7亿）。
BAT仅剩腾讯未拿牌
券商中国记者注意到，今年以来，消费金融公司设立提速，尤其是互联网科技巨头布局呈现加速态势，BAT中仅腾讯尚未透露获取消费金融牌照的意向。
就消费金融行业而言，随着我国经济发展和居民可支配收入的持续提升，社会消费品零售总额稳健增长，消费金融行业面临的宏观环境较好。
8月19日，中国银行业协会发布《中国消费金融公司发展报告（2020）》披露，2019年，消费金融公司整体增速有所放缓，但仍保持在相对较高的水平。截至2019年末，消费金融公司资产规模达4988.07亿元，较上年增长28.67%;贷款余额4722.93亿元，较上年增长30.5%。
截至2020年6月末，消费金融公司已发展到26家，注册资本433.4亿元，资产规模4861.5亿元，贷款余额4686.1亿元，服务客户数1.4亿人。
到今年8月，已经开业的消费金融公司已有27家，从近年来消费金融公司股东背景来看，除了商业银行股东，券商中国记者注意到，互联网科技巨头正在加速布局，包括百度、新浪、中国平安、小米和阿里巴巴均在消费金融领域跑马圈地。
2019年5月，百度的度小满金融出资4.5亿元，持有哈银消费金融30%的股权，跃居第二大股东，成为BAT中首家获得消费金融牌照的互联网巨头。
2019年6月，新浪旗下新浪微博斥资2亿元入股包银消费金融有限公司，成为包银消费金融有限公司第二大股东。
今年4月，科技实力较强的中国平安及关联公司设立的平安消费金融有限公司成立。
今年5月，重庆小米消费金融有限公司成立，小米通讯技术有限公司持股50%。
业内人士认为，互联网科技巨头积累了大量的数据资源，自身拥有巨大的流量优势和风控优势，通过与相关资本方和实业股东合作，能够充分利用自身优势，抓住消费金融行业的红利。
设立消费金融公司，对于阿里系的蚂蚁集团来说意味着什么？
据不完全统计，蚂蚁集团已经相继拿下支付（支付宝）、银行（网商银行）、保险（国寿财险、众安保险）、基金（天弘基金）和小贷（重庆蚂蚁小微小贷、重庆蚂蚁商诚小贷）等多张金融牌照。
蚂蚁集团目前的花呗和借呗业务就是蚂蚁通过小贷牌照经营的业务，其商业模式和消费金融业务没有本质区别。
不过，消费金融牌照的含金量远高于小贷牌照，一方面，消费金融牌照属于银保监会颁发的正宗金融牌照，而小贷牌照属于地方金融局等颁发，小贷公司是否属于金融机构在业界尚存有争议，且消费金融公司还可以获批发行金融债券、同业拆借等；另一方面，相比于小贷1~3倍的杠杆比例，消费金融牌照约有10倍的杠杆优势，能够有效利用资金优势扩大业务规模。
因此，从牌照含金量高、市场发前景广阔以及行业合规性等因素考量，成立消费金融公司成为蚂蚁集团必要的动作。",2020-08-24 09:10:23,凤凰财经
