,title,content,pub_time,src
4,主流房企财报综述：业绩增速放缓、现金流承压、净负债率下行,"主流房企2019年年报和2020年一季报已经披露完成。新华财经和面包财经研究员以2019年销售前50名的房地产企业为样本，剔除未上市、部分数据缺失或部分数据异常等公司后，分析了42家样本房企（以下简称“样本房企”）2019年全年和2020年一季度的财务表现及业绩变化。
研究显示，样本房企2019年平均营业收入为1036.47亿元，同比增长21.67%；平均归母净利润为107.6亿元，同比增长13.32%。平均营收和平均归母净利润增速均较2018年有所放缓。
样本房企2019年累计产生经营性净现金流2440.96亿元，同比下降约四成。负债方面，样本房企2019年的带息债务总额为56931.5亿元，同比增长14.26%，但净负债率连续两年下降。
样本房企营收和利润增速放缓泰禾集团表现最差
数据显示，样本房企2019年实现累计营业收入、归母净利润分别为43531.8亿元和4519.06亿元；实现平均营业收入和归母净利润分别为1036.47亿元和107.6亿元。
样本房企2019年平均营业收入、归母净利润增速分别为21.67%和13.32%，利润增速小于营收增速。同时，相比2018年，营收、归母净利润增速均有明显放缓。
(image_address=""https://x0.ifengimg.com/ucms/2020_21/42B4651F6572D5AC947C262B0471882BD6EF0C86_w864_h570.png"")
图1：2015-2019年样本房企历年平均营收、归母净利润增速
其中，营业收入超过1000亿元的房企共有11家，这些头部企业的平均营收增速为20.44%，接近样本房企整体水平；但平均归母净利润增速只有约10.81%，明显低于样本房企整体水平。值得一提的是，中国恒大2019年营收增速2.44%，归母净利润下滑53.78%，较大程度上拖累了头部房企整体业绩增长。
样本房企中，表现最差的是泰禾集团，营收同比减少23.36%，归母净利润同比下滑67.62%。对于利润大幅下滑，公司表示主要原因为“减少并表项目、交付结利项目减少、毛利率下降以及投资性房地产公允价值评估增值低于预期等”。
值得注意的是，进入2020年以来，房企施工、销售均受到新冠肺炎疫情明显影响。从披露的2020年一季报样本房企财务数据来看，平均营收同比增长1.4%，平均归母净利润同比下降21.81%。
房企现金流受疫情影响有所承压
数据显示，样本房企2019年产生经营性净现金流入2440.96亿元，相比2018年的4215.32亿元明显减少。
(image_address=""https://x0.ifengimg.com/ucms/2020_21/15BF9CC03BA7C9E46F520AB7CC684423682C1B76_w864_h570.png"")
图2：2015-2019年样本房企历年经营性净现金流
中国恒大、华夏幸福和富力地产2019年经营性净现金流出最多，分别为673.57亿元、318.19亿元和241.45亿元，其中华夏幸福2019年第四季度经营性净现金流已经转正。而万科、新城控股和保利地产分别在当年实现经营性净现金流入456.87亿元、435.8亿元和391.55亿元。
2020年一季度，已披露财报的样本房企产生经营性净现金流出为1221.8亿元，相比2019年同期流出902.8亿元增加超过300亿元。
保利地产2020年一季度经营性净现金流出金额最多，达到301.01亿元。公司在财报中表示主要原因为“销售回笼减少，联营合营公司往来款支出增加”。此外，招商蛇口、华侨城等房企一季度经营性净现金流出金额也超过100亿元。中国恒大由于网上销售和降价促销使得一季度销售额逆势增长，市场预计其现金流可能会有较为明显改善。
带息债务增加逾7000亿元净负债率连续两年下行
截至2019年底，样本房企总负债162483.55亿元，总资产201223.89亿元，资产负债率80.75%，相比2018年有所下降，但高于2015-2017年期间的数值。
样本房企截至2019年的带息债务金额（负债合计-无息流动负债-无息非流动负债）为56931.5亿元，相比2018年的49827.82亿元增长14.26%。
(image_address=""https://x0.ifengimg.com/ucms/2020_21/EAEF3C32A92205C1D6D8868C0F42EFBD1F0AF88F_w864_h570.png"")
图3：2015-2019年样本房企历年带息债务金额
带息债务增速最快的是中国奥园，同比增长超过六成。翻查财报显示，中国奥园流动负债中的银行及其他借款金额由2018年192.61亿元上升至2019年338.09亿元，同期非流动负债中的银行及其他借款金额由214.9亿元上升至351.52亿元。
建发国际集团是另一家带息债务金额增长超过五成的房企。研究发现，公司带息债务增长主要由于非流动负债中间接控股公司贷款和计息借款大幅增长。其中，间接控股公司贷款由2018年的160.82亿元上升至2019年的230.82亿元；非流动负债中的计息借款则从67.95亿元上升至139.8亿元，上涨超过一倍。
按照Wind净负债率计算口径（带息债务减现金及现金等价物再除以所有者权益），样本房企2017-2019年的平均净负债率分别为129.71%、119.52%以及107.4%，连续两年下降。",2020-05-18 08:30:20,凤凰财经
5,今年来涨幅50%以上！这些公司股东榜突然出现大批机构身影,"有哲人说，人类永远是肠胃的奴隶。
复合酱汁淋淋洒洒，厨房黑洞也能咂摸出中华小当家的滋味。最近调味品板块逆风走红，其中个股屡创新高，说到当红炸子鸡，当属复合调味品类上市公司。
C端踏上方便、快捷的步调，B端餐饮客户控成本，稳口味，提效率，复合调味料高成长的逻辑开始被市场接纳，而传统基础调味料也逐步被其替代。
复合调味料受追捧
淘宝平台近期出具了一份调味品淘宝直播带货的情况。据统计锅类调味品、调味酱和酱腌菜的占比列前三位，分别占40%、30%和15%，比较而言，调味品大单品酱油、食醋参与直播带货较少。
(image_address=""https://x0.ifengimg.com/ucms/2020_21/FA109C59F6CBC6447FEEE4A6EDA233F0E3C1C5D5_w807_h535.jpg"")
淘宝直播平台调味品带货情况简报（2020年3月）
这份数据也显示出资本偏好，这一轮调味品板块上涨过程中，以安记食品、天味食品、日辰股份为代表的复合调味料最为突出，年初至今分别上涨71.29%、50.81%、46.67%，涨幅明显超过其他品类，线上渠道销售最为突出的千禾味业，年初至今涨幅高达72.57%。
各路资金一季度也涌入复合调味料类公司，天味食品、日辰股份前十大流通股股东榜中，几乎清一色是新进机构股东。
(image_address=""https://x0.ifengimg.com/ucms/2020_21/8EF3B8186E8E52B9D60827911A70899F706F7E72_w572_h651.jpg"")
“现在的消费模式在变，年轻人的宅文化，让复合调味料成为刚需，”中泰证券某食品领域分析师向记者表示，“未来复合调味料厂商或许会不断涌入C2M（用户直连制造）这种销售模式。”
疫情让不少调味品企业重新审视业务模式。山东某公司一直以B端客户为主，高管向记者透露，经此一役，未来要加大C端的销售力度，以备在特殊时期弥补餐饮渠道缺口。
“你在家怎么调，也不如专业的做的好吃。”山东某调味品企业高管表示，“复合调味品是行业的发展趋势，对餐饮企业能简化流程、提高口味稳定性，而且客户粘性强，对C端客户就是方便、便捷。”
多维调整拉动销售
调味品如今走出牛气格局，出乎多数人意料。
“不行了，废了，餐饮渠道缺口太大。”疫情之初，很多行业分析师看衰调味品类公司一季度业绩。
“我不看好一季度业绩，但疫情过去，业绩也就恢复了，这会到是一个黄金坑，逢低配一点。”某沪上私募人士曾在2月份就与记者说到买入调味品类股票的逻辑。
但市场摸爬滚打出来的生意人，怎会被缚了手脚。
以海天味业为例，在2月份就启动了新的经营策略，公司先是上调返利点，激发下游经销商的拿货意愿，然后配合出台促销产品刺激终端销售，堰塞湖得到清理。据公司一季度经营数据显示，报告期内，公司经销商数量增加了384个，目前经销商总量为6107个。
“本想守一个春暖花开，哪成想来了个花蕾满枝。”前述私募人士笑道。
翻看调味品类公司一季报，几乎全线飘红。海天味业、安琪酵母、千禾味业、恒顺醋业、晨光生物、天味食品6家公司一季度实现营收、净利双增，天味食品在存货周转上甚至超过往年。
(image_address=""https://x0.ifengimg.com/ucms/2020_21/ACE3F332143FEDCCB5C1A84D68BC65F163C1B30B_w900_h721.jpg"")
调味品类上市公司一季度经营情况
记者去超市转了一圈，海天的产品总是放在醒目的促销区域，很多小容量的品种直接用塑料扣捆绑，销售员狂推2瓶家庭促销装。配上居家囤货心理作祟，消费者直接“入坑”。
这样的结果促成了公司线下销售的火爆。看其一季度销售情况，在疫情之下，海天味业线下渠道销售收入还同比提高了6.04%。
天味食品也如出一辙，一季度经销商销售金额提升11.27%，直营商超销售比例提升92.34%，电商销售增长109.11%。日辰股份一季度对商超客户的销售比例提高142.23%。
“我们此前觉着能够跟往年持平，就算很好了，但不少公司业绩出现双增，这就超了预期，二季度B端销售回暖，在有疫情期间培育出来的线上销售渠道加持，这大概就是调味品概念受到追捧的原因。”前述券商分析人士如此表示。
调味品还有多少空间
谈起A股中的复合调味料，人们总避不开港股中的颐海国际，两年800%的涨幅羡煞旁人。而各路资金也在不断寻迹A股中的“颐海国际”。
(image_address=""https://x0.ifengimg.com/ucms/2020_21/D42A301BC7167B3B61CE46FF7AA4EDB9F1EE3B71_w1055_h440.jpg"")
颐海国际2018.1.2——2020.5.15股价走势图
从发展历程看，颐海国际定位中高端，海底捞赋予品牌效应，业绩增速与海底捞门店数量密切相关，背靠大树。随后，颐海国际逐步布局第三方业务，不断推出中式复合调料、自加热食品、休闲零食等品类，渠道以商超为主。
(image_address=""https://x0.ifengimg.com/ucms/2020_21/723ADC5C96DBF98EFB7EB74A802B7E1658BFA423_w900_h394.jpg"")
复合调味料企业2019年经营情况
调味品产业与大消费相似，现金转换周期短，账龄几乎全部是在1年期内。
A股调味品龙头海天味业，采用先款后货的经营模式，虽然体量最大，但其应收账款在同业中却最少，甚至几乎可以忽略不计，公司最早以酱油起家，目前已拓展到蚝油、黄豆酱、醋、料酒等品类，发展方向也从传统调味料向复合调味料转变。
天味食品与颐海国际产品结构最为相似，核心产品也是火锅底料，分大红袍、好人家两个品牌，另外公司川菜调料这类新品也已经与火锅底料形成双足鼎立之势头。
日辰股份当属A股中“滋味”最为复杂的一只，旗下产品覆盖汤头、中式菜品、日式酱汁、火锅底料多类品种，公司深耕B端渠道，是呷哺呷哺、鱼酷、小南国、味千拉面等知名餐饮企业的供应商，私人订制的运营模式，让公司的毛利率领先同业。
安记食品的咖喱产品较为突出，其他复合调味品近年来也打通渠道，另外公司2018年开始通过OEM（代工）方式生产大健康食品，其中包括益生菌、功能性饮料，产品向多品类扩张。",2020-05-18 08:08:59,凤凰财经
6,金发科技获美近70亿元口罩订单，股民提醒小心“仙人跳”,"原标题：牛散已提前建仓！这家公司获美近70亿元口罩订单，股民提醒小心“仙人跳”
金发科技5月17日晚间的一则公告，让其直接飙升至股吧人气排名第五的位置。
金发科技称，公司子公司接到一笔金额9.75亿美元（折合人民币近70亿元）的口罩订单，公司预计该订单产生的净利润总额占公司2019年净利润的50%以上。
公告一出，股吧瞬间炸开了锅，有股民调侃金发股份这次是“一单吃半年”。
“一单吃半年”
金发科技5月17日晚间公告，公司子公司广东金发科技有限公司（简称“卖方”）与美国某公司（简称“买方”）签订《货物买卖合同》。在货物买卖合同期限内，卖方根据货物买卖合同及买方的具体采购订单，向买方出售KN95口罩。5月16日（北京时间），卖方收到买方的采购订单，订购金额97500万美元。货物买卖合同的顺利履行预计产生的净利润总额占公司2019年净利润的50%以上。
金发科技2019年年报显示，公司2019年实现归属于上市公司股东的净利润12.45亿元。根据金发科技的预测，此次与美国某公司的口罩订单预计产生的净利润将在6亿元以上。
(image_address=""https://x0.ifengimg.com/ucms/2020_21/B048726A7C61C6433CA48F760E8AB297028BBEC5_w928_h444.png"")
来源：金发科技2019年年报
公告一出，股吧瞬间炸开了锅。不少持仓股民开始提前“庆祝”，并开始猜测涨停板数量。
(image_address=""https://x0.ifengimg.com/ucms/2020_21/6AE12F6A18EB460DA309BE9BECEF7224B368077D_w1000_h387.png"")
来源：股吧截图
但也有不少股民因此前比亚迪与美国加州政府的10亿美元的口罩退还合同预付款风波，提醒公司做生意要谨慎，多找几个律师看看条款，小心“仙人跳”。
(image_address=""https://x0.ifengimg.com/ucms/2020_21/AB5A4126C787360D5F09B1985503C7C137C6478C_w1000_h510.png"")
来源：股吧截图
因“头盔”概念股价已上涨60%
此前，公安部交管局下发了通知，自2020年6月1日起依法查纠摩托车、电动自行车驾乘人员不佩戴安全头盔以及骑车驾乘人员不使用安全带行为。消息一出，头盔供不应求，纷纷涨价。
(image_address=""https://x0.ifengimg.com/ucms/2020_21/060FDA2B309192575EC30789FFABE7AE8ED9DCFF_w1080_h152.jpg"")
来源：股吧截图
金发科技作为一家生产改性塑料、完全生物降解塑料、高性能碳纤维及复合材料等的企业，跻身“头盔概念股”，股价也一路上涨。截至5月15日收盘，公司股价自三月最低点以来，涨幅已超60%。
(image_address=""https://x0.ifengimg.com/ucms/2020_21/CE26A536B24F6715173B0753D312664B011C7B16_w1080_h538.png"")
来源：Wind
另外，公司前十大流通股东明细显示，牛散何雪萍已于一季度建仓，买入公司股票1680万股，位列流通股东第十位。按金发科技目前股价计算，何雪萍持仓市值已超2亿元。
(image_address=""https://x0.ifengimg.com/ucms/2020_21/7553180E17E7702BA90ECF49378A275690214029_w1080_h429.png"")
来源：Wind
海外口罩需求有增无减
由于海外疫情持续，海外口罩需求有增无减。海关总署5月17日发布数据显示，3月1日至5月16日，全国共验放出口防疫物资价值1344亿元。其中，口罩509亿只；防护服2.16亿件；护目镜8103万副；新型冠状病毒检测试剂盒1.62亿人份；呼吸机7.27万台；病员监护仪17.7万台；红外测温仪2643万件；外科手套10.4亿双。防疫物资主要出口目的地为美国、德国、日本、法国、意大利。
除了金发科技外，不少口罩生产相关的企业都在满负荷生产。奥美医疗在业绩说明会上表示，目前公司订单较为饱满，口罩等产品最远的订单已经接到2020年第三季度；卫星石化4月28日在互动平台表示，公司生产的聚丙烯是熔喷改性专用料，因产品品质好、纯度高，可通过改性成为医用熔喷料，目前公司聚丙烯满产满销。",2020-05-18 08:08:47,凤凰财经
7,广发郭磊、源乐晟曾晓洁：股市机会多 两大主线寻找牛股,"原标题：快看！投研大佬这么解读A股大气象：看好经济走势、股市机会多、配置很关键……
5月17日晚，“新华社快看周末直播间”分外热闹。六次金牛奖得主、荣获十周年金牛杰出私募投资经理的源乐晟资产创始合伙人曾晓洁和连续三年斩获金牛最佳分析师称号的广发证券首席宏观分析师、发展研究中心执行董事郭磊来到快看周末直播间，两位投研大咖从资本市场改革和宏观经济走向，到近期热门投资领域，侃侃而谈，与网友互动不断，直播间人气爆棚，在线人数不断增长，网友在两位大咖宏观、微观的分析中直呼“涨知识”！
(image_address=""https://x0.ifengimg.com/ucms/2020_21/47B2CA4CE1D935AADD1663848E7E5233EAA0CBC8_w1080_h663.jpg"")
右一：广发证券首席宏观分析师、发展研究中心执行董事郭磊
右二：源乐晟资产创始合伙人曾晓洁
经济数据有望逐步回升
疫情对经济的影响是当前宏观研究中避不开的一个话题，也是备受投资者关注的重要问题。
曾晓洁表示，此次疫情短期冲击较大，过去3个月全球经济都受到了冲击，中国率先控制住疫情，在疫情逐渐恢复后中国政府也出台各类扶持政策。从经济角度来看，一季度经济数据影响较大，但二、三季度的相关经济数据将会逐步回升。而股市方面，3月各行各业开始复苏，其中部分行业先复苏，有一些则晚一点。反映到股市上也是部分行业未出现明显下跌，有些则下跌较多。他表示，虽然欧美疫情在高峰期后很难快速下降，更多的是缓慢下行，但整体看，欧美疫情高峰已过，也进入逐步复工复产阶段。可以认为，疫情对全球影响最大的阶段已经渡过。
郭磊表示，疫情对全球经济冲击最大的阶段正在过去，欧美也在积极复工，虽然欧美新增病例还是偏多，但逐步复工已经开始。随着整个疫情高峰期过去以及海外经济体复工的逐渐推进，预计后续疫情对经济影响将是一个逐渐减弱的过程，从一个突如其来总量的冲击逐渐变为结构性影响，后续应该更加关注行业的影响线索，也就是疫情对不同行业的影响逻辑以及影响程度的差异。
郭磊认为，二季度政策重点逐渐转向财政政策，因为财政政策可以通过基建、减税、制造业的投资带动需求。除此之外，产业政策也是整个政策的重点之一，这一轮的产业政策是“四位一体”的框架，一是消费，强调的重点是公共消费；二是房地产，强调的重点是旧改；三是基建，传统基建加新基建；四是制造业，重点方向是应用科技，提升产业链基础，提升技术突破能力。
注册制改革将推动价值投资理念成主导
近期，注册制改革提速这一资本市场动向，备受投资者关注。
曾晓洁表示，投资者对注册制改革从科创板推广到创业板是有预期的。注册制改革不会影响资本市场的趋势性方向，但资金会进一步向优质公司集中。无论注册制改革是否推进，好公司和差公司的股价表现都会走向分化，注册制改革推广会令A股的结构化行情更加明显。
从资本市场角度来看，郭磊看好注册制改革对市场效率及投资理念带来的正面推动。郭磊表示，注册制是提升资本市场融资效率的改革，进一步助力中国产业升级和发展，注册制把选择权交给资本市场，包括对企业的选择权和评价权，未来注册制改革推进会伴随信息披露完善和退市制度改革。
从对投资影响看，郭磊表示，对整个A股风格来说，注册制改革从中长期看将会降低“壳”资源价值，从而使价值投资理念逐渐成为主导，这会导致不同行业之间以及行业内部出现分化。预计随着注册制改革推进，行业内龙头溢价会更加明显，这也会使得投资者在感知整个市场时需要更多的信息和专业知识。一方面，投资者本身可以去锻炼去市场的感知力和判断力，另一方面，机构投资者优势得到进一步体现，这期间也会出现普通投资者筛选机构投资者的机会。
A股机会仍较多“配置”很关键
随着直播进行，直播间评论不断刷屏，网友提问聚焦发散，从近期备受关注的通信、银行板块、生物医药等板块到农业股、券商股，评论区不断蹦出网友关心的话题，与两位投研大咖直接互动，直播间在线网友数量也不断增长。
从股市大的方向走向来看，曾晓洁表示，今年疫情对全球经济的冲击非常大，但资产方面，对方向不错的优质标的非常乐观。具体来看，此次疫情下，部分方向较好的资产表现非常强劲，相关个股股价表现也非常好，部分标的甚至创新高，未来相关公司仍呈慢牛态势；而盈利方向一般的资产则需警惕，即使在全球大规模降低利率的背景下，股价也不行。
曾晓洁表示，对于普通投资者而言，更多需自下而上的选择和研究标的，判断企业价值变化；若寄希望市场整体或指数的回报，或较低。此次疫情结束之后，相关标的分化非常明显，部分短期受损恢复较快而部分则未恢复。
郭磊表示，相对看淡总量波动，就结构来说，目前市场处于相对偏活跃、机会比较多的阶段。疫情带来供给端冲击，本身和以前全球发生危机或者经济发生衰退的时候是不一样的，和以前需求冲击的特征有所不同，市场有一个快速的一次性反应。反应之后，一些行业可通过基本面的恢复陆续好转。
他表示，对于普通个人投资者而言，投资的视角其实是比较关键的。当前市场整个系统性机会并不是太明显，这时候投资者其实需要抓住“择时”之外的另外一个视角叫“配置”，要真正站在观测者的角度去观测不同的行业，哪些行业基本面实实在出现改善，或者出现受损但是受损程度被市场所高估了，对应相关条线的产业便存在机会。
对于未来看好的板块方面，曾晓洁表示，一是近两年上涨较多的板块中，关注其中基本面未受疫情冲击影响，本身经营能力变化不大的标的，等待回调后再买入；第二是近一段时间受疫情冲击较大、跌幅较多的板块。例如新能源和光伏等，从中挑选盈利能力较疫情前变化不大的标的，目前以上两大板块中的部分标的离高点尚较远。",2020-05-18 08:08:34,凤凰财经
8,美联储主席：美国经济复苏还需要“一段时间”,"当地时间17日，美联储主席杰伊&middot;鲍威尔在CBS一档即将播出的新闻采访中表示，美国经济还需要“一段时间”才能恢复元气。当地时间周四，美国劳工部公布的统计数据显示，自疫情暴发以来，已有约3650万美国人申请失业救济。对此鲍威尔表示，他预计美国经济复苏将经历一段漫长时期，甚至会持续到2021年。
鲍威尔还说，2020年下半年美国经济能“稳步”复苏的前提是秋天不会出现第二波疫情高峰，但鉴于医学专家们的推测，情况并不乐观，人们对经济充分恢复信心还需要等待疫苗的出现。",2020-05-18 08:06:57,凤凰财经
