,title,content,pub_time,src
6,海关总署：今年1-2月我国进口肉类同比增长69.6%,"(image_address=""https://x0.ifengimg.com/ucms/2020_14/6B323346757DFA5258CBD05084FD9912E8226C79_w1124_h750.jpg"")
为保障新冠肺炎疫情期间国内市场肉类的安全供应，海关多措并举着力扩大进口，满足国内市场消费需求。
(image_address=""https://x0.ifengimg.com/ucms/2020_14/7BFF741CEC67D155CBB017DD502BA5414124D50C_w912_h684.jpg"")
海关总署今天公布，截至3月24日，今年共新批准了997家肉类企业在华注册，其中猪肉企业450家。今年1月至2月，我国进口肉类（包括杂碎）共125万吨，同比增长了69.6%，其中进口猪肉及猪杂碎共72万吨，同比增长了98.2%。",2020-03-31 15:36:23,凤凰财经
7,拉夏贝尔艰难求生：一年关闭4391个零售点 负债69亿,"2020年报风云拉夏贝尔艰难求生：过去一年关闭4391个零售网点，扣非净利亏损21亿负债69亿
上市才两年半光景，拉夏贝尔(603157.SH)已陷入“断臂求生”之境。
3月31日，拉夏贝尔发布2019年业绩快报，2019年实现营业总收入76.38亿元，相比2018年的101.8亿元同比下滑24.94%，扣非净利润为亏损的21.76亿元，同比下滑幅度达789.17%。
拉夏贝尔表示，过去一年采取了主动关闭低效、亏损零售网点的策略，2019年，其境内零售网点由2018年12月31日的9269个减少至4878个，同比下降47.37%。
不过，由于2019年线下直营网点销售低于预期，同店比下降幅度24.79%；暖冬天气等因素影响，四季度收入表现不佳，同比大幅下滑39.11%，以及2019年百货专柜收入32.3亿元下滑34.08%等多重因素叠加，营收仍止不住下跌。
此外，拉夏贝尔2019年未经审计的负债合计69.1亿元。
在同日的另一则公告中，拉夏贝尔强调，由于2018年经审计的净利润为负值，预计2019年净利润仍将为负值，如果最近两个会计年度经审计的净利润连续为负值，公司A股股票将会被实施“退市风险警示”。对此，在2019年业绩快报中，拉夏贝尔也提出了争取2020年扭亏的目标。
过去一年关闭4391个零售网点
从品牌来看，拉夏贝尔的5大女装品牌：LaChapelle与Puella、7m、LaBabite、Candie’s仍是其营收的主要来源，2019年营收占比约75%。
除此以外，拉夏贝尔的男装(JACKWALK、Pote及MARCECKō品牌)、8&eacute;m、NafNaf、其他(投资控股品牌Siastella、DrmGalaxy、GARTINE及劳务收入)贡献营收占比约32%。
值得一提的是，2019年10月，拉夏贝尔子公司JACKWALK申请破产清算，2020年1月，上海市第三中级人民法院已受理JACKWALK的破产清算申请。
从渠道来看，过去一年，拉夏贝尔关闭4391个境内零售网点，
而专柜、专卖等线下渠道中，百货专柜收入明显下滑；2019年百货专柜收入32.3亿元，较上年同期减少16.7亿元，同比下降34.08%，占总收入的比重亦由48.08%降至42.23%。
另一方面，因2019年内完成收购法国女装品牌NafNaf，拉夏贝尔新增586个海外地区零售网点。
尽管NafNaf品牌纳入上市公司并表后，2019年6-12月实现营收9.97亿元，不过，拉夏贝尔表示，2019年，受法国黄马甲事件及欧洲零售业市场不佳等因素影响，NafNafSAS业务经营不及预期，存在持续亏损及现金流不足的情形。
拉夏贝尔强调，若2020年NafNafSAS业务经营未能明显好转，且未能通过内部经营调整、外部融资或处置资产补充营运资金，或其外部经营环境持续恶化，不排除NafNafSAS将面临进入破产清算程序的风险。公司也将根据实际的经营情况和外部环境，不排除转让或出售NafNafSAS(全部或部分)股权。
此外，拉夏贝尔提到，由于新型冠状病毒感染的肺炎疫情对公司审计工作进度造成一定影响，以及欧洲疫情爆发，全资子公司NafNafSAS的审计工作也有所延迟，截至公告披露日，公司2019年度审计工作尚未完成。
今年以来有5位董事相继辞职
21世纪经济报道记者注意到，2020年以来，拉夏贝尔至少有5位董事辞职。
2020年2月3日，拉夏贝尔董事长邢加兴因个人原因申请辞去第三届董事会董事长及董事会专门委员会相应职务，辞职后将不再担任公司任何职务。
随后，2020年2月25日，拉夏贝尔总裁于强因个人原因申请辞去第三届董事会董事、董事会战略发展委员会委员、总裁及下属控股、参股公司相关职务，辞职后不再担任公司任何职务。
四天之后，2020年2月29日，拉夏贝尔董事王文克因个人原因申请辞去第三届董事会董事及董事会专门委员会相应职务；拉夏贝尔独董芮鹏因个人原因申请辞去第三届董事会独立董事及董事会专门委员会相应职务。
2020年3月29日，拉夏贝尔首席财务官沈佳茗因为个人原因申请辞去首席财务官及公司下属控股、参股公司的相关职务，辞职后不再担任公司任何职务。
尽管邢加兴不再是拉夏贝尔董事长，但他依旧是公司控股股东与实际控制人。
辞去董事长职位的同时，邢加兴向拉夏贝尔董事会提名“陆尔穗、蔡国新为公司第三届董事会非独立董事候选人，并建议由陆尔穗作为公司第三届董事会董事长人选”。
公开资料显示，陆尔穗与蔡国新都曾担任原A股上市公司江苏三友的高管。
其中，陆尔穗于2012年至2017年任江苏三友集团股份有限公司董事长，蔡国新于1990年8月至2015年11月任职于江苏三友集团股份有限公司，历任生产贸易部经理、党委副书记、工会主席、监事会主席等职。",2020-03-31 15:30:16,凤凰财经
8,京东数科出资2300万并购海益科技 发力固收板块,"WEMONEY讯3月31日，京东数科宣布并购安徽海益信息科技有限公司（简称“海益科技”），进一步夯实资管科技系统JT&sup2;，探索FICC(即固定收益、外汇和大宗商品业务)创新服务模式。
据悉，双方将整合布局，提升投研效率、提高投资收益、积累投资智慧，合力构筑资管科技新生态。
京东数字科技集团副总裁、资管科技总经理徐叶润表示，未来双方将在风险管理、全球拓展方面等实现优势互补。海益科技董事长葛宏宇表示，海益科技的加入将增强京东数科在FICC板块的实力。
天眼查信息显示，上海君信宜知网络科技有限公司（简称“上海君信”）在2020年3月20日出资2300万元，成为海益科技100%股东。上海君信为京东数科全资子公司。
(image_address=""https://x0.ifengimg.com/ucms/2020_14/AFE13DA1F7423E1F8351DDFB43BBCC89D9EBE0F9_w770_h815.jpg"")
值得关注的是，京东数科在2018年就参与了海益科技A轮融资。根据公开信息，2018年3月，海益科技完成总额为数千万元人民币的A轮融资，由京东金融进行战略投资。
公开资料显示，海益科技是一家金融系统工程专业软件公司，在FICC领域主要面向银行、证券、保险等金融机构提供专业金融投资组合分析及资金资产和风险管理解决方案。目前，海益科技已有海通证券等券商为主的30多家金融机构客户。（WEMONEY刘双霞/编辑）
(image_address=""https://x0.ifengimg.com/ucms/qr/2020_14/CAF6A585A616E4D019240D79907BA80B1A972BAF_w2880_h1396.png"")",2020-03-31 15:19:44,凤凰财经
9,部分粮食出口国限制出口，中国“口粮安全”如何保证？,"(image_address=""https://x0.ifengimg.com/ucms/2020_14/A3FC0C1C4413BE982668A17505C28EC264903948_w500_h327.png"")
随着新冠肺炎疫情在全球蔓延，部分粮食出口国传出限制出口的信息，国家粮油信息中心高级经济师王辽卫28日接受记者专访表示，我国实现了“谷物基本自给、口粮绝对安全”，粮食供求总体宽松，完全能满足人民群众日常消费需求，也能够有效应对重大自然灾害和突发事件的考验。
1
我们的口粮绝对安全
问：部分粮食出口国限制出口的话，对我国老百姓米袋子有影响吗？
答：随着新冠肺炎疫情在全球蔓延，近日越南宣布暂停大米出口。越南常年大米出口700万吨左右，大体占世界贸易量的15%，限制出口可能会造成国际市场大米价格波动。部分粮食出口国为保障国内供给也可能采取限制出口的措施。当然，通常应不会发生这种情况。
2019年我国进口越南大米仅48万吨，为2011年以来最低水平；今年1～2月从越南进口大米仅3万吨。事实是，2016年我国实行粮食收储制度改革以来，大米进口数量逐年下降，2019年大米进口255万吨，同比下降53万吨，进口大米占我国大米消费约1%，主要用于品种余缺调剂，如泰国香米，即使大米不进口也不会影响国内市场供给。
尽管近年来国际市场曾几次出现“过山车”式的粮价大幅波动，但由于我国粮食连续丰收，供给充裕，库存充足，保障有力，粮食市场总体保持稳定。
党的十八大以来，党中央确立了“以我为主、立足国内、确保产能、适度进口、科技支撑”的粮食安全战略，提出了“谷物基本自给、口粮绝对安全”的新粮食安全观，国家采取一系列富有成效的政策举措，粮食综合生产能力稳步提升，粮食连年获得丰收，实现了口粮完全自给，谷物自给率保持在95%以上。
手中有粮，心中不慌。目前我国谷物库存保持较高水平，保障国家粮食安全的物质基础较为坚实。2019年我国粮食种植面积稳定，粮食再获丰收，全年粮食总产量66384万吨，同比增加594万吨，增长0.9%。总体看，我国粮食供求总体宽松，完全能满足人民群众日常消费需求，也能够有效应对重大自然灾害和突发事件的考验。
2
“大国粮仓”库存充足
问：我国粮食储备状况及当前市场粮价总体水平如何？
答：我国粮食总产量连续5年稳定在6.5亿吨以上，近年来粮食储备体制机制不断完善，粮食储备充足，小麦稻谷等口粮品种库存处于历史最高水平。
在中央储备规模保持稳定的同时，从2014年开始，国家按照“产区保持3个月，销区保持6个月，产销平衡区保持4个半月”的市场供应量要求，重新核定并增加了地方粮食储备规模，各地已全部落实到位，而且大中城市还建立了满足市场供应10天至15天的成品粮油储备。同时，在中央和地方政府储备品种结构中，小麦和稻谷等口粮品种比例超过70%。
除上述政府储备外，2004年以来，我国对稻谷、小麦实行最低收购价政策，根据市场情况每年收购了一定数量的最低收购价粮食，这部分粮食主要通过国家粮食交易平台向市场投放，有效地满足了市场供应，稳定了市场价格。多元市场主体也建立了用于正常生产经营的商业库存。我国粮食库存充裕，完全能够满足市场供应和应急保供需要。
新冠肺炎疫情发生以来，国家有关部门和地方政府采取有力有效措施，全力做好粮油市场保供稳价工作，推动粮油加工企业复工复产，保障粮食物流运输通畅，粮油市场供应不脱销、不断档，国内粮油市场平稳有序运行。疫情前期，群众居家不外出多购买储存一些粮食，由于超市、卖场等零售市场货源充足，短暂的群体性集中购买也得到了基本满足。目前居民采购米面油心理稳定，受餐饮业等消费需求减少影响，国内米面油消费总体偏弱。
据国家粮油信息中心监测，3月23日全国加工企业小麦、早籼稻、中晚籼稻、粳稻进厂价格比春节前增长0.1%、下降0.2%、增长0.4%、增长1.3%。面粉、早籼米、中晚籼米、粳米出厂价格比春节前下降0.4%、增长0.6%、增长0.5%、增长1.3%。
3
百姓米面“两无忧”
问：一日三餐离不开米和面，我国稻谷、小麦情况怎样？
答：我国稻谷供给充裕，阶段性过剩特征明显。2019年我国稻谷产量2.096亿吨，同比减少252万吨，食用消费1.58亿吨，同比减少50万吨，尽管稻谷饲用和工业用粮有所增加，预计年度结余1430万吨，已连续多年结余，阶段性过剩特征明显。
在国家政策支持下，我国主产区早稻面积将会增加。疫情防控期间，有关部门合理安排政策性稻谷竞价销售，2月10日开始每周向湖北地区增加投放中晚稻80万吨，成交率仅0.28%，有效地满足了市场供应。
小麦供求平衡有余，连续多年产大于需。2019年我国小麦产量1.34亿吨，为历史第二高水平，已连续5年保持在1.3亿吨以上。由于消费结构升级，面粉消费下降，国内食用消费总体平稳，但饲用和工业消费有所下降，国家粮油信息中心估算小麦消费1.235亿吨，同比减少532万吨，年度结余1400万吨，同比增加870万吨，已连续7年产大于需。
今年全国冬小麦播种面积3.31亿亩，目前苗情长势良好，全国冬小麦一、二类苗占比分别为23%、77%，北方冬小麦苗情明显好于上年同期，今年夏粮再获丰收有较好基础。国家稳定投放最低收购价小麦，2020年以来成交率不足4%，加之政府储备小麦陆续轮换出库，小麦价格走势总体偏弱。
面对新冠肺炎疫情，主要出口国采取限制出口措施，可能会加剧国际市场粮食价格的波动，但对目前我国粮食市场的影响不大，有利于消化不合理粮食库存，减轻国内部分粮食品种库存压力。",2020-03-31 15:15:02,凤凰财经
10,多地出现XX分钟抢光XXX套房，报复性买房开始了？,"作者：彭婧如
XX分钟抢光XXX套房！
近日，北京、深圳、苏州、广州等地楼盘开始出现“震惊体”的销售成绩。如，3月25日晚，北京某楼盘首次开盘，20分钟内，线上销售量便达到814套。
(image_address=""https://x0.ifengimg.com/ucms/2020_14/C8A8C236BE420AEBEE57B735D913F8C39E897140_w700_h521.jpg"")
资料图：住宅楼。郭其钰摄
多地新房火爆开盘，报复性买房开始了？
上述北京楼盘的地产商官微显示，项目位于北京顺义新城(六环外)，单日最高来电120多组、平均每天来访客户300多组、累计1200张排卡量。因为热度高导致房源一再加推，从400套直到1000套。
据了解，最终该楼盘首次开盘845套房源，有超过1100人线上选房。据销售人员介绍，该项目的户型有建筑面积约50-89㎡的精装一居至三居，最低150万/套可以入手。
此前，苏州、深圳、广州等地也出现了楼市“暴走”的消息。
3月20日，苏州某楼盘线上开盘，60秒销售12亿元。3月16日，深圳宝安沙井万科星城线上开盘，推出288套均价约3.9万元/平方米、总价在96万元至250万元之间的小户型商务公寓，开盘7分钟被抢购一空。
对于地产开发商一些项目销售出现的上述情况，易居研究院智库中心研究总监严跃进接受中新网记者采访时指出，一些市场需求开始重新释放，楼市有一定的小幅回温，但整体来讲，市场现在还不至于说完全恢复。
“目前的购房是之前两三个月积累的一些需求，从价格角度来讲，相对来说比较合适。”同策集团首席分析师张宏伟对中新网记者表示，上述北京楼盘的销售成绩，还包括北京的土地市场春节后比较火等原因，所以整个销售情况恢复起来相对较快。
“我自己也看了好多房企现场直播卖房，看的人其实不是太多，可能是线下已有基本意向，组织大家在这个时间点看了一次而已。”张宏伟说，现在整个市场还在恢复过程中，没有到完全正常的状态。
(image_address=""https://x0.ifengimg.com/ucms/2020_14/B0BF0C293D1F6AF23A2A3A4652CF33DEB156A1CE_w700_h468.jpg"")
资料图：图为2019年，福建一处正在开发建设中的房地产楼盘。中新社记者张斌摄
买房者疯狂“剁手”：市场回暖，还是开发商营销手段？
“疫情还没结束就开始抢房子了？要真是卖那么好，中介干嘛打电话推销。”有网友对近日某新楼盘的销售火热程度表示质疑。“都是套路”“假的真不了”“都是戏，愿者上钩”这样的看法不是少数。
“开发商要快速回款兑现，很多房源都是抵押给银行或者中介的，一些新盘很快就会出现在二手交易平台，这也是原因。”天津的张先生认为，“新楼盘销售一空”基本是商业运作，一环套一环。“销量好的盘，一般放房比例在10:1，销量上去立马提价，但里头的销量大部分是企业支撑的。”
作者以购房者身份致电上述北京楼盘时得到回复称，目前50㎡的房源已经售罄，只能等清退。“线上开盘的时候就已经卖完了，70㎡和89㎡的目前还有，但建议也要尽快考虑，否则可能选不到好的楼层。”销售人员说。
“热点城市近期一些楼盘销售都不错，说明购房需求还是很强劲的。”严跃进认为，虽然新冠肺炎疫情影响了楼盘的开盘和销售，但是需求本身没有减少。这也说明此类城市新房项目相对是不足的，所以客观上会形成抢房的现象。
中原地产首席分析师张大伟表示，市场本来就在恢复，谈不上回暖，但刚需开始有点恢复了。
对于北京某楼盘的开盘热销，他认为是由于市场缺少这种低总价项目，“大部分项目总价都是500万左右的，突然出现一个150万到300万的项目，市场这部分需求有了选择，而且疫情缓解了，需求也就开始逐渐回流。”
(image_address=""https://x0.ifengimg.com/ucms/2020_14/B7C89F4DE827DA5CFECE48C0902BE96E09B09853_w540_h359.jpg"")
资料图：置业顾问向民众推荐商品房户型。中新社记者韦亮摄
楼市接下来会怎样，要不要赶买房的热闹？
“整体来访量还没有恢复到之前的正常状态，现在的交易量还是受影响。”张宏伟认为，接下来的政策走向必然有定向宽松，让交易量得到逐步回升。
他预计，非湖北地区，要等到四月中下旬，整个交易结构才能差不多恢复正常；整个市场恢复正常要在五六月份。
严跃进补充说，“楼市调控政策后续肯定是有放松的，但是各地的放松政策在表述上会更加谨慎，毕竟现在库存压力有所增大。”他认为，各地规定还是会防范炒作房价，一些比较敏感政策的出台，会较为谨慎。
梳理地方3月出台的房地产调控政策显示，3月4日，广州关于楼市放松的相关政策被叫停；3月5日，驻马店发布的17项稳楼市政策已从官网撤下。3月24日，浙江嘉兴海宁限购松绑政策也在当日遭遇“下架”。
在中国社会科学院财经战略研究院研究员邹琳华看来，根据疫情对政策作出调整是符合实际的，但是要以“房住不炒”为底线，不能鼓励或变相支持炒房。
3月27日，成都市房地产市场服务中心专门发布了《关于禁止发布含“不限购”等房地产敏感信息的通知》。严跃进认为，该政策对于房地产经纪机构、房地产服务平台等营销广告行为进行了规范，客观上有助于稳定市场，防范各类房价炒作等现象的出现。
对于该不该出手买房的问题，严跃进表示，近期购房者的心态是有分化的。“部分人是期待房价降价后再入市；而部分人则认为房源是稀缺的，需要积极认购，尤其是配套较好、学区较好的房源。”
“这说明，无论是刚需还是改善需求，其实都还是很强劲的，这容易带动房地产市场交易的进一步反弹。”严跃进称。",2020-03-31 15:12:20,凤凰财经
11,欧股集体高开 德指涨超1%,财联社3月31日讯，欧洲主要股指开盘普涨，德国DAX指数涨1.6%，英国富时100指数涨1.3%，欧洲斯托克50指数涨1.5%.,2020-03-31 15:07:39,凤凰财经
