,title,content,pub_time,src
5,上交所：对于主动迎合市场热点的“蹭热点”行为 将露头就打,"关于发布《上海证券交易所科创板上市公司自律监管规则适用指引第2号——自愿信息披露》的答记者问
近日，上海证券交易所正式发布《上海证券交易所科创板上市公司自律监管规则适用指引第2号——自愿信息披露》（以下简称《指引》），就《指引》发布的背景和目的，上交所相关负责人回答了记者的提问。
一、能否介绍一下上交所此次出台自愿信息披露指引的背景和目的？
答：自愿信息披露是上市公司履行持续信息披露义务的重要内容，也是法定信息披露必要和有益的补充。从境内外资本市场实践看，上市公司自愿披露的战略规划、盈利预测、内部治理、环境保护、社会责任、人力资源等信息，已经成为投资者判断公司价值、做出投资决策的重要参考。本次专门出台自愿信息披露指引，主要有如下三方面的考虑。
一是贯彻落实新《证券法》。新《证券法》明确规定，除依法需要披露的信息之外，信息披露义务人可以自愿披露与投资者作出价值判断和投资决策有关的信息，但不得与依法披露的信息相冲突，不得误导投资者。与之相衔接，中国证监会部门规章和交易所业务规则，明确了自愿信息披露的原则性规定。《指引》落实新《证券法》要求，进一步丰富细化了科创板上市公司（以下简称科创公司）自愿信息披露的一般原则和具体要求，并结合市场实践给出范例和说明，为科创公司实践自愿信息披露提供针对性的指导和规范建议。
二是推动提升科创板信息披露有效性。构建更有针对性的信息披露制度，提升信息披露有效性，是科创板建设的一项重要任务。开市以来，一批代表新经济发展方向、拥有“硬科技”的企业登陆科创板，这些企业在内部治理、盈利模式、产品形态、研发活动等方面与传统企业存在差异，其科创属性、成长属性、价值属性需要从更多维度进行呈现，自愿信息披露也得到了更为普遍的运用。从数量看，科创公司自愿披露的公告数量，已经占公告总数的20%左右；从类型看，除以往常见自愿信息披露类型外，科创公司还主动披露行业变化、研发进展、运营数据、业务合作等信息；从载体看，年度报告和临时公告均有涉及；从效果看，自愿披露的信息，提升了信息披露的针对性，加深了投资者对科创公司的认识和理解。出台指引，即顺应这一变化趋势，推动科创公司积极主动实践自愿信息披露，为投资者提供更具针对性和有效性的决策信息。
三是防范自愿披露中的不当行为。近年来，自愿信息披露实践中出现了一些误导投资者的不当行为，引发股票交易出现波动，引起市场关注。出台本指引的另一个重要考虑，就是结合自愿信息披露的监管实践，通过原则阐述和案例示范，明确自愿信息披露的一般要求和具体原则，指导公司建立相应的自愿信息披露内部制度，用好自愿信息披露这一信披方式，防范不当行为的发生，保障自愿信息披露的目标和价值得到实现。
二、本次出台的《指引》，内容较为丰富，能否简要介绍一下《指引》针对自愿信息披露，做了哪些具体的规范？
答：《指引》遵循新《证券法》确定的原则，重点从四方面规范自愿信息披露行为。
一是准确把握自愿信息披露的范围。自愿披露不是随意披露，需要把握好披露的范围。目标上，应当服务于投资者决策需要，不宜披露与投资者决策没有关联的信息；内容上，应当基于一定的客观事实，或者具备实施的基础条件；类型上，包括战略信息、财务信息、预测信息、研发信息、业务信息、行业信息、社会责任信息等常见类型。
二是遵循自愿信息披露的基本要求。总的要求是不得与依法披露的信息相冲突，不得误导投资者。具体而言，首要的是保证所披露信息真实、准确、完整，不能有虚假记载和误导性陈述。其次是尽可能简明友好，力求用平实易懂的语言替代专业术语，必要时可以采用图表辅助表达。此外，还应当注意保持必要的一致性与持续性，同一类事项原则上应当持续披露，同一事件的重要进展也应当及时披露，不应进行选择性信息披露，不能“报喜不报忧”。
三是关注常见自愿披露的公告要点。为方便科创公司编制自愿信息披露公告，《指引》专门列出了常见信息披露事项和公告要点。这些事项，既涵盖战略规划、盈利预测、社会责任等传统上比较常见的类型，也涉及行业信息、研发进展、运营数据、非会计准则下的财务数据、董事长致投资者的沟通信函等符合科创公司特点的内容。科创公司可以根据需要，在披露年报和编制临时公告时参照使用。
四是明确标识“自愿披露”公告类型。《指引》要求科创公司采用临时公告方式自愿披露信息时，应当在所披露的公告标题中标注“自愿披露”字样，以方便投资者识别、理解科创公司自愿披露性质。
三、《指引》除了规定自愿信息披露的要求和内容外，还专门对科创公司自愿信息披露的内部决策程序作出规定，能否介绍一下要点。
答：健全、高效、清晰的内部决策程序，是自愿信息披露规范实施的基本保障。《指引》就此提出了相应的要求，主要有三个要点。
一是强调落实关键人责任。《指引》合理配置责任归属，将自愿信息披露的责任落实到人，重点强调了科创公司董事长作为第一责任人的决策责任，以及董事会秘书作为具体负责人的执行责任。同时，明确其他高管人员应当在各自职责范围内承担相应的职责。
二是强调建立统一的标准。科创公司商业模式、治理结构、核心技术、产品特征差异较大，自愿披露信息的内容和类型也不尽相同。据此，《指引》要求公司结合自身特点，明确自愿信息披露的事项范围及标准，保证遵循统一的披露标准。例如，生物医药类企业，可以将药品研发的阶段性进展，列入自愿披露信息的范围；实施股权激励的企业，可以明确在年报中披露非会计准则核算的财务信息等。
三是强调必要的保密要求。自愿披露的信息，可能影响股票交易。为确保投资者公平获取信息，《指引》特别要求科创公司设置必要的保密性措施，并依法履行相应的信息管理义务。
四、近年来，上市公司信息披露中，出现了一些利用自愿信息披露“蹭热点”的不当行为，证监会、交易所也进行了及时的处置，请问《指引》在这方面做了哪些具体的规定？
答：防范自愿披露中的不当行为，是出台《指引》的一个重要考虑。个别与市场热点不当关联的自愿披露，即市场俗称的“蹭热点”公告，容易干扰投资者理性决策，引起股票交易异常波动，甚至滋生内幕交易、市场操纵等违法违规行为，必须严格规范。为此，《指引》辟出专门一个部分，提出明确要求。
一是审慎评估相关公告披露的必要性。《指引》要求，科创公司应避免披露仅与市场热点有关，但对公司不具有重大影响的信息。尤其不得利用自愿披露，与市场热点进行不当关联，故意夸大所披露事项对公司生产、经营、研发、销售、未来发展等方面的影响，误导投资者过度评估公司股票的投资价值。
二是全面完整地披露信息。对于确有必要披露的涉及市场热点的信息，《指引》尤其强调不能误导投资者，并按照所披露事项涉及市场热点的不同类型，进一步细化了披露要求。例如，披露事项涉及热点技术的，科创公司在公告中说明所掌握的技术与热点技术是否相同，与主营业务的关联度，相关技术是否已经成熟，研发是否存在不确定性，公司是否实际拥有相关技术，等等。
三是及时说明和澄清。《指引》要求科创公司密切关注公共媒体关于科创公司的报道和市场传闻，如果出现不恰当地将热点概念与公司相关联的情形，可能对投资者决策或者公司股票交易产生较大影响的，需要及时澄清。
需要特别指出的是，对于主动迎合市场热点的“蹭热点”行为，特别是滥用自愿信息披露实施信息型市场操纵的违法违规行为，上交所将继续从严监管，露头就打，坚决维护好科创板信息披露市场秩序。
五、我们注意到，此次出台的《指引》，与以往发布的规则相比，增加了许多举例和说明，能否介绍一下在规则中加入这些内容的考虑？
答：不断提升自律监管规则的可读性和友好性，便利市场主体理解规则、掌握规则、使用规则，是上交所科创板制度建设的一个重要目标。此次出台的《指引》，在这方面做了一些探索和尝试。
一是讲清制度逻辑。理解制度逻辑是市场主体熟练掌握和准确运用规则的前提。为此，《指引》在提出相关规范要求的同时，也详尽阐释了确定自愿信息披露范围、基本要求的背景和原因，便于使用者更好理解规则制定的目标和考虑，从而可以更好把握《指引》的相关要求。例如，对于自愿披露应当保持必要的一致性和持续性这一要求，《指引》不仅说明了提出这一要求的原因，还进一步解释了该要求的内涵，并且结合实际的应用场景进行了举例说明。
二是提供操作范例。《指引》编制中，用了比较大的篇幅，详细说明了常见自愿信息披露的事项和公告要点。对于每一类常见公告，都从公告编制目的、可以考虑的披露内容和示例三个方面，提供了公告编写的“说明书”。科创公司可以按图索骥，编制和披露公告。
三是采用柔性规范。自愿披露相比强制披露，其内容更为丰富多元，过于刚性的要求可能既无法适应自愿披露的灵活性，也会带来信息冗余。因此，《指引》采用相对柔性而非强制性的规范形式，在总结经验和共识的基础上，提出原则要求，列举需要考量的因素，以建议和提示的方式，引导科创公司结合自身特点，充分行使信息披露自主权，为投资者提供更多有效信息。
六、除了法定信息披露和自愿信息披露以外，上市公司通过其他渠道发布信息，需要注意哪些问题？
答：除法定信息披露和自愿信息披露以外，科创公司也可能通过新闻发布会、媒体专访、公司网站、网络自媒体等渠道发布其他信息。对于这类信息，《指引》也集中明确了相关要求。
关于上证e互动平台。一是《指引》鼓励科创公司通过上证e互动平台与投资者沟通交流，但不应通过平台发布依法应当披露的信息，也不得通过上证e互动开展自愿信息披露。二是科创公司通过平台回复投资者提问或主动发布信息，应当参照《指引》关于自愿信息披露的基本要求，尤其要注意所发布信息的真实性和完整性，避免误导投资者。三是建议科创公司在非交易时段回复投资者提问，避免因盘中误读误传信息引发股票交易异常波动。
关于接受分析师和机构调研。科创公司可以按照投资者关系管理的总体规划，定期接受分析师和机构调研。《指引》特别强调，为了确保信息披露的公平性，公司应当避免向分析师和调研机构提供未披露的重大信息。如果在调研过程中，分析师和调研机构知悉了相关重大信息，公司应当立即披露。
关于自行发布信息。《指引》明确，科创公司可以通过公司网站或者其他媒体自行发布不属于持续信息披露范围的宣传类、广告类信息，但应当避免误导投资者。此外，根据《科创板股票上市规则》相关规定，科创公司确有需要的，可以在非交易时段通过新闻发布会、媒体专访、公司网站、网络自媒体等方式对外发布应披露的信息，但应当于下一交易时段开始前披露相关公告。",2020-09-25 18:33:13,凤凰财经
6,WEMONEY研究室日报：华夏理财获批开业注册资本30亿元；雪松信托一合作方关联股东实控人意外身亡,"来源：WEMONEY研究室（ID：wemoney1）
优信与创始人戴琨的9年：融资超120亿2次失误后兜里只剩下2.4亿
公司研究室讯从2011年创立优信拍起步，戴琨带领团队在二手车电商路上已跋涉9年。回顾这位海归的创业之路，不难发现，戴琨及其团队至少出现过2次重大失误：一是不计成本的的广告营销策略，二是误入二手车助贷业务。从2011年成立至今，优信至少已经历10轮融资，公开披露的融资金额累计超过18亿美元。二手车电商优信2021财年第一财季财报显示，现金及等价物仅剩2.4亿（截至2020年6月30日）。不过，对于兜里只剩下2.4亿的优信来说，目前最要紧的不是未来的口碑，而是如何活下去。如果没有新资金进入，到年底可能就会无米下锅。优信之所以在此时对外公布自建二手车库存计划，其目的还是融资。【公司研究室】
银保监会：华夏理财获批开业注册资本30亿元
银保监会公布关于华夏理财有限责任公司开业的批复。批复称，银保监会同意华夏理财有限责任公司开业，公司注册资本为30亿元人民币，全部由华夏银行股份有限公司以货币资金方式认购并一次性足额缴纳。同时，银保监会核准李岷华夏理财有限责任公司董事、董事长的任职资格；核准苑志宏华夏理财有限责任公司董事、总裁的任职资格；核准张伟、程庆强、刘越华夏理财有限责任公司董事的任职资格；核准朱大鹏华夏理财有限责任公司副总裁兼公司财务负责人的任职资格；核准贾志敏华夏理财有限责任公司副总裁的任职资格；核准唐博华夏理财有限责任公司资金财务部负责人的任职资格；核准贺丹华夏理财有限责任公司审计部门负责人的任职资格。【新浪财经】
雪松信托“迷雾”后续：一合作方关联股东实控人意外身亡
9月22日，《雪松信托迷雾：42只产品风控全线“裸奔”，220亿底层资产尽数虚无，借道假央企转移百亿巨资！》在业内引起巨大反响。雪松信托“长青”系列产品唯一的合作方——文金世欣商业保理（天津）有限公司（简称“文心保理”）又有新动态。持股文心保理15%的晋汇创富贰拾贰号投资企业（有限合伙），其最终执行事务合伙人（GP）为深圳晋汇基金管理有限公司（简称“深圳晋汇基金”）。据深圳公安局福田分局最新通报，深圳晋汇基金涉嫌非法吸收公众存款，目前案件仍在侦查之中。根据通报内容，深圳晋汇基金实控人张峥意外死亡，立案至今，警方已查封涉案深圳、北京房产2套，异地房产100套，涉案公司股份1家，涉案资金账户11个，扣押车辆2辆，目前正继续对涉案的财产进行深挖。【证券时报】
招商银行：缪建民董事长任职资格已于9月24日获得核准
招商银行9月25日晚公告，公司9月25日接到《中国银保监会关于招商银行缪建民任职资格的批复》，缪建民担任招商银行董事、董事长的任职资格已于9月24日获得核准。【证券时报】
银保监会：华夏理财获批开业注册资本30亿元
银保监会公布关于华夏理财有限责任公司开业的批复。批复称，银保监会同意华夏理财有限责任公司开业，公司注册资本为30亿元人民币，全部由华夏银行股份有限公司以货币资金方式认购并一次性足额缴纳。同时，银保监会核准李岷华夏理财有限责任公司董事、董事长的任职资格；核准苑志宏华夏理财有限责任公司董事、总裁的任职资格；核准张伟、程庆强、刘越华夏理财有限责任公司董事的任职资格；核准朱大鹏华夏理财有限责任公司副总裁兼公司财务负责人的任职资格；核准贾志敏华夏理财有限责任公司副总裁的任职资格；核准唐博华夏理财有限责任公司资金财务部负责人的任职资格；核准贺丹华夏理财有限责任公司审计部门负责人的任职资格。【新浪财经】
江苏银行：存量保本理财将在2021年4月底前压降整改完毕
9月25日，江苏银行在《关于江苏银行配股申请文件反馈意见的回复》（以下简称《回复》）中披露了该行理财产品最新数据及过渡期整改计划。《回复》显示，截至6月末，江苏银行发行的保本理财规模为307.37亿元，较2019年末下降28.07%，非保本理财规模为3359.97亿元。“资管新规出台后，本行即积极组织应对，存量保本理财产品将在2021年4月底前压降整改完毕，在非标债权投资、杠杆控制、流动性风险管理、结构化安排、嵌套层数等方面也在逐步进行整改，编制了过渡期理财业务规划安排，并已报备当地监管部门。”江苏银行表示。【21世纪经济报道】
整理：林小林",2020-09-25 18:27:23,凤凰财经
7,泰禾集团午后跌停，距债务重组方案“大限”只剩5天,"9月25日午后，地产股走弱，其中，泰禾集团股价一路走低，盘中多次触及跌停板。截至收盘，该股跌停，股价报4.41元/股。盘后数据显示，深股通买入超1800万元并卖出865万元，一机构卖出7136万元。
(image_address=""https://x0.ifengimg.com/ucms/2020_39/83A463A6731F72685E7726F5381623D26AB3E11F_w885_h594.png"")
7月31日早间，泰禾集团发布公告表示，与万科全资子公司海南万益管理服务有限公司签订股权转让框架协议，在满足交易前提下，拟按每股4.9元的价格转让19.9%股份，总对价约为人民币24.3亿元。
但此次股权转让，万科设置了两个先决条件，其一，泰禾制定债务重组方案并与债权人达成一致，并且债务重组方案能支持目标公司恢复正常经营，其二是要对泰禾做尽职调查，确保泰禾资产、债务及业务等不存在影响公司可持续经营的重大问题或重大不利变化。
根据协议约定，若上述条件在2020年9月30日前未获得满足且未获得万科方豁免，则万科有权单方面终止本协议。这意味着，如今，距离万科要求泰禾交出各方达成一致债务重组方案仅剩5天。
泰禾集团近期面临困难重重。
基本面上，泰禾集团8月14日晚间发布半年报显示，公司上半年实现营收24.63亿元，同比减少83.02%；净利润亏损15.82亿元，同比下降201.33%。
公司表示，业绩亏损主要原因为收入大幅下降造成的营业利润大幅减少，同时，2020年上半年投资收益主要由公司持有的合联营企业投资按权益法确认的投资收益产生，金额较小，较2019年同期大幅减少，此外，报告期内公司对已到期尚未还款的借款计提预计负债并支付其他违约金等约7.76亿元，以上因素叠加导致本报告期出现亏损。
同日，公司公告称，受地产整体环境下行、新冠肺炎疫情等叠加因素的影响，公司现有项目的去化率短期内有所下降，销售预期存在波动，同时由于公司自身债务规模庞大、融资成本高企、债务集中到付等问题使得公司短期流动性出现困难，公司将无法按期完成公司债券“17泰禾01”本息的兑付。
8月24日，泰禾集团再次公告，由于公司自身债务规模庞大、融资成本高企、债务集中到付等问题使得公司短期流动性出现困难，公司未能完成公司债券“18泰禾02”本息的兑付。
债务缠身、接连违约的泰禾，收到深交所于8月24日发出的监管问询函，要求说明债务重组事项的具体进展及后续安排，并核查是否存在被实行其他风险警示的情形。
9月3日，泰禾集团回复问询函称，基于公司资金紧张的实际情况，公司通过商业票据、房抵工程款等方式替代资金支付，与各供应商积极协商复工赶工，加速推动项目建设，造成账面预付账款暂时性增加。公司正在积极解决债务问题，预计债务问题逐步化解后，对已到期尚未还款的借款计提相关预计负债的金额将大幅降低，另外，公司将不排除通过新增储备项目的开发与销售，进一步为公司提供稳定的利润来源，预计可抵扣亏损将得到弥补。同时，公司正努力解决债务及现金问题，力求重塑客户信心。公司预计此类诉讼达成和解的可能性较大，预计对公司不会产生重大不利影响。",2020-09-25 18:18:49,凤凰财经
