,title,content,pub_time,src
0,渤海银行成都分行被罚 监管“点名”五类行为,"中国人民银行成都分行8日披露的行政处罚信息公示表显示，渤海银行股份有限公司成都分行及3名相关直接责任人员于近日收到了监管部门罚单。
(image_address=""https://x0.ifengimg.com/ucms/2020_37/8E35B0CBAEB5174C6C7E249CD8E4134737C9842C_w895_h342.png"")
图为相应行政处罚信息公示表
具体来看，公示表显示，违法行为类型包括五项：一是虚报、瞒报金融统计数据；二是违反账户管理规定；三是未按照规定履行客户身份识别义务；四是未按照规定报送大额交易报告或者可疑交易报告；五是违反流通人民币管理规定。
根据公示表，监管部门对渤海银行股份有限公司成都分行给予警告，并处68.1万元罚款，对3名相关直接责任人员合计处4万元罚款。作出行政处罚的决定日期为9月2日。
根据渤海银行官网介绍，渤海银行是最年轻的全国性股份制商业银行，于2005年12月30日成立，2006年2月正式对外营业。截至2019年末，已开设33家一级分行（包括直属分行）、30家二级分行、127家支行、54家社区小微支行，并设立了中国香港代表处，网点总数达245家。",2020-09-10 13:59:11,凤凰财经
1,创业板低价股多股跌停！医保个人账户改革方案将出台，医疗信息化概念股有望获资金重点加仓,"医保个人账户改革有望进入正式法案出台阶段，8000多亿元的个人账户资金使用途径将发生重大改变。
今日早盘，指数集体高开，随后震荡回落，截至午间收盘，上证指数涨0.29%，深证成指涨0.37%，创业板指涨0.24%，万得创业板低价股指数跌12.31%。
早盘A股赚钱效应极差，两市个股跌多涨少，涨停仅约20家。盘面上，白酒板块领涨，物流、造纸、水泥等板块一度上涨，随后走低；云游戏、石墨电极、安防等板块领跌。
前期大涨的创业板低价股集体跳水，亚光科技、精准信息、天海防务、杭州高新等多只创业板个股跌停。值得注意的是，昨日创业板低价股已经集体大跌，早盘持续大跌使得创业板低价股受创较重。
(image_address=""https://x0.ifengimg.com/ucms/2020_37/A757C18488B28CF3486F53091FEFA0B2A6D4E66F_w416_h555.png"")
医保个人账户改革方案即将出台
国家医疗保障局早前在官网发布《关于建立健全职工基本医疗保险门诊共济保障机制的指导意见（征求意见稿）》，就健全职工医保门诊共济保障，改革个人账户向全社会公开征求意见。
目前为期12天公开征求意见期限已结束，医保个人账户改革正式出台的脚步渐行渐近，市场分析认为“弱化”和“活化”个人账户将是此次改革的主旋律。根据每年医保工作的进度安排，业内预计明年1月1日将是比较合适的政策调整窗口期。
本次意见征集是针对已有几十年历史之久的职工医保制度，老医保制度实行统筹基金和个人账户相结合的制度模式。个人账户在老医保中发挥着重要作用，但是近年来其门诊保障不充分、共济保障功能不彰显的不足突出显现出来，其弊端已经体现得非常明显，学界取消医保个人账户的建议不绝于耳，这也是新医改的主要方向之一。
从我国职工医保基金的结余结构来看，出现了结构性失衡和配置不合理问题。在职工医保基金收入占比中，社会统筹部分占4.8%，个人账户占3.2%，导致解决医疗当期风险的社会统筹基金不够，而个账积累过多。以国家医保局披露的数据来看，截至2019年末，我国职工医保个人账户当期结余1000.96亿元，累计结余8277亿元，庞大的沉淀基金难以有效发挥医保的风险互济保障功能。
根据征求意见稿，职工医保个人账户改革“破冰”的关键点在于：职工医保个人账户依然保留，但增强了门诊共济保障功能。医保专家指出，由于门诊医疗费用报销水平提高，参保人的整体保障水平是提高的，医保基金的使用效率也将进一步提升。
据报道，目前北京、上海、浙江、广州、青岛、厦门等地已相继开展了职工医保个人账户改革与门诊费用统筹的探索。业内人士认为，此次改革意义不仅在于提供更好更公平的门诊保障，更为医疗保险促进健康管理打开了一扇关键之门，对于医保系统建设也提出了较高要求。
医保全国系统正加速建设，多家企业参与
新医改是目前公共卫生领域的一次巨大变革，覆盖了全国大大小小的卫生部门、医疗机构，对于理顺多年来的医保分配顽疾具有重大意义。
国家医保局在2019年宣布，到2020年我国将建成统一的医保信息系统。全国参保居民将使用全国统一的医保电子凭证，查询个人医保信息、医保参保关系转移接续、异地就医结算也将会更加的快捷方便。
国家医保信息平台建设将对医保疾病诊断、医疗服务、药品、医用耗材等15项信息启用全国统一业务编码，建设成为统一、高效、兼容、便捷、安全的信息系统。
由于目前没有全国统一的医保信息系统，过度用药、过度医疗、过度检查缺乏对标标准，影响医保基金合理使用。控制医疗费用过快增长缺乏有力手段，存在转移接续医保关系、就医结算、异地就医不方便等问题。药品、耗材种类品规繁多，标准不统一，造成管理难点和盲区，价格不够公开透明，缺乏信息化监管手段，难以有效遏制欺诈骗保现象等等。
国家医疗保障局有关负责人表示，现有的医保信息系统主要还是伴随其他的信息系统来设计的，存在着标准不统一、数据不互认、难以共享、区域封闭、孤岛现象突出等问题，于是建设全国统一的医保信息系统就成为当务之急。
国家医疗保障局公布了医保局医疗保障信息平台建设工程业务应用软件采购项目中标结果，多家医疗信息化行业的领军企业中标。其中，创业慧康、久远银海、易联众作为联合体中标基础信息管理子系统/医保业务基础子系统/应用支撑平台子系统，该部分为整个医保局信息系统核心，具备重要价值；平安医保科技中标宏观决策大数据应用子系统、运行监测子系统；易联众、创智和宇、东软集团等分别中标其他包。
(image_address=""https://x0.ifengimg.com/ucms/2020_37/36A41625FF652E6A5D48BB1C8E99AD87A8592AC6_w1080_h325.jpg"")
今年遭遇疫情冲击，上半年对于施工进度有影响。2020年即将进入最后一个季度，随着国内疫情充分控制，推算医保系统的建设进度已经进入加速期。
医疗信息化板块值得长期关注
今年以来，疫情催化下，互联网医疗成为市场热点，医疗信息化两大龙头创业慧康、卫宁健康在股价上都取得不小的涨幅，尤其创业慧康在疫情发生后不久就成功创下历史新高，显示市场对于医疗信息化板块的长期看好。
疫情影响下，各家上市公司的主营业务普遍受到影响，虽然大部分依然保证扣非净利润为正，但能保持主营净利润正成长的仅剩下创业慧康等3家。
创业慧康发布的2020年中报显示，公司主营业务恢复增长，公卫领域存在一定机遇。公司上半年实现营业收入7.09亿元，同比增长15.53%，实现扣非归母净利润8895万元，同比增长11.11%；单看第二季度，公司单季实现营业收入3.82亿元，同比增长30%。在业务拓展上快速恢复，上半年公司新增千万级订单12个，较上年同期增50%，疫情催化下公共卫生领域存在新的市场机遇，机构预测公共卫生业务上将有较大幅度的增长。
另一家龙头卫宁健康虽然也实现了营收的增长，但主营净利润却遭受较大幅度的下降。上半年，公司实现营业收入7.93亿万元,同比增长18.49%，实现扣非净利润为7253.26万元,降幅高达43.23%。
板块今年以来已经积攒了较大的涨幅，近期遭遇了一波集体回调，创业慧康、卫宁健康、久远银海都有20-30%幅度的跌幅。有市场声音认为，随着板块个股受半年线支撑而逐渐平稳，显然回调过程已经告一段落，个股更具有安全性，值得长期关注。
在板块回调过程中，“聪明资金”也对板块个股进行着相应的调仓动作。数据宝统计显示，北上资金近两月不断流出个股，仅业绩表现较好的创业慧康受到北上资金加仓，最新持股数量较6月末增加了14.85%。
(image_address=""https://x0.ifengimg.com/ucms/2020_37/B28F318C832B30B261350A0F3C8E0C7A7B01B043_w847_h664.jpg"")
声明：数据宝所有资讯内容不构成投资建议，股市有风险，投资需谨慎。",2020-09-10 13:38:18,凤凰财经
2,银保监就偿付能力监管规则执行情况开启行业自查,"来源：上海证券报
上海证券报独家获悉，近日，银保监会偿付能力监管部向各保险集团、各保险公司下发相关通知，将在行业内部开展偿付能力信息公开披露等监管规则执行情况自查工作。
此次自查工作，旨在全面了解偿付能力信息公开披露等监管规则实施情况，切实发挥偿付能力市场约束机制作用。
自查内容包括：各保险集团、各保险公司应对照《保险公司偿付能力监管规则第13号：偿付能力信息公开披露》《保险公司偿付能力监管规则第15号:保险公司信用评级》，认真检查相关规定落实情况。
自查方式为：各保险集团、各保险公司根据对照检查情况，回答自查提纲相关问题，填写自查结果汇总表，并按要求准备相关证明或说明材料。对规则执行不到位的，相关公司应分析原因，提出整改措施。
根据要求，各公司要高度重视本次自查工作，逐项对照检查，如实填报情况。并在规定时间内报送自查情况。银保监会偿付能力监管部将根据自查情况进行抽查，对上报信息与实际情况明显不符或执行相关规则问题突出的公司，将进行行业通报；问题严重的，依法予以处罚。",2020-09-10 13:26:28,凤凰财经
3,多只基金抱团股近期遭抛售！这份低估值绩优滞涨股名单请收好,"作者：数据宝郭洁
前期受基金青睐的抱团股，近日频遭抛售。
今年基金发行火爆，增量资金涌入市场推动基金持续加码抱团股，结构性行情持续性高。前期消费、医疗、科技板块最受资金和机构青睐。然而近期却出现了一个迹象，不少前期受到基金青睐且年内涨幅颇大的个股遭到机构抛售，股价大幅下跌。
基金抱团股近期跌幅较大
证券时报&middot;数据宝统计显示，上半年持股基金数超100家的A股有780只。持股基金数超1000家的大多数为今年年内上市的次新股。剔除掉这些次新股来看，有705只股的持股基金数超100家。这705只股在8月份股价平均上涨幅度为2.12%。
然而，自9月以来，705只股的股价平均下跌5.91%，跑输同期大盘（-4.15%）。其中有183股跌幅超10%，数量主要集中在医药生物、食品饮料和电子板块。53股跌幅超15%，欧菲光、安琪酵母、绝味食品、千禾味业、中炬高新、正邦科技和君正集团的股价下跌幅度均超20%。短短7个交易日，这705只股的股价下跌幅度已完全抵消掉整个8月的上涨幅度。
(image_address=""https://x0.ifengimg.com/ucms/2020_37/3A49E59D8A43135A030B9DC4077488D3E6AA42A2_w558_h324.png"")
多只热门概念股遭机构抛售
从机构抛售情况来看，9月以来股价下跌超15%的这53股中，机构资金连续3个交易日呈现净卖出的有33只股，连续5个交易日净卖出的有19股，自9月以来7个交易日全部呈现机构净卖出状态的有11股。君正集团的机构净卖出额最大，净卖出13.46亿元，该股今年因蚂蚁概念已经上涨164.87%，最新收盘价较年内高点回撤35.56%，公司上半年净利润13.25亿元，同比下降7.36%。
欧菲光和正邦科技的机构资金净卖出额位列二、三位，分别净卖出13.43亿元和12.89亿元。欧菲光上半年净利润同比大增2290.28%。9月初的一场“被踢出苹果供应链”的乌龙事件，欧菲光虽澄清是不实传闻，但利空影响依然未散，股价一路震荡下行，最近收盘价14.66元，与年内最低价13.14元已近在咫尺。正邦科技上半年净利润同比增长979.24%，公司业务涉及种猪育种、商品猪养殖等。7日，养猪大户唐人神董事长陶一山预测，2年后猪肉可能跌到4-5元。此言一出，第二天猪肉板块个股全部大跌，市值合计蒸发约700亿元。
(image_address=""https://x0.ifengimg.com/ucms/2020_37/73CF1CA0BF36077EED86D3A9504D74148A05F2EE_w769_h750.png"")
低估值的滞涨绩优股出炉
业内人士普遍认为，当下出现这种迹象的调整，可能是估值比较高，未来的预期投资回报率被压缩，上半年“炒估值”将告一段落，下半年或进入业绩为王阶段，周期股和低估值板块股将颇受关注。
数据宝梳理了整个A股的数据发现，兼具基金重仓、低估值、股价滞涨、业绩绩优和最新收盘价相对低等特点的A股共有14只。其中房地产板块中南建设上半年净利润达到20.5亿元，同比增长56.2%，增幅最大。同样是房地产股的阳光城昨日获主力资金净流入近1.32亿元。
(image_address=""https://x0.ifengimg.com/ucms/2020_37/D7F570E6FF08B3A6C58E92E990FE95F493F9D84F_w921_h570.png"")
声明：数据宝所有资讯内容不构成投资建议，股市有风险，投资需谨慎。",2020-09-10 13:26:15,凤凰财经
4,“消灭低价股”行情告终！创业板老股再次批量杀跌，34股跌超15%,"以天山生物等三只领涨龙头停牌为界，创业板存量老股的博弈正式转向。
9月10日，创业板“低价股”第二日大跌。
至11:10时，天海防务、西部牧业等5只个股封死20%顶格跌停价位，另有腾邦国际、科融环境等29只个股跌幅超过10%。
反观市场的另一面，同日除上市新股继续大涨外，存量老股顶格涨停仅有中科信息一只。
显然，此前被认为是“消灭低价股”的行情已经明显降温。
需要指出的是，这类低价股并非只具备股价绝对值小的特点，公司本身市值也不大。
据统计，8月至今，涨幅排名靠前的天山生物、长方集团、豫金刚石，8月1日总市值均在30亿元以下，同时长方集团、豫金刚石股价低于3元。
(image_address=""https://x0.ifengimg.com/ucms/2020_37/41671406DFA4D889DC09C572E32C56F0F66EDEF8_w700_h419.jpg"")
涨幅紧随其后的也多是创业板个股，普遍具备低股价、低市值的特点。
但是，随着昨日上述三只“带头大哥”的停牌，尤其是天山生物的二次停牌，消灭低价股行情的拐点随之确立。
当日，创业板涨跌幅超过10%的个股达123只，要知道当日处在交易的创业板个股尚不过850只，前一交易日跌幅超过10%的个股也仅有4只。
至此，消灭低价股行情阶段性告终，市场就此转向。
与之相伴的是，在低价股熄火后，部分权重板块开始止跌回升，9月10日休闲服务、食品饮料、房地产板块开始反弹。
只是由于市场仍然处于相对弱势状态，这部分个股反弹幅度相对有限，仅有世茂股份、阳光城等少数地产股出现涨停。
进一步追溯到6月末A股市场反弹起点，则可以看出权重蓝筹股前期积累了可观涨幅，在以消费股为代表的蓝筹股大幅回落后，二级市场资金端将火力集中到了低价股身上，并不断强化相关个股的上涨趋势。
如今，随着三只龙头股的停牌，以及创业板存量老股的批量跌停，二级市场再次进入到了方向、标的选择的十字路口……（作者：董鹏编辑：朱益民）",2020-09-10 13:16:24,凤凰财经
