,title,content,pub_time,src
0,疫情“震中”的华人华侨慌了？归国包机一个座位16万,"“跟预料的一样，我又变成留守儿童了。”曾在复旦发展研究院工作、如今正在西班牙马德里深造的小盛无奈地告诉第一财经记者。
当第一财经记者联系上她时，恰逢西班牙因新冠疫情宣布“全国封城”。
当地时间14日晚间，西班牙新冠肺炎确诊病例累计达6393例，死亡195例。西班牙，也由此成为欧洲仅次于意大利的确诊病例第二多的国家。
西班牙首相桑切斯在当地时间14日晚宣布，西班牙将从即日起为对抗新冠疫情施行“封城”的措施，除工作、就医或购买生活必需品等特定情况外，全国范围内的民众禁止走出家门。
(image_address=""https://x0.ifengimg.com/ucms/2020_12/AF9A6494E6E4A4BF0BF8DD3451690572286D1685_w600_h500.jpg"")
世卫组织15日发布的最新数据显示，截至欧洲中部时间15日6时（北京时间13时），全球新冠肺炎确诊病例累计达152428例，死亡5720例。
就在13日，世卫组织表示，目前欧洲报告的新冠肺炎确诊和死亡病例超过中国以外其他国家和地区的总和，欧洲已成为新冠肺炎“大流行”的“震中”。
随着新冠疫情在海外不断蔓延，越来越多的国家因疫情或进入紧急状态，或选择封城。在当地生活求学工作的华人、留学生、中外企员工们还好吗？
3月1日，国务院联防联控机制就依法有效防控海外疫情输入有关情况举行发布会。中国政府高度关注华侨和留学生等人员在海外的健康安全，积极敦促驻在国政府采取切实措施，重视解决他们在健康安全方面的问题。外交部和有关的驻外使领馆密切关注这些国家的疫情发展情况和我们在当地人员的情况，积极开展领事保护和服务工作。
3月13日，在被问及假如未来有很多国人想要回到国内和使馆的建议等相关问题时，驻美大使崔天凯在接受央视采访时表示，根据很多专业机构，包括世界卫生组织的建议，还是要尽量减少大规模的聚集和长途旅行，因为长途旅行也会增加感染的风险，他希望在美侨胞、留学生要仔细权衡利弊，尽量规避风险。
崔天凯同时表示，现在最基本的是要保护好自己，怎么有利于保护好自己就怎么做。当然如果在美侨胞、留学生经过慎重考虑，最后有种种理由觉得还是需要回去，驻美使领馆也会给他们想办法，解决具体问题，提供各种便利。
(image_address=""https://x0.ifengimg.com/ucms/2020_12/9FE65EEEB90A4847D3A23A9FA2D53AC3F214199E_w640_h400.jpg"")
转道第三国求学
在过了近3个月的假期后，小叶原计划2月中旬返回澳大利亚墨尔本继续自己的学业。但是，新冠疫情打乱了她的脚步。
在她返校前，澳大利亚政府出台了“14天停留第三国入境”的要求。这就意味着小叶直接从国内回澳大利亚的机票作废，她选择泰国作为第三方中转国。
“泰国、马来西亚，之前在我们澳大利亚留学群里讨论的热烈程度甚至超过了澳大利亚本身。”在泰国中转的14天，小叶也没有选择四处闲逛，而是在旅店与餐饮店持续着两点一线的生活。结束了14天自我隔离后，小叶在3月1日顺利入境澳大利亚。
澳大利亚联邦卫生部15日公布的数据显示，截至当地时间15日15时，该国新冠肺炎确诊病例数达281例。澳大利亚总理莫里森当天表示，从15日午夜起，所有到达澳大利亚的国际旅客须进行自我隔离14天。
在西班牙的小盛则开始规划封城期间的生活物资安排。
随着小盛常去的水果店老板闭店谢客，她意识到未来的一段时间里，她的生活质量也许会受到前所未有的挑战。
“超市的鲜肉区抢空了，蔬菜也差不多只剩西兰花了。我在脑内清点了一下家中的物资：面包可以吃到28日，米、面都有，实在不行还有面粉，自己和面；午餐肉、腐乳、金枪鱼罐头、方便面各囤了一些，实在不行就吃这些；鲜肉是真的没了，只有冻库里剩的……”她说道，“我现在都是周一出门囤粮，周中吃得还挺像样，到周末就磕碜了。”
在大西洋彼岸的美国，据约翰&middot;霍普金斯大学发布的数据，截至美国东部时间14日下午3时，美国累计新冠肺炎确诊病例2569例，死亡51例。13日，美国总统特朗普已宣布美国因疫情进入紧急状态。
小严是美国亚马逊公司的员工。已在纽约工作多年的她告诉第一财经记者，美国人到超市抢购，确是实情。当然，不同地区会有差别。“除了实体店，其实大纽约区也有生鲜快递，比如亚马逊和纽约中国超市的网店，目前还不存在买不到食物的情况。”她说道。
目前她也囤了不少干粮和冷冻食品以备不时之需，“家里的食物储备够吃至少一个月。”
“纽约在美国是疫情相对严重的区域。经过一段时间确诊数字的累积，民众也开始有意识地避免人群聚集，减少上街。很多单位从上周起已经实行在家办公，直到3月底。由于通勤和出行减少，街上的行人数量肉眼可见下降，很少见到这么空旷的曼哈顿。”她说道。
在俄罗斯莫斯科，一家中资企业的员工小张并没有因为疫情感到紧张。
他告诉第一财经记者，“使馆几乎每天进行指导，使馆的微信公众号如今高频率地更新，都像对外新闻中心了。而且，针对俄罗斯本地对华人政策的辟谣或解释反应得特别快。”他还提到，海外中资公司的防疫工作和国内是同步的，“基本都有自己的防疫政策和措施，比俄罗斯本地公司起步早太多了，口罩、消毒液这类物资储备相对充足。”
至于日常生活，他表示，“我周末去逛超市了，莫斯科的各个超市货架物资都非常充足。平时麦德龙超市停车位很充裕，但现在明显找车位难。不过超市货架补货非常快，所以没感觉缺什么。不缺就不恐慌，也就没抢购。”
归国包机热炒
在海外新冠疫情持续严峻的当下，也有人归国心切。当普通民航航班暂停时，包机方式很火爆。
一位票代公司人员告诉第一财经记者，当前无论是美国还是欧洲，有回国需求的国人还是很多的。在民航航班大面积暂停的情况下，包机成为了海外国人归国的热门选择。“包机的形式，有公务机，也有民航，也就是那种正常的航班。”
上述票代公司人员举例说，目前如果以普通民航的形式包机，从伦敦回国，东航一架200人的包机，一共需要2000万元（人民币，下同），也就是人均成本在10万元。国航的非公务机包机公务舱价格含税8万多元，也是提供200人的舱位。
如果选择公务机的包机，价格则显著上升。上述票代公司人员告诉第一财经记者，他们掌握的信息显示，最近从伦敦回上海的公务机包机航班是在3月19日，将降落在上海的浦东国际机场。
该公务机的机型是波音757，有67个座位，平均售价在16万元。
“就在信息发布的短短2小时内，67个座位就被一抢而空。”上述票代公司人员表示，“必须趁早”。
有位不愿透露姓名的英国华人告诉第一财经，他和他的朋友们最近打算包机回国，“商务机太贵了，我们目前还是首先考虑民航包机。”他表示，目前他了解的价格是一个座位含税约5.5万元，“我们还在等待最终的日期和价格。”
目前东航、南航等国字头航空公司下属的公务机公司都有包机业务。但由于包机需要提前与目的国的空管局确定航线、申请机场等，需要做很多前期准备。
从事美国高中留学事宜多年的资深顾问JC，近来的生活因为疫情变得更忙碌了。“这两天，我的电话被打爆了。”她说。由于她接手的留学生主要是希望进入美国高中、初中就读，年龄较小，国内家长也更担心疫情对孩子在美国安全、学业等方方面面的影响。
随着疫情的发展，她预计美国的学校会普遍延长春假，因此她在12日就呼吁家长们提前做好准备。“当特朗普宣布美国因新冠疫情进入紧急状态后，家长们的恐慌已经达到巅峰，飞机票已经售罄，处于有钱也买不到的状态，大家哄抢机票，甚至出现高价包机。”她说道。
(image_address=""https://x0.ifengimg.com/ucms/2020_12/AA05A33A4E4B902AF7ACFE875C99772DEE216F3E_w640_h400.jpg"")
“没必要恐慌”
这些天，JC一边忙着安抚这些家长，也一边给他们分析当前美国的状况。
“其实没必要恐慌。”她建议，如果错过买机票的黄金时间或一时半会回不来的，不要慌张，但必须立刻在美国境内找信任的亲属朋友安置，保证孩子们身边有成年人；不管寄宿在哪里，都要找好自己的医疗保险卡，对附近的诊所/医院有所了解，去了解当地治疗流程。对于执意归国的孩子，她建议飞机路上要做好防护，下飞机要做好隔离，该检疫的要检疫，按各地的规矩来。
JC强调，在互联网各种消息满天飞的当下，家长们要冷静理智，密切关注动态，也要根据自己家孩子的实际情况做出理智判断。
据第一财经记者梳理，中国教育部、外交部以及中国驻外各领馆先后已发布相关政策文件，帮助海外留学生、华人度过当下这一特殊时期。
3月12日，教育部留学服务中心通过官方微信平台发布《海外留学人员新型冠状病毒肺炎防控指南》（下称《指南》）。《指南》从新型冠状病毒有关知识、个人防护指引、海外留学人员心理健康指引等方面，对留学生进行提醒。
针对普遍关注的个人防护问题，《指南》做出解答。“尽量减少乘坐公共交通工具，采取步行、骑行或自驾车等交通方式。”在公共场所的防护上，《指南》建议，排队候餐、食堂就餐，尽量间隔1米以上。并鼓励学生网上查阅电子读物，如需到图书馆查阅书籍，建议佩戴一次性手套和口罩，并保持座位间隔1米以上，减少逗留时间。
展望西班牙“全国封城”后的生活，即便会变得更加艰难，其间也有很多人劝小盛回国，但她没有动摇，给出的统一答复是：不回。
(image_address=""https://x0.ifengimg.com/ucms/2020_12/5CEA01A1AF58EED1CA78A1E65E8F9C8BAB79F199_w640_h500.jpg"")
“我告诉自己：绝对不能中招、不能被隔离，因为我的论文还没写完，有一本书要翻译，还有很多游戏没有打通关……”但其实她也有苦衷，她原本预约了3月16日办返乡证，但移民局15日也关门了。
“如今我是被迫坚守此地，靠精神食粮慰藉自己。”她无奈地说道。
小严也没有回国的打算。“就个人而言，口罩、食物暂时不缺，”她说，“也有一些困难，主要是在家办公的技术困难，但都可以克服。”
她告诉第一财经记者，纽约现在的公共卫生政策是轻症人群如不符合（严苛的）疑似条件不进行新冠病毒检测，发烧的话会开点泰诺和布洛芬，然后让你回家躺着自行隔离。“好在（我）在纽约有很多朋友，可以相互照应。”她说道。
“这几天，我会想起2012年10月的桑迪飓风，当时让半个曼哈顿停电整整一周，下城变空城。依旧记得那天早上醒过来，整个街区断电，连手机都没有信号，完全不知道发生了什么（后来才知道中城的变电站爆炸了……信号发射塔因此也断电）。”小严说道，“和自然灾害相比，疫情虽然让人不安，但至少有一定的时间让人储备食物和防护物资，不至于太措手不及。”
在她看来，纽约也是个经历风雨的城市，无论是警务还是卫生系统，对紧急状况都有应对经验，“在国外确实不比在自己国家……但我们都会彼此扶持。望大家都安好，疫情尽快消退，期待绿树成荫的夏天再相见。”",2020-03-15 22:41:21,凤凰财经
1,女王迁离伦敦，10万民众请愿！英国卫生大臣回应群体免疫:不是你们想的那样,"女王迁离伦敦，10万民众请愿！英国卫生大臣回应群体免疫:不是你们想的那样2020年03月15日 22:24:12
来源：每日经济新闻
原标题：女王迁离伦敦，10万民众请愿！英国卫生大臣回应“群体免疫”：不是你们想的那样
据英国天空电视台报道，当地时间14日，英国新增342例新冠肺炎确诊病例，累计确诊1140例。新增10例死亡病例，累计死亡21例。
(image_address=""https://x0.ifengimg.com/ucms/2020_12/532EC874999D9E8D5DA33E2171497A524277D3C4_w1080_h490.jpg"")
英国疫情统计（图片来源：Wind）
据央视新闻援引英国媒体消息，
因英国疫情紧迫，英国女王伊丽莎白二世近日已经暂时迁离白金汉宫，在伦敦以外的温莎城堡躲避。
皇室发言人表示，位于伦敦市中心的白金汉宫有500名工作人员，比起其他皇家领地，这里的潜在危险更大。如果英国情况进一步恶化，即将94岁的伊丽莎白二世女王和98岁的菲利普亲王将被安排到距离伦敦200公里的桑德林汉姆宫躲避。 而在民间，部分物资紧缺的现象已经出现。据央视新闻，英国民众先是抢购卫生纸和洗手液，这些商品基本是每天上货后就会迅速被人买走，而在 面包货架上，几乎什么都买不到了。除此之外，被抢购一空的食品还包括鸡蛋、牛奶、米、面、罐头、饼干和冷冻蔬菜，这些都是非常便于储存的食品。
(image_address=""https://x0.ifengimg.com/ucms/2020_12/40D210599225AABEC1788C5EAD5AA28A53B01D47_w320_h180.gif"")
图片来源：央视新闻
对于英国，全世界更关注的是其政府的疫情防控举措。在“群体免疫”引发一片哗然之后，英国卫生大臣给出了新的解释。
卫生大臣：“群体免疫”不是目标或政策
3月12日，英国首相鲍里斯·约翰逊在新闻发布会上表示，“新冠疫情是这一代人遇到的最严重的公共健康危机。 坦白地说，更多家庭将有亲人夭折。 ”
(image_address=""https://x0.ifengimg.com/ucms/2020_12/59496A263A783FC6CD1241B1D96A842817777A5E_w1080_h737.jpg"")
图片来源：新华社，英国首相府供图
当天，鲍里斯在新闻发布会上正式宣布英国进入抗疫第二阶段——“拖延”阶段（Delay）。简单来说，英国的防疫的策略是""不严防死守，容忍疫情缓慢进展，期待大部分人在隐匿性感染后无症状或仅有轻微症状，从而在人群中获得普遍免疫，以控制疫情""，也就是通过群体免疫力（Herd immunity）来防控新型冠状病毒。
(image_address=""https://x0.ifengimg.com/ucms/2020_12/58588EE57A4AC12DDD20A3D67F508A8B4D268343_w1080_h882.jpg"")
群体免疫（图片来源：华山感染）
鲍里斯的言论也引发舆论关注。
“豪赌！”英国天空电视台的评论批评群体免疫策略是在冒险；伦敦资深病危护理专家西蒙·埃希沃斯（Simon Ashworth）则直呼政府，“快醒醒”。 据央视新闻15日报道，目前已有超10万 人在请愿书上签字，呼吁英国政府采取“更积极的方式”，阻止疫情蔓延。请愿书说，英国有必要效仿意大利，限制一切非必要市镇间人员流动，同时限制大型集会。按英国相关规定，请愿人数超过10万，议会就应考虑对相关议题进行辩论。
此外，英国有300多科学界学者、200多名心理学/行为学家分别发表了公开信，反对英国政府这一政策，质疑“群体免疫”的目标能否实现。
据英国天空电视台15日消息，英国卫生大臣马特·汉考克表示：“‘群体免疫’不是我们的目标或政策——它是一个科学概念。我们的政策是保护生命，战胜这种病毒。”
(image_address=""https://x0.ifengimg.com/ucms/2020_12/44BC9EFF560EA6DBD090F281541655BDD51C618E_w1080_h330.jpg"")
图片来源：英国天空电视台
行动：70岁以上老人将被要求待在室内
对于疫情防控，英国政府并非完全没有行动 。 据参考消息援引路透社报道，英国独立电视公司政治栏目主编罗伯特·佩斯顿说， 英国政府很快将指 示英国年龄超过70岁的人士严格隔离4个月，这是因应新冠病毒肺炎疫情计划的一部分。 佩斯顿说，英国政府很可能在今后5到20天实施“战时”动员。计划中的其他措施包括强制征用宾馆和其他设施作为临时医院和征用私立医院。 据天空新闻网，英国卫生大臣汉考克（Matt Hancock）表示，“
未来几周内英国70岁以上老人将被要求待在室内，以保护他们免受冠状病毒感染。
” 另据《每日邮报》报道，为应对新冠肺炎疫情，英国政府计划进一步出台的措施包括：
(image_address=""https://x0.ifengimg.com/ucms/2020_12/97A2627BBBC923333F6D259B98DA6D0F3B2C7FEF_w1080_h28.jpg"")
部署军队到医院和超市；
数以千计的私人医院床位将被征用，以缓解英国国家医疗服务体系（NHS）的压力；
敦促企业为了国家利益扩大生产线，以生产呼吸机等基本医疗设备；
如果一个家庭有一名成员被感染，整个家庭将被隔离；
英国警方正计划对轻罪不予追究，只对涉及人身安全的犯罪进行调查，以释放警力。
(image_address=""https://x0.ifengimg.com/ucms/2020_12/FF489B44D857D94861155A0AA862B40306A0155D_w1080_h28.jpg"")
“群体免疫”策略是否靠谱？
那么英国提出的“群体免疫”概念是否靠谱？华山医院感染科主任张文宏在其公众微信号华山感染中表示，
(image_address=""https://x0.ifengimg.com/ucms/2020_12/97A2627BBBC923333F6D259B98DA6D0F3B2C7FEF_w1080_h28.jpg"")
这是有理论的基础。首先是流行病学的理论——普遍免疫可以形成稳态。而一个现实则是，这次新冠疫情同样也存在着大部分感染患者为无症状或仅为轻症，可以在不经治疗或者对症治疗后自限性痊愈的特点；此外，英国政府在发布会上也重申新冠的死亡率是1%。因此，通过放开疫情的防控，让大量人口感染后自愈获得免疫力，然后集中医疗力量救治人群中的危重症患者，也就是说不在防“感染”上花成本，而尽在防“死亡”上花成本。
在控制疫情的同时不会因为严格的管控措施牺牲社会活力和经济发展，尽量减小抗击疫情的代价，这就是英国所行策略背后的逻辑。
但是这样的一种“群体免疫“方式看似理论上可行，实际上是否真的能够成功，仍然存在着很多不确定的因素。
从中国的经验来看，中国竭尽全力保障了公民不受感染，在防控上不惜以牺牲经济为代价，在短时间内迅速降低了病毒的社区内传播，并迅速恢复社会秩序，竭力恢复社会经济的发展。但是由于中国国家强大的决心和民众的配合力，这并不是其他国家都能够抄的作业。
(image_address=""https://x0.ifengimg.com/ucms/2020_12/CF252FCB634254935D9054719834CEF9EA0F2FCF_w1080_h641.jpg"")
采取干预后高峰延迟、峰值降低（图片来自美国CDC）
(image_address=""https://x0.ifengimg.com/ucms/2020_12/FF489B44D857D94861155A0AA862B40306A0155D_w1080_h28.jpg"")",2020-03-15 22:24:12,凤凰财经
