,title,content,pub_time,src
0,口罩板块一周涨40%！这些企业“不务正业”跨界生产,"(image_address=""https://x0.ifengimg.com/ucms/2020_06/A0C417B7162BDC961F4601BD42D872E1C50F1F88_w616_h399.jpg"")
今年春节，口罩成了人人必备的物资，口罩概念股随之水涨船高。临近复工，你还在为“一罩难求”而头疼吗？别急，口罩厂商正加班加点赶制，为了支援抗“疫”，一些鞋服、婴幼儿用品厂家开始转产口罩。此外，上汽通用五菱、富士康、中石化等企业也加入了生产大军，“兼职”做口罩。
文|吴晓薇
01
口罩产量呈现持续上升势头
总体看，口罩产量呈现持续上升势头。据工信部统计，中国具备一天生产2000多万只口罩的产能。发改委社会发展司副司长郝福庆表示，根据初步统计，截至2月3日，全国22个重点省份口罩产量已经达到1480.6万只，产能利用率达到67%。其中大家都非常关注的N95口罩，已经达到11.6万只。
然而，假如一人一天戴一只口罩，产能仍有缺口。药店断供，限量供应，买不到合适的口罩甚至买不到口罩的现象仍然存在。
对此，中国纺织品商业协会相关负责人表示，随着节后各地陆续复工，全国的口罩产能将得到迅速提升。部分企业已经启动7天24小时全产能生产，一条生产线提高至原来3倍产能。同时原有的大量非医用口罩生产企业，在完善了净化、消杀菌等工序，经检验合格即可生产普通医用口罩，国家有关部门已开通了相关生产资质的快速审批通道。
02
汽车、鞋服、纸尿裤……这些企业跨界做口罩
经济日报1月30日刊文呼吁，有条件的企业立即转产口罩。几天后，郝福庆表示，“只要符合标准，企业可以开足马力组织生产”。
中新经纬（微信号：jwview）注意到，在口罩厂家加班加点赶制的同时，一些看起来与口罩“八竿子打不着”的企业也纷纷跨界加入生产大军。
(image_address=""https://x0.ifengimg.com/ucms/2020_06/BDB87563AD7B1FEAE7ADBE17D6A7FE0E4686444A_w1080_h1847.jpg"")
▲上汽通用五菱官微截图
上汽通用五菱官方微信号发布消息称，将联合供应商通过改建生产线的方式转产口罩。无尘车间由广西建工集团负责改建，将于本月内建成投入使用，共设置14条口罩生产线，包括4条N95口罩生产线、10条一般医用防护口罩生产线，日产量预计达到170万个以上。
另外，富士康表示，集团旗下工业富联近日在龙华园区首次导入口罩生产线，并于2月5日顺利实现试产，目前正在申请产品资质认证中。预计在2月底可日产200万只。
中国石化也在官方微博上广撒“英雄帖”。“我有熔喷布，谁有口罩机？”“我们需要口罩机。您若有富余、可用的设备，可转让给我们，我们将协调生产、增产口罩。增产的口罩，我们可全部收购支持湖北抗疫一线，也可支持企业所在的地方防疫抗疫。”
据经济观察网报道，华南地区的广汽集团也在筹备口罩生产线，预计将于近期开工生产。
一些原本生产鞋、服装甚至是纸尿裤的企业也纷纷改造或新增口罩生产线。
在莆田，双驰实业、泰盛实业等多家鞋服企业加班加点转产口罩、防护服等防护用品。在确保原料供应的前提下，预计每天能生产口罩共超过150万只。
母婴用品企业南京船之宝决定停下手中已有订单，转型生产口罩，并于当天下午通过考察，成为生产民用防护口罩定点单位。主要生产纸尿裤的爹地宝贝发布微博称，公司转产口罩，截至2月6日产能已经提速至140万片。
商务男装企业雅戈尔宣布，研发团队正在抓紧研发新型口罩，用于对病毒预防，研发成功后将马上投入生产。
从事服装设计的柏堡龙在投资者互动平台上表示，可生产时尚家居防菌用途口罩，也已经完成抗菌物料研发，柏堡龙将提供配方授权合作生产商进行生产。
17年前曾为抗击“非典”紧急生产口罩的红豆股份再一次临危受命。2月3日晚间公告称，根据经营发展需要，经营范围新增“第一类医疗器械生产，第二类医疗器械生产”。此外，三枪内衣、水星家纺等一批商家紧急申请资质，连夜改做医用口罩和防护服，驰援一线战“疫”。
03
口罩概念板块一周暴涨40%
(image_address=""https://x0.ifengimg.com/ucms/2020_06/FB6E9138E71F7C5F6C0E3B50019790A35776A213_w1080_h1488.jpg"")
▲本周（2月3日-7日）板块风云榜。来源：Wind截图
医疗上市公司中谁在做口罩？根据公告，奥美医疗有关人员自1月21日起已提前结束休假，返岗生产医用外科口罩，日产能达到100万只；蓝帆医疗在投资者互动平台表示，公司有专业的医疗防护手套及口罩，适用于医务人员或广大人群的基本防护，能够有效阻挡细菌病毒的传播。
2月7日，口罩概念股持续上演涨停潮，泰达股份、奥美医疗、欣龙控股、振德医疗、南卫股份等10只涨停。其中，奥美医疗8连板，泰达股份、振德医疗均6连板。wind数据显示，春节开市首周，口罩概念板块累计涨幅40.91%。
与此同时，口罩生产再迎利好，央行称设立3000亿元专项再贷款，实施优惠贷款利率，加强对重要医用、生活物资重点企业的金融支持。
部分医疗上市公司紧随其后，调整口罩、防护服等相关的业务。紫鑫药业、延安必康、佛慈制药、再升科技等均发布公告表示将增加经营范围，生产口罩等医疗物资。
04
生产口罩要花多少钱？啥时候够用？
生产口罩要花多少钱？中国纺织品商业协会安全健康防护用品委员会会长雷利民介绍，一条生产线，根据生产品种和自动化程度不同，其成本在20万元到40万元之间。一条口罩生产线24小时不停生产，产能在5万只左右，自动化程度高的最多可达到每天10万只。
纺织服装管理专家、上海良栖品牌管理有限公司总经理程伟雄表示，口罩和防护服缺口比较大，服装企业做口罩等防护用品存在一定的优势，能够救急。不过他认为，这次部分企业转向做防护用品属于应急所需，疫情结束后，口罩和防护服会随着市场规律回归正常市场需求，临时转型的企业也会随之回归正常经营。
据雷利民预计，正月初十后口罩生产可接近正常产能。随着工人2月中旬前后大规模复工、原料供应和物流逐步恢复，加上新口罩自动化生产线不断投产，2月底每天能生产各类口罩1.8亿只，其中N95口罩约3500万只左右。再加上进口部分，可满足社会各界的需求。
封面、导语图为资料图，中新经纬摄",2020-02-07 22:49:53,凤凰财经
1,美三大股指集体低开 吉利德科学涨逾2%,"凤凰国际iMarkets2月7日讯，美股今日低开，标普500指数开盘下跌12.90点，跌幅0.39%，报3332.84点；纳斯达克指数开盘下跌49.80点，跌幅0.52%，报9522.38点；道琼斯指数开盘下跌146.40点，跌幅0.50%，报29233.34点。
Uber涨逾7%，第四季度亏损少于市场预期。
吉利德科学涨2.3%，此前抗病毒药物瑞德西韦临床试验已在武汉金银潭医院启动。
搜狐大涨6%，上调2019年第四季度预期业绩。
(image_address=""https://x0.ifengimg.com/ucms/2020_06/4D35442942BFE5CE657991148162563874731335_w500_h333.jpg"")
重点关注个股
Uber涨逾7%，第四季度亏损少于市场预期。
吉利德科学涨2.3%，此前抗病毒药物瑞德西韦临床试验已在武汉金银潭医院启动。
搜狐大涨6%，上调2019年第四季度预期业绩。
其他市场
周五亚洲市场大多走低。
非农就业数据公布后，黄金期货价格上涨。原油期货价格走低。
美元指数DXY短线上扬近10点，涨幅进一步扩大至0.2%，报98.65。",2020-02-07 22:35:33,凤凰财经
2,微信小程序春节果蔬交易增149%，社区电商交易增三倍,"疫情期间，许多商店关闭，公众大多选择使用小程序在线购买日常所需的物品。微信小程序官方数据显示，2020年除夕到初七，小程序生鲜果蔬业态交易笔数增长149%，社区电商业态交易笔数增长322%。
据各零售企业官方数据显示，到家业务都有明显增长：除夕到初六，每日优鲜小程序相比去年同期的订单量增长309%，实收交易额增长465%，蔬菜、水果、肉蛋、粮油速食、防护口罩始终占据热销品类前五。
除夕到初六，永辉生活&middot;到家福州地区订单同比增长率超过450%，销售额同比增长超过600%。2月1日，永辉超市到家服务全国订单量春节期间首次突破20万单，销售额突破2000万元。
钱大妈全国总店铺数超过1700家，目前依然营业的门店数量华南超过1539家门店。华南有100家店铺选择过年期间不打烊，保障市民需求。面对肺炎疫情，钱大妈华南线上团队提前初五开始上班，到家业务成交增长了5倍，订单量增长了3倍，每天都在加大订货量，保证市民都能买到新鲜肉菜。同时钱大妈精选商城小程序，次日达业务也紧急补充了精选蔬菜和肉水产SKU近50款，来保障消费者需求。用户在微信小程序商城可以搜索钱大妈精选商城，进行下单选购。
绫致集团零售线上小程序2月1日的交易额为141万，2日涨至272万，3日为401万，4日为431万，5日为641万，五天线上交易总额已经超过线下门店交易额的3倍。
梦洁采取了云仓协作、社群运营等形式进行经营。疫情期间，梦洁智慧零售云仓千家齐开，宅家做云生意，日均访客超过50000，商城GMV日均销售超过100万；全员分享纳新，新增用户15万。",2020-02-07 22:26:31,凤凰财经
3,新冠疫苗研发全球竞赛又增一员猛将，葛兰素史克与CEPI展开合作,"近日，英国疫苗巨头葛兰素史克（GSK）宣布将与流行病防范创新联盟（TheCoalitionforEpidemicPreparednessInnovations，CEPI）合作，推进新型冠状病毒疫苗的全球研发。据了解，GSK将提供现有的预防疾病大流行疫苗佐剂平台技术用于加强针对新型冠状病毒有效疫苗的研发。
(image_address=""https://x0.ifengimg.com/ucms/2020_06/2F9CA3B7A161E27F2116AE85B8CBEDC56420CBEA_w1080_h608.jpg"")
图片来源：图虫创意
利用“分子钳”疫苗平台
从GSK披露的信息来看，关于上述新型冠状病毒的疫苗，目前该公司已经与澳大利亚昆士兰大学达成首项协议。2019年1月，该校与CEPI达成合作协议，以开发“分子钳”疫苗平台，旨在使开发针对多种病毒病原的疫苗和加快疫苗生产成为可能。目前，CEPI已经将这项资助拓展至新型冠状病毒候选疫苗的开发工作，并将使用GSK佐剂技术支持这项处于早期阶段的研究。
厦门地区某疫苗研发人员对《国际金融报》记者表示，“佐剂能够增强抗原的免疫原性、应答速度及耐受性，同时可降低抗原的用量，或者达到免疫保护程度所需的接种剂量。因此，在应对疫情的时候，同样剂量的疫苗抗原，加入理想的佐剂后，可产出更多支同样效果的疫苗。”
据悉，针对新型冠状病毒疫苗研发的项目，GSK向昆士兰大学提供的佐剂为该公司独有的AS03佐剂系统。AS03曾用作GSK的H1N1和H5N1大流行性流感疫苗中使用的佐剂，已被证明能诱导更强、更广泛的免疫应答，它可以减少每剂疫苗所需的抗原量，从而在疾病大流行的情况下能生产更多剂量的疫苗。
GSK疫苗首席医学官托马斯&middot;布鲁尔（ThomasBreuer）博士表示，“作为科学和创新领域的领导者，我们相信，我们可以利用创新疫苗佐剂系统，助力抗击疫情。我们的佐剂技术之前已成功地用于应对流感大流行。只需少量的疫苗抗原，就可以生产更多剂量的疫苗，这是应对疾病大流行中的一个至关重要的优势。”
昆士兰大学副校长彼得&middot;霍伊（PeterH&oslash;j）表示，“昆士兰大学的研究团队正在推进新型冠状病毒疫苗项目，GSK佐剂技术将支持我们开展重要的临床前期实验，以评估疫苗的有效性。”
多国正在加速研发疫苗
世界卫生组织对中国新冠肺炎疫情一直十分关注。据联合国网站最新报道，世卫组织总干事谭德塞表示，“尽管病毒的基因序列已经绘制完成，但现在没有预防感染的疫苗，也没有找到对症治疗的方法。坦率地说，我们现在在打‘太极’，我们需要彻底搞清这一病毒的情况，这样我们才能正确地对它加以攻击。”
据了解，国家卫生健康委员会高级别专家组成员、中国工程院院士李兰娟2月3日在接受媒体采访时表示，目前已成功分离到8株新型冠状病毒的毒株，其中有几株非常适合做疫苗，正在紧锣密鼓地开展疫苗研发。
此外，据路透社报道，目前至少有十几家制药公司在争相研发对抗新型冠状病毒的疫苗或其他有效治疗方法。其中，CEPI已向包括Moderna、Inovio、澳大利亚昆士兰大学研究团队等企业或机构各投入900万美元，用于支持新型冠状病毒疫苗的研发。
美国国家过敏症和传染病研究所（NIAID）所长安东尼&middot;福奇（AnthonyFauci）表示，NIAID正在与马萨诸塞州的剑桥生物技术公司Moderna合作开发新型冠状病毒的疫苗。希望在大约3个月的时间内，能够在人体中开始进行早期试验。
但福奇同时警告称，在初步试验之后，可能还需要几个月甚至几年的时间来进行广泛的测试，以证明疫苗安全有效。在最好的情况下，疫苗可能在一年后向公众开放。
相关专家认为，即使加速研发出新病毒疫苗，还需走漫长的临床试验和审批流程，可能难以立刻用于当下疫情防控。因此，目前最有效的方法还是利用公共卫生手段防控疫情蔓延。
来自北卡罗来纳大学教堂山分校全球公共卫生学院的拉尔夫&middot;巴里克（RalphBaric）也表示，新型冠状病毒疫苗的研发可能会比疫情持续时间更久。但这也并不意味着研发疫苗是无意义的，它可以为将来做好准备。",2020-02-07 22:18:55,凤凰财经
4,潘功胜：中国经济高质量增长的基本面没有变化,"2月7日，在国务院应对新型冠状病毒感染的肺炎疫情联防联控机制举行的新闻发布会上，人民银行副行长、外汇局局长潘功胜，银保监会副主席周亮详解支持疫情防控相关金融政策以及缓解小微企业融资难融资贵的有关情况。以下是潘功胜答记者问要点：
要点一：央行流动性供应量增价降有效稳定了市场情绪
1、2月3日和4日超预期开展公开市场操作，累计投放流动性1.7万亿元稳定市场预期。公开市场7天期和14天期逆回购中标利率均较前期下降了10个基点，分别至2.40%和2.55%。2月6日，银行间市场的隔夜回购利率和7天回购利率分别是1.8%和2.3%左右，走势非常平稳。
2、市场预期下次中期借贷便利操作中标利率和2月20日公布的LPR，也有较大的概率下行。
3、LPR调整对商业银行的贷款定价有比较强的指导性和方向性。
要点二：设立3000亿元专项再贷款，精准支持疫情防控工作重点企业
1、为支持打赢疫情防控阻击战，人民银行作出一项特别的政策安排，设立了3000亿元专项再贷款，提供低成本再贷款资金，通过主要的全国性银行和湖北等重点省份的部分地方法人银行，向重点医用物品和生活物资的生产、运输和销售的重点企业提供优惠利率信贷支持。
2、资金投向实行重点企业名单制管理，由国家发改委、工业和信息化部确定重点企业名单，列入名单的企业主要是生产疫情防控的重点医用物资、重点生活物资的重点企业。
3、综合实施低成本贷款利率和财政部贴息政策，确保列入名单的重点企业实际融资成本不高于1.6%。
4、金融机构快速授信、快速放贷。
要点三：股票市场和外汇市场如期正常开市，表明了中国政府坚决维护市场规则的决心和决策层的自信，也说明中国金融市场正在走向成熟
1、股市、汇市经过开市初期的短期波动后，已基本恢复正常运行。金融市场以它特有的方式展现了对中国政府控制疫情、未来经济增长的信心。
2、疫情对中国经济的影响只是暂时性的，我们对未来股市和汇市的平稳运行是有信心的。
3、1月份外汇储备稳中有升。
要点四：疫情影响是暂时的，中国经济高质量增长的基本面没有变化
1、疫情对我国经济的影响是暂时的、阶段性的。疫情得到控制之后，经济会较快回到潜在产出的附近。中国经济具有较强的韧性和强大的潜力，长期向好，高质量增长的基本面没有变化。
2、金融系统为应对疫情而采取的政策措施，得到金融市场及社会各方面的充分肯定，得到了国际货币基金组织、世界银行及国际金融界的高度评价，普遍认为疫情的影响是暂时的、有限的，中国经济将继续展现极强的韧性，中国政府拥有充足的政策空间稳定经济增长。
要点五：缓解小微企业融资问题需要坚持不懈、久久为功
1、缓解小微企业融资问题是一项金融服务实体经济、金融供给侧改革的复杂的系统性工程，需要坚持不懈，久久为功。当前更是我们金融系统的重要工作之一。此前五部委出台的30条措施中，有很多都是针对疫情期间金融支持小微和民营企业的措施。
2、要从政策和实践的层面，培育和塑造金融机构服务小微企业的能力。改革完善货币政策、监管政策、税收政策，完善针对商业银行服务小微企业的政策环境和激励约束机制；引导和鼓励商业银行开展小微企业金融服务能力提升工程，完善内部的资源配置、绩效考评、风险评估、尽职免责、金融科技等政策体系；会同地方政府完善信用信息、风险分担机制建设。
3、广大金融机构（包括银行、保险、证券公司等）讲政治、讲大局，积极行动，主动作为，多家金融机构已经出台多项内部政策措施，帮助缓解小微企业融资问题。
要点六：货币政策将平衡好支持经济增长和稳杠杆的关系
1、近年来，在多种措施的共同作用下，我国宏观杠杆率保持基本稳定，总体杠杆率已经近十个季度保持在250%左右。
2、结构性去杠杆取得良好效果，企业杠杆率水平一直处于下降状态，较2017年底，已经下降5-6个百分点，政府部门、家庭部门杠杆率的增速已经大幅下降。
3、货币政策要综合考虑经济增长、杠杆率、通胀预期、汇率等内外部平衡多重因素，在疫情的背景下，在经济面临下行压力下，保持经济增长更具有重要性。货币政策将认真研判，把握好度，平衡好货币政策支持经济增长和稳杠杆的关系。
要点七：我们的工具箱是充足的，可以有效地对冲疫情的影响
人民银行按照国务院的要求，正在认真分析和评估疫情对我国经济的影响。我国有充足的政策工具应对经济下降的压力，在国际主要经济体中，我国的货币政策仍然是少数处于常态化货币政策的国家。
一是要加大逆周期调节的强度，保持流动性合理充裕，为实体经济提供良好的货币金融环境。
二是要进一步深化利率市场化改革，完善市场报价利率传导机制，提高货币政策的传导效率，降低社会融资成本。
三是继续发挥结构性货币政策工具的作用，如定向降准、再贷款、再贴现等，加大对国民经济重点领域和薄弱环节的支持力度。",2020-02-07 22:16:41,凤凰财经
