,title,content,pub_time,src
7,最新！这两个省，可以有条件地摘口罩了,"安徽省和四川省相继发布消息，在一定情况下，公众可以不佩戴口罩。
安徽：7种情形下可不用佩戴口罩
为科学精准指导公众做好自我防护，安徽省新冠肺炎疫情防控应急综合指挥部16日印发《低风险地区社会公众口罩使用指南》，根据分区分级差异化管理有关要求，提出7种情形之下，公众非必须佩戴口罩。
这7种情形具体为：
1.个人独处、开车时；
2.独自在室外空旷且人员稀少地区；
3.安康码均为绿码且居家家庭成员中均无发热、干咳等异常症状；
4.无发热、干咳等异常症状，且安康码均为绿码的企事业单位工作人员工作时，间隔距离不少于1米，每人占有面积不少于1平方米（特殊行业、岗位除外）；
5.均无发热、干咳等异常症状，且安康码均为绿码的人员开会时，参会人员间隔距离不少于1米，每人占有面积不少于1平方米；
6.空旷地区户外锻炼，且无人员聚集时；
7.年龄极小的婴幼儿不能戴口罩，易引起窒息。
《指南》同时强调，以下13种情形仍然需要佩戴口罩：
1.出现发热、干咳等呼吸道症状的人员；
2.前往医疗机构就诊或探望病人；
3.与有发热、咳嗽等呼吸道症状病人接触；
4.前往机场、火车站、高铁站等人口密集场所；
5.通风不良或密闭工作场所；
6.医疗机构、机场、高铁站、火车站等场所工作人员；7.从事与疫情相关的疾控、警察、保安等人员；
8.实验室从事病原检测人员；
9.乘坐出租车、公交车、地铁等公共交通；
10.前往通风不良的商场、超市购物，前往银行办理业务；11.前往展览馆、美术馆、图书馆、博物馆、理发店、美容院、宾馆等公共场所；12.服务型行业公共场所提供服务的人员；
13.其他需要佩戴口罩的情形。
四川：12种情形下可不用佩戴口罩
今日（17日）14：30，四川省政府新闻办采取网络发布会的形式举行四川省新型冠状病毒肺炎疫情防控工作第15场新闻发布会。发布会上邀请了四川省卫生健康委党组书记、省应对新型冠状病毒感染肺炎疫情应急指挥部副指挥长沈骥，四川商务厅党组成员、副厅长刘祥超，四川省市场监管局党组成员、安全总监吴锐，四川大学华西公共卫生学院教授、成都预防医学会会长、四川省健康管理师协会副会长张建新介绍我省疫情防控工作进展，并回答记者提问。
对于大家感兴趣的问题：什么时候可以取口罩？
(image_address=""https://x0.ifengimg.com/ucms/2020_12/6580F8109BE4869E0B08C0B963DA8BAE3C22F310_w1080_h757.jpg"")
张建新表示，有12种情况可以不佩戴口罩。
(image_address=""https://x0.ifengimg.com/ucms/2020_12/97A2627BBBC923333F6D259B98DA6D0F3B2C7FEF_w1080_h28.jpg"")
第一是在田间地头、森林滩涂、牧场草原等农林牧副渔等户外劳动的时候。
第二是在建筑工地、野外勘探、高空作业等户外人员不密集的这种地方劳动的时候，但是有一些特殊行业需要佩戴，那就需要根据情况来确定了。
第三是在自己的单位，包括公司日常工作，如果员工都没有发热、干咳等异常的症状的时候。
第四是人员固定，并且参会人员都没有发热、干咳等异常症状。
第五是在户外空旷的地方，比如公园、绿道、景区、大街等。
第六是在人员稀少的地方活动，也就是说走路、散步、骑车或者购物等等。
第七是居家并且家庭成员没有发热、干咳等异常症状的时候。
第八是在室内或者室外进行运动的时候。
第九是在个人独处，比如一个人在办公室、实验室，或者在库房。
第十是独自一个人开车。
第十一是和健康的家人、朋友一起乘坐私家车。
第十二是1岁以内的婴幼儿一般不能戴口罩，这样容易引起窒息。
(image_address=""https://x0.ifengimg.com/ucms/2020_12/FF489B44D857D94861155A0AA862B40306A0155D_w1080_h28.jpg"")
对于哪些情况下市民需要佩戴口罩？张建新表示，以下9种情况大家需要佩戴口罩：
(image_address=""https://x0.ifengimg.com/ucms/2020_12/97A2627BBBC923333F6D259B98DA6D0F3B2C7FEF_w1080_h28.jpg"")
第一是出现了发热、干咳等呼吸道症状的人员。
第二是与发热、干咳等呼吸道症状病人接触的时候。
第三是在医疗机构就诊或者去探望病人的时候。
第四是在机场、火车站、高铁站等人员密集的场所。
第五是乘坐出租车、公交车、地铁等公共交通工具。
第六是在密闭和人员密集的商场、超市、银行、理发店、美容院等公共场所。
第七是在医疗机构、餐馆、酒店、机场、火车站等公共场所的工作人员。
第八是从事疫情相关的疾控、警察、保安等人员。
第九是出租车、公交车司机、航空公司乘务员等工作人员。
(image_address=""https://x0.ifengimg.com/ucms/2020_12/FF489B44D857D94861155A0AA862B40306A0155D_w1080_h28.jpg"")",2020-03-17 17:38:15,凤凰财经
8,银保监会力挺！中国金融市场具有稳中向上基础，估值较低！,"近期疫情在全球多国扩散，引起境外主要金融市场波动，也影响了我国金融市场。
对此，银保监会首席风险官兼办公厅主任、新闻发言人肖远企17日详细阐述了他的看法。他指出，国际金融市场波动对我国的影响是短期的，有些影响可对冲。我国金融市场比较健全，具有稳中向上的基础。
他进一步指出，我国金融资产估值较低，股票市场整体市盈率较低，短期是比较好的避险资产，长期是比较好的价值资产。
对于市场关心的不良贷款问题，肖远企指出，银保监会做了压力测试，不良贷款受疫情影响会有所上升，但上升幅度不会太大，对经济造成的风险不大。
我国金融市场具有稳中向上基础
肖远企表示，因为目前信息资讯的发达，国际金融市场波动会导致同步效应，出现“惯性式恐慌”。近期金融市场的动荡，主要是境外市场动荡，我国金融市场出现波动也主要是受外围影响。
他指出，我国金融市场比较健全，具有稳中向上的基础。
其一，疫情防控工作和复工复产在我国稳步推进，生产生活逐步回归常态；
其二，经济基本面长期向好的整体趋势没有改变；
其三，我国金融资产的估值较低，股票市场市盈率较低，短期是比较好的避险资产，长期是比较好的价值资产；
其四，宏观政策工具空间较大，工具比较丰富，财政政策力度和空间大，与境外市场相比货币政策空间较大。
国际金融市场波动对我国影响短期，有些影响可对冲
对于国际金融市场波动与我国金融市场波动之间的关系，肖远企强调：
首先，我国与世界经济依存度较大，国际金融市场波动对我国金融市场的影响肯定是存在的。
目前信息资讯发达，很容易造成全球市场的同步，影响也很容易放大。我国资本市场波动主要还是受外部影响，我们需要分析，哪些影响是实质性的，哪些影响是心理性的，一定要区分开。
从经济看，会从供需两端产生影响。
从需求端看，因为境外疫情扩散，包括境外股市下跌，财富效应缩减，导致消费意愿下降，境外需求减少。如果这种情况持续，我们的出口首当其冲会受到影响。
从供给端看，全球的制造业和物流是相互联系的，如果疫情进一步扩大，肯定影响全球供应链衔接。任何一个国家的某个产业供应能力受到冲击，也会对全球的供应链产生影响。
其次，影响是短期的，有些影响是可以对冲的。
其一，全球经济和金融市场的波动，主要是受疫情的影响。疫情总会过去，不可能一直大规模存在，理性预期2-3个月就会过去，生产生活恢复常态。
其二，我国经济是大国经济，韧性较强，有较完整的制造业体系，有较大的消费市场，经济回旋余地较大。
其三，疫情在我国已经基本得以控制，生产生活逐步回归常态，相比境外主要经济体，我国生产生活恢复正常的速度会快一点，二季度开始我国的出口、生产和消费都会出现回补。
欧美股市震荡有两因素
对于欧美股市大幅震荡，肖远企分析主要有两方面原因：
其一，恐慌性放大。疫情扩散导致投资者信心受到影响、产生波动；财富效应收缩导致出现推迟消费、推迟投资的现象，这就是恐慌推波助澜造成的；
其二，技术性回调。过去十年美国股市经历了较长期的牛市，估值偏高，现在进行技术性回调是正常的。即使没有疫情影响，其他因素也可能造成美国股市回调。
因此，要理性辩证看待境内境外市场波动。
预计不良小幅上升对经济影响不大
因为疫情对实体经济造成了一定冲击，势必对银行不良贷款产生影响。
对此，肖远企称，银保监会对于资产质量问题也高度关注，在密切跟踪、分析和判断，也做了压力测试，银行业不良贷款整体是可控的，无须过于担心。
其一，不良贷款受疫情影响会有所上升，数据显示，2月份不良贷款已经上升了0.05个百分点。而且，2月份受疫情影响还未明显地表现出来，未来几个月影响会逐渐释放。
从2月份上升的不良贷款结构可以看出，主要是信用卡贷款和个人住房抵押贷款上升较快，关注类贷款有所上升。今后，不良贷款还会继续有所上升，对此要有客观预测和分析。
其二，要具体分析，目前上升的不良贷款和未来可能还要上升的不良贷款，哪些是因为疫情因素造成的，哪些是即使没有疫情影响也会产生的，对此要加以区分。
其三，不良贷款虽然会逐步释放，但是疫情影响毕竟是短期的，预计不良贷款小幅上升，上升幅度不会太大，对经济造成的风险不大。目前看，绝大部分企业的不良贷款确实是因为疫情因素，随着疫情好转，企业会恢复正常，甚至有些企业还会有“先发优势”，在全球供应链环境中抓住机会产生更好的经济效应。
其四，宏观政策对于不良上升有对冲措施，比如对小微企业进一步减税降费；比如定向降准、增加再贷款等；再比如贷款本息延期支付，避免资金链断裂中断企业生产经营；再比如增加市场流动性等。
其五，目前银行业不良贷款余额约3.3万亿元，而我国银行体系的拨备有6万亿元，也就是说，1块钱的不良贷款约有2块钱的拨备。每年银行还有2万亿-3万亿元的净利润，因此银行抵御风险的能力很充足。
其六，即使国际金融市场波动，但是可以看到，国际包括中国的金融体系是比较稳定的。2008年国际金融危机以后，各国完善监管体系，国际金融体系整体稳健，因此这是目前与2008年金融危机有本质区别之处。",2020-03-17 17:38:09,凤凰财经
9,证监会：农夫山泉境外IPO审批于3月17日接收材料,e公司讯，3月17日消息，证监会公告，农夫山泉境外IPO审批于3月17日接收材料。,2020-03-17 17:32:22,凤凰财经
10,逃疫德国：从柏林到深圳，我的27小时漫漫回家路,"(image_address=""https://x0.ifengimg.com/ucms/2020_12/897DDF0BCA99ECD183DF336A7543503124FCDB0E_w540_h350.jpg"")
如果核酸检测没有问题，今天（17日）是Kira结束隔离回家的日子。
Kira是一家原创设计师女装品牌创业者，北京时间3月13日晚上6点左右，她启程从德国柏林出发，经莫斯科中转、广州换乘大巴，3月14日晚上9点到达了深圳的隔离酒店。在深圳隔离期间，Kira接受了中新经纬记者采访，讲述了她从柏林到深圳27小时的所见所闻和经历。
文|常涛实习生郎竞宁
3月16日，德国累计确诊人数突破5000，德国政府随即采取了关闭边境的措施。但据Kira讲述，3月13日她离开柏林时，当地居民和平时并无二异，超市也完全没有出现抢购商品情况。在莫斯科机场转机时，Kira见到了非常多穿着防护服的中国乘客，“非常非常夸张”。
3月14日早上9点半，Kira到达了广州机场，在经历了严格的防控措施后，她做了核酸检测。“又经历的漫长等待，我终于坐上了前往深圳的大巴。等待核酸检测结果的这几天，我要隔离，期间费用由政府承担。虽然回程很折腾，但我还是想说，回家的感觉真好！”
以下为Kira自述（略有编辑）：
由于工作原因，1月22日我就已经到达法国了，当时国内尤其湖北地区，已经开始针对疫情采取防控措施。进入2月份，我发现预定民宿越来越困难，因为我网站注册信息是中国籍，所以遭到了很多房东的拒绝，这让我比较困扰，但说实话我也很理解。
后来，我觉得在欧洲跑来跑去也不安全，最后选择留在了德国。其实我原本打算2月底就回国，当时我还问朋友，要不要和我一起，朋友一直说没事的，不着急，3月底再回去吧。但我感觉德国的情况也不太妥，疫情比预想中发展要快。
012月中旬，我在德国参加了狂欢节
我所在的地方是德国南部的巴伐利亚州，2月中旬的时候，这里还没出现新冠肺炎感染病例。当时，我还参加了当地的狂欢节，但考虑到国内疫情比较严重，我没有把照片发到朋友圈。到了2月底，我所在的城市出现了第一例确诊病例，当时我决定去往柏林，因为当时柏林还没有确诊病例。
在柏林呆了一段时间后，我心里还是不踏实，便决定回国。我原本计划是3月7日飞香港，但由于一些原因，后来我改签到3月13日飞广州。
我离开柏林的时候，柏林已经确诊了100多例。但这里居民的生活和平常并无二异，超市也没有出现抢购商品情况。我注意到，有些中年女性可能会有意拉开排队等候的距离，但年轻姑娘们完全不在意这个。
在火车站，我和当地人聊天。我其实很不好意思说我来自中国，我怕对方会介意。但他们又很热情，得知我是中国人后，他们开玩笑地问我是不是从武汉过来的。我说怎么可能，武汉已经封城了，那里是最严格的防控措施。他们说没关系，我们又很开心地聊了很久。
从在柏林机场安检开始，我就一直戴着口罩，我发现戴口罩的大部分都是中国面孔，外国人戴口罩的特别少。在柏林机场，没有体温检测，抵达莫斯科后，我才接受了第一次体温检测，显示飞机上没有体温异常的乘客。
在莫斯科机场，我见到了非常多穿着防护服的中国乘客，我刚开始还以为是工作人员，后来发现只是乘客，确实非常夸张。
从莫斯科飞往广州的飞机是满员的，10个小时左右的飞行时间里，我大概睡了2个小时。当飞机早上9点半到达广州机场的时候，我脑海中闪过的第一个念头就是：终于到家了！
02做核酸检测的“奇妙”体验
广州机场的防控措施非常严格。乘客下飞机的时候需要叫号，5、6人分成一组。由于我坐在第二排的位置，所以很快就轮到我了。说是很快，但其实我已经在机上等了一个半小时。
但这只是漫长等待的一个开端。不仅下飞机需要等，从飞机走到候机厅、从候机厅走到核酸检测区、做核酸检测、出海关取行李以及坐从广州开往深圳的大巴车，均需要等。
(image_address=""https://x0.ifengimg.com/ucms/2020_12/BB9F6837B8457A9257131D42880AE79A954D80CE_w540_h800.jpg"")
▲在广州机场登记受访者供图
核酸检测取样真的太辛苦了。取样时，棉签会很深地怼到你的喉咙里，而且要连续怼四、五次。因为不舒服所以就会不受控制地干咳，生理上也会不自觉地推开工作人员，就这样和工作人员相互拉扯了好久，我放弃了抵抗，把身体抵在凳子上，把采样做完了。同时，我也做了鼻拭子。实际上，后来我回深圳又做了一次咽拭子，明显比第一次顺利多了。做完核酸检测取样后，我领到一张“卫生检疫放行条”。工作人员告诉我，如果三天后没有接到通知，就说明是安全的；如果接到通知，那可能说明你有问题。其实核酸检测最快6个小时就能出结果，但因为做的人太多了，所以只能排队。出海关的时候，会有人取走你的“卫生检疫放行条”，并会询问你去哪里。所有国际航班的乘客都不能自行回家，而是要到一个指定大厅等待。我说我要去深圳，就听工作人员高喊“深圳的一个！”。然后我的护照上就被贴上了一个红点，被带到另一位置等待大巴。此时离我下机已经过去了4个小时。周围乘客脸上疲态尽显，但大家都一直很安静听从指挥，没有什么怨言。下午两点多，大巴车终于来了。上车前，我们又做了一轮登记和消毒，同时工作人员要求我们一排只坐一个人。就这样又在车上等了两个小时，下午四点多，大巴终于发车了。大巴车上有免费的面包和水，我从飞机上下来之后，就一直没有吃饭喝水，感觉很饿，就吃了很多面包。此后，就迷迷糊糊睡着了。
(image_address=""https://x0.ifengimg.com/ucms/2020_12/E24CFE2EF2A2EEEDAAE85EB6C2BB7BCF7F0F0EF7_w540_h720.jpg"")
▲在深圳等待去往隔离酒店的班车受访者供图等我醒来时，大巴已经到达了深圳市南山区，此时已经晚上6点多了。我看到有一群穿着防护服的工作人员在等待我们。我们下了大巴，大概又等了一个半小时，上了前往隔离酒店的商务车。
03
在酒店隔离的生活
在酒店隔离，除了不能擅自出门行动外，别的一切都非常好。隔离期间的费用由政府出，每天要测两次体温，每间房外会放一个小凳子，用来放食物、水等。早上8点、中午12点和晚6点会准时有人送餐，工作人员告诉我，如果吃不惯这里的饭菜，可以自己点外卖，工作人员会帮忙取送。这里的服务很贴心，除了饭菜，他们还给我送来了纸巾、塑料袋、牙膏之类的生活用品。有任何需要帮忙的，都可以打前台电话，工作人员会全副武装的上来帮你。
(image_address=""https://x0.ifengimg.com/ucms/2020_12/31A165E2A07DF60840B2E7FE2DA12BE96FEB0164_w540_h739.jpg"")
▲隔离酒店提供的餐食受访者供图
我是独居，因此如果核酸检测没问题的话，今天（17日）就能回家自我隔离了。那些没有条件独居的人，还需要在酒店继续隔离满14天。最近两天我接到了来自街道社区很多电话，他们询问我具体的回家时间，等检测结果出来以后，他们会派人来接我回家。
你认为留学生应该回国“避疫”吗？需要注意什么？请在评论区留下你的观点。封面、导语图为莫斯科机场身穿防护服的中国乘客，受访者供图标题责编：常涛孙庆阳董文博",2020-03-17 17:32:06,凤凰财经
