,title,content,pub_time,src
5,从今天起，陆港两地投资者可通过这四只ETF互相投资,"内地与香港ETF互联互通迎来历史性一刻！
10月23日，深港ETF互通开通仪式举行，首批4只互通产品挂牌上市，深港ETF互通正式落地实施。
首批互通产品中，嘉实恒生中国企业ETF、银华工银南方东英标普中国新经济行业ETF在深交所挂牌上市；恒生嘉实沪深300指数ETF、南方东英银华中证5G通信主题ETF在港交所挂牌上市。
投资香港ETF的新渠道
对于内地基金投资者而言，嘉实恒生中国企业ETF、银华工银南方东英标普中国新经济行业ETF在深交所挂牌上市，意味着又多了一个投资香港ETF的渠道。
8月28日晚间，中国证监会发布公告称，准予2只深港ETF互通产品注册，产品由境内基金管理人在境内设立，采取合格境内机构投资者（QDII）模式，将不低于90%的基金净资产投资于香港单只目标ETF。
它们分别跟踪恒生中国企业指数、标普新中国行业指数市场表现，基金份额在深圳证券交易所上市交易。
中国证监会公告未提及这两只产品的具体名称，不过当时媒体报道称，银华基金及嘉实基金7月22日分别上报了恒生中国企业ETF（QDII)、工银南方东英标普中国新经济行业ETF（QDII）两只基金，它们就是此次获批参与深港ETF互通的产品。
其中，银华工银南方东英标普中国新经济行业ETF将投资于南方东英资产发行的工银南方东英标普中国新经济行业ETF（基金代码：3167.HK），嘉实恒生中国企业ETF将投资于恒生投资发行的恒生中国企业ETF（基金代码:2828.HK）。
从对应的指数标的来看，恒生中国企业指数是由恒生指数公司编制，于1994年8月8日推出，该指数成份股范围包括在联交所主板作第一上市的H股、红筹股及P股公司。在今年市场震荡中，截至目前恒生国企指数年内下跌9.6%。
南方东英标普中国新经济行业ETF跟踪标的指数为标普新中国行业指数，它旨在衡量在内地和香港注册成立的消费和服务行业公司的表现，年内涨约33.6%。它的前十大成分股为阿里巴巴、腾讯、贵州茅台、美团、AIA集团、京东、平安保险、五粮液、美的以及恒瑞医药。
(image_address=""https://x0.ifengimg.com/ucms/2020_43/D2F0ECA4B05E791734B063E82DE2BBE3A36E5006_w566_h504.png"")
截至早盘收盘，嘉实恒生中国企业ETF上涨0.6%，银华工银南方东英标普中国新经济行业ETF下跌1.2%。
(image_address=""https://x0.ifengimg.com/ucms/2020_43/1A6FDE2ED63A96188BD84B7AEB7762A45DBDF3F4_w1091_h718.png"")
(image_address=""https://x0.ifengimg.com/ucms/2020_43/55FB5EFB49A4328A3D68C5C1C24CF7F5C530F262_w1113_h719.png"")
境外投资者能买到纯正的A股ETF了
对于境外投资者来说，深港ETF互通正式落地实施意味着，他们终于可以买到纯正的A股ETF了。
同在8月28日，香港证监会也发布公告，认可了两只在香港与内地交易所买卖基金（ETF）互挂计划下的ETF在香港联交所上市。这两只ETF将分别投资于一只获中国证监会批准且目前在深交所上市的ETF。
这一公告同样未说明这两只ETF的名称，不过现在看来，它们正是恒生嘉实沪深300指数ETF与南方东英银华中证5G通信主题ETF。
从跟踪指数来看，恒生嘉实沪深300指数ETF跟踪的是沪深300指数，截至目前，该指数年内涨近17%。
(image_address=""https://x0.ifengimg.com/ucms/2020_43/C0D1A26153A5892DB2AA5E906F60890A6E159E9B_w1113_h603.png"")
南方东英银华中证5G通信主题ETF跟踪的则是5G通信指数（931079.CSI），截至目前年内涨幅约21%。
(image_address=""https://x0.ifengimg.com/ucms/2020_43/25784DA2CC3F2DEC8E6337062BCB2D1DB557AAC2_w1346_h613.png"")
深港ETF互通落地实施也引发海外市场的高度关注，彭博行业研究(BloombergIntelligence)分析师SharnieWong表示，“这意味着（深港）ETF互通的开始。”
对于海外投资者来说，值得他们兴奋的地方在于，尽管在香港、伦敦以及纽约的市场本来已经存在跟踪A股市场的ETF，但是由于受到外资持股比例的限制，这个跟踪误差很大，有时甚至能达到15%。
这种跟踪误差意味着什么？去年底资深基金研究专家王群航在接受21世纪经济报道采访时的评论给了很好的参考：
评价ETF优劣最重要的一个指标就是跟踪误差，一般来说ETF与其跟踪指数的日误差不宜超过0.2%，年化累计不宜超过2%，大幅偏离显然是不可取的。其次ETF要有良好的流动性。
根据统计，按照过去一年来计算(2018年12月11日至2019年12月10日)，与区间业绩比较基准出现负偏差的ETF有90只，其中偏差幅度超过5%的ETF有10只，超过10%的ETF有1只。
按照目前的监管要求，在A股市场中，外资持有上市公司股票的比例上限为30%，当外资持股比例触及28%之后，港交所不再接受买盘，随后外资处于只卖不买的状态。
而如果直接投资这两只互通ETF则不会存在这种问题，这是因为它们的发行人内地机构，不会存在对A股持股比例限制的问题。",2020-10-23 12:15:24,凤凰财经
6,理财新规后1523款理财产品提前终止 保本理财即将消失投资者何去何从？,"多家银行纷纷提前终止理财产品，对于投资者而言，有些始料未及。
数据显示，今年以来，银行提前终止未到期的理财产品数量达785款。业界分析，这主要是资管新规与银行内部压力所致。根据理财产品合同规定，银行确实有权提前终止理财产品，但在这种情况下，投资者该如何应对？
何以至此？
事实上，银行提前终止未到期的理财产品并非今年特例，早在2018年便已初现。
普益标准统计数据显示，自2018年初至2020年10月22日，银行理财市场共有1618款产品提前终止运作。这部分产品有1523款是在理财新规发布之后终止的，占比高达94.13%；今年以来提前终止运作的产品有785款，占比为48.52%。
2019年起，银行就开始加速清退部分存量理财，涉及622只产品，较2018年大幅增加。
普益标准研究员于康对21世纪经济报道记者表示，资管新规、理财新规打破刚兑的要求，是商业银行提前终止部分理财产品运作的主要原因。
“资管新规、理财新规发布以后，要求银行理财产品实施净值化管理运作，随着转型过渡期的临近，银行加快了传统不合规老产品的清退。”于康表示，“此外，存续老产品定价较高，大多仍存在‘刚性兑付’压力。而当前市场利率维持较低水平，资金成本较低，新增投资品收益下行，容易出现成本与收益倒挂。因此，出于资金成本控制考虑，部分银行适时采取了终止高收益产品的运作方案。”
一位银行相关工作人员告诉21世纪经济报道记者，提前终止理财产品主要是因为资管新规的影响，及同业间市场被严管。“资管新规打破刚性兑付，而同业间借贷利率提高，低风险的借贷明显减少，由此加大银行压力。”
为有效防范和控制金融风险，央行于2018年4月发布《关于规范金融机构资产管理业务的指导意见》，即资管新规。
资管新规要求理财产品净值化转型，并严格约束理财产品投资非标资产。一些早期发行且原存续期较长的旧产品，无法在过渡期结束时自动到期，届时将不符合监管要求，因此银行只能在适当时间主动停止这类产品的运作。
一位银行理财工作人员告诉记者：“我们银行很早就着手准备停了，也都是老产品到期之后不再续。”
“比如一些保本的理财产品这个月到期后，我们就不再卖了。”上述工作人员说，“资管新规在2018年就已出台，银行对此早有准备。我们本计划今年初开始停售保本理财，但受疫情影响才延期半年。”
21世纪经济报道记者询问的多位负责银行理财产品的人士都认为，现在是利率（无风险利率或LPR）下行期，而且很可能会如美国一般长期保持低利率，银行内成本压力的确存在。
“由于资管新规打破刚性兑付，一些净值型理财产品受影响更为明显，有些甚至出现亏损。银行此前配置非标资产占比大，如银行同业间借贷，而处置这些资产和重新调整配置比例需要一定时间，在疫情叠加影响下，银行处置这些资产时压力更大。”上述工作人员说。
所谓打破刚性兑付，即金融机构开展资产管理业务时不得承诺保本保收益，出现兑付困难时，金融机构不得以任何形式垫资兑付也不得在表内开展资产管理业务。
资管新规还要求，理财产品中配置非标比例不能过高，这样一来，如果银行不能及时调整好其资产配置，理财产品也无法问世。
如何应对？
在被问及银行资金压力到底有多大时，上述工作人员表示，虽然她所在银行没有提前终止理财产品，但一些最近到期的净值型理财没有达到当时的预期收益，即没达到业绩比较基准。
“我们从2018年就开始减少保本理财，去年开始不再体现保本理财这个概念。”她补充说，“实际上保本理财额度一直不断降低，但还是存在少数产品。比如一款理财120天的产品，每周额度不到1分钟就被抢完。抢不到的只能买净值型理财，算是一种引导投资者改变投资观念的方式。”
今年以来，银行普遍开始加快清退非净值型理财产品的步伐，当前银行理财产品净值化转型进度过半，转型积极性较高。
据普益标准调研统计，截至2020年6月末，净值型理财产品存续规模约为13.24万亿元，同比增长67%，占全部理财产品存续余额的53.82%，银行理财产品净值化转型进度过半。
21世纪经济报道记者注意到，在随机选择的多份理财产品协议里，均提及银行有权提前终止理财产品。
如某款理财产品说明书第八条《理财产品不成立及提前终止》显示，在理财产品存续期间，如出现包括但不限于以下情形，银行有权但无义务根据其自身的合理判断提前终止本理财产品。
情形包括：国家政策出现重大调整并影响到本理财产品的正常运作；市场收益大幅波动、投资标的发生风险或因其他原因，并有可能或实质性影响到产品所能实现的投资收益；本产品所投资的资产提前终止，及其他银行认为应当提前终止理财产品的情形。
而资管新规包括在国家金融政策调整作为理财产品提前终止类目中。在这种情况下，银行与投资者应如何应对？
在于康看来，当前资管新规过渡期已延长至2021年底，过渡期延长后，商业银行首先应对存续老产品进行整改规范，没必要提前终止产品运作损害自身声誉。对于过渡期内确实无法完成整改的，商业银行应与投资者进行充分沟通、协商解决。另外，也可协助客户选购替代产品以承接到期资金，尽可能避免客户损失。
“对于购买了老产品的投资者，应当明晰所持有产品的合同条款，密切关注产品公告，了解产品整改动向，合规整改的，应及时根据资金情况调整资产配置方案。”于康补充道，“同时，投资者也应该了解所持有老产品提前终止运作的触发条件，对于管理人不合规整改的，可拿起法律武器维护自身权益。”
一位法律相关人士对21世纪经济报道记者指出，关于银行理财产品被提前终止，银行是否有权提前终止，要看具体协议约定。且银行提前终止的原因为资管新规出台，打破刚性兑付，也可以说是受政策调整的影响，在这种情况下，银行提前终止合同有其合理性。对于投资者而言，抛开不能继续收到此后的收益外，若本金、已到期利息可收回，投资风险并没有增大。",2020-10-23 12:09:55,凤凰财经
