,title,content,pub_time,src
0,港交所财报前瞻：营运利润预计较大增长 估值水平处于历史高位,"2020年8月19日，香港交易所将披露中期财务报告并将于2020年8月19日16:30-17:15举办「香港交易所2020年中期业绩传媒简布会」，而在2020年，香港交易所年涨跌幅高达51.19%，其中港交所一季度报因疫情影响，总收入40亿港元，同比下滑7%；归母净利润22.6亿港元，同比下滑13%。
然而，整个二季度，香港交易所股价涨幅高达41.15%，是否意味着市场先知先觉，还是港交所可能不及预期？
一、交易量的变化
从全球视角来看，资产的流动性就越好，资产能获得流动性溢价，企业也更愿意在交易所上市，那么交易所的核心竞争位在于：
1、成交量；谁拥有更多不错的上市公司，谁便能拥有更多交易量；
2、交易产品丰富程度。交易量越大。交易所每开发出一款新的衍生产品，一般都需要时间来证明其前景，并把其交易量积累到较高量级，至此才能在该产品上拥有较高的护城河，因为此时竞争对手即使开发了类似的产品，也难以获取交易量，因为赢者已经出现通吃。
以恒生指数为例，整个恒生指数在2020年二季度涨幅虽然仅为3.48%，可2020年二季度的成交量总额高达68258亿港元，而正2019年二季度，恒生指数成交量总额为55759亿港元、同比增幅22.42%，恒生指数的成交量大幅度上升与同期内地市场的火爆密切相关(紫色线条为沪深300指数)。
由于2020年二季度，内地资本市场迅速走牛后，港股市场和内地市场的估值水平出现了一定程度的估值差距，大量内地资本蜂拥进入香港市场，促进了整个港股的交易活跃度，并且，随着京东、网易等中概股的回归，亦大量促进了港股市场的繁荣。
(image_address=""https://x0.ifengimg.com/ucms/2020_34/6AB2B349040756200C84900CA2BC2374F6D113AC_w556_h281.jpg"")
在具体的收入科目方面，香港交易所集团的收入分为6个部分，分别是现货分部、股本证券及金融衍生产品分部、商品分部、交易后分部、科技分部和公司项目部分，其中主要收入来源与市场的交易活跃度和波动性高度相关，当市场日趋火爆时，相关的费用收入将持续增加，由于交投活跃，IPO发行情况也将乐观。
二、投资收益
港交所不可忽视的一部分利润来源于投资收益，通常占港交所净利润的15%，属于易被忽视却对当期利润影响较为重要的收益，而港交所的投资本来大多来源于「保证金」，随着港交所业务体量的增大，港交所的保证金也会随着增加，不过，2019年的保证金金额却相对2018年有所下降，主要是由于波幅缩窄令每张合约的保证金要求减少，LMEClear、期货结算公司及联交所期权结算所保证金平均金额下降，而很明显的是，2020年二季度，由于市场波动在加大，整体的「平均资金金额」将显著提升，这也将提供投资本金。
(image_address=""https://x0.ifengimg.com/ucms/2020_34/C1F56D4D1962FC4FEE303B547673261A6BD6E9BD_w600_h538.jpg"")
港交所主要投资对象不是股票、期货等波动率非常大的投资品种，而是主要来源于「存款」收益，那么利率环境将显得至关重要，从下图中能看出，由于疫情影响，全球降息日趋严重，香港的隔夜拆借利率在迅速下降。
(image_address=""https://x0.ifengimg.com/ucms/2020_34/05293029B2FBDF3479276179AAD306C958275D5E_w600_h321.jpg"")
根据悉尼&middot;霍默于1963年出版的《利率史》，利率的波动和国家政治经济发展的大背景有关，古巴比伦、希腊、罗马这三大古国都表现出从最早历史时期利率较高，随着民族发展和经济兴旺，利率开始下降，又在社会稳定性降低的阶段利率上升。2020年二季度，香港资本市场的利率明显下滑，这将使得港交所的投资净收益有所下滑，不过随着疫情好转，利率未来日趋上行概率将加大，港交所的投资收益仍然将扭转。
综合来看，可预期的是，整个二季度，港交所的营运利润将有不错的表现，然而投资收益将拖累整个利润表，由于市场牛熊转化本身即为强周期性，若以PB进行估值定价，香港交易所的PB水平目前处于历史高水位线，投资者是否在关注当期业绩的前提下，更应该注重估值的风险呢？
(image_address=""https://x0.ifengimg.com/ucms/2020_34/4AFA4534F0E5358C0201C96323F361F487E9B5D4_w600_h208.jpg"")
文章来源：富途资讯",2020-08-19 11:56:06,凤凰财经
1,国内大咖共话中国经济新格局 微博话题讨论超1亿,"WEMONEY研究室讯8月12日，“中国经济新格局：乘风破浪2020年新京报贝壳财经夏季峰会”结束一周的会期，近50位国内外大咖、7天12场高规格直播对话，共创下累计3亿观看量。
在峰会上，玻璃大王曹德旺与著名经济学家余永定就财政与货币政策进行了辩论，讨论中美关系的现状与未来。在谈及“政府投资”问题时，余永定认为，想要让2020年的经济达到2.5%增速，投资需求应有较大增长，通过加强基础投资，可以带动上下游一系列需求和投资。曹德旺则认为，即使没有此次疫情，中国经济也有必要结构调整，不应再进行大规模无效基建投资。双方认为：投资的关键在于有效，要投向影响中国发展瓶颈的地方。
“这是自二战以来（世界经济）最大的萧条和衰退，而且现在还没有结束。”2018年诺贝尔经济学奖得主保罗&middot;罗默在峰会上表示，抗疫是中国完全超越美国的时刻，而2020年是中国政治体制比美国更高效的一年。在与保罗&middot;罗默谈及“世界大变局下的中国选择”时，著名经济学家、清华大学中国经济思想与实践研究院院长李稻葵认为，中国已经有能力精准应对疫情的偶然复发，同时努力让经济和社会活动重回正轨，目前关键在于“如何恢复与世界上其他国家的联系”。
黄奇帆、朱光耀、金刻羽、米歇尔&middot;沃克围绕“如何构建国内国际双循环新发展格局”展开探讨。
原重庆市市长、十二届全国人大财经委副委员长黄奇帆认为，加快形成双循环格局已经成为谋划中国经济下一程的重点内容；原财政部副部长朱光耀称，以国内大循环为主体，绝不是要封闭运行，而要有效利用国内、国际两个资源两个市场，把经济发展好；伦敦政治经济学院终身教授、哈佛大学经济学博士金刻羽表示，中国发展双循环格局，传递出拥抱全球化、不希望脱钩的信号；畅销书《灰犀牛》作者米歇尔&middot;沃克认为，危机时刻，各国之间的合作比以往任何时候都重要，“不幸的是，美国‘呼声最高的论调’没有意识到这一点。”
此次峰会的几大热点主题，在新浪微博平台“引爆”的话题讨论总数据已超1亿。
新京报总编辑李海表示，突如其来的疫情使全球大部分国家的经济都受到不同程度的影响，在疫情防控常态化与国际形势日趋复杂的大背景之下，中国的选择和世界的选择，尤其关键。值此关键节点，“中国经济新格局：乘风破浪2020年新京报贝壳财经夏季峰会”提供了更多思辨的空间。（WEMONEY研究室林小林/编辑）",2020-08-19 11:55:00,凤凰财经
2,特斯拉回应“武汉车主交付”：拼多多炮制假新闻,"被交付的车辆早在之前就被下了订单。
8月19日，针对“拼多多武汉消费者成功提车”一事，特斯拉方面回应称是“对方自导自演制造新闻”。
8月18日，拼多多方面发布消息称，被特斯拉拒绝交付的消费者成功提车，并已为车辆上了保险。不少媒体跟进了此进展，网络上还有不少报道以图文形式展示了车主提车的交付过程。
特斯拉方面在线辟谣，相关员工表示“今天（8月18日）晚上9点15分到9点30分我们还在和拼多多事件中的武汉客户沟通他买车的事情，可是8点多就全网都在报道他提车的消息了。赤裸裸的假新闻！”
21世纪经济报道记者从相关人士处了解到，该车辆并非在武汉交付，而是在长沙交付，后来被拉到武汉去了。并且，相关人士表示，新闻中参与车辆交付流程的工作人员也并非特斯拉员工，照片疑似“摆拍”。
特斯拉也公开发布声明称，在相关报道中，使用的拖车、签字文件以及交付操作流程均不符合特斯拉交付规范，非特斯拉正常流程。
“我们对这种通过自导自演制造新闻，恶意误导舆论的做法表示强烈愤慨，并奉劝相关方遵守基本的商业道德底线，停止为了自身利益玩弄公众舆论和消费大众情绪。”特斯拉表示，将保留追究相关方法律责任的权利。
交付事件疑点重重。
其一，根据当事消费者的说法，自己被拒交之后，以家人名义重新在官网下了一单，宜买车和拼多多帮他垫付了费用，这才提车成功。然而据特斯拉查证，这个被交付的车辆早在之前就被下了订单。
特斯拉在声明中称，交付数据显示，本次提车车辆于7月28日在官网下单，而特斯拉取消武汉车主订单的时间为8月14日，与车主描述的因被拉黑而使用家人名义下单的说法不符。
从交付流程上看，后续动作也不可能这么快完成。“如果真如武汉车主所说，8月18日用家人名义购买，就更不对了。特斯拉全部采用订单制，从下单到交付一般需要2周时间，他是如何做到一天之内下单并提车的？？”特斯拉方面发布的材料显示。
其二，车主8月18日提车拍照、与特斯拉人员沟通、接受媒体采访的时间线也和说辞也不一致。
8月18日晚8点左右，网络上出现“武汉车主成功提车”相关报道，并附上了武汉车主本人照片。而晚9点武汉车主又到达酒店与特斯拉工作人员沟通。有质疑称，如果武汉车主真完成了提车，为什么要继续与特斯拉人员商谈买车事宜？
另外，据与武汉车主沟通的特斯拉人员表示，在沟通过程中，武汉车主表示可以再下单，但是始终要通过拼多多渠道。特斯拉方面并不理解，公司并没有所谓“黑名单”，在其官网重新下单可以提供时间和经济补偿的情况下，车主为何还要坚持在拼多多下单。
截至发稿，拼多多方面并未对特斯拉的声明发表回应。（作者：彭苏平）",2020-08-19 11:00:37,凤凰财经
