,title,content,pub_time,src
2,20万股东请注意：面值退市警钟再度敲响！5股股价已低于面值,"原标题：20万股东请注意！面值退市警钟再度敲响，5股股价已低于面值，1元股阵营也大扩容（名单）
数据显示，截至4月21日收盘，*ST欧浦、*ST刚泰、*ST飞马、天广中茂等4股收盘价低于面值，其中，“低面”天数最高的天广中茂已经有9天，距离20天的退市红线还有11天自救的时间。而*ST欧浦、*ST刚泰、*ST飞马等3股“低面”天数分别为4天、6天、3天。
B股方面，东沣B也面临着“面退风险”。公司今日晚间发布“可能将被终止上市的第一次风险提示性公告”。公告指出，东沣B股票已经连续10个交易日(自2020年4月8日至4月21日)收盘价格均低于每股1元人民币面值。公司股票可能将被终止上市。
此外，疫情叠加海外股市波动，市场风险偏好、活跃度双双降低，A股的低价股数量也在不断攀升，截至目前，“1元股”数量高达74只、“2元股”的数量更多达196只。
面值退市恐将成为A股群主踢人的最大“杀器”。
01
警钟再敲响，东沣B公告面退风险
上周一，ST锐电收盘跌停，报0.65元，连续20个交易日股价低于1元，触发“面值退市”规则，将成为A股第8只面退股，同时也将成为2020年面值退市第一股。
ST锐电退市流程尚未走完，A股面退的警钟再度敲响，时报君发现，截至目前，*ST欧浦、*ST刚泰、*ST飞马、天广中茂等4股股价已经连续多天低于1元。
而局面更紧迫的上市公司则是B股板块的东沣B。公司今日晚间发布“可能将被终止上市的第一次风险提示性公告”。公告指出，东沣B股票已经连续10个交易日(自2020年4月8日至4月21日)收盘价格均低于每股1元人民币面值。公司股票可能将被终止上市。东沣B目前股价仅为0.74港元，按汇率折算后则为人民币0.68元，已经大幅低于1元的面值。
(image_address=""https://x0.ifengimg.com/ucms/2020_17/3B66F06C08F9A0475FC4CACD1C6F555D3E742F84_w612_h443.png"")
根据“面值退市”规则，上市公司A股或B股股票连续20个交易日（不含停牌交易日）每日收盘价均低于面值（我国A股及B股股票绝大多数面值为1元），将终止上市。AB股同时存在者则以同时满足前述条件触及面退标准。
事实上，早在4月1日，东沣B即因股价连续10日低于面值，首次发布退市风险公告，随后更连跌3个交易日，至4月7日才勉强回到面值。而且也仅仅保持了一天，就重新迈入下跌通道。
(image_address=""https://x0.ifengimg.com/ucms/2020_17/1AAB21CF2F9217A3B8AC019802CC24D0A8C90189_w558_h326.png"")
A股则以天广中茂处境最为危险，其最新收盘价为0.94元。自4月9日收盘价跌至1元下方后，截至21日，天广中茂已经连续9个交易日收盘价低于1元，这也意味着其距离20天的退市红线仅剩11天。
(image_address=""https://x0.ifengimg.com/ucms/2020_17/7AB2BDE6970C8D50454B09C200FE82CD50C58EB7_w558_h374.png"")
实际上，这已经是天广中茂年内第二轮股价在1元下方徘徊。3月30日，天广中茂当日大跌9.65%，收报0.95元，历史收盘价首次跌破1元。其后，股价在1元下方徘徊了3天。4月2日，公司股价涨停，收盘恰好涨至1元。不过好景不长，仅仅维持数日后，公司股价再度跌至1元下方。
另外，A股的*ST欧浦、*ST刚泰、*ST飞马等3只ST股连续“低面”天数分别为4天、6天、3天。
最新数据显示，上述5家公司合计股东户数为196957人。
02
祸不单行，*ST刚泰和*ST飞马存多项风险
时报君发现，*ST刚泰、*ST飞马不但面临“面退”风险，还可能触及暂停上市。
其中，*ST刚泰因2018年年报被出具“无法表示意见的审计报告”被实施退市风险警示的特别处理，若公司2019年度财务报告仍被会计师事务所出具无法表示意见或否定意见的审计报告，公司股票交易将可能被暂停上市。
资料显示，公司2019年年度报告的预约披露日期为2020年4月29日。
*ST飞马则因涉嫌信息披露违法违规，公司目前正在被中国证监会立案调查。根据《深圳证券交易所股票上市规则》的有关规定，如公司存在重大违法行为，公司股票可能被深圳证券交易所实施退市风险警示并暂停上市。
根据相关规定，如公司因此受到中国证监会的行政处罚，且违法行为属于《深圳证券交易所上市公司重大违法强制退市实施办法》规定的重大违法强制退市情形的，公司股票交易将被实行退市风险警示，实行退市风险警示三十个交易日期限届满后次一交易日，公司股票将被停牌，深圳证券交易所在停牌后的十五个交易日内作出是否暂停公司股票上市的决定，并在公司股票暂停上市起六个月期限满后的十五个交易日内作出是否终止上市的决定。
03
A股1元股大增
春节后，疫情叠加海外股市波动，A股市场风险偏好和活跃度在下降，成交金额与成交量也不断走低。
(image_address=""https://x0.ifengimg.com/ucms/2020_17/EC5B91CF037FA613B4F99539086CE5E21285CD3E_w558_h351.png"")
数据显示，4月21日，A股成交金额为6493亿元，成交量为593亿股，两者较年内最高水平分别下滑54%和49%。伴随活跃度的下滑，A股资金也出现分化，流向绩优和蓝筹股。
受此影响，A股的低价股数量也在不断攀升，截至目前，“1元股”数量高达74只、“2元股”的数量更多达196只，较去年年末上升了39.62%和25.64%。74只1元股中，29股最新收盘价低于1.5元。
(image_address=""https://x0.ifengimg.com/ucms/2020_17/AE9B4B66793EEDD3EDF6A18975C2853FEB6B6258_w643_h1403.png"")
04
“面值退市”进程加速
近日，中共中央、国务院发布关于构建更加完善的要素市场化配置体制机制的意见，其中专门提到——坚持市场化、法治化改革方向，改革完善股票市场发行、交易、退市等制度。完善投资者保护制度，推动完善具有中国特色的证券民事诉讼制度。
实际上，A股“面值退市”进程已经在悄然加速。
截至目前，A股已经有7只个股触及面值退市，包括中弘退、雏鹰退、华信退，印纪退，退市大控、神城A退、退市华业。
武汉科技大学金融证券研究所所长董登新预测，2020年A股市场至少将有20只垃圾股或僵尸企业退市。充分市场化的“面值退市”标准有利于大幅提高A股市场优胜劣汰、优化资源配置的功能。
可以预见的是，在新证券法+注册制的市场环境下，包括“面值退市”在内的市场化退市方式，有望逐渐取代过往以盈利为主要标准的退市机制成为主流，这也是A股的必然选择。对投资者而言，应该谨慎参与低价股特别是基本面不佳的低价股炒作。",2020-04-21 21:53:28,凤凰财经
3,八成企业订单撑不过3个月！他们“慌了”吗？,"2月份，客户问我们：还发货吗？
3月份，我们问客户：还收货吗？
2月份，这个行业“有订单、没人做”。
3月份，这个行业“有人做，没订单”……
面对新冠肺炎疫情肆虐全球，国际贸易活动受限，我国外贸行业就处在这么一个尴尬的境地。
还记得前两天外贸企业要凉凉的消息吗？
东莞泛达玩具有限公司因外贸订单取消导致业务量骤减，资金链断裂，突然宣布结业；东莞精度表业有限公司称Fossil取消或暂停原生产订单，导致公司出现重大危机，面临随时关停的风险……
(image_address=""https://x0.ifengimg.com/ucms/2020_17/8C0434E6B1E2F2EEC84E6A67ABE5F09665145E01_w397_h637.png"")
(image_address=""https://x0.ifengimg.com/ucms/2020_17/154C6536D1125FFB2A5715468236B3381173C554_w516_h613.png"")
由于东莞堪称中国外贸制造业的“晴雨表”，据此，网上兴起了不少流言蜚语，比如中国外贸真的凉凉了、外贸企业即将掀起“倒闭潮”……
实际情况是这样吗？外贸行业到底是个啥情况？口说无凭，咱们一起去东莞企业里看看——
外贸企业绝境求生
来自东莞市工信部门的调查显示，目前手上订单能维持3个月以上的外贸企业，仅占两成左右。也就是说，八成企业的订单甚至撑不到7月份，如果全球疫情得不到缓解，订单继续推迟或取消，那么外贸企业真的很危险。
外需如此萎靡，重压之下的外贸企业怎么活下去呢？
企业类型：家居制造业
求生方式：转型直播
事件：新冠肺炎疫情来袭，家居制造业跌入冰点。但在东莞市慕思寝室用品有限公司的大型数字化工厂中，高端床垫生产线正在紧张运行，为大批订单备货。
为啥该公司还有不少订单？原因就在于该公司切入了电商直播领域。
全国4000家门店、上万名员工一起协同，开启“抗疫特惠全国直播”卖货活动。最终触达受众1.28亿，创造了8小时订单额过亿元、一个月线上订单超15万个的成绩。
企业类型：高科技制造业
求生方式：提升研发能力
事件：打铁还需自身硬，尤其是对高科技制造业而言，技术实力就是第一生产力。
(image_address=""https://x0.ifengimg.com/ucms/2020_17/0D34E199A91B5D9E8570D228FBB61E257D5D1BC9_w854_h640.jpg"")
↑广东鼎泰高科精工科技有限公司的工程师正在调试新研发的设备。郑杨摄
广东鼎泰高科精工科技有限公司的微钻、铣刀及精密刀具广泛应用于PCB、3C、航空航天、军工领域。借力政府对5G、云计算等电子信息新基础设施的投入，该公司大幅提升研发生产能力，一季度订单同比增长了24%。
该公司逆势增长的秘诀就在于主要产品实力过硬，生产出的微型刀具，是生产电子线路板的关键材料，在5G通讯服务器类市场中的占有率极高，具备很强的市场竞争力和抗风险能力。
企业类型：电子制造业
求生方式：调整市场布局
事件：“海外订单比去年同期提升30%，内销订单预计全年能增长50%。”这是东莞市迈思普电子有限公司在疫情中交出的成绩单。
这个外贸企业为啥订单情况这么好？主要原因在于从去年开始，迈思普就开始优化客户结构、产品结构，调整市场布局。
一方面，海外疫情暴发使得居家看电视的用户量猛增，全球13%的机顶盒电源适配器都由迈思普供应，因此新老客户的订单都有所增长。另一方面，去年迈思普未雨绸缪在国内扩建了多个销售网点，目前国内市场占比已超过40%。
“倒闭潮”并未发生
不难看出，外贸企业经历的困难是相同的，一是海外需求端萎缩；二是供应链受限；三是国际通道、货物、人员受阻。但是企业并没放弃，而是先想尽办法活下去。
事实上，2008年的国际金融危机已经促使东莞加速加工贸易转型升级。2年前，东莞一般贸易比重已经超过了纯加工贸易。
当前，东莞早已从原来大进大出的OEM（贴牌生产）模式转向混合经营、内外销并重的模式；OBM+ODM（自主品牌+自主设计）占比也从2008年的32.5%提高到目前的76.6%；外资企业产能内销比重提高到目前的35.9%；对外贸易依存度不断降低，已从最高峰时的400%降为现在的140%。
(image_address=""https://x0.ifengimg.com/ucms/2020_17/A49C4E96C975D050EDC7FBAF7483070265AEFD0F_w854_h640.jpg"")
东莞市慕思寝室用品有限公司打造的大型数字化工厂。郑杨摄
东莞10多年来加工贸易转型升级如今派上了用场。产业链齐全、供应链完善的核心优势，让东莞从“世界工厂”向高端化迈进。
所以，说回“倒闭潮”的传闻，大家心里可能都会得出答案。如今，仍在市场上搏杀的都是抗风险能力较强的优质外贸企业，“倒闭潮”不过是危言耸听罢了。
东莞市商务局也回应表示，目前只有2家企业出现这种情况，是极个别现象。由于东莞的产业基础在，外贸竞争力相对较强，一旦疫情好转，行业将会迎来反弹。
(image_address=""https://x0.ifengimg.com/ucms/2020_17/965DB97BC9904AEB9811904E851FB7975E35623D_w854_h640.jpg"")
东莞市迈思普电子有限公司的电源生产车间。郑杨摄
共克时艰期待春天
中国经济是一片大海，而不是一个小池塘。
中国外贸更是如此，韧性强、竞争力强、企业创新能力和市场开拓能力强。3月份中国出口和进口增速分别为-3.5%、2.4%，远高于市场预期，印证了从国家到企业的努力。
看看企业的自救措施，你就会知道此言不虚：
1、紧抓趋势向高端化转型。
2、创新营销模式开拓内销市场。
3、善用供应链优势强化话语权。
4、顺应疫情需求及时调整生产方向。
看看国家政策，更能感受出共克时艰的决心：
国务院常务会议在3月份两次专门部署“稳外贸”和“稳住外贸外资基本盘”；
商务部等相关部门密集出台大量高含金量的政策措施……
同时，我国还在不遗余力地增设一批跨境电商综合试验区；举办网上广交会；促进出口转内销；完善出口退税；加大信贷和保险支持……
(image_address=""https://x0.ifengimg.com/ucms/2020_17/7B68B068E558E71EF7754BBC51758B79FE981E91_w1024_h680.jpg"")
要知道，中国外贸的竞争力强并非浪得虚名，40多年的改革开放已使中国产业链深度融入全球，强大的供应能力，让全球买家都愿意和中国做生意。
面对目前的困难，我们仍然有充足的理由相信，在国家和企业的共同努力下，外贸企业终可以渡过难关再扬帆。
来源：经济日报微信公众号（ID：jjrbwx）",2020-04-21 21:53:16,凤凰财经
4,国常会重磅！阶段下调中小银行拨备覆盖率，政策背后有何深意？,"疫情冲击下，政策逆周期调节的力度进一步加大。
(image_address=""https://x0.ifengimg.com/ucms/2020_17/0894E8C1B47305AAF60BAB6A62C3DCB2ABF3ECAC_w1080_h567.png"")
4月21日国务院常务会议，会议主要部署了三方面政策：
1、加大对贫困人口、低保人员和失业人员的帮扶保障力度；
2、决定提高普惠金融考核权重和降低中小银行拨备覆盖率，促进加强对小微企业的金融服务；
3、明确帮助服务业小微企业和个体工商户缓解房租压力的措施。
加大低保、失业人员的保障力度
会议指出，按照党中央、国务院部署，应对当前经济发展面临的前所未有挑战，必须采取更有针对性措施，加大基本民生保障和兜底力度。会议具体部署了三方面基本民生保障政策：
一要加强农村贫困人口帮扶。国家重大项目建设优先安排贫困劳动力务工，扩大以工代赈投资建设领域和实施范围、将劳务报酬比例由10%提高至15%，拓展扶贫车间、公益岗位等就地就近就业机会。将扶贫小额信贷还款期限延长至今年底。对受疫情影响可能存在返贫、致贫风险的人员加强摸底排查，做好帮扶。对有劳动能力的贫困边缘人口，可纳入扶贫小额贷款贴息、技能培训等扶贫政策给予支持。积极采取措施促进贫困地区特色产品扩大销售，增加农民收入。
二要对符合低保条件的城乡困难家庭做到应保尽保，及时将未参加失业保险且收入低于低保标准的农民工等失业人员，纳入低保、救助等范围。对受疫情影响遭遇暂时困难的人员做好临时救助。
三要在落实落细今年已出台的延长大龄失业人员领取失业保险金期限、阶段性实施失业补助金、提高价格临时补贴标准等失业人员帮扶措施基础上，进一步将失业保险保障范围扩大至城乡所有参保失业人员。其中，将去年1月以来参保不足1年的失业农民工阶段性纳入保障范围。
受疫情影响，今年我国稳就业压力较大。尽管当前我国经济已出现复苏，企业复工复产加快推进。但由于海外国家二季度经济增长会表现最差，将对国内经济反弹形成制约，尤其是外需疲弱会对我国出口行业就业形成较大挑战。
“预计今年美国、欧洲、日本经济均会陷入衰退，二季度中国出口同比跌幅可能超过20%，这意味着即便国内全面复工、产能利用率大幅提升，外需走弱可能会带来较大冲击。出口需求走弱可能造成相关行业1000万人面临失业，并拖累相关企业投资。”瑞银亚洲经济研究主管、首席中国经济学家汪涛称。
摩根大通中国首席经济学家朱海斌在接受证券时报记者采访时表示，全国城镇调查失业率的统计口径并不足以完全真实反映失业情况。与美国等海外国家的劳动力就业统计数据相比，我国相关数据在统计上有以下两方面未纳入：
一是没有统计劳动市场的参与率，中国就业人口中很大比例是农民工，如果春节假期后一些农民工没回城工作，就属于退出劳动力市场，造成实际劳动力市场参与率的萎缩，但我国官方没有这方面的统计；
二是一些企业采取的用工方式比较灵活，疫情影响下，即便企业没有解雇员工，但也要求员工无薪休假或者缩短工作时长、减薪等，这种未充分就业的情况也不纳入统计口径。
此外，为减轻小微企业和个体工商户房租负担，会议确定，推动对承租国有房屋的服务业小微企业和个体工商户，免除上半年3个月租金。国有企业尤其是央企和高校、研究院所等企事业单位要带头。出租人减免租金的可按规定减免当年房产税、城镇土地使用税，并引导国有银行对减免租金的出租人视需要给予优惠利率质押贷款等支持。非国有房屋减免租金的可同等享受上述各项政策优惠。
逆周期监管导向：阶段性下调中小银行拨备覆盖率
新冠肺炎疫情在全球蔓延，实体经济受到巨大冲击，对银行而言，也会受到波及，导致风险资产快速上升。为了控制银行潜在风险，释放银行信贷投放能力，避免形成“信用收缩——经济下滑”的恶性循环，银行业相关监管指标也需要进行逆周期调节，适当阶段性放松相关监管考核标准。
国外银行业监管部门已在行动。例如，3月27日，巴塞尔委员会宣布，推迟实施巴塞尔协议Ⅲ一年，避免加重银行负担；英国金融监管部门也敦促汇丰、渣打、巴克莱银行等主流银行取消2019年的派息，保留收益，以保持资本水平。
此次国常会决定，将中小银行拨备覆盖率监管要求阶段性下调20个百分点，释放更多信贷资源，提高服务小微企业能力。
目前银行拨备覆盖率的最低监管要求是在120%－150%。具体水平根据银行贷款分类准确性、处置不良贷款主动性和资本充足性等情况确定。此次阶段性下调中小银行拨备覆盖率20个百分点后，最低监管要求将在100%－130%。
国家金融与发展实验室副主任曾刚对证券时报记者表示，理论上讲，只要银行不良贷款暴露充分，拨备覆盖率100%就足够了。近年来，随着监管部门要求银行加强真实不良暴露，以及加大不良贷款处置力度，银行不良贷款偏离度已经明显缩小。截至2019年末，商业银行平均拨备覆盖率186%，说明我国银行业有超额拨备。在经济下行期，适度降低拨备覆盖率监管要求，体现了逆周期监管的导向。
曾刚表示，部分中小银行的资本充足率和拨备都处于监管临界水平，疫情影响可能会加大这部分机构的监管达标压力，并进一步制约其信贷投放能力。考虑到中小银行是服务小微企业的重要力量，相关监管约束的被动强化，不利于当下稳增长和支持中小微企业的各项政策发挥效力。
“拨备是银行的一项成本，适当降低银行的拨备覆盖率要求，理论上讲可以降低银行的成本，增厚银行的利润，释放一部分拨备也可用来核销不良资产。这对银行增强可持续发展能力、风险抵御能力以及资产运用能力都有帮助。”曾刚称。
此外，为促进金融机构更好服务小微企业，会议确定，将普惠金融在银行业金融机构分支行综合绩效考核指标中的权重提升至10%以上，鼓励加大小微信贷投放。
民生银行首席宏观研究员温彬表示，考核权重提高后，一方面利于提高分支行加大对普惠金融的营销、服务力度；另一方面，总行层面也会提高专项信贷额度的保障力度，并通过内部优惠定价进一步降低小微信贷成本，加大资源调配力度。",2020-04-21 21:52:52,凤凰财经
5,WTI原油5月合约即将到期 仍有15000余手合约未平仓,"财联社4月21日讯，据CME官方网站，周二即将到期的WTI原油期货5月合约在周一收盘时仍有15702手未平仓合约，较上日减少92891手。而6月和7月合约当天分别新增44388手和36765手。
(image_address=""https://x0.ifengimg.com/ucms/2020_17/5356C2719023FC17BD1E9AEA2F36EB4C5564CC61_w693_h199.png"")",2020-04-21 21:47:27,凤凰财经
