,title,content,pub_time,src
0,“钻石公主号”后遗症显现，日本一邮轮公司破产,"高江虹
邮轮公司拉开破产序幕？
钻石公主号事件后，不断严重的新冠肺炎疫情让日本旅游业深受冲击。日本神户夜光邮轮公司（LuminousCruisingCo.）2日宣布，受疫情影响，自1月份以来，一系列订单被迫取消，公司已提交破产申请。这是新冠肺炎疫情暴发以来，第一家宣布破产的邮轮企业。
据悉，日本神户夜光邮轮公司经营的“夜光神户2号”邮轮是日本最大的美食邮轮之一，能为1000名乘客提供日间和夜间巡游，欣赏到神户市、神户机场、六甲山以及世界上最长的悬索桥明石海峡大桥的美景。按照日媒的报道，近两年邮轮公司受到地震、台风等影响曾频繁停航，加之燃油价格上涨，新冠疫情成为最后一根稻草。日本信用调查公司帝国资料库的数据显示，夜光邮轮的债务总额约为12.4亿日元（约合7991.5万元人民币）。
神户地方法院2日接受了该公司的破产保护申请，该公司的母公司将协助其完成善后工作。夜光邮轮公司表示，将从2日起暂停“夜光神户2号”邮轮的业务，预定乘坐该船游览的乘客可转乘”浪漫协奏曲号”（theConcerto）。
据日本方面统计，截至当地时间2日晚20时，日本北海道、神奈川县、爱媛县等地新增15例新冠肺炎确诊病例，累计确诊达976例，累计死亡病例12例。其中“钻石公主号”邮轮上的病例占比最大，该邮轮上乘客和乘务人员的确诊病例高达705人，死亡6人。还不包括已经疏散到其他国家、后来才确诊或死亡的的病例情况。
钻石公主号事件对整个邮轮行业冲击巨大，上海一家公关公司高管朱先生向21世纪经济报道透露，近日该公司接到一单邮轮上的项目竞标邀请，拟在从上海到东京的邮轮上做活动。可出于对风险的顾虑，“好挣扎，要不要接？”朱先生很是犹豫。",2020-03-03 14:54:00,凤凰财经
1,通用传奇CEO韦尔奇去世：难以模仿的“商业教父”,"韦尔奇不仅救活了GE，更是改变了美国公司传统文化，甚至重新定义了现代企业。
北美当地时间3月1日晚，前美国通用电气（GE）董事长兼CEO、著名职业经理人杰克&middot;韦尔奇在纽约家中去世，终年84岁。美国总统特朗普当天在社交媒体上表示，杰克&middot;韦尔奇是一个商业传奇，“是我的朋友和支持者，他不会被忘记。”
从120亿到4100亿的“凯尔特人”
韦尔奇是典型的“凯尔特人”：1935年出生于爱尔兰裔天主教徒聚居的麻省皮博迪一个“凯尔特”家庭，父亲是波士顿-缅因铁路的管理人员。
1960年获得博士学位后，韦尔奇进入通用电气，成为该公司位于麻省皮茨菲尔德一间塑料分公司的化学工程师。最初他的升迁并不快，直到1972年才升任这间“庞大GE的小小分支”的副总，5年后升为正职。当时可能并不会有人会想到，他的一生功业，将与GE这个历史悠久的品牌相伴一生。
说GE历史悠久毫不夸张：这家最初以发明和生产白炽灯泡起家的公司，系大发明家爱迪生和三位合伙人于1879年在麻省波士顿所创办。
经过百年发展，成为美国第八大、世界第27大企业，和世界首屈一指的家电、能源、航空、军工等综合集团，雇员人数达到数十万，分支遍布全美和全球上百个国家。
但家大业大的副产品就是“臃肿不堪”。到了上世纪70年代中后期，GE和当时的美国社会、经济一样，得了所谓“富贵病”。到了1980年初，偌大的GE市值竟仅剩区区120亿美元。
1981年4月，疲惫不堪的董事长兼CEO琼斯告退，45岁的韦尔奇临危受命，当时许多投票支持他的董事都抱着“死马当活马医”的想法，并没有对他能将GE“起死回生”抱太大希望。
但他却交出了一份令人瞠目结舌的答卷。
2001年9月上旬，被《纽约时报》社评称作“白领革命家”的韦尔奇宣告退休，他交给继任人伊梅尔特（JeffreyImmelt）的，是一个拥有4100亿美元市值、焕然一新的GE，和一个精干、士气高昂、效率不俗的员工团队。
这足以让他顶着各大财经媒体不吝赠予的“20世纪最佳职业经理人”、“最令人尊敬的CEO”等一系列炫目光环挥手告别职业经理人生涯，转而著书立说，成为“商业成功学市场”的标准模板。
“中子弹”的秘诀
韦尔奇的秘诀是所谓“活力曲线”：他把职业经理人分为“A组”（充满激情，致力于将梦想变成现实的20%）、“B组”（恪尽职守的70%）、“C组”（不称职的10%）三类，其中第一类最可倚靠，第二类不可或缺且“应努力促使他们成为第一类”，而第三类“必须走人”。
为了“让第二类变成第一类”，他力推将GE附设的教育中心斥巨资改造为克顿维尔管理学院，让大量内部中坚在学院深造，并采取了一系列被推崇者称作“标准团建”、被批评者斥为“典型洗脑”的培训模式和技巧，今天GE的多数中高层管理人员，都曾经是“克顿维尔人”。
为了“清洗第三类”，他毫不留情地在走马上任5年间将GE员工总数从41.1万削减至29.9万，这显然远远超过了他最初提出的“末位淘汰10%”理论。
他的“三类法则”更从“人”扩充到部门、分公司和企业经营范围，很多被他认为“低效”的产业被整个割弃，而高端制造、传媒、娱乐、金融、医保、高科技等原本离GE仿佛很遥远的“高效产业”，却被他不惜工本引进。
为此，他力排众议创办了通用电气资本银行，并购了NBC的母公司RCA，不顾后者内幕交易丑闻缠身，强行将KidderPeabody据为己有。
为了减少旧势力和传统习惯的干扰，他甚至不惜将GE的中心从大本营波士顿搬迁到南方，自己也就此离开了“凯尔特区域”。
他的这些争议性做法赢得了褒贬鲜明对立的两个绰号：“新世纪经理人”（managerofthecentury）和“中子弹杰克”（NeutronJack）——前者是赞誉他“开创了职业经理人和企业经营的新时代”，后者则讽刺他“像中子弹那样只杀人不毁东西”。
无论如何，他在GE取得巨大成功，并且在事业巅峰华丽地功成身退，靠兜售“成功学”（成为克杜莱投资公司合伙人，并频繁接受有偿巡回演讲和著书立说的邀请）优哉游哉地度过余生，在三位遗孀（他有三段婚姻，其中两段半途而废）和爱犬的陪伴下平静离去。
正如当初《纽约时报》社评所指出的，他的遗产不仅是救活了GE，更是改变了美国公司传统文化，即注重稳定性、忠诚度和持久性，变为更关注敏捷性、速度和复兴程度。
然而，就连韦尔奇本人也对自己“是否走过了头”屡屡提出质疑，他曾多次表示，自己非常憎恶“中子弹杰克”这个绰号。
不可复制的成功学
2001年9月上旬，“新世纪经理人”在一片赞誉中功成身退。
身后是老当益壮、焕然一新的GE，继任者则是由他亲自挑选、经过“克顿维尔人培训”的伊梅尔特，后者萧规曹随，提出了“积极切入新兴领域、坚决抛弃过时产业链”的经营思路——这其实正是韦尔奇思路的翻版。
但就在短短数日后，“9&middot;11”发生了，随后GE不惜血本切入的“新兴领域”——互联网和电商产业泡沫破裂，投入巨资扶持的NBC、GE资本运营模块黯然收场，从企业诞生第一刻起就存在的电器部门则被剥离。
2017年，伊梅尔特黯然“下课”。随后GE先后经历了弗兰纳里（2018年秋辞职）和卡尔普两位CEO，但都未能力挽狂澜。
前者见证了GE在110年后被逐出道琼斯工业平均指数行列，后者则领略了这支曾经连续十几年稳步上涨“大蓝筹”的“蓝血流干”。就在“中子弹杰克”与世长辞的当天，GE股价跌至11美元，市值则缩水至951亿美元，如果以当年币值计算，说“又回到起点”也并不算特别夸张。
伊梅尔特“下课”时，英国《泰晤士报》曾质疑“杰克当初赖以成功的模型，是否恰为GE刨下一个大坑”，而纽约大学金融学教授达莫达兰则感喟“成功学不可复制，传奇人物难以模仿”。
作为坚定的共和党人和自由经济的推崇者，他曾公开指责前总统奥巴马在2008年金融危机后加强监管的措施，并因此得到现任总统特朗普的赞美。后者在他去世后也发表了热情洋溢的讲话。
“新世纪经理人”已功成身退，但新世纪才刚刚开始，未来的成功之路，需要后来人重新去摸索。
□陈在田（专栏作家）",2020-03-03 14:25:12,凤凰财经
2,广电系大涨！“全国一网”方案出台，这些板块有望受益,"广电一网整合方案有重要进展！
3月2日，国家广播电视总局在北京召开贯彻落实《全国有线电视网络整合发展实施方案》（下称《方案》）电视电话会议，启动全国有线电视网络整合和广电5G建设一体化发展工作。
中国证券报记者获悉，《方案》指出“全国一网”整合将由中国广播电视网络有限公司（下称“中国广电”）主导，联合各省级网络公司、战略投资者共同组建，形成按现代企业制度管理的“全国一网”股份公司。
受这一消息刺激，3月3日早盘广电系股票大涨。路通视信、吉视传媒涨停，湖北广电、天威视讯、广电网络、歌华有线涨逾5%，板块内个股全线飘红。此外，与之相关的5G、通信及传媒板块同样飘红。
今天上午数码科技、兴瑞科技等公司通过互动易平台发声，介绍公司涉及广电5G业务的情况。
(image_address=""https://x0.ifengimg.com/ucms/2020_10/092F61381E48C6924504BBE7D170978F383738E1_w1080_h1596.jpg"")
来源：Wind
一网整合加速推进
按照《方案》，“全国一网”整合将由中国广播电视网络有限公司联合省级网络公司、战略投资者共同发起、组建形成中国广播电视网络有限公司控股主导、对各省网公司按母子公司制管理的“全国一网”股份公司。建设具有广电特色的5G网络，实现“全国一网”与5G的融合发展，推动大屏小屏联动、无线与有线对接、卫星与地面协同，全面实施智慧广电战略，将显著提升全国有线电视网络的承载能力和内容支撑能力。
华西证券传媒首席分析师赵琳告诉中国证券报记者，广电行业长期处于分散经营状态，这种模式对行业发展不利，在与互联网公司和运营商的竞争过程中，广电网用户持续流失。
目前，中国广电的电信固网牌照、700MHZ移动通讯频段到位，补齐了在电信网络牌照和移动频段的短板。2016年，工信部向中国广电颁发的固定宽带业务牌照，意味着中国广电可以自己建设宽带网络和出口。
2019年6月6日，中国广电正式获颁5G牌照。
然而，目前广电全国一网的整合还未完毕，上述牌照尚未发挥应有的作用。
在赵琳看来，广电一网整合还面临多重困难。上市公司股权关系复杂，上市公司整合面临“一网公司”和上市公司股东之间利益的协调；“一网公司”和战略股东的利益协调，战略股东的出资条件等；证券法的相关规定是整合上市公司面临的重要考验。
而按照“十三五”规划，广电一网整合需在今年完成。
中国证券报记者从消息人士处获悉，本次《方案》基本内容和去年草案一致，中国广电牵头、各个省级地方广电参与，成立联合股份制公司。所以成立股份公司是在预期之内，重点在于九部委联合发文，说明广电一网整合得到政府部门强有力的支持。
业内人士指出，从长远来看，在“全国一网”管理架构下，拥有700M黄金频段的中国广电5G，可以用很少的成本投入建设起覆盖范围最广的5G网络，由此才有机会在与另三大通信运营商的5G争战中获得自己的一份市场份额。
这些板块有望受益
“这对广电行业是大利好，有利于行业统一规划、布局、采买、业务统筹等，提升广电行业整体竞争力和运营效率。”赵琳认为，广电5G设备供应商等将受益明显。
银河证券传媒分析师杨晓彤告诉中国证券报记者，广电领域公司受益明显。从收入体量上来看，广电系收入体量大幅低于三大运营商目前的收入规模，随着5G商用的落地，广电系收入规模有望实现大幅突破。根据对行业收入规模的预测，广电行业未来的收入规模可以达到1297亿元-2413亿元，复合年增长率可达到10.73%-25.36%。从业务模式上来看，随着5G、VR、8K、人工智能物联网等新兴技术的快速发展，未来广电将加快这些高新技术的运用，教育、医疗、民生、电子政务等目前具有一定基础的业务未来覆盖面会更广。随着5G技术的快速推进，预计未来广电平台将与政府部门实现更多民生方面的合作，预计ToG业务为重点发展对象增量可期。
中泰证券研报指出，为广电行业提供服务，生产超高清设备类、机顶盒等业务的公司也有望受益。
某券商传媒分析师对中国证券报记者表示，广电过去用户流失的核心，在于内容相对互联网而言较弱。新的集团公司成立以后，各个广电公司在内容购买力上将会显著提升，利好影视内容研制方。",2020-03-03 14:15:47,凤凰财经
3,全面“禁野”后，专家分析受影响养殖户有哪些适用补偿范围,"经营活动中的预期收益、贷款利息等均不属于补偿范围。
全面禁止野生动物交易后，各类野生动物养殖户如何转变经营、如何获得一定的经济补偿，也成为备受关注的问题。
“今天不忍心又喂了一次。”有蛇业养殖户对第一财经记者说，养殖业是农户最大的经济来源。很多人上有老下有小，所有开支收入都指望着养殖。不少人的钱是从银行贷款和亲朋好友那里借来的。如果彻底禁了，肯定会背上不小的债务。
日前出台的《全国人民代表大会常务委员会关于全面禁止非法野生动物交易、革除滥食野生动物陋习、切实保障人民群众生命健康安全的决定》（下称《决定》）明确，全面禁止食用国家保护的“有重要生态、科学、社会价值的陆生野生动物”以及其他陆生野生动物，包括人工繁育、人工饲养的陆生野生动物。
《决定》同时要求，国务院和地方人民政府应当采取必要措施，为本决定的实施提供相应保障。有关地方人民政府应当支持、指导、帮助受影响的农户调整、转变生产经营活动，根据实际情况给予一定补偿。
天津大学法学院院长、天津大学中国绿色发展研究院执行院长、国家生态环境专家委员会委员孙佑海2日撰文表示，《决定》的出台实施，可能会给部分饲养动物的农户带来一些经济损失，特别是在一些重点地区，可能会使一些长期以来专门从事驯养繁殖野生动物的一些单位和农户失去赖以生存的基础。从这个角度来看，《决定》的实施会遇到一定的阻力。
根据现行相关法律法规等规定，野生动物领域主要有三项行政许可：特许猎捕证、狩猎证；人工繁育许可证；专用标识及出售、购买、利用国家重点保护野生动物及其制品审批（包括相应经营利用许可证）。
目前，从事陆生野生动物人工繁育、人工饲养的合规养殖户都持有林草部门颁发的人工繁育许可证（包括相应经营利用许可证）。
根据《决定》要求，2月27日，国家林草局决定全面整顿野生动物人工繁育和经营利用从业机构，依法清理许可证件及文书。要求对取得人工繁育许可证，以食用为目的从事陆生野生动物人工繁育的，须撤回并注销所核发的人工繁育许可证件或文书，并一律停止为食用目的出售、运输野生动物等活动。此外，涉及水生野生动物养殖、野生动物经营利用的，有关许可证书和文书一律予以撤回并注销或申明作废，停止一切以食用为目的的经营利用陆生野生动物活动。
(image_address=""https://x0.ifengimg.com/ucms/2020_10/9478E29A0168CAAB511B6B8DE1FBCEFB23D4F7CC_w640_h430.jpg"")
河北省昌黎县一家貉、貂养殖场。摄影/章轲
京衡律师事务所高级合伙人、浙江省律协环资委主任陈国强律师对第一财经记者说，近日，浙江京衡律师事务所环境法业务团队根据现行有效的法律法规等规定，对《决定》发布后野生动物食用等相关的问题进行了梳理。
对于补偿问题，陈国强说，根据《行政许可法》第八条规定：“公民、法人或者其他组织依法取得的行政许可受法律保护，行政机关不得擅自改变已经生效的行政许可。行政许可所依据的法律、法规、规章修改或者废止，或者准予行政许可所依据的客观情况发生重大变化的，为了公共利益的需要，行政机关可以依法变更或者撤回已经生效的行政许可。由此给公民、法人或者其他组织造成财产损失的，行政机关应当依法给予补偿。”
《行政许可法》第七条规定：“公民、法人或者其他组织对行政机关实施行政许可，享有陈述权、申辩权……”第四十七条规定：“行政许可直接涉及申请人与他人之间重大利益关系的，行政机关在作出行政许可决定前，应当告知申请人、利害关系人享有要求听证的权利……”
陈国强说，有关主管部门依据新出台的相关法律法规等规定决定变更或者撤回已作出的行政许可的，首先应通过直接通知或者公开的方式事先告知当事人；其次，如果最终行政机关依法变更或者撤回已经生效的行政许可，给当事人造成财产损失的，应当给予补偿。
对于撤回行政许可该如何赔偿的问题，陈国强说，《最高人民法院关于审理行政许可案件若干问题的规定》第十五条规定：“法律、法规、规章或者规范性文件对变更或者撤回行政许可的补偿标准未作规定的，一般在实际损失范围内确定补偿数额；行政许可属于行政许可法第十二条第（二）项规定情形的，一般按照实际投入的损失确定补偿数额。”
陈国强说，如相关被许可人因本次法律法规调整而导致无法继续进行已经许可的出售、购买、利用国家重点保护野生动物及其制品等行为，则其已取得的行政许可面临被撤回的风险。在此情况下，被许可人可依法主张补偿其因此而受到的“实际损失”。
对于养殖户们关心的补偿申请程序，陈国强说，公民、法人或者其他组织仅主张行政补偿的，应当先向行政机关提出申请；行政机关在法定期限或者合理期限内不予答复或者对行政机关作出的补偿决定不服的，可以依法提起行政诉讼。
“获得补偿是合法养殖业户的法定权利，给付补偿是行政机关的法定义务。”微信公号“东海法律观察”认为，补偿对象包括“受影响的农户”，也包括人工繁育许可证的被许可人。但补偿不是“行政赔偿”，不适用《行政赔偿法》的程序和标准。此外，补偿标准一般低于实际损失数额，甚至仅相当于实际损失的一小部分。经营活动中的预期收益、贷款利息等均不属于补偿范围。",2020-03-03 14:08:49,凤凰财经
