,title,content,pub_time,src
0,又一相机品牌撑不住了！这家日本百年巨头宣布：退出相机业务,"近日，有着84年相机生产历史的奥林巴斯宣布将其相机部门出售，公告信息显示，奥林巴斯的相机业务已经连续三年亏损。
打败你的往往不是同行，而是跨界。造成这一结果的真正原因不在于奥林巴斯，而在于手机拍照如此方便，成像质量可达到较高水平的今天，给数码相机留下的空间越来越小。在奥林巴斯之前柯达等早已经宣布退出相机市场。目前在相机市场仅剩下佳能、索尼、尼康等品牌。
奥林巴斯最终妥协
奥林巴斯创立于1919年，在去年时成为“百年企业”。其在日本成功地将显微镜商品化，是精密、光学技术的代表企业之一，事业领域包括医疗、影像、生命科学产业三大业务领域。
(image_address=""https://x0.ifengimg.com/res/2020/6153B3A5B6A0CB8D1C54D4CB26310125CD9721B2_size40_w900_h383.jpeg"")
图片来源：摄图网
自1936年起，奥林巴斯推出Zuiko系列相机，正式打入相机市场。1972年，品牌发售OM系列，主打轻巧的单镜反光相机；1991年，品牌又引入自动对焦的轻便相机InfinityStylus系列。直至1996年，奥林巴斯进入数码年代，推出首部数码相机。除了相机业务之外，奥林巴斯近年主力发展科研及医疗用品，例如显微镜、内窥镜等。
医疗业务营收已占奥林巴斯总营收的八成，早在几年前，奥林巴斯已经陆续关停相关的映像业务。如2018年，奥林巴斯(深圳)工业有限公司宣布停止生产运营工作，当时公司最高负责人小松享表示，由于设备老化、业务难以外销等诸多原因，集团内部不得不做出停工停产的决定。2019年奥林巴斯出售了负责数码相机生产的中国子公司，随后在今年5月，奥林巴斯宣布退出韩国相机市场。
而在6月24日，奥林巴斯发布公告：日前，奥林巴斯股份公司与日本产业合作伙伴股份公司（以下称JIP）签署了映像事业转让意向确认书，宣布将数码相机和IC录音笔为代表的映像业务转让给JIP。具体细节仍在商定中，计划于今年9月30日之前达成协议，并于今年12月31日之前完成交易。该公司称，极其严峻的数码相机市场已不再盈利，智能手机的发展是主要因素之一。映像事业在过去3年中一直处于亏损状态。
(image_address=""https://x0.ifengimg.com/res/2020/28A7BF5CCBF66712829602831A35BFEFA2457DC2_size103_w903_h516.png"")
根据奥林巴斯公告，对于后续的售后服务，“映像事业在中国将继续像往常一样开展业务。销售、服务以及市场部门将齐心协力推出能够满足客户兴趣的提案和新产品。”公告还称，衷心感谢大家对奥林巴斯产品的支持以及对摄影的热情。我们相信，此次转让协议对维持品牌资产、技术和产品价值而言是正确的一步，同时对多年来支持奥林巴斯产品的新老客户及摄影爱好者来说也是最好的选择。
根据公开资料，接手奥林巴斯映像业务的JIP此前还接手了索尼的PC品牌VAIO。
退出相机业务后，奥林巴斯将主攻医疗器械。
尼康影像业务收入跌幅超20%
就在本月初，尼康交出了一份全面退步的“成绩单”。
据尼康截至2020年3月31日的财务数据显示，过去一个财年尼康总营收为5910亿日元（约合人民币381亿元），同比减少16.6%；营业利润为67.51亿日元（约合人民币4.3亿元），同比暴跌91%。
作为尼康的重要业务组成，影像业务收入同比大减23.7%，且实现亏损171亿日元（约合人民币11亿元）。另外，精密设备、医疗保健和工业设备等方面收入均有不同程度的跌幅。
相机市场持续萎缩，从尼康的销量数据便可窥见一斑。
在该财年中，尼康总计售出162万台可换镜头相机、265万支镜头和84万台便携型数码相机，销量同比分别下滑21.4%、16.4%和47.5%。
尼康将营收、销量下滑的原因归咎于市场低迷和疫情的双重影响，但主要因素仍然在于智能手机对于整个数码相机产业的剧烈冲击。
至于下一个财年的预期，尼康没有分享太多信息，因为疫情所造成的响尚不确定。尼康指出，今年4月和5月，其影像产品业务的销售额同比大幅下降，在严峻的商业环境中继续发展，连续第二个财政年度出现赤字是不可避免的。
(image_address=""https://x0.ifengimg.com/res/2020/1605A713D033B45F7813E62555683E2D6CA84B0F_size36_w900_h383.jpeg"")
图片来源：摄图网
另一品牌佳能影像业务虽有亮点但整体仍出于下滑趋势。据佳能集团发布的2019年度财报，其营业额为35932.99亿日元，同比降低9.1%。佳能影像系统业务领域，可换镜数码相机中面向爱好者的单反相机新产品受到追捧，销售增长势头强劲，在持续扩大的全画幅专微市场，从2018年下半年开始到2019年年初不断投入的新产品，在销售方面表现抢眼。但因以入门机型为主的市场持续萎缩，使得整体销售台数相比2018年有所下降。
早在2019年初，佳能CEOFujioMitarai就警告称，数码相机业将持续下滑，大约2021年左右将达到历史最低点，整体萎缩50%左右。
FujioMitarai指出，越来越多人习惯使用智能手机记录美好时刻。他认为，虽然全画幅无反在繁荣，但这只是为了部分取代笨重单反而已，并非是吸引更多的用户迁移到数码相机市场。
Mitarai坦承，佳能的数码相机业务在过去几年每年以10%的速度衰退，整个市场的可换镜头相机需求约1000万台。
为了弥补损失，佳能计划迁移更多精力到企业级、工业级用户上，比如监控、医疗等影像领域。
你多久没用相机拍照了？
全球数码相机需求持续萎缩
得益于技术进步，手机的拍照性能近几年突飞猛进，从原来的几十万像素，发展到现在最高1亿像素，传感器的尺寸也越做越大，手机拍照性能的提升，使得很多传统的数码照相机落在墙角吃灰。对于大部分人来说，手机相机已经完全够用了。
国际相机影像器材工业协会（CIPA）公布的2019年相机销售数据显示：2019年，全球数码相机出货量同比减少了21.7％，降至1521万部。
实际上随着手机拍照功能越来越强大，数码相机需求不断缩水，其销量在2010达到顶峰后不断走低。CIPA数据显示，2010年数码相机销量超过1.21亿台，到2019年全年销量仅有1521万台，不仅同比减少21.7%，更是较2010年销量减少了87%。
从单月数据来看，在2017年时，平均每个月的销量在200万台左右，2018年则降到了160万台左右，到了2019年进一步降到了130万台左右。
从相机的机型构成来看，2019年，卡片机销量减少22％，降至675万部；单反相机减少32％，降至450万部；此外，无反相机销量为395万部，占整体的26％，虽然销量也在下降，但是总体占比提升了不少。
至于利润，单反销量下跌32%，利润则是下跌了28%；微单相机销量下跌10%，利润反而却增长了6%。目前尼康、佳能都在筹划新一代的微单产品线，相信也会刺激整个相机市场的活跃度。
CIPA预计，2020年全球数码相机出货或比2019年减少23.3％，最终降至1167万部。其中卡片机会大幅度降低29%到480万部，而包括单反相机和无反相机在内的镜头可换式相机为687万部，降幅为18%。
CIPA在6月1日发布的数据显示，今年4月全球数码相机销量比2019年4月减少64%，降至55万台。
(image_address=""https://x0.ifengimg.com/res/2020/B32DC69EB5535546FB7F2B02F8897489818ED55E_size54_w968_h525.png"")
由于新冠疫情，外出限制扩大至全世界产生了负面影响，与3月同比减少五成相比，数码相机4月销量降幅进一步扩大。",2020-06-26 12:37:12,凤凰财经
1,恒生指数午盘收跌0.57%报24640点 舜宇光学(02382)逆市涨6.26%,"凤凰网港股|港股今日早盘受压下行，恒指低开后震荡向下，其下行压力增加，截至午间收盘，恒指跌0.57%报24640点，国企指数跌0.41%报9895点。
国美金融科技(00628)涨9.17%报1.19元，公司早间发布公告，公司董事会已知悉最近公司的股份价格及成交量上升。董事会亦知悉最近有若干媒体报导指公司控股股东杜鹃的配偶黄光裕已经出狱。
国美金融科技今日早盘再次拉升，延续周三的上涨走势，盘中涨幅一度涨近23%，随后受压回调，涨幅收窄。该股现涨10.09%报1.2元，成交3302万元。
蒙古能源(00276)大涨393%报2.12元，公司公布公布,截至2020年3月底财年,股东应占溢利为14.42亿元,每股盈利7.66元,去年同期亏损4443万元。期内收入升44.8%至11.25亿元。
鲁大师(03601)涨5.52%报3.25元，公司公布,伙拍控股股东兼执行董事田野及首席财务官张凡琛组成一伙,斥资1450万元收购从事证券业务的持牌法团万隆证券,以拓展线上互联网证券业务。
免责声明：本文不代表凤凰网港股立场，不作为投资依据。投资有风险，入市需谨慎。",2020-06-26 12:23:36,凤凰财经
2,净利大降127%，薪酬却涨21万，这家上市公司一把手又双叒叕落马！,"成立于1996年、曾被当地官方媒体称为“江苏最大省属外贸企业”的江苏汇鸿国际集团股份有限公司正经历着连续三任“一把手”落马的考验。
(image_address=""https://x0.ifengimg.com/ucms/2020_26/FDD0C2D266CFDD8B33D48824180555A34C91E6EF_w1080_h402.png"")
江苏省国资委网站2019年6月刊登的一篇文章中将汇鸿集团称为“省属最大外贸企业”
利润下滑72%，薪酬增加21万
江苏省纪委监委6月24日晚间发布消息：汇鸿国际集团党委书记、董事长张剑涉嫌严重违纪违法，目前正在接受纪律审查和监察调查。当天晚上9点半，汇鸿集团也披露了上述消息，并强调称“目前公司生产经营一切正常，“将尽快召开董事会会议推举一名董事代行董事长职务，代行法定代表人职责。”
(image_address=""https://x0.ifengimg.com/ucms/2020_26/823D3BE415EE69D975378319BB211F47EBFEDF9E_w400_h276.jpg"")
图片来源：江苏省国资委网站
汇鸿国际集团成立于1996年12月，是江苏最大的省属外贸企业之一，业务主要包括供应链运营、环保产业、投资与金融业务三大板块。目前旗下包括23家二级子公司、99家三级及三级以下子公司。作为省委省政府确定的深化国企改革试点单位，2015年12月，汇鸿集团在省属企业中率先实现整体上市——当时张剑是汇鸿集团总裁。
(image_address=""https://x0.ifengimg.com/ucms/2020_26/0095FF7BA545244C716D88BDEA9D5228A71B34E9_w1080_h599.png"")
官方简历显示，出生于1964年1月的张剑是江苏丰县人，1983年7月参加工作，1986年5月加入中国共产党，2013年4月任江苏汇鸿国际集团有限公司党委副书记、总裁，2017年9月任江苏汇鸿国际集团股份有限公司党委书记、董事长，直至此番被通报“落马”。
根据汇鸿集团近期公告，张剑最近三次公开亮相是在6月19日、6月2日和5月30日。
6月19日，汇鸿集团召开第九届董事会第六次会议，会议以通讯方式召开。会议应到董事7名，实到董事7名，会议由董事长张剑主持。
6月2日，江苏省商务厅厅长赵建军等人赴汇鸿集团调研指导，张剑简要介绍了汇鸿集团的发展历程、发展现状、三大主业特别是在省商务厅的关心支持下参加全国供应链创新与应用试点工作等情况。
5月30日，青海省商务厅党组书记朱龙翔等人到访汇鸿集团，张剑参加座谈时表示，汇鸿青海公司要按照平台公司的战略定位，立足青海，统合好集团内外各方资源，积极服务和融入青海省改革发展大局。
(image_address=""https://x0.ifengimg.com/ucms/2020_26/943BA35C06D65BF7B16BE33CB20A21A621CA3C33_w364_h346.jpg"")
最新数据显示，汇鸿集团总市值为71.8亿元，股东户数为4.34万户。截至6月24日股价为3.2元。自2015年6月份高位至今，跌幅高达87.45%。
(image_address=""https://x0.ifengimg.com/ucms/2020_26/DEF4B4ABFE743C6145AE9F5E1AA68BCBAC6E3621_w828_h862.jpg"")
据年报显示，2019年，汇鸿集团营业收入355.8亿元，同比减少8.74%；归属于上市公司股东的净利润3.37亿元，同比减少71.95%；经营活动产生的现金净流量3.12亿元，同比下降9.56%；报表期末，归属于上市公司股东的净资产52.93亿元，同比下降1.34%。
不过汇鸿集团高管2019年薪酬普遍有所提升，董事长张剑的薪酬增加21万元，增至89.87万元。
(image_address=""https://x0.ifengimg.com/ucms/2020_26/3804A65C98AB80507978CB2291C009F7E07E5348_w1080_h671.jpg"")
今年一季度，汇鸿集团再度迎来新冠肺炎疫情的考验。公司营业收入58.64亿元，同比下降29.49%；归属上市公司股东的净利润-5454.13万元，同比下降126.97%。同时，受资本市场低迷及波动影响，公司持有的金融资产公允价值变动收益同比下降98.99%。
不只是董事长，还是一名作家
据证券时报&middot;e公司，张剑曾在2019年6月接受当地官方媒体《新华日报》专访，对2018年经营情况进行了回顾。
(image_address=""https://x0.ifengimg.com/ucms/2020_26/B871025DC7F48DE22F45CC9D18A8F948C6BAA533_w584_h677.png"")
张剑将汇鸿集团环保产业形容为“无中生有”：汇鸿集团充分发挥国有企业和上市公司的平台优势和叠加优势，牢牢把握政策机遇和产业机遇，通过资本运作和战略投资快速切入环保产业，“我们与国内水处理行业龙头企业中信环境合作成立了中信汇鸿，通过二级市场购买和股权受让方式成为国内固废危废处理龙头企业东江环保的第二大股东。在与国内领先的环保企业不断合作中，迅速形成了新的产业板块。”
当时的报道同时显示，除了是国企掌门人，张剑还有另一重身份：作家。他在2005年加入中国作家协会，著有长篇小说《非鸟》《听老鼠唱歌》《纯然之色》《欲望的边界》，诗集《边缘人语》《时间与花朵》，并多次荣获全国性诗歌大奖。张剑的笔名为“张尔客”。
(image_address=""https://x0.ifengimg.com/ucms/2020_26/14551926717B1C76B906CD4C7B374D025CD75D43_w553_h306.png"")
张剑在专访中表示，“我们要有国企领导的责任、情怀、格局和担当，要努力为汇鸿的后来者留下一份利润贡献大、回报率高、持续性强的优质资产。”
两名前任均被查
汇鸿集团最近几年高管频频“出事”，董事长就落马三位。张剑被调查之前，2017年11月，汇鸿集团原党委书记、董事长唐国海因严重违纪被开除党籍和公职；2019年3月，汇鸿集团原党委书记、董事长冯全兵涉嫌严重违纪违法接受纪律审查和监察调查。
出生于1952年2月的冯全兵2003年4月起任江苏汇鸿国际集团有限公司党委书记、副董事长、总裁，2004年11月任江苏汇鸿国际集团有限公司党委书记、董事长，2013年3月被免去职务，于2015年3月退休。
2019年10月，江苏省纪委监委消息称：原江苏汇鸿国际集团有限公司党委书记、董事长冯全兵涉嫌严重违纪违法，正在接受纪律审查和监察调查。
(image_address=""https://x0.ifengimg.com/ucms/2020_26/2FE91F594014D3DBDBD7D23B0FFAEE68BF34A44C_w1080_h646.png"")
2020年5月，最高检察院网站发布消息称，冯全兵（正厅级）涉嫌受贿罪一案，经江苏省检察院指定管辖，由镇江市检察院依法向镇江市中院提起公诉。镇江市检察院起诉指控：2005年至2018年，冯全兵利用担任江苏汇鸿国际集团有限公司党委书记、董事长等职务便利，为他人在人事安排、项目合作、企业经营等方面谋取利益，非法收受他人财物，数额特别巨大，依法应当以受贿罪追究其刑事责任。
而张剑的前任唐国海（1961年7月生），则是2013年3月由连云港市委常委、常务副市长调任江苏汇鸿国际集团有限公司党委书记、董事长，接棒冯全兵。4年之后，2017年5月，江苏省纪委消息称：唐国海涉嫌严重违纪，正接受组织审查。
(image_address=""https://x0.ifengimg.com/ucms/2020_26/C0D7A4E7B83819A07BA35D6F34D2E4A6CC20C905_w1080_h449.png"")
2018年8月，唐国海因受贿罪判处有期徒刑八年。经审理查明，2005年至2017年，唐国海利用担任连云港经济技术开发区管委会主任、连云港市委常委、连云港经济技术开发区党工委书记、连云区委书记、连云港市副市长以及江苏汇鸿国际集团股份有限公司党委书记、董事长等职务上的便利，为相关单位和个人在土地出让、项目扶持资金拨付、工程承接等方面谋取利益，非法收受财物共计折合人民币807.9789万元。
此前汇鸿集团还有多名总裁、副总遭调查。2019年9月，原江苏汇鸿国际集团有限公司党委副书记、总裁范迪康涉嫌严重违纪违法接受纪律审查和监察调查。2019年3月，汇鸿集团原副总裁许荣云涉嫌严重违纪违法接受纪律审查和监察调查。
每日经济新闻综合证券时报、中国基金报、中央纪委国家监委网站
本文封面图片来源：摄图网",2020-06-26 12:13:26,凤凰财经
3,黄光裕又火了！最狠21分钟翻倍，国美系又异动…,"黄光裕假释出狱的消息，继续引发国美系股价暴动。
今日早盘，A股仍在放假休市，港股开市交易，国美系股票继续出现暴动，拉近网娱更是在开盘21分钟后，股价出现翻倍。
(image_address=""https://x0.ifengimg.com/ucms/2020_26/F568C29D582129429175680CBFD6180EA586B9CE_w417_h432.png"")
国美金融科技早盘也一度大涨逾20%，不过由于上个交易日及此前连续大涨，国美零售今日上午回落明显。
黄光裕确认出狱：
拉近网娱股价又现翻倍暴涨
6月24日，国美系实控人黄光裕将出狱的消息引爆A股港股两市国美概念股，在港交所上市的国美零售（0493.HK）最高涨幅接近25%；截至收盘，国美零售股价为1.62港元，上涨17.39%；国美金融科技大涨47%；拉近网娱更是暴动55.74%。A股方面，中关村（000931）、*ST美讯（600898）、ST金泰（600385.SH）均涨停。
(image_address=""https://x0.ifengimg.com/ucms/2020_26/32B87A60291FF69BD560B557CEF9A20F4F1A53F3_w557_h745.jpg"")
而后当天晚些时候，北京市高级人民法院微信公众号证实了这个消息，其公告，北京市第一中级人民法院根据刑罚执行机关的报请，依法裁定对黄光裕予以假释，假释考验期限自假释之日起至2021年2月16日止。
消息出来后，今日港股国美系概念股继续异动，拉近网娱开盘即大涨45.26%，而后21分钟即到9：51分股价即已经翻倍，不过稍加冲高后也有所回落。
拉近网娱：市值小炒作容易引发巨大波动
拉近网娱主要从事艺人管理服务；及电影、电视节目及网络内容服务；黄光裕通过稼轩集团有限公司间接持股拉近网娱47.1%的股权。拉近网娱前一个交易日已经大涨55.74%。
(image_address=""https://x0.ifengimg.com/ucms/2020_26/470FE5294938CF5E9B4EE1A7C67217AF6073F90A_w815_h402.jpg"")
拉近网娱股价连续遭到爆炒，与该股市值小、股价低有一定关系。即使今日暴涨，拉近网娱股价仍然不到0.2港元，总股本为42.09亿股，市值不到10亿港元。
黄光裕重出江湖引人关注：
国美已提前联手京东拼多多
从2010年10月正式入狱至今，10年间社会经济发生翻天覆地的变化，国美所在的商业连锁行业也格局全变，阿里、京东、拼多多等电商巨头崛起，传统商业连锁企业艰难突围。市场在期待着黄光裕出狱后，能否带领国美重塑辉煌。
而在黄光裕出狱之前，国美也在提前布局准备。2019年1月底，黄母曾婵贞退位，由刘丽焕出任北京国美执行董事、经理和法定代表人。
国美也开始改革，公司名称从国美电器变成了国美零售，还提出“共享零售”战略，大举向互联网转型，并将核心业务家电零售向市场空间更为广阔的家居+家装领域拓展。
今年上半年，国美又先后引入电商新贵拼多多和京东作为战略投资者。其中，拼多多认购了国美零售发行的2亿美元可转债，最多获配12.8亿股国美新股份，占后者股本的5.62%。
拼多多还上架国美零售全量商品，品牌大家电接入拼多多“百亿补贴”计划，而且国美旗下安迅物流、国美管家两大服务平台，同时成为拼多多物流和家电后服务提供商。
京东则以1亿美元认购国美零售发行的境外可转债，双方将基于彼此的线上线下优势，实现更高效的供应链整合互补，在物流配送安装服务上实现资源共享，并合作开展包括金融服务在内的全方位业务。",2020-06-26 12:10:26,凤凰财经
4,女乘客后排熟睡 美团打车司机趁机猥亵、盗窃被判刑,"中新网上海新闻6月24日电趁女乘客熟睡，竟趁机猥亵其胸部及下身，还通过手机偷偷转钱。被告人惠某某犯强制猥亵罪，23日被上海市嘉定区人民法院判处有期徒刑一年二个月；犯盗窃罪，判处拘役五个月，罚金1000元(人民币，下同)，决定执行有期徒刑一年二个月，罚金1000元。
上海市嘉定区人民检察院指控，2019年12月28日凌晨3时许，被告人惠某某驾驶小轿车通过美团打车接单，送被害人贾某某至上海市嘉定区江桥镇曹安公路XXX弄XXX号门口。被告人惠某某趁贾某某在后排座位上熟睡之机，使用贾指纹支付的方式，分别从贾某某手机支付宝及微信绑定的兴业银行卡中转出800、2300元至其本人支付宝、微信账户内。后被告人惠某某又趁机伸手抚摸贾某某的胸部等部位。醒来后，贾某某发现其银行卡内的钱款被他人转出，质问被告人惠某某后，惠遂将上述窃得的3100元通过手机支付返还给贾某某。
2020年1月6日，公安机关经侦查将被告人惠某某抓获，其到案后如实供述了上述犯罪事实。
法院方面表示，上述事实，被告人惠某某在开庭审理过程中亦无异议，且有被害人贾某某的陈述，证人朱某某的证言，相关辨认笔录及照片，公安机关制作的受案登记表、工作情况，手机微信、支付宝转账记录截图、兴业银行卡交易明细及有关供述等证据证实，足以认定。
法院认为，公诉机关指控被告人惠某某犯强制猥亵罪、盗窃罪的犯罪事实清楚，证据确实、充分，指控罪名成立，量刑建议适当，应予支持。判决被告人惠某某犯强制猥亵罪，判处有期徒刑一年二个月；犯盗窃罪，判处拘役五个月，罚金1000元，决定执行有期徒刑一年二个月，罚金1000元。(完)",2020-06-26 12:08:29,凤凰财经
