,title,content,pub_time,src
0,三个月爆跌20%！钛白粉现成本倒挂，大厂：没下跌空间了,"6月28日，一份攀枝花钛海科技的宣涨单，搅动了已沉寂多日的国内钛白粉市场。
3月末至今，受国内外疫情带来的需求疲软影响，钛白粉价格已狂跌近20%，创近年来罕见跌幅，部分厂商现成本倒挂……
(image_address=""https://x0.ifengimg.com/ucms/2020_27/EE26A1DEFD1645528F27007F5347B23C54F5B1D3_w586_h786.png"")
首份宣涨单搅动市场
6月28日，攀枝花钛海科技宣布称，因高速公路恢复收费、原材料涨价等多方面因素影响，造成销售价格与成本价格倒挂，结合公司实际情况，经研究决定，自2020年6月28日起价格变更如下：钛海金红石型钛白粉内贸价格上调人民币500元/吨，外贸价格上调80美元/吨；钛海锐钛型钛白粉THA2000、鼎星锐钛型钛白粉PDA1000内贸价格上调人民币500元/吨，外贸价格上调80美元/吨。
“这是近三个月来国内钛白粉行业首个宣涨单，虽然最终涨价落地情况不一定能达到预想，但已经向市场透露出行业看涨的信号。”作为国内最大的钛白粉营销渠道公司，上海颜钛分析师杨逊对证券时报&middot;e公司记者表示，钛海科技虽然不是行业龙头企业，但此番率先调涨价格，大概率是了解到了龙企意欲调涨的信息。近期大厂已有封单操作，已表明看涨意愿。同时市场销售情况确实已整体好转，作为大型经销商，公司7月份的订货已经从上游厂商拉走，而下游终端客户也已从公司取走了部分存货，说明整个产业链向下移库意愿较强，对价格看涨情绪显著。
值得关注的是，在钛海科技启动宣涨后，7月1日，又有包括攀枝花钛都化工、广西德天化工在内的行业企业宣布跟涨，涨幅均在500元/吨。
杨逊称，近年来钛白粉的调价策略是首先少数生产商预热市场，然后龙企发函确认利多，最后多数生产商强势跟进。近期西南大企突然封单，对其他生产商的“待涨”暗示较浓。攀枝花钛海的宣涨，实际对价格市场带动性不强，刨除前期价格过低因素以外，想必也是有什么重要信息支持，巩固信心的拉涨。钛白粉行情弱势已久，论供需关系或不足以支撑，但供应端强势硬拉的先例还是有的，一轮不行，再来几轮也是有成功案例的。近期交投市场上百吨以上订单逐渐增多，部分无原矿型生产商已在成本线徘徊，部分已有亏损运转，实际目前的价格水平即便不是最低，已经属于近年来的低位，继续下行空间非常有限，就算真继续下挫，到达最低位的时候，想囤的货也许已经紧张到拿不到了。
卓创资讯分析师田晓雨也表示，临近月末，钛白粉价格的见底也促使下游企业备货的积极性升高，市场库存压力得以消化，加之一段时间以来原料面显示价格刚性，大部分厂商销售价格持续与成本线倒挂，月底已有厂商发布涨价调价函。
三月大跌20%成本倒挂
近期首份宣涨单之所以受关注，是因为钛白粉行业因疫情带来的需求疲软，承受了罕见的价格骤降压力。
3月下旬至6月末，钛白粉进入弱势降价周期，硫酸法金红石型和锐钛型的垂直降幅达3000元/吨和2000元/吨，幅度达19.87%和17.39%。以硫酸法金红石型钛白粉为例，短短三个月降价3000元/吨，平均1000元/吨/月，降幅和降速属历年罕见。
卓创统计数据也显示，6月份全国钛白粉市场价格整体下跌，月内价格变动呈现先跌后稳的趋势，月初的市场调价持续至6月中旬，季度末市场价格持续企稳。截至月底收盘，全国金红石型钛白粉市场均价12600元/吨，跌幅约6.02%，当前市场主流商谈价格区间在12000-13000元/吨。6月份锐钛型钛白粉全国市场商谈均价整体下跌，月内价格变动呈现先跌后稳的趋势，月底收盘均价10558.33元/吨，跌幅7.80%；全国市场商谈主流区间在10000-10800元/吨。
钛白粉之所以价格骤降，与疫情不无关联。
杨逊称，国内外疫情轮番“轰炸”，钛白粉及其下游产品出口受限，持货商交投量收缩严重。同时由于前期大环境不佳，持货商出货压力较大，急于完成任务量和变现心理驱使，对后市行情信心不足。此外，由于持货商低价吸引客户、刺激弹性需求，慢慢演变成严重型“薄利多销”，价格战形势凸显。主要原料钛精矿也是坚挺度不高，随着主力下游钛白粉行情弱势而弱势，给了钛白粉很多下行空间。
“不过目前的价格水平已属近几年低位。基本在无原料资源的生产商成本线僵持，甚至已出现倒挂亏损，价格市场行至6月，已有生产商无心再降，不如停产来的干脆，锐钛型生产商更是如此。”杨逊表示，目前生产亏损厂家多集中在攀枝花地区没有矿源的生产企业，一吨亏损要几百元甚至上千元。低端型的锐钛型钛白粉报价，部分甚至已跌倒1万元/吨以下。由于价格过低，生产商生产热情不高，部分已有限产、限供操作，一方面保证现有客户的稳定供应，另一方面饥饿销售利于推高行情。主要原料钛精矿近期已僵持企稳，从询盘情况来看，矿商已无意低价出货。
大厂表态已几无下跌空间
“现在价格形势下小企业根本不赚钱，整体市场亏损情况比较明显，再往下基本没有下跌空间了。”谈及当前钛白粉价格走势，龙头企业龙蟒佰利相关人士接受证券时报&middot;e公司记者采访时表示，目前公司钛白粉价格还维持在14000元/吨至14500元/吨上下，但很多小企业报价已经低至12000元/吨，低于盈亏平衡线，因此价格再下探可能性不大。近期随着国内疫情控制形势稳定，钛白粉需求已基本恢复正常水平。国外随着疫情常态化，需求也好于四五月份的情况，因此整体下游回暖趋势明显，7月份企业会视市场情况决定价格是否调整。
另一钛白粉行业巨头中核钛白相关负责人也对证券时报&middot;e公司记者表示，当前市场低价形势下，仅余几家龙头企业尚存盈利空间，所以价格基本不存在继续下跌的可能性。“这一轮因疫情带来的市场波动，已经使得部分小企业丧失市场竞争力，大企业的成本控制效果凸显，行业经历进一步洗牌。后期随着需求逐步恢复，低价可持续性不强。公司目前库存水平较低，也会在7月份适时调整产品价格。”
田晓雨也认为，6月末钛白粉市场价格企稳的情况下，7月份市场行情有望回暖，但考虑到厂家前期整体库存压力并未完全消化，国外疫情发展形势的消极影响下出口订单短期内不会转向乐观，外贸不确定性较大，且国内终端需求恢复节奏仍有待提振，价格回升幅度不会太大，预计在500元/吨左右。当前行业开工正在稳步恢复和提升，结合月底市场对厂家发布涨价函的反应情况，业者对后市持偏乐观的态度，预计8月份钛白粉市场行情会有进一步的回暖，市场价格存在回归13000元/吨的可能。
“从目前的市场综合信息来判断，价格市场或大概率利多，但生产商之间共识度不高，以及国内外需求处于疲软状态，仍存在下行风险。国内的价格市场综合走势依然以西南龙企为重要参照，7月上旬或成价格走势关键时间点。短期看，持货商的实单价格坚挺，后市或大概率看涨。”杨逊认为，继续下行空间非常有限主要表现在锐钛型钛白粉生产商，目前价格已经稳定住，成本线限制无价可降，加之出口市场已逐步恢复至正常水平的60%左右，外贸走货量仍在攀升。根据目前的市场交投现状判断，淡季不淡是有可能的。
不过他也提示，未来钛白粉行情利多并不是板上钉钉的事，依然有三个重要隐患。一是时至淡季，内贸需求依然并不乐观，从供需关系来看，并没有较强的拉动力，对后市的持续利多支撑力不足。部分生产商和经销商的移库效应明显，或使旺季提前，透支的是“金九银十”需求。同时，外贸出口仍处于恢复阶段，国际疫情形势依然较为严峻，直接表现为钛白粉的上下游整体出口量到达瓶颈，继续向好恢复较慢。此外，根据海关总署提供统计数据，2019年中国钛白粉出口总量为100.35万吨，出口总量首次空前的突破100万吨，同比2018年增长10.52%。2019年钛白粉出口目标国中，印度排名第一，达12.69万吨，占总出口量的12.65%，而由于印度封国抗疫和中印边界问题，对钛白粉的出口和钛矿的进口还是有一定利空影响的。",2020-07-01 12:59:51,凤凰财经
1,A股再次站上3000点，A50爆拉3%！会调整不？看三大重磅因素,"今日早盘，在众多利好刺激下，A股继续高开高走。
上证指数突破3000点整数大关，深证成指、中小板指、创业板指纷纷再度创出年内新高。盘面上，旅游、酿酒、海南自贸、猪肉等板块涨幅居前，特钢、日用化工、医疗保健等板块跌幅居前。
(image_address=""https://x0.ifengimg.com/ucms/2020_27/6F99AFC1475F3F8F716CF83981CCB7F52895B1AC_w734_h527.png"")
值得注意的是，富时中国A50指数期货涨幅扩大至3%。
(image_address=""https://x0.ifengimg.com/ucms/2020_27/9A8F1E43889A073BB1EB9501A4236E7443C75DCA_w562_h576.png"")
多重因素支撑市场走强
今年早前，上证指数曾有两次突破3000点大关，一次是1月，突破3000点甚至上冲到3100点以上，但碰到春节疫情大爆发罕见的推迟开市，导致市场急速回调数百点。当3月市场企稳好不容易收复3000点的时候，又碰上全球市场巨震，沪指又滑落数百点，有网友戏称满3000减200。
今日沪指梅开三度再上3000点，还会不会像前两次一样深度调整呢？
1、宏观环境不一样，中国经济率先从疫情中恢复。国家统计局最新数据显示，6月份中国制造业采购经理指数(PMI)为50.9%，较上月上升0.3个百分点，连续4个月运行在荣枯线上。当月的分项指数几乎全线飘红，其中，生产指数和新订单指数分别为53.9%和51.4%，比上月上升0.7和0.5个百分点；主要原材料购进价格指数和出厂价格指数分别为56.8%和52.4%，比上月回升5.2和3.7个百分点，双双创下年内高点。
2、流动性方面，央行近日发文称，决定于7月1日起下调再贷款、再贴现利率。其中，支农再贷款、支小再贷款利率下调0.25个百分点，调整后，3个月、6个月和1年期支农再贷款、支小再贷款利率分别为1.95%、2.15%和2.25%。再贴现利率下调0.25个百分点至2%。此外，央行还下调金融稳定再贷款利率0.5个百分点，调整后，金融稳定再贷款利率为1.75%，金融稳定再贷款（延期期间）利率为3.77%。
中信证券在最新发布的研报中指出，再贷款、再贴现是今年央行总量政策中的重要工具，此次调降利率能够更好地支持万亿左右再贷款、再贴现额度加快落地，帮助货币政策“直达”实体经济。而尽管目前已进入了宽松的“下半场”，货币政策针对实体经济的“宽松”难言结束，在7月国债供给较大的时点，降准仍然是重要的政策选项，货币与财政的“合力”可期。
3、各路资金都在争相涌入A股，Wind数据统计显示，北上资金上半年净买入A股1182亿元，融资客融资净买入1259亿元。公募基金上半年募资超万亿元，仅次于2015年上半年牛市募资额。上半年百亿级私募备案新产品数量超过600只，这在私募基金发行史上较为罕见。
外资频频趋近买暴A股的事例接连出现，据深交所今日披露信息显示，截至6月30日，索菲亚QFII、RQFII、深股通投资者持有股份占公司总股本比例达27.98%，逼近“限购线”28%。此外，美的集团、泰格医药、广联达、启明星辰四股的外资持股比例均超过26%。
业绩浪或来临
随着上半年的结束，上市公司半年报披露工作正式提上日程，半年报预增的个股受到市场的追捧，昨日晚间公布中报预增的个股今日全线大涨，业绩浪隐有来临的趋势。
网达软件公告称，在行业政策驱动下，公司主营业务增长较快，大中型客户积极投入大视频业务建设，客户数量、业务规模均呈现上升态势。预计今年上半年现归属于上市公司股东的净利润为3200万元—3800万元，同比增长95.20%—131.80%。今日网达软件一字涨停。
雷柏科技昨晚披露2020年半年度业绩预告，预计归属于上市公司股东的净利润2900万元—3400万元，同比增长943%—1123%。主要受益于外币资金及汇率变动影响，本期汇兑收益较上年同期增加；政府补助较上年同期增加。雷柏科技在昨日涨停的基础上，今日再次一字涨停。
宝通科技也预计2020年上半年净利润为2.17亿元—2.51亿元，同比增长30%—50%。报告期内，子公司易幻网络全球移动网络游戏的发行和运营业务保持稳定增长。子公司海南高图经营业绩较去年同期有大幅增长，成为公司新的业绩增长点。此外，公司继续深化“高端化、国际化”发展战略，国际贸易收入实现了同比大幅增长。宝通科技今日盘中也一度涨停，截至午间收盘仍大涨7.03%。另外宝通转债今日上市交易，开盘大涨30%被盘中临停。
(image_address=""https://x0.ifengimg.com/ucms/2020_27/EFA3AE2778A5186B5A0FD894AE7C8004B1F5BB15_w792_h403.png"")
而业绩上佳的酿酒板块今日也掀创新高浪潮，贵州茅台盘中突破1500元，创历史新高，截至午间收盘报1499.29元，正式实现投资者预期的1股=1瓶酒。五粮液盘中拉升至185元，涨幅高达8.11%，创下历史新高，总市值也历史首次突破7000亿元。泸州老窖则强势涨停，股价迈过百元大关。金种子酒也涨停，老白干酒、口子窖、迎驾贡酒等均大幅上扬。
(image_address=""https://x0.ifengimg.com/ucms/2020_27/0F42EFB368BA59A312BF2FE0CC1B846ADFC22262_w706_h400.png"")
机构：科技与消费仍然是主要方向
中泰证券指出，配置思路上，科技与消费仍然是主要方向。当前极致分化的市场，相对于指数研究或者总量研究，自下而上研究产业和个股的有效性更强。策略投资思路相对简单，建议尊重趋势，除了抱团上述资金合力最强的方向，可以适度提升蓝筹股尤其是行业龙头股的配置比例。
光大证券发文称，三季度形势与二季度有很大的不同，市场将面临由货币驱动向盈利驱动的惊险一跃。当前市场估值已不再明显低估，同时国内货币也不会长期维持高速增长，因而市场上涨动力正由货币驱动向盈利驱动切换。在这个过程中，在企业盈利改善未得到普遍认可之前，政策过度收紧的风险或市场对政策过度收紧的担忧，可能会引发市场短期上行动能弱化的压力，进而使得市场产生短期调整压力，这个短期风险需要引起投资者关注。
中原证券认为，7月份基本面边际回暖以及流动性宽松格局趋势不会变化，资本市场改革加快落地，市场整体氛围尚可，资金继续向股票资产配置，业绩驱动和估值驱动的中期逻辑不变，消费和科技主线仍然有效。短期天气和疫情等因素可能会推动市场途中调整，以及波动率上升。因此我们建议更加注重结构性机会，短线推荐关注食品饮料、新能源汽车、5G、银行、医药和农林牧渔等板块；长线继续建议关注金融、基建、贵金属和优质成长股等。",2020-07-01 12:59:08,凤凰财经
2,A股大突破！大行情要来了？7月精选金股请及时收藏,"作者：数据宝范璐媛
3000点回来了！
股民沸腾了！下半年首个交易日，上证指数小幅高开后一路上探，早盘收涨0.91%，收于3011.77点，自今年3月11日以来重新站上3000点大关。深证成指上涨1.02%，站上12000关口，创业板指数小幅回调，下跌0.36%。房地产、休闲服务、食品饮料行业涨幅居前。
(image_address=""https://x0.ifengimg.com/ucms/2020_27/72FF7F8E929555AFC2652066BA95DCAF0DF2CF9F_w339_h453.png"")
概念板块方面，白酒指数独领风骚，早盘大涨6.44%。受益于海南离岛免税新政正式实施，免税店指数早盘高开上涨近5%。近期表现亮眼的券商指数低开高走，收涨1.24%，领涨龙头光大证券继续上涨3.61%。
(image_address=""https://x0.ifengimg.com/ucms/2020_27/43C2ABC7E366C4773B9BCE99532BA48DBEFC8A2C_w370_h390.png"")
涨价潮来袭，白酒股涨嗨了
今天的上证指数3000点进攻战中，白酒股无疑是最耀眼的明星。早盘万得白酒指数飙涨6.44%，最高涨幅超过7%，已实现周线9连阳。泸州老窖涨停，封单超5亿元，股价跻身百元股之列。金种子酒涨停，五粮液大涨6.82%，市值突破7000亿元，老白干酒、今世缘、古井贡酒等涨幅均超过7%。贵州茅台上涨2.49%，盘中股价突破1500元大关，再创历史新高，总市值突破1.88万亿元。
(image_address=""https://x0.ifengimg.com/ucms/2020_27/A9AFD7F654BFDEC0CD32CAA72B0274232F256E34_w344_h468.png"")
行业动态方面，近期白酒销售出现量价齐升，淡季不淡的情形。据央视财经报道，仅在“618”期间，京东平台的中高端白酒成交额同比增长4倍。随着消费回暖，白酒厂家也纷纷提高了产品出厂价。近日，酒鬼酒、西凤酒业、泸州老窖、汾酒等酒企均发出了涨价函。牛栏山、汾酒等低价酒品种近日也有调价，涨幅从几元到十几元不等。深圳一家大型超市的工作人员介绍，二季度该超市白酒整体销售金额上涨约138%。
国盛证券指出，茅台作为行业风向标，批价恢复至疫前水平，打开价格天花板，品牌酒企积极挺价，需求端逐步企稳，危而后机，白酒行业有望开启发展新周期。3月以来，茅台批价从2000元上涨至2400元左右。4-6月五泸积极控货，五粮液大力发展团购渠道并提出传统商家不增量，近日下发通知上调团购成交价至980元，挺价信号明显。此外，青花汾酒、水井坊等次高端品牌亦下发了涨价通知，增强各区域的价格稳定性。
今年二季度以来，万得白酒指数累计上涨了53.3%，大幅跑赢大盘，贵州茅台、五粮液、水井坊、酒鬼酒、山西汾酒等股价均创历史新高。
“牛市旗手”抢跑，大行情要来了？
自疫情后的低点算起，上证指数已累计反弹了13.5%，创业板指数累计反弹了33.9%，实现周线6连阳，上半年的表现更是牛冠全球。近两周，被誉为“牛市旗手”券商股集体爆发，领涨龙头光大证券近7个交易日累计上涨了50%。
证券时报&middot;数据宝统计，券商股6月份以来获得了杠杆资金、北上资金凶猛加仓。6月份以来融资买盘净买入券商股46.48亿元，同时获融资买盘和北上资金加仓的券商股占比超过七成。
券商股颇受追捧，牛市论调再出江湖。各大券商的中期研判显示，多数机构看好A股后市表现。中信证券看好“小康牛”渐行渐近，安信证券认为未来一个阶段A股的核心依然是“复苏牛”的大趋势，西南证券认为A股科技牛高潮正在到来。科技和消费依然是各大机构看好的投资主线。
资金动向确实显示了市场回暖的趋势。6月A股日均成交额7228亿元，时隔两个月后重返7000亿元之上，北上资金6月累计净买入A股526.8亿元，为年内第二高，最新融资余额已超过1.13万亿元，为近四年半以来的最高值。
券商7月金股出炉
多数机构认为，7月随着中报季临近，市场仍将处于业绩因子主导的环境中，活跃行情仍将持续，投资上应把握中长核心资产和科技创新龙头。数据宝统计的券商7月金股组合显示，电子、医药生物、汽车等是各大机构主推的金股聚集板块。
(image_address=""https://x0.ifengimg.com/ucms/2020_27/5608C66436A2B30D94D37E77EF16BCE33EDD1660_w526_h1163.png"")
声明：数据宝所有资讯内容不构成投资建议，股市有风险，投资需谨慎。",2020-07-01 12:58:32,凤凰财经
3,魏建国：完善产业链，应对反全球化,"后疫情时代，全球产业链、价值链可能出现三个重大变化，需要引起我们重视：
第一，反全球化趋势可能出现一波“回头浪”。一些舆论此前认为，全球化扩大了东西差距、南北差距以及国家内部各阶层之间的差距，激化了发达国家的产业空心化及中下层阶级的衰落。疫情中一些国家的经济衰退及复苏困难，将进一步刺激这些舆论对全球化的反思，其利益受损感将更甚以往。
第二，贸易保护主义思潮可能在多国抬头。这主要集中在通过全球化所形成的大市场格局在疫情作用下出现碎片化，从全球贸易自由化便利化向后倒退至双边甚至单边关税区。这当然是一种过度反思，没有认清全球化业已形成的你中有我我中有你的格局。
第三，全球供应链、价值链格局分化凸显。原先以美加、欧盟、东亚三足鼎立支撑起全球供应链、价值链，形成千万条主次渠道的加工制造业格局，可能在疫情后发生重大改变，由三足鼎立向东亚独强靠拢。疫情中东亚受疫情影响很大，同时防疫工作成果出色，供应链恢复速度很快，得到世界银行和国际货币基金组织的肯定。为了保证主链条的安全，今后，国际资本、技术与人才将跟随供应链、价值链的关键部分，向那些市场优势和潜力巨大，政府与市场配合良好的区域流动。
面对这三大变化，首先，中国需进一步打造以国内市场为主、双循环的产业链和供应链。应该看到，确保本国供应链安全与维护全球化并不矛盾，自力更生不代表与外界“脱钩”。我们的主要目的是确保关键零部件、设备、技术在特殊时期不被人“卡脖子”，保证供应链整体畅通。比如IT产业中的芯片、操作系统，医疗产业中的关键设备、新型药品等要不受制于人，需要自己动手弥补短板；而加工贸易中的汽车零部件、手机装配线等只有与全球产业链深入对接相辅相成才能持续发展壮大。因此，疫情过后，一个开放、稳定、安全的产业链、供应链是我们下一步发展的方向。
其次，需进一步发挥包括粤港澳、长三角在内国内十大产业集群的优势。十大产业集群优势之所以没能得到充分发挥，一大原因是各集群分别与国外挂钩连接，比如，全球汽车产业链一旦受非常事件冲击，湖北汽车零部件加工生产线的上游供应及下游输出都会因此受影响。接下来应该考虑强化优化十大产业集群之间的合作联系，一方面推动传统产业改造升级，一方面鼓励发展新兴产业。
再次，警惕全球化“去中国化”舆论和动作。全球化绝不是中国一家通吃的全球化，把中国作为对手看待，试图关起门打造封闭、独立、保守、自成一体的内循环，既不符合市场经济规律，也不符合本国经济现实。下一步中国在“回头浪”可能甚嚣尘上的环境中，需更多更好地向全球提供整体方案，扛起全球化大旗，推动全球产业链、供应链向细分工、密合作的方向发展。（作者是中国国际经济交流中心副理事长）",2020-07-01 12:04:10,凤凰财经
