,title,content,pub_time,src
4,100%中签机会来了！首批精选层询价开始，估值上演“步步高”,"(image_address=""https://x0.ifengimg.com/ucms/2020_26/43EB55A6175FA4D366BEE44A0071D30A7985BE91_w600_h333.jpg"")
新三板改革再次落下一记实锤。6月23日，新三板精选层首批两家企业颖泰生物和艾融软件正式启动网下询价。
不过，从新三板精选层投资者积极性来看，市场出现较大的分歧，既有热烈参与网下打新并愿意给出高价；也有认为估值太高选择谨慎观望。
如何判断新三板精选层企业估值？有卖方建议可以采用A股打折方法，即选择可比A股上市公司当前估值再乘以50%至80%。从投价报告来看，部分券商给出不低的估值和询价区间。
值得注意的是，与A股不同的是，精选层打新顺位按比例配售。最低申报数是100股起。当网上投资者有效申购总量大于网上发行数量时，实施比例配售。较早申购的投资者有较大概率获100%中签率。对于小资金投资者尤其建议尽早申购。
也有卖方提醒，由于发行市盈率、流通老股等存在差异，A股“新股不败”神话可能难以在精选层企业身上复制；同时，精选层企业网下结构先天缺陷，个人投资者大量涌入，新股由散户定价的后果会是二级收益大幅波动。
本周5家企业开启询价
颖泰生物和艾融软件成为首批步入精选层询价环节的新三板挂牌公司。
全国股转公司中介业务部副总监陈霞在“新三板精选层公开发行与投资价值前瞻云峰会”上表示，颖泰生物和艾融软件两家企业开始询价标志着新三板精选层公开发行进入冲刺阶段。据股转方面了解，投资者报价比较积极。
公开资料显示，上述两家新三板精选层企业询价时间为期2天，具体日期为6月23日至6月24日每日9:15-11:30、13:00-15:00。
(image_address=""https://x0.ifengimg.com/ucms/2020_26/95F5460C52E289F5074E535595DFC48A99F87537_w1080_h243.png"")
(image_address=""https://x0.ifengimg.com/ucms/2020_26/10F237C6F5C22D0F564CAFCC69B9FE5D4A2CF4CE_w1080_h234.png"")
据了解，颖泰生物计划公开发行1亿股，发行底价为4.75元/股；艾融软件计划公开发行880万股，发行价格区间在16元/股至45元/股。
此外，6月24日同享科技、球冠电缆、佳先股份三家新三板精选层企业也将进入询价阶段。这意味着本周将有5家新三板精选层企业进入新股发行询价阶段。
(image_address=""https://x0.ifengimg.com/ucms/2020_26/B29F4399705DD912E8C1A16A614EA95A013DDC5B_w1080_h356.png"")
如何看估值？估值贵不贵？
对于不少新三板个人投资者来说，如何判断新三板精选层股票估值位置，是新的难题。申万宏源分析师刘靖表示，可采用A股打折的方法对新三板股票进行估值，即精选层询价的建议为A股可比公司估值的50%-80%。
具体根据以下步骤进行：
1.选择A股可比公司。后续如果有精选层可比公司可用精选层进行比较；
2.以可比公司的二级估值区间作为基准，得到估值区间；
3.用精选层公司与上市公司进行多因子比较，得出估值区间的大致分位。因子包括以下几类：市占率、增长预期、客户稳定性、技术先进性等；
4.用多因素模式，估算其相对折价率：折价率幅度在20%至50%之间。根据转板预期、可流通比例、行业新兴性、是否有战略配售等进行打分，确定其合理折价率。
对于首批两家新三板精选层企业，卖方分析师会给出怎样的估值建议？从整体来看，卖方对两家企业的询价情况颇为乐观。
据了解，颖泰生物是一家从事农药原药、中间体及制剂产品的研发、生产、销售和GLP技术服务的企业。该公司营业收入从2015年的33.33亿元稳步增长至2019年的52.95亿元，归属于母公司的净利润由1.82亿元增至2.82亿元。
申万宏源根据颖泰生物可比公司估值与精选层折价模型，建议询价区间为4.87元至5.6元。该券商分析师刘靖表示，取可比公司2019年静态估值的18.5倍至21.3倍，考虑到该公司为上市公司子公司，转板有一定的不确定性，给予30%的估值折价，则对应估值为12.95倍至14.91倍。
不过，相比较以下券商，申万宏源对颖泰生物给出的询价范围处于低位。
颖泰生物的保荐机构西南证券，在投资价值研究报告中表示，参考估值区间为5元至9.42元。该券商分析师表示，发行人所在行业为“C2631化学农药制造业”，中证指数有限公司发布的中证全指化学制品指数近一个月平均静态市盈率(截至6月5日)为22.33倍。按照2019年经审计的扣非后归母净利润计算，预计发行人市值对应的市盈率区间为23倍至43倍。
(image_address=""https://x0.ifengimg.com/ucms/2020_26/8651CE10DBE35337C0540936BB0DB1394C001666_w1080_h340.png"")
另一家西南区域券商给出的研究报告，建议颖泰生物网下询价在1.5倍至1.7倍之间，即建议询价范围为10.26元至11.63元，价格区间比西南证券更高。
值得玩味的是，这家券商在给出高询价空间的同时，提醒投资者：不建议长期跟踪和持有颖泰生物。这反映出券商对新三板精选层企业打新和二级市场投资持以迥然不同的态度。
再看另一家企业艾融软件，该公司是一家向金融机构提供深度互联网整体解决方案的计算机科技公司，2019年实现营业收入2.13亿元，扣除非经常性损益后归属于公司普通股股东的净利润3803.71万元，加权平均净资产收益率25.25%，最近三年复合增长率为23.30%。
艾融软件保荐机构光大证券在投价研报中提到，综合绝对估值与相对估值的结果，发行人IPO后参考市值区间为20.60亿元至24.99亿元，对应每股估值区间为27.66元至33.55元，对应2019年PE区间为47.43倍至57.54倍。
据光大证券的盈利预测，预计2020年该公司归母净利润为0.50亿元，则对应2020年PE区间为41.11倍至49.88倍。该公司所在行业近一个月静态平均市盈率为59.69倍(截至6月12日)。
(image_address=""https://x0.ifengimg.com/ucms/2020_26/B52B5C4E9577184D3E822A2EAD6D74677559150C_w1080_h397.png"")
精选层网下结构先天缺陷
面对新三板精选层首批企业网下询价，投资者态度出现较大分歧。
券商中国记者从不少个人投资者及私募了解到，当下市场情绪主要分为两种：一类是炒作首批大涨预期，认为首批亮相的精选层企业会在二级市场迎来资金热炒，因此愿意在网下打新时按询价区间的上限进行申购；另一类资金则认为应该慎重，甚至放弃网下打新机会，认为卖方投价研报给出的估值过高。
申万宏源分析师刘靖就提醒，A股“新股不败”神话可能难以在新三板精选层企业身上复制，需要理性询价，他认为主要有三点理由：
1.创业板由于发行市盈率受限，流动性旺盛，导致了打新风险低，新股溢价率高等现象。
2.科创板呈现出了机构化的特征。首先，科创板有破发现象。1只新股首日破发，共13只股票出现过盘中破发，最大破发幅度为28.8%，平均破发14.3%；其次，新股涨幅与流通市值关系变弱，甚至由负相关变正相关。科创板整体定价更加机构化。这与科创板50万门槛，前五日无涨跌幅限制等制度安排有关。
3.对比创业板和科创板，新三板精选层应该更加理性。高达100万的门槛、涨跌幅达30%，老股不限售等，也都有较大区别于a股其他板块新股。申万宏源计算得到前52家申报公司的平均可流通老股比例，占发行前的总股本为28.28%。
刘靖还表示，新三板精选层网下结构先天缺陷，需理性报价。刘靖在报告其中还提到，由于1000万资产就能开通精选层网下打新权限，导致大量个人涌入，而且没有强制的分类配售规则，机构定价也就并不占绝对优势。
在刘靖看来，新股由散户定价的后果就是二级市场价格大幅波动。网下询价也将呈现“价高者得”特征(即使有高价剔除规定，但在离散报价情况下，剔除后仍将呈现价高者得规律)。如此，在市场情绪好，比如都认为首批有政策红利时，可能会出现定价过高的情形，而在后续又集体撤出，必然又导致二级市场大幅波动。",2020-06-24 09:30:24,凤凰财经
5,中美科技巨头目前的估值合理吗？,"从Uber/Lyft出行双雄失意于二级市场，到美团的成功，我们认为除了公司需具备牢固的壁垒外，合理估值对于独角兽股价的表现亦至关重要。
从独角兽迭出的SaaS板块看，中美SaaS细分领域龙头中，符合40%法则的一般也享受较高估值，SaaS企业估值水平与营收增速及净利率有着密切关系，也正是40%法则的精神。
另外疫情至今市场进入多空博弈的态势，科技巨头FANGMA仍然领涨美股，是时势造英雄，还是估值得宜？
我们建议在海外疫情还未明朗之前，可关注疫情相关度较低或利好的在家办公板块，以及FANGMA，但避免疫情相关度高的旅游板块。
世上没有神话，在烧钱和不可思议的估值与目标的疑团中，到底谁是独角兽，谁是驴子？我们将透过一系列以新经济与独角兽为题的研究，探讨这些公司成功与失败的因素。
从美股出行双雄失意于二级市场，到美团(03690)的成功，看估值对于独角兽股价表现的重要性。
2008年金融危机前后催生的独角兽正逐步完成从一级市场向二级市场的转化，但ToB和ToC端独角兽在IPO后的表现荣辱互见。影响他们表现的其中一个重要因素就是合理的估值方法。独角兽处于公司发展的成长期和加速期。他们多具备创新业务模式且尚未盈利，所以健全且友好的估值体系无疑会为公司提供一个公平的融资环境，有助资本市场对其的认可。
作为去年独角兽龙头的Uber和Lyft，上市后即破发，后续股价表现低迷，IPO估值过高是其中一个重要原因。
我们认为Uber的DCF估值里存在着各种不确定性，主要在于长期成长部分属于DCF估值的重点。
而我们认为Uber在无人驾驶领域并没有明显的技术壁垒及优势，导致长期在无人驾驶普及后，公司的出行寡头地位很有可能受到无人驾驶技术壁垒较高的竞争对手，如谷歌、特斯拉和通用等所动摇。
另外，DCF估值方法里假设变量繁多且复杂，折现率的变动或关键假设一旦有所偏差，也将极大影响公司整体估值。
目前，Uber市值约560亿美元，较IPO初820亿美元下滑32%，Lyft当前市值约107亿美元，较IPO初下滑超55%。从一级市场融资轮次推算，Uber目前市值与2016年5月G轮融资投前600亿美元接近；而Lyft则相当于2017年10月H轮融资投后估值113亿美元。
相对于Uber，同属ToC端的独角兽龙头美团却掌握了流量变现的要诀。
美团业务集外卖、到店酒旅和新业务于一身，绑定了生活不同细节和需要，完善整个生态闭环，自身拥有庞大流量。美团成功将流量变现，并通过规模效应去进一步降低成本，逐步垄断行业。
我们对三大业务不同的成熟度及商业模式，使用不同估值推算方法：1)外卖业务采用DCF；2)到店酒旅业务盈利模式成熟采用P/E估值，对标Expedia、Booking及携程等；3)新业务旗下业务众多，投入较大，盈利模式还在探索中，因此采用P/S估值；最后采用分部估值法(SOTP)加总得出最终估值。
目前美团市值约1300亿美元，对比IPO时528亿美元。美团在上市前2017年10月的F轮融资，和2018年9月IPO时的P/S估值分别为16x和10.2x，对比目前的9.7倍，上市前估值尚算合理。
中美SaaS细分领域龙头中，符合40%法则的一般也享受较高估值。
SaaS企业的估值水平与营收增速及净利率有着密切关系。ToB端SaaS细分领域龙头标的表现普遍突出。除了鉴于上市前的估值较为合理外，近年企业积极转云降本增效，加上SaaS订阅服务拥有稳健的现金流，商业模式备受热捧。近期更受卫生事件下「宅经济」的刺激，这些标的更屡创新高。
SaaS企业的估值主要采用PS和EV/Sales的相对估值法以及行业中流行的40%法则。热门标的如Zoom、CrowdStrike、Zscaler、Datadog、DocuSign及Shopify等，P/S估值均超过20倍，并在40%法则排名中靠前，主要鉴于高营收增速。反观，ServiceNow和Adobe等较成熟SaaS企业则凭借较高的利润率，同样在40%法则中名列前茅。
40%法则的计算方法为，营收增长率+净利率(或现金流率)之和必需达到40%或以上。满足这个水平的公司大多可获更高估值。40%法则的灵活性在于对处于高增长的早期公司的现金流和盈利要求较为放宽。反过来，对增长开始平稳的成熟公司的利润率要求较严格。
在国内，科创板的金山办公凭借62%的超高增速及28%的利润率，位列A/H股SaaS企业40%法则第一排名，并且享有估值溢价，其2020EPS高达47.4x。中国有赞尽管净利润率为负，但其收入增速高达73%，使得其也跻身40+俱乐部。其他包括，恒生电子、会畅通讯、微盟(02013)和卫宁健康等，作为各自细分SaaS行业的龙头，也同样跻身40+行列。
美股进入多空博弈，科技巨头FANGMA领涨美股，是时势造英雄吗，还是估值得宜？
卫生事件至今市场进入多空博弈的态势。3月23日以来美股从底部反弹，基本已接近回到前期高位。
我们认为美股从现在到11月初大选，是特朗普力挽狂澜的时机，叠加美联储QE的配合，美股或能持续在高位震荡，我们认为投资者可保持谨慎乐观态度。
但对目前最大的不确定性也不容忽视。对于卫生事件或二次爆发、实体经济的损害尚未浮现以及中美关系的发展，投资者仍需有所警惕。加上大选在即，特朗普为求连任，或会加剧摩擦来拉拢摇摆州选民的支持。
我们认为美股这波上涨行情主要是基于Fed的无限QE让资金充分流向股票市场，特别是往优质资产FANGMA之类(长逻辑)或往受卫生事件影响前段跌幅较大的旅游相关股(短逻辑/波段性)堆砌。
我们建议在海外卫生事件还未明朗之前，还是保险起见，可关注卫生事件相关度较低或利好的板块，如云计算(软硬件)、电商、游戏、流媒体、必选消费和医疗医药等；但避免卫生事件相关度较高的旅游板块。
FANGMA等科技巨头股价持续跑赢标普，估值也一路走高。我们认为巨头当中，微软(MSFT.US)、亚马逊(AMZN.US)、阿里巴巴(09988)、腾讯(00700)和京东(09618)的业务属于前者。
科技巨头业务众多，对类似亚马逊、阿里巴巴、腾讯和迪士尼(DIS.US)等巨头，市场一般采用SOTP进行分部估值，并根据各业务属性及成长阶段选择可比公司和估值指标。而对于单一估值难以判断或不够准确时，如奈飞，我们会采用FootballField估值，利用多组相对估值的最高最低区间综合得出目标价区间。目前我们认为科技巨头估值尚算在合理水平，但个别受惠于卫生事件而涨幅较多的标的，如奈飞(NFLX.US)，估值或已过高。
（文章来源：中信证券研究）",2020-06-24 09:16:43,凤凰财经
6,小米又要回购了！上市以来已回购41次，此次规模上限300亿，能否改变股价颓势？,"6月23日晚，小米集团公告称，经股东大会同意，授权董事回购不超过本公司已发行股份总数10%的股份。以小米当前市值计算，此次回购金额上限或高达300亿港元。
上市以来已回购41次，股价至今仍低于发行价
2018年7月9日,小米集团正式在香港主板上市,发行价为17港元/股。然而开盘当日即遭遇破发，跌幅达2.35%，不仅没有实现雷军2000亿美元市值的心愿，股价还一路走低，至2019年9月2日盘中创下了8.28港元/股的上市新低，较发行价已经腰斩。2019年9月3日，小米集团公告称将以最高总价120亿港元适时于公开市场购回股份。此后小米股价至2019年11月起逐步回升，今年年初一度升至14港元，截至6月23日，报收12.72港元/股，总市值为3062.39亿港元。
(image_address=""https://x0.ifengimg.com/ucms/2020_26/AB4349C98F6B83AA0F2335FC54026C85BC455C46_w473_h670.png"")
根据财报，小米2019年全年总收入为2058亿，同比增长17.7%；经调整后净利润为115亿，同比增长34.8%。2020年第一季度，公司总收入为497亿元，同比增长13.6%；调整后净利人民币23亿元，同比增长10.6%。另据全球市场调研机构Canalys发布的数据，小米凭借9%的同比增长率成2020年一季度全球手机市场同比增长幅度最大的公司。
据统计，上市以来小米集团共进行了41次回购，合计回购3.87亿股，回购金额32.95亿港元，其中今年进行了2次回购，合计回购4841万股，回购金额近5亿港元。
小米集团当前总股本为240.75亿股，也就是说此次回购或涉及24亿股，参照6月23日12.72港元/股的收盘价，需资金305亿港元左右。根据最新的财务报表,小米集团拥有660亿的现金储备，且前段时间还成功发行了10年期总金额为6亿美元的美元债，回购股份资金方面没有问题，然而能否提振股价还有待观察。
市场人士分析表示，小米上市后股价表现一路向下，不断地抛出回购计划，主要是为了稳定投资人信心。但是中长期股价能否扭转跌势，需要观察公司在互联网业务上能否重拾高速增长。当前，小米互联网业务收入增长缓慢，不能令投资人信服小米是一家互联网公司。而从硬件公司来看小米目前的估值，是较为合理的。
港股回购潮
事实上，回购股票在港股十分常见，大部分原因是股价被低估，或是市场低迷，欲向投资者传递信心。
据有关机构统计，在港股历史上曾出现过三轮明显的回购潮，基本都是在市场低迷时期。第一轮发生在2008年全球金融危机期间，那一年港股上市公司回购总额达到175亿港元；第二轮发生在2011年下半年至2012年上半年，其间港股上市公司整体回购金额约121亿港元；第三轮回购潮出现在2015年6月至2016年6月，其间港股上市公司累计回购金额近300亿港元。
2018年下半年至今则是新一轮的回购潮。本轮回购的公司涉及房地产、医疗保健、互联网、消费品、金融等多个行业，中资股更是其中的主力军。
其中，中国恒大自5月起开始回购，至今累计回购股数1.88亿股，回购金额32亿元。与之相对应的，其股价也一路攀升，近两月涨幅超50%。
(image_address=""https://x0.ifengimg.com/ucms/2020_26/258140C7C0D793CA9B51E05EB44F640C4A01146A_w473_h679.png"")
A股也现回购潮
A股近来也出现回购潮，并频频出现大额回购。Wind统计显示，今年以来，A股市场已实施回购金额达84亿元。
今年2月，美的集团抛出了最高可达52亿元的回购方案。2月21日晚间公告，公司拟回购不超过8000万股且不低于4000万股公司股份，回购价格不超过65元/股，预计回购金额不超过52亿元，回购的股份将全部用于实施公司股权激励计划及/或员工持股计划。消息公布至今，美的集团股价上涨约8%。
(image_address=""https://x0.ifengimg.com/ucms/2020_26/16420C76C92E0166A5C50AF0CA29A2E0EC3EDE58_w473_h629.png"")
5月6日，格力电器公告了《关于回购部分社会公众股份方案的议案》，资金总额不低于人民币30亿元（含）且不超过人民币60亿元（含）；回购股份价格不超过人民币70元/股。该公告发布后，格力电器股价上涨，不过目前出现调整，总体涨幅不大。
(image_address=""https://x0.ifengimg.com/ucms/2020_26/24C71BC662FA5FE2E2C5F01A81A497C61A0B5E1B_w473_h632.png"")",2020-06-24 09:16:25,凤凰财经
7,WEMONEY朝闻：浙江首推小微企业首贷考核；怡富保险代理上线车损互助,"浙江首推小微企业首贷考核全年户数比重不低于15%
对于不少小微企业来说，从银行借到第一笔钱并非易事。疫情后，“零信贷”企业的贷款需求也开始激增。为解决这一难题，部分省份已推出了相应监管措施。据了解，中国人民银行杭州中心支行已印发《浙江省小微企业首贷考核办法》，这也是首个省级出台的小微企业首贷考核办法。据悉，央行杭州中心支行从夯基础、抓考核、优机制、筑平台四个方面采取有力措施，力争2020年全省小微企业首贷户数占全部小微企业贷款户数比重不低于15%。【第一财经】
怡富保险代理上线车损互助业内：流量小成本高做好并不易
近日，新三板挂牌保险中介怡富保险（873221）宣布，已与山东微联相互电子商务有限公司签署全面合作协议，共同推出专门为车主车辆设计的“怡富互助”。当下，“保险+互助”模式风靡，但主要集中于大病互助领域，此次又有保险中介选中车损互助领域，或意味着网络互助抢滩升级。事实上，车损互助平台早已出现，但并未像大病互助一样蓬勃发展，多家平台已停运。业内人士表示，除了监管对车险及相关业务较为谨慎外，目前，车损险市场渗透率较高，会挤压到车损互助市场，同时，车损本身属于高频事故，成本损失较高。【蓝鲸财经】
违规担保授信超标中小银行关联交易乱象何解
盘锦银行的3张罚单让中小银行违规关联交易问题再度浮出水面。6月23日，记者不完全统计发现，开年至今已有多家商业银行因向关联方授信超标、违规发放贷款、违规向关联方融资行为提供隐性担保等问题受到监管处罚。在分析人士看来，近年来银行关联交易乱象频发，主要是为了躲避监管，变相开展表外业务，获取利润，监管应严格审查，从源头追溯关联交易状况。【北京商报】
中国支付通2020财年预亏7亿港元上年亏损约3.08亿港元
近日，港股上市公司中国支付通（08325.HK）发布公告，公告表示，预期截至2020年3月31日的年度未经审核综合亏损约7亿港元，而就截至2019年3月31日止年度则录得亏损约3.08亿港元。中国支付通表示，影响2020年财政年度的未经审核综合亏损大幅增加主要是由于：预付卡及互联网支付现金产生单位及其高端权益先进产生单位分别产生的商誉减值亏；贸易应收款项、应收贷款及其他应收款项亏损拨备及撇销；开联通支付服务公司违规事件以及新冠疫情的爆发对整体业务造成不利影响。【每日经济新闻】
东方金钰年亏18亿将被*ST旗下小贷全部逾期净亏3千万
6月23日，东方金钰（600086.SH）停牌，股票简称将于次日变更为“*ST金钰”。据年报数据，东方金钰在2019年营业收入约5406万，同比下降98.17%；归属于上市公司股东的净利润为负18.27亿，亏损同比扩大6.34%。东方金钰在报告中表示，全资孙公司深圳市东方金钰小额贷款有限公司发放贷款已全部逾期，预期无法全部收回，未确认利息收入。2019年，东方金钰小额贷款业务无收入，业务成本录得约4054万，计入资产减值损失计提、折旧费和摊销后，营业亏损约4054万，净亏损约3041万。【蓝鲸财经】
中小银行股权不香了近1700笔拍卖六成流拍
6月23日，根据淘宝拍卖的数据，2020年已有接近1700笔银行的股权拍卖，其中农商行占比最多，但有6成以流拍告终。6月19日，据阿里司法拍卖网信息显示，辽阳银行8000万股权再次以流拍收场。记者根据阿里拍卖平台的数据梳理，2020年以来共有1659笔股权拍卖，涵盖各地区的城商行、农商行、农村信用社以及村镇银行，其中农商行的数量最多。【21世纪经济报道】
整理：张国栋",2020-06-24 09:09:05,凤凰财经
