,title,content,pub_time,src
0,美国暂停“数字税”谈判并威胁关税报复 或将引发美欧新一轮贸易战,"美国与欧洲国家围绕“数字税”的纷争战火重燃。
法国经济与财政部部长勒梅尔18日确认，美国财长姆努钦已致函法国、英国、意大利、西班牙四国财长，宣布美国将暂停在经济合作与发展组织框架下的“数字税”相关谈判。
姆努钦同时警告，如果欧洲国家推进征收“数字税”计划，美国可能会对这些国家加征关税。
此举立即引发欧洲国家的强烈不满。经合组织更是警告称，美国的行动或将引发新一轮贸易战。
(image_address=""https://x0.ifengimg.com/ucms/2020_25/F405DC2DCF3AA7C0FCEF95C3FB5ABEE7633C7DC0_w1080_h593.jpg"")
谈判即将达成协议美国却发“分手信”
据报道，姆努钦在信中表示，美国无法同意对全球税收法律作出影响互联网领域“美国企业领先”的修改。因此，美国将暂停“数字税”谈判。姆努钦同时警告，如果欧洲国家推进征收“数字税”计划，美国可能会对这些国家加征关税。
法国经济与财政部部长勒梅尔表示，在各方就“数字税”谈判即将达成一致的时候，美国的这一表态是对所有经合组织成员的一种挑衅。“美国在对待作为盟友的英国人、意大利人、西班牙人，以及我们法国人时，用威胁性的话语说：‘如果你们不那样做，我们就要制裁你们。’”
(image_address=""https://x0.ifengimg.com/ucms/2020_25/F2788126B0E3DE6AF5E268F485DD1170DB4C50B9_w1080_h587.jpg"")
法国经济与财政部部长勒梅尔
勒梅尔表示，他和英国、意大利、西班牙财长已联合致信美国财长姆努钦，希望能够尽快在经合组织框架内就征收“数字税”找到公平的做法。
欧盟委员会负责经济事务的委员保罗&middot;真蒂洛尼也发表声明，对美国此举深表遗憾。真蒂洛尼同时表示，欧盟委员会希望就“数字税”达成全面方案，并支持在经合组织框架下进行的相关谈判。但如果谈判无法在今年达成结果，欧盟将会就征收“数字税”提出自己的方案。与此同时，欧委会将与在征收“数字税”方面取得进展的所有成员团结一致，如有必要，将会作出统一反应。
(image_address=""https://x0.ifengimg.com/ucms/2020_25/1500EDB11D7360DAF515394C76AE4F8FCDC6EA38_w1080_h953.jpg"")
保罗&middot;真蒂洛尼在社交媒体上发表声明
“美欧正迅速走向一场贸易战”
欧美媒体的报道聚焦美国暂停“数字税”谈判的两点重要表态：一是美国认为“数字税”会影响美国互联网企业的领先地位；二是美国威胁将对继续推进“数字税”的国家实施关税报复。
美国“政治”网发表文章认为，欧洲和美国正迅速走向一场贸易战，“争论的焦点是谁有权向谷歌、脸书和亚马逊等数字企业征税”。在美国暂停谈判之际，欧盟和法国官员都强调继续支持“数字税”计划，这可能招致美国的报复。
(image_address=""https://x0.ifengimg.com/ucms/2020_25/7EB12618EE932F3B56819CAF7586DE8C46D0260A_w886_h269.jpg"")
美国消费者新闻与商业频道（CNBC）援引专家分析称，“现实政治”已渗透到数字贸易领域。美国这个“数字税”谈判最重要的参与国不再参加多边治理的讨论，同时威胁采取报复性措施企图阻止其他国家推进各自的计划。迎接双方的结局，很可能是贸易战。
(image_address=""https://x0.ifengimg.com/ucms/2020_25/8E14383E40DA57704CCF539202385A8A93602439_w812_h322.jpg"")
美国消费者新闻与商业频道报道截图
美欧“数字税”争端由来已久
近年来，以美国企业为代表的一些大型互联网企业纷纷落脚在税制宽松、税率偏低的欧洲国家，造成一定程度上的税收不公。这也引发了美欧多国在“数字税”问题上的争端。
(image_address=""https://x0.ifengimg.com/ucms/2020_25/1A5E3D11ABF2292ED2A6A4DF27071C88F7ABA473_w1049_h590.jpg"")
2018年3月，欧盟委员会就公布了立法提案，拟调整对大型互联网公司的征税规则。在征收“数字税”问题上，法国、英国、意大利、西班牙等一直比较积极。
以法国为例，法国参议院2019年7月批准了向跨国互联网企业征收3%数字服务税的法规，美国随即施压——当月就宣布对法国“数字税”启动“301调查”。
(image_address=""https://x0.ifengimg.com/ucms/2020_25/8B7928A1A07882CB1BFE697459791BD20D8767F0_w1080_h782.jpg"")
所谓“301调查”，源自美国《1974年贸易法》第301条。该条款授权美国贸易代表可对他国的所谓“不合理或不公正贸易做法”发起调查，并可在调查结束后建议美国总统实施单边制裁。
除法国外，今年6月2日，美国贸易代表办公室宣布，将开始对10个已执行或正在考虑“数字税”的贸易伙伴发起“301调查”，包括欧盟、英国、奥地利、捷克、意大利、西班牙、土耳其、巴西、印度和印度尼西亚。这也被认为是美国暂停“数字税”谈判的先兆和准备动作。
(image_address=""https://x0.ifengimg.com/ucms/2020_25/EB1459E2D9DD14746F7EC5CBEBE68B1CCA4CC91F_w621_h320.png"")
图片来源于网络
今年年初美欧等国同意就“数字税”展开谈判时，美国财长姆努钦就明确表示：“我们认为数字税的本质是带有歧视性的。如果有人想随心所欲地向我们的数字企业收税，我们也将考虑随心所欲地向他们的汽车企业征税。”
“美欧经贸摩擦势必加剧影响全球经济复苏环境”
中国国际问题研究院世界经济研究所所长姜跃春在接受环球资讯广播采访时分析认为，“按照美国人的想法，谈判没能按照美国的要求取得进展，就相当于没有任何进展。美国人认为没达到自己的目标，所以就会退出谈判。”
(image_address=""https://x0.ifengimg.com/ucms/2020_25/621F105FDEBC135E24AA38DD16C12AABB54BC480_w250_h312.jpg"")
姜跃春",2020-06-20 19:52:53,凤凰财经
1,网易、京东或掀起中概股回归潮，下一个“回家”的会是谁？,"近期，“回家”成了中概股的热词。
继去年阿里巴巴赴港二次上市后，今年六月网易、京东也相继回归港股。业内预计更多在美首次上市的中资公司可能回归，香港是二次上市的潜在目的地之一。
有资深中概股业务人士称，目前看到回港二次上市的主要以头部网络科技公司为主，二次上市比起私有化后回归上市的资金、时间成本也低很多。在美中概股上市公司私有化要面对投资人诉讼、董事会审议通过等复杂程序，二次上市相对节省了各种成本。
阿里、网易、京东的“回归路”
去年阿里巴巴回归港股成为了市场期盼的大事，也是去年港股市场最大的IPO。
2019年11月26日，阿里巴巴(9988.HK)在港交所正式挂牌上市，成为首家在中美两地同时上市的中国互联网企业。事实上，阿里巴巴在赴美上市之前曾谋求在香港上市，但因为股权结构的原因未能成功。赴美上市的第一天，马云便承诺“只要条件允许，我们就会回来”。
6月11日，网易正式在香港联交所鸣锣上市，开盘价133港元，较发行价123港元上涨逾8%。数据显示，网易此次公开发售共计接获37.1万份申请，合共认购18.57亿股，超购近360倍。
也是在同一天，赴港二次上市的京东确定最终发售价，为每股226港元。股票于6月18日在港交所上市，成为港交所第四家同股不同权的上市公司，并与阿里、网易一样，成为同时在美国、香港两地上市的公司。
(image_address=""https://x0.ifengimg.com/ucms/2020_25/FFE4A5C30F372AC069F2C18D11754A91E953BE71_w1150_h2342.png"")
东吴证券认为，此前在香港上市的阿里巴巴已做出成功示范，吸引网易、京东等回港上市。中概股的回归利好港股长远发展，将为港股市场增加更多新投资标的并引入更多资金。
中概股为何纷纷回港上市？
不论是外部环境因素，还是自我发展需求，回归对中概股都有着莫大的吸引力。
5月20日，美国参议院通过的“外国公司问责法案”规定，若外国发行人连续三年未能遵守PCAOB（美国上市公司会计监督委员会）对会计师事务所检查要求，将禁止其证券在美国交易。由于中国法律对PCAOB获取中概股审计底稿存在一定约束，导致市场对美股中概股摘牌的担忧加剧。
(image_address=""https://x0.ifengimg.com/ucms/2020_25/BDB9AE40075ADF21425D727569F8D0D0E2EE757A_w1116_h1341.png"")
北京市中银律师事务所律师阮万锦表示，香港联交所对同股不同权、上市条件等监管放松，都会激发更多在美中概股上市公司回港二次上市热情。
此外，即使不考虑监管风险，中概股回归仍或是大势所趋。
过去规定下，AH市场上市制度限制未盈利、同股不同权等公司上市，部分优质“新经济”企业只能选择赴美上市。2018年以来，AH市场对于“新经济”公司上市的条件逐渐放宽，制度层面已不再存在限制。
业内人士表示，港股本身的估值不高，但对于科技类企业却往往能给出较高的估值。回港上市后这种套利空间也是推动中概股回归的一大主要动力。此外，对中概股公司而言，二次上市可以再次融到资金开展业务，同时公司股票的流动性也能大大增强，所以从公司角度来讲，是合理且有利的事情。
这些中概股或加速回归
据Wind资讯统计，目前在美上市的中概股，以科技、消费类企业为主，共251家，总市值达1.71万亿美元。业内人士表示，互联网教育机构有可能是此轮回港上市的主力军之一。
(image_address=""https://x0.ifengimg.com/ucms/2020_25/88D471587CD3558F3443C3790F24EB02B3584C3E_w799_h766.png"")
(image_address=""https://x0.ifengimg.com/ucms/2020_25/19587D6F01B0517836793CE27A3902E1C3A3A18E_w799_h853.png"")
瑞银证券中国股票策略团队分析，目前42家在美首次上市的中资公司符合香港二次上市的要求，即市值大于400亿港元，或市值大于100亿港元且当期收入超过10亿港元。一旦在香港上市，现有股东可将美股转换成港股，上市公司在满足一定条件后可选择申请在香港首次上市。市值小于100亿港元的约180家在美首次上市的中资公司可以私有化、退市或在其他地方再次上市。
德勤预计，全年有5至8只中概股到香港上市，全年融资金额介于1600亿至2200亿港元。
据港交所于2018年修改二次上市规则，以大中华为业务重心的公司在港实现第二上市，可保留现行VIE（协议控制）结构及不同投票权架构，但必须在纽交所或伦交所等英、美市场上市并至少两年保持良好合规记录，且市值不少于400亿港元，或市值不少于100亿港元及最近一年度收益至少10亿港元。
(image_address=""https://x0.ifengimg.com/ucms/2020_25/3E1AB4BC0E71F347598F2CA32CDACA720B7235BF_w799_h600.png"")
按照这个规定，统计显示，符合条件的教育公司包括好未来、新东方，以及在线教育龙头跟谁学。
(image_address=""https://x0.ifengimg.com/ucms/2020_25/8F35CAEE75EAC0108C9DE9EAD68CD9C5B812B58F_w1150_h2290.png"")
A股市场也将获益
中概股回归港股二次上市，对A股有何影响？粤开证券表示，短期来看，中概股大量回归港股，可能会分流一部分资金，尤其可能影响A股市场中部分价值被过分高估的科技股。但长期来看，中概股回归港股对A股的影响比较正面：一是借由中概股在港股上市，带动更多海外资金关注和投资A股；二是可能会一同提升AH股科技板块、新经济板块的整体估值和交易活跃度；三是随着A股试点注册制改革的逐步落地、资本市场基础性制度的完善，中概股回归增多的现象也可能会在A股市场接连上演，为A股市场带来活力。
哪些A股板块有望受益于中概股回归？博时基金认为，中概股中很大一部分以互联网及电商的创新商业模式为代表，国内资本市场对互联网经济广为接受并高度重视，中概股回归必将利好A股。从投资者视角看，中概股回归港股对A股科技板块有正面影响，整体上有互补作用。A股科技板块主要是消费电子产业链、半导体产业链、新能源产业链、光伏产业链和云计算等，中概股则集中在电子商务、在线教育、在线医疗等新经济领域，这些优质龙头公司有望与A股部分优质公司形成共鸣，也会吸引很多国内机构投资者关注。",2020-06-20 19:46:17,凤凰财经
2,线上销售火爆！如何投资家电股？最佳分析师这样说,"由于高分红、低估值，家电板块一向受到市场青睐。在过去13年，家电行业11次跑赢大盘。
但家电这个白马辈出的行业，今年在遭遇疫情黑天鹅后，一季度几大龙头企业营收净利纷纷下滑，家电板块压力显著。而6月以来，随着线上促销，家电消费市场也一夜入夏。那么对于投资者来说，如何鉴别家电股的投资价值呢？
近日，上证报记者专访了长江证券家电首席分析师管泉森。他表示，从二季度开始，家电需求端已呈现比较明显的复苏趋势，整个行业会有比较好的一个反转机会，配置性价比突出。
二季度改善趋势确定
家电市场在疫情后的首个大型电商促销节点迎来大爆发。大牌、爆品、新品持续旺销，电商平台家电销售数据喜人。
在管泉森看来，家电内销拐点已现。5月家电社零同比增长4.3%至738亿元，增速较上月改善12.8%，继1-2月、3月、4月分别下滑30.0%、29.7%、8.5%后，年内首次实现单月正增长，且6月首周行业线上销售十分火爆，终端景气回暖信号已十分明确，家电板块二季度经营环比改善趋势确定。此外5月住宅竣工面积同比增长9.7%，在合同约束下竣工集中释放周期仍在继续。
“我们相信从二季度开始，整个行业将迎来一个比较好的反转机会。一季度是历年以来表现最差的一个季度，二季度环比一季度改善，预计下半年比上半年更好，全年是一个前低后高的走势。”
在整个家电行业受到疫情冲击的背景下，小家电行业则逆势火爆。在家大展厨艺的潮流下，电烤箱等厨房小家电受到市场欢迎。除此之外，线上销售的火爆也带动了小家电市场的需求。管泉森表示，市场对线上渠道关注度仍在升温。随着电商渠道渗透率持续提升、内容营销模式打通并逐步成熟，小家电新兴品类扩张趋势仍将延续。反应敏锐、提前参与渠道变革趋势的品牌龙头具备先发优势，预计后续仍可维持较好业绩表现。
“家电线上消费是一个大趋势，未来占比还会继续提升。”管泉森表示，很多传统企业也在尝试做更多线上渠道的销售。比如格力董明珠开启了“企业家直播”先河，月初的直播活动成交额达65.4亿元。站在渠道变革角度，管泉森给予了“格力董明珠店”比较积极的看法。他认为，这种直播带货的形式是线上线下相结合的新模式，未来一段时间这样的活动还会有很多。
配置性价比突出外资再现底部布局
另外一个不容忽视的现象——外资普遍看好A股家电龙头。
比如2019年末家电板块在QFII板块配置中就排名第二，截至现在家电板块在沪深股通板块配置中排名第三。
管泉森表示，从资金层面来看，在家电行业基本面压力最为显著的2、3月，北上资金持续呈净流出态势。但随着家电行业回暖趋势启动，4月以来北上资金已经重回增持通道，其中5月在外资整体净流出背景下，家电行业仍吸纳资金流入，外资底部布局特征再度充分显现。
后续来看，管泉森认为，随着外资松绑、中国取消境外机构投资者额度限制等措施，北向资金配置该板块的资金流入量不容小觑。
管泉森表示，过去家电板块跑赢大盘的胜率非常高，但如果做业绩跟估值的拆分，其实很多年份里面主要依靠业绩高增长驱动整个板块获得较好的回报，估值的钱并没有赚到。未来5至10年会进入一个新的阶段，业绩端依然可以保持稳健增长，同时估值维度一些优质公司将逐步与国际接轨。
“目前中国家电龙头整体的财务指标都比海外同类公司更好，但估值反而更便宜，这是为什么外资喜欢买A股家电龙头原因。在外资限制逐渐放开的背景下，家电龙头估值中枢系统性提升，板块估值天花板有望进一步打开。”
挑选牛股看重两大维度
家电出牛股，未来这些家电股还有空间可挖吗？谁还会继续保持牛股本色，谁又会成为下一只大牛？
管泉森表示，挑选牛股主要看行业空间和竞争格局的两个维度。“最好的生意模式是空间很大，可以在一个品类内不断复制自己，将企业做得更大；另外一个重要维度是竞争格局，如果别人复制不了，那么企业就可以越做越强——行业空间决定收入端，竞争格局决定盈利端。”
具体来看，管泉森表示，行业空间维度经常用的一个指标是百户保有量，看不同品类在中国目前的渗透率水平，与发达国家做对比，目前保有量还不高的品类，后面会有较好的提升空间。空间维度除了关注销量，还需要关注价格；比如空调、冰箱、洗衣机在过去10年价格整体呈现提升的趋势；产品结构升级驱动行业均价不断提升，对行业整体规模会有比较好的驱动。
在管泉森看来，格局维度很多时候可能比空间更重要，因为竞争格局决定了谁能够持续享受行业空间扩张的红利。具体来看就是要挖掘哪些企业有更深的护城河。家电产业链从最前端的原材料采购，到中游的零部件生产、整机组装；再到下游的渠道流通以及售后维护，其中又涉及研发、营销等等，每个环节的都很重要；不同家电品类具备不同属性，其各个环节的影响权重不同，但每个环节的护城河都是需要关注的。
“大家电是典型的市场空间很大，比如空调，二线企业很难去跟格力、美的竞争，因此龙头可以强者恒强。”管泉森表示，“小家电行业单品类空间相对有限，因此需要持续进行品类拓展和产品迭代；产品创新能力比较强的公司，成长性会更为突出。”",2020-06-20 19:22:29,凤凰财经
3,刘庆峰：人工智能要解决刚需，科大讯飞这样让华为避免被“卡脖子”,"(image_address=""https://x0.ifengimg.com/res/2020/DFCCAC38A0EE8C7DCAFCCCCD95C8E5F02752A45C_size54_w1080_h575.jpeg"")
刘庆峰认为，每一次重大疫情都是人性的试金石，是企业核心能力的试金石，同时也一定会诞生一批伟大的公司。后疫情时代，在民生保障的薄弱短板，一定有人工智能的机会。
文｜《中国企业家》记者刘哲铭
编辑｜李薇
“人工智能一定要解决刚需，而不是做一些可有可无的噱头性的东西。”6月20日，在《中国企业家》杂志社主办的2020（第二十届）中国企业未来之星年会暨中国企业家生态大会上，科大讯飞董事长刘庆峰这样说。
“刚刚结束的618电商节，科大讯飞拿到了22项销售冠军，包括翻译机、录音笔和其他办公用品，总体销售增长了40%。”刘庆峰开场便分享了好消息。他认为，疫情下的销售增长，都来自刚需。
科大讯飞是一家从事智能语音及语言技术研究、软件及芯片产品开发的科技公司，成立于1999年12月30日，旗下核心技术有语音识别技术、语音评测技术、面对面翻译等。2008年，科大讯飞在深圳证券交易所挂牌上市，目前市值774亿。
智能硬件销售增长40%，都是刚需
刘庆峰透露，刚刚结束的618电商节，科大讯飞拿到了22项销售冠军，包括翻译机、录音笔和其他办公用品，总体销售增长了40%。扣除掉因疫情影响下翻译机的大幅度下降，其他所有硬件的增长超过140%。
刘庆峰认为，这可以看出疫情下大家对数字经济消费和人工智能应用的需求。录音笔、办公本等可以大幅提升每个人的能力。
谈及疫情激发的消费需求，刘庆峰称，一定不要用人工智能做可有可无的噱头性的事情，一定要解决刚需的事情，企业才可以穿越整个的经济周期，甚至是引领未来的产业发展。
除此之外，刘庆峰还透露，科大讯飞近期在全球最权威的英语语音系统大赛中获得了全球第一，同时还助力华为P40手机提供了一整套多语言技术，成功避免华为语音助手被“卡脖子”。
刘庆峰称，除了在英语语音方面的优势外，科大讯飞在法语、西班牙语等主要语种都全面超过了Google。
大数据和人工智能“上阵”抗疫
刘庆峰重点分享了科大讯飞如何利用大数据和人工智能，在新冠疫情中帮助政府部门提升疫情防控效率。
新冠疫情爆发后，中国很快就控制住了疫情，取得了阶段性成果。刘庆峰认为，大数据和人工智能的应用在里面起到了很大的作用，使得系统化、智慧化防控和多点触发的机制可以生成。
刘庆峰重点分享了科大讯飞参与武汉疫情防控的相关案例。
据媒体当时的报道显示，武汉在封城之前有将近500万人流出，这其中涉及到流向和密切接触者，如果采用传统人力是无法在短时间内完成。
科大讯飞和武汉公安进行了深入合作，协助武汉公安梳理出铁路流出了300万人，外省160万人，在这中间包括确诊密切接触者，很多用户数据被自动挖掘和分析出来。
刘庆峰表示，如果简单通过后台的数据，没有相应的比对和分析能力也是不太容易做透的。这只是一个方面，但通过人工智能和大数据，确实能够实现系统化防控。
城市超脑背后的高科技
人工智能和大数据在疫情防控中大显身手，未来在推动社会治理，加强环境、卫生、综合治理等全面管理上也将发挥重要作用。
刘庆峰透露，安徽刚刚发布的城市超脑，也是科大讯飞来提供的整体技术方案，“当然也团结了一批合作伙伴一起去做。”
铜陵城市超脑项目目前已经梳理了7类最重要的场景，包括城市管理、社区治理、生态环境、民生服务等等，一共设计了30多个典型的场景，这中间有很多都是原来人工没法做的，工作量太大，人工的黏度时间太长。
刘庆峰举例说，一个井盖没了，如何第一时间获知并快速让相关人员尽快送到？以前用户都不知道找谁打电话，而且打完电话后还要进行后台匹配，整个流程体系很复杂。
但现在通过后台数据贯穿之后，用户只要拍一张照片，几分钟之内相关人员就能到现场处理，这完全靠后台的大数据和人工智能精确计算。
刘庆峰透露，在大数据和人工智能参与后，铜陵城市超脑，仅仅做了半年时间，事件的发现量增加了900%，但是每一件事情的处理流程比原来缩减了70%，并在持续缩减之中。快速发现城市渣土车的位置、识别高空抛物等自动排查工作都可以通过城市超脑来完成。
人工智能和大数据联手，将从根本上改变城市管理和社会治理的效率。这是人工智能带来的根本性的变革，也是社会的刚需。
一个机器人完成5900万人次排查
刘庆峰还分享了武汉封城以后如何让城市更有温度的例子。
武汉封城之后，需要对每一个家庭做排查，当时武汉市提出要在短时间内做到对99%的家庭进行排查，很多人认为这根本不可能做到，一些网友还在网上提出疑问：为什么没有问到他。
“事实上，当时想要做每个家庭的排查，根本没有那么多人手。无论是挨门挨户排查，还是打电话去排查，按照当时的人手，都得几个月才能做得完。后来讯飞研发了两项关键的技术，解决了这个难题。”刘庆峰介绍。",2020-06-20 19:05:24,凤凰财经
