,title,content,pub_time,src
2,重磅！ICU不足医护人员更缺，欧洲是否走向医疗配给,"面对新冠疫情在欧洲的暴增趋势，欧洲的重症病床、配套设施以及最重要的医护人员，准备好了吗？
根据第一财经记者统计，截至3月15日，欧洲（包含英国在内）共确诊人数超过46820例，死亡1816例。其中确诊病例排在前五位的是意大利（21,157）、西班牙（6,391）、德国（4,649）、法国（4,499）和瑞士（1,375），英国的确诊数字在攀升中，目前为1140人。
多位欧洲医生、公共卫生专家在接受第一财经记者采访时普遍认为，德国是目前医疗设备最完善的国家，而英国和葡萄牙的重症加强护理病房（ICU）容量要低得多。以英国为例，不仅其国家医疗服务体系（NHS）的花费比不上德国，且人手也趋于不足，在这种情况下未来脱欧更是雪上加霜——欧洲大陆的护士可能不会再选择到英国工作。
同时，即便是在ICU重症病床配给跟上的情况下，医护人员不足也成为欧洲国家对抗新冠疫情的现实难题。在最差情况下，面临ICU重症病床不足或医护人员不足的欧洲国家，恐怕要面临同意大利目前相同的困境：医疗配给。
“在最坏的情况下，可能需要实施重症监护配给。这是一个哲学与医学相结合的领域，因为很少有社会能很好地解决重症监护的配给问题。”专门从事医保供应链方面研究的欧洲工商管理学院(INSEAD）副教授亚达夫（PrashantYadav）在接受第一财经记者采访时指出，“在这方面，我们对欧洲社会充满信心。我们相信，如果真的要实行重症监护的配给，人们会为了更大的社会公益而尊重这种决定。”
(image_address=""https://x0.ifengimg.com/ucms/2020_12/EB65BD6FAA13155376A4348A1789C7B335DD3E69_w800_h924.jpg"")
盘点欧洲ICU病床：德国最多英国最少
根据欧盟最新数据，德国仍然是医疗设备最完善的国家，每10万居民中有29.2张重症监护病床，意大利(12.5张)、法国(11.6张)和西班牙(9.7张)，欧盟平均每10万居民拥有14.3张重症监护床位。
作为欧洲人均重症监护床位最多的国家，按照日前德国政府方面给出的数据，德国有28000张重症病床，其中25000张已被使用（占用率达89%）。
英国方面数据显示，英国NHS有超过4000张成人重症床位，但五分之四已被占用，预计需求会增加至28000张，且各区域重症病床分布不均，其中北爱尔兰、苏格兰和威尔士是发达国家中人均重症监护床位最少的区域之一。
北爱尔兰每10万人有5.3个ICU床位；威尔士有5.4个，苏格兰有5.1个，可以这样对比：英国和北爱尔兰的所有地区都远远落后于美国、德国(29.2)、罗马尼亚(21.4)。美国每10万人有34张重症监护病房床位。
在威尔士地区，2018-2019年，威尔士地区每天约153张重症病床可以使用，全年整体占用率在90%以上。每年威尔士大约9600名病患需要重症监护设备。威尔士是英国重症病床最少的，英国是全欧洲重症病床最少的。由于人口增长与老龄化，对重症医疗的需求在以每年4-5%的速率增长。然而，2018年，40%的重症病房由于人力短缺而关闭，导致占用率升高到95%。
伦敦政治经济学卫生政策系副教授科斯塔冯特博士（JoanCosta-Font）告诉第一财经记者：“NHS在医疗上的花费比德国要少得多，并且人手处于不充足的状态。在英国脱欧的背景下这一情况会更加严重，因为欧洲大陆的护士可能以后不会再来英国工作了。”
科斯塔冯特表示，NHS的资金一直无法跟上服务需求的增长，而财务上的限制表现为大多数英国医院的员工短缺。因此，大多数英国医院不得不依靠和私人机构签订临时合同，私营医疗提供商已经占NHS花在社区卫生服务上的18％。
英国医生协会主席帕尔马（RineshParmar）称：“在英格兰地区的NHS中，有近10000个医生岗位的空缺和43000个护士岗位的空缺，NHS的人手不足以应对需求。急诊室的排队等待时长到了最差水平，重症监护室正在满负荷运转，难以再多接收重病或等待癌症手术的患者。”
而拥有重症病床最多的德国是否真的那么“佛系”？据第一财经记者从德国多位从事医疗事业相关的人士处了解，自从新冠疫情暴发以来，德国从病毒学专家到医疗人员都在紧密跟踪疫情趋势并做着准备。德国病毒学家克里斯蒂安&middot;德罗斯滕（ChristianDrosten）所在的柏林夏洛特（Charite）医院，目前就已经又下订单购买100套呼吸机。
德国一位拥有自己诊所的全科医生霍利（Dr.ElmarHolle）对第一财经记者表示，德国的医院在最近几个星期里，都在积极为新冠病毒的到来做着准备。其中的措施包括隔离措施：把感染人群放在单独房间内，提供防护服，特定的实验测试程序以及准备为重病人群使用的抗病毒药物等。
(image_address=""https://x0.ifengimg.com/ucms/2020_12/A783193A60612D4D772BC845263915409F3A499C_w500_h346.jpg"")
全科医生霍利认为：“由于不可预知的感染链，该流行病在德国和欧洲已经无法阻止了。”
ICU不足，但医护人员更缺
霍利对第一财经记者表示，在门诊患者中，区分流感或新冠病毒患者的工作将更加困难。
他认为，要中断感染链，必须对流感或新冠病毒进行更广泛测试。霍利表示，由于极高的感染率，新冠病毒病原体的传染性，疾病首发症状的延迟出现（所谓潜伏期，在此期间，感染已经可能传播给人），且在德国存在（传播）热点地区，在他看来，“由于不可预知的感染链，该流行病在德国和欧洲已经无法阻止了。”
根据德国媒体的预计，到5月14日，德国方面会耗尽所有ICU床位，目前给出的预计需求量是在现有床位基础上再加17500张。
在法国方面，法国目前可以提供4500张重症病床，可能会在紧急时增加到11000张，不过虽然几乎每家医院都为新冠患者准备了重症病房，但恐怕远远不够。
在西班牙方面，目前大部分重症患者（81%）都在马德里医院内，其情况最严重，且马德里重症病床即将耗尽。据悉马德里有机会将再雇额外516名医护工作人员，总体而言，西班牙目前约4404张重症病床（不包括新生儿床、烧伤床和冠状动脉床），其中3508张在公立医院，896张在私立医院，西班牙的卫生部门目前预计将再需要1000张ICU病床，其方式是通过对普通病床进行改造，加增呼吸机等等。
在目前疫情最为严重的意大利，其重症病床在5293张左右，预计需求要再加最少4000张重症病床。
分地区看，在疫情最为严重的伦巴第地区，却仅有859个ICU床位，目前其使用率达248%。预计到3月26日，伦巴第可能有1.8万名新冠患者住院，其中2700至3200人需要重症监护。过去两周内，大区已额外增设了150个ICU床位，下周将会开放另外150张重症病床。
在其他地区，Veneto每1000人拥有3.6张床位，截至15日前，该地区共450张重症病床，占用率80%，其中67张给了新冠患者。
一方面，能像德国一样拥有相对充沛的ICU床位，是较为令人感到安心的事情。
“德国拥有最高的人均ICU容量，其较高的确诊人数和较低的病死率数据正反映了这一点。”亚达夫对第一财经记者表示，“但像意大利一样，如果在欧洲其他地区约10%的新冠确诊患者转为重症，那么在大多数国家确实会出现ICU短缺的情况。我们现在应该为最坏的情况做好准备。”
另一方面，床位重组并不代表配套医护人员能够到位，特别是重症室床位本身需要医护人员数量众多。
根据德国媒体报道，目前德国方面有以下设想，即届时如果医护人员不够，则可以采取令退休医护人员返岗，并请各大学医学系高年级学生来医院协助的方式予以疏解。
“法国的ICU病房或设备的容量已经扩大了（有的已增加了一倍）。”亚达夫表示，现在，法国的医疗和护理人员似乎是主要的制约因素。
他解释道，由于新冠肺炎的性质，每次ICU病床被重复使用时，都需要大量的清理工作（包括呼吸器和所有其他设备），这意味着在几个小时内都无法使用ICU病床。
“我们需要快速响应操作管理和预先配置团队角色，就像一级方程式赛车队更换轮胎和修理那样排练，彻底清洁或消毒后重新铺床以供病人使用。”亚达夫说。
(image_address=""https://x0.ifengimg.com/ucms/2020_12/0A95130E1012116F6C4B6BEE8C94B420B18EABF5_w490_h319.jpg"")
在ICU告急、医护人手短缺的情况下，意大利方面已经采用了重症监护配给原则。
欧洲会否走向重症监护配给
在ICU告急、医护人手短缺的情况下，意大利方面已经采用了重症监护配给原则。
大量的外媒报道显示了意大利医生在临床上的艰难选择，不得不根据配给原则，决定谁来接受重症监护。
欧洲工商管理学院(INSEAD）技术与运营管理荣誉教授范沃森侯尔（LukVanWassenhove）对第一财经记者指出，“目前，ICU在意大利、法国和比利时的房间和设备数已经扩大了（有时已增加了一倍），所以，或许除了意大利之外，ICU似乎不是真正的、关键的限制因素。”
“现在，医疗和护理人员似乎才是关键的限制因素，他们压力很大、筋疲力尽，明显缺少良好的轮换或替换安排。在意大利，医务人员正处于崩溃的边缘。”范沃森侯尔认为，目前法国已经讨论了关于定量配给的问题，因为如果确诊患者大幅增加，法国可能会到达一个临界点，那时将不得不决定照顾更年轻的人，而不管生病的老人。
“这不是一个很好的前景，应该尽量避免，以防在未来暴发。”范沃森侯尔说，“比如，ICU的所有人员和后勤（治疗或防护设备）应该准备充分，以便在疫情严重暴发时能够更有效地部署。”
“考虑到后勤方面的限制，做好准备是处理疫情的关键问题之一。”范沃森侯尔表示，ICU病房很重要，但与之相伴的事物也常常被遗忘，比如治疗、人员、防护设备。现在显然需要一种准备工作的系统方法，但这显然也是缺乏的。
“当疫情都结束之后，无论是有关医院容量还是呼吸机等医疗用品，对于管理激增容量这一问题，对于如何制定协调准备计划，我们都要认真反思了。”亚达夫说。
(实习记者李欣洁对本文亦有贡献)",2020-03-15 22:23:52,凤凰财经
3,一张回国机票18万？！欧洲疫情凶猛 张文宏：全球疫情今夏结束已基本不可能,"原标题：一张回国机票18万？！欧洲疫情凶猛，超10万英国民众请求“封城”…张文宏：全球疫情今夏结束已基本不可能
新冠疫情在欧洲迅速蔓延。据世界卫生组织数据，截至北京时间3月15日12时，除中国外，140多个国家和地区累计确诊74225例新冠肺炎，中国以外10个国家确诊过千。
在欧洲，疫情最为严重的意大利，确诊人数已经超过2万；西班牙一日增长2000例，累计确诊7753例，首相妻子也被确诊；法国新冠肺炎累计确诊病例已增至4500例；英国确诊人数已破千。
12日，英国首相约翰逊表示，英国应对疫情的政策将转向“延迟疫情蔓延”阶段，并采取比意大利等欧洲国家更温和的措施。英国政府专家解释称，激进的措施只应在最佳时间实施，目前想要所有人不感染不可能，当大部分人感染后可获得“群体免疫力”。
英国政府首席科学顾问帕特里克&middot;瓦朗斯甚至提到，让4000万英国人接触新冠病毒，以便达到60%的人群感染，在全国形成群体免疫效果，一时舆论哗然。
一票难求18万一个座位2小时售罄
在英国政府做出如上决定之际，回国的机票价格开始飞涨。
据第一财经，昨天下午，一张由787公务机执飞的伦敦经停日内瓦飞上海的海报传遍了朋友圈，海报上的信息显示，这趟航班每个座位售价18万元起。
(image_address=""https://x0.ifengimg.com/ucms/2020_12/34959F8E24B64C5E6E098D36A2EA6E7F0CD36F80_w419_h719.jpg"")
昨日晚间，有消息称这班公务包机的航班在放出售票后的短短两小时内就售罄，据第一财经记者从运营方金鹿公务了解到的消息，目前这架公务机的确已经收到了100多个预定需求，主要来自伦敦。
回国票价飙涨
记者在某售票平台上搜索发现，伦敦16日直飞北京的6班飞机全部取消，仅有四趟中转航班，耗时最长的超过39小时。经济舱价格在1.65万元至3.45万元，商务舱价格高达4.7万。
(image_address=""https://x0.ifengimg.com/ucms/2020_12/7758DC41282750BB1FB849B31136D408687D5CF7_w828_h1288.jpg"")
(image_address=""https://x0.ifengimg.com/ucms/2020_12/1C7E5E306037702F80875C14F27BC29FA5F55645_w828_h1404.jpg"")
3月16日伦敦飞上海共计9趟航班机票在售，均为中转航班，经济舱价格在1.2万至3.4万不等，商务舱价格超过6万。
(image_address=""https://x0.ifengimg.com/ucms/2020_12/77D602A9EF9556B84842EE954305813A508B2CD7_w828_h1518.jpg"")
记者再次查阅5月伦敦飞上海航班信息，购票网站显示，中转一次的航班单程均价在8000元上下。而在英国留学的梁小姐则对记者表示，英国直飞上海的价格一般为3500元到4000元，对当前的票价，她表示不可思议。
(image_address=""https://x0.ifengimg.com/ucms/2020_12/01835EB9B7B1C27799553AC1D26F1D74B206EF10_w1080_h268.jpg"")
超10万英国民众请愿政府效仿“意大利式封城”：别看着更多人死
央视新闻报道，英国卫生当局14日数据，英国累计确诊1140例新冠肺炎，死亡21例。截至当地时间14日上午，已有超10万人在请愿书上签字，呼吁英国政府采取“更积极的方式”，阻止疫情蔓延。请愿书说，英国有必要效仿意大利，限制一切非必要市镇间人员流动，同时限制大型集会，而不是等待更多人死亡。按英国相关规定，请愿人数超过10万，议会就应考虑对相关议题进行辩论。
英国将自我隔离70岁以上老人
BBC当地时间15日报道，英国卫生大臣确认，计划在未来几周内采取行动隔离70岁以上的老人，保护他们免受冠状病毒感染。他在采访中表示，会要求70岁以上老人进行自我隔离，并会在适当的时候制定出更详细的计划，“因为我们知道这对老年人和弱势群体来说是一个很大的要求，这是为了他们自己的保护”。
新冠病毒检测呈阴性后特朗普发推：我们应对自如！
据法新社报道，白宫医生14日说，美国总统唐纳德&middot;特朗普已经做过新冠病毒检测，检测结果为阴性。随后，特朗普在推特上疑似对此次检测结果进行了回应：“当美国在经受考验（检测）时，我们应对自如。”
(image_address=""https://x0.ifengimg.com/ucms/2020_12/CCFA2CC18EB00C0CD0C9CC392B0E864229C9B66D_w1080_h659.jpg"")
意大利切内市市长病逝，系该国首位染疾殉职地方官
据中新网网援引欧联通讯社报道，意大利伦巴第大区是全国新冠肺炎疫情最严重的地区，大区所辖的贝加莫市则是意大利疫情最严重的省府所在地。贝加莫省府14日通报，该省所辖市镇切内市(Cene)市长因感染新冠肺炎病毒不幸病逝，成为了意大利首位感染新冠肺炎病毒殉职的地方官。
据报道，自意大利北部地区新冠肺炎疫情暴发后，切内市年逾七旬的市长乔治&middot;瓦洛蒂(GiorgioValoti)在忙于日常市政工作的同时，为抵御疫情始终身先士卒，亲自安排各项隔离防疫工作，并协助患者就医，在广泛地与民众接触中不幸被病毒感染。
瓦洛蒂为意大利联盟党党员，在当地具有广泛的影响力和民众支持度。瓦洛蒂病逝后，意大利联盟党对瓦洛蒂的不幸殉职表示哀悼，并向家属表示慰问，称瓦洛蒂的离去是联盟党的重大损失。
NBA第三例新冠确诊
据查拉尼亚报道，活塞中锋克里斯蒂安-伍德新冠病毒检测呈阳性！在3月8日活塞对阵爵士的比赛中，伍德曾与戈贝尔对位并砍下30分11板。消息源表示伍德目前感觉良好，并没有表现出任何症状！伍德是继戈贝尔和米切尔之后，NBA第三例球员确诊病例！
马来西亚激增190例确诊病例创单日新高
马来西亚卫生部3月15日发声明说，截至今日中午12时，马来西亚新增190起冠病确诊病例，创单日新高，累计428起。今日新增的新冠肺炎确诊病例大部分都与吉隆坡大城堡清真寺万人大集会有关。此前，马来西亚卫生部称，吉隆坡大城堡清真寺万人大集会在2月27日至3月1日举行，参与人数多达1万6000人。新加坡和文莱也有数起确诊病例与该集会相关。
西班牙警方无人机劝民众回家
14日西班牙多地街头虽已冷清了不少，但仍有部分居民在街上游荡，为更好控制疫情，马德里警方出动两架无人机对路人进行广播劝离，据了解目前西班牙确诊病例达5232例，此前该国已宣布将在全国范实施“封城”。
塞尔维亚足协主席确诊感染
塞尔维亚足协官方网站宣布，塞尔维亚足协主席斯拉维萨&middot;科茨（SlavisaKokez）被确诊新冠病毒阳性。目前他状况良好，正在隔离。塞尔维亚足协表示，足协将继续正常运转。塞尔维亚足协同时呼吁相关的俱乐部和机构能够采取负责任的措施，以最大程度地减少疫情带来的影响。
(image_address=""https://x0.ifengimg.com/ucms/2020_12/ED33BA7085FFAB88C590B96DA2FFC93DD3A9FA7B_w1000_h667.jpg"")
韩国日新增确诊病例降至100以下
文在寅宣布大邱、庆尚北道为特别灾区
韩国中央防疫对策本部15日通报，截至15日零时，韩国较14日零时新增新冠肺炎确诊病例76例，累计确诊病例8162例，共出现75例死亡病例。自上月21日以来，时隔23天后，韩国新增确诊病例再次降至100例以下。上月21日，韩国日新增确诊病例74例；上月22日新增确诊病例190例；此后至本月14日，日新增病例一直在100例以上。
据韩联社消息，韩国总统文在寅宣布大邱、庆尚北道为特别灾区。
伊朗总统谴责美国持续制裁妨碍伊朗抗击疫情
伊朗总统哈桑&middot;鲁哈尼日前致信多国领导人，谴责美国持续制裁严重妨碍伊朗抗击新冠肺炎疫情努力，是对伊朗人民的集体惩罚。他呼吁国际社会抵制美国对伊朗采取的非法制裁，支持伊朗抗击疫情。
伊朗总统官方网站14日发布此信部分内容，但未说明鲁哈尼给具体哪些国家领导人致信。
鲁哈尼在信中说，在与新冠病毒搏斗的同时，伊朗还要面对“两年来源于美国政府的大范围非法制裁、极限施压政策及系统性政府阻挠行为的严重妨碍”，不到两年内，美国制裁已经给伊朗经济造成约2000亿美元直接损失。
鲁哈尼指出，在新冠病毒成为伊朗人民、中东地区人民乃至各国人民共同面对的威胁之际，美国对伊朗实施的制裁不仅非法和违背联合国安理会决议，而且是不道德和不人道的，不仅是对伊朗人民的集体惩罚，也是对全人类的集体惩罚。
鲁哈尼呼吁国际社会抵制美国“非法和不人道的霸凌”，“不要让不公正的美国对伊朗制裁影响抗击致命病毒的战斗”。
伊朗外交部长贾瓦德&middot;扎里夫在其社交媒体推特账户发帖说，鲁哈尼总统在致多国领导人的这封信中告知对方，伊朗抗击新冠肺炎疫情的努力遭到美国非法制裁的“严重妨碍”。扎里夫说，“容忍恶霸杀死无辜之人是不道德的”。
美国总统特朗普政府于2018年5月退出此前美国、俄罗斯、英国、法国、中国、德国六国与伊朗签署的伊核问题全面协议，后恢复并追加对伊朗制裁。伊朗新冠肺炎疫情暴发后，美方一面称愿向伊方提供帮助，一面却追加制裁。
根据伊朗卫生部14日公布的统计数字，截至当天中午，伊朗新冠肺炎确诊病例累计12729例，死亡病例611例。
张文宏称全球疫情今夏结束基本已不可能：
中国下阶段面临管控输入风险
15日，复旦大学附属华山医院感染科主任张文宏教授发文称，中国已经迈过至暗时刻，但是现在欧洲突然成为疫情的新中心，给我们带来巨大的不确定性。后续我国仍然面临较大的输入性风险。按照当前全球的抗疫情况，本场疫情在今年夏天结束基本已经不可能。
气愤！女子吃退烧药后和家人从美国来京，飞机上竟如此谎话连篇！
15日下午，北京市新型冠状病毒肺炎疫情防控工作新闻发布上，国航产品服务部总经理、国航海外疫情防控组成员张允介绍了美国输入病例黎某一家三口3月12日乘坐国航CA988次航班有关的空中防控情况。
3月12日，CA988次航班在洛杉矶旅客登机阶段，乘务员对所有旅客逐一进行了测温的排查，没有发现体温超标的旅客。航班起飞一小时之后，座位在40b的旅客找到了乘务员自述，感到憋气、乏力、脸部微麻，说自己没有同行者，登记前也未不用过任何药品，但自己一周前有短暂的发烧史。
乘务组为其测温是36.4℃，并调整了座位，将其安排到了客舱右后部，留观隔离区。并按要求实施隔离处置程序，要求其全程佩戴口罩，指定了右后门的一个卫生间，为其单独使用。后续乘务组为这位旅客测温了4次，均在37℃以下。
航班落地前两小时，也就北京时间3月13日凌晨4时左右，40b旅客找到乘务员，陈述自己在美国任职公司有人感染，自己在美国已经发烧，并在登机前吃了退烧药，同时她说丈夫和孩子是和她一起居住，座位号是54k和54l。
乘务组立即将此情况报告机长，同时将其丈夫和孩子一同安排在了隔离区。经乘务组再次测温，一家人体温均正常，同时机组也把这个情况报告给了国航的运控中心。运控中心接到报告，立即通知相关部门启动了联防联控机制，并在飞机落地前做好了所有的准备工作。航程中乘务组按要求对全体旅客实施了两次机上测温，没有发现体温超标的旅客。
CA988航班是13日早上6时15分落地，北京首都机场海关海关检疫人员对40b旅客一家三人进行了排查。
综合自新华视点、新华社、人民日报、央视新闻、第一财经",2020-03-15 22:18:05,凤凰财经
