,title,content,pub_time,src
0,自然资源部：加快推进《土地管理法实施条例》修改和配套政策出台,"中证网讯（记者王舒嫄）中国证券报记者3月1日于自然资源部获悉，2月23日下午、24日下午、28日上午，自然资源部先后召开部党组扩大会议、部直属单位及派出机构视频会议、省级自然资源主管部门（含省会城市）视频会议，及时掌握当前各地自然资源工作中遇到的困难和问题，部署统筹推动落实疫情防控和涉及经济社会发展全局的自然资源工作，全力支持保障今年经济社会发展目标顺利实现。
会议强调，要清醒认识国内国际疫情形势严峻复杂，加强防控决不放松，坚守防控底线，准确掌握干部职工真实流动情况，进一步抓紧抓实抓细疫情防控各项工作。
针对地方自然资源管理部门存在的问题和困难，会议指出，一是如何做好新旧《土地管理法》实施政策衔接。自然资源部将加快推进《土地管理法实施条例》修改和配套政策出台，即将公开征求意见；新《土地管理法》实施前，已经受理的建设项目审批，按照原有规定执行。
二是如何加快国土空间规划编制。党中央、国务院以及自然资源部已陆续下发了部署文件、编制规范、技术指南以及生态红线、保护区中存在的各种冲突解决方案，自然资源部正按照“充分体现党中央精神、广泛凝聚全社会智慧”的要求，形成全国国土空间规划纲要的框架，再深化、细化重大问题；各地要按照部署要求，立足国土“三调”基础，深化自然地理空间承载格局、经济社会发展战略格局等方面研究，做好各种控制线调整准备工作，有序推进各级国土空间规划编制。
三是如何做实国土“三调”工作。据《关于做好新冠肺炎疫情防控期间有关工作的通知》，要求结合实际，优化工作流程，调整工作重点；各地要在疫情期间集中力量做好内业工作。当前仍要聚焦现状数据真实性，深入分析现状真实性与现状合理性的关系、准确分析“三调”与“二调”数据的变化。
四是如何加大疫情结束后的土地供应。今年开始改革土地计划管理方式，不再采取因素法分解指标，实行土地要素支撑跟着项目走，总量指标完全可以满足需求；各地要积极对接建设项目储备，做实做深项目前期工作，并继续加大力度盘活批而未供土地和闲置土地。各地要按照住宅用地公告供应量和住宅用地完成交易量双口径统计的要求，准确反映政府土地供应和市场供需关系，合理增加住宅用地公告供应量。
五是如何加快建设用地审批。今年以来，自然资源部结合《土地管理法》修改，推进下放土地审批权改革，采取优化审批流程、创新审批方式、加密会审频次等方式，进一步加快用地用矿用海审批；有关地方要抓紧做好基础准备，确保下放审批“接得住、管得好”，按时完成土地审批有关补正工作，各地要继续探索“多审合一、多证合一”改革。当前要集中力量、全面完成已经受理的各类建设项目用地审批，一季度内现有存量项目审批清零，全力支持企业复工复产，全力保障后续建设项目落地。",2020-03-01 14:07:20,凤凰财经
