,title,content,pub_time,src
0,"""白菜价""承销债券：兴业银行、中信证券遭警告！","""白菜价""承销债券：兴业银行、中信证券遭警告！2020年05月16日 18:28:30
来源：证券时报
原标题：""白菜价""承销债券，兴业银行、中信证券遭警告！监管要求限期整改，对价格战保持强监管
来源：券商中国
(image_address=""https://x0.ifengimg.com/ucms/2020_20/9482B94310674EB4AB22CD9F178BB7CC8281888B_w640_h360.jpg"")
上月末，两家主承销商低价承销债务融资项目，被交易商协会介入调查，而今调查结果公布，两家机构均被警告。
业界再次对低价债券承销行为给予强烈关注。5月15日，交易商协会发布自律处分，对兴业银行、中信证券两家非金融企业债务融资工具主承销商予以警告，并责令两家机构限期整改。
(image_address=""https://x0.ifengimg.com/ucms/2020_20/D8144C080F52D828A29DD0A87EF2D5040E5F5F05_w1080_h1088.jpg"")
三周前，上述两家机构中标海南一个中期票据项目的主承销商，承销费率为十万分之三，被交易商协会介入调查。
投行价格战从来都不是个例，在现实情况下，很多债券承销项目的收费更是低至十万分之一，甚至不收费。监管也一直保持着对低价承销行为的关注，对相关低价竞争行为予以惩处。行业也在加强自律管理，就在4月底，90家机构签署《非金融企业债务融资工具承销机构自律公约》，明确表示，不以低于成本的承销费率报价，参与债务融资工具项目竞标或承揽。
两主承销商因低价承销被警告
5月15日，交易商协会发布2020年第5次自律处分会议审议决定，对兴业银行、中信证券两家非金融企业债务融资工具主承销商予以警告，并责令两家机构限期整改。
经查，两家机构在部分非金融企业债务融资工具项目招标过程中，中标承销费率远低于市场正常水平，预计承销费收入明显低于两家机构核算的业务开展平均成本。该不正当竞争行为，违反了《银行间债券市场非金融企业债务融资工具中介服务规则》相关规定，对市场正常秩序造成不良影响。
交易商协会称，债券市场主承销商的职责非常关键，为争取市场份额，在债务融资工具发行承揽中不当低价竞争，影响执业质量。下一步，将继续强化对主承销商等中介机构执业质量的监督检查，督导各类机构尽职履责、合规从业，对相关机构业务开展中出现的严重违规行为，将及时查处纠正、有效惩戒，严肃市场纪律，维护市场秩序。
4月27日，海南股权交易中心发布公告显示，海南省发展控股有限公司公开选聘发行中期票据主承销商，最终确定中选单位为中信证券和兴业银行，承销费率为十万分之三。意味着每做10亿元的债券承销，只收3万元，平均每家1.5万元。
跌破“地板价”的承销收费引起了监管注意，当日晚间，交易商协会表示已启动对有关事项的自律调查，若相关方在业务开展过程中存在违反自律规则的情况，将依据有关规定予以自律处分。
监管对投行“价格战”保持强监管
投行价格战从来都不是个例，在现实情况下，很多债券承销项目的收费更是低至十万分之一，甚至不收费。比如，今年4月份，交通银行中山支行中标了中山兴中集团中期票据融资券主承销商采购项目，中标承销费率十万分之一；去年4月份，某大型央企为即将发行的百亿规模公司债进行承销招标，有券商报出了1万元的承销费，后来在舆论的关切之下，该项目招标按下暂停键。
这样的报价明显会低于投行债承成本。有投行人士曾对记者表示，承销信用债，投行需要做的工作包括尽调、申报、发行、存续期管理，成本绝大部分为差旅和人员成本，以及维护客户关系的费用。一般来说，信用债承销的平均收费水平是千分之一到千分之六不等，十万分之一的承销费，很可能连差旅费都不够。
监管也一直保持着对低价承销行为的关注。就在上述百亿公司债招标被按下暂停键后没多久，广东省证监局向广发证券下达行政监管决定书，称广发证券存在以低于成本价格参与公司债券项目投标的情形。
2018年证券业协会曾发布《公司债券承销业务收费情况行业通报》，数据显示，有52个公司债券项目未收取承销费，62个公司债项目承销费率不高于千分之一，其中有21个项目承销费率在万分之一以下。
当年9月证监会在《公司债券日常监管问答》中表示，对个别承销机构承销费率远低于正常费率、执业质量存疑的公司债券项目，监管将开展转向现场检查工作，核实承销机构是否履行了充分适当的尽职调查程序以及发行人相关信息披露是否真实、准确和完整。
有投行固收人士分析，券商“不计成本”去承揽，或许是为了长期维护资质较好的发行人客户，也可能是为了承销份额排名，或许为开发其他服务。
有大型投行资深人士曾对记者分析说，“有些项目是挣利的，有些项目是挣名的。一些大项目，我们不赚钱也会争着做。”
头部券商债承规模低于银行
比起传统意义上的“投行”业务，债券承销虽然单笔业务利润相对较低，但债券融资规模更大且日益发展，总体业务规模远大于股权融资项目。就以今年一季度情况来看，全行业合计完成债权承销规模2.03万亿元，同比增幅43.26%。
有投行发行负责人对券商中国记者表示，一季度来，受疫情防控影响，央行释放流动性，公司债、企业债发行推行注册制，种种因素驱使下，今年来债市承销规模水涨船高。
不过，从体量来看，债券承销业务还是银行的天下。今年以来截至5月16日，债券承销总金额排名前十的机构中，仅有两家券商，其余均为商业银行。
上榜的两家券商分别为中信证券（4151.92亿元，排名第五）以及中信建投证券（4013.34亿元，排名第7），较第一名工商银行（5968.18亿元）还有明显差距。兴业银行也上榜前十名，承销金额3918.88亿元，排名第9。
就在4月底，有90家机构签署《非金融企业债务融资工具承销机构自律公约》，主要从强调公平竞争、维护市场秩序、培育诚信文化、提倡主动自律等面着眼，缔约机构有以下“十一个不”，自律约定明确，不以低于成本的承销费率报价，参与债务融资工具项目竞标或承揽。",2020-05-16 18:28:30,凤凰财经
1,打击升级！美国全面封锁华为芯片采购 华为：永不言弃！,"(image_address=""https://x0.ifengimg.com/ucms/2020_20/459D67BC3F968FB8D7B93187EE4BE39326FE2E94_w600_h333.jpg"")
在这个周末，华为精神再次刷屏。
5月16日上午，华为通过心声社区发文：“没有伤痕累累，哪来皮糙肉厚，英雄自古多磨难。回头看，崎岖坎坷；向前看，永不言弃！”
(image_address=""https://x0.ifengimg.com/ucms/2020_20/297073A9ADA420A4B39B41A60AE3A20E2F3032CA_w579_h875.png"")
华为为何如此感慨？这跟美国的全面封锁有关。稍早前，美国商务部旗下工业与安全局(BIS)官方宣布，将严格限制华为使用美国的技术、软件设计和制造半导体芯片，以保护美国国家安全，并切断华为试图脱离美国出口管控的途径，对华为全球芯片采购进行全面封锁。
就在一天前，5月15日，台积电在官网正式宣布，计划投资120亿美元在美国兴建并运营一个先进的晶圆厂。据金融时报报道，美国商务部坚称台积电赴美建厂和美国对华为推出限制措施没有关联。然而，这仍令人产生诸多联想。
在重重包围之下，“中国芯”产业的不断崛起同样不容忽视。近期，国内芯片制造龙头中芯国际利好不断，在一季度各项业绩指标创下纪录之外，其更获得了国家大基金的百亿资金支持。
如何打好这一场封锁战？市场高度期待。
华为：没有伤痕累累，哪来皮糙肉厚
在成为全球疫情最严重的国家之际，美国仍不忘记多方对华为继续进行打压。
虽然第六次延长对华为的临时许可，但美国商务部旗下工业与安全局(BIS)仍发布官方声明，将严格限制华为使用美国的技术、软件设计和制造半导体芯片，以保护美国国家安全，并切断华为试图脱离美国出口管控的途径。
(image_address=""https://x0.ifengimg.com/ucms/2020_20/58A535400A7AD111B3087843FCDEB29E0C9FEEC6_w600_h554.png"")
美国商务部称，2019年5月，美国将华为及其114家海外关联机构列入了“实体清单”，但是华为继续使用美国技术、软件来设计半导体芯片，并交给使用美国设备的海外代工厂进行生产，严重威胁了美国的国家安全和海外政策。
美国商务部部长威尔伯&middot;罗斯称：“尽管美国去年采取了（将华为列入）‘实体清单’的措施，但是华为及其海外关联机构通过一系列本土化举措，削弱了这些涉及国家安全的限制。这不是一家负责任的企业的所作所为。我们必须修订被华为和海思利用的规则漏洞，保护美国技术免受恶意利用，威胁美国国家安全和海外利益。”
5月15日晚间，环球时报报道称，特朗普政府正酝酿出台针对华为公司的进一步打压措施，特别是修改“外国直接产品”再出口规则，意在限制台积电等重要供应商继续向华为供应芯片，对华为“卡脖子”。
对此，有接近中国政府的消息人士透露，如果美方最终实施上述计划，中方将予以强力反击，维护自身合法正当权益。中方可使用的具体反制选项包括以下几项：将美有关企业纳入中方“不可靠实体清单”，依照《网络安全审查办法》和《反垄断法》等法律法规对高通、思科、苹果等美企进行限制或调查，暂停采购波音公司飞机等。
无论中美双方后续将如何博弈，但此次美国出台的限制短期内将对华为造成切实影响，则是不争的事实。根据美国上述要求，只要涉及到美国的技术和软件，任何芯片设计工厂、制造工厂不能为华为提供服务，就算是华为自己设计的芯片，也不能使用美国相关的技术和软件。
对此，华为在5月16日上午通过心声社区发文称：“没有伤痕累累，哪来皮糙肉厚，英雄自古多磨难。回头看，崎岖坎坷；向前看，永不言弃！”在体现华为精神的同时，再次收获国人一波好感度。
(image_address=""https://x0.ifengimg.com/ucms/2020_20/1F68F818B12313E49E5699083DC760992FFE7329_w663_h371.png"")
根据华为2019年年报，当期实现销售收入8688亿元，同比增长19.1%；实现净利润627亿元，同比增长5.6%。分业务来看，消费者业务收入快速增长，当期实现4673亿元，同比增长34%；运营商业务收入和企业业务收入分别为2967亿元和897亿元，同比增长3.8%和8.6%。
此外，2019年华为研发费用为1317亿元，占销售收入总比重的15.3%；全球从事研究和开发的人员约9.6万名，占比总人数近半。截至2019年年底，华为全球共持有有效授权专利85000多件，90%以上为发明专利。
台积电120亿元在美建5nm工厂
就在此次美国推出限制升级之前，5月15日，台积电在官网正式宣布，在美国联邦政府及美国亚利桑那州的共同理解和其承诺支持下，计划在美国兴建并运营一个先进的晶圆厂。
(image_address=""https://x0.ifengimg.com/ucms/2020_20/0DFFD13F054CEBD91716C4ADF943725DD413242D_w600_h439.png"")
官网信息显示，该厂房将设立于美国亚利桑那州，采用台积电公司的5nm制程技术生产来半导体晶片，规划月产能为20000片晶圆。2021年至2029年，台积电将支出（包括资本支出）约120亿美元。
该晶圆厂将于2021年动工，并将于2024年开始量产晶圆；将直接创造超过1600个高科技专业工作机会，并间接创造半导体产业生态系统中的上千个工作机会。台积电表示，此先进晶圆厂不仅能使台积电为客户和伙伴提供更好的服务，也为台积公司提供了更多吸引全球人才的机会。
根据集邦咨询旗下拓墣产业研究院发布的2020年一季度全球晶圆代工厂营收排名，台积电排在第一位，市场份额高达54.1%。而就在5月13日，台媒曾报道称，台积电确认已经拒绝了美国政府，不会在美国本土为美国政府建设新的晶圆厂。
对于此次台积电的“出尔反尔”，美国商务部部长WilburRoss回应称，“这再次表明，特朗普总统的政策议程已经导致美国制造业的复兴，并使美国成为世界上最具吸引力的投资场所，这项计划是台积电、亚利桑那州州长及其幕僚、政府，特别是我们的助理商务部长IanSteff多年来密切合作的结果。”
2020年4月，台积电发布2019年年报显示，其目前最大客户仍是苹果，占台积电总营收的23%，美国客户整体占台积电总营收约六成，而来自中国大陆的营收在台积电总营收占比中不足两成。
前脚“搞定”华为的主要供应商，后脚就大张旗鼓地采取限制，难免不让人产生联想。然而，据金融时报报道，美国商务部坚称台积电赴美建厂和美国对华为推出限制措施没有关联。
中芯国际获高度看好
西方不亮东方亮，在美国对华为采取技术封锁之际，国内芯片产业正在不断崛起。近期，国内芯片制造龙头中芯国际利好不断，令国人生出更多期待。
研究机构认为，中美科技角力中芯片制造环节是美方施压重点，长期利好半导体板块发展。中芯国际作为国内芯片制造端核心企业，未来承载国内产业链自主的重任，其受惠于政策、资金支持将有利于带动上下游公司共同成长，仍然强调国内半导体板块核心逻辑是十年维度的自主可控。
5月13日，中芯国际发布2020年一季报，当期实现营收9.05亿美元，同比增长35.3%；净利润6416.4万美元，同比增长422.85%，创季度营收历史新高。通讯、计算机与消费电子相关营收同比成长，逐步增加市场份额。
在业务方面，中芯国际2020一季度付运晶圆数量为1406714片，同比增长29.1%，产能利用率也从2019年一季度的89.2%增长到98.5%。14nm在2019年底进入量产，2020年一季度14nm晶圆收入贡献超过了1%。
此前，市场曾盛传，在一系列政策因素下，华为已经将订单从台积电分散，其中麒麟710A开始转向中芯国际的14nm。不过，对此消息华为和台积电均未予以正面回应。
在融资方面，5月5日，中芯国际宣布将在国内科创板申请上市，发行16.86亿股份，募集大约234亿资金，主要用于12英寸晶圆厂及先进工艺研发。此后，5月15日，中芯国际发布公告称，两大国家级投资基金——国家集成电路基金II及上海集成电路基金II分别注资15亿、7.5亿美元（约合160亿元），增资目标为子公司中芯南方，14nm、12nm工艺均为中芯南方生产。
在中芯国际之外，中国芯片产业仍有其他好消息。5月15日，据无锡日报报道，全球影响力最大的光刻设备供应商荷兰ASML公司与江苏无锡市高新区政府签署战略合作协议，设立光刻设备技术服务（无锡）基地，为我国芯片产业发展再次“添砖加瓦”。
据悉，该基地涵盖两大业务板块：面积约2000余平米，拥有近200人规模专业团队的技术中心，从事光刻设备的维护、升级等技术服务；以及面积约2000余平米的供应链服务中心，为客户提供高效的供应链服务，为设备安装，升级及生产运营等所需的物料提供更高水准的物流支持。",2020-05-16 18:15:30,凤凰财经
