,title,content,pub_time,src
6,盘后大事扎堆！7月超242万股民“跑步进场”，A股后市怎么走？,"原标题：盘后大事扎堆！7月超242万股民“跑步进场”、中美经贸大消息、人民币收复重要关口…A股后市怎么走？
虽然周三A股大幅回调，但在A股收盘后，有几个大消息值得关注。
我们先看一下几大消息。
1、人民币大幅升值，收复6.9关口
截至发稿，离岸人民币对美元收复6.9关口。
(image_address=""https://x0.ifengimg.com/res/2020/C6B29E82ED0A2CA747254FCFC174B4C313496A85_size90_w666_h667.png"")
根据近日央行发布的《2020年人民币国际化报告》显示，去年人民币跨境收付金额是19.67万亿元，同比增长24.1%，收付金额创了历史新高。人民币跨境收付占同期本外币跨境收付总金额的比重是38.1%，同样创了历史新高，比2018年提高5.5个百分点。
报告指出，国际重要金融指数吸纳中国债券和A股，充分反映了国际投资者对中国经济长期健康发展的信心，以及对中国金融市场开放程度的认可，将有利于更好地促进国际投资者与中国经济合作共赢。
另外据IMF（国际货币基金组织）官方外汇储备货币构成数据显示，到去年年底，人民币储备规模相当于达到2176.7亿美元，占汇储备总额的1.95%，排名第五位。这是IMF从2016年开始公布人民币储备资产以来的最高水平。今年一季度，该数据上升到2.02%，历史新高。据不完全统计，已有70多个央行或者货币当局把人民币纳入外汇储备。
随着中国经济韧性持续体现，人民币国际化速度加快，中国证券市场国际化脚步不可阻挡。随着金融制度改革的深化，外资持续流入A股可期，A股的投资价值也将得到充分的体现。
2、7月份新增投资者数为242.63万户
中国结算最新数据显示，截至7月末，投资者数量已经突破1.7亿户。其中，7月份新增投资者数为242.63万户，同比剧增123.63%。
按照中国结算的统计口径，上述投资者数量是指持有未注销、未休眠的A股、B股、信用账户、衍生品合约账户的一码通账户数量。
从开立A股账户投资者数量来看，截至7月末，自然人为16916.52万户，非自然人为37.81万户——合计总数为16954.33万户。按照当前开户增长势头，8月份A股投资者数量有望突破1.7亿户。
(image_address=""https://x0.ifengimg.com/res/2020/EDB1A698AD7B285DA302D7F6096337094E33C038_size6_w666_h359.png"")
3、美方宣布取消最新一轮中美经贸协议谈判外交部回应
8月19日，外交部发言人赵立坚主持例行记者会。有记者就特朗普宣布取消中美经贸谈判和对中国抗疫的评价提问。赵立坚表示，关于抗疫问题，我们已经多次以时间线的方式介绍中方的抗疫举措和成效，事实非常清楚，新冠肺炎疫情发生以来，中方本着公开、透明、负责任的态度，认真履行国际卫生条例规定的职责和义务，采取了最全面、最严格、最彻底的防控措施，全力遏制疫情扩散蔓延，积极开展国际防控合作。中国政府坚持人民至上、生命至上，交出的抗疫答卷经得起时间和历史的检验，中国为全球抗疫付出的巨大牺牲和作出的重大贡献有目共睹。
(image_address=""https://x0.ifengimg.com/res/2020/69DBC21A0FFEEBA4168F71860F9895195F78FDAD_size209_w491_h312.png"")
8月13日，国新办举行国务院政策例行吹风会，商务部部长助理任鸿斌彼时表示，中美签署第一阶段经贸协议以来，中方认真落实协议，有关部门为推动协议执行做了大量工作。
另外，据彭博社消息，美国国务院要求美国高校剥离他们持有的中国股票。负责经济增长、能源和环境的副部长基思&middot;克拉奇（KeithKrach）在致美国大学和学院董事会的信中写道，美国大学捐赠委员会将谨慎地撤出中国公司的股票。可能的结果是，美国提高上市标准将导致中国公司在明年年底之前从美国交易所全面退市。持有这些股票还带来了中国公司不得不重述财务状况的高风险。
对捐赠基金运作的警告开启了特朗普政府针对中国政府，企业和个人的多管齐下的新趋势。根据彭博社（Bloomberg）2019年的一项调查，在获得更好回报预期的推动下，高校资金对中国公司进行了数十亿美元的投资。
北上资金半日净卖出61.34亿元
周三，A股整体大幅回调，上证指数险守2400点，中小板指跌破9000点整数关，创业板指更是重挫3.27%。两市成交10884亿元，较前一交易日略有萎缩，但成交股数达885亿股，较前一交易日增加逾3.5%，显示资金再一次流向低价滞涨股中。盘面上电力、水利建设、食品价格、种业等板块逆市走强，生物疫苗、保险、半导体等板块则大幅回调。
北上资金净卖出61.34亿元，其中沪股通净卖出22.14亿元，深股通净卖出39.2亿元。净买入海康威视3.79亿元、平安银行2.89亿元、复星医药2.14亿元、立讯精密2.02亿元。宁德时代、格力电器、贵州茅台等则被净卖出超亿元。
用电高峰促电力股拉升
得益于经济基本面的稳健快速发展，以及持续高温天气带来的降温负荷拉动，电网负荷持续上升。据国家发改委数据，进入8月份，全国日发电量和统调用电负荷快速攀升，8月3日、10日、11日，全国日发电量和统调用电负荷连创历史新高。华东、西南2个区域电网以及天津、山东等12个省级电网负荷累计30次创历史新高。日发电量最高达到246亿千瓦时，比去年峰值高出6.86亿千瓦时；统调用电负荷最高达到10.76亿千瓦，比去年峰值高出2400万千瓦。
另外，二季度以来，煤价下降幅度明显，火电企业成本下降受益匪浅。而汛期来水持续偏丰，水电企业也高负荷运转。因此，电力企业整体具备较高的业绩弹性。
电力板块整体涨幅严重落后于大盘，截至周三收盘，今年以来仅累计上涨6.21%。最高的涪陵电力才19.31元，最低的永泰能源仅1.6元，中间值不到5元。在滞涨及多重利好作用下，电力板块周三大涨2.91%，创近3年以来新高。港股电力股也集体走高，华电国际电力股份盘中最高上涨逾30%，华能国际电力股份盘中也一度飙升逾21%，中国电力、大唐发电、华润电力等均逆市飘红。
A股梅雁吉祥、漳泽电力、桂东电力、大唐发电等8股涨停，金山股份、天富能源、国投电力等涨幅居前。北上资金在8月以来整体净卖出的背景下净买入电力板块7.13亿元。其中长江电力净买入最多，达2.45亿元，长青集团增仓幅度最高，达155.81%。
8月以来北上资金净买入超千万元电力股
(image_address=""https://x0.ifengimg.com/res/2020/CF7202BFCF165850323515ACD85BF7D73A36E6BD_size13_w375_h427.png"")
灾害防御升级水利板块逆市上涨
19日水利部表示，长江发生流域性大洪水，预计20日三峡水库将出现建库以来最大入库洪峰76000立方米每秒。针对当前汛情形势，水利部于19日9时将水旱灾害防御Ⅲ级应急响应提升至Ⅱ级。水利部将进一步加密水情监测和滚动预报频次，科学精细调度长江三峡等水库群，做好洪水防御工作。目前，水利部工作组正在重庆、四川防洪一线协助指导洪水防范应对。
受此影响，周三水利建设板块也放量逆市上涨，板块指数涨2%，钱江水利、国统股份、伟隆股份、青龙管业等6股涨停，龙泉股份、新界泵业、三峡水利等涨幅居前。
大禹节水日前公告披露，中标1.5亿元上蔡县2020年12万亩高标准农田建设项目，至此，公司2020年内新增订单已达23.04亿元(含本次中标项目)，超过去年全年订单金额近2亿元。大禹节水连续2个涨停，近5个交易日3涨停。
盘后龙虎榜显示，中信证券旗下营业部在大禹节水交易中表现活跃。买一中信证券上海溧阳路营业部和买三中信证券深圳科技园科苑路营业部分别买入3671万元和1902万元。买入前五席合计净买入1.16亿元，卖出前五席合计净卖出2016万元。
另外，由于洪灾干扰，国内玉米价格持续攀升，并带动小麦、稻谷的价格上涨。这导致农业股近期也反复走强。周三，种业板块指数强势拉升4.05%，再创历史新高，今年以来该指数累计上涨115%。登海种业、农发种业涨停，亚盛集团、丰乐种业、荃银高科、新农开发等涨幅居前。
而农业股的连续大涨又开始向产业链传导，周三农副食品加工板块也逆市大涨，佳隆股份、安记食品、有友食品、海欣食品等7股涨停，好想你、惠发食品、西麦食品等涨幅居前。
对于近期创业板调整走势，英大证券首席经济学家李大霄表示，第一，要淡定，不要恐慌；第二，牛市还在；第三，结构性风险还是要非常谨慎。李大霄认为，现在创业板指数的市盈率是69倍，市净率是7.78倍；科创板市盈率是81倍，市净率是8.26倍，显而易见是高估的，所以这个时候出现了一个冲高回落，应该是非常合理的，非常正常的。指数现在还是3400点，比6124点跟5178点时的点位要低很多，但是这两个板块（创业板和科创板）已经出现了一些风险。但也不是意味着牛市结束，整个市场蓝筹股机会还是蛮大的。",2020-08-19 20:17:38,凤凰财经
7,洪灾“猛于虎”！又有两A股公司公告灾情，皮革公司水深超两米,"原标题：四川洪灾“猛于虎”！又有两A股公司公告灾情，皮革公司过水面积超15万平，水深超两米…
四川地区强降雨导致的洪灾让不少当地上市公司的生产经营受到影响。
继盛和资源（600392）、新金路（000510）之后，又有两家当地上市公司披露了汛情对公司的影响以预计损失情况。不过，证券时报&middot;e公司注意到，一些上市公司表示，正在积极应对汛情影响，制定并实施灾后复产工作计划。
和邦生物预计损失超3.5亿元
8月19日晚，位于四川省乐山市的和邦生物(603077)公告称，公司所在地四川省乐山市五通桥区于8月18日遭遇洪水灾害，洪水进入公司厂区，厂区洪水水位较深。公司已经启动防汛应急预案，公司主要负责人亲临现场指导防汛和应急处置工作。截止目前，公司部分生产线已停产。公司预计损失3.5亿元-4.5亿元，预计停产时间不会超过三个月。
(image_address=""https://x0.ifengimg.com/res/2020/44B40AD5B7590F4CA5B0FE26D81C37B8FBE3EC5B_size166_w715_h520.png"")
重点来看，和邦生物子公司四川和邦生物科技股份有限公司母公司（以下简称“和邦生物母公司”）以及乐山和邦农业科技有限公司（以下简称“和邦农科”）部分生产线到汛情影响停产；此外，公司全资子公司四川和邦盐矿有限公司及乐山涌江实业有限公司的卤水及天然气销售受到相应影响。
值得注意的是，2019年和邦生物母公司实现营业收入38.16亿元，占公司总收入63.92%；净利润1.53亿元，占公司净利润29.66%；截止2019年末，该子公司总资产117.45亿元，占公司总资产的81.09%；净资产91.99亿元，占公司归属于上市公司股东的公司净资产的81.89%。
另一家重要子公司和邦农科2019年实现营业收入22.02亿元，占公司总收入36.89%；净利润1.63亿元，占公司净利润31.49%；总资产24.24亿元，占公司总资产的16.73%；净资产15.43亿元，占公司归属于上市公司股东的公司净资产的13.74%。
总体而言，遭遇洪水来袭，和邦生物损失较为严重，由于工厂水位较深，具体损失及损失金额尚无法准确认定，预计停产时间不会超过三个月。
和邦生物表示，此次汛情将对公司生产经营造成影响。公司预计损失3.5亿元-4.5亿元，其中机器设备、厂房等固定资产损失7000万元—9000万元，存货损失2.8亿元—3.6亿元。不过，公司已在积极行动。“公司现已成立‘灾后复产小组’，制定、实施灾后复产计划，力争尽快恢复公司生产经营。”
振静股份厂区进水
注册地同为四川乐山的振静股份今日也发布了一则关于公司受汛情影响的公告，公司所在地四川省乐山市五通桥区于8月18日发生汛情。汛情造成公司厂区进水，过水面积约15.71万平方米。公司该厂区为公司皮革生产的主要厂区，2019年度该厂区营收占公司营收的99%，净利润占公司净利润的96.31%。目前，公司该厂区已全部停产，预计3个月内恢复生产。汛情对公司营业收入、净利润的影响及造成损失的金额暂无法估计。
具体来看，汛情造成公司厂区进水，过水面积约15.71万平方米，水深约2米，淹没厂区厂房第一层。除少部分储存于厂房二层及更高位置的产品、原材料、设备，公司主要的产品、原材料、设备均被浸泡或冲毁。
振静股份称，此次被浸泡的原皮、在产品和产成品需经清洗后根据具体情况进行再加工、计提减值或做报废处理，已开封的化学材料需做报废处理，设备需清洗、干燥后进行检修或更换部分零部件，电器、仪表等需要更换，具体损失暂无法核定。
8月17日午间，新金路率先发布公告称，公司全资子公司岷江电化遭遇特大暴雨灾害，洪水进入厂区，产品、原材料、部分设备及库房等资产受损，具体损失情况暂无法核定。目前，岷江电化没有人员伤亡情况，生产装置已经全部停产，暂无法预估生产恢复时间，预计将对公司生产经营造成重大影响。
8月18日晚间，盛和资源也发布了遭受洪灾的公告，公司控股子公司乐山盛和稀土股份有限公司（下称“乐山盛和”）及四川润和催化新材料股份有限公司（下称“润和催化”，乐山盛和持股38.12%）所在的乐山市五通桥区于18日遭遇百年一遇特大洪水，工厂水位较深，目前工厂已全部停产，人员已全部安全撤离。
盛和资源称，乐山盛和预计损失2.4亿元-3.3亿元元，其中机器设备、厂房等固定资产损失2000-5000万元，存货损失2.2亿元—2.8亿元。润和催化预计损失1.5亿元-1.9亿元，其中存货1.2亿元-1.3亿元，机器设备、厂房等固定资产3000-6000万元。
受此影响，盛和资源8月19日开盘后即迅速跌停，截至当日午后收盘报8.04元/股。
(image_address=""https://x0.ifengimg.com/res/2020/AEDD7A2126EC035F8F6DD8B6A293C828AED19687_size11_w795_h421.png"")
“8月17-18日，四川省持续遭受强降雨等极端天气，乐山五通桥地区水位持续暴涨。乐山盛和厂区所在的五通桥金粟镇位于岷江下游，因地势低洼、靠近河道分流处，不断受到暴雨和岷江水位急速上涨的冲击。”盛和资源董秘郭晓雷接受证券时报&middot;e公司记者采访时称，汛情发生后，公司董事长及时做出指示，要求乐山盛和严防死守，保障人员安全。公司上下同五通桥政府全力应对，100余人有序开展抗洪抢险，在断水断电、物资紧缺的情况下，最终抢救出全部危险品及120余吨稀土产品。
19日晚间，公司又披露了一则补充公告，经与乐山盛和核实，乐山盛和已投保财产一切险，保险期限自2020年5月29日0时至2021年5月28日24时，总保险金额为2.76亿元，其中，存货8375.58亿元，机器设备及厂房1.12亿元，半成品8028.57万元。经与润和催化核实，润和催化未投保财产险。
盛和资源同时表示，受灾工厂后续将在地方政府指导下，根据汛情积极推进防灾、防疫、复工复产工作。",2020-08-19 20:17:38,凤凰财经
8,舍得酒业：自查发现间接控股股东通过蓬山酒业公司非经营性占用公司资金,e公司讯，舍得酒业(600702)8月19日晚公告，公司经自查，发现公司间接控股股东天洋控股集团及其关联方存在通过蓬山酒业公司非经营性占用公司资金的情形。天洋控股集团承诺于9月19日前归还非经营性占用的资金及利息。若天洋控股集团及其关联方不能按时归还非经营性占用的资金及利息，公司股票可能存在被实施“其他风险警示”的风险。,2020-08-19 20:16:33,凤凰财经
9,创业板注册制下投资者权益如何保障？广东高院出台专门司法意见,"为完善创业板改革并试点注册制的司法保障机制，2020年8月18日，最高人民法院发布《关于为创业板改革并试点注册制提供司法保障的若干意见》。
紧随其后，8月19日，广东省高级人民法院发布《关于为深圳证券交易所创业板改革并试点注册制提供司法保障实施意见》（下称《意见》），据了解，这是为深交所创业板改革并试点注册制制定的专门性司法保障文件，为深交所依法开展发行上市审核和自律监管夯实了法治基础。
从《意见》全文来看，其立足司法审判职能作用，全面落实新《证券法》和资本市场违法犯罪“零容忍”要求，妥善应对涉创业板改革并试点注册制过程中发生的新情况、新问题，把保护投资者合法权益、防范化解金融风险作为证券审判的根本任务，为加快形成融资功能完备、基础制度扎实、市场监管有效、投资者合法权益得到有效保护的多层次资本市场体系营造良好司法环境。
(image_address=""https://x0.ifengimg.com/ucms/2020_34/1EADB5DCE079383CC5B381A55C7C3280ECFE044C_w965_h839.jpg"")
再次强调“零容忍”
推进创业板改革并试点注册制，是我国全面深化资本市场改革、完善资本市场基础制度、提升资本市场功能的重要安排，也是落实创新驱动发展战略、支持深圳建设中国特色社会主义先行示范区、助推粤港澳大湾区建设的重大举措。
《意见》根据《最高人民法院关于为创业板改革并试点注册制提供司法保障的若干意见》的规定，进一步从涉创业板注册制改革案件的集中管辖、依法保障创业板证券发行制度、依法维护证券市场创业板投资者合法权益、建立适应资本市场特点的证券纠纷化解机制等四个方面提出17条举措。
包括明确本次司法保障意见的指导思想，坚持统筹存量改革与增量改革，支持依法监管和自律管理；依法保障创业板证券发行制度改革的顺利实施；进一步通过司法保障维护投资者合法权益；明确推动适应资本市场特点的证券纠纷化解机制。
《意见》第1条，首先就明确了广东省高院依法指导深圳市中级人民法院对涉及创业板改革并试点注册制的民事纠纷、行政纠纷案件依法试点集中管辖。
在此基础之上个，进一步明确支持以信息披露为核心的注册制改革实施，依法保障创业板首发、再融资和并购重组同步推行注册制，进一步压实发行人、董监高以及证券中介机构等主体的法律责任，落实市场主体归位尽责的要求。
针对创业板上市公司特殊治理结构，特别是设置特别表决权股份、红筹企业境内上市等安排，《意见》也提出了相应的要求，重心在于进一步保障普通投资者的合法权益。
另外，有关金融风险防控的司法保障安排，证券违规信用交易、配资合同、证券回购合同等纠纷的法律属性和违规情形的法律后果也得到明晰。
通过司法保障维护投资者合法权益是此次《意见》的主旋律，也是注册制改革的底线。
《意见》第6条尤其强调，对证券市场典型违法犯罪行为的打击，落实对资本市场违法犯罪行为“零容忍”。
在今年7月30日，中国证监会召开2020年系统年中工作会议暨警示教育大会一再强调“零容忍”，严厉打击资本市场违法犯罪行为。
“持续加大对欺诈发行、财务造假、内幕交易、操纵市场等恶性违法犯罪案件的打击力度，推动建立打击资本市场违法活动协调机制，推动构建行政执法、民事追偿和刑事惩戒相互衔接、互相支持的立体、有机体系。”证监会称。
在创业板改革并试点注册制的过程中，创业板股票发行规范委员会（下称“发行规范委”）在召开2020年第一次工作会议时，与会委员们就形成了一个共识，即在坚持以信息披露为核心的前提下，履行好“看门人”职责，尤其是对虚假、不实信息“零容忍”。
《意见》第8~11条也强调了对证券欺诈责任纠纷的审理原则，防范上市公司控股股东、实际控制人等相关主体对中小股东权益的侵犯；提出探索落实有关证券民事赔偿责任优先的保障机制，进一步强调证券公司对创业板证券投资者适当性管理的要求和责任。
证券纠纷化解机制再升级
在推动适应资本市场特点的证券纠纷化解机制方面，《意见》明确全面推进证券纠纷多元纠纷化解机制建设的相关要求，提出建立健全“行业自律、行政监管、专业调解、诉讼、仲裁”多元一体、有机衔接、协调联动的纠纷解决机制。
围绕证券代表人诉讼机制的落地实施，《意见》第14条提出推动投资者保护机构提起特别代表人诉讼的试点工作，依法保障投资者保护机构的诉讼权利；为保证证券代表人诉讼机制的高效开展；推动建立统一的证券审判工作信息平台，通过信息化手段优化案件受理、审判和执行等程序。
在提升证券金融审判专业水平方面，也明确加强创业板纠纷案件审判团队建设，加强证券监管机构、证券交易所、行业协会以及投资者保护机构与司法机关的专业交流，不断提升金融审判专业水平；进一步强化有关投资者教育和证券普法工作，引导市场主体正确理解创业板市场的投资权利、风险和责任，引导理性投资，注意防范风险。
对于上述《意见》，深交所表示，将认真贯彻落实最高人民法院和广东省高级人民法院司法保障意见，坚持“建制度、不干预、零容忍”九字方针，按照“四个敬畏、一个合力”工作要求，坚持稳字当头、稳中求进，努力做到“开明、透明、廉明、严明”，强化以信息披露为核心的注册制理念，完善基础制度体系，严格执行制度规则，审慎开展创业板股票发行上市审核，严厉打击欺诈发行、虚假披露等违法违规行为，配合证券代表人诉讼机制落地实施，保护投资者合法权益，增强市场各方改革获得感，坚决维护公开公平公正的市场秩序，为建设一个规范、透明、开放、有活力、有韧性的资本市场，强化创新资本形成，推动实体经济转型升级发挥积极作用。",2020-08-19 20:15:33,凤凰财经
10,中恒电气：公司董事长收到中国证监会调查通知书,e公司讯，中恒电气(002364)8月19日晚间公告，公司收到公司董事长、董事朱国锭转发的调查通知书，因其涉嫌操纵中恒电气股价、拒不配合国务院证券监督管理机构依法履行职责，涉嫌违反相关证券法律、法规，中国证券监督管理委员会决定对其进行立案调查。,2020-08-19 20:11:51,凤凰财经
