,title,content,pub_time,src
9,可停薪留职去创业，不顺利还能倦鸟归巢？华夏保险刷屏金融圈真相,"原标题：可停薪留职去创业，不顺利还能倦鸟归巢？华夏保险刷屏金融圈真相：中年人的悲伤
导读：4月21日，华夏保险下发通知称，公司鼓励B类及以上干部停薪留职自行创业。与其他保险公司“招人忙”相比，华夏保险的此番决定可谓不走寻常路。
近年来，不少保险公司都在调整组织构架和考核机制，些共识组织架构的调整往往需要招揽更多优秀人才，但不同规模的企业各有差异。
来源丨21世纪经济报道（ID：jjbd21）
记者丨李致鸿
与其他保险公司“招人忙”相比，华夏保险不走寻常路：“鼓励B类及以上干部停薪留职自行创业”。
4月21日，华夏保险下发通知称，公司鼓励B类及以上干部（尤其是年满45周岁以上的），经批准可选择停薪留职自行创业，期限不超过三年。
(image_address=""https://x0.ifengimg.com/ucms/2020_17/36A400C081E9A0176634DA1907090933B272EC4D_w600_h804.jpg"")
45岁以上B类干部并不多，更多是A类
据对21世纪经济报道记者了解，华夏保险B类干部主要是处室负责人，A类干部主要是部门负责人。相对而言，华夏保险45周岁以上的更多是A类。
一位华夏保险内部人士告诉21世纪经济报道记者，猜测公司此举主要出于控制成本，提高效率，避免人浮于事，估计后续还有配套动作。
根据华夏保险的通知，停薪留职后，根据职务年限，公司支持三到六个月标准工资，作为自行创业基金和期间生活保障。
停薪留职期间，社保由公司代缴，不再享受公司其他福利项目。基础标准为三个月标准工资，任B类及以上职务每满两年增加一个月工资，最多不超过六个月，原则上逐月发放，特殊情况经特批可一次性发放。
(image_address=""https://x0.ifengimg.com/ucms/2020_17/15F68F4B30DFD9C117D8CC71ECA00A66C6FDA94D_w1080_h738.jpg"")
图/视觉中国
公司给出三大理由，内部也有不同声音
华夏保险回复21世纪经济报道记者称：
一是尊重部分同仁自主创业的决定。疫情期间，大家都有很多思考，有人认为当前是最恐慌其实也是最有机会的时刻，提出公司给予停薪留职政策出去创业，经研究，公司给予政策通道，并给予一定经济支持。
二是直面市场竞争和人才挖角。由于公司这些年经营发展的经验价值，大量干部面临高薪高职挖角，有人“朝秦暮楚”客观存在，最终损失的还在公司，不如站在员工角度上支持他们成长进步，如果事业不顺可以倦鸟归巢，聚是一团火散是满天星。
三是支持各单位自主经营、化解压力、担升效率。近年来公司施行市场化改革，化小经营单元，成本自担、自主经营。总部各部门、分公司内部各单位的薪酬总量都是固变分离计算提取。在此形势下，各单位也希望有适合的政策来疏导部分成本压力，提质增效，扬弃向前。
不过，华夏保险内部人士也有不同声音，“公司改革可以通过市场化考核机制确定干部的去与留，这种方式还是容易人心不定。”
例如，某保险公司在内部推行的人才市场化改革，是要“干部能上能下、分配能多能少，人员能进能出”。
早在2019年1月，21世纪经济报道还曾独家报道华夏保险减编减员控薪酬。2016年，华夏保险还曾推行新“基本法”，即《华夏保险众创传家管理办法》，包括“四大权益”和创业奖金终身制等核心内容，让其旗下10余万代理人成为自主创业者。
一位保险公司负责人告诉21世纪经济报道记者，“华夏保险属于执行力比较强的公司，比较能够根据实际情况及时调整发展战略。”
有保险业人士对21世纪经济报道记者表示，“我们今年也解散了一些项目团队，团队成员和公司谈了3—6个月的薪酬补贴。”
近年来，华夏保险发展势头迅猛。华夏保险2019年四季度偿付能力报告显示，2019年，华夏保险实现保险业务收入1827.95亿元，同比增长15.49%；实现净利润7.16亿元，同比下降77.16%。
(image_address=""https://x0.ifengimg.com/ucms/2020_17/AB0949C2759AE9D10EDFC340490C2745C602EDC8_w600_h400.jpg"")
图/视觉中国
保险公司招人忙，但大小公司有差异
近年来，不少保险公司都在调整组织构架和考核机制。例如，中国人寿的“鼎新工程”，将大个险发展中心扩展至6个部门，包括营销发展部、收展发展部、个险企划部、个险运营部、培训部、综合金融部。
平安人寿实施的“2355”改革工程计划，在组织构架上将重构东区、西区、南区、北区、中区五大销售区域，及渠道管理、运营、产品、共同资源、投资管理五大职能中心。
在新华保险部门设置优化调整中，设立个险销售中心，下设营销部、收展部、培训部、销售支持部4个一级部门。其中，营销部、销售支持部由原个险销售部拆分设立；收展部由原保费部更名设立。此外，设立东、西、南、北4个个险销售区域，每个区域下设督导组、培训组。
根据华夏保险的安排，是支持各单位自主经营、化解压力、担升效率。
不过，从保险行业整体看，这些共识组织架构的调整往往需要招揽更多优秀人才。
4月15日，中国平安“国聘行动”专场上线，面向全社会求职者开放约2万个岗位需求。据中国平安介绍，此次国聘行动，中国平安全面开启“云招聘”模式，集团共有20多家专业公司参与，约2万个岗位面向全社会开放。
此外，平安正在面向全国招聘数十万保险代理人。中国人寿也于3月13日启动了春季校园招聘活动，累计提供1057个岗位，拟招聘2161人。截至3月29日，中国人寿已经收到超过2万名应届毕业生投递的简历。此前，大家保险集团公布的2020年集中社会招聘岗位多达1626个。
一位保险公司人力资源负责人告诉21世纪经济报道记者，“虽然岗位多，但是竞争也很激烈。”
不过，有业内人士对21世纪经济报道记者坦言，“大公司和小公司处境不同，还是有一些小公司经营很难。”
麦肯锡的报告显示，这次疫情会对大量企业的现金流产生负面影响，这些受影响的企业如果已经投资、参股和控股保险公司，他们有可能因为现金流紧张而通过出让保险资产股权变现。
而一些中小保险公司，特别是新开业的保险公司，也承受着很大的现金流压力，两股力量作用下，是否会引发新一轮股权交易，这点值得关注。
内勤转外勤，保险业发展前景宽广
公开信息显示，在上市保险公司中，单家员工平均薪资在21.54万元左右。
一位保险公司人士对21世纪世纪经济报道记者表示，保险公司员工的创业方向可以是代理人。一些内勤员工往往会选择转为外勤代理人，优秀的代理人可能收入更高。
国泰君安非银金融研报显示：当下为寿险行业代理人渠道的结构性转型期，各家公司逐渐从粗放式的人力增长模式转变为高质量发展模式，明确定位目标客群并坚定推行中长期渠道改革的保险公司将抢占优质代理人资源，有望在寿险发展新周期中获得领先地位。
事实上，经过几十年的发展，保险越来越为广大社会所认识和接受。随着经济社会的发展，保险业必将发挥出更大的不可替代的作用，这是由经济社会发展的阶段，和风险的演进规律，以及保险的职能所决定的。
(image_address=""https://x0.ifengimg.com/ucms/2020_17/6E963CBB6CE789095609B84A9367BC5BC119AF8D_w1080_h718.jpg"")
图/图虫创意
这次疫情，也令健康险快速发展。业内人士认为，中长期来看，疫情提高了居民对疾病的自我防范意识和对健康风险的保障意识，有助于激发健康险的配置需求，预计将推动健康险行业迅速发展。
根据瑞士再保险瑞再研究院报告：
中国引领的亚洲新兴市场被视为行业增长的主要推动力，预计2020年，中国非寿险保费将增长9%，寿险保费将增长11%。此外，预测未来10年，中国保费收入将占亚洲总额的60%。",2020-04-21 15:26:12,凤凰财经
10,银保监会：2019年立案打击涉嫌非法集资刑事案件5888起 涉案金额5434.2亿元,"WEMONEY讯4月20日，2020年处置非法集资部际联席会议在京召开。会议全面总结2019年以来防范和处置非法集资工作，深入分析形势，研究部署下一阶段重点任务。会议以电视电话会议形式召开，联席会议召集人、人民银行党委书记、银保监会主席郭树清出席会议并讲话。
会议认为，2019年以来，各地各部门认真贯彻总书记系列重要指示批示精神和党中央、国务院决策部署，主动担当作为，打非处非工作取得显著成效，为庆祝新中国成立70周年等重大活动营造了良好氛围。公安部连续三年部署打击非法集资犯罪专项行动。司法部等部门积极推动《防范和处置非法集资条例》立法进程。民政部、农业农村部等将防范非法集资风险与促进行业发展同部署、同推进、同考核。全国非法金融活动风险防控平台上线试运行，28个省份监测平台已投入使用。各地重拳出击、精准拆弹，一些积累多年的风险得到化解，一批久拖未决的案件得以处置。2019年全国共立案打击涉嫌非法集资刑事案件5888起，涉案金额5434.2亿元，同比分别上升3.4%、53.4%。
会议强调，面对严峻复杂的国际国内形势，今年打非处非工作要坚持稳中求进工作总基调，坚持“稳定大局、统筹协调、分类施策、精准拆弹”的基本方针，注重提前部署、下好“先手棋”，注重源头管控、打早打小，注重标本兼治、全链条治理，全力保护人民群众财产安全，切实维护社会大局稳定。
会议提出，2020年要重点做好以下工作：一是加快推动《防范和处置非法集资条例》出台。做好贯彻落实《条例》各项准备工作，充分运用行政手段加强源头治理。不断健全执法机制，加快构建行政处置与司法打击并重并举、有机衔接的新格局。
二是审慎稳妥处置风险。完善涉非突发事件应急响应机制，稳妥有序打击处置网络借贷、私募股权等重点领域非法集资活动。深入推进存案攻坚，争取大幅消减存案数量。
三是持续完善监测预警体系。抓紧编制全国非法集资监测预警体系建设三年规划。健全完善国家平台，改造提升地方平台，加快实现互联互通。充分运用反洗钱等手段，更好发挥金融机构“前哨”作用。深入开展涉非广告信息和风险排查整治，建成网上网下、群防群治的风险防控“天罗地网”。
四是推进形成大宣传格局。制定防非宣传教育五年规划，精心组织防非宣传月等品牌活动。进一步发挥主流媒体作用，积极拓展新媒体渠道，推动形成政府全面行动、社会广泛参与、持续协调发力的宣传工作局面。（WEMONEY张国栋/编辑）
(image_address=""https://x0.ifengimg.com/ucms/qr/2020_17/CAF6A585A616E4D019240D79907BA80B1A972BAF_w2880_h1396.png"")",2020-04-21 15:25:07,凤凰财经
11,盛松成：中国经济将转危为机，投资在今年将发挥更重要作用,"(image_address=""https://x0.ifengimg.com/ucms/2020_17/9B43819CF0D2E03C986CEDFE7F59BB2BB20170A5_w690_h423.jpg"")
4月17日召开的中共中央政治局会议强调，当前经济发展面临的挑战前所未有，必须充分估计困难、风险和不确定性，切实增强紧迫感，抓实经济社会发展各项工作，并在“六稳”的基础上首次提出要保居民就业、保基本民生、保市场主体、保粮食能源安全、保产业链供应链稳定、保基层运转。“六保”是首次在政治局会议中提出，体现了坚持稳中求进的工作总基调。
同日，我国统计局公布了今年一季度经济数据。在一季度GDP增速负增长的情况下，政治局会议要求以更大的宏观政策力度对冲疫情影响，包括积极的财政政策要更加积极有为，提高赤字率；稳健的货币政策要更加灵活适度，运用降准、降息、再贷款等手段，保持流动性合理充裕。
对于一季度经济运行情况，我的体会是：
第一，统计数据实事求是地反映了我国经济运行情况。一季度，GDP同比下降6.8%，比不少经济学家预测的低，当然，比有些悲观者预期的高。其中，比较出乎大家预料的是，第二产业增加值下降9.6%，负增长的幅度超过了第三产业的-5.2%。尽管在意料之外，却在情理之中，符合实际情况。因为第三产业和人们的生活更直接、更密切。比如与人们生活密切相关商品呈现增长态势，限额以上单位粮油、食品类，饮料类和中西药品类商品分别增长12.6%、4.1%和2.9%，比1-2月份分别加快2.9、1.0和2.7个百分点。此外，第三产业主要取决于国内情况，受国际环境影响比第二产业相对较小。在三个产业部门中，第二产业下降幅度最大，这和疫情防控期间二产停摆时间较长、以及国外疫情蔓延有关。
第二，3月份经济逐步企稳。3月当月，规模以上工业增加值同比下降1.1%，较1-2月回升12.4个百分点；社会消费品零售总额同比下降15.8%，比1-2月回升了4.7个百分点；固定资产投资同比增速为-9.5%，而1-2月为-24.5%，其中，基金投资、制造业投资、房地产投资增速分别为-14.0%、-20.6%和1.2%（房地产投资由负转正），分别比1-2月回升12.9个、10.9个和17.5个百分点。3月当月，我国进口、出口同比增速分别为-6.6%和-0.3%，降幅分别较1-2月收窄10.6个和3.1个百分点；3月贸易顺差199亿美元，而1-2月为逆差。
第三，高新技术产业逆势而上，我国经济转型有加速的趋势。3月份，我国高技术制造业同比增长8.9%，其中计算机、通信和其他电子设备制造业增长9.9%。工业机器人和发电机组产量分别增长12.9%和20.0%。第三产业中，信息传输、软件和信息技术服务业增加值同比增长13.2%。根据不久前清华大学经管学院对212家大中型企业的调研，本次疫情在中长期对企业发展也有显著的影响，超过七成的企业将数字化转型、实现业务线上化作为未来发展的重点。
第四，金融支持实体经济力度加大。尽管第三产业增加值负增长，但金融业增加值却保持了6%的高增速，依此计算，一季度金融业增加值在GDP中的占比超过10%。3月末，M2余额同比增长10.1%，增速分别比上月末和上年同期高1.3个和1.5个百分点。3月末人民币贷款余额同比增长12.7%，增速比上月末高0.6个百分点，比上年同期低1个百分点。从增量看，一季度人民币贷款增加7.1万亿元，同比多增1.29万亿元，其中3月份同比多增1.16万亿元。3月末社会融资规模存量同比增长11.5%，较上月末和上年同期均提高0.8个百分点。从增量看，一季度社会融资规模增量累计为11.08万亿元，比上年同期多2.47万亿元。其中，人民币贷款、直接融资和政府债券净融资增加较多，同比分别多增9608亿元、9131亿元和6322亿元。
对今年接下来三个季度的经济运行，我也有以下几点看法：
第一，不能单纯凭一季度GDP增速来推论全年的经济增速。这不仅因为二季度开始，我国经济会逐渐企稳向好，并且可能一个季度比一个季度好。我们还应该看到，一至四季度占全年GDP的比重是不同的。在正常年份下，各个季度经济增加值占全年GDP的比重是逐季提高的，比如2019年一至四季度增加值占比分别为22.1%、24.5%、25.6%和27.8%。而且今年情况特殊，经济受疫情的影响程度会逐季减少，而经济发力会逐季增强。所以，全年GDP的占比更会呈现逐季提高的态势。这是预测或设定全年GDP增速所需要考虑的一个重要因素。由于海外疫情等不确定性，二季度我国经济可能还无法恢复至正常水平。假如二季度经济增速达到3%，三、四季度分别达到6%和7.7%，则今年全年的GDP增速可达3%。
(image_address=""https://x0.ifengimg.com/ucms/2020_17/8A22F8B5F4A912E6EEB75727D99C764A2A7B4ACE_w600_h272.jpg"")
第二，投资将在今年我国经济增长中发挥更重要的作用。从GDP支出法衡量，由于今年全球疫情蔓延，国际形势复杂，净出口很大程度上不在我们的掌控之内。由于疫情影响了国内居民的收入，不仅冲击一季度消费，而且对全年后续消费也有影响。一季度，全国居民人均可支配收入同比实际下降3.9%。因此，在努力促进消费和国际贸易的同时，投资将在今年我国经济增长中扮演更重要的角色。
(image_address=""https://x0.ifengimg.com/ucms/2020_17/9CCAD9B572A4BFB0E0B8C080FE83E81FD802B8E1_w600_h350.jpg"")
从图中可以看出，无论是2003年“非典”时期，还是2009年国际金融危机期间，我国净出口对经济增长的贡献都为负，2009年更是触及-42.6%的低位。而投资对经济增长的贡献率都比一般年份高得多，2009年更是高达86.5%。尽管这次疫情冲击与“非典”及国际金融危机时期情况不同，但“三驾马车”对GDP的贡献可能会很相似。
第三，要把稳就业放在更加突出的位置。无论是“六稳”还是“六保”，就业都首当其冲，为民生所系。今年3月我国城镇调查失业率为5.9%，尽管较2月份下降了0.3个百分点，但仍处于较高水平。而且，复工不等于完全复产。企业不裁员不等于员工都正常上班。由于疫情的冲击，“隐性失业”比较普遍。今年870万高校毕业生、农民工和城市低收入人群的生活应该引起高度关注。这也是党和国家领导人多次强调的。为此，要从各个方面支持中小微企业复工复产。首先是它们能活下来，因为它们吸纳了80%的就业人口。4月17日政治局会议首次提出“保市场主体”。市场主体，如企业、个体工商户等，是经济运行最基本的单位。如果市场主体因为疫情冲击而“枯萎”，那么疫情对经济的影响就可能从短期发展为长期。“保市场主体”就是最大的保就业、保民生。
第四，服务业是今年稳经济、稳就业的重要领域。服务业是典型的劳动密集型产业，吸纳就业的能力优于其他产业。截至2018年，服务业就业占比达到46.3%，吸纳就业人口是第二产业的1.68倍，是第一产业的1.77倍。先进制造业也完全离不开现代服务业，如研发、教育、商务服务等。服务业发展既能提升我国GDP，又能提高人民生活质量，还能减少服务贸易逆差。多年来，我国对全球服务贸易逆差不断扩大。从2008年至2018年，我国货物贸易顺差提高了1.1倍，而服务贸易逆差扩大了26倍。2019我国服务贸易逆差首次较上年收窄300多亿美元。未来仍需加快服务业的改革开放。
第五，房地产业在经济增长中仍然具有重要作用。固定资产投资主要由基建投资、制造业投资和房地产投资组成。2019年，我国固定资产投资同比增长5.4%，其中房地产投资增长9.9%，而基建投资和制造业投资仅增长3.8%和3.1%。今年一季度，一季度，全国固定资产投资同比下降16.1%，其中，基建投资同比下降19.7%，制造业投资同比下降25.2%，房地产投资同比下降7.7%，房地产投资对固定资产投资的拉动作用还是最大。房地产业还影响着其他很多产业，所以在坚持“房住不炒”和“稳地价、稳房价、稳预期”的前提下，应该稳定今年的房地产投资和销售。4月17日的政治局会议再次强调“要坚持房子是用来住的、不是用来炒的定位，促进房地产市场平稳健康发展”。这表明我国既需要防止房地产市场过热，也应确保房地产行业合理的发展需求得到满足。应坚持供给和需求相结合的调控方式，当前尤其要加强供给端的调控。按照“一城一策”的原则，增加人口流入和房地产库存较低的城市的住宅土地供应。坚持需求端调控不放松是为了稳房价和稳预期。
（本文作者系上海市人民政府参事、中欧国际工商学院教授、中欧陆家嘴国际金融研究院常务副院长）",2020-04-21 15:23:32,凤凰财经
