,title,content,pub_time,src
0,蚂蚁集团：五只创新未来战配基金认购额会退回给基金,"(image_address=""https://x0.ifengimg.com/ucms/2020_45/923D7E6BF8F2CA52F1348A209D4AA6952948BB65_w3999_h2666.jpg"")
财联社11月5日讯，今日晚间，蚂蚁集团发布公告称，将于6日启动退款程序，相关战略配售基金受何影响？对此，蚂蚁集团回复财联社记者称，参加战略配售的封闭式基金缴纳的认购资金会依照公告退回给基金。“目前五只创新未来战配新发封闭式基金均已成立，战配基金将依据募集说明书的约定和投资方向继续独立运作。”（财联社记者沈述红）",2020-11-05 21:50:41,凤凰财经
1,最新！首批4只科创50ETF上市时间基本定了，首发遭千亿资金疯抢,"证券时报下中国基金报记者若晖
1个多月前刚刚引发千亿资金抢购的4只科创50ETF即将迎来上市“首秀”。
近日，多位业内人士透露，华泰柏瑞、华夏、易方达、工银瑞信旗下4只科创50ETF暂定上市日或在11月中旬左右，不过，具体上市日期仍待基金上市公告书正式披露。
10月底股票仓位或约5成
自9月28日成立以来，截止目前，上述4只科创50ETF仍处于建仓封闭期，仍按照每周的频率公布净值，截止上周五（10月30日），4只科创50ETF最新净值均在0.98元附近。
(image_address=""https://x0.ifengimg.com/ucms/2020_45/2EB211F6E3130059BF5ED2F4045C5AFA09B8EE73_w440_h158.png"")
同期，科创板指数从9月28日的1338.95收盘点位，一路连拉5连阳，至10月13日1498.83点的阶段性高点，而后转升为跌，到了10月26日开始小幅反弹，截止10月30日收盘报收1393.91点，区间涨幅2.19%。
相比指数走势，说明4只科创50ETF在10月上旬，科创50指数上涨时已有所建仓。
分阶段对比基金净值涨跌幅与指数同期走势也可初略看出基金经理的建仓节奏。
国庆长假前夕的最后三个交易日(9月28日-9月30日)，在科创50ETF成立等多重利好带动下，科创50指数三个交易日大涨4.02%，而据9月30日的基金净值披露，同期，4只科创50ETF最高仅上涨0.27%，4只基金平均涨幅仅0.21%，远落后于指数表现，侧面反映出至少在国庆前夕，基金经理刚刚开始建仓。
不过，到了10月23日当周，科创50指数大跌7.09%，上述4只科创50ETF平均跌幅为3.38%，跌幅最大的一只接近4%，说明经过国庆节后的10多个交易日的建仓时间，4只科创50ETF平均仓位已接近50%。
根据ETF相关运作规则，科创50ETF上市时应该基本完成建仓，目前距离11月中旬只有不到10个交易日，在这段时间内，上述4只科创50ETF还会逐步提升股票仓位。
11月5日同时发布份额折算公告
11月5日，华夏、华泰柏瑞、易方达、工银瑞信4只科创50ETF同时对外发布基金份额折算的公告。
例如，华泰柏瑞在上证科创板50成份ETF基金份额折算的公告中称，基金管理人决定对华泰柏瑞上证科创板50成份ETF进行基金份额折算与变更登记，并决定2020年11月9日为本基金的基金份额折算日。基金登记结算机构将于2020年11月10日进行基金份额的变更登记。基金管理人将于2020年11月11日刊登基金份额折算结果的公告。
记者查阅公告发现，其余3只科创50ETF的份额折算日也均设在11月9日。
(image_address=""https://x0.ifengimg.com/ucms/2020_45/30E09855FB13A8502420D061DA3C964EA9F4F834_w540_h288.png"")
据华泰柏瑞介绍，一只新的ETF在成立后往往要进行份额折算，通常以折算当天标的指数收盘价的千分之一作为ETF折算日的基金单位净值，在保证基金资产不变的前提下，基金份额同时做出相应调整。这个行为往往发生在基金建仓期结束后，目的是方便投资者跟踪基金份额净值变化。
此外，份额折算对投资人的权益没有实质性的影响。由于基金资产=单位净值&times;基金份额，基金原单位净值乘以一个系数与折算日指数收盘价的千分之一相等，同时，基金份额再除以同样系数得到折算后份额，基金资产不变。
通过折算，ETF的基金净值与指数挂钩，使投资者可以更加直观地了解ETF的表现，甚至直接从盘中指数的变化来估算ETF净值的变化，从而可以更方便地进行趋势投资或者一、二级市场的套利操作。
曾引发千亿资金抢购
作为首批跟踪科创板指数的ETF，4只科创50ETF从基金上报到获批、发行，每一步都引发市场关注，50亿发行额度上限在首发当日均一日售罄，纷纷开启比例配售，当日累计吸金上千亿元，超过了2012年两只沪深300ETF合计首发500多亿的历史记录，其中，华夏科创50ETF更是单日募集超过450亿，刷新ETF首发史上最高认购规模记录。
(image_address=""https://x0.ifengimg.com/ucms/2020_45/3B7FA80839836A729F83C08914C0D59D471BE325_w564_h165.png"")",2020-11-05 21:35:41,凤凰财经
2,优胜教育陈昊喊话大佬：愿0元出售优胜所有股份,"11月5日，优胜教育创始人陈昊在微博发长文再度公开道歉，分别向学生、学生家长、同事、教育行业及家人致歉。除道歉外，陈昊还表示“愿意把所有股份0元赠予愿意伸出橄榄枝的伙伴”、“愿意在未来十年在新优胜无偿打工”，并且喊话“尊敬的马云、马化腾老师，做实业令人尊敬的许家印老师、曹德旺老师，京东的刘强东先生，新一代的企业家张一鸣先生、王兴先生，以及教培行业中优秀的同行们”，希望众人能够伸出援手帮助优胜渡过难关。
而陈昊方向凤凰网财经《启阳路4号》爆料，事实上，陈昊更想要得到同行业大佬的支持，愿意0元将股份赠予俞敏洪、陈向东、张邦鑫等教育行业的有经验人士，以期优胜教育获得更好的发展。
这已不是陈昊第一次公开道歉，在被媒体曝出优胜教育北京总部人去楼空无人办公、疑似跑路后，他便通过抖音多次道歉，一再表示“优胜不会跑路，我会一直坚持到底”。
不过，对于陈昊这番说法，优胜教育的老师及学生家长似乎并不买账。10月19日，上千名家长和老师聚集在位于北京的优胜教育总部，家长要求退费，老师和优胜教育员工则要求发放拖欠的薪资。
作为老牌K12龙头，优胜教育遭遇了怎样的危机？
疑陷入跑路风波
自“爆雷”以来，多名自称是优胜教育老师的网友称优胜教育从2019年底就已有欠薪的状况出现，对于该种说法陈昊表示个别校区有这种现象，一是因为全国范围较大，管理有所疏忽，二是个别加盟商“甩锅”。
到了2020年，因为疫情，主打线下的优胜教育遭遇重大打击，收入只有原先的三分之一，最差的时候，连以往单月的五分之一都不到。与此同时，更多的加盟商资金断裂无法经营，优胜教育一再承接这些“烂摊子”，负担了结欠薪和结退费的责任及义务。
截至目前，优胜教育全国还有数百家门店在运营，但与2019年相比，可供营业的门店数量已腰斩过半。不过，优胜教育并没有就此沉寂，还在寻求破局之道，即便受疫情影响下，优胜教育也在一线城市等品牌核心地区增设门店。
实际上，对于此次优胜教育“爆雷”的原因，大众普遍认为不能完全归咎于疫情，而是因此前优胜教育扩张太快，通过加盟方式攻城略地而忽视了风险管控。陈昊也曾在直播中坦言，2018-2019年，由于发展过快，他们有接近50%的校区不符合国家规范。
为了符合2018年教育行业的政策要求，优胜教育对校区进行大规模的换址、重新装修，前后花掉3亿多资金，期间优胜教育不仅没有采取措施增加资金储备，反而承担着很大的财务压力。
对于目前大众所质疑的陈昊将优胜教育的法人变更为唐芳琼是为了“全身而退”这一说法，陈昊解释为，更换法人是为了不影响到贷款。长期积累下来，优胜教育涉及大量的诉讼，为了能够顺利贷款解决危机，陈昊选择变更了法人。但是优胜教育的股权没有变更，陈昊仍为大股东，因此，陈昊表示自己没有逃避责任的意思。
试图委身上市公司获得生机
危机发生后，优胜教育四处奔走，寻求解决的方法。首先是包括创始人陈昊在内的一众高管率先变卖资产，向上市公司质押股份获得资金来源，然而此种方法收效不大。此后，优胜教育试图委身上市公司获得生机。
2020年5月26日，上市公司金洲慈航发布公告称，拟以不超过5亿元的现金收购陈昊等交易对手方持有的优胜腾飞100%股权，而优胜教育为其全资子公司。
该公告显示，金洲慈航与陈昊等交易方还约定了业绩对赌承诺，陈昊方承诺2020-2024年分别实现净利润0.2亿元、0.7亿元、1亿元、1.4亿元、1.7亿元。这表明，优胜教育的一众股东、高管对优胜教育仍存有信心。然而，随着优胜教育业绩不确定性增强，五个月后金洲慈航宣布终止了该项交易。
除了主动向上市公司、业界巨头寻求帮助之外，陈昊表示还有一些同行自发的帮助优胜教育。“今天就有超过8家同行伸出了温暖的手，帮我们接收了部分学生。”10月25日晚上8点，优胜教育创始人陈昊在直播中介绍当日公司“自救”进展，这是其自21日承诺每日露面以来的第5次直播。
陈昊透露，自发伸出援手的同行多为规格小于优胜教育的中小机构，这些机构主动帮忙纾困，有的帮忙结算员工欠薪，有的帮忙结算退费，还有的帮助维持课程。
陈昊喊话大佬
同行的援助使陈昊看到了希望，11月5日，陈昊在微博发布长文，表示“如果能让孩子们朗朗的读书声在优胜再次响起，我愿意付出一切。”
从微博文章来看，陈昊所指的付出包括两方面，一是优胜教育的团队愿意将所有股份0元赠予愿意伸出橄榄枝的伙伴，二是陈昊个人愿意未来为新的优胜教育无偿打工十年。此外，陈昊还喊话各行业巨头，“希望尊敬的马云、马化腾老师，做实业令人尊敬的许家印老师、曹德旺老师，京东的刘强东先生，新一代的企业家张一鸣先生、王兴先生，以及教培行业中优秀的同行们能够在这时候，伸出援手，帮助优胜度过难关的同时，也帮助教培机构走向长期的规范，帮助家长消除焦虑。”
对此，凤凰网财经《启阳路4号》联系了陈昊方，陈昊方表示他们不仅寄希望于各巨头能够对优胜教育伸出援手，更希望同行业的大佬如新东方的俞敏洪、跟谁学的陈向东、好未来的张邦鑫等人介入，因为相较而言教育行业更适合接手优胜教育，陈昊团队愿意0元赠送所有股份并且贡献出在教育行业的全部资源。
不过，优胜教育虽有如此希望，但未来是否有教育行业龙头愿意接手，情况仍不明朗。
以下附陈昊道歉全文：
一个近20年教育行业创业者的致歉信
我对不起信任优胜的学生们：
我做优胜教育近20年，最重要的原因就是想为中国孩子的教育做点小贡献，这跟我从小受的教育和创业的初心紧密的绑在一起。曾经一度我以为我做的不错，我自己和亲朋好友的孩子也在优胜上课，当时的我觉得没有辜负作为一个父亲和教育工作者的抱负。但是没想到，一场疫情让我曾经引以为傲的事业瞬间崩塌。优胜教育是给孩子们办的，我最对不起的就是数万名信任优胜的孩子们。如果能让孩子们朗朗的读书声在优胜再次响起，我愿意付出一切。而现在我想表达的，就是歉意和一句承诺，我将负责到底。
我对不起信任优胜的学生家长们：
有几句掏心窝子的话想对学生家长说，为了孩子的教育，中国的父母可以付出一切，优胜认为，教育本来不该那么贵，所以我们坚持做性价比最高的课程服务，这一点我愿意接受大家公开透明的调查。我知道你们的钱都来之不易，出于信任选择了优胜，竭尽所能的退费和补偿是我此刻最想做的事情。但眼下，由于资金链断裂，优胜处理的非常不好。在长达8个月的疫情期间，我们的收入只有原先的1/3，最差的时候，连以往单月的1/5都不到。屋漏偏逢连夜雨，这个时候，部分加盟商资金链开始出现断裂，有的会主动向总部求助，有些加盟商甚至直接失联，造成停课。从出现问题开始，我们都在尽力解决，直接接盘80多家加盟校区，不想因为当时加盟校的问题让学生家长和品牌受损，我们卖房卖车勉强接盘，本以为随着疫情的恢复，我们可以顺利解决，但没想到最终却连累到正常经营的校区，加速了总部资金链断裂。我会尽快找到合适的机构，帮助不同地区的孩子复课。
我对不起并肩创业的同事、战友：
接下来我要对跟我并肩战斗的优胜人说几句。我习惯性的把我的同事和下属看作是我战斗的伙伴以及师徒的情谊，你们和我一起曾经见证了中国K12个性化教育的繁荣景象。在危机到来之时，也一起想尽办法，希望携手共度难关。曾经我们以为我们可以做到，但是困难总是无情的。我可以负责任的说，优胜的高管和同事是负责任的一群人，并没有像传言说的，树倒猢狲散，拼命甩锅不负责任。八个多月的时间，我们努力解决问题。在此期间，很多我的同事没有领一分薪水，纯凭对教育的情怀和对我的信任，并肩战斗。很多管理者都自掏腰包垫付了工资和退费。每次想到这些，我都会有一种隐隐的自豪，伴随而来的是更深的愧疚。我到底该怎么做，才能回报这些信任我支持我的同事们。如果不愿意继续在优胜的同事，我们会努力找到合适的机构予以推荐和安置；如果还愿意跟我并肩作战，我愿意和大家一起守到曙光到来的那一刻。
我对不起信任优胜的加盟商：
投资教育是一个长线的事情，正如你们当时选择优胜一样，是对我近二十年来扎根在教育行业的一种认可。但是在重大危机面前，我们的经验不足，预警缺失，没有在最佳时机帮助大家渡过难关，我个人深感歉意。
我对不起教育行业:
我给行业蒙羞了。我虽然有一个让中国教育更好的梦想，我曾经自信满满的认为，自己不会是教育行业拖累家长的人，还曾经批评过一些跑路的机构，但是今天，我虽依然坚守在这里，但是我给行业造成了恶劣影响。对于家长对教育行业产生的信任危机，我也难辞其咎。
我对不起我的家人：
我父母都是教育工作者，我一直认为我是他们最好的教学作品，但是今天我让我的父母抬不起头，我的亲人抬不起头。为了贷款，让母亲做法人，把我母亲推到了风口浪尖。我父亲年事已高，又患有癌症，我却连续8个月没能给一分钱生活费，更不能在身边尽孝。我的孩子突然变得性格内向，每天忧心忡忡，我甚至都没有勇气跟他坐下来沟通。我的爱人倾其所有，并把亲朋好友可以借的钱都借光了。我让三代人没有地方可以住.......
我很痛苦，我对不起扎根在教育行业奋斗了近20年的优胜人：
我们企业的核心思想是良心加实力等于优胜，但是我现在成为了别人眼中既不讲良心又失去了实力的人。近20年来，我没有惧怕过任何对手，也没有因此痛苦过。以往的任何困难都是让我更坚定的动力，我们之所以能成为行业标杆，也是因为优胜一往无前的决心和血性。但是这次，面对我的学生，家长、同事和加盟商，我痛苦的夜夜无法入睡。我知道大家都关心优胜资金链为什么会断裂。大多数人都愿意相信阴谋论，因为不忘初心的人在这个世界上实在太少，自证清白总是很难的事情。但是我还是想说：
1、在现金流告急的情况下，我和我们高管砸锅卖铁已经支撑了八个月；在这件事情上，我相信我们是想坚守良心的。2、请大家相信现在正在正常运营的校区，他们都是有教育情怀的人，疫情期间他们也是卖房卖车坚守到现在，请大家相信他们的真诚。
3、我们整个团队愿意把所有股份0元赠予愿意伸出橄榄枝的伙伴，纵有万般不舍将自己苦心经营近20年的孩子送出去，但面对亏损的学员、家长、同事、加盟商，我更想更快的解决困难，我个人愿意在未来十年在新优胜无偿打工，将自己积累的近20年的教育经验以及在教育行业拥有的资源全部贡献给新优胜。我不会哗众取宠，我希望尊敬的马云、马化腾老师，做实业令人尊敬的许家印老师、曹德旺老师，京东的刘强东先生，新一代的企业家张一鸣先生、王兴先生，以及教培行业中优秀的同行们能够在这时候，伸出援手，帮助优胜度过难关的同时，也帮助教培机构走向长期的规范，帮助家长消除焦虑。纵然穷尽心力，也只权作是对此刻我伤害过的家长、学生、教育行业以及优胜本身的赎罪。
我希望大家不要因为我个人的失败而对整个教育行业失望。我希望正在面临困难的同行以及跟我一样正在面临困难的创业者能够早日走出困境。
我们一起，负责到底！
优胜教育陈昊",2020-11-05 21:16:48,凤凰财经
