,title,content,pub_time,src
0,融资超500亿，中芯A股上市！开盘暴涨市值追赶中石油,"肩负中国芯片行业希望的中芯国际今天登陆A股！公司发行价为27.46元/股，开盘价为95元/股，涨幅达245.96%，总市值达6780亿元，成为A股市值最高的半导体公司，这个市值在A股一度能排到第11位，仅次于中国石油。
(image_address=""https://x0.ifengimg.com/ucms/2020_29/A38EE7650B9D9D217E3C36BB8BB62EEB6C0714F1_w988_h726.png"")
中芯国际可比公司市值参考（图片来源：同花顺i问财）
中芯国际A股此前有101万个中签号码，每个中签号码只能认购500股中芯国际股票，这也意味，投资者以开盘价卖出，每个号盈利就有3.3万元！
中芯国际A股股价与其H股股价的差距也迅速扩大，截至北京时间10:14，中芯国际H股价报83.62元（总市值缩水到5967亿元），而H股股价仅31.85港元。
(image_address=""https://x0.ifengimg.com/ucms/2020_29/3210F3A86C83D0F01828753208D446BE254F9AE1_w828_h1044.jpg"")
与此同时，中芯国际A股的成交额也达到了285亿元，换手率高达31%，同期半导体板块的成交额为494亿，中芯国际A股堪称“吞金兽”。
(image_address=""https://x0.ifengimg.com/ucms/2020_29/937C042EEB182ADB203E12BEE83B886A2062B214_w576_h796.png"")
受此影响，一些此前颇受追捧的半导体个股，如沪硅产业、中微公司、长电科技等今天大跌。
(image_address=""https://x0.ifengimg.com/ucms/2020_29/48DA59B666D6FE2E991F9D02B41C3BE7A5A0A6FF_w702_h828.png"")
国信证券研报认为，中芯国际比贵州茅台更珍贵。从可替代性来讲，中芯国际与贵州茅台一样不可替代、无法复制。同时，因为稀缺性导致中芯国际具有和贵州茅台同样的议价能力。从社会必要劳动时间的角度看，中芯国际的价值量超越贵州茅台。800年前就有茅台了，而我们奋斗到今天才有中芯国际的14nm先进制程。相同资产在不同市场有不同价格，所以，科创板的中芯国际的估值超过龙头台积电（注：最新市值超2万亿元人民币）也是有可能的。
(image_address=""https://x0.ifengimg.com/ucms/2020_29/7C5A96A11DF61D6C24E9E3E2C2EB7C9162821AD5_w900_h383.jpg"")
图片来源：摄图网（图文无关）
不过贵州茅台股价今天表现并不好，开盘后一度大跌超5%。此前，人民日报《学习小组》发表文章表示，茅台酒凭什么成为官场腐败硬通货？文章指出，酒是用来喝的，不是用来炒的，更不是用来腐的。
最高募资超500亿元
周三，中芯国际公告称，公司已完成人民币股份发行。人民币股份将于2020年7月16日上市及开始于科创板买卖。
根据中芯国际公告，本次发行募集资金净额为4566279.83万元（456.63亿元，行使超额配售选择权之前）；5251560.72万元（525.16亿元，若全额行使超额配售选择权）。这一金额已超越中国通号105亿元的融资额，创下科创板融资新纪录。
其中，公司募投项目预计使用募集资金200亿元，包括80亿元投于SN1项目，40亿元投于先进及成熟工艺研发项目，80亿元用于补充流动资金。
(image_address=""https://x0.ifengimg.com/ucms/2020_29/1AF0234E73788BF303E2C099759FA669CD5F109F_w1080_h238.png"")
当天的公告中，中芯国际提示了以下四大风险：
1、涨跌幅限制放宽
科创板企业上市后前5个交易日内，股票交易价格不设涨跌幅限制；上市5个交易日后，涨跌幅限制比例为20%。科创板股票存在股价波动幅度较上海证券交易所主板、深圳证券交易所主板、中小板更加剧烈的风险。
2、A股流通股数量较少
上市初期，保荐机构跟投股份锁定期为24个月，其他战略投资者锁定期为12个月，网下限售股锁定期为6个月。
本次发行后，公司A股的无限售流通股为1040231223股（10.40亿股），分别占发行后已发行股份总数的14.58%（行使超额配售选择权之前）、14.08%（全额行使超额配售选择权之后），公司上市初期流通股数量较少，存在流动性不足的风险。
3、市盈率高于同行业水平
公司所处行业为专用计算机、通信和其他电子设备制造业（C39），本次发行价格27.46元/股，对应本公司2019年度扣除非经常性损益前的摊薄后市盈率（全额行使超额配售选择权之后）为113.12倍，高于截至2020年7月4日（T-3日）中证指数有限公司发布的行业最近一个月平均静态市盈率46.17倍，提醒投资者注意未来可能存在股价下跌带来损失的风险。
4、股票上市首日即可作为融资融券标的
科创板股票上市首日即可作为融资融券标的，有可能会产生一定的价格波动风险、市场风险、保证金追加风险和流动性风险。
机构此前预估：市值将达6500亿
(image_address=""https://x0.ifengimg.com/ucms/2020_29/FCB86271D087DF0E154F56769382D9ADED4F4EE4_w1080_h540.jpg"")
图片来源：摄图网（图文无关）
去年5月，香港、美国两地上市的中芯国际在香港证券交易所发布公告称，公司决定主动从纽约证券交易所退市，且已得到董事会批准。在那之后，中芯国际的港股开始一路上涨，一年涨幅接近4倍。
2020年一季度，中芯国际实现营收9.05亿美元，同比增长35.3%，创单季营收历史新高；归属于股东的净利润达6416万美元，同比大幅增长422.8%。
在此基础上，中芯国际继续上调二季度营收预期。其预计Q2营收将环比增加3%至5%，毛利率范围在26%至28%之间，并表示全年收入有望同比增长10%至20%，全年毛利率有望达到约20%。
根据ICInsights公布的2018年纯晶圆代工行业全球市场销售额排名，中芯国际位居全球第四位，在中国大陆企业中排名第一。
也就是说，中芯国际是芯片代工厂，为芯片设计公司比如海思、联发科技等芯片设计公司制造芯片。在该领域排名第一的厂商为台积电，中芯国际与行业龙头在制程工艺上有两三代的差异。
(image_address=""https://x0.ifengimg.com/ucms/2020_29/E68955D2177137C40853F87865E894609308BB4F_w1080_h535.png"")
截至7月15日，在美国上市的台积电最新市值为3426亿美元，折合人民币超过2万亿元。若在正常的贸易环境下，中芯国际所占的市场份额对应的市值可能不会超过该公司的五分之一。但由于自主可控的需要，中芯国际的地位上升，因此可能会享受一定的溢价。
(image_address=""https://x0.ifengimg.com/ucms/2020_29/0FDDEBF539D2F76F883F1D52928018411E052627_w582_h690.png"")
图片来源：Wind
国信证券何立中、王学恒研报测算，假设只考虑14nm先进制程，中芯国际计划未来建设2座12寸的工厂，月产能3.5万片。晶圆ASP按照4000美元，净利润率参考假设能到30%（台积电2020Q1净利润率37%）。那么仅仅未来新建的2座工厂贡献净利润10亿美元=3.5*12*2*4000*30%，约70亿元人民币。A股半导体公司平均市盈率93倍计算，未来市值可到6500亿元人民币。
华创证券耿琛研报分析，一方面，中芯国际2020年一季报公司归母净资产为447.8亿人民币，同时公司宣布科创板上市，预计募集资金约456.5亿人民币，同时考虑到超额配售募集资金约69.5亿人民币，募资完成后预计公司净资产总计约为970亿人民币。目前科创板功率半导体IDM厂商华润微估值约为7倍PB，考虑到中芯国际的行业地位，给予6至7倍PB目标估值，对应市值区间为5820至6790亿人民币。
半导体产业链引发关注
作为全球领先的集成电路晶圆代工企业之一，同时也是中国大陆技术最先进、规模最大、配套服务最完善、跨国经营的专业晶圆代工企业，中芯国际A股上市之际，其产业链再度引发市场关注。
(image_address=""https://x0.ifengimg.com/ucms/2020_29/E895F7D2036200C548BDCE2AB77D764BB3106927_w1080_h687.png"")
图片来源：平安证券
平安证券胡小禹、吴文成研报认为，半导体设备市场空间大，国产替代加速。
(image_address=""https://x0.ifengimg.com/ucms/2020_29/379DB121DA45512C322FD1D5751DD02455D7A87E_w1080_h670.png"")
图片来源：平安证券
报告分析，2019年大陆半导体设备市场空间达134.5亿美元，国产化率仅约10%，国产替代空间非常大。中芯国际国产设备供应企业包括盛美股份、中微公司、北方华创、至纯科技、芯源微等企业。伴随中芯国际等晶圆企业的产能扩张，以及设备企业的不断进步，国产设备企业有望迎来业绩的快速成长期。
与此同时，政府也在大力发展集成电路产业。据了解，为推动集成电路产业加快发展，国务院发布实施了《国家集成电路产业发展推进纲要》。《纲要》明确提出，到2020年集成电路产业与国际先进水平的差距逐步缩小，全行业销售收入年均增速超过20%，企业可持续发展能力大幅增强；到2030年，集成电路产业链主要环节达到国际先进水平，一批企业进入国际第一梯队，实现跨越发展。
(image_address=""https://x0.ifengimg.com/ucms/2020_29/28FF00153264FF0CDE77AF668A5D9C18721C0117_w1080_h420.png"")
中芯国际肩负了“国产芯片”突围的重任，华创证券指出，随着政府扶持力度的加大以及产业和金融资本的加速流入，半导体全产业链有望进入新一轮黄金发展期。
（本文仅供参考，不构成投资建议，据此操作风险自担）",2020-07-16 13:56:04,凤凰财经
1,低风险地区电影院可重新开放 推动影院影视股集体拉升,"低风险地区电影院可重新开放 推动影院影视股集体拉升2020年07月16日 13:44:54
来源：凤凰网港股
凤凰网港股|据国家电影局公布，低风险地区电影院7月20日开放营业。
电影院全部采用网络实名预约，无接触方式售票；未戴口罩和体温37.3度以上者不得进入；实行交叉隔座售票，保证陌生观众间距超过1米以上；每场上座率不得超过30%；电影放映场所原则上不售卖零食和饮料，影厅内原则上禁止饮食。
此外，须合理安排场次。电影放映场所减少放映场次，日排片减至正常时期的一半，控制观影时间，每场不超过两个小时；延长场间休息时间，对影厅充分清洁与消毒；不同影厅错时排场，避免进出场观众聚集。
消息带动影院相关股份拉升，其中猫眼娱乐(01896)涨4.11%，报15.2元，早间曾跌逾4.2%。
寰宇娱乐文化(01046)则大涨13.33%，报0.34元。
IMAX中国(01970)涨2.34%，报14元。
次新股力天影业(09958)涨4.2%，报1.49元。
阿里影业(01060)涨2.56%，报1.2元。
免责声明：本文不代表凤凰网港股立场，不作为投资依据。投资有风险，入市需谨慎。",2020-07-16 13:44:54,凤凰财经
2,放宽客运经营限制，道路旅客运输和客运站新规将实施,"新规的实施，对于困境中的公交企业来说是一个福音。”山东一家公交企业负责人说。
9月1日起，我国道路旅客运输及客运站客运经营限制将放宽，允许客运班车在起讫地、中途停靠地所在城区沿途下客；允许客运站在满足基本服务功能前提下拓展旅游集散、邮政、物流等功能。
交通运输部刚刚修订完成的《道路旅客运输及客运站管理规定》，将于今年9月1日起施行。
交通运输部有关负责人介绍，道路客运是综合运输体系中运输量最大、通达度最深、服务面最广的运输方式。近年来，受私家车保有量持续高位增长、综合运输体系日趋健全特别是高铁成网运行、互联网+运输服务深度融合等因素影响，客运市场环境发生很大变化。
特别是新冠肺炎疫情对道路客运行业产生重大影响，经营者普遍出现经营困难，亟须在守住安全稳定底线的基础上，强化政策扶持，促进行业复工复产达产，更好服务“六稳”“六保”。
“新规的实施，对于困境中的公交企业来说是一个福音。”16日上午，山东一家公交企业负责人对第一财经记者说：“受疫情影响客流急剧下滑，上半年收入不足300万元，这对于年收入近6000万元的企业来说，是一个什么概念？”
新规将取消许可条件中的车辆客位数要求，由经营者根据市场需求自行决定客车车型；将“途经路线”由许可事项改为备案事项，放开日发班次上限，允许在不低于车辆类型等级前提下调配车辆，释放经营者经营自主权。
在许可方式方面，将“客运班线经营及包车客运许可原则上应当通过服务质量招投标的方式实施”调整为“客运班线经营可以通过服务质量招投标的方式实施”。
(image_address=""https://x0.ifengimg.com/ucms/2020_29/D789B35BFA517563FB98C2FB9EAB51EB99C5DC64_w640_h427.jpg"")
道路客运是综合运输体系中运输量最大、通达度最深、服务面最广的运输方式。图为四川都江堰市一处公交车总站。摄影/章轲
新规还明确，推广自贸区“证照分离”改革试点做法，明确客运站经营许可实行告知承诺制，简化相对人申请程序，缩短许可时限，降低企业制度性交易成本。对于可通过部门共享、内部核查获取的信息及企业章程等无直接关联材料，不再要求申请人提交，将客运经营许可中的站点方案和聘用驾驶员调整为承诺制，便利相对人。同时，强化对承诺事项检查和违法处置力度，确保承诺事项落实到位。
新规明确，允许客运班车在起讫地、中途停靠地所在城区沿途下客，便利旅客出行；允许客运站在满足基本服务功能前提下拓展旅游集散、邮政、物流等功能，充分利用客运站资源；调整省内包车强制分类管理制度，授权省级交通运输部门确定省内包车客运是否细分市际、县际、县内管理；允许包车客运向下兼容运营，即省际、市际、县际包车客运经营者可以分别经营省内、市内、县内包车客运业务。同时，将包车客运车辆数量要求适度上调，切实做到“放管结合”。
此外，新规还取消现行管理规定中的不满足客运许可条件的全资或控股子公司使用母公司许可资质从事经营活动、客运经营者延续经营优先许可等制度，进一步明确客运班线经营许可期限届满后，应当依法重新申请许可，营造客运市场公平竞争环境。
2016年12月，《交通运输部关于深化改革加快推进道路客运转型升级的指导意见》提出“规范发展道路客运定制服务”以来，已有20余个省份开展了定制客运试点。交通运输部有关负责人介绍，新规明确定制客运的实施主体为具有相应班线经营许可的班车客运经营者，电子商务平台为其提供相应的网络信息服务。车辆核定载客人数应当在7人及以上。
对于农村客运业务，新规明确，农村客运班线中途停靠地客运站点可以由其经营者自行决定，在乡村一端无客运站的，无需进站发班，更好满足实际运营需要。
对于新规实施后会不会引发“甩客”等问题，交通运输部上述负责人表示，交通运输部门将强化客运安全监管，切实保障运营安全。县级以上道路运输管理机构应当加强对道路客运和客运站经营活动的监督检查。客运经营者、客运站经营者存在重大运输安全隐患等情形，导致不具备安全生产条件，经停产停业整顿仍不具备安全生产条件的，由县级以上道路运输管理机构依法吊销相应许可。",2020-07-16 13:42:39,凤凰财经
3,兴业银行全国性金融数据中心机房建成投产 实现亿级交易量秒级响应,"WEMONEY研究室讯日前，兴业银行大厦（福州）机房（简称鳌峰机房）搬迁工作克服新冠疫情和天气影响，成功完成最后一批次物理搬迁。至此，兴业银行鳌峰机房搬迁工作圆满收官，新一代高标准全国性金融数据中心机房建成投产。
(image_address=""https://x0.ifengimg.com/ucms/2020_29/5F40C18264FE4129D2268E718CDF0B455D8B73BB_w1152_h452.jpg"")
（数据中心ECC）
数据中心机房是金融企业日常运营服务的“要塞”，重要性不言而喻。兴业银行鳌峰机房位于福州闽江畔的兴业银行大厦园区内，以全国性金融数据中心的标准规划设计，依照《数据中心设计规范》（GB50174-2017）A级标准建设，是该行响应国家高质量推进新型基础设施建设要求，遵循统筹规范、存算均衡、空间集聚、绿色节能理念建成的数据中心机房，也是兴业银行加快数字化转型的重要基地。
作为中国绿色金融先行者，鳌峰机房建设立足可靠性、安全性，在充分考虑机房所在地气候特征及建筑环境因素影响下，践行绿色节能理念，采用多类新型技术有效降低机房PUE指标，同时兼具易管理性、易维护性和舒适性，已通过中国质量认证中心的增强级数据中心场地基础设施认证。
新建成的兴业银行鳌峰机房拥有网络、存储、服务器集群全面升级的“云计算”服务能力，实现“亿级交易量秒级响应，全量数据实时计算”，可有力支持当前及未来兴业银行集团对数据中心实体环境的需求，保障集团各项业务持续稳健发展，为兴业银行“商行+投行”战略实施与数字化转型夯实科技基础，为更加优质便捷的客户服务提供科技保障。（WEMONEY研究室张国栋/编辑）",2020-07-16 13:33:40,凤凰财经
4,保柏环球：疫情期间七成中国企业高管经历过生理或精神健康问题 仅有8.7%寻求专业帮助,"7月15日，医疗保险提供商保柏环球（BupaGlobal）在北京发布《后疫情时代的信心和转变——中国企业高管调研报告》。该报告旨在探索中国企业高管在新冠肺炎疫情后对生活、工作和宏观经济的预测与态度。
报告显示，疫情期间七成中国企业高管经历过生理或精神健康问题，但仅8.7%的人会寻求专业帮助。经历新冠肺炎疫情后，71.5%的中国企业高管对中国医疗系统的整体看法更正面；56.9%的高管对中国经济发展表示乐观，但疫情发展的不确定性仍然是他们目前最大的担忧。
如今，随着国内疫情进入常态化阶段，企业高级管理人员的身心健康状况和情绪的调适也成为后疫情时期企业保持良好运作的重要因素。有鉴于此，保柏环球（BupaGlobal）展开了一项针对中国企业高管的调研活动，旨在为了更好地了解受新冠肺炎疫情影响，他们对自身健康的关注度，对不同医疗体系的态度，对医疗保险的期待，以及他们对世界和中国宏观经济的看法。
本次调研活动收集了中国一二线大城市各行各业1031名包括企业主、总裁、高级管理层、总监及以上级别在内的高级管理人员的反馈，其中部分受访样本来自全球最大的职场社交平台领英（LinkedIn）。
报告显示，在疫情爆发时，有七成中国高管都经历过生理或精神的问题——主要为生活乏味、持续低落、焦虑，甚至是精神疲惫、心力交瘁。但是，仅有8.7%的人会向医护人士、心理咨询师或精神科医生寻求专业帮助。
疫情进入常态化后，虽然高级管理人员对家人和自身健康安全、患上传染病等方面的担忧已经有所减少，但生活习惯已经产生了长远的改变。疫情给高管们带来的五大改变分别是：1）提高个人卫生意识和改善个人卫生习惯；2）健康饮食并更有规律地运动；3）在人多繁杂的地方会提高警觉；4）更注重保持个人心理健康；5）花更多时间陪伴家人和朋友。其中近五成高管更注重个人心理健康，反映高端人士保持心理健康意识的提升。
(image_address=""https://x0.ifengimg.com/ucms/2020_29/EEFCA2D614C16DC1096BAD804428CFE7304B515D_w1278_h684.png"")
报告中的另一主要发现是，56.9%的企业高管们对中国经济发展表示乐观。他们认为国内经济会很快复苏，与疫情前一样强势发展甚至更强，但是仍有六成以上的企业高管对疫情发展的不确定性和潜在的经济衰退表示担忧。约四成企业高管对全球经济复苏相对悲观，认为疫情会对全球经济产生持续性影响，经济会陷入衰退。
此外，经历新冠肺炎疫情后，71.5%的中国高管对中国医疗系统的整体看法更正面；53.5%对公立医疗系统的评价比以前更好。因此，保柏环球预测，高管人士对国内公立医疗系统信任度高，对贵宾体验的保险需求将继续增加，保险公司应加大公立医院特需门诊和国际医疗部方面保障。
据统计，在政府鼓励人们购买商业医疗健康保险的大环境下，大众对自费私人医保购买-意愿有增加趋势，78%表示在一年内会增购商业医疗健康保险，更有58%称在商业医疗健康保险预期会花费更高。高管对于自费医保和公司医保的需求也充分反映了后疫情时代的特点。重大疾病及住院、及对流行病的保障需求同时位居自费和公司医保需求首两位。
另外首五位中也发现，高管更关注预防性治疗保障，期望得到更高的保障总额。而对于公司医疗保险的需求中，提供线上/虚拟医生诊症服务跻身前五位，精神健康支持例如心理学家或精神科医生的诊疗保障的需求自疫情爆发以来呈明显增加态势，保柏环球预测這方面的保障将会成为公司医保的基本要求。
(image_address=""https://x0.ifengimg.com/ucms/2020_29/E6F3F781FE66CD8D9CBE1674B908D601A371153F_w1269_h662.png"")
保柏环球首席执行官SheldonKenton表示：“作为在医疗保健领域拥有超过70年环球经验的全球医疗计划系列管理方，保柏环球希望通过此次调研，深入发掘中国企业高管在疫情期间和现阶段的主要诉求，帮助合作伙伴加深了解中国企业高管们对个人心理健康情况的关注、对不同医疗系统态度的改变、对医疗保险的期望，以及对待中国和全球宏观经济的最新市场情绪，并据此为其提供更契合的解决方案，拥抱疫情后即将到来的产业全面复苏。”",2020-07-16 13:31:57,凤凰财经
