,title,content,pub_time,src
0,8月13日涨停板分析：两市约77股涨停 农业股现涨停潮,"8月13日，沪深两市弱势震荡，农业股集体大涨，工业大麻、军工、光伏等板块表现活跃。
一、今日大盘情况
截至收盘，上证指数涨0.04%，报3320.73点；深证成指跌0.13%，报13291.32点；创业板指跌0.49%，报2622.64点。两市成交额为8815亿元，缩量明显。
二、今日涨停板综述
今日沪深两市约77只非新股涨停。其中，农业股集体走强，农发种业、神农科技、金健米业、登海种业等近10股涨停。光伏概念表现活跃，亿晶光电、协鑫集成、珈伟新能等6股涨停。
三、今日涨停板具体情况
农业：农发种业、金健米业等近10股涨停
8月12日，农业农村部市场预警专家委员会发布了《2020年8月中国农产品供需形势分析》。在本月预估中，农业农村部将对2020/21中国玉米消费量的预估上调了0.9%，至2.88亿吨，同时调增了对当前和下一市场年度中国大豆进口量的预估。
光伏：亿晶光电、协鑫集成等6股涨停
中信建投研报称，展望8月，光伏行业下游需求端将持续升温，供给端由上游阶段性涨价带来的全产业链调价将继续向下游传导。硅料环节景气度将持续；硅片环节供需尚未反转，原材料涨价压力将向下游传导；电池环节尺寸与技术差异将把各厂商盈利能力的差距进一步拉大；组件环节面对前期低价订单执行压力，龙头企业的规模、品牌、渠道优势将凸显。
特斯拉：华昌达、京威股份等7股涨停
特斯拉宣布将进行1比5的股票分拆，股票分拆将于8月31日生效。这也是特斯拉上市以来的首次拆股。周二，特斯拉股价大涨逾13%。",2020-08-13 15:45:24,凤凰财经
1,一创、首创合并有多大可能？大股东均与北京国资有联系,"原标题：一创、首创两券商合并传闻又起，多大可能？大股东均与北京国资有千丝万缕联系，又刚参与一创定增
财联社（北京，记者高云，邹晨辉）讯，证券行业再传合并绯闻，这次主角是第一创业、首创证券。
据外媒报道，三位消息人士称，中国计划将国内券商第一创业与首创证券合并，首创证券因此推迟了正在进行的IPO计划。消息人士还称，两家公司的合并最早可能在今年敲定。
最先反应的是股价，第一创业盘中直线拉升，截至记者发稿，第一创业涨停，报11.20元，中国银河、中信建投、国盛金控等纷纷走高。港股中资券商板块亦出现短线直线拉升，港股国联证券一度大涨超5%。
(image_address=""https://x0.ifengimg.com/ucms/2020_33/77EB324B7106F92D5E13A754E5C4CEEC7E19D052_w1080_h1250.png"")
值得一提的是，以6元/股参与第一创业定增的机构，相较今日11.20收盘价，定增浮盈已达87%。
合并消息是否为真？第一创业回应称，关于该媒体报道事项，公司没有任何应披露而未披露的信息。
合并可能有多大？是真消息还是假消息？但两家券商股东的千丝万缕联系，显然是最大看点。
近期市场一直不缺少关于券商合并的传言，最近一波券商行情，一方面来自于混业传闻，另一方面，就是两头部券商的合并消息搅动。上一轮中信证券和中信建投证券的合并消息，同样系由外媒传出，而各种草根消息更是层出不穷。
数轮传言，伴随的是数轮澄清，以及股价的扶摇直上，而今又一波传闻由外媒而来，真真假假，跟风小心。
看点一：北京国资系持股首创证券超九成
北京国资系对两家券商均有大额持股，且首创集团为两家券商大股东。
首创证券方面，近日引入新股东，北京市基础设施投资有限公司（下称“京投公司”）受让1.25亿元股权或将成为第二大股东。
7月30日，证监会核准首创证券变更股东的批复，核准京投公司的证券公司股东资格，对京投公司依法受让首创证券1.25亿元股权无异议。这也意味着，京投公司将成为首创证券的第二大股东，仅次于首创集团（认缴金额4.1亿元）。这也是京投公司首次入股首创证券。
据天眼查信息，截至目前，首创证券的控股股东是北京首都创业集团有限公司（下称“首创集团”），认缴金额4.1亿元，持股比例为63.08%；其次是北京达美投资有限公司，认缴金额7500万元，持股比例为11.54%。
经过此次股权变更，包括大股东首创集团在内，公司全部五大股东中就有3家直属于北京国资委，合计持股比例高达91.54%。
(image_address=""https://x0.ifengimg.com/ucms/2020_33/CF784E4647AA20005E30E969554566BD6D59965B_w554_h354.png"")
看点二：3家北京国资持有第一创业22.7%
今年7月20日，第一创业42亿定增正式落地。财联社记者梳理发现，第一创业42亿定增发行对象，除了获得中信等多家券商认购外，还获得包括原第一大股东首创集团、以及两家注册地位于北京的国企的认购。
有第一创业接近董秘办的人士对财联社记者表示，这次定增中，我们更关注首创等国资机构的认购，因为首创集团一直和和公司有渊源。
根据第一创业此前公告，首创集团斥资4.2亿认购7000万股，锁定期为48个月，北京首农斥资12.61亿认购2.1亿股，北京京国瑞国企改革发展基金（有限合伙）同样斥资12.61亿认购2.1亿股，后两者的锁定期分别为6个月。
(image_address=""https://x0.ifengimg.com/ucms/2020_33/57A29273F73EAAECAFB2835E238F87198FF206B9_w394_h378.png"")
本次定增股份发行后，第一创业前十大股东名单中出现较大变化。其中，首创持有第一创业534,686,400股，占该公司总股本比例为12.72%。
北京首农持有第一创业210,119,900股，占该公司总股本比例为4.99%。北京京国瑞国企改革发基金（有限合伙）持有第一创业210,119,900股，占该公司总股本比例为4.99%。
由此计算，上述三家北京国资企业合计持有第一创业22.72%的股份。
(image_address=""https://x0.ifengimg.com/ucms/2020_33/EA7FBE03FFF30FA826AFEFB5906C8F66591BABA1_w425_h447.png"")
第一创业表示，公司股权结构较为分散，本次发行前后公司均无控股股东和实际控制人。公司在治理结构上的独立性不会因本次发行受到影响。本次发行完成前后，公司的日常经营管理均保持独立。",2020-08-13 15:28:45,凤凰财经
2,企业破产数或创10年新高，美国经济陷入深坑？,"(image_address=""https://x0.ifengimg.com/ucms/2020_33/A7BA182C6E92A818A44A71E6477BE239124F7A04_w799_h533.png"")
△（资料图）一位居民戴着口罩从纽约曼哈顿对岸的海滨走过中新社记者廖攀摄
破产浪潮正席卷美国。
标普最新发布的报告显示，截至8月9日，美国今年已有424家公司申请破产，超过了自2010年以来任何一年的同期水平。受新冠肺炎疫情冲击，今年全年申请破产的公司数量或将创10年新高。
消费类公司“伤亡惨重”
疫情对消费类公司的打击尤其严重。据标普数据，今年美国已有超过100家消费类公司申请破产，其中不乏人们耳熟能详的知名零售商，如彭尼百货（JCPenney）、尼曼马库斯（NeimanMarcus）等。
压力山大的公司不仅限于零售业。标普数据显示，因新冠肺炎疫情重创燃料需求，油价较年初大跌等因素影响，工业和能源行业有近100家公司申请破产，其中包括租车巨头赫兹、页岩油气先锋切萨皮克能源等。在今年已申请破产保护的公司中，有35家负债超过10亿美元。
另据美国耶尔普公司数据，截至7月10日，受疫情影响，全美26160家餐厅停业，其中六成永久性关张。加州餐饮业协会公共关系副总裁沙姆斯说，预计30%的加州餐馆将永久停业。此前遭遇类似危机是2008年和“911”恐怖袭击后的两三年，但这次更加糟糕。
然而这仅仅只是个开始。业内人士认为，更大规模的破产浪潮或许正在后头。
美国玩具反斗城公司前首席执行官斯托奇称，原本应该在5-10年内出现的破产量被压缩到了一到两年内集中出现，明年还会有第二波破产潮。
美国经济深受打击
高涨的破产浪潮，是美国经济深受疫情打击的缩影。
二季度，美国GDP环比收缩9.5%，年化收缩幅度达32.9%。无论从收缩的强度还是速度来说，都是难以承受之重。
与此同时，由于疫情之下非必需经济活动被叫停，美国失业率从2月份的3.5%上升至4月份的14.7%。尽管7月失业率回落至10.2%，但失业人数仍然高于2007-2009年经济衰退时的峰值。截至8月1日的一周，美国首次申请失业救济的人数已连续第二十周超过100万人。而在上世纪大萧条期间，美国的经济活动在18个月内也“仅仅”萎缩了4%，失业率也就是10%。
穆迪分析公司首席经济学家马克&middot;赞迪表示，最新数据显示美国经济在第二季度“掉入了很深的黑洞”，“要花很长时间才能爬出来”。赞迪警告说，如果政府和国会不能在8月份国会休会前批准新一轮财政援助，美国经济将面临滑入“W”型双底衰退的严重风险。
目前，美国疫情仍在加速扩散。据约翰斯&middot;霍普金斯大学最新数据，美国累计确诊病例已接近520万例，超过16万人死亡。美国流行病学专家表示，尽管美国确诊和死亡病例数量高居全球之首，但美国疫情可能还未到“最糟糕的阶段”。
疫情威胁将使美国经济复苏之路更加漫长。美联储主席鲍威尔日前在新闻发布会上表示，美国经济前景充满不确定性，经济前景很大程度上取决于能否成功控制住疫情。
美国里士满联储行长ThomasBarkin也称，疫情可能使美国经济面临的“坑洞”变成一个“大深坑”。他警告说，全国各地暴发的疫情正在阻碍美国经济复苏。
世界经济受拖累
(image_address=""https://x0.ifengimg.com/ucms/2020_33/69A9A2630EF13262BEFF517E20F062A90810F17D_w1080_h608.jpg"")
美国经济若迟迟不能走出低谷，对世界意味着什么？
“美国打喷嚏，全球就感冒。”路透社称，如果说过去是美国政策推动世界经济向高处走，现在就是美国的政策在威胁和拖累整个世界。美国GDP约占世界GDP总量的四分之一，就业岗位流失将导致消费者支出减少，进口下滑；企业经济状态不善将导致设备投资下滑或减少库存，而这些设备和库存通常是在美国以外的地方生产。因此，美国经济疲弱将对其他国家经济复苏造成影响。
在商务部研究院国际市场研究所副所长白明看来，美国经济即使复苏，对世界经济的带动作用也不会像以前那么显著。
中国社科院世界经济与政治研究所研究员高凌云对中新社国是直通车称，美国经济复苏会慢于市场预期，反弹力度也可能不如想象中那么大。在此情况下，中美贸易估计难以在短期内复苏。
据中方统计，今年前7个月中美贸易同比下降3.3%。其中，中国对美国出口1.56万亿元，同比下降4.1%。同期，中国与东盟、欧盟、日本等主要贸易伙伴进出口都已实现正增长。
分析人士认为，眼下全球经济复苏需要新动力和新市场。世界各国应尽快适应“后疫情时代”全球经济新环境，挖掘新的市场潜力和经济增长点。",2020-08-13 15:06:56,凤凰财经
