,title,content,pub_time,src
0,Q1社保基金增持近240只股票 新宝股份、人福医药大涨70%,"原标题：一季度社保基金增持近240股票新宝股份大涨70%
财联社讯，截至5月13日，共有3825家上市公司披露2020年一季报。Choice数据显示，一季度末，社保基金持仓股票超过500家。其中，主板股票占持仓总数的一半，中小板块股票以及创业板股票数量占比略高于五分之二，同时，社保基金还持有17只科创板股票。
以持仓市值为衡量标准，一季度末，社保基金重仓的前十大流通股分别为长春高新，三一重工、双汇发展、华鲁恒升、万华化学、恒生电子、中南传媒、我武生物、中炬高新、南极电商，其中，我武生物为创业板股票，南极电商为中小板股票，其余八只则为主板股票，主要分布在生物医药、食品饮料以及工程机械领域。
Choice数据显示，一季度末至今，前十大重仓流通股均呈现上涨趋势，我武生物和南极电商的股价涨幅更是高达25.93%和38.02%。
(image_address=""https://x0.ifengimg.com/ucms/2020_20/2A501F964F28C8BC5B4F46607EDDDE1DF1D30B78_w398_h473.png"")
来源：Choice数据、财联社
我武生物2020年一季报显示，营业收入1.10亿元，同比下滑20.14%；归母净利润0.41亿元，同比下滑37.45%；扣非归母净利润0.40亿元，同比下滑38.21%；净经营性现金流0.68亿元，同比增长39.98%。
光大证券发布研报称，一季度因新冠疫情，医院呼吸科停诊、客流减少等因素，导致公司核心产品粉尘螨滴剂以及点刺试剂盒销售受到影响，收入利润均下滑。随着新冠肺炎国内疫情的减轻，医院流量正在逐步恢复，预计公司产品销售将在Q2逐步恢复正常。
南极电商2020年一季度报表收入下滑18.51%至6.72亿元，净利润增长5.28%至1.28亿元，归母净利润增长5.77%至9693万元。东吴券商认为南极电商主要品牌南极人以家庭为场景，向阿里、京东、社交电商、唯品会等各电商渠道上的消费者提供高性价比、穿透消费层级和消费周期的有个性的基础款产品。在当前的经济环境下，南极电商仍是具备增长确定性的稀缺标的，维持“买入”评价。
一季度，社保基金新进了162只股票，其中，主板股票、中小板股票、创业板股票、科创板股票分别为76只、38只、36只、12只。社保基金持有的科创板股票中有三分之二是一季度新进。新进股票中，移远通信、盐津铺子、心脉医疗、龙马环卫、小熊电器、佰仁医疗、春风动力、天赐材料涨幅居前，分别为48.02%、47.65%、47.37%、44.09%、43.83%、43.74%、41.3%、40.16%。
(image_address=""https://x0.ifengimg.com/ucms/2020_20/0EDE89663D00206FC97EA94411124A2C7E102E00_w398_h393.png"")
来源：Choice数据、财联社
移远通信一季度实现收入10.3亿元，同比增长39%；归母净利润0.34亿元，同比减少22%。国盛证券发布研报称公司是目前物联网模组市场的龙头厂商，判断模组市场的份额会进一步向龙头集中，公司完整的产品线也有助于公司的收入规模持续扩张，维持“买入”评级。
盐津铺子一季度实现实现营业总收入达4.64亿元，同比增长35.43%，第一季度实现归母净利润5720.18万元，同比增长100.80%，扣非后净利润为4027.46万元，较上年同期增长131.73%。天风证券认为盐津是休闲食品领域自主制造第一股，毛利率的增长主要受益于核心品类随着收入增长带来的产能利用率的提升，尤其快速增长的烘焙品类，由于本身自动化程度更高进而带来更加显著的规模效益。
Choice数据显示，一季度社保基金减仓了107只股票。一季度至今减持股票中中小板股票奥佳华及国恩股份跌幅居前，分别为-22.53%、-13.9%，大庆华科跌幅也超过10%。
一季度社保基金增持了近240只股票。增持股票中新宝股份、人福医药涨幅超过70%，收盘价分别为32.01和23.12。
国盛证券发布深度报告称新宝股份以海外订单OEM/ODM起家成为小家电出口领域的龙头，背后是其完善高效供应链体系和产品设计能力在支撑。近年来公司内销发力，自有品牌摩飞凭借着精美的设计，抓住社交内容电商等红利，成为其最亮眼的业务。其研究团队认为为公司的估值正在发生重构，从原来的制造业估值向自主品牌的消费品转化，参考行业小家电公司的估值，国盛证券认为2020年公司的合理估值在30倍左右，并首次覆盖予以“增持”评级。",2020-05-13 18:54:09,凤凰财经
1,历史首次！铁矿石人民币结算“三连击”，全球最大买家要拿定价权,"意义重大
(image_address=""https://x0.ifengimg.com/ucms/2020_20/117B3746C22F3CE83D481CF39C8241249E43F012_w1080_h633.jpg"")
△中国宝武钢铁集团中新社记者申海摄
在大宗商品交易市场上，中国最近收获了一个好消息。
中国最大的钢铁集团中国宝武宣布，集团下属宝钢股份与澳大利亚力拓集团最近完成了首单利用区块链技术实现的人民币跨境结算，总金额为1亿多元。
记住，这是一个具有历史创举意义的交易。
因为，在今年1月和4月，宝武集团已经分别与巴西淡水河谷、澳大利亚必和必拓完成首单人民币跨境结算。
这意味着，宝武集团实现了“三连击”，与全球三大铁矿石供应商之间都已经实现了铁矿石交易的人民币跨境结算。
最大买家要拿定价权
做生意，最大买家一定是市场上的香饽饽。
在全球大宗商品贸易里，中国就是铁矿石的最大买家。
根据中国海关数据，2019年中国累计进口铁矿石10.7亿吨，创下历史第二高进口量，也占到当年全球铁矿石总产量（可供交易量）21.23亿吨的50.4%。
中国主导全球进口铁矿石需求，中国需求也是支撑铁矿石价格相对坚挺的重要力量。
中国钢铁工业协会副会长、冶金工业规划研究院党委书记李新创对中新社国是直通车指出，中国的钢铁产量占全球一半以上，不仅大而且强，那么中国自然也是铁矿石的消费大国，近几年的进口铁矿石年进口量在10亿吨以上，其中约有63%左右来自澳大利亚，23%左右来自巴西。
最大买家中国开始要拿定价权——以人民币结算。
早在2019年末，大连商品交易所理事长就透露，境外矿山、贸易商已开始利用大商所铁矿石期货价格，逐步开展铁矿石人民币业务，把铁矿石期货价格作为定价基准。
“这绝对是一件好事。”对于宝武与三大铁矿石供应商实现人民币跨境结算时，李新创如此评价。
他指出，中国进口的前三位分别是芯片、石油和铁矿石，美元之所以强势，正是因为全球大宗贸易结算基本都以美元结算，现在中国企业在铁矿石领域取得了定价权的突破，以人民币结算，企业就能更好地规避汇率风险。
中国银行研究院研究员王有鑫表示，大宗商品交易通常包含两重风险，一是商品本身的价格波动风险，二是结算货币汇率波动风险。传统的大宗商品结算货币是美元，因此，国内企业在进行大宗商品交易时通常面临商品价格和人民币兑美元汇率波动双重不确定风险。
他指出，此次宝武集团铁矿石交易以人民币计价，可以很好规避掉汇率波动风险，在企业运营过程中只需考虑铁矿石价格波动的单一风险，而无需采用外汇衍生品工具对冲汇率风险，如此，企业运营成本将大幅下降。
目前，巴西铁矿石巨头用中国基准定价、澳大利亚铁矿石供应商也用人民币计价，这代表着中国在全球铁矿石定价权的突破与进步，但也值得注意的是，该方式并未全面施行，全球四大矿山仅针对部分中国钢企采用。
人民币国际化再进步
铁矿石以人民币结算，对企业来说是利好，也能助力人民币国家化更进一步。
李新创指出，随着中国不断快速发展，“走出去”的不仅是技术、装备、人才，货币也应该走出去，人民币国际化不是空洞的国际化，能便利老百姓的旅游消费，也能在国际贸易结算这一重要领域发挥作用。
“随着人民币在更多大宗商品交易场景中运用，获得更多企业认可，对于推广人民币的国际使用，提升人民币定价权和交易便利度来说，都具有重要的意义，有利于人民币国际化向纵深发展，推动人民币从传统的支付结算货币向计价和投融资货币转化。”王有鑫如是说。
大宗商品市场与人民币挂钩，是人民币国际化的重要抓手之一。
2018年3月26日，人民币原油期货上线大连商品交易所，同年5月4日，铁矿石期货正式实施引入境外交易者业务，成为中国首次已上市期货品种的对外开放，人民币铁矿石由此走向国际化。
随后，PTA（精对苯二甲酸）、橡胶期货可以人民币计价，成为对外开放的期货品种。
王有鑫认为，未来，人民币国际化要想获得更好的发展，一方面是切实发挥市场的主导作用，继续提升市场认可度，特别是对于中国进口较多、国外对中国市场较为依赖的行业，比如大宗商品领域，可积极发挥市场需求优势，加大人民币定价谈判博弈能力。
而对于中国存在技术优势、出口产品替代性较低的行业，可凭借定价权优势积极推进人民币计价结算。
另一方面，王有鑫表示，要充分发挥政策的引导作用，不断夯实基础设施建设。国际投资者最大的困扰源自人民币使用政策的左右摇摆，未来在人民币国际化推进过程中，应继续提高政策的可预期性和确定性，更多地以市场化方式调节和疏解风险，完善市场沟通机制，避免政策逆转或后续附加条件。
“应精简人民币跨境使用相关程序，避免产品多头监管，提高跨境投融资审批流程的便利性和透明性。此外，应加强对跨境资本流动的监测和预警力度，防范跨境资本的无序流动。”王有鑫说。",2020-05-13 18:51:48,凤凰财经
2,万亿公募迎来新掌门 王小青任招商基金总经理,"原标题：万亿公募迎来新掌门！王小青任招商基金总经理，曾在监管系统任职，金旭转任专职副董事长
(image_address=""https://x0.ifengimg.com/ucms/2020_20/B03325375BC694F34717ECD5AB3646794201FD82_w600_h333.jpg"")
资产规模接近1万亿的招商基金迎来新的人事安排。
招商基金5月12日发布高管人员变更公告，金旭因担任公司副董事长而离任总经理，由具有证监会背景的王小青任总经理。公开资料显示，加入招商基金前，王小青在中国人保资产管理有限公司分管投资业务，与金旭类似，王小青也具有证监会工作背景。
金旭在其任职期间，招商基金公募业务规模五年增长超过三倍，因备受招商局集团、招行的认可，虽多次请辞，但经各方多次挽留协商后，金旭转任招商基金专职任副董事长。值得一提的是，招行董事长李建红在一次调研招商基金时曾表示，公募基金是新兴行业，班子应该充分市场化，摆脱传统的职业经理人模式，实行中长期激励机制。
招商基金再迎证监会背景掌门人
5月12日，招商基金公告，金旭因担任公司副董事长而离任总经理，由王小青任总经理，任职日期2020年5月12日。公开资料显示，加入招商基金前，王小青在中国人保资产管理有限公司（下称人保资产）分管投资业务，更早之前，1998年5月至2004年4月，王小青在中国证监会上海专员办工作。
(image_address=""https://x0.ifengimg.com/ucms/2020_20/D2201B9B040CF9C1E242B4815C8BF8D4A0F3D2A9_w611_h651.jpg"")
值得一提的是，此次接手招商基金总经理重任的王小青，因具有丰富的投资管理和风险管理的能力经验，业内预期他的加入会使招商基金管理团队进一步加强。
王小青表示，公募基金作为我国最具代表性的普惠金融工具，应承担起为投资者创造更多价值的重托。我国资管行业正处在重要转型期和战略机遇期，广阔前景下大有可为。随着资管行业进一步加大对外开放，银行理财子公司纷纷设立，以权益类资产管理为核心的投研能力是基金行业持续健康发展的关键，基金公司必须找准自身定位，建立核心优势，才能在激烈的市场竞争中脱颖而出。
在看待招商基金与股东方的关系时，王小青认为，招商基金股东方招商银行和招商证券实力强大，两者对市场化的贯彻都走在了行业的前列。股东对招商基金的发展倾注了大量心力，提供了强力支持。招商基金既要利用股东方的强大资源，更要让股东方感受到招商基金自身的专业价值，只有这样才会发挥更大的协同效应。
王小青认为，招商基金的投研业绩将强化长期维度进行考核，秉持“长期投资、价值投资、责任投资”的投资理念，为持有人创造长期稳健的投资回报，带来更好的投资体验。投研能力是基金公司的核心竞争力。未来，招商基金要继续借鉴优秀机构投资者的实践，回归组合管理的“初心”和基本原则，坚持“受人之托、代客理财”的行业本质，强化专业能力建设和内部资源整合，持续推进投研文化变革，提升研究前瞻性和深度，做“好公司”的朋友，做时间的朋友,为优秀投资经理赋能，为投资者创造更多价值。
任职期间基金规模增长高达三倍
前任总经理金旭因其专业能力和经验，在基金业内饱受赞誉。
公开信息显示，金旭拥有北京大学硕士研究生学历，1993年7月至2001年11月在中国证监会工作，全程参与基金法的起草立法，参与完成了中国第一只开放式基金的试点工作。2001年11月至2004年7月在华夏基金管理有限公司任副总经理，之后还担任宝盈基金总经理、梅隆全球投资有限公司北京代表处任首席代表等职务。
自2015年正式任职招商基金总经理，在她的带领下，招商基金公募管理规模开始迅速增长，由2015年初的1163亿元跃升至2019年底的3735亿元，任职期间公募业务规模增长高达三倍，稳居行业第一梯队。
尤其是金旭任职期间的非货币基金资产规模增速更为明显。数据显示，2014年末，招商基金管理的非货币基金资产规模排名行业第18位，仅有431亿元，但到2020年一季度末，招商基金旗下非货币基金资产规模已增至2196亿元，进入行业前10位，五年增长高达4倍。
招商基金内部人士向券商中国记者透露，去年以来，金旭因个人原因多次请辞，经各方多次挽留协商后，将在公司专职任副董事长，由王小青接任总经理。公司对于金旭女士在担任总经理职务期间为本公司发展作出的卓越贡献表示衷心感谢。
券商中国记者获悉，招商局集团、招商银行非常认可金旭任职总经理期间的能力、业绩，这或是金旭多次请辞后，最终担任招商基金专职副董事长的原因。
大股东希望招商基金班子充分市场化
据悉，招商局、招行方面认为，经历了过去十七年，招商基金一步一步地走到了历史最好的时期，招商基金充满着潜力，强调风险管控至关重要，中国经济乃至全球经济都到了高风险时代，黑天鹅事件比比皆是，能根据环境变化提前防范风险是风险管控的最高境界。唯有诚信经营、稳健发展，才能在危机时代立于不败之地。
(image_address=""https://x0.ifengimg.com/ucms/2020_20/38BB44546E47E34B123159C24EA8460EBBBEF07E_w883_h342.jpg"")
值得一提的是，李建红在一次调研招商基金时提到了人事方面的建议。他表示公募基金是新兴行业，班子应该充分市场化，摆脱传统的职业经理人模式，实行中长期激励机制。
招商基金成立于2002年12月27日，是中国第一家中外合资基金管理公司。公司目前的股权结构为：招商银行股份有限公司持有公司全部股权的55%，招商证券股份有限公司持有公司全部股权的45%。公司注册资本金为13.1亿元人民币。自成立以来，招商基金管理的公募资产规模年均增速达63%，非货币管理规模年均增速达57%，在近年来突破千亿后依然保持稳定增长势头，截止2019年末，招商基金管理资产总规模近万亿（含子公司），其中招商基金管理的资产规模超5500亿，非货币管理规模行业前10，稳居行业第一梯队。",2020-05-13 18:49:48,凤凰财经
