,title,content,pub_time,src
0,三位经济学家全面解读一季度数据：背后透露出关键信息,"原标题：许宪春、刘元春、梁红全面解读：一季度数据透露出的关键信息
新冠疫情对我国一季度经济造成了较大冲击，-6.8%的GDP增速更是创下1992年建立季度GDP核算制度以来第一次负增长。在一季度数据公布的当天，中央召开政治局会议，首提“六保”。从“六稳”到“六保”，中国应对疫情冲击的宏观经济政策有了新的方向。
一季度经济数据揭晓，疫情对国内经济造成的影响更为直观,全面评估疫情冲击并研判应对政策重点成为可能。如何最准确地研判一季度数据？当前中国仍面临海外疫情输入压力，下一步，全年经济走势如何？后三个季度的政策施力重点是什么？
4月20日，在浦山讲坛第12期上，有着30余年统计工作经验的统计“老兵”——CF40学术顾问、国家统计局原副局长许宪春对一季度经济数据进行了全面、深入的剖析。此外，CF40成员、中国人民大学副校长刘元春与CF40特邀成员、中国国际金融有限公司研究部负责人梁红也共同剖析了当前中国面临的内外压力，并就全年经济形势展开分析。
本期浦山讲坛主持人为CF40研究部主任、中国社会科学院世界经济与政治研究所研究员徐奇渊。
从生产、消费、收入端解读一季度经济数据
对于一季度经济数据，许宪春从生产、消费、收入端解读了一季度经济数据。他表示，此次疫情对经济的冲击远超1998年亚洲金融危机和2008年爆发的国际金融危机对经济的影响。
1、生产端
（1）疫情对中国经济产生重大冲击
☞三次产业增加值均下降，第二产业增加值降幅最大，对经济下降的影响最大。
&middot;第二产业中，疫情对制造业和建筑业的冲击突出。
&middot;第三产业中，疫情对批发和零售业，交通运输、仓储和邮政业，住宿和餐饮业冲击突出。住宿和餐饮业增加值下降幅度最大。
&middot;第一产业中，疫情对畜牧业冲击突出。
（2）新经济新动能保持增长，对抑制经济下降起到重要作用
（3）从3月份数据看，经济增速呈现明显回升态势
2、需求端
（1）消费需求、投资需求和净出口需求均明显下降
☞一季度，消费需求对经济增长的贡献率为-64.1%，拉动经济下降4.3个百分点。
&middot;居民消费支出明显下降；
&middot;政府消费支出略有下降。
☞一季度，投资需求对经济增长的贡献率为-21.5%，拉动经济下降1.5个百分点。
&middot;固定资产投资明显下降
☞一季度，净出口需求明显下降，拉动经济下降1个百分点。
（2）基础设施、制造业和房地产开发三大领域投资均明显下降，制造业投资降幅最大
☞制造业投资下降幅度最大，对固定资产投资下降的拉动作用最大；
☞房地产开发投资降幅最小，对固定资产投资的下降起到抑制作用。
（3）3月份数据也呈现明显恢复态势
&middot;基础设施投资迅速回升，与地方专项债的提前发行密切相关。
3、收入端
（1）全国居民人均可支配收入名义增速比2019年同期明显回落，实际增速为负
☞居民可支配收入中，转移净收入上升6.8%，增长最快（原因：政府提高转移支付）；
☞居民可支配收入中，经营净收入下降7.3%，降幅最大。
（2）规模以上工业企业利润总额显著下降
（3）全国一般公共预算收入明显下降
☞原因：税收收入明显下降。1-2月份，全国税收收入同比下降11.2%；非税收入同比增长1.7%。
4、总体特点：以往最稳定的消费部门，成为此次经济下滑的最大贡献因素。
五大关键词看懂中国经济下一步
刘元春将本次疫情冲击特点和中国应对方案总结为五个关键词——
关键词一：超级疫情
这一次新冠疫情在本质上是人类有史以来所面临的一种新现象，虽然过去也出现过很多的超级疫情、经济危机和金融危机，但是这一次是人类第一次在交往全球化、网络化、信息化、数字化时代，在经济全球化、金融全球化面对这种传播性强，致死率高的公共危机。因此，它对于整个经济系统的冲击不仅仅是拘泥于一个国家一个区域，而是一个全球性的。
它对于经济系统的冲击不仅仅是来源于供给侧的，同时来源于需求侧，更为重要的，是因为这种疫情及其传播，以及政策的这种把控具有强烈的不确定性，而这种不确定性所带来的这种超级密切的冲击是我们经济社会系统难以承受的。
所以说，这次超级疫情对于一季度对经济的冲击是史无前例的。
关键词二：中国方案
中国方案很重要的特点就是，在严格的疫情管控基础上采取相对温和的经济对冲和经济救助政策。这种政策组合是基于我们的国情出台的。可以看到，最初是1月23号武汉封城，然后是中央成立疫情领导小组，接着采取了一系列的严格管控措施。
这些措施直接导致经济社会出现停摆效应，可以看到，经济政策首先是服从于疫情阻击战。在疫情取得一定成效后，特别是在2月中下旬，国家从全面管控转移到疫情管控与经济社会相统筹的新阶段。在这一时期，我们在经济政策上采取了一系列的经济救助，同时采取了分级分批的复工复产政策，在财政、货币、就业、民生、改革等一系列领域展开相应的政策应对。
由于中央给精神、部门出政策、地方抓落实，使得很多民众感觉这些政策有一些零碎，没有一种整体性的直观感受。因此，在3月下旬和4月份，美国出台超级对冲政策以及日本等国出台各自的救助政策之后，很多人就在讨论是不是中国在经济政策上力度过小，特别是我们的政策过度偏重于经济刺激而忽略了危机救助？
事实上，如果我们现在进行全面梳理就会发现，我国的政策是分阶段、有系统的，并且力度并不小▼
财政政策：3大类，23大项，支出总额1.3万亿，落实金额5000多亿。
货币政策：金融支持30条、货币政策推进计划（渐进式宽松），共4.4万亿支持
就业政策：5大类；稳外贸外资：20大类；促消费政策……
我国为什么不像欧美这样一下子出台天量的救助政策？因为疫情冲击对于中国经济所带来的各种压力与欧美具有本质性的差别。中国社会结构和它的承受力与欧美也具有明显的差别——
&middot;单纯发放救济金，难以触及大量农民工和农民
&middot;传统税收和社保优惠，难以触及大量个体工商户
&middot;欧美第一波冲击是金融冲击，需要流动性对冲；中国则主要为实体经济冲击。
关键词三：阶段性成效
目前，疫情阻击战取得阶段性胜利，这是一个奇迹。从1月23号武汉封城，到4月8号武汉全面解封，在不到3个月时间内，能够做到新增确诊病例基本上处于零状态，可以说明中国方案的正确性。
严格管控所带来的代价就是，一季度GDP增长速度的下降——负6.8%，这个代价大不大？
目前大家预测，第一，按照美国模式英国模式，他们一季度的经济收缩幅度都超过两位数，比如目前大家所预测的美国一季度GDP可能下降15.4%，英国收缩的幅度可能达到11.4%。现在，欧美疫情发展的高点还没有完全出来，它还没有控制住，最糟糕是它的二季度，他们的方案是又要救人又要救经济，或者说是以资本为中心这样一种方案。而中国是以人命为中心，生命至上的原则。那么美国这样一种又想救人又想救经济的方案，最后可能会人也没救着，经济也搞坏了。目前普遍预测，美国二季度GDP可能会下降30%左右，这是一个很悲惨的结果。
因此，一定要从全球范围内、从一种历史视角来认识我国一季度经济增速为负6.8%。从结构角度看，我们目前复工复产进展比较顺利，三月份的很多参数反弹，不仅仅是一个技术性的反弹，而且反映了中国经济的韧性和弹性。所以，这种阶段性成效恰恰印证了“严格管控加温和的经济对冲”这种模式的适应性。
关键词四：超级压力
下一步，复产复工基本完成后，经济循环开始常态化后，我们还将面临五重下行压力的叠加。
第一重：内防反弹外防输入；
第二重：前期金融市场震荡引发的后遗症及可能持续的金融市场震荡；
第三重：疫情的全球蔓延给中国外需、供应链和产业链带来的持续冲击；
第四重：中国经济面临的传统周期性下滑因素和趋势性下滑因素；
第五重：昂贵的重启成本。
这五重压力的叠加会导致我们在二季度所面临的压力，比一季度简单的经济停摆还要大。
关键词五：政策再定位
3月17号、4月8号、4月17号，在一个月里面，政治局连续开会，对传统的以“六稳”为主体的宏观政策进行了全面定位。
这个定位，第一，就是从“六稳”到“六保”，第二个要求，研究设计一揽子宏观政策举措，也就是我们需要有超级的应对举措来应对二季度即将面临的五重下行压力的叠加。
因此，我们第一方面要聚焦民生救助，第二方面要聚焦于经济刺激，第三方面还要聚焦于化危为机的改革。下一步，我们应该高度关注经济所面临的困难，并对中国方案进一步改善。
发达国家救助计划的本质
是“财政赤字货币化”
梁红重点分析了海外疫情形势和对中国的冲击，以及中国接下来可考虑的政策选项——
&middot;各个国家的资本市场都开始出现了一些压力，因为经济停摆的时间越长，企业的现金流、居民现金流受到的压力越大，作为表征的资本市场各项压力也就越大。大家开始担心资本市场和金融受到的负面冲击，会在某种程度上反馈到实体经济上。西方国家用了一个巨大的流动性对冲的方式，来保证金融市场能够继续保持流动性，但实际上，这么大的力度或许能保住的也就仅仅一个季度左右。
&middot;欧美版的救助计划，基本上都是财政赤字货币化。这一选项背后的逻辑是什么？从经济学的角度来讲，如果把这次疫情看成一个较长时间的天灾，有储蓄的国家可以动用储蓄，没有储蓄的国家只有向未来借债。当一些国家没有办法借外债的时候，靠自己国家的信用用货币也是一种举债的方式，美国就是一个典型。美国居民端是没有储蓄的，财富主要集中在一些大企业和少部分富裕人群手中。现在很多人把这次疫情冲击比喻成上世纪30年代、40年代的状况。二战时期，曾经有4、5年的时间，美国的赤字率高达20%左右，美国国债占GDP的比例高峰就是在二战时期达到的。当然，只要国内外对这个国家的信用还有信心，它是可以坚持这么一段操作的。
但是这一次的问题是，当前美国国债已经处在相当高的位置了，几乎和它历史上高峰相持平。欧洲、英国、日本现在基本上都是这样的图景，发达国家的选项最后基本都会是财政赤字货币化。这对中国的政策应对，包括一些海外资产的安排，都提出了较大的挑战。
分析中，梁红提出了两点中国需要关注的问题：1、中国面临的外需冲击，可能会在5-7月份才真正显现在数据上；2、未来需要关注美元荒过后的人民币升值压力。",2020-04-21 21:58:43,凤凰财经
1,疫情期间首个“倒下”的国家，阿根廷濒临第九次债务违约,"IMF日前发布的新一期《世界经济展望报告》预测，2020年阿根廷经济将萎缩5.7%。专家认为，在采取牺牲经济发展的“休克式”抗击新冠疫情政策下，阿根廷就业、出口、债务等一系列问题已经逐渐凸显，经济发展前景堪忧。
新冠肺炎疫情对全球经济造成极大影响，一些原本经济就存在问题的国家在这次“战疫”过程中已经不堪重负。
阿根廷即将迎来第九次主权债务违约。4月22日，阿根廷本应支付5亿美元债务，但因疫情对经济和社会造成的双重冲击，阿根廷决定延期偿还公共债务，并提出全面债务重组。不过分析人士警告说，日益失望的投资者很可能会驳回该国政府提出的债务重组方案。
(image_address=""https://x0.ifengimg.com/ucms/2020_17/52A64C9CBF7F85D7157D951263A84D2D04672E9F_w1080_h734.jpg"")
根据美国约翰斯&middot;霍普金斯大学的数据，截至北京时间4月21日19点，阿根廷新冠肺炎累计确诊病例3031例。分析人士警告说，阿根廷即将迎来第九次主权债务违约，该国或将成为首个受疫情冲击而倒下的国家。
1
债务违约进入倒计时
据新华社报道，阿根廷政府4月6日宣布，由于新冠疫情对经济社会造成冲击，决定将推迟偿还总额约100亿美元的公共债务，推迟日期至2021年。
该国原本应于本月22日支付5亿美元债务，一旦错过，将在30天宽限期后进入违约状态。
阿根廷政府发布的一份公报表示，新冠疫情在全球范围内蔓延，造成经济和社会形势恶化，阿根廷政府偿还到期美元债务变得更加困难。因此，阿根廷政府决定，基于阿根廷法律发行的美元债务本金和利息将推迟至2021年偿还。
据悉，阿根廷计划大幅削减利息支付，相当于节省约379亿美元，即目前总额的62%。平均新利率将为2.33%。阿根廷经济部长古斯曼（MartinGuzman）19日在采访中表示：“这是阿根廷能够承受的报价。如果接受的话，问题就能解决。如果不接受，阿根廷处在‘事实违约’状态，目前无力偿还债务，所以才会提出全面的债务重组。”
然而据路透社20日报道，阿根廷债权人委员会(ACC)已拒绝该国债务重组提案，呼吁政府与债券持有人谈判达成协议。
ACC由阿根廷国际债券的持有人组成，ACC表示，自己代表了各种各样的国际投资者，无法支持该提议，要想实现可持续的债务解决方案，就需要进行真诚的谈判。
阿根廷国家统计与普查局公布的数据显示，截至2019年底阿根廷外债达2776.48亿美元。根据阿根廷政府的债务重组提案，阿根廷在海外的债务共计662.38亿美元。
(image_address=""https://x0.ifengimg.com/ucms/2020_17/AEF45FFE448096F57DECDE3A2703CA7DCFBEDC35_w512_h339.png"")
2018年，IMF与阿根廷政府签署了总额570亿美元的救助协议，在当时创下了IMF的救助纪录。今年2月，IMF认定阿根廷的公共债务“不可持续”，需要通过债务重组，保持其公共债务可持续性。
古斯曼认为，受疫情影响，对于资源有限的国家来说，偿还债权人的债务毫无意义。疫情结束后恢复起来就会更加困难。不过其实在新冠疫情发生之前，阿根廷就已经无力偿还债务。
国际评级机构穆迪认为，阿根廷政府即将进行的大规模债务重组或导致投资者在主权债务上遭受重大损失。所以阿根廷债务重组计划是否能够顺利进行，还是一个未知数。
2
经济几乎停滞
阿根廷自今年3月中旬宣布进入国家公共卫生紧急状态及强制社会隔离措施以来，近一个月的“全民隔离”令被再次延长至4月26日，这让阿根廷的经济几近停滞。
疫情使阿根廷中小企业和中低收入人群的生存环境更加艰难。除超市及药店外，其他商铺全部关门。几乎所有企业都居家办公。此外，阿根廷全面关闭海陆空边境，甚至在海外的阿根廷公民都无法入境。
据新华社报道，阿根廷非正式就业占比达35%，疫情期间这类人群收入大幅削减。民众对失业的恐惧导致储蓄行为优先于消费行为，进一步抑制经济发展活力。
社会停摆使阿根廷出口遭遇严重损失。以占据阿根廷外贸半壁江山的农产品出口为例，物流延迟和人手紧缺使出口大幅下滑。3月，阿根廷农产品出口净收入为10.64亿美元，同比下滑6.9%。数据显示，仅大豆出口一项，疫情将给阿根廷全年造成超过30亿美元的损失。
目前政府向60万户约300万民众发放了紧急救助。据央视新闻报道，阿根廷疫情最严重的首都布宜诺斯艾利斯的市长拉雷塔4月20日宣布，以他为首的市政府主要官员将主动减薪25%，并将把这笔减薪款项用于疫情防控工作和社会救助。此外，科尔多瓦省省长希亚雷蒂也宣布，将贡献自己薪酬的45%支持抗疫。
为减少疫情对民生产生的冲击，阿根廷政府于上周已允许银行、文化用品经营企业和部分农业生产企业复产复工。同时，允许因强制隔离措施被滞留国内其他地区、无法返回住家所在的人员，办理回乡证，但在陆路返程途中必须接受检疫排查。从20日起，可提供非直接接触服务的商家、部分外贸经营和工业加工企业等11个行业也正式恢复经营生产活动。
IMF日前发布的新一期《世界经济展望报告》预测，2020年阿根廷经济将萎缩5.7%。专家认为，在采取牺牲经济发展的“休克式”抗击新冠疫情政策下，阿根廷就业、出口、债务等一系列问题已经逐渐凸显，经济发展前景堪忧。
3
新兴市场危机四伏
阿根廷状况其实也是新兴市场面临压力的一个缩影。
国际金融协会报告预计，今年全球经济将萎缩1.5%，其中发达经济体将萎缩3.3%，新兴经济体将仅增长1.1%，阿根廷、巴西、墨西哥、俄罗斯、南非等新兴经济体则可能陷入经济衰退。根据亚洲开发银行估计，新兴经济体必须通过善用国际援助，尽力避免疫情扩散，加强区内贸易，稳定内需等措施来加以应对。
兴业证券指出，新兴市场的债务状况存忧，疫情或引发新兴市场债务危机。新兴市场依赖于国际贸易，此次疫情导致全球需求大幅下滑，导致新兴市场的经常账户恶化，进而国民流量性收入减少，从而会直接使得债务问题开始突出。
兴业证券预判，相比于2008年，当前新兴市场应对危机的能力更脆弱，若对外偿债能力承压，可能导致主权债务违约。除阿根廷外，南非由于外汇储备不足已经出现了主权债务违约风险。展望未来半年到1年，新兴市场衰退风险和违约风险将加剧，从而引发金融市场进一步动荡。
记者李曦子",2020-04-21 21:55:13,凤凰财经
