,title,content,pub_time,src
0,黑色星期一！美股又大跌，美国疫情严峻，特朗普又发话了…,"来源：证券时报中国基金报记者李迪
美股没能逃脱“黑色星期一”的诅咒，三大股指昨夜均跌超1%，大型科技股也全线下挫。
美国抗疫形势依然严峻，特朗普却被爆出依然在炮轰福奇，他称这位传染病专家是“灾难”，并说他每次上电视时都会有“炸弹”。
刺激计划前景不明，“黑色星期一”诅咒再现
道指跌超400点，纳指已“五连跌”
本周一是“黑色星期一”的33周年纪念日。1987年10月19日周一，道指曾狂泄22.6%，创美股历史上最大的单日百分比跌幅。
在刺激计划前景依然不明的影响下，美股虽然高开，但依然没有摆脱“黑色星期一”的诅咒，三大股指高开低走，跌幅均超1%。
道指跌超400点，日振幅高达573点。
(image_address=""https://x0.ifengimg.com/ucms/2020_43/292ACEF5D4AB1536BB75E079E101160F6F837674_w828_h884.jpg"")
纳指盘中一度下跌1.85%，收跌1.65%，已经五个交易日连续下跌。
(image_address=""https://x0.ifengimg.com/ucms/2020_43/42FB7830F851B0017908EEABAF26F0451BFACBA8_w828_h950.jpg"")
标普500指数盘中也一度下挫1.83%，收跌1.63%。
(image_address=""https://x0.ifengimg.com/ucms/2020_43/8B54AAE82801999C50B49DA6C398FC49572A5222_w828_h887.jpg"")
美股盘后，美国国会众议院议长助理称，佩洛西与姆努钦在关于刺激计划的通话中缩小了分歧，10月19日的通话时长53分钟。此外，美国众议院议长佩洛西与美国财长努钦将在明天继续通话。佩洛西仍然希望，在周二结束前能“明确”大选前的刺激法案是否可能达成。
但不久后，美国参议院少数党（民主党）领袖舒默表示，参议院多数党（共和党）领袖麦康奈尔设计的援助计划失败了，共和党的刺激计划提议仍然不可接受。
富国银行全球市场策略分析师ScottWren称，市场依旧会对与刺激政策有关的消息高度敏感。市场走出三月低谷的主要原因是疫苗等利好经济周期的项目、美联储维持宽松和财政刺激政策，所有这些因素都非常重要，但事实是其中至少有一项正在拖后腿。
全球确诊已超4000万，美国确诊病例数最多
特朗普却炮轰福奇
除刺激计划外，疫情的严峻形式也使得美股走势承压。
周一，全球新冠肺炎疫情累计确诊病例突破4000万例，美国确诊病例数也依然在激增。
据法新社19日报道，全球确诊病例中超过一半来自三大重灾区——美国、印度和巴西，确诊人数分别超过816万、755万和523万。
据央视新闻，当地时间10月18日，前美国食品和药物管理局局长斯科特&middot;戈特利布在接受当地媒体采访时表示，美国即将迎来新冠疫情的“最大浪潮”，因为在没有疫苗的情况下，病例激增会使美国新冠疫情的形式必将更加严峻。
CNN近日也报道，美国平均每天新增5.5万名确诊病例。相较于9月中旬的下降趋势，增幅超过60%。在过去一周，只有两个州的新增确诊病例有所减少，其他48个州都在上升，而在康涅狄格州和佛州的增幅高达50%。
美国抗疫形式依然严峻，特朗普却被爆出依然在炮轰福奇。
据NBC，美国总统唐纳德&middot;特朗普（DonaldTrump）周一在与竞选人员的电话通话中攻击了安东尼&middot;福奇博士，称这位传染病专家是“灾难”，并说他每次上电视时都会有“炸弹”，但“如果你解雇他，会有更大的炸弹。
特朗普称，“如果我听他的话，我们会有50万人死亡，”特朗普接着说，几秒钟后又补充说，“如果我们听他的话，我们现在就会有700-80万人死亡。”
特朗普指出，福西早前就戴口罩和关闭来自中国的旅行发表的言论是所谓不好建议的例子。”
科技股普跌
苹果跌2.55%
科技龙头周一也集体调整，苹果跌2.55%、特斯拉跌2.01%、亚马逊跌2%、谷歌跌2.44%、Facebook跌1.70%、微软跌2.48%、高通跌0.47%、AMD跌1.41%、奈飞跌0.01%。
(image_address=""https://x0.ifengimg.com/ucms/2020_43/27BDAD0FD189C412F4030939E5F316C1709A1175_w828_h1111.jpg"")
或百亿美金出售NAND内存部门
英特尔盘中直线拉升近3%
据外媒周一报道，英特尔正在与海力士商讨出售NAND内存部门的交易，协议总值在100亿美元左右。
该消息一出，英特尔直线拉升，盘中一度涨近3%，收涨0.78%。
(image_address=""https://x0.ifengimg.com/ucms/2020_43/784D389ED23AEBFD66F44F3F8E4C5EE59599078D_w828_h1126.jpg"")
据Statista数据，截至第二季度，英特尔与美光科技并列全球NAND市场第五位，市场份额为11.5%。SK海力士以11.7%的市场份额略微领先，仅次于西部数据（WesternDigital）的约16%。三星以31.4%的市场份额位列首位。
据悉，由于近期的价格压力，英特尔希望退出闪存业务。
一药企盘后飙涨100%
美股盘后，生物制药公司Aptinyx（APTX）一度飙涨100%。
(image_address=""https://x0.ifengimg.com/ucms/2020_43/F06DFDABB76DF326450A6ECBA9501A97B94F25C1_w828_h986.jpg"")
消息面上，该公司用于治疗创伤后应激障碍(PTSD)的药物NYX-783的二期试验显示出积极、有统计学意义的顶线数据。
公开信息显示，AptinyxInc.于2015年6月24日在特拉华州注册成立。该公司是一家临床阶段的生物制药公司，专注于治疗大脑和神经系统疾病的新型专有合成小分子的发现，开发和商业化。该公司致力于靶向和调节N-甲基-D-天冬氨酸受体或NMDArs，NMDArs对大脑和神经系统的正常和有效功能至关重要。
摩根士丹利：美股还要跌10%
又一家大行发表对美股未来走势的悲观言论。摩根士丹利表示，9月份开始的美股市场调整尚未结束。
摩根士丹利认为，美股在上周未能实现突破，表明9月份开始的回调至少可能持续到下个月的总统大选。该投行称，牛市恢复之前市场还需要再经历10%的修正。美国大选的不确定性依旧笼罩市场。
高盛资深策略师AbbyJosephCohen此前亦表示，经济和政治的不可预测性让策略师都目瞪口呆，美股可能在美国大选前大跌。
部分综合Wind资讯、央视新闻、环球网",2020-10-20 07:51:28,凤凰财经
1,美股全线重挫，发生了什么？华尔街正经历关键24小时！疫情加速扩散,"(image_address=""https://x0.ifengimg.com/ucms/2020_43/898A97238F31B77675503C3B304BD067EEC69CAA_w600_h333.png"")
在中国可能没有感觉，但国外似乎又陷入到新冠疫情的泥潭之中！
周一美国大型科技股全线走低，苹果跌2.55%，亚马逊跌2%，谷歌跌2.41%，Facebook跌1.7%，微软跌2.48%。
美东时间周一，美股高开低走，三大指数集体收跌，跌幅均超1%。截至收盘，道指跌1.44%，纳指跌1.65%，标普500指数跌1.63%。
(image_address=""https://x0.ifengimg.com/ucms/2020_43/A69E4944F9C38296A7E72B96386938DD129D8F1F_w1080_h803.jpg"")
佩洛西在上周日（10月18日）表示，国会和特朗普政府在达成广泛的疫情救助方案上仍存在分歧。尽管她乐见立法可能会在大选日之前获得通过，但她也承认，若要达成协议必须在未来48小时内完成。一些人士谈到，如果周二协商没有达成一致的话，在未来两周内产生价值数万亿美元的全面救助计划的可能性将越来越小。可以说，华尔街正迎来关键的24小时！
据美国约翰斯&middot;霍普金斯大学19日发布的新冠疫情最新统计数据显示，截至美国东部时间19日4时24分，全球累计新冠确诊病例突破4000万例。而最近新增的1000万例确诊仅耗时32天。从耗时来看，新冠病毒传播似乎越来越快。
值得注意的是，新冠确诊病例几乎在全美所有州攀升，美国可能迎来第三个疫情高峰，全美各地的重症监护病房都人满为患。欧洲某些地区重症监护病床的数量持续减少并接近承载极限。
在这种情况下，一是需要疫苗，二是需要特效药，三是经济仍需要求助。据世界卫生组织，目前对于重症的有效药仍只有地塞米松。疫苗却是雷声大雨点小。专家表示，可能要等到明年初才会有疫苗上市。
4000万！美国第三波？
据界面，美国约翰斯&middot;霍普金斯大学19日发布的新冠疫情最新统计数据显示，截至美国东部时间19日4时24分（北京时间19日16时24分），全球累计新冠确诊病例突破4000万例，达40050902例，累计死亡病例1113750例。
美国是确诊病例和死亡病例最多的国家，累计确诊病例8154936例，累计死亡病例219674例。统计数据中累计确诊病例较多的国家还有印度、巴西、俄罗斯、阿根廷等，累计死亡病例较多的国家还有巴西、印度、墨西哥、英国等。
全球新冠确诊病例数仍在快速攀升。约翰斯&middot;霍普金斯大学统计数据显示，全球累计确诊病例6月28日超过1000万例，8月10日超过2000万例，9月17日超过3000万例，从1000万例升至2000万例耗时43天，从2000万例升至3000万例耗时38天，从3000万例升至4000万例仅耗时32天。
据NBC电视台19日报道，新冠确诊病例几乎在全美所有州攀升，美国可能迎来第三个疫情高峰。根据NBC统计，过去14天里，全美38个州、首都华盛顿哥伦比亚特区和关岛的新增新冠确诊病例都出现增长，9个州新增病例持平。其中，佛蒙特州和新墨西哥州的病例数激增。不过，得克萨斯州的新增病例数稍有下降。NBC还统计称，北达科他州和南达科他州的每周人均感染病例数居全美之首，且全美各地的重症监护病房都人满为患。
更令人担忧的是，目前因新冠病毒而死亡的人数，并未显示出新冠病毒对全世界死亡率的真正影响。英国《金融时报》收集并分析了全球范围内的超额死亡率数据（即超过历史平均水平的死亡人数），发现某些国家在疫情期间的死亡人数比平时高出50%以上。很多国家的超额死亡人数大大超过官方公布的新冠病毒死亡病例。自三月初以来，厄瓜多尔瓜亚斯省的死亡人数比正常时期多了一万人，相当于增加了300%以上。伦敦的整体死亡人数已超过平时的两倍，而纽约市在三月中以来，其总和死亡人数更是平常的四倍以上。
封锁！欧洲第二波？
欧洲政府争先恐后地通过重新引入一系列对公共生活和酒店业的限制性措施以遏制案件激增，包括关闭或有限开放酒馆，酒吧和餐馆，限制社交聚会，甚至诉诸宵禁，现在包括巴黎在内的少数法国主要城市中都可以看到这些措施。
德国、法国、英国、意大利、西班牙和荷兰都在过去一周宣布新措施，以遏制第二波新型冠状病毒肺炎（COVID-19，即2019冠状病毒病）感染，预计未来几天还会有更多措施出台。周日，比利时宣布关闭所有酒吧和咖啡馆四周，而瑞士扩大了戴口罩的要求。
英国威尔士首席部长表示，如果现在不采取行动，新冠疫情爆发将加速。将实行为期2周的“限时防火”封锁，封锁措施将于周五开始。所有非必需品商店都将关闭。封锁措施将于11月9日结束。
世卫组织周五警告说，欧洲的冠状病毒爆发正在“引起人们的关注”，因为在某些地区，重症监护病床的数量持续减少并接近承载极限。
波兰卫生部长表示，计划让私立医院做好治疗新冠病毒感染患者的准备。预计下周每天至多将新增2万例新冠肺炎确诊病例。
根据人口调整，欧洲新的冠状病毒感染数量现已超过美国，欧洲报告的每7天内平均每百万人有187例新增Covid-19病例，而美国只有162例。
疫苗？可能要到明年
全球都将希望寄托在疫苗身上。然而，从最新的消息来看，疫苗仍是雷声大、雨点小。
前美国食品药品管理局（FDA）专员斯科特&middot;戈特利布（ScottGottlieb）对CBS新闻频道说，特朗普政府的战略是“忍受”Covid-19的传播，直到推出疫苗为止。戈特利布（Gottlieb）对美国45个州较高的Covid-19传染率表示担忧，并表示可能要等到明年2月或明年3月，第一批人才能接种疫苗并保持免受冠状病毒病的保护。
纽约州州长安德鲁&middot;库莫（AndrewCuomo）周日表示，疫苗推出后，高危人群和医护人员将被优先接种。据彭博社报道，库莫表示，他将写信给白宫，寻求有关如何在可用时分发冠状病毒疫苗的具体建议。
与此同时，JohnsonandJohnson和AstraZenecaPlc疫苗试验的暂停导致研究人员质疑腺病毒载体的作用。由于它们具有一个共同的关键特征，因此它们的疫苗试验已经停滞了，它们都基于腺病毒。
疫苗特别工作组主席凯特&middot;宾厄姆（KateBingham）说，在圣诞节前可能会出现疫苗的“可能性很小”。但是她希望它能在“明年年初”之前出现。药品和保健产品监管局必须首先批准任何疫苗，然后才需要生产和分发。制药公司已经在试验中制造了数百万剂药物，但分配可能更加复杂。
经济？前景更加难测
国际货币基金组织（InternationalMonetaryFund）于10月初预测，到2020年全球经济将收缩4.4%，较6月份的-5.2%向上修正。该公司表示，此次修订的部分原因是发达经济体和中国在今年第二季度的增长好于预期。
然而，从疫情再度来袭的这个趋势来看，最终经济是否会符合预期，目前很难预料。欧洲央行管委埃尔南德斯德科斯表示，新的新冠疫情爆发将增加银行损失。
欧洲央行执委默施表示，复苏仍然不完整且容易遭受影响；欧洲央行将非常谨慎地评估未来的信息，包括汇率的发展；欧洲央行将继续准备好调整其所有工具；紧急抗疫购债计划（PEPP）现在变得更加重要。
美国白宫幕僚长梅多斯表示，刺激计划谈判取得了良好进展。有望在48小时内达成新冠疫情援助协议。昨天与总统特朗普就刺激计划进行了对话。
美联储前主席耶伦向民主党总统候选人拜登和副总统候选人哈里斯介绍了金融领域的问题时表示，需要控制疫情，以使经济恢复正常。失业人员的储蓄正在用尽。各州和地方政府面临巨大的预算缺口。预计美联储将提供更多关于资产购买的指引。财政政策需要在未来发挥积极作用。",2020-10-20 07:51:17,凤凰财经
