,title,content,pub_time,src
4,血“幸”之夜：瑞幸自曝财务造假 或面临近800亿索赔,"瑞幸咖啡迎来公司历史上最黑暗的一天。
(image_address=""https://x0.ifengimg.com/ucms/2020_14/BBCE75A6B0AD4CD8D8826AEA6F66C527FC24E3F5_w830_h457.png"")
美东时间4月2日，瑞幸咖啡开盘暴跌81.6%，盘中数度“熔断”暂停交易。截至证券时报&middot;e公司记者发稿，该股已从昨日收盘价26.2美元跌至仅约7美元。受此事件影响，美股上百只中概股飘绿。
4月2日晚间，瑞幸咖啡公告承认，2019年第二季度到第四季度期间存在伪造交易行为，涉及销售额大约22亿元。
从全球最快IPO公司，到被爆财务造假、股价暴跌，瑞幸还能幸运多久？
(image_address=""https://x0.ifengimg.com/ucms/2020_14/25690038FC2919200B42B29D2CAAF9CB63980CAC_w794_h419.png"")
瑞幸称COO伪造22亿元销售
4月2日，瑞幸咖啡宣布，公司董事会已成立特别委员会，负责对2019年财年财报审计期间的问题展开调查。
根据最新公告，特别委员会由董事会的三名独立董事SeanShao,TianruoPu，WaiYuenChong组成，SeanShao担任主席。特别委员会已聘用与该调查相关的独立顾问团队，包括独立法律顾问和法务会计师。特别委员会已聘用Kirkland&Ellis律师事务所担任独立外部法律顾问。Kirkland&Ellis由FTIConsulting作为独立法务会计专业顾问提供协助。该内部调查尚处于初步阶段。
特别委员会今日向董事会提供信息表明：
自2019年二季度起，公司的COO、董事刘剑，以及下属几名向其汇报的员工，参与进行了某些违规行为，包括伪造某些虚假交易。特别委员会建议采取纠正措施，包括对刘剑和部分相关员工停职，以及终止与虚假交易相关的合同和往来。董事会接受建议并已经落实了特别委员会提出的针对目前所发现的所涉虚假交易的相关当事人和当事方的措施。公司未来将根据调查结果对相关当事人员采取相应措施，包括追究法律责任。
此次涉事的瑞幸首席运营官（COO）刘剑为何人？刘剑此前也是神州租车团队的成员。
资料显示，刘剑于2005年获得中央财经大学劳动与社会保障专业学士学位。2008年至2015年，先后担任神州租车车辆管理中心副主任和收益管理负责人；2015年至2018年担任神州优车收益管理负责人；2018年5月起担任瑞幸咖啡COO，2019年2月起任董事。
根据公告，该内部调查的初步调查发现，和这些虚增交易相关的2019年第二季度到第四季度的总销售额约为22亿人民币，与这些虚增交易相关的成本和费用也被大量虚增。以上数字尚未被特别委员会、外部顾问或公司独立审计师独立核实。公司仍在评估这些违规行为对公司财务报表的整体影响。所以，投资者不应该依赖于公司此前公布的截止到2019年9月30日的前九个月、2019年第二季度、第三季度的财务报表和业绩公告，包括公司此前发布的对2019年第四季度产品净收入的指引，以及公司发布的其他和公司财报相关的沟通文件。该调查尚在进行之中，公司将继续评估此前发布的财务数据和潜在的调整。
瑞幸将根据内部调查的进展及时提供进一步信息，并坚决采取有效措施提升公司的内控水平。
专家：上市前可能就已经存在造假行为
“我认为瑞幸咖啡有可能在上市前就已经存在造假行为。随着调查的进一步深入，瑞幸未来在美国面临的法律赔偿责任将会非常巨大，甚至可能导致公司在美国退市。”4月2日晚，上海交通大学上海高级金融学院教授陈欣接受证券时报&middot;e公司记者采访时表示，餐饮行业本身就非常难核实现金流，这也是为什么在A股少有餐饮行业上市的原因。
陈欣同时表示，2011年左右中概股曾爆发了一次信任危机，导致赴美上市公司数量大幅度减少，而这一次瑞幸咖啡造假也可能会造成类似的影响，同时此次事件对中概股估值也会产生较大打击。
据了解，2011年可谓中国概念股从天堂到地狱的一年。经历过2010年的上市潮，2011年，中概股先是在前6个月中频频出现会计问题，被指“财务造假”爆发诚信危机而被华尔街抛弃，后又出现上市受阻或勉强上市即破发的各种困局。下半年，更是大批中概股遭到做空机构公开质疑，股价狂跌不止，更有多家中概股停牌或面临退市危机。
统计显示，2011年前11个月，累计从美国主板市场退市的中国概念股有28家，这意味着，十家中概股公司中，就有一家离开。截至2011年11月30日，不同程度地遭到做空机构公开质疑的中概股达67家。截至12月6日，美国股市的中概股总共有92家公司股价低于2美元，其中，低于1美元的概念股有43家，面临被退市可能。
瑞幸咖啡将面临近800亿元索赔
“中概股造假很普遍，只要被发现，就会遭遇集体诉讼，且索赔额非常大，惠及所有受害人，严重者会造成公司破产。”4月2日晚，上海汉联律师所合伙人宋一欣接受证券时报&middot;e公司记者采访时表示，在美国，发起集团诉讼过程是，发现造假后，律师开始征集，然后起诉，让法院选择第一原告，这一原告代表所有受害者（除非自己表示不参加），受害者只需合乎法院设定条件及时段即可。
至于具体索赔额，宋一欣表示，美国法律对类似案件的索赔额一般这样计算，即设定一个时段，当中的最高价，以及事发后最低价，得出价差，再乘以股份数量，即是这家公司可能面临的投资者索赔额。
若以2020年以来至今作为时间段计算，期间LK瑞幸咖啡2020年1月7日曾触及年内最高价51.38美元/股，事发后最低价为2020年4月2日晚触及的4.9美元/股，而公司最新总股本为2.4亿，由此可粗略计算出一旦面临集体诉讼，LK瑞幸咖啡将面临总计约112亿美元（折合人民币754亿元，（最高价-最低价）*总股本）。
值得一提的是，截至北京时间4月2日晚10：30分，LK瑞幸咖啡的总市值仅为16亿美元左右。
宋一欣还表示，美国证监会对上市公司发行、财务造假行为也会有处罚，而相关中介机构也将承担连带责任，比如上市保荐机构、律所等。
这些资本“踩雷”
机构投资者仍在增持瑞幸咖啡。
数据显示，2019年第四季度，机构增持达到2.89亿股，同比增长26.81%。新进机构持有股份1.45亿股，同比增长879.62%。
截止2019年末，瑞幸咖啡的持仓机构中，最大机构股东为“CAPITALRESEARCHGLOBALINVESTORS”，持有6032万股，其次是孤松资本、Alkeon资本公司、美国银行、Melvin资本管理公司、瑞银、Darsana资本、瑞信、JanusHenderson和Sylebra资本。
(image_address=""https://x0.ifengimg.com/ucms/2020_14/D86788A324A81E4E1D84CEDF747D719F7BE49C73_w1070_h329.png"")
瑞幸咖啡创办于2017年6月，据记者不完全统计，自成立以来，瑞幸咖啡已经历了至少10轮以上融资，合计融资近10亿美元。
瑞幸咖啡由陆正耀主导的神州系一手操盘建立，公司前期融资主要来自陆正耀旗下公司。
2018年6月，瑞幸咖啡正式引入风投机构。A轮融资2亿美元，引入大钲资本、愉悦资本、新加坡政府投资公司（GIC）、君联资本，公司估值达到10亿美元。
2018年11月，瑞幸咖啡启动2亿美元B轮融资，A轮资方除君联资本之外全部跟投，同时引入中金公司。
2019年4月，贝莱德所管理的私募基金在IPO前突击入股，瑞幸咖啡再融资1.5亿美元，投后估值达29亿美元。
2019年4月22日，瑞幸咖啡向美国证券交易委员会（SEC）正式递交了招股书F-1文件，计划登陆纳斯达克。股票代码“LK”，拟最高募资1亿美元。承销商为瑞士信贷、摩根士丹利、中金公司和海通国际。
此外，金杜律师事务所在瑞幸IPO项目中担任公司的中国律师，全面参与了中国法律尽职调查、招股书审阅和修改、美国证监会反馈意见答复、法律意见书出具等各项重要法律事务。
全球最快IPO公司
回顾瑞幸的发展史，从创立到IPO，瑞幸咖啡只花了17个月时间，一举成为全球最快IP0公司。
上市之初，因为对标“星巴克”，华尔街投资者对瑞幸咖啡青睐有加。摩根士丹利就曾称瑞幸的股票“质量好、价格实惠”。
但自瑞幸咖啡上市以来，瑞幸咖啡一直处于烧钱扩张状态中。2018年全年该公司净亏损16.19亿元，2019年前三季度净亏仍达到约17.65亿元。
2018年，瑞幸咖啡的销售及市场费用达到7.45亿元，占到了总支出的30%以上。其中，广告费用占3.6亿元，为消费者提供的赠品价值达1.3亿，配送费用2.4亿元。
与此同时，瑞幸咖啡线下门店数量急剧增长。至2019年一季度末，瑞幸咖啡在全国28个城市开设了2370家直营门店。而在一年前，线下门店数量仅为290家，一年内，瑞幸咖啡线下门店增长率超过700%。今年1月8日，瑞幸咖啡对外宣布其直营门店数已达4507家，成为我国最大的咖啡连锁品牌，累计交易客户数已超过4000万。
围绕公司的商业模式一度引发广泛争论。网络上，有网友笑称瑞幸咖啡为“瑞&middot;民族之光&middot;幸咖啡”，“收割‘资本主义韭菜’，为国人提供廉价补贴咖啡。”。
曾遭浑水做空
瑞幸咖啡亦遭到专业研究机构的质疑。
此前1月31日，浑水称收到了一份关于瑞幸咖啡的匿名报告，该报告长达89页，指出瑞幸捏造公司财务和运营数据，并质疑瑞幸商业模式。浑水认为报告内容属实，并在社交媒体上表示已做空该股。
“这是一个试图通过残酷的折扣和免费赠送咖啡向中国消费者灌输饮咖啡文化的彻底失败的企业。”报告称。
报告认为，瑞幸咖啡从2019年第三季度开始捏造财务和运营数据，夸大门店的每日订单量、每笔订单包含的商品数、每件商品的净售价，从而营造出单店盈利的假象。又通过夸大广告支出，虚报除咖啡外其他商品的占比来掩盖单店亏损的事实。
受此消息，瑞幸咖啡当日股价应声下跌，盘中跌幅超过20%，最终收盘缩窄至近11%。
随后，瑞幸咖啡公开回应，逐条否认了浑水报告的所有指控并称“匿名报告有意误导和虚假指控”。
不过，在遭浑水做空后，瑞幸还面临多家美国律所的集体诉讼。
据报道，日前，美国多家律师事务所发布声明，提醒投资者，有关瑞幸咖啡(LK.US)的集体诉讼即将到最后提交期限。此前有多家美国律所对瑞幸咖啡提起集体诉讼，控告瑞幸作出虚假和误导性陈述，违反美国证券法。该项集体诉讼已于2月13日在纽约南区地方法院立案。
上百只中概股飘绿
4月2日晚，瑞幸咖啡发布公告，在SEC新公布的一份文件显示，公司过去的确存在造假行为，在2019年Q2至Q4虚假交易22亿元。受此影响，瑞幸盘前跌幅已超80%，每股由26.2美元降至每股4.31美元。
美股开盘后，瑞幸咖啡随即熔断，截至发稿当晚瑞幸咖啡已熔断6次，后恢复交易。
受瑞幸咖啡该事件影响，美股部分热门中概股同时走低。开盘后，蔚来汽车跌3.4%，拼多多跌3.5%，唯品会跌2.23%，京东跌2.1%，阿里巴巴跌0.78%，但随后中概股走势开始分化，部分个股由弱走强。
截至证券时报记者发稿，美股上百只中概股飘绿，其中近30只个股跌超5%，除瑞幸咖啡领跌外，房多多跌31%，慧择跌12.77%，安博教育跌11.34%，瑞思学科英语跌9.87%，美联跌9.03%，诺亚财富跌6.53%，蔚来汽车跌5.66%，另外蘑菇街、金融界、网易有道等都跌超4%。
不过，58同城仍涨12.77%，万达体育涨7.48%、腾讯音乐、优点互动、新浪、迅雷等国内中概股仍涨超5%，另外优信涨4.86%、新东方涨3.8%、前程无忧涨3.35%、百度涨2.96%、拼多多涨1.6%、阿里巴巴涨1.11%。",2020-04-03 06:48:21,凤凰财经
5,1.8万亿企业年金放榜！整体收益率8.3%，去年人均领7.17万,"1.8万亿企业年金放榜！整体收益率8.3%，去年人均领7.17万2020年04月03日 06:47:17
来源：证券时报
原标题：1.8万亿企业年金""放榜""！整体收益率8.3%，去年人均领7.17万，投管人、受托人排名出炉
(image_address=""https://x0.ifengimg.com/ucms/2020_14/8EBB38D97206B927431DE8E76B92337F0C4B67EE_w600_h333.png"")
2019年末，企业年金基金规模1.8万亿，同比增长22%，规模创新高的同时，增速也明显高于上一年。
人社部3月31日发布全国企业年金基金业务2019年数据显示，建立年金的企业增至9.6万家，同比增长9.8%；参加职工2548万人，增长了6.7%。
2019年，企业年金领取人数180万人，领取金额492亿元。其中，一次性领取的有14.49万人，领取金额103.89亿元，相当于平均每人一次性领取7.17万元。
企业年金基金业绩方面，在去年股市小牛带动下，企业年金2019年收益大幅提升，当年收益1258亿，同比增长199.25%；加权平均收益率8.3%，较上一年（3.01%）大幅提高超过5个百分点。
(image_address=""https://x0.ifengimg.com/ucms/2020_14/4A1DACF7C532317F1C7F5460CBEB859BB03FFEBF_w404_h357.png"")
作为企业职工的养老钱，企业年金要在保障基金安全的情况下，追求尽可能保值、增值，稳健增长，投资管理人处于关键角色。投资管理能力，是竞争企业年金、职业年金业务的看家本领。
未来，随着更广阔的个人商业养老金领域形成，各类资产管理机构、财富管理机构同台竞技，投资管理人之间的竞争，会更加激烈。企业年金的管理业绩，正是公众了解各家机构养老金管理能力的一个窗口。
在2019年，企业年金的受托管理、投资管理等业务，都在呈现强者更强的“马太效应”。
(image_address=""https://x0.ifengimg.com/ucms/2020_14/DE88DF0BE71D9E8068D1441CCD59B18E6380EB9A_w618_h561.png"")
2019年整体收益率8.29%
2019年，企业年金基金合计收益率8.29%，其中固定收益类组合的收益率5.67%，含权益类组合收益率8.89%。
在去年权益市场有较好表现的情况下，含权益类组合的收益率明显高于固收类组合，不过，仍会跑输同期股票和一些股基。这显示出，整体上，作为企业职工养老钱的年金，收益率保持着稳健特征。
单一计划中：
固定收益类组合950个，资产规模2290亿，平均收益率5.65%；
含权益类组合2458个，资产规模1.3万亿，平均收益率8.92%。
集合计划中：
固收类组合数67个，资产规模798亿元，平均收益率5.73%；
含权益类组合数106个，资产规模753亿，平均收益率8.49%。
22家投管人：6家管理千亿规模，泰康资产领先优势扩大
从各类业务看，企业年金有四大业务，包括：受托管理、账户管理、托管以及投资管理。其中，投资管理业务被认为“含金量”最高。
共有22家机构有企业年金投资管理资质，这些投管机构的比拼维度包括管理组合数、管理规模、投资收益率等。通常情况下，投资管理组合数、规模与投资收益率正相关。
2019年末，投资管理规模最大的仍是泰康资产，管理规模2800多亿，领先优势进一步扩大，同比增速达到30%。据券商中国记者统计，该公司所占投管份额达到16.48%，同比提升1.1个百分点。
管理组合数最大的投管人是平安养老险，管理762个组合，管理规模2300多亿，增长13%，份额有所下滑，不过仍有13.44%，仍稳居规模第二大投资管理人位置。
管理规模超过千亿的投资管理人一共6家，排名前二的泰康资产和平安养老险是仅有的投资管理规模超过2000亿的2家投资管理人。
另外4家投资管理人超千亿的是中国人寿养老险、工银瑞信基金、华夏基金、太平养老。其中，除中国人寿养老险外，其他3家都是在2019年实现的千亿规模突破。
(image_address=""https://x0.ifengimg.com/ucms/2020_14/88A45CDCE01F072EDECA471DB2AA537B4C7561B5_w637_h969.png"")
整体看，这22家投资管理人的管理规模大多实现了增长，增速较快的包括易方达基金、中国人民养老保险（人保养老）、工银瑞信基金、华泰资产、泰康资产，这几家的增速都达30%以上。
不过，与此同时，国泰基金的管理规模出现下降，也是唯一一家投资管理规模下降的投资管理人。
这其中，最新获得投资管理资质的人保养老、新华养老，业务也有进展。人保养老的投资管理资质由人保资产迁移而来，2019年末的企业年金投管规模364亿，管理组合数99个，与2018年相比（含人保资产），规模增长38%，组合数增加34个。
新华养老投资管理规模7.22亿元，管理3个组合，与2018年相比，实现了零的突破。
投资管理人投资业绩方面，在含权益类组合中，收益率较高的投管机构是工银瑞信基金、银华基金、易方达基金、华泰资产。
(image_address=""https://x0.ifengimg.com/ucms/2020_14/56B7BD7BBF50D8B88B7CEB3908CF81D8E5A4FD16_w590_h986.png"")
在固收类组合中，收益率较高的投资管理机构是招商基金、易方达基金、中金公司、博时基金。
(image_address=""https://x0.ifengimg.com/ucms/2020_14/61C71FBF7542358672CE783A337BB6315E7CBFE9_w596_h986.png"")
受托管理：国寿养老、平安养老险稳居前二
企业年金另一重要业务是受托管理，目前共有13家受托管理机构，2019年末合计受托管理资产1.25万亿。其中中国人寿养老险、平安养老险、工商银行管理规模稳居前三，受托管理业务呈现“寡头”特征。
中国人寿养老险受托管理3700多亿，份额接近三成；平安养老险管理2700多亿，市场份额22%；工商银行受托管理1300多亿，份额接近11%。
(image_address=""https://x0.ifengimg.com/ucms/2020_14/2F3398091F26B62B0B1A0CC6670C47F61972BC5A_w509_h628.png"")
其他机构的受托管理规模都在千亿以下，太平养老、建信养老金、长江养老的管理规模相对接近，都在900多亿，所占份额超过7%。
在这些受托机构中，中国银行、农业银行、人保养老为2018年新增的受托管理机构，3家的管理情况差异较大。截至2019年末，中国银行受托管理192家企业年金计划，覆盖37.1万职工，受托管理资产金额341亿；农业银行受托管理1个企业年金计划，覆盖64.2万职工，受托资产508亿；人保养老受托58个企业年金计划，覆盖职工8065人，受托管理规模4.65亿。
入市投资谋增值，开户就选广发【马上点击开户】",2020-04-03 06:47:17,凤凰财经
6,ST锐电命悬一线 接盘方仍“半遮面”,"距离“面值退市”渐行渐近，ST锐电日前抛出“易主”自救方案，却迟迟未能披露表决权受让方的权益变动报告书，对于监管问询也尚未回复。遮遮掩掩之下，令本次表决权委托事项蒙上了一层阴影。
不得不提的是，截至4月2日收盘，ST锐电股价报0.8元，已连续14个交易日低于股票面值，距离“面值退市”仅剩下6个交易日。自3月30日公司签署表决权委托协议，两家总资产合计不足4000万元的基金准备充当“白衣骑士”后，公司股价已连收两个涨停。在市场人士看来，毫无资金投入、没有详细方案的一纸协议引爆股价，其中既有公司的保壳忽悠，也不乏投机客的炒作，中小投资者需高度警惕其中的风险。
权益变动报告书“难产”
ST锐电3月31日晚间公告，公司股东起重重工、北京天华中泰、萍乡富海将合计22.69%股份委托给中俄丝路和中俄发展，公司实际控制人由此变更为王峰。根据规定，公司需要在事实发生之日起3日内发布详式权益变动报告书，并提供财务顾问意见。
但公司4月2日晚间公告，由于相关事实仍在核实，将延期到4月7日予以披露。公司的行为已经涉嫌违反了上述规则。上交所工作函已经明确视情况进行处分。
权益变动报告书因何“难产”？据记者了解，收购人收购20%股份并控制上市公司的，须披露详式权益变动报告书以及财务顾问的意见，主要内容包括股东关系、财务数据、主要资产、经营计划等。这些披露要求，就是为了明确收购方是否具备收购人资格。而细看中俄丝路和中俄发展两个基金情况，其成立时间不足两年，总资产合计仅3746万元，本次受让表决权以公司不退市为目的，未付出对价，没有明确的投资计划。有投行人士分析，延期披露背后不排除交易对方还在彷徨中：进，没有实力；退，又怕股价下跌。
抛盘压力逐日上升
记者粗略计算一下，在剩余的6个交易日中，公司股价都要面临“退市生命线”的压力，否则将回天乏术。如，4月3日的收盘价必须不低于0.78元。随着“退市生命线”的水涨船高，股价上涨的压力越来越大。
目前来看，4月1日买入ST锐电的资金已经出现浮盈，不排除其在公司股价尚未到达1元之时抛售获利。市场人士向记者表示：“只要在1元以下，公司股价不能有任何一天下跌，每一个交易日都是命悬一线。一旦获利盘抛售，股价就将崩盘。这种几近赌博式的走势，希望中小投资者能够充分意识风险，理性投资。”
2018年以来，A股已有7家公司因连续20个交易日股价低于面值而终止上市，“面值退市”已成为主要退市渠道，市场化退市逐步建立。但目前来看，个别公司还存在炒作之风，前期的7家“面值退市”公司，其过程中也有起伏，但终究难逃退市命运，如今的ST锐电仍不乏投机客在其中博弈。
对此，市场人士认为，无论从市场角度还是从监管层面来看，都要不遗余力地清除此类公司，这将有利于维护市场秩序、提振市场信心、提高上市公司质量，是资本市场健康发展的必然选择。",2020-04-03 06:44:48,凤凰财经
