,title,content,pub_time,src
3,抄底机会？国际投行大举增持中国股票，全球动荡彰显A股魅力！,"原标题：抄底机会？国际投行大举增持中国股票，全球动荡彰显A股魅力！别人恐慌时贪婪？巴菲特已多次出手
原创许诺
(image_address=""https://x0.ifengimg.com/ucms/2020_12/EDC2C1ABA7E6956F754C30389BD72A6055BB21B1_w600_h333.jpg"")
巴菲特独爱美股，近期抄底航空股、银行股套牢之后，一些国际投行开始将中国市场作为避风港，将资金布局转移到中国资产上。
近日，港交所披露易信息显示，在美股熔断的第二天，摩根大通就在3月10日大举增持中国股票资产，扫货对象包括中国的保险股、银行股、能源化工股、基建股等。这与3月3日的中国稳金融、稳投资、稳就业的政策一拍即合。
不怕低，就怕比。继瑞银、大摩在美股熔断前已将中国视为全球资产避风港后，A股行情独立，而美股连续熔断的现实，进一步刺激全球机构看好中国，一些国际投行认为亚洲市场尤其中国的股票比美股更具有安全性，美股市场已来到了一个转折点。
国际投行看好中国政策加仓中国股票
港交所3月16日披露的信息显示，3月10日，摩根大通一天内大幅增持15家中国公司，包括邮储银行、中海油田、中石化炼化工程等，其中，摩根大通对中国平安最为青睐，该机构加仓幅度更是高达21亿港元，折合19.20亿元。
券商中国记者发现，摩根大通似乎正在根据政策主线投资中国，上述中国公司主要涉及银行保险、基建、投资、能源化工等。这似乎与中国最新的政策有关。3月3日，国务院常务会议指出，必须更有针对性加大稳就业、稳金融、稳外贸、稳外资、稳投资、稳预期工作力度，更有效应对疫情对经济运行的影响。
摩根大通增持的股票，还包括银河娱乐，这家澳门公司于3月10日被摩根大通以每股平均价50.3606港元增持约374.66万股，涉资约1.89亿港元。增持后，摩根大通的最新持股数目为3.49亿股，持股比例由7.96%升至8.05%。
或许因为中国大基建的前景，国电集团旗下的龙源电力也成为摩根大通的扫货对象。港交所披露，摩根大通于3月10日以每股平均价4.4016港元增持约337.61万股，涉资约1486.03万港元，增持后，摩根大通持有龙源电力为202,448,651股，持股比例由5.96%升至6.06%。
这是摩根大通在最近美股市场暴跌环境下，再一次押注中国。
在3月5日那天，港交所披露的信息显示，摩根大通增持了腾讯约417.89万股股票，每股作价404.03港元，涉资16.88亿港元。增持后，摩根大通对腾讯的持股总数约为4.79亿股，最新持股比例上升至5%。除了腾讯，在3月4日，摩根大通耗资39.52亿港元增持中国平安H股4508.68万股，买入均价为87.66港元/股，持股比例由15.19%上升至16.04%。
摩根大通押注中国，很大程度上可能受到最近主流机构的影响，国际投行瑞士银行在2月底已经强调，鉴于欧洲低迷的经济和企业盈利增长前景，与欧元区股票相比，中国股票看起来尤其具有吸引力。摩根士丹利于3月1日也调高了中国、新加坡的股市评级，其中中国股市的评级由持有上调至增持，并表示中国将成为投资者的“避风港”。
中国股票或将在全球首先维稳复苏
俗话说得好，不怕低，单怕比。这些具有前瞻性的国际投行，将中国视为避风港的判断，需要一个强有力的比较，3月9日开始成为许多海内外机构关注中国资产的关键节点。
3月9日美股市场罕见的因为暴跌熔断了。之后更是一发不可收拾，3月12日再次熔断，3月16日美股开盘再次暴跌，标普500指数即跌7.47%，又一次触发熔断。这是继3月9日、12日以来，本月的第三次熔断，也是美股自1987年引入熔断机制以来，史上第四次触及熔断。
相对于美股的连续熔断，A股市场表现出强劲的独立行情，这种强劲在于美股的熔断几乎未对A股产生实质性影响。在这种背景下，越来越多的机构投资者开始将股票投资的重心转到中国市场——避风港。
富达国际首席投资官ParasAnand认为，亚洲市场的股票比美股更具有安全性，美股市场已来到了一个转折点，货币政策对经济的刺激效应将继续减弱。尽管如此，ParasAnand并不担心全球股票市场会共同陷入恐慌性大抛售的境地。尽管过去3年，以标普500为代表的美股市场取得了不错的涨幅，但是新兴市场的涨幅仅为标普500的一半，欧洲市场3年取得的涨幅仅为约5%。美国之外的其他市场尚未达到“高处不胜寒”的程度。
安信证券认为，美股下跌引发全球风险资产下跌，但这一轮下跌，目前为止的特殊性在于新兴市场跌幅小于美股。美国很多机构看好中国，包括中概股在2月初有下跌后修复，但在最近美股暴跌时中概股有相对收益。A股市场，也是美国机构要做中期战略配置的两大市场（美国与中国的科技、医疗、消费优质股权资产），由于目前美国机构在A股配置比例依然较低，因此即使减少风险资产比例，往往减A股配置并不明显。
德意志银行大中华区宏观策略主管刘立男在一份报告中认为，2月底的中国国债纳入摩根大通全球新兴市场政府债券指数生效，纳入将在接下来10个月分步完成。德意志银行预计，受纳入该指数的推动，每月境外资金流入规模达25亿至30亿美元。虽然受美元资金市场流动性紧缩影响，近期市场下调人民币债券配置，但刘立男强调，这将为投资者带来加大长期人民币资产配置的机遇。
景顺投资亚洲市场分析师赵耀庭认为，尽管金融环境最近有所收紧，但世界各地央行都采取了大幅的宽松货币政策，例如英国央行紧急降息，美联储承诺向市场注入1.5万亿美元的流动性。但投资者的担忧并未因此减弱。在这样的市场动荡时期，投资者应保持投资的多元化，可以持有一定的风险资产。在股票市场方面，看好中国和亚洲新兴市场的股票，并相信该地区的收益很可能会首先得到复苏。中国和亚洲新兴市场股票的估值仍然令人瞩目。
别人恐慌时贪婪？巴菲特已出手
根据美国监管机构3月13日披露的数据，巴菲特在3月3日对美股的银行股展开布局，当日完成对纽约梅隆银行的增持，增持后持有纽约梅隆银行8900万股，占总股本比例的10.06%。而在此前的2月27日，巴菲特还以每股45.48美元至47.14美元的价格买入达美航空，斥资约4530万美元。
截止3月16日收盘，巴菲特的上述操作已悉数被套，3月3日对纽约梅陇银行的这笔投资已亏损16%，达美航空股价表现更是惨烈，3月16日收报35.81美元，不到一个月，巴菲特就被这只航空股套牢超22%。
值得一提的是，在巴菲特刚买入达美航空不久，就有A股基金经理认为巴菲特此举太过冒险，而且巴菲特低估了疫情在全球和美国的影响，尤其是对航空业的影响。
美国卫生总署负责人杰罗姆&middot;亚当斯最近表示，美国疫情可能会像意大利一样糟，目前意大利累计确诊病例涨至27980例，死亡2158例。但是，美国人口约是意大利人口的5倍，截至当地时间16日19时，美国较前一天新增确诊病例860例，全美共报告新冠肺炎确诊病例4629例，死亡90例。
据美国媒体CNBC报道，股神巴菲特66岁的女儿苏西正在进行两个星期的自我隔离。她表示曾密切接触过确诊患者两小时，自她所遭受的这一潜在风险暴露以后，就再也没见过巴菲特。而在被问及疫情是否对自己生活造成影响时，巴菲特表示，只是多喝了点可乐，自己身体很棒，现在的身体状况比几年前好多了。巴菲特还强调，目前为止疫情尚未对自己的生活真正造成影响，可以在家里轻松地办公，但医生告知自己不要去人多的地方。
3月17日，根据知名美股网站GuruFocus的计算，自2月19日美股开始堕入熊市以来，“股神”巴菲特的股票投资组合已经损失约802亿美元，跌幅为32%。其中，巴菲特在前三大持仓公司苹果、美国银行和可口可乐中持有的市值分别蒸发199.5亿美元、132亿美元和58亿美元。今年迄今，巴菲特投资组合的市值下跌713亿美元，跌幅为29%。同期，标普500指数下跌了26%。
目前巴菲特有高达1300亿美元的现金储备，这意味着如果美股市场进一步暴跌，巴菲特仍有足够的资金进行抄底自救。",2020-03-17 17:52:45,凤凰财经
4,沪市公司监管锐评：好年报是怎样生成的？不妨讲点道与术,"(image_address=""https://x0.ifengimg.com/ucms/2020_12/3E13D4D0FB2178CB8013F82235B558016121F54C_w900_h506.jpg"")
众里寻他千百度，年报回首，好公司尽在“道”“术”兼备处。
如果说读年报就像去“相亲”，讲究一个透过现象看本质，面面观后定终身，那么写年报则像“相亲角”的老父老母给自家孩子做简历，既要守好实事求是的“道”，又要运好言之有物的“术”。
一份勾勒上市公司过去一年模样和轨迹的“介绍信”，究竟是笔酣墨饱的自然流淌，还是长篇累牍的简单堆砌，效果大相径庭。大凡天下之学问，皆不出“道”与“术”的范畴。道为术之灵，术为道之体，以道统术，以术得道。道是法则，是方向；术是谋略，是方法。小成靠术，大成依道。
年报之道，与万事万物一样，大道至简、返璞归真。简单地说，年报是写出来的，不是依葫芦画瓢编出来的。写出来的年报，才有其文气脉络、谋篇布局，而非貌似整体，实则断简残编，读者不知所云。
写与编，其最大不同在于有没有价值观。公司相信什么、愿景如何，直接决定了公司的经营理念、定位和团队的根本动力。更直白来说，我们能否透过这份“简历”看见企业的精气神，切身感受到经营者对公司的热情和抱负。
写出来的年报，也是管理层与投资者的主动交流。这样的年报，不一定要辞藻华丽、术语高深，却能把一个观点、一件事情说清道明，用实事求是、中正平和，来代替满篇宏大叙事、概念堆砌。
千人千面，公司各有不同，把“自家孩子”取得的成绩写得更客观，把风险写得更深入，从而展现其真实全貌，是一份好年报需要具备的基因。同时，“叔叔阿姨们”介绍时流露出的亲切自然，往往也是赢得对方信任的基础。
掌握了年报之道的公司都是怎么写年报的？“课代表”喊你“抄作业”了！
股神巴菲特每年都会在伯克希尔年报出炉的同时，奉上干货满满的致股东信，字里行间把“道”的精髓体现得淋漓尽致。
在最近的一封信中，巴菲特深度解读了公司的业绩表现，分享了收购对象的三个标准，还回应了市场对公司接班人的关切。五十多年来，这封随着年报如约而至的信，始终贯穿着平实诚恳的风格，在分析公司经营情况的同时，也用价值投资的理念与思考影响了一代代投资人。
脚踏实地之“道”，放诸四海而皆准。近年来，也有越来越多的境内公司在年报中丰富形式，更诚恳、全面地与市场深入沟通。
如招商银行在董事长和行长致辞中，阐述了对当前时代变局下银行业何去何从的思考和预判；万科在致股东信中探讨了房地产行业的白银时代和公司秉持的社会理想。还有一些公司通过年会总结报告、媒体见面会问答等形式向市场回应公司正在历经的危机、风波，或是未来计划开展的一些重大战略调整。
那么，找到了年报之“道”就万事大吉，可以随心所欲了？
不！还得讲究点“术”。
术有万象，有四个关键词贯穿其间，首在“精要”。年报要囊括公司一年来的方方面面，常常动辄数百页，读起来着实有些累人。
好的年报，要让投资者如观大山、如行流水，不经意间即已览尽公司经营要害。简单来说，你这份“简历”得让人一目了然、一看就懂。这就要求，开工动笔前，要先谋好布局，才能在挥洒时圈出重点、删减冗余、控制篇幅。
同时，语言表述和展示形式上也得花些功夫，力求简明扼要、通俗易懂。就拿“业务概要”来说，要在有限的篇幅里把公司业务情况讲清楚，关键就要抓住公司的产品定位、应用领域、生产流程和业务模式这些核心要素。
举个例子，华电重工主营物料输送系统工程、热能工程等大型系统业务，在年报中用图片清晰展示了产品形象及应用场景，将专业的产品名称具象化，图文并茂，直观明了。再有中国巨石，结合生产流程模拟图清楚展现出公司主营产品玻璃纤维的生产过程，三言两语就把复杂抽象的工艺化繁为简。
年报之术，务求“客观”。切莫父母看孩子，越看越欢喜。所言所述要皆有实证，有指标、有数据、有干货。
对业务经营情况，可以主动披露及分析关键业务指标。拿中国神华来讲，公司区分煤炭、发电等分部，把特定行业的关键量价指标列出来，多维度解析业务经营情况，细致深入。再看中国太保，公司按照人身保险、财产保险、资产管理三大板块，详尽分析其业务特点和财务情况，图表数据清晰，文字观点精炼。
如果当年出现主要财务数据变化，还可以通过数据拆解，深入分析根本原因，避免浮于表面。也有两个例子，上海石化按照产品细项对主要财务数据进行了拆分，并针对每项产品量化分析了量价变化对收入、成本乃至利润的影响；中国国航则阐明驱动客运、货运业务收入变化的主要因素，拆分运力投入、客座率和收益水平等三个指标，并测算其对营收的影响，让人读之了然于心。
年报之术，须讲“专业”。年报是公司以内行专业的眼光对其自身一年来经营运行情况的总结，要有分析、有判断、有态度。
这个专业，讲的是对公司经营的专业，主要就体现在对公司核心竞争力的了然于胸、对所处行业的深刻理解，以及对风险的实在把握里。父母作为最了解情况的人，在介绍“自家娃”的时候，务必要拿出最专业的态度和最清晰的阐述来。
讲核心竞争力，关键是把“护城河”的高度和宽度衡量清楚，需有理有据，和“别人家孩子”比比，切忌空洞宽泛。安琪酵母在论述其产品优势时，就通过生产规模、市占率等指标的同业比较，有力佐证了公司的实力。
谈行业理解，要把公司的实际规划嵌入对行业发展的判断中，避免流于表面、徒有噱头。中国石油清晰阐述了各项业务板块的前景展望，又进一步列明了相应的资本支出计划，未来的发展方向和布局清晰可见。
论风险把握，则要突出核心、点到关键，不能只顾扬长避短、报喜不报忧。实践中，不少公司虽将“丑话”说在了前面，但都泛泛谈之、千篇一律。要把风险说好、讲明，既取决于公司的判断，也存乎于公司对投资者的态度。去年，汽车行业遇冷，广汽集团就分层次阐述了公司可能面对的风险，有针对性地提及了行业产销首次下滑、竞争日趋激烈、消费政策调整等问题。不回避问题的态度，才彰显了直面困难的信心。
年报之术，得有“照应”。年报是一个有机的整体，业务活动、会计政策及至财务数据等各部分之间，一脉相承、融会贯通。
就像相亲时的介绍信，这人干啥的、赚多少都要对得上。信息之间的前后照应，深刻勾画出一家公司的经营状态，也能在层层递进的信息中，加深对方的理解。
这其中，首要的是业务活动与财务数据相互匹配、相互印证。赚少了谈谈原因，债多了说说咋办。财务数据显示收入下滑明显或利润持续亏损的，要在经营分析与讨论中，更多地解读公司存在的问题或面临的困境；资产负债率有所攀升的，可以花一些篇幅谈谈公司的融资情况和资金安排；研发投入占比较低的，就不宜在业务中大谈研发能力和技术优势。
还有，公司的会计政策，也需要与业务活动相互呼应，不能仅是简单抄录会计准则的原则性规定，更要结合具体的业务模式去分析如何适用、影响几何。具体来说，就是要“因业制宜”。比如，对房地产、互联网服务等业务模式比较特殊的行业，要结合业务流程把收入确认的具体方法和时点披露清楚；新旧准则变化可能带来重大影响的，也要前后对比、分析差异。
明白了年报的道与术，如何知行合一，也有讲究。就像相亲并不是简单的“按头安利”，年报也绝不只是单纯给投资者的一个交代，更是一年一度对公司全方位的回顾、观察和检视。一年来的所得所失、下一年的所思所想，都可以通过年报来集思广益、统一认识。
这就需要“全家出动”来总结。公司主要负责人的重视程度，决定了年报的视野和格局，也反映了公司对资本市场、对投资者的认识。一份好的年报，不只是由董秘办汇总信息编制而成，而是由公司的主要业务部门参与其中，从多个维度传递出对公司运营情况的分析和判断，再由公司管理层统揽汇总，才能得以生成。
如此一来，市场各家写出来的年报才会更加精彩纷呈，“相亲角”的交流互动才能更加言之有物，年报的道与术也就自然蕴含于其中了。",2020-03-17 17:50:08,凤凰财经
5,中医药“出海”受追捧！哪些上市公司迎来市场开拓新机遇？,"在中国的战“疫”方案中，“发挥中医药优势，坚持中西医结合”是最显著的特征。近期，以岭药业的连花清瘟和聚协昌的金花清感，成为中国医疗专家驰援意大利、伊拉克等国家，首次公开参与海外抗疫的两款中药产品。
海外疫情蔓延，传统中药有了新的“用武之地”。天津中医药大学校长、中国工程院院士张伯礼称：“目前开展的研究发现，这两种中药对治疗轻型和普通型新冠肺炎，疗效是确切的。”
中医药抗疫愈发受海外认可
“韩国大田大学，日本神户东洋医疗学院，以及意大利罗马一所医学院，都给我们来信，愿意与我们分享经验，并希望我们寄中药帮助他们抗病。”在日前的采访中，张伯礼称。
随着海外疫情的蔓延，中医药抗疫经验正走出国门，走向抗击疫情的国际战场。据海外媒体报道，自3月1日纽约宣布首个新冠肺炎病例后，传统中药的需求激增，唐人街上金银花和板蓝根等中药还出现脱销情况。而包括匈牙利、意大利等在内的多个国家，也都有“大锅中药在欧洲开煮”。
(image_address=""https://x0.ifengimg.com/ucms/2020_12/DAC00729A3BB87597FA317DEC6584F063C1BFD9D_w996_h666.jpg"")
华人社区向民众免费提供爱心防疫茶图片来源：中国侨网
中国日报报道称，根据湖北省卫健委提供的药方生产的“新冠肺炎湖北预防方颗粒”，继3月8日第一批750盒出口到荷兰和意大利，并在当地证明有疗效后，后续还将有5000盒出口到这两个国家。
2016年奥运会期间，美国游泳名将菲尔普斯背上的“大红印子”曾让国人感到新奇，外国人也用中医“疗内伤”？其实，国外体育、娱乐领域兴起的拔火罐，只是中医在国外流行的一瞥，更多的中医疗法、药物正在被慢慢接受。
在美国，超过40个州有专门的中医管理法案，其中的一半拥有中医的医保制度。此外，从2020年1月1日起，针灸服务被美国麻省的蓝十字与蓝盾协会（BCBS）纳入承保范围。
另据美国国立卫生研究院官网显示，约有1/5的美国人使用中草药。
上市公司海外市场开拓迎机遇
记者从国家药监局官网了解到，连花清瘟是以岭药业独家药品；金花清感颗粒为聚协昌（北京）药业有限公司独家药品。
(image_address=""https://x0.ifengimg.com/ucms/2020_12/898C8A17AABD27A0567EA06A7BFA62AAC769F5E1_w1080_h361.jpg"")
据悉，金花清感是2009年甲型H1N1流感大流行期间研发的，主要来自两张古方，一个是张仲景《伤寒论》中的麻杏石甘汤，另一个是来自清代《温病条辨》的银翘散。连花清瘟与金花清感的主方相差不大，又多了几种药材，由连翘、金银花、炙麻黄、绵马贯众、板蓝根等13味药物组成，配伍大黄、红景天、藿香而成。
广州医科大学呼吸病国家重点实验室（即钟南山团队的实验室）证实，连花清瘟对新冠病毒引起的细胞病变具有良好的抑制作用，可减少细胞内里毒素的颗粒，明显抑制肿瘤坏死因子等上升，抑制炎症风暴，由此控制病情的发展。
3月12日，中国政府派遣的由国家卫生健康委和中国红十字会组建的专家组一行9人携带10万盒连花清瘟胶囊等大批医疗救治及防护用品等物资从上海飞赴罗马，支援意大利新冠肺炎疫情防控工作。此前，以岭药业还向中国红十字会捐赠了177.6万元连花清瘟用于支援伊拉克新冠肺炎疫情防控。
以岭药业表示，目前满产产能为每天生产胶囊剂约五千万粒，颗粒剂约二百万袋。石家庄生产基地计划再引进三条颗粒生产线，目前设备已基本到位，正处于安装、设备调试过程中。目前公司产能瓶颈主要体现在提取能力方面，后续计划在衡水建设生产基地，一期先建设提取车间，建成后中药材提取能力将得到提升。
佛慈制药则在互动平台表示，公司产品目前出口美国、加拿大、澳大利亚、日本、巴西等28个国家和地区，出口欧美市场主要是中成药产品，欧洲有少量中药饮片出口。
(image_address=""https://x0.ifengimg.com/ucms/2020_12/EB1B73F5BF591B4B470DC8823EF6A54F262341F6_w1080_h373.png"")
佛慈制药工作人员介绍说，公司1931年就开始中药出口业务，出口量一直在国内企业中名列前茅。受疫情影响，今年国际贸易普遍启动较晚，海外中药抗疫的流行有望拉动公司中药（材）出口份额。
此外，华润三九在互动平台表示，海外业务在公司总体业务中占比极小，板蓝根有少量出口业务（近期部分出口用于捐赠）。随着国内新冠肺炎疫情得到有效控制，海外国家疫情形势日益严峻，公司已在研究中药配方颗粒等品种拓展海外市场的机会。
(image_address=""https://x0.ifengimg.com/ucms/2020_12/2D4E8D30C3F4A2E2CBD4A27A8B396834B9F3A142_w1080_h415.jpg"")",2020-03-17 17:45:32,凤凰财经
6,欧股跌幅扩大 三大股指跌超2%,财联社3月17日讯，截至目前，欧股跌幅扩大，英国富时100指数跌近3%，德国DAX指数跌2.8%，法国CAC40指数跌2.17%，欧洲斯托克600指数跌3.2%。,2020-03-17 17:42:57,凤凰财经
