,title,content,pub_time,src
0,又一首富被证监会点名！操纵19个银行账户伪造合同 细节大曝光,"又一首富被证监会点名！操纵19个银行账户伪造合同 细节大曝光2020年04月30日 13:36:37
来源：中国基金报
原标题：财务造假细节大曝光！又一""首富""被证监会点名：操纵19个银行账户伪造合同！市值蒸发逾90%
见习记者 楚深
“以全资孙公司为平台，虚构翡翠原石购销业务，通过造假方式实现业绩目标”、“主观恶意明显”。4月24日，监管部门措辞严厉，点名上市公司东方金钰财务造假，公司股票随后连续两个交易日应声跌停。相比2015年市值高点，暴跌超过90%！
更多幕后细节随后曝光。4月28日晚，东方金钰发布公告称，公司在当天收到了证监会下发的《行政处罚及市场禁入事先告知书》，这份公告也揭开了这起财务造假大案背后更多的细节：孙公司刚成立就造假、控制19个银行账户、伪造交易合同、虚增利润上亿元、虚构利润金额占当期利润比高达211%！
(image_address=""https://x0.ifengimg.com/ucms/2020_18/C02DDBBEF0B13E5F52BD4987ACDBE545F0468D88_w700_h498.png"")
伪造合同及现金流水虚构数亿元交易
控制三组19个银行账户形成资金闭环
证监会查明，在2016年12月至2018年5月的涉案期间，东方金钰为完成营业收入、利润总额等业绩指标，虚构其所控制的瑞丽市姐告宏宁珠宝有限公司（以下简称“宏宁珠宝”）与普某腊等6名自然人名义客户之间的翡翠原石销售交易。
天眼查显示，宏宁珠宝成立于2016年11月10日，为东方金钰的全资孙公司，后者的全资子公司深圳市东方金钰珠宝实业有限公司持有宏宁珠宝100%股权。
这也意味着，宏宁珠宝前脚刚成立，后脚就成为了这起财务造假案的核心主体。
证监会的调查结果显示，在前述两年多的涉案期内，宏宁珠宝控制19个银行账户，虚构销售和釆购交易资金流。
而这19个银行账户，被设计分为了三组。第一组为普某腊等6名名义客户的银行账户，第二组为董某成等7名自然人中转方的银行账户，第三组为李某退等6名名义供应商的银行账户。
证监会查明，在虚构销售交易中，宏宁珠宝通过控制上述19个银行账户，将来源于或流经东方金钰及其控制的公司或银行账户的资金4.79亿元，通过上述中转方和名义供应商账户，转入6名名义客户账户，再控制上述名义客户账户支付销售交易款项，资金最终回流至宏宁珠宝，实现资金闭环。
销售交易得有配套合同，证监会同时查明，涉案销售交易涉及宏宁珠宝与普某腊等6名名义客户之间的翡翠原石销售合同也是假的，其理由如下：
1、该销售合同上普某腊等六人的笔迹与其真实笔迹明显不一致；
2、普某腊等六人称从未与宏宁珠宝发生过任何翡翠原石交易，从未在与宏宁珠宝翡翠原石销售合同或出库单等文件上签字；
3、从合同的履行情况看，宏宁珠宝并无上述交易中交付合同标的物的记录，如提货人名称记录、提货单据、物流单据等，相关工作人员亦不知悉标的物的去向，也未见过前来看货和提货的客户；
4、普某腊等六名名义客户缺少翡翠原石交易的相关经历、经验、鉴定能力、资金实力及渠道，客观上缺少签订并履行翡翠原石交易合同的能力。
证监会认定，綜合考虑合同签字情况、履行情况、交易主体适格情况等，宏宁珠宝与上述六名名义客户的翡翠原石交易合同系虚假合同。因此，东方金钰通过其控制的宏宁珠宝虚构上述销售交易的资金流及销售合同等，虚构上述销售交易。
有卖就得有买。公告显示，除了销售交易作假之外，东方金钰还虚构了上亿元的采购交易。
证监会查明，为使涉案资金顺利从东方金钰及其控制的公司转入名义客户账户，宏宁珠宝在2016年至2017年伪造与李某退等6名名义供应商之间的采购合同，虚构釆购交易。
宏宁珠宝向李某退等6名名义供应商支付了8.18亿元釆购款，其中3.98亿元通过中转方账户转入名义客户账户。如此一来，东方金钰通过其控制的宏宁珠宝虚构上述采购交易的资金流及釆购合同等，虚构了上述采购交易。
就这样，宏宁珠宝控制19个银行账户，伪造销售和采购交易现金流水，相关资金来源于东方金钰及其控制的公司或银行账户，最终作为普某腊等六人支付的销售款项流入宏宁珠宝，构成了一个完整的资金链条闭环。
为了更直观呈现，基金君根据上述信息做了一个简单的流程示意图：
(image_address=""https://x0.ifengimg.com/ucms/2020_18/138CB583E6DB5C387E449304250779FDD3BE48D3_w627_h529.png"")
连续三年定期报告财务数据作假
虚增利润占利润总额比竟超200%
证监会查明，东方金钰在2016-2018年连续三年的定期报告中的营业收入、营业成本、利润总额等科目存在虚假记载。
具体来看，东方金钰的孙公司宏宁珠宝通过前述虚构销售合同及现金流等手段虚构销售交易，通过上述伪造采购合同等方式虚构采购交易。
数据显示，2016年年报、2017年年报、2018年半年报中，东方金钰的虚增利润总额分别为0.95亿元、1.84亿元和0.79亿元，上述虚增利润占对应报告期合并利润表利润总额比分别达29.60%、59.70%和211.48%。也就是说，东方金钰2018年半年报的虚增利润直接让利润指标“咸鱼翻身”，由负转正。
(image_address=""https://x0.ifengimg.com/ucms/2020_18/AA8A5B4479DFE79E886CDC22AD6F98077B436CCB_w596_h311.png"")
证监会认为，上述行为构成2005年《证券法》第一百九十三条第一款所述的“发行人、上市公司或其他信息披露义务人所披露的信息有虚假记载”行为。
证监会决定，对东方金钰责令改正，给予警告，并处以60万元的罚款；对时任董事长赵宁罚款30万元，采取十年市场禁入措施；对时任高管杨媛媛、曹霞、尹梦葶罚款20万元，釆取五年市场禁入措施；涉案的其他董监高等人员分别被处以3至15万元不等的罚款。
“翡翠第一股”两年巨亏数十亿
“疯狂的石头”巨额存货难题待解
回顾历史，东方金钰曾有“翡翠第一股”之称，是中国翡翠业第一家也是唯一的一家A股上市公司。2005年，被称为“赌石大王”的赵兴龙创办的云南兴龙实业借壳多佳股份登陆资本市场，之后多佳股份更名为东方金钰，主营珠宝玉石等饰品的生产和销售。
“疯狂的石头”曾给赵氏家族带来巨额财富。2007年，赵兴龙以27亿元身家登顶云南首富。2013年，赵兴龙家族再次以35亿元资产成为云南首富。2016年，赵兴龙之子，1981年出生的赵宁接任上市公司董事长，并于次年以70亿元的身价问鼎云南首富宝座。
然而，东方金钰眼下的日子有些难过。
今年1月22日，东方金钰发布了业绩预亏公告，预计2019年公司归属于上市公司股东的净利润亏损11.5亿元至14.5亿元。在2018年，公司也曾巨亏17.8亿。这意味着，两年之内公司亏损或将超过30亿元，更严重的是，作为主板上市公司，连续亏损三年就要被强制退市的红线已经近在眼前，保壳变得迫在眉睫。
复盘业绩预亏原因时，东方金钰称，受金融去杠杆政策及其他因素叠加影响，公司融资出现困难，资金流动性紧张，到期债务无法按期偿还，导致出现严重的债务违约现象，并由此引发公司部分账户资产被查封、冻结，债权人申请诉讼或仲裁等一系列问题。经初步统计，2019年全年计提应付债权人利息及罚息约为10.10亿元。
今年2月22日，东方金钰公告称，因公司无法按期支付2017年3月发行的规模为7.5亿元的“17金钰债”该期利息5250万元，经公司申请，“17金钰债”自2019年3月18日起开始停牌。
东方金钰的债务危机由来已久，甚至连董事长赵宁都成为了失信被执行人。2018年，北京市三中院的一份执行裁定书显示，被执行人云南兴龙实业有限公司、赵兴龙、赵宁名下银行账户内无存款、无机动车登记信息，无财产可供执行。
债务高企，巨额亏损，但东方金钰还面临着原石的巨额存货难题待解。
根据东方金钰年报，截至2018年12月31日，东方金钰公司存货账面余额为人民币89.34亿元，占资产总额的比重为82.54%，存货主要为翡翠原石、翡翠成品及黄金。
公开信息显示，2004年至2017年，东方金钰耗资45.58亿元囤积了809块原石，其中仅2017年便花费25亿元采购了319块翡翠原石。但这批石头并没有给上市公司带来太大收益，数据显示，在2006年至2017年间，仅销售了翡翠原石58块，合计销售金额还不足6亿元。
斥巨资追逐“疯狂的石头”，甚至为此大幅举债，但最终销售状况不佳，反过来加剧了公司的流动性危机。2019年三季报显示，截至2019年9月末，东方金钰一年内到期的非流动负债高达49.49亿元，短期借款金额为10.59亿元，账面的货币资金却仅有647万元。
根据天眼查显示的数据，截至目前，东方金钰已13次被列入失信被执行人。
(image_address=""https://x0.ifengimg.com/ucms/2020_18/9B688ED4EED6DBE7E3681A2D47993C2C4B6676EF_w707_h533.png"")
截止4月29日下午收盘，东方金钰最新股价1.51元/股，总市值仅为20.39亿元。股价年内累计跌幅达45.49%，出现了2008年以来的新低。而在此之前的4月18日，公司发布了关于公司股票可能被实施退市风险警示的第三次风险提示公告。
(image_address=""https://x0.ifengimg.com/ucms/2020_18/8AB768F7AC61B29D95267500E8AB0D23C6C75584_w1076_h1506.jpg"")
入市投资谋增值，开户就选广发【马上点击开户】",2020-04-30 13:36:37,凤凰财经
1,太原亿元国资疑遭流失“黑老大”死亡5年仍为房企股东,"王文志　太原报道来源：经济参考报
“太原中和房地产开发有限公司的股东兼董事米为明，绰号‘拐三’，2014年7月已去世，但网上的工商登记资料中发现，米为明至今仍是太原中和房地产开发有限公司的股东兼董事。一个已经去世五年多的人怎么还能继续做具有一级开发资质房地产企业的股东及董事？”
2月19日，天涯社区等多家网站出现上述内容的举报帖，引发网民关注。
《经济参考报》记者对疑似“死人股东”米为明（江湖绰号“拐三”）占股10%的太原中和房地产开发有限公司（简称中和公司）展开调查，发现该公司十余年来的运作路数颇为诡异。
这家被指“有江湖背景”、以62万元“吃掉”亿元国企资产的房地产公司，被指曾导演了“太原最大之一的房地产骗局”，案发后，一方面其9.5亿元的涉案财物未被如数扣押和追缴，另一方面其违法预售商品房收取的3.56亿元房款，则由太原市财政和市属国企出借资金代为退还。
此后其价值数亿元的涉案楼盘被收归国有，最终却以1.24亿元的价格过户给中和公司的关联企业。几番辗转腾挪，中和公司核心资产兜兜转转后似乎是“完璧归赵”，亿元国有资产权益遭侵蚀。
疑为“黑道”染指促成“蛇吞象”改制
2005年12月，太原市属国有企业——太原市综合开发公司改制为民企，接盘者为该公司总经理白仲玉等人。改制后，企业更名为中和公司，白仲玉任董事长，其妻子任红卫任总经理。
资料显示，作为全国首批获得房地产开发一级资质的企业，太原市综合开发公司先后开发了太原市和苏州市的多个房地产项目，总开发面积200多万平方米。
据知情人士向《经济参考报》记者透露，改制前的太原市综合开发公司，除了在部分地市拥有一些存量商品房和未开发土地，还拥有多处不动产，包括位于太原市黄金地段府西街建筑面积6000平方米的办公大楼、位于漪汾苑小区建筑面积5000平方米的停车楼，以及位于市区繁华地段总建筑面积约25500平方米的六所学校等。
多位知情人士表示，改制前，太原市综合开发公司保守估算资产在数亿元左右，而白仲玉等仅出资62万元，就将这家山西省优质房地产企业收入囊中。时隔十余年，这例被指为“蛇吞象”的国企改制，其涉嫌巨额国有资产流失的质疑和举报仍然不断。
记者从天眼查查询得知，截至2020年3月23日，中和公司注册资金5000万元，股权结构为白仲玉78.16%，米为明10%，白卫平10%，化威1%，王袆彬0.8%，吴剑0.04%，主要管理人员为：白仲琴（白仲玉妹妹）、任卫红、陆怡、米为明、李素芬、吴剑，其中白仲琴为董事长，米为明为董事。
据一份审计报告显示，实际出资金额为白仲玉50万元、化威10万元、吴剑2万元，共计62万元，其余4938万元相对应股东均未实际出资。
“在太原，米为明绰号‘拐三’被指涉黑，白仲玉用购买一套商品房的价格，就吃下数亿元国有资产，如果没有股东米为明参与，殊难实现。”当地一位持续举报太原市综合开发公司改制中巨额国有资产流失问题的知情人对记者说。
当地知情人士对《经济参考报》记者说，2014年7月，米为明被对外宣称死亡，死因是“骑自行车不慎跌落摔死”，太原坊间一直有米为明“诈死”的传言，其生死悬疑，扑朔迷离。记者获得的太原市中院（2016）晋01民初640号民事判决书载明，法院认为，“米为明已去世”。
9.5亿元涉案资金被“放水”
米为明加盟的中和公司，改制后不久就在太原房地产市场接连搞出“大动静”。
2008年9月，中和公司和太原市宝田房地产开发有限公司（简称宝田公司）签订《合作开发协议》，就宝田公司名下的大吴村土地证号为京晋字第3304号、面积为72亩土地进行合作开发，约定中和公司出资1.65亿元。协议签订后，中和公司仅支付宝田公司2750万元。在未实际取得该地块、无任何土地开发和售房手续证件的情况下，中和公司就将该地块冠名“中和一号”项目，与购房人签订《认购协议》，公开预售商品房720套，收取预售房款2.62亿元。
2009年12月，中和公司和山西海基房地产开发有限公司（简称海基公司）签订《股权转让协议》，约定海基公司以2.8亿元的价格，将其包括位于小店区西吴村93亩土地在内的全部资产转让给中和公司。协议签订后，中和公司仅支付海基公司1.7亿元。同样在未取得该地块、无任何土地开发和售房手续证件的情况下，中和公司将该地块冠名“中和二号”项目，与购房人签订《认购协议》，公开预售商品房827套，收取预售房款3.25亿元。
2008年12月，中和公司在仅有13.95亩土地手续、规划容积率为3.5的情况下，编造规划容积率为6.39并冠名“中和嘉园”项目，与购房人签订《认购协议》，公开预售商品房233套，收取预售房款9168.6万元。
上述情况，均出自太原市公安机关有关中和公司情况报告。
《经济参考报》记者从太原市房产局的一份有关中和公司问题的报告中说，“中和公司违法建设和销售中和一号、中和二号和中和嘉园项目，未能履行合同按时交房，引发购房人多次群体性上访，对社会稳定造成极大隐患”。
2010年9月，太原市公安局经侦支队对中和公司违法预售商品房涉嫌合同诈骗立案侦查。2012年1月，太原市委、市政府成立“处理中和公司违法预售商品房问题领导组”（简称处理中和公司问题工作专班）。2013年3月15日，中和公司董事长白仲玉被刑事拘留，“3&middot;15”专案组随之成立。
专案组查明，2008年12月至2012年3月，中和公司账面收入共计9.5亿元，公安机关冻结该公司三个账户时，账面余额仅3万余元。
9.5亿元涉案资金流向了何处？知情人士对记者说，除了查明的白仲玉支付宝田公司、海基公司土地合作开发款1.97亿元，其余资金大多在白仲玉被刑事立案之后，其以多种方式转移挪用和挥霍。
《经济参考报》记者获得的太原市公安局《中和公司案件情况报告》称，2012年5月25日，太原市委政法委副书记、市处理中和公司问题工作专班办公室主任张守斌召集市公检法相关负责人开会，就中和公司违法预售商品房涉嫌合同诈骗的问题定性进行研究，“议定中和公司违法预售商品房行为不构成合同诈骗罪”；“我局在案件侦办中审查出的中和公司一系列支出，如个人借款、车辆、捐赠款等款项，因非涉案赃款，故无权扣押与追缴”。
太原市信访部门在向市委市政府报送的有关中和公司问题的请示中说，“公安机关在前期按诈骗立案，善后处理小组的处理思路也是在诈骗的法理上处理。但案件处理小组在市委政法委召开的检察院、法院、公安局‘三长’会议上未将该案定为诈骗，给善后工作带来被动”。
《经济参考报》记者调查发现，被太原市中院、太原市迎泽区法院和山西运城中院轮候查封的中和嘉园项目土地，在白仲玉被刑事拘留后的一段时间内，均被上述法院解除查封。
相关材料显示，案件侦办过程中，公安经侦部门对中和公司价值4000余万元的数十辆豪车未进行扣押，对白仲玉银行卡上的623万元、白仲玉妻子任卫红银行卡上的2376万元、白仲玉儿子白某某银行卡上的300万英镑，以及山西省汇港房地产公司拖欠中和公司的3000万元借款、中和公司在四川西昌投资的2000万元林地款等没有冻结和追缴。特别是对中和公司汇出境外和转入内蒙古乌拉盖管理区东和矿业有限公司（中和公司子公司，法人代表白仲玉变更为任卫红）的大额资金也没有予以冻结扣押。
最终，中和公司董事长白仲玉“违法预售商品房行为不作为合同诈骗犯罪移送”。2012年12月，太原市中院以非法吸收公众存款罪（1750万元）、职务侵占罪（1500万元）、挪用资金罪（13259万元），终审判处白仲玉有期徒刑19年。而中和公司9.5亿元涉案资金究竟流向何处，至今质疑声不断。
国有资金代替私企退还涉案款
数位知情人士对《经济参考报》记者说，一方面是中和公司9.5亿元涉案财物未追缴到位，一方面太原市有关方面积极筹划为该案买单。
太原市房产局《关于中和公司相关问题处理情况的报告》显示，“为保证退款工作顺利进行，根据领导组安排”，2012年4月至12月，市房产局从市属国有企业太原市龙城投资公司借款2.494亿元，代替中和公司退还中和一号、中和二号项目预售房款。
《经济参考报》记者调查了解，2013年2月，太原市国土部门分别从宝田公司、海基公司名下土地中切割出21.3亩、35.3亩，以公开出让所得价款归还了太原市龙城投资公司借款。此后，又通过提高容积率等多种办法对宝田公司、海基公司给予相应的补偿，但两家公司并按规定未补缴土地出让价款和相关规费，事实上造成巨额国有资产权益损失。
太原市政府办公会议纪要［2013］第75期载明，“由市房产局负责向市财政申请借款，用于退还中和嘉园购房户购房款”。2013年8月，太原市房产局动用财政借款1.07亿元，代替中和公司退还中和嘉园预收房款9178.61万元、车位集资款1537.3万元。
收归国有的楼盘最终回归原企业关联方
《经济参考报》记者查阅太原市政府相关会议纪要发现，2013年至2018年，市政府就中和公司因法院查封未能及时转移的中和嘉园项目楼盘处置问题，先后召开十几次会议进行专题研究。而该楼盘在处理完各种历史遗留问题后，被指最终以低价格重新回到中和公司的关联方。
2013年5月9日，太原市政府［2013］第41期办公会议纪要决定，对中和公司依法破产清算，对相关资产进行拍卖处置。会后无任何进展。
2013年6月20日，太原市政府［2013］第65期办公会议纪要决定，由太原市规划局依法没收中和嘉园违法建设的楼盘，由市国土局依法收回土地，由市房产局所属太原市住宅开发修建公司负责建设并安置拆迁户和预售住房户。会后，太原市规划局没收了中和嘉园项目楼盘，太原市国土局收回了中和嘉园项目土地，但太原市住宅开发修建公司没有组织工程续建。
2013年8月27日，太原市政府［2013］第90期办公会议纪要决定，由市规划局、市国土局负责将中和嘉园相关规划、土地手续变更至太原市住宅开发修建公司名下，由该公司负责组织工程续建。会后，变更了相关手续，但未组织续建。
2014年9月24日，太原市政府召开中和嘉园项目专题会议，决定由经纬机械（集团）有限公司（简称经纬公司）作为中和嘉园项目建设单位，负责后续建设及善后相关工作；由市国土局将收回的中和嘉园项目地块土地使用权办理至经纬公司名下，经纬公司承担中和嘉园项目已退房款1.07亿元，转入市房产局专户，用于归还市财政。据了解，此项部署未有过任何实质性进展。知情人士表示，如此虚晃一枪，但却借此名义给项目增加了土地面积、提高了容积率。证据材料显示，在此过程中，中和嘉园项目容积率从3.5提高至5以上，土地面积从13.95亩增加至15.39亩。
2018年3月，太原市国土局以挂牌方式，出让已收归国有的中和嘉园项目土地，山西亿城泰房地产开发有限公司（简称亿城泰公司）以1.24亿元的低价摘牌。
事实上，早在2017年3月22日，太原市房产局上报并经市政府圈阅：中和嘉园项目土地收储费用不低于1.08亿元，在建工程价款按法院裁决为准。2017年10月20日，太原市国土局向太原市政府办公厅报送有关中和嘉园项目问题请示件，建议该项目地上建筑36986.3平方米和地下车库8749.33平方米，随土地一并打包出让，对此太原市政府主要领导圈阅同意。
而亿城泰公司不仅摘牌取得该地块土地使用权，还无偿获得该项目地上、地下建筑物45735.63平方米。知情人士测算，中和嘉园项目资产的最终处置，至少造成亿元国有资产流失。
中和嘉园楼盘资产摘牌人为何是亿城泰公司？《经济参考报》记者调查发现，2012年3月，中和公司董事长、法人代表白仲玉涉嫌犯罪被公安机关刑事拘留后，白仲玉授权委托其妹妹白仲琴担任中和公司董事长、法人代表。而白仲琴也曾是山东长泰置业有限公司监事。记者查询工商登记信息发现，亿城泰公司历史股东跟山东长泰置业有限公司股东存在很多关联，亿城泰公司与中和公司存在关联关系。
记者多次联系太原市处理中和公司问题工作专班办公室主任张守斌，想就此采访了解中和嘉园项目处置有关情况，但是未获得张守斌的回应。
(image_address=""https://x0.ifengimg.com/ucms/2020_18/415A028139693414C547C50F727684D8CAB9CB5E_w591_h444.jpg"")
“元福绿都”楼盘。记者　王文志　摄
4月16日，位于太原市双塔南路的中和嘉园项目已改名为“元福绿都”，楼盘售楼处醒目的广告牌，不时引得过往市民驻足。",2020-04-30 13:08:53,凤凰财经
