,title,content,pub_time,src
2,政府掏几个亿喊大家买买买！深圳杭州消费券火了 为啥不直接发钱？,"导读：分析认为，历史上的消费券出台，基本上出现在经济遇到巨大冲击的时候，这种一次性的消费券发放对提升经济增速是有显著作用的。
来源丨21世纪经济报道（ID：jjbd21）
记者丨侯潇怡、王帆、包慧
编辑丨曾芳、耿雁冰、黎雨桐
部分内容来自券商研报
3月31日，深圳市罗湖区工信局（商务局）局长周建军表示，罗湖举办“2020礼享罗湖”系列促消费活动已开始预约，4月1日起，将向消费者发放3000万元消费券，可在零售、住宿、餐饮、汽车等七个领域使用。消费券有效期7天，不得转让，后期将视情况增加力度。
目前，深圳全市层面尚未有统一的发放消费券措施，但各区在积极行动，截至目前，已有罗湖、龙华和福田区宣布了发放消费券的措施，总额加起来已经过亿。
深圳市罗湖区发放3000万消费券！领取攻略来了
21世纪经济报道记者获悉，此次福利优惠额度总额共5000万元，其中3000万元作为消费券计划，每个月计划发放1000万元，市民在零售、餐饮、住宿等消费到一定额度时，在最终支付时，可以直接抵用现金。此外，1000万元，专门用于促进汽车消费；每购一台小汽车，就送出购物卡1000元。另有1000万元，用于加速度稳增长计划，奖励辖区企业尽快地恢复到疫情前的水平，恢复得越快，获得的奖励越多。
根据官方介绍，此次消费券面向所有市民发放，不限定人员区域，罗湖外的其他城区，甚至广州的市民来罗湖消费也可以使用。但使用第仅限于罗湖区，消费券还可以“折上折”，与商家折扣相叠加。而且，消费券投入力度视消费者参与热度而调整额度、进度。消费者参与度越高，消费券的力度越大。消费的金额越多，中奖的机会越大；由于抽奖的号码是累加的，越早来罗湖消费，中大奖的机会越大。
21世纪经济报道记者尝试申请，具体的申领流程十分简单。在深圳本地宝微信公众号输入“消费券”即可申领。
具体流程如图：
(image_address=""https://x0.ifengimg.com/ucms/2020_14/96396F7CF78DAAB8FCBD084E479C23F2BAB3C8F7_w700_h1459.jpg"")
之后识别二维码进入预约界面：
(image_address=""https://x0.ifengimg.com/ucms/2020_14/0DF1B56D29613C634701B36D1AAC3E56C9446CE9_w700_h2562.jpg"")
点击页面下方申领填写电话号码等基本信息即完成预约。
(image_address=""https://x0.ifengimg.com/ucms/2020_14/51BC1FB890103ABA2BFFE932494604FDF689790F_w700_h1516.jpg"")
深圳已有3个区宣布发放消费券
目前，深圳全市各区均为低风险地区。3月29日，深圳发布了《关于进一步调整疫情防控措施的通告》，明确尽快恢复正常生产生活秩序。其中，商场、大型连锁超市、餐馆、娱乐场所、旅馆酒店等各类公共场所全面开放。
周建军在3月31日透露，罗湖区商圈已有很大恢复，东门商圈从冰冻期的每日4000人流量恢复到了11万人，万象城商圈用电量下降四成恢复到了下降-5%。
全力提振消费，成为接下来一段时期的一大重点。各区领导各显神通，罗湖区区长带头去麦当劳堂食，福田区区长华强北直播逛街买5G手机。
在罗湖之后，龙华区也提出将向市民发放5000万消费券，从餐饮消费、汽车消费、活动支持等角度，制定“商贸业”促消费系列措施。
福田区区长在3月28日直播买手机时透露，将推出“春夏欢乐GO”计划，通过银、政、企合作，为市民提供不少于3000万元现金优惠，重塑消费信心。
拉动汽车消费
在提振消费方面，汽车消费成为各区单独强调的一个重点。
罗湖区的5000万促消费资金中，专门拿出了1000万用于促进汽车消费，每购买一台小汽车，送出购物卡1000元。
3月25日，在深圳举办的一场发布会上，龙华区区长专门“喊话”称，“欢迎大家到龙华买汽车，我们会有2000块钱到3000块钱的补贴，以后还会再增加。”
2月21日，广东省人民政府印发《广东省进一步稳定和促进就业若干政策措施》，其中提出，鼓励广州、深圳进一步放宽汽车摇号和竞拍指标。
这被视为一个重要信号。随后的2月28日，深圳市委市政府印发《关于统筹推进疫情防控和经济社会发展工作的若干措施》，其中就提到，要稳定汽车等大宗消费，加快新增汽车指标放号，优先保障家庭首购需求。
事实上，去年5月广东省就出台了《完善促进消费体制机制实施方案》，明确要求广州、深圳要优化汽车消费环境，逐步放宽汽车指标。6月初，广深两地在同一天出台了增加车牌指标的政策，其中深圳在原定每年普通小汽车增量指标配置额度为8万个的调控目标基础上，2019年至2020年每年增加投放普通小汽车增量指标4万个。
曾有经济观察人士向21世纪经济报道记者表示，由此释放出的汽车消费力，将在年度的经济数据中体现出来。
目前，深圳尚未发布2019年的年度统计公报，一份相对简要的《2019年深圳经济运行情况》并未披露汽车消费的情况，但全年深圳商品销售总额增长了7.8%，这对比2018年的9.3%下降了1.5个百分点。
疫情过后，市民的买车需求会上升吗？在被限牌的城市，市民的购车需求很大程度被压制，如果增加车牌指标，购买力也将相应释放出来，使得有效需求上升。
3月25日，深圳2020年第3期小汽车增量指标竞价举行，个人车牌竞拍平均成交价格达到41303元，对比上一期上涨了6582元，涨幅达到了19%。
杭州2000万消费券也来了，2.5天拉动消费4.53亿！
3月26日，杭州宣布将发放16.8亿元消费券，定向鼓励杭州市本地消费者拉动杭州的线下消费。
而在刚过去的这个周末，杭州第一批消费券已经拉动消费4.53亿！
杭州市的小吃店、超市、商场甚至加油站里，已经领取杭州消费券的市民付款超过40元就能立减10元。
3月27日8时，杭州第一批消费券在支付宝开放领取。截至29日16时，已拉动消费4.53亿。21世纪经济报道记者了解到，这背后总核销的消费券金额不过两千多万，粗略计算，消费券撬动消费的杠杆超过20倍！
值得注意的是，第一批消费券在4月2日过期，提醒还没有去消费的市民朋友们，赶紧去线下消费哦。不管是街边吃早餐，小店购物，还是医院看病，甚至停车费和加油这样的“刚需”都可抵扣，这波福利简单粗暴。
3月以来，除杭州外，广西、南京、合肥等多地政府通过支付宝发放消费券，激活被疫情抑制的消费需求。
杭州联华华商超市在刚刚过去的周末两天支付宝的总交易额突破2000万、全家便利店杭州200多家门店平均营业额增幅超过20%。
(image_address=""https://x0.ifengimg.com/ucms/2020_14/8B19F0825A9114D8E9493FF884B3928D08BC1FB2_w700_h933.jpg"")
（图：杭州消费者在街边早餐店也可使用消费券）
永辉超市主动加推周末特价4.9折商品，可与消费券叠加使用，杭州门店环比上周客流增加70%，甚至比去年同期增加25%，升温明显。
杭州人熟悉的银泰百货推出“满1000返200”的春季美妆节活动。双重促动下，3月最后一周迎来了本月客流量最大的一个周末，对比3月的前三个周末，增幅最高接近50%。杭州盒马14家门店积极参与杭州消费券的活动，截至3月29日，门店销量增幅47.3%，线下客流增幅50.5%，疫后消费增长明显。
国家统计局数据显示，今年前2个月全国社会消费品零售总额同比下降20.5%，其中餐饮收入同比下降43.1%。随着各地逐渐复产复工，发放消费券可以增加民众的购买力和激发消费欲望，进而促进整个国民经济的反弹和复苏。
为什么发消费券而不是直接发钱？
政府也是算过账的，消费券能推动多种业态消费需求分阶段释放，有效带动所有业态的复苏，推动消费回归。
21世纪经济报道记者从支付宝了解到，依托支付宝实名认证、风控等技术，消费券可实现“一城一策、按需定制”、“灵活可调整”、“公平可追溯”。
(image_address=""https://x0.ifengimg.com/ucms/2020_14/06EF3BCF37A34F26525035CE2D39FE95B7D25BDE_w720_h1278.png"")
中国首席经济学家论坛副理事长李迅雷表示，当前需要一些适当的刺激政策来促进消费，以回补因疫情影响而受到遏制的消费需求，从而加快消费恢复速度。各地政府联合互联网平台、商家一起举办惠民活动，为疫情后期提振消费提供了一种新的创新实践。
在国泰君安零售团队看来，历史上的消费券出台，基本上出现在经济遇到巨大冲击的时候，这种一次性的消费券发放对提升经济增速是有显著作用的，原因有四：
1、消费券能够放大乘数效应。乘数效应是指经济活动中某一个变量的增减引起整个经济总量变动的连锁效应。边际消费倾向越高，消费乘数越大，也就是说居民越愿意消费，对于经济增长的拉动作用就越大。
发放消费券是一种比较中和的方式，既能够规避发放食物和现金的弊端，又相当于政府把一部分的购买力从自己手里转移到民众手里，从而能够在短时间内提升居民的边际消费倾向，放大乘数效应，使经济成倍增长。
2、消费券能够缓解低收入家庭的经济压力。经济下滑，企业降薪裁员，对于低收入群体的影响更大，而收入水平越低，对物价的变化就越敏感。收入水平会很大程度上影响人们的消费决策，其中低收入群体整体的生活质量呈现明显的下滑。
南京、杭州等城市发放的消费券都包括特定的发放人群，如低收入群体，因此，消费券还有社会救济的功能，对低收入群体的刺激作用更大。
3、消费券能够在过渡时期发挥作用。调控政策通常从推出到落地需要一个消化期，如果将这种延迟视为一个长期政策，消费券则可以视为一个短期政策，能够在短期内发挥作用，迅速提振特定领域的消费，并且能够为中长期政策的落地实施提供缓冲时间，为下一阶段的发展打下基础，缩短经济恢复的时间。
4、消费券能够改善生产端的经营。消费是一切生产活动的最终目的，消费收缩必定会对生产端产生影响。疫情之下，如果需求疲软，即使企业复工复产也找不到销路。
因此政府给居民发放消费券能够引导居民在特定领域进行消费，消费券看似发放到消费者手中，但真正间接受惠的是生产端的企业，发放消费券能够刺激终端消费，从而促进企业扩大再生产，使企业用工增加，从而居民收入提升，再到居民进一步增加消费，形成良性循环。消费券间接助力企业生产经营的回暖，对未来政府财政收入的增加也有好处。
3月24日，21世纪经济报道记者就获悉，为了保消费，浙江省正在酝酿诸多大招，其中包括鼓励每周只上4.5天班，还有加快研究制定发放消费券、旅游券等消费提振政策措施。
浙江日前印发《浙江省人民政府办公厅关于提振消费促进经济稳定增长的实施意见》提出，发挥浙江数字经济先发优势，推动数字生活新服务走在全国前列，打造有国际影响力的消费大省。
总体目标为到2022年，实现社会消费品零售总额3.4万亿元，居全国第四位，年均增长8%左右；人均居民生活消费支出达到3.5万元，居全国第一位；文化和旅游消费年均增幅保持在10%以上。到2022年，全省网络零售额达到2.6万亿元，居全国第二位；数字生活新服务比上年增长10%以上。
《意见》还提到，各地、各有关部门要加快研究制定发放消费券、旅游券等消费提振政策措施，鼓励实施一周4.5天弹性工作制，支持有条件的机关、社会团体、企事业单位落实带薪休假制度。",2020-03-31 15:50:53,凤凰财经
3,大V反弹！3月份PMI大幅回升越过枯荣线，中国经济回暖了？,"出乎意料
(image_address=""https://x0.ifengimg.com/ucms/2020_14/8DD4228BA59313ADE5B76ACF040893A8D98DD385_w640_h17.png"")
“V”型反弹！
今天国家统计局公布的中国采购经理指数（PMI）大出市场意料。
(image_address=""https://x0.ifengimg.com/ucms/2020_14/C902F2334A03AB5E2EE816A9E727A245B1A7B8F6_w1080_h700.png"")
(image_address=""https://x0.ifengimg.com/ucms/2020_14/835CDD5E4E1F5E7AFB3093A0888ADA870DD9C521_w1080_h707.png"")
(image_address=""https://x0.ifengimg.com/ucms/2020_14/44AE4697930CC6932DBF8C3245E392736CFE8720_w1080_h624.png"")
图表来源：国家统计局
当月，中国采购经理指数在上月大幅下降基数上环比回升，制造业PMI、非制造业商务活动指数、综合PMI产出均大幅反弹至50%的枯荣线上方。
作为国际上通用的监测宏观经济走势的先行性指数之一，PMI数据具有较强预测、预警作用。此番大幅反弹，是否意味着中国经济已经出现回暖势头？
3月份PMI大幅回升越过枯荣线
先来看看数据。
3月份，最受关注的制造业PMI为52.0%，比上月回升16.3个百分点。
其中，不同规模企业全线回升：大、中、小型企业PMI分别为52.6%、51.5%和50.9%，比上月回升16.3、16.0和16.8个百分点。
从供需两端看，生产指数和新订单指数分别为54.1%和52.0%，比上月回升26.3和22.7个百分点。生产指数高于新订单指数2.1个百分点，显示制造业产能有所恢复。采购量指数为52.7%，比上月回升23.4个百分点，企业采购活动较上月活跃。
与此同时，受疫情冲击最严重的服务业总体回暖。
3月份，服务业商务活动指数为51.8%，比上月回升21.7个百分点。在调查的21个行业中，除证券行业外，其他行业均有不同程度回升，其中交通运输、零售、银行等行业商务活动指数相对较高。
不过，当月生活性服务业商务活动指数为50.2%，低于服务业总体指数1.6个百分点，其中住宿餐饮、旅游、居民服务、文化体育娱乐等行业受疫情影响较大，复工复产进度较服务业总体滞后，商务活动指数继续位于收缩区间。
3月份，综合PMI产出指数为53.0%，比上月回升24.1个百分点，构成综合PMI产出指数的制造业生产指数和非制造业商务活动指数分别为54.1%和52.3%，环比均有不同程度回升。
中国物流信息中心研究员文韬指出，总体来看，2月份，受新冠肺炎疫情影响，经济发展出现“堵点”和“断点”，下行压力加大。到3月份经济恢复明显，疫情得到有效控制以及复工复产相关政策效果的释放共同拉动了经济的回升。
“V”型反弹因何而来？
看到3月份数据后，各方都不免疑问：疫情给中国经济带来较大冲击，为何短短一个月内，PMI数据就出现“V型”反弹？
首先需要指出的是，PMI是一个环比指数，反映的是本月比上月发生的经济变化情况，变化幅度与上月基数有很大关系。
据了解，今年以来，新冠肺炎疫情对中国经济形成严重冲击，尤其是2月份采购经理指数跌至历史最低点，甚至低于2008年国际金融危机期间，经济活动短期内大幅收缩。但3月份以来，中国统筹推进新冠肺炎疫情防控和经济社会发展工作取得积极成效，疫情防控形势持续向好，企业复工复产明显加快。
截至3月25日，全国采购经理调查企业中，大中型企业复工率为96.6%，较2月25日调查结果上升17.7个百分点，生产生活秩序稳步恢复。3月份制造业PMI、非制造业商务活动指数和综合PMI产出指数在2月份大幅下降基数上环比回升，表明当月企业生产经营状况与2月份相比发生了明显的积极变化。
那么，这一系列数据又是怎么得来的？到底靠不靠谱？
国家统计局服务业调查中心负责人介绍说，按照国际通行算法，制造业PMI由新订单、生产、从业人员、供应商配送时间、原材料库存5个分类指数加权计算而成，各分类指数均采用扩散指数方法计算。
以生产指数为例，根据企业采购经理人对“本月主要产品的生产量比上月变化”问题的回答，把回答比上月“增加”的企业个数百分比与回答与上月“持平”的企业个数百分比的一半相加即可得到生产指数。
所以，3月份PMI指数为52.0%，实际上可以直观地理解为：3月份有一半以上企业生产经营状况比2月份有所好转。
在国务院发展研究中心宏观经济研究部研究员张立群看来，3月份PMI指数出现大幅提高，显示复工复产成绩显著。但目前仍处疫情防控的特殊时期，经济运行各个方面，包括PMI指数变动均带有特殊情景下的明显特点。
张立群表示，PMI指数反映的是与上个月的环比变化，由于2月份经济活动受疫情冲击最为严重，因此3月份PMI指数大幅提高符合预期。
PMI反弹是否预示经济回暖？暖？
PMI数据大幅反弹，是否代表中国经济已经回暖？
对此，张立群特别提醒，3月份PMI指数处于荣枯线上，不表明经济活动已全面恢复；必须与PMI指数常态水平变动所表达的经济含义加以区别。要充分认识当前国内外经济形势的空前严峻和复杂，高度重视疫情对社会生产和三大需求的严重冲击。
国家统计局服务业调查中心负责人亦明确指出，3月份采购经理指数较2月份明显上升是反映当前多数企业随着复工复产的有序推进，企业生产经营情况比上月有所改善，但并不意味着企业实际生产经营已恢复至疫情前水平。
通常情况下，当PMI连续三个月以上同向变化时，才能反映经济运行趋势性变化，仅单月数据升至荣枯线上，并不能判断经济已完全恢复正常水平，实现趋势性好转，还需持续观察变化。
同时，3月份PMI数据回暖，也未必预示其他主要宏观经济数据都会出现同步变化。
上述负责人指出，由于PMI指数是一个月度环比指标，容易受到工作日、季节、基数等因素影响，与同比指标相比，数据波幅较大，更适合反映短期经济形势变化。而同比指标一般反映本期与去年同期相比的变化情况，受季节因素影响较小，数据波动相对平滑，更适合反映长期趋势，但对于短期变动缺乏敏感性。
在经济出现较大波动时，有时环比指标与同比指标走势可能发生背离。由于目前主要宏观经济数据多为同比指标，所以PMI环比回升并不意味其他主要宏观经济数据一定会发生同向变化。
中国民生银行首席研究员温彬也表示，仅依靠单月景气指数回升，不足以做出经济已经回暖的判断，还需继续观察后续走势变化。下阶段仍要加大逆周期调控力度，金融、财政、就业政策要协调发力，打通复工复产各环节堵点，加大资金保障力度，切实降低实体经济融资成本，保证经济延续积极改善迹象，实现趋势性好转。",2020-03-31 15:42:07,凤凰财经
4,阿里计划收购韵达至少10%股份？称对市场传闻不予置评,"阿里巴巴又要入股快递公司了？
3月31日消息，据路透社报道，两名知情人士称，阿里巴巴集团控股有限公司（NYSE:BABA，09988.HK）计划购买韵达股份（002120.SZ）至少10%的股份，这是阿里巴巴对大型快递公司的第五笔投资。
对此消息，阿里巴巴方面回应澎湃新闻（www.thepaper.cn）记者：“对市场传闻不予置评。”
韵达股份方面截至记者发稿前无回应。今日韵达股份开盘报28.38元，午后直线涨停，报30.81元，总市值685.92元。
据路透社报道，其中一位知情人士说，阿里巴巴正寻求从韵达股东（创办人聂腾云和陈立英）手中收购股份，聂腾云和陈立英二人通过其独资公司上海罗杰斯投资管理公司拥有韵达股份52.19％的股份。以目前的市场价格计算，这些股份的价值至少为7.9亿美元。另一位知情人士则表示，阿里巴巴也可能会收购超过10%的股份，最多收购韵达股份15%的股份。
路透社在报道中指出，从另外两名知情人士处得知，阿里巴巴已经收购了韵达股份的一小部分股份，只是该股份的数量低于公开要求。
据了解，阿里巴巴已先后投资入股了百世、中通、圆通和申通四家快递公司。",2020-03-31 15:41:56,凤凰财经
5,别等了！今天油价不调了,"3月31日国内成品油调价窗口将再次开启。按照《石油价格管理办法》，本轮周期国内成品油价格挂靠的国际原油均价低于40美元/桶的“地板价”，国内油价调整将暂停。
新一轮成品油调价窗口开启
按照2016年出台的《石油价格管理办法》规定，国内汽、柴油最高零售价根据国际原油价格变化，每10个工作日调整一次。根据国家发改委消息，新一轮成品油调价窗口将于今天（3月31日）24时开启。
国际油价跌破“地板价”国内汽、柴油价格不作调整
据国家发改委价格监测中心监测，本轮成品油调价周期内（3月17日—3月30日），国际油价继续震荡下跌，伦敦布伦特、纽约WTI平均油价比上轮调价周期下降36.05%。根据2016年出台的石油价格管理办法，国际油价平均水平已跌破“地板价”（每桶40美元的调控下限），按照机制，国内汽、柴油价格不作调整。未调整部分将按照《油价调控风险准备金征收管理办法》规定，全额上缴中央国库，纳入一般公共预算管理。
何为“地板价机制”？
成品油价格机制设定了调控上下限。上限为每桶130美元，下限为40美元，即当国内成品油价格挂靠的国际市场原油价格高于每桶130美元时，汽、柴油最高零售价格不提或少提；低于40美元时，最高零售价格不再下调。从历史情况看，2016年1-4月份，由于国际油价大幅下跌，触动了国内成品油价格调控下限，国内油价按机制在40美元以下部分未作调整。
设定上下限，主要是考虑我国既是石油进口和消费大国，也是石油生产大国，油价过高过低都会带来不利影响。过高，会加大用油行业和消费者负担，影响国民经济平稳运行；过低，会影响国内原油开采行业正常发展，削弱自给能力，导致对外依存度进一步上升，不利于保障国内能源安全。
需要说明的是，当油价低于调控下限时，国内成品油价格未调金额不是直接留给企业成为收入，而是全部纳入风险准备金，并根据《油价调控风险准备金征收管理办法》规定，全额上缴中央国库纳入一般公共预算管理，统筹用于节能减排、提升油品质量、保障石油供应安全，以及应对国际油价大幅波动，实施保障措施的资金来源。
(image_address=""https://x0.ifengimg.com/ucms/2020_14/B838EDC2296F90DD4B332280508F5F391E9D907F_w533_h533.jpg"")
原油市场供需严重过剩影响油价下跌
调价周期内，原油市场供需严重过剩影响油价进一步下跌。3月30日，伦敦布伦特、纽约WTI油价跌至近18年来的最低位，分别为每桶22.76美元、20.09美元。一方面，新冠肺炎海外疫情继续恶化导致经济活动显著放缓，用油需求大幅下降；另一方面，沙特发动价格战，几大产油国表示扩产参与市场份额之争，原油产量和库存大幅上升进一步压低了油价。
(image_address=""https://x0.ifengimg.com/ucms/2020_14/C437CAE63D2DB43555B7C56E2479B917D00AD647_w713_h452.jpg"")
综合多方面因素，国家发改委价格监测中心预计，供应过剩将影响油价国际油价二季度在每桶40美元的“地板价”下方徘徊。后期市场的焦点将集中在新冠肺炎海外疫情的防控效果，以及美国、沙特和俄罗斯之间政治角力带来产量的变化。
(image_address=""https://x0.ifengimg.com/ucms/2020_14/7F7C57325BA30272B7D12A9A23983EA77F9F7948_w610_h190.jpg"")
年内油价变动一览：三跌三搁浅
2020年，国内成品油调价已呈现“三跌三搁浅”的格局。截至3月31日,今年共有6次调价窗口期,其中2月4日、2月18日、3月17日国内成品油价格下调。截至本次调价，汽油价格累计每吨下调1850元，柴油价格累计每吨下调1780元。按照《石油价格管理办法》，本轮周期国内成品油价格挂靠的国际原油均价低于40美元/桶的“地板价”，国内油价今天将不调整。未调整部分将按照《油价调控风险准备金征收管理办法》规定，全额上缴中央国库，纳入一般公共预算管理。
(image_address=""https://x0.ifengimg.com/ucms/2020_14/64BBB5905E69888F8498694E941AFB78A4BD9D8C_w700_h1641.jpg"")",2020-03-31 15:41:50,凤凰财经
