,title,content,pub_time,src
0,种中“茅台”蓄势待发？农发种业澄清：酒粮业务占比较低,"白酒股近日表现抢眼，与酿酒业息息相关的种企也受到市场关注。8月18日、19日，中农发种业集团股份有限公司（下称“农发种业”，600313）连续两日涨停。有研报称其“布局酒粮成效渐现，种中‘茅台’蓄势待发”。
对此，农发种业8月19日晚间发布公告澄清：公司本年度尚未与其他酒厂签署供货协议及长期战略合作协议。目前酒粮业务在公司整体业务体量中占比较低，未达到信息披露标准。
上述研报称，龙头酒企向上游龙头种企集中采购小麦、高粱等酒粮是大势所趋，农发种业作为国内小麦种子绝对龙头，也是国内唯一涉足高粱种子业务的种企，已布局酒粮业务多年，与国内诸多酒企已达成实质性合作，未来酒粮业务有望成为公司新的利润增长点。
农发种业在公告中提到，截至目前，公司控股子公司河南黄泛区地神种业有限公司与四川绵竹剑南春酒厂有限公司签署了1万吨的“泛麦8号”小麦购销合同。经公司估算，该合同如履行完毕，预计产生的销售收入不到公司上一年度经审计合并报表营业收入的1%，预计产生的净利润与公司上一年度经审计合并报表的净利润相比约为3%左右。
另一家控股子公司山西潞玉种业股份有限公司与江苏洋河酒厂股份有限公司于今年4月达成了种植面积为1000亩的高粱定向采购协议。此次定向种植面积很小，且为试验性质，对其今年的销售收入、净利润基本不产生影响。
官网资料显示，农发种业成立于1999年，于2001年1月在上交所上市。该公司目前拥有控参股企业12家，业务涵盖玉米、小麦、水稻三大粮食作物等农作物种业、农药、肥料以及农业综合服务业务，已于2015年实现了小麦种业全国第一、水稻种业全国第六、玉米种业全国第九的阶段性目标，综合实力位居中国种业第四位。
今年一季度，该公司营业收入为3.08亿元，同比下降65.76%；净利润为-1.03亿元，同比下降30.27%；而其2016至2019年期间扣非净利润也均为负值。
8月19日收盘，农发种业报收于6.42元/股，上涨9.93%。",2020-08-19 20:58:08,凤凰财经
1,涉嫌操纵股价、违法违规 ，中恒电气董事长遭证监会立案调查,"8月19日晚间，中恒电气发布公告称，因“涉嫌操纵‘中恒电气’股价”、“拒不配合国务院证券监督管理机构依法履行职责，涉嫌违反相关证券法律、法规”，中国证券监督管理委员会决定对公司董事长、董事朱国锭进行立案调查。
中恒电气在公告中表示，本次立案调查事项系对朱国锭先生个人的调查，不会影响公司正常生产经营活动。公司将根据调查情况及时履行信息披露义务。
(image_address=""https://x0.ifengimg.com/res/2020/5CFDB1BBDD0072371C68F7D1F70B0FB2C8F9BB8A_size68_w680_h429.png"")
中恒电气还发布公告称，公司近日收到实控人朱国锭及其一致行动人包晓茹减持公司股份比例累计达到1%的告知函，朱国锭、包晓茹于2020年8月12日至8月17日通过集中竞价交易合计减持公司股票563.6万股，占公司总股本的1%。
公开资料显示，中恒电气此前发布的2020年半年报显示，上半年公司实现营收4.06亿元，同比增长7.71%；实现归母净利润0.32亿元，同比下降21.37%；实现扣非归母净利润0.16亿元，同比下降55.82%。
其中，公司二季度实现营收3.40亿元，同比大幅增长90.66%；实现归母净利润0.57亿元，同比大幅增长90.35%；实现扣非归母净利润0.45亿元，同比大幅增长59.76%，超市场预期。
截至今日收盘，中恒电气收报14.06元/股，跌4.74%。
(image_address=""https://x0.ifengimg.com/res/2020/FC4D1F1DB06F8CB249C7988B21FD03BCDD5DCC0F_size11_w606_h485.png"")",2020-08-19 20:49:25,凤凰财经
2,舍得酒业收问询函 需说明是否存在其他未披露的资金占用和违规担保等情形,e公司讯，舍得酒业收上交所问询函，要求说明公司是否存在其他未披露的资金占用和违规担保、不当交易等侵占上市公司利益的情形。,2020-08-19 20:42:40,凤凰财经
3,7月新增投资者数量创5年新高 证券市场投资者总数首次突破1.7亿,"A股投资者数量首次突破1.7亿。
今年7月，A股市场行情相当火爆，中国结算的最新数据显示，7月当月新增投资者数量达242.63万，创下最近5年单月最高纪录。
01
7月新增投资者数量创5年新高投资者总数首次突破1.7亿
中国结算最新公布的数据显示，今年7月，内地证券市场新增投资者数量达到242.63万，而上次这一数量超过200万还是在2019年3月。
(image_address=""https://x0.ifengimg.com/res/2020/D6D9EBCA9516EA5E25B26F264778A123BE3C2D74_size88_w558_h358.png"")
今年7月新增投资者数量也创下2015年6月之后，最近5年新高。2015年6月，A股单月新增投资者数量达到464.22万。此后由于股市快速暴跌，新增投资者数量急剧下滑，2015年7月骤降至204.87万，2015年8月进一步降至136.85万。
2019年一季度，A股市场出现过一波强劲上涨行情，当年3月，新增投资者数量达202.48万，此后随着行情的再次走弱，这一数量降至200万以下，直到今年7月才重新突破200万。
值得注意的是，在投资者数量大幅增长后，今年7月末投资者数量达17,016.95万（即约1.702亿），这是内地证券市场投资者数量首次突破1.7亿。
对比可以发现，今年7月末投资者总数已是5年前的2倍左右。
(image_address=""https://x0.ifengimg.com/res/2020/F432A16917BB0CFFF1B513B275A2728C771E78AE_size146_w603_h1667.png"")
02
7月券商业绩也井喷四成上市券商利润环比翻倍
在新增投资者数量创下最近5年新高，以及老股民返场的大背景下，股市成交量急剧增长，券商业绩也迎来了大爆发。
据Wind数据，目前已披露2020年上半年业绩的上市券商中，多数利润出现明显增长，其中锦龙股份、东方财富归母净利润同比增速超过100%，中信建投、华林证券同比增速则超过50%，其他多数券商也超过10%，仅方正证券、中原证券归母净利润同比出现下滑。
(image_address=""https://x0.ifengimg.com/res/2020/C32593735FB4CA3CA3BD836D2C7B7EC3C5C00662_size69_w603_h839.png"")
7月份A股市场成交井喷，券商业绩在此基础上又有了进一步大幅增长。
据Wind数据，纳入统计的38家上市券商中，32家今年7月单月营收环比出现增长，其中7家环比增速超过100%。利润环比增速方面，多达25家上市券商归母净利润环比增速超50%，其中16家环比增长超过100%，占比超过四成。
(image_address=""https://x0.ifengimg.com/res/2020/30933FCA18EF60F02444FF252A0DB75C92B1D717_size180_w602_h1943.png"")",2020-08-19 20:37:19,凤凰财经
4,李小加：美国制裁香港是杀敌八百自损一千，蚂蚁、字节上市只是时间问题,"8月19日，港交所发布2020年中报业绩显示，报告期内，公司实现营业收入87.82亿港元，同比增长2%，归属股东净利润52.33亿港元，同比增长1%。
值得一提的是，董事会宣派中期股息每股3.71港元，占股东应占溢利90%，这是什么概念呢？即港交所每赚10港元就派发9港元回馈给股东。
在业绩会上，李小加还回应证券时报记者称蚂蚁金服、字节跳动香港上市只是时间问题，阿里巴巴、未盈利生物科技股无理由不入港股通，并表示“应做的事将来都会做”。
营收、净利同创半年度新高
今日港交所中报业绩放榜，先来看几组关键数据：
2020年上半年，港交所实现营业收入87.82亿港元，同比增长2%，EBITDA(税息折旧及摊销前利润)达67.06亿港元，同比微增1%，净利润52.33亿港元，同比微增1%。2020年上半年的整体收入及其他收益创半年度新高。
(image_address=""https://x0.ifengimg.com/res/2020/C192274B79C67B2DFB85B03D8971603F16959D43_size40_w558_h269.png"")
港交所行政总裁李小加表示，尽管上半年宏观经济动荡不定，香港交易所今年开局仍然良好，营业收入及溢利同创半年新高，现货市场成交增长，沪深港通成交额继续创新高。新股上市络绎不绝，包括多只来港作第二上市的大型股，抵消了由于投资组合估值波动带来的投资收益下滑影响。
2020年上半年，港股市场成交主要数据表现亮眼，平均每日成交金额达到1175亿港元，同比增长20%，其中股票日均成交额1000亿港元，同比增长33%，沪深股通的平均每日成交额达到743亿港元，同比增长69%，债券通平均每日成交额达到199亿港元，同比增长202%。
(image_address=""https://x0.ifengimg.com/res/2020/73F095B9597F9DAB584A6C5D17507B6F1C223CC6_size74_w558_h228.png"")
派息比率高达90%
港交所中报显示，公司董事会建议派发中期股息每股3.71港元，派息比例达90%。
这是个什么概念？假如一家公司每股盈利10元，其中9元就拿来现金派发给股东，就问你大气不大气，希望这样的公司能在A股也有。
Wind统计数据显示，自2006年至今，14年间港交所累计实现净利润875亿港元，已实施现金分红14次，累计现金分红740.69亿港元，分红率84.63%。
(image_address=""https://x0.ifengimg.com/res/2020/E90530AC8C78D0DA9C7AACCDC4959432BB80EDC0_size29_w558_h159.png"")
虽然派息率高不一定是好事，某种程度上表示公司缺乏再投资的机会，因此选择把大部分盈利回馈给股东，但是港交所不一样，因为做的是“独家”生意，不必每年有大额资本开支。
资本开支方面，港交所上半年营运支出20.76亿港元，最大的资本支出为雇员费及相关支出，达13.98亿港元，同比增长5%，其次为资讯技术及电脑维修保养支出，为3.15亿港元，同比增长13%，楼宇支出5900万，同比减少8%。
(image_address=""https://x0.ifengimg.com/res/2020/BC423E88144F3FFEB8F0AA0AB12C81BBD3147AAA_size42_w558_h279.png"")
债券通每日成交高达199亿，为2019年上半年三倍
债券通于2020年7月进入三周年，自推出以来债券通不论在成交量、外资持有量级登记投资者数目方面均有大幅增长。中报显示，2020年上半年，债券通平均每日成交额高达人民币199亿元的半年度新高，是2019年上半年的三倍，2020年5月份的平均每日成交金额更创出人民币260亿元的单月新高。
截至2020年6月30日，中国内地银行间债券市场国内债务证券的整体外资持有量上升至人民币2.5万亿元，认可机构投资者总数增至2012名，较2019年12月31日分别上升15%及26%。2020年上半年，债券通首次有芬兰及俄罗斯投资者加入，涉及范围因此扩大至33个司法权区。
为进一步优化债券通，中国人民银行于2020年7月公布四项措施，包括降低交易成、延长交易时间，拓宽交易平台服务覆盖范围及进一步完善一级市场服务质量。
沪深港通收入创半年度新高
2020年上半年，沪深港通的收入及其他收益创半年度新高至7.43亿港元（2019年上半年为5.08亿港元），其中5.78亿港元来自交易及结算活动，尤其北向交易的成交额创半年度新高，北向交易平均每日成交额为人民币743亿元，较2019年上半年上升69%，南向交易平均每日成交金额为207亿元，较2019年上半年上升86%。南向交易金额于2020年3月19日创单日成交新高，达463亿元。
(image_address=""https://x0.ifengimg.com/res/2020/1ECA04D25138D1C7AF4BF32676E87DF1AB2B5E99_size110_w538_h410.png"")
中泰国际策略分析师颜招骏认为，沪深港通收入创半年新高，为港交所带来新的收入贡献点，这一收入贡献未来还将会持续增加。
此外，港交所于2020年1月13日成功推出港股通投资者识别码制度，有助提升沪深港通的有序运作及市场监管。
李小加回应蚂蚁金服、字节跳动香港上市：只是时间问题
中报显示，香港市场继续备受发行人欢迎，截至2020年6月底，申请来港上市的医疗公司及整体大型新股数目均大幅增加。2020年上半年，港交所共有64家新上市公司（包括网易及京东的第二上市），总集资额达到928亿港元，按新股数目计，位列全球第二，按首次公开招股集资额计位列全球第三。
蚂蚁金服赴港上市消息尘埃落定，市场传言字节跳动也将于今年香港上市，证券时报记者在业绩会上问及港股生态未来是否由科技、生物医药等新兴行业主导时，李小加表示，“港股生态已经在发生变化，而且是不可逆转的变化。新经济公司给我们的市场带来巨大的生命力，不仅是IPO数量大幅增加，交易量大幅增加，交易活跃度大幅增加，而是整个生态结构的变化，目前新经济公司已经重新编制成指数，被称为港股‘纳指’。随着中概股的进一步回归，我们也需要这样的新鲜血液，我无法具体评论蚂蚁金服或者字节跳动，但几乎你们所看到的报道最后都会来港上市，他们来港发行只是时间的问题。”
美国制裁香港是杀敌800自损1000
据香港苹果日报报道称，美国可能推出进一步措施制裁香港，包括禁止美国企业来港投资，不准ADR换货转来香港买卖，在业绩会上港交所行政总裁李小加在接受证券时报记者采访时回应上述问题，他表示，“我很难想象这些制裁到底是针对谁，也很难想象这么大的一个市场到底谁的损失会更大，这种措施实际上是充满自我毁灭，完全就是杀敌800自损1000。所以我们针对这些不合理以及无法想象的制裁很难去做准备，如果真出现了这种制裁措施，那天要下雨娘要嫁人。可以看到的是，即使上半年如此动荡，我们依然能作出创纪录的业绩，这恰好证明了港交所的竞争力。”
李小加：阿里巴巴无理由不纳入港股通
明年卸任行政总裁的李小加指出，港交所今年上半年开局良好，“我们有很好的业绩，今年至今都是好年，对下半年也有信心。虽然中美关系影增加了市场波动性，但没有影响市场本身的活力和投资者的热情。今天我们的市场在交投上如虎添翼，一翼就是北上通，沪深港通使得投资者的池子有了巨大的变化和化学反应，我们的交投量已经上了一个台阶，日均在1000亿港元以上；另一翼就是我们IPO市场尤其是科技生物医药市场依然强劲，加上中概股的回归，今年的市场一定是非常强劲的。”
业绩会上李小加被问及阿里巴巴、未盈利生物科技股纳入港股通时间表，他重申，期待互联互通扩容，特别是在内地有影响力且为投资者认识的大型企业，无理由不入港股通，他认为“应做的事将来都会做”，而上海科创板纳入互联互通，李小加称议题“较少争议”。
李小加重申，不认同上海和香港金融市场争夺新股IPO资源，指出双方各有数以百计企业上市，甚至有企业在两地同时上市。
大摩：升港交所目标价至430港元
受益于市场交投活跃，中概股回归超预期，MSCI相关衍生品推出取得积极进展，港交所股价表现强势，年初以来涨幅达到49.45%，并创出388港元的历史高位，截至今日收盘，报373.6港元。
花旗发表研究报告称，港交所业绩表现较好，超出市场预期，主要受到投资及其他收益的强劲趋势所提振，第二季度现货及商品业务收入势头强劲，目前给予港交所“买入”评级，目标价420港元。
大摩认为港交所今年第二季美股盈利2.37港元，按年升15%，高于原预期10%，并认为港股第三季交投持续强劲，维持其增持评级，目标价430港元。
不过高盛发表研究报告表示，现在港交所的投资收益非常波动，如果不考虑投资收益，公司收入及盈利实际上比高盛预计分别低约４％和７％，成本略高于高盛预期。高盛暂时维持港交所“中性”的投资评级，未来12个月目标价为325港元。",2020-08-19 20:37:19,凤凰财经
5,百亿富豪张劲的“抄底”策略失灵？雪松控股旗下雪松信托亏15亿，雪松普惠面临清盘,"出品｜公司研究室（ID：gsyjs8）
文｜刘双霞
2020年8月10日，美国《财富》杂志发布2020年世界500强名单，雪松控股集团（简称“雪松控股”）以412亿美元（约合2851亿元人民币）的营收位列第296位。
值得关注的是，连续3年登上世界500强名单的雪松控股，利润连续下降，总资产也在缩水。另外，雪松控股这两年热衷的金融布局受挫，2019年4月收购的雪松信托亏损15亿元，旗下网贷平台雪松普惠也面临清盘危机。
(image_address=""https://x0.ifengimg.com/ucms/2020_34/0C788B3F212184DAEF64F4C58B5CC6F7444A3F2B_w994_h819.png"")
（数据源自《财富》杂志）
雪松信托2019年亏15亿，不良率翻倍升至28.85%
雪松信托2019年年报显示，2019年营业收入2.64亿元（合并口径，下同），较2018年4.18亿元减少36.84%；营业支出17.41亿元，较2018年32.55亿元减少46.51%。
2019年，雪松信托净亏损15.34亿元。
(image_address=""https://x0.ifengimg.com/ucms/2020_34/B69843B51648C5BF7264C4796ED8EA87E737B43F_w824_h952.png"")
另外，雪松信托2019年不良率暴增。年报显示，根据资产质量五级分类标准，雪松信托2019年不良资产由期初的5.1亿元增至期末的7.89亿元，不良率由11.36%上升至28.85%。
(image_address=""https://x0.ifengimg.com/ucms/2020_34/463ADB079E740C19CD4955E3C3FADCEFFE919CF5_w1080_h251.png"")
雪松信托前身为中江信托。中江信托成立于1981年，原名江西省国际信托投资公司，注册地位于江西省南昌市，2012年更名为中江信托。
在雪松控股收购之时，中江信托已是“爆雷王”。中江信托2017年业绩断崖式下跌，净利润暴跌9成。2018年，中江信托开始密集“爆雷”，先后踩雷凯迪生态、亿阳集团、神雾节能等民企或上市公司，随后卷入金马、银象等政信项目。
在中江信托麻烦缠身之时，雪松控股选择进入。2018年11月，银保监会批复同意雪松控股受让原中江信托71.35%股权。2019年6月，中江信托正式更名为雪松信托，注册资本维持30.05亿元不变。
在收购中江信托的媒体见面会上，雪松控股创始人张劲披露，彼时中江信托有35个逾期项目，本金总规模共计79亿元，涉及投资者2400人左右。
张劲承诺，“我们只占70%的股份，但会承担100%的责任”，“将9个月内解决所有问题项目”。
不过，2020年以来，雪松信托并未按承诺9个月内兑付违约项目，多个违约项目进展缓慢。据媒体报道，6月15日，投资者拉横幅要求雪松信托“还钱”。
“抄底”收购金融资产：大金所曾踩雷辉山乳业，雪松普惠面临清盘风险
作为一家民营企业，雪松控股在金融业务布局上偏爱“抄底”收购金融资产。
除了收购中江信托之外，2019年，雪松控股还收购了大连金融资产交易所有限公司（简称“大金所”）和一家网贷平台。
大金所成立于2011年，是东北地区第一家也是目前唯一一家以“交易所”命名的金融资产交易机构。
在2016年9月，大金所设立“辉山乳业定向融资计划”理财产品，总计发售110期、累计金额达3亿元人民币。不过，2017年辉山乳业资金链断裂产生的债务危机持续发酵，大金所作为融资平台受到牵连，停发新的理财产品。
截至2018年末，大金所总资产为6350.6万元，净资产仅剩2879.6万元，并处于持续亏损状态，2017年亏损4290万元，2018年亏损4238万元。
雪松控股于2019年3月向大金所增资2.3亿元，增资完成后雪松控股持有大金所69.77%股权。据媒体报道，雪松控股增资入股大金所的对价约为6亿元，包括“牵头化解大金所当前已暴露的所有风险”。
另外，雪松控股收购的网贷平台雪松普惠也面临清盘。
雪松普惠前身为正勤金融，创立于2014年，注册地在广州。2019年3月，雪松控股通过旗下全资子公司收购其80%股份，并于当年7月更名为雪松普惠。
截至2020年6月末，雪松普惠累计借贷金额30.48亿元，逾期金额365万元，代偿金额近2亿元。雪松普惠客服人员表示，员工目前正常上班，是否清盘等待公司进一步安排。
不过，2020年8月10日，广州市地方金融监管局副局长何华权公开表示，“广州针对P2P网贷小微平台全面推动出清。截至2020年7月，49家中实现41家全面出清，希望在今年年底之前全面实现清零”。
发迹于股市、房地产业，张劲热衷布局供应链金融
在外界看来，雪松控股的金融布局策略和其创始人张劲的经历息息相关。
张劲1971年11月生于广州，祖籍湖南。他毕业于深圳大学金融系，和腾讯创始人马化腾为同届校友。在2019年福布斯全球亿万富豪榜，张劲排名第413位，财富值46亿美元。
1989年，还是在校生的张劲便投身股市，赚得第一桶金。之后，他撤离资本市场，转向房地产。在地产泡沫破裂之际，他大胆收购烂尾楼，获利颇丰。
雪松控股集团前身创立于1997年。2016年，雪松控股以48亿元控股深市上市公司齐翔腾达，进军化工上游产业。2017年，又以42亿元控股同在中小板的上市公司希努尔男装，进军服装行业。至此，雪松控股发展成为了集地产、金融、化工、贸易、服装、文旅为一体的民营企业巨头。
2017年，雪松控股全年营收2210亿元，成为了广州市最大的民营企业。2018年，雪松控股上榜《财富》世界500强361位。2019年7月位列《财富》世界500强榜单第301位。2020年，排名升至第296位。
不过，值得关注的是，雪松控股近两年净利润在走下坡路。
(image_address=""https://x0.ifengimg.com/ucms/2020_34/F22B8662DFB501DDA51134D59BF5D7A937AF94A4_w1080_h577.png"")
（雪松控股2019年相关数据，源自《财富》杂志）
据《财富》杂志披露的数据显示，截至2019年末，雪松控股的总资产为167.369亿美元，相较于上年末的209.328亿美元，缩水20%。
业绩方面，2017年至2019年，雪松控股净利润连年下滑，分别为10.681亿亿美元、8.447亿美元及1.221亿美元。
显然，雪松控股亟需扩展新的增收渠道。
有了早年在股市和房地产领域的抄底经验，张劲对金融业的布局同样采取了这一策略：在中江信托、大金所危机时抄底收购，在2019年网贷监管收紧时，收购网贷平台正勤金融。
不过，从整体布局策略来看，雪松控股对金融业务的布局由前期的广撒网向供应链金融聚焦。
在金融业务布局上，据媒体披露，此前雪松控股官网信息显示，公司金融方面的业务包含基金管理、互联网小额贷款、融资租赁等多个领域，金融服务企业有润邦财富、利凯基金等。
目前，雪松控股网站的金融业务介绍已做了修改，和金融业务相关的板块只显示：产业投资集团和雪松信托。
(image_address=""https://x0.ifengimg.com/ucms/2020_34/19C2B4CD62E21DBDE504394412B7EE9795046731_w1080_h268.png"")
雪松控股发布的五年规划（2017-2021）显示：重构四大产业，着力发展第五板块社会公益服务产业。六大产业变成五大产业，其中消失的一大板块正是金融。
张劲对此表示：“金融产业不以独立板块的形式出现，并不意味着金融业务会弱化，它在雪松产业体系的重要性反而更加突出。”他要将金融业务全面融入各个产业板块，“化有形为无形”。
张劲曾为雪松信托圈定“供应链金融”布局策略。
2019年年报中，雪松信托新增了中江信托此前未涉足过的供应链领域。在雪松控股接管八个月时间内，雪松信托投向供应链的资产规模合计达38亿元，占其总资产规模的比例为4.02%。
(image_address=""https://x0.ifengimg.com/ucms/2020_34/C89CA6DECFC786736644FF0031BCDF4AD151B194_w820_h749.png"")
雪松控股进驻后，大金所于2019年6月底恢复上线新理财产品，主要即为商业保险理财相关的供应链金融产品。大金所相关负责人接受记者采访时也表示，“大金所未来的业务将聚焦于供应链金融领域，助力东北地区的实业振兴。”
在收购中江信托后，对于未来雪松控股是否加码金融领域布局，张劲曾表示：“我们近期不会再收购任何金融牌照，随着未来产业的发展，会根据具体的变化再做判断。”
公开资料显示，雪松控股还持有广州银行、广州农商行、开源证券的部分股权。不过，2020年年初，雪松控股拟清理掉持有的两家广州本地银行——广州银行和广州农商银行的少数股权，让其持有的金融资产更聚焦于服务主业。",2020-08-19 20:31:33,凤凰财经
