,title,content,pub_time,src
3,又一私募爆雷！B站暴涨150%、基金却跌剩3成 募集资金投向了哪儿？,"原标题：投资B站却巨亏？又一私募爆雷！B站暴涨150%，基金却跌剩3成！募集资金投向了哪儿？是否涉嫌违规承诺？
(image_address=""https://x0.ifengimg.com/ucms/2020_20/4D91111C7C4D6A7602E61B6DE2FE03AC4BFA4A59_w600_h333.png"")
今年五四青年节期间，哔哩哔哩（Nasdaq：BILI；以下称B站）的视频《后浪》在线上刷屏，让这个定位年轻人UGC(用户创作内容)文化视频平台“出圈”，引发全年龄层热议。
5月4日至今，B站股价累计涨幅超过14%；从其2018年3月28日在美上市时间点计算，B站股价已累计上涨超150%。
然而，连日来，券商中国记者收到多位上海投资人反映称：数只号称“投资B站”的私募基金产品却在近期出现巨额亏损——两年过去了，产品到了兑付之时，但投资者却被告知该基金净值仅剩下当初的三成。
这中间发生了什么？
在整个过程中，投资者，管理人基岩资本，代销方恒天财富、东家金服，托管机构国泰君安证券，究竟谁来为巨亏负责？
事件：号称投资B站基金巨亏，净值仅剩三成
事情说回到两年多前。
2017年底，广州基岩资产管理有限公司（以下简称基岩资本）发行“东家—基岩东方价值发现一号”（以下称东方价值一号）和“东家—基岩东方价值发现五号”（以下称东方价值五号）。均是100万起购，认购费为1%，管理费为2%；基金期限为两年，其中一年封闭期、一年退出期，2019年12月4日到期。
从券商中国记者获取的材料看，东方价值一号的产品规模为5100万元；根据基岩资本向投资者出具的电话会议沟通记录，同期成立的东方价值五号总规模为3.6亿元。两只产品一共募集了约4.1亿元。
尽管宣传材料中两支基金并没有表示投向中概股IPO项目。但数位投资人均告诉记者，基金管理人和代销机构都有口头承诺，募集资金将投向B站。
基岩资本的投后报告显示，截至2019年9月30日，东方价值五号基金净值为1.2290元；截至2019年11月29日，东方价值一号净值为1.3103元。彼时，相比初始净值，均有浮盈。
然而，眼见该基金将要兑付的当口，风云突变。
2019年12月3日（基金到期日），基金管理人基岩资本发布《到期清算公告》称，基金所持有仓位已于基金到期日前完成减持，并在2019年12月3日正式启动清算，预计60个工作日左右完成清算。然而，60天清算时间结束后，投资者仍迟迟未能收回本金和投资收益。
今年3月3日，投资人再次收到基金清算说明称，基岩资本力争在3月31日之前完成基金清算，并于4月初完成基金分配工作。但到目前为止，仍有部分投资人告诉记者，“原本早该清算的基金仍然一直没兑付。”
对于出现的清算延期，基岩资本给投资者的情况说明中称：
“
“2019年以来，中美贸易摩擦不断，中概股受到较大的冲击。近期，受沙特掀起石油价格战和新冠肺炎疫情蔓延等‘黑天鹅事件’的影响，美股大盘遭遇了史无前例的4次熔断，基金的投资标的也不可避免地受到影响，使得基金净值大幅下挫。”
这个“下挫”幅度有多大？这时，投资人被告知，截至今年3月31日，东方价值一号基金、东方价值五号基金的净值均为0.315元；也就是说，从去年11月底到今年3月，东方价值一号净值下降了75.96%；而过去半年时间，东方价值五号净值下滑了74.36%。
也就是说，投资人两年前投入的100万元只剩31.5万元。而在这期间，如果从其2018年3月28日上市时间点计算，B站股价已累计上涨超150%；从去年9月至今，B站股价累计涨幅逾110%。
(image_address=""https://x0.ifengimg.com/ucms/2020_20/5A49534843FFDB2EDF36A41D2CF5B4DC52D76AC1_w777_h466.png"")
谁来担责？
在整个产品发售及管理过程中，投资者，管理人基岩资本，代销方恒天财富、东家金服、泛华、普益财富等，托管机构国泰君安证券，究竟谁来为巨亏负责？
当前，基金管理人基岩资本、代销机构、投资者等多方还在不断交涉中，争议的焦点主要如下：
（1）募集资金投向了哪里？
“基金投向B站，为什么会巨亏？”是数位投资人不满的地方之一，并质疑该基金及代销机构违规操作、误导宣传、虚假信批。
目前的基金合同、投后报告中，可以看到，并没有对投资具体标的的表述，而是写着“本基金将通过QDII资产管理计划，投向拟赴美国纳斯达克或纽交所主板市场上市的中国企业”、“以持有美国纳斯达克市场上市企业股票”等更严谨的表述。
但在投资人向券商中国记者出具的东方价值五号的募集材料里，推介信息详细介绍了B站项目；根据投资者提供《东方价值五号基金》二季度报告中，写明该基金主要投向哔哩哔哩IPO份额，但基金合同的投资范围中仅包含收益互换和各类资管产品。
(image_address=""https://x0.ifengimg.com/ucms/2020_20/AB86B723D8E60015D6380B8295147DD26DDC9DB3_w532_h759.png"")
（图片来自投资者提供，下同）
一份代销机构的重点项目推荐邮件里，也称拟投向B站IPO项目。
基岩资本相关负责人回应记者，“基金主要投向B站”不具有可操作性，“在投资者购买公司产品之际，我们也强调基金产品的风险且为维护投资者权益，产品倾向于分散投资。”
“从风控角度而言，除了大宗交易等约定固定收益产品，其余产品倾向于分散投资，美股市场风险大，QDII基金尤甚，不允许投资单一标的。其次，产品标的是Pre--IPO企业，股票发行时间、价格、份额不定，本着提高投资者收益的意愿，对于投资于二级市场的基金超募部分，基金经理选择在股价下行区间，适当地投资其他产品。”上述负责人称。
不过，在另一份投资者提供的落款为基岩资本并加盖公章的承诺函中，基岩资本又称：“东家-东方价值发现一号私募基金的投资标的为哔哩哔哩在美IPO增发股份，除此之外不会投资其他标的。”
(image_address=""https://x0.ifengimg.com/ucms/2020_20/A4007BAA0DE98D0313E8662D42F06E99E22D813B_w433_h578.png"")
此外，该文件还承诺了不低于8%每年的保底收益率。
（2）是否存在“保本保收益”行为？
有投资者告诉记者，在此前购买时，该基金曾承诺主要认购B站在美IPO的股份，并提出了8%的兜底协议。如果标的企业未能完成IPO，则会由担保方以基金年化6%的净收益予以现金补偿。
除了基金合同之外，基岩资本和投资者签订了一个东方价值五号的补充协议，明确约定自基金成立日起12个月内，如标的企业不能完成IPO，则担保方ChinaCornerstoneManagementLimited以基金年化6%的净收益对基金予以现金补偿。同时，如果顺利完成IPO，投资者所获得的年化净回报率将不低于8%/年。若基金未达到保底收益条件，则由担保方以现金予以补足。
(image_address=""https://x0.ifengimg.com/ucms/2020_20/601E5D22844048B55267498B23F647DFF02B843F_w640_h467.png"")
在一份由投资人出具的基金产品推介邮件中，上面写有“因项目作为1+1美股IPO项目，虽然属于权益类，但整体风险可控，由管理人及京东金融做了进一步风险保障，有托底。后续超额收益可期（对标公司为目前市值60亿美元的YY欢聚时代及MOMO陌陌），故作为近期重点推介项目。”
(image_address=""https://x0.ifengimg.com/ucms/2020_20/98BBBEA2C6A47A96E7398605EB53475024F901BF_w363_h557.png"")
基岩资本方面对此的解释则是，在投资者购买产品过程中，公司要求业务人员当面或录音形式告知收益风险，但“产品发行初期，企业员工培训落实未到位，以致运营人员在相关文件中使用不正当用词。合同并无出现上述信息。”
（3）后续兑付进展如何？
近来，上海的数位投资人已经多次赴其当时购买产品的代销机构东家金服“讨说法”——出现基金延期兑付、清算的情况时，为什么却迟迟没有对投资者给出解决方案？
东家金服方面人士向记者解释的情况显示，早在今年年初，基岩资本宣布清算延长时已经获悉情况并成立专门负责推动资金清算的协调小组。
东家金服上述人士称，“2020年1月7日，东家金服曾正式发函件至基岩，要求其尽快向投资人披露最新净值数据、持仓明细、QDII资管计划变现安排、基金管理费用等信息，但未得到明确答复；3月26日，基岩方面向东家金服承诺，要在2020年4月10日之前完成清算应兑付全部本金及收益。然而，到2020年4月2日，基岩副总裁黄明麒到东家进行沟通时突然告知，基岩之前发布的持仓信息和资产净值并不准确，募集资金并未投资于所承诺的投资标的（哔哩哔哩），相关基金的最新实际净值并非此前在2019年12月底所披露的1.3左右，而是在0.3左右。”
东家金服方面称，当前派出协调小组驻场基岩总部追查，向管理人所在的地方监管部门如实反馈相关情况、协助相关投资人报警，组织沟通会。
到目前为止，有上海投资人告诉记者，东家金服方面告知：购买东方价值五号的部分投资人签署了协议，“后续分步返还本金”；但东方价值一号的协议“还没谈好”。
基岩资本上述负责人称，“已与投资人及所有代销机构共同协商了处理方案”；“基岩直销的投资人已经按照兑付方案收到了部分资金，在恒天财富、泛华代销机构购买产品的投资人，陆续收到部分资金”；而东家金服代销渠道，“自行制定其渠道投资者的实际处理方式。”
中基协数据显示，基岩资本成立于2015年8月，注册资本1000万元，备案“东方价值”系列基金共有59只，在官方推介中称，东方价值基金是“我国第一只专注于中概股投资的基金”。据其向美国证券交易委员会（SEC）递交的招股书，截至2019年一季度，基岩资本管理规模为49.48亿元。
对于该事件后续的进展，券商中国记者将持续关注。",2020-05-13 18:45:33,凤凰财经
4,沙特携中东产油国加大减产力度，市场前景究竟如何？国际大行转向看多,"原标题：减产！减产！减产！沙特携中东产油国加大减产力度，市场前景究竟如何？国际大行转向看多
(image_address=""https://x0.ifengimg.com/ucms/2020_20/FC012BF160C28EF483B566E089CE2D607DC35C94_w600_h333.png"")
过剩的国际原油市场再次传来好消息！
沙特表态6月将在此前协议基础上额外减产100万桶/日，科威特和阿联酋也相继宣布加大减产力度，三大中东产油国合计将进一步减产118万桶。
然而，市场对于这一利好消息的反响相对平淡，国际油价继续回调。原油市场的前景究竟如何？接受券商中国记者采访的多数分析人士仍对后市缺乏信心，不过值得注意的是，上周至今油价已经出现一轮明显反弹。
沙特宣布额外减产100万桶！科威特、阿联酋也表明立场
据新华社消息，沙特阿拉伯能源部官员11日表示，政府已经指示沙特阿拉伯国家石油公司（沙特阿美）6月每天进一步减产100万桶原油，届时沙特原油日产量将降至大约750万桶。
沙特通讯社援引能源部声明报道，政府要求阿美公司6月每天再减产100万桶。一名不愿公开姓名的能源部官员告诉路透社记者，这将使沙特6月原油日产量较4月减少大约480万桶。
沙特4月增产原油，日产量一度达到1230万桶。这名官员说，额外减产100万桶以后，沙特6月（原油）产量将是每天749.2万桶。沙特能源部说，额外减产意在鼓励欧佩克和非欧佩克产油国遵守4月减产协议，稳定国际油价。
与此同时，中东产油国科威特和阿联酋也宣布将扩大减产规模。科威特将在原有减产协议基础上，额外减产8万桶/日；阿联酋额外减产幅度为10万桶/日。
受新冠疫情冲击，全球能源需求已经下降了约30%，导致全球原油库存大幅增加。为了支撑油价，OPEC+上个月达成了创纪录的减产协议：将自2020年5月1日起减产970万桶/日；自2020年7月1日至12月减产770万桶/日；自2021年1月至2022年4月减产580万桶/日。此次沙特等中东产油国宣布额外减产，有望进一步改善过剩局面。
原油市场不太买账
受额外减产消息影响，北京时间11日晚国际原油市场一度快速反弹，但之后又很快回吐涨幅、重新走弱，12日延续弱势。截至记者发稿时，加权计算的布伦特原油指数报32.74美元/桶，下跌1.18%，布伦特原油主力7月合约重新跌破30美元；美油市场11日晚走势与布油类似，但12日表现相对较强，6月合约涨幅一度接近5%。
(image_address=""https://x0.ifengimg.com/ucms/2020_20/7F1AB24E9EC1E79B44DBEFB3F4758D571064AA9B_w1080_h2135.png"")
东证衍生品研究院原油高级分析师安紫薇表示，沙特宣布将在6月超额减产100万桶/天，这一决定将使得沙特6月产量降至749.2万桶/天，达到近18年以来的新低。沙特能源部长称，超额减产旨在加速消耗全球的过剩，使市场重新回归平衡，科威特和阿联酋也宣布将分别超额减产8万桶/天和10万桶/天。目前，沙特超额减产仅计划持续一个月，能源部长并未就是否延长表态。他在采访表示，如果市场情况持续好转，将遵循原协议逐步降低减产规模，这也说明沙特目前对于减产并没有表现出过多的热情，此次超额减产的决定或是在美国总统特朗普的施压和自身财政压力的被迫之举。美国总统特朗普自油价暴跌以来一直施压OPEC+减产，上周五沙特国王与美国总统通话后，有消息称美国考虑从沙特撤回爱国者反导系统，超额减产可能是对美国的妥协。此外，在宣布超额减产前，沙特已宣布了一系列提高政府收入和削减支出的措施，包括大幅提高增值税和削减政府工作人员的生活补贴，这些举措表明油价的暴跌导致石油收入锐减以及新冠肺炎疫情的影响使得沙特财政压力与日俱增，提振油价的诉求也在上升。
“从油价表现来看，沙特超额减产的消息没能对油价形成有效的提振，油价在短暂冲高后回落。尽管欧美国家开始逐步解封将促使需求恢复，但原油库存的持续上升表明当前过剩的局面还没有发生根本性的扭转，距离市场再平衡仍有很长的路。此外，多位白宫官员确诊新冠以及韩国的聚集性感染导致市场对于解封可能导致疫情二次爆发的担忧加剧，使得油价短期可能会面临一定的调整压力。”安紫薇说。
国泰君安期货原油研究总监王笑也表示，沙特宣布在减产基础上再次自愿增加100万桶/日的减产，但是此举仍未能让油价产生更多的上行动力，原油价格冲高后快速回落基本回吐所有涨幅。从目前市场情况来看，沙特在最近不断的释放各类政策性利好，希望通过用自身对于原油市场的影响力来影响市场价格走势，从此提前开始减产到大幅提升CP价格，再到昨天宣布再次增加主动减产的产量，沙特可以说为最近的原油市场操碎了心；然而在全球疫情仍在蔓延的情况下，我们看到的仍然是一个非常弱势的基本面，疲弱的需求和高涨的库存都让此前达成的OPEC++的减产利好未能如产油国希望的那样释放出足够的价格拉动作用。
他进一步解释说，在这种情况下我们可以看到原油价格虽然随着欧美的复工复产预期出现了边际利好改善的变化，原油期货价格也出现了非常快速的反弹，但实际上这种反弹的后劲儿是严重不足的，市场仍未迎来非常明确的基本面改善，而最大的问题是全球库存仍在缓慢的增加，如果不能得到有效的控制，全球性胀库的问题将会把原油价格再次打回一个更低的位置，届时产油国将会承受更大的压力。
“单从沙特自己来看，我们可以明确的看到沙特为了应对低油价已经在国内大幅提高增值税并减少开支，但实际上沙特的外储仍然在以一个很块的速度下降，从当前的减产的态度上也可以非常明确的看出来沙特需要一个高油价，然而仅凭沙特自己的努力，这一目标是很难实现的。”王笑认为。
美国还在拖后腿？
在OPEC+明确减产的情况下，美国的动向成为了国际原油市场的重要变量，从目前情况看，美国在强制减产上并没有太大的动作，但企业的自主减产正在持续进行中。
美国得克萨斯州油气监管机构得克萨斯州铁路委员会在5日发布声明说，该委员会三名成员当日投票否决了在得克萨斯州油气行业实施强制性配额减产的建议。该委员会三名成员以二比一的比例决定对美国先锋自然资源公司和欧芹能源公司在此前提出在得克萨斯州实施配产的提议不予考虑。
得克萨斯州铁路委员会主席WayneChristian在会议召开之前就在媒体上公开表示不会支持这一提议。得克萨斯州铁路委员会原定在4月21日就此召开会议并进行投票，但最终决定推迟至5月5日进行投票表决。该委员会在此前举行的听证会，大型石油企业就对配产建议表示反对。得克萨斯州铁路委员会曾在4月14日就配产提议举行听证会。据记者统计，出席听证会和在会前提交立场声明的50余家机构（包括企业、协会和其他机构）中，对配产表示支持和反对的机构数量相当。得克萨斯州铁路委员会的专员RyanSitton此前支持在德克萨斯州进行配产，削减100万桶/日的产量。
实际上，RyanSitton在投票前一天就曾表示，委员会并未做好就强制减产进行投票的准备。在原油价格出现历史性暴跌之际，美国页岩行业仍然分歧不断。
不过，一些企业的自主减产正在发生。据了解，在全球原油行业前景迅速萎靡的背景下，一些美国公司已经关闭了钻井平台，遣散了压裂工人，削减了工作岗位，并在没有政府指令的情况下关闭了油井。数据显示，过去七周，美国油田的水力压裂活动减少了82%，石油钻探活动减少了52%。雪佛龙、埃克森美孚以及康菲石油已经计划在6月底之前减产最多66万桶/日。二叠纪盆地的能源公司Concho已经关闭了4%-5%的产量，并警告称可能进一步减产。
油价上周大幅反弹，高盛转向看多
值得注意的是，5月起OPEC+减产正式实施，而国际油价在上周出现了大幅反弹，美油和布油主力7月合约的周涨幅均超过16%。
(image_address=""https://x0.ifengimg.com/ucms/2020_20/9FE5968F2CDA13788DAF3A9A05A61B677FC40875_w1030_h2056.png"")
5月7日沙特阿美石油公司宣布了6月份原油出口价目，从价格中可以看出，沙特阿美大幅度调高了对欧洲的石油售价，部分品种上调超过了7.2美元。
原油市场逐渐筑底，高盛也对明年的油价表现转向乐观，上调2021年WTI原油价格的预期值至51.38美元/桶，此前预期值为48.50美元。
高盛在报告中称，由于经济活动的封锁以及OPEC+产油国开始减产，石油供给已经开始迅速下滑。与此同时，需求开始从低位反弹。主要由中国经济复苏以及全球发达市场经济体的运输需求增长所带动。该行在提高对WTI原油价格预测值的同时，也提高了对伦敦布伦特原油价格预测值至55.63美元，此前为52.50美元。
不过高盛认为油价在未来几周内不会大幅上涨，其大宗商品负责人JeffreyCurrie表示，美国油价的回升仍需数周时间。尽管自5月1日起，OPEC+产油国开始减产近1000万桶/日，但这难以支撑油价在未来几周走高。
12日A股市场石化类公司整体表现低迷，其中中国石油收跌0.89%报4.43元；最新开盘的美股市场上，能源类公司总体持稳，近期维持窄幅震荡的走势。",2020-05-13 18:43:55,凤凰财经
