,title,content,pub_time,src
6,原油库存空间卡死油价的脖子！全球动用了哪些花式储油方式？,"距离5月交货的WTI期货交割日期还剩1天，
留给华尔街交易员的似乎只有一条路——
卖！全部卖掉！
无论是什么价格，都要平仓！
为啥？
原油库存空间勒死了脖子
新冠肺炎疫情让全球石油需求自由落体式下降，石油生产商们的钻机却没那么容易停下来，OPEC+970万桶/日的减产份额短期来看就是杯水车薪。市场上多出来的原油势必要存储起来，可是存在哪里呢?
一个悲伤的消息——基本没地儿了。
WTI（西德克萨斯轻质原油）期货的实物交割地点在美国俄克拉荷马州的库欣。众所周知，交易的原油往往不在交割地，须先运输至交割地的储油设施里。然而库欣的原油存储空间现在如何呢？
Genscape4月20日报告称，截至4月17日当周，库欣地区原油库存增加至6100万桶，库欣的原油库存总容量约在7800万桶，面临胀库风险。
(image_address=""https://x0.ifengimg.com/ucms/2020_17/A98E3F713E7F44135C27B0855DB69F90B7B91EF5_w718_h300.jpg"")
库欣储油罐
普氏能源估计，全球原油存储能力为14亿桶，但本月底，储量就将达到13亿桶，剩余1亿桶库存剩余空间。按IEA月度石油市场报告统计，3月份全球石油产量降至9920万桶/日，而市场普遍认为当前全球石油需求大约8000-8500万桶/日，每日约1500-2000万桶的供应过剩量。理论上讲，只需约1周时间，全球仅存的1亿桶库存空间便能填满。
储罐库容不够，同时面临疫情带来的物流不畅，存储成本过高，生产商宁愿接受负油价，不得不赔钱让买家拉走。
所以交易员若不平仓，交割了也没有地方囤货，就算费九牛二虎之力找到地方存了或者找到炼厂消化了，运输存储费用比原油本身还贵，何苦？
“卖”，成了做多WTI5月合约交易者的唯一选择。
纽交所20日收盘，WTI价格狂泄到了史无前例的每桶-37.63美元。
(image_address=""https://x0.ifengimg.com/ucms/2020_17/7CB4B6642E9F8D84E8BE8D7220F2D4E7BE540FB7_w1080_h607.jpg"")
来源：CNBC
眼下，对于全球石油贸易商、石油生产商、产油国、买油国来说，火烧眉毛的当务之急都只有一个——
哪些地方能储油？都用起来！
自从3月份OPEC+减产谈崩之后，自由生产和需求减少带来的原油库存告急的消息便屡见报端。日益减少的库存空间，成为当前悬在石油业头上的达摩克里斯之剑。
港口储油罐当然是主要选择之一，但现在几乎全面告急。除了油罐，首先被想到的还有输油管道。
(image_address=""https://x0.ifengimg.com/ucms/2020_17/97E8F9DBB1479C9C85C2A3C14ACA7FF1E4AFBD53_w529_h300.jpg"")
路透社报道称，随着原油供过于求愈发严重，早在3月份，交易商们开始试图将原油储存在管道网络中，直到油价再回升。这已经引发了一些管道公司的担忧。美国一些管道公司要求客户证明，他们通过该公司管道运输的原油有买家或卸货地点。
但显然，当前很多原油找不到买家和卸货地点，管道公司的“要求”形同虚设。实际情况是，美国最大的管道公司PlainsallAmericanpipline的管网系统已经不堪重负。该公司称，大量库存不可避免地使部分地区基础设施达到了储备极限，公司希望石油生产商自愿减产。
管道也不够用了，哪里还能存？不能忘了铁路油罐火车。
(image_address=""https://x0.ifengimg.com/ucms/2020_17/28ABC62385D01558039C4BBB0A146C708B9A1CB2_w1080_h581.jpg"")
据彭博社报道，北美生产商、炼油商和交易商正考虑将多余的石油储存在得克萨斯州、萨斯喀彻温省和马尼托巴省的铁路油罐火车中，俄罗斯也正考虑利用铁路货场储油。业内人士提醒，在原油期货溢价处于历史高位之际，铁路运输的油罐无疑是储存原油的经济选择，但铁路货场可能不在主要的石油交易中心，须考虑和地理位置相关的风险。
陆上的储油空间不够了，还有海上。目前，全球海上浮动储油设施库容也在急剧增长。
在新加坡附近海域，聚集了大量满载原油却无处可去的船舶，这些船舶已经被迫成为了一种浮式存储设施。
(image_address=""https://x0.ifengimg.com/ucms/2020_17/28DE77FFC90B0A1F117561E5A4E6C62CCD649B8C_w1077_h648.jpg"")
图中密密麻麻的红点代表正在新加坡海域漂浮的满载原油的轮船。
据国际船舶网消息，当前全球已经动用60艘超大型油轮（VLCC）进行海上储油，创10年来新高。
(image_address=""https://x0.ifengimg.com/ucms/2020_17/E429CA3308F47DDB7FA434CC656730C107790B64_w500_h351.jpg"")
国际知名航运经纪公司ClarksonsPlatou数据显示，截至上周，全球浮动原油存储量增长了2000万桶，达到1.96亿桶。
需要指出的是，从成本方面考量，把石油存在海上油轮中可能不具有经济性。拿VLCC来说，在沙特一口气抢租25艘VLCC之后，其运价飙涨超过600%，一度突破40万美元/天。
花式储油方式，你pick哪个？
除了上述常规储油方式外，受形势所迫，交易商们还脑洞大开地发掘了不少新式储运方式。
据悉，国内一些民营炼厂已经开始使用一种“软体油罐”来储运石油，价格低廉且处置灵活。记者致电山东潍坊一家包装制品公司获悉，油价暴跌以来，该公司生产的此类产品销量上涨不少，普通罐价格在1500元/个左右，高温罐（可装卸高温油品）约2600元/个，起订数量不限。
(image_address=""https://x0.ifengimg.com/ucms/2020_17/15E76FCCAED69B3DB97D1CEECB54C73F9CF86737_w994_h701.jpg"")
(image_address=""https://x0.ifengimg.com/ucms/2020_17/9ADF68AAF60E7F9729332E00DE22F2F539596DF6_w1080_h741.jpg"")
软体油罐可以装入集装箱或者大型货车中运输，十分灵活。
甚至还有业内人士表示，改造集装箱拉运原油也可以考虑。例如，在废旧集装箱中先铺一层防护塑料泡沫，再把蔬菜大棚用的加厚塑料袋装进集装箱里，灌油即可。
如果真的可行，勇于尝试的企业记得留言给小编，反馈下使用感受~
不少网友也积极贡献脑力，提供了五花八门的储油解决方案。
(image_address=""https://x0.ifengimg.com/ucms/2020_17/AFB5A8C560C6A59AE8EDEF18AB4FB979E1340364_w555_h860.png"")
来源：牛弹琴微信公众号
你能想到的储油方式还有哪些？各位网友请留言，贡献你的智慧！",2020-04-21 21:46:17,凤凰财经
7,一季度税收降幅远超GDP，经济晴雨表失灵？,"(image_address=""https://x0.ifengimg.com/ucms/2020_17/57F77CEB6BA575476634A6744B2BB19C0ECAE719_w640_h360.jpg"")
税收是经济晴雨表，一般来说税收增速与经济增速相匹配，趋向基本一致，但今年一季度税收收入降幅却远超经济降幅。
官方数据显示，一季度国内生产总值（GDP）同比下降6.8%，但税收收入却同比下降16.4%。
辽宁大学地方财政研究院院长王振宇告诉第一财经记者，因为GDP增速是按不变价计算，而税收增速按现价计算，两者口径不同，不能直接对比，需要将GDP不变价格增速转换成现价增速，即以今年一季度GDP总值直接与去年同期总值对比。
据此测算，一季度现价GDP增速约为-3.3%，高出一季度税收收入增速约13.1个百分点，差距仍然很大，不同寻常。
(image_address=""https://x0.ifengimg.com/ucms/2020_17/20B2DA46453A70EA2874CEEAB915D9AA584DB68D_w640_h385.jpg"")
数据来源：国家统计局、财政部
从过去十年全年数据来看，现价GDP增速与税收增速相差最小只有0.3个百分点，最大也不超过7个百分点（2019年现价GDP增速高出税收增速6.8个百分点），去年一季度现价GDP增速仅高出税收增速约2个百分点。那为何今年一季度两者相差如此之大，税收增速远低于经济增速？
中国政法大学财税法研究中心主任施正文告诉第一财经记者，一般来说，税收增速与经济增速相匹配，趋向基本一致。因为中国税制是以间接税为主，间接税跟经济增长十分密切。通常情况下，经济高速发展，税收收入也会大幅增长，反之则下滑。
“所以今年一季度税收收入大幅下滑首要原因还是经济下滑。但税收下滑幅度远高于经济下滑程度，最主要的原因是受政策性减税影响。”施正文说。王振宇也持相同观点。
去年史无前例的2万亿元减税降费政策中，包括第一大税种增值税降低税率等举措在当年4月1日之后实施，这就导致去年增值税减税等政策在今年一季度也会产生影响，造成减收。
而为了应对新冠肺炎疫情冲击，今年2月份以来国家出台了一揽子新的减税降费政策，包括对疫情防控重点保障物资生产企业给予税费优惠，对受疫情影响较大的行业企业给予税费减免，加大鼓励社会捐赠的税收优惠力度，加大个体工商户和小微企业税收优惠力度等。
新旧减税降费政策直接导致财政减收。国家税务总局总审计师王道树曾公开表示，今年1~2月份，全国减税降费共计4027亿元。随着4月按季申报大征期的到来，今年出台的减税降费新政策都会纳入统计核算范围，企业享受减税降费的统计规模也会进一步扩大。
财政部数据显示，一季度，第一大税种国内增值税同比下降23.6%，第二大税种企业所得税同比下降12.8%。
“增值税收入大幅下滑，除了受经济影响外，新旧减税主要政策都涉及增值税，因此政策性减收也很明显。而企业所得税下滑除了受企业利润下滑之外，减税也是原因之一。”施正文说。
按照国务院预计，今年新出台减税降费政策，加上去年减税降费政策翘尾，可为企业减负1.6万亿元。这是连续第四年减税降费规模超过1万亿元，而且今年力度仅次于去年。
最近，中共中央政治局会议又提出“推进减税降费”。施正文认为，这意味着除了落实好现有减税降费政策，未来还可能会有新的针对性的减税降费举措出台。
除了减税之外，为了帮助受疫情影响的企业纾困解难，税务总局发文称，对受疫情影响生产经营发生严重困难的企业特别是小微企业，税务机关要依法及时核准其延期缴纳税款申请，积极帮助企业缓解资金压力。
延期缴纳税款需要经过省、自治区、直辖市税务局批准，但最长不超过3个月。各地积极依法帮助经营困难企业延期纳税，也导致一季度税收减收。
比如，深圳税务局已经为3000多户企业办理了延期缴纳税款，涉及税款接近17亿元；青岛二、三月份为439户纳税人办理了延期缴纳税款25.35亿元；北京已批准延期缴纳税款7.31亿元。
财政部国库支付中心主任刘金云近日表示，一季度受新冠肺炎疫情影响税基减少，以及为支持疫情防控保供、企业纾困和复工复产采取减免税、缓税等措施，拉低全国财政收入增幅约10个百分点。巩固减税降费成效，增值税翘尾减收效果持续释放，拉低全国财政收入增幅约5个百分点。
此外，他表示，导致一季度税收收入下降还有一个原因，即上年末延至今年初缴纳入库的税收收入同比减少。
施正文也表示：“像缓税等因素都可能导致上年末税收延至今年初缴纳，这是个临时性因素，每年都有，情况也不一样。”
王振宇认为，一季度税收增速明显低于经济增速，说明了减税政策真正落地，在疫情当前政府将更多的收入让渡给企业等市场主体，帮助企业等渡过难关。
刘金云表示，展望二季度，受国际国内新冠肺炎疫情形势发展变化影响，财政收入仍呈下降态势。但随着我国生产生活秩序加快恢复，复工复产正在逐步接近或达到正常水平，财政收入降幅会逐步收窄。",2020-04-21 21:38:51,凤凰财经
8,美股三大股指低开逾1% 石油股集体下挫,"凤凰网财经4月21日讯，美股全线低开，道指跌1.21%，纳指跌1.17%，标普500指数跌1.36%，美股石油股集体下挫，墨菲石油跌近4%，康菲石油跌近5%，贝利石油跌近7%。
(image_address=""https://x0.ifengimg.com/ucms/2020_17/052088A68AE86C38FB83D5922D9C7BAE08B38722_w1125_h674.jpg"")
周一原油史诗级的暴跌吓坏了投资者，周二WTI原油6月主力合约也难逃暴跌“魔咒”，一度暴跌逾40%，最低报11.89美元/桶。截至发稿，WTI原油6月合约和布伦特原油6月合约均跌逾20%，WTI原油5月合约仍处于负值区间。
原油暴跌引发了人们对能源行业遭受更大损失的担忧，并进一步打击了美国经济。
投资者继续关注新冠病毒大流行以及美国重新开放经济的计划。有迹象表明，纽约疫情高峰或已经过去。佐治亚州周一推出了重启经济的积极计划，呼吁许多企业最早在周五重新开放。
Nationwide投资研究主管MarkHackett表示：“市场动荡依然激烈，因为新闻基调的微妙变化推动了投资者情绪的急剧变化。市场希望上周爆发最严重的疫情已经过去，因此市场急剧上涨。随着重启经济计划引发激烈的辩论，这种乐观情绪可能会面临阻力。”
公司消息
【苹果开启近十年来最大服务版图扩张】
苹果周二表示，它将在数十个新市场中扩展其AppStore、AppleMusic和其他服务，这是近十年来苹果服务业务版图最大的一次扩张。苹果将在20个新的国家/地区推出AppStore、iCloud、ApplePodcasts和AppleArcade，还将AppleMusic服务新扩展到52个国家/地区。
【苹果计划到2021年3月份前将iPhone的产量提高4%】
据日经新闻，苹果通知其供应商，计划在截至2021年3月的12个月内生产约2.13亿部iPhone，较上年同期增长4%。
【可口可乐一季报优于预期】
可口可乐第一季度每股收益51美分，好于市场预估的44美分；一季度营收为86亿美元，预期82.82亿美元，去年同期为80.24亿美元。可口可乐表示，由于新冠病毒大流行而导致的消费习惯改变将对本季度的业绩产生重大影响，但希望下半年出现反弹。
【LabCorp获得FDA授权可在家检测病毒】
LabCorp已获得美国食品药品监督管理局的紧急授权，可在家进行新冠病毒检测。该测试要求消费者填写调查表，然后获得医疗保健提供者的批准。
【洛克希德&middot;马丁称疫情影响刚刚开始】
洛克希德&middot;马丁公司最新一季度的每股收益为6.08美元，高于市场普遍预期的每股5.80美元，营收也高于分析师的预期。该公司表示，新冠病毒对其各项业务的影响刚刚开始，并且对2020年业绩的最终影响尚不清楚。
【Jeffries将亚马逊股价目标上调至2800美元还能再涨近20%】
Jeffries将亚马逊股票价格目标从每股2,300美元上调至2,800美元，这也意味着较周一收盘价2,393.61美元还能再涨近20%，Jeffries称亚马逊继续受益于冠状病毒的爆发，并且该公司的高利润率业务增长更快。
【星巴克与BeyondMeat合作将在中国推出人造肉产品】
星巴克宣布，将于本周在中国推出一份新的基于植物蛋白的人造肉午餐菜单。该菜单将从周二开始在中国星巴克分店发售，产品主要由美国“人造肉第一股”BeyondMeat生产。
【IBM财报不及预期云业务收入大涨近20%】
周一盘后，科技巨头IBM发布了2020财年一季度财报，报告期营收下降3.4%至175.7亿美元，略低于市场预期的176.2亿美元。盈利11.8亿美元，同比下降约25%，EPS1.31美元。财报最大的亮点是云业务营收达到54亿美元，同比上升19%。与一众巨头类似，IBM今日也撤回了全年营收指引。",2020-04-21 21:32:23,凤凰财经
