,title,content,pub_time,src
0,这家国有险企公开招聘总经理和3名副总经理，特别强调业绩薪酬双对标,"(image_address=""https://x0.ifengimg.com/ucms/2020_31/52A81E9B6503A5BFE9072A70501A5D5A9E074188_w600_h333.png"")
24日晚间，国资委网站挂出一则招聘信息：
“根据经营改革发展需要，现面向社会公开招聘鼎和保险公司经理层岗位职业经理人。”
在岗位和职责部分，招聘公告给出了1名总经理、3名副总经理的职位。
一时间，保险圈乃至金融圈都被吸引了，国企系统内招聘如此高职务的管理人员，而且同时放出几个名额，并不多见。
(image_address=""https://x0.ifengimg.com/ucms/2020_31/41DC016C8BF34981E14B6CDE03DA835937E25FAF_w829_h529.png"")
鼎和保险是谁？
鼎和财产保险是一家全国性财产保险公司，为南方电网公司二级子公司，股东包括南方电网、广东电网、广西电网、云南电网、贵州电网、海南电网以及南网财务公司。
鼎和保险总部设在深圳，有自己的大楼，目前已成立15家分公司，业务分布全国14个省区市。
鼎和保险自2008年5月成立以来，表现可谓低调而务实。公司设立后的第二个完整年度就实现盈利，后持续盈利近10年。经过几轮增资，公司目前注册资本金30.18亿元。
近年来，鼎和保险资产、保费规模稳步增长，截至2019年末，鼎和保险总资产101.87亿，实现利润6.32亿，利润在财险行业排名前十。
鼎和保险现任党委书记、董事长王晓锦来自南方电网，曾任中国南方电网有限责任公司审计部副主任、广西电网公司总会计师，2011年6月起出任鼎和财险董事，随后历任总经理、董事长，主持公司全面工作。
去年，鼎和保险原总经理王嘉君调回南方电网，致使公司总经理一职出现空缺。目前，公司有两位副总经理。
总经理或需承担开拓任务
据悉，新任总经理将全面负责鼎和保险公司的日常经营管理工作。其中被重点提及的任务包括，负责鼎和保险公司整体的市场开拓和经营管理工作。
业内人士表示，鼎和保险开业12年，曾经依托南方电网的优势稳步发展，但作为一家全国性保险公司，扩大业务范围是势在必行的选择。近年，鼎和保险逐步寻求南方电网辖区外的省份设立分公司，面向全国、走向市场，这意味着，新任职业经理人或许需要在业务开拓方面做出成绩，证明能力。
在对总经理的要求上，包括具有良好的政治素质、职业道德、专业素质，熟悉熟悉国家宏观经济政策、保险监管政策及保险法律法规，了解保险行业发展动态和方向，具有丰富的企业管理知识与经验。
此外，总经理还应具有突出的治企能力。有良好的战略思维、法治理念和创新意识、竞争意识，懂经营、会管理、善决策，能够处理复杂局面，具有丰富的职业经历和突出的经营业绩。
资格条件方面，总经理年龄一般不超过50岁，应当担任过财产保险公司副总经理以上职务高级管理人员2年以上，或者担任财产保险公司(上年度保费规模行业排名前10名)分公司总经理以上职务高级管理人员5年以上；或者担任金融监管机构相当管理职务5年以上；或者有其他足以证明具有拟任职务所需知识、能力、经验的职业资历的，都可以过来一试，对特别优秀的人才可适当放宽。
3名副总经理分别负责销售管理、两核(即核保核赔)管理、内部管理兼财务管理工作。
其中，一名副总经理兼总会计师负责组织编制执行预算、财务收支计划，合理配置使用资金，健全经济核算制度，强化成本管理，进行经济活动分析，提高经济效益。
副总经理需要有相关的经验，应当从事金融工作8年以上或者经济工作10年以上，工作业绩突出，有大型财产保险公司相关任职经历者优先；还应当具备相关任职经历，比如担任财产保险公司分公司总经理以上职务高级管理人员3年以上；或者担任财产保险公司部门总经理3年以上；或者担任金融监管机构相当管理职务3年以上；或者有其他证明具有拟任职务所需知识、能力、经验的职业资历。如果应聘副总经理,可同时选报两个岗位。
南方电网公司在招聘中表示，公司党组坚持以市场化改革为方向，建立了“市场化选聘、契约化管理、差异化薪酬、市场化退出”的职业经理人管理机制，实行“业绩与薪酬双对标”，实现“市场来市场去”，着力激发经理层干事创业活力。这意味着，本次鼎和保险的招聘也将按照市场化规则进行。",2020-07-26 07:57:44,凤凰财经
1,超预期！6月份结构性存款压降1.01万亿，产品“量价齐跌”,"(image_address=""https://x0.ifengimg.com/ucms/2020_31/68A1AAEE3C1DBD3DFC022D6440C0457527156127_w600_h333.png"")
结构性存款作为保本理财的优质替代品，向来备受银行“青睐”，但其存量规模从今年一路上涨到近期调头直下，先升后降走出倒V型反转。
券商中国记者根据近日央行发布的数据统计，今年前四个月全国中资银行结构性存款余额分别增加了11945.47亿元、234.89亿元、8512.08亿元、4719.5亿元，但近两个月却出现大幅下滑，5、6月份分别下降3009.61亿元、10109.2亿元。
(image_address=""https://x0.ifengimg.com/ucms/2020_31/3DFAA50204CC110087410BFE9F5BDDA9ECA2101A_w1016_h326.png"")
此前，多家股份行已经收到了监管部门的窗口指导，要求压降结构性存款规模，在今年年底前逐步压降至年初规模的三分之二。若以1月份结构性存款余额10.79万亿元为标准，预计到年底压降规模为3.56万亿。目前来看，银行压降结构性存款的速度超出预期，将会带来怎样的影响？
结构性存款加速压降超预期
为对冲疫情对宏观经济造成的影响，一季度央行加大了货币信贷的投放力度，市场资金利率一路下行，短贷、票据、短融等融资工具的成本下降明显，而银行理财产品、结构性存款等仍保持着较高利率，因此企业“左手贷款，右手理财”的套利行为逐渐兴起，推动了结构性存款大增。
券商中国记者发现，近两个月监管对结构性存款的整治主要集中于中小银行的单位结构性存款，5月、6月中资中小银行单位结构性存款分别下降2065.26亿元、6103.9亿元，分别占当月下降总额的68.62%、60.4%。
央行在附注中解释称，中资大型银行指本外币资产总量大于等于2万亿元的银行，包括工行、建行、农行、中行、国开行、交行和邮政储蓄银行。换言之，其他银行均属于中资中小银行。
今年以来，波动幅度最大的是中资中小银行的单位结构性存款，与个人存款不同，单位存款又称“对公存款”，包括企业存款、财政存款、基本建设存款、机关团体存款、部队存款等项内容。
单位结构性存款的净增额远远大于个人，背后折射出的便是企业的资金空转现象。近两个月以来，结构性存款的下降在一定程度上反映了企业套利空间的收缩，这在票据融资的规模变化上也有体现。
中银证券分析人士指出，6月票据融资规模下降2104亿元，为2018年4月以来首次减少，环比大幅少增3690亿元，这主要与监管打击企业“票据贴现—购买结构性存款”套利行为有关。
中金固定收益研究分析员陈健恒表示，此前预计在监管窗口指导压降的情况下，9月末需要压降超2万亿元，到年底共需压降约5万亿元。但6月份的压降速度已经超预期。考虑到结构性存款3～4月份增加较多，且结构性存款平均期限在150天左右，因此9～10月份到期的量如果不续的话，9月末完成目标难度并不大。
国信证券经济研究所金融业首席分析师王剑则认为，如果把结构性存款压缩，可以压降银行负债成本，对银行经营压力有较大帮助。即使银行把腾出来的成本如数转让给借款人，降低贷款利率，那么也有助于企业缓解财务负担，改善经营，最终银行也会受益。
券商中国记者注意到，5月份以来，银保监会针对银行结构性存款套利行为已开出3张罚单。其中，中信银行舟山分行存在贷款资金转存结构性存款及定期存单、虚增存款业务、发放用途不真实贷款等问题；光大银行苏州分行存在贷款转为结构性存款、贴现资金转存保证金后滚动申请银行承兑汇票的行为。
根据银保监会此前下发的有关通知，2020年银行机构市场乱象整治“回头看”工作要点包括：以通过融资政策便利获得的贷款购买银行理财产品、结构性存款、大额存单和发放委托贷款等进行资金“空转”套利；结构性存款不真实，通过设置“假结构”变相高息揽储或进行套利等。
收益率走低致套利空间收窄
在监管出击下，6月份结构性存款产品呈现“量价齐跌”的状态。
一家股份制商业银行的理财经理告诉券商中国记者，现在银行的结构性存款产品最高利率普遍在3%左右，与之前相比会偏低一些，还挂着的三四款产品额度都非常紧张。该理财经理坦言，现在结构性存款的规模受限，但属于保底理财，想要购买的人不少，所以很难抢到。
据融360大数据研究院不完全统计，7月6日-7月12日期间，人民币结构性存款发行量83只，较上周增加了15只，这是6月初以来结构性存款周发行量首次环比增长；平均期限为144天，平均预期最高收益率为3.77%，与上月持平。
从不同类型银行来看，国有银行结构性存款平均期限为158天，平均预期最高收益率为3.53%；股份制银行结构性存款平均期限为129天，平均预期最高收益率为4.01%。而在6月22日-6月28日，国有银行和股份制银行的结构性存款产品的平均预期最高收益率为3.46%、4.29%
中金固定收益研究报告指出，企业结构性存款规模的下降除银行在监管指导下主动压降有关，还与套利空间压缩有关。6月份银行执行结构性存款压降的力度比较大，且价格也有所下调，呈现“量价齐跌”的特点。
除缩量1万亿元以外，从收益率来看，6月发行的结构性存款产品平均预期最高收益率从上月4.54%大幅下降了57bp至3.93%，跌破4%。
此外，在结构性存款利率下降的同时，由于6月央行主动引导货币市场利率上行，带动企业融资利率上行，企业融资购买结构性存款的套利空间（以结构性存款平均最高收益率-6个月AAA企业短融收益率估算）从5月份280bp左右下滑至160bp左右，套利空间已经大幅压缩。
监管加码之下，结构性存款的产品设计也越来越规范。上述理财经理表示，以前还有两档收益率的产品，但现在基本都是设置三档的。此前，有部分结构性存款产品将浮动收益率的波动区间设计较窄，以此来“保证”投资者收益率，但现在更多的是设置三档收益率或宽幅收益区间。
压降过程中，部分结构性存款或向短期大额存单转移。数据显示，在企业结构性存款规模下降的同时，6月份企业定期存款增量较过去4年同期平均值多增了1808亿元。
中金固定收益研究报告指出，估计6月份压降的部分结构性存款或转化为1年以内的大额存单。对于银行而言，化解存款流失最为直接的办法就是把结构性存款转化为定期存款，包括大额存单等。但大额存单可以承接的量预计有限，后续银行负债端可能面临一定压力。
中信证券首席固收分析师明明表示，短期来看结构性存款的压降部分很可能会转移到一般存款，对中小银行不利。除此以外，一般性存款难以完全实现短期内对结构性存款的有效替代，结果很可能反映为部分银行的负债缩表。长期来看，银行结构性存款压降可以一定程度上打击高息揽储行为，缓解银行经营压力，利好债市，也有助于实体经济的健康发展。",2020-07-26 07:54:40,凤凰财经
2,医药龙头获两百多家机构调研，透露高壁垒药物最新动态,"原标题：医药龙头获两百多家机构调研，透露高壁垒药物最新动态！这些公司中报净利大幅增长
近一周机构调研个股数量有70多只，丽珠集团列成为调研机构数量最多的股票。
证券时报&middot;数据宝统计显示，近一周以来机构调研个股数量有70多只。从调研机构类型来看，近一周证券公司调研相对最广泛，调研54家公司，即超七成上市公司调研活动有券商参与；基金公司和阳光私募调研数量次之，分别调研41家和27家公司。
丽珠集团获227家机构调研
丽珠集团成为近一周调研机构数量最多的股票之一。数据显示，合计有227家机构调研了该公司，包括31家基金公司、45家证券公司、41家私募、14家保险公司、7家海外机构等。在调研纪要中，公司提到微球是高壁垒药物，目前集采对于微球暂无太大影响。机构问及该药业的提问也较多。比如有机构问到，公司的微球方向，在国内企业中处于明显的领先位置，能深入讲一下吗？比如从产品立项研发和监管沟通能力，产品产业化能力等方向。
公司表示，丽珠的微球平台目前技术积累和产业化经验都比较前沿，我们也还在积极加速。
丽珠在进行项目立项时，选择有竞争优势的项目，主要根据集团的六大领域方向，扬长避短。主要把握市场、技术的方向，尽可能避免风险。
还有机构问到，目前微球在研品种的产业化问题已经完全解决了吗？公司表示，微球平台经历近10年的技术经验积累，目前产业化问题不太大。
公司还回答了下半年的工作安排。公司表示，丽珠是集研发、销售、生产为一体的综合企业。所有工作围绕销售、研发和生产三大块来开展。
下半年第一重要的任务是销售方面改革落地和实现销售收入的增长预期。第二是研发方面的工作，快速推进各个在研项目，完成新项目的探索和立项，不同新产品进入不同的研发阶段，确保按照公司计划获批，持续提升研发团队建设。
其他较多机构调研的个股还有聚飞光电、康弘药业、兴齐眼药等，均获得了50家以上机构调研。聚飞光电获得99家机构调研。在调研纪要中，有机构问到公司如何看待MiniLED市场，未来是否会对公司的业绩产生积极影响？
公司表示，MiniLED是公司拓展的一项新业务，也是公司未来重点投资的方向之一。MiniLED、MicroLED顺应高品质图像及节能概念，未来将产生巨大的市场需求，公司的MiniLED模组采用COB或COG两种方案。
还有机构问到，公司申请公开发行可转债投资在哪些方向？
公司表示，本次公开发行可转债募集资金将用于惠州LED产品扩产项目和惠州LED技术研发中心建设项目。其中LED产品扩产包括背光LED、车用LED及显示LED的扩产;技术研发中心的研发内容有“MiniLED模组制造技术”、“MicroLED模组制造技术”、“QD至LED封装技术”、“生物识别IRLED封装技术”、“VCSEL激光器件封装技术”、“深紫外LED封装技术”和“车用大灯LED封装技术”等。
这些公司中报净利大幅增长
数据宝统计显示，近一周机构调研的上市公司中，牧原股份、宏达新材、金溢科技、*ST盐湖、得润电子、博创科技、长安汽车等上半年净利有望大幅增长或者大幅扭亏。其中，牧原股份上半年净利超过107亿元，去年同期亏损1.56亿元。
宏达新材预计上半年净利700万元至1000万元，同比增长657.17%至981.67%。金溢科技预计上半年净利35160万元至38830万元，比上年同期增长680.76%至762.25%。
本周A股市场全线回调，上证指数下跌0.54%，深证成指下跌1.37%，中小板指下跌2.34%，创业板指下跌1.3%。
梳理发现，近一周机构调研股本周平均上涨超3%，表现强于大盘。涨幅最大的是创意信息，本周累计上涨超51%。其他涨幅较大的个股还有翰宇药业、康芝药业、鲁西化工等，累计涨幅均超过10%。下跌的个股中，金科文化跌幅最大，超过10%。
(image_address=""https://x0.ifengimg.com/res/2020/6378847773DB2A36A44CD45740878148E79AFF8D_size51_w662_h710.png"")
声明：数据宝所有资讯内容不构成投资建议，股市有风险，投资需谨慎。",2020-07-26 07:29:00,凤凰财经
3,超10亿美元遣散费！全球最大油田服务公司斯伦贝谢将裁员2.1万人,"(image_address=""https://x0.ifengimg.com/ucms/2020_31/9BE6046C1BB94AFD78CC6136EC57C190F11E923D_w640_h360.jpg"")
据美国广播公司新闻网报道，全球最大的油田服务公司斯伦贝谢（Schlumberger）24日宣布，将裁员2.1万人，并将支付超10亿美元的遣散费。斯伦贝谢公司当天公布的第二季度财报显示，公司收入下跌约三分之一，亏损高达34.3亿美元。公司预计，大部分离职员工的遣散费将在今年下半年支付。报道称，全球经济增长放缓给能源行业带来压力，过去五年中，已有200多家石油生产商申请破产保护，而新冠肺炎疫情加剧了行业整合。今年以来，原油价格下跌33%，天然气价格下跌17%。（国际组汪雍茜",2020-07-26 07:08:18,凤凰财经
