,title,content,pub_time,src
0,陆金所旗下公司在港拿到证券交易牌照,"近日，陆金所控股旗下公司陆国际（香港）有限公司（以下简称“陆金所香港”）正式获得香港证监会批复，取得第1类证券交易牌照。
结合此前已获得的香港证监会第4类牌照（就证券提供意见）、第9类牌照（提供资产管理），陆金所香港可正式向香港地区所有客户提供线上投资理财和财富管理服务。与此同时，陆金所控股旗下服务香港居民的线上财富管理平台“陆香港”APP预计于8月上线。
“陆香港”APP将上线
根据香港当地监管要求，想要在香港地区提供财富管理/资产管理服务的金融机构，都必须持第“1、4、9”三类牌照，即第1类证券交易牌照、第4类就证券提供意见牌照和第9类提供资产管理牌照。
“此次获取牌照最重要的地方在于我们将直接在香港落地业务，上线后的陆香港APP，将引入港币投资理财产品和更多美元投资理财产品。”陆金所香港业务部负责人蔡华表示。
除此次获批的第1类牌照，陆金所香港此前已申请并获得香港证监会第4类和第9类牌照，可以提供投资建议、并向专业投资人提供资产管理服务。此次获得第1类牌照，意味着陆金所香港可以正式提供个人“账户建立、操作交易、资产持有”等服务。
陆金所方面表示，在香港抢滩注册第“1、4、9”类牌照，布局香港财富管理市场，正是看重香港市场的重要战略意义和重大机遇，抓住金融支持粤港澳大湾区建设的契机。
积极布局海外市场
香港已然是陆金所控股国际化业务的第二站。2017年，陆金所控股正式出海，旗下陆国际（新加坡）金融资产交易所有限公司获得新加坡金融管理局“资本市场服务牌照（CMSL）”并正式开业，之后又于2019年2月再次获批新加坡金融管理局　“认可市场操作者（RMO）”牌照，获准正式向新加坡本地居民提供服务。
陆金所是中国平安旗下重要金融科技平台之一。经过9年发展，陆金所已从最初的单纯线上理财平台发展成为涵盖线上财富管理、普惠金融以及机构金融的金融科技公司。2018年陆金所控股完成C轮融资，投后估值达394亿美元。
近年来，为适应监管和市场环境，陆金所的业务因市场变化几经调整，2015年将P2P（网贷）业务剥离到了平安普惠。2019年，由于中国互联网金融行业进入合规发展的强监管周期，陆金所配合监管“三降要求”转型，压缩网贷业务。
6月19日，中国平安总经理兼联席CEO谢永林在陆家嘴论坛上表示，陆金所控股已明确“金融科技公司”战略定位，“将通过2F2C（连接金融机构和C端客户）路径，帮大众理财，实现财富保值增值，满足大众对美好生活的向往；通过2F2B（赋能金融机构和企业）路径，赋能中小金融机构，进一步解决中小微企业融资难题”。",2020-06-24 09:49:43,凤凰财经
1,内测视频号、推出新App，微博短视频连续出招,"布局短视频多年的微博，没有放过任何一个强化视频业务的机会。6月23日，北京商报记者发现，微博开始内测视频号和独立短视频App“星球视频”。与微信一样，微博视频号也是采用邀请制，但是微信视频号是类似于抖音的视频入口，属于功能型。微博视频号是针对视频作者的扶持计划，提供产品服务和商业变现等一系列服务。
从上线微博故事、增设视频专区，到内测视频号和短视频独立App“星球视频”,微博一直在视频赛道赶路，不过相比头部的短视频平台始终有一段差距，在重视视频化的背后，微博的商业化压力也不能忽略。
(image_address=""https://x0.ifengimg.com/ucms/2020_26/0F5B36F02B9D1C8C6BD47B52984F792B981B43BE_w1304_h1392.jpg"")
同名不同义
在微信视频号内测数月后，微博也打出了同样的概念。
按照微博视频的官方介绍，视频号已经开启内测，采用分批邀请制，正式上线时间在7月初。微博视频号计划，是微博针对优质视频作者推出的一项扶持计划，其中包括账号成长、产品服务及商业变现等服务支持和权益。
据悉，微博将持续扩大测试范围，并选择合适的时间点全面上线。在内测阶段，微博用户满足两个标准之一，即可获得加入微博视频号计划的资格，即成功投稿自制视频内容（1分钟以上）不少于1条，或最近一年发布原创小视频内容（一分钟以下）不少于5条。
北京商报记者与多个微博用户交流得知，经常在微博上发布视频内容的用户，很容易符合条件”。目前已有不少微博用户收到视频号内测的邀请，加入该计划的微博用户的账号左侧会标注视频号勋章，首页会显示最新视频，用户还可在最新视频下催更。
相比之下，微信的视频号功能性更强，位于微信发现页面的朋友圈入口下，视频号分为关注、朋友、热门三栏，用户也可以根据地理位置信息浏览视频内容。
因为同叫视频号，微信和微博难免被拿来比较。“他们都是针对短视频创作者的，但微信视频号有很强的流量导入的意义。微博视频号看起来更像是创作者后台，微博的视频内容入口也更分散。从关注度上看，微博将扶持计划命名为‘视频号’，有可能是想蹭热度”，比达分析师李锦清认为。
在回答微博为何在微信之后推出“视频号”的问题时，微博相关人士对北京商报记者表示，“视频是微博的长期战略，此次推出视频号计划，主要是立足于微博本身社交媒体平台的优势，完善其中视频消费体验，加强对视频创作者的服务能力”。
他进一步说，“微博和微信都在探索在短视频市场上发力的机会，这表明视频已经成为主流内容消费形式，而且拥有广阔的发展前景，对视频作者来说是个利好，微博将继续发挥平台自身优势为视频作者提供差异化服务，提升服务质量”。
(image_address=""https://x0.ifengimg.com/ucms/2020_26/2B2F17882D2AAF1A111B7793E1DE0601422FB963_w1296_h1636.jpg"")
直奔短视频
除了视频号，微博还同步宣布，“星球视频”App正式开启内测。
北京商报记者发现，目前该款App已经在苹果应用商店上线一个月，不过尚未在小米、华为等安卓应用商店出现。根据苹果应用商店信息，星球视频支持高清投屏、具有全局小窗模式、支持视频后台播放。
对比其他短视频产品，星球视频有强烈的微博风格，仅支持手机和微博登录。在星球视频首页仅有推荐、关注两栏，如使用微博账号登录，用户在关注栏中可以浏览，已关注博主的视频内容，像一款整合了微博视频内容的独立短视频App，等于给微博视频设立了一个独立的应用入口。
对比七麦数据的榜单和预估下载量信息，官宣内测给星球视频带来了直接利好。截至北京商报记者发稿，星球视频在苹果应用商店的免费娱乐榜单104位，而在6月22日15时，星球视频的排名仅为761位，6月22日至今，星球视频的预估下载量也一路飙升。
近年来，微博从不避讳自己在视频业务上的野心，不仅上线了垂直类产品微博故事，增设视频专区、发力vlog（影像网络日志），还曾推出数款独立的短视频应用。
来自微博的数据显示，今年3月，微博平台上活跃PGC视频作者的规模接近100万，日均发布量相比去年年底增长超过20%，500多名视频作者收获了100万以上的新增粉丝。向微博视频社区投稿的PGC视频作者，日均发布视频数量相比去年年底增长超过50%。与此同时，微博UGC视频的日均播放量相比去年年底增长50%。
(image_address=""https://x0.ifengimg.com/ucms/2020_26/65EF28947F8CBFCAB36A250FA01AB66DD2D0091A_w960_h564.png"")
商业化压力
其实，不论从头部互联网企业的布局，还是第三方数据来看，视频尤其是短视频都已经成了各家争夺的流量高地。
根据第45次《中国互联网络发展状况统计报告》，截至2020年3月，我国短视频用户规模7.73亿，占网民整体的85.6%。对比各垂直行业，短视频在用户规模、用户总使用时长等方面也增幅明显，微信等头部互联网企业也将短视频业务视为未来船票。
流量为王，头部互联网企业押宝短视频的目的很明确，就是变现。
这一点，在微博视频号的扶持内容中可窥一二。按照微博的规定，月投稿通过量不少于2条或月发布原创小视频不少于5条，且月总播放量不少于5000，即可优先解锁一系列进阶权益，其中第一项是加入“引力计划”，此计划可帮助博主获得更多视频广告分成。
根据QuestMobile数据，2019年头部媒介竞争格局发生变化，广告年收入500亿元的企业有今日头条、手机淘宝、微信，微博属于100-500亿元阵营，但排在拼多多、抖音、美团、京东、58同城之后，是该区间广告收入同比增长率最低的一家。
微博2020年一季度财报显示，营收3.23亿美元，同比下降19%；归属于微博的净利润为5210万美元，同比下滑65%，2019年同期为1.5亿美元。
李锦清直言，“广告变现是互联网最成熟的商业化手段，但现在移动互联网市场竞争激烈，微博营收的主要来源又是广告，所以微博一直在强化视频业务，因为短视频不光是未来的社交形式，也是当下非常重要的广告载体”。
微博相关人士在谈及视频发展时也提到了商业化，他告诉北京商报记者，“视频号计划推出后，预计微博对于视频作者的服务能力将有显著提升，同时，微博社交媒体平台的属性将帮助视频作者更好的积累社交关系，并为视频作者带来多元化的商业变现模式”。
北京商报记者魏蔚（图片来源：App截图、QuestMobile）",2020-06-24 09:49:34,凤凰财经
2,BATH掘金万亿新基建风口：百度巨资砸向AI新基建,"尽管距离首次提出已经两年之久，但“新基建”今年以来突然成为了热门词。而伴随着新基建的“破土动工”，包括BATH（百度、阿里巴巴、腾讯、华为）在内不少科技公司也开始加大新基建领域的布局。
6月19日，百度宣布，未来十年将继续加大在人工智能、芯片、云计算、数据中心等新基建领域的投入。预计到2030年，百度智能云服务器台数将超过500万台；未来5年，预计培养500万AI人才。就在一周前，百度还首次公布了自己的AI新基建版图。
阿里则在今年4月宣布未来三年布局包括云操作系统、服务器、芯片等在内的新技术、新基建；5月，腾讯同样宣布将加码新基建布局，并随后首次公布AI新基建“一云三平台”架构。华为则持续在5G、云、AI、工业互联网、数据中心等领域发力，参与新基建建设。
巨头混战下，新基建格局初显。那么接下来，它又将如何进一步演变？它的致胜要素是什么？
(image_address=""https://x0.ifengimg.com/ucms/2020_26/09BCC3E5B9FDC74F391064174D76E6A4B4792751_w500_h270.jpg"")
抢滩新基建
目前，新基建主要涉及一些高科技领域，如以5G、物联网、人工智能、云计算、数据中心等在内的信息基础设施，以深度应用互联网、大数据、人工智能等技术支撑传统基础设施转型升级的融合基础设施，以及支撑科学研究、技术开发、产品研制的创新基础设施。
风口之下，包括BATH在内的科技巨头们也早有所动。不过从目前来看，各家也有自己的侧重点。
百度早在2010年就开始人工智能技术布局，2012年宣布将成立深度学习研究院，后陆续发布百度大脑和阿波罗计划、推出AI芯片等，可谓开启国内人工智能领域的先河。
如今，百度正在依托包括百度大脑、飞桨、智能云、芯片、数据中心等在内的新型AI技术基础设施，推动智能交通、智慧城市、智慧金融、智慧能源、智慧医疗、工业互联网和智能制造等领域实现产业智能化升级，目标直指中国新基建AI服务最大提供商。
阿里巴巴则以阿里云为起点和支撑。2017年，阿里巴巴成立达摩院，宣布致力于探索科学未知，同年推出结合城市管理、工业优化等全局能力为一体的ET城市大脑，2018年成立平头哥半导体有限公司并于次年推出玄铁910及含光800AI芯片，但阿里的优势和着力点依然在云计算业务上。
腾讯目前的新基建布局同样从自身擅长的社交领域出发，推出腾讯云、腾讯会议、企业微信等产品。不过近日腾讯亦宣布将加大投资，并提出包括腾讯云、算法平台、服务平台及开放平台的“一云三平台”架构。
华为的出身是网络设备商，因此在布局新基建的时候更偏重在5G端，包括参与制定5G标准、供应5G模组设备等。同时，华为提出新基建的核心是建设数字基础设施，其亦推出鲲鹏、昇腾等计算芯片，在数字生态上均有布局。
“国内几家互联网巨头在数字化转型方面也都各有布局，但侧重点各有不同，”中国国际电子商务中心研究院副院长邱琼表示，“从未来走势看，这几家互联网巨头都各有优势，同时各有侧重，不论最终谁为赢家，但赢家一定是能解决好技术与业务的协同归一化问题。”
落地成熟期？
新基建无疑将带动巨大的投资。
赛迪研究院电子信息研究所《“新基建”发展白皮书》对新基建相关领域带动的投资进行了估算。其中，预计2025年5G全产业链相关投资将超过5万亿元，人工智能核心产业规模超过4000亿元，工业互联网带动相关投资超万亿元。此外，到2022年，大数据中心将带动相关投资超3.5亿元。
投资是一方面，另一方面是产业成熟度的问题，它也决定了巨头解决“技术与业务协同归一化”的赢面。何谓技术与业务协同归一化？“也就是说数据产业链和产业价值链能实现良好耦合，最后形成新的经济形态。”邱琼指出。
经历了数次起伏、近年来开始提速的人工智能，无疑将成为更容易落地的领域。早在去年，便有多位业内人士在公开场合判断，人工智能已进入应用落地期，相关应用场景也正在加速落地。
无疑，百度正是这一协同过程非常好的观察样本，随着今年以来新基建的提出，百度也形成了自身的AI新基建版图。
“未来十年，智能经济将成为中国经济的新标签。而新基建则是让智能经济火箭加速升空的燃料舱。”百度创始人、董事长兼CEO李彦宏指出，“新型的AI芯片，便捷高效的云服务，各种应用开发平台、开放的深度学习框架、通用人工智能算法等，正在成为这个时代新的基础设施，推进千行百业的智能化转型。”
据百度方面介绍，目前百度大脑对外开放250多项领先AI能力，开发者数量超过190万，日均调用量突破1万亿次，语音、人脸、NLP、OCR调用量国内领先；百度自主研发，也是国内首个开源开放、技术领先、功能完备的产业级深度平台飞桨，目前服务企业8.4万家，发布了超过23万个模型数量。
百度智能云数据中心则覆盖10个地区，拥有100T级别带宽近千个边缘节点，位于国内公有云第一阵营。6月19日，百度宣布加大新基建投入，预计到2030年百度智能云服务器台数超过500万台。这意味着百度的数据中心能够提供更加强大的计算能力，是当今全球可统计的top500超级计算机算力总和的7倍。
此外，百度还推出国内自主研发的AI芯片昆仑和鸿鹄，并在前沿技术布局上推出云上量子脉冲系统、核心自主可控的百度超级链XuperChain等。
而这些底层技术布局的目的，都是为了落地。据介绍，百度的AI技术目前已在智能交通、智慧金融、智能客服与营销、智慧医疗、智能汽车、智慧能源、智能制造等领域进行应用。
在新基建重要的融合基础设施——智能交通方面，百度Apollo依托百度领先的AI能力，接连中标重庆、合肥、阳泉等地车路协同新基建项目，ApolloRobotaxi自动驾驶出租车服务也已在长沙全面开放试运营。第一季度，知名研究公司NavigantResearch将百度Apollo列为全球四大自动驾驶领域领导者之一。
百度智慧城市则已经逐渐落地北京海淀、重庆、苏州等城市，成为新一代城市智能基础设施，让城市变得更智慧。例如，北京市朝阳区早在前几年便与百度合作建设依托于百度智能云技术开发的智慧朝阳城市管理系统，城市管理者可借此理解城市布局与产业发展，并基于技术手段给出相应的治理方案。
“对于百度而言，我们既是AI基础设施建设者，也是AI技术及应用创新引领者和推动者。”百度CTO王海峰表示，“以百度大脑、飞桨、智能云等为代表的AI平台，已经成为智能时代的重要基础设施，正在帮助国家社会发展实现经济效益和社会效益的同步提升。”
但不光是百度，其他巨头的布局也同样值得关注和分析。目前，阿里巴巴旗下的达摩院XG实验室、平头哥半导体有限公司等的最新研究成果将率先应用在阿里云下一代数据中心，包括“飞天”云操作系统、“含光800”芯片、“神龙”服务器、高性能低延时网络、大计算系统集群等核心自研技术，将在云数据中心大规模部署。
在人工智能领域，腾讯则建立了优图实验室、AILab、微信人工智能实验室等多个AI实验室。华为则依靠5G领域的绝对优势，向芯片、AI、云等技术能力延伸。
应用前瞻
互联网企业丰富多样的商业模式，为AI新基建应用场景落地提供了更多可能。尤其是在今年新冠肺炎疫情期间，多家公司技术应用落地表现突出。
今年2月17日，新冠疫情期间，教育部“国家中小学网络云平台”正式开通。它也是面向全国近1.8亿中小学生、1千万老师的居家平台，免费供全国各地小初高师生使用。鲜为人知的是，这一平台运行在百度智能云上。这也意味着，突如其来的疫情令百度成为保证“停课不停学”的主力军。
据了解，百度在接到需求的第一时间，迅速组建了重大专项保障团队，包括十多个产研团队，连夜部署，仅用七天时间就完成大量基础云资源准备和调试工作，确保国家中小学网络云平台在2月17日正式上线。
疫情期间除了“停课不停学”保障外，百度的AI技术还落地在方方面面。比如，百度智能外呼平台可提供流动人员排查、本地居民排查及回访、特定人群通知三大场景的外呼服务，在多个城市及地区投入使用，截止4月，外呼总量达500万次；百度AI测温方案在多个火车站、机场等公共场所落地，其非接触、可靠、高效且无感知的方式快速测量体验，能够实现人流密集处的快速筛选。
阿里巴巴达摩院则联合阿里云，针对新冠肺炎临床诊断研发了一套全新AI诊断技术，可对新冠疑似案例CT影像做出判读，分析结果准确率达到96%，时间不超过20秒，大幅提升诊断效率。
不仅是疫情期间，技术应用的落地也在其他很多领域落地开花。如腾讯云AI与华星光电合作，在制造液晶面板的检测环节利用AI代替人工，将检测环节的效率提高了5倍至10倍。
而百度的AI技术也在包括智能交通、智能汽车、智慧金融、智慧城市、智慧能源、智能制造等多个领域落地。
从各大巨头进入的领域可以看到，尽管大家都在新基建这一赛场上竞争，但细分赛道却是大不相同，百度凭借人工智能的抢跑优势及多年积累，AI新基建无出其右，从底层到应用层均有全面布局，阿里专注发力云计算，以此进行延展布局，腾讯更偏重自身业务所在的应用领域，华为则以5G为起点进行发力，新基建的人工智能领域很难构成完全竞争关系。
“各家在自身所处领域提供人工智能能力输出，结合自身优势给出相应的解决方案，”有业内分析人士指出，“但最终还是需要看各家具体的落地情况。”
(作者：穆岚）",2020-06-24 09:49:29,凤凰财经
3,恒生指数高开0.51%突破25000点大关 腾讯再涨近1%破500关口,"凤凰网港股|投资者对美国经济重启信心增强，隔夜美国三大股指集体收涨，尤其科技股表现强劲。港股早盘获得提振，恒指高开0.51%报25034，国企指数高开0.46%报10039点。
腾讯高开0.92%，报502港元，突破500港元关口。
梁渊表示，外围市场活跃港股周二小幅高开，市场关注疫情和全球经济恢复情况，惟市场流动性宽松支持港股反弹，盘中A股上涨支持港股升幅扩大，市场做多意愿增加。现外围欧美市场走强给港股正面牵引，加上疫苗研发推进顺利缓和市场担忧情绪，不过端午假期临近资金或有分歧，因此，料港股近期持续稳好，可留绩优股。
免责声明：本文不代表凤凰网港股立场，不作为投资依据。投资有风险，入市需谨慎。",2020-06-24 09:34:13,凤凰财经
