,title,content,pub_time,src
0,欧佩克+会议在即，俄罗斯却不愿商谈？油价命悬一线,"欧佩克+会议在即，俄罗斯却不愿商谈？油价命悬一线，阻碍欧佩克+达成减产协议的分歧在哪？一图汇总此次减产角力各方表态。截至19:31，美、布两油直线跳水转跌，现分别报25.08美元/桶和32.68美元/桶。此前分别涨9%、6%。克里姆林宫声明称，俄罗斯总统普京表示，未计划与美国总统特朗普和沙特方面就原油问题进行会谈。
(image_address=""https://x0.ifengimg.com/ucms/qr/2020_15/2656F200F21770BA8D948FD96292CBCBF5E333EE_w1133_h5291.png"")",2020-04-09 19:57:09,凤凰财经
1, 跟谁学CEO回应做空质疑：收入为何大增400%？巨额现金流向哪里？,"导读：中概股近期屡屡被做空。
先有瑞幸咖啡被浑水做空，紧接着爱奇艺、跟谁学也被做空。
4月8日下午，跟谁学召开媒体沟通会，创始人兼CEO陈向东针对近期外部对跟谁学的质疑，作出了解答。
陈向东说：“跟谁学会不会再去融资？不会的，我们不缺钱。”
来源丨21世纪经济报道（ID：jjbd21）
记者丨王峰
编辑丨林虹
(image_address=""https://x0.ifengimg.com/ucms/2020_15/71E5F9C9A318E5E08D1E09E53BA1E54B75C33C60_w1080_h617.jpg"")
中概股陷入多事之秋。
先是瑞幸咖啡自爆财务造假，紧接着爱奇艺遭遇做空，好未来自爆内审时发现内部员工虚增收入。在此之前，跟谁学也曾被做空。
一时间，互联网新业态公司集体陷入危机，尤以风头正劲的在线教育所受质疑最大。
4月8日下午，跟谁学召开媒体沟通会，创始人兼CEO陈向东针对近期外部对跟谁学的质疑，作出了解答。
“今天早上起了床，我就发现有很多关心我的朋友给我发了很多微信，说‘我们相信你，你们扛得住。’我就感到这个事情的方向有点不一样。”
(image_address=""https://x0.ifengimg.com/ucms/2020_15/53397BF9396013E0BB22A3F594CF5A72A87AC698_w700_h1400.jpg"")
（图：陈向东朋友圈）
内审让一家公司更健康
对于中概股危机，陈向东说，“我觉得不管是新东方还是好未来，它们都是好公司，但是好公司是不是就没有任何问题呢？时间会做出更好的验证、洗礼，也可以通过内审让一家公司变得更加健康”。
陈向东担任新东方执行总裁时，新东方亦曾遭遇浑水做空，股价大跌。
陈向东回忆：
“2012年，浑水抓住了新东方的一个把柄，导致新东方股价两天连续暴跌。
浑水通过一个投资人问新东方CFO，因为当时的CFO对公司业务并没有那么了解，他对投资人回答说新东方没有任何加盟业务，但事实上新东方业务有一些加盟业务，占营收比重大概千分之几，但不管怎样是有加盟的。
当时浑水把录音放在报告首页，来证明新东方说假话。
但是通过长时间的审查发现新东方没有问题，算是浑水对中概股攻击的一次失败。”
业绩过于亮眼遭做空
现在，被做空的轮到了跟谁学。
4月3日，跟谁学在中概股公司中率先发布了经审计的2019财年年报。
报告显示，于2019财年，跟谁学的净收入为21.149亿元人民币，同比增长432.3%，现金收入为33.582亿元人民币，同比增长412.6%。
(image_address=""https://x0.ifengimg.com/ucms/2020_15/8FAE54FEA9C0249C0291E14F4E04F5E9C10A493C_w700_h445.jpg"")
（陈向东在媒体沟通会上）
其实，这些数据在今年2月随2019年Q4财报公布后，立即引来做空机构GruzzlyReseach发布了针对跟谁学的做空报告。
做空报告体现了市场中很多人的疑问：
在线教育行业普遍亏损，跟谁学没有品牌、没有广告、没有营销，APP下载量不高，怎么可能不是一家作假的公司？
陈向东说，我们在2014年11月发现有一个员工在入驻老师的业绩上特别好（当时跟谁学的业务是教育020，吸引老师入驻平台），我们的内部审查团队就开始审查，发现这个老师虚假注册。
陈向东说：
“当时我们的分公司总经理跟我讲，这个员工是大学老师加入到咱们的，他就是为了做业绩，所以做了假动作，他业绩非常好，咱们能不能放他一马，警告处分就可以了？当时很多人替他求情，我说宁愿公司不做，也不能作假，当时就把这个大学老师开除了。”
是否通过关联公司做高利润？
做空报告中提到几家跟谁学体系外的公司，与跟谁学的地址相同，进而怀疑跟谁学通过关联公司来做高利润。
陈向东回应，这与跟谁学的业务转型有关。跟谁学2014年成立后，只进行了一轮融资，但却处处出击，成立了5个2B业务的事业部。
“2015年开始跟谁学非常艰难，2016年底时，账上大概发工资都发不出来了。当时我自己给了公司1000万美金，让公司能够活下来。
另外，我们做了个决定，把这5个2B业务要么关掉、要么拆分，而这些公司拆分出去的时候都是以独立公司出去，让它融资，并且让拆分公司的人尽可能成为大股东。”陈向东说。
当时5个事业部关掉了3个，拆分出去2家公司。
一家是北京百家视联科技有限公司，产品名称叫“百家云”，实际控制人为原百度大数据部总监，后加入跟谁学的李钢江。
“跟谁学在这家公司没有持有任何股份，跟谁学为了支持它活下去，不但没有跟它收钱，还给了300万启动资金。”陈向东说。
第二家是北京百家云图科技有限公司，对外的名称叫“天校”，实际控制人为原新东方助理副总裁，后加入跟谁学的邓弘。
“这家公司在拆分出去之后仍然是同样的，为了支持这家公司活下去，我个人给了他们700万，公司给了他们300万。他们一度找不到办公场所，当时跟谁学还有办公场地，我们以相当优惠的价格让他们支付我们一定房租，仅此而已。”陈向东说。
被做空报告质疑为跟谁学做高利润的还有北京优联环球教育科技有限公司，其产品是家长社区“家长家”，创始人熊骁以前是跟谁学北京分公司总经理。
“我发现他是很有想法的，就跟他聊做点什么事情，我觉得家长这个群体是值得做的。所以我说我个人投资，我个人拿所有的资金，让他做一家公司，然后他说这家公司要不要给你51%股份？我说我不要，我最多只要10%。因为会用到跟谁学的资源，所以跟谁学占股30%，其他都是你和团队的。跟谁学帮你提供3年房租，同时，如果你要用跟谁学的技术，向跟谁学支付一定的费用。”陈向东说。
跟谁学盈利之谜
(image_address=""https://x0.ifengimg.com/ucms/2020_15/A2BD735B3430132414140E9B7589A030DDED1ADC_w1024_h683.jpg"")
（图片来源：陈向东微博）
做空报告还指出，与竞品相比，跟谁学的百度指数不高、微信指数也不高，但收入和利润却高于竞品。
陈向东介绍，2019年头部在线教育公司现金净流出可能都在20亿甚至25亿以上，而跟谁学去年经营现金的净流入是近13亿。这可以理解为跟谁学在市场上的投入比其他公司少了很多。同时，跟谁学截至2019年12月31日有6400多员工，而其他头部公司人数都是1万多人。这又节省了一定的薪酬成本。
为什么跟谁学能够盈利，而其他在线教育公司没有？
陈向东说：
“跟谁学不是靠融资活下来的，跟谁学是在弹尽粮绝的时候，我作为创始人拿出钱来才活下来的。可以坦率的讲，一个公司花的是自己的钱，和一个公司花的是别人的钱，人的行为是完全不一样的。你会告诉每一个伙伴，要把每分钱花到极致状态。”
跟谁学让外界看不懂的地方还有流量来自何处。
陈向东说，“2018年时我们确实有一波微信红利，沉淀了很多流量，那些流量曾经有1个亿的用户，那些用户为我们迅速把跟谁学聚焦，起到了大的作用。但是我也必须承认，到了2019年各家都是一样的，每家都可以做投放，这就是为什么跟谁学2019年第三季度的市场投放量已经是去年的9倍，第四季度的投放量大概是去年的8倍。”
“大家都在担心跟谁学的获客成本问题。但是到了今天这个状态，获客成本恰恰不是跟谁学担心的问题，因为外部获客成本，最终市场一定是趋于一致的。任何从外部掏钱买的东西，你有钱能买，别人也能买，各家都是一样的。但是流量买来之后，通过你的主讲环节、辅导环节、销售环节，通过内部运营环节、技术体验环节，最后留存是有天壤差异的。”他说。
到2019年底，跟谁学有27亿多现金，但被质疑现金额与利息对不上。
陈向东介绍，“跟谁学上市融资2亿美元，但发现这2亿美元我不需要了，我为了防止我们团队骄傲和用这2个亿瞎做事，于是把2亿美元的75%存到花旗银行，存了3年的保本长期，世界上很少有公司这么做，我这么做的原因是我们对公司有信心，我们不需要钱，所以大家可能认为这跟利息对不上。”
跟谁学成立至今，只进行过A轮5000万美元融资，这导致其上市前，创始团队融资股份比例超过83%。
“跟谁学会不会再去融资？不会的，我们不缺钱。”陈向东4月8日说。",2020-04-09 19:56:04,凤凰财经
2,警报频响，今年会有多少只A股被“开除”？,"警报频响，今年会有多少只A股被“开除”？
年报季，退市警报频频响起！
4月1日，*ST保千发布公告，上交所对公司股票作出了终止上市的决定，公司成为新证券法实施以来第一家退市A股公司。
ST锐电近日公告称，预计公司股票将因股价连续20个交易日低于股票面值，触及终止上市条件，公司股票将于4月14日开始停牌。
有专家预测，2020年A股退市公司总数将超过20家！
市场人士普遍认为，新证券法赋予证券交易所更大的退市自主权，有利于引导市场化、多元化的退市机制。同时，科创板推出后，严标准、简流程，实行真正意义的“一退到底”，其退市力度和效率均将大幅提升，这也将引导A股构建更为有效的退市机制。
26家公司面临暂停上市风险
业绩持续亏损仍然是导致上市公司可能退市的重要原因。
中国证券报记者统计，目前仍然有10家公司处于暂停上市状态，其中包括乐视网、金亚科技、千山药机等。
仍处于暂停上市公司状态的公司
(image_address=""https://x0.ifengimg.com/ucms/2020_15/E81CD709E019418EA69F5F07FEE40F1E202B8EBC_w436_h180.png"")
（数据来源：wind）
从目前来看，这些公司经营业绩普遍堪忧，2020年退市的风险极高。
比如乐视网，4月3日，公司发布公司股票暂停上市进展暨存在终止上市风险提示公告称，公司2019年未经会计师事务所审计的归属于上市公司股东的净利润约为-112.82亿元，归属于上市公司股东的所有者权益约为-143.29亿元。公司2019年年度报告披露后，公司股票存在被深圳证券交易所终止上市的风险。
值得注意的是，2020年，暂停上市的上市公司规模有望进一步扩大，wind数据显示，根据2019年业绩快报以及年报数据，有26家*ST公司因为续亏可能暂停上市。
26家可能被暂停上市的公司
(image_address=""https://x0.ifengimg.com/ucms/2020_15/13991925FD6373A8020B7650640E3C6ADE4A940F_w557_h481.png"")
来源：Wind
同时，ST板块的阵营也在扩大中。截至目前，主板非ST板块中，已有超过70家上市公司业绩预告显示2018年和2019年连续亏损，其中拉夏贝尔、飞乐音响等公司已经公告可能被实施退市风险警示。
“面值退市”进程加速
2012年，我国A股市场首次引入“面值退市”标准：上市公司A股股票连续20个交易日（不含停牌交易日）每日收盘价均低于面值（我国A股股票绝大多数面值为1元），将终止上市。
武汉科技大学金融证券研究所所长董登新对中国证券报记者表示，“面值退市”将垃圾股或僵尸企业的退市决定权，完全交由投资者“用脚投票”，不需要任何理由，也不需要任何解释，实现真正的“市场化”。
2019年就有近10只A股通过投资者“用脚投票”被“面值退市”标准无条件地逐出市场。
中国证券报记者梳理，截至4月9日收盘，A股有72家上市公司股价低于2元，其中天广中茂、*ST刚泰、梦舟股份等30余支个股股价不足1.5元。
例如，天广中茂4月9日收盘价仅有0.99元，*ST天马只有1元。大多数低价股也都问题缠身，比如*ST刚泰，公司2018年度财务报告被众华会计师事务所出具无法表示意见的审计报告。
随着监管加强，一些问题公司即便不触及连续亏损、“面值退市”等标准，也难以侥幸过关。
ST东海洋4月8日公告称，截至公告日，公司最近三十六个月内累计受到深交所两次公开谴责，根据《深圳证券交易所股票上市规则》规定，“上市公司最近三十六个月内累计受到深交所三次公开谴责的，深交所有权决定终止其股票上市交易”，公司股票交易存在可能被终止上市的风险。
董登新表示，在新证券法+注册制的市场环境下，上市公司要更加敬畏法律、诚信守法，财务造假的难度、成本及风险将数倍加大，投资者也会更加理性地行使“用脚投票”的权利。充分市场化的“面值退市”标准有利于大幅提高A股市场优胜劣汰、优化资源配置的功能。
董登新预测，2020年，A股市场至少将有20只垃圾股或僵尸企业退市。
退市制度有望进一步强化
“未来退市制度会越来越严格，A股投资者对于退市的接受程度也会越来越高，”前海开源基金首席经济学家杨德龙表示，退市的公司大多数是问题公司，这些公司的退市会让投资者更好地坚持价值投资，去做好公司的股东。
董登新认为，新证券法赋予证券交易所更大的退市自主权，有利于引导市场化、多元化的退市机制。同时，科创板实行真正意义的“一退到底”，严标准、简流程，其退市力度和效率均将大幅提升，这也将引导A股构建更为有效的退市机制。
上海海能证券投顾分析师欧阳小智表示，“面值退市”已经成为近两年A股退市的主要渠道，并且趋向常态化。纵观全球市场，美国近20年退市率高达5%以上，而A股近10年整体退市率仅在0.2%左右，从市场优胜劣汰机制来看，显然还有较大的改善空间。
金融市场开放是大势所趋。2020年金融机构外资持股比例逐步放开，先进的资本定价模型引进将驱使A股更为成熟。同时，机构主导市场最近两年愈发明显，这也从侧面印证了市场对劣质公司退市的接受程度。
欧小智指出，相较于境外交易所，A股退市数量和比例依旧偏小。“保壳”现象、流程缓慢以及事后监督等方面不足依旧制约市场机制的有效发挥。中国资本市场未来除了加大优质资源供给之外，还要加快出清劣质存量，存进资本市场更好地发挥优化资源配置的作用。",2020-04-09 19:55:52,凤凰财经
3,【主力资金】资金抢筹最凶的RCS概念股出炉，4股上亿资金扫货,"两市主力资金全天净流出58.9亿元，RCS概念再掀起涨停潮，多股资金流入上亿元。
A股三大指数今日集体高开，午后指数稳步走高，创业板指领涨，截至收盘，创业板指数上涨1.65%，盘中一度站上2000点大关。涨停个股逾百只，个股总体涨多跌少，两市合计成交6532亿元。行业板块多数收涨，RCS概念股再掀涨停潮，彩票、医疗器械、特高压板块涨幅居前，氮化镓、石油开采、稀土永磁等板块跌幅居前。
两市主力资金全天净流出58.9亿元，其中沪深300成份股净流出16.52亿元，中小板净流出24.82亿元，创业板净流入2119万元。
申万28个行业今日有10个行业主力资金净流入，18个行业净流出。医药生物行业资金流入27.34亿元，流入居首，行业指数涨幅2.71%，居行业涨幅榜首位。传媒行业资金流入20.12亿元，行业指数涨幅2.25%。非银金融、计算机两个行业资金流入超5亿元，商业贸易、公用事业分别流入超2亿元。
今日电子行业流出资金高居榜首，净流出58.96亿元，行业指数微跌0.65%。机械设备行业资金流出9.57亿元，化工行业净流出8.59亿元，有色金属、国防军工、纺织服装、地产等行业流出金额超5亿元。
RCS概念涨停潮多股资金流入超亿元
个股方面，主力资金流入超亿元的有34只，其中医药生物行业占9只。资金流入金额最高的东方财富，流入金额7.6亿元，盘后公司披露年报及一季度业绩预告，其中年报净利18.31亿元，同比增长91%，一季报预计盈利8.2亿元-9.2亿元，同比增长112%-138%。流入居第二位的仍是互联网金融股同花顺，净流入金额4.27亿元，股价涨停。
今日医药股反弹，包括贝瑞基因、景峰药业等十几只个股涨停，消息面上，美国接受中国口罩标准，4家企业出口获批。从资金面看，此前资金持续流出的呼吸机概念鱼跃医疗今日流入金额最高，净流入3.97亿元，人福医药流入2.53亿元，三友医疗、恒瑞医药流入均超2亿元，药明康德、和佳医疗、浙江医药、鲁抗医药等流入超亿元。
今日RCS概念再掀起涨停潮，包括神州泰岳、吴通控股等十几只概念股涨停。从资金面，二六三流入金额最高，为1.66亿元；天源迪科流入1.57亿元；中信国安、省广集团流入超亿元；银之杰、号百控股、吴通控股、三五互联等流入超5000万元。
(image_address=""https://x0.ifengimg.com/ucms/2020_15/0269DAF1F93BFCF06488275D69BA50DF0189E524_w399_h801.jpg"")
今日有61股资金流出超亿元，其中电子行业占21股。以岭药业流出金额5亿元，流出最高，公司股价昨日涨停，今日冲高回落获利资金出逃。
贵州茅台资金流出3.77亿元，另一只白酒龙头五粮液流出2亿元，两只白酒龙头均高开低走，五粮液跌幅一度超1.5%。
今日资金又开始出走科技股，歌尔股份资金流出3.76亿元，华天科技、海康威视、中兴通讯等流出超3亿元，立讯精密、欧菲光、TCL科技、通富微电流出超2.5亿元，华胜天成、纳思达、蓝思科技等流出超2亿元。
(image_address=""https://x0.ifengimg.com/ucms/2020_15/57967E156C27485C468820177D4280BD50C8DC3F_w812_h1142.jpg"")
人工智能龙头科大讯飞尾盘流入资金居首
尾盘主力资金净流出6.3亿元，其中创业板流入8421万元，沪深300流出5.8亿元。尾盘12个行业资金净流入，有26个行业净流出。医药生物行业尾盘流入3.21亿元，计算机、传媒、汽车等3个行业尾盘净流入超亿元。尾盘有6个行业资金流出超亿元，电子行业尾盘资金流出3.26亿元，非银金融行业流出2.36亿元，电气设备、家用电器、化工、房地产等行业尾盘流出超亿元。
个股方面，尾盘无一个股流入超亿元。流入最高的是人工智能概念龙头科大讯飞，净流入9034万元。东方财富、高鸿股份尾盘流入超6000万元，三友医疗、中国国旅、浙大网新、创意信息等尾盘流入超4000万元。
尾盘也无一个股流出资金超亿元，流出最高的是口罩概念股道恩股份，流出额9016万元，公司昨日披露去年营收翻倍，今年一季度净利增逾九成。万科A、复星医药尾盘流出超6000万元。
(image_address=""https://x0.ifengimg.com/ucms/2020_15/E849FE6D12CDD011E519B3486329BC50396B70E9_w764_h1130.jpg"")",2020-04-09 19:48:45,凤凰财经
4,普京称未计划就原油问题进行会谈 油价2分钟内跳水8%,"财联社4月9日讯，国际油价直线跳水，美、布两油直线跳水转跌，现分别报25.08美元/桶和32.68美元/桶。此前分别涨9%、6%。稍早前，克里姆林宫声明称，俄罗斯总统普京表示，未计划与美国总统特朗普和沙特方面就原油问题进行会谈。
(image_address=""https://x0.ifengimg.com/ucms/2020_15/B05B9458563DB92ACCD2FE47BD11A485E19AAF4D_w665_h304.png"")
欧佩克代表表示，欧佩克+正就减产15%-17%进行讨论，但沙特和俄罗斯仍未能就减产基线达成一致。
据塔斯社报道，俄罗斯能源部称，俄罗斯准备好减产150万桶/日。",2020-04-09 19:44:25,凤凰财经
5,“榨菜”们频创新高，低位大消费股名单来了！最高涨超60%,"原标题：“榨菜”们频创历史新高，低位大消费股名单来了，最高看涨超60%
大消费板块牛股成群，部分低位股未来能否跑赢大盘？
大盘依然处于低位，一批股票近期却创出历史新高。证券时报&middot;数据宝统计显示，3月20日以来，剔除次新股后有49只股票创出历史新高。大消费板块牛股成群，合计贡献了32只股票，占比近7成。有分析人士表示，大消费板块抗风险作用在本轮行情中得到凸显，而低位的大消费板块龙头品种，有望在未来跑赢大盘。
大消费板块牛股成群
涪陵榨菜又创历史新高了。今日涪陵榨菜小幅低开后持续震荡上扬。截至收盘，该股大涨7.23%，收报33.09元，为近期创出的又一历史新高。除了涪陵榨菜，食品饮料行业可谓牛股成群。以海天味业为首的食品股中，包括洽洽食品、桃李面包等11只股票3月20日以来创出了历史新高。
(image_address=""https://x0.ifengimg.com/ucms/2020_15/CB5803D00DDA72F89F2C17681F8DBE9A10F0201B_w401_h658.png"")
医药生物行业牛股数量更多，18只个股近期创出历史新高。龙头企业比如迈瑞医疗、长春高新、恒瑞医药等。
食品饮料和医药生物均被认为隶属于大消费板块，具备较好的抗风险作用。整体来看，大消费板块占创新高个股榜单比例较高，加上其他行业的家家悦、新希望、珀莱雅等个股，占比近7成。从涨幅方面看，美诺华、司太立等医药股4月以来均涨超15%，领衔医药行业，洽洽食品涨超13%领涨食品饮料股。
(image_address=""https://x0.ifengimg.com/ucms/2020_15/AD4CAC9B2F4C50C1DC6656CBC10D0356629B1546_w503_h898.png"")
机构扎堆推荐的相对低位消费股
分析人士指出，在市场环境未完全稳定的情况下，大消费板块更容易获得市场关注。而尚处于相对低位的大消费板块龙头品种，有望在未来跑赢大盘。
数据宝统计显示，隶属于大消费板块、且周期性较弱的食品饮料、医药生物、农林牧渔、商业贸易等4个行业中，剔除上述创新高股及次新股后，有65只股票评级机构数在10家以上且市值超过百亿元。
市值最高的股票是白酒龙头贵州茅台，超过1.4万亿元，最新价较历史高点下跌不足7%。另外，白酒龙头五粮液、农林牧渔龙头牧原股份、乳业龙头伊利股份等个股市值均超过千亿元。
从回调幅度来看，豫园股份、苏宁易购等个股最新价较历史高点均下跌超60%，百润股份、美凯龙、通化东宝、国药一致等个股下跌均超过50%，九州通、天虹股份、美年健康、国药股份等个股下跌均超过40%。
部分股票距离历史高点咫尺之遥。昭衍新药、金域医学、天坛生物等7股最新价较历史高点跌幅不足5%，红旗连锁、欧普康视、乐普医疗等12股最新价较历史高点跌幅不足5%。
16股一致上涨空间超过30%
从一致目标上涨空间来看，有16只股票空间超过30%。其中，通化东宝一致目标价接近20元，相比现价上涨空间超64%。另外，温氏股份、美凯龙、口子窖等个股上涨空间均超过50%。
部分个股一旦达到机构一致目标价，将突破历史新高。比如贵州茅台一致目标价为1316.78元，其历史最高价为1241.61元。另外五粮液、泸州老窖、温氏股份、通策医疗等个股一致目标价也均超过历史最高点。
(image_address=""https://x0.ifengimg.com/ucms/2020_15/7BF81CFCF4A63B4C009C1B7D3A21838FD07E3930_w572_h1474.jpg"")",2020-04-09 19:43:25,凤凰财经
