,title,content,pub_time,src
0,规模下降收入上升 头部券商资管转型见效,"经过了一年多艰难的去通道后，券商资管们“过得”怎么样？
近日，各家券商陆续发布年报，其资管业务现状也一一呈现。其中，大型机构继续保持强劲的盈利能力，如广发资管去年利润约10亿元，华泰资管则赚了13亿元。而中小券商的资管业务明显分化，既有突出重围的，也有挣扎在盈亏边缘的。
去年，部分券商资管在向“主动管理”转型方面已取得成效。如浙商证券资管、国君资管、海通证券资管的资产管理规模虽有所下降，但资管业务收入实现逆势增长。
年报显示，截至2019年末，国君资管业务规模6974亿元，同比减少7%，全年实现营收20.58亿元，增长12%。同期，浙商证券资管业务规模为1395.74亿元，同比下降0.46%，实现收入3.83亿元，增长45%。海通证券资管去年实现营业收入13.8亿元，增长67%，业务规模则同比下滑12%。海通证券年报称，这是因为资管子公司“主动管理”的业务规模增长较快。
2020年将是券商资管转型的关键一年，各家机构将采取怎样的打法？对此，多家头部券商在年报中透露，产品线扩张将是转型的重要抓手。
如在主动管理领域居业内领先地位的东证资管表示，公司将加快在指数基金、养老目标基金等方面的业务布局，延伸产品谱系，丰富客户解决方案。
激烈竞争之下，马太效应也在加剧。相比头部券商，部分中小券商的资管机构去年仅能维持营收与成本的大致平衡。
去年，银河金汇资管、华西证券及红塔证券的资管业务利润均徘徊在1亿元左右。而债券违约及风险资产处置难度加大，成为制约资管业务发展的一大因素。如银河金汇资管因旗下存量通道业务涉诉，红塔证券控股子公司红塔资管也有通道产品踩雷中安消、华越置业等项目。
一家头部券商资管人士表示，部分中小券商在资管业务上的劣势越来越明显。未来，主动管理转型方面难见起色的机构，生存空间也将日益受到挤压，留给它们的时间已越来越有限。",2020-04-03 06:58:40,凤凰财经
1,险资聚焦内需 等待中长期布局机会,"“近期我们更多聚焦内需板块，主要关注新老基建、可选消费等领域。我们预判，短期机会更多出现在一季报相对较好的一些子行业中，近期主要聚焦医药生物、汽车整车、家电、建材、钢铁、计算机、军工、5G产业链、造纸、超市等领域。”这是一家保险机构最新的投资观点。
做出这样的投资决策，源于这家机构对近期市场的判断。他们认为，随着中国疫情防控态势不断向好，国内经济有望逐渐趋于平稳。
“从风险补偿和库存周期的角度，中期依然看好A股的投资价值。但海外疫情尚未出现拐点，受此影响，预计近期股市整体上还是宽幅震荡，后续市场逻辑最终会回归基本面。”沪上一家保险资管公司投资经理告诉记者。他们认为，目前市场反弹窗口已开启，但受风险因素压制，反弹空间和力度还有待观察，近期仍会配置一些安全边际相对高一点的个股。
在近期由中国保险资产管理业协会召开的相关会议上，多位保险公司掌门人也表达了近期他们对于资本市场的观点。
中国保险资产管理业协会会长、泰康资产总经理兼首席执行官段国圣表示，长期来看，疫情对宏观经济的影响主要集中于2020年，不会改变长期趋势，对资本市场的影响也是中短期的。疫情冲击对上市公司盈利会产生短期抵消，但出现长期拖累的概率不大，资本市场长期发展前景仍然较为确定。“基于长期视角，短期市场调整是保险资管机构的布局机会。”
阳光资产总经理彭吉海表示，当前环境下需要注意的三个问题：一是利差损风险，目前利差贡献仍是保险业利润的重要来源，如果固定收益资产利率持续下行，利差损风险不可忽视。二是疫情加速了实体经济风险暴露，需警惕实体经济向金融市场的风险传导。保险资管机构在进行资产配置时，要重点防范信用风险。三是从长期来看，疫情带来部分产业的成长与重塑，如医疗产业、新基建等，要积极关注新领域的资产配置机会。",2020-04-03 06:54:31,凤凰财经
2,上市险企管理层：保险股估值已背离基本面,"随着境外疫情蔓延，全球金融市场出现大幅波动。在A股和港股上市的保险公司股票也“跌跌不休”。在申银万国行业分类中，A股保险板块今年以来下跌了19.85%；在港股Wind行业分类中，港股保险板块今年以来下跌了20.58%。
从个股跌幅来看，港股中国太平（0966.HK）今年累计下跌34.27%，远高于其他保险股。万联证券研究所所长缴文超分析称，港股保险股跌幅整体大于A股，主要是受海外疫情影响。如果所在地区新冠肺炎患者不是免费治疗，商业保险公司需支付就医费用，包括重症治疗费用，普通寿险产品还需要支付被保险人死亡赔偿金。
“从投资端看，海外股市下跌、降息和量化宽松等都会导致市场收益率下行，债券收益率走低，对保险公司投资端造成不确定性。”他进一步补充道，无风险收益率下行还会导致保险公司计提准备金增加。
一位资深投资人士表示，在疫情冲击之下，保险公司承保端展业也受到很大影响，目前恢复速度较慢，保费收入短期内难有明显改善。今年2月，保险业原保费收入仅2687.11亿元，不及1月的三分之一。其中，财产险保费收入同比下降16.65%，人身险保费收入同比下降13.82%。
对于远高于市场平均跌幅的保险股，投资者迫切想知道上市险企管理层的看法和做法。
“近期保险股下跌主要受外围市场巨幅震荡、恐慌情绪蔓延等多种因素影响，股价表现已背离了公司发展基本面。”中国太保副总裁、董秘马欣相信，随着市场信心的恢复，这种背离会逐步得以修正。
中国人保集团董事长缪建民直言，中国人保H股股价确实低得不合理。但因为中国人保H股流通股数量不大，无法通过回购等措施提振股价。他认为，中国人保H股当前有很好投资机会，随着香港市场回暖，公司股价会有所回升。
“我们也非常关注二级市场走势，希望通过规模和价值全面发展的模式，提升公司内在底蕴；通过资产和负债协同发展，改善公司发展动能；通过提升市场地位和排名，强化公司形象和抗风险能力；通过提交良好的经营业绩来提高市场关注程度和认可度。”新华保险管理层近期公开表态。",2020-04-03 06:54:16,凤凰财经
3,凛冬已至？美国失业人数超660万，45年出租车公司也要破产,"原标题：凛冬已至？美国失业人数超660万，2300亿油企跌成渣！45年出租车公司也要破产，何时可破局？
(image_address=""https://x0.ifengimg.com/ucms/2020_14/B48568B9C9B9A7A275B6B151A3D8A246F498030D_w600_h333.png"")
有投资者在股吧里发问：从370美元跌到0.37美元，大伙儿说说有没有地狱？这不是幻想，这事的的确确就发生在美股市场！
曾经风头无两的油气白马，经过近六年的坎坷，终于走到了终点。总部位于丹佛的石油生产商惠廷石油公司（WhitingPetroleum）周三申请破产保护。这是在油价惊人下跌的情况下，引发做出破产举动的第一家大型上市公司。
WhitingPetroleum的股票（交易代码：WLL）曾于2014年一度达到了371美元以上，彼时该公司市值高达341亿美元（折合人民币达2300亿元）。但在过去几周跌至1美元以下，原因是该公司的债务问题将许多投资者吓跑了。在该公司申请破产保护的消息传出之后，股价周三再度狂跌44.78%，至0.37美元。
(image_address=""https://x0.ifengimg.com/ucms/2020_14/D47DE081BEC1887F593AC0EF2A919CF98225C265_w1080_h383.png"")
与此同时，因为新冠病毒破坏了本已艰难的行业，在1970年代获得第一枚纪念章的布鲁克林出租车运营商已申请破产。据华尔街日报报道，即使华盛顿提供了数万亿美元的支持，在接下来的几个月中，成千上万的消费者和企业仍将拖欠债务。对于小型企业而言，前景更是黯淡。哪怕有成千上万的资金可以用于救济个人和小型企业，大量企业仍会选择破产。从近期的法律案件来看，破产案件也越来越多。
北京时间4月2日晚，美国最新公布的数据显示，至3月28日当周初请失业金人数突破600万关口达到664.8万，续创纪录新高。
美国参议院少数党（民主党）领袖舒默看到美国初请失业金人数创纪录新高时：哦天啊。
石油价格战打趴首家企业
总部位于丹佛的惠廷（WhitingPetroleum）周三表示，已申请破产。理由是由于新冠病毒大流行，以及沙特阿拉伯与俄罗斯之间的价格战，石油和天然气价格大幅下跌。
惠廷在一份声明中表示，在2019年7月取消254个职位（占其劳动力的三分之一）时，已采取措施来增加现金流量和削减支出。
惠廷董事长、总裁兼首席执行官布拉德利&middot;霍利（BradleyJ.Holly）表示，该公司董事会认为，申请破产重组，并与其债权人进行谈判是最好的选择。
惠廷在破产申请中列出了36亿美元的债务和价值76亿美元的资产。根据重组协议，Whiting的资产负债表将减少22亿美元。债务持有人将获得重组后公司新股权的97％，而现有股东将获得3％。该公司称，大多数债务持有人都在董事会上。
惠廷表示，该公司仍拥有5.85亿美元的现金，并将“在正常情况下继续运营，而不会对其供应商，合作伙伴或员工造成重大干扰”。
上周，惠廷董事会批准了向高层管理人员发放约1460万美元的奖金和激励措施，其中包括向Holly支付约640万美元。但该公司周三并未对有关裁员或向高管人员付款的问题作出回应。
石油价格战和新冠疫情蔓延，对整个行业造成了较大冲击。由于全球新冠病毒大流行，旅行和业务急剧下降，许多公司都在沉重的债务压力下运营。据悉，DMCGlobalInc.裁员264人，约占其员工总数的三分之一。这家位于布鲁姆菲尔德的公司周三表示，由于石油和天然气活动急剧减少，正在削减其中的97个项目，但这是暂时的。该公司表示，裁员主要影响了DMC油田产品业务DynaEnergetics在制造和装配中的全职，兼职和临时直接工角色。
由于油价和需求下滑，科罗拉多州排名前两位的石油和天然气生产商也正在削减支出并减少员工的工资和工时。西方石油公司是科罗拉多州丹佛-祖勒斯堡盆地的主要石油生产商。该公司周二也表示，已通知员工采取多种措施，包括减薪，以应对这个前所未有的时期。
从数量上说，科罗拉多州第二大生产商来宝能源（NobleEnergy）表示，将从4月6日开始，将其大约30％的美国劳动力用于休假或兼职工作。该公司表示，工人将继续获得全部的健康福利。
Enverus战略分析副总裁BernadetteJohnson表示，很可能会有更多的石油和天然气生产商申请破产。惠廷是疫情大流行期间第一家寻求重组的公共石油和天然气公司。但是一些运营商很难找到买家。
EastDaleyCapitalAdvisors的高级商品主管瑞恩&middot;史密斯（RyanSmith）说，当石油和天然气公司削减生产和支出时，会产生连锁反应。当一家勘探和生产公司重组并重新谈判其协议时，加工，储存和运输石油和天然气的中游公司将受到影响。但随着生产商的削减，供应开始减少，市场应开始平衡。
运营45年的出租车公司也破产
其实，破产的案例并不只是发生在石油行业。据美国媒体报道，因为新冠病毒破坏了本已艰难的行业，在1970年代即在布鲁克林运营的出租车公司已申请破产。
法庭文件显示，乔&middot;普罗斯（JoePross）于1975年开始驾驶出租车，现在拥有42个出租车车队，他于3月27日在CrownHeights的申请了公司WalkerServiceCorp.（沃克服务公司）破产保护。他在布鲁克林联邦法院申请破产时强调，在新冠病毒削弱旅游业之前，出租车经营者已经非常脆弱。
行业专家称，自疫情大流行关闭城市以来，沃克服务公司是第一个申请破产保护的出租车公司，但这不可能是最后一个。据当地的律师说，在发生疫情之前，这个行业就处于濒临灭绝的边缘，而这种病毒将其完全推向了深渊。后续很多人可能还会破产并申请破产保护。从经济上讲，这将比9/11更差。
在提交破产文件说明中，Pross说，曾经上百万美元的出租车运营牌照，随着乘车软件的应用而下降，而Uber和Lyft越来越受欢迎。
法庭文件显示，到2019年，甚至在新冠病毒尚未发作之前，Pross的船队每月收入29400美元，远远低于他每月需要偿还的105610美元。2月下旬，他的贷款人，总部位于弗吉尼亚州的五角大楼联邦信贷联盟（PentagonFederalCreditUnion）发布了六笔贷款的违约通知，并要求在30天之内赔偿158186美元。
Pross说，他试图就还款问题进行谈判。然后，新冠病毒来袭，即使出租车司机和操作员继续停开，调度员，机械师和行政管理人员的开支，也打击了出租车公司收入。Pross的文件说：“当前的COVID-19大流行使债务人几乎没有收入，无法经营自己的业务，因为债务人最近在3月、4月甚至可能是5月的期间都要暂停运营。”
在纽约州长科莫甚至下令关闭餐馆和非必要工人留在家中之前，出租车司机每周的收入只有50美元，因为人们担心传染都避免使用公共交通，很多司机连油费都支付不起。
Pross也指责沃克的债务持有人PenFed，称其“震惊”地拒绝延长30天付款期限，并一直处于强硬态度。信用合作社拒绝评论目前拥有多少出租车贷款，但坚持要努力使出租车经营者继续经营。
PenFed发言人在一份声明中说：“PenFed积极与遇到经济困难的会员合作，包括救济的出租车借款人。”“PenFed在纽约拥有一支庞大的团队，致力于在这一充满挑战的时期内，为需要帮助的成员提供帮助。”
档案显示，Pross希望通过减少贷款而摆脱破产，以便他可以继续通过其主要业务UticaTaxi，该公司经营汽车和车库，并雇用调度员和其他工人。但是随着纽约的新冠病毒死亡人数接近2000并不断增加，主要业务也面临破产的威胁。
中银证券曾表示，全球化产业链会受到一些撕裂的风险。产业链的断裂风险具体体现在：一旦某个产业链的其中一环因疫情而梗住，那整条产业链便存在停滞的可能。从具体品种的交易规模来看，目前显著暴露在疫情风险之下的品种是：机械、交通设备、原油燃料。
国泰君安表示，向前看，预计本轮海外疫情全面扩散的影响将超过2003年非典时期。当前美股市场并未完全计入疫情对经济和企业盈利的冲击，投资者需警惕美国失业率和企业违约率的上升造成美股第二次冲击。
何时能迎来转机？4月2日，新冠疫情防控经验国际分享会暨健康中国国际公共卫生管理培训项目启动会以线上直播的方式正式召开，钟南山、李兰娟、世界卫生组织驻华代表高力博士等海内外专家出席分享会。钟南山在会议上表示，他认为，意大利、德国疫情已经接近顶峰了。复旦大学附属华山医院感染科主任张文宏也表示，全球疫情一定会控制住，4月份全球疫情形势可能出现高点。但疫情爆发后，各国都会采取自己的做法，疫情终将会过去，在这个过程中，每个人要保护好自己。",2020-04-03 06:50:37,凤凰财经
