,title,content,pub_time,src
0,港元强则港股强？机构提醒后市波动或加剧,"截至目前，美元/港元仍紧紧贴在强方汇兑保证。港元的强势从4月开始就令市场格外关注，美元对港元几度触及7.75的强方汇兑保证，引发香港金管局几次入场干预。恰逢港股低位反弹、南下资金大幅涌入，“港元强则港股强”的讨论不绝于耳。但事实真的如此吗？进入5月后，哪些市场风险需要关注？
对此，建银国际首席港股策略师赵文利对第一财经记者表示，不能简单得出“港元强则港股强”的结论。“虽然历史上，港元强多数也伴随着港股强，但并不是必然，因为如果港元强势主要受套息交易影响，有可能主要停留在香港银行系统，而并不必然进入股市。比如2015年9月港元多次触及强方兑换保证，但那段时间港股总体处于下行趋势。”他认为，5~7月市场波动仍将加剧，大多数港股公司将从7月开始发布中期业绩，业绩将更好地量化疫情的影响，并可能引发另一波盈利预测下调。
港元强并不一定港股强
先说港元走强的原因。过去两年，港元利率大幅低于美元，交易员以港元融资、买入美元计价资产来套息。然而，这类套息交易在息差收窄或资产遭遇抛售时会被迫平盘。在3月美联储大幅降息、资产抛售的背景下，交易员正在平掉之前的套息头寸。此外，近期也有不少交易是借入低收益的美元，投资高收益的港元。目前这两种货币的3个月期利率大约相差80个基点。“只要美国利率维持在近零水平，并且香港的储蓄率不大幅下降，我们就可能看到这种趋势持续下去。这就推动港元对美元不断升值。”
港元从1983年起实行盯住美元的联系汇率制度，目的是让本地商业与贸易活动具有较大的可预测性，其汇率保证维持在1美元兑7.75~7.85港元的区间。由于有稳健的金融体系，港元最近一直保持坚挺，而亚太地区许多货币在过去几个月都剧烈波动。
恰巧在港元走强的同一段时间，港股不断迎来南下资金流入并低位反弹。年初至4月末，南下资金总计2380亿元，而北上资金则为353亿元，这也与A/H估值溢价达历史高位、投资者布局估值洼地的心态有关。不过，是否真的“港元强则港股强”？
香港大正资本创办人兼投资总监陈惠仁表示，恒生指数目前的股息率在3.9%左右，不算可观，但在目前的零利率荒漠中，却是名副其实的一方绿洲。相比之下，标准普尔500指数的股息率为2.2%。此外，恒指目前的市净率约为1倍，接近过去20年的最低水平。然而，从市盈率的角度看，该指数的预期市盈率约为10.7倍。如果全球市场再迎一轮下跌，该指数很可能下跌10%，再次试探近期低点，在最糟糕的情况下可能下跌20%以上，试探20年来的低点，市盈率降到8倍。
“通常情况下，当股市走弱时，港元也表现疲弱。反之，港元强势往往导致恒指走高，并可能表明股市要迎来一轮潜在上涨行情。这虽然不是一条定律，却似乎是一个先决条件。”他称。
对此，赵文利表示，不能简单得出这一结论。如果港元强势主要受套息交易影响，有可能主要停留在香港银行系统，而并不必然进入股市。例如，2015年9月，港元多次触及强方兑换保证，但那段时间港股总体处于下行趋势；2015年8&middot;11汇改之后，人民币贬值预期强化，导致资金对港元和美元需求骤然增加，但人民币贬值对中资企业盈利构成了压力，港股反而下行压力加大。
事实上，近两个月港股触底回升，主要在于南下资金的放量，以及全球抛售后的空头回补。港股当时相对于A股的低估值是主因，即A/H股溢价是南下资金放量的主因。恒生A/H溢价指数一度从年初的近110飙升至3月时最高135，此后仍保持在130附近。
5月后市场波动将加剧
告别了恐慌性抛售的3月，4月全球主要股市都收复了近60%的跌幅，但进入5月，比起近期“港元强则港股强”的乐观判断，市场波动率大概率加剧。
眼下，投资者再次面临是否要“在5月抛出”的问题。在2020年高度不确定的全球前景中，这一困境可能比以往更加困难。
赵文利对记者表示，需要从两个角度考察“在5月抛出”的策略，其中一个情景，观察11月至次年4月和5月至10月的历史表现，另一个仅观察5月份。过去的10年中，“5月抛出”的策略大部分是盈利的。2010年以来，5月抛出和11月回购在10年中的5年中，能够避免急剧的下降。仅从5月来看，恒生指数在过去有记录的10年中8年下降。最近的趋势或许表明，“5月抛出”的策略是稳健的。
但从长期角度看，“5月抛出”的策略不一定能盈利。过去40年里的17年中，5月至10月的表现实际上好于11月至次年4月。因此，虽然“5月抛出”的策略近年来可能取得了可观的成绩，但从历史上看，它并非有效的防御策略。
今年而言，尤其是在市场反弹幅度较大、不确定性较高的背景下，“5月抛出”的策略可能再次有效。即使各经济体可能开始放宽对社交距离的限制，但疫情蔓延的后果还远未明朗。
5月至7月，市场可能面临更多挑战，赵文利认为，大多数港股公司将从7月开始发布中期业绩，业绩将更好地量化疫情的影响，并可能引发另一波盈利预测的下调。他建议增持能够受益于中国内地需求的行业，因为这些行业可能受益于相对较早重新启动的中国经济。
（文章来源：第一财经日报）",2020-05-18 08:52:47,凤凰财经
1,果冻市场无力救赎 蜡笔小新食品能挺过转型期吗？,"(image_address=""https://x0.ifengimg.com/ucms/2020_21/7A73FB69C8EF603BC8A8407B40082EE60FCC9A97_w400_h400.jpg"")
5月15日，蜡笔小新食品（01262.HK）披露2019年业绩公告，公司营业收入4.67亿元，同比下降7.20%，净利润-1.70亿元，同比下降5.29%。
同时，公司财务状况持续恶化。当年，公司经营活动现金流入净额3500万元，较2018年下降60.63%。
截至2019年底，公司应收账款2.45亿元，占流动资产的比例为47.14%，较上年增加4个百分点。公司资产负债率从2018年的60.61%增加至66.53%，现金及现金等价物降低2.45%至2488.3万元。
蜡笔小新食品2000年成立于福建晋江，主营业务为果冻、甜食、饮料及其他休闲食品，旗下产品包括6大系列、300多个品种。在果冻市场，公司市场占有率排名第二，仅次于喜之郎。
中粮入股成为二股东后，中国休闲食品2011年赴港上市，并在不久之后更名为蜡笔小新食品。
那几年，公司业绩突飞猛进，2013年登上业绩巅峰：营业收入18.34亿元，净利润3.26亿元。当年，休闲零食板块中，公司业绩力压洽洽食品、好想你、来伊份，风光无两。
不过，次年，因“毒明胶”事件，公司业绩急转直下，营业收入下降38.44%，净利润暴降96.60%至1110万元。
公司于2015年陷入亏损，至今已连亏5年，分别亏损3.38亿元、6.02亿元、2.89亿元、1.80亿元、1.70亿元，合计15.79亿元。
“毒明胶”事件再加上持续爆出的窒息风险等原因，果冻基本上卖不动了。行业老大喜之郎转型，陆续进军地产、煤炭等领域，实力较小的金娃果冻退出市场，亲亲果冻被恒安出售之后，也从公众视野中消失。
连年巨亏，公司从各方面削减开支，艰难求生。
早些年，公司请正当红的张柏芝代言，年年砸出几个亿的广告，如今销售及分销开支不断缩减，2019年仅为7463.7万元。
想当年公司也是年赚数亿的食品大厂，除福建总部外，天津、成都、安徽三大成产基地，高峰时员工接近3000人。截至2019年底，公司员工总数1120人。
果冻行业无力救赎，但公司并不打算束手就擒。在2020年1月召开的蜡笔小新食品核心经销商战略研讨会上，公司提出“高端化、新渠道、新人群、新零售”，启动“二次创业”。
公司于2018年起停止生产多数低毛利产品系列，以海味休闲零食、休闲速食为主要方向，不断涉足网红休闲食品领域。2019年，公司推出的新品就包括自热煲仔饭、老闽南扇贝粉、关东煮等。
这些新产品确实取得了一定效果。2019年，公司果冻、甜食、饮料三大传统板块收入分别下滑2.40%、8.41%、69.88%，其他休闲食品板块收入则逆势增长了8.33%。
不过，新业务几百万元的收入，离支撑起公司业绩，还有相当遥远的距离。
而且，零食领域的巨头们，三只松鼠、良品铺子等，借渠道优势“降维打击”，随便动动手就能把上面几个单品做成爆款。
而公司的销售渠道正在不断收缩，2019年，公司经销商544家，较2018年减少149家，下降21.50%。公司的市场机会还有多少？
截至2019年底，公司银行借款总额6.25亿元。近几年，公司每年付出的融资成本均高达4000多万元。
主营业务失去盈利能力后，公司自身滚动发展已经存在问题。目前，公司正采取两大措施解决资金问题。
一方面，股东输血：2019年，公司主要股东郑育龙，将自己的5000万元融资，向公司提供3891.10万元贷款，以解燃眉之急。
另一方面，折价出售资产回款。公司拟将旗下位于晋江市食品产业园12.70万平方米的土地及之上14.83万平方米的楼宇进行出售，对价1.8亿元。如出售，该项资产亏损4669万元。
但是，对于蜡笔小新食品来说，如果不能创造盈利能力、止住亏损，这些都解决不了根本问题。
因负面消息不断，公司股价持续下探，从2014年初的6港元，跌至如今不到0.4港元，市值仅4.92亿港元。当年的零食小白马，沦为仙股。",2020-05-18 08:37:55,凤凰财经
2,青海春天隐退主流虫草圈,"(image_address=""https://x0.ifengimg.com/ucms/2020_21/94DAC90D186B8212D47F2BC51748E89520BD97E1_w600_h408.jpg"")
自“极草”5X冬虫夏草纯粉片跌落神坛之后，曾头顶“虫草第一股”光环的青海春天，逐渐在冬虫夏草行业里黯淡。
在日前青海省冬虫夏草协会等部门举办的首届青海冬虫夏草鲜草节活动中，已难见青海春天的身影。
失去“极草”这门好生意后，公司除保留冬虫夏草（原草）及净制冬虫夏草业务，陆续在广告、投资、快消品等领域左突右进，至今未能彻底“突围”。
2019年，公司业绩再度下行，收入和净利润同比下降29.81%和91.51%。辛辛苦苦干完1年，净利润不到600万元，不及2016年的3%。
虫草收入跌7成
青海春天（600381.SH）靠冬虫夏草发家，也因此跌落神坛。
2016年3月，公司红极一时的主力产品“极草”5X冬虫夏草纯粉片被国家监管部门叫停。这个近乎“黑户”的产品迅速消失在公众视野。
当时，公司保留了冬虫夏草业务，以维持基本的“体面”。这成为此后4年公司收入的主要来源。
斑马消费统计显示，2016年至2019年，其冬虫夏草业务收入分别为3.86亿元（包括部分冬虫夏草纯粉片收入1.87亿元）、1.95亿元、1.34亿元和1.02亿元，分别占比54.52%（若剔除冬虫夏草纯粉片业务收入，实际占比28.11%）、41.40%、40.24%和43.59%。
近3年，冬虫夏草业务收入占公司收入比重较为稳定，但其经营状况不太乐观。
根据公司披露的信息显示，冬虫夏草业务主要有两款产品，一款是净制冬虫夏草，一款是冬虫夏草（原草）。两款产品无论是生产量、销售量，还是盈利状况均不同程度出现萎缩。
以净制冬虫夏草为例，2017年至2019年，其生产量分别为38.65万克、8.28万克、3万克。销售量分别为35.87万克、5.71万克、2.51万克。
随着净制冬虫夏草产品生产、销售的萎缩，其收入下降明显，分别实现0.99亿元、0.14亿元和511.26万元。该项业务毛利率从43.55%降至5.34%。
相较之下，冬虫夏草（原草）产品收入稍稍稳定。上述同期，其收入分别为0.79亿元、0.72亿元和0.68亿元，毛利率从34.11%降至16.73%。
来自现有冬虫夏草业务利润贡献对公司十分有限，这没让公司从冬虫夏草领域彻底退出。
在“极草”5X冬虫夏草纯粉片叫停当年，公司子公司春天药用从三普药业（现：智慧能源（600869.SH））手里获得中成药产品虫草参芪膏的全国总经销权。
2018年第四季度起，虫草参芪膏作为公司核心单品推广和销售，依靠经销商商和药店渠道开拓市场。
虽说这款产品毛利率高达70%以上，经过1年多时间销售，所获收入仅占公司收入1%左右。2018年和2019年，虫草参芪膏实现收入分别为176.74万元和355.96万元。
新业务短期难长大
公司推出虫草参芪膏意在“充实”冬虫夏草业务，就目前来看，整个冬虫夏草业务暂时“救”不了公司业绩。
自2016年起，公司业绩逐渐走进下行通道，2017年至2019年，其收入分别下降33.74%、29.30%和29.73%，同期，归母净利润分别增长27.24%、-77.96%和-91.51%。
痛失“极草”，公司一度慌了阵脚，先后涉足广告、对外投资和快消品业务。短期内，广告和投资业务，一定程度上对公司业绩发挥了提振作用。
这两项业务分别由西藏老马广告和恒朗投资执行实施。启信宝显示，这两家公司均为公司孙公司。
2017年至2019年，公司实现广告收入分别为2.24亿元、1.72亿元和0.74亿元，占公司各期收入的47.56%、51.66%和31.62%，毛利率由51.33%降至11.22%。
2016年，公司决定通过向外投资基金等形式获得收益，这生意也不好做，其收益从2017年的1.18亿元降至2019年的0.40亿元。
上述两项业务收入受外部市场环境影响逐年下行，靠广告和投资业务终究不是长久之计。2018年，公司跨界白酒行业。公司宣布，酒水业务是公司新的产业布局和长远稳健发展的优选项目，“力争将该板块业务打造成公司支柱产业”。
当年3月，公司以对价0.34亿元收购关联方西藏正库持有的西藏听花酒业100%股权，并以此销售凉露酒、凉茶等产品，覆盖吃辣人群这一细分消费群体。
收购西藏听花等当年，公司主要通过餐饮和特渠等渠道拓展产品市场份额。2018年，销售费用0.93亿元，同比增长792.97%。2019年，随着公司对凉露酒市场推广减少，销售费用同比下降47.02%。
2018年至2019年，公司“酒水及其他”板块，实现营业收入0.25亿元、0.52亿元。2019年收入增速104.85%，其毛利率均在60%以上。
和虫草参芪膏一样，公司的酒水业务正处于测试和发育期，未能形成规模效益。",2020-05-18 08:35:51,凤凰财经
3,WEMONEY朝闻：万向信托为长城集团融资罚息年化24%；2020年以来66位上市银行董监高离职,"上市前夕分红竟是往年26倍农夫山泉超百亿分红后赴港IPO背后有何算计
4月29日，农夫山泉向港交所递交了招股申请书，拟赴香港上市并募资70.9亿元。消息一出，农夫山泉就被媒体戏言最会算计的企业。尽管业绩不错，但“上市前突击分红95亿”、“不差钱却上市”等言论，都让农夫山泉赴港上市的目的和诚意遭受质疑。2017年至2019年，共给原有股东派息103亿元，其中2017年派息3.67亿元，2018年派息3.67亿元，而计划上市前的2019年公司向股东派付股息95.98亿元。按照此计算，农夫山泉2019年分红暴增，是2018年、2017年的26.15倍，也远超过此次募资金额。有业内人士表示，大股东应该要套现。“大股东想在上市前把公司的资金派尽，然后到香港上市集资套现，沽出手上持股，把大额资金从内地转到海外。”【详情点击标题】
2020年以来66位上市银行董监高离职体系内流动占多数
记者根据上市银行的公告进行梳理，2020年以来，离职的银行高管共有66位。值得注意的是，在银行高管离职的原因中，与以往跳出行业不同，大多数高管是以工作调动、换届为主，大多新岗位与原岗位性质不变，仍留在商业银行系统内。此外，记者注意到，部分银行高管虽然离开了银行圈，但是并没有离开金融圈，一些非银企业成为银行高管离职后的去处。【证券日报】
万向信托卷入长城集团资金泥潭年化24%的超高罚息浮出水面
近日，长城影视发布公告，浙江省杭州市中级人民法院对万向信托股份有限公司（简称“万向信托”）与公司控股股东长城集团、公司、赵锐勇先生的金融合同纠纷一案作出一审判决。万向信托因不服一审判决结果向浙江省高级人民法院提起上诉。2016年，基于日常营运流动资金需要，长城集团向万向信托申请融资，存续期为2年。万向信托因此设立了“万向信托-工商企业信托基金29号（长城影视集团流动资金贷款集合资金信托计划）”。对于该项目的现状，万向信托回复记者称：“该项目已正常清算。”因此，在后续过程中，当长城集团支付了前7期利息，却未能按约偿付贷款本金及最后一期利息时，借款期内的所有利息都要按照24%来计算。这也就导致了1.5亿元的借款，需要支付利息7200万元，扣除已支付利息2258.38万元，还需要支付利息4941.62万元。此外，还需要支付按照24%利率计算的罚息、复利128.22万元和律师费45万元。【界面新闻】
北京农商行资产总额接近万亿关口拨备覆盖率由1068.87%降至398.24%
近日，北京农商银行披露2019年年报。数据显示，截止到2019年年末，资产总额达到9585.90亿元，较年初增长8.79%，正接近万亿关口。实现利润总额100.00亿元，同比增加10.37亿元，增长11.57%；净利润82.29亿元，同比增加9.77亿元，增长13.47%。同时，该行各项存款余额6388.26亿元，较年初增长6.59%；不良贷款率为0.95%，连续6年控制在1%以内。此外，北京农商银行的拨备覆盖率也由2018年末的1068.87%下降至2019年末的398.24%。【华夏时报】
全国网贷存量风险化解“读秒”已有地区实现机构“清零”
网贷存量风险化解再现新进展，已有地区实现机构全部出清。在5月16日召开的2020清华五道口全球金融论坛上，重庆金融监管局党组书记、局长阮路表示，重庆市互联网金融风险整治取得阶段性成果，P2P网贷机构已实现全部出清。记者注意到，重庆是继湖南、山东之后，全国第三个公告将全部取缔P2P网贷业务的省市。当前，全国网贷存量风险化解进入“读秒”时间。2020年4月，互金整治领导小组与网贷整治领导小组联合召开的互联网金融和网络借贷风险专项整治工作电视电话会议指出，截至2020年3月末，全国实际在运营网络借贷机构仅139家，机构数量、借贷规模及参与人数连续21个月下降。按照国务院相关工作部署，争取2020年基本完成互联网金融和网贷风险专项整治的主要目标任务。【北京商报】
广东警方发布云付通、智还信用卡套现、“312”地下钱庄等十大经济犯罪案
5月15日广东警方发布2019年十大经济犯罪案件，2019年广东省公安机关经侦部门全力开展护航金融“利剑行动”“猎狐行动”等专项行动，深入推进智慧新经侦建设和法治经侦行动计划，严厉打击各类突出经济犯罪，全面服务防范化解重大金融风险，共侦破各类经济犯罪案件13000余宗，抓获犯罪嫌疑人20600余人，挽回经济损失上百亿元，有力维护了全省政治安全、经济安全和社会稳定。2019年11月12日，根据公安部和广东省公安厅统一部署，广州市公安机关对广州“云付通”特大非法集资案开展全国统一收网行动，成功抓获包括主犯黄某锦在内的主要犯罪嫌疑人19名，涉及投资人89万余名，涉及资金350余亿元。2019年9月初，深圳市公安局经侦支队成功发起“智还”平台信用卡非法套现案收网行动，捣毁犯罪窝点6个，打掉非法套现犯罪团伙3个，抓获犯罪嫌疑人135名，涉案金额380多亿元人民币。【支付要闻】
整理：林小林",2020-05-18 08:34:19,凤凰财经
