,title,content,pub_time,src
0,中国正抛售美债，1个月卖掉643亿！美元信用快速损耗，黄金价格飙升,"(image_address=""https://x0.ifengimg.com/ucms/2020_34/5CBA04DAB6A2B027703F06887857808A16EE6421_w1080_h641.png"")
美国时间8月17日，美国财政部公布了月度国际资本流动报告。数据显示，6月份，中国抛售93亿美元国债（约合人民币643亿元），成为抛售美债最多的国家。目前，中国美债持仓总金额仍维持在1万亿美元上方，仍是美债第二大海外持有国。
数据也显示，外国投资资金在连续3个月抛售美国国债之后，6月开始回补，实现了净买入。统计显示，今年3月份，外国资金流出美债市场规模达到破纪录的3107.9亿美元，4月份净流出1876亿美元，5月份净流出366.9亿美元。而最新的6月份数据则实现了净买入288.9亿美元。
在美国债务持续飙升的背景下，外国投资者持有美债的占比越来越小了，6月份占比已经跌到了26.6%，创下2008年以来的最低水平。截至8月4日，美国联邦债务总额已达到26.5万亿美元（约合人民币183万亿元）。而且目前白宫与国会正在就新一轮财政刺激计划谈判，若立法通过或将进一步增加美国债务规模。
面对美国不断发行政府债券或印钱，投资者已经转向用黄金增值保值。在最新公布的持仓中，巴菲特、达里奥等投资大佬进一步增持黄金股，而央行党委书记、银保监会主席郭树清在8月16日在《求是》刊文称，在以美元为主导的国际货币体系中，当前美国这种前所未有的无限量化宽松政策，实际上也消耗着美元的信用，侵蚀着全球金融稳定的基础，会产生难以想象的负面影响。
8月17日，公布的一项美国银行进行的调查表明，对美元的看跌情绪已经达到历史最高水平。目前，黄金价格已经重返2000美元以上。
中国成为6月抛售美债最多的国家
根据美国财政部8月17日周一公布的数据显示，第二大“债主”的中国持有量则下降93亿美元至1.07万亿美元，为降幅最大的国家。目前，中国仍是美债第二大海外持有国。
数据还显示，6月份，日本仍是除美国以外最大的美债持有国，持有量仅增持了9亿美元，增至6月份的1.261万亿美元。
(image_address=""https://x0.ifengimg.com/ucms/2020_34/36589172E4BC75ACD617F2B3C114A7658B5930A3_w586_h384.png"")
作为美国国债两个最大的外国持有者，过去一年多中日两国对于美债的持仓量进一步分化。在过去一年中，日本的美债持仓量增加了1380亿美元，而中国则在过去一年中减少了380亿美元。在2013年底时，中国持有美债的规模触及1.32万亿美元的高位，此后下降约15%。
美债在6月份实现净流入外国投资者占比却在持续下降
数据也显示，在美债市场总量上看，6月份实现了外国投资者的净流入。美国财政部的统计显示，6月份月度外资持有量来看，外国投资者持有7.03万亿美元的美债，高于5月的6.978万亿美元，而印度在6月是美国国债最大的买家。
这意味着，外国投资资金在连续3个月抛售美国国债之后，6月开始回补，实现了净买入。统计显示，今年3月份，外国资金流出美债市场规模达到破纪录的3107.9亿美元，4月份净流出1876亿美元，5月份净流出366.9亿美元。而最新的6月份数据则实现了净买入288.9亿美元。
值得注意的是，在6月份，美国10年期国债基准收益率最高达0.90%，创下当时约3个月来的最高水平，6月底报0.65%。而随后，7月份美元指数跌幅达到了4%，创下2010年9月份以来最大跌幅。
(image_address=""https://x0.ifengimg.com/ucms/2020_34/E8895C7A0438F3FFF4BFC9F50D47DC75961E9A32_w580_h514.png"")
在美国债务持续飙升的同时，外国投资者持有美债的占比越来越小了，6月份占比已经跌到了26.6%，创下2008年以来的最低水平。而日本和中国这两个美国最大的外国债权人合计持有美国国债的8.8%，也是近8年来最低的份额。
统计显示，到今年6月份，美国政府基金（社保信托基金、各类政府和军队退休金等）持有美债5.95万亿美元，占比22.5%，美联储持有4.2万亿美元，占比15.9%，美国商业银行持有1.07万亿美元，占比4.0%。
(image_address=""https://x0.ifengimg.com/ucms/2020_34/E23644BC57CED3895E2E173D2333989A41C2B271_w552_h497.png"")
美债规模突破26万亿美元，美元信用正在被大量消耗
统计显示，截至8月4日，美国联邦债务总额已达到26.5万亿美，目前白宫与国会正在就新一轮财政刺激计划谈判，若立法通过或将进一步增加美国债务规模。
数据显示，今年1月至6月初，美国国债增长近3万亿美元，而往年全年增长不超过1.5万亿美元。目前，经济分析师普遍预测，到2020年底美国国债还有可能进一步攀升并超过30万亿美元。
8月12日，美国财政部表示，预计今年7至9月政府借款规模将达到9470亿美元，较市场预期高出2700亿美元。这将是本季度的最高借款规模纪录，但规模低于今年第二季度创纪录的2.75万亿美元。美国财政部预测，美国政府在截至9月30日的本预算年度的新借款总额预计将达到4.51万亿美元。此外，美国财政部表示，政府计划在今年10至12月期间借债1.22万亿美元。
随着美债规模的持续攀升，人们开始担心美元的储备货币地位还能维持多久。7月26日，全球最大避险基金创始人、桥水基金达里奥表示，最担心的是美元的稳定性。他说，政府预算不能一直处于赤字状态、不断发行政府债券或印钱，美国如果不能团结合作对美元做出更为健全的决策，经济将会走下坡。
据桥水基金8月13日向美国证监会（SEC）提交的持仓报告显示，桥水基金二季度加仓SPDRGoldTrust黄金ETF持仓，占投资组合比例为15.34%，加仓幅度34%，持仓价值超9亿美元。此外，桥水对第五大重仓股IshareGoldTrust的增持比例也高达35%。
上周末，巴菲特旗下的伯克希尔哈撒韦公司二季度持仓出炉，最引人注目的变化就是它新买入了黄金股。巴菲特在二季度唯一新建仓的个股就是巴里克黄金公司(BarrickGoldCorp)，共买入了2092万股，金额为5.64亿美元，占该公司已发行股份的1.2%。
8月6日，国际货币基金组织(IMF)发表报告指出，美国若未能重建财政可持续性、可能导致外国资金对美国固定收益证券需求意外下滑，进而引发金融稳定风险。
8月16日，央行党委书记、银保监会主席郭树清在《求是》刊文称，当前，国际上许多国家特别是最发达国家，采取了强刺激做法。短期看，这一做法有利于稳定经济与金融，但是中长期效果则存在很大不确定性。
郭树清称，世界上没有免费的午餐，天下也没有不散的筵席。在以美元为主导的国际货币体系中，当前美国这种前所未有的无限量化宽松政策，实际上也消耗着美元的信用，侵蚀着全球金融稳定的基础，会产生难以想象的负面影响。新兴经济体可能面临输入性通胀、外币资产缩水、汇率和资本市场震荡等多重压力。更严重的是，世界可能再次走到全球金融危机的边缘。
(image_address=""https://x0.ifengimg.com/ucms/2020_34/50255BACBFC311DA498892F2CA189E09D7DD400A_w1080_h520.png"")
8月17日，公布的一项美国银行进行的调查表明，对美元的看跌情绪已经达到历史最高水平。另一方面，美国期货交易委员会公布的数据显示，对欧元的看涨押注也达到历史最高水平。目前，黄金价格已经重返2000美元以上。",2020-08-19 08:54:25,凤凰财经
1,扎心了！这一基金公司老总“自降”为副总！业绩不行还是另有它因？,"(image_address=""https://x0.ifengimg.com/ucms/2020_34/78FD405554D8B14554F8A3D5CE9E0D6467FE8A96_w600_h333.png"")
因为个人原因，东海基金总经理“自降”为副总经理，原下属的副总经理升为总经理。
东海基金日前发布总经理变更公告和副总经理任职的公告，公司新聘副总经理竟然是公司原总经理邓升军，理由是因“个人原因”。
天天基金数据显示，截至2017年9月底，东海基金公募业务总份额为10.5亿份，而到了2020年3月底，东海基金的份额就只剩下不足6亿份，份额赎回接近50%。幸有A股行情在2020年持续给力，购基资金溢出效应带来资金回流，但截至2020年6月30日已披露信息，东海基金公募业务总份额也仅维持在9亿。这意味着东海基金的公募份额增长在这三年时间颗粒无收。
这种回炉的做法除了基金高管，在基金经理岗位也比较多见，在2011年至2012年期间，有多达四名基金经理因业绩不佳回炉担任研究员。回炉也大多冲击任职人员心理，因此多数人最终淡出基金业。
昔日下属变老板，总经理“自降”为副总经理
东海基金8月15日发布的一则人事变动公告引起业内的关注。根据公告内容显示，公司新聘副总经理竟然是公司原总经理邓升军，理由是因“个人原因”。此外，在原总经理自降为副总经理后，东海基金的副总经理又被升为总经理，看起来就像上司和下属换了个角色。公告显示，接替邓升军的新任总经理是该基金公司原副总经理严晓珺。
(image_address=""https://x0.ifengimg.com/ucms/2020_34/BBBABC699793E2A3E98049E1EC06AB23F86628A0_w843_h444.png"")
公开信息显示，原总经理邓升军曾任广发证券资产管理部投资经理，2013年7月加入东海基金，先后担任研究开发部研究总监、专户理财部投资总监、公司总经理助理、副总经理等职，2017年8月正式升任总经理。原副总经理、新总经理严晓珺曾任职于德邦证券股份有限公司，先后担任资产管理部总经理、总裁助理兼资产管理部总经理等职，2020年加入东海基金。
东海基金上述人事变动令人诧异，但这还不是第一次。今年四月，东海基金发布副总经理任职的公告，任命苏尚才为副总经理，任职日期为2020年4月17日。而在苏尚才此次担任东海基金副总经理的一年前，他的履历上唯一有点看头的还只是海通证券的固收研究员。
东海基金由东海证券股份有限公司、深圳鹏博实业集团有限公司和苏州市相城区江南化纤集团有限公司共同发起成立。注册地上海，注册资本1.5亿元人民币。
虽然东海基金成立时间已有六年，但公募业务的发展较同时期成立的其他公募基金公司颇为滞后，比东海基金成立时间晚半年的红土创新基金公司，截至2020年6月底，后者公募业务规模是前者的3倍，而同样成立时间比东海基金晚半年的创金合信基金公司，后者的公募业务规模更是前者的20倍。
任职期间管理不佳或是主因
虽然拿着公募业务牌照，但东海基金的心思却重在发展专户业务。不过，从东海基金专户业务存在的违规现象，也大致可以管中规豹的了解东海基金的投研治理存在问题。
在2018年1月初，上交所发布的《关于对东海基金—工商银行—东海基金—鑫龙72号资产管理计划（第一期）名下证券账户实施限制交易纪律处分的决定》，据悉，东海基金-工商银行-东海基金-鑫龙72号资产管理计划（第一期）以协议转让方式减持闻泰科技股份时，并未遵循6个月内不减持的承诺，对此监管做出停止该证券账户交易6个月的处罚决议。
处罚书显示，2017年10月31日，鑫龙72号以协议转让方式减持闻泰科技股份时，曾承诺6个月内不减持。然而该账户违背相关承诺，通过竞价交易卖出上述股票312万股，卖出金额达1.1亿元。对于这种违规减持的行为，上交所做出限制鑫龙72号证券账户实施交易6个月的纪律处分。
根据发生的时间，此时正值邓升军任职东海基金总经理期间。邓升军主动让贤的另一因素可能在于，自2017年8月任职三年总经理，公司公募业务规模几乎毫无进展。
天天基金数据显示，截止2017年9月底，东海基金公募业务总份额为10.5亿份，而到了2020年3月底，东海基金的份额就只剩下不足6亿份，份额赎回接近50%。幸有A股行情持续给力，购基资金溢出效应带来资金回流，但截至2020年6月30日已披露信息，东海基金公募业务总份额也仅维持在9亿。这意味着东海基金的公募份额增长在这三年时间颗粒无收。
回炉大多最终淡出基金业
值得一提的是，这种在人事上回炉的做法，也曾多次出现在部分基金公司的其他人事变动上，最常见的是基金经理因业绩不佳回炉做研究员。
2014年12月30日，东吴基金发布公告称，因公司发展需要，东吴新经济基金经理邹国英、东吴新创业基金经理吴广利现从事公司研究工作。业绩是基金经理回炉做研究员的主要因素，天天基金的数据显示，邹国英任职东吴新经济基金经理期间，基金净值增长率为33%，但依然跑输业绩基准，在当时的同类基金业绩回报中位列中下水平。
而在2011年至2012年期间，基金经理回炉做研究员的现象更多。2012年9月28日，易方达基金发布公告，侯清濯由于工作需要不再担任易方达平稳增长基金经理，转任研究部资深研究员，成为2011年回炉做研究员的第四位基金经理。公开资料显示，侯清濯从2001年7月进入易方达基金，最初担任行业研究员。2006年开始升任基金经理，先后管理过基金科讯、易方达科讯和易方达平稳增长三只基金。而在此前一个月，申万菱信基金也发布公告称，管理申万菱信消费增长基金的基金经理魏立将转任“研究员岗”。
值得一提的是，回炉的基金公司高管或基金经理，大多将面临心理冲击，公开信息显示几乎所有回炉担任研究员的基金经理，再无机会重回基金经理岗位，最终往往淡出基金行业。",2020-08-19 08:52:17,凤凰财经
2,泡沫破灭迹象显现？五大科技股市值占比超23%！牛市还能撑多久？,"(image_address=""https://x0.ifengimg.com/ucms/2020_34/8B32FCD6BA5356E394268100C4DDCF2F14AA6F02_w600_h333.png"")
标普500距离历史新高仅一步之遥，然而因为分散投资而持有标普500指数ETF基金的投资者，正被迫“看好”五大科技股。
据来自标普道琼斯指数公司的数据，标普500指数中前五大科技股的市值占比超过23%，而前10大成份股公司市值之和在该指数总市值中占比更接近30%，这是至少40年来的最高占比，高于2019年底的22.7%，少数几只巨头的上涨正推动标普500指数的前进。
值得一提的是，尽管一些华尔街的基金经理强调，标普500指数头部股票集中可能带来潜在的风险，集中有助于推动牛市，但之后所导致的崩盘也更加严重。但高盛最新发布的研报则强调，标普500指数未来一年仍有13%的上涨空间。
五大科技股支配标普500
北京时间8月19日，苹果公司股价收于462.25美元，市值1.98万亿美元，距离2万亿美元大关只差约1%。标普道琼斯和彭博的数据显示，目前苹果在标普500指数中的权重占比达到6.5%，超过了IBM公司在35年前创下的6.4%的纪录。
(image_address=""https://x0.ifengimg.com/ucms/2020_34/880DE71984C35F9067964FB4A31A0FD708907194_w1075_h1235.jpg"")
截至8月19日收盘，苹果股票的市盈率为33.83倍，较标普500指数溢价约30%，为十年以来最高的水平。苹果仅仅是美股科技巨头影响股票市场的一个代表公司。
据来自标普道琼斯指数公司的数据，当前标普500指数前10大成份股公司市值之和，在该指数总市值中占比已高达30%，这是至少40年来的最高占比，高于2019年底的22.7%。
五大科技股的疯狂拉升掩盖了更多美股上市公司的糟糕表现，虽然标普500指数今年以来的收益已转为上涨，收复疫情造成的失地后，但是标普500指数的大部分成分股，实际上并未享受到太多好处。根据一份统计数据显示，今年标普500指数中个股涨跌比为1：1.7。
(image_address=""https://x0.ifengimg.com/ucms/2020_34/9C2A10FEB5C7BC96B147FEAE0F10385C90E8AAE4_w1075_h1263.jpg"")
跌的公司比涨得公司更多，但年内指数却仍能收涨的重要因素在于，五大科技巨头的股价涨幅惊人，而五大科技公司对标普500指数有着支配性的影响。比如，苹果公司的股价年内涨幅早已超过50%，亚马逊公司的股价年内涨幅更是超过70%。
指数投资者被迫“看好”科技股？
在这种情况下，标普500指数似乎正在远离它最初的定位。
标普500指数，是记录美国500家上市公司的一个股票指数，该指数是在1957年开始编制的，它最初的成份股包含了425种工业股票、15种铁路股票和60种公用事业股票，根据纽约证券交易所上市股票中绝大多数普通股票的价格计算而成。也正因为它包含的公司很多，所以它的指数数值很精确，能够反映出非常广泛的市场变化。
也正因为其被视为综合指数，能够有效的分散投资，因此该指数被指数基金投资者广泛关注。但标普500指数当前的现实是，它更像是一只科技主题指数，这意味着那些流向标普500ETF的被动资金，实际上正“看好”科技股。
造成这一问题的因素在于，标普500指数是一个市值加权指数，市值越高，权重就越大。根据公开的数据，在2018年的前七个月的标普500指数收益中，标普指数99%的上涨是由谷歌、苹果、亚马逊、微软等六大科技股贡献的。
也就是说，即便投资者并不看好科技股，但持有跟踪标普500指数的ETF基金，实际上意味着投资者正被迫“看好”科技股，而且是少数的几只。但反过来，一旦这少数几只科技股的势头出现变化，也意味着将对投资者带来重大风险。
少数几家科技股支配着标普500指数，市值占比持续提升的情况，令许多投资者想起了另一个泡沫。在2017年加密货币的牛市末期，比特币市值占比仅仅用一个多月的时间从就62.8%下降到32.81%，接近50%的跌幅。而在牛市期间，比特币一只标的的市值，就占加密货币总市值高达60%以上的份额，但比特币的市值占比成为当时的反向指标。
失真的标普500指数还能走多远？
五大科技股在标普500指数中的支配地位，已经引起许多投资者的高度警惕。
根据媒体报道，华尔街大多头、美国宏桥信托投资集团（BTIG）首席股票和衍生品策略师JulianEmanuel警告称，目前美股市场最大的赢家们可能已处于泡沫中，建议投资者考虑削减他们对大型科技股的风险敞口。
JulianEmanuel表示，科技股存在不成比例的风险。这就是投资者担心出现泡沫的地方。被称为“FAAMG”股票的五大科技股——Facebook、苹果、亚马逊、微软和谷歌——是最脆弱的，在顶部和底部板块之间的相对表现上存在失调，或者说是泡沫。
华尔街人士警告称，当科技股泡沫破裂时，标普500指数不会毫发无损，因为该指数对大型科技公司也有巨大敞口，考虑到目前市场上的风险因素，市场存在回调的可能。
值得一提的是，2020年的美股的整体估值比2009年要高得多。这背后的一大因素的科技股占比巨大，2009年时只占18.4%，而今则占32%。此外，能源股的市值占比下降，从12.4%下降到3%。
五大科技股对标普500指数的“扭曲”，早就引起了一些基金经理的关注，但最终的表现实际上远远超出投资者的预期。
早在两年前，Smead资本管理公司首席执行官兼首席投资官BillSmead就认为，如果指数中某个行业的大盘股数量太多，这是一个不好的迹象。Smead说：“1929年的RCA股票，六十年代的漂亮50，1981年的石油股，1999年的科技股和2005年的银行股，在市场崩盘前都曾释放出过类似的信号。在每个时代，特定行业股票的大量集中有助于推动牛市，但之后所导致的崩盘也更加严重。”
即便如此，科技股的泡沫或者标普500指数的走势，仍然一如既往的超出预期。
就在最近，虽然市场再度争论标普500指数因为五大科技公司变得失真，但一些机构投资者依然认为科技股将继续推动泡沫，标普500指数依然有不错的上涨空间。
高盛在8月14日发布的研报中称，考虑到美国的增长前景和新冠肺炎疫苗的前景，美股可能还会有更大的上涨空间。这份报告认为，对美国经济增长观点的市场计价仍有上升空间，尤其是考虑到早期疫苗的前景正在改善；只要增长改善是主导因素，这就可能与股市进一步上涨保持一致，即使近期实际收益率下降的趋势出现逆转，2020年底批准疫苗和2021二季度年底广泛分发疫苗作为上调美国经济增长的核心理由。
关于指数的上涨空间，高盛研报中称，标普500指数在年底的隐含水平可能在3600点以上，而未来12个月则有望升至3800点。这意味着高盛判断标普500指数未来一年内仍有13%的上涨空间。",2020-08-19 08:49:59,凤凰财经
