,title,content,pub_time,src
0,中国债券成功“入富”！万亿资金将流入中国，债、汇、股影响几何？,"(image_address=""https://x0.ifengimg.com/res/2020/D9EC1B1094C199E696ED782F669761C411EC3A97_size593_w1080_h603.png"")
来源：21世纪经济报道21金融圈
记者：杨志锦
北京时间9月25日早晨，富时罗素公司宣布，预计中国国债将于明年10月份被纳入富时罗素全球政府债券指数（WGBI）。具体纳入时间仍有待富时罗素咨询委员会成员和其他指数用户在明年3月份正式确认。
至此，中国债券市场将被全球三大主要债券指数悉数纳入。根据市场的普遍预计，未来18至24个月，中国债市有望因此吸引1500亿美元（人民币约1万亿元）的增量资金流入。这将对债、汇、股形成什么影响？
什么是国债入“富”？
富时罗素全球债券指数（WGBI）是衡量本币计价的固定利率投资级主权债的三大主要指标之一。另外两个指标分别是巴克莱全球综合债券指数(BGAI)和摩根大通新兴市场政府债券指数（GBI-EM）。
WGBI指数覆盖超过23个国家地区的主权债券，每月底根据市值加权调整一次，具有极强的代表性和灵活性。该指数受到投资界的广泛认可，目前跟踪WGBI的基金管理规模已达到2.5万亿美元。
WGBI的纳入标准主要包括三方面。原则上，一旦一个国家持续三个月满足相关条件，该国将会被纳入指数：
一是市场规模需要超过500亿美元、400亿欧元或者5万亿日元；
二是信用评级，国内长期信用评级需至少为标普评级A-或者穆迪评级A3；
三是没有明显的市场进入障碍（包括外资流动障碍、外资控股障碍等）。
7月19日，央行、证监会联合发布公告决定，同意银行间与交易所债券市场相关基础设施机构开展互联互通合作。这将明显提升了境外合格投资者的投资便利度，也会加强外汇结算便利程度，助力债券市场和人民币国际化。
9月14日，全国银行间同业拆借中心、中央国债登记结算有限责任公司、银行间市场清算所股份有限公司联合公告称，自2020年9月21日起延长银行间现券买卖交易时段至20:00。这将进一步推动银行间债券市场开放发展，便利境内外投资者交易银行间债券。
“中国市场自2018年被列入WGBI指数观察名单以来，中国监管机构已对债券市场基础设施进行了重大改进，以扩大国际投资者的进入渠道，包括改善债券二级市场流动性，改善外汇市场结构以及完善全球结算和托管流程。即将进行的进一步改革还包括将允许海外投资者在开立账户时注册法人实体。”富时罗素称。
市场影响几何？
目前中美10年期国债的利差已经超240BP，处于历史最高位。这样的利率和利差水平对境外投资者具有较高的吸引力。
实际上，境外投资者已经成为国内利率债市场的重要配置力量，这主要是主动投资。截至2020年8月，境外投资者在在岸市场持有的人民币债券规模已经超过2.4万亿，约占全部债券存量的2.5%。由于境外投资者主要投资于国债和政策性金融债，因此他们在利率债市场的影响力更大。
而通过三大指数配置中国国债则属于被动投资。高盛估计全球有2.5万亿美元的资金追踪WGBI，中国国债被纳入该指数将可能额外吸引约1400亿美元资金流入中国债券市场。
西部证券宏观分析师张育浩表示，假设富时罗素像彭博巴克莱一样将中国债券分20个月分阶段纳入市场，则每月大约会吸引75亿美元流入，将会显著提振我国债券市场的表现。如果我国国债纳入WGBI的权重高于预期，或者节奏加快，其对外资流入的吸引作用将进一步加大。尤其是目前的中美利差目前位于历史最高值附近，中国国债对于外资的吸引力也比较大。
国盛证券首席固收分析师杨业伟表示，从前两次中国政府债券纳入国际债券指数的情况来看，短期内外资流入增加，国内债券市场需求增强，10年期国债到期收益率会下降。
“由于大量境内商业银行采取国债持有到期策略，因此我们预计若WGBI能给中国债券市场带来逾1400亿美元增量资金，将会驱动中国国债交投更加活跃与国债价格趋于触底反弹。”某外资机构策略分析师表示，“不少海外主动投资型机构之所以提前加仓中国国债，某种程度也是在‘押注’中国国债由熊转牛。”
Wind数据显示，今年初以来至4月末，10年期国债收益率整体呈现下行趋势，由3.15%下行至4月末的2.5%，下行65BP，债市走牛。5月以来，10年期国债收益率整体呈现上行趋势，由4月末的2.5%回升至7月的3%左右。8月以来开始震荡，近期突破3.1%的点位，债市再度走熊。
杨业伟称，外资进入中国债券市场，增持人民币资产，将进一步推动人民币汇率升值。Wind数据显示，9月25人民币兑美元小幅上涨，徘徊在6.81左右。
(image_address=""https://x0.ifengimg.com/res/2020/E30892E133DF37E88FB06EDFAD97ED3371B3D0CB_size26_w400_h536.jpeg"")
杨业伟表示，长期来看，（国债入“富”）将推动我国债券市场进一步开放，丰富市场投资主体，外资对我国债券市场影响增强。
其原因在于，为了便利境外机构的投资，在纳入富时罗素指数后，可能会出台相关配套措施配合境外资金流入，这也会促进我国债券市场外汇风险对冲工具发展。债券市场境外资金投资规模的扩大会使外资对我国债市的影响增强，一方面使债市交易更加活跃，但另一方面，也会增加债市资金波动的风险。
金融开放再进一步
中国国债入“富”意味着中国金融市场对外开放再进一步。实际上，以2018年博鳌论坛召开为标志，中国金融展业领域对外开放“指数级”加速：
2018年以来，明晟、富时罗素、标普道琼斯等国际指数开始将A股纳入，并且指数比重逐步提高；
2019年4月1日起，人民币计价的中国国债和政策性银行债券已被纳入彭博巴克莱全球综合指数；2020年自2月28日起，中国国债正式纳入摩根大通全球新兴市场政府债券指数等。
中金公司首席宏观分析师张文朗表示，外资流入中国金融市场影响因素众多，但综合金融开放、国际政策和基本面三个层面，并从权益和债券市场两个角度切入，从2020年到2022年，国际资本流入中国的年均金额可能接近2万亿人民币，这将给中国资本市场增添新动力。
回顾历史来看，资本市场对外开放以来，境外机构和个人持有境内人民币股票和债券资产的数量持续增加，境外投资者参与我国资本市场的程度逐年加深，中国资本市场的国际地位大幅提升。
中金公司董事总经理陈健恒表示，开放加码过程中，境外资金也在逐步流入中国资本市场，也吸引了一批外资金融企业入市开展相应的金融业务。后续来看，对外开放加速和人民币国际化进程加深，境外机构参与国内金融市场的意愿会进一步走强，资金流入也可能呈加速之势。
安信证券首席经济学家高善文此前表示，人民币升值会进一步提升人民币资产的吸引力，在国际投资者资产配置比例中，人民币资产比例显著偏低。同时中国金融开放进程在加快，（升值）有助于降低股票市场波动、增强上升趋势。",2020-09-25 18:56:29,凤凰财经
1,国金、国联被证监会点名，核查内幕知情人！深交所也发话了,"9月25日，证监会新闻发言人常德鹏表示，证监会要求国金、国联证券自查，并提交内幕知情人名单，启动核查程序。
盘后，深交所也发话了：本周将对复牌后的“天山生物”、“豫金刚石”、“长方集团”持续进行重点监控，并及时采取监管措施。
(image_address=""https://x0.ifengimg.com/res/2020/49E8D7531C8E24C36B63F9FE2DB1C2D5A5404513_size527_w846_h427.png"")
9月20日，国联证券发布公告称公司与长沙涌金集团签订股份转让意向性协议，拟受让长沙涌金集团持有的国金证券约7.82%的股份；
同时国联证券与国金证券签署吸收合并意向性协议，拟通过向国金证券全体股东发行A股股票的方式换股吸收合并国金证券。
详见21金融圈报道：重磅刷屏！两家“国”字头上市券商合并，股价“精准”异动，内幕信息流出？大行情要来？下周怎么走
(image_address=""https://x0.ifengimg.com/res/2020/8BA79FCF825D6335724027E71DD86FF37156AA0D_size499_w650_h623.png"")
(image_address=""https://x0.ifengimg.com/res/2020/F47AD42A25932446E1FBBB47D584E85B5409B349_size392_w642_h581.png"")
值得注意的是，这是A股市场上第一例两家上市券商合并。截至停牌前，国联证券市值394亿，国金证券市值462亿。初步计算，双方合并市值近千亿。
(image_address=""https://x0.ifengimg.com/res/2020/079C358188C58E5AA1FF72AF32DECF94CE2ABE59_size163_w1080_h300.png"")
(image_address=""https://x0.ifengimg.com/res/2020/F19D6D687C47B754835DC0563EA427E03B35AE1C_size159_w1080_h293.png"")
受此提振，当日A股券商纷纷上涨，港股国联证券则直接高开75%，之后有所回落。
(image_address=""https://x0.ifengimg.com/res/2020/E8E8AE72CF68FD01765B8B5A8EBA85FE443484AA_size260_w1080_h506.png"")
值得注意的是，在合并公告发布之前的9月18日，两家券商A股就双双涨停，引发市场对其涉嫌内幕交易的猜测。
(image_address=""https://x0.ifengimg.com/res/2020/F69C2B785DDB43A241AC028C4AE01162C0C81F06_size27_w1080_h720.jpeg"")
其他新闻发布会要点：
证监会发言人常德鹏表示，目前有部分公司利用新冠疫情蹭热点炒作股价，证监会目前正在关注。
证监会将对上市公司再融资实施分类审核，审核相关信息将在证监会官网及时公告。
关于期货法制定情况，他表示期货法已列入全国人大常委会2020年立法工作计划，证监会积极配合相关工作，争取尽快提交全国人大常委会审议。
无独有偶，说到这里，今天早盘近400亿市值的疫苗大牛股辽宁成大闪崩跌停，引发舆论关注。
9月25日开盘，辽宁成大报28.65元，随后在此上下略微涨跌。10:45，辽宁成大突然直线跳水，闪崩砸上跌停板。
(image_address=""https://x0.ifengimg.com/res/2020/0AF588DE689E32885AF77151629B07227563E64E_size66_w700_h970.jpeg"")
截至收盘，辽宁成大成交额7.89亿元，换手率1.94%，至收盘仍有432.8万股封单躺在跌停板上。
消息面上，今日上午9时，辽宁成大的控股子公司成大生物科创板上会审议。
最新数据显示，辽宁成大的股东户数为7.31万户。
即使今日跌停，辽宁成大市值仍有391.3亿元，今年以来涨幅仍有69%，是今年的大牛股。而从2018年10月份底部至今，股价涨幅更是达到200%。
(image_address=""https://x0.ifengimg.com/res/2020/72CE165A4CAA8417340279E75B584E037BFB6E34_size92_w1076_h584.jpeg"")
辽宁成大，目前的业务分为医药医疗、金融投资、供应链服务（贸易）和能源开发四大业务板块。生物医药是重要板块，为业绩贡献不少；辽宁成大金融板块重要的是持股广发证券的股份，被称为“广发三宝”之一。
辽宁成大最新仍然持股广发证券12.5亿股，占比为16.4%，为广发证券的第二大股东。以今日上午收盘价，对应持股市值为197亿元，相当于辽宁成大目前市值的一半。
(image_address=""https://x0.ifengimg.com/res/2020/EDF6C4442C8B27642B68C36805DA3C1FCE6CADC5_size59_w971_h493.jpeg"")
今年以来，辽宁成大的股价大涨，市场认为与分拆子公司成大生物科创板上市有一定关系，成大生物为疫苗股，也是今年上半年的热门板块。",2020-09-25 18:56:29,凤凰财经
2,证监会核发2家企业IPO批文 中金公司在列,"(image_address=""https://x0.ifengimg.com/ucms/2020_39/C0600E8B177F4AFB6E6A2AECB8F9DE16E9312C66_w360_h200.jpg"")
近日，我会按法定程序核准了以下企业的首发申请：中国国际金融股份有限公司，欣贺股份有限公司。上述企业及其承销商将分别与交易所协商确定发行日程，并陆续刊登招股文件。",2020-09-25 18:54:06,凤凰财经
3,巴菲特又出手！40亿投下去，股价应声暴涨70%…,"证券时报旗下中国基金报记者文景
“股神”巴菲特又出手了！这一次，他瞄准了传统媒体。
9月24日，据海外多家媒体报道，美国广播电视公司EWScripps（SSP）拟以26.5亿美元收购同行IONMedia，巴菲特旗下的伯克希尔哈撒韦公司拟投资超6亿美元（约合40亿人民币）以支持该项收购。
(image_address=""https://x0.ifengimg.com/res/2020/D6FA8B19E66F01D0B3F7411E7A673B69CADB3305_size181_w643_h546.png"")
消息一出，EWScripps股价盘前一度大涨70%，开盘后涨幅回落至40%左右，随后接连走低，收盘时涨幅收窄至7.64%，报11.27美元/股，总市值约9.19亿美元。
(image_address=""https://x0.ifengimg.com/res/2020/62E1B261CC343A58AD3E962D53D5A4B0312B85ED_size62_w706_h786.jpeg"")
巴菲特6亿美元投资传统媒体
据外媒报道，当地时间9月24日，EWScripps在一份声明中称，作为对公司26.5亿美元收购IonMedia项目提供支持，巴菲特旗下的伯克希尔-哈撒韦公司将对EWScripps进行6亿美元的优先股投资，同时，伯克希尔还将获得认股权证，以每股13美元的价格购买多达2310万股A类EWScripps股票。
此外，作为交易的一部分，伯克希尔将获得8％的年度分红。无论是今年投资道明尼能源、巴里克黄金还是五家日本贸易公司，过去几十年中，在巴菲特投资交易背后，都有高分红因素囊括其中。
除了巴菲特的投资支持外，EWScripps还将通过举债来完成这笔收购，预计发债融资18.5亿美元。
公开信息显示，目前，EWScripps旗下拥有60家电视台，以及Bounce和CourtTV等媒体网络。IONMedia则还没有上市，由BlackDiamond资产管理公司持有，在美国62个地区拥有电视台，出品了在美国知名的《NCIS:LosAngeles》以及《LawandOrder》等节目。
业内人士认为，随着Netflix等流媒体服务和免费节目越来越受欢迎，收购IONMedia将使EWScripps能够使用其无线网络，而无需收取大额租赁费用，从而提高竞争力。
“股神”对传媒行业情有独钟
其实，这并不是巴菲特第一次盯上传媒行业。
早在1969年，巴菲特收购第一家报纸《奥马哈太阳报》开始，他对纸媒的投资兴趣从未减退过，1973年开始，曾先后对《波士顿环球》、《华盛顿邮报》、《新闻周刊》、《布法罗晚报》等媒体成功投资。他的介入曾使《华盛顿邮报》利润大增，每年平均增长35%。10年之后，巴菲特投入的1000万美元升值为两个亿。
到2012年底，美国包括《坦帕论坛报》、《里士满时讯报》等在内的63家报纸均被巴菲特收购，包括巴菲特家乡的美国《奥马哈世界先驱报》及其附带资产，作价1.5亿美元。公开资料指，这几十家报纸收购交易，巴菲特总计投入超过3亿美元。
当时，在巴菲特眼中，社区报纸意味着低价广告，当地的大型百货商店、杂货店打折，社区报纸是他们最有效的广告投放渠道。但是如今，数字化趋势明显，即便是巴菲特这样对报纸本身有情结的投资人，在收购大批报纸之后也采取了一系列数字化的举措。比如采取press+订购技术，且发力推进报纸转型为广告和数字媒体。
去年，巴菲特在股东大会上曾表示，未来对报业持悲观态度。他表示，大多数报纸已经无法被挽救，而能留下来的更多是《华尔街日报》等一些头部玩家。因此，今年1月，伯克希尔以1.4亿美元的现金价格将旗下部分报纸业务出售给了出版商LeeEnterprises。
除了报业，2014年3月，巴菲特麾下的伯克希尔哈撒韦公司曾以14亿美元，接收格雷厄姆控股旗下位于迈阿密的电视台WPLG。
今年5月，在伯克希尔向美国证券交易委员会提交的报告显示，5月21日至5月26日，伯克希尔还加仓了201.70万股自由媒体集团旗下SiriusXM股票。按照最后一笔交易价格粗略估算，巴菲特约斥资6743.97万美元。
从报业、到电视、到自媒体，再在如今6亿美元购入EWScripps优先股，巴菲特对传媒行业可谓一直情有独钟。
近期伯克希尔动作频频
过去几个月，新冠疫情导致国际市场剧烈波动，伯克希尔却动作频频，引起市场关注。
今年8月底，巴菲特旗下的伯克希尔&middot;哈撒韦公司宣布，已经收购了日本五大贸易公司（日本公司伊藤忠商事、丸红、三菱商事、三井物产和住友商事）各5%以上的股权。
此外，沃伦巴菲特曾公开表示讨厌黄金，但在伯克希尔哈撒韦公司（BerkshireHathaway）8月14日提交的13F文件显示，二季度建仓巴里克黄金，共买入2090万股，价值5.63亿美元。黄金价格今年已飙升至历史新高。8月金价一度突破每盎司2000美元，之后略有回落。在全球应对新冠疫情之际，华尔街将黄金视为避险投资。
前不久，伯克希尔哈撒韦公司又以IPO价格购买了价值2.5亿美元的Snowflake公司股票，并以上市价格从另一位投资人手中额外购买了404万股（价值超3.2亿美元）。Snowflake的股价上市首日飙升111%，达到约253.93美元，按照每股120美元的IPO定价计算，伯克希尔的持股价值从约7.3亿美元增至约15.5亿美元。这意味着“股神”巴菲特54年来首次打新，第一天就豪赚超过8亿美元（约合54亿人民币）。",2020-09-25 18:36:39,凤凰财经
4,沪指创两个月最大周跌幅，长假前一大波股票开始躁动,"指数回调、成交缩量、北向资金持续离场......本周A股市场交投情绪降温明显。
Wind数据显示，截至9月25日收盘，A股三大股指本周周线尽墨，沪指更是创下两个月来最大周跌幅。
从板块看，本周生物医药是唯一收涨板块，休闲服务本周跌幅较小，不少旅游股在9月25日逆势上扬。
在券商看来，当前市场或将呈现混合、轮动的均衡格局，建议投资者关注顺周期及大金融布局机会，中长期科技仍是主线。
沪指创两个月来最大周跌幅
北向资金净流出超230亿元
9月25日，A股三大股指开盘后呈震荡调整态势，沪指一度逼近3200点关口，市场成交额进一步萎缩。Wind数据显示，截至收盘，上证指数跌0.12%，报3219.42点；深证成指跌0.02%，报12814.17点；创业板指涨0.18%，报2540.43点。
(image_address=""https://x0.ifengimg.com/res/2020/48A3F8A509E56B91CCB409E04266AD75BEA6AA1D_size622_w1050_h1003.png"")
图片来源：Wind
从板块表现看，随着中秋十一“双节”长假渐行渐近，投资者对旅游、消费等个股关注度持续升温，从而带动休闲服务板块逆势领涨。Wind数据显示，截至收盘，申万28个一级行业跌多涨少，休闲服务以2.03%的涨幅居首，腾邦国际、岭南控股涨停，天目湖、西安饮食等多只个股跟涨。
(image_address=""https://x0.ifengimg.com/res/2020/7D3A9A35571642E559C92765FC89B1650E82792D_size772_w1075_h1963.png"")
图片来源：Wind
非银金融板块全天收涨1.18%，涨幅在申万28个一级行业中位居第二。消息面上，因有投资者猜测或与海通证券、国泰君安合并，东方证券今日股价涨停，浙商证券、东兴证券、西部证券、第一创业等纷纷跟涨，多只券商股盘中价格出现异动。
(image_address=""https://x0.ifengimg.com/res/2020/8194E72BE280CF8A39B333D2A3BE2C98BA088ECA_size800_w1075_h1935.png"")
图片来源：Wind
概念板块中，连板、在线旅游全天收涨逾3%。涨幅居前的还有营销传播、证券（一致评级）、黄金（一致评级）等概念板块，触板以6.13%跌幅居首，跌幅居前的还有生物育种、超硬材料、其他建材（一致评级）等概念板块。
(image_address=""https://x0.ifengimg.com/res/2020/35945275034C5E7FDE89A60EDA4C6D30838E5BA5_size980_w1073_h1944.png"")
图片来源：Wind
在经历上周百亿元净流入后，本周北向资金持续净流出。Wind数据显示，9月25日北向资金合计净流出12.91亿元。就全周（9月21日至9月25日）情况看，5个交易日北向资金全部维持净流出态势，9月24日当天更是大幅净流出超121亿元，创下近2个月来单日净流出新高。全周北向资金合计净流出247.09亿元，9月以来净流出近290亿元。
(image_address=""https://x0.ifengimg.com/res/2020/CECAE086B76572E388C44492E3211E40815328F3_size109_w415_h346.png"")
图片来源：Wind
在北向资金持续离场的同时，本周A股主要股指亦持续下挫。Wind数据显示，截至9月25日收盘，上证指数、深证成指、创业板指全周分别下跌3.55%、3.25%、2.14%，沪指创下最近两个月来最大周跌幅。
(image_address=""https://x0.ifengimg.com/res/2020/8877025F438672B821D8C3BE24424A558789A8E3_size587_w1051_h1082.png"")
图片来源：Wind
从成交看，本周市场交易情绪较上周进一步降温。Wind数据显示，9月25日全天两市成交额尚不足5700亿元，创下5月29日以来单日成交额新低；全周两市合计成交3.37万亿元，环比进一步下滑10.13%。
医药生物止跌企稳
后市建议关注四条主线
就全周情况看，上周领涨的汽车板块本周遭遇重挫，此前持续调整的医药生物却初显企稳迹象，休闲服务板块本周虽然下跌，但行情表现仅次于医药生物。
Wind数据显示，申万28个一级行业中，医药生物是唯一收涨板块，本周累计上涨0.51%，成分股中，正川股份、博晖创新、拱东医疗周涨幅均超过30%，康泰医学、英特集团、赛升药业周涨幅也均超过20%。休闲服务本周累计下跌1.30%，有色金属以7.20%的周跌幅领跌，汽车、房地产周跌幅均超过6%。
(image_address=""https://x0.ifengimg.com/res/2020/648598CFAF7ADD5C5F20B40D72AD65DE3D7AD4CF_size750_w1074_h1948.png"")
图片来源：Wind
从全年表现看，医药生物板块自年初开始持续上涨，到7月年内高点，累计涨幅超过68%。此后板块持续回调，截至9月25日收盘，该板块年内涨幅仍达到44.86%，在申万28个一级行业中高居第三。
(image_address=""https://x0.ifengimg.com/res/2020/83A8EA68A5EA29DF640D7A678322F851E6F3BE15_size1067_w1064_h1550.png"")
图片来源：Wind
兴业证券指出，随着疫情逐步平复，拥抱高景气主线仍然是目前最好的应对策略之一，考虑到国家在医药板块的战略性投入，创新板块预计会成为下半年持续关注的热点，长期看好创新药及创新药产业链的发展前景。推荐四线布局主线：IVD化学发光、消费医疗、创新药及产业链、创新医疗器械和创新疫苗。
对于休闲服务板块，万联证券认为，在旅游复苏态势下，国内及周边游率先恢复，由于国外的疫情还在蔓延，出境游仍需观察。短期来看，受益于疫情后的旅游复苏，看好各细分板块的龙头企业，尤其看好酒店、景区、旅行社等弹性大的板块龙头。中长期看好具备优质成长性的免税、演艺主题公园板块龙头。
风格或转向相对均衡
经历本周缩量调整，展望后市，A股还将演绎出怎样的行情？
粤开证券认为，当前的市场风格可能正在朝相对均衡的方向转变，即在经济复苏的大逻辑下，叠加科技板块的表现，市场可能不会是单纯的低估值和周期占优风格，而是呈现混合、轮动的均衡格局。
在流动性方面，北上资金近两月由净流入转为净流出，资金面的边际变化直接导致消费、科技板块的震荡回调。不过长期来看，待市场短期风险释放后，有望带动增量资金入场，在创业板低价股炒作降温后，游资和个人投资者重归价值投资。",2020-09-25 18:34:49,凤凰财经
