,title,content,pub_time,src
5,指数重挫5%，B股再现离奇暴跌！跌停公司却很淡定,"原标题：指数重挫5%，B股再现离奇暴跌！跌停公司却很淡定：“这种下跌并不异常”
长期遭受“冷遇”的B股市场，因为暴跌的缘故，重获市场的注意力。
5月12日，B股早盘上演跌停潮，逾20只个股跌幅超过9%。B股指数早盘收跌6.91%报198.38点。午后，B股指数跌幅收窄，最终下跌5.10%至202.25点。国新B、凯马B、海控B等多股遭遇跌停。
(image_address=""https://x0.ifengimg.com/ucms/2020_20/A80356AE6A4430DA55890C9E431B85307B65A079_w506_h422.png"")
沪深两市早盘亦受此影响，主要指数一度集体下挫，不过这种影响并未持续太久，A股随后止跌回升。沪指最终微跌0.11%、深成指上涨0.42%。
东沣B面值退市影响市场情绪
过去，B股暴跌通常先会解读为受汇率影响，由于深、沪两市B股分别以港币和美元交易和结算，其变动直接影响A、B股的市场价格，二者呈现出不规则的正相关关系，但这种影响通常为长期影响，且目前汇率预期稳定，因此该因素并不构成今日暴跌的原因。
那么，此次B股缘何暴跌？从证券时报&middot;e公司记者了解的情况看，主要还是因为东沣B或因“破面”退市的消息，致使市场情绪受到影响，投资者对B股改革不确定性、未来前景的担忧进一步加剧。
昨日（5月11日），东沣B停牌，因公司股票已连续20个交易日收盘价格均低于面值，其退市几乎已成定局。东沣B预计成为国内股票市场上首支因面值退市的纯B股公司。
“B股本身盘子很小，又缺少明星企业，一直吸引不到投资者的眼球，加上东沣B要退市的影响，投资者心里上不好受，下跌主要是这种心理影响。”天宝华投资（北京）副总裁于宝山告诉证券时报&middot;e公司记者。
一位长期跟踪投资B股的投资人士也向记者表示，“对这个市场很失望，对B股改革的预期比较迷茫，而且现在行情结构性不好，头部企业不错，小公司关注度很低，市场流动性很低，退市风险出来以后，可能三五个跌停股价就掉到一块以下了，很多投资者就会提前跑路了。”
目前，B股改革仍无实质性进展，相当一部分B股公司并不具备改革的能力。东沣B曾于2015年尝试股权重构改革，但因为“市场变化以及相关政策尚不明确”，在两年后宣告失败。有业内人士预估，以后非纯B股将慢慢通过重组的方式解决改革的问题，纯B股可能面临“自生自灭”。
此外，由于科创板试点注册制，加之创业板实施注册制的脚步临近，壳资源价值已大幅下降。这种趋势也加剧了投资者“越跌越害怕”的心理，促使其注重回避低价垃圾股。
除了东沣B面值退市的影响，“账号限制”也成为市场流传的下跌原因之一。有观点称，受新证券法关于个人账号不得出借影响，目前B股帐号大多是之前借用海外人士护照开户，市场担心这部分长线资金会撤离，故引发B股大跌。
于宝山认为，借用账户是以前的擦边球行为，但这种行为本身比例并不大。现在监管层的要求越来越规范化，确实对投资人、企业起到约束作用，可能存在一定的影响，但影响不大，因为投资主要还是要看企业本身的底气如何，发展如何。
上善若水资产董事长侯安扬也认为“账号限制”这一因素不会是主要原因，在他看来，B股大跌与美国资金要求从中国市场撤出的传闻有关。“我认为是美国这个原因，因为港股也明显有抛售行为。“侯安扬向证券时报&middot;e公司记者表示。从市场表现看，今日恒生指数下跌1.45%。
不过，于宝山认为上述传闻解释没办法判断，目前数据尚不能支撑这个说法。
B股市场易诱发暴跌
“我们也不知道今天为什么会大跌，大盘都在跌，没有了解过原因”，一家触及跌停的B股公司工作人员向证券时报&middot;e公司记者表示，在她看来，这种下跌并不异常。
自2015年以来，B股指数至少有超过20次当日跌幅超过5%。不过，其中多数与A股大跌同步，原因多是受外部环境因素影响。而上一次B股跌幅显著大于A股还要追溯到2016年10月17日，当时市场分析多集中于人民币汇率、深港通预期等影响。
从两个市场的联动性看，历史数据显示，B股下跌对A股市场的拖累也极为有限，一般影响只发生在当日。
值得关注的是，B股本身极易陷入“暴跌”模式。从市场规模看，wind数据显示，目前B股市场上仅有96只股票。今日B股整体异动，但B股指数全天成交金额也仅逾3亿美元。该市场交投长期处于不活跃状态，流动性较差。对于此次B股暴跌，虽然市场上并未达成一致认可的解释。但B股存在感变弱，日益边缘化已是不争事实。
此外，B股目前高度散户化，容易形成“类坐庄效应”，若投资者集中抛售，B股市场也极易诱发暴跌。
“AB股过去有明显的分工作用，现在B股发挥的作用越来越小，加之QFII、港股通等投资渠道的搭建越来越畅通，B股盘子越做越小，一旦有风吹草动，影响就更大了。”于宝山表示。",2020-05-12 20:43:15,凤凰财经
6,央行：社会融资规模大幅增长主要受三个方面合力推动,"问：4月份M2增长较快，请问您怎样看待当前货币供应量增长的？
答：今年以来，货币政策逆周期调节效果十分显著。4月末，M2同比增长11.1%，分别比上月末和上年同期高1个和2.6个百分点，增速上升较多，货币派生能力较强，货币乘数处于6.72的高水平；M1平稳增长5.5%，分别比上月末和上年同期高0.5个和2.6个百分点；4月末超储率为1.9%，比上年同期高0.7个百分点。
前4个月，人民币各项存款增加9.34万亿元，同比多增2.77万亿元。存款主要流向实体经济，住户和非金融企业新增存款8.7万亿元，占新增各项存款的93.2%。
其中，住户存款增加5.67万亿元，同比多增2265亿元，一方面，是由于疫情影响，居民消费减少，另一方面国家加大民生支持力度，居民名义收入保持正增长；非金融企业存款增加3.03万亿元，同比多增2.87万亿元，企业获得了较多信贷资金支持，有效对冲了收入下降，并为后续企业运营储备了资金；财政性存款和机关团体存款合计增加256亿元，同比少增1.56万亿元，体现了财政政策加大对实体经济支持力度。
整体来看，当前稳健的货币政策更加灵活适度，为疫情防控、复工复产和实体经济发展提供了精准的金融服务。
问：请您介绍一下，今年以来推动社会融资规模大幅增长的主要因素有哪些方面？
答：4月末，社会融资规模余额同比增长12%，为2018年6月以来最高水平。1-4月社会融资规模增量累计为14.19万亿元，与去年上半年的增量接近；其中，4月份社会融资规模增量为3.09万亿元，同比多增1.42万亿元。
社会融资规模大幅增长主要受以下三个方面合力推动：
一是金融机构进一步加大对实体经济的信贷支持。1-4月金融机构对实体经济发放的人民币贷款累计增加8.88万亿元，同比多增1.71万亿元。其中，4月对实体经济发放的人民币贷款增加1.62万亿元，同比多增7506亿元。
二是金融市场对实体经济提供的直接融资增多，企业债券和股票融资在社融中的比重明显上升。1-4月企业债券净融资为2.68万亿元，相当于去年全年企业债券净融资的80%；1-4月非金融企业股票融资1570亿元，同比增长近一倍。二者合计占社会融资规模的比重达到20%，同比高6.4个百分点，从历史上看也处于较高水平。
三是金融体系积极配合财政政策发力，推动政府债券融资大幅增加。1-4月政府债券净融资1.91万亿元，同比多5246亿元。其中，地方政府专项债券净融资1.14万亿元，同比多4373亿元。
问：贷款总体增长速度比较快，在结构上主要表现在哪些领域？
答：当前，为有力支持实体经济恢复发展，金融逆周期调控力度大幅增强，信贷投放速度明显加快。4月末，金融机构人民币贷款余额161.91万亿元，同比增长13.1%，比上月末高0.4个百分点，是2019年6月以来的最高水平；4月份新增1.70万亿元，同比多增6818亿元。
分借款主体看，企业部门贷款增速上升较快，住户部门消费贷款增长逐步恢复。4月末，企（事）业单位人民币贷款余额同比增长12.7%，比上月末高0.6个百分点；4月份新增9563亿元，同比多增6092亿元。4月份，个人消费贷款新增4782亿元，同比多增90亿元。其中，个人住房贷款新增3675亿元，同比多增173亿元，总体保持稳定。
企业贷款结构显示，金融支持实体经济的针对性和有效性提升明显，突出表现为抗疫和受疫情影响大的行业受信贷支持力度大，且较多中长期贷款流向制造业、基础设施业（注1）、服务业等关键领域。具体来看：
一是卫生和社会工作（注2）行业贷款增速大幅上升。4月末，卫生和社会工作行业贷款余额同比增长19.2%，分别比上月末和上年末高2.3和7.1个百分点；4月份新增113亿元，同比多增122亿元（去年同期减少9亿元）。信贷继续大力支持社会抗疫。
二是批发零售业贷款增速上升较快。4月末，批发零售业贷款余额同比增长8.8%，分别比上月末和上年末高0.8和4.3个百分点；4月份新增258亿元，同比多增698亿元（去年同期减少440亿元）。
三是交通运输、仓储和邮政业贷款较快增长。4月末，交通运输、仓储和邮政业贷款余额同比增长13.7%，比上月末和上年末分别高0.9和1.2个百分点；4月份新增1399亿元，同比多增1132亿元。
四是投向制造业、基础设施业、服务业等关键领域的中长期贷款增速均创近期高点。4月末，制造业中长期贷款余额同比增长17.8%，比上月末高1.1个百分点，是2011年3月以来的高点。其中，高技术制造业中长期贷款持续快速增长，月末余额同比增长39.9%，比上月末高0.7个百分点。基础设施业中长期贷款余额同比增长11.2%，比上月末高0.7个百分点，是2018年5月以来的高点。服务业（不含房地产业）中长期贷款余额同比增长14.7%，比上月末高0.7个百分点，是2018年3月以来的高点。
此外，投向房地产业的中长期贷款增速稳定，增长10.5%，与上月末持平，比上年末低0.9个百分点。
问：疫情发生以来，全社会非常关心普惠金融领域中的“小微”和“三农”获得信贷支持的情况，从总量数据看，当前贷款增长速度很快。能否介绍一下“小微”“三农”贷款增长的具体情况。
答：4月份，在各项政策引导下，金融机构继续加大对实体经济，特别是普惠领域的信贷支持，取得了较好的效果，政策效果也进一步显现。从小微企业贷款情况看，“量增、面扩、价降、结构优化”的特点更为突出。
一是普惠小微贷款加速增长。2020年4月末，普惠小微贷款（包括单户授信1000万元以下的小微企业贷款及个体工商户和小微企业主经营性贷款）余额12.6万亿元，同比增长25.1%，增速分别比上月末和上年末高1.5个和2个百分点。前4个月，普惠小微贷款累计新增1.1万亿元，占各项贷款增量的12.2%，比前3个月高0.4个百分点。
二是信贷支持小微经营主体的覆盖面继续扩大。截至2020年4月末，普惠小微贷款支持了2815万户小微经营主体，同比增长21.9%。前4个月增加117万户。从各月增长情况看，1-2月受疫情影响，仅增长18万户。3月份随着复工复产的推进，金融机构及时加大了对小微经营主体的针对性支持。3月当月增加71万户，相当于去年同期增量的四分之三；4月当月增加28万户，已基本恢复去年同期增量水平。
三是普惠小微企业贷款利率持续下降。2020年4月，当月新发放普惠小微企业贷款利率为5.24%，比上年12月下降0.77个百分点。
四是有七成多普惠小微企业贷款投向了制造业等劳动密集型行业。截至2020年4月末，普惠小微企业贷款中，制造业、批发零售业和建筑业企业贷款分别占39.3%、29.7%和7.6%，合计占76.6%。上述劳动密集型企业在疫情中受到冲击较大，信贷资金及时支持这些企业解决流动性问题和复工复产，对“保就业”也起到明显促进作用。
五是信用贷款占比提升。2020年4月末，信用贷款余额占普惠小微企业贷款的15.5%，占比比上年末提高了2个百分点。
六是涉农贷款持续回升。2020年4月末，本外币涉农贷款余额37.05万亿元，同比增长9.6%，增速比上月末高0.6个百分点，连续9个月回升；今年前4个月增加2.04万亿元，占各项贷款增量的25.0%，比上年全年水平高7.1个百分点。涉农贷款的稳步增长对农业、农村的持续发展和疫情下保持民生稳定具有积极作用。
问：请您介绍一下，一季度宏观杠杆率情况如何？
答：2017年以来，我国宏观杠杆率总体保持稳定，2018年还实现净下降，2019年仅上升约5.7个百分点，增幅远低于2008至2016年年均增长10个百分点的水平，初步实现稳杠杆目标。今年一季度，受疫情冲击影响，我国宏观杠杆率有显著的上升。
应该看到，一季度宏观杠杆率的回升，是逆周期政策支持实体经济复工复产的体现。在疫情防控常态化前提下，逆周期政策的制定应对疫情防控和经济社会发展做统筹考虑，把更好支持实体经济恢复发展放到更加突出位置，同时，做好金融风险防控。在这个过程中，当前应当允许宏观杠杆率有阶段性的上升，扩大对实体经济的信用支持，这主要是为了有效推进复工复产，这实际上为未来更好地保持合理的宏观杠杆率水平创造了条件。
虽然一季度宏观杠杆率显著回升，但只是阶段性的。特别是逆周期政策支持实体经济复工复产取得显著成效，向实体经济传导效率明显提升，生产秩序加快恢复。人民银行对全国1万家实体企业的调查显示，4月末，工业生产基本修复到位，服务业开工率持续回升，97.5%的企业已复产，超半数工业企业设备利用率已达到或超过上年二季度平均水平。
注1：包括交通运输、仓储和邮政业，水电气的生产和供应业，水利环境和公共设施管理业。
注2：社会工作是指提供慈善、救助、福利、护理、帮助等社会工作的活动。",2020-05-12 20:37:08,凤凰财经
7,美国4月季调后CPI月率录得-0.8%，刷新2008年11月以来新低。=,财联社5月12日讯，美国4月核心CPI环比下跌0.4%，为有史以来最大月跌幅。,2020-05-12 20:35:44,凤凰财经
8,华统股份：获温氏投资举牌,财联社5月12日讯，华统股份公告，本次权益变动前，温氏投资持有896.23万股上市公司股份，占上市公司股份总数的3.23%。温氏投资于2020年4月27日至2020年5月12日期间以自有资金通过深交所证券交易系统大宗交易方式进行本次权益变动后，温氏投资持有1386.99万股上市公司股份，占上市公司股份总数的5.00%。,2020-05-12 20:35:13,凤凰财经
