,title,content,pub_time,src
0,双循环、房住不炒、存款利率下降，央行二季度货币政策执行报告说了啥？,"8月6日，中国人民银行发布2020年第二季度中国货币政策执行报告（以下称“报告”），报告从货币信贷情况、货币政策操作、宏观经济形势等多方面，梳理了二季度中国金融市场发展状况，并指出了下阶段主要的政策思路。
首提：国内大循环为主体、国内国际双循环相互促进的新发展格局
本次报告中，央行首次提出要协调好本外币政策，处理好内外经济平衡，加快形成以国内大循环为主体、国内国际双循环相互促进的新发展格局。
央行表示，稳健的货币政策更加灵活适度、精准导向，保持货币供应量和社会融资规模合理增长，完善跨周期设计和调节，处理好稳增长、保就业、调结构、防风险、控通胀的关系，实现稳增长和防风险长期均衡。
要增强针对性和时效性，根据疫情防控和经济金融形势把握货币政策操作的力度、节奏和重点，坚持把支持实体经济恢复与可持续发展放到更加突出的位置，综合运用并创新多种货币政策工具，保持流动性合理充裕，疏通货币政策传导机制，有效发挥结构性货币政策工具的精准滴灌作用，提高政策的“直达性”，支持实体经济特别是中小微企业渡过难关、平稳发展。多渠道做好预期引导工作，保持物价水平基本稳定。深化金融供给侧结构性改革，推动金融、科技和产业形成良性循环和三角互动，协调好本外币政策，处理好内外经济平衡，加快形成以国内大循环为主体、国内国际双循环相互促进的新发展格局。
信贷调结构：强调房住不炒
疫情对经济发展带来冲击，在此情况下，如深圳等部分地区房地产市场再次出现过热现象。在本次报告中，央行表示要发挥货币信贷政策促进经济结构调整的作用，尤其强调牢牢坚持房子是用来住的、不是用来炒的定位，坚持不将房地产作为短期刺激经济的手段，坚持稳地价、稳房价、稳预期，保持房地产金融政策的连续性、一致性、稳定性，实施好房地产金融审慎管理制度。
从上半年房地产发展情况来看，在固定资产投资方面，房地产开发投资复苏较快，制造业投资恢复较缓。上半年，房地产开发投资、制造业投资同比增速分别为1.9%、-11.7%，比1~5月回升2.2和3.1个百分点；上半年全国房地产开发投资6.3万亿元，同比增长1.9%，增速较第一季度提高9.6个百分点。
在房地产贷款方面，上半年房地产贷款增速稳中趋缓。6月末，全国主要金融机构(含外资)房地产贷款余额47.4万亿元，同比增长13.1%，增速较3月末回落0.8个百分点。
从总量到结构：完善结构性货币政策
在一季度疫情影响最严重的时候，央行加大了逆周期调节力度，市场流动性十分充裕。但随着疫情好转和经济复苏，央行也在逐步回收流动性，超宽松货币政策逐步退出。在本次报告的专栏：完善结构性货币政策工具体系中，央行也强调了结构性货币政策工具运用力度。
具体来看，一是进一步完善“三档两优”存款准备金框架。3月16日实施普惠金融定向降准，释放长期资金约5500亿元用于支持发放普惠金融领域贷款。4月3日宣布针对农村商业银行等中小金融机构和仅在本省级行政区域内经营的城市商业银行实施降准，释放长期资金约4000亿元。
二是为应对疫情冲击，先后出台3000亿元专项再贷款、5000亿元和1万亿元普惠性再贷款、再贴现政策。截至6月末，3000亿元专项再贷款和5000亿元再贷款、再贴现政策已基本执行完毕。其中，3000亿元专项再贷款支持有关银行向7597家全国性和地方性重点企业累计发放优惠贷款2834亿元，5000亿元再贷款、再贴现政策支持地方法人银行向59万家企业累计发放优惠利率贷款4983亿元。1万亿元再贷款、再贴现政策有序衔接，截至7月27日，累计发放优惠利率贷款4573亿元，支持企业和农户78万户，户均贷款59万元。
三是创新两个直达实体经济的货币政策工具。为鼓励地方法人银行缓解中小微企业贷款的还本付息压力，创设了普惠小微企业贷款延期支持工具，提供400亿元再贷款资金，预计可支持地方法人银行对普惠小微企业延期贷款本金约3.7万亿元；为缓解小微企业缺乏抵押担保的痛点，提高小微企业信用贷款比重，创设了普惠小微企业信用贷款支持计划，提供4000亿元再贷款资金，预计可带动地方法人银行新发放普惠小微企业信用贷款约1万亿元。近期，人民银行对地方法人银行于2020年3月1日至5月31日发放的符合条件的信用贷款开展了首次信用贷款支持计划操作，首次信用贷款支持计划共向地方法人银行提供资金支持270亿元，近期即将开展贷款延期支持工具的首次利率互换操作。
LPR改革带动存款利率下调
央行表示，改革以来，LPR报价逐步下行，较好地反映央行货币政策取向和市场资金供求状况，已成为银行贷款利率定价的主要参考，并已内化到银行内部资金转移定价(FTP)中，原有的贷款利率隐性下限被完全打破，货币政策传导渠道有效疏通，“MLF利率→LPR→贷款利率”的利率传导机制已得到充分体现。
同时，LPR改革也有效地推动了存款利率市场化。
2015年10月以来，存款基准利率未作调整，但存款利率的上下限均已放开，银行实际执行的存款利率可自主浮动定价。随着LPR改革深入推进，贷款利率的市场化水平明显提高，已经和市场接轨。改革以来贷款利率明显下行，为了与资产收益相匹配，银行会适当降低其负债成本，高息揽储的动力随之下降，从而引导存款利率下行。从实际情况看，在存款基准利率保持不变的情况下，近期银行各期限存款利率均有所下降。
6月，几家大型银行主动下调了3年期、5年期大额存单发行利率，股份制银行随之作了相应下调，部分地方法人银行的存款利率也有所下行。2020年6月，国有大行、股份制银行大额存单加权平均利率分别为2.64%和2.71%，较2019年12月下降30个和34个基点。代表性的货币市场基金收益率也已降至1.5%以下，低于1年期存款基准利率。结构性存款和银行理财产品收益率均有所下行。这充分体现了通过LPR改革促进降低存款利率的市场机制已经发挥作用，货币政策向存款利率的传导效率也得到提高，存款利率市场化改革取得重要进展。
央行表示，下阶段会继续深化利率、汇率市场化改革，提高金融资源配置效率。推动LPR改革，按照市场化、法治化原则，于8月底基本完成存量浮动利率贷款定价基准转换工作，疏通货币政策传导机制，用改革的办法推动综合融资成本明显下降。发挥好市场利率定价自律机制作用，规范存款利率定价行为，维护公平定价秩序，督促金融机构严格落实明示贷款年化利率的要求，切实保护金融消费者权益。深化汇率市场化改革，完善以市场供求为基础、参考一篮子货币进行调节、有管理的浮动汇率制度，保持人民币汇率弹性，发挥汇率调节宏观经济和国际收支自动稳定器作用。稳定市场预期，保持人民币汇率在合理均衡水平上的基本稳定。加快发展外汇市场，为基于实需原则的进出口企业提供汇率风险管理服务。引导企业树立“风险中性”的财务理念，通过外汇衍生品管理汇率风险。稳步推进人民币资本项目可兑换，完善人民币跨境使用的政策框架和基础设施，支持人民币在跨境贸易和投资中的可自由使用。
加强债券市场建设
完善金融市场体系，切实发挥好金融市场在稳增长、调结构、促改革和防风险方面的作用。加强债券市场市场化、法治化、国际化建设，以发展促创新，提升债券市场服务实体经济能力。
一是加强制度建设、完善债券市场管理制度，促进制度标准统一，提升债券市场效率，支持民营企业发行债券融资。二是坚持市场化、法治化原则，完善债券违约风险防范和处置机制。三是加强金融市场基础设施统筹监管与互联互通，推进托管行与交易报告库建设，确保金融市场安全整体稳定和高效运行。四是积极稳妥推动债券市场制度性、系统性开放，引入更多中长期投资者。
在债券市场发展方面，今年受金融开放利好政策和疫情之下中国经济预期相对稳定的影响，外资大幅增持人民币债券。8月4日，中央结算公司最新发布的7月债券托管量最新数据显示，七月境外机构的人民币债券托管面额达到23441.24亿元，较6月环比骤增1481.13亿元，创下今年以来最大的单月增幅。
不存在长期通胀或通缩基础
在判断下阶段中国宏观经济形式的时候，央行表示物价涨幅总体下行，不存在长期通胀或通缩的基础。
央行表示，2020年初CPI同比涨幅走高至5%以上，主要是猪肉价格较快上涨拉动，同时叠加疫情对供给的影响,既有结构性特征，又有阶段性特点。随着各部门多举措保供稳价，货币政策保持稳健，2月以来物价涨幅稳步回落至3%以下，初步估计全年CPI涨幅均值将处于合理区间。
第二季度以来，多种大宗商品价格出现不同程度回升，PPI环比涨幅转正、
同比降幅收窄，也反映出需求回暖。近期部分省份汛情可能给农产品生产运输造成一些影响，发达经济体货币供应量快速攀升未来可能推高大宗商品价格，加之全球疫情演进及防控措施对供应链、产业链的
冲击还有不确定性，仍需对各种因素可能导致的短期物价扰动保持密切关注。中长期看，我国经济运行总体平稳,总供求基本平衡，供给侧结构性改革深入推进，市场机制作用得到更好发挥，货币政策保持稳健，货币条件合理适度，不存在长期通胀或通缩的基础。
金融防风险：支持中小银行多渠道补充资本和完善治理
央行在报告中表示，要继续打好防范化解重大金融风险攻坚战，确保风险总体可控、持续收敛，坚决守住不发生系统性风险的底线。在巩固攻坚战取得的阶段性成果基础上，坚持“稳定大局、统筹协调、分类施策、精准拆弹”的基本方针和政策，统筹考虑宏观经济形势新变化，把握好抗击疫情、恢复经济和防控风险之间的关系，稳妥推进各项风险化解任务，牢牢守住不发生系统性金融风险的底线。支持银行特别是中小银行多渠道补充资本和完善治理，加大不良贷款处置力度，增强金融机构的稳健性。
今年国常会、央行会议等多次会议都提到了中小银行资本补充问题，推动中小银行资本补充、化解地方金融机构风险是今年金融防风险工作重点。在中小银行资本补充方面，在扩展中小银行资本补充渠道方面，今年7月1日的国常会表示地方专项债可用于补充银行资本。
近年来，中小银行风险事件频发，包括锦州银行、包商银行风险事件等，部分地区还冒出因当地银行行长被捕而造成的挤兑风险。近期，包商银行接管组组长周学东在《中国金融》上撰文表示，诸多中小银行的风险，其背后的根源在于公司治理失灵。以包商银行为例，包括大股东操纵股东大会，干预银行正常经营，通过各种方式进行利益输送；董事会形同虚设；监事会监督职能弱化等。
对此，本次报告中也提到要以强化公司治理机制为核心，持续深化商业银行和其他金融企业改革，规范股东大会、董事会、监事会与管理层关系，完善经营授权制度，形成有效的决策、执行、制衡机制，提高经营管理水平和风险控制能力。",2020-08-06 19:52:38,凤凰财经
1,美国大选进入烧钱冲刺阶段，候选人是这样寻找“金主”的,"美国总统特朗普的竞选团队和共和党全国委员会于当地时间周三（5日）晚间宣布，他们在7月总共筹集了1.65亿美元。此前，美国民主党总统候选人拜登的团队和民主党全国委员会公布了7月筹款总额约为1.4亿美元。
根据美国联邦选举委员会(FEC)的统计，截至7月底，特朗普竞选团队与共和党全国委员会的银行存款总计约3亿美元，拜登和民主党方面则为2.94亿美元，差距约600万美元。
(image_address=""https://x0.ifengimg.com/ucms/2020_32/0DE7AFB0BDFAA463E99D323B182B03F1C87E2461_w640_h360.jpg"")
拜登筹款靠名人，特朗普靠晚宴
特朗普竞选团队表示，7月筹款金额是自特朗普宣布竞选连任以来的最佳表现。此前的5月和6月，特朗普的竞选筹款曾连续两个月落后于拜登。
数月来，由于新冠肺炎疫情，两位候选人基本上都是通过云竞选的方式为自己的竞选助威。拜登在这段时间里举办了多场线上筹款活动，与著名主持人合作，平均每场“云筹款”都能筹到数百万美元。为拜登或民主党全国委员会捐款超过50万美元以上的“金主”主要来自硅谷、好莱坞、华尔街等，包括了苹果创始人乔布斯的遗孀、慈善家劳瑞尼&middot;乔布斯(LaureneJobs)，金融大鳄索罗斯，好莱坞电影大亨卡森伯格（JeffreyKatzenberg），以及脸书（Facebook）联合创始人达斯汀&middot;莫斯科维茨(DustinMoskovitz)等。
在拜登确定成为民主党总统候选人后，此前支持其他民主党候选人的“金主”纷纷转而支持拜登。在他们中有媒体大亨默多克的长子詹姆士&middot;默多克，他在民主党初选中曾支持南本德市市长布蒂吉格。而6月起，詹姆士&middot;默多克和他的妻子已分别向拜登捐赠了61.5万美元。
根据FEC的记录，今年第二季度，拜登筹款的总数约为2.83亿美元，超过了特朗普的2.66亿美元。外界认为，特朗普之所以在这段时间落后，主要是因为疫情。
6月11日，特朗普亲自出席了近3个月来的首次竞选筹款活动，当天在得克萨斯州达拉斯举行的筹款晚宴上，他总共筹得了1000万美元。自7月开始，特朗普的竞选活动逐渐增加，先后在佛罗里达州的迈阿密和坦帕湾，以及得克萨斯州的石油重镇奥德萨(Odessa)举行了三场筹款活动，这些筹款活动的门票从2800美元到10万美元不等。
广告大战一触即发
传统上，候选人在筹款和广告投放上开始被比较，也意味着大选进入了冲刺阶段。
特朗普团队6月在竞选广告上投入了超过5000万美元，是5月投入的两倍；拜登团队从6月下旬也开始进行大规模的广告投入，当月的广告支出超过1700万美元，比5月的17.5万美元大幅增加。
特朗普竞选团队本月公布，他们计划在今秋投入1.47亿美元用于电视和电子媒体的广告；拜登团队周三（8月5日）也宣布，今年秋季将投入2.8亿美元用于广告宣传。
根据FEC的记录，在本届大选中，民主党在摇摆州的广告投入比2016年要高6倍，共和党在摇摆州的广告投入比2016年高5倍。
2016年1月到7月，希拉里&middot;克林顿竞选团队在威斯康星州的广告投入为约280万美元、在宾夕法尼亚州投入约180万美元、在密歇根州投入约170万美元；同期，特朗普竞选团队在威斯康星州的广告投入为约110万美元、密歇根州约180万美元、宾夕法尼亚州则投入140万美元。
而在2020年的1月到7月，拜登在威斯康星州的广告投入为960万美元、宾夕法尼亚州1730万美元、密歇根州1240万美元；同期，特朗普团队在这些州的广告投入依次为威斯康星州560万美元、密歇根州520万美元、宾夕法尼亚州560万美元。",2020-08-06 19:41:17,凤凰财经
2,WEMONEY研究室日报：香港客户北上购买内地保险成趋势；年内48名银行高管任职资格被否,"WEMONEY研究室日报：香港客户北上购买内地保险成趋势；年内48名银行高管任职资格被否2020年08月06日 19:34:35
来源：凤凰网财经WEMONEY
来源：WEMONEY研究室（ID：wemoney1）
还记得信息评估费吗？芒芒分期换套路以VIP会员费收割用户，快捷通提供支付通道
近日，市面上又出现收取信息评估费类似情况，只不过当初的“信息评估费”已经化身“VIP会员”。据用户向WEMONEY研究室反映，在一款贷款超市里下载了“芒芒分期”借款APP，填完身份信息和银行卡后，就被强制划走298元VIP会员费。这位用户称，本来是想借钱的，没想到反被扣钱了，而且现在无法登陆该APP，更没法借钱。黑猫投诉上用户称，快捷通为芒芒分期、金宝商城等商户提供支付渠道，免密划走会员费等。从投诉信息看，快捷通合作过多个不合规商户。【WEMONEY研究室】
保险业变局：赴港买保险渐成历史 内地保险吸引香港客户北上
曾几何时，内地客户热衷于南下赴港专门购买保险产品，所看重的是香港保险市场保费低、保额高、产品灵活，以及资产境外配置的优势。然而，近年来，随着内地保险市场的越加成熟，保险产品的种类及服务得到了极大提升，内地客户赴港买保险的热度日渐降低，反倒是吸引了不少香港客户专门到内地来配置保险产品。2020年以来，受新冠疫情影响，港澳个人游几乎冰冻，2020年一季度，香港长期业务（不包括退休计划业务）的新造保单保费为351亿港元，同比下降27.5%，内地访客带来的新造保单保费为54亿港元，同比下滑57.7%。2015年以来，随着“粤港澳大湾区”概念被提出，以及《粤港澳大湾区发展规划纲要》、《关于金融支持粤港澳大湾区建设的意见》等政策文件的相继落地，大湾区内保险互联互通渐行渐近。随着保险互联互通的推动，香港客户也开始将视线转向了内地保险市场。【第一财经】
年内48名银行高管任职资格被否 资格考试成主要""试金石""
据不完全统计，2020年1-7月，银保监会官网发布了67份不予核准任职资格的批复。其中，48名银行机构高管任职资格被否，19名保险机构高管任职资格被否。四成左右高管任职资格被否的原因是“未通过任职资格考试或专业知识测试”，此外还有“不具有担任拟任职务所需的相关知识、经验及能力”“不具有良好的守法合规记录”“有故意犯罪记录”等原因。【中国银行保险报】
人行济南分行：山东已上线99个金融科技应用项目
2019年8月人民银行印发《金融科技（FinTech）发展规划（2019－2021年）》（下称《发展规划》）以来，人民银行济南分行把握金融科技发展机遇，积极筹谋部署应用试点，推动省内金融机构开展金融科技创新探索，全省金融科技发展势头良好，在服务实体经济、实施普惠金融、提升金融科技监管效能等方面取得显著实效。近日，人民银行济南分行介绍，2019年8月《发展规划》出台以来，已上线99个金融科技应用项目，聚焦大数据、人工智能等前沿技术，涵盖供应链金融等多个应用场景。【移动支付网】
江南农商行又被罚了50万 停摆两年的IPO之行还有戏吗？
8月4日，银保监会江苏监管局官网公布了一则由常州银保监分局开出的罚单：江苏江南农村商业银行股份有限公司（下称江南农商行）因在开展同业投资业务过程中提供信用担保，被处罚款人民币50万元。此前，江南农商行于6月16日曾因网络安全工作严重不足，被江苏银保监局罚了人民币30万元，距今尚不足2个月。不光是网络安全工作严重不足及信贷业务等内控问题突出，江南农商行还数次遭遇过大额贷款诈骗案件。实际上，江南农商行目前还处在IPO的过程。然而，一晃马上两年时间过去了，江南农商行上市进程始终没能传出更新的消息。【江苏金融圈】
银行业大幅降薪？中信集团发文要求节流100亿 有上市银行员工称已变相降薪
近日，一则关于银行大幅度降薪的传闻在社交媒体流传。8月6日，记者获悉，中信集团7月发文要求，达成费用成本“双控”、质量效率“双升”，实现 2020 年度开源增效 50 亿元、节流降本100亿元目标。实施主体覆盖集团、股份、有限三层总部与各一级子公司，由各一级子公司向下属各级子公司层层传导分解管控目标。另有一上市股份行人士表示，该分行今年变相降薪。但不是直接下调，而是通过与业绩挂钩的方式调整，例如工资原来只有1/3和业绩挂钩，现在2/3和业绩挂钩，由于今年业绩难做，工资变相下降。【21世纪经济报道】
人民币版运通百夫长卡来了！中国首家合资银行卡清算系统低调上线
8月6日凌晨，美国运通公司通过官方网站正式宣布，历经近两年的筹备，由连通（杭州）技术服务有限公司运营的银行卡清算系统正式上线。与此同时，美国运通网站还公布了数个版本的以“37”开头的运通人民币信用卡，正式对中国消费者开放申请。连通公司筹划开业已超两年时间。据悉，美国运通成为了国内首家，也是目前唯一一家获得《银行卡清算业务许可证》的外卡组织。早在2017年，运通和连连数字科技有限公司便已合资成立连通（杭州）技术服务有限公司；2018年11月，运通向央行提交银行卡清算机构筹备申请，已获得央行、银保监会审查通过。【界面财经】
OKEx起诉一名四川用户追讨被盗取的比特币 价值数百万元
境外数字货币交易平台OKEx起诉用户“盗取”比特币。8月5日，记者从OKEx处获悉，OKEx委托北京天达共和律师事务所张雷律师团队起诉四川邓某明，追讨其在OKEx平台上“盗取”的若干比特币。据悉，2020年7月25日，此案在四川省都江堰市人民法院正式立案。目前，此案正在审理过程中。据律师介绍，邓某明的操作手法非常隐蔽和老到，截至诉讼时，OKEx因此案的损失可达数百万元。【澎湃新闻网】
整理：张国栋",2020-08-06 19:34:35,凤凰财经
