,title,content,pub_time,src
9,"暴跌之夜！瑞幸咖啡1小时6度""跌崩""，市值蒸发超7成","暴跌之夜！瑞幸咖啡1小时6度""跌崩""，市值蒸发超7成2020年04月03日 06:39:55
来源：证券时报
原标题：暴跌之夜！瑞幸咖啡1小时6度""跌崩""，市值蒸发超7成！自曝22亿财务造假，158家机构被埋，星巴克偷着乐？
(image_address=""https://x0.ifengimg.com/ucms/2020_14/88458B552CB79C6D0BFC33D8EAC316C7C08CF0DD_w600_h333.png"")
瑞幸咖啡的故事，似乎终于到讲不下去的时候了。
北京时间4月2日晚间，瑞幸咖啡在公告中自曝，该公司COO刘健涉嫌伪造22亿元人民币销售额。突如其来的丑闻，使瑞幸咖啡股价在盘前一度大跌超过85%并触发熔断。
(image_address=""https://x0.ifengimg.com/ucms/2020_14/8BF3503EA9B75A121B5CC61E0667FDEFBEEF174D_w889_h381.png"")
截至北京时间23：50，瑞幸咖啡盘中第六度暂停交易，目前跌72.94%，股价报7.09美元，市值蒸发约48亿美元（约人民币340.5亿元）。
(image_address=""https://x0.ifengimg.com/ucms/2020_14/7130A5BAF5AFABC42C7EB7AF8CEF3FBDE6FB0832_w604_h703.png"")
值得一提的是，星巴克盘中大涨近10%，随后涨幅回落，截至北京时间11点50分，股价报64.71美元，涨3.34%。
(image_address=""https://x0.ifengimg.com/ucms/2020_14/138A31C8C21B3FC4C2B5282518279194DCACCF89_w604_h707.png"")
瑞幸咖啡董事会已成立特别委员会，专门负责内部调查在2019年年度财报审计期间提请董事会注意的一些问题，目前该调查仍处于初步阶段。
特别委员会由三名独立董事Mr. Sean Shao、Mr.Tianruo Pu、Mr. Wai Yuen Chong组成，由Mr. Sean Shao担任主席，Mr. Tianruo Pu 和 Mr. Wai Yuen Chong则是3月27日瑞幸咖啡刚刚任命的独立董事。特别委员会已就内部调查保留了独立法律顾问和法务会计师，Kirkland＆Ellis将在FTI Consulting的协助下担任独立的法务会计专家。
内部调查初步阶段确定的信息表明，瑞幸咖啡首席运营官（COO）兼董事刘健以及几名下属从事了捏造交易等不当行为，从2019年2季度到4季度期间，涉及伪造销售总金额约为22亿元人民币，期间某些成本和费用也因此大幅膨胀。
特别委员会表示，上述数字尚未经过独立验证，可能会随着内部调查的进行而改变。瑞幸咖啡正在评估不当行为对其财务报表的整体财务影响，并提醒投资者不应再依赖瑞幸咖啡之前的财务报表和收益发布。
此外，特别委员会还建议采取某些临时补救措施，包括暂停刘健和与不当行为有牵连的雇员的职务，暂停和终止合同，并与被查明的伪造交易的有关各方进行交易。审计委员会接受并执行了这些建议。
瑞幸咖啡表示，将采取一切适当的行动，包括法律行动，让行为不当的个人为自己的行为负责。瑞幸咖啡还将在适当的时候发布更多关于内部调查的信息，并致力于采取适当的措施来改善内部控制。
曾反驳浑水做空报告
事实上，早在今年1月31日，浑水公司就曾宣布收到一份做空报告，直指瑞幸咖啡涉及造假。彼时浑水公司认为内容属实，并在社交媒体上公开报告，宣布做空瑞幸咖啡。瑞幸咖啡股价也因此一度下跌20%以上。
该报告认为，瑞幸咖啡从2019年第三季度开始捏造财务和运营数据，夸大门店的每日订单量、每笔订单包含的商品数、每件商品的净售价，从而营造出单店盈利的假象。又通过夸大广告支出，虚报除咖啡外其他商品的占比来掩盖单店亏损的事实。
(image_address=""https://x0.ifengimg.com/ucms/2020_14/1E307C8E1E012F37F73E6E899FF0632998299A48_w895_h440.png"")
然而瑞幸咖啡却在2月3日发布公告，称该报告包含误导性和虚假信息，坚决否认报告中的所有指控。瑞幸咖啡还认为，这一报告恶意攻击了其管理团队、股东和业务合作伙伴，对公司业务模式和运营环境存在根本误解。
然而如今泡沫破裂，裸泳的瑞幸咖啡终于暴露在了大众视野中。
其实，瑞幸咖啡的“烧钱”模式在业内始终争议颇多。2019年8月，基石资本董事长张维曾一针见血地点出，瑞幸咖啡本质上是一个传统的咖啡/饮料企业，能否成功的关键在于其运营咖啡店的传统能力，期待瑞幸咖啡早日证明自己运营能力，届时才能判断它的真正价值。
“无论瑞幸咖啡的模式最后能否成功，都不适合采用烧钱的方式去扩张，精细化运作的效果会更好。”东兴证券计算机行业分析师此前也提到，瑞幸咖啡的商业模式并不存在突破某个临界点，就可以战胜竞争对手，建立长期的护城河，因此其烧钱带来的长期价值并不大。
(image_address=""https://x0.ifengimg.com/ucms/2020_14/93F5F1824A1A6D018617D5954C71AC5E15F5A04D_w1036_h850.png"")
然而在此之前，包括安信证券、国盛证券、中泰证券、天风证券在内的多位分析师，仍在为瑞幸摇旗呐喊。所幸，互联网是有记忆的，不知道那些曾经给予瑞幸咖啡买入评级的分析师，此刻作何感想？
海内外或同遭法律追责
与此同时，针对此前浑水报告带来的瑞幸咖啡股价暴跌，美国多家律师事务所发布声明，提醒投资者有关瑞幸咖啡的集体诉讼即将到达最后提交期限。
(image_address=""https://x0.ifengimg.com/ucms/2020_14/8AF14970F9255653B0FD6919297FBE7DD49554E7_w846_h812.png"")
来自Globe Newswire的消息显示，包括Pomerantz LLP、Bragar Eagel & Squire、
The Rosen Law Firm PA等在内，多家美国法律事务所均表示，在2019年11月13日至2020年1月31日间购买过瑞幸咖啡股票的投资者如果试图追回损失，应当在4月13日之前完成诉讼提交。
据悉，已有多家律所对瑞幸咖啡提起集体诉讼，控告瑞幸咖啡作出虚假和误导性陈述，违反美国证券法。该项集体诉讼已于2月13日在纽约南区地方法院立案。
(image_address=""https://x0.ifengimg.com/ucms/2020_14/8D643784D54A125A2519265313A2E0D6F3D4BE8F_w586_h498.png"")
截至2019年年底，共有158家机构投资者持有瑞幸咖啡股票，持股总数达4.6亿股，股比达23.93%。而在2019年3季度末，仅有94家机构投资者持有瑞幸咖啡股票，持股总数也仅为3亿股。这意味着，仅2019年四季度，就有64家机构新进入场，如今被埋在了坑底。
(image_address=""https://x0.ifengimg.com/ucms/2020_14/64554A5BD1E26F0424B3DC5DCDDC9B1C963E45C9_w738_h598.png"")
而从机构持股明细来看，截至2019年年底，12家机构持有超过千万股瑞幸咖啡股票，其中既有美国银行、瑞银这样的国际知名投行，也不乏Capital Research Global Investors（全球资本研究投资者基金）、LONE PINE CAPITAL LLC（孤松资本）这样的著名对冲基金。
值得注意的是，最新修订的《证券法》新增规定：“在中华人民共和国境外的证券发行和交易活动，扰乱中华人民共和国境内市场秩序，损害境内投资者合法权益的，依照本法有关规定处理并追究法律责任。”
这意味着，即便瑞幸咖啡远赴美国上市，但亦有可能在国内遭遇法律追责。
此外，瑞幸咖啡还在今年1月通过瑞信、摩根士丹利、中金公司、海通国际证券、KeyBanc Capital Markets和Needham发行900万美国存托股票（ADS），其中股东发售480万股。
彼时，瑞幸咖啡表示，计划将发行所得净款项用于包括网络扩展、资本支出和研究等一般公司用途，并承诺不会从股东出售ADS中获得任何收入。如今这一行为是否涉及欺诈发行，尚需打上一个问号。
入市投资谋增值，开户就选广发【马上点击开户】",2020-04-03 06:39:55,凤凰财经
10,鼓励汽车消费政策扎堆出台 细分领域迎红利,"鼓励汽车消费政策近日不断出台，包括将新能源汽车购置补贴和免征购置税政策延长2年等。分析人士指出，补贴延长可推动新能源汽车市场持续增长，带动上游电池、电机和电控关键零部件增长。
促进汽车消费
3月31日国务院常务会议确定，为促进汽车消费，将新能源汽车购置补贴和免征购置税政策延长2年。
3月23日商务部办公厅、国家发展改革委办公厅、国家卫生健康委办公厅联合发布的《关于支持商贸流通企业复工营业的通知》指出，稳住汽车消费，各地商务主管部门要积极推动出台新车购置补贴、汽车“以旧换新”补贴、取消皮卡进城限制、促进二手车便利交易等措施，组织开展汽车促销活动，实施汽车限购措施地区的商务主管部门要积极推动优化汽车限购措施，稳定和扩大汽车消费。
3月13日国家发改委、工信部等23个部门联合发布《关于促进消费扩容提质加快形成强大国内市场的实施意见》，提出促进消费体制机制，进一步改善消费环境。汽车作为传统大宗消费产品，政策再次重点提及。
据中国证券报记者不完全统计，浙江、吉林、湖南、广州、佛山、珠海、南昌等省、市陆续出台促进汽车消费政策，通过汽车下乡、新能源汽车购车补贴、鼓励购买“国六”标准新车等方式，促进汽车消费。
全国乘用车市场联席会秘书长崔东树表示，新能源汽车补贴延长的政策会拉动2020年产量达到160万辆，同比增长23%。
不过，新能源汽车市场销量不容乐观。中国汽车工业协会数据显示，2019年新能源汽车累计销量为120.6万辆，同比下降4%。今年1-2月我国新能源汽车生产5万辆，同比下降63%。其中，新能源乘用车市场累计下降58%。中国汽车工业协会副总工程师许海东指出，新能源汽车销量下滑与补贴退坡有直接关系。
“多数城市要求购买本地生产和销售的汽车才能获得当地政府补贴。地方政府鼓励汽车消费最终还是为了推动本地汽车产业发展。”伊维智库研究总监吴辉向中国证券报记者表示。
产业链受益
吴辉表示，补贴延长能降低疫情对新能源汽车产业的负面影响，带动上游电池电机和电控的关键零部件增长，“行业洗牌进程延缓，尤其是电池环节。补贴延长使得外资大规模渗透更加不确定，补贴给了国内企业更多时间和机会。”
从市场结构来看，纯电动汽车是新能源汽车的销售主力，锂电产业链将直接受益。高工产业研究院（GGII）统计数据显示，2019年我国新能源乘用车累计生产约102.4万辆，同比增长2%，动力电池装机量约42.24GWh，同比增长28%。其中，排名前十动力企业合计装机量约为37.58GWh，占新能源乘用车整体的88.96%，头部效应明显。
吴辉指出，由于补贴延长，车企对动力电池企业降价压力缩小，补贴大概率会倾向高能量密度产品，对动力电池企业、三元材料企业等有利。
国务院常务会议提出，中央财政采取以奖代补，支持京津冀等重点地区淘汰国三及以下排放标准柴油货车。对二手车经销企业销售旧车，从5月1日至2023年底减按销售额0.5%征收增值税。
中国汽车流通协会认为，这将有利于激发二手车企业的积极性，释放市场活力，推动二手车市场健康有序发展。同时，新车经销商可以通过开展二手车业务实现快速发展，提高置换率，拉动新车销售，新车市场与二手车市场的联系将更加紧密。",2020-04-03 06:29:06,凤凰财经
11,“云调研”+频繁举牌 险资解码选股路线图,"3月，60家保险公司及保险资管公司通过视频会议形式对87家A股上市公司进行了“云调研”，调研次数共计234次；中国保险行业协会（简称中保协）日前披露的数据显示，险企3月份举牌上市公司股票的次数达四次，整个一季度举牌达13次，已超2019年全年。险企调研关注了哪些行业和企业？举牌了哪些标的？这些动作和信息或暗藏着保险资金投资布局、入市选股的密码。
中小型险企调研积极
业内人士称，不同于以往的现场会议为主的实地调研，保险机构3月的调研方式延续了2月“云调研”的风格，均采用“视频会议”形式。
Wind数据显示，今年3月60家保险公司或保险资管公司参与A股上市公司调研共计234次；而在2月份，84家保险公司或保险资管公司调研共计411次。3月参与调研的险企数量及调研次数均环比减少，险资调研节奏放缓。
从调研次数来看，平安养老“最勤奋”，该公司3月份参与调研次数为32次。国寿养老、太平养老、长江养老、前海人寿、国华人寿调研均超10次。从调研次数而言，中小型险企的调研积极性有所提高。
从调研对象来看，中小板和创业板上市公司仍为险企关注之重点，其分布的行业比较广，半导体产品、通信设备、应用软件、电子元件和医疗医药等领域受到相对较多关注。兆易创新、信维通信、华宇软件、一心堂、创业慧康、云南白药、楚江新材、广联达、东南网架、普莱柯、立讯精密、得润电子、乐鑫科技、珠江啤酒、高新兴、西麦食品、博雅生物等公司至少迎来了5家以上险企调研。
举牌迎来小高峰
虽然险企调研A股节奏放缓，但举牌上市公司却迎来小高峰。据中保协数据，3月披露的险企举牌次数为四次，2020年以来，险企举牌次数已达13次，一个季度即超越去年全年的数据。2019年全年，险资举牌次数为10次。
今年以来，险资举牌动作频繁。其中3月份披露的就包括中信保诚人寿举牌中国光大控股、太平人寿增持并举牌农业银行H股、太平洋人寿举牌锦江资本、中国人寿增持并举牌中广核电力H股。
此前，中国太保、太保安联健康、安信农险、太平洋人寿、太平洋财险、华泰资管等纷纷举牌，涉及赣锋锂业H股、锦江资本、农业银行H股、大悦城、国创高新等个股。险资出手对象不仅包括低估值的优质H股，还包括疫情期间整体表现相对稳健的部分A股标的。
在险资迎来举牌小高峰之际，保险巨头“平安系”今年却按兵不动；且据中保协披露，“平安系”成员平安人寿今年两次减持了云南白药。平安方面表示，今年尚未举牌不是因为布局，而是受疫情影响，匹配资金比较保守。
择机优选成共识
多位险企人士对中国证券报记者表示，目前市场环境对于保险资金的投资“不太友好”，险资面临疫情、市场巨震和利率下行多重考验。“目前的情况有点像黑天鹅遇上灰犀牛”，有保险资管人士感叹。
业内人士称，如果说利率下行趋势早已被保险资管人士预见，成为灰犀牛式存在，那么新冠肺炎疫情蔓延给经济和资本市场带来的不确定性，则更像是黑天鹅式冲击。“优质资产荒”让险资选择优质资产的空间受到挤压。
平安资管董事长万放在中保协近日举办的线上研讨会上表示，面对挑战，险资可采用拉久期、增收益等方式应对。其中，增加非标资产，以牺牲流动性换取相对高收益以及提升风险偏好增加权益资产，配置稳定现金分红的上市公司等均被提及。
保险业人士表示，在利率下行、非标资产收益率下降及信用风险增加的情况下，险企增配权益性资产配置比重将成为有效对冲方式。
从上市险企近日在业绩会上透露的信号来看，长期投资、价值投资、稳健投资仍是险资“入市”的配置思路。精选核心资产，构建高股息组合，降低组合波动性；看重基本面发展稳定与业绩稳步增长，围绕低估值、高分红、低波动优选价值型股票和基金品种，成为业界共识。此外，加大战术性配置的灵活度，及时把握市场“错杀”机会，把握市场调整下的买点做长线布局，也成为险资重要的入市逻辑。",2020-04-03 06:28:39,凤凰财经
12,瑞幸咖啡自曝造假22亿！股价重挫75.75% 市值蒸发350亿元,"凤凰网财经讯北京时间4月3日（周五），隔夜美股全线大涨，道指涨近500点，中概股瑞幸咖啡收盘重挫75.57%，收报6.4美元，市值蒸发49.5亿美元，约合350亿元人民币。一项内部调查发现瑞幸咖啡首席运营官伪造了2019年销售额约22亿元(约合3.1亿美元)。
美国当地时间4月2日盘前，瑞幸咖啡提交监管文件显示，在审计截至2019年12月31日的年报发现问题后，董事会成立了一个特别调查委员会。
特别委员会由三名独立董事Mr.SeanShao、Mr.TianruoPu、Mr.WaiYuenChong组成，由Mr.SeanShao担任主席，Mr.TianruoPu和Mr.WaiYuenChong则是3月27日瑞幸咖啡刚刚任命的独立董事。
该调查委员会向董事会汇报称，发现公司2019年二季度至四季度期间虚增了22亿人民币交易额，相关的费用和支出也相应虚增。目前，调查仍在进行，公司将进一步对财务数据等调整进行公告。
调查发现，瑞幸的首席运营官刘建和几名向他汇报的员工存在不当行为，包括销售造假。刘建及其他涉及不当行为的员工已被停职，瑞幸表示将对相关责任人采取法律行动。
这家仅成立两年半的公司曾希望超越星巴克(Starbucks)，成为中国最大的咖啡连锁店。瑞幸表示，投资者不应该依赖于其之前的财务报表和截至9月30日的9个月收益发布。该咖啡连锁店此前表示，2019年前9个月的净销售额为29亿元(约合4.13亿美元)。
在监管文件公布后，该股在盘前交易中暴跌超过85%。北京时间4月2日晚间21:30，美股开盘，瑞幸咖啡开盘暴跌78.5%，触发熔断，且在开盘后的40分钟内熔断五次。截至北京时间23:50，瑞幸咖啡盘中第六度暂停交易。",2020-04-03 06:27:47,凤凰财经
13,原油市场“乌龙”时间线：特朗普“夸大其词” 但没说已达成减产协议,"财联社（上海，编辑吴斌）讯，周四晚间，原油市场上演“乌龙”一幕，油价上演疯狂“过山车”走势，布油一度暴涨近50%，随后大幅回落。综合各方反应来看，特朗普称减产1000万桶-1500万桶的话明显“夸大其词”，但他的确没说已达成减产协议。
减产协议迟早会达成，但悲催的是，市场普遍预期，即使达成协议，仍然不足以抵消需求破坏带来的供过于求。
北京时间周四22:20左右，沙特通讯社称沙特王储与美国总统特朗普就油市问题进行了电话通话，原油开始暴涨。
北京时间周四22:32，特朗普发推表示，刚刚与我的朋友沙特阿拉伯王储MBS交谈过，王储已与俄罗斯总统普京谈过，我期待并希望他们将削减大约1000万桶产量，甚至更多，如果真的如此，这将对石油和天然气行业大有裨益！
(image_address=""https://x0.ifengimg.com/ucms/2020_14/5A7E280EE2B4EA2AA75E0E2C63CF2F87EECA3214_w594_h285.png"")
北京时间周四22:38，布伦特原油期货涨幅快速扩大至46%，突破36美元/桶。
北京时间周四22:40左右，克里姆林宫发言人佩斯科夫表示，普京尚未与沙特王储通电话。
北京时间周四23:30左右，国际油价大幅回落，布伦特原油期货涨幅收窄至14%，跌破30美元/桶。
北京时间周四23:40左右，欧佩克代表表示，俄罗斯和沙特尚未就任何减产规模达成协议。但已经呼吁产油国开展会议以“最终达成”同意减产的目的，沙特希望非欧佩克+的产油国也能加入会议。
北京时间周五01:00左右，美国政府高级官员表示，美国不知道沙特和俄罗斯削减石油供应计划的细节。
北京时间周五01:30左右，沙特官员表示，特朗普关于减产1000万桶/日及以上幅度的言论是夸张的说法。
北京时间周五01:50左右，沙特官员表示，当前最好的场景是减产600万桶/日，不确定特朗普是如何得到此前那些数据。
北京时间周五02:20左右，美国德州铁路委员会委员RyanSitton表示，和俄罗斯能源部长诺瓦克讨论了全球减产1000万桶/日，将很快和沙特能源部长通话。
北京时间周五02:30，WTI5月原油期货收涨5.01美元，涨幅24.67%，报25.32美元/桶，创历史最大单日百分比涨幅。布伦特原油上涨17.8％，或4.40美元，收于29.14美元/桶。
分析师也认为特朗普说话含有水分，RystadEnergy石油市场负责人BjornarTonhaugen称：“沙特阿拉伯和俄罗斯不会单枪匹马砍掉其国家石油产量的一半（500万桶/日），但我们相信各方将同意继续讨论和监督市场情况。”
沙特和俄罗斯也承担不起长期进行价格战，瑞穗分析师保罗&middot;桑基在给客户的一份报告中说：“进行价格战的情况下，沙特和俄罗斯在原油市场上的消耗将在两年内用掉他们5000亿美元外汇储备。”",2020-04-03 06:19:16,凤凰财经
