,title,content,pub_time,src
4,中芯国际上市首日券商打新浮盈4.1亿 两家另类子公司跟投浮盈37亿,"原标题：中芯国际上市首日券商打新浮盈4.15亿元，两家另类子公司跟投累计浮盈高达37亿元
来源：金融1号院
当下，券商参与网下打新热情高涨，多家券商各类打新资金（自营、资管）全线回归“打新战场”，对于一些热门新股，券商的关注度一直居高不下。
7月16日，中芯国际在A股科创板上市，首日上涨201.97%，成交额高达479.67亿元。“金融1号院”据公开数据统计显示，本次共有24只券商自营账户及券商集合理财产品参与中芯国际的网下申购，合计获配748.09万股，首日累计浮盈高达4.15亿元。
同时，海通证券另类投资子公司海通创投与中金公司子公司中金财富均分别获中芯国际战略配售3371.24万股，首日均分别浮盈18.7亿元，累计浮盈37.4亿元。
(image_address=""//n.sinaimg.cn/finance/crawl/37/w550h287/20200716/fd76-iwpcxkr3771817.jpg"")
对此，宝新金融首席经济学家郑磊接受“金融1号院”采访时表示，“中芯国际在A股上市是符合国家发展战略的重大举措，从此形成了境内外两个重要的融资平台。芯片龙头企业关系到国家安全和技术发展基础，中芯未来的再融资可能类似当年的京东方，这属于一个较长期的战略性投资，比较适合长线投资者考虑。一般投资者可能更适合选择一些与日常生活联系紧密的投资标的。”
中芯国际
网下“0”弃购
中国第一“芯”中芯国际获得如此高关注，很重要的一个原因在于，中芯国际为国内晶圆制造龙头厂商，市占率全球第四，国内第一，具有重要战略意义。
“金融1号院”注意到，中芯国际的上市速度惊人，5月5日，中芯国际公告，公司董事会于4月30日通过决议，批准建议进行人民币股份发行等事宜；6月1日，中芯国际递交的科创板上市申请被上交所受理；7月16日，中芯国际登陆A股科创板上市。也就是说，自中芯国际的IPO申请受上交所受理直至上市，仅用了46天。
中芯国际《首次公开发行股票并在科创板上市发行结果公告》显示，本次公开发行股份全部为新股，初始发行股票数量为16.87亿股，约占发行后总股本的23.62%（超额配售选择权行使前），也就是说，按照发行价27.46元/股来计算，中芯国际募集资金总额为462.87亿元。同时，发行人授予海通证券初始发行规模15%的超额配售选择权，若超额配售选择权全额行使，则发行总股数将扩大至19.38亿股，约占发行后总股本26.23%（超额配售选择权全额行使后），那么中芯国际募集资金总额则为532.3亿元。
同时，在超额配售选择权及网上、网下回拨机制启动后，中芯国际网下最终发行数量为5.9亿股，包括中国银河、浙商证券、方正证券等在内的24只券商及券商集合理财产品共获配中芯国际748.09万股，占网下最终发行数量的1.27%。此外，回拨机制启动后，中芯国际网上发行最终中签率为0.21196071%。
从打新弃购方面来看，本次中芯国际网上、网下投资者放弃认购股数全部由海通证券包销，总计包销股份的数量为49.09万股，包销金额为1348.03万元，其中，网下投资者0弃购，弃购的全部为网上投资者。
“金融1号院”注意到，上述24只券商自营账户及券商集合理财产品中，开源证券、红塔证券、华安证券、渤海证券、浙商证券、长江证券、国金证券、江海证券、野村东方国际证券均获配中芯国际42.71万股，获配数量最少的中天证券也有10.68万股。
“金融1号院”据此估算，这24只券商自营账户及券商集合理财产品在中芯国际上市当日浮盈高达4.15亿元（浮盈计算均假设当日未卖出）。
两家券商子公司累计
获战略配售6742万股
从中芯国际的战略配售方面来看，阵容相当豪华，本次中芯国际发行的战略配售由联席保荐机构相关子公司跟投（跟投机构为海通创投与中金财富）和包括国家集成电路产业投资基金二期股份有限公司、中国信息通信科技集团有限公司在内的其他战略投资者共计29家机构组成。
中芯国际本次发行最终战略配售数量为8.43亿股，其中，海通证券另类投资子公司海通创投与中金公司子公司中金财富均分别获配3371.24万股，2家公司累计获配6742.48万股，占最终战略配售数量的8%。至此，中芯国际上市首日，海通创投、中金财富均分别浮盈18.7亿元，累计浮盈37.4亿元。
从机构角度来看，国信证券研究团队认为，中芯国际比贵州茅台更珍贵。从可替代性来讲，中芯国际与贵州茅台一样不可替代、无法复制。同时，因为稀缺性导致中芯国际具有和贵州茅台同样的议价能力。从社会必要劳动时间的角度看，中芯国际的价值量超越贵州茅台。相同资产在不同市场有不同价格，所以，科创板的中芯国际的估值超过龙头台积电也是有可能的。
在科创板股价方面，华润微的技术和规模都不及中芯国际，中芯国际的相对合理估值应该超过华润微，华润微7月15日收盘价对应PB为6.9倍，考虑本次超额募集之后PB只有2.11倍，对标华润微至少还有3倍以上的空间，对应股价83.3元人民币。此价格对应市值为6355亿元。在港股股价方面，由于AH投资人趋同，AH股价也会趋同，港股股价将会向科创板股价看齐。
对于本次中芯国际采用的“绿鞋机制”（超额配售权），新时代证券曾分析称，科创板“绿鞋机制”明确超额配售锁定期、禁止刷新、“价差”收益归证券投资者保护基金，是同科创板T+1的交易制度和不完善的做空机制相匹配的，相对而言更加稳健。“绿鞋机制”短期稳定上市股价效果显著，但对长期走势无明显影响，是帮助实现新股价格从一级向二级的稳健过渡。并且“绿鞋机制”对发行人、承销商、打新和战略投资者均有益，多方共赢能有效地降低新股发行的风险，助推科创板的市场化定价进一步向国际化看齐。
免责声明：自媒体综合提供的内容均源自自媒体，版权归原作者所有，转载请联系原作者并获许可。文章观点仅代表作者本人，不代表新浪立场。若内容涉及投资建议，仅供参考勿作为投资依据。投资有风险，入市需谨慎。
(image_address=""//n.sinaimg.cn/finance/cece9e13/20200514/343233024.png"")
海量资讯、精准解读，尽在新浪财经APP
责任编辑：逯文云",2020-07-16 20:48:33,新浪财经
5,冠昊生物收关注函：核查是否存在内幕交易、操纵市场的情形,"新浪财经讯 7月16日消息，冠昊生物收关注函，交易所要求核查公司控股股东、实际控制人、其他持股5%以上的大股东、董事、监事、高级管理人员及其直系亲属近一个月买卖你公司股票的情况，是否存在内幕交易、操纵市场的情形。
(image_address=""//n.sinaimg.cn/finance/cece9e13/20200514/343233024.png"")
海量资讯、精准解读，尽在新浪财经APP
责任编辑：张熠",2020-07-16 20:33:34,新浪财经
6,创业板上市委第三审：卡倍亿等4家企业首发过会,"新浪财经讯 7月16日消息，创业板上市委员会召开第3次上市委员会审议会议，卡倍亿、大宏立、安克创新、圣元环保四家公司首发过会。
(image_address=""//n.sinaimg.cn/finance/cece9e13/20200514/343233024.png"")
海量资讯、精准解读，尽在新浪财经APP
责任编辑：逯文云",2020-07-16 20:30:38,新浪财经
7,葵花药业原董事长“杀妻”案一审获刑11年 曾挥刀暴砍妻子,"原标题：葵花药业原董事长“杀妻”案一审获刑11年，曾挥刀暴砍妻子致重伤后自残
来源：经观一线
震惊一时的知名医药类上市公司——葵花药业集团股份有限公司（002737.SZ，下称葵花药业）时任董事长、实际控制人关彦斌“杀妻”案，今日（2020年7月16日），在黑龙江省大庆市让胡路区法院一审宣判。法院判决，关彦斌犯故意杀人罪，处有期徒刑11年。关彦斌不服，表示将上诉。
包括关彦斌的女儿、葵花药业现任董事长关玉秀在内的数个消息源，向经济观察网记者证实了上述信息。
接近案情的人士亦告诉经济观察网记者，案发后，关彦斌也一直在寻求与张晓兰达成和解，但在一审宣判前未能如愿。二审阶段，双方仍然会为达成和解而继续努力。
2018年12月22日，时任葵花药业董事长关彦斌在其前妻张晓兰父母家中，手持菜刀，暴砍张晓兰4刀，致其失血性休克，创伤性面瘫，构成重伤二级。行凶后，关彦斌亦举刀刺向自己的左胸部，并划伤自己的脖子。后经全力抢救，张晓兰幸免于难。
案发次日，即2018年12月23日凌晨2时左右，在哈尔滨一家医院就医的关彦斌被警方抓获。
案发6日之后，即2018年12月28日，关彦斌辞去他所担任的葵花药业董事、董事长及总经理职务，公告辞职理由是“因个人年龄的原因，从公司长远发展角度出发，为给年轻人更多机会，优化经营管理团队”，但他迄今仍是葵花药业的实际控制人。
他的女儿关玉秀，接任董事长职务；另一位女儿关一，则任总经理。
关彦斌辞职次日，即2018年12月29日，被警方以涉嫌故意杀人罪监视居住。2019年1月24日，大庆警方对关彦斌刑事拘留。同年1月31日，被批准逮捕。
葵花药业迟至2019年3月21日，才在2018年年报中首次披露，“公司实际控制人因个人原因与他人发生纠纷造成身体伤害，被司法机关采取强制措施”。
2019年6月13日，大庆市让湖区检察院以关彦斌犯故意杀人罪，提起公诉。
检方称，关彦斌是在与张晓兰的交谈中，“被张晓兰的话激怒”，所以跑到厨房拿来菜刀，连砍张晓兰4刀。菜刀被张晓兰的弟弟张明夺下之后，关彦斌又持尖刀试图自杀。
张晓兰被她的家人转移至客厅之后，关彦斌又找出另一把菜刀和另一把尖刀，尾随而至。这两把刀，分别被张明，以及关彦斌的随从夺下。
检方认为，应当以故意杀人罪追究关彦斌的刑事责任，同时，他在实施杀人的过程中，是“因（本人）意志之外的原因未能得逞”。
检察院建议对其判刑十年至十二年。
2019年12月，此案以不公开开庭方式审理。
关彦斌的辩护人称，现有证据不能证明关彦斌存在杀害张晓兰的动机，同时关彦斌存在精神类疾病，为“限定刑事责任能力人”，且有自首情节。
不过，辩护人的上述意见，全部未被一审法庭采纳。
接近案情的人士亦告诉经济观察网记者，案发后至一审宣判前，关彦斌未能与张晓兰一方达成和解。但二审阶段，双方仍然会为达成和解继续努力。
2019年4月，张晓兰在接受经济观察网记者当面采访时，对关彦斌提出三点诉求：充分道歉、还原事实、充分赔偿。
未能在一审宣判前双方达成和解的原因何在？
2020年7月16日，葵花药业董事长关玉秀对经济观察网记者表示，“不便答复”。
关彦斌，生于1954年10月，满族，黑龙江省哈尔滨市下辖县级市五常市人。上世纪九十年代，五常制药厂进行改制，关彦斌掌控了这家公司，这就是葵花药业的前身。
1998年，关彦斌与张晓兰结婚。不过，关玉秀、关一，均为关彦斌前妻所生的女儿。
2014年12月30日，葵花药业在深交所上市。关彦斌和张晓兰是上市公司的共同实际控制人。
2017年7月，关彦斌和张晓兰离婚。在两人婚姻存续期间，两人育有一子。
离婚时，张晓兰将名下上市公司股权全部转给关彦斌，后者以现金方式补偿9亿元人民币给张晓兰。至2018年12月，案发前已支付6.5亿元。
2019年4月26日，辽宁省沈阳市和平区人民法院冻结了关彦斌持有的1900万股葵花药业的股票，以当时股价粗略计算约3亿元，基本对应关彦斌尚未支付给张晓兰的2.5亿元现金补偿及6000万元“小关”的抚养费。
关彦斌一直在二级市场通过减持股票，筹措资金。
2019年7月30日至2020年7月15日，葵花药业发布了9次股东减持公告。
2020年7月15日，葵花药业公告称，根据2020年4月8日预披露，关彦斌计划于2020年4月30日至2020年9月30日，通过大宗交易或集中竞价，减持最多1465万股股票，占其直接持有葵花股份的25%，占公司总股本的2.51%。截至7月7日，关彦斌已累计减持584万股。
2020年7月16日，葵花药业收于14.98元，下跌6.49%。
(image_address=""//n.sinaimg.cn/finance/cece9e13/20200514/343233024.png"")
海量资讯、精准解读，尽在新浪财经APP
责任编辑：张熠",2020-07-16 20:23:35,新浪财经
8,粤高速A：广东省交通集团筹划资产重组 公司拟收购广惠高速股权,"新浪财经讯 7月16日消息，粤高速A晚间公告，公司收到控股股东广东省交通集团的通知，广东省交通集团将筹划所属高速公路项目资产重组事项。重组涉及的资产及交易方式拟定为：广东省高速公路有限公司向粤高速A转让其持有的广东广惠高速公路有限公司21%股权，粤高速A以现金支付对价。
(image_address=""//n.sinaimg.cn/finance/cece9e13/20200514/343233024.png"")
海量资讯、精准解读，尽在新浪财经APP
责任编辑：张熠",2020-07-16 20:19:51,新浪财经
9,网红概念炒上天、中报大亏失脸面 星期六股东抛大笔减持,"(image_address=""//image.sinajs.cn/newchart/new_daily/n/sz002291.gif"")
热点栏目
自选股
数据中心
行情中心
资金流向
模拟交易
客户端
网红概念炒上天，中报大亏失脸面，星期六股东抛大笔减持
来源： 富凯财经 
富凯摘要
消费者在家上网都赚不到真金白银，下半年全面复工之后更是希望渺茫。
作者|蓝月
排版|十一
去年底因伴上网红李子柒而飙升的星期六15日刚曝出中报亏损，16日三大股东又宣布拟合计减持2954万股，可谓是连出利空，该股16日应声跌停。去年因为并购星期六一度业绩大增、股价暴涨，然而，随着网络直播行业的规范以及行业参与者的不断增加，行业的竞争日益加剧，公司业绩想要保持稳定增长恐怕也不容易，而高企的股价已摇摇欲坠。
上半年亏损逾8000万元
说起星期六，就不得不提起网红李子柒。李子柒是个视频博主，微博粉丝2000多万，抖音粉丝3000多万。她的视频主要以中国传统美食和文化为主，为观众呈现一个“从无到有”的过程。比如徒手做毛笔、制墨、造纸、制砚台，徒手做酱油，自制面包窖等。李子柒不仅在国内有着超高的人气，在海外更是圈粉无数，她在YouTube粉丝量一度超过BBC、CNN 等知名媒体。
(image_address=""//n.sinaimg.cn/finance/crawl/94/w550h344/20200716/9acc-iwpcxkr3701384.png"")
去年12月中旬，主业做时尚女鞋的星期六风头正劲，市场传出星期六旗下子公司遥望网络与头部网红李子柒存在合作关系的消息。此后虽然星期六进行了辟谣，却也挡不住资本的热情。
因为被贴上“李子柒概念股”的标签，星期六的股价曾连续十几个涨停板，该股从7元一路飙升至今年1月中旬的36.56元。短短一个月时间，星期六暴涨4倍多，可谓是当之无愧的大牛股。
然而，自1月中旬见顶以来，星期六股价从高位一路回落，仅仅三个月时间最低跌至17.1元，股价一度被腰斩。
尽管由于疫情刺激，上半年网络营销、网红经济行业发展迅速，但星期六业绩却不佳。
一季报显示，公司一季度亏损4921万元，刚公布的中报预告显示，上半年公司亏损8000万元至1.2亿元，比上年同期下降231.48%至297.22%。
对于中报预亏，公司解释称，主要是受新型冠状病毒肺炎疫情影响。公告称，疫情下，由于部分店铺停业、线下人流大幅减少造成实体店铺销售额同比大幅下滑，公司传统零售业务遭受重大打击。
值得注意的是，公司线上销售业务在疫情下也没能幸免。上半年公司互联网营销业务及线上销售业务的正常开展在疫情前期由于部分供应商延期复工、特殊交通管制、物流受阻等受到一定影响。
资料显示，星期六2009年9月3日登陆中小板。公司从事皮鞋、皮革制品批发、零售、进出口及相关配套业务，近年来公司转型互联网精准营销。
三大股东拟再减持4%
最近两年，星期六在向互联网营销等轻资产业务转型。
一方面，公司剥离部分女鞋业务。2018年7月，星期六试图将鞋类相关品牌、销售以及存货等经营性资产转移至外部合资公司，这是公司首次尝试转移鞋类业务。去年，公司又将旗下鞋类研发公司以1385万元出售，宣布以轻资产模式发展女鞋业务。
此外，公司减少直营店的比例，加大加盟商门店的占比。去年，公司自营门店减少390家，加盟店增加243家。数据显示，
另一方面，星期六加大对网红业务的投入。今年4月，公司宣布拟募集不超过29.7亿元，用于遥望数字营销云平台建设项目、社交电商生态圈建设项目等。
然而，公司的转型能否见效目前还未可知，毕竟去年公司业绩大增近16倍主要是因为并购了遥望网络，而今年上半年公司业绩就曝出了亏损。
除了业绩不佳，星期六还面临股东大笔减持的压力。公司16日公告称，此前大股东星期六控股已通过竞价交易、大宗交易方式减持2648.85万股，股份减少3.59%，权益变动后持股比例为12.21%。本次减持均价为23.067元/股，减持套现6.11亿元。
此外，包括大股东星期六在内的三大股东又宣布将大笔减持：拟6个月内减持不超过2953.95万股（占公司总股本比例4%）
对于控股股东减持的原因与前次相同，公司表示为“化解股东债务压力和股票质押融资风险，部分减持所得用于向公司提供财务资助”。
星期六近期还遭遇监管层警示。2日，因未及时披露公司及其下属子公司与三家品牌公司发生的逾7.5亿元的关联交易，星期六收到广东证监局出具的警示函。根据相关规定，广东证监局对星期六、于洪涛、何建锋采取出具警示函的行政监管措施。
广东证监局在警示函中表示，星期六及下属子公司与三家品牌公司累计发生关联交易7.51亿元。对于上述关联交易，星期六未按规定及时履行关联交易审批程序及披露义务，直至4月21日、5月13日才分别召开董事会和股东大会补充确认并公开披露。
免责声明：自媒体综合提供的内容均源自自媒体，版权归原作者所有，转载请联系原作者并获许可。文章观点仅代表作者本人，不代表新浪立场。若内容涉及投资建议，仅供参考勿作为投资依据。投资有风险，入市需谨慎。
(image_address=""//n.sinaimg.cn/finance/cece9e13/20200514/343233024.png"")
海量资讯、精准解读，尽在新浪财经APP
责任编辑：陈志杰",2020-07-16 20:18:23,新浪财经
10,*ST富控：公司股票可能被暂停上市,"新浪财经讯 7月16日消息，*ST富控（维权）7月16日晚间公告，经公司初步测算，预计2019年年度实现归属于上市公司股东的净利润约亏损1.41亿元左右，归属于母公司的股东权益约-36.74亿元左右。公司2018年度经审计的期末净资产为负值，若公司2019年度经审计的期末净资产继续为负值，根据《股票上市规则》有关规定，公司股票将于2019年年度报告披露之日起停牌。上交所将在公司股票停牌起始日后的十五个交易日内作出是否暂停公司股票上市的决定。此外，如公司未能在2020年8月25日前披露2019年年度报告，将触及《上海证券交易所股票上市规则》中关于公司未按规定披露年度报告的相关条款。
(image_address=""//n.sinaimg.cn/finance/cece9e13/20200514/343233024.png"")
海量资讯、精准解读，尽在新浪财经APP
责任编辑：逯文云",2020-07-16 20:14:57,新浪财经
11,证监会：厦门银行等4家企业首发过会,"新浪财经讯 7月16日消息，证监会公告，厦门银行股份有限公司、陕西中天火箭技术股份有限公司、广东天元实业集团股份有限公司、杭州豪悦护理用品股份有限公司首发均获通过。
(image_address=""//n.sinaimg.cn/finance/cece9e13/20200514/343233024.png"")
海量资讯、精准解读，尽在新浪财经APP
责任编辑：逯文云",2020-07-16 20:03:53,新浪财经
12,“最赚钱新股”康华生物开板首日闪崩跌停 游资爆买8亿高位接盘,"原标题：“最赚钱新股”开板首日闪崩跌停！游资却爆买8亿高位接盘
来源：财联社
财联社（上海，研究员 姚辉）讯，年内“最赚钱新股”康华生物今日开盘即闪崩跌停，另一只“大肉签”新股甘李药业同样跌停。康华生物盘后公布的龙虎榜数据显示，豪华游资阵容大买，五家席位合计买入超8亿元。
太狠了，开板首日就跌停，连“大肉签”也没能逃过。今天，年内“最赚钱新股”的强势连板终于戛然而止，然而让人意想不到的是，开板首日两大明星新股康华生物和甘李药业竟不约而同地双双跌停了。
(image_address=""//n.sinaimg.cn/finance/crawl/770/w550h220/20200716/4bdd-iwpcxkr3654685.png"")康华生物分时图
康华生物高开后急速跳水，在集合竞价阶段就有大单卖出，开盘后4分钟触及557.76元的跌停板价。上市短短20天，康华生物的股价就暴涨了近700%。截至昨日收盘，康华生物619.73元的收盘价不仅取代了500.55元的长春高新，成为新晋的“最贵”医药股，更是成为A股仅次于贵州茅台的第二高价股，堪称药中“茅台”。
(image_address=""//n.sinaimg.cn/finance/crawl/772/w550h222/20200716/b16d-iwpcxkr3654711.png"")甘李药业分时图
(image_address=""//n.sinaimg.cn/finance/crawl/65/w550h315/20200716/2650-iwpcxkr3654740.png"")康华生物龙虎榜
盘后公布的康华生物一日榜数据显示，龙虎榜资金净买入5.33亿元。买一顶级游资上海超短帮狂买2.3亿元，买二大笔扫货1.9亿元，买三一线游资和买四一线游资方新侠分别买入1.3亿元和1.2亿元，买五顶级游资敢死队大买超1.1亿元。主卖方面，五家席位均为券商营业部，不过均非知名游资席位。
截至7月16日，康华生物和甘李药业已分别录得20个、13个一字板，虽然涨停天数没有超越万泰生物26连板的记录，但是二者却凭借着超20万元的单签收益，创造了A股打新中签盈利新“神话”，超越国盾量子成为今年当之无愧的“新股王”。
截至7月16日开板前，康华生物已经收获20个一字板，若以7月15日的收盘价619.73元/股计算，中一签就能暴赚27.47万元，“A股史上最赚钱新股”实至名归。
华西证券崔文亮团队发布关于狂犬疫苗专题报告指出，本轮狂犬疫苗供不应求+中标价提升，有望呈现量价齐升局面，提价显著增厚业绩，利好狂犬疫苗上市公司如康华生物等。
资料显示，人用狂犬病疫苗贡献了康华生物90%以上的销售收入，其境内销售客户全部为各地区疾控中心。
根据最新披露的业绩预告，今年上半年，预计归属于上市公司股东的净利润为1.80亿元~1.85亿元，预计同比增长112.33%~118.23%，仅今年半年的利润已经接近去年全年。
(image_address=""//n.sinaimg.cn/finance/cece9e13/20200514/343233024.png"")
海量资讯、精准解读，尽在新浪财经APP
责任编辑：张熠",2020-07-16 20:02:36,新浪财经
