,title,content,pub_time,src
0,美的集团：已回购股份175万股 耗资9173万元,"美的集团（000333）3月13日晚间公告，截至3月13日，公司以集中竞价方式累计回购股份175万股，占总股本的0.025%，最高成交价为54.18元/股，最低成交价为50.10元/股，支付总金额为9173万元。
责任编辑：王帅",2020-03-13 19:45:57,新浪财经
1,主动退市近5年 国机重装重新上市申请获上交所同意,"原标题：主动退市近5年 国机重装重新上市申请获上交所同意
来源：每日经济新闻
3月13日晚，上交所发布公告，同意国机重装（原*ST二重）重新上市。
国机重装于2019年12月12日向上海证券交易所提出股票重新上市申请，上交所于12月18日受理。根据上市委员会的审核意见，上交所同意国机重装A股股票约72.68亿股（每股面值1.00元）在上交所重新上市交易。
根据国机重装递交的上市申请书，公司目前的前十大股东包括中国银行德阳分行、中国建设银行四川省分行、中国工商银行德阳旌阳支行等。另外公司还引入了东方电气、三峡控股、中广核控股、国新资产以及结构调整基金等5家战略投资者。
2014年，国机重装连续三年亏损其股票被暂停上市，于2015年5月21日从上交所主动退市，此后于2015年7月20日在股转系统挂牌转让。
国机重装表示，公司于2016年成功完成破产重整，最终达成“以股抵债+现金偿还+保留债务”的综合受偿方案。公司在做强传统业务的同时，强化核电、煤化工等新兴领域的技术储备，为未来创造新的盈利增长点。2018年，国机重装通过发行股份购买资产的方式收购了国机集团旗下的中国重机100%的股权及中国重型院82.827%的股权。
2017年~2019年，国机重装归属于母公司股东的净利润分别为4.45亿元、4.82亿元、4.98亿元。国机重装的主营业务包括机械装备研发与制造、工程总承包、贸易与服务、售电业务 ，2019年的毛利率分别为10.90% 、14.16% 、9.81% 、71.01% 。不难发现，公司售电业务毛利率最高，占收入比例也达到了25.05%。
国机重装预计2020年至2022年，营业收入分别为102亿元、113亿元、125亿元，净利润分别为5.14亿元、5.2亿元、5.3亿元。根据公司业务规划调整，公司除继续履行完现有电力等非重型装备行业核心业务项目在手订单外，五年内停止从事电力等领域工程总承包业务，并重点发展好涉及冶金、有色矿山等重型机械行业核心业务相关工程总承包业务。
责任编辑：陈志杰",2020-03-13 19:16:39,新浪财经
2,中国金茂68.5亿元收购武汉三项目 新增138万平米土储,"原标题：中国金茂68.5亿元收购武汉三项目，新增138万平米土储
3月12日，中国金茂（00817.HK）公告，公司间接全资附属公司亦城置业拟收购武汉化资100%股权，收购代价为68.5亿元。
公告显示，中国金茂拟收购的资产包括：武汉化资所持有的杨泗港项目20%股权、小王庄项目100%的权益和收购武汉化资在中欧国际城五宗地块项目中所持有100%的权益。这也是武汉化资所有的资产。
武汉化资为中化资产的全资附属公司，成立于2016年11月，主要业务是从事房地产信息咨询及投资。
杨泗港项目是2016年11月22日由一名第三方通过公开竞买获得，总价为110.65亿元，武汉化资产与其签署合作开发协议，通过向相关项目公司增资2000万元并提供约22.2亿元股东贷款的方式获得项目20%的权益。
该项目位于武汉市汉阳区，占地面积约为182900平方米，规划总建筑面积约814300平方米，开发为住宅及社区配套商业，并以超高层、高层住宅为主。项目已经在2017年5月开始施工建设，分期开发，预计将在2023年11月全部完工，总投资预计约为189.89亿元。
小王庄项目是武汉化资在2017年7月31日公开竞得，总价为31.5亿元。该项目位于天津市东丽区，占地面积约59628平方米，规划总建筑面积约为119300平方米，开发为住宅及社区配套商业，并以小高层、洋房住宅为主，项目已经在2018年2月开始施工建设，分期开发，预计在2023年9月份完工，预计总投资43.5亿元。
2019年10月25日，武汉化资以17.73亿元收购了位于青岛市高新区的中欧国际城五宗地块，占地面积约为278900平方米，用途为城镇住宅及工业，并以高层住宅为主，规划总建筑面积住宅部分约为448900平方米。项目预计在2020年6月开始施工建设，2024年3月全部完工，总投资预计54.16亿元。
截至2019年12月31日，公司的资产净值约为76.09亿元，此次中国金茂的收购价格较武汉化资的资产净值折价约10%。
此外，武汉化资及其附属公司的负债和或有负债包括，计息银行贷款约为5.36亿元；对某些在建物业及土地使用权的抵押，合计约18.07亿元；欠股东及关联方款项合计约11.62亿元。
中国金茂称，此次交易有利于公司迅速扩大在青岛、天津和武汉三大战略布局城市的土地储备，有助于提高在这些城市的市场占有率，对今年可售货值进行补充。另外，公司可以从杨泗港和小王庄项目带来的回流资金缩短资金占用周期，从而提高资金使用效率。
中国金茂及其附属公司在2月份取得签约销售金额25.03亿元，签约销售建筑面积约20.31万平方米。截至2月29日，中国金茂在今年前2个月累计取得签约销售金额共计130.1亿元，累计签约销售建筑面积约78.01万平方米。此外，中国金茂已取得已认购（未签约）物业销售金额共计64.28亿元。
责任编辑：陈志杰",2020-03-13 19:12:56,新浪财经
3,中国人保前2月保费收入同比降5% 人保健康保费增超7%,"原标题：中国人保前两月保费收入同比下降5%，人保健康保费增超7%
继新华保险、中国人寿之后，中国人保也披露了2020年1-2月原保险保费收入数据。
3月13日，中国人保（601319.SH，1339.HK）披露的数据显示，2020年1月1日至2020年2月29日，该公司原保险保费收入为1241.61亿元，同比下降5.13%。
分别来看，人保财险、人保健康、人寿寿险的原保险保费收入分别为750.21亿元、68.93亿元及422.47亿元，分别较去年同期增长-4.4%、7.74%、-8.18%。从2月份单月来看，人保财险、人保健康、人保寿险保费收入均较去年同期有所下滑。
就人保财险来看，其车险保费收入占比较2019年的6成降至5成，意外伤害及健康险保费收入占比则从去年末的13.3%上升至24.13%。
在各家子公司中，人保健康前两月的保费收入可谓亮眼。虽然2月份单月同比有所下降，但前两月68.93亿元的保费收入较去年同期的63.98亿元增长超过7%。
中国人保董事长缪建民在该公司2019年投资者开放日上曾表示，人保健康要对标国际先进健康险公司，加强专业能力建设，真正做出专业健康险的价值，成为集团市值支撑的“新亮点”。
近段时间，健康险也频频迎来政策红利。人保健康上海分公司总经理王光毅向澎湃新闻表示，商业健康保险的发展不仅要加大健康保险保障产品的开发与销售，今后更多的是构建由医疗服务、药品供应、疾病预防、健康管理、护理养老、医疗健康数据库等多产业组成的覆盖全生命周期的健康服务链和利益共享链，不仅要解决看不起病、因病致贫、因病返贫的问题，更关键是要让健康管理从源头介入起到“预防”效果，保护参保人群少得病、不得病。
责任编辑：陈志杰",2020-03-13 19:05:55,新浪财经
4,央行降准后港股怎么走:恒指期货大涨1% 哪些板块受益,"(image_address=""//image.sinajs.cn/newchar/png/k/hk/daily_660/hsi.png"")
热点栏目
自选股
数据中心
行情中心
资金流向
模拟交易
客户端
3月13日消息，周五盘后重磅消息落地，央行决定于2020年3月16日定向降准，释放长期资金5500亿元。值得注意的是，今日A股一度跌超4%，午后暴拉，收盘跌幅收窄至1.23%，创业板跌幅更是收窄至0.75%。不仅如此，今日港股更是上演1500点大逆转，除了技术反弹、南下资金大幅增持，市场也憧憬央行大礼包。
消息公布后，富时A50由跌转涨，从跌超0.3%转涨至0.39%，日前进一步涨幅扩大至1%。恒指期货指数直线拉升大涨近1%，现涨0.93%。
(image_address=""//n.sinaimg.cn/finance/transform/179/w550h429/20200313/0ceb-iquxruh8853143.png"")
本次降准具体内容如何？释放多少长期资金？历次降准后A股怎么走，港股会否跟随A股步伐？
降准释放多少资金？如何支持实体经济？
答：此次定向降准释放长期资金5500亿元，其中对达到普惠金融定向降准考核标准的银行释放长期资金4000亿元，对符合条件的股份制商业银行再额外定向降准1个百分点释放长期资金1500亿元。此次定向降准释放长期资金有效增加银行支持实体经济的稳定资金来源，每年还可直接降低相关银行付息成本约85亿元，通过银行传导有利于促进降低小微、民营企业贷款实际利率，直接支持实体经济。此次定向降准兼顾主动推动和事后激励，用市场化改革办法疏通货币政策传导，有利于激发市场主体活力，进一步发挥市场在资源配置中的决定性作用，支持实体经济发展。
普惠金融定向降准的具体内容是什么？
答：人民银行自2018年起建立普惠金融定向降准年度考核制度，对普惠金融领域贷款占比达到一定比例的大中型商业银行给予0.5个百分点或1.5个百分点的准备金率优惠。普惠金融领域贷款包括农户生产经营贷款、建档立卡贫困人口消费贷款、助学贷款、创业担保贷款、个体工商户经营性贷款、小微企业主经营性贷款、单户授信小于1000万的小型企业贷款、单户授信小于1000万的微型企业贷款。考核对象包括大型银行、股份制银行、城商行、较大的农商行和外资银行。近期人民银行完成了2019年度考核，一些达标银行由原来没有准备金率优惠变为得到0.5个百分点准备金率优惠，另一些银行由原来得到0.5个百分点优惠变为得到1.5个百分点优惠，总的看，对这些达标银行定向降准了0.5至1个百分点。
额外定向降准是出于什么考虑？
答：以股份制商业银行为代表的中型银行是我国银行体系的重要组成部分。考虑到去年人民银行已对符合条件的农商行和城商行实施过定向降准，此次普惠金融定向降准中所有大型商业银行都将得到1.5个百分点的准备金率优惠，为发挥定向降准的正向激励作用，支持股份制银行发放普惠金融领域贷款，同时优化“三档两优”存款准备金率框架，此次对得到0.5个百分点准备金率优惠的股份制商业银行再额外定向降准1个百分点，同时要求将降准资金用于发放普惠金融领域贷款，并且贷款利率明显下降，从而加大对小微、民营企业等普惠金融领域的信贷支持力度。
央行降准后A股、港股怎么走？
根据历史数据，从2018年以来央行历次降准后A股走势来看，降准实施后，上证综指次日整体上涨概率超70%，涨幅大致介于0.7%-0.85%之间，仅有一次超过1%，而两次下跌跌幅均超过1%。
如果把时间线拉长至2008年，降准次日上证综指有涨有跌，上涨概率降至52%。不过，若是全面降准，上证综指整体呈现上涨趋势，涨多跌少。
2018年以来，港股涨跌参半，涨幅概率为50%，时间拉长到2011年，港股上涨概率为40%。
(image_address=""//n.sinaimg.cn/finance/transform/129/w544h385/20200313/1b3f-iquxruh8895580.png"")新浪港股制图
不过，南下资金不断涌入港股。截至港股收盘，南下资金净流入161.71亿，连续两日创出历史新高。本周流入额超过510亿元，刷新历史高位。
(image_address=""//n.sinaimg.cn/finance/transform/247/w550h497/20200313/152d-iquxruh8336949.png"")
今日港股更是上演1500点大逆转。截止收盘，恒指跌1.14%，报24032.91点，跌276点，从今日低点反弹1500点。
近七日数据显示，南下资金更青睐建设银行（净买入近100亿）、腾讯控股（净买入近50亿）、工商银行（净买入37.95亿）。汇丰控股、美团点评、中国飞鹤、小米集团、农业银行、中国平安、融创中国近七日流入额居前。
(image_address=""//n.sinaimg.cn/finance/transform/42/w550h292/20200313/d267-iquxruh8349240.png"")
机构如何解读本次降准？
财信证券财信证券首席经济学家伍超明表示，降准的直接作用在于缓解银行信贷供给存在的“三大约束”，为实体经济提供更多低成本的中长期资金。此时降准有利于支持企业加快复工复产，配合财政加快债券发行节奏。
中南财经政法大学数字经济研究院执行院长盘和林表示，首先，股份制银行的客户主要集中在小微企业和个体工商户，额外加大对股份制银行的降准力度有助于将资金实现精准释放给小微客户，降低企业融资成本，为小微企业及个体工商户及时解围。
其次，股份制银行相比于大型银行而言，负债占比较高，有一定的金融风险，额外的降准支持有利于缓解目前股份制银行负债占比高带来的成本压力，降低银行整体融资成本，提高风险防范水平，能够增强其信贷支持能力，为企业提供坚实的金融保障；同时股份制银行比中小型银行的资金规模更大、覆盖的中小企业范围更广，对其降准能够加大股份制银行的贷款投放力度，增强了银行支持实体经济发展的可持续性，为小微企业、个体工商户提供更有力的信贷支持。
方正策略表示，本次降准是新一轮稳增长政策的开端。国内疫情已经基本控制，湖北新增病例连续两日保持在个位数，湖北以外新增病例除去境外输入为零。从复工情况来看，据工信部介绍，目前全国除湖北外的规上工业企业平均开工率超过95%，企业人员平均复岗率约为80%，中小企业开工率已达到60%左右。在复工复产提速的背景下，稳增长政策加码是大势所趋，从后续政策的演绎来看，下周是货币政策的窗口期，需要关注经济数据、月中的MLF续作、美联储议息会议、LPR利率报价等事件；财政政策方面，关注可能的专项债扩容以及赤字率调整。
降准之后还要降息？
中南财经政法大学数字经济研究院执行院长盘和林表示，从国际金融市场以及国内宏观经济、产业链等情况来看，后续应该还存在全面降准和降息空间。
中泰证券首席经济学家李迅雷对记者表示，MLF（中期借贷便利）等货币政策工具降息的空间也还有，但要分阶段实施，3月通胀数据如果回落，那时候降息可能更稳妥一些。
中信证券明明称，降准之外，考虑到对冲疫情的需求和中美利差空间，比较合适的降息时点已经到来。MLF降息或将在3月16日落地，预计下调5-10个基点以引导20日的LPR继续下行，释放更加“灵活适度”的货币政策信号，向降低实体融资成本的目标更进一步。
中国民生银行首席研究员认为，随着普惠金融定向降准政策落地，将释放资金专门服务小微企业、个体工商户等薄弱领域，帮助企业复工复产，提升金融纾困的精准度。同时，资金面的宽松还有助于降低银行资金成本，预计3月20日LPR将进一步下降，从而带动企业融资成本下行。此外，银行当前仍然面临较大的负债成本压力，适时适度降低存款基准利率，将是下阶段货币政策的一个选择。
哪些板块将会受益？
方正策略表示，目前市场的不确定性在外不在内，综合疫情演变、经济趋势、估值水平、政策空间，A股的配置价值凸显，受外围市场冲击是布局机会，不必过度悲观，坚守两条主线：
一是逆周期政策加码相关的基建、地产和金融，关注建材、房地产、工程机械、建筑、券商等；
二是成长，创业板和沪深300相对估值变化印证了成长风格已经形成大趋势，从前几轮成长占优的背景来看，流动性宽松环境具有较强的溢出效应，对于近期调整到位，具备业绩和景气支撑的成长股，可积极配置，关注TMT、先进制造、医疗服务等细分领域。
中泰国际策略分析师颜招骏表示，今次降准每年可直接降低银行付息成本85亿元，为下周的降MLF及LRP利率打开窗口。适逢美股出现技术性反弹，预期高BETA值的行业反弹力度更大，预期内银股，内险，债重的内房及水泥股会受惠。券商板块亦能够受惠人行释放流动性。
市场普遍认为，降准对股市有一定利好作用，尤其对资金敏感的银行、地产、券商。新浪财经总结如下：
一、资金敏感型品种：银行、地产、券商板块
无论是银行还是地产，都属于资金敏感型品种。本次降准净释放长期资金约5500亿元，对于银行、地产行业而言都有一定的利好，而对依赖经纪业务的券商而言也属于利好。
地产股：万科、融创、碧桂园、恒大、保利地产、金地集团、华夏幸福、龙湖集团等。
银行股：工商银行、建设银行、交通银行、农业银行、中国银行、平安银行、中信银行、光大银行、宁波银行、华夏银行、浦发银行、兴业银行、招商银行、北京银行、民生银行等。
券商股：中信证券、海通证券、招商证券、长江证券、华泰证券、中金公司等。
二、大宗商品类：有色金属板块
降准往往意味着以有色金属为代表的大宗商品价格将上涨，因此有色金属股有望受益于央行降准。
有色金属股：铜陵有色、中国铝业、江西铜业、中金岭南、锌业股份、云南铜业、厦门钨业、洛阳钼业等。
三、高分红的新蓝筹
降准虽然不等同于降息，但随着银行间流动性的些许好转，银行间市场的资金价格有望出现一定程度回落。资金价格的回落也会是民间借贷等资金信贷的投资回报率回落。相比之下始终能够保持高分红比例的蓝筹股，其持有价值将有所突出。目前正是年报陆续披露阶段，对于高分红、低市盈率的蓝筹股而言，正是一个长期价值凸显的时候。
四、筹资性现金流占比较大的行业
对筹资性现金流占比较大的行业来说，降准意味着企业获取资金能力的增强以及获取资金成本的降低，因此，对于那些资金链紧张，筹资性现金流较大的行业来讲，降准意味着利好。
钢铁股：方大特钢、沙钢股份、柳钢股份、韶钢松山、西宁特钢、武进不锈、八一钢铁等。
建材股：青松建化、四川金顶、万里石，尖峰集团等。
五、跌势较大的科技板块
方正策略表示，流动性宽松环境具有较强的溢出效应，对于近期调整到位，具备业绩和景气支撑的成长股，可积极配置，关注TMT、先进制造、医疗服务等细分领域。
结合港股分析师观点，建议关注：腾讯、阿里、美团等此前跌势较大的绩优股，以及5G板块的中兴通讯等。
责任编辑：张海营",2020-03-13 19:03:20,新浪财经
5,宁德时代：股东拟减持公司不超2%股份,"宁德时代（300750）3月13日晚间公告，公司股东招银叁号和招银动力，计划未来6个月内合计减持不超4417万股，占公司总股本的比例不超过2%。
责任编辑：王帅",2020-03-13 19:02:32,新浪财经
