,title,content,pub_time,src
0,确定宁德时代订单 科恒股份:知情人买卖股票与此无关,"原标题：确定宁德时代订单金额超亿元 科恒股份：知情人买卖股票与此无关
来源：每日经济新闻
每经记者 吴泽鹏    每经编辑 陈俊杰    
此前因披露收到宁德时代订单而股票涨停，随后引来深交所关注函的科恒股份（300340，SZ），在3月16日晚间发布了关注函回复公告。
科恒股份称，子公司浩能科技于3月5日收到宁德时代确认设备总数量的订单邮件，但当时无依据判断整批设备的金额，直到3月10日收到德国时代（宁德时代全资子公司）首张具体确认设备金额、型号的订单（首批6台），才据此预计订单含税总金额超过1亿元并对外披露。
科恒股份还表示，上述项目开展至今已有近两年，前期主要是技术人员沟通协商技术标准，近半年来这一阶段基本结束，主要在进行价格谈判和相关物流准备工作。
不过，记者注意到，近半年内，有包括子公司技术人员王莉、董事会秘书黄珍在内的信息知情人交易科恒股份股票。对此，科恒股份解释称，上述买卖公司股票是知情人基于独立判断，与本次信息披露事项无关。
订单金额预计超1亿元
几日前，科恒股份披露，全资子公司深圳市浩能科技有限公司（以下简称浩能科技）收到宁德时代设备采购订单。披露该公告后次日，科恒股份股价一字涨停。交易所就此事下发关注函，要求公司说明是否存在迎合市场热点、炒作公司股价等情形。
关注函中提到，公告提交了“宁德时代设备采购订单”与“德国时代设备采购订单”作为备查文件，其中前者仅为与宁德时代员工往来邮件截图。因此，关注函要求科恒股份对此补充说明。
3月16日晚间，科恒股份回复了交易所的关注函。科恒股份表示，此次宁德时代欧洲基地的建设对其长期合作的国内锂电设备供应商来说是难得的机遇，可趁此机会打入海外市场，“经过长时间更加严格的技术论证、考察、谈判后，公司抓住此次机遇打入了海外市场。”
据披露，科恒股份2019年出口总额1713.13万元，其中锂电设备仅为388.78万元。而此次科恒股份称，根据首批6台订单的具体情况，预计本批出口订单含税总金额超过1亿元，远超此前金额。
此外，科恒股份称，与宁德时代合作多年，后者在历次招标后公布结果，都会采用邮件方式定点通知中标企业中标数量，让中标企业提前筹备生产，然后再分批次下达包含设备数量等的订单。
“邮件通知虽然不具有法律效力，但根据多年来双方的合作经验，首次下达通知的邮件均与之后陆续下达的设备订单数量吻合。”科恒股份认为，邮件所显示的采购数量在后续执行中不存在不确定性。
知情人炒股与订单无关？
关注函还询问了信息保密工作情况，要求科恒股份解释说明是否存在内幕信息泄漏情形、是否存在通过披露市场热点信息配合相关人员减持的情形等。
根据回复，就德国项目合作，科恒股份与宁德时代开展商讨已将近两年，前期主要是技术人员参与，双方技术人员通过多次沟通协商确定设备的各项技术标准。近半年来，技术交流阶段已基本结束，主要在进行价格谈判和相关物流准备工作。
科恒股份统计，知情人员主要包括浩能科技业务员王莉、总经理吴娟、董事会秘书黄珍、董事长助理陈涛及公司董事程建军（亦为浩能科技董事长）等人。
值得注意的是，其中，黄珍、王莉、程建军等人在去年9月到今年2月间存在交易公司股票行为。此外，唐芬（公司控股股东万国江的一致行动人）、程建军还存在未到期减持计划。
《每日经济新闻》记者发现，上述交易公司股票的信息知情人中，王莉交易量较小，时间主要在去年10月至12月间；程建军、唐芬二人的减持计划在去年12月披露，截至回函日，分别减持了394.5万股和110.7万股。
此外，黄珍最为特殊，去年9月至12月，黄珍先是分三次共买入2万股科恒股份股票，后卖出1万股，随后又买入1万股，结余2万股在12月中下旬分两次卖出。但在2020年2月12日及14日，黄珍分两次大笔买入公司股票，成交数量分别为60.9万股和55.1万股。
记者从科恒股份相关人士处了解到，实际上，黄珍最后两笔较大金额的买入，也不是个人直接在二级市场买入，而是黄珍本人此前通过员工持股平台持有，现在量化到了个人手里，“实质上不是真实交易，而是原先通过平台持有，现在通过大宗交易的方式，转到个人持有。”
责任编辑：王帅",2020-03-17 23:39:53,新浪财经
1,法匹拉韦疗效获肯定 概念股海正药业二股东拟减持,"原标题：法匹拉韦疗效获肯定 概念股海正药业二股东拟减持
来源：每日经济新闻
3月17日晚间，海正药业（600267，SH）发布公告表示，第二大股东浙江省国际贸易集团有限公司（以下简称国贸集团）及其一致行动人浙江英特药业有限责任公司（以下简称英特药业）拟分别减持公司股份不超过1725.29万股和205.77万股，分别占公司总股份的1.79%和0.21%。
值得一提的是，就在17日下午，在国务院联防联控机制的新闻发布会上，科技部生物中心主任张新民建议，尽快将法匹拉韦纳入诊疗方案。而就在上个月，海正药业公告披露，其获得了国家药监局核准签发的法匹拉韦片的《药品注册批件》和《药物临床试验批件》。
预计套现2.5亿元
公告显示，国贸集团持有海正药业8.96%的股份，为后者的第二大股东，本次拟通过集中竞价交易方式减持海正药业不超过1.79%的股份，英特药业则拟清仓减持其持有的海正药业0.21%的股份，而减持的原因均为经营发展资金需求。
如果按照海正药业3月17日的股票收盘价12.95元/股计算，上述股份减持全部完成，将总共套现约2.5亿元。
值得一提的是，公告还显示，国贸集团曾在2015年6月17日至25日期间减持海正药业431.86万股股份，减持价格区间在21.60元/股至25.20元/股之间，套现至少9328.18万元。而海正药业则表示，根据减持时的相关规则，上述减持并未披露减持计划公告。不过，海正药业并未说明上述规则具体指的是什么。
记者注意到，国贸集团在资本市场颇为活跃，作为浙江省国资委旗下的子公司，国贸集团还持有浙江医药（600216，SH）的股份，同时也是浙江东方（600120，SH）和英特集团（000411，SZ）两家上市公司的控股股东。
海正药业迎利好消息
有意思的是，就在海正药业披露国贸集团拟减持公司股份计划的同一天，也出现了一则海正药业的利好消息。
3月17日下午，张新民在国务院联防联控机制就药物疫苗和检测试剂研发攻关最新情况举行的发布会上表示，在新冠肺炎治疗的临床研究中，法匹拉韦显示出了很好的临床疗效；同时鉴于法匹拉韦安全性好、疗效明确、药品可及，经过科研攻关组组织专家充分论证，已正式向医疗救治组推荐，建议尽快纳入诊疗方案。
谈及可及性方面，张新民还表示，今年2月国内已有企业获得国家药监局签发的法匹拉韦的药品注册批件，并实现量产，临床药品供应有保障。而海正药业正是在上个月披露，其已收到国家药监局核准签发的法匹拉韦片的《药品注册批件》。
尽管暂时无法确定上述消息将给海正药业的股价带来怎样的影响，但作为抗疫概念股，海正药业的股价此前便已从1月17日收盘的10.17元/股一路上涨至了2月18日盘中最高的18.89元/股，涨幅最高超过80%；不过，其股价随后又一路回落至了3月17日收盘的12.95元/股。
而从过往的业绩表现来看，海正药业的发展则并不能让人满意。海正药业在过去多年的扣非后归母净利润持续亏损，在2019年，其通过非核心长期资产的处置等，实现了归母净利润的同比扭亏为盈，但其扣非后的归母净利润亏损反而扩大至了24.85亿~25.10亿元。
责任编辑：陈志杰",2020-03-17 23:38:57,新浪财经
2,“一亿口罩出口”遭火速问询 格力地产误导投资者？,"原标题：“一亿口罩出口”遭火速问询，蹭热度误导投资者？相关概念股已降温
这家公司刚公布“口罩出口一亿片”的小目标，便收到了交易所的问询函。
3月17日，格力地产公告称，收到上交所问询函，要求说明是否存在利用市场热点信息影响股价的情况。此前，相关媒体报道显示，格力地产旗下高格口罩产品正在积极推进出口业务，预计全年出口1亿片一次性医用口罩。
(image_address=""//n.sinaimg.cn/spider2020317/6/w830h776/20200317/0a84-iqyryku8493343.jpg"")
今日晚间，格力地产在问询函回复中称，旗下高格医疗目前尚未接到具体口罩出口订单，出口计划（即预计全年出口1亿片一次性医用口罩）是否能够实现存在较大不确定性。
需说明五大问题
上交所指出，在当前疫情防控形势下，口罩相关生产和供应是市场高度关注的热点信息，影响较大。
上交所此次对格力地产提出5个问题：
一、格力地产需核实并说明，近期是否存在接受调研、采访等情形，是否存在利用市场热点信息影响股价的情况。同时，是否曾向投资者透露过与生产经营相关的信息。
二、格力地产需结合孙公司珠海高格医疗科技有限公司成立以来的实际生产经营情况，核实说明相关报道所称“出口1亿片一次性医用口罩”、“积极推进出口业务”等事项是否属实，高格医疗是否具备生产和出售的相关许可，并提供相应的依据。
三、格力地产需核实并说明口罩的已建和在建生产线情况、日均产能、出口目的地、在手出口订单等信息，并披露口罩业务对该公司营业收入、净利润等的实际影响，同时提示相关风险。
四、2020年2月11日，格力地产披露《关于设立医疗科技公司的公告》，拟以2100万元投资高格医疗科技70%股权，主要生产口罩等医用物资。格力地产需按照信息披露一致性原则自查核实，通过新闻媒体而非公告形式发布前述口罩产能、积极推进出口业务等信息的原因和考虑，相关决策流程、信息发布内容等是否违反《公司章程》和上交所《股票上市规则》等相关规定，并核实信息发布的具体渠道和主要责任人。
五、格力地产需按照相关规定，及时向上交所填报内幕信息知情人名单，上交所将启动内幕交易核查。格力地产及全体董事、监事、高级管理人员应当勤勉尽责，本着对投资者负责的态度，依法依规做好信息披露工作，切实保障投资者合法权益。在收到问询函后立即披露信息，并于2020年3月17日回复《问询函》。
随后，格力地产表示，将按照《问询函》的要求尽快落实相关工作，并就上述事项予以回复并履行信息披露义务。
今日晚间，格力地产在回复中称，旗下高格医疗目前尚未接到具体口罩出口订单。此外，高格销售虽然已经取得了《第二类医疗器械经营备案凭证》，但目前尚未获得欧盟国家CE认证和北美FDA认证，高格医疗为新设立企业尚未申请海关进出口业务资质，能否实现出口销售业务具有较大不确定性。
经格力地产自查，“口罩产能、积极推进出口业务”等信息是高格销售口罩销售负责人不熟悉信息披露规则。该信息发布不符合《股票上市规则》的信息披露规定，公司对此向广大投资者致歉。
公开资料显示，2月10日，格力地产全资子公司珠海高格企业管理有限公司与珠海市微创科技有限公司、珠海医凯电子科技有限公司、珠海丰炎科技有限公司合资3000万元成立高格医疗，其中格力地产持股70%。
相关报道显示，2月29日，格力地产高格口罩曾宣布，经过安装调试，高格口罩第二条全自动生产线顺利投产。投入新生产线后，口罩月产能将增至600万片，在此基础上，3月份口罩生产线还将增至10条，全力投入防疫物资生产。
口罩概念股已降温
口罩出口的相关信息对格力地产股价有一定提振作用。
3月17日，受外围市场影响，A股大多数个股收跌，部分个股跌幅较大。但格力地产早盘高开，最高涨至4.62元/股。最终收于4.49元/股，收涨1.35%。
(image_address=""//n.sinaimg.cn/spider2020317/752/w830h722/20200317/023a-iqyryku8493367.jpg"")
不过，由于近期交易所加大了问询力度以及市场波动加剧，此前涨势强劲的口罩概念股已经纷纷走弱，部分交易日甚至跌幅居前。Wind口罩指数显示，该指数在3月9日到达高点后，便一路走低。
(image_address=""//n.sinaimg.cn/spider2020317/654/w644h810/20200317/5c02-iqyryku8493366.jpg"")
今日，多只口罩概念股出现下跌，不乏前期热门概念股。
(image_address=""//n.sinaimg.cn/spider2020317/264/w828h1036/20200317/3e97-iqyryku8493409.jpg"")
多公司曾被质疑炒作口罩概念
近期，多家公司被质疑是否刻意迎合市场热点、炒作公司股价的情形。
3月11日，全新好（维权）公告称，公司决定以免费的方式向公司股东赠送公司子公司产品二代灭菌纸巾相关产品以及委托生产的民用一次性防护口罩一份，本次免费赠送活动预算不超过100万元。此外，全新好于2月3日公告称，公司拟在未来两个月内向武汉红十字会及深圳慈善会等机构捐赠第二代灭菌纸巾20吨及消毒灭菌口罩100万只。
3月12日，深交所下发关注函称，前期公司捐赠计划截至目前仍未完成，以及相关口罩生产设备尚未到位。详细说明相关公告是否存在误导投资者、刻意炒作“口罩”概念的情形。
3月2日，国立科技在互动易答复投资者时表示，公司目前有在研发聚丙烯熔喷料相关产品，后续将依据市场情况决定是否量产；3月5日在互动易表示公司目前已研发用于口罩熔喷布的聚丙烯原材料，不过尚未量产。3月4日至6日，国立科技连续三个交易日涨停。
3月8日，深交所向国立科技下发关注函要求自查并说明公司是否存在以互动易回复替代临时公告的情形，是否存在应披露未披露信息，前述互动易回复是否存在主动迎合市场热点、炒作公司股价的情形。
2月28日，南京聚隆在微信公号发布文章称，公司成功开发出可用于医用口罩的无纺布用聚丙烯熔喷专用料系列产品，并在文章留言中回复称“目前该系列料已经量产，日产量50T，后续会继续增加产能”。2月28日至3月5日，公司在深交所互动易平台多次表示，近日开发出的聚丙烯熔喷专用料可以应用于口罩生产，已部分量产，已有销售。自2月28日以来公司股价涨幅较大，其中3月5日、3月6日连续两个交易日涨停。
3月8日，深交所向南京聚隆下发关注函，要求说明公司是否存在主动迎合市场热点、炒作公司股价的情形等。
此外，金太阳、搜于特等公司因披露口罩业务收到深交所关注函，要求说明是否迎合市场热点、炒作或影响公司股价的情形。不过，相关上市公司均否认“蹭热点”、炒作公司股价。
]article_adlist-->推荐阅读
]article_adlist-->
责任编辑：王帅",2020-03-17 23:25:22,新浪财经
3,中国忠旺重启借壳回A新方案 前次重组4年无果后终止,"原标题：中国忠旺宣布重启借壳回A新方案，前次重组4年无果后终止
(image_address=""//n.sinaimg.cn/sinakd2020317s/89/w580h309/20200317/042f-iqyryku8457339.jpg"")
3月17日晚间，中国铝加工龙头企业中国忠旺控股有限公司（下称“中国忠旺”，01333.HK）发布公告，披露潜在分拆的框架协议，宣布重启回归A股的进程。
公告显示，3月17日当天交易时间段后，中国忠旺全资附属公司忠旺精制投资有限公司（下称“忠旺精制”）与中房置业股份有限公司（下称“中房股份”，600890）签订框架协议，将忠旺精制持有的辽宁忠旺集团有限公司（下称“辽宁忠旺”）约96.55%股权注入中房股份，实现辽宁忠旺在上海证券交易所上市（“潜在分拆”）。
同日晚间，中房股份也发布相关公告，披露拟议交易初步方案为：中房股份拟通过资产置换、发行股份的方式购买忠旺集团的全部或控股股权（“置入资产”）。具体而言：中房股份拟以其全资子公司新疆中房置业有限公司（下称“新疆中房”）100%股权（“置出资产”）与忠旺精制持有忠旺集团股权中的等值部分进行置换，差额部分由中房股份以发行股份的方式向忠旺精制及忠旺集团的其他股东购买。
交易标的价格方面，由中房股份聘请具有证券期货从业资质的中国评估机对置入资产和置出资产进行评估，置入资产和置出资产的交易价格应基于其评估价值并经相关交易方协商确定。
中房股份方面表示，将尽合理努力及诚意促使拟议交易完成。双方及其关联方将按照相关交易方最终确定的方案促成拟议交易签约。忠旺精制也将尽合理努力及诚意推进忠旺集团其他股东与中房股份进行拟议交易的相关工作，就中房股份以发行股份的方式购买忠旺集团其他股东所持有忠旺集团的全部股权做进一步协商。
中国忠旺董事会在公告中称，潜在分拆将使市场更有效地评估本公司价值，并为本公司提供另一个上市公司平台。交易顺利完成后，辽宁忠旺将成为中房股份的直接全资附属公司，且仍为中国忠旺的间接非全资附属公司。
值得一提的是，中国忠旺的回A之路颇为曲折。
历史公告显示，此前的2015年10月，中国忠旺首次披露借壳中房股份回归A股计划。2016年3月22日，双方披露的资产重组预案显示，中房股份拟以其持有的新疆中房100%股权作为置出资产，与忠旺精制持有的忠旺集团100%股权中的等值部分进行置换。经交易双方协商，置入资产作价调整为282亿元，中国忠旺通过将铝挤压业务注入中房股份实现分拆至A股上市。该交易构成借壳上市。
但交易受多因素影响，中国忠旺借壳回A推进缓慢。2019年8月26日，筹划近4年未果，双方宣布终止该重组。不过，中国忠旺随后披露公告称，公司目前正在调整分拆忠旺集团。
另外值得注意的是，在此前的2019年10月30日，中国忠旺公告宣布公司间接全资附属忠旺精制、辽宁忠旺与国家军民融合产业投资基金有限责任公司（基金一）订立增资协议，基金一同意向辽宁忠旺注资现金人民币10亿元。忠旺精制、辽宁忠旺同日还分别与嘉兴力鼎昌浩股权投资合伙企业（有限合伙）（基金二）、淄博盈科百耀创业投资合伙企业（有限合伙）（基金三）订股权转让协议一，忠旺精制同意分别向基金二及基金三出售辽宁忠旺约3.45%股权，代价各为人民币10亿元。
注资及转让完成后，忠旺精制、基金一、基金二与基金三于辽宁忠旺的股权将分别约为89.65%、3.45%、3.45%及3.45%，辽宁忠旺仍构成该公司的间接附属公司。
中国忠旺此次公告同时披露，中国忠旺与国家军民融合产业投资基金有限责任公司的交易正常推进。但由于近期新冠肺炎疫情影响，上述基金二和基金三未能如期完成有关交易的若干必要外部程序，导致交易无法按预期时间完成。出于此次潜在分拆的整体进程和后续时间安排的考虑，中国忠旺决定与基金二、基金三终止相关协议。
中房股份在当天公告还表示，因有关事项尚存不确定性，为了维护投资者利益，避免对公司股价造成重大影响，根据上海证券交易所的相关规定，经公司申请，公司股票自3月18日开市起开始停牌，预计停牌时间不超过10个交易日。
中国忠旺成立于1993年，总部位于辽宁省，是全球第二大、亚洲最大的工业铝挤压产品研发制造商。公司主要从事多元化的优质工业铝加工产品的研发、生产及销售，形成了以铝挤压、深加工以及铝压延三大核心业务并举的发展格局。公司2009年在香港上市，当年创下自2008年后全球最大IPO。
责任编辑：陈志杰",2020-03-17 23:12:09,新浪财经
4,万科祝九胜：毛利率下降可能是长期趋势,"来源：财联社
万科2019年年报显示房地产及相关业务的结算毛利率为 27.2%，较 2018 年下降 2.5 个百分点。在今日举行的万科2019年度业绩推介会上，万科总裁祝九胜回应：“毛利率下降可能是长期趋势，我们会进一步提升运营管理能力和效益等，毛利率下降不等于ROE的下降，投资人可能更关注股东回报。”
责任编辑：王帅",2020-03-17 23:06:23,新浪财经
