,title,content,pub_time,src
0,易华录：一季度净利同比变动幅度为-25%至5%,"新浪财经讯 3月8日消息，易华录晚间披露业绩预告，预计公司2020年第一季度净利润为盈利5790.43万元至8106.61万元，同比变动幅度为-25%至5%，公司上年同期净利润为盈利7720.58万元。报告期内，受新型冠状病毒疫情影响，公司项目订单及交付量都有所下滑。
责任编辑：陈志杰",2020-03-08 17:57:27,新浪财经
1,亿纬锂能拟募资25亿 投资TWS锂离子电池等3个项目,"亿纬锂能公告，公司公布非公开发行A股股票预案，拟募集资金总额不超过25亿元人民币，扣除发行费用后将投资于“面向TWS应用的豆式锂离子电池项目”、“面向胎压测试和物联网应用的高温锂锰电池项目”、“三元方形动力电池量产研究及测试中心项目”和补充流动资金。
责任编辑：王帅",2020-03-08 17:57:16,新浪财经
2,海能达：美国法院判决公司向摩托罗拉支付损害赔偿53.34亿,"海能达公告，伊利诺伊州法院法官作出一审判决，支持陪审团裁决结果，判决公司等向摩托罗拉支付损害赔偿合计约合人民币53.34亿元。
责任编辑：王帅",2020-03-08 17:54:58,新浪财经
3,商界木兰们表现亮眼 A股上市公司女性高管占比近20%,"原标题：（网站-要闻）致敬女性 | 商界木兰们表现亮眼，A股上市公司女性高管占比近20%
三八国际劳动妇女节是全球女性劳动者的节日，也是向女性们致敬的节日，她们有的早已成名，有的刚开始创业，有的是企业高管，但更多的都是默默奋斗的普通人。无论是什么身份，女性都在为全社会做出着贡献。
商界木兰们表现亮眼，A股上市公司女性高管占比近20%
今年2月，福布斯中国发布‘最杰出商界女性排行榜’，上榜的100位商界女性所管理企业总市值近10万亿元。其中，超过半数的上榜者拥有硕士及以上（包括MBA）学历，拥有本科及以上学历的比例接近90%。地域上，上海、杭州、北京成为拥有最多上榜者的城市。格力电器董事长董明珠时隔两年再次问鼎榜首，中信银行董事长李庆萍和阿里巴巴集团首席财务官武卫分别位居榜单的第二三位。
(image_address=""//n.sinaimg.cn/spider202038/607/w235h372/20200308/13c0-iqrhckm2234432.png"")（图片来源：福布斯中国）
天眼查数据新闻实验室根据公开资料，梳理了国内超3，700家A股上市公司的高管信息，发现其中女性高管占比近20%。值得注意的是，女性高管中，拥有本科及以上学历的比例接近85%，年龄较多集中在41-50岁之间，占比43.45%。另外发现，有近10%的女性高管在公司担任财务总监或相关负责人的角色。
(image_address=""//n.sinaimg.cn/spider202038/82/w420h462/20200308/909f-iqrhckm2234434.png"")（图片来源：天眼查）
中国女性爱美之心，助推我国医疗美容行业蓬勃发展
宅在家的第N天，素颜的第N+N个小时，妹子们纷纷感叹，早知道年前就去整容了，竟然错过了这么好的恢复期。要么在家，要么戴口罩出门，爱美的女孩子们正迫切等待着，一个可以化完妆美美得出门的时机到来。
爱美之心，人皆有之，但是原因却各不相同。艾媒咨询的数据显示，2019年，64%的中国医美消费者在消费后都表示医美可以提升自信心，50%的消费者表示医美可以让她们有更好的工作机会，另外34%的消费者则表示，医美后她们能获得更多异性关注和告别单身。
(image_address=""//n.sinaimg.cn/spider202038/18/w491h327/20200308/f5c8-iqrhckm2234508.png"")（图片来源：网络）
越来越多的女孩子想变美，随之扩大的还有中国的医美市场。据报道，从2015年开始，中国医美行业市场规模一直处于高速增长的态势，现在中国已经成为世界第三大医疗美容市场。预计2020年，中国医美行业规模将达到3，150亿元。
根据艾媒咨询的统计，2018年，私密整形、皮肤激光，和全脸线雕是增速最快的医美项目，增速分别为127.2%、110.3%，和89.8%。
天眼查专业版数据显示，我国目前共有700多家从事医疗美容业务的企业，并且过半都集中在北京市、广东省，和上海市。其中，北京市以172家医美企业排名第一，有趣的是，北京市超过一半的医美企业都集中在朝阳区。
(image_address=""//n.sinaimg.cn/spider202038/103/w470h433/20200308/2da3-iqrhckm2234509.png"")（图片来源：天眼查）
从成立时间看，2014-2017年是我国医美行业爆发式发展的年份，四年共成立400多家医美企业，占总数的55%。从融资轮次上看，我国医美行业共有26家企业完成天使轮融资，19家完成A轮融资，另外有4家企业通过IPO上市。
(image_address=""//n.sinaimg.cn/spider202038/103/w470h433/20200308/3e5e-iqrhckm2234591.png"")（图片来源：天眼查）
准妈妈们特殊的妇女节：母婴类产品企业陕西最多
最近，准妈妈们呆在家，只能靠补钙类的母婴产品补充孕期所需钙质。但目前传统的线下母婴店大多无法正常开业，所以大量的母婴产品需求转入线上。在这个特殊的妇女节，准妈妈们纷纷下单，为自己购买孕期需要的营养品。
(image_address=""//n.sinaimg.cn/spider202038/195/w589h406/20200308/48e5-iqrhckm2234593.png"")（图片来源：网络）
据育儿网调查数据显示，补钙类产品最受孕妈们青睐，占比37.11%，其次是维C和营养配比比较丰富的孕妇奶粉。行业分析称，在接下来的一段疫情防控期，这些补钙类母婴产品的热度依旧不会减少。
国家统计局的数据显示，2017-2019年，我国新生儿出生率逐年下降，从12.43‰下降到10.48‰。
天眼查专业版数据显示，我国目前共有超过117万家经营母婴类产品的企业。其中，2019年是相关企业爆发增长的年份，一年共注册接近62.5万家企业，超过现有企业总数的一半，比上年增长249.2%。
（图片来源：天眼查）
从成立时间来看，母婴行业非常年轻，过半的企业都不到“一岁”，而且超过90%的企业都成立于5年之内。
就地域分布来看，陕西省的母婴类企业最多，数量达到20多万。浙江省排名第二，共有140多万相关企业。
（图片来源：天眼查）
然而在疫情防控期间，传统的线下母婴店大多无法正常开业，所以大量的母婴产品需求都转入线上。奶粉、纸尿裤这种传统线下门店“引流保证”的销路也暂时受阻，使母婴行业到了变革的路口。
北京有多少家宠物店？中国有多少家婚姻介绍所？
猪肉价格上涨，如何用数据证明我国猪肉供给稳定有保障？
英雄联盟有了手游版，电子游戏业有多火？……
这些看起来稀奇古怪的“数字题”，只要和公开商业数据相关的，都能在天眼查专业版（std.tianyancha.com）上找到答案。
(image_address=""//n.sinaimg.cn/spider202038/439/w862h377/20200308/9018-iqrhckm2234784.png"")（图片来源：天眼查专业版）
天眼查专业版不仅可按省份地区、注册资本、成立时间、行业分类等基本工商信息进行多维度组合条件检索，还能够根据检索条件自动生成可视化图标，聚焦行业分析动态，例如大数据、电子烟、工业大麻等新兴行业的产业分布及发展预期等；除此之外，天眼查专业版不仅包含股权结构、投资族谱等基本功能外，还支持多维度动态监控和预警，第一时间推送一手变更。
(image_address=""//n.sinaimg.cn/spider202038/464/w862h402/20200308/7c1d-iqrhckm2234783.png"")（图片来源：天眼查专业版）
截止目前，天眼查收录了1.8亿家社会实体信息（含企业、事业单位、基金会、学校、律所等），300多种维度信息全量实时更新，是目前获得央行认证的企业征信资质的大数据科技公司，已有超过2亿用户。
责任编辑：王帅",2020-03-08 17:50:09,新浪财经
4,英科医疗：美国免除多种医疗产品进口关税,"英科医疗晚间公告，近日，美国政府对从中国进口的100多种医疗产品免除了进口关税，其中包括公司的主要产品丁腈手套医疗级。丁腈手套医疗级在第四批第一期3000亿美元的征税清单中，今年2月初丁腈手套医疗级加征的关税税率刚刚由15%下降至7.5%。公司2018年医疗防护产品销售收入占总收入的84.75%，近期因受新冠状病毒疫情影响，一次性防护手套需求激增，产品供不应求。
责任编辑：王帅",2020-03-08 17:48:49,新浪财经
5,益生股份：2月销售收入7645.81万 同比减少50.46%,"益生股份：2月鸡苗销售数量3，188.4万只，同比增加52.22%，销售收入7，645.81万元，同比减少50.46%，环比均减少9.32%和41.45%。
责任编辑：王帅",2020-03-08 17:42:03,新浪财经
6,中恒集团 ：拟9.5亿元认购莱美药业定增股份,"中恒集团（600252）3月8日晚间公告，公司拟与中恒同德基金和广投国宏基金共同参与认购莱美药业2020年度非公开发行A股股票，莱美药业拟募资总额不超过10.97亿元，发行价4.5元/股。广投国宏基金拟认购不超过5000万元，中恒同德基金认购金额不超过1亿元，公司认购金额不超过9.5亿元。此外，中恒集团持有中恒同德基金98%出资额，为中恒同德基金有限合伙人。莱美药业3月6日报收5.48元。
责任编辑：王帅",2020-03-08 17:35:23,新浪财经
7,国立科技收关注：是否具备口罩熔喷布的生产能力,"三连板国立科技收关注函，要求说明公司研发用于口罩熔喷布的聚丙烯原材料的基本情况，包括但不限于研发起始时间、投入规模、人员数量、研发进展等，以及你公司是否具备用于口罩熔喷布的聚丙烯生产能力、是否具有生产聚丙烯所必需的生产设备、厂房、技术、原材料采购渠道，是否需取得相关生产资质及其获取情况，结合上述情况说明相关业务对你公司财务状况和经营成果的影响，并提示相关风险。
责任编辑：王帅",2020-03-08 17:06:12,新浪财经
