,title,content,pub_time,src
0,宋都服务折戟港交所：自身造血不足 盈利能力下滑构成上市障碍,"来源：IPO早知道
原标题：宋都服务折戟港交所：自身造血不足 盈利能力下滑构成上市障碍 
近三年外拓中标项目仅3个。
据IPO早知道消息，宋都服务集团有限公司（简称“宋都服务”）于1月24日递交的港股招股书届满6个月，已于昨日（7月24日）失效，信达国际担任独家保荐人。
招股书资料显示，宋都服务于1995年在杭州成立，宋都股份（600077.SH）董事长俞建午通过家族信托控制其股权的95％，为其最终控制人，也即宋都服务和宋都股份是兄弟公司。俞建午90后女儿俞昀自2018年3月加入宋都服务，现担任公司董事会主席兼执行董事，亦可看作这是一次二代接班的前哨站。
(image_address=""//n.sinaimg.cn/spider2020725/167/w500h467/20200725/2cfb-iwtqvym1525653.jpg"")
宋都服务股权结构（来源：招股书）
当然，招股书失效并不意味着宋都服务就此与港交所绝缘，其只需更新招股书即可延续上市进程，特别是在疫情后物业价值更为凸显的背景下，相信宋都服务不会错过这样一个绝佳时机。而从此前披露的招股书来看，宋都服务的体量过小、盈利偏弱依然值得投资者关注。
受困浙江，自身供血不足
宋都物业从浙江发家，历经二十余年的发展，已将服务拓展至合肥、舟山、宁波、衢州等10个城市。截至2019年9月30日，宋都服务在中国设有8间附属公司及12间分公司，向在管总建筑面积约为4.0百万平米的27项物业提供物业管理服务。于最后可行日期，其的在管总建筑面积约为5.9百万平方米。
按物业管理综合实力计，宋都服务于2017-2019年分别位列中指院排名第81、第71及第65。而在总部设在杭州及浙江省的物业服务百强企业中，宋都服务按纯利计分别排名第9及第10。
纵然如此，宋都服务属于“袖珍”物业公司范畴。克而瑞数据显示，2019年中国物管行业管理面积突破1亿平米的企业数量达到15家，其中万科物业、碧桂园服务（06098.HK）、彩生活（01778.HK）及金碧物业，管理面积均在3亿平米以上。
同既有上市物业公司相比，宋都服务的在管面积只略微领先兴业物联，与其同日交表且现已上市的金融街物业（01502.HK）于2019年9月的在管面积也已达1900万平米，体量是其近5倍。
而物管行业规模为大，但宋都服务的现有迹象并不支持规模快速走阔。
地产拆分的物业公司普遍依赖关联公司输血，宋都服务也遵循这一规律，2017-2018年及2019年前9个月其来自宋都股份开发物业（含独立开发和合作开发）的在管建筑面积分别为192.5万311.5万平米、364.5万平米及343.5万平米，占同期总在管建筑面积的98.4％、95.5％及86.9％。
(image_address=""//n.sinaimg.cn/spider2020725/783/w500h283/20200725/e639-iwtqvym1525654.jpg"")
宋都服务关联方依赖（来源：招股书）
但宋都股份却是“小富即安”的保守派，2018年销售额才首度踏破百亿关口，2019年以118.5亿元的年销售额位列克而瑞《2019年中国房地产企业销售TOP200排行榜》第146名，距离当年300亿的销售目标相去甚远。关联方尚且跑不动，意味依赖关联方的扩张路径显然行不通。
另一方面，宋都服务外拓的野心并不大。2017-2019年9月，宋都服务对标投标次数分别为1次、1次、4次，中标次数分别为0、1、2，频次相当稀少。
(image_address=""//n.sinaimg.cn/spider2020725/756/w500h256/20200725/1aaa-iwtqvym1525678.jpg"")
宋都服务收入地区分布（来源：招股书）
而在区域分布上，宋都服务还是紧守以杭州为首的大本营。截至2019年9月，宋都服务在杭州的在管建筑面积为280.7万平米，占总在管建筑面积的71％；去年头9月来自杭州的收入为4767.4万元，是当期总收益的69.6％。如若算上浙江其他地市，浙江单省在管面积与收入占比分别达到79.8％及84.3％。
盈利偏弱，长租公寓难添胜算
在管面积的大小，客观决定收入水平的高低。2017-2018年及2019年前9月，宋都服务实现营收8396万元、1.32亿元、1.37亿元，同期净利润分别为1396.5万元、2088.9 万元和1942.5万元。
(image_address=""//n.sinaimg.cn/spider2020725/786/w500h286/20200725/3428-iwtqvym1525677.jpg"")
宋都服务利润表（来源：招股书）
可以看出，宋都服务的营收增速要快于净利增长，一定程度凸显其的盈利弱化。事实上，于往绩记录期间，宋都服务毛利率分别为29.7％、28.3％、28.5％，而净利率分别为16.6％、15.7％、14.1％。
宋都服务的盈利能力值得进一步深究。Wind数据显示，2019年港股房地产服务板块平均毛利率为30.4％，超过宋都服务近两个百分点；上述提及的兴业物联，2019年毛利率高达42.72％，净利率也高达19.10％，宋都服务与之相比逊色不少。
其实，宋都服务坪效并不低。据悉，2017-2019年杭州的住宅物业平均物业管理费分别为2.3元/月/平方米、2.3元/月/平方米、2.5元/月/平方米，往绩期间宋都服务住宅物业的物管费为2.39元/月/平方米、2.6元/月/平方米、2.63元/月/平方米，均高于市场平均水平。
单位收费高而利润低，各种的原因在于费用的大幅增长。招股书显示，宋都服务将清洁、保安、养护及园艺服务等部分服均授予外包商，过往期间这部分的成本分别约为120万元、456万元及490万元，占同期销售成本总额约20.3％、47.8％及49.9％。
加之，宋都服务的物管费收缴率持续走低，从2017年的87.1％降至2019年9月的64.6％，这也使得利润空间变得更薄。
相较其他物管企业，宋都服务比较特殊的是长租公寓服务，2019年前9月共为其贡献收入124.7万元。目前，宋都服务旗下的[琪寓公寓]均位于杭州时间国际大厦12-13楼，其表示未来将加大长租公寓的投资。
只是，年内长租公寓雷声不断。如年初“长租公寓第一股”青客公寓被爆出拖欠房东租金导致百余名租客被赶，其后“长租公寓第二股”蛋壳公寓创始人兼CEO被调查，蛋壳公寓股价暴跌熔断。
当下国内的长租公寓通常采取重资产模式，宋都服务的营运能力能否支撑该项业务的发展，也是一个悬而未决的问题。
免责声明：自媒体综合提供的内容均源自自媒体，版权归原作者所有，转载请联系原作者并获许可。文章观点仅代表作者本人，不代表新浪立场。若内容涉及投资建议，仅供参考勿作为投资依据。投资有风险，入市需谨慎。
(image_address=""//n.sinaimg.cn/finance/cece9e13/20200514/343233024.png"")
海量资讯、精准解读，尽在新浪财经APP
责任编辑：陈悠然 SF104",2020-07-25 08:56:45,新浪财经
1,京东健康传赴港上市：最新估值71亿美元 中金公司持股,"新浪港股讯 7月25日消息，昨日传京东计划分拆京东健康于香港上市，拟集资10亿美元。而相关工作已开展，料最快今年底至明年初完成。京东发言人表示，对消息不予置评。
京东健康是京东集团旗下唯一经营大健康相关业务的子集团，将依托京东集团的各项能力和资源优势，在现有医药零售、医药批发、互联网医疗、健康城市四个业务版块基础上，逐步完善 “互联网+医疗健康”产业布局。
辛利军为公司执行董事兼总经理，为公司法定代表人，廖晓红为公司监事。
(image_address=""//n.sinaimg.cn/finance/transform/714/w550h164/20200725/e033-iwtqvym1435243.png"")
徐雷担任公司公司董事长，曾历任京东商城市场营销部负责人、无线业务部负责人、京东商城营销平台体系负责人等多个职务。
根据天眼查数据，京东在2019年11月15日进行了A轮融资，投后估值71.43亿美元，中金资本、京东集团领投。
(image_address=""//n.sinaimg.cn/finance/transform/664/w550h114/20200725/b0df-iwtqvym1439628.png"")
中金资本于2017年3月6日正式成立，并于同年12月13日，取得了中国基金业协会的私募基金管理人资格。中金资本为中金公司唯一的私募股权投资基金业务平台，统一管理中金公司境内外私募投资基金业务。
目前中金资本管理的基金类型涵盖政府引导基金、存量经济改革基金、美元母基金、美元股权投资基金、人民币股权投资基金、并购基金、海外基金等。截至2018年底，中金资本整体管理规模超过3000亿元。（文/金石）
(image_address=""//n.sinaimg.cn/finance/cece9e13/20200514/343233024.png"")
海量资讯、精准解读，尽在新浪财经APP
责任编辑：张海营",2020-07-25 08:27:04,新浪财经
2,招商蛇口逾60页回复详解问询 70亿重组难救下滑业绩,"(image_address=""//image.sinajs.cn/newchart/new_daily/n/sz001979.gif"")
热点栏目
自选股
数据中心
行情中心
资金流向
模拟交易
客户端
国际金融报
原标题：招商蛇口逾60页回复详解问询，70亿重组难救下滑业绩
7月23日晚，针对深交所就重组下发的问询函，招商蛇口给出了62页的回复，就交易所提及的土地评估、交易价格、股价参考标准、股份来源等问题进行解释。
受访专家表示，招商蛇口收购南油集团的信心足，收购信念坚定，对交易所的问询函详细回复，产生其他变数的可能性小。
不过，南油集团涉及的前海片区土地由于开发周期长达8-10年，招商蛇口的业绩短期内并不会因此得到显著提升。
“资产评估合理”
7月13日，招商蛇口发布《发行股份、可转换公司债券及支付现金购买资产并募集配套资金报告书（草案）》（下称“报告书”），披露了购买南油集团24%股权的具体细节。
南油集团24%股权的交易对价约为70.35亿元，招商蛇口以发行股份、可转换公司债及现金方式支付的对价分别约为1.76亿元、33.42亿元、35.18亿元，在交易对价中占比分别为2.5%、47.5%、50%。
交易完成后，南油集团将成为招商蛇口的全资下属公司，进一步增强招商蛇口在前海片区的享有的权益。
7月17日，深交所就上述报告书向招商蛇口下发了问询函，涉及地块评估、交易价格、股份来源等问题。
深交所提出，报告书显示，南油集团的股东全部权益评估值为293.14亿元，较账面价值增值64.36%。南油集团的主要资产为下属公司前海蛇口自贸投资持有的前海自贸区内土地资源，而该土地资源主要由招商蛇口与深圳市前海开发投资控股此前以各自持有的招商驰迪与前海鸿昱100%股权共同增资注入。
由此，深交所要求招商蛇口说明招商驰迪、前海鸿昱是否构成南油集团具有重大影响的下属企业，以及交易标的的资产评估情况及评估结果的合理性。
招商蛇口在回复中表示，南油集团具有重要影响的主要下属公司为招商前海实业。
(image_address=""//n.sinaimg.cn/spider2020725/76/w1006h670/20200725/9636-iwtqvym1027133.png"")
南油集团直接持股招商前海实业32.89%，通过其持股35%的前海平方间接持股招商前海实业34.1716%，合计权益比例为44.85%。
招商前海实业的主要资产为通过持股50%的前海自贸投资持有的招商驰迪和前海鸿昱100%股权，招商驰迪和前海鸿昱的主要资产为其持有的深圳南山区前海深港合作区编号为T102-0296、T102-0310地块。而招商驰迪、前海鸿昱并非南油集团的控股子公司。
招商蛇口进一步表示，交易评估基准日为2019年12月31日，此前增资前海自贸投资时的评估基准日为2019年9月30日，两次评估基准日间隔较短；同时，前后两次评估中，招商驰迪、前海鸿昱的的核心资产未发生变化。
“两次评估基准日接近，仅相差一个季度，期间深圳市房地产市场及土地市场平稳，评估所涉及土地规划无变化，本次评估中已考虑了相关土地所涉项目建设进度的前述影响。”招商蛇口表示，“评估过程中根据不同物业类型的租售信息及建造成本数据取值，开发利润率按正常的客观水平取值，销售税费按照相关的法律法规计算，评估价值合理。”
此外，对于交易所提到的部分地块存在被收回或未能正常续期的问题，招商蛇口表示，随着未来前海片区土地开发与建设的开展，土地效益逐步释放，所涉土地被收回或未能正常续期风险对于南油集团未来整体经营的影响会降低。
这笔遭遇了问询的交易未来还会有新的变数吗？诸葛找房数据中心高级分析师王小嫱向记者表示，
从目前情况看，招商蛇口收购南油集团的信心足，收购信念坚定，对交易所的问询函详细回复，产生其他变数的可能性小。
地产分析师严跃进表示，“单纯从业务匹配度看，估计不会有变数。但从程序看，下半年在兼并收购方面预计政策会趋严，包括收购的资金来源、后续经营的规划等方面，这可能是招商蛇口所需要注意的地方。”
地块利润释放慢
收购事项完成后，招商蛇口对前海片区土地的控制权将得到增强，在前海土地持地公司的持股比例由36.2%提升至41.6%。
天风证券发布的研报显示，前海合资公司持有总建面约497.76万平方米，按照90%可售面积（约逾450万平方米），保守按照均价8万元假设，粗估货值为4032亿元。
尽管坐拥庞大的土地储备，但前海地块开发周期较长，利润释放缓慢，招商蛇口的业绩短期内不会得到显著提升。
在2019年底的一次股东大会上，有股东问到前海土地何时能兑现收益，前海蛇口自贸投资发展有限公司总经理胡勇回应，招商蛇口在前海的发展时间规划为六年分工，十年开发。
同时，王小嫱表示，此地块涉及金额庞大，开发周期长，短期内对招商蛇口的资金带来一定的压力。
这对近年来业绩表现明显下滑的招商蛇口来说，并不是个好消息。
梳理招商蛇口年报发现，2016年-2019年间，其归母净利润同比增速分别为97.54%、27.54%、24.71%、5.2%；同时，扣非净利润增速也连年下滑，至2019年则首度出现负增长，为-14.55%。
(image_address=""//n.sinaimg.cn/spider2020725/296/w1205h691/20200725/927b-iwtqvym1027134.png"")（来源：克而瑞）
另据克而瑞数据，2017年-2019年间，招商蛇口毛利率分别为42.7%、37.9%、34.66%，下滑明显；2019年，营收占比最高的深圳区域的毛利率则出现了13个百分点的下滑。
有投资者在业绩发布会上将招商蛇口的财务状况形容为“一年比一年差”。
2020年上半年，招商蛇口的业绩表现更是出人意表。据招商蛇口7月13日发布的半年度业绩预告，其预计今年上半年归属上市公司股东的净利润8亿-10亿元，较上年同比下降79.59%-83.67%。
除了新冠疫情影响、2019年同期基数较高等，招商蛇口还提到，“房地产业务结转规模同比增长，但受结转项目地区结构影响，毛利率同比下降”。
而今年以来，招商蛇口在土地市场上表现积极。中金公司发布的研报显示，招商蛇口上半年新增土储面积、金额分别为660万平方米、641亿元，分别同比增长72%、67%，拿地强度上行13个百分点至58%。其中，不乏高价地块，如6月份在徐州以138%溢价率拿下的地块，7月初在上海虹口区拿下的地块楼面价则达到8.1万元/平方米。
在王小嫱看来，高溢价拿地是为了扩张规模，但是扩张规模的同时往往会带来成本走高、公司利润下降，高溢价对后期盈利会造成一定压力。
(image_address=""//n.sinaimg.cn/finance/cece9e13/20200514/343233024.png"")
海量资讯、精准解读，尽在新浪财经APP
责任编辑：陈悠然 SF104",2020-07-25 08:05:19,新浪财经
3,五次喊话无任何军工业务:东安动力仍任性六连板 谁在爆炒？,"(image_address=""//image.sinajs.cn/newchart/new_daily/n/sh600178.gif"")
热点栏目
自选股
数据中心
行情中心
资金流向
模拟交易
客户端
原标题：五次喊话“无任何军工业务”，东安动力仍任性六连板，谁在爆炒？
(image_address=""//n.sinaimg.cn/spider2020725/110/w580h330/20200725/6305-iwtqvym1382529.jpg"")图片来源：视觉中国
记者 | 张艺
越澄清越上涨，上市公司五次劝退喊话表示“无任何军工业务”，仍抵挡不了投资者的热情，东安动力（600178.SH）在7月24日“任性”一字涨停。这是东安动力近期连续第六个涨停板。
当日晚间，东安动力再发出风险提示公告，公司确认，无任何军工业务，增程器业务收入目前占公司营业收入的比重仅在10%左右，占公司业务的比重很小。
上周五（7月17日），东安动力第一个涨停时，公司就及时发文提示，“媒体有报道航母概念股拉升，内容涉及公司，公司确认不存在航母概念。”
这种澄清并未凑效。
军工板块本周仍异常活跃。市场仍把东安动力归为军工板块，东安动力本周五个交易日，收五个涨停板。截至7月24日，公司最新收盘价9.34元，7月至今，累计涨幅109.89%。
有投资者对界面新闻分析，之所以东安动力走势如此疯狂，一方面是之前未被爆炒过，这次遇到军工板块的概念性炒作。另一方面，低位、低价，加上总市值、流通市值、实际流通市值都极小，都是易被资金控盘的关键指标。“本身浮动筹码少，一旦有游资介入，跟风资金就以追龙头的心理追涨，导致人气龙头的强者恒强。”
与此同时，在7月20日、22日、23日、24日连发股票交易异常波动暨风险提示公告，公告中的措辞一次比一次更强调，自己与军工业务无任何关系。
(image_address=""//n.sinaimg.cn/spider2020725/674/w576h98/20200725/14d1-iwtqvym1382528.png"")
7月24日晚间公告
(image_address=""//n.sinaimg.cn/spider2020725/684/w580h104/20200725/4df1-iwtqvym1382581.png"")
7月23日晚间公告
(image_address=""//n.sinaimg.cn/spider2020725/649/w580h69/20200725/76a7-iwtqvym1382580.png"")
7月22日晚间公告
(image_address=""//n.sinaimg.cn/spider2020725/703/w580h123/20200725/6f0b-iwtqvym1382619.png"")
7月20日晚间公告
(image_address=""//n.sinaimg.cn/spider2020725/650/w580h70/20200725/58cf-iwtqvym1382618.png"")
7月17日晚间公告
东安动力主要从事微型汽车发动机、变速箱及其零部件的生产和销售。
其公告是提到的增程器一般指能够提供额外的电能，从而使电动汽车能够增加行驶里程的电动汽车零部件，传统意义上的增程器指发动机与发电机的组合。
基本面上东安动力并无大涨支撑，公司一季度出现亏损。公司一季度实现营业收入4.91亿元，同比增长20.48%；实现归属于上市公司股东的净利润为亏损685.24万元。
值得注意的是，尽管东安动力在24日涨停未打开过，但成交放量，全日成交额4.20亿元，换手率9.74%。
尤其是在午盘大盘跳水之时，东安动力在14时26分有万手以上大卖单多达7手，全日万手以上卖单多达10手。
谁在打板东安动力？从盘后龙虎榜可见游资正击鼓传花，已有两波游资套现退出。
东安动力在7月17日、22日、24日均登上龙虎榜，上榜无机构席位，多为游资席位。
7月17日买入前五席位中，第一位国元证券上海虹桥营业部买入金额991.54万元，第二位中国中金财富证券无锡清扬路营业部买入696.00万元，第三位长城证券莆田荔城大道营业部买入647.84万元。
这三家营业部同时登上了7月22日卖出前五的名单。国元证券上海虹桥营业部、中国中金财富证券无锡清扬路营业部、长城证券莆田荔城大道营业部分别卖出875.88万元、844.58万元和792.91万元。几乎出货完毕。
同日，买入第一大席位包括中信证券上海分公司买入3510万元，中信证券上海红宝石路营业部买入3086.37万元，华泰证券辽宁分公司买入700.67万元。这三个席位又现身7月24日的卖出前五，分别卖出4670万元、3736万元、932.23万元。
从金额来看，这三家营业部已锁定收益全部套现离场。
7月24日，中泰证券深圳后海大道营业部和中泰证券北京学院南路营业部还进行了一次倒手交易，二者同时出现在买入和卖出前五席位名单中。前者卖出783.82万元，买入1359.62万元；后者卖出851.99万元，买入1165.82万元。
东安动力是一家游资较为青睐的小市值公司。在连续大涨股价翻倍后，东安动力总市值也才43.16亿元。
(image_address=""//n.sinaimg.cn/spider2020725/695/w580h115/20200725/20d6-iwtqvym1382661.png"")
东安动力7月17日龙虎榜
(image_address=""//n.sinaimg.cn/spider2020725/695/w580h115/20200725/48c3-iwtqvym1382660.png"")
东安动力7月22日龙虎榜
(image_address=""//n.sinaimg.cn/spider2020725/695/w580h115/20200725/42eb-iwtqvym1382698.png"")
东安动力7月24日龙虎榜
(image_address=""//n.sinaimg.cn/finance/cece9e13/20200514/343233024.png"")
海量资讯、精准解读，尽在新浪财经APP
责任编辑：陈悠然 SF104",2020-07-25 08:04:09,新浪财经
