,title,content,pub_time,src
12,节能风电：上半年净利润3.71亿元 同比增20%,"新浪财经讯 7月20日消息，节能风电晚间发布业绩快报，2020上半年年营业收入为13.56亿元，同比增长10.54%；净利润3.71亿元，同比增长20.00%。
(image_address=""//n.sinaimg.cn/finance/cece9e13/20200514/343233024.png"")
海量资讯、精准解读，尽在新浪财经APP
责任编辑：张熠",2020-07-20 18:10:55,新浪财经
13,上市后20连板 康华生物称狂犬疫苗销售大增助推股价,"新京报讯（记者 王卡拉）自6月16日登陆深交所后，康华生物连续20个交易日涨停，深交所要求其核查股价短期内涨幅较大的原因。7月20日，康华生物回复深交所称，公司业绩稳步增长，疫苗行业受到市场较多关注，且公司流通股规模较小，易受市场资金影响。
康华生物6月16日在创业板上市，开盘价84.44元/股，首日顶格涨幅44%，此后又连续19个交易日涨停，20个交易日涨幅累计达到633.93%。7月16日，公司股价涨至上市后最高价659.97元/股后开始回落，当日跌停。7月20日，股价收于566.87元/股。自上市以来，康华生物已经发布7个股票交易异常波动公告，并收到深交所关注函，要求其核查股价短期内涨幅较大的原因以及是否存在违反信披原则的情形等。
康华生物主营业务为疫苗的生产、研发及销售，主要产品包括冻干人用狂犬病疫苗（人二倍体细胞）和ACYW135群脑膜炎球菌多糖疫苗。该公司也是国内首个且唯一一个人二倍体细胞狂犬疫苗生产企业，主力产品人二倍体细胞狂犬疫苗2014年开始为康华生物贡献销售收入，2017年-2019年，该疫苗的销售收入分别为2.41亿元、5.51亿元、5.38亿元，占康华生物同时期的营收比重均在90%左右。
2020年上半年，人二倍体细胞狂犬疫苗销量增加，助推康华生物业绩大幅增长，预计扣非后净利润为1.79亿元-1.84亿元，同比增长112.69%-118.63%。在7月20日的回复中，康华生物认为，公司经营业绩的稳步增长对公司股价的提升起到一定促进作用，公司股价上涨趋势与公司生产经营及业绩实现情况等基本面变化情况基本匹配。另外，由于公司属于上市新股，无限售流通股仅有1500万股，规模较小，致使股价易受市场资金影响。
随着生物疫苗产业的发展，国内疫苗企业不断加大生物疫苗企业研发力度，行业处于较快发展阶段。同时，受新冠疫情影响，政府对预防性医疗的政策支持力度不断加大，民众对生命健康保护意识逐渐提升，市场对疫苗行业关注度较高，同行业可比公司市盈率均处于较高水平。康华生物以康泰生物、智飞生物、沃森生物作对比，认为公司截至7月15日的静态市盈率（199.18倍）仍处于同行业可比公司静态市盈率区间内。不过，医药制造业滚动市盈率为58.87倍，康华生物显著高于医药制造业的市盈率水平，因此提醒投资者注意风险。
康华生物回复深交所时否认公司存在违反信披公平原则的情形，并表示，公司、公司控股股东、实际控制人目前及未来三个月内均无其他重大资产重组、收购资产、控制权变更、重大投资等重大事项。
(image_address=""//n.sinaimg.cn/finance/cece9e13/20200514/343233024.png"")
海量资讯、精准解读，尽在新浪财经APP
责任编辑：逯文云",2020-07-20 18:10:47,新浪财经
14,股东矛盾进一步激化 大连圣亚董事会成员又将生变？,"大连圣亚（600593）股东间的矛盾再度激化！
大连圣亚7月20日晚公告显示，公司第一大股东星海湾投资与股东、董事长杨子平相互提议罢免对方提名的董事、独董。对于近期正经历高层人事大变局的大连圣亚而言，真可谓是一波未平一波又起。
国有股东提董事、独董任免议案
星海湾投资是大连圣亚的国有股东，持有大连圣亚的股份比例为24.03%，系大连圣亚的第一大股东。
大连圣亚最新披露的公告显示，星海湾投资向大连圣亚董事会提请召开公司2020年第一次临时股东大会，审议《关于罢免陈琛董事职务的议案》、《关于罢免郑磊独立董事职务的议案》、《关于提请补选朱琨先生为公司第七届董事会非独立董事的议案》、《关于提请补选任健先生为公司第七届董事会独立董事的议案》等4个议案。
值得注意的是，6月29日，大连圣亚召开2019年股东大会。在这次股东大会上，杨子平提交的关于增加郑磊为独董，杨奇、陈琛为大连圣亚董事的提案均获通过；星海湾投资提名任健担任独董、朱琨担任董事的议案均未获通过。
正是在这次股东大会之后，杨子平方面在大连圣亚董事会中所在占的席位达到了5个，在全部9个董事会席位当中占据了绝对的优势。
据悉，星海湾投资提议罢免郑磊独董职务的理由是，郑磊作为公司的独立董事，在公司第七届十六次董事会召开程序存在瑕疵的情况下，未按照《上市公司独立董事履职指引》规定履行必要的关注和监督义务，未勤勉尽责履行独立董事职责。
提议罢免陈琛董事职务的理由是，陈琛先是上海申科滑动轴承有限公司的行政副总以及上海赟涞国际贸易有限公司的法定代表人及执行董事，同时，何建东（与磐京基金的法定代表人毛崴曾共同投资设立“上海申科投资有限公司”）是上海申科滑动轴承有限公司的法定代表人、执行董事、总经理，该公司有一家全资子公司——上海赟涞国际贸易有限公司。公司董事陈琛与股东磐京基金或其法人代表毛崴有着一定的关联，不利于行使公司董事权利。
鉴于陈琛因不再适合继续担任公司董事、郑磊因不再适合继续担任公司独立董事已经被双双提请罢免已经被提请罢免，所以星海湾投资提请补选朱琨为董事、任健为独董。
董事长杨子平反击
作为大连圣亚的董事长、同时也是大连圣亚单独持有4%股份的股东，杨子平眼见自己提名的一名董事、一名独董被大连圣亚的国有股东提请罢免，也迅速见招拆招还以颜色。
大连圣亚的公告显示，杨子平鉴于公司董事会已经收到星海湾投资关于提请召开公司2020年第一次临时股东大会。如公司董事会决定召开2020年第一次临时股东大会，在充分考虑公司利益及未来发展的前提下，提请公司董事会增加《关于提请罢免吴健董事职务的议案》、《关于提请罢免梁爽独立董事职务的议案》，提交2020年第一次临时股东大会审议，请国资另行委派合格董事。
需要指出的是，在连圣亚董事会现有的9个席位当中，杨子平方面占据5席、磐京基金的法定代表人毛崴占1个席位，原总经理肖锋系职工代表董事，吴健和梁爽则是星海湾投资提名的董事和独董。
值得注意的是，在此之前的7月15日，大连圣亚召开董事会，以7票赞成、2票反对，审议通过了《关于审计公司在建工程的议案》，2票反对票分别来自于肖峰和梁爽。
在该次董事会上，除了杨子平方面和磐京基金的法定代表人毛崴共计投出6票赞成票之外，吴健也意外地对议案投了赞成票。为此外界颇为关注，并引发了诸多猜测。
充满变数的一个半月
7月19日，大连圣亚召开董事会，以5票赞成，0票反对，4票弃权，审议通过《关于召开公司2020年第一次临时股东大会的议案》。大连圣亚的2020年第一次临时股东大会将于9月7日召开。
据悉，4票弃权票分别来自于吴健、肖峰、梁爽和郑磊。
其中，肖峰、吴健弃权的理由是，对股东提案的内容表示同意，但是反对股东大会拖至9月7日召开。例如，吴健就认为，对股东提案的内容同意，但公司董事会理应从勤勉尽责的角度出发、从对提案股东尊重和负责的角度出发，尽快召开临时股东大会，股东会议完全有条件在8月初召开，因此，反对9月7日才召开股东大会。
独董梁爽弃权的理由是，根据大连圣亚公司章程的规定，董事会同意召开临时股东大会的，应当在作出董事会决议后的5日内发出召开股东大会的通知，发出召开股东大会通知的15天后即可召开股东大会。因此，董事会理应勤勉尽责，尊重提案股东的提议，尽快召开临时股东大会。2020年第一次临时股东大会完全可以在8月初召开，而七届十九次会议议案却将其推迟到9月召开，理由不够充分。
独董郑磊弃权理由是因为议案涉及提案股东对其本人的独董罢免提案，其中的内容，明显不符合事实。圣亚正处于发展的关键时期，希望各位董事以全体股东利益为重、以公司发展为重，合法合规履职，平和积极沟通，而不是无视事实，利用召开股东大会对独董发表不同意见进行威胁敲打。
“目前距离大连圣亚召开2020年第一次临时股东大会尚有一个半月的时间，这期间自然也是充满各种变数，不排除相关股东还会增加各种提案。这是否会令大连圣亚股东矛盾愈加白热化？”有市场人士不无担忧地表示。
(image_address=""//n.sinaimg.cn/finance/cece9e13/20200514/343233024.png"")
海量资讯、精准解读，尽在新浪财经APP
责任编辑：逯文云",2020-07-20 18:09:07,新浪财经
