,title,content,pub_time,src
0,天普股份：中签号出炉 共有30168个,"8月16日消息，天普股份（605255）晚间披露网上中签结果，中签号码共有30168个，每个中签号码只能认购1000股天普股份A股股票。
(image_address=""//n.sinaimg.cn/finance/transform/764/w550h214/20200816/6d4e-ixvrvsp0010599.png"")
扫二维码 3分钟在线开户 佣金低福利多
(image_address=""//n.sinaimg.cn/finance/512/w256h256/20200807/333c-ixkvvuc9099771.png"")
(image_address=""//n.sinaimg.cn/finance/cece9e13/20200514/343233024.png"")
海量资讯、精准解读，尽在新浪财经APP
责任编辑：张熠",2020-08-16 15:46:21,新浪财经
1,派克新材：中签号出炉 共有24300个,"8月16日消息，派克新材（605123）晚间披露网上中签结果，中签号码共有24300个，每个中签号码只能认购1000股派克新材A股股票。
(image_address=""//n.sinaimg.cn/finance/transform/751/w550h201/20200816/e581-ixvrvsp0005386.png"")
扫二维码 3分钟在线开户 佣金低福利多
(image_address=""//n.sinaimg.cn/finance/512/w256h256/20200807/333c-ixkvvuc9099771.png"")
(image_address=""//n.sinaimg.cn/finance/cece9e13/20200514/343233024.png"")
海量资讯、精准解读，尽在新浪财经APP
责任编辑：张熠",2020-08-16 15:43:47,新浪财经
2,键凯科技：中签号出炉 共有11400个,"8月16日消息，键凯科技（688356）晚间披露网上中签结果，中签号码共有11400个，每个中签号码只能认购500股键凯科技A股股票。
(image_address=""//n.sinaimg.cn/finance/transform/683/w550h133/20200816/e1f5-ixvrvsn9998512.png"")
扫二维码 3分钟在线开户 佣金低福利多
(image_address=""//n.sinaimg.cn/finance/512/w256h256/20200807/333c-ixkvvuc9099771.png"")
(image_address=""//n.sinaimg.cn/finance/cece9e13/20200514/343233024.png"")
海量资讯、精准解读，尽在新浪财经APP
责任编辑：张熠",2020-08-16 15:41:24,新浪财经
3,玉龙股份：拟收购澳大利亚黄金开采加工企业,"8月16日消息，玉龙股份（601028）晚间公告，近期，公司与Barto Australia Pty Ltd签署了《收购意向协议》，公司拟以现金方式收购其持有的Barto Gold Mining Pty Ltd的100%股权。标的公司是一家在澳大利亚注册设立的公司，在西澳生产、运营金矿项目，核心业务为黄金的开采和加工。
(image_address=""//n.sinaimg.cn/finance/cece9e13/20200514/343233024.png"")
海量资讯、精准解读，尽在新浪财经APP
责任编辑：张熠",2020-08-16 15:38:45,新浪财经
4,周鸿祎：未被理解的悲观,"(image_address=""//n.sinaimg.cn/finance/crawl/784/w484h300/20200816/8d18-ixvrvsn9966843.jpg"")
周鸿祎：未被理解的悲观
来源： 卢泓言
我一直是个悲观者。道理也很简单，当人们不要自律而只渴望自由，那么被科技工具加持的自由会把各种人性缺点放出闸门，吞噬一切。我观察到只有少数人会公开表达类似的观点，周鸿祎是少数之一。去年马斯克发布脑机接口的消息，他在朋友圈说，“人类在坚决摧毁自己的路上越走越快了。”
所以昨天看了周鸿祎跟法律专家同时也是粉丝众多的up主罗翔在互联网安全大会上的对话，我的悲观又深了一点。
周鸿祎再一次阐述了他的悲观逻辑：“整个人类社会进入到一个数字孪生的时代，我们每个人生活中的方方面面、工作中的点点滴滴，无论整个社会的运转、还是每个人的衣食住行吃喝玩乐，都被数字化。所有的大数据会汇集，所以我们每个人都是透明的。这时候，个人消费者在强大的技术面前是无能为力的。”
罗翔也肯定了这种“现实的悲观”，不过他话头一转也表示了“法律人的乐观”。“因为法治的力量，在本质上就是从无序走向有序。”但我认为，如果不为这种乐观注入一种扎实的逻辑，如果只是一种言辞和信仰上的乐观，那么当技术实打实的撕裂一切，法律如何能兵来将挡、庖丁解牛？就是一个悬而未决的现实问题。
当然，周鸿祎所提到的大量的隐私问题是可以在法律之下直接解决的。最初级的，比如刚刚买了车，马上就有人打电话，要不要上保险？刚刚买了房，就有装修公司说，要不要装修？我们在一个APP上买了东西，马上其他APP就冒出来这种东西的广告。
个人数据被厂商掌握已经是一个客观存在的事实。只能退而求其次，要求厂商不能利用或者出卖用户的数据。即使你要用，选择权和知情权要交给用户，由立法和严格执法来保证。那些广泛存在的打擦边球的做法，会在全民觉醒以及“严刑峻法”的大势下收手，而360们所做的各种努力比如互联网安全大会ISC，比如跟有诸多粉丝的罗翔的对谈，其实就是在推动“大势”的形成。
更深一步的情况就不同了，比如2016年山东徐玉玉案，一个贫困大学生被骗走9900元学费，伤心猝死。而之所以被骗，是因为行骗者在学校网站上植入木马窃取了她的隐私信息，得知她申请了贫困助学金以及父母家庭信息，以此为由头得到了她的信任。
这一种如果单单靠立法就难以解决，为了利益很多人可以铤而走险，即使死刑也制止不了杀人和贩毒。关键点在于多如牛毛的网站存储了大量的个人的隐私信息，而网站们对于保护这些信息并没有足够的动力，而且单靠自己的薄弱的技术也不可能抵抗住高超的黑客。
这种情况就是周鸿祎说的，作为受害者的老百姓，在技术面前是弱势群体，很多人根本抵抗不了，或者受害了不知道，受害了无法取证，也很难立案。所以，这就要靠顶尖的但也是低成本的技术，把所有人包括执法机构武装起来。
但最难的是第三种情况，周鸿祎的原话是，“马斯克这种半疯半狂的人，还要搞脑机接口，我对这个一直是强烈反对。脑机接口应该限制它的使用，用来帮助一些残障人士，比如让看不见的人可以看见。可是你给所有人都脑机接上，结果是你所有的想法，所有的公司都一览无余。在脑机接上之前，数字孪生复制的还只是你一切的行为，而接上之后，数字孪生覆盖的是一切的起心动念。你想，出现这种情况，会是一个什么样的世界呢？”
我的理解是，法律面对这种情况可能无效，因为是你自己选择接入，自己选择完全暴露，然后被洗脑和操控，这时你自己已经完全不知道了，或者很享受。而法律只会在你想要保护自己的时候才会起作用。法律是个工具，需要一个把它拿起来做出抗争的主体，也就是人，而这个人已经被技术绑架了。对了，用脑机接口控制你比用网络游戏或者信息茧房容易1百倍。
当然对于这种情况，安全公司们也可以在大脑里展开攻防，比如告诉你，你的脑机接口获取了一个重要想法，正试图改变你的这个想法，你是否知情？你是否愿意？是否现在切断脑机联接？只是这种事太危险了。在电脑里的攻防可以激烈残酷到把电脑搞瘫，在大脑里的攻防会不会把人搞瘫？
技术会改变人本身，技术会把战场从工具延伸到人体本身，这就是最令人悲观的地方。更令人悲观的是，极少人意识到了这个迫在眉睫的将来。
关于法律人所乐观的法律，我想多说两句。
2010年美国最高法院大法官做了一个判决，5票对4票，从此以后美国人或者企业对政治的献金可以无限，而且可以不暴露自己的身份以及金额。理由是这是一种“言论自由”。这被称为“近年来关于第一修正案最为重要的案件”。因为有钱人可以肆无忌惮的用钱收买政客并且帮他们收买选票，而政客们的天平会逐渐的更多的倒向金主而不是平民。据说科赫集团一家的政治献金就超过了共和民主两党的所有运营资金。
斯蒂格利茨开始把美国称为“一美元一票”，桑德斯把这个判决看成是这架国家机器不可避免的堕落的开端，潘多拉魔盒被打开了。
这个事证明了，法律也是人制定的，而人是会出错的。如果人被绑架了还很开心得意，法律能如何？
广义看，三权分立也是一种跟法律类似的制度安排。上面说的是司法，大法官们是代表。下面说行政，代表是总统。克林顿在他8年任期的最后一年，签发了放松金融管制的行政命令，这直接导致了8年后的次贷危机以及经济危机。但这些事已经跟荣休的克林顿总统无关了。跟那几位大法官一样，总统也是会犯错的，而且不会被追究责任。推而远之，代表立法权力的国会和议员们自然也会犯错。
到这里，我们对狭义的法律以及广义的制度安排，还会相当乐观吗？
谜底揭晓，美国第二任总统亚当斯200年前就说：“我们的政府和宪法只是为有道德、有信仰的人服务和制定的。它完全不适合治理其他类型的人。”
所以周鸿祎和罗翔的交流里有一句共识，“法律不一定是万能的”，但我更倾向于说，“法律一定不是万能的”。
那到了最后，靠什么呢？
罗翔说，“如果要实现天下无诈，靠法律，甚至靠技术，也都不是能够完全实现的。它还是一个内心的笃定，内心的确信。这些东西是一个综合的过程。”
说白了，这个东西就是所谓的道德吗？
周鸿祎说，黑客分好人和坏人，坏人挖到漏洞就去卖，或者直接用来打砸抢，能挣很多钱，可还是有好人，也就是白帽黑客，跟他们作战。只要好人通过作战能挣到体面的钱，就吸引了很多人加入，甚至把坏人变成好人。因为如果能站着把钱挣了，又不用犯罪，人内心的善会被激发出来。
也就是说法律、技术、道德，三者的结合，可能会让安全成为可能，安全是周鸿祎和罗翔共认的底线。尤其，如果没有技术的武装，光有法律和道德就会很脆弱。而这三者背后都是理性这个东西在支撑。
周鸿祎对马斯克的形容是“半疯半狂”，据说他的脑机接口很快就要正式在人身上实验了，潘多拉魔盒就要正式打开了。对此感到悲观而瑟瑟发抖的人是极少数，而绝大多数人反而会把他当成英雄。
盖茨的评价要更深一步。他说“马斯克的策略定位就是保持高强度的过激言论（Elon‘s positioning is to maintain a high level of outrageous comments）。”举两个例子。马斯克不仅仅是疫情期间“要自由”、不要隔离的坚定份子，甚至跟美国地方政府叫板要违抗禁令而开工，不久前还说出了“我们想政变谁就政变谁”这样的霸道，以及“金字塔是外星人造的”这样的神秘意志。
如果说“疯狂”还可能是一个人的本性，是一种随性，那么盖茨就直接否定了这种可能，他暗示第一，马斯克的“随性”不是真的随性，而是一种策略。第二，这种策略会发出过激言论，挑动分裂和狂躁的情绪。
这样会导致什么呢？过激、分裂、狂躁、以及神秘主义的氛围会天然的摧毁人的理性和道德感，这两样东西也就是一直把马斯克叫做“自大狂”的巴菲特和芒格所孜孜以求的，“健全的常识和基本的道德”。只有摧毁了这两样，才能让脑机接口这样的潘多拉魔盒受到最少的阻力，甚至变成一种不假思索的时髦。而马斯克本人几乎有了“道德豁免权”，当众抽大麻、在外面鬼混、连公司退市这种话也敢随便说，却不受指责。这很可怕。
我们刚才说了，法律、技术、道德，三者的结合，才是安全的保障。而道德是最基础的，因为技术会改变人，而道德和理性是抵抗这种改变的内在力量。
当然我不是说这些好人黑客和安全公司就是天然的道德模范，如果这么说，也是一种绑架。我更认为这是一种人性里的反抗意志。当有人在对人和人性做出伤害时，人类的一部分天然会产生反抗和斗争的意志，于是站到了道德和守护的一边，站到了理性的一边。
这是人类作为一个整体的自发的免疫，以及平衡。就像一根磁铁，无论被斩成多少小截，每一截都有自己的南北。
我期望免疫的风暴来得更猛烈一点。觉醒来得更早一点。未被理解的悲观，可以被更多的理解。
免责声明：自媒体综合提供的内容均源自自媒体，版权归原作者所有，转载请联系原作者并获许可。文章观点仅代表作者本人，不代表新浪立场。若内容涉及投资建议，仅供参考勿作为投资依据。投资有风险，入市需谨慎。
(image_address=""//n.sinaimg.cn/finance/cece9e13/20200514/343233024.png"")
海量资讯、精准解读，尽在新浪财经APP
责任编辑：陈志杰",2020-08-16 15:28:58,新浪财经
5,15次出手赚6亿：秦安股份炒期货比主业还赚钱 幕后或为“涌金系”,"原标题：15次出手大赚6亿！董事长炒期货从不亏钱，“涌金系”或为幕后玩家
(image_address=""//n.sinaimg.cn/finance/crawl/37/w550h287/20200816/7710-ixvrvsn9955641.jpg"")
秦安股份（603758.SH）怎么也没想到，炒期货比做主业还要赚钱。
3个月前的5月29日，秦安股份发布一份关于期货交易实施进展的公告。公告中称，自4月15日至5月28日间，公司期货合约累计平仓收益总额为1333.74万元，占公司2019年度经审计净利润（约1.18亿元）的11.31%。
同时公司决定使用不超过5亿元人民币的自有资金，选择适当的时机进行期货投资。
短短不到一个月的时间内，秦安股份就依靠炒期货赚取了足额的利润。在汽车市场不太景气的情况下，这家主要从事汽车零配件生产的上市公司，终于走向了另外一条道路——“金融致富”。
秦安股份为何走上期货交易的道路？幕后是否有高人指点？关于这些疑问，时代周报记者曾致电秦安股份，但截至发稿，公司尚未回应。
期货之王，从不亏损
秦安股份是一家生产汽车零配件的企业，和期货扯上关系不过是因为生产中所需要用到的一种原材料——铝。
无论是气缸体还是曲轴等产品的生产，都需要用到不同的原材料，包括铝锭、碳钢等。秦安股份的主营业务是汽车零部件的生产，而零部件的主要原料就是铝，所以公司对铝这种商品的行情有一定的信息优势。
时代周报记者查阅秦安股份公告发现，以2019年为例，原材料铝的采购额占据秦安股份产品制造成本的21.34%，而该公司也预期2020年铝采购量将继续增加，因此在期货市场上进行套期保值业务，基本上可以视为该公司的基本操作。
(image_address=""//n.sinaimg.cn/finance/crawl/125/w550h375/20200816/8344-ixvrvsn9955680.png"")秦安股份公告
只不过，秦安股份的营业收入从2017年开始便逐年下降，净利润虽然看似从2018年的亏损局面转变到2019年的盈利，但实际上扣非净利润依然是实打实的负值，而且数值也在不断扩大，亏损依然严重。
据公司2020年一季度财报显示，营业收入仅为9165万元，净利润却是-1880万元。如果死抓着主营业务努力干，秦安股份估计几年内就会达成“戴帽（ST）”的成就。
所以，找一条另外的“致富道路”，非常重要。
从秦安股份公告正式介入期货投资到8月14日，秦安股份已经发布了15次期货平仓的投资收益公告。
(image_address=""//n.sinaimg.cn/finance/crawl/271/w491h580/20200816/7271-ixvrvsn9955716.png"")秦安股份期货投资详情
在这15份公告中，没有任何一次的投资是亏损的，胜率达到令人叹服的100%。
期货投资不断赚钱的公告，也刺激了无数投资者。秦安股份股价从5月29日的6.20元/股到8月11日的最高价9.11元/股，市值从27亿元一路飙升到36.60亿元。
有意思的是，已经赚了约6亿元的秦安股份，其董事长YUANMING TANG（曾用名：唐远明，2006年取得加拿大国籍），此前没有任何公开的期货交易记录。据悉，唐远明历任国营204厂总装车间副主任，北碚缙云摩托车配件厂副总经理，重庆泰安发动机研究所所长，泰安机电总经理。
有业内人士表示，能够一次拿出数亿元投入期货市场的，都不是简单人物，至少是勇气可嘉。而秦安股份能够在十多次期货交易中保持100%的胜率，背后若没有高人指点，董事长唐远明又是如何做到的呢？
这，可能与A股市场历史悠久的“涌金系”有关。
传奇资本“涌金系”浮出水面
“涌金系”，曾经是A股市场上叱咤风云的资金派系，其创始人——魏东更是传奇人物。
如果回看魏东的简历，绝对可以称得上是“年轻有为”。
(image_address=""//n.sinaimg.cn/finance/crawl/227/w474h553/20200816/f3c6-ixvrvsn9955782.jpg"")魏东
1986年，魏东考入中央财经金融学院；1990年大学毕业后，进入当时极具盛名的“中经开”后，继续攻读研究生。据悉，魏东在中经开执掌证券部，直到1994年在北京自立门户，创立北京涌金财经顾问公司。
而真正让魏东成名的是，1995年的“3·27国债期货”一战。
坊间传言，魏东在“3·27国债期货”一战中代表“中经开”，和“万国证券”、“辽国发”交手。也有传言称，当时魏东已经离开“中经开”，但依然保持着不错的关系。
据了解，在这场期货战中，作为多方的魏东成为赢家并从中赚走约2亿元。此后，从期货市场中赚到第一桶金的魏东，相继创立了“上海涌金实业有限公司”和“湖南涌金投资（控股）有限公司”。
至此，魏东手中的“涌金系”正式成型。
有业内人士称，早期的“涌金系”主要从事转配股、法人股受让等股权交易，同时“涌金系”根据政策热点转战投资市场，积累财富之余也为魏东积累下大量的人脉。
人脉，成为了魏东打造“涌金系”金融帝国的关键。
(image_address=""//n.sinaimg.cn/finance/crawl/116/w550h366/20200816/1091-ixvrvsn9955845.jpg"")
据市场消息称，魏东打造的“涌金系”金融帝国离不开其家族的帮助。魏东父亲——魏振雄，曾经是中央财经大学第一任会计系会计学教授，同时还是当时财政部高级会计师评委会委员。魏东当年进入“中经开”，也被外界视为依靠父亲关系的证明。
尽管魏东本人对这些“关系”言论表现反感，但其父亲、兄弟、妻子在“涌金系”的发展过程中的确有所影响。
有投资人士称，魏东与其兄魏锋相互配合，一个主攻投资，在前方攻坚；一个擅长战略，打造家族产业。而魏东的妻子——陈金霞，更是著名经济学家吴晓求的门生，其人脉资源之广无法想象。
可惜的是，魏东在2008年跳楼自杀，只留下一个庞大的“涌金系”金融帝国。
由于魏东在公开场合从不接受媒体采访，也不透露任何关于其家人的信息。如果要挖掘“涌金系”的资金来源和资本操作方式，可能只有魏东本人最为清楚。只不过，魏东已经带着这些秘密与世长辞，真相被永远掩盖。
魏东去世后，妻子陈金霞接棒“涌金系”。但相比起魏东执掌时候的意气风发，“涌金系”已不复当年荣光，越来越低调。陈金霞让“涌金系”从水上潜入水底，从此“涌金系”慢慢离开了大众视野。
(image_address=""//n.sinaimg.cn/finance/crawl/707/w550h157/20200816/5003-ixvrvsn9955871.jpg"")
直到秦安股份以100%的胜率征战期货市场。
“涌金系”或为幕后高手？
据秦安股份8月11日公告显示，祥禾泓安、祥禾涌安、上海泓成拟合计减持公司股份不超过 2632.7822 股，占公司股份总数的 6%，而这三位股东均属于“涌金系”公司，共合计持有秦安股份2886.87万股股份，占公司股份总数的6.57%。
(image_address=""//n.sinaimg.cn/finance/crawl/90/w550h340/20200816/d205-ixvrvsn9955909.png"")图源：通联数据
据了解，“涌金系”手中持有的股份均为IPO前所获得，因此减持获利离场属于正常行为。
这个时候，股价的高低便是决定“涌金系”能够获得多大利益的关键。
众所周知，秦安股份借助炒期货来投资获利，从而将股价一路上抬。一位没有任何公开期货交易记录的董事长，能够在10多次期货投资交易中保持100%的胜率，这背后要说没有高人，恐怕也没人信。
恰巧，传奇资本“涌金系”起家的第一桶金便是期货。
秦安股份炒期货和“涌金系”之间，到底有没有关联？为此，时代周报记者曾致电秦安股份，但截至发稿，公司尚未回应。
规避退市，强行续命
主业不怎么样，每年总能靠投资赚点钱，从而逃避退市惩罚。这似乎已经成为了上市公司业绩不佳时的一种手段。
和秦安股份炒期货“维持生计”相似，兰州黄河（000929.SZ）靠炒股“强行续命”。
2010年，兰州黄河制定了《兰州黄河企业股份有限公司证券投资内控制度》后，开始走上了“炒股之路”。
据不完全统计，2010至2017年间，兰州黄河净利润合计约3.86亿元，其中炒股收益约2.24亿元，占比接近60%。在2010至2019年间，兰州黄河有7年借助“炒股”实现了业绩大幅增长或扭亏为盈。
只不过，兰州黄河这一招“股票救企”的方法越来越不好使了。据2020年一季度财报显示，该公司持有10家上市公司股权，其中有7只股票处于亏损状态，共计亏损3279.45万元。
有投资者并不看好上市公司“不务正业”，凭运气赚的钱，最终都会凭运气亏进去。也有投资者称，大型企业都要对冲风险，做点期货投资实属正常。
(image_address=""//n.sinaimg.cn/finance/crawl/58/w550h308/20200816/fc87-ixvrvsn9955958.jpg"")评论截图
但如果企业一直专注于“副业”，而非回归到主营业务，那最终也就只有退市这一条路。
扫二维码 3分钟在线开户 佣金低福利多
(image_address=""//n.sinaimg.cn/finance/512/w256h256/20200807/333c-ixkvvuc9099771.png"")
(image_address=""//n.sinaimg.cn/finance/cece9e13/20200514/343233024.png"")
海量资讯、精准解读，尽在新浪财经APP
责任编辑：张熠",2020-08-16 15:26:00,新浪财经
