,title,content,pub_time,src
0,青岛市政府：免去樊伟青岛啤酒总裁职务,2月28日，青岛市政府官网消息，2月26日，青岛市政府决定，免去：樊伟的青岛啤酒股份有限公司总裁、青岛啤酒集团（股份）有限公司董事职务。青岛啤酒证券部工作人员回复中国证券报记者称，樊伟为正常年龄退休,2020-02-28 15:55:04,新浪财经
1,出售百草味母公司 好想你收重组问询函,"2月24日，好想你披露《重大资产出售报告书（草案）》称，拟通过现金方式，向百事饮料出售上市公司持有的郝姆斯（百草味母公司）100%股权。2月28日，深交所中小板公司管理部向好想你下发问询函。
重组问询函中表示，2013年至2015年，好想你归属于上市公司股东的净利润分别为1.02亿元、0.54亿元、-323.31万元，持续大幅下滑。2016年公司购买郝姆斯100%股权，2016年至2018年，公司净利润分别为0.39亿元、1.07亿元、1.30亿元。本次交易完成后，好想你将聚焦原有的红枣相关业务。请结合2016年以来郝姆斯营业收入、营业利润、净利润等占比情况，以及公司红枣相关业务营业收入占、毛利率、市场需求等情况详细论证本次交易是否有利于增强公司持续经营能力。
好想你2015年年报显示，公司净利润大幅下降的主要原因包括拓展商超渠道及促销费等渠道费用大幅增加。《草案》显示，好想你在郝姆斯的协助下，积极拓展电商渠道，目前已提升了独立电商运作能力。交易所要求其结合最近三年公司线上线下营业收入占比、销售费用占比等，分析论证本次交易完成后是否将导致公司销售费用大幅增长。
责任编辑：王帅",2020-02-28 15:44:39,新浪财经
2,李凡荣任中石油集团总经理 疫情下石油央企考验待解,"原标题：李凡荣履新中石油集团总经理，疫情下石油央企多重考验待解
换帅40余天后，中国石油天然气集团有限公司（下称中石油集团）空缺已久的总经理人选正式到位。据官网消息，2月28日上午，中国石油天然气集团有限公司召开领导班子（扩大）会议。受中央组织部领导委托，中央组织部有关干部局负责同志宣布了中央关于中国石油天然气集团有限公司总经理任职的决定：李凡荣同志任中国石油天然气集团有限公司董事、总经理、党组副书记，免去其国家能源局副局长、党组成员职务。上述职务任免按有关法律和章程的规定办理。
现年56岁，从国家能源局回到石油央企、出任中石油集团总经理的李凡荣是一位“老石油人”。他毕业于江汉石油学院开发系采油工程专业，获工学学士学位，后获英国卡地夫大学商学院工商管理硕士（优等）学位，教授级高级工程师。1984年起进入中海油总公司工作30余年。除中海油总公司副总经理、党组成员外，李凡荣曾兼任中国海洋石油有限公司（00883.hk）首席执行官、尼克森公司董事长、中国海洋石油国际有限公司董事长。
2016年5月，随着国家能源局彼时分管油气工作的副局长张玉清到龄退休，李凡荣履新国家能源局副局长、党组成员，负责分管能源局煤炭司、石油天然气司、国际合作司、电力业务资质管理中心。
近年来，三大石油央企的人事变动频繁。具体到中石油，2016年7月出任中石油集团总经理、董事、党组副书记的章建华，在2018年11月升任国家能源局局长，成为国家能源局有史以来首位来自能源央企的掌舵者，他还同时担任国家发改委党组成员。2018年12月底，中央企业里最年轻的总裁之一、在中化集团工作20余年的张伟空降中石油集团，填补总经理一职的空缺。但由于2019年开始国家油气管网集团的组建全面提速，张伟在2019年下半年出任国家管网集团筹备组组长。去年12月，国家管网集团正式成立，张伟担任该集团党组书记、董事长，并卸任中石油职务。
此外，2020年1月17日，中石化集团原董事长戴厚良被任命为中石油集团董事长。
2020年以来双双履新的中石油集团一二把手，在油气体制改革、保障能源安全等多重挑战叠加的背景下并不轻松。上游，有加大勘探开发力度确保油气产量的压力；中游，剥离三桶油剥离管道资产和调度的国家油气管网集团已经成立，中石油所拥有的管道数量最大；下游，为应对管网剥离，中石油正加码天然气下游销售。
1月中旬举行的中石油2020年工作会提出，“全力推动国内油气产量当量迈上2亿吨历史新水平。在全力保障国家能源安全背景之下，国内油气企业集中力量打好探勘开发进攻战。2020年保持50亿元风险勘探投入，要实现国内油气产量当量突破2亿吨，其中天然气所占比重力争达到50%，真正实现“油气并举”，今年塔里木油田、西南油气田将双双建成300亿方大气区，公司页岩气产量超过110亿立方米。”同时，要主动适应“管网分离”、“俄气东进”的市场新格局，“加大天然气终端开发和销售力度”。
意料发生的新冠肺炎疫情，正令国内油气市场受到显著冲击。
据中国石油集团经济技术研究院石油市场研究所预测，参考2003年“非典”期间成品油市场特点，估计本次疫情将导致2020年国内成品油需求整体上仍呈现“V”形走势，疫情对成品油市场的影响主要集中在一季度，尤其是2月份，将为供需最低点。从需求侧看，预计一季度国内成品油需求同比下降35.7%。从供需平衡看，预计2020年一季度供大于求2708万吨，二季度供需形势将有明显好转。
天然气方面，中石油经研院天然气市场研究所认为，一季度原本是国内供气高峰，国内供气企业筹备大量资源保障供应。但受疫情引起的需求大幅下降影响，市场出现供应过剩。预计二季度疫情结束后，企业复工生产，供需形势将会好转。如果疫情延续到二季度，则供应过剩问题更为突出。
2月18日举行的国新办发布会上，国务院国资委副主任任洪斌表示，国资委对于年初制定的生产经营目标和改革任务不会改变。“咬定目标不放松，确保任务不变、压力不减，全力以赴完成全年各项目标任务，为全国经济平稳运行提供有力的支撑。当然，挑战是非常大的，不改变目标而要实现目标，需要我们付出更加艰苦的努力。”为此，须“牢固树立’过紧日子’的思想，加大降本节支、提质增效的工作力度，以最大的努力冲抵由于疫情所造成的损失。”
为了降低企业用气成本、支持企业复工复产，国家发改委日前发出通知，自2月1日至6月30日，要求阶段性降低非居民用气成本。通知决定，在现行天然气价格机制框架内，提前实行淡季价格政策，尽可能降低企业用气成本。执行政府指导价的非居民用气，以基准门站价格为基础适当下浮，尽可能降低价格水平。
根据央视报道的阶段性降低企业用电用气费用政策“预计可降低企业用电、用气成本630亿元以上”，扣除两大电网公司已宣布的减免电费595亿元，天然气产业链须承担的成本超过35亿元。这意味着中石油等上游供气企业的降价割肉在所难免。
责任编辑：王帅",2020-02-28 15:34:31,新浪财经
3,斯莱克公告减持计划后吹风特斯拉 遭问是否配合减持,"原标题：斯莱克公告减持计划后吹风特斯拉 遭问是否配合减持
深交所网站昨日下发对苏州斯莱克精密设备股份有限公司（以下简称“斯莱克”）的关注函，公司26日表示目前正在调试用于特斯拉圆柱电池21700的电池壳自动生产线，该生产线调试成功后，公司将正式向特斯拉以及其他国内外的主流圆柱电池制造商提供大批量自动化生产线。公司股价于2月26日、27日连续两个交易日涨停。1月17日，公司控股股东科莱思有限公司披露减持计划，拟在公告披露之日起十五个交易日后的六个月内，以大宗交易、集中竞价方式减持公司股份不超过3347.50万股。
对此，深交所创业板公司管理部要求斯莱克说明公司是否存在迎合市场热点，炒作公司股价配合控股股东减持公司股份的情形，并说明公司控股股东、持股5%以上股东、董事、监事、高级管理人员最近一个月买卖公司股票的情况、未来3个月内是否存在减持计划。
深交所创业板公司管理部还要求斯莱克补充说明公司电池壳自动生产线的具体研发情况，包括研发启动时间、研发计划、研发投入、人员储备及形成技术和产品情况等，该业务与公司主营业务的相关性以及公司具有的竞争优势。
以下为全文：
关于对苏州斯莱克精密设备股份有限公司的关注函
创业板关注函〔2020〕第 135 号
苏州斯莱克精密设备股份有限公司董事会：
2020 年 2 月 26 日，你公司在本所投资者关系互动平台表示，目前公司正在调试用于特斯拉圆柱电池 21700 的电池壳自动生产线，该生产线调试成功后，公司将正式向特斯拉以及其他国内外的主流圆柱电池制造商提供大批量自动化生产线。2 月 26 日、2 月 27 日，公司股价连续两个交易日涨停。1 月 17 日，公司控股股东科莱思有限公司披露减持计划，拟在公告披露之日起十五个交易日后的六个月内，以大宗交易、集中竞价方式减持公司股份不超过 33，475，040 股。我部对此表示关注，请公司核实说明以下事项：
1． 请补充说明公司电池壳自动生产线的具体研发情况，包括研发启动时间、研发计划、研发投入、人员储备及形成技术和产品情况等，该业务与公司主营业务的相关性以及公司具有的竞争优势。
2． 请说明公司与特斯拉是否已达成正式合作，如是，请说明相关协议签署时间、签署地点、主要内容等；如否，说明达成正式合作尚需满足的条件，并充分提示相关风险。
3． 请结合电池壳自动生产线领域的市场环境、竞争格局和在手订单等情况，说明电池壳自动生产线业务对公司经营业绩的影响及其可持续性，并充分提示相关业务风险。
4． 请说明公司是否存在迎合市场热点，炒作公司股价配合控股股东减持公司股份的情形，并说明公司控股股东、持股 5%以上股东、董事、监事、高级管理人员最近一个月买卖公司股票的情况、未来 3个月内是否存在减持计划。
5． 请说明公司近期接受媒体采访、机构和投资者调研、回复投资者咨询等情况，是否存在违反信息披露公平性原则的情形。
6． 请核实说明公司是否存在其他应披露未披露的信息，是否存在筹划中的重大事项或可能导致股票交易异常波动的事项。
请你公司就上述问题做出书面说明，在 3 月 2 日前将有关说明材料报送我部并对外披露，同时抄送江苏证监局上市公司监管处。
同时，提醒你公司：上市公司必须按照国家法律、法规和本所《创业板股票上市规则》，认真和及时地履行信息披露义务。上市公司的董事会全体成员必须保证信息披露内容真实、准确、完整，没有虚假记载、误导性陈述或重大遗漏，并就其保证承担个别和连带的责任。
特此函告。
创业板公司管理部
2020 年 2 月 27 日
责任编辑：陈志杰",2020-02-28 15:16:47,新浪财经
4,盛路通信预亏超6亿 集中计提6.5亿商誉减值是否合理,"原标题：盛路通信2019年预亏超6亿 集中计提6.5亿商誉减值是否合理？
来源：财联社
盛路通信（002446.SZ）于2月28日午间披露2019年业绩快报。公司预计，去年将亏损超过6亿元，同比2018年下滑627.29%。财联社记者注意到，盛路通信高达7.29亿元的资产减值计提议案同期获得通过，这亦是公司去年巨额亏损的主要原因。鉴于此番集中计提减值的比例较高，有分析指出，公司对相关资产后续盈利能力的评估仍然值得商榷。
业绩快报显示，2019年，盛路通信归母净利润预计为-6.39亿元，同比上年减少627.29%。公司将大幅亏损的原因归咎于子公司业绩的下滑。据其披露的数据，子公司合正电子2019年经营情况恶化，全年实现营业收入36，890万元，较2018年下降了17%；南京恒电2019年营业收入和净利润则分别同比下降30%、 44%-50%。
合正电子和南京恒电分别是盛路通信于2014年、2015年收购的资产，公司亦因此分别形成商誉4.36亿元和7.87亿元，合计12.24亿元。盛路通信的大幅亏损，除两家子公司业绩贡献减少之外，还与母公司对其计提相关资产减值有关系。
根据盛路通信同期披露的方案，2019年，公司决定对合正电子、南京恒电合计计提应收款项减值准备2665.54万元、存货跌价准备5210.37万元、商誉减值准备6.5亿元（其中对合正电子、南京恒电分别计提30000-35000万元、25000-30000万元）。
巨额的资产减值计提引起深交所关注。在2月20对深交所的回复中，盛路通信表示，对合正电子计提相关资产减值主要是因为主要客户众泰汽车经营状况恶化以及国内汽车市场形势严峻，导致应收账款存在无法收回的风险，以及库存短时间内无法消化。对南京恒电计提商誉减值则是因为军工电子行业竞争加剧，核心客户订单预计会减少，且未来几年业绩可能出现持续下滑。
但财联社记者则注意到，仅以最低值计算，盛路通信此次对合正电子、南京恒电计提的商誉减值金额分别达到了收购形成的商誉初值的68.81%和31.77%。尤其是对合正电子后续业绩的评估，或许仍存在争议。
一位汽车行业人士对此持相同看法。他指出，受限售、限牌等政策以及需求不振的影响，国内汽车市场近年来陷入低迷，但汽车工业对整体经济的影响不容忽视，尤其是对产业链上相关产业的冲击，将逐步成为整个行业复苏的推动因素。目前来看，个别地区正在逐步放开限售、限牌政策，并不断推出应对举措，这对行业来说无疑是利好消息。合正电子主营汽车电子产品以及系统开发，在消化了众泰汽车的不利影响后，应该仍有业绩企稳回升的空间。基于以上判断，公司高比例计提商誉减值的决定或许仍值得商榷。
责任编辑：陈志杰",2020-02-28 15:14:42,新浪财经
