,title,content,pub_time,src
4,快速过会：审核意见聚焦三大募资投向 蚂蚁集团科创板IPO来了,"快速过会！审核意见聚焦三大募资投向，蚂蚁集团科创板IPO来了
来源：上海证券报
9月18日晚间，上交所发布科创板上市委审议结果，同意蚂蚁集团科创板首发上市。蚂蚁集团科创板IPO于8月25日获受理，经过两轮问询后快速过会。
从审核结果看来，蚂蚁集团收到两个需要落实的审核意见，主要集中在关联交易以及募资具体内容方面。
蚂蚁集团脱胎于阿里巴巴，其前身可追溯至2004年上线的“支付宝”，后者从2011年开始独立运营。根据招股书，蚂蚁集团的实际控制人为马云。
今年6月，公司正式由此前的“蚂蚁金服”更名为“蚂蚁集团”，明确了“全面服务社会和经济数字化升级需求”的定位。
蚂蚁集团营收由数字支付与商家服务、数字金融科技平台、创新业务及其他三大门类构成。报告期内，数字金融科技平台收入占比逐年提升，从2017年的44.33%提升至2020年上半年的63.39%。
本次上会前，公司接受了两轮问询，主要集中在监管政策变化的影响、公司股权结构、业务及市场竞争情况等方面。根据上交所最新公布的审议结果，蚂蚁集团还需落实两个审核意见，方能进入注册程序。这两个需要落实的审核意见主要集中在关联交易以及募资具体内容等方面。
具体来看，上市委要求公司补充说明与阿里巴巴集团、网商银行等重要关联方之间经常性关联交易的商业合理性及未来前景；未将杭州阿里巴巴认定为共同控股股东的依据和理由；以及是否已就与阿里巴巴集团、网商银行等重要关联方之间的经常性关联交易制定合理合法的控制制度，该等制度安排如何有效地保护中小投资者权益。
此外，公司还需要补充披露“助力数字经济升级”“加强全球合作并助力全球可持续发展”“进一步支持创新、科技的投入”等三大募集资金投资方向的具体内容，并说明三大投资方向是否界限清晰、目标明确、与发行人业务存在内在关联，是否与包括阿里巴巴集团在内的重要关联方不存在明显利益冲突。
记者注意到，在上市委会议现场问询的主要问题中，发行人主要业务与微信相似业务的差异，以及主营业务是否将受到大型竞争对手的进入或货币表现形态及收付运行机制变革的重大不利影响等问题，也被重点问及。
在蚂蚁集团科创板IPO过会的同时，有消息称公司计划下周开始寻求通过港交所上市聆讯。
值得一提的是，本次蚂蚁集团的A股发行可引入绿鞋机制，超额配售权最高不超过15%。
市场预计，蚂蚁集团将大概率成为近年来全球最大规模的IPO之一。公司此次募资拟用于支持创新和科技投入、助力数字经济升级、加强全球合作并助力全球可持续发展三大方向，其中40%将投向创新及技术研发。
(image_address=""//n.sinaimg.cn/finance/cece9e13/20200514/343233024.png"")
海量资讯、精准解读，尽在新浪财经APP
责任编辑：陈志杰",2020-09-18 20:28:00,新浪财经
5,银行坐不住了 众泰汽车百亿巨亏后被申请预重组,"来源：中新汽车
9月17日，*ST众泰发布《关于债权人向法院申请公司预重整的提示性公告》。公告显示，浙江永康农村商业银行股份有限公司（下称“浙江永康农商行”）以众泰汽车不能清偿到期债务，且明显缺乏清偿能力，但仍具有重整价值为由，向永康市人民法院提出对公司进行预重整的申请，不过浙江永康农商行的申请能否被法院受理登记，众泰汽车是否进入预重整程序尚存有不确定性。
(image_address=""//n.sinaimg.cn/finance/crawl/83/w550h333/20200918/30c6-izmihnt0466863.png"")
公告内容称，2019年8月，浙江永康农商行等4家银行作为初始贷款人，众泰汽车作为借款人，签署《人民币30亿元流动资金银团贷款合同》，签署合同后浙江永康农商行向众泰发放贷款本金1.5亿元，发放贷款后，众泰汽车支付利息至2020年3月20日，贷款于2020年8月14日到期，众泰汽车不能清偿到期的贷款本金1.5亿元及2020年3月20日之后的利息。
成立于1998年的众泰汽车，也算是老牌国产品牌了。由于高度模仿豪华品牌车型，众泰汽车销量曾一路高涨，市值最高达到了386亿元，而后因产品问题、经营问题导致业绩下滑以及经销商维权后，当前众泰汽车市值仅剩下28亿元。
(image_address=""//n.sinaimg.cn/finance/crawl/84/w550h334/20200918/3c25-izmihnt0466918.jpg"")
6月22日，众泰汽车发布财报显示，2019年实现营收29.86亿元，同比下降79.78%；净亏损111.9亿元，同比大降1498.98%。随后，众泰汽车公司股票被实行“退市风险警示”处理，股票简称由“众泰汽车”变更为“*ST众泰”。
8月29日，众泰汽车发布半年报显示，上半年实现营收7.70亿元，同比下降76.69%；净亏损10.34亿元，同比下降256.08%。
这也引发了监管关注，深交所对众泰汽车迅速下发问询函，开启“灵魂17问”。深交所要求众泰汽车结合行业情况、毛利率等变化，说明营收和净利润大幅度下滑的原因，同时还要求众泰汽车说明整车销量和销售收入是否匹配。
(image_address=""//n.sinaimg.cn/finance/crawl/62/w550h312/20200918/5bce-izmihnt0466998.jpg"")
众泰汽车技术实力薄弱，老车型又迟迟不能升级国六排放标准，新车型开发又进展缓慢，如今又被债权人申请重整。在当前汽车行业加剧洗牌的环境下，众泰汽车在市场中摇摇欲坠，就目前众泰汽车在市场上的表现来看，面临着较大危机。
免责声明：自媒体综合提供的内容均源自自媒体，版权归原作者所有，转载请联系原作者并获许可。文章观点仅代表作者本人，不代表新浪立场。若内容涉及投资建议，仅供参考勿作为投资依据。投资有风险，入市需谨慎。
(image_address=""//n.sinaimg.cn/finance/cece9e13/20200514/343233024.png"")
海量资讯、精准解读，尽在新浪财经APP
责任编辑：陈志杰",2020-09-18 20:18:35,新浪财经
6,36天即过会成功 蚂蚁火速上市将如何影响股市？,"36天即过会成功！蚂蚁火速上市将如何影响股市？
来源：财联社
财联社（北京，记者姜樊 上海 实习记者林汉垚）讯，今天，上交所宣布蚂蚁集团过会成功，蚂蚁集团从申请到反馈到上会，只有36天。联储证券首席投顾胡晓辉分析，金融科技是蚂蚁集团营收的核心，也是本次计划募集资金重点投向。
兵贵神速 蚂蚁火速过会
8月24日晚间，证监会浙江监管局网站就披露，中金公司、中信建投均已完成对蚂蚁集团的上市辅导。这距离证监会浙江监管局官网8月14日公示蚂蚁集团辅导备案文件仅10余天。
而在今日，蚂蚁集团成功过会，从申请到反馈到上会，只有36天。对此，胡晓辉称，蚂蚁集团的火速过会体现了特事特办，同时随着注册制的推进，支持科技企业的战略更加清晰，转换发展模式的愿望更加强烈，资本市场的核心构成也逐步向西方发达国家靠拢，这对市场来说是积极的信息。
前海开源基金首席经济学家杨德龙也表示，蚂蚁金服从上市辅导到上市用的时间非常短，一路绿灯，显示A股市场在过去十年错失了像BATJ、美团、拼多多为代表这些新经济企业。现在这个情况表示出A股市场欢迎这些独角兽企业在A股上市，给A股投资者提供投资新经济的机会。所以蚂蚁金服上市受到市场各方的关注。
另外，就在昨晚，两家上市公司千方科技与鱼跃医疗作为重庆蚂蚁消费金融有限公司的共同出资人双双发布公告，收到来自银保监的批复，同意蚂蚁集团在重庆市筹建重庆蚂蚁消费金融有限公司，距离8月22日重庆蚂蚁消费金融有限公司申请筹建，尚不足一个月。
蚂蚁过会刺激金融科技公司上市欲望
据了解，除了蚂蚁集团外，京东数科也于9月11日正式向科创板递交上市申请，另外，9月1日，上海证监局也公布了关于银联商务首次公开发行人民币普通股（A股）股票并在科创板上市辅导备案情况报告及辅导备案基本情况表。
对于蚂蚁上会成功是否会引起金融科技股的上市潮，杨德龙分析，蚂蚁金服的上市可能会带来金融科技类企业的上市潮或者回归潮，让投资者更加关注金融科技类公司的发展啊，它对于提高新经济企业在A股市场的市值占比也是有利的。
但是胡晓辉向财联社记者表示，蚂蚁金服上市势必会带来金融科技公司上市欲望，但是具备条件的不多，因此称不上上市潮。
此前，在蚂蚁传出上市风声后，市场就做出了反应，以君正集团为代表的蚂蚁概念股应声而起。杨德龙称，这次是上市同样可能会给相关概念股带来一波行情。
但是胡晓辉也表示，这些蚂蚁概念股与蚂蚁集团直接关联度不大。他分析到，蚂蚁上市，我们可以从几个纬度来寻找受益公司。从股权角度看，人寿、新华保险由于直接持股，蚂蚁集团上市一定带来投资收益的增加。从经营角度看，蚂蚁集团三大块业务，其中云服务营收占比最小，但是未来潜力最大，可以寻找阿里云生态的核心企业投资。
就在今日，中国人寿、新华保险双双涨停，最新股价分别为47.25元/股、67.19元/股。
高市值公司或成股市上涨发动机
据了解，蚂蚁集团估值达2000亿美元，杨德龙称，2000亿美元是现在全球最大的独角兽企业，那么它的上市一方面让投资者更加关注科技股的机会，带来金融科技类的投资热潮。另外，对于二级市场也有一定的资金分流作用，在之前市场调整的时候，其对资金的分流作用就有一定体现。
虽然蚂蚁这2000亿美元的估值可能会带了一定的资金分流作用，但是胡晓辉也表示，并不是不是市值高了就会影响股指，会形成虹吸效益，反过来，这也可能是股市上涨发动机。
胡晓辉分析，我们A股目前市值最高的是银行，银行金融的波动直接影响A股的走势，过去，我们经济是地产经济，银行是总阀门，我们经济的跳空通过银行，因此银行涨跌与宏观跳空关联度很大。未来，为了支撑实体经济，银行让利于民，必然带来业绩增速不足，可以预见如果没有新的属于未来的产业替代银行，我们A股将无牛市。
胡晓辉继续分析，从美国看，微软，谷歌，亚马逊，脸书，苹果贡献了60%涨幅，苹果一度高达二万亿美元，可见不是市值高了会影响股指，会形成虹吸效益，反倒是股市上涨发动机。中国香港也是如此，阿里，腾讯，小米，美团，京东五大科技公司涨幅远超其他，如果没有这五大公司，恒生指数将呈现非常明显下跌。相信，以蚂蚁金服为代表的优秀科技公司登录资本市场，将会带动股指向上拓展空。
(image_address=""//n.sinaimg.cn/finance/crawl/439/w439h800/20200918/42f2-izmihnt0445037.jpg"")
扫二维码 3分钟开户 稳抓大反弹行情！
(image_address=""//n.sinaimg.cn/finance/512/w256h256/20200807/333c-ixkvvuc9099771.png"")
(image_address=""//n.sinaimg.cn/finance/cece9e13/20200514/343233024.png"")
海量资讯、精准解读，尽在新浪财经APP
责任编辑：陈志杰",2020-09-18 20:08:40,新浪财经
7,大连圣亚“宫斗”就此完结？暴力冲突后五名副总同时辞职,"大连圣亚“宫斗”就此完结？暴力冲突后，五名副总同时辞职
来源：风云地产界 
持股3.78%的股东，半年内从董事升任董事长，并且更换了高层团队。为取公章，新董事长报假警、强闯公司，连证监会都“劝架失败”。
此前，大连圣亚的内斗局面已是A股“罕见”，但进入9月，“战事”却仍在升级……
撰文/ 姚悦
编辑/ 卢泳志 
继大连圣亚旅游控股股份有限公司（下称：大连圣亚）新任董事长杨子平强闯公司大门，公司内斗从“暗斗”变“明争”后，9月7日，在大连圣亚2020年第一次临时股东大会上，爆发了更严重的暴力冲突。大连圣亚副董事长、磐京基金董事长毛崴以及另一名股东受伤，被送往医院。
此后，大连圣亚于9月13日公告，董事会收到公司5位副总经理的联名书面辞职报告，均因个人原因辞去公司一切职务。
就在外界认为这或许意味着大连圣亚“宫斗”完结时，随后《财联社》消息称，杨子平发布声明，表示这份公告是擅自发出，且辞职行为是“威胁董事会”。
目前，关于副总辞职的公告已消失在大连圣亚官网。大连圣亚内斗事件或将持续……
01
顺利“清洗”原管理层
风云地产界（微信公号：fydcj888）梳理发现，大连圣亚的内斗涉及五方力量，分为两大阵营。
其中，一方为通过二级市场持股公司股份的杨子平及毛崴实际控制的磐京股权投资基金管理（上海）有限公司（下称：磐京基金）；另一方则是国有控股股东大连星海湾金融商务区投资管理股份有限公司（下称：大连星海湾）及发起人股东辽宁迈克集团股份有限公司（下称：辽宁迈克）、大连神洲游艺城（下称：大连神洲）。
回顾大连圣亚股权变更就会发现，以“野蛮人”身份出现的杨子平与磐京基金，在4月内斗爆发之前，就早已通过增持公司股票开始蓄力。
据披露，杨子平2018年4月在大连圣亚董事会换届中成为公司董事。成功任职董事后，杨子平开始不断增持公司股票，截至2020年4月28日，杨子平已持有大连圣亚3.78%股份。
原本为大连圣亚第十大股东的磐京基金，也于2019年5月开始增持动作，并于7月4日首度对大连圣亚举牌。在持股比例增至15%时，磐京基金成功上位为大连圣亚的第二大股东，并且逼近控股股东大连星海湾24.03%的持股比例。
当时，磐京基金的增持操作还被交易所问询，是否有意通过股份增持获得上市公司的实际控制权，磐京基金则否认了质疑。如今来看，内斗局面早已埋下隐患。
4月27日，当时作为大连圣亚董事的杨子平率先采取行动，突然提出增加股东大会临时提案的申请。
杨子平提出的4项提案中有2项关于罢免，被罢免人分别是董事长王双宏与副董事长刘德义，罢免原因是“未能清晰规划公司战略发展路径，未能良好管理公司，不适合继续任职。”此外，杨子平还提名了4位董事候选人。
6月29日股东大会召开，大连圣亚原董事长王双宏、原副董事长刘德义罢免案被通过，杨子平新提名的4位董事中也有三位获通过。
此时，董事会的9位董事中，除杨子平外有4位都是杨子平提名上任的。当天，杨子平立刻主持召开董事会会议，成为新任董事长。
杨子平上任董事长职位的第二天，杨子平和磐京基金的阵营继续对原管理层进行“清洗”。通过召开董事会会议，先后解聘肖峰的总经理职务，以及丁霞董秘职务。
需要指出的是，大连圣亚的原董事长王双宏是发起人股东辽宁迈克所推荐，副董事长刘德义则是另一位发起人股东大连神洲所推荐。但作为发起人股东，截至到6月30日，辽宁迈克持股比例仅为3.16%，2020年上半年还出现了连续减持行为，大连神洲持股比例也仅为2.67%，均低于杨子平个人所持股份。这也就解释了当时持股仅为3.78%的杨子平，为何能顺利罢免原董事长和副董。
02
控股股东被挤出董事会 
大连圣亚的控股股东是国资企业大连星海湾，目前持有大连圣亚24.03%的股份。不过虽身为实际控制人，大连星海湾却并未过多参与大连圣亚的实际管理，其仅在董事会中提名了2位董事，其中1位还是独立董事，因此并不具有强势话语权。
面对内斗局面，大连星海湾并没有袖手旁观，还通过推迟股东大会，试图与杨子平沟通等方式控制局面，但最终不仅无济于事，还落得自身难保。
在与杨子平一方“撕破脸”后，7月21日，大连星海湾发出罢免2位杨子平阵营董事的提案，并继续新提名2位董事候选人。作为回应，杨子平同样提出了要罢免大连星海湾一方仅剩的2名董事席位。
9月7日，就在发生暴力冲突的那场临时股东大会上，杨子平的罢免议案被通过，大连星海湾的罢免议案则被否决。同时，星海湾投资提出的两名董事候选人也均未通过。这也意味着，磐京基金及杨子平一方取得了压倒性胜利，控股股东大连星海湾在这次董事会席位争夺战中也被迫出局。
(image_address=""//n.sinaimg.cn/finance/crawl/779/w550h229/20200918/1448-izmihnt0433937.jpg"")
图片来源：企业半年报
关于内斗事件的最新消息，9月13日，大连圣亚发布公告称，董事会收到公司5位副总经理孙彤、刘明、薛景然、张宝华、丁霞的联名书面辞职报告，5位副总经理均因个人原因辞去公司一切职务。随后，据《财联社》消息称，杨子平对此发布声明，表示这份公告是擅自发出，且辞职行为是“威胁董事会”。
截至发稿前，关于五位副总辞职的事情还没有最新进展。
03
“内忧外患”，业绩承受重压
资料显示，大连圣亚是大连地区旅游文化企业，旗下拥有多个海洋主题公园。公司成立于1993年12月；1995年6月，建成中国第一座海底通道式水族馆；2002年7月成为中国唯一旅游上市企业。公司旗下的大连圣亚海洋世界还是大连5大4A景区之一。
(image_address=""//n.sinaimg.cn/finance/crawl/25/w550h275/20200918/a3d9-izmihnt0433972.jpg"")
图片来源：企业官网
如今，在内忧外患下，大连圣亚面临着严峻考验。
大连圣亚2020年半年报显示：上半年营收同比下降82.52%，约为2285.88万元，归属于上市公司股东的净利润同比下降800.61%，由盈转亏，约为-5320.07万元。今年上半年经营活动产生的现金流量净额为-2703.6万元，而去年同期为4590万元。
(image_address=""//n.sinaimg.cn/finance/crawl/56/w550h306/20200918/bf09-izmihnt0434018.jpg"")
图片来源：企业半年报
半年报解释称，业绩主要受到新冠肺炎疫情影响，旗下景区按当地政府要求暂停营业，未取得相关收入。
大连圣亚预测第三季度仍将延续亏损或同比发生大幅变动，原因在于其经营业绩受季节影响明显，全年中第三季度处于夏季和暑期，是全年经营的旺季，主营业务收入占全年主营50%以上，但本年度7、8月主要时间段基本处于暂停营业状态。
业务方面，上半年大连圣亚还发布公告披露了镇江大白鲸魔幻海洋世界、大白鲸千岛湖文化主题乐园水下世界项目等四大在建工程的相关进展。
公告显示，这四个在建项目，由于资金筹措时间较长、审批流程、配套工程施工延迟等原因均出现了无法按计划推进、进展放缓等现象，有项目甚至已经计划将二期整体转让，公司尽量不再继续投入了。
据《华夏时报》引用大连圣亚内部人士消息，目前，公司有的项目停止，有的项目计划转让。
半年报中也提及内斗事件称，除新冠肺炎疫情影响及行业的竞争和洗牌加速等风险外，“公司目前面临的主要风险为被解聘总经理等人干扰新任董事会、总经理（代理）及董事会秘书（代理）等人履职对公司经营发展的风险。”
据《财经网》消息称，原董事梁爽指出：中小股东提名的董事占据 2/3 董事会席位，却未有一人具备旅游行业的经营管理经验，也未提出过具体对公司发展有利的创新发展战略，且自董事会改组后召开了多次董事会会议，但却没有提出或审议过任何一项关于创新经营和发展的议案，半年报中提及的创新管理经营理念等不符合实际情况，有误导投资者的嫌疑。
此外，上述信源还报道，原总经理肖峰也同样认为新上任的董事缺乏旅游行业管理经验，也未提出过具体对公司有力发展的措施。
2012年，时任总经理肖峰提出“大白鲸计划”，有意打造“中国蓝色迪士尼”。如今，大连圣亚却因“内忧外患”整体滑向危机“深渊”。
免责声明：自媒体综合提供的内容均源自自媒体，版权归原作者所有，转载请联系原作者并获许可。文章观点仅代表作者本人，不代表新浪立场。若内容涉及投资建议，仅供参考勿作为投资依据。投资有风险，入市需谨慎。
(image_address=""//n.sinaimg.cn/finance/cece9e13/20200514/343233024.png"")
海量资讯、精准解读，尽在新浪财经APP
责任编辑：陈志杰",2020-09-18 20:06:02,新浪财经
8,爱施德：阿里巴巴承诺3年内不转让持有的公司股份,"9月18日消息，爱施德公告，公司近日收到阿里巴巴出具的《关于自愿延长股份锁定期的承诺函》，为加强和深化阿里巴巴与公司的战略合作关系，为公司的未来发展提供长期支持，谋求双方长期共同战略利益，阿里巴巴自愿作出如下不可撤销的承诺：阿里巴巴通过本次发行认购的公司股份自本次发行结束之日起 36 个月内不予转让，阿里巴巴将积极配合公司办理股份锁定相关手续。
(image_address=""//n.sinaimg.cn/finance/cece9e13/20200514/343233024.png"")
海量资讯、精准解读，尽在新浪财经APP
责任编辑：陈志杰",2020-09-18 20:04:53,新浪财经
