,title,content,pub_time,src
0,知名游资出手：保龄宝10天7涨停 但没抗住今天市场的大跌,"【今日直播】
川财2020中期策略会|食品饮料：集中度提升与消费行为改变为主线
广发基金姚曦：中芯之后，我国芯片市场投资价值分析
上交所郑力海、华夏余昊：如何使用ETF和衍生品进行资产配置？
国盛张启尧、华夏轩伟：为何看好科创牛？科创50指数投资价值分析
川财2020中期策略会|海外：疫情下全球资本市场的挑战与机遇
郑志勇：“黄金坑”来了如何选择好基金
长盛基金郭堃、长江证券邬博华（金麒麟分析师）：如何看待新能源行业？如何挖掘长期牛股？
华盛证券钟俊锵：波动市场中的港股防守策略
温莎资本熊琦：业绩为王——一切不能兑现业绩的上涨都是耍流氓
原标题：知名游资出手！这公司10天7涨停，但没抗住今天市场的大跌
来源：中国基金报  
安曼
好大一碗面！10天7板的大黑马都没抗住……
7月24日早盘，在一片绿油油中，元気森林概念龙头股保龄宝一度涨停，随后涨幅缩窄。截至收盘，公司股价下跌2.31%。
(image_address=""//n.sinaimg.cn/spider2020724/785/w1080h1305/20200724/5f09-iwtqvyk9636278.png"")
今年夏天，在大牌如云的瓶装饮料杀出来一瓶黑马。这瓶小小的饮料撬动了多支个股一个月来气势如虹的涨势。
它就是李佳琦直播间里被秒空的元気森林。
为什么保龄宝是龙头？
元気森林主打的概念是0糖、0脂肪、0卡路里。那它是如何做到的呢？
基金君特意买了一瓶酸梅汁口味的苏打气泡水，其配料表显示为：水、赤藓糖醇、二氧化碳、碳酸氢钠等。
(image_address=""//n.sinaimg.cn/spider2020724/120/w1080h1440/20200724/d25c-iwtqvyk9636383.png"")
在其营养成分表下方特别注明“本品碳水化合物主要来自赤藓糖醇，赤藓糖醇能量系数为0KJ/g”。
虽然大家饮用含有赤藓糖醇的饮料是否有副作用一直争论不休，但是这并不妨碍中国最大的赤藓糖醇生产商保龄宝的上涨之路。
天风证券分析师在研报中提到：2016年元气森林出世，凭借“无糖”的产品概念一路逆袭，到今年上半年销售超8亿。而元气森林爆红的秘诀之一就是使用了赤藓糖醇作为代糖甜味剂。在元気森林的带动下，众多厂商纷纷推出添加赤藓糖醇的饮料，受益于此国内赤藓糖醇行业有望迎来高速增长。2018年国内赤藓糖醇产量已达2.87万吨，同比增加59.4%。在减糖的大趋势下，假设未来赤藓糖醇代替5%的白糖市场，那么国内潜在需求空间有望达到80万吨。
而保龄宝作为深耕二十余年的功能糖行业隐形冠军是可口可乐、百事可乐、伊利、蒙牛等著名企业的战略合作伙伴，是全球重要的功能配料制造服务商。
10天7板
一个月股价已经翻倍
尽管保龄宝的股东在7月初已经抛出减持方案，但是仍然没能阻止资本在二级市场上对保龄宝的追捧。
万得数据显示，保龄宝的股票已经在最近10个交易日（7月10日至7月23日）里收获了7个涨停板。截止到7月23日的近一个月里，保龄宝的股价已经上涨103.47%，总市值也从31亿元上涨到58亿元，上涨87%。
(image_address=""//n.sinaimg.cn/spider2020724/662/w859h603/20200724/1a90-iwtqvyk9636369.png"")
知名游资现身龙虎榜
保龄宝的疯狂上涨也引来了游资们的炒作。7月以来，保龄宝已经5次登上龙虎榜，多名知名游资现身。
23日，保龄宝开盘即涨停，盘中短暂开板后再次封上涨停板，报收于15.61元，该股全天成交6587万元，振幅为4.19%。
龙虎榜数据显示，23日买入金额前五名买入总计10098.09万元，占当天总成交金额22.36%，其中不乏知名游资。
(image_address=""//n.sinaimg.cn/spider2020724/7/w1080h2127/20200724/c032-iwtqvyk9636468.png"")
买入方面，顶级游资中信证券杭州延安路证券营业部23日买入3216.58万元，该营业部近期参与过天音控股、南京公用、岭南控股等个股的炒作。另外两个知名游资国盛证券宁波桑田路证券营业部、国泰君安上海分公司均买入超1500万元，依次位于买三、买四。
卖出方面，23日卖出金额前五名卖出总计8746.89万元，占当天总成交金额19.37%。卖一为知名游资华鑫证券湖州劳动路浙北金融中心证券营业部，23日卖出2442.53万元，该营业部23日还现身森马服饰“龙虎榜”。
不知道今天，这些游资是否安在？
A股还有哪些元気森林概念股？
元気森林在二级市场上掀起了一波浪潮，不少投资者也纷纷去互动平台上询问，还有哪些元気森林小伙伴？
6月初，奥瑞金在互动平台上回复称，公司是元气森林金属包装和灌装的核心供应商。
(image_address=""//n.sinaimg.cn/spider2020724/269/w874h195/20200724/99fb-iwtqvyk9636465.png"")
奥瑞金随即也展开了一波坚定的涨势，7月以来，股价上涨超50%。
(image_address=""//n.sinaimg.cn/spider2020724/658/w850h608/20200724/986e-iwtqvyk9636549.png"")
除此之外，在2019年年度报告中，珠海中富（维权）提到，元气森林为其客户之一。
虽然珠海中富2018年和2019年两年扣非之后的净利润都亏损超3000万，但是珠海中富的股价从6月以来，仍然上涨了近50%。
元気森林还能红多久？
市场永远炒的是预期，那么元気森林还能红多久呢？
上周，36氪报道称，元気森林即将完成新一轮融资，投后估值约为20亿美元。接近交易的人士透露，目前该笔交易尚未完全结束，但基本可确认的是：红杉中国和元生资本将为新晋投资方，另有部分老股东跟投。
天眼查显示，元気森林成立于2016年，短短四年内，已经完成了四轮融资。上一轮融资在2019年10月底，公司估值达37.5亿人民币。
(image_address=""//n.sinaimg.cn/spider2020724/501/w930h371/20200724/2311-iwtqvyk9636548.png"")
按照投后20亿美元的估值计算，元気森林的估值在短短四年里翻了3.5倍。
根据官方消息，截至今年5月，在饮品销售旺季到来前，元气森林2020年就共向消费者卖出产品193726121瓶饮品，翻译过来，就是1.9亿瓶！在月度销售额方面，2020年的3、4、5月份，分别为1.2亿、1.7亿和2.6亿。
翻阅饮品巨头农夫山泉2018、2019年的茶饮销售额——30.36亿元、31.38亿元，就能计算出他的平均月销售额：约为2.5亿。
也就是说，元气森林作为饮品新秀，在销售额方面，几乎要和农夫山泉平起平坐了。
值得注意的是，元気森林投资人中，峰尚资本和黑蚁资本都是近年来依靠新消费投资崛起的新一代机构。
而传闻即将入局的元生资本则是由腾讯原副总裁、腾讯投资并购部总经理彭志坚创办，在最近一段时间高频布局新消费领域，相继投资了“茶颜悦色”和新式白酒“开山”等。
万水千山总是情，点个 “在看” 行不行！！！
]article_adlist-->
(image_address=""//n.sinaimg.cn/finance/cece9e13/20200514/343233024.png"")
海量资讯、精准解读，尽在新浪财经APP
责任编辑：张熠",2020-07-24 16:57:35,新浪财经
1,航天宏图：多名股东拟合计减持不超5.43%股权,"新浪财经讯 7月24日消息，航天宏图晚间公告，名轩投资及其一致行动人宁波天创鼎鑫、宁波龙鑫中盛拟合计减持公司股份不超过总股本的5.43%。
(image_address=""//n.sinaimg.cn/finance/cece9e13/20200514/343233024.png"")
海量资讯、精准解读，尽在新浪财经APP
责任编辑：张熠",2020-07-24 16:52:47,新浪财经
2,金达威：持股5.83%的股东厦门特工拟3个月内减持不超1%,"新浪财经讯 7月24日消息，金达威晚间公告，持股5.83%股东厦门特工拟3个月内减持不超过1%。
(image_address=""//n.sinaimg.cn/finance/cece9e13/20200514/343233024.png"")
海量资讯、精准解读，尽在新浪财经APP
责任编辑：张熠",2020-07-24 16:33:30,新浪财经
3,浙商证券：上半年净利润6.58亿元 同比增长36.61%,"新浪财经讯 7月24日消息，浙商证券发布2020年半年度报告，报告期公司实现营业收入44.9亿元，同比增长67.83%。实现归属于母公司所有者的净利润6.58亿元，同比增长36.61%。
(image_address=""//n.sinaimg.cn/finance/cece9e13/20200514/343233024.png"")
海量资讯、精准解读，尽在新浪财经APP
责任编辑：张熠",2020-07-24 16:28:02,新浪财经
4,业绩波动能否支撑2000亿高估值？蚂蚁集团反哺阿里巴巴,"原标题：业绩波动能否支撑2000亿高估值？蚂蚁集团反哺阿里巴巴，服务费支出高增长丨新金融
《投资时报》研究员 田文会
市场预估值2000亿美元的蚂蚁集团市值将占据科创板市值近半。2019年，蚂蚁集团利润爆增，但是这几年业绩波动较大。与阿里巴巴的关联交易是其重要收入来源，但是阿里巴巴从蚂蚁集团及其关联方收到的服务费近两年也在加速高增长。
(image_address=""//n.sinaimg.cn/sinakd2020724s/64/w550h314/20200724/0023-iwtqvyk9570500.jpg"")
这一次，终于不是“被”上市了。蚂蚁科技集团股份有限公司（下称蚂蚁集团）近日官宣启动在上交所科创板和香港联交所主板同步发行上市的计划。
而就在今年7月13日，在工商信息中，这家公司的名称刚刚由“浙江蚂蚁小微金融服务集团股份有限公司”变更而来，且其官网的名称尚未及变更，仍为“蚂蚁金服”。
据阿里巴巴（9988.HK，BABA.N）2020年财报（阿里巴巴财年为截至3月31日）及券商分析，蚂蚁集团在2020年财年税前利润将达到280亿元左右。而2017年和2018年（自然年）蚂蚁集团税前利润分别为约131.89亿元和约-19.01亿元。蚂蚁集团利润在2019年（2020年财年主要覆盖2019年自然年）出现暴增。阿里巴巴未披露蚂蚁集团2020年财年利润结构，作为2017年和2018年蚂蚁集团利润主力的两家小贷公司或许辉煌不再。
《投资时报》研究员发现，目前阿里巴巴仍是蚂蚁集团收入的重要来源，但阿里巴巴从蚂蚁集团及其关联方收到的服务费（剔除与利润分成相应的特许服务费和软件技术服务费）近两个财年加速高增长，蚂蚁集团反哺阿里巴巴的服务费增速高于阿里巴巴给予的增速。
从蚂蚁集团的诞生和发展看，其与阿里巴巴的关联交易将长期存在。
目前，市场预估蚂蚁集团上市估值约为2000亿美元，登陆上交所科创板后，市值大约占据科创板市值近半壁江山，必定给新生的中国科创板生态带来改变。
《投资时报》就启动上市计划、业绩情况、关联交易等问题向蚂蚁集团发送沟通函，蚂蚁集团方面称以统一对外发布的新闻稿为准，暂不方便回应具体问题。
业绩暴增，估值几何
蚂蚁集团这几年的业绩可谓坐上了“过山车”。
据阿里巴巴2020年财报，2020财年，阿里巴巴与蚂蚁集团的利润分成安排下的许可使用费和软件技术服务费为38.35亿元（截至2019年9月取得蚂蚁集团33%股份）。此前分润协议双方约定阿里巴巴获得蚂蚁集团约37.5%的税前利润，据此计算，相应期间，蚂蚁集团税前利润为约102.27亿元。2020财年，阿里巴巴与蚂蚁集团按权益法核算的投资收益为53.24亿元（从2019年9月取得蚂蚁集团33%股份至2019年末），按33%的股份比例计算，相应期间，蚂蚁集团净利润约为161.33亿元。
据此前报道，申万宏源测算蚂蚁集团在2020年财年税前利润将达到281.53亿元。
而此前阿里巴巴财报显示，2017年（自然年）和2018年蚂蚁集团税前利润分别为约131.89亿元和约-19.01亿元。
2017年和2018年，花呗原始权益人重庆市蚂蚁小微小额贷款有限公司（下称“蚂蚁小微小贷”）和借呗原始权益人重庆市蚂蚁商诚小额贷款有限公司（下称“蚂蚁商诚小贷”）是蚂蚁集团利润的主要来源，其税前利润2017年分别为40.21和71.85亿元，2018年分别为4.34亿和40.70亿元。其中蚂蚁商诚小贷是主要功臣。不过，2019年，蚂蚁商诚小贷企业ABS发行金额大幅缩水，仅为约115亿元，2017和2018年发行金额分别为约1497.59亿元和约555亿元。
如果没有其他主融资渠道来替代，蚂蚁商诚小贷恐难继续成为蚂蚁集团主要利润来源。
阿里巴巴2020年财报显示，蚂蚁集团业务主要包括国内平台业务、全球化业务和创新科技。其中，国内平台业务主要包括数字支付服务和数字金融服务，其中数字金融服务包括理财、微贷和保险。创新科技主要包括商用区块链等多种创新科技服务。
蚂蚁集团官网（官网上名字目前仍是“蚂蚁金服集团”）则显示，“蚂蚁家族”包括支付宝、余额宝、蚂蚁财富、芝麻信用、蚂蚁小贷、蚂蚁借呗、蚂蚁花呗、招财宝、网商银行、蚂蚁金融云等。
区块链业务在蚂蚁集团已被日益重视，就在今年7月23日，蚂蚁集团宣布蚂蚁区块链正式升级为“蚂蚁链”。蚂蚁集团宣布蚂蚁链已取得三个关键成绩：技术上，蚂蚁链连续四年每年全球专利申请数始终保持在第1名；应用上，已经助力解决50多个实际场景的信任问题；商业上，目前每天“上链量”超过1亿次。其中，“日上链量”为首次披露。
蚂蚁集团官网显示，蚂蚁链的应用场景包括：金融（含供应链金融等）、融资租赁、溯源、数字物流、数字营销、数字仓单、政务民生、医疗健康、公益、区块链合同等。
蚂蚁集团董事长井贤栋曾表示，2015年，蚂蚁集团投身区块链，相信区块链可以重构数字时代的信任体系，希望区块链能像移动支付一样去改变数字时代人们的生产和生活。
“未来的互联网是价值互联网，未来的社会将是高效透明协作的世界，我们正致力于推动这样的契约时代到来。”蚂蚁集团官网区块链页面上也有这样的表述。
不过，尚未见到蚂蚁集团在区块链上投入和产出的相关数据。
据悉，目前市场预期蚂蚁集团上市的估值约为2000亿美元。此前，蚂蚁集团在2018年6月完成C轮融资后的估值水平约为1500亿美元。2017年（自然年），蚂蚁集团税前利润分约为131.89亿元，2020年财年，蚂蚁集团税前利润或为281.53亿元，利润翻倍，若按利润简单估算，估值上涨三成似乎并不过分。只是，当年1500亿美元的估值也曾引发争议，而且，随着对小贷公司发行ABS的监管加强和消费金融行业整顿，蚂蚁集团2018年由巨额赢利迅速转为亏损，更映衬其上年融资时估值高高在上。
对于此次蚂蚁集团上市估值，最重要的可能还是其业绩表现是否能持续，若仍出现上蹿下跳的情况，日后恐将受诟病。
另外，对于蚂蚁集团业务性质的分类，恐也将影响其估值，2018年时，蚂蚁集团还叫“蚂蚁金服”，现在则是“科技集团”，科技类公司应可以获得更高估值，而且，此次其在内地选择的还是最新推出的上交所科创板，这将进一步推高蚂蚁集团估值。
近日登陆科创板的中芯国际（688981.SH，0981.HK）7月23日在科创板的股价收于78.78元，但H股只收于27.70港元（约合24.99元人民币），科创板的股价高达H股的3.15倍。
支付给阿里巴巴的服务费高增长
蚂蚁集团脱胎于阿里巴巴，并与后者联系紧密。
据阿里巴巴2020财报，2018财年、2019财年和2020财年，阿里巴巴支付给蚂蚁集团及其关联方的支付处理和担保交易服务费、行政和支持服务费、交易平台软件技术服务费及其他，这三项服务费总计分别为81.89亿元、95.80亿元、114.66亿元。2018年和2019年同比增速分别为16.99%、19.69%。
2018财年、2019财年和2020财年，阿里巴巴从蚂蚁集团及其关联方收到的中小企业贷款年费、行政和支持服务费、云计算服务费、交易平台软件技术服务费及其他，这四项服务费总计分别为31.40亿元、42.21亿元、61.25亿元，2018年和2019年同比增速分别为34.43%、45.11%。
虽然阿里巴巴支付给蚂蚁集团的服务费高于蚂蚁集团及其关联方支付给阿里巴巴的服务费（已剔除与利润分成相应的特许服务费和软件技术服务费），但后者的增速远高于前者，且呈加速增长态势。
据阿里巴巴2020年财报，在阿里巴巴取得股份后至蚂蚁集团合格首次公开发行前，阿里巴巴对于蚂蚁集团和其特定关联方的其它新股增发享有优先认购权，以确保阿里巴巴在蚂蚁集团的股比保持在紧接该等增发前的持股比例。就阿里巴巴的优先认购权的行使，阿里巴巴有权从蚂蚁集团收取最多不超过15亿美元（在特定情况下可调整）的付款（优先认购权付款），以支付阿里巴巴认购增发股权的对价。
上述财报称，虽然现行的利润分成付款已根据《经修订知识产权许可协议》终止，但在若干情形下，经蚂蚁集团和独立委员会共同同意，蚂蚁集团仍需继续向阿里巴巴支付某些许可使用费，该等款项可能被用作《股权和资产购买协议》项下的优先认购权付款。
蚂蚁集团依托阿里巴巴诞生和发展，未来也恐难脱离母体。离开阿里巴巴不是蚂蚁集团的目标。
蚂蚁集团官网站“集团简介”中称，“蚂蚁金服集团与阿里巴巴集团一起，共同致力于让天下没有难做的生意。”“我们追求成为一家活102年的好公司。到2036年，我们努力与阿里集团一起，服务20亿消费者……”
而且，从股权上说，马云和阿里巴巴也牢牢掌控了蚂蚁集团。因此，与阿里巴巴的关联交易，未来也仍将是蚂蚁集团业务交易的重要组成部分，以及收入的重要来源。
阿里巴巴支付给蚂蚁集团及其关联方的服务费
(image_address=""//n.sinaimg.cn/sinakd2020724s/310/w720h390/20200724/8669-iwtqvyk9570499.png"")数据来源：阿里巴巴财报
阿里巴巴从蚂蚁集团及其关联方收取的服务费
(image_address=""//n.sinaimg.cn/sinakd2020724s/372/w720h452/20200724/c67d-iwtqvyk9570577.png"") 数据来源：阿里巴巴财报
(image_address=""//n.sinaimg.cn/finance/cece9e13/20200514/343233024.png"")
海量资讯、精准解读，尽在新浪财经APP
责任编辑：张熠",2020-07-24 16:20:01,新浪财经
5,嘉元科技4股东拟减持1816万股 有人3年豪赚8倍,"炒股就看金麒麟分析师研报，权威，专业，及时，全面，助您挖掘潜力主题机会！
新浪财经讯 7月23日，在科创板开板刚满一年之际，嘉元科技就抛出了重磅减持公告，4名股东合计拟减持1816.18万股，占公司总股本的7.8663%。按照7月24日46.82 元的收盘价计算，减持金额为8.5亿元。减持起始日为2020年8月14日，截止日为2021年2月10日。
当前，鑫阳投资 (原名鑫阳资本)持有嘉元科技1618.63万股，占比7.0108%，计划通过集中竞价、大宗交易等方式减持不超过971.178万股，占比为4.2064%。
丰盛六合持股850万股，占比3.6816%；荣盛创投持股751万股，占比3.2528%；王志坚持股578.7万股，占比2.5065%；合计持股2179.7万股，占比9.4409%。三者为一致行动人，计划通过集中竞价、大宗交易的方式减持合计不超过845万股，占比为3.6599%。
嘉元科技于2015年10月22日在新三板挂牌，2019年7月5日从新三板摘牌后，于2019年7月22日成为了科创板的首批上市公司。新浪财经发现，4名股东的股份均是通过新三板取得。
根据嘉元科技2017年4月26日披露的《权益变动报告书》，2017年4月25日，梅雁吉祥（600868.SH）通过新三板以协议转让的方式，转让其持有的嘉元科技流通股3118.63万股（占比20.78%），受让方为鑫阳资本、丰盛六合、荣盛创投等5名股东，转让完成后，梅雁吉祥不再持有嘉元科技任何股份。
(image_address=""//n.sinaimg.cn/finance/transform/543/w365h178/20200724/da35-iwtqvyk9517013.png"")
2017年9月，嘉元科技在新三板进行了第三次定向发行，以5.15元/股发行了2300万股，融资11845万元。其中，荣盛创投和王志坚分别认购了400万股和220万股，认购金额为2060万元、1133万元。
(image_address=""//n.sinaimg.cn/finance/transform/749/w329h420/20200724/6a6a-iwtqvyk9518433.png"")
根据嘉元科技于2019年1月28日披露的《权益变动报告书》，2019年1月25日，王志坚通过新三板以盘后协议转让方式增持嘉元科技股票224万股。
发行前，荣盛创投、王志坚分别持有嘉元科技751万股、578.7万股，意味着除了已披露的增持外，两名股东通过新三板二级市场分别还增持了201万股、134.7万股，因未披露这部分增持的交易详情，故按照2017年7月1日至嘉元科技停牌期间7.3元的均价估算增持成本。
按照嘉元科技7月24日46.82元的收盘价计算，鑫阳资本浮盈6.74亿元，浮盈比例为809.13%；丰盛六合浮盈3.54亿元，浮盈比例为809.13%；荣盛创投浮盈3.09亿元，浮盈比例为717.75%；王志坚浮盈2.33亿元，浮盈比例为622.24%。从新三板买入到发布减持公告，前前后后也不过3.32年的时间。毫无疑问，这是一笔非常成功的投资。
(image_address=""//n.sinaimg.cn/finance/transform/686/w550h136/20200724/779e-iwtqvyk9520126.png"")
(image_address=""//n.sinaimg.cn/finance/cece9e13/20200514/343233024.png"")
海量资讯、精准解读，尽在新浪财经APP
责任编辑：公司观察",2020-07-24 16:09:34,新浪财经
