,title,content,pub_time,src
0,旅游业将迎政策大力扶持 机构称板块景气趋势明确,"炒股就看金麒麟分析师研报，权威，专业，及时，全面，助您挖掘潜力主题机会！
旅游业将迎政策大力扶持 机构称板块景气趋势明确
来源：证券日报之声
原创 证券日报网 
日前，文化和旅游部印发《在线旅游经营服务管理暂行规定》（以下简称《规定》），将于2020年10月1日起正式施行。《规定》将不合理低价游、评价权保障、旅游者信息使用等热点纳入了监管。
9月5日，在“世界旅游合作与发展大会”上，文化和旅游部部长胡和平表示，正在编制的旅游业“十四五”规划中，将以高质量发展为主线，谋划推出一批重大政策、项目、举措。
对此，业界普遍预计，旅游酒店行业在“十四五”期间会得到政策大力扶持，近期相关股票也已开始发力，市场资金正在悄悄潜伏，具有业绩支撑的龙头股值得关注。
“中秋、十一”双节长假是旅游业一年之中最重要的盈利时段，从而进一步催化旅游业复苏。根据去哪儿网数据显示，以山西、山东为例，这两地在发布景区门票减免政策后，不仅门票整体销量相较前一月分别增长了2.1倍、1.3倍，而且当地的民宿预订也分别出现了环比1.5倍、1.1倍的上涨。此外，湖北省推出门票减免政策后，周边酒店搜索量也较前一周增长四成，民宿搜索量增长近七成。
携程表示，从目前的情况看来，“十一”假期，国内各目的地将迎来今年以来最大规模的出游潮，特别是长线跨省旅游预计热度将创新高。
对此，私募排排网未来星基金经理夏风光在接受《证券日报》记者采访时表示，“在疫情冲击下，旅游行业受影响最大，危机之下也有变革的伏笔，海外游的暂停给境内游提供了超车的可能。‘中秋、十一’双节黄金周对旅游行业是报春的信号，行业竞争力好、现金储备充分的企业有望得到更大的市场份额，而短途旅游支出有望抬头。”
“在国内疫情缓解信心重塑、海外疫情蔓延消费需求或有回流双重推动下，旅游酒店板块景气回升趋势明确。”中信证券行业首席分析师姜娅在最新研报中表示。姜娅认为，今年暑期旅游旺季落下帷幕，多种数据信号显示旅游出行复苏良好，整体出行情况较为符合预期。据去哪儿网数据显示，8月份国内旅客量恢复至去年同期的85%，暑期机票预订量恢复至去年同期九成。后期，“中秋+国庆”连假有望进一步催化旅游业复苏。
“当下正值旅游旺季，跨省团队旅游的恢复以及景区游客限流上调对行业的复苏均有积极影响，随着国庆和中秋双节的临近，行业热度有望复苏。”沃隆创鑫基金经理黄界峰对《证券日报》记者表示，“随着疫情逐渐控制，国内的本地传染渠道几乎被消灭，管理层逐渐扩大了旅游业开放的规模和程度。旅游业上市公司的中报相比一季度财报数据也有了较大程度的改观，展望后期边际改善依然存在，景气有望持续回升。”
在多重利好集中释放下，本周，旅游酒店板块表现十分出色，其整体上涨5.51%，31只成份股股价实现上涨，占比逾九成。腾邦国际、凯撒旅业等2只个股期间累计涨幅均在20%以上。
正因如此，近期部分场内主流资金纷纷涌入旅游酒店板块布局，有17只旅游酒店股本周呈现大单资金净流入态势，凯撒旅业期间累计大单资金净流入居首，达到3.54亿元，锦江酒店、腾邦国际、华天酒店、中青旅、大连圣亚、峨眉山A、黄山旅游等7只个股期间均受到1000万元以上大单资金抢筹，这8只个股本周合计吸金6.49亿元。
对投资者而言，黄界峰表示，“建议从以下三条主线挖掘旅游酒店板块机会：1．逻辑清晰且壁垒较强的免税行业；2．估值处于低点且具备较大弹性的酒店行业龙头股；3．对门票收入依赖较低且具备异地复制能力的优质景区类公司。”
表：本周大单资金净流入超过1000万元的旅游酒店股
(image_address=""//n.sinaimg.cn/finance/crawl/730/w550h180/20200918/b7d1-izmihnt0556421.png"")
制表：任世碧
扫二维码 3分钟开户 稳抓大反弹行情！
(image_address=""//n.sinaimg.cn/finance/512/w256h256/20200807/333c-ixkvvuc9099771.png"")
新浪声明：新浪网登载此文出于传递更多信息之目的，并不意味着赞同其观点或证实其描述。文章内容仅供参考，不构成投资建议。投资者据此操作，风险自担。免责声明：自媒体综合提供的内容均源自自媒体，版权归原作者所有，转载请联系原作者并获许可。文章观点仅代表作者本人，不代表新浪立场。若内容涉及投资建议，仅供参考勿作为投资依据。投资有风险，入市需谨慎。
(image_address=""//n.sinaimg.cn/finance/cece9e13/20200514/343233024.png"")
海量资讯、精准解读，尽在新浪财经APP
责任编辑：陈志杰",2020-09-18 20:59:36,新浪财经
1,如此嚣张：涉黑涉毒敲诈勒索 ST中科创张伟被控11项罪名,"一线监管 | 如此嚣张！涉黑涉毒敲诈勒索 ，ST中科创张伟被控11项罪名
来源： 读数一帜 
原创 张欣培 杨楚滢
张伟掌控的“中科创系”管理的资产规模曾超300亿元，如今却因涉黑涉毒等被提起公诉，可谓“眼看他起朱楼，眼看他宴宾客，眼看他楼塌了”。
文丨记者 张欣培 实习生 杨楚滢
编辑丨杨秀红
9月17日晚，ST中科创（002290.SZ）发布公告称，从深圳市人民检察院微信公众平台“深圳检察”发布的消息获悉，深圳市人民检察院以组织、领导、参加黑社会性质组织罪、非法吸收公众存款罪、强迫交易罪、故意伤害罪、非法拘禁罪、诈骗罪、敲诈勒索罪、聚众斗殴罪、寻衅滋事罪、容留他人吸毒罪、行贿罪对公司实际控制人张伟提起公诉。
自2019年1月被带走协助调查21个月后，张伟最终被提起公诉，涉及罪名多达11项，其中包括组织黑社会、非法吸存、敲诈勒索、容留他人吸毒罪等。
张伟除了是ST中科创实际控制人外，更是“中科创系”创始人，后者更为世人所悉知。如今查明，曾经的百亿中科创帝国实质为涉黑组织，可谓“眼看他起朱楼，眼看他宴宾客，眼看他楼塌了”。
在张伟出事后，其在入主ST中科创后极力发展的保理业务也逐渐凋零，并在今年上半年归零。重新全力专注新材料的ST中科创今年上半年经营状况正在逐渐好转。
截至9月18日收盘，ST中科创报5.06元/股，跌幅0.39%，总市值为12.3亿元。
百亿帝国涉黑
9月17日晚，ST中科创发布公告称，公司实际控制人张伟因涉黑、涉毒等多项罪名被提起公诉。
张伟除了是ST中科创实际控制人外，更是“中科创系”创始人，其一手创办了百亿中科创帝国。2015年，张伟接受媒体采访时介绍，中科创金融控股集团有限公司（下称“中科创集团”）累计管理资产规模312亿元。企查查资料显示，中科创集团至今已为超过100家上市公司提供金融服务，累计管理资产逾500亿元。
起诉书指控，被告人张伟自2004年11月始陆续成立中科创科技有限公司、中科创金融控股集团有限公司、深圳市中科创资产管理有限公司、深圳市新资本投资有限公司等公司，并以自己持有或委托他人代持的方式控制上述公司，以笼络乡邻、招揽小弟、聘用员工等方式，逐步形成以其本人和王涛（另案处理）为组织者、领导者，以被告人韩作纪和王栋为骨干成员，被告人黄彬等人参加的黑社会性质组织。
以张伟、王涛为首的黑社会性质组织，为攫取非法经济利益，非法吸收公众存款、以“套路贷”等方式进行高息民间借贷，并通过暴力、威胁、“软暴力”索债，多次对借款人实施非法拘禁、敲诈勒索等一系列违法犯罪活动，“以商养黑”“以黑护商”，为非作恶，欺压残害群众，严重扰乱正常金融秩序，侵犯他人人身、财产权利，严重破坏了当地经济、社会生活秩序。
ST中科创2020年半年报显示，公司报告期内控股股东及实际控制人未发生变更，即截至2020年6月30日，深圳市中科创资产管理有限公司仍持有该公司7766.79万股，持股比例32%，仍为第一大股东。张伟通过100%持股深圳市中科创资产管理有限公司，系ST中科创的实际控制人。
(image_address=""//n.sinaimg.cn/finance/crawl/99/w550h349/20200918/862a-izmihnt0523956.png"")
张伟控股中科创集团。天眼查资料显示，该公司成立于2004年，注册资金2.11亿元，净资产10.3亿元，总部位于深圳，集团专注于为超高净值人群及企业提供定制化服务及一揽子综合金融解决方案，主营业务包括私人银行管理中心、家族办公室、互联网金融、财富管理等。张伟持有94%股份，认缴出资额超1.9亿元。
2015年，张伟在接受相关媒体采访时表示，经过十年行业经验的积淀，中科创集团旗下已拥有互联网金融、互联网地产、财富管理、并购投资、财富艺术馆、财富俱乐部六大板块。
巅峰与倾覆
一篇关于中科创集团的宣传报道曾介绍称，2004年，中科创集团最初进入的是担保行业；2008年，中科创集团果断转型，开始运营财富管理业务，并推出全新商业模式“财富通”，布局金融创新领域，到了2010年已经累计了30多亿元净资产。
在张伟的财富版图上，88财富网是一步关键的棋子。
2013年10月，中科创集团进军互联网金融，上线网贷平台“88财富网”，运营主体为深圳市中科创财富通网络金融有限公司。
2014年，88财富网作为唯一互联网金融平台企业受邀参加博鳌亚洲论坛，并以银牌合作伙伴身份独家举办“定制夜话”论坛。此外，88财富网还受邀参加2014年APEC工商领导人峰会。
在2015年数字世界博览会上，88财富网执行总裁陈小龙称，88财富网是中科创集团倾力打造的创新互联网金融平台，独创“P2B+O2O”线上线下整合服务模式，首创“固定+浮动”、“纯浮动”投资收益模式，平台上线运营至今累计成交额已超过30亿元。
2015年前后，在88财富网最为辉煌的时刻，它还曾签约钢琴家郎朗为其代言。
彼时，张伟还花费5亿元购买的第一架空客A319公务飞机到位。据悉，张伟曾计划10年内买下5架空客飞机，以进一步服务高净值人群。张伟因而又被称为“买飞机的老板”。
飞黄腾达后，张伟开始营造热爱公益的成功企业家人设。2015年，在“中国深商总会十周年”大会上，张伟宣布捐资10亿元人民币发起成立中科创基金会，专项运作具有全球视野的创造力人才奖励计划，打造中国版的“诺贝尔基金会”。张伟亦于“2017中华企业社会责任高峰论坛”上，获颁“2017公益先锋人物奖”。
然而，光鲜背后乌云密布，一触即发。2017年2月，88财富网爆雷。公司突然宣布停运，并相继关闭新用户注册和投资功能。根据当时网贷行业媒体的报道，88财富网“2017、2018年待兑付本息列表”显示，截至2018年12月，88财富未兑付本息共计约7.53亿元。
2019年4月11日，深圳警方发布公告称，近日，打掉了以深圳中科创金融控股集团有限公司张伟为首的涉黑犯罪集团。经检察机关批准，张伟、韩作纪、王栋等44名犯罪嫌疑人被逮捕。通告中，88财富网被点名。
经查明，该涉黑犯罪集团通过架设“88财富网”网络融资平台，虚构投资项目，非法吸收公众存款，获得巨额资金后再用于高息放贷牟利，并采取摆场收数、非法拘禁、寻衅滋事等暴力手段逼迫催收，还通过制作虚假银行流水、空白债务确认书、以贷平贷等方式，利用虚假诉讼强迫债务人偿还债务。
ST中科创焕发新生机
在张伟及其掌控的中科创集团最辉煌的2015年，张伟对禾盛新材（后更名为“中科新材”）出手了。此前，张伟曾参与过天目药业（600671.SH）和新黄浦（600638.SH）的股权争夺，但两度控股失败。
禾盛新材，全名苏州禾盛新型材料股份有限公司，主要生产VCM覆膜彩色钢板、PCM涂漆彩色钢板、书写板等家电用复合材料，应用于冰箱、洗衣机、空调、电热水器等家电的外观部件，公司原第一大股东为自然人赵东明。
2009年上市后，禾盛新材业绩一路走低。2011年-2015年，禾盛新材营收保持在10.8亿元至11.8亿元之间，但净利润由2011年的0.62亿元持续下降至2014年的-1.22亿元，2015年以0.28亿元的微薄利润扭亏。
2015年5月，深圳市中科创资产管理有限公司受让赵东明、章文华、蒋学元三人持有的2712万股禾盛新材股份，成为禾盛新材新股东，持股比例12.87%；2016年，中科创资产又通过二级市场交易、大宗交易以及参与定增等多种方式陆续增持禾盛新材股票至27.42%的份额。
2016年8月，禾盛新材原董事长赵东明辞职，中科创资产成为公司新的控股股东，张伟通过100%持股中科创资产终于成为了上市公司的实际控制人。
2017年3月，苏州禾盛新型材料股份有限公司正式更名为苏州中科创新型材料股份有限公司，证券简称也由禾盛新材更名为中科新材。
中科新材主营业务为家电复合材料业务。张伟入主后，逐渐将深圳市中科创资本投资有限公司、深圳市中科创商业保理有限公司、中科创国际有限公司等与金融业务相关的子公司注入中科新材版图，并极力主张发展保理业务，保理业务营收占比从2016年的1.77%涨至2018年的7.97%。
好景不长，实控人出事后，公司保理业务一落千丈。2019年，保理业务实现营收5820万元，同比下降57.87%，营收占比跌至3.37%。而到2020年上半年，保理业务已经在ST中科创的收入中抹去，公司更加专注于新材料领域。
2019年ST中科创惨淡经营，营业收入17.26亿元，下降0.47%；净利润亏损11.98亿元，同比下降2006.78%。其中，深圳市中科创资本投资有限公司净利润亏损8.59亿元。
ST中科创2019年年报显示，公司因保理业务卷入12起纠纷。据《读数一帜》不完全统计，12起纠纷合计涉诉金额超11.71亿元。
不过，在抹去保理业务后，ST中科创回归主业，公司经营状况开始好转。2020年上半年，ST中科创营业总收入约7.17亿元，同比下降13.05%；净利润2762.47万元，上年同期亏损约9961.44万元。其中，2020年第二季度营收3.96亿元，同比下降3.07%；净利润1818.74万元，同比增长117.46%。
9月16日，ST中科创还宣布，为满足家电用外观复合材料的订单需要，同意全资子公司合肥禾盛新型材料有限公司固定资产投资不超1亿元，新建高端数字化复合材料生产线。项目理论年产家电用复合材料6万吨，建设周期2年。
扫二维码 3分钟开户 稳抓大反弹行情！
(image_address=""//n.sinaimg.cn/finance/512/w256h256/20200807/333c-ixkvvuc9099771.png"")
免责声明：自媒体综合提供的内容均源自自媒体，版权归原作者所有，转载请联系原作者并获许可。文章观点仅代表作者本人，不代表新浪立场。若内容涉及投资建议，仅供参考勿作为投资依据。投资有风险，入市需谨慎。
(image_address=""//n.sinaimg.cn/finance/cece9e13/20200514/343233024.png"")
海量资讯、精准解读，尽在新浪财经APP
责任编辑：陈志杰",2020-09-18 20:43:23,新浪财经
2,招商4亿定向资管计划背后：担保人身背多起诉讼 股份频遭冻结,"昨日晚间，招商证券发布公告称，作为招商资管质融宝13号股票质押定向资产管理计划（以下简称“资管计划”）管理人的子公司招商证券资产管理有限公司（以下简称“招商资管”），此前代表资管计划委托人向林某、杨某及广州粤泰控股集团有限公司（以下简称“粤泰控股”）提起诉讼仲裁的事件有了新进展。
公告显示，公司于近日收到杭州仲裁委员会《裁决书》，仲裁庭裁决林某向招商资管（代表资管计划）偿付融资本金 4.09 亿元，并支付相应利息、罚息及违约金；裁决杨某及广州粤泰控股集团有限公司对上述林某所确定的债务承担连带清偿责任。
同时，裁决招商资管（代表资管计划）在上述裁决确定的债权范围内对林某持有并质押的3937万股“河钢资源”股票以及后续产生的无需支付对价的送股、转增股份、现金红利享有优先受偿权。
作为一项通道业务，券商资管的定向资管计划业务往往很少有做主动管理的。作为计划的管理人，券商资产管理公司仅仅只是根据委托人的指令进行标的投资的操作，其中的交易风向和损益都与券商无关。因此，本次的仲裁结果实际上对招商证券的经营并未造成影响。
据公司此前公告，该笔债务的产生起始于2017年8月，上述资管计划通过股票质押式回购交易业务，向林某融出资金5个亿（截止目前未偿还融资本金4.09亿元），担保人为广州粤泰控股集团有限公司（以下简称“粤泰控股”）和该公司法定代表人杨某。
而在2018年5月，随着股价的下跌，上述交易的履约保障比例低于最低线，但林某未能完成补充质押等措施使履约保障比例高于最低线，亦未提前购回，并自2019年第二季度起未按照协议约定支付当期利息，构成违约，粤泰控股与杨某亦未履行任何担保责任。
根据《裁决书》显示的“河钢资源”、“3937万股”等信息，可以非常容易的查到，裁决书中提及的林某为上市公司河钢资源第四大股东林丽娜。
按河钢资源进今日12.93元/股的收盘价来看，该部分股权总价值约5亿元，可覆盖上述仲裁提及的未偿还的本金。据了解，目前该部分股份已被司法冻结。
值得注意的是，通过天眼查可以发现，林丽娜也是担保人粤泰控股的董事之一，而另一位担保人杨某则是粤泰控股的法人代表杨树坪。
粤泰控股名下公司众多，但其中最知名和最核心当属其实际控制的A股上市房企粤泰股份。
公开信息显示，粤泰股份的前身为东华实业，2004年经粤泰控股获得公司实控权后，便开始进行资产置换，2016年东华实业完成重组后更名为粤泰股份。
不过，近两年该公司的发展却颇为不顺利，频曝债务危机、实控人及其一致行动人股权遭冻结等问题。
天眼查数据显示，仅去年至今粤泰股份名下的各大借贷合同纠纷就有十数起，而且公司实控人粤泰控股名下也有多起金融借贷纠纷。
2019年中报显示，粤泰股份短期借款金额为32.91亿元，一年内到期的非流动负债金额为34.07亿元，而彼时公司的账面货币资金仅3.88亿元。
为化解相关债务风险，缓和公司现金流压力，从2019年6月份开始，粤泰股份便陆陆续续向世茂地产转让了五个项目股权，其中还不乏公司的稀缺项目广州天鹅湾二期。
通过出售相关资产，虽然暂时缓解了粤泰股份的燃眉之急。不过，此时公司的实控人粤泰控股却又再起波澜，因多起借款纠纷，频繁导致公司大比例股权被冻结，一旦债务无法偿还，则很有可能导致公司实控权的转移。
根据粤泰股份今年6月份发布的最新消息，公司实控股股东粤泰控股债务逾期总金额为人民币24亿元，涉及债务违约的诉讼金额为人民币17亿元。目前粤泰控股及其一致行动人所持有的粤泰股份64.15%股权已被全部冻结。
尽管粤泰股份表示公司在业务、资产、财务方面与粤泰控股方面保持独立，控股股东股份的冻结暂时不会对公司经营造成影响。然而皮之不存毛将焉附，在国家严控房市，地产公司存量竞争愈发激烈，行业集中度逐渐提高的的今天，留给公司的时间和空间恐怕也不多了。（文/王不留行）
(image_address=""//n.sinaimg.cn/finance/cece9e13/20200514/343233024.png"")
海量资讯、精准解读，尽在新浪财经APP
责任编辑：陈志杰",2020-09-18 20:42:02,新浪财经
3,权威榜单出炉：A股公司现金分红谁最慷慨？,"权威榜单出炉：A股公司现金分红谁最慷慨？
来源：上海证券报
A股上市公司现金分红谁最壕？来看最新出炉的权威榜单。
今日，中国上市公司协会联合上交所、深交所发布A股上市公司现金分红榜单，包括“上市公司丰厚回报榜单”和“上市公司真诚回报榜单”各100家公司。
现金分红不仅反映公司经营业绩和规范运作水平，也关系资本市场良好生态环境的形成。近年来，A股上市公司投资者保护意识逐步增强，现金分红和投资者回报水平逐年提升。根据2019年年度报告，上市公司现金分红合计约1.36万亿元，同比增长约10.7%，分红上市公司占全部上市公司总数的约66%。
本次榜单以近一年和近三年的现金分红总额为主要指标，评选出“上市公司丰厚回报榜单”前100家；以近一年和近三年的股利支付率为主要指标，评选出“上市公司真诚回报榜单”前100家。
榜单评选坚持代表性和持续性的基本原则，既选择出具有代表性的上市公司，鼓励长期持续稳定的分红，又兼顾不同板块公司的特点，充分反映公司分红的积极意愿。值得注意的是，除了分红总额、股利支付率等客观量化指标之外，榜单设置了证券市场诚信合规、财务等方面的前置指标，采取负面清单“一票否决”。
从榜单情况来看，“上市公司丰厚回报榜单”入选公司2019年的现金分红总额占全体A股公司总额的67.9%，2017-2019年三年累计现金分红总额占全体A股公司总额的68.61%。
入选“丰厚回报榜单”的公司中，沪市主板77家，深市主板16家，中小板6家，创业板1家。
(image_address=""//n.sinaimg.cn/finance/crawl/53/w550h303/20200918/7054-izmihnt0496777.jpg"")
入选“真诚回报榜单”的公司中，沪市主板37家，深市主板12家，中小板33家，创业板18家。
(image_address=""//n.sinaimg.cn/finance/crawl/69/w550h319/20200918/76a3-izmihnt0496839.jpg"")
从地域来看，共有30个辖区上市公司入选，排名前三的分别是北京、江苏和深圳。
入选“丰厚回报榜单”的公司中，有82%的公司自上市以来连续每年分红，有70家公司近10年以来连续进行分红。入选“真诚回报榜单”的公司中，有84%的公司自上市以来连续每年分红，有30家公司近10年以来连续进行分红。
值得注意的是，合计有7家公司同时入选两个榜单，它们是：华能国际、双汇发展、宇通客车、永辉超市、步长制药、重庆水务、云南白药。
(image_address=""//n.sinaimg.cn/finance/crawl/423/w550h1473/20200918/3689-izmihnt0496924.jpg"")
(image_address=""//n.sinaimg.cn/finance/crawl/582/w550h1632/20200918/555d-izmihnt0496988.jpg"")
(image_address=""//n.sinaimg.cn/finance/cece9e13/20200514/343233024.png"")
海量资讯、精准解读，尽在新浪财经APP
责任编辑：陈志杰",2020-09-18 20:30:58,新浪财经
