,title,content,pub_time,src
0,梦洁股份割韭菜露馅：薇娅3次带货仅812万 却吹升8涨停45亿市值,"原标题：梦洁股份割韭菜露馅：薇娅3次带货仅812万，却吹升8涨停45亿市值 来源：德林社
德林社　　文 | 侯龙飞
当能力撑不起野心时，所有的路都是弯路。
5月22日，深交所的一纸问询函，就顺势将 梦洁股份的股价掰弯了——收盘大跌盘中一度跌停。在给深交所的回复函中， 梦洁股份与薇娅直播合作的底牌却露馅了：今年三场直播仅带货812万元，同时还需支付对方213.24万元，公司实际收入还不到600万元。
当然，看起来游资和背后的炒作资金，已经完成了一轮完美的收割游戏。这一番资本炒作，10个交易日 梦洁股份拉出8个涨停板，市值从32.78亿元一度拉升至77.32亿元，吹升45亿市值。
这是典型的营收实力撑不起资本野心的故事。到底是薇娅在玩资本，还是 梦洁股份在玩资本，还是双方互相借力玩起了股价拍卖的击鼓传花游戏，似乎已经并不重要。重要的是，最近三天累计逾86%的换手率，注定又是一场游资割散户韭菜的血泪故事。
问询函揭开 梦洁股份暴涨画皮
今天，A股5月份的人气之王 梦洁股份蔫了，一根难看的大阴线收跌7.87%，盘中还一度跌停。
梦洁股份终止连板走势，不少股民感慨道——“薇娅终于带不动了！”。同时，更多股民疑问的是——“薇娅和公司的合作开始了没？带货成绩怎么样？”毕竟，如果带货效果一般，股价涨起来就一场资本收割韭菜的游戏。
展开剩余81%
5月18日深交所曾对 梦洁股份下发问询函，22日晚间 梦洁股份的回复终于公告披露。出乎意料的是，带货女王的成绩，却有点拿不出手。
(image_address=""//n.sinaimg.cn/spider2020523/267/w640h427/20200523/4599-itzixrs4592762.jpg"")
根据 梦洁股份披露的公告，公司与薇娅所在的谦寻（杭州）文化传媒有限公司（下称谦寻文化）旗下主播“薇娅”共合作7次，其中2019年合作直播销售公司产品3次，累计销售金额469万元。 2020年，薇娅直播销售公司产品共4次，5月18日的销售成果因结算周期原因暂未结算，其他3次累计销售金额为812.12万，占公司2019年营收的0.31%。同时， 梦洁股份支付的费用为213万，实际收入仅为600万元不到。
是的，你没看错，薇娅今年3次带货公司产品，销售额仅有812.12万，平均每次271万。与薇娅“带货女王”的称号相比，这个成绩实在有点拿不出手。但就是这拿不出手的带货量，却以绝对以资本魔手的神奇——将 梦洁股份拉出8个涨停，股价翻番，一度吹升45亿元市值。
之前股价连续涨停时， 梦洁股份曾“谦虚”地表示——“此次合作不会对公司生产经营产生重大影响。”现在看来， 梦洁股份的这番表述依然是有所水分。相比于 梦洁股份2019年26亿元的营收而言，与薇娅的3场合作收入，仅占其总收入的0.3%。以此乐观测算，假设薇娅与 梦洁股份的直播场次一年为12场，其直播收入也仅为3200万元，占其公司营收1.2%。而剔除合作费用，再剔除产品实际成本， 梦洁股份实际的利润空间将更加微小，甚至更多是赔钱赚吆喝的买卖——对公司生产经营的影响可以说是“微乎其微”。
毫无疑问，薇娅直播对 梦洁股份的营收影响也很有限。但是， 梦洁股份却依然在借回复函打开投资者的想象空间。 梦洁股份表示，与谦寻文化签署《战略合作协议》，将根据“薇娅”粉丝的反馈，有针对性的进行产品开发，增加公司产品进入“薇娅”直播间销售的频次，有利于提升公司产品销量和品牌知名度。
谁在玩资本爆炒 梦洁股份
事实上，之前 梦洁股份曾表示，与薇娅的合作不仅是在直播带货层面，薇娅还将参与公司的产品设计与品控，是一种轻“C2M”模式。
造模式，造概念，这种资本运作的玩法。而在22日晚间的回复函中，双方的合作还仅限于直播带货。但是，下半年双方是否将在更多维度展开合作仍然存疑。若薇娅参与公司产品的品控、设计，或将给公司产品注入新的活力，进而提升公司的知名度和业绩。否则，单纯的网红直播已没有多少想象空间，也远远撑不起 梦洁股份已经翻倍的股价。
在最近三个交易日，换手率高达86%，筹码几近全部倒手的情况下，到底谁在玩资本爆炒 梦洁股份？
在5月18日深交所要求 梦洁股份回复的问询函中，这也是核心的问询要点之一——是否存在内幕交易、操纵市场的情形，是否存在利用其他非信息披露渠道主动迎合 “网红直播”市场热点进行股价炒作并配合股东减持的情形？
梦洁股份的回答自然是否认。但是，这个回答很官方，却难以打消投资者的疑问，而且这其中还有诸多诡异的细节。
今年2月3日、4日，春节开市之后， 梦洁股份即以两个跌停的弱势凸显了疫情带来的冲击波，并创出2015年股灾以来的最低股价3.94元。随着A股反弹， 梦洁股份股价也一路反弹至6.05元，但随后又回落至5月7日的4.29元，股价陷入低迷。此时， 梦洁股份32.78亿元的市值与2015年牛市顶峰时期的106.57亿元已经砍去70%。
(image_address=""//n.sinaimg.cn/spider2020523/266/w640h426/20200523/2a8a-itzixrs4592761.jpg"")
作为家具消费中的家纺企业龙头， 梦洁股份注重品牌营销自然情理之中。但此番签约薇娅背后，正值疫情冲击之下网红直播概念泛起。尤其是在 梦洁股份与薇娅签约前一个交易日——5月8日，其却突然拉出涨停板，成交量比平时骤然放大7倍，大约有7000多万资金先知先觉布局其中。
一个周末之后，5月11日 梦洁股份与薇娅所在的谦寻文化签约了。协议签署完成后， 梦洁股份公司品牌宣传部门向媒体推送了相关的内容。
次日开始， 梦洁股份继续拉出7个涨停板，诠释着当下网红直播概念的红火。但，让股民们震惊的是， 梦洁股份实际控制人姜天武的前妻伍静却在5月12日至5月18日期间，通过集合竞价和大宗交易合计减持1419.91万股，套现资金逾9600万元。
5月18日收到了深交所问询函，不过 梦洁股份依然继续拉出两个涨停板。当然，深交易已经盯上了连续多日涨跌幅异常的“ 梦洁股份”，并持续进行重点监控和采取监管措施。
值得一提的是，在这一轮的涨停板拉升过程中，5月15日、19日、20日、21日，公司副总经理成艳女士及其配偶张戬通过集中竞价交易累计减持了公司股份140，366股。同时，5月14日，公司董事张爱纯之子周瑜通过集中竞价交易减持了公司股份76，959股。
同时，如果翻看 梦洁股份的龙虎榜信息，我们也许更会发现，这又是一场游资收割中小散户的套利游戏。
5月中旬以来， 梦洁股份总共有5个交易日登陆A股龙虎榜榜单。5月12日，签约后的第一个涨停板，主要由东亚前海证券深圳分公司、国盛证券重庆大坪正街营业部、国盛证券宁波天童南路营业部、华泰证券常州和平北路营业部、中信证券杭州延安路营业部。14日前两家营业部继续大笔资金买入，20日前三家营业部开始大举抛售落袋为安。后续参与的营业部也是快进快出模式。
尤其值得关注的是，此前拉出涨停板乃至参与打板资金的营业部，基本在5月20日、21日两天完成了出货套利。5月22日，游资留下的则是暴跌模式的开启信号。这也留给交易所新的监管课题，直播合作双方或者背后资金是否精准埋伏博弈网红直播概念？股市资金追逐的热门风口是否是该披露的内幕信息？谁又该为这一场收割股民的股价炒作乃至操纵负责？
免责声明：自媒体综合提供的内容均源自自媒体，版权归原作者所有，转载请联系原作者并获许可。文章观点仅代表作者本人，不代表新浪立场。若内容涉及投资建议，仅供参考勿作为投资依据。投资有风险，入市需谨慎。
(image_address=""http://n.sinaimg.cn/finance/cece9e13/20200514/343233024.png"")
海量资讯、精准解读，尽在新浪财经APP
责任编辑：常福强",2020-05-23 13:51:08,新浪财经
1,昔日“小甜甜”即将“成仙” 又有一批A股离退市已不遥远,"只差4毛钱，4个月前资本市场上的明星就要成为不折不扣的“仙股”了！
截至收盘，瑞幸咖啡再度暴跌30.85%，盘中最低价仅1.33美元/股，距离从纳斯达克摘牌又近了一步。
而在昨日，A股市场也有一家上市公司被正式“宣判”退市。还有多少即将退市股排队在路上？
复牌3天暴跌68% 瑞幸咖啡即将“成仙”
美东时间周五，美三大股指小幅低开，道指盘中一度跌超170点。随后三大股指震荡走高，纳指、标普500由跌转涨，截至收盘，道指微跌，纳指、标普500小幅上涨。
热门中概股多数收跌，百度跌6.1%、阿里巴巴跌5.87%、，京东跌5.08%，不过拼多多大涨14.50%。
当然，最让人注目的还是瑞幸咖啡，最终再度大跌30.85%，收报1.39美元/股，盘中最低1.33美元/股。也就是说，如果股价再跌0.39美元失守1美元/股的“红线”，将彻底沦为“仙股”。
(image_address=""//n.sinaimg.cn/finance/crawl/50/w550h300/20200523/a2b1-itzixrs4525134.jpg"")
瑞幸咖啡近期日K线图
自周三复牌以来，瑞幸咖啡3个交易日分别下跌35.76%、28.72%、30.85%，累计下跌幅度高达68.34%，总市值也从巅峰期的超过120亿美元缩水至3.34亿美元。
回望1月17日的盘中最高点51.38亿美元/股，昔日还是“小甜甜”的瑞幸咖啡股价在4个月内缩水超97%，实在是太过惨烈。
对投资者的赔偿方式值得A股借鉴
5月19日晚，瑞幸咖啡发布公告称，已于15日收到纳斯达克股票市场公司上市资格部门的书面通知，该部门已经决定将瑞幸咖啡从纳斯达克股市摘牌。实际上，从纳斯达克上市公司收到通知到最终被摘牌，是一个复杂而且耗时的过程。若上市公司从板块退市时，投资者仍未抛售手中的股票，那么只能去场外交易证券市场进行交易，该市场流动性较差。
(image_address=""//n.sinaimg.cn/finance/crawl/93/w550h343/20200523/ec5b-itzixrs4525205.jpg"")
图片来源：摄图网
此前有报道称，投资者对瑞幸的诉讼正在推进中。据报道，AFN Law律师事务所创始人倪非表示，目前有18个不同的律所递交了领导原告的申请，近日已有12家因原告资金量不足而主动撤出，而剩下6家代理原告申请。其中一家律所的申请主体就因瑞幸损失了约2400万美元。倪非表示，证券类的诉讼都属于民事诉讼，除诉讼律师提出集体诉讼外，SEC（美国证券交易委员会）也可以对瑞幸公司及相关负责人提出起诉，如果涉及重大诈骗行为，联邦检察院还可以对相关责任人进行刑事指控。
与此同时，瑞幸咖啡关店、裁员的信息流入市场。对此，瑞幸咖啡称，目前对个别效益不好或客户覆盖重合的门店进行“关停并转”，裁员是个别部门涉及人员的转岗和优化。
财经评论人皮海洲对此评论称，瑞幸咖啡最终被摘牌几无悬念，上市公司因为财务造假被摘牌，投资者的损失并不由投资者来买单，而是由上市公司及相关的责任方来赔偿投资者，这一点是尤其值得A股市场借鉴。
从4月2日瑞幸咖啡自曝22亿元财务造假事件，到5月15日该公司收到纳斯达克股票市场的摘牌令，纳斯达克市场在监管方面的动作堪称雷厉风行。正如5月20日凌晨，瑞幸咖啡董事长陆正耀发布的个人声明中所表示的那样，纳斯达克不等最终调查结果就要求公司退市，出乎意料。在瑞幸咖啡摘牌的问题上，纳斯达克市场丝毫没有拖泥带水，真正表现出对于造假者的“零容忍”，这是值得A股市场借鉴的。
美国对安然公司的严厉处罚堪称是美国市场打击上市公司账务造假的经典案例。安然公司是世界上最大的能源、商品和服务公司之一，也是当时美国的500强企业。2001年该公司财务造假事件东窗事发，结果该公司难逃退市破产的厄运。安然公司被美国证交会罚款5亿美元，股票被从道琼斯指数除名并停止交易，安然公司宣告破产。安然公司CEO杰弗里·斯基林被判刑24年并罚款4500万美元；公司创始人肯尼思·莱虽因诉讼期间去世被撤销刑事指控，但仍被追讨1200万美元的罚款。安然公司的投资者通过集体诉讼获得了高达71.4亿美元的和解赔偿金。
纳斯达克市场对于瑞幸咖啡发出摘牌令，对于A股市场的启示当然不限如此。尤其需要引起A股市场关注的是，摘牌令并不妨碍投资者的索赔。如在安然事件中，安然公司的投资者通过集体诉讼获得了高达71.4亿美元的和解赔偿金。其中，三大投行花旗集团、摩根大通、美洲银行因涉嫌财务欺诈被判有罪，向安然公司的破产受害者分别支付了20亿、22亿和6900万美元的赔偿罚款。上市公司因为财务造假被摘牌，投资者的损失并不由投资者来买单，而是由上市公司及相关的责任方来赔偿投资者，这一点是尤其值得A股市场借鉴。
龙力生物被终止上市
而在A股市场上，昨日也有一家上市公司很“惨烈”。
(image_address=""//n.sinaimg.cn/finance/crawl/203/w550h453/20200523/b81c-itzixrs4525275.jpg"")
图片来源：深交所
昨日，深交所发布公告称，山东龙力生物科技股份有限公司股票终止上市。该公司因2017年、2018年连续两个会计年度财务会计报告被出具了无法表示意见的审计报告，且连续两个会计年度经审计的净资产为负值，公司股票自2019年5月15日起暂停上市。公司股票自2020年6月1日起进入退市整理期。退市整理期的期限为三十个交易日。
公开资料显示，龙力生物成立于2001年6月，后于2011年7月28日正式挂牌上市。该公司是以玉米芯、玉米为原料，采用现代生物工程技术生产功能糖、淀粉及淀粉糖等产品，并循环利用功能糖生产中产生的玉米芯废渣生产第2代燃料乙醇等新能源产品的生物质综合利用企业。其产品主要有低聚木糖、木糖醇、纤维素乙醇、淀粉及副产品、结晶葡萄糖、高麦芽糖浆等。该公司曾经获得生物质综合利用的国家级重点高新技术企业，全国食品工业优秀龙头企业，院士工作站，国家糖工程技术研究中心，中国轻工业食品添加剂行业十强等众多资质荣誉。
在2015年6月12日，龙力生物盘中股价最高曾达到20.8元/股，总市值近125亿元。在去年4月暂停上市前，公司股价为1.96元/股，市值为11.75亿元。也就是说，在近4年时间里，公司股价暴跌九成，逾110亿元市值蒸发。其中，2018年4月11日至5月15日更是出现惊人的连续22个一字板跌停。
(image_address=""//n.sinaimg.cn/finance/crawl/69/w550h319/20200523/60d2-itzixrs4525363.jpg"")
龙力生物2018年上半年日K线图
还有多家即将退市股在路上
2017年底，山东龙力生物爆发债务违约。2017年12月18日，龙力生物公告称，公司2016年11月10日因流动资金需求与中海信托签署信托贷款合同，第一期借款1.38亿元已经在同年12月7日到期，但公司未清偿贷款，出现债务违约。同时，龙力生物4个银行的8个账户已经被冻结。根据此前龙力生物发布的2017年三季度财报，公司货币资金还高达9.36亿元。奇怪的是，在这样的情况下，公司却无法偿还1.4亿元的债券。
爆出债务危机后，事态迅速恶化，深交所连发关注函质询冻结资金以及信披问题。2018年1月2日，龙力生物在回复深交所质询的公告中表示，公司对13家提供了贷款担保达10.5亿，而此前从未披露过，涉嫌信披违规。
2018年1月11日，龙力生物收到证监会下发的《调查通知书》，因公司涉嫌存在信息披露违法违规行为，证监会决定对公司进行立案调查。
财务数据显示，2017年、2018年、2019年公司亏损额分别达到34.86亿元、28.08亿元和8.12亿元，3年合计亏损额达到71亿元。此外，从2017年年报起，公司多名已经对年报、季报、半年度报告等多份财务报告表示无法保证真实、准确、完整。
(image_address=""//n.sinaimg.cn/finance/crawl/138/w550h388/20200523/279b-itzixrs4525420.jpg"")
图片来源：证监会官网
今年4月24日，证监会公告严厉打击上市公司财务造假，龙力生物因系统性造假突出，被列入4个典型案例之一。证监会表示，经查，龙力生物2015年至2017年上半年为虚增公司利润，定期通过删改财务核算账套实施造假。
龙力生物是今年深交所退市的第三家公司。在此之前，5月14日，乐视网（维权）和金亚科技（维权）两只创业板股票同日被深交所终止上市。此外，上交所方面也有两只股票退市，分别是保千里和华锐风电，目前两只股票简称已更改为退市保千（维权）和退市锐电。
目前来看，已可提前锁定触发面值退市的上市公司还有四家，分别为*ST美都、神雾环保（维权）、盛运环保（维权）和ST天宝（维权）。
(image_address=""http://n.sinaimg.cn/finance/cece9e13/20200514/343233024.png"")
海量资讯、精准解读，尽在新浪财经APP
责任编辑：田原",2020-05-23 13:03:33,新浪财经
