,title,content,pub_time,src
0,招商蛇口引入战投平安:认购定增或超20亿 战略合作期3年起,"(image_address=""//image.sinajs.cn/newchart/new_daily/n/sz001979.gif"")
热点栏目
自选股
数据中心
行情中心
资金流向
模拟交易
客户端
新浪财经 中国平安再次拓展地产版图：招商蛇口拟引入战投，向平安资管、平安人寿非公开发行股票，所得现金将用于收购南油集团的少数股权。
6月7日，招商蛇口发布交易预案公告，公司拟向深圳市投资控股有限公司（下称“深投控”）购买其持有的深圳市南油（集团）有限公司（下称“南油集团”）24%股权。
本次交易的支付方式分为三种，包括向深投控发行股份、可转换公司债及支付现金，分别占交易对价的2.5%、47.5%和50%。
根据公告，招商蛇口向深投控发行股份的最终发行价定为16.58元/股（上市公司重组定价基准日前20个交易日的交易均价），可转债初始转股价定为17.41元/股（发行股份的价格*105%）。
而现金部分主要来自平安人寿的保险资金。为了募集本次交易的配套资金，招商蛇口引入平安作为战投，向平安资管、平安人寿非公开发行股份，发行股份数量不超过发行前公司总股本的30%，股份最终发行价同样是16.58元/股。
不过，南油集团24%股权的交易价格尚未确定，因此向深投控发行的股份、可转债及向平安发行的股份数量等相关内容仍有待进一步披露。
购买南油集团少数股权 提升前海土地权益
南油集团创立于1984年，现位于深圳市前海蛇口自贸区，主要在中国境内从事物流仓储、实业投资以及园区开发、建设和运营业务。在本次交易前，招商蛇口占股76%，深投控占股24%。
2013年，深圳市政府发布了《前海综合规划》，要求除妈湾港区仍保留港口功能外，原归属于招商局集团及其下属企业在前海的土地性质基本规划调整为商业性用地。次年，深圳市政府提出就招商局集团前海湾物流园区协议用地约3.9平方公里展开土地整备。
2020年1月，招商蛇口控股下属子公司招商前海实业与前海管理局下属前海投控共同完成了对前海自贸投资（下称“合资公司”）的增资，招商前海实业与前海投控分别持股50%，前海土地整备收官。
这正是本次招商蛇口收购南油集团股权的交易背景。上述增资后，合资公司间接拥有位于深圳前海妈湾约80.62万平方米的土地使用权。而南油集团合计持有招商前海实业44.85%股份（直接持有32.89%、间接持有11.96%股份），因此间接享有合资公司在前海片区的土地权益。
前海片区是目前深圳房价最高的地区之一。在2019年招商蛇口年报中，公司称妈湾片区资产价值超过千亿。
在本次交易完成后，南油集团将成为招商蛇口的全资下属公司，进一步增加了招商蛇口对于合资公司的控制，有利于上市公司提高其在前海片区享有的资源价值，从而增厚归母净利润。
对于前海土地开发计划，在2019年度业绩发布会，招商蛇口董事长许永军曾对媒体表示，将在8-10年开发完毕，总建筑面积约500万平方米，分为可售物业及持有物业，具体根据公司铺排而定。
作为招商局集团旗下唯一的地产资产整合平台。2019年招商蛇口累计实现签约销售面积1169.44万平方米，签约销售金额2204.74亿元，同比分别增加41.35%和29.25%。
平安再度拓展地产版图 认购定增或超20亿
根据预案公告，平安资管接受平安人寿委托，以平安人寿的保险资金全额认购招商蛇口本次募集配套资金非公开发行的股份，发行价格为16.58元/股。发行完成后，平安人寿将成为招商蛇口股东，平安方面有权提名在招商蛇口的董事人选。
在经营业务层面，双方则将围绕智慧园区、智慧康养、智慧建筑、保险保障、投融资等领域深化合作。战略合作期限为3年，合作期限届满后如各方均未书面提出终止协议，则合作期限将自动延长3年。
截至2020年一季度末，南油集团总资产为231.28亿，总负债为53.23亿，归母净资产为177.97亿，一季度营收1386万，亏损1990万。
如果按净资产规模粗略评估，24%南油集团股权的对应作价约为42.71亿，再按招商蛇口现金支付占比50%来计算的话，平安方面认购招商蛇口定增的金额或超过20亿元。
实际上，中国平安与招商蛇口渊源颇深，招商蛇口控股股东招商局集团是中国平安的发起人股东之一。对于此次参与招商蛇口混改，中国平安方面表示：“平安的投资原则是匹配保险资金长期负债”。
这次的战略投资也让平安的地产版图再次拓展。自2015年开始，平安陆续参与众多头部房企的股权投资，目前是碧桂园、华夏幸福、旭辉集团、中国金茂等房企的第二大股东。
“平安对房地产立足于财务投资，关注长期价值和投资价值，不做房地产公司的野蛮人，不会参与公司实际经营管理”，平安集团总经理任汇川曾公开表示，平安在房地产的投资符合监管要求，保险资金配置远低于银保监会规定的30%的上限。
近一年来，央企开发商引入险资的动作频频。今年1月，太平人寿以约19.07亿认购了大悦城非公开发行的约2.83亿股股份；2019年底，上海临港也引入了中国太保旗下太保寿险，后者斥资近27亿元参与了定增认购。
天风证券发布于6月2日的研报指出，从大悦城定增引入太平人寿、上海临港引入太保寿险、金茂引入平安定增等类比来看，招商蛇口此次引入平安，或符合当前“地产-险资”合作发展模式。
“一方面为地产补充低成本资金，另一方面为险资提供高分红、高股息的投资渠道”，天风证券分析称。2019年，招商蛇口现金分红金额（含税）为64.23亿，归母净利润为160.33亿，分红率连续三年保持在40%以上。
国泰君安谢皓宇团队则表示，房地产行业近年以来股权融资案例较少，股权融资通道的收紧对企业扩表带来较大影响，招行蛇口若成功发行股份并募集配套资金，将为市场提供新的思路。
招商蛇口因筹划收购南油集团股权事宜，自6月1日起停牌，今日起复牌。截至发稿，招商蛇口股价为16.93元/股，涨5.61%。（新浪财经 徐苑蕾）
(image_address=""http://n.sinaimg.cn/finance/cece9e13/20200514/343233024.png"")
海量资讯、精准解读，尽在新浪财经APP
责任编辑：陈悠然 SF104",2020-06-08 10:56:30,新浪财经
1,许家印机会来了？南国置业曲线上市要成真？钉子户深深房何时复牌,"又一家地产企业计划通过重组方式冲A。
6月7日晚，南国置业发布停牌公告，拟对控股股东电建地产吸收合并。由于构成重大资产重组，公司股票8日开市起开始停牌。
地产作为资本市场的“敏感行业”，其每一次股权融资举动都备受市场关注：是否成为房企股融松绑的信号。根据券商中国记者从多名券商投行人士处了解到，在再融资方面，监管层对房企定增或上市公司募投项目为地产的仍在收紧；但对于地产类并购重组，暂无明确限制。
券商中国记者梳理近年来案例发现，通过定增收购涉房企业的重大资产重组中，成功率较高的重组具备以下特点：国企改革、同行业整合。在投行人士看来，南国置业吸收合并电建地产或没有来自监管的障碍。
在南国置业发布重组的同时，深深房因停牌旷日持久再被市场关注，这家停牌逾1300天的上市公司，股民已表示不耐烦，“不如放弃”、“不能永久拖下去”……
央企地产即将实现整体上市
6月7日晚，南国置业发布关于筹划重大资产重组事项的停牌公告，公司表示计划对电建地产进行吸收合并。根据公告，本次交易具体内容如下：
交易对方：电建地产100%股权的全部股东。据了解，电建地产股权结构为中国电建持股91.25%，电建建筑持股8.75%。
交易方式：发行股份及支付现金的方式。
吸收合并完成后，电建地产将注销法人资格，公司作为存续主体。本次交易构成关联交易，预计构成重大资产重组，不构成重组上市。
(image_address=""//n.sinaimg.cn/spider202068/662/w960h1302/20200608/8523-iurnkps0840329.png"")
自电建地产控股南国置业起，就有市场人士猜测前者是否会运作上市，随后电建地产否认，称对上市没有想法。
据了解，南国置业主要从事房地产的开发与运营业务，原为一家民企上市公司。早在2012年，彼时南国置业的控股股东许晓明及其兄弟许贤明通过股权转让，引入了中国水电地产（后更名“电建地产”）做第二大股东。电建地产于2013年实现控股，南国置业从此成为电建地产的一个上市平台。
电建地产为促进南国置业发展，曾努力推动双方业务互补发展。但南国置业去年经营情况不佳，从2018年扣非净利润盈利8311.23万元到2019年亏损3.57亿，南国置业解释2019年是受当期部分商业项目主动调改与部分住宅开发项目结利周期的影响。
今年一季度南国置业仍然亏损，扣非净利润为-1.53亿。主要受新冠肺炎疫情的影响，自2020年1月底之后，公司的房地产开发项目停工，公司经营的商业项目大部分属于停业状态。
南国置业经营情况也反映在股价表现上。从周K线来看，公司2009年上市当月即股价巅峰。2011年及2015年股价有所提振，但随后持续下行。停牌前股价2.05元，总市值35.6亿。
(image_address=""//n.sinaimg.cn/spider202068/744/w1080h464/20200608/a01c-iurnkps0840719.png"")
电建地产能否力挽狂澜？公开资料显示，电建地产是中国电建重要的房地产开发板块。
根据中国电建2019年年报显示，作为国务院国资委核准的具有房地产开发主业资格的央企之一，中国电建主要依托下属电建地产开展房地产业务。
2019年电建地产净利润达到6.76亿元，盈利能力远超南国置业。但去年也出现同比下滑45.8%，主要因为受行业形势影响，重点商业项目停业改造以及还建房项目结利形成亏损，以及计提资产减值准备。
(image_address=""//n.sinaimg.cn/spider202068/414/w1080h934/20200608/cb7a-iurnkps0840883.png"")
监管对地产类重组无明确限制
南国置业吸收合并电建地产，之所以受到市场关注主要因为涉及敏感行业——地产。据了解，监管层对地产股权融资向来收的较紧，此次并购重组是否意味着地产股权融资监管得到松绑？
对此，华东地区一名券商并购人士向券商中国记者表示，“地产类重组一直没有命令说不能做。”
北京一名券商并购人士也有相似观点，他表示，监管层限制房地产行业的股权融资行为，但对并购重组没有明确限制。
前述券商并购人士都表示，这单并购重组特殊背景在于，是同集团吸收合并，且是央企；虽涉房地产但双方都属同行业。
根据券商中国记者梳理近年来上市公司通过发行股份方式收购涉房企业的重大资产重组案例，发现成功率较高的重组主要有几个特点：国企改革、同行业整合。
(image_address=""//n.sinaimg.cn/spider202068/587/w668h719/20200608/a14c-iurnkps0840872.png"")
比如今年新披露预案的数源科技，计划定增收购东软股份88.8309%股权和诚园置业50%股权。上市公司表示，通过本次交易，数源科技与东软股份将形成房地产业务板块和产业园区运营业务板块的优势资源互补；同时东软股份是西湖电子集团下属的优质业务资产，数源科技是西湖电子集团下属的重要证券化平台，而诚园置业现为上市公司下属子公司中 兴房产的参股公司，这次交易可以推进集团核心业务资产证券化，实现国有资产的优化整合。
此外，上海临港定增收购6家公司、中粮地产定增收购大悦城地产、信达地产定增收购淮矿地产、西藏城投收购3家公司股权、中华企业定增收购中星集团等，其交易背景都有着“国企改革”或“做大国有企业”的特点。
深深房股民：难就别搞、求复牌、要交代
在市场关注南国置业这场并购同时，“停牌钉子户”深深房再次被市场热议。深深房与恒大这场旷日持久的重大资产重组，所有市场人士都期待能快点迎来“剧终”时刻。
(image_address=""//n.sinaimg.cn/spider202068/485/w1080h205/20200608/cc14-iurnkps0841324.png"")
据2016年的中国恒大与深深房订立的协议，后者将以发行A股或现金方式购买恒大境内附属公司凯隆置业持有的100%恒大地产股权。深深房及深投控股同意恒大地产可引入总金额上百亿的战略投资者。
然而谁都没想到，这场重组停牌了上千天。
今年6月6日最新公告显示，深深房在2016年9月14日开始停牌，至本公告披露日，公司与深投控及对手方积极推进重大资产重组的各项工作。称由于涉及深圳市国有企业改革，交易结构较为复杂，拟购买的标的资产系行业龙头类资产，资产规模较大，属于重大无先例事项，使得重组方案需跟监管部门进行反复的沟通及进一步的商讨、论证和完善，同时因有效期要求更新标的资产审计及评估报告，而体量较大尚需一定时间。
以此推算，截至6月6日，深深房已经停牌长达1341天。重组停滞，停牌时间之长，引起股民的普遍不满。
(image_address=""//n.sinaimg.cn/spider202068/244/w1080h764/20200608/3acb-iurnkps0841327.png"")
在恒大方面，今年1月13日，中国恒大发布公告称，鉴于恒大地产重组上市工作正在有序推进，经与第一批及第二批战略投资者友好协商，一致同意将700亿人民币股权投资增资协议中约定的实现重组上市期限延期，与第三批战略投资者600亿股权投资约定的期限保持一致，即由“2020年1月31日前”延期至“2021年1月31日前”。
两个月后，3月31日的中国恒大业绩发布会上，恒大集团董事局主席许家印对此次重组战投利润对赌协议表示，如果深深房重组成功，要保证第一年实现利润目标500亿，第二年550亿，第三年600亿。
(image_address=""http://n.sinaimg.cn/finance/cece9e13/20200514/343233024.png"")
海量资讯、精准解读，尽在新浪财经APP
责任编辑：陈悠然 SF104",2020-06-08 10:31:20,新浪财经
2,主动退市第一股ST国重装凤凰涅槃：重返A股最高涨超188%,"(image_address=""//image.sinajs.cn/newchart/new_daily/n/sh601399.gif"")
热点栏目
自选股
数据中心
行情中心
资金流向
模拟交易
客户端
来源：每日经济新闻
原标题：近5万股民嗨了！！主动退市第一股ST国重装“凤凰涅槃”：重返A股最高涨超188%！
6月8日，ST国重装开盘涨超80%，公司主动退市5年后重新上市首日不设涨跌幅限制。此后ST国重装高开高走，涨幅迅速扩大至134.9%，报7.8元/股，触发临时停牌。ST国重装短暂停牌后恢复交易，股价持续拉升至逾188%，最高触及9.59元，此后有所回落。
(image_address=""//n.sinaimg.cn/spider202068/748/w1080h1268/20200608/1227-iurnkps0800499.jpg"")
6月7日晚间，ST国重装发布公告称，公司于2020年3月13日收到上交所的《关于国机重型装备集团股份有限公司人民币普通股股票重新上市交易的通知》，上交所同意公司股票重新上市。公司股票将于6月8日在上海证券交易所重新上市。公司股票重新上市后在风险警示板交易。重新上市首日，公司A股股票简称为“ST国重装”，股票代码为601399，公司股票价格不设涨跌幅限制。这意味着，公司4.82万户股东将享受从股转中心跨越到沪市主板的巨大利好。
(image_address=""http://n.sinaimg.cn/finance/cece9e13/20200514/343233024.png"")
海量资讯、精准解读，尽在新浪财经APP
责任编辑：陈悠然 SF104",2020-06-08 10:26:58,新浪财经
