,title,content,pub_time,src
0,印度拟禁止华为、中兴参与5G网络建设 两家公司回应了,"【今日直播】
温冠麟：香港除了正股外的快速投资机会
掘金大消费|长江农业余昌（金麒麟分析师）：拥抱成长—长江农业2020年度中期投资策略
掘金大消费|长江李俐璇（金麒麟分析师）：破晓——长江纺服2020年度中期投资策略
掘金大科技|招商余俊（金麒麟分析师）：精选新基建四大赛道，在变革中寻求确定性投资机会
联海资产佟思雨：如何布局核心资产
华夏基金徐漫：免税行业新时代
新华基金周晓东：搞懂军工 投资不慌
易方达成曦、 兴业证券徐佳熹（金麒麟分析师）：详解科创板下的创新药投资机会
广发基金霍华明：上海金投资价值分析
华宝基金曾豪：如何抓住未来市场的投资大趋势？
天弘杨超、国泰君安王聪（金麒麟分析师）：电子行业的重构与创新
印度又挑事！拟禁止华为、中兴参与5G网络建设，两家公司刚刚这样回应……
印度又挑事！
8月12日，印度多家媒体报道，印度全国贸易商联合会（CAIT）当地时间11日致信印度通信和信息产业部长拉维•尚卡尔•普拉萨德，寻求禁止中国科技公司华为和中兴在印参与部署5G网络业务。对此，华为、中兴通讯方面12日均向证券时报·e公司表示“暂无回应”。前不久，印度刚以影响国家安全为由，禁用了59款中国应用。
印度或禁止华为、中兴参与5G建设
据印度-亚洲新闻社报道称，CAIT在信中声称，“应当禁止中国的华为和中兴公司参与印度5G网络部署。此外，在5G网络部署过程中，还应敦促任何（印度）公司都应禁用华为和中兴的技术和设备。”该贸易商团体还列举英国禁用华为设备的例子，并宣称有关举措将在印度发挥“至关重要的”作用。
(image_address=""//n.sinaimg.cn/sinakd2020812s/51/w516h335/20200812/c420-ixreehp2552290.png"")
目前，一个政府小组已经在研究是否该允许上述两家中国企业参与印度5G网络部署。且据知情人士透露，该小组建议不允许这两家中国公司参与部署。
此前，今年6月，代表约7000万家贸易商的CAIT还要求印度政府和地方各邦政府支持抵制中国商品，取消给予中国企业的政府合约。
据了解，目前华为在印度市场主要有两大合作伙伴，分别是巴蒂电信（Bharti Airtel）和Vodafone Idea，但是现在巴蒂电信公司已经选择与爱立信合作，这意味着跟华为的合作将减少。早在2019年，华为已经失去拉加斯坦邦地区的订单，一旦未来华为失去泰米尔纳德邦其余地区的订单，华为与巴蒂电信的合作将仅剩下两个服务区。
在失去这两大电信合作商的订单之后，华为已经将2020年印度营收目标下调50%，从原来的7亿美元到8亿美元之间，下调到3.5亿美元到5亿美元之间。
中兴通讯方面，据中兴通讯印度相关负责人此前介绍，“印度市场在中兴通讯的海外业务中占据着非常重要的地位，我们正持续对印度市场进行投资。”
8月12日，证券时报·e公司记者分别致电华为、中兴通讯询问印度拟禁止其参与5G网络建设事宜，公司方面均表示暂无回应。
针对印度此举，中国外交部发言人赵立坚6月30日回应称，中国政府一向要求中国企业在遵守国际规则和当地法律法规的基础上开展对外合作，印度政府有责任根据市场原则维护包括中国企业在内的国际投资者的合法权益。中印两国在务实领域的合作是互利共赢的，这种合作格局受到人为损害，实际上并不符合印方自己的利益。
华为加速“造芯”
海外市场拓展频繁遇阻、台积电断供芯片步入倒计时之际，华为自力更生的“造芯”行动正提速。
据悉，昨日（8月11日）华为消费者业务CEO余承东签发了一份《关于终端芯片业务部成立显示驱动产品领域的通知》，华为成立了专门部门做屏幕驱动芯片，进军屏幕行业，同时华为海思第一款OLED Driver已经在流片了。对于该消息，华为已向媒体证实，确实成立了该部门。
资料显示，虽然中国已成为屏幕生产、出口大国，但屏幕驱动芯片，却主要靠进口，2019年京东方采购屏幕驱动芯片金额超过60亿元，其中国产芯片占比不到5%。
显示屏驱动IC是一个关键的零部件，它就像人脑的中枢神经，掌管着全身的肢体行动以及大脑思维意识的运转。驱动IC的性能高低决定了显示屏画面播出的效果，尤其是在小间距LED显示屏的应用中，为了保证用户长时间用眼的舒适度，低亮高灰成为考验驱动IC性能的一个尤为主要的标准，使得驱动IC的要求严苛。
另外，12日早间，华为塔山计划在坊间刷屏。据流传的资料显示，这项计划的战略目标非常明确，即要突破包括EDA设计、材料、材料的生产制造、工艺、设计、半导体制造、芯片封测等在内的各个半导体产业关键环节，实现半导体技术的全面自主可控。
其中，第一批入围计划的公司有16家，包括上海微电子、沈阳芯源（芯源微）、盛美、北方华创、中微、沈阳拓荆、沈阳中科（中科仪）、成都南科、华海清科、北京中科信、上海凯世通（万业企业）、中科飞测、上海睿励、上海精测（精测电子）、科益虹源、中科晶源。
此外，华为还正研发激光雷达技术，以发力自动驾驶。据华为智能汽车解决方案BU总裁王军8月11日在第十二届汽车蓝皮书论坛上透露，华为在武汉成立团队研究激光雷达，短期目标是研发出100线、200线的激光雷达，降低成本，支撑智能汽车，实现更高等级的自动驾驶。
中信证券研报显示，2018年自动驾驶相关的激光雷达市场规模约为2.16亿美元，预计2024年可达42亿美元。
这些，用户都在看
股价5年涨了15倍！这家酒企有6000年酿造史，大诗人杜牧为其“代言”，今年是复兴战略启动元年……
“后悔跟董明珠赌，当时膨胀了！”、芯片遇阻但会继续、每天走10公里缓解焦虑……小米10周年，雷军深度拆解“终极三问”
又一内幕交易，被罚没196万！提前知悉“老朋友”新城控股前董事长被查，这夫妻两账户突击卖出……
“疯狂的石头”让钢厂利润薄如纸，再涨又要大面积亏损？澳大利亚赚嗨了
7倍疫苗股的背后：期货大佬获利丰厚，姐弟两人左右手互倒
(image_address=""//n.sinaimg.cn/sinakd2020812s/78/w1080h598/20200812/0f6c-ixreehn9347262.png"")
]article_adlist-->
(image_address=""//n.sinaimg.cn/sinakd2020812s/88/w1080h608/20200812/751b-ixreehp2552003.jpg"")
]article_adlist-->
(image_address=""//n.sinaimg.cn/finance/cece9e13/20200514/343233024.png"")
海量资讯、精准解读，尽在新浪财经APP
责任编辑：陈志杰",2020-08-12 20:59:56,新浪财经
1,创业板上市委：康平科技等3家企业首发过会,"8月12日消息，深交所发布创业板上市委2020年第15次审议会议结果公告，研奥电气股份有限公司、杭州山科智能科技股份有限公司、康平科技（苏州）股份有限公司首发申请均获通过。此外，华自科技股份有限公司向不特定对象发行可转债也获通过。
(image_address=""//n.sinaimg.cn/finance/cece9e13/20200514/343233024.png"")
海量资讯、精准解读，尽在新浪财经APP
责任编辑：张熠",2020-08-12 20:53:14,新浪财经
2,冻结股权 舍得酒业实际控制人又被控股股东告了,"原标题：冻结股权，舍得酒业实际控制人又被控股股东告了
8月12日晚，舍得酒业（600702.SH）发布公告，称其间接控股股东天洋控股，因为拖欠沱牌舍得集团的资金，所持沱牌舍得集团股权被再次冻结。在此之前，天洋控股刚刚“搞定”了被成功（中国）大广场有限公司（下称 成功集团）冻结的沱牌舍得集团股权。
天洋控股创立于1993年，涉及文化产业、消费品、科技产业、金融投资和其他产业的大型控股集团。沱牌舍得集团为舍得酒业第一大股东，持股29.85%，而天洋控股2015年以38亿收购沱牌舍得集团，目前持有沱牌舍得集团70%股权。
天洋控股所持沱牌舍得集团的股权第一次被冻结是在2019年底，源自2015年天洋控股和成功集团的一笔交易，后者以20.8亿元的价格向前者转让位于三河市燕郊的“成功中国大广场休闲娱乐项目”。由于双方在尾款上未能协商一致，2019年底，成功集团向香港国际仲裁中心提起仲裁，北京市第三中级人民法院裁定保全天洋控股持有的沱牌舍得集团 70%股权等资产，而天洋控股也以超额保全为由提起执行异议。
8月11日，天洋控股已经收到了北京市第三中级人民法院的通知，从2020年8月4日起，解除对其所持沱牌舍得集团70%股权的冻结。
不过上述股权刚刚解冻，又被四川省遂宁市中级人民法院冻结。
公告显示，由于天洋控股、三河天洋城房地产开发有限公司因业务需要未能及时归还沱牌舍得集团资金，沱牌舍得集团向四川省遂宁市中级人民法院提出财产保全的申请，2020年8月11日，四川省遂宁市中级人民法院裁定，对天洋控股持有的沱牌舍得集团70%的股权予以冻结，冻结金额以3.3亿元为限，冻结期限为2020年8月10日至2023年8月9日。
而这也不是双方第一次发生资金纠葛。2019年11月4日，沱牌舍得集团就曾起诉天洋控股及相关人员，并申请遂宁市中级人民法院对其持有的沱牌舍得集团70%股权和相关人员财产采取三次诉前保全措施，舍得酒业2019年12月3日发布的公告中，称涉诉双方已经达成和解共识，天洋控股或其关联方需在9个月内，分期偿还沱牌舍得集团欠款及利息。
当天舍得酒业向第一财经记者表示，上述沱牌舍得集团股权冻结事项，系公司直接控股股东与间接控股股东之间欠款纠纷诉讼所引致的司法保全措施，与公司日常经营无关，目前舍得酒业生产经营活动一切正常。
有法律界人士认为，间接控股股东的股权被冻结，一般不会对上市公司的生产经营产生实质性影响，直接控股股东发起对间接控股股东股权冻结保全，也不会对实际控制权构成实质性影响。
不过值得注意的是，中国执行信息公开网显示，近日天洋控股新增一条被执行人信息，执行标的约26.65亿，执行法院为北京市第二中级人民法院，案号为（2020）京02执764号，不过被执行事由并未公布。
对此，香颂资本执行董事沈萌告诉第一财经记者，之前舍得集团与大股东之间就曾出现过资金纠纷，此次资产保全也不排除是为了保住舍得集团，不会被大股东的其他业务拖垮。
(image_address=""//n.sinaimg.cn/finance/cece9e13/20200514/343233024.png"")
海量资讯、精准解读，尽在新浪财经APP
责任编辑：陈志杰",2020-08-12 20:49:21,新浪财经
