,title,content,pub_time,src
0,全聚德取消门店服务费 菜价整体下调10％-15％,"原标题：全聚德取消门店服务费，菜价整体下调10%到15%
记者 张钦
7月26日，烤鸭老字号全聚德迎来156岁生日，并宣布了一系列新举措。
降低消费门槛是其中最引人注目的一条。全聚德集团宣布，所有门店对菜品和价格进行统一调整，菜价整体下调10%到15%。烤鸭会员价由原来的258元调整至238元，所有门店大厅不再收取服务费。过去消费者到全聚德就餐，需要支付10%到15%的服务费。
此外，公司调整了北京门店的统一菜单，集团技术研发室厨师李鹏发布47道新菜，除传统菜品外，全聚德通过改良和创新，重新设计了消失已久的鸭汤醋椒鱼、清炸鸭胗肝等17道菜，还增加了鲜椒澳洲小牛肉、奶香金瓜香芋煲配法包等以年轻人为目标受众的15款菜品，及芥辣鸭脯等15道原创菜。这47款新菜，五成以上设有会员价，消费者可通过储值或支付20元工本费的方式升级为会员。 
为了提升烤鸭的口味和品质，今后全聚德将全面统一烤鸭价格和制作工艺，选派优秀烤鸭师上炉掌杆。 
这一些列举措，可以被视为全聚德自2019年12月换帅以来施行的自救策略之一。
今年3月，全聚德新任总经理周延龙曾对界面新闻表示，公司今年会做出很多调整，特别是在产品体系和年轻客群就餐体验两个方面。包括推出更多菜品，并定期更新产品，采取一些措施走亲民路线，在人均消费100-150元的集中区域发力等。
加入全聚德之前，周延龙曾在北京东来顺集团有限责任公司担任党委书记、董事、总经理，在他任期内，为吸引并留住年轻客群，东来顺推出了火锅品牌“涮局”，该品牌也成为东来顺往门店小型化方向发展的一项试探。面对“品牌老化”这个老字号们的共同课题，全聚德希望借这位新掌门之手重拾消费者、尤其是年轻消费者的青睐。
自2013年后，全聚德便走上了下坡路，最新财报显示，2019年全聚德业绩再降四成，创15年来新低。
全聚德自己也承认，近三年来，面对餐饮市场需求和消费结构快速变化带来的挑战，90后、00后消费群体的兴起，公司由于产品陈旧、创新不足、调整缓慢等问题，和年轻人的消费认知拉开了距离。业绩之所以持续下滑，从内部看，是产品和服务与年轻消费群体脱节；从外部看，正餐市场客源分流明显，全聚德经营模式和产品类型单一，行业扩展不足，导致了客流呈现连续下降趋势。
2019年全聚德旗下餐饮门店总数较2018年的121家减少了3家，年报中显示餐饮业务全聚德全年接待宾客658.92万人次，较2018年减少了110万余人次，较2017年减少了逾145万人次。
(image_address=""//n.sinaimg.cn/finance/cece9e13/20200514/343233024.png"")
海量资讯、精准解读，尽在新浪财经APP
责任编辑：张熠",2020-07-24 19:47:39,新浪财经
1,证监会同意4家企业创业板IPO注册,"新浪财经讯 7月24日消息，近日，证监会按法定程序同意以下企业创业板首次公开发行股票注册：北京锋尚世纪文化传媒股份有限公司、康泰医学系统（秦皇岛）股份有限公司、杨凌美畅新材料股份有限公司、安徽蓝盾光电子股份有限公司。上述企业及其承销商将分别与深圳证券交易所协商确定发行日程，并陆续刊登招股文件。
(image_address=""//n.sinaimg.cn/finance/cece9e13/20200514/343233024.png"")
海量资讯、精准解读，尽在新浪财经APP
责任编辑：逯文云",2020-07-24 19:40:42,新浪财经
2,珠海港：正在筹划重大事项 7月27日起停牌,"新浪财经讯 7月24日消息，珠海港公告，公司正在筹划重大事项，经公司向深圳证券交易所申请，公司股票自2020年7月27日开市起停牌，预计停牌时间不超过5个交易日。
(image_address=""//n.sinaimg.cn/finance/cece9e13/20200514/343233024.png"")
海量资讯、精准解读，尽在新浪财经APP
责任编辑：逯文云",2020-07-24 19:39:48,新浪财经
3,珠海港：正在筹划重大事项 7月27日开市起停牌,"新浪财经讯 7月24日消息，珠海港晚间公告，公司正在筹划重大事项，经公司向深圳证券交易所申请，公司股票自2020年7月27日开市起停牌，预计停牌时间不超过5个交易日。
(image_address=""//n.sinaimg.cn/finance/cece9e13/20200514/343233024.png"")
海量资讯、精准解读，尽在新浪财经APP
责任编辑：张熠",2020-07-24 19:39:12,新浪财经
4,阳谷华泰：上半年净利润同比下降72%,"新浪财经讯 7月24日消息，阳谷华泰晚间公告，上半年公司实现营业总收入8.25亿元，较上年同期下降18.20%；实现净利润2638.77万元，较上年同期下降71.69%。报告期内，受整体市场环境及疫情影响，公司部分产品销量和价格与去年同期相比有所下降。
(image_address=""//n.sinaimg.cn/finance/cece9e13/20200514/343233024.png"")
海量资讯、精准解读，尽在新浪财经APP
责任编辑：张熠",2020-07-24 19:38:04,新浪财经
5,G60九城市30家企业登陆科创板 储备库企业280家,"记者7月24日从G60科创走廊联席办获悉，目前，科创板累计受理G60九城市企业78家，其中，30家已成功上市。
根据长三角G60科创走廊与上交所签订的战略合作协议，G60联席办搭建了九城市拟上科创板企业储备库，目前储备企业已达280家。
依托上交所资本市场服务G6O科创走廊基地，G60联席办强化科创板政策宣讲和精准辅导，建立企业服务联动机制，助推九城市更多“硬科技”上市。
未来，随着G60科创走廊产业基金的设立以及科创板上市联动机制的完善，G60九城市创新企业的融资渠道将进一步丰富。
(image_address=""//n.sinaimg.cn/finance/cece9e13/20200514/343233024.png"")
海量资讯、精准解读，尽在新浪财经APP
责任编辑：逯文云",2020-07-24 19:32:15,新浪财经
6,诚志股份：上半年净利润亏损2.06亿元 同比转亏,"新浪财经讯 7月24日消息，诚志股份发布2020年半年度报告，报告期公司实现营业收入39.8亿元，同比增长46.7%。实现归属于母公司所有者的净利润亏损2.06亿元，同比转亏。
(image_address=""//n.sinaimg.cn/finance/cece9e13/20200514/343233024.png"")
海量资讯、精准解读，尽在新浪财经APP
责任编辑：张熠",2020-07-24 19:30:56,新浪财经
7,股价一周暴跌31%：共达电声重组突然告吹 遭投诉后收关注函,"原标题：股价一周暴跌31%！共达电声重组突然告吹 遭投诉后收关注函 
记者 帅可聪 陈锋 北京报道
历时20个月，共达电声一波三折的重组突然告吹。7月20日早间，共达电声公告称，收到间接控股股东万魔声学科技有限公司（下称“万魔声学”）的书面通知，决定终止本次重大资产重组事项。受此影响，共达电声股价连续下挫，一周累计暴跌逾31%。
共达电声公告提到，终止原因包括万魔声学拟重新评估其他路径登陆资本市场。万魔声学是否意欲登陆科创板？《华夏时报》记者就此向万魔声学相关人士求证，回应称“看后续公告”。
在半年多前，共达电声重组事项遭到证监会否决，但公司此后仍决定继续推进。如今骤然宣布终止，令人嘘唏的同时，也引发不少投资者质疑。
7月24日，在接到投资者投诉后，深交所向共达电声下发关注函，要求公司补充说明终止重组具体原因、终止重组是否违反前期协议约定、终止对上市公司具体影响等问题。
股价暴跌三成
共达电声重组事项已酝酿长达20个月，推进过程可谓一波三折。
2017年12月，万魔声学通过全资子公司潍坊爱声声学科技有限公司收购了共达电声原控股股东潍坊高科电子有限公司持有的5498万股（占共达电声总股本的15.27%），成为共达电声的间接控股股东。
2018年11月15日，共达电声首次披露吸收合并万魔声学暨关联交易预案及相关文件。根据该预案，共达电声拟通过向万魔声学全体股东非公开发行股份的方式收购万魔声学100%股权，从而对万魔声学实施吸收合并。交易完成后，万魔声学将注销法人资格，共达电声作为存续公司，将承接万魔声学的全部资产、债权、债务、业务、人员及相关权益，万魔声学的全体股东将成为共达电声的股东。
重组期间，共达电声两次收到深交所问询函，公司随后予以回复。2019年12月12日，经证监会并购重组审核委员会审核，共达电声重组方案被否。未获通过的原因主要是，并购重组委认为：标的资产近三年实际控制人未发生变更的披露不充分、标的资产销售和利润来源对关联方依赖度较高，不符合有关规定。
不过，尽管遭证监会否决，共达电声此后仍然决定继续推进本次重大资产重组事项。直至2020年6月18日，共达电声还披露了重组进展公告。当时公告还称，“本次交易的各项工作进展顺利，公司及相关各方正在开展本次重大资产重组的审计、评估工作以及审批程序等各项相关工作。”
出人意料的是，短短一个月后，共达电声重组戛然而止。7月20日早间，共达电声突然公告称，公司于7月18日收到间接控股股东万魔声学决定终止本次重大资产重组事项的书面通知，公司拟终止本次重大资产重组事项。
受此影响，共达电声股价应声暴跌。7月20日、21日连续跌停，7月22日大跌6.38%，7月23日再度大跌9.91，7月24日尽管微涨0.2%，但一周累计下跌仍达31.5%。公开资料显示，截至7月20日，共达电声股东户数为52354户。
拟其他路径上市
天眼查资料显示，共达电声成立于2001年，是一家专业的电声元器件及电声组件制造商、服务商和电声技术整体解决方案提供商，是国家级高新技术企业、中国电子元件百强企业。
成立于2013年的万魔声学主要业务为耳机及关键组件的研发、设计、销售以及相关技术知识产权的授权服务。公开资料显示，其创始人谢冠宏在富士康工作10年，曾是富士康最年轻的事业群总经理。2016年，知名艺人周杰伦还曾宣布以股东的身份加盟万魔。
不难看出，共达电声与万魔声学同属于声学领域。然而，重组推进近两年，为何突然终止？共达电声在公告中披露：“受新冠肺炎的影响，虽然标的公司（万魔声学）有序复工复产，积极经营，业绩持续增长，但增幅仍不及预期，完成2020年的业绩承诺存在不确定性。与此同时，鉴于本次重组历时较长，国内证券市场环境和政策已较本次交易筹划之初发生较大变化，标的公司拟重新评估其他路径登陆资本市场。”
受疫情影响，今年上半年各行各业都不同程度受到影响。根据此前发布的重组草案，万魔声学曾作出业绩承诺，若吸收合并于2020年完成，则2020年至2022年度的扣非归母净利润分别不低于2.2亿元、2.85亿元和3.57亿元。
更值得关注的则是万魔声学“拟重新评估其他路径登陆资本市场”。一年前，科创板横空出世，行情已是如火如荼。《华夏时报》记者就“万魔是否欲上科创板”向万魔声学相关人士寻求置评，这位今年1月申请辞去共达电声董事一职的人士回应称，“这个要看后续公告。”
共达电声前途未卜
对于共达电声而言，在重组告吹之后，无疑将面临更严峻的挑战。
共达电声2012年2月在深圳中小企业板上市，但上市后业绩一直不温不火，甚至不如上市之前。同花顺iFind数据显示，上市前的2010、2011年，共达电声扣非归母净利润均超4000万元。但在上市后的2012年至2016年，分别为3659万、-615万、1625万、805万、1018万。2017年，共达电声扣非归母净利润更是巨亏1.8亿元。
2017年末，万魔声学间接控股共达电声后，共达电声业绩很快有所改观。2018年扣非归母净利润亏损大幅缩减至2025万，2019年更是盈利3173万元。
如何增强自身的竞争力是摆在共达电声面前最大的难题。公司近期在深交所互动平台上也表示，重组的终止并不是公司发展的终止，自万魔声学间接控股公司以来，公司高效解决了高比例质押、缺乏流动性、经营困难等问题，在转换经营思路、管理团队建设、新产品研发和市场开拓等方面都取得了明显的进步。下一步，公司将深耕先进传感器、换能器、微机电等半导体设计封测、零件及模组的制造，全力支持智能手机、智能穿戴、智能汽车、智能健康、智能家居等领域的发展，抓住行业发展机遇实现自身的快速发展，使公司成为行业最具竞争力的企业之一。
值得注意的是，因重组告吹导致共达电声股价连续暴跌，已引发一些投资者心生不满。《华夏时报》记者注意到，有投资者在互动平台上质问上市公司“草率终止是否对投资者负责”“投资者的损失谁来负责”“不怕引发集体诉讼吗”。
共达电声在一则回复中表示，“本次重组，已历时近两年，国内证券市场环境和政策已经发生较大变化，而重组双方都因受限于重组事项无法进行其他的重大投融资活动，已经严重影响了各自的发展。在不得已的情况下终止重组，也是为抓住机会、独立发展创造条件。独立发展的上市公司，可以更好地聚焦主业，深耕专业领域，走智能声学厚积博发的道路，相信公司会越来越好，这也是对投资者最大的负责。”
而不止于此，共达电声重组终止引发的风波还在继续。7月24日，深交所向共达电声下发关注函，要求公司补充说明终止重组具体原因、终止重组是否违反前期协议约定、终止对上市公司具体影响等问题。关注函提到，“我所接到投资者投诉，称其拨打你公司咨询电话，工作人员所述事项与公司公告不符。”
(image_address=""//n.sinaimg.cn/finance/cece9e13/20200514/343233024.png"")
海量资讯、精准解读，尽在新浪财经APP",2020-07-24 19:28:31,新浪财经
8,博晖创新：狂犬病疫苗产品不属于控股孙公司知识产权,"新浪财经讯 7月24日消息，博晖创新晚间公告，公司控股孙公司中科生物与柏奥特克联合申报冻干人用狂犬病疫苗（无血清Vero细胞）产品，目前已取得国家药监局颁布的《药物临床试验批准通知书》。根据合同约定，该产品的知识产权由柏奥特克持有；且产品上市后10年内，中科生物只获得该产品每年度生产经营税后10%净利润，利益分配占比较小。同时公司持有河北大安制药有限公司40.14%股权，河北大安持有中科生物72%股权，若该产品成功上市，归属于上市公司的利润也较小。上述产品临床试验批准通知书的取得不会对公司近期业绩产生重大影响。
(image_address=""//n.sinaimg.cn/finance/cece9e13/20200514/343233024.png"")
海量资讯、精准解读，尽在新浪财经APP
责任编辑：张熠",2020-07-24 19:27:57,新浪财经
9,木林森：拟以3000万元增资至芯半导体 加大深紫外领域布局,"新浪财经讯 7月24日消息，木林森晚间公告，拟出资3000万元对至芯半导体进行增资。本轮融资结束后，其注册资本将由700万元变更为1000万元，公司认缴注册资本100万元，持股10%。至芯半导体主营业务为深紫外半导体芯片，目前公司在深紫外领域逐步加大拓展，已积极开展深紫外智能杀菌机器人相关业务合作与布局。
(image_address=""//n.sinaimg.cn/finance/cece9e13/20200514/343233024.png"")
海量资讯、精准解读，尽在新浪财经APP
责任编辑：张熠",2020-07-24 19:25:54,新浪财经
10,士兰微：大基金将成公司持股5%以上股东,"新浪财经讯 7月24日消息，士兰微晚间公告，公司拟通过发行股份方式购买大基金持有的集华投资19.51%的股权以及士兰集昕20.38%的股权，本次交易完成后，大基金将成为公司持股5%以上的股东。此外，公司拟向不超过35名特定投资者定增募集配套资金不超过13亿元，用于8英寸集成电路芯片生产线二期项目等。
(image_address=""//n.sinaimg.cn/finance/cece9e13/20200514/343233024.png"")
海量资讯、精准解读，尽在新浪财经APP
责任编辑：张熠",2020-07-24 19:20:46,新浪财经
11,利好一分钟见光死、半年亏掉两年利润 金逸影视三年遇坎,"(image_address=""//image.sinajs.cn/newchart/new_daily/n/sz002905.gif"")
热点栏目
自选股
数据中心
行情中心
资金流向
模拟交易
客户端
利好一分钟见光死，半年亏掉两年利润，金逸影视三年遇坎
来源：富凯财经
富凯摘要
三年解禁期将至，股价距离20.98元的发行价近乎腰斩，等待减持的股东恐怕焦虑不已。
作者|股伯通
排版|十    一
7月24日，深圳金逸影城（中心店）做完复工准备恢复开放，来自本地宝的一份影单包括《捉妖记3D》、《美人鱼3D》、《十二生肖》、《北京爱情故事》、《寻梦环游记3D》、《何以为家》、《战狼2》、《哪吒之魔童降世》、《夏洛特烦恼》、《白蛇缘起》、《一条狗的使命1、2》、《超时空同居》、《大鱼海棠》、《阿凡提之奇缘历险》、《误杀》、《当幸福来敲门》、《疯狂动物城》、《超能陆战队》。
可以看出，其中并没有足够多有吸引力的新片上映。《第一次的离别》出品人吴飞跃此前表示，如果没有新片、观众稀少，复业后的影院恐怕将面临更大的经营压力。
金逸影视的股价走势正是鲜明的写照。7月24日，其股价保持连续下跌的态势，以大跌4.42%收盘。
利好一分钟见光死
7月16日，国家电影局下发《关于在卫生事件防控常态化条件下有序推进电影院恢复开放的通知》，表示低风险地区在电影院各项防控措施有效落实到位的前提下，可于7月20日有序恢复开放营业。中高风险地区暂不开放营业。
受此利好消息带动，金逸影视盘中大涨近8%之后，股价（复权价）创下13个月来的新高，不过大好局面连1分钟也没能维持住便迅速跳水，最终以大跌8%收场。
(image_address=""//n.sinaimg.cn/finance/crawl/779/w550h229/20200724/558b-iwtqvym0172320.png"")
据《中国新闻周刊》报道，电影院属多头管理，国家电影局同意复工后，还需所在地的有关部门同意，多数影院还难以在7月20日真正复工。
此外，中国电影发行放映协会要求，未戴口罩和体温37.3度以上者不得进入；实行交叉隔座售票，保证陌生观众间距1米以上；每场上座率不得超过30%；电影放映场所原则上不售卖零食和饮料，影厅内原则上禁止饮食。
如此一来，除了上座率影响影院的收入，作为重要利润来源的卖品收入也会被大大压缩，但消毒杀菌产生的额外支出却是刚性的，一些影院由于商业考量，可能选择暂不开业。数据显示，金逸影视2019年电影放映收入、广告服务收入和卖品收入占比分别为79.84%、9.26%和8.71%，但毛利率分别为7.99%、98.88%和58.86%。万达电影2019年卖品毛利率更是高达63.33%。
从根本上来讲，影院复业的最大困难是优质新片的缺乏。吴飞跃表示，从出品方角度来看，由于担心巨大的票房风险，投资巨大的商业大片会推迟上映，由于没有足够多有吸引力的新片上映，观影热情则很难被调动，如此一来便容易陷入恶性循环。
今年3月22日，新疆、内蒙古、四川、福建等地的523家影院曾短暂复工，但总票房仅为4.14万元，惨淡之状目不忍睹。
半年亏掉两年利润
7月14日晚间，金逸影视发布公告称，预计上半年净利润亏损3.1亿元-3.9亿元，上年同期公司盈利5519.06万元。从1月24日起，公司旗下近200家直营影院及广州金逸珠江电影院线有限公司旗下200多家加盟影院全部暂停营业，截至报告期末仍未恢复营业，直接影响了公司的经营收入。
(image_address=""//n.sinaimg.cn/finance/crawl/16/w550h266/20200724/50c2-iwtqvym0172343.jpg"")
这无疑让金逸影视的生存状况雪上加霜。自从2017年10月上市以来，其净利润呈现连续大跳水状态，2018年实现净利润1.58亿元，同比下跌25.29%，2019年实现净利润1.07亿元，同比下跌32.54%，2020年上半年预计实现亏损超过3.1亿元，同比下跌超过661.69%。可以看出，过去两年的净利润总和都不足以弥补今年上半年的亏损规模。
中国电影家协会发布的《电影院生存状况调研报告》显示，受访的187家影院今年第一季度每家影院平均收入为34.45万元，平均运营成本为117.9万元，从2月起开始入不敷出。截至5月底，47%的影院现金流告急，42%的影院可能面临淘汰。
即便如此，金逸影视今年还计划新增影城25家。2019年已签署14个影城项目合作意向书或房屋租赁合同，同时正在跟踪和商谈的影院项目近数十个。
观影习惯或将巨变
2010-2019年，中国观影人次从2.5亿提高至17.3亿，但观影人次自2017年以来增长幅度不断下降。2019年，银幕数从2018年的60079块增长到69787块，同比增长16.2%；但观影人次仅从2018年的17.18亿增长到17.27亿，增幅仅为0.6%。
2019年春节档的观影人次为1.3亿，较2018年春节档减少1500万人次，减少10%；此外在票价上，2019年春节档的平均票价为44.8元，同比大幅增长12.8%。
业内人士指出，在观影人次趋于稳定的当下，依靠扩张电影院和银幕数已经带不动观影人次的增长，只会加剧影院上座率差，营收困难。
(image_address=""//n.sinaimg.cn/finance/crawl/109/w550h359/20200526/3e52-itzixrt5745469.jpg"")
另一个对院线造成冲击的重大变化正在出现。
云合数据显示，2020年上半年全网上线电影391部，其中爱奇艺上线176部，优酷114部，腾讯视频86部，PPTV6部，搜狐视频6部，西瓜视频3部。其中有37部票房分账破千万，创网络电影历史之最，占比高达9.5%。
可见，疫情背景下院线停摆，网络电影在经历了减量提质的“U型”转弯之后，正面临着新机遇。艾媒咨询分析师认为，随着网络大电影投资的增加、制作团队的不断壮大、不少知名演员的加入，未来网络大电影质量也会不断提高。
免责声明：自媒体综合提供的内容均源自自媒体，版权归原作者所有，转载请联系原作者并获许可。文章观点仅代表作者本人，不代表新浪立场。若内容涉及投资建议，仅供参考勿作为投资依据。投资有风险，入市需谨慎。
(image_address=""//n.sinaimg.cn/finance/cece9e13/20200514/343233024.png"")
海量资讯、精准解读，尽在新浪财经APP
责任编辑：陈志杰",2020-07-24 19:19:58,新浪财经
12,园城黄金：标的公司业绩未达预期 终止重大资产重组事项,"新浪财经讯 7月24日消息，园城黄金晚间公告，受国内疫情的影响，本次重组主要标的津彤源的经营业绩未达到预期，同时，经检测，津彤源污泥处置车间及污泥库等建筑物存在工程质量问题，公司决定终止本次重大资产重组事项。
(image_address=""//n.sinaimg.cn/finance/cece9e13/20200514/343233024.png"")
海量资讯、精准解读，尽在新浪财经APP
责任编辑：张熠",2020-07-24 19:06:50,新浪财经
13,天山股份：拟以发行股份等方式收购中国建材水泥板块资产,"新浪财经讯 7月24日消息，天山股份公告，公司拟以发行股份或发行股份及支付现金购买资产的方式收购中国建材水泥板块资产，正在论证的标的资产包括中联水泥、南方水泥、北方水泥、西南水泥、中材水泥的股权以及中建材投资下属水泥资产，股票停牌。
(image_address=""//n.sinaimg.cn/finance/cece9e13/20200514/343233024.png"")
海量资讯、精准解读，尽在新浪财经APP
责任编辑：逯文云",2020-07-24 19:06:00,新浪财经
