,title,content,pub_time,src
11,跟着国家队炒股：汇金证金种草保险 社保中意长春高新,"原标题：跟着“国家队”炒股：汇金证金“种草”保险，社保中意长春高新
随着上市公司2019年报逐渐披露，“国家队”及社保组合、养老基金组合投资情况也逐渐浮出水面。
统计显示，“国家队”中的“中央汇金系”偏爱保险，重仓了中国平安（601318.SH）、新华保险（601336.SH）；证金公司的第一持仓亦是中国平安，并且通过“通道”持有新华保险。
另外，第一财经统计已经披露的2019年年报，社保基金共重仓持有191家上市公司的股票，重复计算来看，共持有265只股票。具体来看，最多有5只社保基金组合持有长春高新（000661.SZ），后者也成为社保基金最“中意”的个股。
“国家队”扫货保险
统计显示，在国家队中，“汇金系”持仓数量及持仓市值最多，分别为17.20亿股、820.20亿元；其次为证金公司，其持仓数量为16.34亿股，持仓市值为694.56亿元。
目前已披露的2019年年报显示，中央汇金资产公司（下称“汇金资产”）持有流通股市值排在前五的依次是中国平安、中国银行（601988.SH）、万科A（000002.SZ）、工商银行（601398.SH）和中信证券（600030.SH）。
进一步来看，持有流通股比例在4%以上的共有9只，其中持有股份占中国平安流通股总数的4.47%。除了重仓中国平安，汇金资产亦持股中国人寿（601628.SH）、新华保险、中国太保（601601.SH），分别持有11971.99万股、2824.92万股、11074.12万股，俨然有“扫货”保险之势。
在汇金资产已重仓新华保险的情况下，中央汇金投资公司（下称“汇金投资”）也重仓了新华保险，持股97753.05万股，占新华保险流通股比例高达46.87%。
在新华保险的前十大股东中，除了汇金投资，还有证金、证金的“通道”大成中证金融资产管理计划和华夏中证资产管理计划，以及社保基金四零三组合。
同样，证金的第一重仓股也为中国平安，除了平安，中国银行和招商银行（600036.SH）分别为第二、第三大重仓股。证金持有平安的流通股比例也达到5.05%，持有中国银行和招商银行的流通股比例则分别为4.08%和3.66%。
值得一提的是， 证金在建设银行中的流通股市值达到158.3亿元，占到流通股比例22.82%。
进一步来看，2020年第一季度，“国家队”中的证金、汇金分别持有9只、3只个股，其中汇金持仓前三是金科股份（000656.SZ）、鲁西化工（000830.SZ）和华兰生物（002007.SZ）；证金持有3只个股分别是华兰生物、昆药集团（600442.SH）和金山股份（600396.SH）。
社保、养老金“中意”股曝光
目前已披露的数据显示，社保基金共重仓持有191家上市公司的股票，其中5只社保基金合计持有长春高新，被4只社保组合持有的上市公司有3家，分别是国药股份（600511.SH）、中国重汽（000951.SZ）和杰瑞股份（002353.SZ）。
从持仓市值来看，5只社保基金合计持有51.23亿元市值的长春高新，其中社保基金一一八组合更是持有17.7亿元市值；3只社保基金合计持有35.7亿元市值的万华化学（600309.SH），其中社保基金一一一组合持有近13亿市值。
第一财经进一步统计发现，被3只及以上社保基金组合持有的股票有艾华集团（603989.SH）、华鲁恒升（600426.SH）、冀东水泥（000401.SZ）、杰克股份（603337.SH）、金风科技（002202.SZ）、凯莱英（002821.SZ）、克来机电（603960.SH）、美亚光电（002690.SZ）、双汇发展（000895.SZ）、万华化学（600309.SH）、我武生物（300357.SZ）、中炬高新（600872.SH）以及中科创达（300496.SZ）。
从单个社保基金组合对个股流通股占比来看，占流通股市值比例最高的是中宠股份（002891.SZ），截至去年年末社保基金五零二组合持有比例为6.69%，社保一零三组合持有国药股份流通股的比例是6.48%，紧随其后。
5只社保基金合计持有长春高新流通股比例为6.74%；3只社保基金组合持有杰克股份流通股的比例更是达到12.1%。3只社保基金组合合计持有我武生物流通股比例为7.86%。
与上期持仓相比，从流通股占比来看，社保基金重点加仓了菲利华（300395.SZ）、克来机电和鹏鼎控股（002938.SZ）。减持了乐普医疗（300003.SZ）、北新建材（000786.SZ）以及凯莱英。进一步来看，2只社保组合减仓了凯莱英，另1只则进行了加仓。
2月14日再融资新规刚落地，凯莱英就走在最前方，推出首份新版再融资预案。凯莱英公告称，拟非公开发行股票不超过1870万股，发行价格123.56元/股，募资总额不超过23.11亿元，而发行对象只有高瓴资本一家。修改后的预案显示定价由9折调整为8折、锁定期缩短至18个月。
养老金方面，截至目前，已披露的2019年年报显示，养老金重仓了43家上市公司，按照持仓市值计算，排名前五的分别是复星医药（600196.SH）、吉祥航空（603885.SH）、洽洽食品（002557.SZ）、中国巨石（600176.SH）和银泰黄金（000975.SZ）。截至去年年末，分别持有上市公司市值7.08亿、4.35亿、3.15亿、2.52亿和2.30亿。
进一步来看，2只养老金组合同时持有九阳股份（002242.SZ），其中养老保险基金一二零五组合持有288.92万股、八零八组合持有275.01万股。
从持股占流通股的比例来看，养老金组合在中孚信息（300659.SZ）、景旺电子（603228.SH）和地素时尚（603587.SH）中持仓比例较高，分别是3.77%、3.03%和2.13%。
责任编辑：陈志杰",2020-04-14 17:23:18,新浪财经
12,七匹狼：预计一季度亏损3700万元-4800万元,"新浪财经讯 4月14日消息，七匹狼晚间发布业绩预告，预计一季度净利为亏损3700万元-4800万元，上年同期盈利9165万元。一季度，受新冠肺炎疫情影响，全国各地实施严格的疫情防控措施，商场、购物中心等场所开店时间普遍延后，消费终端停滞，公司及上下游产业链企业复工延迟，导致营业收入大幅减少，实现利润相应减少。同时，由于公司持有的交易性金融资产公允价值变动，导致利润减少。
责任编辑：陈志杰",2020-04-14 17:17:51,新浪财经
13,晨鸣纸业预计一季度盈利超两亿 同比大增423%-449%,"原标题：晨鸣纸业预计一季度盈利超两亿 同比大增423%~449%
来源：每日经济新闻
记者 彭斐  
虽然湖北基地因新冠肺炎疫情停产，但纸业巨头晨鸣纸业（000488，SZ）一季度的表现，却有些让人意外。
4月14日，晨鸣纸业发布的2020年第一季度业绩预告显示，预计一季度实现归属于上市公司股东的净利润2~2.1亿元，相较于去年同期的盈利3822万元，同比上升423%~449%。
(image_address=""//n.sinaimg.cn/spider2020414/212/w777h235/20200414/bc72-isehnnk2900376.png"")图片来源：晨鸣纸业一季度业绩预告 截图
对于一季度的业绩表现，晨鸣纸业提到，报告期内，公司全力以赴做好疫情防控，除黄冈晨鸣、武汉晨鸣停产抗疫外，公司其他主要生产基地全部正常生产，产量同比增长。但疫情期间物流运输受阻，一定程度上影响了效益的发挥。
《每日经济新闻》记者注意到，在湖北的布局，对于晨鸣纸业有着举足轻重的地位。
晨鸣纸业2019年半年报显示，随着黄冈晨鸣和寿光美伦化学木浆项目的投产，公司目前拥有湛江、黄冈、寿光三大浆厂，木浆产能国大，年产能超过420万吨，是全国首家木浆自产自足、浆纸产能完全匹配的浆纸一体化企业。
此前，晨鸣纸业在互动平台上表示，虽然疫情暴发以来黄冈晨鸣一直处于停机状态，可由于黄冈晨鸣尚处在试生产阶段，对公司整体影响有限。
从目前来看，影响晨鸣纸业一季度财务的因素，更多源于其“浆纸一体化”战略。晨鸣纸业一季度业绩预告显示，报告期内，公司按照既定的经营策略稳步经营，浆纸一体化优势逐步显现，机制纸价格同比提高，营业收入同比增长，毛利率水平同比上升；同时，高毛利率产品销售比重提升，毛利相应增加，盈利能力同比增强。
在3月28日发布的2019年财报中，晨鸣纸业称，当前，国内木浆产能为1100多万吨，仅公司纸浆产能就超过420万吨，浆纸一体化优势明显，是目前国内唯一实现造纸与纸浆产能相平衡的造纸企业。
不过，晨鸣纸业今年一季度业绩的同比大幅提升，与造纸行业的整体表现也有关联。
2019年一季度，晨鸣纸业当期实现净利润3822万元。在2019年财报中，晨鸣纸业做出这样的解释：受经济下行、市场需求减少、原材料供给收紧且价格升高等多重因素影响，造纸行业出现了经济效益下滑，生产和运行困难增多、纸价下跌的局面。
此后，随着市场明显好转，这个纸业巨头的业绩迅速提升。随着2019年三、四季度传统印刷行业旺季的到来，市场对纸张的需求进一步旺盛，公司落实提价，三、四季度净利润呈逐季度增长态势。
“预计2020年，晨鸣的产量将突破600万吨。届时，晨鸣纸业浆纸平衡优势将在浆价恢复常态后充分发挥出来。”晨鸣纸业总裁李峰此前向《每日经济新闻》记者表示。
不过，国盛证券在最新研报中提到，木浆系成品纸经过2019年全年价格逐上扬后，当前行业盈利能力已处在较高水平，一季度受疫情影响，下游印刷包装行业开工不足，产业链量能传导暂显不畅，纸厂及渠道端库存有一定程度的积累，虽目前仍处可控水平，但后期价格是否能在高位平稳，还需观察终端需求恢复情况。
责任编辑：陈志杰",2020-04-14 17:16:30,新浪财经
14,奥特佳：预计一季度亏损1600万-2200万元,"新浪财经讯 4月14日消息，奥特佳晚间发布公告称，预计一季度亏损1600万-2200万元，上年同期实现盈利622.93万元。公司表示，受新冠肺炎疫情影响，今年一月末至三月上旬期间，公司大部分国内供应商、客户停产停工，这导致一季度公司项目交付及实施延缓，公司营业收入下降，固定人工费用和固定资产折旧摊销费用导致产品成本上涨、毛利下降，综合影响使得公司当期总体亏损。
责任编辑：陈志杰",2020-04-14 17:16:25,新浪财经
15,赣能股份：一季度净利润同比预降24.08%-49.38,"新浪财经讯 4月14日消息，赣能股份发布业绩预告，第一季度预计盈利4297万元-6445万元，同比下滑24.08%-49.38%。公司业绩同比下降的原因为第一季度公司上网电量及投资收益较上年同期减少所致。
责任编辑：陈志杰",2020-04-14 17:14:35,新浪财经
16,浮亏近20亿、踩雷商誉减值 四川国资“抄底”惨淡不堪,"原标题：浮亏近20亿、踩雷商誉减值 四川国资“抄底”行动惨淡不堪 
来源：财联社
自2018年底开始，成都国资、泸州国资在内的四川国资大肆“抄底”上市公司股权，汉鼎宇佑（300300.SZ）、鸿利智汇（300219.SZ）、清新环境（002573.SZ）等公司先后被收入囊中。
尽管声势浩大，但四川国资抄底公司的“回报”有些惨淡，除上述公司以外，包括中化岩土（002542.SZ）、东方网力（300367.SZ）、思美传媒（002712.SZ）、红日药业（300026.SZ）莱茵体育（000558.SZ）等公司在内的国资股权投资（含分红）浮亏已近20亿元。
更为悲催的是，泸州老窖集团旗下平台投资入主鸿利智汇不久即踩上了商誉减值的大雷，业绩大变脸，甚至还被爆出“抢夺”公章的丑闻。
实际上四川国资抄底行动“先锋”就是泸州老窖集团所属的泸州国资，回看鸿利智汇历史公告可知，2018年5月份开始，泸州老窖集团旗下的金舵投资先后以10.93元|股、11.96元|股、11.91元|股价格从鸿利智汇原股东手中买下了4275.42万股（占公司总股本6%）、5000万股（占比7.01%）、 4793.98万股（占比6.72%）的股权，斥资16.363亿。
此外，金舵投资还通过集中竞价及大宗交易方式先后自2018年7月19日至2018年11月2日，买入公司股票2495.24万股，占公司总股本的3.50%；2018年11月5日至2019年4月30日买入公司股票3560.84万股，占公司目前总股本的5.00%，按照两次增持的中间价计算，粗略估算，耗资在5亿元左右。
而公司股价截止4月14日收盘为8.13元，由此可以推算出，金舵投资浮亏超5亿元。实际上金舵投资入主之前的2018年鸿利智汇进行了上市以来的最大分红10派3元，入主后则没有分红。而且公司的业绩也不容乐观，业绩快报显示2019年公司亏损8.77亿元，而2018年则为2.09亿元。对于业绩大幅下跌，鸿利智汇表示，“系公司计提商誉减值合计8.47亿元。 ”
泸州国资投资的另一创业板公司汉鼎宇佑同样浮亏严重，泸州老窖集团旗下四川璞信以10.71元|股的价格从汉鼎宇佑控股股东受让3422万股，占公司总股本的5%。
截止4月14日收盘，汉鼎宇佑股价为8.25元，虽然四川璞信减持了37万股，但是浮亏仍超9100万。
汉鼎宇佑业绩同样表现不佳，四川璞信持股前的2018年，汉鼎宇佑实现营收6.24亿元，同比增长54.25%；净利1.48亿元，同比增长73.43%。持股后的2019年营收4.82亿元，同比下降20.04%；净利更是亏损7.46亿元。与鸿利智汇类似，汉鼎宇佑亏损原因之一则是，“增加计提资产减值准备约7.5亿元。”
与泸州国资两战皆输不同，成都国资有赚有亏，2018年11月25日，成都兴城投资集团以3.83 元/股的价格斥资18.68亿元从红日药业原股东手中买下拿下4.87亿股。此后又增持1.80亿股，增持均价为3.395元/股，耗资约6.11亿元。
2019年5月10日，红日药业按每10股派0.2元进行中期分红。截至2020年4月13日，红日药业报收于5.40元/股，粗略估算，成都兴城浮盈11.05亿元。
不过成都兴城另一手笔的中化岩土则表现不佳，2018年11月18日，成都兴城与中化岩土原股东签署《股份转让协议》，以4.353元/股的价格拿下1.79亿股，耗资7.81亿元。此后成都兴城又以4.353元/股的价格拿下1.87亿股，以4.633元/股的价格拿下1.62亿股，合计耗资15.65亿元。
2019年7月9日，中化岩土按每10股派0.2元进行中期分红。截至2020年4月13日，中化岩土报收于3.71元/股，粗略估算，成都兴城浮亏3.76亿元。
成都另一国资平台成都体育产业投资集团收购的莱茵体育也出现浮亏，2019年3月11日，成都体育产业投资以3.44元/股的价格拿下莱茵体育3.8547亿股，耗资13.26亿元。截至2020年4月14日，莱茵体育报收于2.63元，粗略估算，成都体育产业投资浮亏3.12亿元。
莱茵体育原本披露2019亏损8000万元至9800万元，不过此后因关联方成都文旅集团买入莱茵体育将旗下莱茵达西部体育发展有限责任公司100%股权、莱茵达体育小镇建设发展有限公司100%股权扭亏为盈至净利润为2500万元至3200万元。
实际上莱茵体育2018年业绩就是亏损，成都国资之所以入主原本是为了2021年大运会，但是受疫情影响，文体旅游产业必然受到极大冲击，很难在短时间内有所起色。
四川省级的国资表现同样不佳，2019年4月28日，四川发展国润环境投资公司与清新环境原大股东签署《股份转让协议》，以9.08元/股的价格拿下2.7367亿股，累计耗资24.85亿元。
截至2020年4月14日，清新环境报收于5.73元，粗略估算，四川发展国润环境投资公司浮亏9.16亿元。
2019年5月21日，四川省川投信息产业公司以11.72元/股的价格从东方网力原股东拿下6388万股。当年7月17日，东方网力按10股转4股派0.37元进行中期分红，除权后的收购价格为8.35元/股。截至2020年4月14日，东方网力报收于3.57元，粗略估算，四川省川投信息浮亏4.21亿元。
2019年8月25日，四川省旅游投资集团以4.81亿总价从思美传媒原股东手中买下6039.88万股。此后又以3.83亿元的价格拿下4193.90万股。截至2020年4月14日，思美传媒报收于5.98元，粗略估算，四川省旅游投资浮亏4.078亿元。
综合计算，截止目前，四川国资在上述8家公司投资中累计浮亏19.20亿元。
责任编辑：陈志杰",2020-04-14 17:13:05,新浪财经
17,中信证券、中信建投将合并？ 中信建投有回应,"今日午后2时许，有外媒报道称，中信证券、中信建投或将合并。对此，中信建投董秘王广学回应：“我没听说。”
追溯消息源头，外媒（彭博）在下午2时02分报道称，中信证券与中信建投有可能合并。随即，在2时07分，彭博又发布了一篇较为详细的报道：
(image_address=""//n.sinaimg.cn/spider2020414/692/w600h892/20200414/ba6e-isehnnk2762591.jpg"")
受此消息影响，中信证券、中信建投股价快速拉升。
(image_address=""//n.sinaimg.cn/spider2020414/478/w600h678/20200414/6cc3-isehnnk2762588.jpg"")
中信证券管理层人士曾在3月20日举行的业绩发布会上表示，公司正在不断做大做强的路上，但目前没有收购计划，未来会根据形势和金融市场的不断发展变化，实时制定中信证券不同阶段的发展策略。
2019年6月，中信建投曾发布公告表示，中信证券拟减持其持有的中信建投A股股票。
中信证券管理层人士3月20日表示，去年共减持中信建投股票4400万股，“目前没有减持计划”。
据了解，中信证券、中信建投均为国内大型券商。2019年中信证券实现营收431亿元，同比增16%；实现净利润122亿元，同比增30.23%。中信建投2019年实现营收137亿元，同比增26%；实现净利55亿元，同比增78%。",2020-04-14 17:05:33,新浪财经
18,"业绩被海外子公司拖累 长虹华意""输血""能否力挽狂澜","原标题：业绩被海外子公司拖累 长虹华意“输血”能否力挽狂澜 
来源：财联社
“欧洲人工成本较高，公司增资主要是帮助巴塞罗那子公司进行裁员、重组。巴塞罗那子公司制造方面将减少，未来会向压缩机业务的营销、服务方向转型。”针对“输血”海外子公司一事，长虹华意（000404.SZ）相关负责人向财联社记者表示。
4月14日晚间，该公司发布公告称，决定以自有资金对全资子公司华意压缩机巴塞罗那有限公司（Huayi Compressor Barcelona， S.L.U，以下简称“HCB公司”）增加投资1200万欧元，增资全部作为资本溢价计入资本公积。
值得一提的是，由于华意巴塞罗那子公司面临业绩亏损等情况，拖累到长虹华意，令其业绩大幅下滑。家电行业分析师刘步尘指出，在家电行业整体承压、全球疫情加大经营压力的情况下，长虹华意能否帮助子公司脱离困境，同时保住自身的发展，仍有待考察。
海外子公司业绩不佳
“此次增资是为了支持解决HCB公司为实施‘增强全球市场营销能力及技术服务质量水平，降低欧洲制造规模’为核心的重组计划，带来的大额费用支出问题，以及其持续经营的需要。”长虹华意在公告中指出。
“子公司亏损，长虹集团不能放任不管，增资是当前最好的解决方式，不仅可以补充亏损的现金流，还可以增加话语权，在公司改革过程中掌握主动权。”家电行业分析师洪仕斌告诉财联社记者。
据了解，HCB公司是长虹华意2012年收购西班牙Cubigel业务和资产设立的全资子公司，主营业务为轻型商用压缩机的研发、生产和销售。从数据上来看，该公司2020年一季度净资产为-5321.54万元，净利润亏损941.40万元；2019年全年则亏损8625.74万元。
另有数据显示，HCB公司近年来业绩表现均不理想。2015年亏损1464万元，2016年虽然扭亏，净利润也只有259万元。随后更是一路下滑，2017年和2018年净利润分别为57.80万元和42.68万元，2019年则出现大额亏损。
“目前欧洲许多企业都已经退出家电制造业，国外的冰箱产品很多是从国内采购，主营冰箱压缩机的长虹华意在欧洲的业务，对当地供应链并没有太大意义，从而导致产品销量不足，公司利润也达不到预期。”刘步尘向记者表示。
也正是因为业绩原因，长虹华意开始对HCB公司进行重组。“HCB公司由于地处西欧，用工成本远高于同行业平均水平，产品制造成本居高不下，面临持续亏损的不利局面。”长虹华意在2019年12月公布的重组公告中直言。
长虹华意于当地时间2019年12月18日与HCB公司工会组织达成集体裁员框架协议，计划裁减149个职位，为被裁员工发放遣散费和补偿金，并为受影响的员工提供再就业培训。该公司表示，未来HCB公司将全面建设成为其轻商业务的海外研发中心、营销中心、技术服务中心和信息中心。
“走研发营销的道路是一个正确的选择，中国品牌在国外发展主要利用的就是核心技术、供应链及营销渠道。”洪仕斌说。
国内某家电品牌内部人士向财联社记者指出，受疫情等因素影响，业务重组能否拯救HCB的业绩很难讲。对此，长虹华意负责人向财联社记者表示，“疫情对HCB的经营产生一定的影响，但具体影响目前还不能评估。”
产业链面临挑战
HCB公司表现不佳，直接拖累了长虹华意2019年的业绩。长虹华意2019年净利润下滑57.55%至3062.64万元，其直言，HCB启动业务重整计划涉及安置职工支出、整合费用626万欧元，直接影响2019年母公司净利润4831万元。
“冰箱行业增长继续放缓，冰箱压缩机产业产能过剩情况十分严重。”长虹华意坦陈，终端销量的下滑令其主营冰箱压缩机业务承压。
据产业在线数据统计，2019年中国冰箱行业整体增速为3.1%，其中内销增速仅为0.7%；同期国内冰箱压缩机产量1.86亿台，销售1.83亿台，总销量同比增长8.3%。该机构预计2020年冰箱行业产量下滑2.4%，而全球冰箱压缩机产能为3.68亿台，其中国内产能从2.509亿台增加到2.554亿台，全行业产能利用率仅为67%，产能过剩情况十分严重。“产能严重过剩导致价格成为主要竞争手段，部分企业‘以价换量’，行业降成本压力进一步加大。”
“受疫情影响，国内家电行业正面临危局，下游整机销量不足，采购量少，直接影响上游压缩机业务。”刘步尘认为，“长虹系”所有上市公司中，长虹华意算是一块优质资产，其压缩机业务在业内也属于龙头位置，虽然营收规模不大，但发展稳定，市场份额较高。
资料显示，“长虹系”旗下共有四家上市公司，包括A股的四川长虹、长虹美菱和长虹华意，及港股上市的长虹佳华。2018年10月，长虹集团董事长赵勇曾对外宣布集团产业结构转型升级计划，并表示将推动长虹集团的整体上市。
从四家上市公司业绩来看，长虹华意因海外子公司拖累导致业绩下滑；四川长虹2019年净利润预计为4500-6500万元，同比下滑约80%-86%；长虹美菱营收下滑5.36%，净利润同比增长46%，但扣非后净利润同比大幅下滑1505.41%；长虹佳华业绩较为稳定，营收和净利分别录得35.76%和7.04%的增长。
“近年来，四川长虹和长虹美菱从业绩到市场表现都不是很好，若HCB公司业绩不改善，长期拖累长虹华意这部分优质资产，整个长虹集团也会受到影响。”刘步尘说。
责任编辑：陈志杰",2020-04-14 17:01:07,新浪财经
