,title,content,pub_time,src
0,*ST莲花：重整计划执行完毕,"*ST莲花（600186）3月4日晚公告，当日，公司收到河南省周口市中级人民法院《民事裁定书》，周口中院裁定确认莲花健康重整计划执行完毕、终结莲花健康重整程序。上述重整事项对公司2019年度的净利润和期末净资产将产生积极的影响。
责任编辑：王帅",2020-03-04 17:54:52,新浪财经
1,*ST富控：所持宏投网络100%股权将被司法拍卖,"*ST富控（维权）（600634）3月4日晚公告，公司当日在“公拍网”上查询到，上海市第二中级人民法院将于3月29日10时至4月1日10时止在“公拍网”上进行公开网络司法拍卖活动，公开拍卖公司持有的宏投网络100%股权，起拍价为20.42亿元。此次拍卖为第二次拍卖，此前因无人参与竞拍而流标。截至目前，此次拍卖事项暂未对公司本次重大资产出售工作造成实质影响，但可能对最终受让方的购买意愿产生动摇。
责任编辑：王帅",2020-03-04 17:48:50,新浪财经
2,中广天择：2019年度MCN平台营收占总营收占比很小,"中广天择：有媒体报道公司涉及“网红概念股”，公司2018年开始布局短视频业务，从2019年开始实现收入，2019年度MCN平台营收占公司总营收占比很小。
责任编辑：王帅",2020-03-04 17:48:45,新浪财经
3,网传疫苗已装瓶 康希诺：新冠疫苗处临床前研究阶段,"(image_address=""//image.sinajs.cn/newchar/png/k/hk/daily_660/06185.png"")
热点栏目
自选股
数据中心
行情中心
资金流向
模拟交易
客户端
原标题：康希诺回应一财：新冠疫苗还处于临床前研究阶段
在疫苗研发这条路上，没有谁更快，该走的路都要一步步踏实走完，才能研制和生产出安全有效的疫苗。
新冠肺炎疫情发生已两月余，人们对疫苗的期望也越来越高。日前，网间流传由康希诺生物股份公司研制的“重组新型冠状病毒疫苗”产品已经装瓶。港股上市的康希诺生物-B（06185 ．HK）3月4日当天股价表现也不错，上涨14.92%。
不过，康希诺市场部人士在接受第一财经采访时表示：目前疫苗处于临床前研究阶段。
(image_address=""//n.sinaimg.cn/spider202034/199/w639h360/20200304/4fd3-iqmtvwu4655035.jpg"")　网传的“重组新型冠状病毒疫苗”产品已经装瓶
目前，中国多家疫苗企业参与新冠病毒疫苗的研发，研发路径也不尽相同。根据国家卫生健康委员会副主任曾益新在2月21日国新办会议上的介绍，现在是5条疫苗研发技术路线同步开展：灭活疫苗、重组基因工程疫苗、腺病毒作为载体、核酸疫苗、减毒流感病毒疫苗作为载体。
在2020年天津市“新型冠状病毒感染应急防治”科技重大专项首批拟立项项目清单上，康希诺生物股份公司承担的项目为“新型冠状病毒候选疫苗研发”，市财政支持额度300万元。其研发路径为腺病毒载体疫苗和mRNA疫苗。
在疫苗研发这条路上，没有谁更快，该走的路都要一步步踏实走完，才能研制和生产出安全有效的疫苗。
正如科技部中国生物技术发展中心主任张新民在此前所表示：新冠病毒是一个新的病原体，疫苗研发难度比较大，周期比较长。为了确保尽早研发成功，安排了多条技术路线并行推进，切实保障成功率。当前部分疫苗品种已经进入到了动物实验阶段。疫苗作为一种应用于健康人的特殊产品，其安全性是第一位的。疫苗研发必须遵循科学规律以及严格的管理规范，要给科研人员一定的时间。从目前进展来看，我国各研究团队的研发进度与国际进展基本保持一致。
疫苗的研发、生产和使用，这条路还很长，所涉及到的每个关节都关系到产品的质量问题，包括生产的质量安全保障，以及生产的产能问题。
康希诺生物官网显示，康希诺生物股份公司于2009年注册于天津滨海新区。2019年3月，康希诺生物在香港联交所主板H股上市；2020年1月，公司正式递交科创板上市申请并获得受理，拟募集资金用于新型疫苗产能扩大与新疫苗产品研发。
公司招股说明书显示，2016年、2017年、2018年及2019年1~9月，公司研发费用分别为5163.34万元、6810万元、1.13亿元和9459.18万元。目前，康希诺产品管线包括针对预防埃博拉病毒病、脑膜炎、百日破、肺炎、结核病、带状疱疹等12个适应症的15种创新疫苗产品。
截至1月22日，康希诺在天津已基本建成总建筑面积约3.8万平方米的生产厂房，涉及年原液产能约为7000万至8000万剂，其设计、建造均按照国际标准实施。
此次募资建设的产业化二期项目建设，拟以现有工艺技术为基础，购置先进的生产、检测及公辅设备，增加生产和研发人员，生产百白破联合疫苗、肺炎等疫苗产品。该项目总投资5.75亿元，项目建设期拟定为3年。
责任编辑：陈志杰",2020-03-04 17:48:26,新浪财经
4,三连板星期六：线上销售业务正逐步恢复正常,"星期六公告，公司近期经营情况。2020年春节前后，新型冠状病毒肺炎疫情迅速蔓延，受疫情影响公司及重要子公司复工时间延迟10-20天，目前小部分地区实体店铺尚未能正常营业，同时由于线下人流大幅减少造成实体店铺销售额同比大幅下滑。另一方面，疫情期间由于部分供应商延期复工、特殊交通管制、物流受阻等，前期对公司线上销售业务的正常开展也带来一定影响，目前正逐步恢复正常。本次疫情预计在一定时期内会对公司部分业务尤其是线下销售业务造成较大影响。
责任编辑：王帅",2020-03-04 17:46:15,新浪财经
5,荃银高科：第二大股东大北农拟减持不超过5.02%,"荃银高科公告，持有本公司股份60，964，596股（占本公司总股本的比例为14.17%，占本公司总股本剔除回购专用账户中股份数量后的股本412，195，835股的比例为14.79%）的股东大北农计划通过证券交易系统大宗交易、集中竞价或其他合法方式减持其持有的股份，其中未来6个月内预计减持通过大宗交易买入的股份不超过20，700，693股（占本公司总股本的4.81%，占本公司总股本剔除回购专用账户中股份数量后的股本的比例为5.02%）。
责任编辑：王帅",2020-03-04 17:45:29,新浪财经
6,昔日网红妖股三连板 机构游资混战龙虎榜,"原标题：昔日网红妖股三连板 机构游资混战龙虎榜
来源：财联社
沪深两市今日探底回升，沪指重回3000点上方。个股呈现出普涨格局，两市近百股涨停，市场短线情绪回暖。
网红成为最大赢家，包括星期六、黑芝麻、新文化、搜于特、天龙集团、天创时尚、三五互联、日出东方、中广天择、引力传媒、立昂技术、徐家汇、普邦股份共13股涨停。
其中黑芝麻、星期六、三五互联、天龙集团、立昂技术和中广天择6股登上龙虎榜。
前期“妖股”星期六再次三连板，成交金额13.54亿，换手率24.14%，总市值报222.7亿元。
星期六龙虎榜成交3.18亿，合计买入1.83亿，合计卖出1.35亿，净买入4845.10万元。其中1家机构和1家游资净买入，2家机构和2家游资净卖出。
(image_address=""//n.sinaimg.cn/spider202034/155/w554h401/20200304/17f4-iqmtvwu4598427.png"")
星期六买一为机构专用席位，净买入9118.92万元，买四为知名游资席位，净买入1989.90万元。而卖一和卖五同样是机构席位，净卖出分别为3494.69万元、1682.97万元，合计净卖出5177.66万元。
卖三和卖四为游资席位，净卖出额分别为2904.55万元、2268.91万元，合计净卖出5173.46万元。
由此计算，机构净买入3941.26万元，游资净卖出3183.56万元。
其他个股龙虎榜中，一机构净卖出黑芝麻276.54万元，两机构合计净买入立昂技术1.46亿元，两机构卖出中广天择5492.82万元（3日榜），两游资卖出三五互联893.71万元。
立昂技术成为今日网红龙虎榜成交之冠，成交额3.29亿元，合计买入1.98亿，合计卖出1.31亿，净额6720.40万元。
(image_address=""//n.sinaimg.cn/spider202034/578/w802h576/20200304/24cf-iqmtvwu4598423.png"")
责任编辑：陈志杰",2020-03-04 17:44:58,新浪财经
7,祖斌调任国家电投集团党组副书记 时家林不再担任,"原标题：中核集团原党组副书记祖斌调任国家电投集团党组副书记
2020年3月4日下午，国家电力投资集团有限公司召开领导班子扩大会议，通报了中央关于祖斌同志任国家电力投资集团有限公司董事、党组副书记的决定。时家林同志不再担任国家电力投资集团有限公司董事、党组副书记职务，另有任用。
上述任命按有关法律规定办理。
此番调动之前，祖斌担任中国核工业集团有限公司董事、党组副书记。
责任编辑：陈志杰",2020-03-04 17:43:26,新浪财经
8,雅居乐回应雅城科创上市传闻：没有明确即时分拆计划,"来源：财联社
今日有市场消息称，雅居乐集团计划分拆旗下经营建设业务的雅城科创（Agile City）于年内上市，对此，雅居乐集团相关人士对财联社记者表示，根据集团的计划，包括雅城科创在内的旗下诸多产业板块，在合适时间内，都有分拆上市的打算，但目前雅城科创没有很明确即时的分拆上市计划。
责任编辑：王帅",2020-03-04 17:38:14,新浪财经
9,三天两板拓尔思：正研究再融资事项的可能性及必要性,"三天两板拓尔思发布股票交易异常波动公告称，近日，公司根据再融资新规的精神，正在研究公司启动再融资事项的可能性及必要性。截至本公告披露日，公司是否启动再融资事项以及再融资发行方案等均未确定，该事项存在重大不确定性。
责任编辑：王帅",2020-03-04 17:36:10,新浪财经
10,华明装备：上海国投、国投创新等拟合计减持不超过2%,"华明装备：上海国投、国投创新和北京国投拟合计减持不超过2%。
责任编辑：王帅",2020-03-04 17:35:12,新浪财经
11,金字火腿：网销大幅增长 预一季度净利为4500-5500万,"金字火腿：预计一季度净利润为4500万元-5500万元，同比增长41.16%-72.53%。公司2020年第一季度网上销售收入较上年同期有大幅增长，同时新增进口品牌肉业务收入，因此2020年第一季度净利润较上年同期增长。
责任编辑：王帅",2020-03-04 17:33:19,新浪财经
12,中国移动采购2200套分布式块存储产品 刷新纪录,"来源：C114通信网
据C114通信网报道，昨日，中国移动启动2020-2021年分布式块存储产品集采，将采购分布式块存储产品共计2200套。此次集采刷新了中国移动在分布式存储集采史上的纪录。据了解，中国移动2019年共采购分布式块存储产品910套，被称为中国移动和中国运营商在分布式块存储集采历史上最为重要的大单。
责任编辑：王帅",2020-03-04 17:28:59,新浪财经
13,*ST海马：2月汽车产量0辆 同比下降100%,"*ST海马：2月汽车产量0辆，同比下降100%；销量134辆，同比下降92.88%。
责任编辑：王帅",2020-03-04 17:23:08,新浪财经
14,突然辞职：张善明离任中国最大核电上市公司董事长,"原标题：突然辞职！张善明离任中国最大核电上市公司董事长
来源：能源圈
登陆深A股六个月后，“核电巨头”中国广核电力股份有限公司董事长突然离开。
(image_address=""//n.sinaimg.cn/finance/crawl/182/w500h482/20200304/b88a-iqmtvwu4524661.jpg"")
昨日（3月3日）晚间，中国广核电力股份有限公司【 003816.SZ（简称：中国广核）/01816.HK（简称：中广核电力）】（以下统一简称为：中广核电力）公告称，董事会于当天收到张善明的书面辞职报告，其因工作调整向董事会请求辞去公司董事长、非执行董事、董事会提名委员会委员及董事会核安全委员会主任职务。
中广核电力系中广核集团旗下核电运营平台，由中广核集团联合恒健投资以及中核集团于2014年3月设立，中广核电力为目前全球唯一单一经营核电的上市公司，是中国核电行业最大的参与者。截至2019年12月底，该公司共运营管理24台在运和5台具备商运条件的核电机组，总装机容量为27.14吉瓦。
2019年8月26日，中广核电力登陆深交所中小企业板，成为国内首家在A股和H股实现整体上市的核电企业。（中广核电力于2014年12月10日在港交所上市交易）
资本市场布局上，中广核集团旗下目前有四家上市公司，中广核电力、中广核新能源、中广核矿业、中广核技。
(image_address=""//n.sinaimg.cn/finance/crawl/91/w550h341/20200304/7190-iqmtvwu4524729.jpg"")
上周四（2月27日），中广核电力发布了2019年业绩快报，公司2019年营业收入达到608.75亿元，同比增长19.77%；营业利润165.88亿元，它同比增长10.99%；归属于上市公司股东的淨利润为94.66亿元，同比增长8.77%。
截至今天（3月4日）收盘，中广核电力A股股价报收于3.19元，H股股价报收于1.94港元。
自3月3日后，张善明将不再担任中广核电力任何职务。2017年5月，张善明开始担任中广核电力董事长，至今已有接近三年的时间。
而且，目前张善明也已经不再担任中广核集团的任何职务。在此之前，2020年1月，国资委发布中央企业领导人员职务任免信息显示：免去张善明的中国广核集团有限公司党委副书记、党委常委、董事职务，不再担任中国广核集团有限公司总经理职务。
张善明去职中广核集团总经理职务后，中国核工业集团公司副总经理杨长利接任的该职。
现年56岁的张善明（1964年8月出生）为浙江衢县人，浙江大学热物理系热动专业毕业，后获上海交大MBA硕士研究生学位。自1984年8月参加工作以来，他一直从业于核电领域，已拥有逾36年的工作经验。
张善明在中广核集团工作已有17年之久，2003年1月-2020年1月，张善明先后担任中广核集团总经济师，副总经理，总经理、党组副书记 、党委副书记等职务。
依照惯例，除了特殊情况下央企领导退休年龄可以延期至63岁，央企负责人的退休年龄为60岁。张善明离正常退休还尚且有一段时间。
另外，中广核集团董事长贺禹（1957年3月出生）即将到零退休，届时中广核集团董事长的职位由谁接替将引发关注。
(image_address=""//n.sinaimg.cn/finance/crawl/266/w550h516/20200304/a3ad-iqmtvwu4524797.jpg"")
截止目前，还未有关于张善明新职位的发布信息。
中广核电力表示，张善明任职期间勤勉敬业、恪尽职守，带领董事会和公司不断提升公司治理水平，推进公司改革创新，实现可持续发展。
根据相关法律，中国广核全体董事共同推举执行董事高立刚代为履行董事长职务。代行职务期限自推举之日起，至选举产生新任董事长之日止。
免责声明：自媒体综合提供的内容均源自自媒体，版权归原作者所有，转载请联系原作者并获许可。文章观点仅代表作者本人，不代表新浪立场。若内容涉及投资建议，仅供参考勿作为投资依据。投资有风险，入市需谨慎。
责任编辑：陈志杰",2020-03-04 17:22:39,新浪财经
15,国泰君安成首批获准开展基金投顾业务试点的证券公司,"日前，证监会正式批复了获得基金投顾业务试点资格的首批证券公司名单，国泰君安凭借专业投研实力和综合服务能力成功入围，成为首批获准开展基金投顾业务试点的证券公司之一，这意味着券商以公募基金为突破点的“买方投顾时代”正式来临，财富管理迎来跨越发展机遇。
2019年10月25日，证监会下发《关于做好公开募集证券投资基金投资顾问业务试点工作的通知》，行业期待已久的基金投资顾问业务试点正式落地。基金投顾业务的推出是落实全面深化资本市场改革的又一重大举措，通过发展壮大买方投顾中介力量，有利于引导投资者树立正确的价值投资理念，从而逐步摆脱长期以来“基金赚钱，基民不赚钱”困境，让广大投资者真正能够分享经济发展成果，推动中长期权益资金入市，提升直接融资比例，进一步促进多层次资本市场发展。截至2019年底，已有5家基金公司和3家第三方基金销售机构先后获批基金投顾业务试点。
基金投顾业务本质是“买方投顾”业务，属于投资咨询业务范畴。一个“投”字，指的是投资，体现专业投资能力，按照协议约定代为作出专业投资决策并执行相关产品交易操作；一个“顾”字，指的是顾问，体现专业服务能力，重点弥补市场当前产品售后服务的不足。监管部门在《通知》中也明确要求，各试点机构要遵循客户利益优先原则，诚实守信、谨慎勤勉为客户提供服务，有效识别、评估和处理与其他各项业务利益冲突，切实维护客户合法权益。
就目前获批基金投顾业务试点资格的四类机构来看，券商在渠道、客户、投顾队伍等关键要素具有比较优势，其投研能力、服务能力、获客能力也相对更加突出。此次业务试点在券商正式落地将成为进一步助推行业向财富管理转型发展的重要抓手，放开AUM收费模式，将大力推动券商真正转向客户为中心，回归财富管理服务本源，不断提升产品配置专业能力，从而形成投资者、券商投顾、基金管理人之间相互促进、良性循环，最终实现多方共赢。
国泰君安多年来致力于成为“客户高度信赖、金融行业领先的财富管理者”，坚持以客户为中心，利用集团化综合资源优势，建立业内领先的零售客户服务体系，明晰集团统一的客户分层分类标准，着力打造以“智能科技平台+投资顾问团队”为核心的服务主体，聚焦提供满足客户“交易、产品及咨询”等获得感的差异化内容，拥有较强的业务经验、客户基础、投顾团队及科技平台。
截至2019年末，国泰君安代理证券买卖业务净收入连续四年排名行业第一，注册用户数超过3300万户；拥有两千余名熟悉资本市场、具备资产配置能力的总分投顾团队，由总部相关部门、30家分公司、343家营业部共同组成的市场营销架构，可高效有序地组织推进基金投顾业务；此外，还拥有一只高素质的专业产品研究团队和评价团队，建立了覆盖境内外金融产品及主流投资策略、大类资产配置、基金行业等领域的研究体系，为业务试点顺利开展提供专业保障。
近两年国泰君安信息系统投入排名行业第一，核心系统自主研发比例超过90%。依托目前在相关IT系统资源和研发能力上的充足储备，已建立起一整套资产配置、组合策略与产品管理的系统平台，可实现规模化的服务供给，个性化的千人千面，从而大幅提升客户专属服务体验，为买方投顾时代的到来做足准备。
此次基金投顾业务试点将成为国泰君安向大财富管理转型的重要利器。借助业务试点契机，国泰君安将在经纪业务全面领先、服务体系充分释放效能基础上，进一步把握机遇，直面挑战，努力做好专业投资和专业服务，加速推进公司向大财富管理迈进。
责任编辑：王帅",2020-03-04 17:11:45,新浪财经
