,title,content,pub_time,src
8,中控技术拟赴科创板：上市公司正泰电器持股10%,"原标题：中控技术拟赴科创板，正泰电器持股10%，重要的是这个实控人！
来源：科创板日报
作为中控科技集团（简称“中控集团”）核心成员企业，浙江中控技术股份有限公司（简称“中控技术”）3月18日在披露辅导总结报告中称，计划前往科创板上市。
《科创板日报》记者了解到，中控技术成立于1999年，是一家国产自动化企业，其业务涵盖工业软件、自动化仪表及运维服务的智能制造产品及解决方案，据其官方微信（简称“官微”）2017年12月发布的一篇文章显示，中控连续6年位居国内控制系统市场占有率第一。
在股权结构方面，中控技术股东人数众多，包括金建祥等83名自然人，以及中控集团等11家公司，其中不乏知名企业。
《科创板日报》记者梳理发现，上市公司正泰电器是中控技术的股东之一，2015年，正泰电器公告称，拟出资1.1 亿元受让王建军持有的浙江浙大中控信息技术有限公司（中控技术前身）10%的股权，共计 1100 万股。
彼时正泰电器称，此次股权收购系培育新的战略增长点，同时借助中控信息技术优势，推动工业生产制造向自动化、智能化、网络化方向升级。正泰电器2019年半年报显示，其持有中控技术10%股权，并向其委派了董事，对其经营决策能够实施重大影响，截至报告期末，正泰电器对这笔长期股权投资的期末余额为1.29亿元。
“如果中控技术上（科创板）或达到了披露标准，公司会披露”，正泰电器内部人士今日向《科创板日报》记者表示。
除持有中控技术股份外，正泰电器还持有中国电器科学研究院有限公司（简称“中国电研”）的股权，后者已于去年11月成功登陆科创板，中国电研招股书显示，发行前，正泰电器持股比例为11%，发行后持股比例为9.64%。
另外，上市公司巨星科技2019年半年报显示，其持有中控技术的期末余额为1.22亿元，这笔投资被归类为：其他权益工具投资。
此外，在去年9月，天眼查显示，包括中石化资本、中核（浙江）新兴产业股权投资基金（有限合伙）、中信证券股份有限公司（作为“中信证券中控技术员工持股 2号单一资产管理计划”之管理人）分别对中控技术进行了投资，实缴出资额分别为2189万元、1327万元以及1200万元。
其中，中石化资本与中控技术签署的是战略投资协议，有业内人士向《科创板日报》记者表示，战略投资者和财务投资者、VC不一样的地方是，其大多是是产业链里面的一些公司，投资者不仅仅是给钱，还能对以后的生意有帮助。
《科创板日报》记者了解到，中控技术于2007年成为武汉石化800万吨/年油品质量升级改造工程炼油主装备第一家国产控制系统供应商，2017年，中控技术在国内石化、化工的市场份额分别达到21%和38%，并成为中国石化控制系统领域的第一大供应商。
实际上，提起“中控”就不得不提起中控集团的创始人——褚健。2017年1月18日，中控集团官微发布了一篇名为“过尽千帆，必见辽阔”的文章，其中写到：2017年的这一天，中控人会像中控创立那天一样，．．．．．．．．．，敬畏今日，铭记今日，所有中控人都载歌载舞，为这一天而欢庆。
上述这一天，是褚健出狱归来的第一天。
2017年1月19日，中控集团又在其官微上发表了一篇褚健的“致中控员工的信”，信中写道：“过去的三个夏天四个冬天，虽然我承受了我一生中最困难的经历和遭遇，但是我一直告诉我自己，我不会被任何磨难打倒，也不能被恶劣条件打倒。”不过，《科创板日报》记者今日未能在其官微上找到前述文章。
公开资料显示，褚健是国内工业自动化领域的知名科学家，前浙大副校长，于1993年创办中控集团，突破工业自动化领域被外资企业垄断局面。
褚健归来后对中控技术的业绩提升是显著的，根据中控技术于2017年7月份在其官微中称，创始人褚健回归后的半年里，中控业绩实现了喜人的突破，在上半年完成七年内同期最高的一次业绩增长。
不过天眼查显示，褚健未在中控技术中担任任何职位，后者的法定代表人以及董事长为褚敏，中控集团董事长金建祥任董事职位，但另据上述辅导报告显示，褚健是中控技术的实控人。
责任编辑：陈志杰",2020-03-19 17:07:23,新浪财经
9,韵达前2月业务收入同比持续下降 3月份客户投诉大增,"原标题：韵达股份1、2月份业务收入同比持续下降 3月份客户投诉大幅增长
3月18日晚，韵达股份发布公告称，公司2020年2月快递服务业务收入8.97亿元，同比下降26.48%；完成业务量2.97亿票，同比下降13.41%；快递服务单票收入3.02元，同比下降15.17%。
根据韵达股份此前的公告，公司2020年1月快递服务业务收入18.11亿元，同比下降22.90%；完成业务量6.33亿票，同比下降3.95%；快递服务单票收入2.86元，同比下降19.66%。
另据国家邮政局的公布数据，1、2月份全国快递服务企业业务量累计完成65.5亿件，同比降10.1%；业务收入累计完成864.9亿元，同比降8.7%。
也就是说，韵达股份业务收入下降幅度超过了行业平均水平。
同样值得注意的是，随着快递业务的逐渐恢复，有关韵达股份的投诉也在增加。
根据聚投诉显示的数据，韵达股份在今年1、2月份的投诉量分别为66件、57件，而截至3月18日，3月份当月投诉量已达150件。而2月份投诉量相对较少的主要原因是，公司自2月10日起才恢复全网运营。
这些投诉大多集中在快递丢失、延误等问题。
例如有客户反映称，“韵达快递多次丢件，导致买的东西几个月都不到也不提醒，客服敷衍，整个小区80%丢件。”
还有疑似韵达员工反映了拖欠工资的问题——“韵达快递郑州分公司从2019年12月至今不发放工资，员工生存已经成为最大的问题。”
而根据《邮政业消费者申诉处理办法》的有关规定，消费者向邮政企业、快递企业投诉后7日内未得到答复或者对企业处理和答复不满意，或者邮政企业、快递企业投诉渠道不畅通，投诉无人受理的，可以向有关部门提出申诉。申诉有效期为发生于与邮政企业、快递企业产生服务争议或者交寄邮件、快件之日起一年之内。
另据中国网财经中心记者了解，邮政业消费者申诉专用电话为“12305”（省会区号-12305）。消费者可以通过电话或者登陆国家邮政局和各省、自治区、直辖市邮政管理局网站申诉，也可以采用微信、书信或者传真形式申诉。
责任编辑：陈志杰",2020-03-19 17:03:29,新浪财经
