,title,content,pub_time,src
0,泰禾集团：预计前三季度净亏损16.5亿-22.3亿元,"10月14日消息，泰禾集团公告，预计前三季度净亏损16.5亿-22.3亿元，去年同期盈利21.2亿元。2020年1-9月，受新冠肺炎疫情及公司房地产开发项目结算排期的影响，无集中交付的地产项目，仅有零星项目交付结转收入，造成收入较上年同期大幅下降，相应的营业利润大幅减少。
(image_address=""//n.sinaimg.cn/finance/cece9e13/20200514/343233024.png"")
海量资讯、精准解读，尽在新浪财经APP
责任编辑：陈志杰",2020-10-14 20:56:12,新浪财经
1,宝信软件三季报大增60%股价却出现闪崩 机构、北向现大分歧,"这一大白马三季报大增60%，股价却出现闪崩，机构、北向现大分歧
来源：财联社
财联社（上海，研究员 马登科）讯，近日，从三七互娱、信维通信、圣邦股份到宝信软件，多只科技白马股出现闪崩现象。宝信软件盘后龙虎榜数据显示，机构、北向资金出现大分歧。
值得一提的是，宝信软件在昨日盘后发布三季报，预计2020年1-9月归属于上市公司股东的净利润较上年同期增加3.1亿元到3.8亿元，同比增长51%到63%。本次业绩预增，主要来自于软件开发及工程服务收入增加，以及宝之云IDC四期项目上架机柜数量较上年同期增长。
开盘后，宝信软件却放量大跌，盘中一度跌停，截止收盘跌8.79%，成交额近13亿，创下历史新高。
(image_address=""//n.sinaimg.cn/finance/crawl/735/w550h185/20201014/3b9f-kakmcxe9398852.png"")
盘后龙虎榜数据显示，机构、北向资金出现大分歧，全天资金净流出1.71亿。席位方面，今日共5个机构席位出现在龙虎榜单上，分别位列买二、买三、卖二、卖三、卖四，合计净卖出1.51亿元。沪股通的身影，占据了买一、卖一的位置，净卖出1031万。
业内人士认为，近期多只白马股出现闪崩现象，与其近年股价大涨不无关系，很大程度上也在于补跌预期下的基金调仓。
其还表示，A股市场将逐步从估值驱动转向业绩驱动，资金对业绩的敏感度更高，低估值的价值风格品种以及前期挖掘较少的顺周期板块成为A股基金经理重点关注的方向。
闪崩白马股有以下共同特征
1、都是2019年开始股价一路上涨到三季度的个股，期间，圣邦股份走出10倍大牛股，宝信软件涨超4倍，涨幅最低的信维通信也超过2倍。
2、均为基金重仓股票，据半年报显示，三七互娱最多，被945家基金持有，宝信软件、信维通信、圣邦股份分别被527家、570家、277家基金持有。
3、股价调整明显滞后同类白马，兆易创新、汇顶科技、数据港等见顶后最高回调均超过了40%。
(image_address=""//n.sinaimg.cn/finance/cece9e13/20200514/343233024.png"")
海量资讯、精准解读，尽在新浪财经APP
责任编辑：陈志杰",2020-10-14 20:33:01,新浪财经
2,上市12年亏超2亿、连爆两雷又遭调查 安妮股份封死跌停,"上市12年亏超2亿，连爆两雷又遭调查，安妮股份（维权）封死跌停
来源：富凯财经
狂揽12个热点，却累计亏损逾2亿元，安妮股份跨界经营雷声大雨点小。
作者|A   K
排版|十一
10月14日，安妮股份股价开盘跌停，截至收盘，跌10.05%，报收6.8元/股，九月中旬以来，公司股价持续大跌，短短一个月已跌近40%。
(image_address=""//n.sinaimg.cn/finance/crawl/18/w550h268/20201014/6752-kakmcxe9364928.png"")
但今天的跌停主要是由于昨天晚间的两份公告，一是因涉嫌信息披露违规被证监会立案调查，二是今年前三季度预计亏损8000-9500万元。
连爆两雷，业绩亏跌又被调查
安妮股份业绩预告显示，今年前三季度，公司预计亏损8000万元-9500万元，而去年同期，公司盈利8701.29万元。其中，仅第三季度，就预计亏损7500万元-8100万元。
对于亏损的原因，公司认为主要有三：新冠肺炎疫情下，公司及上下游企业复工延迟，各项业务开展受影响，版权服务业务部分项目延期，而非经常性损益对净利润影响金额也约为1738万元。
但最主要的还是受疫情及文化内容行业政策、市场变化等影响，公司计提商誉减值7000万元-8000万元。
(image_address=""//n.sinaimg.cn/finance/crawl/95/w550h345/20201014/f638-kakmcxe9364950.jpg"")
与此同时，安妮股份还发布公告称，公司于10月12日收到证监会的调查通知书，因涉嫌信息披露违法违规，公司被立案调查。
这样的情形对于安妮股份的投资者来说似曾相识。2017年5月，公司就曾因为超高比例的商誉减值未能及时进行信息披露而收到深交所的监管函。
当时的监管函显示，2016年，安妮股份对商誉计提减值准备金额为2798.36万元，占2015年度经审计的归属于上市公司股东净利润的240%。针对上述事项，公司未在2017年2月底前提交董事会审议并及时履行信息披露义务，直至2017年4月26日才提交董事会审议并对外披露，违反相关规定。
但此次被立案调查看上去比三年前更为严重，对于被立案调查的具体原因，安妮股份并未在公告中说明，还需要等待调查结果，这无疑在投资者心中蒙上一层担忧的阴影。
狂蹭热点，概念多业绩差
公开资料显示，安妮股份成立于1998年，主营商务信息纸品制造和销售业务，2008年登陆深交所中小板。
上市之初，安妮股份的业绩稳定增长，但2009年-2010年，公司斥资扩张，收购了至美数码、中冶美隆、绿荫实业等印刷和纸业公司，业绩大幅缩水，当年扣非净利润出现亏损。
主业的惨淡经营让安妮股份调转方向，2011年开始，公司开启了跨界并购之路，而且每每出手都是热点，同花顺信息显示，安妮股份的概念加持多达12个，其中不乏大数据、区块链、虚拟现实等热点。
(image_address=""//n.sinaimg.cn/finance/crawl/612/w550h62/20201014/94a4-kakmcxe9365013.png"")
但这些热点除了导致大额商誉和市场关注外，没有给公司业绩带来好处。
2011年，公司收购互联网公司联移合通，经过两年开发推出彩票销售平台，但随着政策变化，网上彩票代购业务全面告停。
2013年，公司收购物联网公司安捷物联，但三年后，因对赌业绩不达标，又将安捷物联回售给了原股东；2015年，公司收购自媒体运营公司微梦想51%股权和虚拟现实技术应用开发公司桎影数码的股权；2016年，安妮股份作价11.38亿元并购了畅元国讯100%股权，并确认约10.4亿元商誉，切入数字版权概念，但随后因未能兑现业绩，2017年和2019年共计提商誉减值5.21亿元；近年来，安妮股份又化身区块链概念股，频繁传出将区块链技术应用于版权业务的消息。
整体来看，安妮股份业绩始终维持在小盈利大亏损的状态。据媒体统计，自2008年上市至2019年，公司累计净利润为亏损2.3亿元。
(image_address=""//n.sinaimg.cn/finance/crawl/653/w550h103/20201014/76e2-kakmcxe9365055.png"")
今年半年报显示，分产品来看，公司的主营业务仍然是商务信息用纸及服务，营收占比68.66%，版权交易与增值，营收占比17.97%，版权技术和保护，营收占比7.79%，游戏分发，营收占比2.59%，互联网营销，营收占比0.29%，游戏虚拟货币，营收占比为0。
免责声明：自媒体综合提供的内容均源自自媒体，版权归原作者所有，转载请联系原作者并获许可。文章观点仅代表作者本人，不代表新浪立场。若内容涉及投资建议，仅供参考勿作为投资依据。投资有风险，入市需谨慎。
(image_address=""//n.sinaimg.cn/finance/cece9e13/20200514/343233024.png"")
海量资讯、精准解读，尽在新浪财经APP
责任编辑：陈志杰",2020-10-14 20:17:21,新浪财经
3,东阿阿胶：前三季度预亏1671万元—2925万元,"10月14日消息，东阿阿胶（000423）10月14日晚间披露前三季度业绩预告，预亏1671万元—2925万元，上年同期盈利2.09亿元；其中，第三季度预计盈利5477万元—6731万元。受国内新冠肺炎疫情影响，报告期内特别是一季度，国内部分经销商复工复产延期，且药店等销售场所普遍顾客流量严重低迷，导致公司线下业务受到较大影响。
(image_address=""//n.sinaimg.cn/finance/cece9e13/20200514/343233024.png"")
海量资讯、精准解读，尽在新浪财经APP
责任编辑：陈志杰",2020-10-14 20:06:30,新浪财经
4,国盛金控：预计前三季度净亏损5380万-1.07亿元,"10月14日消息，国盛金控（维权）公告，预计前三季度净亏损5380万-1.07亿元，去年同期盈利9258.27万元。董事赵岑女士不能保证公告内容真实、准确、完整。
(image_address=""//n.sinaimg.cn/finance/cece9e13/20200514/343233024.png"")
海量资讯、精准解读，尽在新浪财经APP
责任编辑：陈志杰",2020-10-14 20:04:52,新浪财经
5,獐子岛：预计前三季度盈利2000万元–3000万元 同比扭亏,"10月14日消息，獐子岛（维权）披露业绩预告，预计前三季度盈利2000万元–3000万元；其中第三季度预计亏损2000万元–1000万元。扭亏原因为上半年出让部分海域使用权相关资产及转让子公司股权等非经常性损益项目收益较高。
(image_address=""//n.sinaimg.cn/finance/cece9e13/20200514/343233024.png"")
海量资讯、精准解读，尽在新浪财经APP
责任编辑：陈志杰",2020-10-14 20:03:30,新浪财经
