,title,content,pub_time,src
6,律师解读武汉凡谷乌龙案：业绩快报造假能否脱罪？,"新浪财经讯 1990年至今，中国资本市场经历了从无到有、从萧条到繁荣的“跃进”三十年。回首过去30年，股民数量剧增、投资者结构不断优化，法制化下证券市场日趋完善。
2020年新《证券法》实施在即，哪些调整会对未来资本市场发展带来深远影响？又有哪些股民措施会使1.6亿股民受益？
新浪财经《法说资本》315特别策划，邀请资深证法律行业资深人士，为您讲述法前案后。
由于财务人员业务不熟，武汉凡谷（维权）少计自制半成品的领用，由此导致公司2016年半年度报告、第三季度报告合并报表分别虚增营业利润1560万元、3811万元。2018年3月5日，因信披违规武汉凡谷被证监会行政处罚。
在具备索赔前置条件的情况下，数百位投资者向武汉中院提起诉讼，要求武汉凡谷对损失进行赔偿。武汉市中级人民法院一审，一审判决支持了的股民大部分诉讼请求，武汉凡谷不服一审判决，上诉至湖北省高级人民法院，后二审驳回上诉、维持原判。
(image_address=""//n.sinaimg.cn/finance/transform/575/w550h825/20200310/2c5e-iqrhckn0601281.jpg"")
本期做客嘉宾是韩友维律师，现为江苏剑桥颐华律师事务所合伙人，毕业于厦门大学法学院，长期致力于证券法、公司法等领域法律事务研究和诉讼服务，办理过多起在全国有影响力的股票投资者维权典型案件。
一、具体案情
武汉凡谷系一家在A股上市的公司。2017年9月12日因涉嫌信息披露违法被立案调查。2018年3月5日，因信披违规被证监会行政处罚。武汉凡谷及相关责任人违法事实如下：
2016年半年度报告、第三季度报告财务数据虚假记载。调查显示，由于财务人员业务不熟，武汉凡谷少计自制半成品的领用，由此导致公司2016年半年度报告、第三季度报告合并报表分别虚增营业利润1560万元、3811万元，分别占当期披露营业利润的51%、115.09%。虽然绝对金额不是很大，但所占比例较大。武汉凡谷上述行为违反了《证券法》第六十三条的规定，构成虚假记载行为，由此武汉凡谷及相关责任人员受到了警告罚款等处罚。
此后武汉凡谷投资者将公司及相关责任人告上法庭，请求赔偿由于虚假陈述给投资者造成的差额损失。韩友维律师团队代理了其中的部分案件。
二、双方争议焦点和法院判决
一般来说，证券虚假陈述案件的争议焦点多集中在揭露日（更正日）的认定、投资者损失与虚假陈述行为之间的因果关系等方面。
【焦点一】实施日的认定
本案与大多数案件不同的是，实施日的认定也成为原、被告双方争议的焦点。本案中，武汉凡谷先是在2016年7月30日发布《2016年半年度业绩快报》，8月27日才发布《2016年半年度报告》。这样就出现了两个实施行日，到底哪一个应该是实施日内呢？我们代表原告主张业绩快报的发布之日为实施日，被告则主张正式报告发布日才是实施日。
被告理由有两个，一是证监会行政处罚决定书中认定的是2016年半年度报告虚假记载，并没有认定2016年半年度业绩快报虚假记载。而且在业绩快报中已经提示：所载财务数据仅为初步核算数据，未经会计师事务所审计，与半年度报告中披露最终数据可能存在差异。二是全国各地法院之前没有把业绩快报时间作为实施日的先例。应该说被告的这两个理由看起来好像非常有道理，一旦法庭采纳被告的上述主张，那就意味着投资者在半年度业绩快报发布至正式报告发布期间买入的股票将被排除在赔偿范围之外。
为了能够让更多的投资者得到赔偿，我们在法庭辩论时，针对被告的抗辩提出了两点意见：
一是《深圳证券交易所上市公司业绩预告、业绩快报披露工作指引》第十一条规定：“上市公司应当对业绩预告、快报及修正公告的披露准确性负责，确保披露情况与公司实际情况不存在重大差异。”因此，业绩快报所披露的数据虽允许与正式报告所披露数据存在一定差异，但并不意味着业绩快报可以随意编报，投资者对业绩快报的真实、准确性可以产生合理信赖。
二、证监会行政处罚所指向的对象是虚假陈述行为，并不是仅仅针对一份半年度报告。事实上，业绩快报和正式报告中的财务数据基本一致。也就是说，业绩快报的信息也是虚假的，在业绩快报公布后该虚假信息就已经传递给资本市场，就可以推定此时虚假陈述行为已经开始对投资者的决策和股价产生影响。
最终我们的观点得到了法庭支持，武汉市中级人民法院认定该案的虚假陈述实施日为2016年7月30日。
【焦点2】更正日的认定
根据法律规定，只有在更正日（揭露日）之前还持有的股票才能纳入索赔范围，所以在几乎所有的虚假陈述赔偿案件中更正日（揭露日）都是争议的焦点。武汉凡谷更正的时间有二个，第一个是2017年3月25日，当天武汉凡谷发布《2016年度业绩快报修正公告》。第二个是2017年4月26日，武汉凡谷发布2016年半年度及三季度报告的修正公告，正式对虚假记载的信息进行修正，值得注意得是，在这二次修正公告中武汉凡谷对营业利润出现差异的原因给出的理由完全相同。
被告主张更正日为2017.4.26，被告理由：4.26修正公告是专门针对出现差错的半年度三季度报告进行的修正，而3.25修正公告则是对年度业绩快报进行的修正，并没有专门更正半年度及三季度报告的会计差错。如果把4.26作为更正日，意味着在3.25到4.25之间卖出的股票被排除在赔偿范围之外，而且还会大比例扣除系统性风险。权衡再三，我们认为2017.3.25为更正日能最大程度地保护投资者。
为此我们在法庭辩论时，向法庭陈述了二个理由：
第1、当有多个更正行为时，除了在时间上把握“首次”这一特点以外，还应该着重考察更正行为之后的股价波动，应把引发股价跌幅较大的更正时间作为更正日。如果其中一个更正行为之后，股价出现大幅下跌，说明向市场发出了较强的警示信号，具备较强的警示强度。相反如果更正行为后并没有引起股价下跌，则说明该揭示行为并不具备较强的警示强度，该更正行为的时间就不适合作更正日。
（在本案中，3.25业绩修正后到4月26日一个月时间：股价从12.19跌到9.05元，跌幅-26%。同期深证成指跌幅仅有-3.58%，而反观4.26的修正公告发布后，股价并没有发生明显波动），上述情况说明3.25更正行为更符合更正日（揭露日）的特征。
第2、从保护投资者的角度来看，我们的主张更有利于保护投资者利益。把引起股价大幅下跌的更正（揭露）行为时间作为揭露日，可以把因虚假陈述给股民造成的大部分损失纳入赔偿范围，符合《证券法》有利于保护投资者利益的立法宗旨。如果选取一个没有引起股价下跌的揭示行为作为揭露日，就会把前面大幅下跌的损失排除在赔偿范围之外。
法庭最终采纳了我们的辩论意见，武汉市中级人民法院最终认定2017年3月25日为更正日。
三、武汉凡谷案的意义
武汉中院对武汉凡谷案的判决具有非常典型的示范意义。主要体现在两个方面：
一是体现在实施日的认定方面。本案之前的此类案例，法院大多是以正式报告发布之日作为实施日，如成都中院金亚科技（维权）案、南京中院雅百特案、长沙中院尔康制药（维权）案等（上述案例中都有业绩快报）。这种认定标准极不科学，一般来说业绩快报公布后该虚假信息就已经传递给资本市场，就必然已经对投资者的决策和股价产生影响，上述案件在认定实施日的时候并没有充分考虑到股票市场的特点和规律。如在尔康制药一案中，尔康制药先在发布了2016年度业绩快报，一个月后又发布了正式报告，法院认定实施日时，选取的是年度报告正式公布日，这就导致大量在业绩快报至正式年报报告期间买入的股票无法获赔，按照一审判决，该案只有12个交易日中买入的股票才符合赔偿条件。
二是体现在更正日（揭露日）的认定方面。目前更正日（揭露日）的认定并没有一个统一的标准，（事实上由于揭露过程的复杂性，法律也很难规定一个具体的标准，）此前，大多数法院在选择认定更正日（揭露日）时，并没有把揭露行为之后股价波动作为一个重要的因素去考察，法院常常会选择一个并没有引发股价下跌的更正（揭露）行为作为更正日（揭露日），从而导致股民的大部分损失得不到赔偿。如在宁波中院审理的圣莱达（维权）一案中，针对圣莱达业绩造假行为有两个揭露日，一个是证监会立案调查日，之后股价出现暴跌。另一个是调查结果出来后，行政处罚事先告知日，之后股价不跌反涨。宁波中院把行政处罚事先告知日认定为揭露日，由此带来两个法律后果：一是在立案调查后股价暴跌中卖出的投资者排除在赔偿范围外。二是以此为由认定投资者损失与造假行为之间没有因果关系。最终所有投资者的诉讼请求全部被驳回，股民整体败诉。目前宁波中院的一审判决已被浙江省高院撤销发回重审。但此前全国有很多很多类似的判决都已经生效。
因此，武汉中院对武汉凡谷一案的判决不管是从科学的角度，还是从保护投资者利益角度来说，都具有很强的典型示范意义。我们希望本案的判决能够给该类案件的审判起到较强的示范作用。
四、最新立法规定
最近，我们欣喜地看到，最高人民法院最新发布的民商事审判会议纪要（简称《九民会议纪要》）中也涉及到揭露日和更正日的认定，并规定：原则上，只要交易市场对监管部门立案调查、权威媒体刊载的揭露文章等信息存在着明显的反应，对一方当事人主张市场已经知悉虚假陈述的诉讼理由，人民法院应予支持。这就等于肯定了武汉凡谷一案中，法院在认定更正日时所选择的法律适用。
责任编辑：王妍",2020-03-10 17:29:35,新浪财经
7,特斯拉闷声干大事：上海工厂本月开始产能或提升75%,"原标题：特斯拉闷声干大事！一份会议记录透露上海工厂动向：本月开始产能提升75%
近期，随着特斯拉股价跌破700美元大关，A股相关概念个股们也收起锋芒，变得低调起来。而一度助力特斯拉攀上900美元股价巅峰的上海超级工厂，也因2月产值的低迷备受压力。
然而，近日几份重要内部文件的曝光，证明了特斯拉短暂的“颓废”只是表象，与华尔街分析师们旷日持久的唇枪舌剑经历，似乎终于让特斯拉学会了闷声干大事：上海超级工厂，正谋求产能、供应链国产化率的“双提升”。
产能提升 长续航版Model 3在路上
据欧洲电气化运输垂直媒体Electrive当地时间9日报道，根据一份申港证券在3月1日投资者会议的纪录，特斯拉上海工厂目前采用一班制，电动车产能已达约2000辆/周。第二轮产能提升将从本月开始，预计电动车产能将增至3500辆/周。
这个数字显然并非特斯拉今年的最终目标。会议记录显示，特斯拉上海工厂计划在今年上半年生产50000-60000辆Model 3，2020年全年共计生产170000辆电动车。这意味着到今年下半年，上海工厂产能还将开始新一轮的提升。有机构援引专家透露，特斯拉将于6月在中国进行“压力测试”，随后大幅提高产量，印证了下半年产能再次加速的猜想。
在产能不断进阶的基础上，特斯拉上海工厂还计划从第三或第四季度开始，生产长续航版本（long-range）的Model 3。在此之前，上海工厂需要增加一类变体版本电池（即长续航版本电池）的生产，随之而来的将是生产复杂性的增加。
文章介绍称，从标准电池到长续航版本电池的转换并不是简单的电池变体，还包括模型以及其内部电池单元的改变。与其他版本的Model 3电池由宁德时代供货不同，长续航版电池将采用LG-Chem电池，其形态以及内部单元都会有较大的变化。
与此同时，上海工厂还将加速在现有车型上进行软件更新。文件显示，新的更新还将包括第三方充电站。其他的改进包括Model S和Model X的恢复效率，以及Model 3的新自动驾驶仪视觉效果和新轨迹模式。
国产率提升 产线增加涉及多种零件
除了产能提升外，上海工厂还不忘在先前的承诺上加码加速，即年底前推动产业链完全国产化。数据显示，截至去年12月底，特斯拉上海工厂的零件国产率不到30%，而要在2020年底前完成产业链的100%国产化，特斯拉的任务并不轻松。
路透社10日报道称，特斯拉近期提交给上海市政府的一份文件显示，特斯拉上海工厂计划增加部分汽车零部件的产能，以推动其在全球最大汽车市场的供应链本地化。
文件称，自去年12月上海工厂开始交付Model 3电动轿车起，该工厂就在计划增加生产线，以生产更多的电池组、电动机和电机控制器。
此外，特斯拉上海工厂希望将其冷却管道（汽车热管理系统的关键部分）的年建设能力提高近一倍，从15万套增加到26万套。另据路透社看到的一份施工文件，上海工厂还将在上海新建一条冲压生产线，以加快汽车生产。
不过，特斯拉在文件中强调，增加的生产线将不会用于电池的生产，但外包生产的电池将在工厂进行包装。
对于路透社的置评请求，特斯拉尚未作出回应。
上海超级工厂是特斯拉业绩增长的关键，已成为大部分业内人士的共识。
根据2018年的一份政府文件，到2020年，特斯拉上海工厂的目标是全年生产15万辆Model 3轿车，随后将产量提高至每年25万辆电动车（包括Model Y车型）。特斯拉的目标则是在全球交付超过50万辆汽车。
然而，在疫情影响下，上海工厂1-2月产量尚未达到预期。在此背景之下，可以预见，此次“双提升”，上海工厂所承载的压力将更加沉重，无论是对特斯拉本身或是国内供应链公司来说，意义也更加深远。
责任编辑：陈志杰",2020-03-10 17:04:47,新浪财经
8,华夏银行业绩快报：2019净利润219.05亿 同比增5.04%,"华夏银行业绩快报：2019年全年实现净利润219.05亿元，同比增长5.04%。
责任编辑：王帅",2020-03-10 17:03:45,新浪财经
9,云南白药：平安人寿累计减持公司1%股份,"云南白药（000538）3月10日晚间公告，截至3月9日，平安人寿以集中竞价方式减持了1277.40万股，占公司总股本的1%。根据减持计划，平安人寿拟以集中竞价交易方式减持不超过公司1%的股份。减持后，平安人寿持有4.85%公司股份。
责任编辑：王帅",2020-03-10 17:01:38,新浪财经
