,title,content,pub_time,src
0,57岁中银香港原总裁高迎欣空降民生银行 出任党委书记,"原标题：57岁中银香港原总裁高迎欣空降民生银行，出任党委书记
中国第一家由民间资本设立的全国性商业银行民生银行将迎来高层调整。
澎湃新闻证实，民生银行5月29日上午召开会议，宣布57岁的原中银香港副董事长、总裁高迎欣加入民生银行，出任党委书记，行长郑万春将由党委书记改任党委副书记。
目前，民生银行第七届董事会尚在超龄服役，第八届董事会尚未选举产生。不出意外，待完成相关程序后，高迎欣有望接替现年63岁的洪琦，成为民生银行新任董事长。
高迎欣在中行任职超30年
高迎欣履新民生银行已有预期。
中银国际发布公告称，因工作调动，高迎欣自2020年5月25日起辞任该公司及其主要营运附属公司中国银行（维权）（香港）有限公司执行董事、副董事长兼总裁、战略及预算委员会委员和可持续发展委员会委员。
高迎欣的工作履历集中在中国银行集团，并在中国银行集团境内外多家机构担任不同职务。
在1986年加入中国银行后，高迎欣开始在中国银行北京总行从事多项业务领域的项目融资工作；1999年担任中国银行总行公司业务部总经理，领导和建立中国银行集团的跨国公司客户和中国内地重要客户的客户关系和全球授信业务，也负责中国银行大型项目融资工作。1995年到1996年间，高迎欣曾短暂在加拿大北方电讯公司总部财务部工作。
高迎欣在中国银行体系内多年负责国际业务。在2005年到2015年3月期间，高迎欣担任中银香港副总裁，在2007年5月至2015年3月，担任中银香港执行董事， 2015年5月起，高迎欣兼任中国文化产业投资基金管理有限公司董事长；2015年8月起，兼任中银国际控股有限公司董事长和中国银行（卢森堡）有限公司董事长；2015年10月起担任中国银行（英国）有限公司董事长；在2016年9月开始担任中银国际证券有限责任公司董事长。2015年5月起，高迎欣任中国银行副行长；2016年12月起，任中国银行股份有限公司（中银香港的控股股东）执行董事。2018年1月进入中银香港。
在任职中银香港期间，高迎欣出任包括香港银行公会主席、香港中国企业协会会长、香港中资银行业协会会长，外汇基金咨询委员会委员、银行业务咨询委员会委员、香港特区人力资源规划委员会委员、香港贸易发展局理事会成员，亚洲金融合作协会监事长、香港银行同业结算有限公司董事、香港银行学会副会长等多项公职。
新一届董事会选举延期至今
在党委班子完成更迭后，摆在民生银行面前的，是延期的新一届董事会选举。
去年12月9日，民生银行发布公告称，结合公司实际情况拟于近期启动董事会换届工作。但受疫情影响，换届工作延期。
但在现任董事会超龄服役期间，作为股东的民生明星企业家们动作不断，罕见地在董事会上对提案投下反对票和弃权票。
3月30日晚间，民生银行披露的《第七届董事会第二十次会议决议公告》中，作为民生银行副董事长的东方集团名誉董事长张宏伟投出了1张反对票和4张弃权票；同样作为民生银行副董事长的新希望集团董事长刘永好也投出了2张弃权票。两位董事的诉求也并不相同：张宏伟希望民生银行能够降低成本，提高利润， 而刘永好则认为民生银行的“改革力度和治理力度应更强”。
民生银行第八届董事会将由18名董事组成，其中独立董事的人数不少于三分之一即6名；董事会中由高级管理人员担任董事的人数应不少于2名；董事会的规模和组成结构可根据提名情况及相关规定适当微调。在股东董事（即非执行董事）候选人方面，公告规定，在《公司章程》规定的董事会人数范围内，按照拟选任人数，由第七届董事会提名委员会在广泛征求股东意见的基础上提出股东董事候选人名单；单独或者合计持有民生银行已发行的有表决权股份总数3%以上股份的股东亦可以向董事会提出股东董事候选人。
(本文来自澎湃新闻，更多原创资讯请下载“澎湃新闻”APP)
]article_adlist-->
(image_address=""http://n.sinaimg.cn/finance/cece9e13/20200514/343233024.png"")
海量资讯、精准解读，尽在新浪财经APP
责任编辑：陈志杰",2020-05-29 16:57:48,新浪财经
1,泰禾近千亿借款待还：一季亏5.6亿 项目停工引业主维权,"原标题：近千亿借款待还！泰禾一季度亏损5.6亿元，项目停工引发业主维权
来源： 风云地产界
进入千亿行列的泰禾，没能守住自己的业绩，不到两年便跌出千亿队伍。如今债务压顶，由资金引发的工程问题又遭遇业主维权。
撰文/ 廖凯
编辑/ 卢泳志 
随着地产行业开启“高周转、高杠杆”发展模式，千亿规模成为众多房企追逐的目标，但快速扩张千亿后，能不能守住自己的基本盘，对于房企是一个考验。
曾经的千亿房企泰禾，2017年底刚到千亿，便喊出了进军2000亿的目标，2019年却已掉出千亿房企队列，令人唏嘘。
近段时间以来，泰禾日子并不好过。风云地产界（微信公号：fydcj888）发现，在泰禾出现一系列债务问题时，也引发了部分项目维权。
01
工程缓慢，引发业主烂尾担忧
近日，一封《上海长兴岛泰禾大城小院购房者写给上海市委、市政府的信》再次将泰禾推向风口浪尖，让本就资金链紧张的泰禾，再次面临业主维权的困扰。
据了解，根据开发商与业主的预售合同，泰禾大城小院项目需要在2020年7月30日前交付，然而项目从2019年9月开始施工进程缓慢，虽未办理停工备案，单业主认为项目2019年至今相当于处于停工状态。
(image_address=""//n.sinaimg.cn/finance/crawl/155/w550h405/20200529/9101-iufmpmp0300709.png"")
业主在信中表示：由于前期资金监管缺失，建设资金被挪用，导致长兴岛大城小院出现极大的烂尾风险，房屋交付无望，市民业主的利益正在遭受侵害，恐慌情绪已蔓延至全体市民业主，严重地影响了正常工作和生活秩序。
项目进程缓慢，以及泰禾目前的资金链问题，引发了业主的担忧。一位业主在黑猫投诉上对泰禾上海大城小院项目进行了投诉，反应了泰禾延期交房、挪用资金、违规销售等问题。
资金挪用、工程进展缓慢等问题同样也引发了泰禾北京院子业主的担忧。
据了解，泰禾北京院子二期维权业主在《致泰禾北京院子二期业主书》表示，目前项目工程停工已超半年，2019年承诺的封顶，并没有履行。对于项目资金挪用问题也有业主向政府相关部门反映。
关于泰禾北京院子的资金问题，朝阳区房管局在5月13日回复业主留言中表示，朝阳区房管局在2019年3月就对泰禾预售资金问题下发了《责令改正通知书》，但泰禾未按要求改正其违法行为，已于4月11日暂停了该公司的网签资格。
2019年年初泰禾就已出现“资金链断裂”的传闻，如今因为资金问题导致大多工程项目无法按时进行，引发业主集中维权，更是难上加难。
对此，风云地产界（微信公号：fydcj888）致电联系泰禾，电话无人接听。联系公司内部人士，对方表示一切以公告为主。
02
1900亿负债压顶，寻求战投支援
从“传闻”到爆发，泰禾债务问题逐渐显现出来。
5月12日，泰禾因子公司未履行还款义务，再次被列为被执行人。公告显示，泰禾全资子公司、实际控制人黄其森因未能及时偿还一笔约13亿元的融资款和偿还约5亿元的借款而被列为被执行人。
5月26日，晚间泰禾又发出公告，其控股股东泰禾投资7.1亿股被司法冻结占其所持股份的58.32%，占公司总股本28.56%，涉及29.31亿元担保纠纷。
据了解，截止2019年底，泰禾集团的有息负债约为960亿元，其中一年内到期的非流动性负债467亿元。
(image_address=""//n.sinaimg.cn/finance/crawl/58/w550h308/20200529/c44d-iufmpmp0300761.jpg"")
今年一季度，泰禾负债达到1900.46亿元，其中有息负债达到964.72亿元，一年内到期的非流动性负债增加到607亿元，比2019年底增加约30%。
截至2020年3月31日，泰禾的货币资金为55.53亿元，现金及现金等价物余额为41.79亿元，目前的现金流只能覆盖很少一部分短期债务问题。
不过其负债总额同比下降9.10%，净负债率也在2019年底降至243.76%，大幅下降了140个百分点，财务状况有一定改善。
2019年，泰禾为了加速资金回笼，减少债务暴雷风险，就已通过转让项目股权形式与合作方共同开发，累计减少并表项目21个。
虽然确认投资收益约15.5亿元，但导致房地产销售业务收入相比于2018年度减少约72亿元。这样的收益，对于泰禾目前的债务来讲，只是杯水车薪。
5月13日，泰禾连发5个公告，表示将引入战投，引发行业内轩然大波。公告称，此次交易可能涉及公司控制权变更，战略投资者的主要经营业务中包含房地产业务。
有业内人士表示，目前泰禾已经洽谈了包括厦门建发、厦门国贸、中国华融、保利地产、中国金茂等多家意向战略投资者。
据泰禾内部人士对外透露，引入战投成功与否，预计一个月左右时间会出结果。5月28日，厦门国贸对外回应称，没有接盘泰禾的计划。
03
跌出千亿阵容，一季度亏损5.6亿元
2013年开始全国扩张的泰禾，一路上拿下不少地王。在快速增长下，2017年成功晋升为千亿房企。
2017年底时，刚刚晋升千亿的泰禾喊出了2018年冲击2000亿的目标。2018年底，泰禾完成“22城44院”的布局，最终销售额却仅完成1300亿。
不断扩张下的泰禾总负债也从2012年的一百多亿直线飙升到2112亿元，高债务问题引发业内人士担忧。
(image_address=""//n.sinaimg.cn/finance/crawl/101/w550h351/20200529/1309-iufmpmp0300871.jpg"")
泰禾集团董事长黄其森
面对扩张带来的高负债 ，泰禾董事长黄其森曾表示：“泰禾90%以上的项目基本上都做到拿地7-8个月就可以开盘销售。高周转能够有效地规避政策风险和市场风险。我们的策略是不捂盘，以抵抗市场波动带来的风险。”
然而，面对市场环境不佳时，高周转并没有解决泰禾的债务问题，其经营业绩更是不断下滑。
目前泰禾2019年年报暂定为6月份公布，据其2019年主要业绩公告显示，泰禾2019年营收为237亿元，同比下降23%；归母净利润为8.27亿元，同比下降68%。
克而瑞机构统计，泰禾2019年销售额仅有808.7亿元，掉出千亿队列。
屋漏偏逢连夜雨，债务压顶的泰禾2020年又遭遇疫情影响，经营业绩更是大幅度下滑。2020年4月30日，泰禾同时公布了今年一季度的业绩报告。
报告数据显示，泰禾今年一季度营收仅为4.80亿元，相较去年同期减少94%，归母净利润-5.64亿元，同比下降158%，经营活动现金流量净额﹣29.3亿元，同比下降124.55%。
目泰禾手握的核心筹码在于持有的大笔储备货值。据了解，其中在一二线的可售货值有4000多亿元，年内可供销售的货值就有2500亿元。
2020年泰禾能否成功走出困境，或许要在一个月后的战投引入情况明朗才能揭晓！
免责声明：自媒体综合提供的内容均源自自媒体，版权归原作者所有，转载请联系原作者并获许可。文章观点仅代表作者本人，不代表新浪立场。若内容涉及投资建议，仅供参考勿作为投资依据。投资有风险，入市需谨慎。
(image_address=""http://n.sinaimg.cn/finance/cece9e13/20200514/343233024.png"")
海量资讯、精准解读，尽在新浪财经APP
责任编辑：王帅",2020-05-29 16:50:07,新浪财经
2,零售电商江湖变局：京东认购国美1亿美元可转债,"原标题：零售电商江湖变局：京东认购国美宣1亿美元可转债，京东+拼多多+国美能否对抗阿里系？
来源：21世纪经济报道
一个是老牌家电零售商，一个是新零售电商巨头，二者牵手会碰撞出怎样的火花？
5月28日晚，国美宣布与京东完成了1亿美元可转债认购。公告显示，国美向京东发行1亿美金可换股债券，初步股份转换价为每股1.255港元，较国美零售5月28日收盘价及截至5月27日前5个连续交易日平均收盘价溢价37.91%。
资本率先异动，5月29日，国美零售（0493.HK）开盘大涨11%，截至记者发稿，报0.95元，涨幅4.4%。
值得注意的是，今年4月拼多多也以总计2亿美元的可转换债券方式对国美进行战略投资。
京东和拼多多两大电商平台，因国美走到了“同一阵营”。
国美动作频频，又让外界将目光投向了国美的“宿敌”——苏宁。
在国美“失去黄光裕”的十多年里，苏宁早已遥遥领先，背后站着的更是阿里系。随着黄光裕回归将近，加上京东、拼多多、国美的抱团，各大零售平台的竞赛变得愈发有趣。
供应链优势互补
根据国美零售公告，双方同意就产品采购及销售（包括联合采购、联合营销及于京东平台开设国美官方旗舰店，以提升产品竞争力及销售规模）、物流服务、金融服务及其他相关服务开展战略合作。
京东方面表示，此次京东集团与国美零售达成战略合作，是继国美官方旗舰店正式入驻京东平台之后，双方在合作上的进一步深化。根据协议，双方将基于彼此多年沉淀的线上线下优势，实现更加高效的协同和商品供应链的整合互补。
在联合采购方面，基于双方原有的采购优势，国美和京东联合后，形成中国最大的家电采购规模。
供应链输出层面，双方约定，国美将为京东提供家电与“家·生活”整体解决方案等优势性商品，扩充京东平台家电商品品类，而京东将为国美提供非家电商品，扩充国美商品SKU，加速推进全品类进程。
在物流方面，国美旗下安迅物流将为京东提供大家电送装解决方案，届时安迅物流中大件家电的自营物流仓储、配送服务，特别是大家电送装同步服务将向京东全面开放。
此外，国美管家将为京东平台用户提供家电全生命周期管理和“家·生活”服务解决方案。
京东称，此次合作也是京东集团的又一次战略延伸，京东集团曾投资五星电器、迪信通、联想来酷等企业，在线下场景推出了京东电器超级体验店、京东家电专卖店、京东数码专卖店等业态。
国美零售公告称，战略合作可令国美集团运用京东的平台、资源及优势，加快于线上社区的渗透，在数字及实体零售领域更好地为客户合作，与京东的合作符合集团致力发展将社交电商平台，实体店及国美App相融合的创新零售模式策略。 
两大阵营PK
值得注意的是，在4月份，拼多多以总计2亿美元的可转换债券方式对国美进行战略投资。
公开信息显示，国美零售全量商品将上架拼多多，品牌大家电将接入拼多多“百亿补贴”计划。
国美旗下安迅物流、国美管家两大服务平台，将同时成为拼多多物流和家电后服务提供商，两大服务平台将分别为拼多多平台商家提供覆盖全国的中大件物流、仓储及交付服务，以及包含家电维修-清洗保养-以旧换新在内的消费者服务方案。
拼多多则会向国美注入消费大数据、平台流量等优势数字零售资源，双方还将在市场推广等方面展开积极合作。
在与拼多多达成深度战略合作之后，此次国美再度牵手京东，给当下各大零售巨头的“厮杀”再添一把战火。
十多年前，国美与苏宁并称为“零售双雄”，风光无限。随着黄光裕入狱和电商平台的崛起，国美业绩直线下滑。
2019年，国美实现营收602亿元，净利润亏损25.9亿元；同期，苏宁实现营收2692亿元，净利润98亿元。二者规模早已不可同日而语。与此同时，还有拼多多、京东、天猫等后起之秀，2019年，拼多多营收为301.4亿元，京东为5768.9亿元，阿里巴巴集团收入达3768.44亿元，也通通将国美甩在后面。
究其原因，业内普遍认为，是因为国美没有赶上电商的红利。直至今日，其线上业务体系仍未完全建立。
根据中国家用电器研究院和全国家用电器工业信息中心联合发布的《2019年中国家电行业年度报告》显示，在线上，京东、苏宁易购、天猫分别以22.39%、18.09%、11.72%的市场份额位列前三，国美的份额仅4.88%。
此次与拼多多和京东的抱团，国美的意图明显，即在线上平台发力，把失去的追回来。
目前黄光裕仍然以49.12%的持股比例位列国美零售第一大股东，消息面显示，如无意外，黄光裕将在明年2月出狱。
虽然黄光裕身陷囹圄，但这些年每每传出“黄光裕即将出狱”的消息，都引起国美系上市公司的股价暴涨，显示着这位商界奇才对强大的影响力。
当下，电商大促618已近在眼前，京东与苏宁历来相互叫板，如今京东、拼多多、国美三者抱团，虽与阿里系无法用势均力敌来形容，但想必能为今年的618电商大战添上几分精彩。（作者：张赛男）
(image_address=""http://n.sinaimg.cn/finance/cece9e13/20200514/343233024.png"")
海量资讯、精准解读，尽在新浪财经APP
责任编辑：陈志杰",2020-05-29 16:17:58,新浪财经
3,强强联合：招商港口“联姻”阿里 欲建设智慧港口开放平台,"原标题：强强联合！招商港口“联姻”阿里 欲建设智慧港口开放平台
来源：21世纪经济报道
21世纪经济报道记者获悉，28日下午，招商港口与阿里巴巴集团、蚂蚁集团三方签署了战略合作框架协议，拟建设“智慧港口开放平台”，抓住“新基建”政策的风口。
5月29日，招商港口（001872.SZ）股价飘红，涨逾1%。
据知情人士透露，此次合作将整合阿里巴巴、蚂蚁集团和招商港口的产业资源和金融科技优势，结合贸易和港口物流链的业务场景，建立新的开放的贸易物流+金融业务联盟，共同拓展业务生态，实现场景联动、数字闭环、服务创新。
通过招商港口产业资源、阿里巴巴平台资源与蚂蚁集团金融科技相结合，消除贸易和港口物流业务全链路上的信息障碍，解决信息不对称等问题。
根据公开资料显示，截至2019年12月31日，招商港口业务分布26个国家和地区的50个港口。2019年集装箱码头吞吐量达11，293万标准箱，散杂货吞吐量4.9亿吨，货物权益吞吐量位列世界第一。
蚂蚁集团还将依托于金融生态能力，协助解决港口生态圈内中小企业面临的融资难、融资成本高的问题，更好的实现资金流转，并与上下游的合作伙伴建立更加紧密的商业合作关系。
消息一出，引发了市场的广泛关注。
早在3年前，招商港口就已经开始“数字化”战略的布局，2017年9月27日，招商港口旗下“妈湾智慧港”正式开工建设，由传统散杂货码头向智慧型集装箱码头转型升级，设计年吞吐量155万TEU，总投资人民币43.7亿元。今年建成后将拥有两个20万吨级泊位，是粤港澳大湾区第一个应用5G、北斗定位、区块链、人工智能等技术的智慧型港口。
2019年，招商港口对内进一步优化招商ePort客户服务平台，成功上线电子提单、人脸识别无感办单服务；对外与深圳市工业和信息化信局签署了5G智慧港口战略合作协议，携手中国移动深圳分公司、华为技术有限公司等11家单位共建5G智慧创新实验室。
进入2020年后，招商港口为了推动“智慧港口”落地，进一步扩大战略合作版图。3月份，招商港口相继与腾讯公司、平安旗下金融壹账通签署达成战略合作关系，以区块链为底层技术，进一步深化港口产业互联网的合作内容。（作者：杨坪）
(image_address=""http://n.sinaimg.cn/finance/cece9e13/20200514/343233024.png"")
海量资讯、精准解读，尽在新浪财经APP
责任编辑：陈志杰",2020-05-29 16:16:06,新浪财经
4,获南航等2.41亿增资 航旅纵横混改提速,"原标题：获南航等2.41亿增资，航旅纵横混改提速
在被列入央企混改第二批试点名单后，一直在寻找外部投资者的航旅纵横，终于迎来了新股东。
根据航旅纵横的大股东中航信（00696）发布的最新公告，中航信与中航信移动科技、南航资本、空管投资公司、启航资本订立增资协议。南航资本（隶属南航集团）、空管投资公司及启航资本（中航信关联公司）同意向航旅纵横出资合计2.41亿元，南航资本、空管投资公司及启航资本分别持股航旅纵横12%、12%及36%。
航旅纵横原为央企中航信的全资子公司，主要为常旅客提供航班信息服务，此次的增资，是航旅纵横被列入央企混改第二批试点名单后，混改工作实质推进的一部分。
除了南航等外部股东，易程科技也向航旅纵横出资3370.86万元，占据航旅纵横8.39%的股份。易程科技是由航旅纵横核心骨干员工出资的、针对员工激励项目而成立的航旅纵横员工持股平台。
“航旅纵横的混改已经酝酿了好几年，这次入股的完成，标志着混改工作一个重要的节点，选择的几个股东也都挺有意思，”民航业内人士林智杰对记者分析，引入员工持股能够提升国有企业的活力，信息服务业it产业必须要有更加灵活的运营机制；引入空管公司能够帮助稳定地获得航班动态数据，飞机几点起飞几点降落，有没有延误延误了多长时间？这个也是航旅纵横的一个核心的服务能力。
值得注意的是，在此之前，国有三大航就是航旅纵横母公司中航信的股东，其中东航集团占股12.21%、中国航空集团占股9.81%、南航集团占股9.18%。
不过，尽管早有资本联系，但此前三大航与航旅纵横的业务合作并不紧密，南航甚至一度要求包括航旅纵横在内的第三方平台下线在其平台上进行南航航班的值机业务。
而在最近，双方似乎“冰释前嫌”——南航“官方直销机票”悄然在航旅纵横APP上线，与南航并列排在页面上的还有川航、长龙、奥凯等中小型航司，但并无东航，国航和海航的身影。
(image_address=""//n.sinaimg.cn/sinakd2020529s/688/w1080h2008/20200529/7043-iufmpmp0168331.jpg"")
据记者了解，与竞争对手航班管家、飞常准早已开卖机票不同，航旅纵横是在今年才在app上上线机票预订功能，类似航司在OTA上开辟的旗舰店，每交易一笔预定，航旅纵横会从航司获得一定比例的佣金，不过这个比例非常小，因此目前靠此赚到的佣金也不会太多。
事实上，尽管积累的用户数超过5000万，但航旅纵横依然是亏损状态。此次中航信发布的公告中的披露，截至2019年12月31日，航旅纵横亏损5536万元，2018年亏损4848万元。
“对航旅纵横来说，未来面临的主要问题有两个，第一个是找到一个有效的商业模式，怎么做才能赚钱？钱从哪来？”林智杰指出，第二个是作为行业的基础的信息平台，有南航入股的情况下，如何能够保持独立，无差别的为所有航空公司和旅客提供基础服务，是他们必须面对的。
(image_address=""http://n.sinaimg.cn/finance/cece9e13/20200514/343233024.png"")
海量资讯、精准解读，尽在新浪财经APP
责任编辑：陈志杰",2020-05-29 16:13:50,新浪财经
5,新潮能源：因涉嫌信披违规遭证监会立案调查,"新浪财经讯5月29日消息，新潮能源：因公司涉嫌信息披露违法违规，证监会决定对公司立案调查。
(image_address=""http://n.sinaimg.cn/finance/cece9e13/20200514/343233024.png"")
海量资讯、精准解读，尽在新浪财经APP
责任编辑：王帅",2020-05-29 16:11:32,新浪财经
6,新潮能源：涉嫌信披违规 证监会决定对公司立案调查,"新浪财经讯 5月29日消息，新潮能源晚间公告，因公司涉嫌信息披露违法违规，证监会决定对公司立案调查。
(image_address=""http://n.sinaimg.cn/finance/cece9e13/20200514/343233024.png"")
海量资讯、精准解读，尽在新浪财经APP
责任编辑：陈志杰",2020-05-29 16:11:07,新浪财经
