,title,content,pub_time,src
0,甘肃电投：拟参与甘肃电力交易中心增资项目,"新浪财经讯 6月3日消息，甘肃电投晚间公告，公司拟以公开报价方式，参与甘肃电力交易中心增资项目，拟投资比例为甘肃电力交易中心全部股权的9%，对应的最低投资额为1299.7万元。甘肃电力交易中心负责甘肃省电力市场交易平台的建设、使用和管理，是公司电力业务的主要交易平台。参与其增资，有利于公司各控股发电企业更加精准的开展市场电量交易。
(image_address=""http://n.sinaimg.cn/finance/cece9e13/20200514/343233024.png"")
海量资讯、精准解读，尽在新浪财经APP
责任编辑：陈志杰",2020-06-03 15:57:43,新浪财经
1,港股五菱汽车一度涨120% A股汽车板块尾盘拉升,"炒股就看金麒麟分析师研报，权威，专业，及时，全面，助您挖掘潜力主题机会！
原标题：港股五菱汽车一度涨120%，A股汽车板块尾盘拉升丨牛熊眼
6月3日，汽车股尾盘异动，长安汽车、小康股份、福田汽车封板，江铃汽车、众泰汽车、亚星客车等纷纷大幅拉升。
(image_address=""//n.sinaimg.cn/finance/crawl/628/w370h258/20200603/c91b-iumkapw7683180.png"")
消息面上，五菱荣光推出翼开启售货车助推“地摊经济”，该款售货车整车高度2.26米，货厢空间达5300L；左右侧门、后门向上翻启85度角。下边板安装有挂钩可平铺使用，承重力强，扩大货台面积。受该消息影响，港股五菱汽车一度涨幅扩大至120%，报0.45港元。
(image_address=""//n.sinaimg.cn/finance/crawl/32/w550h282/20200603/3ede-iumkapw7683276.png"")
华西证券表示，虽然疫情致销量短期承压，但自3月起环比持续改善，预计2020H2增速有望回正，全年增速约-5%。“刺激政策+首购需求”双重逻辑驱动需求回暖，将催化乘用车板块投资情绪，提升板块风险溢价能力，推荐长安、吉利H、广汽A+H，建议关注长城、上汽。坚定看好“大吉利”及其产业链：吉利拟合并沃尔沃汽车业务开启“全球一体化”模式，孕育吉利产业链新一轮成长机遇，建议关注新泉、拓普、银轮、伯特利。
中国银河证券指出，拥有强周期车型的企业有望最先抢占销量缺口，头部主机厂市占率将持续提升有望对估值形成有力支撑。建议关注有强周期车型以及长期技术车型储备，未来几年业绩相对确定且目前估值水平较低的上汽集团、广汽集团，长城汽车。
天风证券表示，今年2-3月重卡市场受到疫情影响，需求被压制，但随着社会复工，3月中旬开始需求迅速转暖，很多被压制的需求在4月开始得到持续释放。进入5月，重卡生产端也是高负荷生产，呈现产销两旺的势头。分车型来看，物流重卡的需求仍保持高景气，工程车市场需求也在快速回升，未来随着基建持续发力，工程重卡边际大概率将继续改善。据第一商用车网预计，6月份重卡销量有望继续增长，全年来看，行业销量有望在去年的高基数基础上继续实现正增长。继续看好重卡发动机龙头潍柴动力、治理改善的中国重汽H、受益国六升级的威孚高科、重卡整车龙头一汽解放，建议关注中国重汽A。
(image_address=""http://n.sinaimg.cn/finance/cece9e13/20200514/343233024.png"")
海量资讯、精准解读，尽在新浪财经APP",2020-06-03 15:48:16,新浪财经
2,东风汽车：1-5月累计销量为63819辆 同比下降6.03%,"东风汽车：5月份公司汽车销量为18080辆，同比增长33.44%，上年同期为13549辆；1-5月累计销量为63819辆，同比下降6.03%。
(image_address=""http://n.sinaimg.cn/finance/cece9e13/20200514/343233024.png"")
海量资讯、精准解读，尽在新浪财经APP
责任编辑：王帅",2020-06-03 15:48:03,新浪财经
3,诺力股份：实控人及其一致行动人拟减持不超2%公司股份,"新浪财经讯 6月3日消息，诺力股份晚间公告，公司控股股东、实际控制人丁毅其一致行动人丁晟计划自本公告披露之日起15个交易日后的6个月内，拟通过集中竞价或大宗交易等法律法规允许的方式合计减持将不超过535万股的本公司股份，占公司总股本的比例为2%。
(image_address=""http://n.sinaimg.cn/finance/cece9e13/20200514/343233024.png"")
海量资讯、精准解读，尽在新浪财经APP
责任编辑：陈志杰",2020-06-03 15:41:44,新浪财经
4,焦作万方控制权变幻：民营铝电大佬伊电、锦江介入,"焦作万方即将获得两家公司增持，实控人或将变更。
6月3日，焦作万方铝业股份有限公司（证券简称：焦作万方）发布公告，焦作万方的第一大股东樟树市和泰安成投资管理中心（有限合伙）（以下简称“和泰安成”）未来或将持有公司28.32%的股权，成为焦作万方的实际控制人，而杭州正才控股集团有限公司（以下简称“杭州正才集团”）在完成本次发行后将成为焦作万方持股5%以上的股东。
焦作万方表示，通过本次非公开发行融资，前述股东的持股比例显著提升，一方面公司深度绑定了战略投资者，股权结构的稳定性得到了进一步巩固；另一方 面，和泰安成和杭州正才已与公司签署了《战略合作协议》，公司将与和泰安成和杭州正才在工艺改进、人才交流、成本控制等多方面进行合作，助力公司持续发展。
焦作万方2019年报显示，公司2019年实现营业收入47.61亿元，同比减少3.01%，实现归母净利润1.06亿元，相比于2018年的净亏损大幅增长。
公告介绍，焦作万方至今为无实际控制人状态。公司第一大股东和泰安成持有公司 17.30%的股份；第二大股东杭州金投锦众投资合伙企业（有限合伙）持有公司16.41%的股份。
目前，焦作万方与战略投资者和泰安成、杭州正才集团分别签署了《附条件生效的非公开发行股票认购协议》及《战略合作协议》。其中，和泰安成为目前焦作万方的第一大股东，而杭州正才集团与焦作万方的第二大股东杭州金投锦众投资合伙企业（有限合伙）都是钭正刚同一控制下的企业，为一致行动人。
新京报记者注意到，和泰安成的实际控制人为霍斌，霍斌也同时是伊电控股集团有限公司（以下简称“伊电控股”）的实际控制人、董事长。
工商信息显示，和泰安成成立于2017年7月26日，经营范围包括资产管理；实业投资；投资管理；企业管理咨询；商务信息咨询；财务咨询等。和泰安成的两名股东分别为霍斌、
樟树市伊华和泰投资管理有限责任公司。
焦作万方公告介绍，和泰安成2019年营业收入为0，净利润为-2174.95万元。
据焦作万方2019年1月18日公告介绍，霍斌出生于1969年，现任焦作万方董事长。2004年12月至2006年5月，霍斌任洛阳轴承集团有限公司副总经理；2006年5月至2012年12月任洛阳巨创轴承科技有限公司董事长；2013年1月至2015年3月任伊电控股集团有限公司（以下简称“伊电控股”）副董事长兼总经理；2015年3月至2015年12月任伊电控股集团有限公司董事长兼总经理。
从2016年1月起至今，霍斌任伊电控股集团有限公司董事长。同时，霍斌至今也担任焦作万方董事。
伊电控股官网介绍，公司是以铝冶炼为主导，铝加工为龙头，发供电为基础，铝冶炼、铝用碳素、循环经济、地产、贸易、物流、金融一体化发展，跨地区、跨行业的特大型民营企业、中国500强企业。
新京报记者于2月29日报道，伊电控股背后母公司伊川龙泉当时已被列为失信被执行人，被判需对2527.38万元欠款本息承担连带责任，但全部未履行。截至6月3日，伊川龙泉已不再为失信被执行人。
另一方面，杭州正才集团的控股股东为杭州锦江集团有限公司（以下简称“锦江集团”）。锦江集团于1983年创立，目前已是以环保能源、有色金属、化工新材料为主产业，同时集贸易与物流、投资与金融于一体的现代化大型民营企业集团。（记者 林子）
(image_address=""http://n.sinaimg.cn/finance/cece9e13/20200514/343233024.png"")
海量资讯、精准解读，尽在新浪财经APP
责任编辑：陈志杰",2020-06-03 15:31:18,新浪财经
5,“PE教父”天堂硅谷购上市公司遇挫 遭上交所三连问,"原标题：“PE教父”收购上市公司遇挫，遭遇上交所三连问
来源：野马财经
作为资本市场中的梦想实现家，PE机构一直承载着外界太多艳羡期许的目光。在这片土地上有多少人一夜之间平步青云，又有多少人在片刻之内千金散尽。
其中“硅谷天堂系”以“PE教父”的身份，从默默无闻到锋芒出露再到如今的声名鹊起，靠的是精准的战略目光和异于别家的经营模式。
近日，“硅谷天堂系”与德宏股份（603701.SH）的资本联姻再次引来了各方关注的目光，但前几日德宏股份却发布公告称联姻终止，这也引来了上交所问询。
德宏易主终止，“PE教父”联姻遇挫
因重大资产重组停牌的德宏股份于6月1日重新复牌，公司也发布公告称，控股股东张元园与硅谷天堂控股子公司天堂硅谷资产管理集团有限公司无法就控股权转让中的核心条款达成一致意见，决定终止本次控股权转让事项。
引人关注的是德宏股份曾在5月18日发布公告称预计停牌时间不超过10个交易日，5月22日上交所就此交易事项向德宏股份下发了问询函，但德宏股份还没有回复该问询函就率先宣布终止本次控股权转让事项。
接着上交所又对终止事项下发相关问询函，并要求在6月3日之前回复且披露。
因为一个交易事项，上交所已对德宏股份三连问。
(image_address=""//n.sinaimg.cn/finance/crawl/68/w550h318/20200603/508c-iumkapw7590057.jpg"")
图片来源：巨潮网
据悉该交易原计划德宏股份控股股东张元园与硅谷天堂的控股子公司天堂硅谷签署合作框架协议，张元园拟转让29.99%名下股权给天堂硅谷或其指定方。标的股份的转让价格拟为17.32元/股，转让总价款拟为10.496亿元。
这项交易若没有终止的话，天堂硅谷或其指定方将持有上市公司29.99%的股权及公司表决权，成为上市公司控股股东。公司实际控制人将由张宏保、张元园变更为王林江和李国祥，也即是说PE教父将入主德宏股份。
消息一出，市场哗然，毕竟，于2016年正式上市的德宏股份未满五岁便被张元园插标卖首，实不寻常。
浙江德宏汽车电子电器股份有限公司是一家致力于汽车发电机研究开发的专业生产制造商，前身为湖州德宏汽车电机厂，成立于2000年1月，属于当时中湖集团将与汽车电机业务相关产业分离时形成的产物。
2001年湖州德宏汽车电机厂改制为湖州德宏汽车电器系统有限公司，与改制相比更为深远的影响，则在于引入了德宏日后的壮大的引路人——张宏宝为首的40位自然人股东。
接下来的近十年，虽然发生了数次股权转移事项，但德宏城头插的“张”家大旗已然稳固。
2009年，德宏再次变更公司名称，由“湖州德宏汽车电器系统有限公司”到“浙江德宏汽车电器系统有限公司”简单的名头转换，不难看出身后浓重的野心。
果然，公司在一年后完成了股份制改制，摇身一变成为浙江德宏汽车电子电器股份有限公司，为进一步发展铺平垫稳。
经过多年的发展沉淀，做大做强，德宏终于在2016年成功登陆上交所。虽然发行价格敲定在了13.5元每股，但市场热情的反馈甚至将初期的股价最高抬升至80元左右。
曾经如此辉煌成绩的公司，虽然本次交易并未成功，但德宏股份要改弦更张转给硅谷天堂的“资本联姻”，令人好奇其中的因果缘由。
德宏易主之谜
根据德宏公告说法，本次重组的原因是基于实际控制人夫妇健康原因和年龄情况以及现任董事长，即实控人之女的意向，为了将德宏发展壮大而进行的。
企业观察员孙艺源对野马财经（微信公号：ymcj8686）表示，将德宏交出去固然有为公司发展添砖加瓦的因素，但明眼人不难看出，其实张氏掌舵者抽身离开，也是基于对当前德宏发展状况的判断下，急流勇退明哲保身的明智选择。
尽管德宏在上市初期打响了头炮，但遗憾的是这一上升趋势并未能维持长远，反而每况愈下。
从股价上来看，虽有13.5元开盘最高时涨到80元/股，但其后每况愈下，由8至7，由7跌6，由6降5，循环往复，目前已经达到低于发行价格的12.55元/股；
与之相符的则是公司不尽如人意的业绩。自上市以来，公司的经营指标一直不太稳定。营业收入从2016年的4.16亿元，勉强上升至2019年的4.76亿元；净利润方面虽然自2016年起逐渐攀升，最高时在2018年度升至1.11亿，奈何2019年画风突变，以低于上期48.11%的5751.36万元净利润。
(image_address=""//n.sinaimg.cn/finance/crawl/685/w550h135/20200603/d4fc-iumkapw7590187.jpg"")
图片来源：同花顺
另外，从盈利能力指标来看。净利率从2018年的24.08%下降至19年的12.12%、毛利率从16年的34.95%逐年降至最新的29.80%。此外，就连表现相对优秀的净资产收益率也从18年的17.24%腰斩至19年的8.32%。
值得一提的是，就在德宏股份与天堂硅谷签订合作框架协议的同时，又与杭州伯坦科技工程有限公司签订了资产重组协议，德宏筹划以发行股份或可转换债券及支付部分现金的方式收购杭州伯坦科技工程有限公司100%股权并募集配套资金；
前手刚刚将控制权转移出去，后手却又考虑要并入新的公司，不难想见，幕后的推手，定是天堂硅谷，以及隐藏其背后的硅谷天堂等一干”硅谷天堂系”资本力量。
毕竟，这种独具特色的资本操作手法对于“硅谷天堂系”来说，已是再熟悉不过了。
“硅谷天堂系”起源
截至2019年底，天堂硅谷总资产19.7亿元，净资产16.6亿元。天堂硅谷的母公司为硅谷天堂资产管理集团股份有限公司，截至2019年年底总资产68亿元，净资产63亿元，可谓实力雄厚。
根据公开信息显示，天堂硅谷所投资企业约90家，涵盖多个领域，已经形成了一个健全的投资体系。而从”硅谷”系整个集团的层面来看，这不过是庞大资本帝国的冰山一角而已。
“硅谷”系的主力军当数硅谷天堂资产管理集团股份有限公司，成立于2006年，注册资本5000万元。2011年11月，公司整体变更为硅谷天堂资产管理集团股份有限公司。
截至目前，第一大股东山水控股持有公司45.13%股份，硅谷天堂董事长王林江、副董事长李国祥分别持有山水控股50%的股权，为公司实际控制人。两人均曾任职于老牌国企钱江水利。
“硅谷天堂系”此前一直默默无闻，直到斯太尔之战才一炮打响初露头角。
2012年11月，硅谷天堂以5亿元的价格向博盈投资出售了其一手培育的斯太尔动力公司，该公司是硅谷天堂不久前以2.84亿元的价格收购的，片刻之间便赢得了2.16亿元的利润。
棋高一招的是，硅谷天堂并未安于现状，而是拿出2亿元认购博盈投资的定增，获得重组后的博盈投资7.61%的股权。截至7月10日，这部分股份市值高达5.3亿元。粗略估算，在博盈投资中，硅谷天堂盈利约3.5亿元。
这种精妙操作在当年的中国产融资本高峰论坛上，就连硅谷天堂合伙人、董事总经理韩惠源都直言，将硅谷天堂并购博盈称为近几年来最满意的投资。
随后，”硅谷天堂系”开始了自己独特的“PE+上市公司”模式。而公司产品也分为了三大类：并购整合、创业投资和资本管理。
该模式分为三步走，首先选择合作的上市公司，然后充当财务顾问的角色对标的公司价值进行相应塑造引导，最后通过前期的了解以及中期的培育，决定后期是否选择战略入股。
凭借这套模式，公司先后与广宇集团（002133）、京新药业（002020）、合众思壮（002383）、升华拜克（600226）上市公司签订了合作协议。
2015年成功登陆新三板，说明该模式对于硅谷天堂的发展提供了强大动力。
2017年，硅谷天堂所投资的公司自行IPO的有8家，借壳上市1家，成绩斐然。
在2020年1月，硅谷天堂成功买下了知名“口罩股”欣龙控股（000955，SZ）的控制权，在硅谷天堂看来，取得欣龙控股控制权，是公司在控股型收购方面实现的重要布局。
16年业绩突然缩水，“硅谷天堂系”今如何？
然而，目前硅谷天堂的情况却似乎没有了以往的那般辉煌。
根据公开数据显示，硅谷天堂目前的股票价格跌落至0.81元/股，成交额仅为9.14万，而35.9亿的市值较巅峰时期缩水了近10倍。 
天上地下的分界线，出现在2016年，让“硅谷”系跌落王座的缘由，竟然也是由于其多元化的经营战略。
2016年A股市场波动剧烈，由于硅谷天堂管理着巨大规模的证券基金及定增基金，因此A股市场上的资本运作一起，就总能看到硅谷天堂的身影。自硅谷天堂半年报起，低迷之相便初现，营业收入1.84亿元，同比降低77.56%；实现归属于挂牌公司股东的净利润5316.80万元，同比减少92.19%；基本每股收益0.01元，同比减少97.80%。
可在这种不利情况下，公司当年依然发布了3.55亿元的现金股利利润分配方案。
到了年底，硅谷天堂营业收入实现9.51亿元营业收入，同比下滑41%；净利润5.3亿元。下滑55%，其中公允价值变动损益和投资收益两项，从2015年度的13.5亿元下降至2016年度的6.7亿元，是当年年度业绩不佳的主要原因之一。
大额股利发放后对股价的拉低效应加上经营业绩下滑，使得公司当年股价由年初的29元直线下降到年末的6.23元。也是从那年开始，本能与同在新三板挂牌的信中利（833858）、明石投资等私募机构一起争雄的硅谷天堂，渐渐的掉了队。
如今，信中利股价达到5.32元，明石创新（832924）每股股价2.57元，与之相比硅谷天堂相形见绌。
从自成一派的“PE教父”收购德宏股份遇挫，虽未能为“硅谷天堂系”注入强心剂，但后续是否还会有新的举动吗？你看好“硅谷天堂系”吗？
免责声明：自媒体综合提供的内容均源自自媒体，版权归原作者所有，转载请联系原作者并获许可。文章观点仅代表作者本人，不代表新浪立场。若内容涉及投资建议，仅供参考勿作为投资依据。投资有风险，入市需谨慎。
(image_address=""http://n.sinaimg.cn/finance/cece9e13/20200514/343233024.png"")
海量资讯、精准解读，尽在新浪财经APP
责任编辑：王帅",2020-06-03 15:27:38,新浪财经
6,西藏珠峰：目前免税品有限公司收入、利润规模较小,"西藏珠峰6月3日在互动平台表示，西藏珠峰中免免税品有限公司为公司参股子公司，其控股股东为中国免税品（集团）有限责任公司。公司参股该公司已多年。目前中国免税渠道占全球免税市场份额大幅低于国人全球消费贡献度，未来中国免税全球份额提升可期。目前西藏珠峰中免免税品有限公司收入、利润规模较小，对公司整体业绩基本不产生影响。
(image_address=""http://n.sinaimg.cn/finance/cece9e13/20200514/343233024.png"")
海量资讯、精准解读，尽在新浪财经APP
责任编辑：王帅",2020-06-03 15:22:44,新浪财经
7,万科旗下万纬物流类首期REITs产品今日正式挂牌 发行规模5.732亿,"原标题：万科旗下万纬物流类首期REITs产品今日正式挂牌 发行规模5.732亿元 
6月3日，万科旗下万纬物流首期类REITs产品“万纬物流-易方达资产-物流仓储1期资产支持专项计划”（以下简称“万纬物流首期类REITs”）在深交所举行挂牌仪式。此次发行的首期类REITs规模为5.732亿元，其中优先级证券规模为2.95亿元（获中诚信AAAsf评级），权益级证券规模为2.782亿元，产品期限为3+3+2年。
万纬物流是万科集团旗下成员企业。2015年，万科集团正式推出独立物流品牌——万纬，经过五年发展，已成为国内出色的多温区综合物流解决方案服务商，万纬物流目前可为客户提供高标准的仓储设施及多元化的冷链物流服务。万纬物流的核心业务聚焦于全国六大城市群，覆盖47个主要城市，拥有144个物流园区，全国在建及运营管理25个冷链物流园，仓储规模超过千万平方米。
作为万纬物流在交易所市场发行的首个类REITs，本次产品最大的亮点在于最大限度参考了境外成熟市场REITs模式，采用了“纯权益型”结构且底层物流园完全采用市场化方式进行运营和管理，产品运营期间和退出收益全部来源于底层物流园的运营净现金流以及资产增值。
截至目前，万纬物流的类REITs产品已获得中国民生银行、兴业银行、中国邮政储蓄银行、招商银行等多家机构的投资。此次产品的成功发行，意味着万纬物流的项目开发与管理能力受到了资本市场的认可。（刘礼文）
(image_address=""http://n.sinaimg.cn/finance/cece9e13/20200514/343233024.png"")
海量资讯、精准解读，尽在新浪财经APP
责任编辑：陈志杰",2020-06-03 15:10:45,新浪财经
