,title,content,pub_time,src
4,长城影视、千金药业进场：网红概念股遍地开花 谁的盛宴？,"炒股就看金麒麟分析师研报，权威，专业，及时，全面，助您挖掘潜力主题机会！
原标题：李佳琦、薇娅……长城影视（维权）、千金药业……网红概念股遍地开花，谁的盛宴？
记者 梅岭
5月以来，多家A股上市公司因牵手网红获市场追捧。据东方财富统计，目前A股上市公司“网红直播”概念股达49只，网红概念股呈遍地开花之势。
其中，也有多家上市公司一边重申网红直播对业绩不会带来较大影响，一边股价被疯狂炒作，连续涨停冲高，实控人、股东“顺势”减持套现。
5月19日后，网红概念股又要增加了。
5月19日盘后，因涉嫌信披违规正被证监会立案调查的长城影视（002071.SZ）发布与“十方美播”平台开展战略合作的公告，表示将拓展“网红+直播+短视频”新零售供应链生态圈，签约知名网红、知名影视明星并孵化自有网红，与品牌企业进行“直播带货”的销售服务。
签约完成后，长城影视旗下所有的实景娱乐，旅游景区，影视基地将成为十方美播的独家网红直播基地，长城影视通过影视圈的明星资源，网红资源为十方美播输出明星，网红经济服务合作，年度服务知名明星，大牌网红数量不少于100人次。
此外，长城影视为十方美播定制宣传策划，短视频内容，基础服务费用不少于5万元/月，双方共同服务的网红+直播+短视频供应链品牌商营业额不少于10亿元/年。
长城影视认为，通过本次战略合作，有利于公司广告营销板块业务模式的转型升级。
5月19日，长城影视股价报收1.58元/股，上涨0.64%。
同日，千金药业（600479.SH）在互动平台上表示，子公司千金养生坊与薇娅有合作，对公司研究院自主研发的产品天然洗衣液进行了直播带货。午盘后，千金药业股价直线拉升，大幅上涨3.38%，截至收盘，千金药业报收9.29元/股，上涨4.74%。
此前，已有多家上市公司宣布牵手网红后股价大涨，多只个股遭到相关部门问询，要求公司说明是否存在主动迎合热点，炒作股价的情形。
中南财经政法大学数字经济研究院执行院长盘和林5月19日对界面新闻记者表示：“确实不少公司在蹭网红的热点，但实际上整个网红经济目前看来对A股的业绩贡献并不大， 而且目前网红这种模式都是靠流量，低价，很难产生很高的价值，这里面有存在一定的泡沫，投资者还是要警惕，整个从目前看来，网红概念并不一定就会带来业绩正相关的增长。”
5月15日，金字火腿（002525.SZ）旗下人造肉系列新品登陆罗永浩直播间，当天公司股价封上涨停板。今年1月初，金字火腿宣布旗下产品牵手李佳琪，直播5分钟内销售额突破10万包，销售额突破300万元，次日公司股价封上涨停。
在金字火腿搭上网红经济引发股价上涨的同时，金字火腿实际控制人陆续减持了超过2亿元的股份。深交所曾对其下发关注函，要求公司说明是否存在互动易平台主动迎合热点，炒作股价并配合减持的情形。
与薇娅、李佳琦等头部网红直播多次合作的御家汇（300740.SZ）5月19日封上涨停板，该股近期股价暴涨，5月以来，御家汇股价累积上涨幅度超过70%。
深交所在5月14日对御家汇下发关注函，表示有媒体报道公司为网红经济概念的代表公司，要求公司就市场关注的网红经济对公司业务发展及财务数据的影响作出说明，并就此进行充分的风险提示。
5月17日，御家汇对此进行回复表示网络直播只是御家汇品牌的宣传推广手段，对公司经营业绩影响较小。2019年，御家汇通过网红直播、短视频推广模式带来的收入站公司全年营业收入的比重为10%，对公司经营业绩影响较小。受此影响，5月18日御家汇跌停。
据介绍，2019年，御家汇与李佳琦直播合作47次，薇娅合作超过30次，全年直播累积超过8000场，但这并没有挽救公司全年净利润同比下降79%的业绩表现。此外，去年全年，御家汇销售费用达10.4亿元，占当期营业收入的43.1%。
5月11日，梦洁股份（002397.SZ）宣布公司与电商直播机构签订相关战略合作，将与主播薇娅在多方面开展合作后至今，梦洁股份已拉出6个涨停板，5月19日，梦洁股份报收8.50元/股，创下该股三年来的历史新高。
5月18日，深交所对梦洁股份下发关注函，要求公司说明是否存在利用其他非信息披露渠道主动迎合“网红直播”市场热点进行股价炒作并配合股东减持的情形。
整个2019年，线上收入占比梦洁股份营收比约为15%。在公司连续拉出涨停板的同时，梦洁股份实际控制人前妻伍静在5月12日-5月14日期间套现3500万元，合计卖出600万股。
虽然上述网红概念股都在不同情况下表示与网红直播对公司的生产经营不会产生重大影响，但这并没有降低市场对网红直播的热情。盘和林对界面新闻记者表示：“网红带货可能会出现销量增加，利润并不增加，但最终企业都要回归到利润上。”
根据艾媒咨询数据显示，直播电商市场规模从2017年的190亿元增长到2019年的4338亿元，预计2020年将达到9610亿元。
“网红直播一直会存在，而且我觉得是一个不错的、新的销售场景，但是不宜过高的去拔高它。此外目前的商业模式可能还有待改变，目前很多都是靠价格来吸引流量，这对企业短期来说没有太大的好处。”盘和林表示。
(image_address=""http://n.sinaimg.cn/finance/cece9e13/20200514/343233024.png"")
海量资讯、精准解读，尽在新浪财经APP
责任编辑：陈志杰",2020-05-19 21:24:33,新浪财经
5,鹏博士2019全年亏损57.5亿元 此前23亿转让数据中心,"(image_address=""//image.sinajs.cn/newchart/png/min/new_min/n/sh600804.png"")
热点栏目
自选股
数据中心
行情中心
资金流向
模拟交易
客户端
历经一次延期之后，鹏博士2019年年报于5月19日晚间出炉，在报告期内公司实现归属净利润约为-57.51亿元，同比由盈转亏。
财务数据显示，2019年鹏博士实现营业收入约为60.5亿元，同比下降11.81%；当期对应实现归属净利润约为-57.51亿元，同比大幅下降1610.74%。在去年同期，鹏博士实现归属净利润约为3.81亿元。
对于业绩变动的原因，鹏博士表示，2019年度公司计提商誉减值准备19.99亿元，计提固定资产减值准备30.75亿元，计提坏账准备及其他资产减值损失等4.17亿元。
(image_address=""//n.sinaimg.cn/sinakd2020519s/191/w565h426/20200519/2a98-itvqcca5193268.png"")
此前在4月30日公布的一季报显示，公司2020年第一季度实现归属于上市公司股东的净利润8134.17万元，较上年同期上升57.70%。扣非净利润4450万元，较上年同期增幅达149.73%。
一季报发布前夕，4月27日，鹏博士发布公告称，拟以23亿元人民币转让其数据中心相关资产，交易受让方为平盛国际、锦泉投资。
鹏博士方面表示，本次交易将实现公司数据中心业务“轻资产、重运营”的战略转型，由传统的“自建自营”模式向多元化合作模式转型，输出数据中心运营服务能力，与投资方等合作伙伴共享运营收益。
但此举还是遭到上交所的问询，上交所要求鹏博士“分项列示标的资产所属各经营主体、各经营主体资产负债情况、以及各经营主体中所涉标的资产比重，详细说明本次拟出售资产在原业务体系中切割的方式、依据和考虑”。
(image_address=""http://n.sinaimg.cn/finance/cece9e13/20200514/343233024.png"")
海量资讯、精准解读，尽在新浪财经APP
责任编辑：陈志杰",2020-05-19 21:24:26,新浪财经
6,晚间公告热点追踪：华谊兄弟与阳光人寿战略合作议案被否,"炒股就看金麒麟分析师研报，权威，专业，及时，全面，助您挖掘潜力主题机会！
华谊兄弟：股东大会否决与阳光人寿建立战略合作关系的议案
华谊兄弟披露2019年年度股东大会决议公告称，此次股东大会存在否决议案的情况，被否决的议案为：关于与阳光人寿签署附条件生效的非公开发行股份认购协议、关于与阳光人寿签署附条件生效的战略合作框架协议。在推进战略合作的过程中，现场投反对票的股东考虑到公司与阳光人寿双方对部分具体合作内容尚未完全达成一致，因此认为双方通过本次非公开发行股票建立战略合作关系的时机尚不成熟。
鹏博士：2019年亏损57.5亿元 数据中心及云计算业务收入增17.69%
鹏博士披露年报，2019年度，公司营收为60.5亿元，同比下降11.81%；净利为亏损57.5亿元，上年同期盈利3.8亿元。2019年度公司计提商誉减值准备19.99亿元，计提固定资产减值准备30.75亿元，计提坏账准备及其他资产减值损失等4.17亿元。报告期，公司互联网接入业务收入同比下降21.20%，数据中心及云计算业务收入同比上升17.69%。
重大事项
国轩高科：实控人等筹划股权转让 公司控制权或将变更
轴研科技：股价异动 子公司从中芯国际下属子公司获得的订单具有偶发性
重组与融资
浙商证券：拟定增募资不超100亿元 发展主营业务
中创环保（维权）：终止筹划现金收购重大资产重组事项 后续拟采用并购基金方式收购
银泰黄金：终止重大资产重组事项
新界泵业：重组事项获证监会有条件审核通过 股票复牌
*ST劝业：重组事项将上会 股票停牌
投资与经营
合锻智能：2019年净利2731万元 拟10派0.20元
精伦电子：2019年亏损6764.41万元
长城影视（维权）：与“十方美播”平台战略合作 将拓展“网红+直播+短视频”新零售供应链生态圈
新希望：子公司发起设立伊春新希望畜牧产业发展基金
科沃斯：与美国上市公司iRobot签署业务合作协议
三星医疗：全资子公司拟5.17亿元收购关联方所持奥克斯产业管理100%股权
万邦达：约1.5亿元中标项目不再签署项目合同
龙建股份：中标3.96亿元工程项目
达实智能：签订近5700万元智慧医疗项目
同益股份：拟6000万元设立两家全资子公司
绿色动力：拟设项目公司 负责朔州生活垃圾焚烧发电项目的投建及运营
康德莱：子公司1940万竞得温州市滨海新区龙湾工业园国有建设用地使用权
中国联通：广西联通与合作方签署综合改革合作协议
中电兴发：参与广西联通综合改革合作项目
金城医药：子公司多个药品获得再注册批件
道恩股份：熔喷料业务相关合资公司已完成工商注册登记手续
增持与减持
吉艾科技：青科创实业5.4亿元受让公司19.66%股份 将成控股股东
安德利：股东陈学高以3.38亿元协议转让公司9.63%股份
南风股份（维权）：南海控股增持公司1.07%股份 持股比例达10.59%
雷科防务：股东华融华侨拟减持不超3%公司股份
万里石：股东金麟四海拟减持不超2%公司股份
正海生物：股东Longwood拟减持不超2%公司股份
新力金融（维权）：股东张敬红拟减持不超1%股份
银禧科技：控股股东及其一致人拟减持不超1%公司股份
利通电子：股东张德峰减持100股 持股降至4.9999%
坚瑞沃能：自然人郑俊波拍得股东郭鸿宝所持公司196万股股份
南京熊猫：实控人增持公司866.4万股H股
其他事项
一汽轿车：更名为“一汽解放”
容大感光：股价异动 新建的募投项目光刻胶及其配套化学品预计5月底前正式投产
申通地铁：投资70%份额的建元基金持有华大九天股份 公司只是财务投资者
中信证券：公开发行不超500亿元公司债获批复
平安银行：获准发行不超500亿元小微企业贷款专项金融债券
闻泰科技：云南省国资委将持有的云南城投集团50.59%股权划转注入云投集团
华光股份：拟更名为“无锡华光环保能源集团股份有限公司”
乐歌股份：调整公开发行可转债方案
*ST辉丰（维权）：辉丰转债自5月25日起暂停上市
(image_address=""http://n.sinaimg.cn/finance/cece9e13/20200514/343233024.png"")
海量资讯、精准解读，尽在新浪财经APP
责任编辑：陈志杰",2020-05-19 21:18:14,新浪财经
7,长源电力：重组拟收购湖北电力100%股权,"新浪财经讯 5月19日消息，长源电力晚间公告，公司拟向控股股东国家能源集团发行股份及支付现金购买其持有的湖北电力100%股权。同时，拟向不超过35名特定投资者定增募资不超16亿元。以本次交易标的公司未经审计的财务数据初步测算，此次交易构成重大资产重组。标的公司主营业务为电力、热力的生产和销售。交易完成后，上市公司的资产规模、收入规模和利润规模进一步扩大。
(image_address=""http://n.sinaimg.cn/finance/cece9e13/20200514/343233024.png"")
海量资讯、精准解读，尽在新浪财经APP
责任编辑：陈志杰",2020-05-19 21:18:06,新浪财经
8,联通与中兴通讯签6G战略协议：联手研究潜在关键技术,"原标题：联通与中兴通讯签6G战略合作协议：将联手研究潜在关键技术
中国联通和中兴通讯在6G领域进行战略合作。
澎湃新闻记者获悉，5月17日，中国联通与中兴通讯公司签署6G战略合作协议。根据战略合作协议内容，双方将充分发挥各自在6G领域的创新优势，针对中国联通网络和业务情况，共同探讨6G目标愿景和技术趋势，开展6G系统潜在关键技术研究，开展技术创新及标准合作，实现战略协同发展。
6G是5G后的下一代移动通信技术，预计将在2030年会正式商用。4月17日，工业和信息化部召开数字基础设施建设推进专家研讨会。会议要求加快数字基础设施核心技术和应用技术协同攻关，加大5G增强技术、6G技术研发支持力度，推动创新链、产业链、资金链、政策链的精准对接。加快5G建设进度，加大6G技术研发支持力度。
据了解，2020至2023年将是6G网络需求、结构与使能技术的研究窗口。
中国联通方面表示，该公司与中兴是长期合作伙伴，在网络技术方面有深入的合作并取得过丰硕成果，后续联通将与中兴持续加强6G创新技术方面的合作研究。一方面双方将围绕着6G技术创新及标准推动进行合作，另一方面也将积极推动6G与卫星网络、物联网、车联网、工业互联网深度融合，实现运营商服务和业务的拓展。
中兴通讯方面表示，面向2030年的6G网络，中兴通讯将不遗余力持续推进与联通的战略合作，双方将针对6G高潜关键技术，包括空天地一体化技术、太赫兹通信技术、可见光通信技术等内容展开研究，并通过测试、试验验证其技术可行性，以实现1Tbps峰值数据率、20Gbps用户数据率、100Gbps/m3业务容量等KPI的6G网络性能目标。
]article_adlist-->
(image_address=""http://n.sinaimg.cn/finance/cece9e13/20200514/343233024.png"")
海量资讯、精准解读，尽在新浪财经APP
责任编辑：王帅",2020-05-19 21:17:13,新浪财经
9,乐心医疗：拟定增募资不超5.97亿元 用于TWS耳机等项目,"新浪财经讯 5月19日消息，乐心医疗晚间披露非公开发行股票预案，发行数量不超3425万股，募集资金总额不超过5.97亿元，扣除发行费用后将用于“健康智能手表生产线建设项目”、“基于传感器应用的智能货架生产线建设项目”、“TWS耳机生产线建设项目”和“研发中心建设项目”四个项目。
(image_address=""http://n.sinaimg.cn/finance/cece9e13/20200514/343233024.png"")
海量资讯、精准解读，尽在新浪财经APP
责任编辑：陈志杰",2020-05-19 21:07:04,新浪财经
10,吉艾科技：青科创实业受让公司19.66%股份 将成控股股东,"(image_address=""//image.sinajs.cn/newchart/png/min/new_min/n/sz300309.png"")
热点栏目
自选股
数据中心
行情中心
资金流向
模拟交易
客户端
吉艾科技5月19日晚间发布公告称，公司控股股东、实控人高怀雪与青科创实业签订股权转让协议，拟协议转让其持有的1.74亿股，占公司总股本19.66%。每股转让价格为3.1元，转让总价款5.4亿元。
公告显示，本次权益变动后，青科创实业将合计持有上市公司174，200，000股股份，占上市公司总股本的19.66%，上市公司控股股东将变更为青科创实业，实际控制人将变更为刘钧。高怀雪不排除在未来12个月继续减持股份的可能。
据公告，截至《股份转让协议》签署日，高怀雪所持上市公司股份中共有91，260，000股股份办理了质押，其中37，260，000股涉及本次转让，高怀雪以该部分股份为上市公司向中国民生银行股份有限公司的融资进行了质押担保，其转让采取带质押转让的方式过户至青科创实业名下。
此前，吉艾科技发布2019年年报显示，公司2019年1-12月实现营业收入11.82亿元，同比增长37.03%，保险及其他行业已披露年报个股的平均营业收入增长率为15.80%；归属于上市公司股东的净利润-11.91亿元，同比下降713.09%。
同时，公司发布发布2020年第一季度业绩报告显示，公司2020年1-3月实现营业收入653.96万元，同比下降97.07%，归属于上市公司股东的净利润-1.10亿元，同比下降247.22%。
关于2020年一季度业绩变化原因，公司表示：报告期内受疫情影响，AMC板块的项目处置进度持续延期，底层资产的变现能力和变现速度受限，营业收入较上年同期大幅减少。公司后续将密切关注疫情进展情况并积极应对，降低疫情对公司经营情况的影响。
(image_address=""http://n.sinaimg.cn/finance/cece9e13/20200514/343233024.png"")
海量资讯、精准解读，尽在新浪财经APP
责任编辑：陈志杰",2020-05-19 21:02:03,新浪财经
11,华谊兄弟：股东大会否决与阳光人寿建立战略合作关系,"新浪财经讯5月19日消息，华谊兄弟披露2019年年度股东大会决议公告称，此次股东大会存在否决议案的情况，被否决的议案为：关于与阳光人寿签署附条件生效的非公开发行股份认购协议、关于与阳光人寿签署附条件生效的战略合作框架协议。在推进战略合作的过程中，现场投反对票的股东考虑到公司与阳光人寿双方对部分具体合作内容尚未完全达成一致，因此认为双方通过本次非公开发行股票建立战略合作关系的时机尚不成熟。
(image_address=""http://n.sinaimg.cn/finance/cece9e13/20200514/343233024.png"")
海量资讯、精准解读，尽在新浪财经APP
责任编辑：王帅",2020-05-19 21:00:42,新浪财经
