,title,content,pub_time,src
0,寒武纪将于7月20日科创板上市 发行价64.39元,"原标题：寒武纪将于7月20日科创板上市，发行价64.39元丨热公司
7月16日，寒武纪发布公告称，该公司股票将于2020年7月20日在上海证券交易所科创板上市，发行价为64.39元/股。本次发行后公司总股本为40，010.00万股，其中上市初期无限售条件的流通股数量为3，110.4785万股，占本次发行后总股本的比例为7.77%。
据公告，2020年1-6月，寒武纪预计营业收入约为8200万元至8600万元，预计同比下降约12.24%至16.32%，主要系预计从华为海思取得的终端智能处理器IP授权业务收入同比下降较大以及受新冠肺炎疫情的不利影响。2020年1-6月，公司预计净利润为-23000万元至-21000万元，主要系预计研发投入大幅增加造成净利润下滑。
寒武纪科技是一家AI芯片研发商，致力于打造各类智能云服务器、智能终端以及智能机器人的核心处理器芯片，同时还为用户提供IP授权、芯片服务、智能子卡和智能平台等服务。
天眼查数据显示，寒武纪的运营主体中科寒武纪科技股份有限公司成立于2016年3月，法定代表人、最终受益人为寒武纪CEO、创始人陈天石。
本次发行前，公司控股股东陈天石直接持有公司33.19%的股份，并作为艾溪合伙的执行事务合伙人控制艾溪合伙持有公司8.51%的股份，陈天石合计控制公司41.71%的股份，为公司的实际控制人。
(image_address=""//n.sinaimg.cn/finance/cece9e13/20200514/343233024.png"")
海量资讯、精准解读，尽在新浪财经APP
责任编辑：张熠",2020-07-16 20:59:49,新浪财经
1,厦门银行将成为A股今年首家上市银行 还有18家银行在排队,"炒股就看金麒麟分析师研报，权威，专业，及时，全面，助您挖掘潜力主题机会！
原标题：厦门银行将成为A股今年首家上市银行，还有18家银行在排队
7月16日，根据证监会网站消息，第18届发审委2020年第105次会议审核结果公告显示，厦门银行（首发）获通过。这意味着，今年A股迎来了首家银行IPO。
审核公告显示，虽然证监会通过了厦门银行的过会申请，证监会也指出厦门银行存在的一些问题：厦门银行贷款主要集中于制造业、批发零售业和房地产行业，部分为住宿和餐饮等行业；截至2019年末，作为原告涉及金额合计约28.05亿元；厦门银行理财业务规模较大，主要投资于债券；2017年，厦门银行曾因非保本理财产品违规出具担保而被中国银监会厦门监管局行政处罚。
厦门银行IPO排队3年之久
从2017年6月13日向厦门证监局递交辅导备案登记材料，到今年7月16日上会，已经有3年多的时间。
2017年12月1日，厦门银行在证监会网站披露了该行的A股招股说明书。2018年9月7日，证监会对厦门银行的招股说明书进行了公开反馈，从规范性问题、信息披露问题、与财务会计资料相关的问题、其他问题等4个方面，证监会共提出了64条反馈意见。2018年10月9日，厦门银行再次在证监会网站上披露了招股说明书。自此之后，厦门银行的IPO便进入到了等待期。
2019年厦门银行净利润增长22.69%，不良率为1.18%
根据厦门银行2019年年报，截至2019年末，厦门银行资产总额为2469亿元，同比增长6.22%。2019年，厦门银行的营业收入为45.09亿元，同比增长7.73%；净利润为17.36亿元，同比增长22.69%。
截至2019年末，厦门银行发放贷款及垫款总额为1081.70亿元，较上年末增长29.77%。按照行业划分的企业贷款及垫款分布情况显示，2019年，厦门银行的批发和零售业占比24.41%、制造业占比19.05%、房地产业占比19.51%。
资产质量方面，截至2019年末，厦门银行的不良贷款率为1.18%，较上年末下降0.15个百分点；拨备覆盖率为274.58%，同比上升61.75个百分点。
资本充足率方面，截至2019年末，厦门银行的资本充足率为15.21%，一级资本充足率为11.16%，核心一级资本充足率为11.15%。
富邦金控入股厦门银行，成为台湾金融机构直接入股陆资银行的首例
截至2019年末，厦门银行的前十大股东和持股情况分布为：厦门市财政局持股20.21%，富邦金融控股股份有限公司（下称富邦金控）持股比例为19.95%，北京盛达兴业房地产开发有限公司持股比例为10.65%，福建七匹狼集团有限公司持股比例为8.90%，厦门港务海润通资产管理有限公司持股比例为4.99%，佛山电器照明股份有限公司持股比例为4.62%，大洲控股集团有限公司持股比例为4.21%，泉舜集团（厦门）房地产股份有限公司持股比例为3.90%，厦门华信元喜投资有限公司持股比例为2.52%，江苏舜天股份有限公司持股比例为2.10%。
值得一提的是，2018年11月30日，富邦金控完成受让其全资子公司富邦银行（香港）所持有的厦门银行19.95%的股份，取代以往通过第三地子公司间接参股的方式，直接成为厦门银行的第二大股东，成为台湾金融机构直接入股陆资银行的首例。
厦门银行成立于1996年11月，前身是在原厦门市14家城市信用社和市联社基础上组建的厦门城市商业银行，并于1998年由“厦门城市合作银行股份有限公司”更名为“厦门市商业银行股份有限公司”，而后再次于2009年更名为“厦门银行股份有限公司”。
A股正在排队IPO的银行还有18家
7月16日，渤海银行（9668.HK）在总部天津通过网络连线方式成功在香港联交所挂牌上市，成为今年以来的首家上市银行。
厦门银行则在同一日成为首家A股IPO的银行。此外，A股正在排队IPO的银行还有18家，分别为湖州银行、兰州银行、大丰农商行、重庆银行、昆山农商行、上海农商行、马鞍山农商行、东莞银行、广州农商行、南海农商行、顺德农商行、齐鲁银行、瑞丰银行、厦门农商行、药都农商行、海安农商行、广州银行和重庆三峡银行。
]article_adlist-->
(image_address=""//n.sinaimg.cn/finance/cece9e13/20200514/343233024.png"")
海量资讯、精准解读，尽在新浪财经APP
责任编辑：张熠",2020-07-16 20:58:48,新浪财经
2,中公教育陷退费风波：遭投诉欠钱不还 存在诱导贷款行为,"原标题：中公教育陷退费风波，遭学员投诉欠钱不还
记者 查沁君
市值超千亿的中公教育（002607.SZ）最近站上风口浪尖。7月14日下午，中公教育因近期被消费者频繁投诉，而被北京市海淀区市场监督管理局点名。
在黑猫投诉、聚投诉等平台上，界面教育记者发现，消费者投诉的问题主要有以下几点：违反当初承诺不退费、退款慢、定金不退、学员报名不成功不给退课等问题。
曾报名中公教育的小南告诉界面教育，她在同学推荐下于去年2月份购买其省考+国考课程。因为她未能进入省考面试，也没参加补录，按照当初签协议，中公教育应予以退费，扣除报名所有优惠费用后，应退给小南约8000元。
至于退费时间，小南告诉界面教育，当时她签署的协议中显示，退费需延长至调剂人员名单、拟录用名单公布后退还。退费前先提交退费申请，申请受理后才开始计算时间，45个工作日内退回。
小南（化名）的退费审核本已通过，但令她空欢喜一场的是，等过几天再看，系统显示突然又变为等待审核。当她给客服打电话，对方开口第一句话就是你的退费近期内即将到账，注意查收。
小南告诉界面教育：“客服跟我说就算她们同意办理，上级和总部也会驳回。”
中公教育退费难是否违法？法律博主“风的节奏吹”曾在去年12月发布微博称，目前看还没有违法，还属于民事纠纷的范畴，因为中公教育没有跑路，没有涉及‘骗’，但基于其强势地位，其利用规则的延迟退费，不太地道。”
除退费难之外，据蓝鲸教育6月17日报道，大量中公学员反映，旗下推出“理享学”产品也存在问题。该产品称，学员不需要花一分钱就可以听课，如果考试不过，学生无需支付学费。
但有学员在报名后才发现，所谓“不花一分钱”是以学员名义去做贷款，合同内标注的贷款年利率为6.6%，贷款性质为商业贷款。
(image_address=""//n.sinaimg.cn/spider2020716/102/w580h322/20200716/03d2-iwpcxkr3771261.jpg"")
据公开信息显示，“理享学”是中公教育公益助学计划的一部分，由中公教育联合上海贝丁网络科技有限公司共同推出。
蓝鲸教育报道称，中公教育既可以通过引流的方式获得分成，又可以以0元的方式得到用户。“理享学”的贷款模式与消费金融或者互联网小额贷款类似。但无论是上海贝丁网络还是理享学金融，都没有消费金融、小贷牌照，甚至在主营业务上，两家公司都没有包含金融业务。
中公教育的一系列风波在社交媒体引起争议。在微博“中公退费难”这一话题下，有近400万阅读，上千条讨论。有网友在其中表示：“中公教育吃相真的不要太难看！”、“希望未来你们可以对待退费学员可以像推销课程一样积极”。甚至还有学员专门写文打趣地说“当你选择了中公教育，你的对手就成功了一半”。
就上述问题是否属实，界面教育询问中公教育，截止发稿，对方表示暂不回应。
(image_address=""//n.sinaimg.cn/spider2020716/215/w580h435/20200716/19d2-iwpcxkr3771343.jpg"")社交平台上，法律博主解读与网友评论   图片来源：微博
与之形成鲜明对比的是中公教育在二级市场的表现。7月13日，中公教育股价再创历史新高，盘中最高涨至32.20元。当日收盘，公司股价涨幅超5%，市值突破1900亿元。截止今日发稿为止，其最新市值1921.76亿元。
公开资料显示，1999年成立的中公教育，依靠公务员考试培训起家，目前还将业务拓展至教师培训、事业单位培训，以及综合招录培训。提供超过100个品类的职业培训，在319个地级市建立1104个直营网点。
2018年5月，亚夏汽车拟作价185亿元收购中公教育，后者于2019年2月21日正式登陆中小板。
此时的中公教育，陷入遭学员大量投诉与业绩创新高的两极状态。
据中公教育2020年Q1财报显示，中公教育的营收模式除了基础的培训收益以外，还通过券商、银行等机构进行短期投资理财，报告期内实现相关收益高达4900余万元。
结合往年财报数据，2018年中公教育营收为62亿元，其投资支付高达171亿元，并从中获得投资收益1.1亿元；2019年，中公教育营收91.76亿元，投资支出飙升至271亿元，从中收益2.59亿元。
2020年第一季度财报显示，中公在受疫情影响、线下无法开课的情况下，仍然实现营收同比微降6.22%，净利润同比增长9.52%。对于利润增长，中公教育解释称，公司投资收益4911.87万元，同比增长52.47%，投资收益占据净利润的42%。
除此之外，中公教育每年的清仓式分红也备受争议。2018、2019连续两年，中公教育现金分红分别高达14.19亿、14.80亿，占当期归母净利润的123%、82%，占当期可供分配利润的99%、97%。
资料显示，中公教育持有5%以上的股东分别为鲁忠芳、李永新、王振东，王振东为公司董事、总经理。其中，鲁忠芳、李永新为母子关系，是公司实际控制人。
2020年3月26日，鲁忠芳、李永新母子以910亿元人民币财富，超越好未来创始人张邦鑫，名列《2020胡润百学·全球教育企业家榜》首位。
但清仓式分红也引来了深交所问询。中公教育回复，高比例分红合理，当经营现金流不足的时候，可以向银行借款，不会给公司财务造成负担。
（应受访者要求，小南为化名。）
(image_address=""//n.sinaimg.cn/finance/cece9e13/20200514/343233024.png"")
海量资讯、精准解读，尽在新浪财经APP
责任编辑：张熠",2020-07-16 20:56:00,新浪财经
3,芯片第一股中芯国际首日交出亮丽答卷 前十大股东合计浮盈逾334亿,"原标题：不负众望，“芯片”第一股首日交出亮丽答卷，前十大股东合计浮盈逾334亿元
来源：金融1号院
7月16日，对于科创板乃至整个A股来说，是值得纪念的一天。这一天，一支新股创出了多项纪录，科创板市值王、芯片行业市值王、A股科技股市值王等等，中芯国际将多项头衔揽入怀中，其首日表现也不负众望，向全市场交出了一份亮丽答卷。
中芯国际首日高开高走，开盘价即以95元/股的价位呈现，全天维持在高位运行；截至收盘，报收于82.92元/股，上涨55.46元/股，涨幅为201.97%；盘中市值一度突破6000亿元，全天主力资金流入252.74亿元，流出232.99亿元，换手率为53.08%。
(image_address=""//n.sinaimg.cn/finance/crawl/735/w550h185/20200716/e0fc-iwpcxkr3791816.png"")
“金融1号院”按照当日上涨点位、涨幅，以及前十大股东合计持有的6亿多股测算，全天浮盈高达334亿元。同时，多家券商分析认为，对比来看，中芯国际比贵州茅台更加珍贵，尤其是在不可代替、不可复制方面，独有的稀缺性导致该股具有较高的议价能力，从长远来看，中芯国际的价值量或将超过贵州茅台。
换手率仅为五成
事实上，中芯国际在未正式上市前，市场已经充满了期待。公开资料显示，中芯国际是全球第四大、中国市场排名第一的晶圆代工厂，代表中国市场最高技术水平。同时，中芯国际也是内地规模最大、制程最先进的晶圆代工厂，能够提供0.35微米至14纳米多种技术节点、不同工艺平台的集成电路晶圆代工及配套服务。
根据资料显示，2019年中芯国际实现营业收入31.24亿美金，全球份额位列第四名，客户覆盖海外及大陆地区大部分知名厂商，代表大陆地区晶圆代工先进制程最高技术水平，公司90%以上的收入来自于28nm以上成熟制程。
有券商分析指出，受益于去年下半年开启的半导体行业复苏，叠加以海思为代表的半导体国产化转移，中芯国际产能利用率及产品结构持续改善，带动公司盈利能力持续恢复，预期随着物联网、汽车电子、AIoT/5G等下游领域的蓬勃发展，中芯国际下游高景气度有望持续，成熟制程盈利能力有望持续改善。
(image_address=""//n.sinaimg.cn/finance/crawl/230/w550h480/20200716/619c-iwpcxkr3791890.png"")
7月16日，中芯国际迎来了在科创板的首个交易日，全市场可谓万众瞩目，头顶多项殊荣，尤其是以“芯片”第一股冠称，早盘以95元/股的开盘价呈现，较发行价上涨近246%，集合竞价成交接近50亿元。截至收盘，报收于82.92元/股，上涨55.46元/股，涨幅为201.97%；盘中市值一度突破6000亿元，全天主力资金流入252.74亿元，流出232.99亿元，换手率为53.08%。
前十大股东首日浮盈高达334亿元
中芯国际在上市首日交出亮丽答卷的同时，其股东也获得了不错的收益。“金融1号院”根据东方财富Choice数据显示，中芯国际前十大股东分别为国家集成电路产业投资基金二期、新加坡政府投资有限公司、青岛聚源芯星股权投资合伙企业（有限合伙）、中国信息通信科技集团有限公司、中国保险投资基金（有限合伙）、中国国有企业结构调整基金股份有限公司、国新投资有限公司、海通创新证券投资有限公司、中国中金财富证券有限公司、深圳市创新投资集团有限公司，以发行前5月底为时间段，以上股东全部为新进股东，合计持有6.0286亿股。
(image_address=""//n.sinaimg.cn/finance/crawl/308/w525h583/20200716/add5-iwpcxkr3791965.png"")
“金融1号院”按照首日上涨55.46元/股测算，前十大股东当日浮盈高达334.35亿元。
此外，“金融1号院”根据中芯国际网下发行安排来看，包括公募产品、社保基金、养老金、企业年金基金、保险资金和合格境外机构投资者资金等配售对象中，发行参与网下配售摇号的共有2075个账户，10%的最终获配账户（向上取整计算）对应的账户数量为208个，这部分账户对应的股份数量为5542.18万股，占网下发行总量的9.39%；按照首日上涨55.46元/股测算，首日浮盈30.74亿元。
另据公开数据统计显示，本次共有24只券商自营账户及券商集合理财产品参与中芯国际的网下申购，合计获配748.09万股，“金融1号院”注意到，上述24只券商自营账户及券商集合理财产品中，开源证券、红塔证券、华安证券、渤海证券、浙商证券、长江证券、国金证券、江海证券、野村东方国际证券均获配中芯国际42.71万股，获配数量最少的中天证券也有10.68万股。
据此估算，这24只券商自营账户及券商集合理财产品在中芯国际上市当日浮盈高达4.15亿元（浮盈计算均假设当日未卖出）。同时，海通证券另类投资子公司海通创投与中金公司子公司中金财富均分别获中芯国际战略配售3371.24万股，首日均分别浮盈18.7亿元，累计浮盈37.4亿元。
(image_address=""//n.sinaimg.cn/finance/crawl/728/w550h178/20200716/f07b-iwpcxkr3792033.png"")
今年一季度，中芯国际营收为64.01亿元，同比增长38.42%，归属母公司股东的净利润（非经常性损益）为1.43亿元，同比增长143.34%。
目前市值尚处正常区间
在临近收盘时，中芯国际总市值略微下降，盘终市值为5918亿元。“金融1号院”通过多家券商研判发现，目前中芯国际的走势处于预期区间，其市值尚处正常水平。
华创证券分析认为，目前科创板功率半导体IDM厂商华润微估值约为7倍PB，考虑到中芯国际的行业地位，应给予6倍至7倍PB目标估值，对应市值区间应为5820亿元至6790亿。同时，晶圆代工全球龙头台积电目前市值约2万亿人民币，鉴于中芯国际先进制程的顺利推进，行业份额有望稳步提升，考虑到中芯国际的长期成长空间，给予台积电三分之一市值目标，约为6600亿人民币。结合两种估值方法，给予中芯国际目标市值区间为5820亿元-6790亿元，对应股价为76元/股-88.7元/股。
由此来看，从中芯国际首日的股价、估值和市值表现来看，当前整体处于合理预期区间。
国信证券分析认为，中芯国际比贵州茅台应当更珍贵。从可替代性来讲，中芯国际与贵州茅台一样不可替代、无法复制；同时，因为稀缺性导致中芯国际具有和贵州茅台同样的议价能力。从社会必要劳动时间角度看，中芯国际的价值量要超越贵州茅台。
“中芯国际属于绝对稀有资产，不能参考国际半导体代工厂估值，应该参考科创板半导体代工厂华润微的估值。”国信证券分析表示，相同资产在不同市场有不同价格，因此，科创板的中芯国际的估值超过龙头台积电也是有可能的。此外，华润微的技术和规模都不及中芯国际，中芯国际的相对合理估值应该超过华润微。
以7月15日收盘价对比，华润微对应的PB为6.9倍，考虑到中芯国际本次超额募集之后PB只有2.11倍，对标华润微至少还有3倍以上的空间，中芯国际对应的股价应当为83.3元/股，此价格对应市值为6355亿元。
国信证券指出，由于A股和H股投资人趋同，A+H股股价也会趋同，港股股价将会向科创板股价看齐。
免责声明：自媒体综合提供的内容均源自自媒体，版权归原作者所有，转载请联系原作者并获许可。文章观点仅代表作者本人，不代表新浪立场。若内容涉及投资建议，仅供参考勿作为投资依据。投资有风险，入市需谨慎。
(image_address=""//n.sinaimg.cn/finance/cece9e13/20200514/343233024.png"")
海量资讯、精准解读，尽在新浪财经APP
责任编辑：逯文云",2020-07-16 20:53:05,新浪财经
