,title,content,pub_time,src
12,华侨城A：武汉项目或面临资金缺口 拿地关注“短平快”,"新浪财经 央企华侨城A一改往日的低调作风，在今日举行业绩会，并且直面回答了投资者关于负债、现金流、拿地计划、疫情影响等诸多问题。
根据4月27日晚间公司发布的年报，2019年华侨城A实现营收600.25亿元，同比增长24.65%，归母净利润123.4亿元，同比增长16.69%。
虽然公司业绩创出历史新高水平，但利润增速开始出现放缓。尤其是衡量主营业务的扣非归母净利润，2019年仅实现100.05亿，同比增长5.33%，而2018年同比增幅为30.41%。
公司利润增速低于营收增速，一方面在于旅游业务的营业成本增加，使得公司整体营业成本较2018年增长36.53%，毛利率同比下滑3.8个百分点至56.6%；此外，2019年少数股东损益占比14.0%，同比增加7.7%。
武汉项目或面临资金缺口
旅游和地产是华侨城A的两大支柱业务。根据年报数据，2019年华侨城A的旅游综合业务收入反超房地产业务，是自2010年以来的首次。
具体来看，2019年华侨城A旅游综合业务营收为302.63亿，同比增长58.96%，营收占比从2018年的39.53%提升至50.42%；而房地产业务营收为291.34亿，同比增长3.88%，营收占比从2018年的58.24%下降至48.54%。
受疫情影响，华侨城A旗下的旅游景区自1月25日起全面关闭，直至近日才陆续重开。谈及疫情对公司旅游业务的影响，旅游管理部总监王刚在业绩会上直言，“国内旅游业恢复是一个漫长的过程”。
他介绍称，第一季度公司游客接待的水平只有去年同期的30%，收费旅游景区只恢复到去年同期的20%水平，酒店则恢复到30%左右的水平。
湖北房地产市场也首当其冲地受到疫情波及。投资管理部总监汪文进表示，湖北市场目前还处于一个收缩状态，尤其是武汉市场，预计很难恢复到原有的市场规模。
目前，华侨城A在湖北共有5个项目，其中4个在武汉，1个在襄阳市，目前已经全面复工复产。但汪文进指出，因为武汉疫情尚未解除，因此项目的报批报建审批效率不高，人员流动受限导致用工不足，还有部分原材料的供应短缺，所以武汉在建项目进度滞后。
“再加上疫情下土地成本刚性上涨，此外由于销售回款和开发周期的拉长，财务成本亦有所上升，因此武汉项目预期会面临一定的资金缺口压力，可能对项目的利润空间造成严重挤压”，汪文进说。
疫情影响之下，今年一季度华侨城A业绩大幅受挫，公司营收为68.18亿元，同比下降13.91%，归母净利润8.39亿元，同比下降30.01%。
关注“短平快”及大型综合项目
房地产业务方面，报告期内，华侨城A实现签约面积252万平方米，同比增长22%；实现签约金额863亿元，同比增长45%，销售均价为34246元/平方米。
2019年华侨城A依然积极拿地，而且得益于龙头央企的优势，拿地成本处于行业较低水平。公司年内累计获取土地47宗，新增土地面积625万平方米，计容建筑面积1208万平方米；土地总价款745亿元，其中28个项目以底价摘牌，新增项目平均地价为6165元/平方米；权益对价494亿，权益占比66.4%
以此推算，全年公司拿地/销售金额比达到86%，拿地/销售均价比18.0%，这有利于未来公司房地产业务利润的进一步增强。根据年报，2019年华侨城A地产成本较上年下降14.83%，毛利率为74.60%，增加5.81个百分点。
在业绩会上，机构投资者多次就华侨城A今年的拿地策略及计划进行提问。对此，汪文进表示，公司会继续巩固成片综合开发模式的领先优势，加快推进周期长、规模大、增值空间好的大型综合项目的落地，并且逐步扩大综合项目用地的比例。
此外，汪文进还提到，在重点区域和城市，华侨城A会高度关注短平快的、收购的以及城市更新的项目作为土地补充。根据公司年报，2019年内共有13个地产项目实现一年内拿地并推盘入市。
截至2019年底，公司累计权益建筑面积2533万平方米，主要分布在粤港澳大湾区、长三角和华中区域。
经营活动现金流连续3年为负
随着销售去化力度的提升，以及执行“以收定投”的拿地策略，2019年华侨城的现金流状况有所改善。年内，公司经营活动现金流净额同比上升48.35%，投资活动现金流净额同比上升71.60%。
然而，如果把时间拉长，公司经营活动现金流净额已经连续3年为负值，而投资活动现金流净额负值则已经保持了5年。这也是近几年来，投资者和媒体一直关注和追问的问题。
公司副总会计师冯文红在业绩会上表示，目前经营和投资现金流为负的状态，实际上与公司目前的跨越式发展的战略是相匹配的。她指出，目前公司上下都在为改善现金流而努力，“2020年公司对各站区的考核，运营性资金的流入是一个重点考核的指标。”
为缓解资金压力同时加快项目周转率，近两年来，华侨城接连出售旗下项目股权。根据不完全的统计，2018年，华侨城转让了18家子公司股权和1个资产包，2019年公司拟转让19个子公司股权，转让价格总计超过百亿。
融资方面，2019年华侨长A通过直接融资、发行债券、Reits、权益融资等多种手段实现外部融资558.16亿元。截至2019年末，公司资产负债率和净负债率分别为75.0%和84.5%，分别同比增长1.2%和0.2%，整体平均融资成本4.56%，较2018年下降0.46%，处于同行业较低水平。
冯文红表示，公司高度关注债务风险和刚兑问题，一年内到期的短债基本保持在30%左右。一季度公司进行了一些融资置换，融资成本继续保持下行的趋势。（新浪财经 徐苑蕾）
责任编辑：陈志杰",2020-04-28 20:16:26,新浪财经
13,邮储银行：一季度实现净利润200.94亿 同比增长8.5%,"新浪财经讯4月28日消息，邮储银行：一季度实现净利润200.94亿元，去年同期为185.2亿元，同比增长8.5%。
责任编辑：王帅",2020-04-28 20:14:32,新浪财经
14,安徽小房企三巽控股二次递表 经营现金流连续4年为负,"来源：财联社
首次递交的招股书失效后仅十天，三巽控股集团有限公司（以下简称“三巽控股”）再度向港股IPO发起了冲击。
4月27日港交所信息显示，三巽控股更新了IPO申请材料并重新递交招股书。这是该公司第二次提交上市申请，其首度递交招股书是在2019年10月17日，由于未获港交所通过该招股书于4月17日失效。
在首度提交招股书时，三巽控股的融资成本及现金流就饱受外界质疑。重新提交后的招股书更新了2019年的相关财务数据，不过现金流等相关情况并未得到明显改善。
招股书显示，2016年-2019年，三巽控股经营现金流量净额连续4年为负，其中现金流在2019年出现大幅流出。2017年-2019年其现金流量净额分别为-4.83亿元、-4.21亿元以及-19.13亿元。
“现金流量净额长期为负数，对于企业经营会有一定影响，这也是其想在港股上市的原因之一，因为上市后可以从资本市场融到更多的资金。”一家资管公司的高管向财联社记者表示。
“经营现金流出净额于2019年增加至19.13亿元乃主要由于2019年项目数目增加。”三巽控股方面表示，录得净经营现金流量为负额时，公司须取得充足外部融资，以应付财务需要及责任。
据了解，三巽控股以信托、资管计划为重要融资手段，造成近几年融资成本居高不下。
招股书披露，2017年-2019年，三巽控股未偿还银行贷款及其他借款总额分别约为5.14亿元、7.09亿元及17.57亿元；加权平均实际年利率分别为14.9%、14.0%及12.3%。
由此可见，该公司借贷成本虽出现一定优化，但仍处于10%以上高位。此外其资产负债比率逐年递增，2017年资产负债比率为132.6%，2018年为140.5%，2019年攀升至204%。
“我们维持相当高的借贷水平为我们的营运提供资金，且我们预期于后将继续保持相当高的借贷水平。”三巽控股方面表示。
截至2019年末，该公司货币资金总额达到15.95亿元，同比增长91.9%，现金短债比由2018年1.17提高至2019年的1.83。
“过去三巽的长期有息债务占比较低，短期有息负债占比较高。但是从2019年三巽的债务结构来看，企业的长期有息负债略高于短期有息负债，债务结构有一定改善。”亿翰智库一位分析师表示。
据悉，三巽集团前身为三巽投资有限公司，于2004年在安徽成立，2018年将总部搬至上海，并在2019年赴港IPO。
值得关注的是，该公司2018年刚迈进百亿元销售门槛，却放言要在五年内实现千亿目标。在快速扩张过程中，三巽控股问题不断，如部分时段出现亏损、因项目质量问题需要赔偿损失等。
2017年-2019年，三巽控股营收为2.63亿元、7.24亿元、31.09亿元；毛利为6880.7万元、2.07亿元、9.79亿元，毛利率为26.2%、28.6%、31.5%；净利润为-562.7万元、5762.3万元、4.42亿元。
业内人士认为，三巽控股接下来面临的一个重要命题是，如何在快速扩张的同时，降低资金成本并保证财务安全。
招股书显示，三巽控股土地储备连续三年呈递增趋势，截至2020年1月31日，三巽控股总土储400万平方米，共拥有36个项目，其中30个物业项目位于安徽省。
对于这家小型房企而言，二度冲击港股IPO能否成功，仍存变数。
截至目前，已经有4家内房企在港股IPO上市遇阻，而去年成功登陆港交所的中小房企，多数都出现了公开发售认购不足的情况，其中包括天保集团、新力控股等。
“对于谋求在港上市的房企，即使可以达到上市的业绩要求，但是在房地产市场并不乐观的现状下，如何吸引足够数量的投资者是个难题。”58安居客房产研究院首席分析师张波向记者表示。
责任编辑：陈志杰",2020-04-28 20:04:39,新浪财经
15,追讨15亿募资补充流动性：康得新延披年报 董监高保真,"原标题：追讨15亿募资补充流动性 康得新延披年报 董监高保真 
4月28日，上市公司康得新复合材料集团股份有限公司（证券简称：*ST康得（维权） 002450）披露公告称，受全球新冠肺炎疫情影响，公司将2019年年报披露日期由4月28日延期至6月30日。
此前，深交所曾于4月8日披露《关于支持上市公司做好2019年年度报告审计与披露工作的通知》，称上市公司确因疫情影响无法按期披露年度报告的，可以延期披露，但原则上不晚于6月30日。
与此同时，康得新披露了2019年主要经营业绩和董监高对此的专项说明，对公司债务违约、违规担保、大股东资金占用等问题进行披露，同时，康得新表示，公司目前已聘请专业律师团队对其中未被银行扣划的15.13万元募集资金通过诉讼程序进行追讨，并争取解除冻结，待解除冻结后，公司将以该部分资金用于补充流动资金。
年报受疫情影响延期披露
完成进度15%
对于无法按期披露年报的原因，康得新指出，在国内，江苏省、苏州市及张家港市都启动了新冠疫情应急预案、交通管制，导致公司复工延迟，员工大量滞留外地，无法返岗，公证天业会计师事务所（特殊普通合伙）（下称“公证天业”）的现场尽调工作被迫推迟；同时，受疫情影响，公司相关会议的召开被迫推迟，导致变更审计机构的审议被耽搁。
在国外，康得新海外子公司分布在新加坡等地，在疫情重灾区，给审计机构的审计尽调工作带来较大的困难。
对此，公证天业发布专项意见表示，经审计团队的初步估算，已完成总体审计工作量的15%左右。根据目前国外疫情现状，尚无法开展康得新境外子公司的现场审计，由康得新委托境外审计机构对其进行审计。
公证天业指出，康得新能够提供必要的工作条件，能配合审计工作开展，无其他情形影响审计工作正常开展。目前不存在与管理层就重大审计事项意见不能达成一致的情形。为尽快完成审计，公证天业拟加派审计人员，对康得新国内公司开展现场审计工作。审计人员将于今年5月30日前完成现场审计工作，预计于6月29日前出具审计报告。
此前，康得新曾一度陷入“无会计所接单年报审计”危机。康得新去年曾尝试与容诚会计师事务所（下称“容诚所”）、中审众环会计师事务所（特殊普通合伙）达成聘任协议，但最终未能实现。（相关报道：《15天后股东会审议 康得新审计机构拟变更为公证天业》）
对于2019年年报，康得新提示风险称，若公司2019年度报告继续被出具无法表示意见或者否定意见的审计报告，深交所将自公司披露年度报告之日起，对公司股票实施停牌，并在停牌后十五个交易日内作出是否暂停公司股票上市的决定，请广大投资者注意投资风险。
董监高对主要业绩“保真”
拟追讨15亿募集资金
在披露年报的同时，康得新披露了2019年主要经营业绩和董监高对此的专项说明。
主要经营业绩显示，2019年，康得新实现营业收入14.59亿元，同比下降84.05%；实现归属于上市公司股东净利润为亏损58.10亿元，同比下降2169.75%；资产方面，康得新2019年报告期末总资产和归属于上市公司股东净资产分别为268.37亿元和122.90亿元，同比下降21.65%和32.23%。
与时任多位董监高对2018年年报、2019年一季报、半年报“不保真”不同的是，康得新去年7月选出的新一届管理层，虽然对2019年三季报“不保真”，但其此番保证2019年主要经营业绩真实、准确、完整，不存在虚假记载、误导性陈述或者重大遗漏，并承担个别和连带法律责任。
不过，康得新董监高表示，截至公告日，证监会尚未对公司做出最终违法事实认定并发出《行政处罚决定书》，同时，其他权力机关的立案调查也未有最终结论，公司尚未重述前期报告，公司2019年主要经营业绩是基于以上情况进行编制，未进行追溯调整，后续调查结论出具后，会计报表相关科目存在重大调整的可能性甚至实质性的变化，请投资者特别关注。
去年7月5日，证监会下发《行政处罚事先告知书》显示，康得新存在虚增利润总额119亿元、未在年度报告中披露控股股东非经营性占用资金的关联交易情况等多项违法违规事实。
其中，康得新大股东康得集团利用与北京银行西单支行签订的《现金管理服务协议》，分别于2014年至2018年非经营性占用康得新资金65.23亿元、58.37亿元、76.72亿元、171.50亿元和159.31亿元。
公告显示，康得新涉及11起违规担保，金额合计约53亿元，担保对象包括大股东康得集团和北京益鼎吉祥科技有限公司，以及全资子公司张家港康得新光电材料有限公司、张家港保税区康得菲尔实业有限公司、江苏康得新智能显示科技有限公司等。
与此同时，截至今年4月24日，康得新尚未结案被起诉类案件共304起，其中被诉金额5000万元以上的51件、1000万元以上的71件、劳动纠纷101件、其他小额诉讼129件，累计涉及影响金额约95.78亿元（涉及美元已按汇率折算为人民币），占最近一期经审计净资产比例为约52.81%。
康得新还指出，中国银行（维权）苏州分行、南洋商业银行苏州分行、中国工商银行张家港分行、建设银行张家港港城支行、农业银行张家港分行5家募集资金监管银行从康得新开设于该行的募集资金账户中擅自划扣募集资金，共计6.56亿元。
除该部分募集资金，康得新还有15.13亿元募集资金，但被全部冻结。康得新表示，公司目前已聘请专业律师团队对其中未扣划的15.13亿元募集资金通过诉讼程序进行追讨，并争取解除冻结，待解除冻结后，公司将以该部分资金用于补充流动资金。
记者 肖玮 李云琦
责任编辑：陈志杰",2020-04-28 20:04:18,新浪财经
