,title,content,pub_time,src
0,京投发展：公司土地储备中无永久基本农田,"京投发展今晚披露股价异动公告，表示公司土地储备中无永久基本农田、生态保护红线、自然保护区用地。《国务院关于授权和委托用地审批权的决定》对公司不存在影响。
责任编辑：王帅",2020-03-16 22:47:29,新浪财经
1,旅游业遭疫情冲击 三特索道拟募资还债,"原标题：旅游业遭疫情冲击 三特索道拟募资还债
来源：每日经济新闻
3月15日，三特索道（002159，SZ）发布《非公开发行A股股票预案》（以下简称《预案》），拟募集资金总额不超过约3.91亿元，其中3亿元用于偿还银行借款，9100万元用于补充流动资金。
《每日经济新闻》记者注意到，近年三特索道资产负债率一直保持较高水平，且显著高于行业平均水平。三特索道称：“通过本次发行……可缓解公司为解决资金需求而通过债权融资的压力，有助于控制有息债务的规模，减少公司财务费用的支出，从而提高公司的经营业绩。”
旨在降低资产负债率
三特索道的主要业务之一是投资建设、运营景区索道，旗下包括了陕西华山三特索道、贵州梵净山索道、浙江千岛湖梅峰索道、黄山尖索道、海南猴岛跨海索道等。据三特索道2019年半年报显示，索道业务占其营业收入比重为69.33%。
三特索道称：新型冠状病毒肺炎疫情给公司业务经营带来一定不利影响。
在《预案》中三特索道表示，疫情暴发期间，公司仍需要继续支付财务费用、人工成本和水电费等其他刚性费用，并要处理退订退款、合约取消等问题。
本次再融资的背景之一，是三特索道近年来的资产负债率处于较高水平。2016年末、2017年末、2018年末和2019年9月末，三特索道的资产负债率分别为66.47%、67.49%、65.92%和62.40%。同期，申万二级旅游综合行业上市公司（含三特索道）的平均资产负债率则分别为46.16%、46.24%、45.15%和44.89%。
(image_address=""//n.sinaimg.cn/spider2020316/544/w1072h272/20200316/7b9f-iqyryku4131102.png"")图片来源：三特索道公告截图
较高的资产负债率导致三特索道的财务费用对营业收入的比例较高，2019年前三季度，财务费用达到三特索道的营业收入的15.61%。
因此，三特索道此次的募资，主要部分就是用于偿还银行贷款。
三特索道称：“通过本次发行，以募集资金偿还银行借款、补充流动资金，有利于降低公司资产负债率，优化资本结构，提高公司抗风险能力。”
三特索道此次非公开发行股票认购对象为其控股股东武汉当代城市建设发展有限公司。
旅游业遭疫情冲击
2月3日，三特索道曾发布公告称，为全面做好新型冠状病毒肺炎疫情防控工作，旗下分布于全国多地的旅游项目已暂停主要业务运营，恢复运营时间将根据各地疫情的情况确定。
三特索道表示：公司总部地处湖北武汉，投资经营的旅游项目分布于陕西、海南、贵州、浙江、江西、湖北、内蒙古、广东、福建等地。根据对公司2016年至2018年经营情况的分析，本次疫情重点爆发的湖北地区2016年、2017年、2018年营业收入占公司当年总营业收入的比例分别为11.28%、9.67%、5.30%，呈逐年下降趋势，公司对湖北地区的收入不具有依赖性。
2月24日，三特索道又发布公告称，旗下位于浙江的杭州千岛湖索道有限公司已恢复运营。旗下贵州梵净山、陕西华山、海南猴岛（含呆呆岛）等多地项目也将陆续恢复运营，具体时间将根据各地疫情防控的情况确定。
与三特索道类似，丽江旅游（002033，SZ）和黄山旅游（600054，SH）的索道也开始逐步恢复。丽江旅游公告称，自2020年2月21日开始，玉龙雪山云杉坪索道恢复游客接待。黄山旅游公告称，自2月21日起开放玉屏索道、云谷索道，太平索道暂不开放。
据文化和旅游部数据显示，2019年全年，国内旅游人数60.06亿人次，比上年同期增长8.4%；入出境旅游总人数3.0亿人次，同比增长3.1%；全年实现旅游总收入6.63万亿元，同比增长11%。
今日（3月16日），国家统计局贸易外经司司长蔺涛在其文章中写道：“新冠肺炎疫情发生以来，按照疫情防控需要……景区订票大幅取消，旅游企业暂停经营，旅游住宿等相关行业也受到严重影响。”但蔺涛也在文章中表示：“居民消费需求只是暂时被抑制，居民消费意愿和能力并未消失，短期波动不会改变长期向好发展趋势。我国消费市场规模大、潜力足、韧性强的基本特点没有改变，消费市场长期稳定增长和加快转型升级的发展态势没有改变。”
展望未来，三特索道也认为，疫情结束后旅游业仍大有可为。三特索道称：“早在2003年的‘非典’疫情期间，公司便积极谋求战略转型，从单一的索道投资开发运营，转型到包含索道在内的景区综合开发，在很大程度上，正是‘非典’疫情加速了公司战略的迭代升级。因此，此次疫情同样将给公司带来进一步发展机遇。伴随着疫情结束，人民被压抑的旅游消费需求将会进行释放，旅游业将迎来复苏。”
责任编辑：陈志杰",2020-03-16 22:14:58,新浪财经
