,title,content,pub_time,src
0,10天9板轴研科技回应中芯国际概念：订单未超过1万元,"(image_address=""//image.sinajs.cn/newchart/new_daily/n/sz002046.gif"")
热点栏目
自选股
数据中心
行情中心
资金流向
模拟交易
客户端
原标题：10天9板！轴研科技回应中芯国际概念：订单未超过1万元
“10天9板”的“妖股”轴研科技再度回应“中芯国际”概念。
5月19日晚间，洛阳轴研科技股份有限公司（轴研科技，002046）公告称，公司关注到近期有公共传媒舆论涉及“中芯国际”概念。经自查，自2019年至今，子公司三磨所从中芯国际下属子公司获得的订单未超过1万元，具有偶发性，敬请广大投资者注意投资风险。
近来，A股芯片股走强，连带相关企业股票价格也走强。Wind数据显示，轴研科技在5月6日至5月19日连续十个交易日的区间涨幅达138.60%，其中有9个交易日为涨停收盘，股价短期内波动幅度很大，其中于2020年5月15日、5月18日、5月19日连续三个交易日收盘价格区间涨幅为22.38%。
轴研科技官网显示，公司成立于2001年，于2005年在深交所中小企业板上市，公司隶属于世界500强中国机械工业集团有限公司（国机集团），业务聚焦精密制造领域，在高精度、高可靠性轴承与高速高效超硬材料制品及相关零部件研发与制造、检测与试验方面具有雄厚的实力，居国内领先地位。业务涉及航空航天、汽车与轨道交通、能源环保、船舶兵器、机床工具、石油化工、电子、冶金、建筑等国民经济重要产业，市场遍布全球80多个国家和地区。
5月14日，轴研科技收到了中小板公司管理部的问询函，其中提出因为轴研科技近期股价涨幅较大，并分别于5月8日、5月12日达到股价异常波动标准。
中小板公司管理部对于上述情况表示关注，问询函称关注到轴研科技于2月26日在互动易平台上回复投资者称，子公司三磨所半导体行业客户有华天科技、长电科技、通富微电、日月光等，对中芯国际下属子公司有小批量供货。请轴研科技补充说明对相关公司具体供货产品，相关业务近两年又一期营业收入及占当期总营业收入的比重、毛利率情况、在手订单情况。
问询函还提出，轴研科技于5月11日披露的股票交易异常波动公告中称，为满足公司经营发展需要，公司拟发行股份募集资金，该事项目前处于前期论证阶段，尚存在较大的不确定性。请自查你公司就上述事项是否做好内幕知情人登记和保密工作，相关内幕知情人在过去3个月内是否存在买卖公司股票的行为。
中小板公司管理部还要求轴研科技说明近期召开投资者说明会、接待机构和个人投资者调研情况，自查是否通过非信息披露渠道透露内幕信息，是否存在违反公平披露原则的事项。
对此，轴研科技回复问询函称，为满足公司经营发展需要，公司拟发行股份募集资金，该事项目前处于前期论证阶段，尚存在较大的不确定性；公司前期披露的信息不存在需要更正、补充之处；近期公司生产经营情况正常，内外部经营环境未发生重大变化；公司、控股股东和实际控制人不存在应披露而未披露的信息；经查询，公司控股股东、实际控制人在公司股票交易异常波动期间未买卖公司股票。
轴研科技还在公告里称，公司有盈利能力较弱的风险，提醒广大投资者注意二级市场交易风险，理性投资。
]article_adlist-->
(image_address=""http://n.sinaimg.cn/finance/cece9e13/20200514/343233024.png"")
海量资讯、精准解读，尽在新浪财经APP
责任编辑：陈志杰",2020-05-19 21:55:12,新浪财经
1,工信部副部长陈肇雄调任中国电科 一直强调抢占科技竞争制高点,"原标题：工信部副部长陈肇雄调任中国电科，多次强调核心技术不能“受制于人”
来源：21世纪经济报道
5月19日下午，中国电子科技集团有限公司召开中层以上管理人员大会。中共中央组织部有关负责同志宣布了中央关于中国电子科技集团有限公司董事长、党组书记调整的决定：陈肇雄同志任中国电子科技集团有限公司董事长、党组书记，免去其工业和信息化部副部长、党组成员职务；免去熊群力同志的中国电子科技集团有限公司董事长、党组书记职务。
(image_address=""//n.sinaimg.cn/sinakd2020519s/464/w700h564/20200519/a2b5-itvqcca5175295.jpg"")
据21世纪经济报道记者梳理，科研出身的陈肇雄早年从事机器翻译理论研究及系统开发，是国内最早从事人工智能研究的科学家之一。由于首次实现机译技术产业化，在1995年成为中国最年轻的国家科技进步一等奖第一获奖人。
此后，陈肇雄转战中国电子信息产业集团等央企，并在湖南任职近八年，在陈肇雄任内，湖南提出了“数字湖南”战略。2015年入职工信部以来，陈肇雄分管信息化和软件服务业司、信息通信发展司、信息通信管理局、网络安全管理局等部门。
长期以来，陈肇雄高度重视技术创新和自主知识产权，并在多个场合强调抢占科技竞争制高点，并认为核心技术是最大“命门”，受制于人是最大隐患。
陈肇雄多次强调，中国应强化基础技术研究，突出通用芯片、基础软件、智能传感器等关键共性技术创新，重点突破自主可控操作系统、高端工业和大型管理软件技术；加大非对称技术、“杀手锏”技术研发攻关力度。
早期从事AI研发，跨界政企研
官方简历显示，现年59岁的陈肇雄早年从事科研工作。1989年，他在中国科学院计算所计算机应用专业获得工学博士学位，此后历任中国科学院计算所研究员、中国科学院计算机语言信息中心主任，中国科学院华建公司总裁等职位。
在上世纪80年代末，陈肇雄的研究重点是机器翻译理论及系统开发，这门涉及语言学、数学、计算机科学等多个学科的领域正是当前世人皆知的人工智能的前身，在此意义上讲，陈肇雄是最早从事人工智能研究的科学家之一。
硕士期间，陈肇雄提出了“基于替换的逻辑程序实现技术”，实现了处理速度比国外同类快3-4倍的实用系统，并发表了十余篇论文。这不但使他提前9个月顺利通过了硕士论文答辩，并在硕士刚毕业便受命担任了机器翻译研究项目的负责人。
彼时，发达国家开始在这一领域投入巨资，中国在资金、设备等方面处于劣势，陈肇雄等已提出智能型翻译的系统创新，急需必要的经费支持把这项理论成果转化为实用系统。
在著名机译专家、“中国译星”总设计师董振东的力荐下，“863”专家组给予了机译系统44万元的支持。据其回忆，这无异于雪中送炭，在1991年，其研发的“IMT/EC─863智能型机器翻译系统”甫一面世，边引起了轰动：在当时，用键盘输入一个英文句子，三五秒钟内，便可以在屏幕上显示出相应的汉语句子，正确率高达80%以上，被公认为当前国际上同类系统中的最高水平。
此后，其团队成功开发出快译通EC863A，在国际上首次实现机译技术产业化。这一技术在3年时间中为中国创汇860万美元，1995年，陈肇雄成为中国最年轻的国家科技进步一等奖第一获奖人。
据21世纪经济报道记者梳理，在此前后，陈肇雄围绕机器翻译申请了“基于不完备知识的推理技术”“特殊语言现象处理技术”“英汉翻译系统的词法分析算法”等一系列技术专利。
陈肇雄高度重视技术创新和自主知识产权。其在2004年履新长城集团董事长后不久就提出“五个目标四项重点”，要求提高自主知识产权技术、产品在整个收益中的比例，重点打造核心零部件、整机、软件和系统集成、以及宽带业务，并确立了长城“全面转型，实现往高端发展”的改革思路。
2007年底，陈肇雄由央企“空降”湖南省，先后担任副省长，省委常委、副省长，省委常委、长株潭“两型社会”建设综合配套改革试验区工作委员会书记等职，并于2013年4月担任湖南省委常委、常务副省长。
在湘近8年，陈肇雄负责的工作，一直聚焦在湖南的信息化、新型工业化、两型示范区建设、三网融合试点等领域，在陈肇雄任内，湖南提出了“数字湖南”的战略，即充分利用信息技术，高效开发信息资源、推动信息化和新兴工业化、农业现代化、新型城镇化深度融合。
一直强调抢占科技竞争制高点
2015年陈肇雄再度回京，分管该部信息化和软件服务业司、信息通信发展司、信息通信管理局、网络安全管理局等部门。
在工信部期间，陈肇雄频频出现在大数据、云计算、人工智能、5G、工业互联网等信息通信行业论坛上，鼓励这些新兴领域的发展，颇像是一个“中国CIO”。
在陈肇雄看来，构建高速、移动、安全、泛在的新一代信息基础设施是新时代建设网络强国的重要基础设施。
此前，陈肇雄在人民日报发表的署名文章《加快推进新时代网络强国建设》称，当前以网络信息技术为主要驱动力的新一轮科技革命和产业变革正在加速推进，全球技术、产业和分工格局深刻调整，这与中国加快转变经济发展方式形成历史性交汇，中国的网络强国建设正面临难得的历史机遇。
他指出，要瞄准全球领先目标，抓好网络演进升级。加快全光网络建设，大力发展工业互联网，深入推进网络提速降费，推进基础设施智能化改造，形成万物互联、人机交互、天地一体的网络空间。
同时，他强调，要全面提升网络服务水平，积极稳妥推进电信市场开放，促进各类资本平等竞争，激发市场主体活力；积极推动网络共享发展，进一步扩大电信普遍服务试点范围。
抢占科技竞争制高点一直是陈肇雄强调的重点。他表示，发展互联网，核心技术是最大“命门”，受制于人是最大隐患。掌握中国互联网发展主动权，必须突破这个难题，紧紧牵住互联网核心技术自主创新这个“牛鼻子”，努力实现从跟跑并跑到并跑领跑的转变。
为此，他强调，中国应强化基础技术研究，突出通用芯片、基础软件、智能传感器等关键共性技术创新，重点突破自主可控操作系统、高端工业和大型管理软件技术；超前布局网络前沿技术，推进高性能计算、人工智能、量子通信等研发和商用，实现前瞻性基础研究、引领性原创成果重大突破；加大非对称技术、“杀手锏”技术研发攻关力度。
陈肇雄最近一次公开露面是出席2020年世界电信和信息社会日大会并致辞。他在致辞中指出，中国将持续加强5G、大数据、人工智能、工业互联网等新一代信息通信技术创新突破和辐射渗透。加快“新基建”步伐，推动5G加快发展，力争2020年底实现全国所有地级市覆盖5G网络，促进“5G+”垂直行业融合应用。推动工业互联网加快发展，实施“5G+工业互联网”512工程。
据悉，中国电子科技集团有限公司主要从事国家重要军民用大型电子信息系统的工程建设，重大电子装备、软件、基础元器件和功能材料的研制、生产及保障服务。是中央直接管理的涉及国家安全和国民经济命脉的国有重要骨干企业，是国内唯一覆盖电子信息技术全领域的大型科技集团。
附：陈肇雄简历
陈肇雄，男，汉族，1961年9月生，福建莆田人，1985年2月参加工作，1994年6月入党，研究生学历，工学博士学位，研究员。
1978年9月至1982年9月，华东工学院计算机系计算机软件专业学习。
1982年9月至1985年2月，中国科技大学研究生院计算机应用专业学习。
1985年2月至1988年10月，中国科学院计算所实习研究员、助理研究员。
1988年10月至1992年10月，中国科学院计算所副研究员（1986年2月至1989年3月，中国科学院计算所计算机应用专业学习，获工学博士学位）。
1992年10月至1997年7月，中国科学院计算所研究员，中科院计算机智能机器翻译研究中心主任。
1997年7月至2001年11月，中国科学院计算机语言信息中心主任，中国科学院华建公司总裁、党委书记。
2001年11月至2004年4月，中国电子信息产业集团公司副总经理、党组成员。
2004年4月至2005年9月，中国长城计算机集团公司董事长、党委书记。
2005年9月至2007年12月，中国电子信息产业集团公司党组副书记、副董事长、总经理。
2007年12月至2010年12月，湖南省人民政府副省长、党组成员。
2010年12月至2011年3月，湖南省委常委、省政府副省长、党组成员。
2011年3月至2011年12月，湖南省委常委、省长株潭“两型社会”建设综合配套改革试验区工委书记。
2011年12月至2013年4月，湖南省委常委、省政府副省长、党组成员。2013年4月至2015年10月，湖南省委常委、省政府党组副书记、常务副省长。
2015年10月，任工业和信息化部党组成员、副部长。
2020年5月，任中国电子科技集团有限公司董事长、党组书记。
(image_address=""http://n.sinaimg.cn/finance/cece9e13/20200514/343233024.png"")
海量资讯、精准解读，尽在新浪财经APP
责任编辑：陈志杰",2020-05-19 21:47:34,新浪财经
2,市值逆势激增百亿 通策医疗“独立行情”卖的什么药？,"来源：环球老虎财经
通策医疗股价走出彪悍的独立行情。之所以说它彪悍，因为即使在一季度大亏，甚至在收到上交所关于年报的问询函后，通策医疗股价依然可以屡创新高。
5月18日，饱受疫情滋扰的通策医疗发布了《下属医院全面恢复诊疗》的公告，称全面恢复包括牙周超声洁治、牙齿种植植入手术及冠桥牙体预备等在内的口腔科诊疗项目。这距离公司在2月6日于《应对新型冠状病毒疫情》中宣布暂停诊疗服务已经过去3个月时间。
与常规认知较为贴切的是，受到疫情影响，国内大量口腔医院在一季度进行了停工停业。通策医疗亦难幸免，2020年一季度公司亏损1855万元，净利润同比减少119.58%。然而常规认知产生巨大差异的是，自宣布停诊开始，通策医疗二级市场估值接连走高，截止5月18日达到440亿，累积涨幅达到30%。
无独有偶，5月13日，上交所针对通策医疗的年报发出事后审核问询函，关于“联营企业财务资助”、“留存利润与分红政策”、“经营情况及财务指标”和“其他事项及进展”四个方面问题，提出了多点质疑。然而即便如此，通策医疗股价仍然稳步走高，
通策逆势而涨的密码是什么？监管层又为何出在通策医疗迭创新高之际“泼冷水”？
“蒲公英计划”单年投入不到一亿
虽然通策医疗早在1996年即实现上市。然而真正开启市值腾飞还要追溯到2018年6月联合浙江省推出的“蒲公英计划”。
所谓“蒲公英计划”，指的是通策医疗将在3至5年，依托公司旗下主要资产杭州口腔医院在浙江省建设100所口腔科门诊，以满足浙江省日益成长的口腔医疗需求。
然而，即公司过去数年利润增速较快，但分红偏少。
年报显示，通策医疗的未分配利润余额14.33亿，货币资金期末余额 4.83 亿元，无短期借款，一年到期非流动负债6000万，长期借款3.2亿。同时，通策医疗宣布2019年度不会分红。近三年，通策的累计分红金额只有961.92万元。通策表示，留存资金主要拟用于相关医院项目建设。
100家医院的海量投入是否会给通策医疗带来短期压力？从股权结构上来看，通策医疗采取了与爱尔眼科不同的模式，即上市公司体系内培育。企查查显示，通策医疗通过杭州口腔医院投资的门诊部，杭州口腔医院大部分均占股51%以上，并入公司合并报表。2019年下半年杭州口腔医院旗下子门诊部陆续成立11家口腔子医院门诊部，杭州口腔医院子门诊部数量也从12家提升至23家。
然而在建工程相比留存利润来说却仍然偏少。财报显示，近三年公司在建工程期末余额分别为0.22亿元、0.14亿元、0.82亿元，且未详细披露报告期内收购或新建医院相关投资的具体情况。
(image_address=""//n.sinaimg.cn/translate/767/w579h188/20200519/d0b7-itvqcca4929793.png"")
可疑的关联交易
那么公司海量的留存收益的投向究竟是哪里呢？
年报显示，2020年公司计划投向多个项目，包括杭州口腔医院城西总部及公司总部项目建设（1亿元）、宁口总院建设（0.5亿元）、蒲公英项目建设（0.5亿-1亿）、滨江和紫金港医院（3亿元）、收购三叶口腔诊所（1.5亿元），这些项目合计金额约6.5亿。
从布局方式来看，被券商研报作为卖点的蒲公英项目建设投入金额不到1亿。而收购三叶口腔诊所却要耗费1.5亿。
有意思的是，三叶口腔诊所为实控人吕建明实际持有的公司。企查查数据显示，三叶口腔诊所运营主体上海三叶儿童口腔医院投资管理有限公司包括三方股东，吕建明借助杭州海骏科技有限公司间接持有上述公司股权的22%。预计该项收购将构成关联交易。
2015年，通策医疗曾试图借助非公开发行募集50亿并入上述海骏科技以及另一家公司股权，吸并的理由则为解决同业竞争问题。而由于当时吕建明对海骏科技火箭增资8.5亿后直接向上市公司出售引发投资者对公司“利益输送”的指责，以及2016年二级市场股价的连续走低，该项交易于2016年宣布遭到终止。
除上述关联交易外，交易所的问询函，也对通策医疗的财务资助与实控人吕建明的关联关系进行了质疑。
问询函提到，通策医疗其他非流动资产期末余额 4.11 亿元，其中联营企业财务资助4.10 亿元，同比增长 176.95%。根据其他公告显示，通策医疗对联营企业浙江通策眼科医院投资管理有限公司（简称“通策眼科”）的财务资助期末余额2.09亿元。
根据企查查，通策的实控人吕建明，直接或间接持有通策眼科63%的股权，为最终受益人。而通策医疗作为投资方，只持有18%的股份。年报显示，通策眼科投资去年为通策医疗贡献1000万投资收益。而通策医疗在报告期内对它新增了6100万元财务资助。
增速放缓、浙江省外扩张有障碍？
通策医疗近三年营业收入增长率分别为34.25%、31.05%、22.52%，归母净利润增长率分别为59.05%、53.34%、39.44%，业绩增速有所放缓。同时，报告期内公司对外投资 9，552 万元，2018 年对外投资 48，072 万元，同比减少 80.13%，扩张的态势也满了下来。
这或许是由于省外扩张遇到了阻碍。
年报显示，报告期内公司在浙江省内实现营业收入17.05亿元，占比90.02%，毛利率47.54%；在浙江省外实现营业收入1.83亿元，占比9.66%，毛利率31.01%。同时，公司业务结构包括口腔业务、辅助生殖业务、眼科业务，且近年通过对外投资等方式不断向浙江省外扩张。
(image_address=""//n.sinaimg.cn/translate/21/w647h174/20200519/d155-itvqcca4929832.png"")
通策医疗在年报中表示：进入一个市场都是经过精心战略考虑，选择有很大市场空间的优质市场，逐步布局全国，保持中长期高速发展。
但现实是，浙江省以外的业务规模较小，毛利率也相比浙江省内低了不少。故而，问询函也对通策医疗在地区上不同的毛利率提出了疑问：通策医疗是否在浙江省有独特的供应优势，向省外扩张似乎面临障碍？
年报显示，2019年，通策医疗口腔医疗门诊量 212.12 万人次，实现总营业收入18.94亿元，比去年同期增长22.52%；实现归属于上市公司股东的净利润4.63亿元，同比增长 39.44%；实现基本每股收益1.44元/股，同比增长38.46%。赛道优势似乎决定了通策医疗的底气，但实控人与上市公司的多项关联交易，甚至是之前曾经遭遇行贿案件，都将监管层对这位曾经的地产大佬格外留意。
(image_address=""http://n.sinaimg.cn/finance/cece9e13/20200514/343233024.png"")
海量资讯、精准解读，尽在新浪财经APP
责任编辑：王帅",2020-05-19 21:42:53,新浪财经
3,爱司凯：收购金云科技100%股权 构成重组上市,"新浪财经讯5月19日消息，爱司凯（300521）19日晚公告披露重组预案，公司拟通过资产置换、发行股份及支付现金的方式购买金云科技100%股权，并募集配套资金。此次重大资产重组拟置入资产为金云科技100%的股权。经交易各方初步协商，拟置入资产初步交易作价为25亿元。本次交易构成重大资产重组，并构成重组上市，公司实际控制人将发生变更。交易完成后，公司将转型进入互联网数据中心业务和互联网接入业务。公司股票5月20日复牌。
(image_address=""http://n.sinaimg.cn/finance/cece9e13/20200514/343233024.png"")
海量资讯、精准解读，尽在新浪财经APP
责任编辑：王帅",2020-05-19 21:28:53,新浪财经
